user_input,retrieved_contexts,response,faithfulness,answer_relevancy,summary_type
How has the evidence changed regarding acceptable macro/microsteatosis in liver grafts?,"['[29,30]. Spitzer et al. [30] concluded that steatosis should\nbe added to the DRI, when dealing with a high-risk\ndonor. However, objective evaluation of the range of\nsteatosis, either as macro- or microvesicular steatosis, is\nnot standardized so far subjective to some degree [29].\nWe believe that routine donor biopsy evaluation may en\ufffeable the design of more powerful and robust donor risk\nscores.\nWe believe that the prognostic power of the DRI and\nET-DRI is further significantly undermined by the fact\nthat graft acceptance decisions on offered organs for\ntransplantation are not documented and evaluated in\nthese scores. There is an urgent need to evaluate and ad\ufffedress this shortcoming immediately, especially on the\nbackground of the current liver transplant scandals in\nGermany [23,31]. We believe that this aspect is a rele\ufffevant issue in liver transplantation today. Transplant cen\ufffeters regard their graft acceptance policy as their\npotential advantage in a highly competitive area for a\nvery scarce resource in times of ubiquitous organ short\ufffeage. It can be assumed that these aspects of potentially\nunwanted transparency by the proponents of transplant\ufffeation stood in the way of previous attempts to generate\nrobust prognostic scores that include donor organ qual\ufffeity. This may represent a deeper reason for the notorious\ndifficulty to assess donor organ quality and its impact on\nprognosis after transplantation objectively.\nThe balance of equity and utility in donor organ allo\ufffecation is a serious ethical dilemma. Several risk predic\ufffetion models are available and their head to head\ncomparisons would benefit from standardized reporting\nand formal, consistent statistical evaluation [18,26]. It\nwas claimed previously and in a different context that\noutcome selection and optimism biases may affect litera\ufffeture on prognostic scores in medicine [26].\nWe would like to propose joint efforts to develop a ro\ufffebust and objective donor risk score in an international\ncollaboration that should include the available large\ndata-sets from multiple institutions. We believe that the\ntime has come for a consensus on the reporting of the\nreasons for declined organ offers and on quality stan\ufffedards for prognostic scores and their statistical analysis\nand validation. Jacob et al. [18] proposed a reasonable\nscientific approach to the latter. High quality scientific\njournals should make uniform requirements mandatory\nfor the reporting of prognostic scores.\nConclusion\nThe results of this current study clearly show that the\nET-DRI is not applicable in the population from our\ncenter within the Eurotransplant community for the pre\ufffediction of patient or graft survival. On the background\nof a paucity of proper prognostic models, justified organ\nallocation which weighs urgency against prediction of\nsuccess of liver transplantation must be the aim of future\nresearch in this field.\nPatients and methods\nEthics statement\nAs an observational retrospective study, according to the\nProfessional Code of the German Medical Association\n(article B.III. § 15.1), neither informed consent nor ap\ufffeproval of the ethics committee was needed for this\nstudy.\nPatients\n291 consecutive liver transplants were included to\nanalyze the model’s accuracy and applicability for this\ndataset of a major transplant centre in the Eurotrans\ufffeplant community. Included were 20 (6.9%) split liver\ntransplants, 30 (10.3%) acute re-transplants (retransplan\ufffetation within 30 days after the previous transplant) and\n25 (8.6%) chronic retransplants (primary transplantation\nn = 235, secondary transplantation n = 48, tertiary trans\ufffeplantation n = 6, quaternary transplantation n = 1) in a\ntotal of 257 patients (median age: 49.6 years, range: 18–\n69 years; males n = 177 (64.4%), females n = 114 (35.6%),\nratio males/females: 1.8). All transplants were performed\nin our centre between the 01/01/2007 and the 12/31/\n2010. The post-transplant observational period ended on', 'Biopsy findings in cases of rejection of liver allograft\nity of portal inflammatory changes. Other changes\nwere similarly graded in a semiquantitative manner.\nResults\nPEROPERATIVE BIOPSIES\nAbnormalities were invariably present in the per\ufffeoperative biopsy specimens, although these were usu\ufffeally unimportant. All seven showed centrilobular\nhepatocyte vacuolation and necrosis. In four cases\nthere was bridging necrosis and frank subcapsular\ninfarction. All the histological changes seen in these\nbiopsies improved on subsequent biopsy, although\ntwo cases showed persistent centrilobular necrosis or\nfibrosis, or both (cases 1 and 2). The severity of\nchanges seen in peroperative biopsy specimens was\nnot related to the cold ischaemic time.\nPOSTOPERATIVE BIOPSIES\nHistological changes of rejection were seen between\nsix days and five months after transplantation\n(Table 2).\nPORTAL INFLAMMATION AND BILE DUCT\nDAMAGE\nAcute rejection was characterised by a dense mixed\nportal inflammatory infiltrate composed mainly of\nlymphocytes and neutrophils with smaller numbers of\n1367\nplasma cells, macrophages, and eosinophils. A partic\ufffeularly striking finding was the presence of poly\ufffemorphs surrounding and infiltrating the epithelium of\nsmall bile ducts and ductules (Fig. 1). This was associ\ufffeated with a variable degree of nuclear hyper\ufffechromatism and cytoplasmic vacuolation of the bili\ufffeary epithelium. These acute changes were seen in nine\nbiopsy specimens taken six to 18 days after trans\ufffeplantation.\nIn one patient (case 2) the acute bile duct lesion was\nfollowed by complete loss of ducts on the 28th day\nafter transplantation (Fig. 2) and led to graft failure\nnecessitating retransplantation. In another patient\n(case 1) acute inflammation subsided, but bile duct\nepithelium showed severe focal atypia resembling that\nseen in graft v host disease (Fig. 3).8 In the remaining\nfive cases treatment with immunosuppression resulted\nin clinical improvement and resolution of histological\nchanges, although a residual, mild and predominantly\nmononuclear infiltrate persisted in all these cases.\nThe hepatectomy specimen removed for chronic\nrejection (case 2) showed complete absence of small\nbile ducts. Larger ducts showed features similar to\nthose noted in smaller ducts in previous biopsies with\nthe additional finding of numerous foamy histiocytes\nin surrounding connective tissue (Fig. 4). A small\namount of material resistant to diastase and positive\nfor periodic acid Schiff was present in their cyto\ufffeplasm, but fat stains yielded a negative result.\nTable 1 Clinical details ofpatients and timing of biopsies after transplantation\nCase Age and Original diagnosis No of Timing of biopsy Follow up\nNo sex biopsies (day after graft)\nI O.L. 10 40 F Primary biliary cirrhosis 2 90, 102 Died at 5 months\n2 O.L. 15 41 F Primary biliary cirrhosis 3 15, 28, 56 Regraft at 2 months and\nalive at 9 months\n3 O.L. 18 46 F Primary biliary cirrhosis 3 7, 28, 38 Alive at 5 months\n4 O.L. 19 40 F Primary biliary cirrhosis 3 6, 20, 28 Alive at 5 months\n5 O.L. 21 35 F Cryptogenic cirrhosis 4 15, 18, 30, 42 Alive at 4 months\n6 O.L. 22 15 F Cryptogenic cirrhosis 2 7, 48 Alive at 2 months\n7 O.L. 24 15 M al antitrypsin deficiency 4 6, 12, 16, 40 Alive at 2 months\nTable 2 Histologicalfindings in 21 biopsies taken after transplantation\nFeatures assessed Degree of abnormality\nMild or moderate Severe\nPortal changes:\nInflammation 12 9\nPolymorphonuclear infiltration of biliary epithelium 5 9\nVascular changes:\nArterial intimal hyperplasia 3 0\nPortal vein endothelial inflammation 8 3\nCentral vein endothelial inflammation 3 2\nLobular changes:\nCholestasis 7 11\nCentrilobular necrosis or fibrosis 5 0\nAcidophil bodies (solitary) 10 0\n(clusters) 3 0\nPolymorph aggregates 4 0\nProtected by copyright, including for uses related to text and data mining, AI training, and similar technologies. \n. University, Serials Bobst Library Technical Services Serials', '(typically from a registry) would be required to determine specific \nmarkers of viability.\nThe importance of bile production during NMP is unclear. \nPreliminary evidence from our group20 suggests that preservation \ninjury causes impaired hepatocellular uptake of bile salts. We have \nshown evidence of progressive accumulation of bile salts in the perfu\ufffesate of livers with high post-transplant transaminase levels; something \nthat also correlates with poor bile production during NMP. The extent \nand nature of the injury required to produce this effect is not clear but \ndoes appear to reflect organ quality rather than viability.\nHigh-risk organs (for example, those with steatosis) may benefit from \ntherapeutic interventions delivered during NMP: several groups are \nexploring potential strategies, including stem cell treatments, de-fatting \nagents and immunological modification of the organ. Future trials \nmay be needed to formally test the size of the effect of NMP on organ \nutilization; for this it will be necessary to randomize livers at the time \nof organ offering rather than the time of retrieval. Organ utilization, or \norgan utilization with 12-month graft survival (functional utilization) \nwould be a logical primary endpoint for a study of this sort.\nThis study describes the formal clinical evaluation of a novel tech\ufffenology in liver transplantation, and could herald the start of a new era \nof intervention during organ preservation. It represents a first, neces\ufffesary step in demonstrating that NMP is feasible, safe and effective in \nclinical practice; the fact that the study has definitively met its primary \nendpoint should now enable the exploration of the technology’s wider \npotential.\nOnline content\nAny Methods, including any statements of data availability and Nature Research \nreporting summaries, along with any additional references and Source Data files, \nare available in the online version of the paper at https://doi.org/10.1038/s41586-\n018-0047-9.\nReceived: 28 September 2017; Accepted: 8 March 2018; \nPublished online 18 April 2018.\n1. Annual Report on Liver Transplantation 2016/2017 (NHS Blood and Transplant, \n2017).\n2. APPHG. Liver disease: today’s complacency, tomorrow’s catastrophe. The \nAll-Party Parliamentary Hepatology Group (APPHG) inquiry into improving \noutcomes in liver disease. (March, 2014).\n3. Todo, S. et al. Extended preservation of human liver grafts with UW solution. J. \nAm. Med. Assoc 261, 711–714 (1989).\n4. Clavien, P. A., Harvey, P. R. & Strasberg, S. M. Preservation and reperfusion \ninjuries in liver allografts. An overview and synthesis of current studies. \nTransplantation 53, 957–978 (1992).\n5. Chouchani, E. T. et al. Ischaemic accumulation of succinate controls reperfusion \ninjury through mitochondrial ROS. Nature 515, 431–435 (2014).\n6. Watson, C. J. et al. Preimplant normothermic liver perfusion of a suboptimal \nliver donated after circulatory death. Am. J. Transplant. 16, 353–357 (2016).\n7. Mergental, H. et al. Transplantation of declined liver allografts following \nnormothermic ex-situ evaluation. Am. J. Transplant. 16, 3235–3245 (2016).\n8. Perera, T. et al. First human liver transplantation using a marginal allograft \nresuscitated by normothermic machine perfusion. Liver Transpl. 22, 120–124 \n(2016).\n9. Ravikumar, R. et al. Liver transplantation after ex vivo normothermic machine \npreservation: a phase 1 (first-in-man) clinical trial. Am. J. Transplant. 16, \n1779–1787 (2016).\n10. Brockmann, J. et al. Normothermic perfusion: a new paradigm for organ \npreservation. Ann. Surg. 250, 1–6 (2009).\n11. Xu, H. et al. Excorporeal normothermic machine perfusion resuscitates pig DCD \nlivers with extended warm ischemia. J. Surg. Res 173, e83–e88 (2012).\n12. Eisenbach, C. et al. An early increase in gamma glutamyltranspeptidase and \nlow aspartate aminotransferase peak values are associated with superior \noutcomes after orthotopic liver transplantation. Transplant. Proc 41, 1727–1730 \n(2009).', '(2004) 9:57–8.\n20. de Boer JD, Putter H, Blok JJ, Alwayn IPJ, van Hoek B, Braat AE. Predictive\ncapacity of risk models in liver transplantation. Transplant Direct. (2019)\n5:e457. doi: 10.1097/TXD.0000000000000896\n21. Rana A, Jie T, Porubsky M, Habib S, Rilo H, Kaplan B, et al. The\nsurvival outcomes following liver transplantation (SOFT) score: validation\nwith contemporaneous data and stratification of high-risk cohorts. Clin\nTransplant. (2013) 27:627–32. doi: 10.1111/ctr.12181\n22. McCormack L, Quinonez E, Rios MM, Capitanich P, Goldaracena N,\nCabo JK, et al. Rescue policy for discarded liver grafts: a single-centre\nexperience of transplanting livers ’that nobody wants’. HPB. (2010) 12:523–\n30. doi: 10.1111/j.1477-2574.2010.00193.x\n23. Jimenez-Romero C, Caso Maestro O, Cambra Molero F, Justo Alonso I,\nAlegre Torrado C, Manrique Municio A, et al. Using old liver grafts for\nliver transplantation: where are the limits? World J Gastroenterol. (2014)\n20:10691–702. doi: 10.3748/wjg.v20.i31.10691\n24. D’Errico A, Riefolo M, Serenari M, De Pace V, Santandrea G, Monica M, et al.\nThe histological assessment of liver fibrosis in grafts from extended criteria\ndonors predicts the outcome after liver transplantation: a retrospective study.\nDig Liver Dis. (2019). 52:185–9. doi: 10.1016/j.dld.2019.05.013\n25. Liu Z, Jia J, Ning H, Que S, Zhou L, Zheng S. Systematic evaluation of\nthe safety threshold for allograft macrovesicular steatosis in cadaveric liver\ntransplantation. Front Physiol. (2019) 10:429. doi: 10.3389/fphys.2019.00429\n26. Mihaylov P, Mangus R, Ekser B, Cabrales A, Timsina L, Fridell J,\net al. Expanding the donor pool with the use of extended criteria\ndonation after circulatory death livers. Liver Transpl. (2019) 25:1198–208.\ndoi: 10.1002/lt.25462\n27. Muthusamy AS, Vaidya A. Expanding the donor pool in pancreas\ntransplantation. Curr Opin Organ Transplant. (2011) 16:123–7.\ndoi: 10.1097/MOT.0b013e328341b123\n28. Boggi U, Del Chiaro M, Vistoli F, Signori S, Vanadia Bartolo T, Gremmo\nF, et al. Pancreas transplantation from marginal donors. Transplant Proc.\n(2004) 36:566–8. doi: 10.1016/j.transproceed.2004.02.031\n29. Proneth A, Schnitzbauer AA, Schenker P, Wunsch A, Rauchfuss F,\nArbogast H, et al. Extended pancreas donor program-the EXPAND\nstudy: a prospective multicenter trial testing the use of pancreas\ndonors older than 50 years. Transplantation. (2018) 102:1330–7.\ndoi: 10.1097/TP.0000000000002122\n30. Kopp WH, Lam HD, Schaapherder AFM, Huurman VAL, van der Boog\nPJM, de Koning EJP, et al. Pancreas transplantation with grafts from\ndonors deceased after circulatory death: 5 years single-center experience.\nTransplantation. (2018) 102:333–9. doi: 10.1097/TP.0000000000001940\n31. Axelrod DA, Sung RS, Meyer KH, Wolfe RA, Kaufman DB.\nSystematic evaluation of pancreas allograft quality, outcomes and\ngeographic variation in utilization. Am J Transplant. (2010) 10:837–45.\ndoi: 10.1111/j.1600-6143.2009.02996.x\n32. Smits JM, De Pauw M, de Vries E, Rahmel A, Meiser B, Laufer G, et al. Donor\nscoring system for heart transplantation and the impact on patient survival.\nJ Heart Lung Transplant. (2012) 31:387–97. doi: 10.1016/j.healun.2011.\n11.005\n33. Weiss ES, Allen JG, Kilic A, Russell SD, Baumgartner WA, Conte JV,\net al. Development of a quantitative donor risk index to predict short\ufffeterm mortality in orthotopic heart transplantation. J Heart Lung Transplant.\n(2012) 31:266–73. doi: 10.1016/j.healun.2011.10.004\n34. Orens JB, Boehler A, de Perrot M, Estenne M, Glanville AR, Keshavjee S,\net al. A review of lung transplant donor acceptability criteria. J Heart Lung\nTransplant. (2003) 22:1183–200. doi: 10.1016/S1053-2498(03)00096-2\n35. Collins GM, Bravo-Shugarman M, Terasaki PI. Kidney preservation for\ntransportation. Initial perfusion and 30 hours’ ice storage. Lancet. (1969)\n2:1219–22. doi: 10.1016/S0140-6736(69)90753-3\n36. Collard CD, Gelman S. Pathophysiology, clinical manifestations, and', 'of host liver mass in mice after infusion of 3 − 5% of the total\nrecipient liver cells (22). Finally, allogeneic rejection is most\nprobably the main cause for the observed decline of cell graft\nfunction within 1 year of HT (19). Although the safety of\nclinical HT has been very well established, therapeutic benefit\nhas been modest and only temporary so far. This is partially in\ncontrast with very convincing preclinical results obtained in a\nnumber of animal models of liver disease (2–4), possibly\nbecause these models do not properly mimic the disease in\nhumans. Animals usually develop liver injury within a few days\nor weeks, whereas in humans the injury is significantly more\nsevere occurring over many decades, thus highlighting a need\nof more realistic models of liver disease.\nPROCEDURES: HEPATOCYTE SOURCE, ISOLATION, QUALITY\nCONTROL, AND ADMINISTRATION FOR CELL\nTRANSPLANTATION\nHuman hepatocytes are isolated from (i) whole donor livers\nunsuitable/rejected for OLT, mostly because of severe\nsteatosis, prolonged ischemia time, older, or non-heart\ufffebeating donors, or (ii) from liver segments, mainly I and\nIV, which are available for cell isolation after split liver\ntransplantation. Alternatively, fetal and neonatal livers are\nbeing explored as a potential cell source (23,24) as they are\ncurrently not considered for OLT and may allow the isolation\nof very high-quality cells (9). Neonatal-derived hepatocytes,\nalthough not fully mature, show activity of some of the main\nenzymes responsible for hepatic-detoxifying functions (23).\nExplanted livers from patients with liver-based metabolic\ndisorders have also been considered as a potential source of\ncells. This concept was adopted from a similar approach used\nin the so-called “domino” liver transplantation performed\nsince the mid-1990s, in which a liver transplant recipient with\na known metabolic defect can donate his explanted native\nliver for use as liver graft in another patient (25). In a similar\nway, liver explants from patients with defined metabolic\ndisorders could become a source of hepatocytes, since their\nmissing enzymatic function would be performed by the\nrecipient’s native liver, left in place. This approach was used in\na 6-year-old boy with severe phenylketonuria transplanted\nwith hepatocytes isolated from a glycogen storage type 1b\nliver explant, with significant reduction of blood phenylala\ufffenine levels up to 3 months after transplantation (13).\nIn order to isolate the hepatocytes, a standardized three-step\ncollagenase perfusion technique originally developed by Berry\nand Friend and later modified (26–28) is used. First, major\nhepatic vessels are cannulated and perfused with Hank’s buffered\nsalt solution (HBSS) containing EGTA, which is able to chelate\ncalcium ions, thus disrupting the desmosomes, calcium\ufffedependent cell-to-cell adhesions. Second, the liver is flushed\nwith plain HBSS to remove any residue of EGTA. Third, the\ntissue is perfused with a calcium-dependent collagenase solution\nto digest the extracellular matrix. After breaking of the liver\ncapsule, the released liver cells are filtered and centrifuged at low\nspeed to separate hepatocytes from nonparenchymal cells.\nHepatocytes can be used fresh for transplantation or cryopre\ufffeserved. Several protocols have been described to cryopreserve\nhuman hepatocytes, with the best results being achieved\ncryopreserving 106\n–107 cells/ml in the University of Wisconsin\norgan preservation solution containing 10% dimethyl sulfoxide\nand 5% glucose, and using a controlled-rate freezer (29).\nCryopreserved hepatocytes are then stored at –140 °C until\nrequired for HT. Hepatocyte isolations for use in clinical HT\nmust be performed under good manufacturing practice (GMP)\nin an aseptic and accredited units.\nEvaluation of hepatocyte quality before transplantation is\nvital, especially on cryopreserved cells, as it has been shown\nthat freeze-thawing cycles damage mitochondria, affect cell', 'withdrawal regimens are inconclusive, and most of them lack\nevidence of invasive liver biopsy. However, direct comparisons\nof these trials are difficult because of the lack of standardization.\nAccording to the current research results, the acute rejection rate\nafter IS withdrawal varies from 12 to 76% (Tables 1, 2), but it is\ngenerally moderate and almost reversible. Chronic rejection is\nrare (0–6%), and the incidence of graft loss owing to rejection\nis extremely low (39, 40). Over time, however, the prevalence\nand severity of chronic graft injury such as subclinical rejection,\nchronic portal inflammation, borderline hepatitis, and/or fibrosis\n(periportal and/or perivenous) would increase (41–51). Ten years\nafter transplantation, most studies report that normal histology\nis present in up to 30% of allografts; bridging fibrosis and/or\ncirrhosis may be equally common, accounting for about 60%\n(42, 45, 52). The transcriptome analysis of liver tissue revealed\nan expression profile very similar to that of T-cell mediated\nrejection (53). Notably, more than 90 percent of patients who\nstopped IS 20 years after the transplant did not experience\nrejection (27). To date, there is no definitive data suggesting that\nFrontiers in Immunology | www.frontiersin.org 4 June 2020 | Volume 11 | Article 1326', 'nonalcoholic fatty liver disease. Liver Transpl 2010;16:431–439. doi: 10.\n1002/lt.22004.\n[51] McCormack L, Dutkowski P, El-Badry AM, Clavien PA. Liver transplantation\nusing fatty livers: always feasible? J Hepatol 2011;54:1055–1062. doi: 10.\n1016/j.jhep.2010.11.004.\n[52] Angulo P. Nonalcoholic fatty liver disease and liver transplantation. Liver\nTranspl 2006;12:523–534. doi: 10.1002/lt.20738.\n[53] de Graaf EL, Kench J, Dilworth P, Shackel NA, Strasser SI, Joseph D, et al.\nGrade of deceased donor liver macrovesicular steatosis impacts graft and\nrecipient outcomes more than the Donor Risk Index. J Gastroenterol\nHepatol 2012;27:540–546. doi: 10.1111/j.1440-1746.2011.06844.x.\n[54] Spitzer AL, Lao OB, Dick AA, Bakthavatsalam R, Halldorson JB, Yeh MM, et al.\nThe biopsied donor liver: incorporating macrosteatosis into high-risk donor\nassessment. Liver Transpl 2010;16:874–884. doi: 10.1002/lt.22085.\nJournal of Clinical and Translational Hepatology 2020 vol. 8 | 215–221 221\nGadiparthi C. et al: Liver transplantation in NASH patients', ""Int. J. Med. Sci. 2018, Vol. 15\nhttp://www.medsci.org\n255\nTransplantation and the American Society of Transplant Surgeons. 2011; 11: \n1773-84.\n9. Singal AK, Guturu P, Hmoud B, Kuo YF, Salameh H, Wiesner RH. Evolving \nfrequency and outcomes of liver transplantation based on etiology of liver \ndisease. Transplantation. 2013; 95: 755-60.\n10. Clavien PA, Harvey PR, Strasberg SM. Preservation and reperfusion injuries \nin liver allografts. An overview and synthesis of current studies. \nTransplantation. 1992; 53: 957-78.\n11. Strasberg SM, Howard TK, Molmenti EP, Hertl M. Selecting the donor liver: \nrisk factors for poor function after orthotopic liver transplantation. \nHepatology. 1994; 20: 829-38.\n12. Castaldo ET, Chari RS. Liver transplantation for acute hepatic failure. HPB: the \nofficial journal of the International Hepato Pancreato Biliary Association. 2006; \n8: 29-34.\n13. Jia JJ, Li JH, Jiang L, Lin BY, Wang L, Su R, et al. Liver protection strategies in \nliver transplantation. Hepatobiliary & pancreatic diseases international: HBPD \nINT. 2015; 14: 34-42.\n14. Elwood D, Pomposelli JJ. Hepatobiliary surgery: lessons learned from live \ndonor hepatectomy. The Surgical clinics of North America. 2006; 86(vii): \n1207-17.\n15. He S, Atkinson C, Evans Z, Ellett JD, Southwood M, Elvington A, et al. A role \nfor complement in the enhanced susceptibility of steatotic livers to ischemia \nand reperfusion injury. J Immunol. 2009; 183: 4764-72.\n16. Limanond P, Raman SS, Lassman C, Sayre J, Ghobrial RM, Busuttil RW, et al. \nMacrovesicular hepatic steatosis in living related liver donors: correlation \nbetween CT and histologic findings. Radiology. 2004; 230: 276-80.\n17. Bernardi M, Gitto S, Biselli M. The MELD score in patients awaiting liver \ntransplant: strengths and weaknesses. Journal of hepatology. 2011; 54: \n1297-306.\n18. Dirican A, Baskiran A, Dogan M, Ates M, Soyer V, Sarici B, et al. Evaluation of \nPotential Donors in Living Donor Liver Transplantation. Transplantation \nproceedings. 2015; 47: 1315-8.\n19. Drebber U, Dienes HP. [Histopathology in liver transplantation]. Der \nPathologe. 2008; 29: 84-92.\n20. Markin RS, Wisecarver JL, Radio SJ, Stratta RJ, Langnas AN, Hirst K, et al. \nFrozen section evaluation of donor livers before transplantation. \nTransplantation. 1993; 56: 1403-9.\n21. O'Leary JG, Lepe R, Davis GL. Indications for liver transplantation. \nGastroenterology. 2008; 134: 1764-76.\n22. Mukherjee S, Mahmoudi TM, Mukherjee U. Liver transplant for viral hepatitis \nand fulminant hepatic failure. Minerva gastroenterologica e dietologica. 2009; \n55: 83-100.\n23. Briceno J, Marchal T, Padillo J, Solorzano G, Pera C. Influence of marginal \ndonors on liver preservation injury. Transplantation. 2002; 74: 522-6.\n24. Jamieson NV, Sundberg R, Lindell S, Claesson K, Moen J, Vreugdenhil PK, et \nal. Preservation of the canine liver for 24-48 hours using simple cold storage \nwith UW solution. Transplantation. 1988; 46: 517-22.\n25. Steininger R, Roth E, Holzmuller P, Reckendorfer H, Grunberger T, Sperlich \nM, et al. Comparison of HTK- and UW-solution for liver preservation tested in \nan orthotopic liver transplantation model in the pig. Transplant international:\nofficial journal of the European Society for Organ Transplantation. 1992; 5 \nSuppl 1: S403-7.\n26. Tolba RH, Akbar S, Muller A, Glatzel U, Minor T. Experimental liver \npreservation with Celsior: a novel alternative to University of Wisconsin and \nhistidine-tryptophan-alpha-ketoglutarate solutions? European surgical \nresearch Europaische chirurgische Forschung Recherches chirurgicales \neuropeennes. 2000; 32: 142-7.\n27. Perera T, Mergental H, Stephenson B, Roll GR, Cilliers H, Liang R, et al. First \nhuman liver transplantation using a marginal allograft resuscitated by \nnormothermic machine perfusion. Liver transplantation: official publication of \nthe American Association for the Study of Liver Diseases and the International \nLiver Transplantation Society. 2016; 22: 120-4."", 'Additionally, for patients with HCV-related end-stage \nliver disease, another study in Egypt provided evidence \nthat administration of MSCs followed by granulocyte col\ufffeony stimulating factor (GCSF) mobilization is excellent \nfor liver stem cell therapy to retain liver mass and restore \nliver functions [18]. In summary, the above large con\ufffetrolled trials demonstrated that MSCs play a supportive \nrole in the treatment of liver failure and show satisfactory \ntolerability and beneficial effects on liver synthetic func\ufffetions and hepatic fibrosis resolution.\nMSC therapy for\xa0complications of\xa0liver transplantation\nOrthotopic liver transplantation is the only curative \nmeasure for patients with end-stage liver failure. How\ufffeever, the risk of complications after liver transplantation \nis still high, even with increases in surgical expertise. \nTwo of the most common complications following liver \ntransplant are rejection and infection. MSCs offer new \ntherapeutic opportunities to prevent and treat solid \norgan transplant rejection. A recent pilot study demon\ufffestrated that UC-MSC therapy can alleviate liver dam\ufffeage and improve allograft histology in liver transplant \npatients with acute graft rejection who did not respond \nto immunosuppressive agent dose adjustments. However, \nthe study was not carried out long enough to determine \nwhether decreased infection resulted from MSC infusion \n[19].\nHowever, in the same year, Detry et\xa0al. [20] enrolled \n10 liver transplant patients to receive MSCs infu\ufffesion and another 10 patients acted as controls. It was \nshown that no difference in the overall rates of rejec\ufffetion or graft survival was observed between the MSC \ninfusion group and the control group. And Month-6 \nbiopsies did not demonstrate a difference between \ngroups. The study indicated that the immunosuppres\ufffesion weaning in MSC recipients was not successful. \nThe results are completely different and contradictory \ncompared to those of the above pilot study. We ana\ufffelyze that the possible reason might be that the aim and \nexperimental design of the two studies were different. \nThe pilot study aimed to examine the clinical feasibil\ufffeity of MSC infusion as a therapeutic option for liver \nallograft rejection, and all patients were treated with', 'donor shortage [6]. This shortage in PHHs might be\nresolved with the emergence of human induced pluripo\ufffetent stem cells (hiPSCs), which could provide an\nunlimited source of hepatic-like cells (HLCs) [7, 8].\nhiPSC-HLCs have been used for engraftment in a liver\ninjury model and to repair injured liver tissue [9];\nhowever, following engraftment, it took weeks for\nhiPSC-HLCs to start producing detectable levels of spe\ufffecific proteins and exhibit hepatic function [10]. Because\nof the rapid deterioration of liver function and extensive\ntoxic substance accumulation [1], the treatment window\nfor ALF patients is very narrow, and the extended time\nperiod needed for engraftment with hiPSC-HLCs might\nnot be suitable for ALF therapy. Therefore, transplants\nthat can assume hepatic functions with little delay are\nrequired for ALF treatment.\nTransplantation of in vitro-generated organoids can\nregenerate functional tissue in vivo and might be a po\ufffetential approach for ALF treatment [11]. Previous stud\ufffeies have developed a macro-liver organoid (macro-LO)\nfrom hiPSCs with endothelial cells (ECs) and mesenchy\ufffemal cells (MCs) that can grow into vascularized,\nfunctional tissue post transplantation by recapitulating\nevents that occur in early liver organogenesis [12, 13].\nHowever, the three types of cells necessary for LO gener\ufffeation were derived from three different donors with dif\ufffeferent HLA types, and thus would not match any\nparticular patient’s HLA for clinical application. Clinical\nliver transplantation studies have found that incompat\ufffeible HLA matching between the graft and the patient is\nassociated with increased mortality and graft loss in ALF\npatient therapy [2]; therefore, LOs derived from a single\ndonor cell should be developed to match specific\npatients’ HLAs. Single donor-derived cells have the same\nhost genetic background and thus may recapitulate liver\norganogenesis more accurately to support LO differenti\ufffeation. Additionally, the LOs reported previously were\nstill at an immature stage, and they required 2 weeks to\ndifferentiate and exhibit hepatic function with human\ufffespecific albumin (ALB) production in vivo [12]. How\ufffeever, for ALF therapy, transplants that can immediately\nexhibit hepatic function in vivo are urgently needed [14],\nand functional LOs are thus considered to hold promise.\nTherefore, functional LOs generated from single donor\ncells are expected to be useful for ALF therapy.\nTo generate functional single donor cell-derived\n(SDC)-LOs for clinical application, all three types of cells\n(hiPSC-endoderm, ECs, and MCs) should be obtained\nfrom the same donor with high purity and few genomic\nmutations. Human somatic cells accumulate nuclear and\nmitochondrial genomic mutations over the course of\ntheir lifespan [15]; thus, cells obtained from newborns\nwould be expected to have fewer mutations than adult\ncells. ECs and MCs that have been used for LO\ngeneration are derived from newborn umbilical cords\n(UCs) and adult bone marrow (BM), respectively [12, 13].\nThe isolation of MCs from newborn BM requires an inva\ufffesive procedure that would cause harm to the newborn, so\na replacement MC source from the same newborn is thus\nnecessary for SDC-LO generation. The newborn UC is an\nimmature tissue with a large number of MCs that can be\nisolated without invasive procedures [16], and UC-derived\nMCs have characteristics similar to those of BM\ufffederived MCs (BM-MCs) [16]. Therefore, ECs and MCs\nderived from the same UC might be useful for generating\nfunctional SDC-LOs with the same donor-derived hiPSCs.\nIn this study, we obtained ECs and MCs from a single\ndonor UC and investigated the role of single donor\ufffederived ECs and MCs in LO generation and differenti\ufffeation. We also generated hiPSCs from the same donor\nto provide a hiPSC-endoderm source for LO generation.\nUsing these three types of cells, we generated functional\nSDC-LOs for ALF therapy.\nMethods\nEC and MC isolation and culture\nUnder the permission of the Ethical Review Board of']","This study investigates the potential of using normothermic machine perfusion (NMP) to preserve and resuscitate livers from expanded criteria donors (ECDs) for transplantation. The study compares the outcomes of NMP versus traditional cold storage (CS) in terms of graft function, bile production, and histopathologic changes. The results suggest that NMP improves graft function and reduces histopathologic changes compared to CS. The study also explores the use of macro-liver organoids (LOs) derived from single donor cells for ALF therapy. The study finds that LOs generated from single donor cells have fewer genomic mutations due to the use of cells from newborn sources. Overall, the study highlights the potential benefits of NMP and LOs for expanding the donor pool and improving outcomes in liver transplantation.",0.375,0.8426431139504343,CHUNKS_ONLY
How has the evidence changed regarding acceptable macro/microsteatosis in liver grafts?,"['R E S EAR CH Open Access\nPrognostic limitations of the Eurotransplant-donor\nrisk index in liver transplantation\nBenedikt Reichert1,2†\n, Alexander Kaltenborn1,3*†\n, Alon Goldis4 and Harald Schrem1\nAbstract\nBackground: Liver transplantation is the only life-saving therapeutic option for end-stage liver disease. Progressive\ndonor organ shortage and declining donor organ quality justify the evaluation of the leverage of the Donor-Risk-Index,\nwhich was recently adjusted to the Eurotransplant community’s requirements (ET-DRI). We analysed the prognostic\nvalue of the ET-DRI for the prediction of outcome after liver transplantation in our center within the Eurotransplant\ncommunity.\nResults: 291 consecutive adult liver transplants were analysed in a single centre study with ongoing data\ncollection. Determination of the area under the receiver operating characteristic curve (AUROC) was performed to\ncalculate the sensitivity, specificity, and overall correctness of the Eurotransplant-Donor-Risk-Index (ET-DRI) for the\nprediction of 3-month and 1-year mortality, as well as 3-month and 1-year graft survival. Cut-off values were\ndetermined with the best Youden-index. The ET-DRI is unable to predict 3-month mortality (AUROC: 0.477) and\n3-month graft survival (AUROC: 0.524) with acceptable sensitivity, specificity and overall correctness (54% and 56.3%,\nrespectively). Logistic regression confirmed this finding (p = 0.573 and p = 0.163, respectively). Determined cut-off\nvalues of the ET-DRI for these predictions had no significant influence on long-term patient and graft survival\n(p = 0.230 and p = 0.083, respectively; Kaplan-Meier analysis with Log-Rank test).\nConclusions: The ET-DRI should not be used for donor organ allocation policies without further evaluation, e.g. in\ncombination with relevant recipient variables. Robust and objective prognostic scores for donor organ allocation\npurposes are desperately needed to balance equity and utility in donor organ allocation.\nKeywords: Prognostic model, Accuracy, Goodness-of-fit, Score, Prediction, Validation\nBackground\nExpansion of the organ donor pool by using grafts with\nreduced quality has become reality in transplant centers\naround the world due to increasing donor organ short\ufffeage and raising numbers of patients on the waiting lists.\nThis has led to an increased awareness of the associated\nrisks for patient and graft survival [1-16]. Thus, a series\nof attempts to develop objective scores for the assess\ufffement of donor liver quality with significant influence on\npatient and/or graft survival have been made [1,2,4-9].\nIn the transplant literature there is a current debate on\nthe criteria for statistical validation of prognostic scores\nin liver transplantation that may be relevant for fair and\njust allocation rules that balance equity and utility\n[10,12,13,17,18]. Astonishingly, there is still a high het\ufffeerogeneity of statistical approaches to the validation of\nprognostic scores even though Jacob et al. published as\nearly as 2005 uniform quality criteria for the design, val\ufffeidation and reporting of prognostic scores in liver trans\ufffeplantation more than eight years ago [18]. Last year we\nhave reported from our centre that the Donor-Risk\ufffeIndex is not applicable to our patients for the prediction\nof three month mortality, three month patient survival,\nthree month graft survival as well as the necessity of\nacute retransplantation within thirty days [13]. In con\ufffetrast Blok et al. claimed in the same year that they were\nable to validate the value of the DRI for the prediction\nof three month, one year and three years graft survival\nin the Eurotransplant region [3]. In this study as well as\nin earlier studies the authors could not demonstrate\n* Correspondence: alexander.kaltenborn@gmail.com †\nEqual contributors\n1\nDepartment of General, Visceral and Transplant Surgery, Hannover Medical\nSchool, Carl-Neuberg Str. 1, 30625, Hannover, Germany\n3\nFederal Armed Forces Medical Center Hannover, Hannover, Germany\nFull list of author information is available at the end of the article\n© 2013 Reichert et al.; licensee BioMed Central Ltd. This is an open access article distributed under the terms of the Creative\nCommons Attribution License (http://creativecommons.org/licenses/by/2.0), which permits unrestricted use, distribution, and\nreproduction in any medium, provided the original work is properly cited.\nReichert et al. Journal of Negative Results in BioMedicine 2013, 12:18\nhttp://www.jnrbm.com/content/12/1/18\n\nareas under the receiver operating characteristic curve\n(AUROC) greater than 0.700 for these predictions\n[3,4,7,13]. This raises the fundamental question: What\nare the criteria for a robustly validated prognostic model?\nA relevant body of scientific literature in the bio\ufffestatistical world agrees on the outstanding value of the\nreceiver operating curve analysis for the determination\nof the value of clinical prognostic scores [18-22]. There\ufffefore, we present in this paper a validation study on the\nrecently published Eurotransplant-Donor-Risk-Index\n(ET-DRI) and evaluate its value for prognostic decision\nmaking in the cohort of our center.\nThis study is a timely contribution to the urgently\nneeded debate on prognostic models in liver transplant\ufffeation with potential impact on donor organ allocation\npolicies. The recent liver transplant scandals in Germany\nrevolve around waiting list manipulations that affected\ndonor organ allocation directly and undermined public\ntrust in current donor organ policies [23].\nResults\nET-DRI score\nThe variables’ frequencies, range and percentages used\nin the ET-DRI of our study population are summarized\nin Table 1. The mean ET-DRI in this cohort was 1.79\n(median 1.70, range: 1.14 - 3.79).\nMajor results of the analyses of the ET-DRI’s predict\ufffeive capabilities for the study endpoints are summarized\nin Table 2.\nPrediction of 3-month mortality\nWith an AUROC of 0.477 (95%-CI: 0.390-0.564) the ET\ufffeDRI failed to predict 3-month mortality after liver trans\ufffeplantation in our study population (see Figure 1). This\nresult could be confirmed by binary logistic regression\n(p = 0.692). The Hosmer-Lemeshow goodness of fit test\ndid show that the model fit of the logistic regression\nmodel was adequate (p = 0.542). Kaplan-Meier survival\nanalysis above versus below the calculated cut-off level\nof the ET-DRI for the prediction of 3-month mortality\n(2.06) did not reach statistical significance (p = 0.172,\nLog Rank; see Figure 2).\nPrediction of 1-year mortality\nFurther, the ET-DRI did not reach a relevant AUROC\nfor the prediction of 1-year mortality (AUROC 0.492)\n(see Table 2). A well fitted binary logistic regression\nmodel (p = 0.262, Hosmer-Lemeshow test) revealed no\nstatistically significant influence of the ET-DRI values on\n1-year mortality (p = 0.573). The calculated cut-off level\nfor this prediction is identical to the cut off for the pre\ufffediction of 3-month mortality. Therefore, it is no surprise\nthat the Kaplan-Meier survival analysis above versus\nbelow this cut-off level did also not reach statistical sig\ufffenificance (p = 0.230, Log Rank; see Figure 2).\nPrediction of 3-month graft survival\nWith an AUROC of 0.524 (95%CI: 0.447-0.601) the ET\ufffeDRI failed to predict 3-month graft survival after liver\ntransplantation in our study population (see Figure 3).\nFurther, investigation of the ET-DRI as a risk factor for\n3-month graft loss with a well fitted binary logistic re\ufffegression model (p = 0.491, Hosmer-Lemeshow test)\nremained insignificant (p = 0.475). Kaplan-Meier analysis\nof graft survival above versus below the determined cut\ufffeoff level for the prediction of 3-month graft survival did\nnot reach statistical significance (p = 0.655, Log Rank;\nsee Figure 4).\nPrediction of 1-year graft survival\nApplied to our data the ET-DRI is not able to predict\n1-year graft survival as shown by ROC-curve analysis re\ufffesults (AUROC = 0.540; 95%CI: 0.473-0.607). In binary\nlogistic regression, which was performed with adequate\nmodel goodness of fit (p = 0.631, Hosmer-Lemeshow\ntest), the ET-DRI was no statistically significant risk fac\ufffetor for graft loss within one year after transplantation\n(p = 0.163). Kaplan-Meier analysis of graft survival above\nversus below the determined cut-off level (1.84) did not\nreach statistical significance (p = 0.083, Log Rank).\nTable 1 Shown are the donor characteristics of our study\npopulation’s variables which are part of the ET-DRI model\nVariables\nn (%)\nCOD anoxia 24 (8.2%)\nCOD cerebrovascular accident 181 (62.1%)\nCOD other 86 (29.6%)\nDCD nil\nSplit LTX (yes/no) 20 (6.9%)\nregional share (yes/no) 253 (86.9%)\nnational share (yes/no) 38 (13.1%)\nrescue offer (yes/no) 53 (18.2%)\nage group <40 years 71 (24.4%)\n40 ≤ age < 50 (in years) 69 (23.7%)\n50 ≤ age < 60 (in years) 105 (36.1%)\n60 ≤ age < 70 (in years) 52 (17.9%)\n70 ≤ age (in years) 12 (4.1%)\nmean (median) range\nCIT in h 9.75 (9.6) 2.4 – 27.3\nlatest labGGT (U/L) 70.66 (43.0) 5 – 775\nAge in years 48.4 (51.0) 12 – 74\n(COD = cause of death, DCD = donation after cardiac death, LTX = liver\ntransplantation, CIT = cold ischemic time).\nReichert et al. Journal of Negative Results in BioMedicine 2013, 12:18 Page 2 of 8\nhttp://www.jnrbm.com/content/12/1/18\n\nPower calculation and sample size\nSince the focus of this paper is prognostic estimation ra\ufffether than hypothesis testing, strictly speaking power\ncalculations are not directly relevant. The rationale for a\nsufficient sample size in the presented study is the fact\nthat all 95%-CIs of the AUROCs are sufficiently narrow to\nexclude 0.700, the nominal criterion value for utility [20].\nDiscussion\nThe ET-DRI was originally developed with thousands of\npatients transplanted in the Eurotransplant region in\ufffecluding many transplant centers and the authors claimed\nthat the ET-DRI is of prognostic relevance for graft sur\ufffevival after liver transplantation [5]. We believe that the\nfundamental discrepancy to our results and interpret\ufffeation can be related to the fact that the ET-DRI as\nshown by Braat et al. cannot reach a c-index above 0.700\nfor the prediction of graft survival in thousands of liver\ntransplant recipients [5]. This finding could be con\ufffefirmed in our study with AUROCs <0.700.\nBraat et al. [5] used the previously published DRI [7]\nwhich was developed in the United States and they\nattempted to tailor and adapt the DRI to the donor\npopulation in the Eurotransplant region. The goal of our\nstudy was to test the ET-DRI as a prognostic model in\nour centre with current MELD-based liver allocation\nrules. Braat et al. used a dataset of recipients who were\ntransplanted in the vast majority of cases outside\nMELD-based organ allocation between 2003 and 2007.\nMELD-based liver allocation was introduced in Germany\nin December 2006 [5]. Braat et al. claimed in their paper\nwhich was published in 2012 that the ET-DRI should be\nused for liver allocation in the future [5]. We therefore\nbelieve that our analysis of the ET-DRI with a current\ncohort is fully justified in order to assess the potential\nmerit of the ET-DRI for the future. Braat and colleagues\nclearly stated quite righteously that Eurotransplant is di\ufffevided into different regions; i.e. for Austria, Belgium/\nLuxembourg, Croatia, the Netherlands and Slovenia\neach country is considered as one region, whereas\nGermany is divided into seven regions. Therefore the\nterm allocation is divided into local (transplant center is\nin the procurement area), regional (transplantation and\nprocurement area within the same country, or region in\nGermany), and national or extra-regional (anywhere in\nEurotransplant, but outside the region) [5]. Interestingly,\nthe ET-DRI calculation formula as shown by Braat et al.\ndoes not contain a criterion for local share. Our analysis\nof the influence of local versus regional versus national\nshare on transplant outcome did not show a significant\nimpact of local share on outcomes in our cohort\n(p < 0.05; Chi2\n).\nCurrently, Avolio et al. have claimed that ROC-curve\nanalysis is not the adequate measure to assess the value\nof prognostic models for graft or patient survival, espe\ufffecially if they include donor organ variables. Additionally,\nthey postulated that it would be preferable to use time\ufffedependent ROC-curve analysis [17]. This notion is an\nexpansion of the current thinking as expressed in the\nmajority of recent bio-statistical publications [18-21].\nSensitivity, specificity and area under the ROC-curve are\noften used to measure the ability of survival models to\npredict future risk [18-21]. Estimation of these parame\ufffeters is complicated by the fact that these parameters are\nTable 2 Shown are the results of the analyses of the study endpoints\nEndpoint ET-DRI cut off values\nAUROC 95%-CI Logistic regression p-value Sensitivity Specificity Overall correctness\n3-month mortality 0.477 0.390-0.564 p = 0.692 2.06 26.7% 81.4% 54%\n1-year mortality 0.492 0.405-0.579 p = 0.573 2.06 26.7% 81.4% 54%\n3-month graft survival 0.524 0.477-0.601 p = 0.475 1.95 38% 74.5% 56.3%\n1-year graft survival 0.540 0.473-0.607 p = 0.475 1.84 47.4% 63.6% 55.5%\nAUROC = area under the receiver operating characteristic curve; 95%-CI = 95%-Confidence Interval\nFigure 1 Shown is the ROC-Curve for the prediction of 3-month\nmortality after liver transplantation with the ET-DRI (AUROC =\n0.477; 95%CI: 0.390-0.564).\nReichert et al. Journal of Negative Results in BioMedicine 2013, 12:18 Page 3 of 8\nhttp://www.jnrbm.com/content/12/1/18\n\ntime-dependent. Furthermore, censoring affects their es\ufffetimation just as it affects estimation of survival curves or\ncoefficients of survival regression models [22]. In the\npresented study only relatively short time windows\nhave been investigated. Therefore, application of time\ufffedependent ROC-curve analysis is in our view not\njustified.\nThere is currently no objective score for the assess\ufffement of donor organ quality available that would be able\nto predict short-term patient and graft survival with ac\ufffeceptable overall correctness ((sensitivity + specificity)/2).\nIt appears safe to assume that extended donor criteria\norgans with extreme properties would affect graft sur\ufffevival negatively in the short-term and lead to initial graft\nnon-function which is known to be associated with in\ufffecreased patient mortality [1,2,4-9,14,15]. Current prog\ufffenostic scores for donor organ quality are unable to\ndemonstrate significant statistical influences on short\ufffeterm graft survival as robust prognostic tools\n[1,2,4-10,12-15]. We believe that these currently avail\ufffeable scores may have missed potentially critical parame\ufffeters and/or combinations of donor organ variables and/\nor their interaction that may be critical for a robust\nprognostic score to predict short-term graft survival with\nacceptable overall correctness. The design of many prog\ufffenostic scores in the medical literature, including the ET\ufffeDRI has failed so far to assess multivariable co-linearity\nof the influences of variables on the target output vari\ufffeable (e.g. graft survival) [5,18,26].\nHanley and McNeil have shown that c is identical to a\nwidely used measure of diagnostic discrimination, the\nAUROC in ROC-curve analysis [20,21]. A value of c of\n0.5 indicates random prediction and a value of 1 indicates\nn=231 (79.4%)\nn=60 (20.6%)\nFigure 2 Kaplan Meier survival analysis above and below the ET-DRI cut-off values for the prediction of 3-month mortality (2.06) shows\nthat this cut-off value has no significant influence on long-term survival (p = 0.172; Log Rank). The curve clearly demonstrates that the\nET-DRI has no influence on long-term survival and limited influence on survival within the first 90 days.\nFigure 3 Shown is the ROC-Curve for the prediction of 3-month\ngraft survival after liver transplantation with the ET-DRI\n(AUROC of 0.524 (95%CI: 0.447-0.601, SD 0.039).\nReichert et al. Journal of Negative Results in BioMedicine 2013, 12:18 Page 4 of 8\nhttp://www.jnrbm.com/content/12/1/18\n\nperfect prediction. A model having c greater than roughly\n0.7 has some utility in predicting the responses of individ\ufffeual subjects [21]. The c-index 0.624 which was published\nbefore for the prediction of graft survival with the ET-DRI\nin a large Eurotransplant cohort [5] appears therefore as a\nmeasure of limited utility of this score.\nThis study is limited by the relatively small number of\nenrolled patients (n = 291). However, none of the 95%\nCIs included a relevant AUROC >0.700. Moreover, organ\nprocurement from donors after cardiac death is a rele\ufffevant factor of the original population, in which the ET\ufffeDRI was created [5]. Unfortunately we were not able to\ninclude this specific donor group, because liver donation\nafter cardiac death is not applied in Germany. Thus, the\nresults of this analysis may be confounded by the ab\ufffesence of these cases.\nTaken together we believe that the ET-DRI or any\nother donor risk score should not be used for donor\norgan allocation rules without adequate criticism of its\nmethodological limitations. The transplant community\ndesperately needs a debate on the power and limitations\nof prognostic scores in liver transplantation which\nshould lead to a consensus. In our opinion Jacob et al.\nhave made a reasonable proposal for the quality assess\ufffement of prognostic models for liver transplantation [18].\nThe application of a previously developed score to a\nnew dataset premises that the characteristics of both refer\ufffeence and study populations should result in overlapping\nor at least should present similar patterns [17]. This ex\ufffepectation is met with our study population which is a sub\ufffeset of the Eurotransplant population which was used by\nBraat and colleagues [5].\nWe believe that the reasons for our findings which\nsomehow contrast the previously published findings [5]\nare maybe due to a strong center bias. This notion is\nlikely because our population constitutes a subpopula\ufffetion of the one that was investigated by Braat et al. [5].\nFurther, the fact that at least two transplant centers\nwithin the Eurotransplant region are known to believe\nthat rescue allocated organs do not affect outcome after\nof liver transplantation [27,28] and the fact that the per\ufffecentage of accepted rescue allocated livers for trans\ufffeplantation differs widely within the Eurotransplant\nregion may contribute to this center bias. In our center\nthe percentage of rescue allocated livers was compara\ufffetively low (18.2%) while approximately 30% of livers in\nthe Eurotransplant region are transplanted after rescue\nallocation [27].\nAnother critical aspect in donor organ assessment is\nthe histological diagnostics. Not all donor livers are bi\ufffeopsied. Moreover, the frequency of biopsies is com\ufffepletely dependent on the indication to perform a\nhistological examination. This subjective and irregular\nindication is the responsibility of the explant surgeon or\nthe accepting transplant center. Recently, two studies de\ufffescribed the importance of steatosis as a donor risk factor\nn=191 (65.6%)\nn=100 (34.4%)\nFigure 4 Kaplan Meier survival analysis above and below the ET-DRI cut-off values for the prediction of 3-month graft survival (1.95)\nshows that this cut-off value has no significant influence on long-term graft survival (p = 0.655; Log Rank). The curve clearly\ndemonstrates that the ET-DRI has no influence on long-term graft survival.\nReichert et al. Journal of Negative Results in BioMedicine 2013, 12:18 Page 5 of 8\nhttp://www.jnrbm.com/content/12/1/18\n\n[29,30]. Spitzer et al. [30] concluded that steatosis should\nbe added to the DRI, when dealing with a high-risk\ndonor. However, objective evaluation of the range of\nsteatosis, either as macro- or microvesicular steatosis, is\nnot standardized so far subjective to some degree [29].\nWe believe that routine donor biopsy evaluation may en\ufffeable the design of more powerful and robust donor risk\nscores.\nWe believe that the prognostic power of the DRI and\nET-DRI is further significantly undermined by the fact\nthat graft acceptance decisions on offered organs for\ntransplantation are not documented and evaluated in\nthese scores. There is an urgent need to evaluate and ad\ufffedress this shortcoming immediately, especially on the\nbackground of the current liver transplant scandals in\nGermany [23,31]. We believe that this aspect is a rele\ufffevant issue in liver transplantation today. Transplant cen\ufffeters regard their graft acceptance policy as their\npotential advantage in a highly competitive area for a\nvery scarce resource in times of ubiquitous organ short\ufffeage. It can be assumed that these aspects of potentially\nunwanted transparency by the proponents of transplant\ufffeation stood in the way of previous attempts to generate\nrobust prognostic scores that include donor organ qual\ufffeity. This may represent a deeper reason for the notorious\ndifficulty to assess donor organ quality and its impact on\nprognosis after transplantation objectively.\nThe balance of equity and utility in donor organ allo\ufffecation is a serious ethical dilemma. Several risk predic\ufffetion models are available and their head to head\ncomparisons would benefit from standardized reporting\nand formal, consistent statistical evaluation [18,26]. It\nwas claimed previously and in a different context that\noutcome selection and optimism biases may affect litera\ufffeture on prognostic scores in medicine [26].\nWe would like to propose joint efforts to develop a ro\ufffebust and objective donor risk score in an international\ncollaboration that should include the available large\ndata-sets from multiple institutions. We believe that the\ntime has come for a consensus on the reporting of the\nreasons for declined organ offers and on quality stan\ufffedards for prognostic scores and their statistical analysis\nand validation. Jacob et al. [18] proposed a reasonable\nscientific approach to the latter. High quality scientific\njournals should make uniform requirements mandatory\nfor the reporting of prognostic scores.\nConclusion\nThe results of this current study clearly show that the\nET-DRI is not applicable in the population from our\ncenter within the Eurotransplant community for the pre\ufffediction of patient or graft survival. On the background\nof a paucity of proper prognostic models, justified organ\nallocation which weighs urgency against prediction of\nsuccess of liver transplantation must be the aim of future\nresearch in this field.\nPatients and methods\nEthics statement\nAs an observational retrospective study, according to the\nProfessional Code of the German Medical Association\n(article B.III. § 15.1), neither informed consent nor ap\ufffeproval of the ethics committee was needed for this\nstudy.\nPatients\n291 consecutive liver transplants were included to\nanalyze the model’s accuracy and applicability for this\ndataset of a major transplant centre in the Eurotrans\ufffeplant community. Included were 20 (6.9%) split liver\ntransplants, 30 (10.3%) acute re-transplants (retransplan\ufffetation within 30 days after the previous transplant) and\n25 (8.6%) chronic retransplants (primary transplantation\nn = 235, secondary transplantation n = 48, tertiary trans\ufffeplantation n = 6, quaternary transplantation n = 1) in a\ntotal of 257 patients (median age: 49.6 years, range: 18–\n69 years; males n = 177 (64.4%), females n = 114 (35.6%),\nratio males/females: 1.8). All transplants were performed\nin our centre between the 01/01/2007 and the 12/31/\n2010. The post-transplant observational period ended on\nthe 12/31/2011. Indications leading to liver transplant\ufffeation as well as the most probable leading causes of\ndeath in our cohort are summarized in Tables 3 and 4.\nStudy end-points\nPrimary study endpoints were 3-month and 1-year pa\ufffetient mortality and 3-month and 1-year graft survival.\n(Graft survival and failure free survival (FFS) are syno\ufffenyms that describe the time period from date of trans\ufffeplantation until the date of retransplantation or recipient\ndeath).\nStatistical analysis\nFor the primary study endpoints ROC-curve analysis was\nperformed to calculate the sensitivity, specificity, and\noverall model correctness of the ET-DRI as a predictive\nmodel. AUROCS larger than 0.7 indicate a clinically\nuseful prognostic model [18-22]. The respective cut-off\nvalues of the potential prognostic models were deter\ufffemined with the best Youden index (Youden index =\nsensitivity + specificity – 1) [24]. If possible, the Hosmer\ufffeLemeshow Chi2\n-statistic goodness-of-fit test was applied\nto assess model calibration of the binary logistic regres\ufffesion models. These statistics suggest good fit when the\nassociated p-values are greater than 0.05 [21,25]. Survival\nanalysis was performed with the Kaplan-Meier method.\nThe statistical influence of the determined cut-off values\non patient and graft survival was analyzed with the Log\nReichert et al. Journal of Negative Results in BioMedicine 2013, 12:18 Page 6 of 8\nhttp://www.jnrbm.com/content/12/1/18\n\nRank test. Binary logistic regression was performed as\nadditional test to determine the influence of the ET-DRI\non study end-points. For all statistical tests a p-value\n<0.05 was defined as significant. The SPSS statistics soft\ufffeware version 20.0 (IBM, Somers, NY, USA) was used to\nperform statistical analysis.\nCalculation of the ET-DRI\nThe ET-DRI was calculated as described before with this\nformula [5]:\nET-DRI = exp[0.960((0.154 if 40 ≤ age < 50) + (0.274If\n50 ≤ age < 60) + (0.424 if 60 ≤ age < 70) + (0.501 if 70 ≤\nage) + (0.079 if COD = anoxia) + (0.145 if COD = cere\ufffebrovascular accident) + (0.184 if COD = other) + (0.411\nif DCD) + (0.422 if partial/split) + (0.105 if regional\nshare) + (0.244 if national share)) + (0.010 × (cold ischemia\ntime − 8 h)) +0.06((latest lab GGT (U/L)- 50)/100) +\n(0.180 if rescue offer)].\nRegional share was defined by Braat et al. as allocation\nwithin Germany and national share as allocation within\nEurotransplant land [5].\nData collection\nThis is a single centre analysis complemented by on\ufffegoing data collection.\nSetting\nThe setting of the study is a university hospital in\nGermany within the Eurotransplant community.\nInclusion and exclusion criteria\nIncluded were all consecutive liver transplants per\ufffeformed in adult recipients (minimum age 18 years). Ex\ufffecluded were all combined transplants (e.g. combined\nliver and kidney transplantation) and living-related organ\ndonor transplants.\nTable 3 Shown are the indications for liver\ntransplantation in the study population\nIndications for liver transplantation: %\nacute liver failure 10.3\nalcoholic cirrhosis 8.6\nalpha-1-antitrypsin deficiency 1.4\nautoimmune hepatitis 1.0\nbiliary atresia 0.7\nBudd Chiari syndrome 2.1\ncryptogenic cirrhosis 5.5\nfamilial amyloidotic polyneuropathy 1.0\nHBV HCV related cirrhosis 0.3\nHBV related cirrhosis 4.5\nHCC 19.6\nHCV related cirrhosis 5.5\nintrahepatic CCC 0.7\nM. Osler/hemangioma 0.3\nneuroendocrine metastases 1.0\nOther 0.7\nOxalosis 0.3\nPBC 2.7\npolycystic disease 3.4\nPSC 8.2\nre-TX: biliary complications 3.4\nre-TX: chronic graft failure 5.5\nre-TX: chronic rejection 1.0\nre-TX: primary graft non-function 6.2\nre-TX: recurrent viral hepatitis 0.3\nre-TX: vascular complications 2.4\nsecondary biliary cirrhosis 1.7\nWilson disease 1.4\nTotal: 100.0\n(HBV = hepatitis b; HCV = hepatitis c; CCC = cholangiocellular carcinoma,\nPBC = primary biliary cirrhosis, PSC = primary sclerosing\ncholangitis, re-Tx = retransplantation).\nTable 4 Shown are the most probable causes of death in\nour study population\nMost probable causes of death: %\ncardiovascular event 12.2\ncerebral: bleeding 2.1\ncerebral: ischemia 4.7\ndata not available 10.5\nde novo malignancy 3.2\ngastrointestinal: ischemia 3.2\ngastrointestinal: perforation 2.1\nInfection: fungal 5.8\nInfection: sepsis 21.1\nintraabdominal bleeding 4.7\nliver graft: biliary tract complications 12.2\nliver graft: initial graft non-function 2.1\nlung: ARDS 8.5\nlung: pneumonia 3.2\npolytrauma 0.6\nsocial: suicide 0.6\ntumor recurrence 3.2\nTotal deaths: 100.0\n(HBV = hepatitis B; HCV = hepatitis C; ARDS = Acute Respiratory\nDistress Syndrome).\nReichert et al. Journal of Negative Results in BioMedicine 2013, 12:18 Page 7 of 8\nhttp://www.jnrbm.com/content/12/1/18\n\nAbbreviations\nDRI: Donor risk index; ET-DRI: Eurotransplant-donor risk index; AUROC: Area\nunder the receiver operating characteristic; MELD: Model of end-stage liver\ndisease; ECD: Extended donor criteria.\nCompeting interests\nThe authors have no competing interests to declare. They did not receive\nany funding for this work.\nAuthors’ contribution\nBR, AK and HS designed the study and accumulated the data. BR, AK, AG\nand HS analyzed and interpreted the data and drafted the manuscript. All\nauthors read and approved the final manuscript.\nAuthor details\n1\nDepartment of General, Visceral and Transplant Surgery, Hannover Medical\nSchool, Carl-Neuberg Str. 1, 30625, Hannover, Germany. 2\nGeneral and\nThoracic Surgery, Universitätsklinikum Schleswig Holstein, Kiel, Germany.\n3\nFederal Armed Forces Medical Center Hannover, Hannover, Germany. 4\nLean\nSix Sigma Black Belt, LM Advisors, Amstelveen, Netherlands.\nReceived: 12 June 2013 Accepted: 22 December 2013\nPublished: 24 December 2013\nReferences\n1. Avolio AW, Agnes S, Cillo U, Lirosi MC, Romagnoli R: The Italian survival\ncalculator to optimize donor to recipient matching and to identify the\nunsustainable matches in liver transplantation. Transpl Int 2012,\n25:294–301. http://www.D-MELD.com.\n2. Avolio AW, Cillo U, Salizzoni M, De Carlis L, Colledan M, et al: Donor-to\ufffeRecipient Italian Liver Transplant (D2R-ILTx) Study Group. Balancing\ndonor and recipient risk factors in liver transplantation: the value of\nD-MELD with particular reference to HCV recipients. Am J Transplant\n2011, 11:2724–2736.\n3. Blok JJ, Braat AE, Adam R, Burroughs AK, Putter H, Kooreman NG, et al:\nValidation of the donor risk index in orthotopic liver transplantation\nwithin the Eurotransplant region. Liver Transpl 2012, 18:112–119.\n4. Bonney GK, Aldersley MA, Asthana S, Toogood GJ, Pollard SG, Lodge JP:\nDonor risk index and MELD interactions in predicting long-term graft\nsurvival: a single-centre experience. Transplantation 2009,\n27(87):1858–1863.\n5. Braat AE, Blok JJ, Putter H, Adam R, Burroughs AK, Rahmel AO, et al: The\nEurotransplant donor risk index in liver transplantation: ET-DRI. Am J\nTransplant 2012, 12:2789–2796.\n6. Cameron AM, Ghobrial RM, Yersiz H, Farmer DG, Lipshutz GS, Gordon SA,\net al: Optimal utilization of donor grafts with extended criteria: a\nsingle-center experience in over 1000 liver transplants. Ann Surg 2006,\n243:748–753.\n7. Feng S, Goodrich NP, Bragg-Gresham JL, Dykstra DM, Punch JD, DebRoy\nMA, et al: Characteristics associated with liver graft failure: the concept of\na donor risk index. Am J Transplant 2006, 6:783–790.\n8. Halldorson JB, Bakthavatsalam R, Fix O, Reyes JD, Perkins JD: D-MELD, a\nsimple predictor of post liver transplant mortality for optimization of\ndonor/recipient matching. Am J Transplant 2009, 9:318–326.\n9. Rana A, Hardy MA, Halazun KJ, Woodland DC, Ratner LE, Samstein B, et al:\nSurvival outcomes following liver transplantation (SOFT) score: a novel\nmethod to predict patient survival following liver transplantation. Am J\nTransplant 2008, 8:2537–2546.\n10. Reichert B, Becker T, Weismüller TJ, Kleine M, Zachau L, et al: Value of the\npreoperative SOFT-score, P-SOFT-score, SALT-score and labMELD-score\nfor the prediction of short-term patient and graft survival of high-risk\nliver transplant recipients with a pre-transplant labMELD-score ≥30. Ann\nTransplant 2012, 17:11–17.\n11. Schlitt HJ, Loss M, Scherer MN, Becker T, Jauch KW, Nashan B, et al: Current\ndevelopments in liver transplantation in Germany: MELD-based organ\nallocation and incentives for transplant centres. Z Gastroenterol 2011,\n49:30–38.\n12. Schrem H, Reichert B, Frühauf N, Kleine M, Zachau L, et al: [Extended donor\ncriteria defined by the German Medical Association : study on their\nusefulness as prognostic model for early outcome after liver\ntransplantation]. Chirurg 2012, 83:980–988.\n13. Schrem H, Reichert B, Frühauf N, Becker T, Lehner F, Kleine M, et al: The\nDonor-Risk-Index, ECD-Score and D-MELD-Score all fail to predict\nshort-term outcome after liver transplantation with acceptable sensitivity\nand specificity. Ann Transplant 2012, 17:5–13.\n14. Volk ML, Lok AS, Pelletier SJ, Ubel PA, Hayward RA, et al: Impact of the\nmodel for end-stage liver disease allocation policy on the use of\nhigh-risk organs for liver transplantation. Gastroenterology 2008,\n135:1568–1574.\n15. Volk ML, Reichert HA, Lok AS, Hayward RA: Variation in organ quality\nbetween liver transplant centers. Am J Transplant 2011, 11:958–964.\n16. Weismüller TJ, Negm A, Becker T, Barg-Hock H, Klempnauer J, Manns MP,\net al: The introduction of MELD-based organ allocation impacts 3-month\nsurvival after liver transplantation by influencing pretransplant patient\ncharacteristics. Transpl Int 2009, 22:970–978.\n17. Avolio A, Halldorson J, Lirosi M, Lupo L, Nicolotti N, et al: D-MELD, a strong\nand accurate tool to guide Donor-2-Recipient Matching. Ann Transplant\n2013, 18:161–162.\n18. Jacob M, Lewsey JD, Sharpin C, Gimson A, Rela M, et al: Systematic review\nand validation of prognostic models in liver transplantation. Liver Transpl\n2005, 11:814–825.\n19. Cholongitas E, Marelli L, Shusang V, Senzolo M, Rolles K, et al: A systematic\nreview of the performance of the model for end-stage liver disease\n(MELD) in the setting of liver transplantation. Liver Transpl 2006,\n12:1049–1061.\n20. Hanley JA, McNeil BJ: The meaning and use of the area under a receiver\noperating characteristic (ROC) curve. Radiology 1982, 143:29–36.\n21. Harrell FE: Regression Modelling Strategies: With Applications to Linear Models,\nLogistic Regression and Survival Analysis. New York: Springer Publishing; 1986.\n22. Chambless LE, Diao G: Estimation of time-dependent area under the ROC\ncurve for long-term risk prediction. Stat Med 2006, 30:3474–3486.\n23. Metz C, Hoppe N: Organ transplantation in Germany: regulation scandals\nand scandalous regulation. Eur J Health Law 2013, 20:1–4.\n24. Youden WJ: Index for rating diagnosis tests. Cancer 1950, 3:32–35.\n25. Hosmer D, Lemeshow S: Applied Logistic Regression. New York: Wiley; 2000.\n26. Siontis GC, Tzoulaki I, Siontis KC, Ioannidis JP: Comparisons of established\nrisk prediction models for cardiovascular disease: systematic review. BMJ\n2012, 344:e3318.\n27. Doenecke A, Scherer MN, Tsui TY, Schnitzbauer AA, Schlitt HJ, Obed A:\n“Rescue allocation offers” in liver transplantation: is there any reason to\nreject “unwanted” organs? Scand J Gastroenterol 2010, 45:1516–1517.\n28. Sotiropoulos GC, Paul A, Gerling T, Molmenti EP, Nadalin S, Napieralski BP,\net al: Liver transplantation with “rescue organ offers” within the\neurotransplant area: a 2-year report from the University Hospital Essen.\nTransplantation 2006, 82:304–309.\n29. Doyle MB, Vachharajani N, Wellen JR, Anderson CD, Lowell JA, Shenoy S,\net al: Short- and long-term outcomes after steatotic liver transplantation.\nArch Surg 2010, 145:653–660.\n30. Spitzer AL, Lao OB, Dick AA, Bakthavatsalam R, Halldorson JB, Yeh MM, et al:\nThe biopsied donor liver: incorporating macrosteatosis into high-risk\ndonor assessment. Liver Transpl 2010, 16:874–884.\n31. Schrem H, Kaltenborn A: Avoid more organ transplant scandals. Nature\n2013, 498:37.\ndoi:10.1186/1477-5751-12-18\nCite this article as: Reichert et al.: Prognostic limitations of the\nEurotransplant-donor risk index in liver transplantation. Journal of\nNegative Results in BoiMedicine 2013 12:18.\nReichert et al. Journal of Negative Results in BioMedicine 2013, 12:18 Page 8 of 8\nhttp://www.jnrbm.com/content/12/1/18\n\n']","This study aimed to investigate the accuracy of the Eurotransplant-Donor Risk Index (ET-DRI) in predicting short-term patient and graft survival after liver transplantation. The study analyzed a current cohort of 296 patients who received liver transplantation in Hannover, Germany between January 2008 and December 2011. The ET-DRI was calculated for each patient based on donor characteristics, and the study evaluated the sensitivity, specificity, and overall correctness of the ET-DRI in predicting 3-month and 1-year mortality and graft survival using receiver operating characteristic (ROC) curves. The study found that the ET-DRI failed to predict short-term patient and graft survival with acceptable sensitivity and specificity, similar to previous findings for the Donor-Risk-Index, ECD-Score, and D-MELD-Score. These results suggest that none of these scores accurately predict short-term outcomes after liver transplantation. The study highlights the need for continued development of objective scores for assessing donor organ quality and optimizing donor-recipient matching.",0.8888888888888888,0.8463055231424601,FULL_PAPER
How has the evidence changed regarding acceptable macro/microsteatosis in liver grafts?,"['J Clin Pathol 1985;38:1366-1373\nBiopsy findings in cases of rejection of liver allograft\nSG HUBSCHER, D CLEMENTS,* E ELIAS,* P McMASTERt\nFrom the Department ofPathology, The Medical School, University ofBirmingham, and the Departments of\n*Medicine and tSurgery, Queen Elizabeth Hospital, Edgbaston, Birmingham\nSUMMARY Features of rejection were found in 21 needle biopsies obtained from seven patients after\nliver transplantation. Wedge biopsies taken peroperatively were used as a baseline for comparison.\nRejection was diagnosed by excluding other known causes of graft dysfunction using appropriate\nmethods. In cases in which these criteria were fulfilled a consistent picture of rejection was seen, and\nthis was useful in clinical management. Two features constantly present in cases of acute rejection\nwere: a dense mixed portal inflammatory infiltrate; and polymorphonuclear infiltration of biliary\nepithelium.\nEarly studies of liver allograft pathology that were\nprimarily based on necropsy findings ascribed a wide\nrange of lesions to rejection.`3 Liver biopsies were\nrarely performed during this period, and interpreting\nthem was difficult.45 Recent studies illustrate the use\ufffefulness of performing serial biopsies for the diagnosis\nand management of rejection, although there are still\ndifferences in the histological features ascribed to\nrejection.67\nThe purpose of our study was to determine whether\nconsistent and reliable histological features of rejec\ufffetion could be identified in biopsies from patients in\nwhom other causes of graft dysfunction had been\nexcluded.\nMaterial and methods\nCLINICAL DATA\nTwenty-three patients underwent orthotopic liver\ntransplantation at the Queen Elizabeth Hospital\nbetween January 1982 and May 1985. Biopsies were\nperformed to assess graft dysfunction in 10 of the last\n15 patients who had undergone surgery (orthotopic\nliver transplants, O.L. 10-O.L. 24). In all cases a diag\ufffenosis of rejection was supported by the exclusion of\nother known causes of graft dysfunction. Infection\nwas excluded by bile culture and cytomegalovirus\ncomplement serology; biliary obstruction by T tube\ncholangiography; and ischaemia by a combination of\nclinical, radiological, and histological criteria. All\npatients had an internal T tube until three months\nafter the operation: this allowed regular bile culture\nand cholangiography to be carried out. Hepatic arte\uffferiography was performed to exclude hepatic artery\nthrombosis in one patient (case 1).\nAccepted for publication 21 August 1985\nThree of the 10 biopsied patients were considered\nto have graft dysfunction due to factors other than\nrejection and were therefore excluded from this study.\nIn these three cases (O.L. 11, 12, and 20) severe per\ufffeoperative technical problems occurred, which resulted\nin considerable loss of blood. Further haemorrhage\nand hypotension complicated the postoperative\ncourse, and wedge biopsies for bleeding obtained at\nrepeat laparotomy showed centrilobular to sub\ufffemassive necrosis compatible with ischaemic damage.\nAll three died 15-24 days after transplantation, and\nnecropsy confirmed the presence of extensive hepatic\ninfarction and opportunistic infection.\nTable 1 summarises the clinical details of the\nremaining seven patients and the timing of their biop\ufffesies.\nHISTOLOGICAL DATA\nPeroperative wedge biopsies were carried out as a\nbaseline assessment in all seven patients. Twenty one\npercutaneous biopsies were obtained using a Men\ufffeghini needle (16G or 17G, 1-4mm or 16mm\ndiameter). Biopsy specimens were fixed in formalin\nand embedded in paraffin. Sections were stained with\nhaematoxylin and eosin, reticulin, van Gieson, peri\ufffeodic acid Schiff (with and without diastase digestion),\nOrcein, and Perls\'s iron stain. In one patient (case 2)\na hepatectomy specimen was available for study. In\nanother patient (case 1) the liver obtained at necropsy\nwas examined.\nTable 2 summarises the features that were assessed.\nThe severity of portal inflammation was graded semi\ufffequantitatively according to the proportion of portal\nareas affected and the intensity of inflammation\nwithin them. The presence of an acute inflammatory\ncomponent was also considered in assessing the sever\ufffe1366 Protected by copyright, including for uses related to text and data mining, AI training, and similar technologies. \n. University, Serials Bobst Library Technical Services Serials\nat New York on November 3, 2025 http://jcp.bmj.com/ Downloaded from 1 December 1985. 10.1136/jcp.38.12.1366 on J Clin Pathol: first published as \n\nBiopsy findings in cases of rejection of liver allograft\nity of portal inflammatory changes. Other changes\nwere similarly graded in a semiquantitative manner.\nResults\nPEROPERATIVE BIOPSIES\nAbnormalities were invariably present in the per\ufffeoperative biopsy specimens, although these were usu\ufffeally unimportant. All seven showed centrilobular\nhepatocyte vacuolation and necrosis. In four cases\nthere was bridging necrosis and frank subcapsular\ninfarction. All the histological changes seen in these\nbiopsies improved on subsequent biopsy, although\ntwo cases showed persistent centrilobular necrosis or\nfibrosis, or both (cases 1 and 2). The severity of\nchanges seen in peroperative biopsy specimens was\nnot related to the cold ischaemic time.\nPOSTOPERATIVE BIOPSIES\nHistological changes of rejection were seen between\nsix days and five months after transplantation\n(Table 2).\nPORTAL INFLAMMATION AND BILE DUCT\nDAMAGE\nAcute rejection was characterised by a dense mixed\nportal inflammatory infiltrate composed mainly of\nlymphocytes and neutrophils with smaller numbers of\n1367\nplasma cells, macrophages, and eosinophils. A partic\ufffeularly striking finding was the presence of poly\ufffemorphs surrounding and infiltrating the epithelium of\nsmall bile ducts and ductules (Fig. 1). This was associ\ufffeated with a variable degree of nuclear hyper\ufffechromatism and cytoplasmic vacuolation of the bili\ufffeary epithelium. These acute changes were seen in nine\nbiopsy specimens taken six to 18 days after trans\ufffeplantation.\nIn one patient (case 2) the acute bile duct lesion was\nfollowed by complete loss of ducts on the 28th day\nafter transplantation (Fig. 2) and led to graft failure\nnecessitating retransplantation. In another patient\n(case 1) acute inflammation subsided, but bile duct\nepithelium showed severe focal atypia resembling that\nseen in graft v host disease (Fig. 3).8 In the remaining\nfive cases treatment with immunosuppression resulted\nin clinical improvement and resolution of histological\nchanges, although a residual, mild and predominantly\nmononuclear infiltrate persisted in all these cases.\nThe hepatectomy specimen removed for chronic\nrejection (case 2) showed complete absence of small\nbile ducts. Larger ducts showed features similar to\nthose noted in smaller ducts in previous biopsies with\nthe additional finding of numerous foamy histiocytes\nin surrounding connective tissue (Fig. 4). A small\namount of material resistant to diastase and positive\nfor periodic acid Schiff was present in their cyto\ufffeplasm, but fat stains yielded a negative result.\nTable 1 Clinical details ofpatients and timing of biopsies after transplantation\nCase Age and Original diagnosis No of Timing of biopsy Follow up\nNo sex biopsies (day after graft)\nI O.L. 10 40 F Primary biliary cirrhosis 2 90, 102 Died at 5 months\n2 O.L. 15 41 F Primary biliary cirrhosis 3 15, 28, 56 Regraft at 2 months and\nalive at 9 months\n3 O.L. 18 46 F Primary biliary cirrhosis 3 7, 28, 38 Alive at 5 months\n4 O.L. 19 40 F Primary biliary cirrhosis 3 6, 20, 28 Alive at 5 months\n5 O.L. 21 35 F Cryptogenic cirrhosis 4 15, 18, 30, 42 Alive at 4 months\n6 O.L. 22 15 F Cryptogenic cirrhosis 2 7, 48 Alive at 2 months\n7 O.L. 24 15 M al antitrypsin deficiency 4 6, 12, 16, 40 Alive at 2 months\nTable 2 Histologicalfindings in 21 biopsies taken after transplantation\nFeatures assessed Degree of abnormality\nMild or moderate Severe\nPortal changes:\nInflammation 12 9\nPolymorphonuclear infiltration of biliary epithelium 5 9\nVascular changes:\nArterial intimal hyperplasia 3 0\nPortal vein endothelial inflammation 8 3\nCentral vein endothelial inflammation 3 2\nLobular changes:\nCholestasis 7 11\nCentrilobular necrosis or fibrosis 5 0\nAcidophil bodies (solitary) 10 0\n(clusters) 3 0\nPolymorph aggregates 4 0\nProtected by copyright, including for uses related to text and data mining, AI training, and similar technologies. \n. University, Serials Bobst Library Technical Services Serials\nat New York on November 3, 2025 http://jcp.bmj.com/ Downloaded from 1 December 1985. 10.1136/jcp.38.12.1366 on J Clin Pathol: first published as \n\n1368\nVASCtJLAR CHANGES\nInflammation was commonly present in portal and,\nto a lesser extent, central veins. Most cases were\ngraded as mild or moderate and showed occasional\nlymphocytes adherent to the luminal surface of\nvenular endothelium and focal endothelial hyper\ufffeplasia.\nIn three cases graded as severe there was sub\ufffeendothelial infla\'mmation and disruption of the endo\ufffethelium (Fig. 5). These were biopsies performed six\ndays (case 4) and seven days (cases 3 and 5) after\ntransplantation. Inflammation rapidly subsided after\nimmunosuppressive treatment, although mild\ninflammation was seen in subsequent biopsies.\nChanges in hepatic artery branches were rarely\nfound and usually only present to a minor degree. In\ntwo cases (one necropsy specimen, case 1; one sur\ufffegically removed liver, case 2) there was subendothelial\naccumulation of lipid laden macrophages causing\nsevere luminal narrowing of large arterial branches in\nthe hepatic porta (Fig. 6). This change was present at\nfive and two months, respectively. In both cases pre\ufffevious biopsies had shown centrilobular necrosis and\nreticulin collapse suggestive of ischaemic damage, but\nno abnormalities had been seen in small arteries.\nHubscher, Clements, Elias, McMaster\nCHOLESTASIS\nCentrilobular cholestasis was a common, though not\nuniversal, feature of acute rejection, being virtually\nabsent in one patient (case 3) whose biopsy had the\ntypical portal changes described above. In the other\npatients (cases 4, 5, 6, and 7), whose portal changes\nresolved after immunosuppression, cholestasis persis\ufffeted in subsequent biopsies performed up to 28 days\nlater and caused difficulty in interpretation. In one\ncase (5) the presence of worsening cholestasis with\nbile infarcts and a small bile lake suggested the possi\ufffebility of large duct obstruction, which was excluded\nradiologically. Continued treatment with low dose\nimmunosuppression resulted in gradual clinical and\nbiochemical recovery in all these cases and histologi\ufffecally, bile pigment was reduced in canaliculi and\nincreased in the cytoplasm of Kupffer cells.\nLOBULAR INFLAMMATION AND ACIDOPHIL\nBODIES\nInflammation was often present in centrilobular areas\nin association with degeneration of hepatocytes due\nto bile stasis. In four biopsy specimens tiny discrete\npolymorph clusters unrelated to cholestasis were scat\ufffetered randomly within the lobules (Fig. 7). Isolated\n*}.w*W W s,. w # WX...\nk .X.: ;S , S - :?: ssF AB\nD\nI\nI 4.:\n;@\' k ^X- _-X 4\'s t\nt v\n* .ilY .... r: t Is- 4..s\nFig. 1 Biopsy specimen 15 days after transplantation (case 2) showing acute rejection. Mixed portal inflammatory infiltrate\nincludes polymorphonuckear leucocytes surrounding and infiiltrating epithelium ofsmall bike ducts (arrowed). (Haematoxylin\nand eosin.) x 450.\nA-ML lug\' .JO *VIO\n.I 0. iqW. .:!I .0, k*...\nVW "";4w:\n.Ak.\nProtected by copyright, including for uses related to text and data mining, AI training, and similar technologies. \n. University, Serials Bobst Library Technical Services Serials\nat New York on November 3, 2025 http://jcp.bmj.com/ Downloaded from 1 December 1985. 10.1136/jcp.38.12.1366 on J Clin Pathol: first published as \n\n* X ;~~~~~~p vt.__\n,\'\'4.*>^ \' ^\nJ * , *, s s ~~~~~~~~v O\nFig.2ipyseie 8dy fe rnpanain(ae2 hwn nes etiobrcoetss otltat oti\nligt onnuler nfamatry nfltat ad onai n ble ucs.(P= oraltrct, = enra vin. Hamaoxli\nandeosin.)x 100.\n.~~~~~~~~~~~~~~~~~~~~~~~~~~P \'\n0\n*ourbb.iv; t o; x L¢t ~~~~~~~~~~~~~~~~~~~~t_j~4\n;4 ., o ;f <t ,o, t .......... * **.s.sw\nf\n01I.tv 10 Ol/7 dPw Allit, %\n\'Itt\nwo\ndw\nN,\nf1o l .8\ntr l. 44 . ;.\ns.:>h*: tf~4\n-f /*\nI\nI\nr-5 y _\n:~~~~~~~~A\n.01\n10- Ahftk..W\nim\nWm- -.\nl*\nFig. 3 Section ofliver after death ofpatient (case 1). Bile duct epitheliwn shows loss ofpolarity, nuclear pleomorphism, and\nhyperchromalism, resembling appearances seen in graft v host disease. (Haematoxylin and eosin.J x 250.\nProtected by copyright, including for uses related to text and data mining, AI training, and similar technologies. \n. University, Serials Bobst Library Technical Services Serials\nat New York on November 3, 2025 http://jcp.bmj.com/ Downloaded from 1 December 1985. 10.1136/jcp.38.12.1366 on J Clin Pathol: first published as \n\n1370\n. 4^ *.i \'.}\n; ,0,.ff-P ,,0 s g\nX\n; b~~~~~~~~~~~~* *6 \' -\n4,\',\n-I,~~~~~~~:- JI,~~~~~~\n*t .. S t ** f\nFig. 4 Hepatectomy specimen (case 2). Septal bile duct is\nsurrounded byfoamy histiocytes. Epithelium is irregular and\nshowsfocal infiltration by lymphocytes. (Haematoxylin and\neosin.) x 160.\n:! Hubscher, Clements, Elias, McMaster\n;,\n* * *\n;* :e\' 0\n..~~~~~~~~:\n\'.\n14m\n9_S t\n:: ot. :.-y4 t\n.AK\n.-,,4 ..\nv 1.\na,\n7. *4~~~~~~~~~~~~~~~~~~~~~.\nI * 4 L\nFig. 5 Biopsy specimen seven days alier transplantation\n(case 6) showing subendothelial inflammation in central vein\nand disruption ofendothelium. (Haematoxylin and eosin.) x\n400.\nt, 4\' i k\n-\nA V\n* ;I \'t 9 p eV:\' A p\n*Aflu,:t ""I "";t £ "".4; = I - \'\'\ntr I r * _\n*X; aj4.\'; ""\'¢ ,9. ,,9 4, h*f 9 &\n\'atflqt!*s tiJ;*> >ffZ *- ;i#t4 } - *~ * * *.t#@ a vF 6\nt<v«~~~~~i 4 4 \'i. *>,\nAt t *OA >t: v -.\ni a \' f \' , t\njfa\n.4\',~~~.. -\n-\n,-,.,,.9~~~~~~~\' 5 4a\nt\n4 .fl ,\'~~~~1 Pj.r\nWv--s~~~~~r\' 4\nFig.~~~~ 6\'reto oflive afe det ofpaten (cas 1) shwn uedteilacmlto fomitoyenhlratr\ncau-n seer luia narwig (Heaoyi£n oi. fO\n4~~~~~~ A\n4kr *. )O, , - ,. w 4 g1\nFig. 6 Section ofliver after death ofpatient (case 1) showing subendothelial accumulation offoamny histiocytes in hilar artery\ncausing severe lummnal narrowing. (Haematoxylin and eosin.) x 160.\nVIA I\n*..\n; .:.\n1--.\n1,\nProtected by copyright, including for uses related to text and data mining, AI training, and similar technologies. \n. University, Serials Bobst Library Technical Services Serials\nat New York on November 3, 2025 http://jcp.bmj.com/ Downloaded from 1 December 1985. 10.1136/jcp.38.12.1366 on J Clin Pathol: first published as \n\nBiopsy findings in cases of rejection of liver allograft\n.. .1-W4- w\nv6a.\n:-.- A-P\'V U\n\'I\nXB\n_...\n*\'x ! w ,~~~~~~~. 4\n0 .t * spES . ..o\nI\n\'C\n.\n.:\n. \': \\ .^r #\n-\n--~~~~~~~~~~~~~~~~~~~2 .. fi_sE ................................. W..F .t.w &6\n~~A t3 e\nif IN\na\n- 1.\nI, ,.* k\n40\ns\n\'\nFig. 7 Biopsy specimen 28 days after transplantation (case\n4) showing small cluster ofpolymorphs unrelated to portal\ninflammation or centrilobular cholestasis. (Haematoxylin\nand eosin.) x 450.\nacidophil bodies were also seen in association with\ncentrilobular cholestasis and portal inflammation,\nbut in three biopsy specimens small aggregates were\nscattered randomly within the lobules (Fig. 8). Viral\ninclusions or serological evidence of viral infection\nwere not present in any of these cases.\nDiscussion\nLiver biopsy has a potentially useful part to play in\nthe diagnosis and management of liver allograft rejec\ufffetion as there are no specific clinical, biochemical, or\nother markers of rejection. In view of the liver\'s\nlimited range of responses to injury other causes of\ngraft dysfunction should be excluded before any\nchanges seen are ascribed to rejection. Failure to do\nso may account for the difficulty experienced in inter\ufffepreting biopsies in early series.45 Necropsy studies are\nalso unhelpful as a guide to interpreting biopsy speci\ufffemens during life as the changes of rejection are often\nadvanced and may be indistinguishable from other\ncomplications that contribute to death.9""0\nApplying the criteria of exclusion, two recent stud\ufffeies, one prospective6 and the other retrospective,7\nreported that biopsies were useful in the clinical man\ufffeagement of patients with rejection. In both reports\nseveral biopsies were performed on each patient\nallowing the evolution of lesions and their\nmodification by treatment to be monitored.\nIn this study the most consistent and diagnostically\nuseful feature of acute rejection was the presence of a\nmixed portal inflammatory infiltrate, together with\n""Iv\nt.\n4..S\nJF BYF_^! .. .4 .. xpt q> ... * *4*s\' a ..\n^ .9"" *, waS\n.,. ^ * s. .ts w :*S\n:s\n..\n$ X w £ .ws\n_ .X\nFig. 8 Biopsy specimen 15 days after transplantation (case\n2) showing small periportal collection ofacidophil bodies.\n(Haematoxylin and eosin.) x 450.\nthe highly characteristic lesion of acute bile duct dam\ufffeage by polymorphs. This agrees with the findings of\nSnover et al7 but differs from those of Eggink et al,6\nwho describe a picture similar to chronic active hepa\ufffetitis without evidence of destruction of bile ducts. The\nreason for this disparity is uncertain. One possible\nexplanation is a difference in immunosuppression as\ncyclosporin A is used routinely in Minnesota and\nBirmingham after the immediate postoperative\nperiod while the Dutch group continue treatment\nwith azathioprine. Early reports of rejection before\nthe advent of cyclosporin A also described spillover of\nportal inflammation into lobules, a particularly strik\ufffeing example being seen in one patient in whom immu\ufffenosuppression was deliberately withheld because of\npossible viral infection (Fig I in Williams et al2). A\nsimilar process has been described in untreated canine\nallografts. 1 12\nThe bile duct lesion seen in rejection has been lik\ufffeened to that which occurs in primary biliary cirrhosis\nand graft v host disease (GVHD) and a unifying\nmechanism proposed for duct damage in these three\nconditions based on their anatomical similarity.1314\nThe susceptibility of bile ducts to damage by rejection\nmay be due to expression of HLA class IV5 or class\n1116 antigens, neither of which is normally expressed\non hepatocytes.\'718 Similar mechanisms have been\nproposed for bile duct damage in primary biliary\ncirrhosis19 and chronic GVHD.20\nAlthough similar mechanisms could account for\nthe apparent selectivity of bile duct damage in these\nthree conditions, the histological features of acute\n1371\n.* I\n41 ,\n0 W\'WF\nJ&\n4\' flq I.:..\nV\nI :.\'\nAO%L\nlb\nI Protected by copyright, including for uses related to text and data mining, AI training, and similar technologies. \n. University, Serials Bobst Library Technical Services Serials\nat New York on November 3, 2025 http://jcp.bmj.com/ Downloaded from 1 December 1985. 10.1136/jcp.38.12.1366 on J Clin Pathol: first published as \n\n1372\nrejection in this study are distinctive and differ from\nthose seen in either primary biliary cirrhosis or\nchronic GVHD. The presence of numerous poly\ufffemorphs surrounding and infiltrating the wall of bile\nducts was a consistent feature of acute rejection and\ndid not occur to any important degree in the two\nother cases. A polymorphonuclear infiltrate related to\nbile ducts might suggest a diagnosis of ascending cho\ufffelangitis.6 In all our cases polymorphs were absent\nfrom the biliary lumen, and infection was excluded by\nbile culture.\nDisappearance of bile ducts was first described as a\ncomplication of transplantation by Calne et al and\nhas been ascribed to chronic immune mediated bile\nduct damage,""4 ischaemia related to poor surgical\ntechnique,6 and ischaemia due to chronic vascular\nrejection (DGD Wight, personal communication).\nThe pattern of damage and course of events in our\npatient with disappearing duct syndrome (case 2) is\nmore in favour of immune mediated rather than\nischaemic damage. The resemblance of bile duct dam\ufffeage in the other patient with chronic rejection (case 1,\nFig. 3) to that seen in chronic GVHD also favours an\nimmunological mechanism.\nVenous endothelial changes of acute rejection were\nnot seen to an important degree in this study, in con\ufffetrast to the findings of Snover et al,7 who included\nthese as part of their diagnostic triad of acute rejec\ufffetion (portal inflammation, bile duct damage, and\nendothelialitis of portal or central veins). Endothelial\ndamage was also a regular finding in the study of\nDemetris et al.2"" This disparity may be a consequence\nof differences in immunosuppressive regimens and the\ntiming of biopsies. Endothelial inflammation, a strik\ufffeing feature of uncontrolled acute rejection in\nanimals\'2 and man,2 rapidly resolves following\nimmunosuppression and is not described in chronic\nrejection.\nArterial changes of rejection may be prominent in\nlarge intrahepatic arteries but not seen in needle biop\ufffesies which only sample small vessels. Their presence\nmay be suspected in biopsies if centrilobular necrosis\nor fibrosis is seen and other causes of hypoperfusion\nare excluded.\nCentrilobular cholestasis is a common finding in\nrejection and is possibly a consequence of bile duct\ndamage. It is not an invariable finding, being minimal\nin one patient whose biopsies had typical portal and\nbile duct lesions. Persistence and even worsening of\ncholestasis may occur after the successful treatment\nof acute rejection. This may lead to difficulty in histo\ufffelogical diagnosis and clinical management, particu\ufffelarly if a biopsy performed during the acute episode is\nnot available for comparison. It is our experience that\nif other causes of cholestasis have been excluded it\nis not associated with an adverse prognosis and\nHubscher, Clements, Elias, McMaster\nresolves without additional immunosuppression. We\ndid not see any examples corresponding to the picture\nof pure or functional cholestasis described in other\nstudies.621\nThe presence of polymorph and acidophil clusters\nscattered randomly within lobules is a finding of\nunknown importance. Although suggestive of viral\ninfection, no inclusions or serological evidence of\nviral infection were present in any of the patients. In\nthe absence of more sensitive probes for detecting\ncytomegalovirus and other viruses in sections22 the\npossibility that these lesions represent occult viral\ninfection cannot be excluded, although their clinical\nimportance is uncertain in patients with other histo\ufffelogical features of rejection and clinical improvement\nwith immunosuppression.\nAbnormalities were invariably present in per\ufffeoperative biopsies, in contrast to the findings of Egg\ufffeink et al,6 and are probably a reflection of more pro\ufffelonged cold ischaemic times. None of the abnormal\nfeatures noted in the baseline biopsies had any appar\ufffeent adverse prognostic importance.\nIn conclusion, the present study showed that liver\nbiopsies were useful in the diagnosis and management\nof rejection after transplantation. If other causes of\ngraft dysfunction are excluded the changes seen and\ndescribed here are highly characteristic. A mixed por\ufffetal inflammatory infiltrate and polymorphonuclear\ninfiltration of biliary epithelium are the two most con\ufffesistent and diagnostically useful features of acute\nrejection of liver allografts. Both changes rapidly\nresolve after successful immunosuppressive treatment\nand are associated with clinical and biochemical\nrecovery.\nWe thank Dr AJ Howie for helpful criticism of the\nmanuscript and Mr AA Cooper for photographic\nhelp.\nReferences\n\' Starzl TE, Paterk A, Brettschneider L, et al. Clinical and patholo\ufffegical observations after orthotopic transplantation of the human\nliver. Surg Gynecol Obstet 1969;128:327-39.\n2Williams R, Smith M, Shilkin KB, Hebertson B, Joysey V, Caine\nRY. Liver transplantation in man: the frequency of rejection,\nbiliary tract complications and recurrence of malignancy based\non an analysis of 26 cases. Gastroenterology 1973;64:1026-48.\n3Roddy H, Putnam CW, Fennell RH Jr. Pathology of liver trans\ufffeplantation. Transplantation 1976;22:625-30.\n\'Starzl TE, Porter KA, Putnam CW, et al. Orthotopic liver trans\ufffeplantation in ninety-three patients. Surg Gynecol Obstet\n1976;142:487-505.\n\'Calne RY, McMaster P, Portmann B, Wall WJ, Williams R.\nObservations on preservation, bile drainage and rejection in 64\nhuman orthotopic liver grafts. Ann Surg 1977;186:282-90.\n6 Eggink H, Hofstee N, Gips CH, Krom RAF, Houthoff HJ. Histo\ufffepathology of serial graft biopsies from liver transplant recip\ufffeients. Am J Pathol 1984;114:18-31. Protected by copyright, including for uses related to text and data mining, AI training, and similar technologies. \n. University, Serials Bobst Library Technical Services Serials\nat New York on November 3, 2025 http://jcp.bmj.com/ Downloaded from 1 December 1985. 10.1136/jcp.38.12.1366 on J Clin Pathol: first published as \n\nBiopsy findings in cases of rejection of liver allograft\n\'Snover DC, Sibley RK, Freeze DK, et al. Orthotopic liver trans\ufffeplantation: a pathological study of 63 serial liver biopsies from\n17 patients with special reference to the diagnostic features and\nnatural history of rejection. Hepatology 1984;4:1212-22.\n8Sloane JP, Farthing MJG, Powles RL. Histopathological changes\nin the liver after allogeneic bone marrow transplantation. J Clin\nPathol 1980;33:344-50.\n9Fennell RH, Roddy HJ. Liver transplantation. The pathologist\'s\nperspective. Pathol Annu 1979;2:155-82.\n""Gartner JC, Zitelli BJ, Malatack J, Shaw BW, Iwatsuki S, Starzl\nTE. Orthotopic liver transplantation in children: two year\nexperience with 47 patients. Pediatrics 1984;74:140-5.\nl McBride WA, Wheeler HB, Smith LL, Moore FD, Dammin GJ.\nHomotransplantation of the canine liver as an orthotopic vascu\ufffelarised graft: histological and functional correlation during resi\ufffedence in the new host. Am J Pathol 1962;41:501-19.\nPorter KA. Pathology of liver transplantation. Transplantation\nReviews 1969;2:129-70.\n13Fennell RH. Ductular damage in liver transplant rejection. Pathol\nAnnu 1981;16:289-94.\n14 Fennell RH, Shikes RH, Vierling JM. Relationship of pre\ufffetransplant hepatobiliary disease to bile duct damage occurring\nin the liver allograft. Hepatology 1983;3:84-9.\nNagafuchi Y, Hobbs KEF, Thomas HC, Scheuer PJ. Expression\nof beta-2-microglobulin on hepatocytes after liver trans\ufffeplantation. Lancet 1985;i:551-4.\n16 Takacs L, Szende B, Monostori E, et al. Expression of HLA-DR\n1373\nantigens on bile duct cells of rejected liver transplant. Lancet\n1983;ii: 1 500.\n17Lautenschlager I, Hayry P. Expression of the major histo\ufffecompatibility complex antigens on different liver cellular com\ufffeponents in rat and man. Scand J Imnmunol 1981;14:421-6.\n18Lautenschlager I, Nyman N, Vaananen H, Lehto VP, Virtanen I,\nHayry P. Antigenic and immunogenic components in rat liver.\nScand J Immunol 1983;17:61-8.\n9Ballardini G, Mirakain R, Bianchi FB, Pisi E, Doniach D, Bot\ufffetazzo GF. Aberrant expression of HLA-DR antigens on bile\nduct epithelium in primary biliary cirrhosis: relevance to patho\ufffegenesis. Lancet 1984;ii:1009-13.\n20Snover DC. Acute and chronic graft venus host disease: histo\ufffepathological evidence for two distinct pathogenetic mechanisms.\nHum Pathol 1984;1S:202-5.\n21 Demetris AJ, Lasky S, Van Thiel D, Starzl TE, Dekker A. Pathol\ufffeogy of hepatic transplantation. A review of 62 adult allograft\nrecipients immunosuppressed with cyclosporine/steroid regi\ufffemen. Am J Pathol 1985;118:151-61.\n22Myerson D, Hackman RC, Nelson JA, Ward DC, McDougall JK.\nWidespread presence of histologically occult cytomegalovirus.\nHum Pathol 1984;15:430-9.\nRequests for reprints to: Dr SG Hubscher, Department of\nPathology, The Medical School, University of Birmingham,\nEdgbaston, Birmingham B15 2TJ, England.\nProtected by copyright, including for uses related to text and data mining, AI training, and similar technologies. \n. University, Serials Bobst Library Technical Services Serials\nat New York on November 3, 2025 http://jcp.bmj.com/ Downloaded from 1 December 1985. 10.1136/jcp.38.12.1366 on J Clin Pathol: first published as \n\n']","This article discusses the histopathological features of liver allograft rejection and compares them to previously reported findings. The authors describe the characteristics of acute rejection, such as a mixed portal inflammatory infiltrate and polymorphonuclear infiltration of biliary epithelium, which rapidly resolve with successful immunosuppressive treatment and are associated with clinical and biochemical recovery. They also note the presence of inflammation in perioperative biopsies, which may reflect longer cold ischemia times. The authors emphasize that the changes seen in liver biopsies are highly characteristic and diagnostic of acute rejection, even in the absence of other histological features. Additionally, they mention the occurrence of cholestasis in some cases, but note its lack of association with an adverse prognosis. Overall, the authors conclude that liver biopsies are useful in diagnosing and managing rejection after liver transplantation.",0.9333333333333333,0.8707064150389137,FULL_PAPER
How has the evidence changed regarding acceptable macro/microsteatosis in liver grafts?,"[""Article\nhttps://doi.org/10.1038/s41586-018-0047-9\nA randomized trial of normothermic \npreservation in liver transplantation\nDavid Nasralla1\n*, Constantin C. Coussios2\n*, Hynek Mergental3, M. Zeeshan Akhtar1,4, Andrew J. Butler5,20, Carlo D. L. Ceresa1\n, \nVirginia Chiocchia6,7, Susan J. Dutton8, Juan Carlos García-Valdecasas9, Nigel Heaton10, Charles Imber11, Wayel Jassem10, \nIna Jochmans12,13, John Karani10,14, Simon R. Knight1,15, Peri Kocabayoglu16, Massimo Malagò11, Darius Mirza3, Peter J. Morris1,15, \nArvind Pallan17, Andreas Paul16, Mihai Pavel9, M. Thamara P. R. Perera3, Jacques Pirenne12,13, Reena Ravikumar1\n, Leslie Russell18, \nSara Upponi19, Chris J. E. Watson5,20, Annemarie Weissenbacher1\n, Rutger J. Ploeg1\n, Peter J. Friend1\n* for the Consortium for Organ \nPreservation in Europe\nLiver transplantation is a highly successful treatment, but is severely limited by the shortage in donor organs. However, \nmany potential donor organs cannot be used; this is because sub-optimal livers do not tolerate conventional cold storage \nand there is no reliable way to assess organ viability preoperatively. Normothermic machine perfusion maintains the liver \nin a physiological state, avoids cooling and allows recovery and functional testing. Here we show that, in a randomized trial \nwith 220 liver transplantations, compared to conventional static cold storage, normothermic preservation is associated \nwith a 50% lower level of graft injury, measured by hepatocellular enzyme release, despite a 50% lower rate of organ \ndiscard and a 54% longer mean preservation time. There was no significant difference in bile duct complications, graft \nsurvival or survival of the patient. If translated to clinical practice, these results would have a major impact on liver \ntransplant outcomes and waiting list mortality.\nLiver transplantation is the accepted treatment for end-stage liver \nfailure, with one and five year survivals in excess of 90% and 70%, \nrespectively1\n. With increasing rates of liver disease2\n, the supply of \ntransplantable organs is no longer able to meet demand. Paradoxically, \ndespite substantial waiting list mortality (for example, 21% in the UK), \nonly 63% of UK deceased donor livers are transplanted1\n. Increasing \nnumbers of deceased organ donors in many countries have not been \nmatched by a corresponding rise in the number of transplantable \norgans. This is mainly because these additional donors tend to be \nhigh-risk—either declared dead by cardiovascular criteria (DCD), as \nopposed to brainstem death donors (DBD), or elderly with multiple \nco-morbidities (extended criteria donors). Such organs pose a greater \nrisk to the recipient, with a higher probability that the liver will never \nfunction (primary non-function (PNF)) or that it will lead to later com\ufffeplications, particularly biliary stricturing.\nDespite many advances in liver transplantation, the method of \norgan preservation has changed very little in almost 30 years3\n. The \nliver is flushed and cooled with specialist preservation fluid, then \nstored in an icebox. This process of static cold storage (SCS) has \nseveral limitations. Although SCS slows metabolism by 10- to 12-fold, \nsubstantial anaerobic activity continues even at ice temperature4\n. \nThis leads to ATP depletion and accumulation of succinate and other \nmetabolites. These lead to the generation of reactive oxygen species5\nthat are the basis of ischaemia–reperfusion injury, when the organ \nis re-exposed to oxygenated blood at the time of transplantation. \nThis damage, exacerbated by any prior injury, limits the maximum safe \npreservation time of the donor organ. Once cooled, the cessation of \nnormal cellular activity also makes functional assessment impossible.\nThese shortcomings are particularly problematic in the higher-risk \ndonor organs that form an increasing proportion of current liver \ntransplant practice. The very severe ischaemia–reperfusion-related \nmorbidity that characterizes transplantation of such organs is now a \nmajor limitation in meeting the demand for life-saving transplants. To \ncombat the limitations imposed by cold storage, a change in preser\ufffevation technology is required. In recent years, interest has developed \nin perfusion at physiological temperature (normothermic machine \nperfusion (NMP))6–9\n.\nDuring NMP, the liver is perfused with oxygenated blood, med\ufffeications and nutrients at normal body temperature to maintain a \nphysiological milieu. Evidence from animal models of both DBD \nand DCD liver transplantation10,11 suggests that this improves \nthe post-transplant survival of transplanted livers, and potentially \nenables the assessment of organ viability during preservation. The \nmechanism underlying these improved outcomes is at least partly \nrelated to the metabolic resuscitation of the organ that occurs with \npreservation under physiological conditions. This has been demon\ufffestrated through the replenishment of ATP levels11, which in turn con\ufffetributes to a reduction in the severity of the ischaemia–reperfusion \ninjury that is experienced after transplant5,10.\nThere is increasing interest in the clinical application of NMP, with \nseveral cases described in the recent literature6,7\n. In 2013, a phase-I \nstudy by our group9\n, demonstrated the safety and feasibility of NMP in \n1Nuffield Department of Surgical Sciences, University of Oxford, Oxford, UK. 2Institute of Biomedical Engineering, Department of Engineering Science, University of Oxford, Oxford, UK. 3Queen \nElizabeth Hospital Birmingham, Birmingham, UK. 4Target Discovery Institute, University of Oxford, Oxford, UK. 5University of Cambridge Department of Surgery, Addenbrooke’s Hospital, \nCambridge, UK. 6Centre for Statistics in Medicine, University of Oxford, Oxford, UK. 7Surgical Intervention Trials Unit, Nuffield Department of Surgical Sciences, University of Oxford, Oxford, UK. \n8Oxford Clinical Trials Research Unit, University of Oxford, Oxford, UK. 9Department of Hepatobiliopancreatic and Transplant Surgery, Hospital Clinic, Barcelona, Spain. 10Institute of Liver Studies, \nKing’s College Hospital, London, UK. 11Department of Hepatopancreatobiliary and Liver Transplant Surgery, Royal Free Hospital, London, UK. 12Abdominal Transplant Surgery, Department of \nSurgery, University Hospitals Leuven, Leuven, Belgium. 13Laboratory of Abdominal Transplantation, Department of Microbiology and Immunology, KU Leuven, Leuven, Belgium. 14Department of \nRadiology, King’s College Hospital, London, UK. 15Centre for Evidence in Transplantation, Clinical Effectiveness Unit, Royal College of Surgeons of England, London, UK. 16Department of General, \nVisceral and Transplantation Surgery, University Hospital Essen, Essen, Germany. 17Department of Radiology, Queen Elizabeth Hospital Birmingham, Birmingham, UK. 18OrganOx Limited, Oxford, \nUK. 19Department of Radiology, Addenbrooke’s Hospital, Cambridge, UK. 20National Institute of Health Research (NIHR), Cambridge Biomedical Research Centre, Cambridge, UK. *e-mail: david.\nnasralla@nds.ox.ac.uk; constantin.coussios@eng.ox.ac.uk; peter.friend@nds.ox.ac.uk\n50 | NA T U RE | VO L 557 | 3 MAY 2018\n© 2018 Macmillan Publishers Limited, part of Springer Nature. All rights reserved.\n\nArticle RESEARCH\n20 liver transplant recipients. This was used as the precursor to the pres\ufffeent study which, to our knowledge, is the first randomized controlled \ntrial to test the efficacy of machine perfusion against conventional cold \nstorage in liver transplantation.\nLivers from adult DBD or DCD donors were eligible for enrolment. \nAdult patients awaiting a liver-only transplant, excluding those with \nfulminant liver failure, were eligible. If a suitable liver was allocated \nto a consented recipient, the liver was randomized to either conven\ufffetional SCS or NMP. In the SCS arm, the organ retrieval, storage and \nthe transplant were conducted according to standard practice. In the \nNMP arm, following removal from the donor, the liver was attached to \nthe OrganOx metra NMP device, where it was perfused throughout the \nduration of preservation (Fig.\xa01), until the transplanting surgeon was \nready to implant it, at which point it was removed from the device. The \nremainder of the recipient’s care followed standard practice.\nDaily during the first postoperative week, and at day 10, day 30, \nmonth 6 and month 12, biochemical results were recorded as well as \ngraft and patient survival data. At six months, a magnetic resonance \nimaging scan of the biliary tree (MRCP) was performed to assess evi\ufffedence of biliary injury. Biological samples were collected and stored in \na biobank from each liver and recipient enrolled in the study, for use \nin further mechanistic studies.\nThe primary endpoint was defined as the difference between the two \ntreatment arms in the peak level of serum aspartate transaminase (AST) \nwithin seven days after transplant. This hepatocellular enzyme is a clini\ufffecally accepted biomarker, predictive of graft and patient survival12.\nRecruitment\nBetween 26 June 2014 and 8 March 2016, 334 livers were randomized, \nwith 64 livers subsequently excluded (Fig.\xa02). Following organ retrieval, \na markedly different discard rate between the two trial arms resulted in \n100 SCS and 120 NMP livers available for primary outcome reporting, \nwith 101 SCS and 121 NMP livers available for secondary outcome anal\ufffeysis. This discrepancy in group size reduced the study power to 89.7%.\nOne NMP liver was cold stored due to an accessory left hepatic artery \narising from the aorta preventing effective cannulation. Eight NMP \nlivers received machine perfusion for less than four hours (for logistic \nrather than technical reasons). All of these organs are included in the \nNMP arm as part of the modified intention to treat analysis. For the \nper protocol sensitivity analysis, the eight livers perfused for less than \nfour hours were excluded and the single NMP liver that was preserved \nusing SCS was reassigned to the SCS group.\nDonor, preservation and recipient characteristics\nNMP and SCS donor and recipient groups were well-matched (Tables\xa01, 2). \nThe discard rate was higher in the SCS arm (24.1%; 32 out of 133) \nthan the NMP arm (11.7%; 16 out of 137; Extended Data Table\xa01). \nThis difference was statistically significant (−12.4%, 95% confidence \ninterval −21.4 to −3.3%; P=0.008). One NMP discard was the result \nof a device malfunction in an already marginal organ (hepatic artery \nhypoperfusion due to pinch valve miscalibration; see\xa0Supplementary \nInformation).\nFunctional warm ischaemia time applies only to DCD livers and was \nmeasured as the time from the onset of donor hypoxia (oxygen satu\uffferation<70%) or hypoperfusion (systolic blood pressure<50mmHg) \nuntil the start of cold aortic perfusion in the donor. The median \nfunctional warm ischaemia time was longer for NMP than SCS livers \n(21min versus 16min; P=0.003).\nTotal preservation time was measured from the start of cold aortic \nperfusion in the donor until graft reperfusion in the recipient. The \nmedian total preservation time was longer for NMP than SCS liv\ufffeers (11 h 54 min versus 7 h 45 min; P < 0.001). Within the NMP \narm, there was no significant difference in median perfusion time \nbetween DBD and DCD livers (9 h 55 min DBD versus 8 h 45 min \nDCD; P=0.449).\nPost-reperfusion haemodynamics were documented in 218 cases: \npost-reperfusion syndrome was more common in the SCS (32 out of \n97) than the NMP group (15 out of 121), a statistically significant dif\ufffeference (–20.6%, 95% confidence interval –31.6 to –9.5%; P<0.001). \nThis was despite reduced requirement for vasopressors in NMP livers \nin the post-reperfusion period (Extended Data Table\xa02a–c).\nIVC\nPV\nCBD\nGB\nHA\nFig. 1 | Image of liver during normothermic machine perfusion.\nThe hepatic artery (HA), portal vein (PV), inferior vena cava (IVC) and \ncommon bile duct (CBD) are all cannulated. The gallbladder (GB) is also \npresent although this was often removed during the retrieval process before \nNMP. This image has been used with consent from the family of the donor.\nNumber of livers randomized\nn = 335\nAllocated to NMP\nn = 170\nAllocated to SCS\nn = 164\nIncluded n = 137\nExcluded n = 33\n• DCD did not proceed n = 17\n• Non-consented recipient n = 6\n• Non-eligible donor organ n = 8\n• Other reasons n = 2\nIncluded n = 133\nExcluded n = 31\n• DCD did not proceed n = 20\n• Non-consented recipient n = 6\n• Non-eligible donor organ n = 4\n• Other reasons n = 1\nSuccessfully transplanted n = 121\nDiscarded n = 16\nSuccessfully transplanted n = 101\nDiscarded n = 32\nAnalysed (primary outcome):\nITT n = 120\nPP n = 111\nNot analysed n = 1\n(no AST available after transplant)\nAnalysed (primary outcome):\nITT n = 100\nPP n = 101\nNot analysed n = 1\n(no AST available after transplant)\nExcluded n = 1\n(randomized in error: R&D not \nin place) \nOutcome at 1 year:\nAlive with functioning graft n = 112\nDied with functioning graft n = 3 \nRe-transplanted n = 3\nDeath with graft failure n = 3 \nOutcome at 1 year:\nAlive with functioning graft n = 95\nDied with functioning graft n = 2\nRe-transplanted n = 2\nDeath with graft failure n = 2\nFig. 2 | CONSORT diagram. CONSORT diagram depicting the outcome \nfor all donor livers enrolled in the trial. ITT, intention to treat; PP, per \nprotocol; R&D, research and development.\n3 MAY 2018 | VO L 557 | NA T U RE | 51\n© 2018 Macmillan Publishers Limited, part of Springer Nature. All rights reserved.\n\nRESEARCH Article\nPeak AST (primary outcome)\nPeak AST during the first 7 days after transplant was reduced by 49.4% \nin the NMP group compared to SCS when adjusted by centre and donor \ntype (geometric mean ratio 0.506, 95% confidence interval 0.388–0.659; \nP<0.001). Unadjusted analysis (Student’s t-test) and sensitivity analysis \nundertaken in the per-protocol population confirmed these results.\nSubgroup analysis showed that the effect of NMP was different in \nthe two donor types (test for interaction P=0.012), although it was \nstatistically significant in both subgroups; the reduction in geometric \nmean peak AST was greater in DCD (73.3%, 95% confidence interval \n53.7–84.6%; P<0.001) than in DBD livers (40.2%, 95% confidence \ninterval 19.3–55.7%; P=0.001). Subgroup analyses for the model for \nend-stage liver disease (MELD) score and Eurotransplant-donor risk \nindex (ET-DRI) showed no statistically significant differences (data not \nshown). See Extended Data Table\xa03a, b and Extended Data Fig.\xa01 for \nfurther analysis. See Table\xa03 for full outcome results.\nEarly allograft dysfunction\nData to assess early allograft dysfunction (EAD) rates were available in \n216 recipients: the odds of developing EAD in the NMP arm (12 out of \n119) were 74% lower than the SCS arm (29 out of 97; odds ratio 0.263, \n95% confidence interval 0.126–0.550; P<0.001). A logistic regression \nmodel adjusted for donor type, MELD score and ET-DRI showed that \nthe adjusted odds of EAD in the NMP arm were approximately 72% \nlower than in the cold storage arm (adjusted odds ratio 0.276, 95% \nconfidence interval 0.124–0.611; P=0.002). The difference in EAD \nrates was partly a result of the difference in peak AST (described above), \nbut also a reflection of differences in bilirubin. The median bilirubin \nlevel in the first week postoperatively was lower in NMP recipients \n(2.25mgdl−1\n, 95% confidence interval 1.23–4.28)) than in the SCS \ngroup (2.87mgdl−1\n, 95% confidence interval 1.52–5.00; P=0.029).\nBiliary strictures on MRCP\nAn MRCP was performed on 155 (81 NMP, 74 SCS) of the 222 trans\ufffeplanted trial patients. There was no significant difference in the rate of \nnon-anastomotic strictures for DBD (NMP 7.4% (4 out of 54) versus SCS \n5.4% (3 out of 55); P=0.678) or DCD (NMP 11.1% (3 out of 27) versus \nSCS 26.3% (5 out of 19); P=0.180) livers. Only one patient in each trial \narm developed clinically relevant evidence of ischaemic cholangiopathy \nin the first year after transplant, both of whom were re-transplanted.\nTable 1 | Donor demographic details\nStratification factors for all \nrandomized livers NMP (n=170) SCS (n=164)\nDonor typea\nDBD 107 (62.9%) 104 (63.4%)\nDCD 63 (37.1%) 60 (36.6%)\nDonor demographics for all \nretrieved livers\nNMP (n=137) SCS (n=133)\nGendera\nFemale 54 (39.4%) 57 (42.9%)\nMale 81 (59.1%) 76 (57.1%)\nMissing 2 (1.5%) 0 (0.0%)\nAgeb 56 (45–67) (16–84) 56 (47–66) (20–86)\nEthnicitya\nAfrican–Caribbean 3 (2.2%) 1 (0.8%)\nCaucasian 131 (95.6%) 128 (96.2%)\nOther 1 (0.7%) 4 (3.0%)\nMissing 2 (1.5%) 0 (0.0%)\nCause of death\nCVA 74 (54.0%) 74 (55.6%)\nHypoxia 30 (21.9%) 32 (24.1%)\nTrauma 17 (12.4%) 16 (12.0%)\nOther 14 (10.2%) 11 (8.3%)\nMissing 2 (1.5%) 0 (0.0%)\nBody mass indexb 26.26 (23.66–30.52) \n(16.42–46.65)\n27.01 (23.74–30.56) \n(17.24–49.96)\nMissing 2 (1.5%) 0 (0.0%)\nET-Donor risk indexb 1.72 (1.47–2.09) \n(0.98–4.31)\n1.72 (1.50–2.10) \n(1.06–3.49)\nMissing 16 (11.7%) 19 (14.3%)\nCVA, cerebrovascular accident.\naFrequency and column percentages are reported.\nbMedian, interquartile range (IQR, first brackets) and full range (second brackets) are reported.\nTable 2 | Preservation and recipient demographic details\nPreservation details for all \ntransplanted livers NMP (n=121) SCS (n=101) P valuea\nFunctional warm ischaemia timeb\n(min) (applies to DCD livers; \nn=55 (34 NMP, 21 SCS))\n21 (17–25) \n(9–93)\n16 (10–20) \n(2–32)\n0.003\nCold ischaemia time prior to \nNMP (min)c\n (n=120)\n126 \n(106.5–143.0) \n(49–218)\nNA\nMachine perfusion time (min)c\n(n=120)\n547.5 \n(372.5–710.5) \n(85–1,388)\nNA\nTotal preservation time from \ncross-clamp in donor to organ \nreperfusion in recipient (min)\n714 (542–876) \n(258–1,527)\n465 \n(375–575) \n(223–967)\n0.0000\nSteatosis assessed \npre-preservationd,e\n0.366\nNone or mild 91 (75.3%) 89 (88.2%)\nModerate or severe 29 (24%) 12 (11.9%)\nMissing 1 (0.8%)\nRecipient demographics NMP (n=121) SCS (n=101) P valuea\nGenderd 0.717\nFemale 35 (28.9%) 27 (26.7%)\nMale 86 (71.1%) 74 (73.3%)\nDonor typed 0.209\nDBD 87 (71.9%) 80 (79.2%)\nDCD 34 (28.1%) 21 (20.8%)\nAgec 55 (48–62) \n(20–72)\n55 (48–62) \n(22–70)\n0.713\nCause of liver failured 0.782\nAlcoholic 36 (29.8%) 29 (28.7%)\nAuto-immune hepatitis 2 (1.7%) 5 (5.0%)\nHepatitis B 3 (2.5%) 2 (2.0%)\nHepatitis C 4 (3.3%) 4 (4.0%)\nHepatocellular carcinoma on \nbackground of cirrhosis\n15 (12.4%) 16 (15.8%)\nNon-alcoholic steato-hepatitis 11 (9.1%) 11 (10.9%)\nPrimary biliary cirrhosis 10 (8.3%) 3 (3.0%)\nPrimary sclerosis cholangitis 18 (14.9%) 13 (12.9%)\nOther 22 (18.1%) 18 (17.8%)\nBody mass indexc 26.18 \n(23.12–32.39) \n(18.02–50.99)\n26.94 \n(24.36–30.42) \n(18.91–42.95)\n0.626\nMissing 0 (0.0%) 1 (1.0%)\nRetransplantd 12 (9.9%) 8 (7.9%) 0.605\nMELD scorec\n (calculated at time \nof transplant)\n13 (10–18) \n(6–35)\n14 (9–18) \n(6–29)\n0.970\nUK 13 (10–17) \n(6–33)\n14 (9–18) \n(6–28)\nEssen, Germany 17 (14–19) \n(13–23)\n15.5 (14–17) \n(14–17)\nBarcelona, Spain 16 (8–26) \n(8–35)\n14 (9–16) \n(8–29)\nLeuven, Belgium 19 (13.5–25.0) \n(13–26)\n16 (16–20) \n(9–27)\neGFRc 87.36 \n(69.61–107.66) \n(33.45–156.43)\n92.22 (69.72–\n104.24) \n(30.19–\n155.04)\n0.928\nMissing 4 (3.3%) 3 (3.0%)\nET-Donor risk indexc 1.70 \n(1.47–2.07) \n(0.98–4.31)\n1.71 \n(1.50–2.01) \n(1.06–3.49)\n0.610\nMissing 13 (10.7%) 13 (12.9%)\nNA, not applicable. eGFR, estimated glomerular filtration rate.\naχ2 tests and non-parametric Mann–Whitney U-tests were used for categorical and continuous \nvariables, respectively. No adjustment for multiple comparisons were made.\nbFunctional warm ischaemia applies to DCD donors and is measured from the onset of functional \nwarm ischaemia (systolic blood pressure<50mmHg or O2 saturation<70%) to cross-clamp. c\nMedian, IQR and full range are reported.\ndFrequency and column percentages are reported.\neMeasurement of the degree of steatosis was based on clinical assessment by the retrieval \nsurgeon.\n52 | NA T U RE | VO L 557 | 3 MAY 2018\n© 2018 Macmillan Publishers Limited, part of Springer Nature. All rights reserved.\n\nArticle RESEARCH\nSimilarly, there was no significant difference in the rate of anasto\ufffemotic strictures for DBD (NMP 40.7% (22 out of 54) versus SCS 41.8% \n(23 out of 55); P=0.909) or DCD (NMP 48.1% (13 out of 27) versus \nSCS 57.9% (11 out of 19); P=0.515) livers.\nHospital stay, graft and patient survival\nThere was no difference in median intensive care unit (ICU) stay \n(4 days NMP versus 4 days SCS; P=0.339), hospital stay (15 days NMP \nversus 15 days SCS; P=0.926) or the need for renal replacement therapy \nin the first postoperative week (2.7%, 95% confidence interval –7.9 to \n13.2%; P=0.621).\nOne NMP liver developed PNF (see\xa0Supplementary Information). \nThere were no PNF cases in the SCS arm. Overall 10 recipients died \nduring follow-up, producing a one-year survival of 0.949 (95% confi\ufffedence interval 0.890–0.977) in the NMP group and 0.958 (95% confi\ufffedence interval 0.902–0.982) in the SCS group (P=0.901). Two deaths \nin the SCS group and three deaths in the NMP group were due to graft \nfailure.\nGraft survival at one year was 0.950 (95% confidence interval 0.893–\n0.977) and 0.960 (95% confidence interval 0.897–0.985) in the NMP \nand SCS groups, respectively (P=0.695). The causes of graft failure \nin the SCS arm were hepatic artery thrombosis (n=3) and ischaemic \ncholangiopathy (n=1). The causes of graft failure in the NMP arm were \nhepatic artery thrombosis (n=2), ischaemic cholangiopathy (n=1), \nnon-thrombotic infarction (n=1), inferior vena cava occlusion (n=1) \nand PNF (n=1). (Extended Data Fig.\xa02a, b).\nTable 3 | Trial outcomes\nNMP (n=121)a SCS (n=101)a Effect (95% CI)b P value\nPeak AST\nITTc\nAdjusted 488.1 (408.9–582.8) 964.9 (794.5–1,172.0) 0.5 (0.4–0.7) 0.0000\nUnadjusted 484.5 (406.4–577.6) 973.7 (795.2–1,192.3) 0.5 (0.4–0.6) 0.0000\nTest for interaction by donor type 0.012\nSubgroup analysis by donor type\nDBD 526.2 (427.3–647.9) 880.2 (708.5–1,093.5) 40.2% (19.3–55.7%) 0.0009\nDCD 389.7 (278.0–546.4) 1,458.1 (944.7–2,250.5) 73.3% (53.7–84.6%) 0.0000\nPP analysis 498.6 (414.8–599.4) 982.9 (810.4–1,192.2) 0.5 (0.4–0.7) 0.0000\nSecondary outcomes\nDiscard ratesd 16 (11.7%) 32 (24.1%) −12.4% (−21.4 to \n−3.3%)\n0.008\nPrimary non-functione 1 (0.8%) 0 (0.0%) NA NA\nPost-reperfusion syndrome 15 (12.4%) 32 (33.0%) −20.6% (−31.6 to \n−9.6%)\n0.0002\nPost-reperfusion lactatef 3.6 (2.6–4.2) 4.1 (3.2–5.0) 0.018\nEarly allograft dysfunction 12 (10.1%) 29 (29.9%) 0.263 (0.126–0.550) 0.0002\nBiochemical liver testsf (average value over day 1–7)\nBilirubin (µmol l−1)\nDays 1–7 38.5 (21.0–73.2) 49.1 (26.0–85.5) 0.029\n30 days 13.0 (8.0–22.1) 13.0 (9.1–21.0) 0.479\n6 months 9.1 (6.0–15.1) 9.1 (6.0–13.0) 0.671\nAST (IU l−1)\nDays 1–7 167.5 (98.0–320.7) 318.5 (152–611.5) 0.0000\n30 days 20 (14–35) 22 (15–40) 0.707\n6 months 23 (18–33) 23 (18–37) 0.931\nγGT (IU l−1)\nDays 1–7 268.1 (156.3–408.3) 301 (201.1–443.9) 0.157\n30 days 178 (109.5–410.0) 200 (96.0–397.5) 0.949\n6 months 47 (28–144) 47 (26–128) 0.452\nINR\nDays 1–7 1.2 (1.2–1.4) 1.2 (1.2–1.4) 0.644\n30 days 1.1 (1.0–1.2) 1.1 (1.0–1.2) 0.735\n6 months 1.1 (1.0–1.2) 1.1 (1.0–1.1) 0.167\nCreatinine (µmol l−1)\nDays 1–7 92.8 (60.1–121.1) 97.2 (67.2–143.2) 0.139\n30 days 82.2 (66.3–104.3) 90.2 (72.5–121.1) 0.019\n6 months 99.9 (81.3–117.6) 99.9 (83.1–134.4) 0.265\nLactate (mmol l−1)\nDay 1–7 1.3 (1.0–1.7) 1.1 (0.9–1.6) 0.130\nOther outcomes\nNeed for RRT (number (percentage) of patients)\nDay 1–7 after transplant 26 (21.5%) 19 (18.8%) 2.7% (−7.9 to 13.2%) 0.621\n30 days 27 (22.3%) 20 (19.8%) 2.5 (−8.2 to 13.3%) 0.648\n6 months 27 (22.3%) 21 (20.8%) 1.5% (−9.3 to 12.4%) 0.784\nDuration of RRT day 1–7f 4 (2–6) 5 (4–6) 0.346\nLength of hospital stayf 15 (10–24) 15 (11–24) 0.926\nLength of ICU stayf 4 (2–7) 4 (3–7) 0.339\nGraft survival at 1 year 0.950 (0.893-0.977) 0.960 (0.897–0.985) 0.707\nPatient survival at 1 year 0.958 (0.902–0.982) 0.970 (0.909–0.990) 0.671\nCI, confidence interval.\naTotal number of livers transplanted and analysed overall. Primary outcome analysed on n=220 due to unavailability of AST values during the first seven days after transplant. Specific outcomes may \nhave different denominators due to some missing data.\nbEffect reported is: Percentage reduction (from geometric mean ratio) for peak AST; odds ratio for early allograft dysfunction; difference in proportions (%) for discard rates, post reperfusion syndrome \nand need for renal replacement therapy (RRT); not reported for outcomes for which medians are reported, for survival scores and for tests for interactions of subgroup analysis (only P values are \nreported).\nc\nIntention to treat (ITT) analysis was adjusted for donor type and transplant centre.\ndDenominators for the discard rates is the total number of livers retrieved (n=270 (NMP, n=137; SCS n=133)). eTest not performed due to few events and no events in one arm.\nf\nMedian and IQR are reported, a non-parametric Mann–Whitney U-test was used.\n3 MAY 2018 | VO L 557 | NA T U RE | 53\n© 2018 Macmillan Publishers Limited, part of Springer Nature. All rights reserved.\n\nRESEARCH Article\nFor more detailed analysis of trial outcomes please see\xa0Supplementary \nInformation.\nPerfusion characteristics indicative of organ quality\nThe following continuously monitored parameters (mean±s.d.) by the \nthird hour of NMP were measured for all livers that went on to be suc\ufffecessfully transplanted (Extended Data Figs.\xa03, 4). The measured haemo\ufffedynamic parameters were: hepatic artery flow (280±120mlmin−1\n) \nand portal vein flow (1.11 ± 0.2 l min−1\n). The measured meta\ufffebolic parameters were: pH (7.31±0.17) and lactate clearance\xa0from \n9.99±3.13mmol l\n−1\n at 15min NMP to 0.93±0.63mmol l\n−1\n by 4h \nNMP. The measured synthetic parameter consisted of bile production \n(9.17±11.16mlh−1\n). Notably, 18 transplanted NMP livers produced \nno/minimal bile during perfusion. All but one of these functioned \nafter transplant. There was no correlation\xa0between bile production and \npost-transplant liver function or later development of non-anastomotic \nbiliary strictures.\nOne NMP liver developed PNF. This liver was persistently acidotic \nwith lactate>4mmol for the duration of NMP. No other liver with \nthese characteristics was transplanted.\nFollowing transplant, 28 livers displayed minimal preservation \ninjury (MPI; peak AST<250 IU l−1\n) and 25 showed evidence of \nsevere preservation injury (SPI; peak AST>1,000 IU l−1\n). The donors \nin these groups were well-matched in all characteristics other than \nsex\xa0(Extended Data Table 4). During NMP, there was a difference in \nbaseline perfusate alanine aminotransferase (ALT) (MPI 171 IU l−1\nversus SPI 669 IU l−1\n; P=0.005) and lactate dehydrogenase (LDH) \n(MPI 1,073 IU l−1\n versus SPI 1,838 IU l−1\n; P=0.01) between the two \ngroups. Levels of these enzymes, as well as γ-glutamyltransferase (γGT), \nincreased more rapidly during the first 8h of NMP in the SPI group \n(ALT, an increase of 56 IU l−1\n versus an increase of 461 IU l−1\n, P<0.001; \nLDH, an increase of 483 IU l−1\n versus an increase of 980 IU l−1\n, \nP=0.06; γGT, an increase of 23 IU l−1\n versus increase of 104 IU l−1\n, \nP=0.004). MPI livers showed a reduction in measurable levels of \nhaemolysis (haemolysis index) as NMP progressed, in contrast to SPI \nlivers in which the levels of haemolysis rose (MPI, a decrease of 0.04 U \nversus SPI, an increase of 0.09 U; P=0.03). Bile production was greater \nin the MPI group (MPI 13.1mlh−1\n versus SPI 7.8mlh−1\n; P=0.03). \nLactate clearance was similar in each group. Post-reperfusion syndrome \nwas less common in the MPI group (MPI 0% (0 out of 28) versus SPI \n24% (6 out of 25); P=0.007). One NMP liver with perfusate transami\ufffenases in excess of 20,000 IU l−1\n was transplanted successfully.\nAdverse events\nThe proportion of patients for whom adverse events were reported \n(Extended Data Tables\xa05a–c, 6) was similar in the two arms (55.4% \nNMP, 95% confidence interval 46.1–64.4% versus 57.4% SCS, 95% \nconfidence interval, 47.2–67.2%) with a larger total number of events \nreported for SCS livers (128 NMP versus 164 SCS). Of these, a greater \nproportion of the serious adverse events (Clavien–Dindo grade ≥IIIb) \nwere in the SCS than NMP arm (16.4% NMP (21 out of 128) versus \n22% SCS (36 out of 164)). No statistical tests were applied to these data.\nDiscussion\nTo our knowledge, this is the first randomized controlled trial to com\ufffepare any type of machine perfusion technology with conventional static \ncold storage in human liver transplantation.\nThe trial demonstrated significant reductions in peak AST and EAD \nrates in NMP livers; this is of clinical relevance as both are clinically \naccepted biomarkers for long-term graft and patient survival12,13. \nThese benefits are consistent with previous animal work10 and the \nphase-I clinical study9\n that preceded this trial, both of which showed \npost-transplant AST reductions in NMP livers. No differences were \nseen in graft or patient survival: a much larger trial is required to test \nthis outcome. It is notable that these reductions in peak AST and EAD \nrates were achieved in the context of improved organ utilization and \nlonger preservation times, both of which have implications in terms \nof addressing the donor shortage and logistical barriers that currently \nlimit liver transplants.\nDCD donors represent a largely untapped source of organs, com\ufffeprising 42% of UK deceased donors, but only 21% of transplanted \nlivers14. Utilization of DCD livers is limited by poorer outcomes (PNF \nand ischaemic cholangiopathy) compared with DBD livers. Allowing \nthe limitations of small group analyses, in this study NMP DCD liver \nprimary outcome data were superior to those of both DCD and DBD \nlivers preserved using SCS. In fact, the primary outcome of DCD NMP \nlivers was superior to that of DBD livers preserved by NMP: this was \npossibly owing to a selection bias, both of donors (lower threshold \nto decline DCD donors) and recipients (fitter patients selected for \nhigher-risk organs). The AST differences are in the context of longer \nfunctional warm ischaemia times, longer preservation times and fewer \norgan discards in the NMP arm, suggesting that NMP may be achieving \nthe desired objective of increasing organ utilization without compro\ufffemising outcome. If these findings were translated into clinical practice, \nthe increase in organ utilization would have substantial implications \nfor waiting list mortality, which is currently approximately one in five \npatients1\n.\nThe longer preservation times in the NMP group were not planned, \nbut were all within the maximum perfusion time defined in the pro\ufffetocol. There was no stipulation in the trial protocol that the preser\ufffevation times should be matched. As clinicians gained experience, it \nappeared that some centres had started to organize their operating \nschedule according to the preservation method, although no overall \ndifference between arms was seen in the proportion of transplants \noccurring in daylight hours. If, as appears to be the case, NMP can \nsafely extend preservation times without compromising outcomes, this \nwill have implications for operating department planning as well as \norgan utilization.\nThere were over 50% fewer discarded organs in the NMP group, \nresulting in 20% more transplanted livers (121 NMP versus 101 SCS). \nThe SCS discard rate of 23.7% was higher than the 17% reported in \nUK registry data14, and may reflect the high proportion of DCD livers \nenrolled in the trial; the discard rate of retrieved DCD livers in the UK \nis 30%14. This reported difference in organ utilization is likely to be an \nunderestimation of the full potential impact that NMP could have on \ntransplant numbers. The trial stipulated that only livers considered \ntransplantable according to standard practice could be enrolled. For \nthe full extent of improved organ utilization to be measured, livers \nwould need to be randomized to NMP or SCS before being offered for \ntransplant; this should form the basis of a future study. An increase of \n20% or more in the number of transplantable donor livers would have \na transformative effect on the mortality on liver transplant waiting lists \naround the world.\nThe haemodynamic characteristics of the NMP recipients following \nreperfusion were measurably superior to those of SCS recipients, in line \nwith previously reported findings15. This did not translate into a differ\ufffeence in ICU stay, hospital stay or need for renal replacement therapy \nbetween the two groups, despite previous reports showing a correlation \nbetween peak AST and renal replacement therapy16. The magnitude of \nthe reperfusion syndrome is a factor in determining the eligibility of the \nsickest patients for high-risk organs, due to the limited capacity of such \npatients to tolerate cardiovascular instability; NMP might therefore \nincrease the options for the most urgent patients.\nPerhaps the greatest limitation to more widespread utilization of \nDCD livers is the high rate of clinically important non-anastomotic \nbiliary strictures (NAS) which lead to a high rate of graft failure; this \nis believed to develop due to the vulnerability of the biliary tree to \nprolonged warm ischaemia. The rate of NAS in the NMP DCD group \n(11.1%) was lower than in SCS (26.3%) livers, despite longer functional \nwarm ischaemia times. This did not reach statistical significance, which \nmay be a function of sample size; the trial was not powered for this \noutcome. Reported rates of NAS in DCD transplants vary from 10 \nto 30%17,18, but these are in patients with symptoms suggesting bil\ufffeiary pathology, rather than those only apparent on imaging; biliary \n54 | NA T U RE | VO L 557 | 3 MAY 2018\n© 2018 Macmillan Publishers Limited, part of Springer Nature. All rights reserved.\n\nArticle RESEARCH\ninvestigations are usually only performed for clinical indications \n(typically deranged liver function). Prior to this study, the radiolog\ufffeical incidence of both anastomotic and non-anastomotic strictures in \nasymptomatic patients was unknown; in particular, there is no real \nbenchmark against which to compare the rate of NAS seen in the DCD \nSCS group. Apart from the two patients retransplanted for ischaemic \ncholangiopathy, almost all of the remaining patients with radiological \nevidence of NAS had normal liver function at one year; this questions \nthe clinical relevance of a protocol MRCP at six months. The longer\ufffeterm follow-up of these patients will shed light on the importance of \na radiological diagnosis of biliary stricturing in patients with normal \ngraft function, and the role of MRCP as an endpoint in future trials.\nAs well as demonstrating improved graft preservation, this trial \ntested the feasibility, usability and safety of NMP, a vital component of \nthe evaluation of any new technology. It showed that the logistical chal\ufffelenges of NMP can be met successfully within clinical practice. Over \n120 NMP livers were transplanted in seven transplant centres across \nfour European countries. Nonetheless, adoption of this technology \ninto clinical practice may necessitate changes in the organ retrieval \nprocess, particularly with respect to technical support and transport \narrangements. It remains to be seen whether NMP is required for the \nfull duration of an organ’s preservation or can equally well be applied \nafter a short period of SCS when the organ reaches the transplanting \ncentre—this would simplify the logistics but may not be suitable for \nthe most marginal organs19. A phase-II study to test this has recently \ncompleted enrolment in the UK (NCT03176433).\nFor this new technology to be supported by healthcare funders, a \nhealth–economic case is needed. The results of this study suggest that \nbenefits will accrue not only from improved early graft function and \ntransplantation logistics, but also from improved utilization. Secondary \neconomic benefits will accrue from logistic changes, enabling trans\ufffeplants to be moved predominantly into daytime operating, with reduc\ufffetion in staffing costs and likely improvements in outcome. More timely \nintervention will also bring economic benefits—earlier transplantation \nis associated with lower morbidity and cost.\nThe effects of NMP demonstrated in this study are unequivocal with \nrespect to the primary endpoint, implying a benefit in livers currently \nused for transplantation. However, the greatest benefit may be realized \nby applying this technology to livers outside current acceptance crite\uffferia, in order to transplant organs currently deemed untransplantable. \nAlgorithms to assess organ viability, based on data obtained during \nNMP, will be essential if this potential is to be realized10. This study \nsheds some light on which perfusion parameters may be used to assess \norgan quality: bile production, acid–base stability, lactate clearance, \nperfusate transaminase levels, falling measurable haemolysis—all \ncorrelate with the degree of preservation injury evident after trans\ufffeplant. However, all but one of the livers transplanted in the NMP group \nfunctioned postoperatively, including one NMP liver with perfusate \ntransaminases in excess of 20,000 IU l−1\n and 18 livers with minimal \nbile production. Data from much larger numbers of NMP transplants \n(typically from a registry) would be required to determine specific \nmarkers of viability.\nThe importance of bile production during NMP is unclear. \nPreliminary evidence from our group20 suggests that preservation \ninjury causes impaired hepatocellular uptake of bile salts. We have \nshown evidence of progressive accumulation of bile salts in the perfu\ufffesate of livers with high post-transplant transaminase levels; something \nthat also correlates with poor bile production during NMP. The extent \nand nature of the injury required to produce this effect is not clear but \ndoes appear to reflect organ quality rather than viability.\nHigh-risk organs (for example, those with steatosis) may benefit from \ntherapeutic interventions delivered during NMP: several groups are \nexploring potential strategies, including stem cell treatments, de-fatting \nagents and immunological modification of the organ. Future trials \nmay be needed to formally test the size of the effect of NMP on organ \nutilization; for this it will be necessary to randomize livers at the time \nof organ offering rather than the time of retrieval. Organ utilization, or \norgan utilization with 12-month graft survival (functional utilization) \nwould be a logical primary endpoint for a study of this sort.\nThis study describes the formal clinical evaluation of a novel tech\ufffenology in liver transplantation, and could herald the start of a new era \nof intervention during organ preservation. It represents a first, neces\ufffesary step in demonstrating that NMP is feasible, safe and effective in \nclinical practice; the fact that the study has definitively met its primary \nendpoint should now enable the exploration of the technology’s wider \npotential.\nOnline content\nAny Methods, including any statements of data availability and Nature Research \nreporting summaries, along with any additional references and Source Data files, \nare available in the online version of the paper at https://doi.org/10.1038/s41586-\n018-0047-9.\nReceived: 28 September 2017; Accepted: 8 March 2018; \nPublished online 18 April 2018.\n1. Annual Report on Liver Transplantation 2016/2017 (NHS Blood and Transplant, \n2017).\n2. APPHG. Liver disease: today’s complacency, tomorrow’s catastrophe. The \nAll-Party Parliamentary Hepatology Group (APPHG) inquiry into improving \noutcomes in liver disease. (March, 2014).\n3. Todo, S. et al. Extended preservation of human liver grafts with UW solution. J. \nAm. Med. Assoc 261, 711–714 (1989).\n4. Clavien, P. A., Harvey, P. R. & Strasberg, S. M. Preservation and reperfusion \ninjuries in liver allografts. An overview and synthesis of current studies. \nTransplantation 53, 957–978 (1992).\n5. Chouchani, E. T. et al. Ischaemic accumulation of succinate controls reperfusion \ninjury through mitochondrial ROS. Nature 515, 431–435 (2014).\n6. Watson, C. J. et al. Preimplant normothermic liver perfusion of a suboptimal \nliver donated after circulatory death. Am. J. Transplant. 16, 353–357 (2016).\n7. Mergental, H. et al. Transplantation of declined liver allografts following \nnormothermic ex-situ evaluation. Am. J. Transplant. 16, 3235–3245 (2016).\n8. Perera, T. et al. First human liver transplantation using a marginal allograft \nresuscitated by normothermic machine perfusion. Liver Transpl. 22, 120–124 \n(2016).\n9. Ravikumar, R. et al. Liver transplantation after ex vivo normothermic machine \npreservation: a phase 1 (first-in-man) clinical trial. Am. J. Transplant. 16, \n1779–1787 (2016).\n10. Brockmann, J. et al. Normothermic perfusion: a new paradigm for organ \npreservation. Ann. Surg. 250, 1–6 (2009).\n11. Xu, H. et al. Excorporeal normothermic machine perfusion resuscitates pig DCD \nlivers with extended warm ischemia. J. Surg. Res 173, e83–e88 (2012).\n12. Eisenbach, C. et al. An early increase in gamma glutamyltranspeptidase and \nlow aspartate aminotransferase peak values are associated with superior \noutcomes after orthotopic liver transplantation. Transplant. Proc 41, 1727–1730 \n(2009).\n13. Olthoff, K. M. et al. Validation of a current definition of early allograft dysfunction \nin liver transplant recipients and analysis of risk factors. Liver Transpl 16, \n943–949 (2010).\n14. Organ Donation and Transplantation Activity Report 2016/17\xa0(NHS Blood and \nTransplant, 2017).\n15. Angelico, R. et al. Normothermic machine perfusion of deceased donor liver \ngrafts is associated with improved postreperfusion hemodynamics. Transplant. \nDirect 2, e97 (2016).\n16. Leithead, J. A. et al. Hepatic ischemia reperfusion injury is associated with acute \nkidney injury following donation after brain death liver transplantation. Transpl. \nInt 26, 1116–1125 (2013).\n17. Jay, C. L. et al. Ischemic cholangiopathy after controlled donation after cardiac \ndeath liver transplantation: a meta-analysis. Ann. Surg. 253, 259–264 (2011).\n18. Mourad, M. M., Algarni, A., Liossis, C. & Bramhall, S. R. Aetiology and risk factors \nof ischaemic cholangiopathy after liver transplantation. World J. Gastroenterol.\n20, 6159–6169 (2014).\n19. Reddy, S. et al. Non-heart-beating donor porcine livers: the adverse effect of \ncooling. Liver Transpl. 11, 35–38 (2005).\n20. Abstracts of the 18th Congress of the European Society for Organ \nTransplantation, 24–27 September 2017, Barcelona, Spain. Transpl. Int. 30 \n(Suppl 2), 5–576 (2017).\nAcknowledgements This study was performed by the Consortium for Organ \nPreservation in Europe (COPE).\xa0We thank the European Commission for \ntheir support through the Seventh Framework Programme. The following \norganisations, groups and individuals also made substantial contributions \nwithout which this trial could not have been completed successfully: NHS Blood \nand Transplant; the Surgical Intervention Trials Unit, University of Oxford; the \nClinical Trials and Research Governance unit, University of Oxford; Centre for \nEvidence in Transplantation, Royal College of Surgeons of England; the Liver \nTransplant Coordinators, anaesthetists and liver unit physicians at the Queen \nElizabeth Hospital, Birmingham, Addenbrooke’s Hospital, Cambridge, King’s \nCollege Hospital, London, the Royal Free Hospital London, Hospital Clinic, \n3 MAY 2018 | VO L 557 | NA T U RE | 55\n© 2018 Macmillan Publishers Limited, part of Springer Nature. All rights reserved.\n\nRESEARCH Article\nBarcelona, University Hospitals, Leuven, University Hospital, Essen; M. Soo, \nS. Morrish, C. Morris, L. Randle, R. Macedo Arantes, R. Morovat, A. Elsharkawy, \nG. Hirschfield, P. Muiesan,\xa0J. Isaac, J. Grayer, B. Buchholz, H. Vilca-Melendez, \nA. Zamalloa, D. Chasiotis, S. Khorsandi, B. Davidson, D. Sharma, A. Esson, \nD. Monbaliu, S. Mertens, S. Swoboda, J. Neuhaus, T. Benkö, V. Molina, R. Kumar, \nA. Bradley, M. Laspeyres, B. Patel,\xa0A. Mukwamba, S. Banks,\xa0the COPE Transplant \nTechnicians, the Specialist Nurses in Organ Donation and, of course, all of the \ndonors and their families. This study was funded by a European Commission \nSeventh Framework Programme (FP7) Grant (No 305934).\nReviewer information Nature thanks S. Schneeberger, S. G. Tullius and the other \nanonymous reviewer(s) for their contribution to the peer review of this work.\nAuthor contributions D.N., S.R.K.,\xa0R.J.P., C.C.C. and P.J.F. designed this study \nwith help from other authors.\xa0R.J.P is Coordinator of the COPE Consortium. \nM.Z.A. and R.J.P. oversaw the collection of samples and establishment of the \ntrial biobank. D.N., C.D.L.C., A.W., H.M., M.T.P.R.P., D.M., W.J., N.H., C.I., M.M., \nR.R., A.J.B., C.J.E.W., I.J., J.P., P.K., A.Pau., M.P. and J.C.G.-V. were responsible for \nthe clinical conduct of the study at the respective trial sites. D.N., S.R.K., V.C. \nand S.J.D. were responsible for statistical design and analysis. L.R. and C.C.C. \nprovided device support and expertise to all trial sites. D.N., S.U., A.Pal. and \nJ.K. were responsible for MRCP image analysis. P.M., S.R.K. and S.J.D. provided \ngovernance oversight to ensure the study adhered to all regulatory and ethical \nrequirements. All authors reviewed the manuscript.\nCompeting interests P.J.F. is a co-founder, chief medical officer and consultant \nto OrganOx Limited and also holds shares in the company. C.C.C. is a co\ufffefounder, chief technical officer and consultant to OrganOx Limited and also \nholds shares in the company. Neither P.J.F. nor C.C.C. were involved in the \nselection, recruitment or transplantation of patients in this study.\nAdditional information\nExtended data is available for this paper at https://doi.org/10.1038/s41586-\n018-0047-9.\nSupplementary information is available for this paper at https://doi.\norg/10.1038/s41586-018-0047-9.\nReprints and permissions information is available at http://www.nature.com/\nreprints.\nCorrespondence and requests for materials should be addressed to D.N. or \nC.C.C. or P.J.F.\nPublisher’s note: Springer Nature remains neutral with regard to jurisdictional \nclaims in published maps and institutional affiliations.\n56 | NA T U RE | VO L 557 | 3 MAY 2018\n© 2018 Macmillan Publishers Limited, part of Springer Nature. All rights reserved.\n\nArticle RESEARCH\nMethods\nStudy design. This investigator-led, multinational, open-label, two-arm, paral\ufffelel randomized controlled trial included seven liver transplant centres from\xa0the \nUK (Addenbrooke’s Hospital, Cambridge; King’s College Hospital, London; \nQueen Elizabeth Hospital, Birmingham; Royal Free Hospital, London), Belgium \n(Universitaire Ziekenhuizen, Leuven), Spain (Hospital Clínic de Barcelona, \nBarcelona) and Germany (Universitatsklinikum, Essen), and was part of the \nEU-funded Consortium for Organ Preservation in Europe (COPE, http://www.\ncope-eu.org/). Approval was obtained from national research ethics commit\ufffetees and medical device regulatory bodies in each trial region, in particular the \nLondon–Dulwich National Research Ethics Committee (NREC) and the Medicines \nand Healthcare Regulatory Agency (MHRA) in the UK; the Federaal Agentschap \nvoor Geneesmiddelen en Gezondheidsproducten (FAGG) and the Commissie \nMedische Ethiek of Universitaire Ziekenhuizen, Leuven, Belgium; the Comité \nÉtico de Investigación Clínica of the Hospital Clínic de Barcelona; the Deutsche \nÄrztekammer and the ethics committee of University Hospital Essen, Germany. \nThe trial protocol was registered before recruitment (ISRCTN 39731134). All rel\ufffeevant ethical regulations relating to the conduct of this study were followed at \neach trial site. The trial is reported in accordance with the CONSORT statement21.\nNo major amendments were made to the trial design after the start of recruit\ufffement.\nEligibility and consent. Inclusion criteria for donors and recipients were deliber\ufffeately broad to represent the full spectrum of clinical practice. Whole livers from \nDBD and DCD (Maastricht category III22) donors at least 16 years of age were \neligible. Specific donor consent was not required for trial inclusion. No organs \nwere procured from prisoners. Recipients were eligible provided they were at least \n18 years old and listed for a liver-only transplant, excluding those with fulminant \nliver failure, owing to the poor prognosis of this group regardless of organ quality. \nPotential participants were consented while on the waiting list; consent was \naffirmed on the day of transplantation. The consent included the recording of \nanonymized data for trial purposes and the collection of biological samples for \nstorage in the trial biobank (see ‘Sample collection’). No patient identifiable data \nwere collected.\nRandomization. Once an eligible donor organ was allocated to a consented recip\ufffeient and the availability of the NMP device and team was confirmed, the liver \nwas randomized. All clinical decisions thereafter, including graft suitability and \nprocedure scheduling, were made independently of the trial team.\nUsing an online randomization tool, livers were assigned to NMP or SCS with \n1:1 allocation ratio as per a computer-generated randomization schedule, using \nvariable block size, stratified by transplant centre and donor type (DBD/DCD). \nThe unit of randomization was donor livers rather than recipients, but analysis is \nreported for the transplant recipients.\nStatic cold storage group. Livers randomized to SCS were retrieved, preserved, \ntransported and transplanted according to local standard practice.\nNormothermic machine perfusion group. The OrganOx metra normothermic \nliver perfusion device was used (Extended Data Fig.\xa05a), which enables automated \norgan preservation for up to 24h. Following randomization to NMP, the device and \naccompanying researcher were transported to the donor hospital. The device was \nset-up during the retrieval procedure, as has been previously described9\n. A sterile \ndisposable set was installed on to the device and primed with 500ml gelofusine \n(B. Braun Ltd) and three units of donor-matched packed red blood cells. Antibiotics \nwere given at the outset and heparin, insulin, prostacyclin, bile salts and fat-free \nparenteral nutrition were infused during the perfusion (Extended Data Fig.\xa05b).\nFollowing retrieval of the donor organ, and while still at the donor hospital, the \nliver back-table operation was performed23, followed by cannulation of the hepatic \nartery, portal vein, inferior vena cava and bile duct. The liver was connected to the \nNMP device and perfusion commenced (Fig.\xa01). During the early part of the per\ufffefusion sodium bicarbonate was added incrementally to achieve a physiological pH. \nThe OrganOx metra perfusion device incorporates online blood gas measurement \n(Terumo CD1-500) together with software-controlled algorithms to control PO2\nand PCO2\n (within physiological limits), temperature (37°C), mean arterial pressure \n(65–75mm Hg) and), inferior vena cava pressure (0–2mm Hg). Typical blood \nflows of 200–400mlmin−1\n (artery) and 1,000-1,200mlmin−1\n (portal vein) were \nobtained. Glucose was measured manually and the value entered into the device. \nIf glucose fell below 10mmoll\n−1\n this automatically triggered the infusion of a fat\ufffefree TPN mixture (Nutriflex Special, B. Braun Ltd) into the perfusate.\nNMP continued throughout the duration of transport and storage until the \ntransplanting team were ready to implant the liver. The minimum protocol-stipulated \nNMP duration was 4h, the time needed for ATP repletion in animal studies11. \nThe maximum allowed NMP duration was 24h in line with the experience in the \nphase-I study and the regulatory approval for the device9\n.\nSample collection. Tissue biopsies (donor liver and bile duct), recipient blood \nand urine were collected at pre-specified time points from every liver/transplanted \npatient in the study. In addition to these, samples of perfusate fluid and bile were \ncollected from every NMP liver. These were stored in a central biobank established \nby the COPE Consortium for use in ongoing mechanistic studies. Each sample was \nallocated a unique bar code, which the biobank coordinator was able to match to \na specific trial identification number. No patient identifiable data were associated \nwith each sample.\nStudy end points. The primary endpoint was defined as the difference between the \ntwo treatment arms in the peak level of serum AST within seven days after trans\ufffeplant. This is a clinically accepted biomarker, predictive of primary non-function \nas well as graft and patient survival12,24 and is also associated with histological \nevidence of moderate to severe perfusion injury25,26.\nA surrogate marker of graft survival was used in this trial for two reasons: (1) \nthe relatively high survival rates in liver transplantation (>90%) and (2) the mul\ufffetifactorial causes of graft loss. A trial based directly on graft or patient survival \nwould have had to be unfeasibly large.\nIn order to ensure consistency and to minimise the hypothetical AST ‘wash-out’ \neffect in the NMP-treated organs, the first post-transplantation value was measured \nbetween 12 and 24h after reperfusion.\nSecondary end points included: (1) organ discard rate (after retrieval); (2) \npost-reperfusion syndrome27:>30% drop in mean arterial pressure persisting \nfor>1min within five minutes of reperfusion; (3) primary non-function: irre\ufffeversible graft dysfunction, for non-technical and non-immunological causes, lead\ufffeing to death or emergency liver replacement during the first 10 days after liver \ntransplantation; (4) early allograft dysfunction13 as indicated by any one of the \nfollowing clinical indicators: (i) bilirubin>170 μmol l−1\n on day 7 after transplant; \n(ii) INR>1.6 on day 7 after transplant; (iii) peak-AST>2,000 IU l−1\n during the \nfirst 7 days; (4) length of hospital and ICU stays; (5) need for renal replacement \ntherapy; (6) evidence of cholangiopathy on MRCP at six months; (7) graft and \npatient survival at one year.\nFull details of all secondary outcomes are available in the trial protocol28.\nSix-month MRCP. An MRCP scan was performed six months (range \n5–7 months) after transplant to evaluate the biliary tree for features of cholangiopathy \nevident by biliary strictures. All scans were reviewed by two independent radio\ufffelogists blinded to the method of organ preservation with disparities adjudicated \nby a third radiologist. Owing to the lack of any existing grading system for biliary \nstrictures, a system was agreed to in advance by consensus among the radiolo\ufffegists to allow definitive categorization of the presence and site of strictures. The \nfindings were reported as follows: (1) normal biliary tree; (2) anastomotic stric\ufffeture (>70% of luminal diameter); (3) unequivocal evidence of non-anastomotic \nstricture anywhere in the biliary tree; (4) both anastomotic and non-anastomotic \nbiliary strictures.\nStatistical analysis. Previous data from Universitaetsklinikum Essen, Germany \n(A.Pau. & S.R.K., unpublished observations), demonstrated the geometric mean of \npeak AST to be 608.59 IU l−1\n in patients transplanted following SCS. The present \nstudy was powered to detect a (clinically relevant) 33% reduction in peak AST \nwith 90% power at a 5% significance level, requiring 220 transplanted livers (110 \nper arm).\nResults are reported as a modified intention-to-treat analysis. A per-protocol \nsensitivity analysis was also performed excluding livers that received machine per\ufffefusion outside the protocol specified range (4–24h) and comparing the groups \naccording to the treatment actually received. Livers randomized but not retrieved \nwere excluded from the analysis.\nPrimary outcome was analysed using ANOVA with adjustment for stratification \nfactors. The peak AST was calculated for each recipient with at least two values \navailable. Missing AST values were not imputed. Binary outcomes were assessed \nusing test for proportions or logistic regression to adjust for potential confounders \nand report odds ratios. Continuous outcomes were compared using a Student’s \nt-test, if normally distributed, or by Mann–Whitney U-test otherwise. Time-to\ufffeevent outcomes were analysed using Kaplan–Meier estimates and log-rank tests. \nOutcomes are reported with 95% confidence intervals and P values to three decimal \nplaces. P<0.05 was regarded as statistically significant.\nPre-specified subgroup analyses were performed for donor type (DCD versus \nDBD), donor risk index (ET-DRI) and MELD score using tests for interaction and \nreported using forest plots. Interaction methods were used to look for consistency \nof treatment effect across the different subgroups and reported using forest plots. \nThe study was not powered to detect differences in the subgroups; these results \nshould only be regarded as hypothesis-generating.\nAnalyses were conducted using Stata version 14.2 (StataCorp).\nNo formal interim analyses of end points were carried out. At regular intervals, \nan independent Data Monitoring Committee reviewed confidential reports cov\ufffeering recruitment, safety parameters and primary end point data.\nFull details of the statistical methodology are available in the\xa0Supplementary \nInformation.\nMachine perfusion parameters. During NMP continuous displays of pressures, \nflows, metabolic (pH) and synthetic (bile production) liver function were available \n© 2018 Macmillan Publishers Limited, part of Springer Nature. All rights reserved.\n\nRESEARCH Article\nto the operator. In addition, lactate measurements were carried out using external \nblood gas analysis. The trial protocol did not stipulate the manner in which these \nparameters should be interpreted.\nOnce trial recruitment was complete, an ad hoc analysis was performed in which \nNMP organs were categorized according to those which, following transplantation, \ndisplayed minimal preservation injury (MPI; peak AST<250 IU l−1\n) and those \nwith severe preservation injury (SPI; peak AST>1,000 IU l−1\n). Groups were com\ufffepared for differences in donor and recipient characteristics, perfusate biochemistry, \nbile production and evidence of post-reperfusion syndrome.\nAdverse events. Reporting of adverse events was in accordance with the European \nCommission MEDDEV guidelines29. Following trial completion, these were \nreviewed by two independent clinicians blinded to the treatment arm. Adverse \nevents with a Clavien-Dindo30 grading greater than IIIa were considered serious \nadverse events. Rates of adverse events are reported with 95% confidence intervals. \nNo statistical tests were applied to these data.\nFull details of the trial methodology are available in the clinical trial protocol28.\nReporting Summary. Further information on experimental design is available in \nthe Nature Research Reporting Summary linked to this paper.\nData availability. The data that support the findings of this study are available from \nthe corresponding author upon reasonable request. The full trial protocol, statis\ufffetical analysis plan and final statistical report are available in the\xa0Supplementary \nInformation.\n21. Schulz, K. F., Altman, D. G. & Moher, D. CONSORT 2010 statement: updated \nguidelines for reporting parallel group randomised trials. Br. Med. J 340, c332 \n(2010).\n22. Kootstra, G., Daemen, J. H. & Oomen, A. P. Categories of non-heart-beating \ndonors. Transplant. Proc 27, 2893–2894 (1995).\n23. Makowka, L. et al. Surgical technique of orthotopic liver transplantation. \nGastroenterol. Clin. North Am 17, 33–51 (1988).\n24. Glanemann, M. et al. Clinical implications of hepatic preservation injury after \nadult liver transplantation. Am. J. Transplant 3, 1003–1009 (2003).\n25. Gaffey, M. J. et al. Predictive value of intraoperative biopsies and liver function \ntests for preservation injury in orthotopic liver transplantation. Hepatology 25, \n184–189 (1997).\n26. Karayalçin, K. et al. The role of dynamic and morphological studies in the \nassessment of potential liver donors. Transplantation 57, 1323–1327 (1994).\n27. Hilmi, I. et al. The impact of postreperfusion syndrome on short-term patient \nand liver allograft outcome in patients undergoing orthotopic liver \ntransplantation. Liver Transpl 14, 504–508 (2008).\n28. Nasralla, D. et al. A multicentre randomised controlled trial to compare the \nefficacy of ex-vivo normothermic machine perfusion with static cold storage in \nhuman liver transplantation. Protoc. Exch. https://doi.org/10.1038/\nprotex.2018.027 (2018).\n29. Guidelines on Medical Devices. Clinical Investigations: Serious Adverse Event \nReporting. Report No. MEDDEV 2.7/3 (European Commission, 2010).\n30. Dindo, D., Demartines, N. & Clavien, P. A. Classification of surgical \ncomplications: a new proposal with evaluation in a cohort of 6336 patients and \nresults of a survey. Ann. Surg. 240, 205–213 (2004).\n© 2018 Macmillan Publishers Limited, part of Springer Nature. All rights reserved.\n\nArticle RESEARCH\nExtended Data Fig. 1 | Forest plot for subgroup analysis of peak AST by donor type. Geometric mean ratio and 95% confidence interval are reported \nfor each subgroup and overall for all groups. DBD group, n=87 NMP, n=80 SCS; DCD group, n=33 NMP, n=20 SCS.\n© 2018 Macmillan Publishers Limited, part of Springer Nature. All rights reserved.\n\nRESEARCH Article\nExtended Data Fig. 2 | Post-reperfusion syndrome. a, Kaplan–Meier plot for one-year survival of patients with two-sided log-rank test. b, Kaplan–\nMeier plot for one-year graft survival with two-sided log-rank test.\n© 2018 Macmillan Publishers Limited, part of Springer Nature. All rights reserved.\n\nArticle RESEARCH\nExtended Data Fig. 3 | Machine perfusion parameters during NMP.\na, Hepatic artery flow during NMP. b, Portal vein flow during NMP. \nc, Perfusate pH during NMP. d, Bile production during NMP. \na–d, Data are mean±s.d. of each time point. Actual values are shown in \nthe table. n=87.\n© 2018 Macmillan Publishers Limited, part of Springer Nature. All rights reserved.\n\nRESEARCH Article\nExtended Data Fig. 4 | Perfusate lactate levels during NMP. Scatter graph with trend line showing perfusate lactate levels at different time points during \nNMP for all transplanted livers. n=94.\n© 2018 Macmillan Publishers Limited, part of Springer Nature. All rights reserved.\n\nArticle RESEARCH\nExtended Data Fig. 5 | NMP device and circuit. a, OrganOx metra \n(generation 1). The NMP device used in the trial. b, OrganOx metra NMP \ncircuit. The liver is perfused via the hepatic artery and portal vein. It \ndrains via the inferior vena cava to a centrifugal pump through which the \nperfusate passes, via a heat exchanger/oxygenator, to a reservoir or directly \ninto the hepatic artery. The perfusate in the reservoir drains under gravity \ninto the portal vein.\n© 2018 Macmillan Publishers Limited, part of Springer Nature. All rights reserved.\n\nRESEARCH Article\nExtended Data Table 1 | Detailed breakdown of reasons for discard of NMP livers\n© 2018 Macmillan Publishers Limited, part of Springer Nature. All rights reserved.\n\nArticle RESEARCH\nExtended Data Table 2 | Post-reperfusion syndrome analysis\na, Post-reperfusion syndrome by treatment group. Frequencies and column percentages are reported. Difference in proportions was tested using a Fisher’s test for proportions. b, Difference in \npost-reperfusion lactate in the recipient in each treatment arm. This relates to the first lactate measurement recorded by the anaesthetist after liver reperfusion and occurred within 30min of reperfu\ufffesion. Analysis using non-parametric Mann–Witney U-test. IQR, inter-quartile range. c, Difference in use of vasopressor medications before, during and after liver reperfusion in the recipient. Percentage \nof total events are reported in brackets. Details of the specific vasopressors that were used were not recorded.\n© 2018 Macmillan Publishers Limited, part of Springer Nature. All rights reserved.\n\nRESEARCH Article\nExtended Data Table 3 | Extended primary outcome analysis\na, Primary outcome results from the unadjusted analysis. Sample size for analysis of primary outcome is n=220. A Student’s t-test was used. ^First cell in this column refers to the mean difference in \nnatural logarithm of peak AST (variable used to run the analysis models). The second cell in this column refers to the geometric mean ratio of the peak AST, used to look at the reduction in the original \nmeasurement. b, Treatment effect on peak AST for donor type subgroups. Sample size for subgroup analysis is n=220 (DBD group, n=87 NMP, n=80 SCS; DCD group, n=33 NMP, n=20 SCS). A \nStudent’s t-test was used. No power calculation or adjustment was made for subgroup analysis.\n© 2018 Macmillan Publishers Limited, part of Springer Nature. All rights reserved.\n\nArticle RESEARCH\nExtended Data Table 4 | Characteristics and perfusate analysis of livers included in NMP liver quality model development\na, Demographic data for organ quality model development livers. Demographic data for minimal preservation injury (MPI; peak AST<250 IU l−1; n=28) and significant preservation injury (SPI; peak \nAST>1,000 IU l−1; n=25) groups. Continuous variables were analysed using an unpaired Student’s t-test and categorical variables using Fisher’s exact test. Data are mean±s.e.m. b, Comparison of \nNMP perfusate analyses between MPI (peak AST<250 IU l−1; n=28) and SPI (peak AST>1,000 IU l−1; n=25) groups. A D’Agostino–Pearson normality test was performed to assess data distribution. \nParametric data were analysed using an unpaired Student’s t-test and non-parametric data were analysed using a Mann–Whitney U-test. Parametric data are presented as mean±s.e.m. and \nnon-parametric data are presented as median and range.\n© 2018 Macmillan Publishers Limited, part of Springer Nature. All rights reserved.\n\nRESEARCH Article\nExtended Data Table 5 | Adverse events analysis\na, Number of patients with any adverse events reported in each trial arm. The percentage of total events is reported in brackets. No statistical tests have been applied. b, Adverse events were catego\uffferized by Clavien–Dindo grade. Breakdown of adverse events in each trial arm according to Clavien–Dindo grading. The percentage of total events is reported in brackets. Adverse events with Clavien–\nDindo grading ≥IIIb were categorized as serious adverse events. No statistical tests have been applied. c, Breakdown of adverse events and serious adverse events in each trial arm. The percentage of \ntotal events is reported in brackets. Adverse events with Clavien–Dindo grading ≥IIIb were categorized as serious adverse events. No statistical tests have been applied.\n© 2018 Macmillan Publishers Limited, part of Springer Nature. All rights reserved.\n\nArticle RESEARCH\nExtended Data Table 6 | Detailed breakdown of adverse events in each trial arm\nThe percentage of total events is reported in brackets. No statistical tests have been applied.\n© 2018 Macmillan Publishers Limited, part of Springer Nature. All rights reserved.\n\n1nature research | life sciences reporting summary June 2017\nCorresponding author(s):\nDavid Nasralla, Constantin C Coussios, \nPeter J Friend\nInitial submission Revised version Final submission\nLife Sciences Reporting Summary\nNature Research wishes to improve the reproducibility of the work that we publish. This form is intended for publication with all accepted life \nscience papers and provides structure for consistency and transparency in reporting. Every life science submission will use this form; some list \nitems might not apply to an individual manuscript, but all fields must be completed for clarity. \nFor further information on the points included in this form, see Reporting Life Sciences Research. For further information on Nature Research \npolicies, including our data availability policy, see Authors & Referees and the Editorial Policy Checklist. \n` Experimental design\n1. Sample size\nDescribe how sample size was determined. Data from 416 liver transplant recipients from University Hospital Essen \ndemonstrated the geometric mean of peak AST to be 608.59 IU/L (the geometric \nmean is used as peak AST is non-normally distributed). 220 transplants (110 per \narm) would have 90% power at 5% significance level to detect a 33% reduction (to \n401.67 IU/L) in the geometric mean of peak AST. Thus the trial required a sample \nsize of 220 livers to be transplanted and reach the primary endpoint. \nOnce trial recruitment was complete, an ad hoc analysis was performed in which \nNMP organs were categorised according to those which, following transplant, \ndisplayed minimal preservation injury (MPI; peak AST <250 IU/litre; n=28) and \nthose with more severe preservation injury (SPI; peak AST >1000 IU/litre; n=25). \n2. Data exclusions\nDescribe any data exclusions. Inclusion criteria for donors and recipients were deliberately broad to represent \nthe full spectrum of clinical practice. Whole livers from brainstem death (DBD) and \ncirculatory death (DCD) donors aged at least 16 years were eligible. \nRecipients were eligible provided they were at least 18 years old and listed for a \nliver-only transplant, excluding those with fulminant liver failure, due to their poor \nprognosis regardless of organ quality. \n3. Replication\nDescribe whether the experimental findings were \nreliably reproduced.\nThis is the first phase 3 randomised controlled trial to compare any form of \nmachine perfusion technology with static cold storage in human liver \ntransplantation. This findings have broadly confirmed those demonstrated in small \nscale animal studies and in small retrospectively matched case series. \nThis was a clinical trial not involving experiments that need replication.\n4. Randomization\nDescribe how samples/organisms/participants were \nallocated into experimental groups.\nOnce an eligible donor organ was allocated to a consented recipient and the \navailability of the normothermic liver perfusion (NMP) team was confirmed, the \nliver was randomised. All clinical decisions thereafter, including graft suitability and \nprocedure scheduling, were made independently of the trial team. \nUsing an online randomisation tool, livers were assigned to NMP or static cold \nstorage with 1:1 allocation ratio as per a computer generated randomisation \nschedule using variable block size, stratified by transplant centre and donor type \n(DBD/DCD). The unit of randomisation was donor livers rather than recipients, but \nanalysis is reported for the transplant recipients.\n5. Blinding\nDescribe whether the investigators were blinded to \ngroup allocation during data collection and/or analysis.\nThis was an open label study. Due to the nature of the intervention (large machine \nperfusion device), it was not possible to blind investigators as to which arm the \nliver had been randomised. .\nNote: all studies involving animals and/or human research participants must disclose whether blinding and randomization were used.\n\n2nature research | life sciences reporting summary June 2017\n6. Statistical parameters \nFor all figures and tables that use statistical methods, confirm that the following items are present in relevant figure legends (or in the \nMethods section if additional space is needed). \nn/a Confirmed\nThe exact sample size (n) for each experimental group/condition, given as a discrete number and unit of measurement (animals, litters, cultures, etc.)\nA description of how samples were collected, noting whether measurements were taken from distinct samples or whether the same \nsample was measured repeatedly\nA statement indicating how many times each experiment was replicated\nThe statistical test(s) used and whether they are one- or two-sided (note: only common tests should be described solely by name; more \ncomplex techniques should be described in the Methods section)\nA description of any assumptions or corrections, such as an adjustment for multiple comparisons\nThe test results (e.g. P values) given as exact values whenever possible and with confidence intervals noted\nA clear description of statistics including central tendency (e.g. median, mean) and variation (e.g. standard deviation, interquartile range)\nClearly defined error bars\nSee the web collection on statistics for biologists for further resources and guidance.\n` Software\nPolicy information about availability of computer code\n7. Software\nDescribe the software used to analyze the data in this \nstudy. \nAnalyses were conducted with the use of Stata version 14.2 (StataCorp, College \nStation, TX).\nFor manuscripts utilizing custom algorithms or software that are central to the paper but not yet described in the published literature, software must be made \navailable to editors and reviewers upon request. We strongly encourage code deposition in a community repository (e.g. GitHub). Nature Methods guidance for \nproviding algorithms and software for publication provides further information on this topic.\n` Materials and reagents\nPolicy information about availability of materials\n8. Materials availability\nIndicate whether there are restrictions on availability of \nunique materials or if these materials are only available \nfor distribution by a for-profit company.\nThe normothermic machine perfusion device used in this study is now CE marked \nand can be used for clinical practice, but is only available through the \nmanufacturing company, OrganOx Ltd. There are no restrictions on the other \nmaterials used in this study.\n9. Antibodies\nDescribe the antibodies used and how they were validated \nfor use in the system under study (i.e. assay and species).\nNo antibodies were used\n10. Eukaryotic cell lines\na. State the source of each eukaryotic cell line used. No eukaryotic cell lines were used\nb. Describe the method of cell line authentication used. No eukaryotic cell lines were used\nc. Report whether the cell lines were tested for \nmycoplasma contamination.\nNo eukaryotic cell lines were used\nd. If any of the cell lines used are listed in the database \nof commonly misidentified cell lines maintained by \nICLAC, provide a scientific rationale for their use.\nNo eukaryotic cell lines were used\n` Animals and human research participants\nPolicy information about studies involving animals; when reporting animal research, follow the ARRIVE guidelines\n11. Description of research animals\nProvide details on animals and/or animal-derived \nmaterials used in the study.\nNo animals were used in the study\n\n3nature research | life sciences reporting summary June 2017\nPolicy information about studies involving human research participants\n12. Description of human research participants\nDescribe the covariate-relevant population \ncharacteristics of the human research participants.\nLivers were obtained from deceased donors aged at least 16 years who's family \nmembers had provided appropriate consent for the donation of their organs. \nRecipients were eligible provided they were at least 18 years old and listed for a \nliver-only transplant, excluding those with fulminant liver failure, due to their poor \nprognosis regardless of organ quality. \nDonors in both arms of the study were well matched in the following respects: \nDonor type (DBD, DCD); age; sex; ethnicity; cause of death; BMI; eurotransplant \ndonor risk index. \nRecipients in both arms of the study were well matched in the following respects: \nAge; sex; cause of liver failure; BMI; retransplants; Model of end-stage liver disease \n(MELD) score; estimated glomerular filtration rate (eGFR).\n\n""]","This study compares the effectiveness of normothermic machine perfusion (NMP) versus conventional cold storage (CCS) in liver transplantation. The study involved livers from deceased donors aged at least 16 years, with families providing consent for organ donation. Recipients were eligible if they were at least 18 years old and listed for a liver-only transplant, excluding those with fulminant liver failure. Both arms of the study were well-matched in terms of donor and recipient characteristics, including donor type, age, sex, ethnicity, cause of death, BMI, eurotransplant donor risk index, and model of end-stage liver disease score. The study found that NMP significantly reduced the peak alanine aminotransferase (ALT) level during the first week after transplant compared to CCS, with a geometric mean ratio of 0.506 (95% confidence interval 0.388–0.659; P<0.001). The study confirms previous findings from animal studies and smaller retrospective case series, but it is still considered an open-label study since it was not possible to blind researchers to group allocation due to the large machine perfusion device used in NMP. The study also notes that the NMP device used in the study is now CE marked and commercially available through the manufacturer, OrganOx Ltd. However, there are no restrictions on the availability of other materials used in the study. The study follows the ARRIVE guidelines for reporting animal research and provides detailed descriptions of the research animals and cell lines used, as well as information on their validation and authentication. The study also reports the statistical parameters used in analyzing the data, including the exact sample sizes, statistical tests used, and confidence intervals. Finally, the study indicates that there are no restrictions on the availability of unique materials used in the study, except for the NMP device, which is only available through the manufacturer.",0.56,0.8604672481272203,FULL_PAPER
How has the evidence changed regarding acceptable macro/microsteatosis in liver grafts?,"['REVIEW\npublished: 12 May 2020\ndoi: 10.3389/fimmu.2020.00631\nFrontiers in Immunology | www.frontiersin.org 1 May 2020 | Volume 11 | Article 631\nEdited by:\nPeter Schemmer,\nMedical University of Graz, Austria\nReviewed by:\nJosefina M. Alberu,\nTecnológico de Monterrey, Mexico\nCaner Süsal,\nHeidelberg University\nHospital, Germany\n*Correspondence:\nSefan Schneeberger\nstefan.schneeberger@i-med.ac.at\nSpecialty section:\nThis article was submitted to\nAlloimmunity and Transplantation,\na section of the journal\nFrontiers in Immunology\nReceived: 03 December 2019\nAccepted: 19 March 2020\nPublished: 12 May 2020\nCitation:\nResch T, Cardini B, Oberhuber R,\nWeissenbacher A, Dumfarth J,\nKrapf C, Boesmueller C, Oefner D,\nGrimm M and Schneeberger S (2020)\nTransplanting Marginal Organs in the\nEra of Modern Machine Perfusion and\nAdvanced Organ Monitoring.\nFront. Immunol. 11:631.\ndoi: 10.3389/fimmu.2020.00631\nTransplanting Marginal Organs in the\nEra of Modern Machine Perfusion\nand Advanced Organ Monitoring\nThomas Resch1\n, Benno Cardini 1\n, Rupert Oberhuber 1\n, Annemarie Weissenbacher 1\n,\nJulia Dumfarth2\n, Christoph Krapf 2\n, Claudia Boesmueller 1\n, Dietmar Oefner 1\n,\nMichael Grimm2 and Sefan Schneeberger 1\n*\n1 Department of Visceral, Transplant and Thoracic Surgery, Medical University of Innsbruck, Innsbruck, Austria, 2 Department\nof Cardiac Surgery, Medical University of Innsbruck, Innsbruck, Austria\nOrgan transplantation is undergoing profound changes. Contraindications for donation\nhave been revised in order to better meet the organ demand. The use of lower-quality\norgans and organs with greater preoperative damage, including those from donation after\ncardiac death (DCD), has become an established routine but increases the risk of graft\nmalfunction. This risk is further aggravated by ischemia and reperfusion injury (IRI) in the\nprocess of transplantation. These circumstances demand a preservation technology that\nameliorates IRI and allows for assessment of viability and function prior to transplantation.\nOxygenated hypothermic and normothermic machine perfusion (MP) have emerged\nas valid novel modalities for advanced organ preservation and conditioning. Ex vivo\nprolonged lung preservation has resulted in successful transplantation of high-risk\ndonor lungs. Normothermic MP of hearts and livers has displayed safe (heart) and\nsuperior (liver) preservation in randomized controlled trials (RCT). Normothermic kidney\npreservation for 24 h was recently established. Early clinical outcomes beyond the market\nentry trials indicate bioenergetics reconditioning, improved preservation of structures\nsubject to IRI, and significant prolongation of the preservation time. The monitoring\nof perfusion parameters, the biochemical investigation of preservation fluids, and the\nassessment of tissue viability and bioenergetics function now offer a comprehensive\nassessment of organ quality and function ex situ. Gene and protein expression profiling,\ninvestigation of passenger leukocytes, and advanced imaging may further enhance the\nunderstanding of the condition of an organ during MP. In addition, MP offers a platform\nfor organ reconditioning and regeneration and hence catalyzes the clinical realization\nof tissue engineering. Organ modification may include immunological modification and\nthe generation of chimeric organs. While these ideas are not conceptually new, MP\nnow offers a platform for clinical realization. Defatting of steatotic livers, modulation\nof inflammation during preservation in lungs, vasodilatation of livers, and hepatitis C\nelimination have been successfully demonstrated in experimental and clinical trials.\nTargeted treatment of lesions and surgical treatment or graft modification have been\nattempted. In this review, we address the current state of MP and advanced organ\nmonitoring and speculate about logical future steps and how this evolution of a novel\ntechnology can result in a medial revolution.\nKeywords: transplantation, machine perfusion, marginal, graft, immunogenecity, immunomodulation,\nreconditioning, expanded criteria donor\n\nResch et al. Machine Perfusion for Marginal Organs\nINTRODUCTION\nThe velocity and significance of progress in transplantation\nstarted to decrease around the turn of the century. Up until\nthat point, the number of transplantations performed was\never-increasing, and the outcomes continued to improve. The\nclinical benefit to the patient from the immediate and effective\ntreatment of organ failure was defined by improved patient\nsurvival. Patient survival as an endpoint followed by graft survival\nas a surrogate and indicator of judicious organ attribution\nwere the framework of significant momentum that succeeded\nin making transplantation a standard of care. This success\nwas fueled, however, not only by the healthcare quality gain\nbut also by a flourishing industry producing high-quality and\nexpensive immunosuppressive medication—to be taken for life\nafter transplantation (1–3).\nThe honeymoon period came to an end when both donor\nrates and short-term results stagnated. The established endpoints\nfor clinical trials are difficult to improve in the short run\nafter transplantation, and the field was slow in anticipating\nand responding to the changing circumstances—specifically\nthe shortage of standard criteria donors (SCD). The field of\ntransplantation now finds itself in very difficult circumstances:\n90%+ patient and graft survival rates leave little room for\nimprovement but also little room for error. At the same\ntime, the conditions and circumstances in organ donation are\nradically changing, with increasing donor age and comorbidities\nand donation from non-heart-beating donors. In countries\nspearheading the evolution, donation after cardiac death (DCD)\nand extended criteria donor (ECD) organs make up more than\n50% of the organ pool. With the pressure to maintain and further\nimprove the excellent short- and long-term results, but working\nwith very different resources, the most prominent immediate\nchallenge is to better define and preserve, if not improve, organ\nquality in transplantation.\nAbbreviations: A2AR, Adenosine A2A receptor; AST, Aspartate\naminotransferase; ATP, Adenosine triphosphate; CIT, Cold ischemia time;\nCMV, Cytomegalovirus; CVA, Cerebrovascular accident; DAMP, Danger\ufffeassociated molecular pattern; DBD, Donation after brain death; DC, Dendritic\ncell; DCD, Donation after cardiac death; DGF, Delayed graft function;\nD-HOPE, Dual hypothermic oxygenated perfusion; DRI, Donor Risk Index;\nEAD, Early allograft dysfunction; ECD, Expanded criteria donor; ECMO,\nExtracorporal membrane oxygenation; EMS, Exsanguinous metabolic support;\nESP, Eurotransplant senior program; ET-1, Endothelin-1; EVLP, Ex vivo lung\nperfusion; FABP, Fatty Acid- Binding Protein 1; GFP, Green fluorescent protein;\nGST, Glutathione S-Tranferases; H-FABP, Heart-type fatty acid-binding protein;\nHOPE, Hypothermic oxygenated perfusion; HMP, Hypothermic machine\nperfusion; HMPO, Oxygenated hypothermic machine perfusion; IFNγ, Interferon\ngamma; IL-10, Interleukin-10; IRI, Ischemia-reperfusion injury; KDRI, Kidney\nDonor Risk Index; LDH, Lactate dehydrogenase; MP, Machine perfusion; MSC,\nMesenchymal stromal cells; NAG, N-acetyl-beta-D-glucosaminidase; NMP,\nNormothermic machine perfusion; NK, Natural killer cell; NKT, Natural killer\nT cell; NRP, Normothermic regional perfusion; OCS, Transmedic Organ Care\nSystem; PDR, Pancreas Donor Risk Index; PGD3, Prostaglandin D3; PNF, Primary\nnon-function; PV, Pressure volume; RCT, Randomized controlled trial; ROS,\nReactive oxygen species; SCD, Standard criteria donor; SCS, Static cold storage;\nSOFT, Survival Outcomes Following Liver Transplantation score; SOP, Standard\noperating procedure; SOT, Solid organ transplantation; TNF-α, Tumor necrosis\nfactor α; UNOS, United Network for Organ Sharing; VEGF, Vascular endothelial\ngrowth factor; WIT, Warm ischemia time.\nWith this as a driving force, modalities to prolong and\nimprove preservation together with the tools to assess organ\nquality and function are emerging as the new frontier. Beyond\nserving an immediate medical need, the technologies evolving\nherald a more fundamental potential for change in healthcare:\nwith the extracorporeal long-term preservation and assessment\nof organs, the capability for human organ treatment and repair\narises. Hence, 20 years after transplantation advanced to become\na standard of care, the field has the potential to play a key role and\nadd a chapter to healthcare once again (4–10).\nIn this review, we aim to address the current state of the\nfield. A clarification of the terminology and the definitions\nof marginal organs, including an overview and comparison\nbetween the definitions for each organ, shall help to provide\na better picture of the actual status. Considering the changing\ncircumstances, the actual impacts of a condition on organ quality\nand function need to be addressed not only from the viewpoint\nof an empirical correlation. The individual parameters need to be\nfurther addressed for their reversibility and treatability. Building\non this concept, the various modalities of MP in their different\nstages of development and actual benefit require a critical\nreflection. While the assessment of organ quality and function\nduring extracorporeal perfusion is in its infancy, the growing\nbody of data may help to eventually develop a comprehensive\npicture of the quality of the components of organs as relevant to\ntransplantation and beyond. An important focus in this context\nis the assessment, definition, and relevance of the immune system\nof organs if isolated from the human body. Immunomodulation\nand immunomasking seem more realistic if attempted under\nthe conditions of an isolated and perfused organ. The vision\nof a realization and refinement of the repair, treatment, and\nmodification of organs is starting to trigger a boost in interest\nboth in academia and in industry.\nDEFINING “MARGINAL” ORGANS\nIn the light of organ shortage, critical reflection on the expansion\nof the donor pool is essential. The definition of organs that are\nmarginal for transplantation is often considered a well-defined\nentity. In reality, however, the definition is very different for each\norgan, and there is incongruence between the various definitions.\nIt is clear and well-justifiable that different organs are considered\nto be extended criteria organs going by different criteria, since the\nrelevance of one single factor may be very diverse. The assessment\nof the outcome after transplantation of extended criteria organs,\nhowever, needs to be seen and interpreted with reference to the\ndiverse definitions used throughout the years.\nECD Kidneys\nThe determination of ECD evolved from the term “marginal\ndonors,” and much of the literature focuses on criteria for living\ndonors. Since this is not the focus of this article, we will restrict\nthe research to deceased donors and deceased donor organs.\nIt is well-known that a number of factors may impact\nthe eventual outcome after transplantation. The definition of\ncadaveric kidney organs marginal for transplantation emerged\nfrom prioritization of and preference for factors that may outrank\nFrontiers in Immunology | www.frontiersin.org 2 May 2020 | Volume 11 | Article 631\n\nResch et al. Machine Perfusion for Marginal Organs\nTABLE 1 | Commonly used “ECD” criteria for the kidney.\nDonor age category (years)\nDonor condition <10 10–39 40–49 50–59 ≥60\nCVA+ HTN+ creatinine >1.5 md/dL x x\nCVA+ HTN x x\nCVA+ creatinine >1.5 md/dL x x\nCVA+ creatinine >1.5 md/dL x x\nCVA+ creatinine >1.5 md/dL x\nCVA x\nHTN x\nCreatinine >1.5 mg/dL x\nCVA, cerebrovascular accident was the cause of death; HTN, history of hypertension.\nother contributors in magnitude and simplicity of assessment\n(11). In the deceased donor situation, the prior medical history\nis not completely known, and the exact determination of\nhypertension, for example, often remains incomplete regarding\ndetails such as manifestation, duration, or response to treatment.\nSome of the understanding of donor risk factors also stems from\nliving donors (12), where early definitions of marginal donors\nrelate to the risks for the recipient rather than the risk for the\ndonor, which was only assessed and understood much later.\nHence, the definition of marginal or ECD kidneys needs to be\nused with caution since the definitions used are building on a set\nof parameters that have not been formally established, validated,\nand re-validated.\nStill, compared to other organ systems in SOT, a comparatively\ngood definition of marginal or ECD has been established.\nNoteworthily, the term “marginal” should be avoided in favor of\nECD, as “marginal” may be considered pejorative by the patients\nwho receive them and also by the programs that transplant\nthem (13).\nThe ECD criteria most widely used in kidney transplantation\nare the OPTN-approved criteria, as described by Metzger et al.\n(13). They are shown in Table 1.\nA helpful tool that combines such parameters is the Kidney\nDonor Risk Index (KDRI), which was generated by weighting the\nfollowing factors into a single number in order to predict the risk\nof post-transplant graft failure: age, weight, height, race, history\nof hypertension, history of diabetes, cause of death, hepatitis C\nstatus, serum creatinine, and DCD. The association of KDRI\nwith the outcome in the Eurotransplant senior program (ESP)\nwas evaluated by Schamberger et al. (14). Kidney transplantation\nfrom Maastricht category-III donors after circulatory death\n(DCD), which introduces a higher risk of primary non-function\nand delayed graft function (DGF), has been added to ECD\ncriteria (15). Furthermore, kidneys from a donor with an acute\nkidney injury before organ procurement correspond to marginal\nquality (16). Importantly, kidneys from donors with a history\nof extracorporal membrane oxygenation (ECMO) have not been\naddressed specifically but can be classified as marginal organs\nsince deteriorated microperfusion can be assumed (17–19).\nTABLE 2 | Common criteria defining “marginal” or “expanded criteria donor\n(ECD)” livers, as well as “ECD DCD” livers.\nDBD\nCardiac arrest (min) >15\nProlonged hypotensive periods <60 mmHg for >1 hr\nAge (yrs) >55\nBMI (kg/m2\n) >30\nHBV Positive\nHBC Positive\nBMI (kg/m2\n) 79 (100.0)\nMacrosteatosis (%) >30\nHypernatriemia (mEq/L) >155\nICU stay (days) ≥ 5 (mechanical ventilation)\nNosocomial infection Positive blood cultures or pneumonia\nSplit liver yes\nAST (U/L) >170\nALT (U/L) >140\nCIT (hrs) >12\nVasopressor drug requirement Dopamine dose >10 µg/kg/min or\nany doses of other amines)\nNon-heart-beating Yes\nDCD\nAge (yrs) >50\nBMI (kg/m2\n) >35\nFunctional WIT (min) >30\nMacrosteatosis (%) >30\nDCD, donation after cardiac death; DBD, donation after brain death; min, minutes; yrs,\nyears; hrs, hours; CIT, cold ischemia time; HBV, hepatitis B virus; HCV, hepatitis C\nvirus; BMI, body mass index; ICU, intensive care unit; AST, aspartate aminotransferase;\nALT, Alanin-aminotransferase.\nECD Livers\nIn liver transplantation, the term “marginal” does not refer to\na number of distinct internationally accepted criteria that could\ncharacterize a graft, and nor does “ECD.” Instead, both terms\nencompass a variety of factors that have been observed to limit\ngraft quality, but the impact of each of these factors remains\nto be defined. Therefore, several models for the assessment of\nthe sum of such risk factors have been introduced (20). In this\nregard, valuable predictive quality of patient and graft survival at\n3 months was achieved using the Survival Outcomes Following\nLiver Transplantation (SOFT) score (21). Death censored graft\nsurvival at 60 months follow-up was well-predicted by the Donor\nRisk Index (DRI; c-index 0.59) and Eurotransplant-DRI (c-index\n0.58) (20).\nTable 2 lists those criteria that overlap in the mentioned\nscoring systems and that are widely applied when defining\n“marginal” or “ECD” liver grafts (22, 23). Apart from clinical and\nmetric parameters, these include histological criteria, since liver\nbiopsies are considered helpful in order to evaluate the organ\nquality. Whereas, liver fibrosis has been reported to predict a\nhigh incidence of early graft failure (24), Liu et al. (25) suggested\na macrovesicular steatosis of 30 percent as a cutoff value for\nmarginal grafts.\nFrontiers in Immunology | www.frontiersin.org 3 May 2020 | Volume 11 | Article 631\n\nResch et al. Machine Perfusion for Marginal Organs\nTABLE 3 | Common criteria defining a “marginal” or “ECD” pancreas.\nAge (yrs) <10/>45 (>50)\nBMI (kg/m2\n) >30\nTrauma Yes\nPancreatitis Yes\nAlcohol intake Yes\nDCD Yes\nyrs, years; BMI, body mass index; DCD, donation after cardiac death; ECD, expanded\ncriteria donor.\nTABLE 4 | Common criteria defining “marginal” or “ECD” hearts.\nAge (yrs) >40 (32)/>55 (33)\nBMI mismatch donor/recipient (%) >20\nHCV Positive\nBMI (kg/m2\n) 79 (100.0)\nLV hypertrophy (mm) >14\nEjection fraction (%) <45\nHigh-dose catecholamine administration Yes\nTobacco or illicit drug use (cocaine) Yes\nHistory of diabetes\nProlonged cardiopulmonary resuscitation Yes\nTransient reversible hypotension or cardiac arrest Yes\nLV, left ventricular; BMI, body mass index; HCV, hepatitis C virus.\nNoteworthily, while livers from non-heart-beating donors are\nper se considered as ECD, Mihylov et al. suggested criteria for\n“ECD DCD” livers in order to subclassify DCD organs (26)\n(Table 2).\nECD Pancreas\nIn analogy to other organs in SOT, no clear definition exists\nfor a “marginal” or ECD pancreas graft. Table 3 summarizes\nthe criteria that have been commonly used by various authors\n(27–30). In an attempt to bring such criteria into a clinically\nuseful context, Axelrod et al. (31) presented a Pancreas Donor\nRisk Index (PDR). The score builds a prediction model of graft\nsurvival on donor factors together with ischemia time and type\nof transplantation (31).\nECD Hearts\nDue to the imminent gap between the supply of donor hearts\nand the demand for transplantable organs, strategies have\nemerged to overcome this clinical dilemma. The numbers of left\nventricular assist devices as bridge-to-transplant therapy have\nsignificantly increased over the last decade. Simultaneously with\nthis trend, marginal or “extended criteria” hearts are routinely\nevaluated in order to increase the donor pool. While standardized\ncriteria have not been published by societies so far, there is a\ngeneral consensus when it comes to the definition of marginal\ndonor hearts. The literature on this topic is primarily driven\nby US data. A Meeting Report by the American Society on\nTransplantation on adult cardiac transplantation is still lacking\na unified formal definition.\nTABLE 5 | Common criteria defining standard criteria (SCD), therefore not ECD\nlung.\nAge (yrs) <55\nBMI mismatch donor/recipient (%) >20\nClear chest X-ray Yes\nPaO2 (mm Hg) >300 (FIO2 1.0,\nPEEP 5 mm Hg)\nHistory of smoking (pack yrs) <20\nAbsence of chest trauma Yes\nAbsence of microbiologic organisms endobronchial Yes\nAbsence of malignancy Yes\nAbsence of purulent secretions or signs of aspiration\nendobronchial\nYes\nNegative virology Yes\nyrs, years; BMI, body mass index; FIO2, fraction of inspired oxygen; PaO2, partial pressure\nof oxygen; PEEP, positive end-expiratory pressure.\nBased on the current literature, the factors that should be\nconsidered as extended criteria in heart donation are given in\nTable 4.\nIn order to facilitate a better risk-assessment of allografts,\ndonor profiles have been implemented in Risk Scores. Smits et al.\nhave identified 12 variables associated with donor non-use in\nthe Eurotransplant region and have generated the Eurotransplant\nHeart Donor Score (32). Based on the UNOS database, a risk\nscore model (UNOS Donor Risk Score) has been developed by\nWeiss et al. (33).\nECD Lungs\nBased on the standard criteria donor lung definitions published\nin 2003 by Orens et al. (34), one can define an ECD lung if\nthe donor does not fulfill at least one criterion of the SCD\ncriteria suggested by the International Society for Heart and Lung\nTransplantation (Table 5).\nMACHINE PERFUSION\nThe concept of MP was part of organ preservation long before\nsolid organ transplantation (SOT) started to become a clinical\nreality and routine. With the publication by Collins et al., in\nwhich the authors described a method for the transportation of\nkidneys on ice using a preservation solution with the result that\nthe organs could be shipped in a small box and showed almost\nno damage after 30 h, the era of static cold storage (SCS) had\nbegun (35). The implementation of SCS led to satisfactory results\nwithin the entire field of SOT. However, with the increasing\nuse of organs procured from ECD and DCD, SCS alone is not\nable to deliver the post-transplant results we aim to achieve for\nour patients. The lack of oxygen, the continuation of anaerobic\nmetabolism leading to organ-damage and recipient-harming\nIRI after reperfusion, is significantly pronounced and more\ndetrimental in these marginal donor organs (36).\nFigure 1 illustrates the different possibilities for combining\nall preservation techniques available today clinically for almost\nall organs: static cold storage (as the golden standard,\nFrontiers in Immunology | www.frontiersin.org 4 May 2020 | Volume 11 | Article 631\n\nResch et al. Machine Perfusion for Marginal Organs\nFIGURE 1 | The past, present, and potential (near) future of organ preservation. Whereas, static cold storage (SCS) has been successfully applied over decades with\ngood outcomes in standard criteria donor (SCD) organs, at present, marginal or expanded criteria donor (ECD) organs in particular are increasingly preserved by\nhypothermic (HMP) or normothermic machine perfusion (NMP) technologies. After initial cold perfusion [*and optimally following normothermic regional perfusion\n(NRP) in Donation after cardiac death (DCD) organs], machine perfusion is commenced either at the retrieval center or at the transplant center in a “back to hub”\napproach. The next step is to effectively use the prolonged preservation times of ECD grafts achieved by optimized machine perfusion protocols to characterize ECD\norgan quality and transplantability via the assessment of biomarkers. To improve graft quality, NMP provides an ideal platform for future immunomodulatory\nmodifications and organ repair.\nso far), hypothermic preservation with/without oxygen, and\nnormothermic perfusion. Normothermic regional perfusion\n(NRP) is mentioned in Figure 1, as it has become an important\ntool for use before the procurement process of DCD starts. The\nfollowing sections will not present NRP data in particular, as the\nreview is about machine preservation in marginal donor organs.\nHowever, good and satisfying results after kidney, pancreas,\nheart, and liver transplantation were reported by several groups\nin the United Kingdom, Spain, and France and have been\nsummarized by previous reviews (37–42).\nRecently, Ruiz et al. presented a series of 46 livers transplanted\nafter NRP and concluded that their results, including 23%\nearly allograft dysfunction, are superior to standard DCD organ\nprocurements and comparable to donation after brain death\n(DBD) results (43). The Cambridge group (United Kingdom),\nclear NRP proponents, commented on this publication in a way\nsimilar to our suggestions illustrated in Figure 1. The publication\nby Ruiz et al. (43), like many others before it, did not compare the\nresults to an adequate prospectively organized control group.\nIt is noteworthy that, only recently, a protocol for NRP\nwas established even for DCD heart transplantation. Due to a\nrestoration of function of the arrested heart, organ assessment via\nechocardiography, pressure-volume loops, and cardiac-output\nmeasurements could be implemented (44).\nAccepted criteria for subsequent heart transplantation after\nweaning from mechanical support are defined as: cardiac\nindex >2.5 L/min/m2\n; central venous pressure < 12 mm Hg;\npulmonary capillary wedge pressure < 12 mm Hg; left ventricular\nejection fraction > 50% in transoesophageal echocardiography.\nNRP leads to a meaningful increment of survival benefits and\nhelps to enlarge the available donor pool by utilizing marginal\ndonor organs in a safe way (45, 46). Future trials are needed to\ncompare DCD organ transplantation +/– NRP followed by +/–\na combination of preservation techniques (42, 45).\nSince 2009, dynamic cold storage—hypothermic machine\nperfusion (HMP)—has progressed to become clinical routine in\nseveral fields of SOT—above all, in kidney preservation. Moers\net al. published their landmark paper in the New England Journal\nof Medicine and demonstrated a significantly lowered DGF\nrate in recipients receiving a hypothermically perfused kidney\ncompared to a renal graft stored on ice in the common way\n(47). Applying the same technology (HMP without supplemental\noxygenation), numerous publications on DCD and ECD kidneys\nhave followed over the past 10 years, showing similar results:\nECD and DCD kidneys and their recipients clearly benefit from\nMP as long as the duration of cold ischemia time (CIT) is\nreasonable (48–52). During the second half of the recent decade,\noxygen as a supplement has been focused on for kidney HMP.\nIn 2016, Jochmans et al. published an overview of ongoing\nMP trials in kidney and liver transplantation, including those\nassessing oxygenated HMP (53). One of these trials run by the\nCOPE\nR\nconsortium (http://cope-eu.com/work%20programme/\ntrials.html) has finished recruiting, and 1-year-follow-up results\nwere presented during the American Transplant Congress 2019.\nThis international RCT on oxygenated HMP of DCD kidneys\nincluded 197 kidney pairs, of which 106 were successfully\nhypothermically perfused and transplanted. Approximately 80%\nof the transplanted kidney pairs were eligible for the primary\nFrontiers in Immunology | www.frontiersin.org 5 May 2020 | Volume 11 | Article 631\n\nResch et al. Machine Perfusion for Marginal Organs\nanalysis and resulted in a similar eGFR at 1 year after transplant\nfor oxygenated (HMPO) and standard HMP. Analysis of all\ufffecause graft failure, however, showed a higher eGFR in HMPO\nthan in HMP. Overall graft loss was significantly lower in HMPO,\nleading the authors to suggest that HMPO improves 1-year\nkidney graft function when accounting for the beneficial effect\non allograft survival.\nIn contrast, in the field of pancreas transplantation,\ndynamic preservation technologies have not yet experienced\na breakthrough. Neither hypothermic nor NMP technologies\nare well-established, and SCS remains the standard procedure.\nA recent review outlined nine studies on HMP and 10 studies\non NMP. All of them were experimental; none of the human\npancreatic grafts were transplanted. However, the common\nconclusion of all of the published articles considered was that\nIRI, thrombosis, and morbidity after whole organ pancreas\ntransplantation might be reduced by both technologies (54–56).\nLiver transplantation can be regarded as the field in SOT that\nprimarily focuses on the development of preservation techniques,\ncurrently. The most commonly used perfusion types in the\ndaily routine are HOPE (hypothermic oxygenated perfusion),\nD-HOPE (d for dual oxygenation via hepatic artery and portal\nvein), and normothermic liver preservation. HOPE and D\ufffeHOPE studies have produced promising results, showing higher\nadenosine triphosphate (ATP) levels during preservation, less\nIRI, excellent graft survival after DCD liver transplantation,\nand a significantly reduced rate of bile duct injuries (57–60).\nThe Birmingham group was the first to publish its experiences\non livers undergoing HOPE and NMP consecutively (61).\nAlthough such livers were not transplanted, HOPE/NMP livers\ndeveloped less oxidative injury and inflammation and achieved\nenhanced metabolic recovery compared to livers undergoing\nNMP only (61). Liver NMP had its great appearance when the\nfirst prospective international multicenter RCT was published in\nApril 2018 (62). The trial on DBD and DCD livers with NMP\ndurations up to 24 h could show a significantly lower level of graft\ninjury, measured by reduced peak aspartate aminotransferase\n(AST), longer preservation times, and a 50% lower discard rate of\norgans compared to SCS. Bile duct complications and graft and\npatient survival were comparable in both groups (62).\nNMP has been shown to be beneficial in terms of immediate\ngraft function in all organ types in which it has been explored\nclinically: this includes the kidney (63–65), liver (62, 66), and\nthe lung (67, 68). The mechanism by which this occurs has not\nyet been conclusively proven, but the concept is that reperfusion\n(rewarming and oxygen delivery) in the artificial context of the\nperfusion circuit is beneficial by allowing recovery of cellular\nenergetics in the absence of the effector mechanisms needed for\nan acute inflammatory response (as in ischemia-reperfusion).\nORGAN PRESERVATION VS. ORGAN\nCONDITIONING VS. ORGAN REPAIR\nWith a new technology, the accompanying terminology is often\nsomewhat unspecific and unprecise in the beginning. This also\napplies to MP. It is paramount, however, to eventually clarify the\nterminology and define a uniformity for its correct use. Simply\nput, no other terminology than organ preservation would be\njustified at this point in the clinical application, since no targeted\nmeans for organ reconditioning (let alone repair) have been\nestablished. While this remains a glorious goal for the future,\nit also represents a significant legal and ethical challenge, since\nthe framework for the treatment of human organs remains to\nbe established. It remains entirely unclear whether extracorporal\norgan reconditioning and/or repair can be achieved. The hope\nand the hype are building on a growing body of experimental\ndata that indicates the feasibility of success or organ-specific\ntreatment. While this remains a most significant opportunity for\nthe field, we herein aim to adequately define organ preservation,\norgan (re-)conditioning, and organ treatment.\nOrgan Preservation—A Definition\nIt is interesting to note that no entry exists on organ preservation\nin Wikipedia (search, 21.08.2019), while a PubMed search\nyields 17189 entries (https://www.ncbi.nlm.nih.gov/pubmed/?\nterm=organ+preservation). It seems to be a term where the\ndefinition appears so clear and easy that it does not need to\nbe written down. Yet again, a uniform description of organ\npreservation is not straightforward since it is not necessarily\ndefined by organ retrieval, temperature, metabolic state, or any\nother sole condition. The one possible common ground for a\ndefinition is the purpose. Putting an organ into a state that\nallows later reactivation and restitution of its original function\nwith the aim of minimizing damage during the period of mal\ufffeand non-perfusion.\nOne essential limiting factor in the determination of the\nquality of the preservation method is the poor definition of\nendpoint for a clinical readout. Primary non-function (PNF)\nseems relatively well-defined at first glance, but the actual\ndefinitions leave room for interpretation. PNF does not indicate\nno organ function at all but rather a function insufficient to\nprevent/avoid longer-term organ replacement therapy.\nFor example, in liver transplantation, according to Ploeg\net al., PNF is defined by poor initial function, requiring re\ufffetransplantation or leading to death within 7 days after the\nprimary procedure without any identifiable cause of graft failure\n(69). Such parameters inevitably introduce non-specificity into\nthe definition. The call for the need for re-transplantation and\nthe risk for death are clinician’s calls built on medical facts, the\ninterpretation of the physician, and a projection based on the\nparameters and the experience of the doctor. Since alternatives\nare insufficiently well-established, studies relating preservation\nquality to PNF need to be read in the light of this limitation.\nWhile PNF is seen as a suitable measure for organ preservation,\nother factors impacting on the PNF rate need to be considered.\nThe fact that re-transplantation is a risk factor for PNF indicates\nthat the role of recipient factors may be underestimated (70).\nFurther to this, no clinical preservation trial can seriously build\non PNF as an endpoint, since the PNF rates reported more\nrecently are in the range of 2–5%. Primary poor function is even\nmore vague in its sufficiency as a definition and clinical endpoint.\nVery recently, Dutkowski et al. (71) critically reflected on the\ncurrent parameters used to determine the success of preservation\nFrontiers in Immunology | www.frontiersin.org 6 May 2020 | Volume 11 | Article 631\n\nResch et al. Machine Perfusion for Marginal Organs\nin liver transplantation trials. While the current practice might be\nreasonable in the sense that it is building on the combination of\nparameters currently best established, alternatives are needed but\nneed to be more formally established prior to considering them\nnew clinical standards.\nA Brief History\nThe original vision of organ preservation as formulated in 1813\nwas built on the continuation of circulation and blood supply\n(72). The substitution of blood with perfusion solutions led to\nprolonged successful preservation of tissues, as described by\nCarrell (73). While prolonged successful preservation of tissues\nseems plausible according to these early findings, the actual\nsuitability for transplantation remained to be established (72).\nSuccessful kidney preservation for 3 to 5 days was achieved by\nthe use of continuous perfusion with cooled, oxygenated blood\nor plasma (74). Since continuous warm perfusion, oxygenation,\nand nutrition of an organ during transportation was technically\nvery demanding, the alternative concept eventually surpassed MP\nin the 1960s. The chemical composition of advanced solutions\nfor hypothermic organ storage resulted in excellent short-term\npreservation with good outcomes after transplantation. As with\nany achievement, the good results are a blessing and a curse.\nWith patient and graft survival as the only hard endpoints for\nclinical trials, the room for improvement became very small—\nat least with standard criteria organs. The search for superior\ntechnologies found a platform for clinical realization only when\nthe results after transplantation became less convincing, with a\ngreater effect on bile ducts as a target for early damage in liver\ntransplantation (72, 75–77). The organ shortage, together with\nthe push to use lower-quality organs and organs with additional\ndamage as a result of DCD, triggered the clinical realization of\nMP in liver transplantation.\nCurrent Situation\nThe current status of organ preservation remains largely defined\nby SCS. The well-established and standardized procedures of\norgan storage in three sterile plastic bags filled with preservation\nsolution (bag 1) or saline/ringer lactate/other (bags 2/3) is well\ufffeestablished, with a relatively good understanding of the risk\naccumulating with the duration of preservation. The major\nadvantage of SCS is the safety of the procedure. Pretty much\nnothing can happen to an organ in plastic bags, on ice, in\na plastic container. The major limitations of this technique\nrelate to the fact that metabolism continues—even though\nat a very low rate—eventually resulting in the accumulation\nof succinate and reactive oxygen species (ROS) (78–81). The\nimmediate exposure to normothermia and oxygen results in an\ninflammatory response and organ-specific damage early after\ntransplantation. The mechanisms responsible for the eventual\norgan damage not only in organ transplantation but also in\nother diseases such as cardiac infarction and stroke are well\ufffeestablished but not are the focus of this review. The key question\nin the consideration of NMP as an alternative to SCS is how\neffectively the mechanisms leading to an IRI are interrupted\nthrough either immediate NMP or NMP following SCS. While\npreclinical evidence (81) and the phase II/III trial by Nasralla et al.\n(62) have delivered evidence suggesting that NMP is superior to\nSCS when applied immediately, the actual net benefit of NMP\nfollowing SCS remains to be more clearly established. While\na key elements in such assessments are the proper definition\nof and agreement in the community on suitable endpoints\nregarding the preservation quality, the accompanying benefits\nand alternative endpoints should not be overlooked. The major\nbenefit of NMP vs. SCS is the time gained with (as it appears)\na relatively safe prolongation of preservation times under close\nto physiological conditions. The ability to monitor the viability\nand function of the organ adds important parameters for decision\nmaking and significantly ameliorates the logistical challenges\nin transplantation. The benefit of transforming transplantations\ninto scheduled procedures has the potential to significantly\nenhance safety but also training and teaching in transplantation.\nOrgan Reconditioning\nThe term organ reconditioning is used in a rather unspecific\nmanner in our field. According to Wikipedia, reconditioning\nmeans “to restore to a functional state, or to a condition\nresembling the original” (search “reconditioning,” September\n2019). The way this can be read in reference to human organs\nis that no intervention aiming beyond the restoration of the\ncondition of an organ prior to retrieval (a) or beyond the optimal\n(naïve) condition of a healthy human organ (b)—depending\non how the term “original” is interpreted in this context—shall\nbe included. These two possible views already point toward\nvery different states of an organ. The way the term was used\nin the recent scientific transplant literature is in agreement\nwith repair of the immediate injury prior to and during organ\nretrieval and storage. The key element of reconditioning/repair\nas clinically applied at this point relates to the prevention of an\neventual ROS burst by mitochondria and subsequent disruption\nof ATP production, mitochondrial permeability transition pores,\nand danger-associated molecular pattern (DAMP) release upon\nreperfusion. An electron shift toward succinate and subsequent\nreverse electron transfer upon reperfusion is discussed as a\nmechanism of damage and target of therapy in liver HMP (82).\nNMP is suggested to mitigate post-reperfusion hyperfibrinolysis\n(83) and inflammation (84). While these may be indirect effects\nof NMP, the actual immediate therapeutic mechanisms (if any)\nmay be glycogen repletion and ATP regeneration (85). Whether\nthese mechanisms are a simple effect of the restoration of close\nto physiological conditions or specific for NMP remains to be\nestablished. It is likely, however, that the benefit of NMP is\nmostly defined by the replacement or shortening of SCS and the\nindirect effects on logistics and preparation, organ monitoring,\nand decision making. Further to this, NMP may emerge as a\nplatform enabling organ treatment, while it may not have a\ntherapeutic/reconditioning effect per se.\nOrgan Repair\nHuman organ repair, apparently, is treated as an equivalent\nto organ regeneration (Google search “human organ repair,”\nSeptember 2019). While the common understanding of organ\nrepair might be more mechanistic and that of organ regeneration\nmore biological, the distinction between the terms seems vague.\nAlbeit experimental, therapeutic interventions in lungs seem\nmost closely approaching possible clinical implementation (86).\nFrontiers in Immunology | www.frontiersin.org 7 May 2020 | Volume 11 | Article 631\n\nResch et al. Machine Perfusion for Marginal Organs\nBronchoalveolar lavage, surfactant replacement, and alveolar\nrecruitment maneuvers seem to positively affect organ tissue\nmorphology and organ function. A hurdle to clinical application\nmay be the legislation. Directive 2004/23/EC of the European\nParliament and of the Council “on setting standards of\nquality and safety for the donation, procurement, testing,\nprocessing, preservation, storage, and distribution of human\ntissues and cells” largely focusses on tissues and not organs\nbut represents an important reference. Since preservation times\ncan be prolonged with the technologies being developed and\nurgency may no longer serve as justification for immediate\nprocessing (transplantation) without quality assurance, the legal\nframework for tissues and cells could be applied to organs.\nThe second element of the legal consideration relates to the\nelement of organ therapy. Inevitably, the issues of responsibilities\nand possession require clarification for attempts to introduce\nex vivo human organ treatment into clinical application. As\nlong as an organ is labeled as discarded because it seems\nunsuitable for immediate transplantation, the organ will not\nbe allocated to an individual, and hence considerations of\npossession and responsibilities become less demanding. Once\norgans possibly suitable for immediate transplantation have been\ntreated for reasons such as quality improvement or possibly organ\nreconditioning, the allocation process may be completed and the\nfuture recipient indicated. If and how an individual can consent\nto interventions and/or a trial involving organs will eventually\nrequire clarification.\nDirective 2010/45/EU of the European Parliament and of\nthe Council of 7 July 2010 on standards of quality and safety\nof human organs intended for transplantation (https://eur-lex.\neuropa.eu/eli/dir/2010/53/oj) does not provide much guidance\nregarding this issue.\nMACHINE PERFUSION IN CLINICAL\nPRACTICE\nSCS is a simple, safe, and cheap method to preserve and transport\norgans, and it has been successfully applied over decades with\ngood outcomes in SCD organs. However, to date, the large\ndiscrepancy between patients on the waiting lists and available\ndonor organs has forced the transplant community to cope with\nthe demand by pushing the limits and expanding the donor\npool by accepting increasing numbers of marginal organs from\nECD and reestablish DCD programs (87). Importantly, ECD and\nDCD organs have been identified to be particularly prone to IRI.\nAlthough SCS can decelerate degradation of a preserved organ,\nespecially in high risk or marginal organs, limited applicability\nis the consequence (36, 78). Attempting to overcome this issue,\nseveral MP technologies have been developed and now find their\nway into clinical practice in SOT.\nHMP of the Liver\nLiver HMP has been translated from the experimental state to\nclinical reality over the last decade. In 2010, the first phase I\nprospective cohort study was published, reporting on 20 patients\nwho underwent liver transplantation of grafts preserved by non\ufffeoxygenated HMP. Outcomes were compared to a matched SCS\ncontrol group. HMP time ranged from 2 to 7 h, with a total\nCIT below 12 h. Except for a significantly lower peak serum\nAST in the HMP group, no further significant differences were\nobserved in regard to PNF, early allograft dysfunction, or graft\nand patient survival. However, clinical feasibility, as well as non\ufffeinferiority to SCS, was proven, making way for further studies\n(88). Five years thereafter, the same group showed promising\nresults by transplanting 31 ECD livers declined by the United\nNetwork for Organ Sharing (UNOS) region and preserved under\nhypothermic dynamic conditions at 4–8◦C. Compared to well\ufffematched SCS controls, significantly fewer biliary complications\nand shorter hospital stays were observed. This study represents a\nlandmark, since the effectiveness of MP was shown within the\nmost susceptible livers in the donor pool (89). The impact of\nHMP on marginal organs was further investigated by Dutkowski\net al. In an international matched-case analysis, 25 DCD livers\nwere subjected to HOPE and compared to matched SCS DCD\nlivers. HOPE resulted in a significant reduction of ischemic\ncholangiopathy (HOPE: 20% vs. SCS: 46%) as well as a significant\nimprovement of 1-year graft survival rates (90 vs. 69%) (58).\nThe beneficial effect of HMP on DCD grafts was confirmed by a\nprospective case-control liver transplantation study, comparing\n10 grafts with at least 2 h of DHOPE to 20 grafts without.\nAn 11-fold increase in cellular ATP during oxygenation was\ndocumented. In addition to good early graft function, both 6-\nmonth and 1-year graft survival were 100%, while 6-month graft\nsurvival and 1-year graft and patient survival in the control group\nwere 80, 67, and 85%, respectively (57). Moreover, the same\ngroup could demonstrate an attenuation of IRI-associated bile\nduct damage after transplantation of DCD end-ischemic DHOPE\nliver grafts (90).\nHOPE in particular has evolved to become a widely used\ntechnology, showing excellent longer-term results. Schlegel et al.\nprovided data on 5-year outcomes of patients receiving DCD\nlivers preserved with 1–2 h of end-ischemic HOPE (n = 50)\nand compared them to the equal numbers of DCD liver\ntransplants without HOPE or DBD liver transplantations. Five\ufffeyear outcomes of HOPE-treated DCD liver transplants were\nsimilar to those of DBD primary transplants and superior to those\nof untreated DCD liver transplants (HOPE DCD 94% vs. SCS\nDCD 78%) (91).\nNMP of the Liver\nPreserving an organ under physiological conditions is the ideal\ncondition to prevent deleterious effects of ischemia as well as\nIRI following SOT. Similar to HMP, NMP has recently been\nimplemented in clinical routine at a variety of centers. The\ntransfer from the experimental stage to clinical application\nwas first described by Ravikumar et al. in 2016. In this phase\n1 (first-in-man), non-randomized prospective trial, short-term\noutcomes of 20 recipients of NMP-perfused donor livers were\nmatched in a ratio of 1:2 to cold-stored livers. In the study group,\nlivers were preserved under normothermic conditions over the\nentire preservation period (ranging from 3.5 to 18.5 h). Except for\na significantly reduced peak serum AST in NMP-liver recipients,\nFrontiers in Immunology | www.frontiersin.org 8 May 2020 | Volume 11 | Article 631\n\nResch et al. Machine Perfusion for Marginal Organs\nno differences regarding short-term recipient survival, PNF rate,\nor early allograft dysfunction were observed. Therefore, the safety\nand feasibility of this dynamic preservation method could be\nconfirmed, opening the field for further clinical investigations\nwith major implications on logistics (66).\nFeasibility and reproducibility following transplantation were\nfurther underlined in a U.S. phase I non-randomized pilot study\n(92). However, this trial also pointed out that NMP of an organ\nis not a trivial procedure and runs the risk of graft loss if\nhuman/technical errors occur. Out of 10 procured livers, one\norgan had to be promptly discarded due to an unrecognized\nportal vein twist. The remaining nine organs (four DCD\nMaastricht class III, 5 DBD) were successfully transplanted, and\noutcomes were comparable to matched control liver transplant\nrecipients of SCS grafts. The proof of concept and feasibility gave\nway for larger-scale trials.\nNasralla et al. were first to perform RCT to test the efficacy\nof NMP vs. SCS. After informed consent had been obtained\nfrom the recipient, the allocated liver was either randomized to\nSCS or NMP. NMP was performed over the entire preservation\nperiod. Outcomes of 121 NMP-graft recipients were compared to\noutcomes from 101 well-matched SCS-graft recipients. The key\nfindings of this study were a significantly reduced peak serum\nAST, a significant reduction of post-reperfusion syndrome, and\na 72% lower adjusted odds rate of developing early allograft\ndysfunction (EAD) in the NMP liver recipients compared to\ncontrols. Furthermore, NMP of the liver graft resulted in\nincreased organ utilization with a 50% lower discard rate in this\ngroup (62).\nThe additional positive effect of NMP is the “almost”\nphysiological aspect of this method, which opens up new\npossibilities by means of organ assessment and organ selection.\nThis fact was a matter of investigation in an observational\nstudy, where livers considered unsuitable for transplantation\nas well as highest risk liver were included. In total, 47 livers\nwere biochemically assessed during the preservation, resulting\nin 39 liver transplants. Remarkably, two out of 19 livers deemed\nunsuitable were transplanted (93).\nIn summary, both HMP/HOPE and NMP are accepted\nand clinically established preservation methods, particularly\ninteresting in the preservation and preconditioning of high-risk\norgans. Especially in this organ category, including ECD and\nDCD livers, they have both been shown to be superior to SCS.\nWhether HMP/HOPE or HMP is superior to the other is still a\nmatter of debate since the two methods have not been correlated\nwith each other in clinical settings, and further RCTs are needed.\nHMP of the Kidney\nThe amount of clinical evidence for dynamic preservation of\nkidney grafts is rapidly increasing. Moers et al. were first to\nperform an international RCT on hypothermically perfused\nkidneys for transplantation. One kidney from 336 deceased\ndonors was randomly assigned to HMP, and the other to SCS. A\nreduced risk of DGF and improved graft survival in favor of MP\ufffepreserved organs was shown (47). These promising results were\nconfirmed in a subsequent RCT from the Eurotransplant region.\nJochmans et al. investigated the efficacy of HMP in preserving\nDCD kidneys. Similar to Moers et al., DCD kidneys were assigned\nin a 1:1 match to HMP or SCS, resulting in a total of 164 kidney\ntransplants (82 HMP vs. 82 SCS). HMP resulted in a significantly\nreduced DGF rate as well as better early graft function after\n1 month compared to SCS. However, 1-year graft survival was\ncomparable in both groups (49).\nFurthermore, in another RCT, kidneys were either preserved\nby HMP or SCS. In accordance with Moers as well as\nJochmans, the primary end-point was the occurrence of DGF.\nSecondary endpoints were primary non-function as well as graft\nsurvival. Both the risk of DGF and the incidence of non\ufffefunction were significantly reduced by HMP in their cohort.\nOne-year graft survival and function could be improved by\ndynamic cold graft preservation (52). Despite these findings,\nthe importance of different factors such as the impact of CIT\nand the combination of CIT with HMP have to be mentioned.\nCIT is a known independent risk factor for DGF. In order\nto investigate which kidney graft may further benefit from\nHMP prior to transplantation, Kox et al. analyzed prospectively\ncollected data from the “Machine Perfusion Trial.” A total of 752\nrenal transplants were included with 376 dynamically preserved\nkidneys and 376 statically preserved grafts. They identified CIT\nas an independent risk factor for DGF. Furthermore, HMP did\nnot prevent DGF if CIT exceeded 10 h (51).\nThe optimal timepoint for, as well as the optimal duration of,\nHMP is still a matter of debate. HMP can be used either as a\nprimary preservation method or in the end-ischemic phase as\na reconditioning tool. Matos et al. were able to show a faster\nrecovery of renal function if grafts were subjected to HMP prior\nto transplantation after a mean SCS period of 22 h. MP time was\nat least 6 h. However, this beneficial effect was limited to donors\nunder the age of 50, who represent a rather selective group (94).\nFurther studies followed, indicating a beneficial effect of MP in\nthe end-ischemic phase by displaying a reduction of DGF, as\nwell as an improved organ acceptance. This last positive trend is\nattributed mainly to the possibility of organ monitoring (95, 96).\nNMP of the Kidney\nNMP of the kidney may eventually resolve many issues\nrelated to damage induced by ischemic phases. The idea of\npreserving kidney grafts under almost physiological conditions\nwith the possibility of real-life assessment of the graft prior to\ntransplantation sounds intriguing. However, while the number\nof preclinical studies using animal models as well as discarded\nhuman kidneys is steadily increasing, evidence for NMP of\nthe kidney in a clinical setting is rather poor. Hosgood et al.\nwere first to transform preclinical experience into clinical reality\nby transplanting a 62-year-old ECD kidney into a 55-year old\nrecipient. After 11 h of SCS, the graft was perfused with a\nplasma-free red cell-based solution at 33.9◦C for 35 min prior\nto transplantation. Although a slow graft function was observed,\nthe patient remained dialysis free with a serum creatinine level\nof 132 µmol/L at 3 months post-transplantation. In contrast, the\nrecipient of the opposite kidney developed DGF (64). Based on\nthis first success, the Leicester group translated NMP into clinical\nreality on a larger scale. Eighteen ECD kidneys were subjected to\nNMP reconditioning prior to transplantation. The average NMP\nFrontiers in Immunology | www.frontiersin.org 9 May 2020 | Volume 11 | Article 631\n\nResch et al. Machine Perfusion for Marginal Organs\ntime was prolonged to 63 min. Outcomes were compared to 47\nmatched ECD kidneys preserved by SCS. In this study, NMP\nresulted in a significantly reduced DGF rate compared to controls\n(NMP: 5.6% vs. SCS: 36.2%). However, no differences could be\nobserved in regard to 1-year graft or patient survival (97).\nTaken together, HMP of the kidney has been shown to have its\nplace, especially in the preservation of marginal grafts, including\ngrafts from DCD and ECD, with superior outcomes in the early\nphase compared to SCS. However, CIT is still the limiting factor\ninfluencing short- as well as long-term outcomes. In contrast,\nalthough the amount of preclinical data is rapidly increasing,\nNMP is still in its early phase. However, feasibility and non\ufffeinferiority to SCS have been described at this early stage, and\nmulticenter RCTs are planned.\nMachine Preservation of the Pancreas\nIn contrast to the dynamic preservation of liver and kidney,\npancreatic MP is challenging. This is attributed to the physiologic\nas well as the anatomical characteristics of the pancreatic graft\n(98). MP of pancreatic grafts poses major challenges due to the\nsusceptibility of the organ to IRI-associated alterations, including\nacinar necrosis, edema formation, and endothelial disruption.\nThese factors in particular are recognized risk factors for early\ngraft pancreatitis and thrombosis, eventually resulting in graft\nloss (98, 99).\nIn contrast to the liver as well as the kidney, the\npancreas is characterized by a low-flow and low-pressure\nenvironment, which impedes the direct translation of the existing\nperfusion machines for use in dynamic pancreas preservation\n(100). However, the feasibility of pancreatic HMP has been\ndemonstrated in several experimental settings involving the\npreservation of porcine, dog, and discarded human pancreas\ngrafts (55, 101, 102). Although results are promising in this\nexperimental setting, clinical translation is still pending.\nTherefore, assessment and evaluation of a pancreatic graft\nprior to transplantation would be of the utmost importance,\nsince changes in donor demographics result in an increased\nneed for the acceptance of higher-risk grafts at high-volume\ncenters. However, MP of pancreatic grafts must still be considered\nexperimental at this stage.\nMachine Preservation of the Lung\nDue to pre- and peri-retrieval management and direct\nexamination of the donor organ by the explant surgeon, some\nextended criteria organs can be directly used with acceptable risk\nfor the recipient, but a notable number are rejected during the\nretrieval process. There is still a lack of clear decision criteria\nfor lung suitability for transplantation or attempts at lung\nreconditioning using an ex vivo lung perfusion (EVLP) (103).\nNeedless to say, MP could improve organ availability, which is\ncritically needed in the face of a waitlist mortality that is reported\nto be up to 30% depending on the allocation system (104).\nImportantly, ex vivo prolonged lung preservation resulted in\nsuccessful transplantation of high-risk donor lungs (105), and\nMP is now indispensable for evaluating lung graft quality from\nan uncontrolled DCD (106). Very promising data have come\nfrom experimental EVLP studies, which are outlined later in\nthis article.\nMachine Preservation of the Heart\nAt present, SCS of donor hearts remains the standard practice\nin most transplant units, whereas MP is limited to a few centers\nin the US and Europe. To date, only one device is available for\nclinical use—the Transmedic Organ Care System (OCS) Heart.\nAt mild hypothermia (34◦C), the system uses a combination of\ndonor blood and a proprietary solution as perfusate for the heart.\nIn 2014, heart NMP has led to the first distant procurement DCD\nheart transplantation. To date, over 100 DCD heart transplants\nhave been performed using a cardiac perfusion system (107), and\nMP of hearts exhibited safe preservation in RCTs (108).\nEX VIVO MONITORING OF ORGAN\nFUNCTION AND QUALITY\nCurrently, the decision as to whether organs are suitable for\ntransplantation is determined on the basis of more or less\nsubjective empirically established clinical parameters that have\nbeen shown to be associated with an increased rate of early\nallograft dysfunction or graft failure. Parameters such as donor\npast medical history, last known laboratory values, findings\nduring procurement, and other procurement variables such as\nexpected ischemia times primarily determine the acceptability\nof a graft. These parameters include prolonged warm ischemia\ntime (WIT) >30 min during DCD, prolonged CIT, and\nparenchymal alterations within the graft (e.g., steatosis, fibrosis,\narteriosclerosis). Viability testing and functional assessment\nprior to transplantation are likely to extend the utilization of\nsuboptimal or marginal organs (109–111).\nHMP is an alternative method to standard SCS for the\npreservation of organs. For different types of kidney grafts, HMP\noffers superior preservation compared with SCS. In terms of graft\nquality assessment during HMP, some biochemical parameters of\nthe released perfusate and hydrodynamic parameters are found\nto independently correlate with the outcome—a finding that may\nhelp clinicians in their decision making.\nIncreased Glutathione S-Tranferase (GST), N-acetyl-beta-D\ufffeglucosaminidase (NAG), heart-type fatty acid-binding protein\n(H-FABP), or lactate dehydrogenase (LDH) concentrations\nduring MP may serve as indicators for suboptimal graft quality.\nFurthermore, levels of redox-active iron measured in the\nperfusate have been correlated with DGF rates (112–114).\nMoreover, the measurement of vascular resistance during MP\nrepresents an additional and objective source of information\nthat can assist clinicians in their decision-making process.\nHigh vascular resistance as a hydrodynamic parameter has\nbeen shown to be associated with an increased risk of DGF\ndevelopment and predictive for 1-year graft failure (115–117).\nTaken together, to date, increased vascular resistance and high\ninjury marker concentrations in the perfusate are risk factors for\nDGF and helpful parameters, but they are not accurate enough\nto justify a decision for discard based on their interpretation\nalone (112–114, 117).\nFrontiers in Immunology | www.frontiersin.org 10 May 2020 | Volume 11 | Article 631\n\nResch et al. Machine Perfusion for Marginal Organs\nConcerning kidney NMP, a scoring system has been\ndeveloped by Hosgood and Nicholson. The decision on whether\nto transplant an NMP-kidney was based on macroscopic\nappearance, renal blood flow, and total urine output during\nNMP. The authors conclude that, currently, a high percentage of\nretrieved kidneys are being unnecessarily discarded (80, 118).\nCompared to the kidney, data on liver monitoring during\nHMP remain scarce, although recent publications suggest\npromising parameters. A correlation between the AST levels\nin the perfusate during HMP and the peak of AST after liver\ntransplantation has been described. Furthermore, during HMP\nof porcine livers, a cumulative release of Fatty Acid- Binding\nProtein 1 (FABP) or AST may be represented by a linear or\nlogarithmic equation, respectively. Each equation is characterized\nby a b-coefficient that is able to discriminate between livers likely\nto fail. Similarly, during HMP of human livers discarded for\ntransplantation, AST release in the perfusate could discriminate\nbetween livers suitable for transplantation and unsuitable ones.\nMore sophisticated methods to determine graft viability include\nevaluation of ATP content assessed by magnetic resonance\nimaging and spectroscopy (89, 91, 119–121). In this regard, van\nRijn et al. used cellular ATP content during oxygenated dual\n(arterial and portal perfusion) HMP as a viability marker for liver\ngrafts. Cellular ATP content correlated with biochemical function\nearly after transplantation (57).\nFurthermore, there is evidence that a decline in arterial flow\nin a pressure-controlled system of MP can be used as a marker\nfor decreasing graft viability. However, in general, it cannot be\nadvised to use flow values as an indicator of liver damage and\nviability during human liver MP (61, 91, 122).\nConcerning NMP of liver grafts, this technology has been\napplied with promising results for utilization and outcomes\n(62, 66, 92, 123–126), and the option for the assessment of\nliver viability during NMP has been highlighted. Imber et al.\n(127) suggested that bile production is directly associated with\nliver viability. Matton et al. (128) were able to show that a\nbiliary bicarbonate concentration greater than 18 mmol/L has a\nhigh negative predictive value in terms of histological bile duct\ninjury. Moreover, biliary pH greater than 7.48, biliary glucose\nconcentration less than 16 mmol/L, bile/perfusate glucose\nconcentration ratio less than 0.67, and biliary LDH concentration\nless than 3,689 U/L may serve as indicators for high biliary\nviability. Watson et al. (93) published their experience of\ntransplanting declined livers following NMP and graft viability\nassessment. They observed that NMP resulted in a reduced\nincidence of post-reperfusion syndrome and described biliary\npH as a predictive marker for post-transplant cholangiopathy.\nPerfusate lactate and transaminases and bile production during\nNMP were suggested by Op den Dries et al. (129) to serve\nas viability markers. Recently, Mergental et al. (130) published\nviability criteria (applicable within 3 h of perfusion) for livers\nconsidered suitable for transplantation. These include lactate\nclearance, bile production, PH- homeostasis, and stable pressure\nand flow dynamics of the graft.\nThere is growing evidence that hepatic ATP content may serve\nas a viability marker. In clinical studies, hepatic ATP levels prior\nto organ retrieval or during preservation correlated with primary\nliver function after transplantation. Bruisma et al. showed\nthat differences in mitochondrial respiration and restoration of\ncellular ATP contents are possible viability markers in the setting\nof NMP. Moreover, NMP offers the option to perform dynamic\nmetabolomic analyses in both bile samples and sequential liver\nbiopsies (111, 131).\nHowever, although these results seem impressive, none of the\nabove-mentioned viability markers have been validated in larger\nstudies, and the small numbers of patients included in the studies\nmake it difficult to draw robust conclusions.\nRegarding a potential viability assessment of human pancreas\ngrafts during HMP, flow indices and histological assessment\nof duodenal and pancreas-parenchyma biopsies throughout the\nperfusion duration have been proposed. Branchereau et al.\ndescribed an absence of edema, a decrease in resistance indices,\nand normal staining for insulin, glucagon, and somatostatin as\nmarkers for good graft quality (56, 101). Barlow et al. suggested\nthe assessment of amylase levels in the perfusate, fat infiltration\n(detected using standard histology), and exocrine pancreas\nfunction as criteria to assess graft viability during NMP (55).\nConcerning heart transplantation, organ assessment during\nNMP mainly relies on metabolic parameters and measurements\nof lactate levels in the aortic root and pulmonary artery. In the\nPROCEED II trial, three hearts were discarded due to rising total\nperfusate lactate concentrations. Histopathological examination\nshowed myocardial injury (necrosis, hemorrhage, scarring) or\nleft ventricular hypertrophy in those organs (108). Calculations\nof pressure volume loops in the left and right ventricle\nhave been described by switching the heart into a “working\nmode” during NMP. Based on pressure-volume (PV) loop data,\nend-systolic elastance could be calculated as a parameter for\nventricular contractility (44, 132). Due to complicated clinical\ninterpretation and difficulties in reproducibility, “working mode”\nhas been removed from the OCS perfusion module. Contrast\nechocardiography or intravascular ultrasound of coronary\narteries might emerge as tools for anatomical and mechanical\nassessment during NMP but have not been implemented in\nclinical routine so far.\nIn EVLP, assessment of the organ relies primarily on\nfunctional and macroscopic parameters, as has been reviewed\nrecently (103). Adequate gas exchange, stable hemodynamic\nand ventilatory parameters, macroscopic evaluation (absence\nof oedema), bronchoscopy (absence of purulent secretion and\nerythema of the bronchus), and deflation after endotracheal\ntube disconnection (collapse test) during the evaluation period\nare the commonly used decision criteria for acceptance of the\nlung. Yet these criteria are not standardized and differ between\ntransplant centers (103). As physiological parameters are in\nthe lead for decision making in EVLP, clinical single-center\nstudies assessed different biomarkers and metabolic parameters\nof the perfusate or the bronchioalveolar lavage to predict organ\nacceptance and occurrence of early prostaglandin D3 (PGD3).\nMachuca et al. (133) showed that high levels of endothelin-1 (ET\ufffe1) and Big ET-1 measured in perfusate samples have prognostic\nvalue for decline in the lung because of subsequent development\nof poor physiological performance. Subsequently, the same group\nsuggested IL-8 as a powerful predictor for early graft dysfunction\nFrontiers in Immunology | www.frontiersin.org 11 May 2020 | Volume 11 | Article 631\n\nResch et al. Machine Perfusion for Marginal Organs\n(134). Furthermore, IL-1β and IL-8 levels measured in the\nperfusate during EVLP were reported to inversely correlate with\nthe recipient oxygenation 24 h post-transplantation (135).\nInterestingly, given the observation that perfusate IL-1β and\nTNF-α at 30 min during EVLP were effective markers for\ndifferentiating between in-hospital survival and non-survival\npost-transplant, blocking the IL-1β pathway during EVLP\nmight reduce endothelial activation and subsequent neutrophil\nadhesion on reperfusion (136).\nIMMUNOLOGICAL ASPECTS OF\n(MARGINAL) ORGANS DURING MACHINE\nPERFUSION\nThe definition of marginal organs per se is a rather arbitrary one.\nThe most commonly used is the dichotomy between standard\ncriteria (SCD) and extended criteria donors (ECD), which is\nsimply discriminated by age and three donor criteria for the DBD\n(and, increasingly, DCD) kidney cohort (13, 137, 138). However,\nin clinical routine, it is not always straightforward to decide if an\norgan is within “standard criteria,” as there are plethora of factors\ninterfering with organ quality, i.e., estimated duration of CIT,\n(functional) WIT, or the grade of steatosis in liver and pancreas,\njust to mention a few.\nWhen we focus on the donor age only, a vast amount of\nliterature exists. There is evidence that the immunogenicity\nof elderly organs is increased, as it is believed that aging in\ncombination with injuries (i.e., brain death) induces a pro\ufffeinflammatory environment, which could lead to an activation\nof innate and adaptive immune responses (139–141). Aging\ninfluences cellular repair mechanisms, and it is known that\nthe number of MHC molecules present on the cellular\nsurface is increased by aged parenchymal cells (139). In\nexperimental studies, transplantation of elderly organs was\nassociated with a more powerful early immune response\ncompared to transplantation of younger ones. Recipients of\nsuch old grafts presented with a higher concentration of\neffector/memory T-cells with an increased alloreactivity, leading\nto acute rejection, which results in a particular high burden\nof damage for the older donor organ (140). Elderly organs do\nnot have the same repair mechanism capabilities, so the clinical\ndamage of acute rejection leaves a more severe defect, explaining\nthe increased rates of DGF and/or graft loss in this donor\ncohort (140, 142).\nAn alteration of immunogenicity in aging organs could be\none reason to focus on preservation techniques (143) such\nas HMP and NMP to learn more about the process or even\nto (re-)condition an organ for reperfusion in the recipient.\nDue to the fact that the reconstitution of a near-physiological\nenvironment might work best to study immune cells, the\nfollowing paragraphs will bring NMP into focus.\nHuman organs are equipped with a sophisticated resident\nimmune system. The kidney, for example, not only hosts tissue\uffferesident macrophages (144); the organ also harbors lymphocytes,\ninnate lymphoid cells, natural killer (NK) cells, natural killer T\n(NKT) cells, and γδ T cells (145). The residential immune cells\nof human organs remain in a balanced homeostatic state unless\nthey are stimulated—by the insult of brain death in an organ\ndonor, for example—when an immunological activation might be\ninduced. Such a response to a significant injury like brain death in\nan organ donor includes both local and systemic inflammation,\ncomprising cellular infiltrates and a cytokine storm (146).\nWith the current gold-standard preservation technologies such\nas SCS, the organs will be transplanted unchanged, in an\nimmunologically activated status, into recipients in whom\nalloantigens will trigger another immune response immediately\nafter reperfusion, presented by donor-derived antigen presenting\ncells to recipient T cells (147, 148). How important donor\ufffederived leukocytes are in the allorecognition and rejection\nprocesses was demonstrated by Lechler and Batchelor years\nago. They impressively showed that placing a rat kidney into\nan intermediate recipient before implanting it into the final\nrecipient could significantly prolong allograft survival. These\nexperiments demonstrated that “clearing” the organ of dendritic\ncells (DC), the “passenger leukocytes” responsible for activating\nrecipient T cells, by using the intermediate rat led to the desired\nsuccess (149, 150). “Parking” the organ in an interim host\nis not a feasible strategy for implementation in the clinical\nroutine. However, NMP offers the possibility to represent the\nintermediate recipient as a conditioning tool to achieve the same\nend result, as previously published by Lechler et al. (150). An\nex vivo setting might provide not only a more physiological\npreservation method but also the ability to assess the organ\nprior to transplantation and to investigate its immunological\ncharacteristics in isolation (42).\nOne of the leading groups analyzing marginal and SCD\norgans after ex vivo perfusion is the Manchester group around\nFildes and Stone. Already in 2015, they compared the clinical\noutcome of patients transplanted with marginal donor lungs\nafter undergoing EVLP compared to standard transplantation\nof acceptable lungs (151). Despite having transplanted marginal\nlungs, there was no significant difference in the clinical outcome\nup to 12 months after transplantation concerning the overall\nincidence of acute rejection and the number of treated infection\nepisodes (151). This work was followed by a study on passenger\nleukocyte migration from donor lungs into the recipients and\nthe effects of donor leukocyte depletion prior to transplantation\nusing EVLP (152). In this experimental work using a porcine\nmodel, Stone et al. illustrated that donor leukocyte transfer\ninto the recipient was reduced by EVLP and therefore reduces\ndirect allorecognition and T-cell priming (152). The same group\ntransferred their experience to an ex vivo NMP model to analyze\ndonor-derived leukocytes in a porcine renal transplantation\nmodel. Stone et al. were able to demonstrate that an inflammatory\ncytokine storm and the release of mitochondrial and genomic\nDNA were initiated in the NMP circuit prior to transplantation.\nHowever, the renal function was not impacted at all after\ntransplanting those organs. They suggest that NMP could be used\nto immunodeplete and to saturate the capacity of inflammation\nof donor kidneys before transplanting them (152). Amin et al.\n(153) evaluated the impact of a post-SCS-preservation flush on\nthe inflammatory burden of a limb allograft (a porcine model for\nvascularized composite allotransplantation). The venous effluent\nFrontiers in Immunology | www.frontiersin.org 12 May 2020 | Volume 11 | Article 631\n\nResch et al. Machine Perfusion for Marginal Organs\nafter flushing the limbs following either 2 or 6 h of SCS comprised\na large population of viable leukocytes, significant concentrations\nof pro-inflammatory cytokines and mitochondrial DNA. These\nresults support the hypothesis that flushing or dynamically\npreserving the organs prior to transplantation impacts the\ninflammatory burden otherwise transferred to the recipient upon\nreperfusion unchanged (153).\nLiver NMP has recently been implemented as a standard\nprocedure in the United Kingdom and been shown to improve\norgan utilization and post-transplant outcomes following phase I\nand phase III prospective randomized trials (62, 66). Jassem et al.\n(84) transplanted, compared, and analyzed 12 NMP-preserved\nlivers against 27 SCS-preserved livers to assess the impact of NMP\non IRI, necrosis, platelet deposition, neutrophil infiltration, and\nthe degree of steatosis after NMP or SCS pre- and post-perfusion.\nTheir results showed that, with NMP, there were altered gene\ufffeexpression profiles of liver tissue from pro-inflammation to\nregeneration, reduced numbers of interferon gamma (IFNγ)-\nand interleukin-17-producing T cells, and an enlarged pool\nof regulatory T cells. In addition, NMP liver tissue was less\nnecrotic and apoptotic compared to SCS-preserved livers, with\nless neutrophils infiltrating the periportal area (84).\nOverall, with the clinical and experimental evidence gained\nso far for the field of SOT, dynamic preservation methods -\nand NMP in particular - provide the means to introduce\norgan conditioning so as to lower immunogenicity as well as\npro-inflammatory markers while ensuring the promotion of\ngraft regeneration.\nIMMUNOMODULATION DURING MP\nMachine perfusion (MP) offers a previously non-existent link\nbetween basic and clinical science. The opportunity to treat an\norgan during preservation creates a new field of translational\nresearch. In this context, one of the main targets that can now\nbe addressed is the modulation of the immunogenicity of a\nspecific graft. In theory, such immunomodulation could allow the\nobviation of lifelong immunosuppression or even forge a path to\nthe holy grail in transplantation—the achievement of tolerance.\nImportantly, MP offers a platform to apply immunomodulatory\nstrategies that have been elucidated in in vitro or preclinical\nmodels in the past.\nIn the existing literature, three major such strategies have\nbeen investigated, which are discussed herein. One of the\nmost promising is the application of stem or progenitor\ncells, with the potential to suppress immunogenicity and help\nrepair injured tissue. Another strategy is the administration of\nanti-inflammatory/immunomodulatory drugs and agents, and,\nfinally, gene transduction by adenoviral vector gene delivery.\nThe majority of studies have been carried out under\nnormothermic conditions. However, oxygenated perfusion of\na graft per se seems not only to protect against preservation\ninjury but also to downregulate the immune system and\nblunt the alloimmune response, as was shown in a rodent\nmodel of hypothermic oxygenated perfusion (HOPE) (154). In\nparticular, the constant flow of fluids in the vessels during MP is\nregarded to promote the expression of vasoprotective endothelial\ngenes, alleviating the microcirculatory failure associated with\nischemia-reperfusion injury (IRI) (155–157). On the other\nhand, when it comes to additional modification, it is perfusion\nunder normothermic conditions that seems to represent the\nideal platform, since NMP grants a physiological metabolic\nstate (81, 158–160).\nMany of the ongoing studies addressing the field of\nimmunomodulation during MP are carried out in a porcine\nsetting, as pigs have appropriate size and anatomy as well\nas immunologic characteristics (161). Whereas, much of our\nknowledge on organ preservation is derived from various animal\nstudies (162), the porcine model above all has now evolved\nas an ideal model, making ex vivo porcine organ perfusion\nmodels a suitable platform for translational transplant research.\nAccording to a recent review, in 2017, 22 articles discussed ex\nvivo porcine organ perfusion within the context of transplant\npreservation surgery (162), but the number of articles has steadily\nincreased since then. However, also in this setting, it is important\nto highlight potential limitations when translating experiences\nbetween species (158).\nStem and Progenitor Cells\nSeveral candidate cells have been investigated, including stromal\nmesenchymal cells (MSCs), induced adult pluripotent stem cells,\nfetal stem cells from placenta, membranes, amniotic fluid, and\numbilical cord, and hematopoietic cells (163). Among these,\nMSCs have been reported to represent the most promising cell\nsubset. MSCs are multipotent cells that are found in adult tissues,\nincluding adipose tissue and bone marrow, where they support\nfunction and repair. Importantly, they have been shown to abate\nimmune and inflammatory responses via the release of paracrine\neffectors (164, 165).\nThis circumstance has led to a broad application of MSCs in\na variety of pathologies. Therefore, a prerequisite for research\non MSCs is the agreement on criteria that define these cells and\nallow comparability between studies. The International Society\nfor Cellular Therapy has established the minimum criteria that\na cell must meet to be considered an MSC: first, an MSC\nmust be plastic-adherent when maintained in standard culture\nconditions; second, an MSC must express CD105, CD73, and\nCD90 and lack expression of CD45, CD34, CD14 or CD11b,\nCD79alpha or CD19, and HLA-DR surface molecules; third, an\nMSC must differentiate into cell types of mesodermal origin in\nvitro (166, 167).\nThe fact that MSCs are known for their potent anti\ufffeinflammatory and regenerative capacities, combined with the\nfinding that a therapeutic effect can be achieved with either\nautologous or allogeneic MSCs (168), has led to the conduction of\nseveral studies investigating whether their application is feasible\nin the context of MP. However, the detailed mechanisms by\nwhich MSCs exert their anti-inflammatory and regenerative\npotential have not yet been depicted. The main mechanism of\naction is supposed to rely on secreted mediators. Therefore, an\nappropriate timeframe is likely to be required for these cells\nin order to mediate beneficial effects (169). This hypothesis is\nunderlined by the findings of a recent study in a porcine ex\nvivo lung perfusion (EVLP) model. Twelve-hour NMP of DCD\nlungs with intravascular delivery of MSCs (150 × 106\n) resulted\nin reduced levels of interleukin-8 (IL-8), a pro-inflammatory\nFrontiers in Immunology | www.frontiersin.org 13 May 2020 | Volume 11 | Article 631\n\nResch et al. Machine Perfusion for Marginal Organs\ncytokine associated with reperfusion injury, along with increased\nlevels of vascular endothelial growth factor (VEGF) (170). The\nfact that IL-8 was suppressed is of particular note, since MSCs are\nknown to produce the anti-inflammatory cytokine IL-10, which\nin turn has been reported to significantly suppress the production\nof IL-8 in a dose-dependent manner (169).\nIn human kidneys, Brasile et al. demonstrated actual\nrenal regeneration mediated by MSCs under 24 h of ex vivo\nnormothermic perfusion. The authors used an exsanguinous\nmetabolic support (EMS) tissue-engineering platform to study\nfive pairs of kidney allografts from DCD donors. Whereas, one\nkidney of each pair solely underwent perfusion, the partner\nkidney was EMS perfused with MSC (1 × 10). Indeed, a reduced\ninflammatory response was observed along with increased\nsynthesis of adenosine triphosphate and growth factors and a\nnormalization of the cytoskeleton and mitosis (171).\nEven though these findings are promising, more insight\nneeds to be gained regarding the effects of the NMP milieu\non MSC themselves and the comparability between human\nand porcine data. These aspects were highlighted in a kidney\nNMP model, showing that while the suspension conditions\nreduced the viability of porcine MSC by 40% in both perfusion\nfluid and culture medium, the viability of human MSC was\nreduced by suspension conditions by 15% in perfusion fluid,\nand no differences were found in survival in culture medium.\nFurthermore, it was shown that a freeze-thawing process\nimpaired survival, metabolism, and the ability to adhere to\nendothelial cells. The authors concluded that NMP conditions\naffect MSC but show sufficient support of their function and\nsurvival that MSC administration through NMP should be\nconsidered, and secondly that slight differences in the behavior\nof porcine and human MSC need to be taken into account (158).\nAnother recent analysis focused on the characteristics of\nculture-expanded MSC, investigating heir viability and homin\nduring NMP. Kidneys were perfused for 7 h in the presence\nof 105\n, 106\n, or 107 human adipose tissue-derived MSC. Intact\nMSCs were detected in the lumen of glomerular capillaries,\nbut only in the 107 MSC group. After a rapid decline of cell\nnumbers during NMP, only a small portion of the MSCs were\nintact, and these were clustered in a minority of glomeruli. Apart\nfrom outlining the complexity of MSC therapy during MP, the\nauthors concluded that “an exciting new window of opportunity\nmight emerge to actively pre-condition isolated organs in a fully\ncontrolled setting and in the absence of an immune response, before\nthey are transplanted” (172).\nIt is noteworthy that such promising findings have recently\nled to the creation of the international “MePEP consortium”\n(173) in order to study this novel modality of treatment in\npreparation for human trials. Therefore, more findings on MSC\nand immunomodulation can be expected in the near future.\nAnti-inflammatory Agents\nAlternatively, pharmacologic interventions to decrease\nimmunogenicity or prevent recurrent disease can be applied\nduring MP. The seemingly most obvious strategy to influence the\ninflammatory profile is the delivery of anti-inflammatory agents\ndirectly into the machine perfusion circuit, treating the liver\nex vivo during the preservation period to obviate the need for\nlifelong immunosuppression or to improve long-term outcomes\nseparate from the physiological quality of the organ at the time\nof transplantation (174).\nSeveral targets for potential agents have been identified.\nAmongst these is TNF-alpha, one of the most potent\nproinflammatory cytokines, which is released in response\nto and has been implicated in the pathogenesis of IRI (175, 176).\nTherefore, in a recent clinical HMP study, it was hypothesized\nthat the administration of the TNF-α inhibitor etanercept\ncould improve outcomes following kidney transplantation.\nHowever, no significant differences were found concerning\nkidney machine perfusion parameters, including average flow\nand vascular resistance, nor did the authors observe significant\nchanges regarding DGF, rejection episodes, or allograft survival\n(177). However, it has to be taken in mind that this study was\ncarried out under hypothermic conditions. Although possible in\nother machine-perfusion techniques, NMP seems to be ideal, as\nactive metabolism permits graft intervention and modification\nduring preservation, circumstances that are not present in\nHMP (178).\nMore promising data come from a porcine study in\nwhich a variety of agents were added to act at different\nlevels. Prostaglandin E1, a prostacyclin analog with vasodilator,\nantiplatelet, fibrinolytic, and several other anti-inflammatory\nproperties, was continuously administered. In addition, n\ufffeacetylcysteine was added due to its free radical scavenging\nproperties. Sevoflurane was administered due to its protective\nproperties on endothelial cells, and carbon monoxide was\nadded with the objective of improving vasodilatation and\nreducing inflammation. Indeed, during a 3-day follow-up after\ntransplantation, this treatment resulted in lower AST levels as\nwell as lower levels of IL-6, tumor necrosis factor α (TNF- α),\nand galactosidase and increased IL-10 levels (179).\nOther candidate markers for modulation during MP are anti\ufffeinflammatory receptors. In this context, the adenosine A2A\nreceptor downregulates inflammation, including the suppression\nof CD4+ and CD8+ T cells, and increases endothelial cell\nnitric oxide (174). Since experiences in rabbit experiments\nshowed that adenosine A2A receptor activation can diminish\nIRI (180), a subsequent study evaluated whether treatment with\nan adenosine A2A receptor agonist could be beneficial during\nnormothermic ex vivo lung perfusion (EVLP). Indeed, EVLP\nwith targeted A2AR agonist treatment could attenuate IRI after\ntransplantation of DCD donor lungs subjected to prolonged 12-h\ncold preservation in a preclinical porcine model (181).\nAdenoviral Vector Gene Delivery\nAs cellular metabolism is preserved during normothermic\nperfusion, it represents a potential platform for effective gene\ntransduction in a specific graft (182). To test this hypothesis\nin donor lungs, Yeung et al. used a porcine model of\nEVLP and treated them with an E1-, E3-deleted adenoviral\nvector encoding either green fluorescent protein (GFP) or the\nimmunosuppressive interleukin-10 (IL-10). They observed a\ndecreased expression of inflammatory cytokines such as IL-1,\nFrontiers in Immunology | www.frontiersin.org 14 May 2020 | Volume 11 | Article 631\n\nResch et al. Machine Perfusion for Marginal Organs\nTNF-α, and IL-6, as well as attenuation of the alloimmune\nresponse following transplantation (174, 182).\nThis finding is also of particular interest, since the delivery\nof adenoviral vectors could result in a prompt innate immune\nresponse by macrophages, recruiting circulating neutrophils,\nwhich in turn propagate the inflammatory response. Moreover,\nin the transplant setting, this preexisting inflammation could\npotentiate subsequent IRI (182, 183). Therefore, the authors\ncompared in vivo and ex vivo administration and showed that\ndonor lung is superior to in vivo delivery since it leads to less\nvector-associated inflammation (182).\nConcerning the kidney, already in 2002, proof of principle of\na similar technique had been reported by Brasile et al., using a\nrecombinant adenovirus, Ad5, CMV5 GFP encoded with green\nfluorescence protein. They achieved effective transfection and\nsynthesis during 24 h of ex vivo normothermic perfusion (184).\nOnly recently has a normothermic ex vivo organ perfusion\ndelivery method for cardiac transplantation gene therapy been\nreported. Adenoviral vector transduction was utilized to deliver\nparticles of an Adenoviral firefly luciferase vector with a\ncytomegalovirus (CMV) promotor to porcine donor hearts\nduring NMP and prior to heterotopic implantation. Along with\na high copy number of vector genomic DNA in transplanted\nhearts, there was no evidence of vector DNA in either the\nrecipient’s native heart or liver, substantiating the applicability\nand safety of the protocol.\nThese findings make it likely that this technology could be\nfeasible for other organ systems as well. A wide variety of\ninteresting genes could be targeted. As has been reviewed lately\n(159), promising possibilities arise when translating the findings\nof rodent models using adenoviruses expressing CTLA4Ig (185)\nto the setting of NMP; also, NMP could be used to deliver\ngene therapies that induce cytoprotection against IRI, such as\nmyr-Akt (159, 186).\nOutstandingly, Figueiredo et al. recently showed that antigen\nsilencing is feasible during NMP. In a porcine model of\nlung NMP, short hairpin RNAs were delivered by lentiviral\nvectors, successfully reducing the immunogenicity of the\nlung by silencing MHC expression on the endothelium.\nThe authors concluded that the decrease in immunogenicity\ncarries the potential to generate immunologically invisible\norgans to counteract the burden of rejection and\nimmunosuppression (187).\nOrgan Reconditioning and Repair\nRecent experimental data primarily focusing on marginal livers\nfurthermore suggested that NMP offers a platform for organ\nreconditioning and repair.\nImpressive data from Birmingham, UK, showed that livers\ndiscarded due to pronounced steatosis could be effectively treated\nwith defatting agents during 6 h of NMP. Tissue triglycerides\nwere lowered by 38% and macrovesicular steatosis by 40%, which\nwas associated with a down-regulation of inflammatory marker\nexpression relevant for oxidative injury and activation of immune\ncells (CD14; CD11b), combined with reduced inflammatory\ncytokines in the perfusate (TNFα, IL-1β) (188). In addition,\narterial vasospasm can be modulated by the application of ET-1\nantagonists, prostacyclin analog, or calcium channel antagonists\nduring NMP (189). Furthermore, NMP can be used for the\ndirect and efficient application of antiviral agents, as shown in\na porcine NMP model, in which Miravirsen, an inhibitor of\nhepatitis C virus (HCV) replication, produced improved uptake\ncompared to SCS control livers. The authors concluded that\nthis approach might offer a future strategy to prevent HCV\nreinfection after liver transplantation (190). Likewise, HCV\ufffeinfected human donor lungs could effectively be treated during\nshort-time EVLP via physical viral clearance combined with\ngermicidal light-based therapies (191).\nIn summary, immunomodulation in the context of MP seems\nto offer a plethora of novel strategies. A series of porcine\nand human studies distinctively underline its effectiveness and\nfeasibility. However, as formulated in a recent review (191, 192),\nthe studies conducted so far just scratch the surface of conceivable\ninterventions. In particular, NMP provides an ideal platform\nfor immunomodulatory modifications. The next step will be the\ntranslation of findings from preclinical and rodent models as well\nas HMP trials into the setting of NMP.\nTHE IMMEDIATE FUTURE IN THE\nTRANSPLANTATION OF MARGINAL\nORGANS\nMuch speculation about the changes in transplantation is\ncurrently energizing the field. The conceptual approach of\nextracorporal organ preservation and monitoring begs for\nspeculation about organ reconditioning, repair, and treatment.\nWhile these are all valid considerations and perfectly reasonable\nhopes, the implementation of machine perfusion is the first\nstep. Immediate and widespread adoption of HMP and NMP is\nunlikely since this technology does not immediately improve the\noutcome with regard to the primary endpoints in transplantation:\npatient and graft survival. Authority approval and market entry\nare largely based on secondary endpoints such as delayed\ngraft function (DGF, kidney) or primary poor function (PPF,\nliver), which are considered to serve as surrogates for improved\nlong-term results. The conceptual limitation with surrogates is,\nhowever, that the predictive value is not uniformly robust or\nformally established and immediately reproducible. The DGF\nrate, for example, in kidneys from DCD donors is high, but\nthe predictive value of DFG in these cases is low (193). The\ndefinition of PPF is mostly based on high AST/ALT values early\nafter transplantation. While these parameters indicate hepatocyte\ndamage, correlation with the eventual outcome is very limited\n(194). Hence, the adoption of the technology is possibly built\non the wish for innovation and the belief in the value of the\ntime gain with NMP. Preliminary data on HOPE in recent and\nongoing trials indicate a possible benefit in organ survival. If such\nan outcome is eventually formally achieved, the arguments for\nimplementation will be more substantial.\nFor clinical implementation, several regional and center\nfactors play an important role. First, the retrieval team\nmay be different from the team eventually performing the\ntransplantation. Even if the retrieval team is familiar with the\ntechnology, the preparation of the graft prior to NMP (more\nthan HMP) is more substantial and more definitive for the\nFrontiers in Immunology | www.frontiersin.org 15 May 2020 | Volume 11 | Article 631\n\nResch et al. Machine Perfusion for Marginal Organs\nfate of the graft. Hence, in a system with longer-distance organ\nexchange, additional steps and a new routine would need to be\nestablished. The technology and the shifting of the work of the\nbacktable procedure to the retrieving team need to be considered.\nThe alternative approach where the organ is transferred to\nthe recipient center and is then machine perfused is currently\nbeing pursued, but data indicating the actual advantage of this\napproach are lacking (195). For now, NMP serves as a technology\nthat allows one important asset in surgery to be gained: time.\nThe value of time and flexibility is dependent on the regional\ncircumstances but may hold great potential for easing the surgery\nlogistics, working hours, and surgical training but also gives rise\nto higher risks of nighttime procedures. The actual value of time\nin this context, however, requires further attention and needs to\nbe better defined.\nThe consideration of longer-term organ preservation under\nnormothermic conditions further carries the challenge of\ndefining the responsibilities for managing and monitoring the\norgans. Eventually, the working place description of health\ncare workers involved in this will require adoption and formal\ntraining. Standard operating procedures (SOP) and safety\nparameters need to be established for a wider spread use of\nthe technology. It is likely that the advanced technological\nrequirements and the need for 24-h availability of knowhow and\npersonnel would favor the establishment of regional hubs for MP.\nDespite the hype in the field, the clinical adoption of MP is\nslow. In addition to the above-mentioned factors, the lack of\nreimbursement is a stringent limitation in many regions. For the\ntechnology to be reimbursed, the authorities will require hard\nfacts. Hence, the path to more widespread clinical use might\nbe long, and the focus should remain on the demonstration of\nsuperiority regarding the most relevant clinical endpoints.\nOne major important step toward collective advancement in\nthis field would be the definition of data points during and\nafter MP and the establishment of registries for coordinated\ndata collection. Such data points should include the definition\nand terminology of the various time points and actions such as\ncold flush and storage prior to MP, temperature and flow during\nMP, parameters indicating metabolic function and bile/urine\nproduction during MP, second flush, second cold ischemia time,\nand others. One of the hurdles in improving NMP is the\nlarge number of variables added to preservation. Identifying\nthe relevance of individual parameters will require attention\nto the details of the procedure and adequate data collection\nand handling. To the knowledge of the authors, no routine\ndata collection and no consensus toward data points have been\nestablished at present.\nThe decision-making process in MP is relatively arbitrary\nsince the data collected during MP are suggestive but not formally\nestablished as quality-defining parameters. Since the decision to\ntransplant an organ or not is extremely meaningful, great care\nneeds to be applied in the process, and detailed documentation\nof the reasoning for decision making should be carried out. A\ngreater effort toward orchestrated data collection could help to\nstreamline and eventually enhance the robustness of the decision\ufffemaking process.\nThe preference for MP to be used for the preservation\nof marginal organs results from the greater need for\norgan assessment and the greater potential benefit of better\npreservation. This might be particularly true and relevant for\norgans from uncontrolled DCDs, where the circumstances and\nthe accumulated damage to the organs might be less clear. The\nvalue of an additional assessment under these conditions is not\nonly meaningful with respect to the number of additional organs\nfor transplantation but also for preventing the transplantation\nof organs that are severely damaged. While the assessment\nof this subject would be highly valuable and is much needed,\nthe behavior of the investigators in the NMP trial by Nasralla\net al. indicates the limitations and conflicts observed with this\napproach (62). Since the trial cannot be fully blinded, the bias\ngenerated by the fact that a technology is used that is deemed\nsuperior and the data generated during MP define a deviation in\nthe behavior of the decision makers.\nTHE FAR FUTURE OF (MARGINAL) ORGAN\nTRANSPLANTATION\nThe fantasies building on the realization of extracorporal organ\npreservation under physiological conditions are currently\nfuelling hopes that this technology could facilitate tissue\nregeneration, organ repair, immunomodulation, xenograft\nhumanification, and many other things. MP as a platform\nmay impact medicine far beyond transplantation and delivers\na unique chance to alter the treatment of organ failure and\norgan disease. Between the imagination and the realization\nof medical advancement stands a mountain of work and an\nas yet unknown but probably large number of technical and\nmethodological challenges. An important initial goal is the\nexpansion of the duration of MP and the establishment of\nan equilibrium of the condition of the organ. Preservation\nof organs for several days will likely require additional\nmodifications from the currently existing technologies.\nPreservation of the acid-base equilibrium, nutrition organ\nweight-induced pressure, electrolyte shift, hemolysis, and many\nother challenges may require closer attention. A tissue- and/or\ncell-specific and targeted treatment is a realistic consideration,\nand proof of concept trials indicate the feasibility of this\napproach (196, 197). The treatment and replacement of\ndamaged or displaced elements of organs may evolve as a\nnew discipline and help the field to make the leap to serve\none of the greatest unmet needs: The effective treatment of\ndamaged organs.\nAUTHOR CONTRIBUTIONS\nTR and SS conceived and designed the study and wrote the\nmanuscript. BC, RO, AW, JD, CK, and CB wrote sections of the\nmanuscript. DO and MG helped to revise the manuscript, tables\nand figures. All the authors contributed to manuscript revision,\nread, and approved the submitted version.\nFUNDING\nThis study was supported by a funding from the ‘‘Dr. Gabriel\nSalzner Stiftung’’ to SS and DO.\nFrontiers in Immunology | www.frontiersin.org 16 May 2020 | Volume 11 | Article 631\n\nResch et al. Machine Perfusion for Marginal Organs\nREFERENCES\n1. Black CK, Termanini KM, Aguirre O, Hawksworth JS, Sosin M. Solid\norgan transplantation in the 21(st) century. Ann Transl Med. (2018) 6:409.\ndoi: 10.21037/atm.2018.09.68\n2. Bezinover D, Saner F. Organ transplantation in the modern era. BMC\nAnesthesiol. (2019) 19:32. doi: 10.1186/s12871-019-0704-z\n3. Karam S, Wali RK. Current state of immunosuppression: past,\npresent, and future. Crit Rev Eukaryot Gene Expr. (2015) 25:113–34.\ndoi: 10.1615/CritRevEukaryotGeneExpr.2015011421\n4. Bodzin AS, Baker TB. Liver transplantation today: where we are now and\nwhere we are going. Liver Transpl. (2018) 24:1470–5. doi: 10.1002/lt.25320\n5. Toniutto P, Bitetto D, Fornasiere E, Fumolo E. Challenges and future\ndevelopments in liver transplantation. Minerva Gastroenterol Dietol. (2019)\n65:136–52. doi: 10.23736/S1121-421X.18.02529-1\n6. Young KA, Dilling DF. The future of lung transplantation. Chest. (2019)\n155:465–73. doi: 10.1016/j.chest.2018.08.1036\n7. Nathan SD. The future of lung transplantation. Chest. (2015) 147:309–16.\ndoi: 10.1378/chest.14-1748\n8. Veroux M, Corona D, Veroux P. Kidney transplantation: future challenges.\nMinerva Chir. (2009) 64:75–100.\n9. Pesavento TE. Kidney transplantation in the context of renal replacement\ntherapy. Clin J Am Soc Nephrol. (2009) 4:2035–9. doi: 10.2215/CJN.055\n00809\n10. Kobashigawa JA. The future of heart transplantation. Am J Transplant.\n(2012) 12:2875–91. doi: 10.1111/j.1600-6143.2012.04223.x\n11. Ojo AO, Hanson JA, Meier-Kriesche H, Okechukwu CN, Wolfe RA,\nLeichtman AB, et al. Survival in recipients of marginal cadaveric\ndonor kidneys compared with other recipients and wait-listed transplant\ncandidates. J Am Soc Nephrol. (2001) 12:589–97.\n12. Reese PP, Caplan AL, Kesselheim AS, Bloom RD. Creating a medical, ethical,\nand legal framework for complex living kidney donors. Clin J Am Soc\nNephrol. (2006) 1:1148–53. doi: 10.2215/CJN.02180606\n13. Metzger RA, Delmonico FL, Feng S, Port FK, Wynn JJ, Merion RM.\nExpanded criteria donors for kidney transplantation. Am J Transplant.\n(2003) 3(Suppl. 4):114–25. doi: 10.1034/j.1600-6143.3.s4.11.x\n14. Schamberger B, Lohmann D, Sollinger D, Stein R, Lutz J. Association of\nkidney donor risk index with the outcome after kidney transplantation\nin the eurotransplant senior program. Ann Transplant. (2018) 23:775–81.\ndoi: 10.12659/AOT.909622\n15. Favi E, Puliatti C, Iesari S, Monaco A, Ferraresso M, Cacciola R. Impact of\ndonor age on clinical outcomes of primary single kidney transplantation\nfrom maastricht category-III donors after circulatory death. Transplant\nDirect. (2018) 4:e396. doi: 10.1097/TXD.0000000000000835\n16. Domagala P, Gorski L, Wszola M, Kieszek R, Diuwe P, Goralski P,\net al. Successful transplantation of kidneys from deceased donors\nwith terminal acute kidney injury. Ren Fail. (2019) 41:167–74.\ndoi: 10.1080/0886022X.2019.1590209\n17. Bronchard R, Durand L, Legeai C, Cohen J, Guerrini P, Bastien O. Brain-dead\ndonors on extracorporeal membrane oxygenation. Crit Care Med. (2017)\n45:1734–41. doi: 10.1097/CCM.0000000000002564\n18. Chen CL, Wu ST, Kao CC, Cha TL, Lee CY, Tang SH. Short-term result\nof renal transplantation using extracorporeal membrane oxygenation\ufffesupported brain-dead donors. Transplant Proc. (2014) 46:1061–3.\ndoi: 10.1016/j.transproceed.2013.10.062\n19. Gravel MT, Arenas JD, Chenault R II, Magee JC, Rudich S, Maraschio M,\net al. Kidney transplantation from organ donors following cardiopulmonary\ndeath using extracorporeal membrane oxygenation support. Ann Transplant.\n(2004) 9:57–8.\n20. de Boer JD, Putter H, Blok JJ, Alwayn IPJ, van Hoek B, Braat AE. Predictive\ncapacity of risk models in liver transplantation. Transplant Direct. (2019)\n5:e457. doi: 10.1097/TXD.0000000000000896\n21. Rana A, Jie T, Porubsky M, Habib S, Rilo H, Kaplan B, et al. The\nsurvival outcomes following liver transplantation (SOFT) score: validation\nwith contemporaneous data and stratification of high-risk cohorts. Clin\nTransplant. (2013) 27:627–32. doi: 10.1111/ctr.12181\n22. McCormack L, Quinonez E, Rios MM, Capitanich P, Goldaracena N,\nCabo JK, et al. Rescue policy for discarded liver grafts: a single-centre\nexperience of transplanting livers ’that nobody wants’. HPB. (2010) 12:523–\n30. doi: 10.1111/j.1477-2574.2010.00193.x\n23. Jimenez-Romero C, Caso Maestro O, Cambra Molero F, Justo Alonso I,\nAlegre Torrado C, Manrique Municio A, et al. Using old liver grafts for\nliver transplantation: where are the limits? World J Gastroenterol. (2014)\n20:10691–702. doi: 10.3748/wjg.v20.i31.10691\n24. D’Errico A, Riefolo M, Serenari M, De Pace V, Santandrea G, Monica M, et al.\nThe histological assessment of liver fibrosis in grafts from extended criteria\ndonors predicts the outcome after liver transplantation: a retrospective study.\nDig Liver Dis. (2019). 52:185–9. doi: 10.1016/j.dld.2019.05.013\n25. Liu Z, Jia J, Ning H, Que S, Zhou L, Zheng S. Systematic evaluation of\nthe safety threshold for allograft macrovesicular steatosis in cadaveric liver\ntransplantation. Front Physiol. (2019) 10:429. doi: 10.3389/fphys.2019.00429\n26. Mihaylov P, Mangus R, Ekser B, Cabrales A, Timsina L, Fridell J,\net al. Expanding the donor pool with the use of extended criteria\ndonation after circulatory death livers. Liver Transpl. (2019) 25:1198–208.\ndoi: 10.1002/lt.25462\n27. Muthusamy AS, Vaidya A. Expanding the donor pool in pancreas\ntransplantation. Curr Opin Organ Transplant. (2011) 16:123–7.\ndoi: 10.1097/MOT.0b013e328341b123\n28. Boggi U, Del Chiaro M, Vistoli F, Signori S, Vanadia Bartolo T, Gremmo\nF, et al. Pancreas transplantation from marginal donors. Transplant Proc.\n(2004) 36:566–8. doi: 10.1016/j.transproceed.2004.02.031\n29. Proneth A, Schnitzbauer AA, Schenker P, Wunsch A, Rauchfuss F,\nArbogast H, et al. Extended pancreas donor program-the EXPAND\nstudy: a prospective multicenter trial testing the use of pancreas\ndonors older than 50 years. Transplantation. (2018) 102:1330–7.\ndoi: 10.1097/TP.0000000000002122\n30. Kopp WH, Lam HD, Schaapherder AFM, Huurman VAL, van der Boog\nPJM, de Koning EJP, et al. Pancreas transplantation with grafts from\ndonors deceased after circulatory death: 5 years single-center experience.\nTransplantation. (2018) 102:333–9. doi: 10.1097/TP.0000000000001940\n31. Axelrod DA, Sung RS, Meyer KH, Wolfe RA, Kaufman DB.\nSystematic evaluation of pancreas allograft quality, outcomes and\ngeographic variation in utilization. Am J Transplant. (2010) 10:837–45.\ndoi: 10.1111/j.1600-6143.2009.02996.x\n32. Smits JM, De Pauw M, de Vries E, Rahmel A, Meiser B, Laufer G, et al. Donor\nscoring system for heart transplantation and the impact on patient survival.\nJ Heart Lung Transplant. (2012) 31:387–97. doi: 10.1016/j.healun.2011.\n11.005\n33. Weiss ES, Allen JG, Kilic A, Russell SD, Baumgartner WA, Conte JV,\net al. Development of a quantitative donor risk index to predict short\ufffeterm mortality in orthotopic heart transplantation. J Heart Lung Transplant.\n(2012) 31:266–73. doi: 10.1016/j.healun.2011.10.004\n34. Orens JB, Boehler A, de Perrot M, Estenne M, Glanville AR, Keshavjee S,\net al. A review of lung transplant donor acceptability criteria. J Heart Lung\nTransplant. (2003) 22:1183–200. doi: 10.1016/S1053-2498(03)00096-2\n35. Collins GM, Bravo-Shugarman M, Terasaki PI. Kidney preservation for\ntransportation. Initial perfusion and 30 hours’ ice storage. Lancet. (1969)\n2:1219–22. doi: 10.1016/S0140-6736(69)90753-3\n36. Collard CD, Gelman S. Pathophysiology, clinical manifestations, and\nprevention of ischemia-reperfusion injury. Anesthesiology. (2001) 94:1133–8.\ndoi: 10.1097/00000542-200106000-00030\n37. Oniscu GC, Randle LV, Muiesan P, Butler AJ, Currie IS, Perera MT, et al.\nIn situ normothermic regional perfusion for controlled donation after\ncirculatory death–the United Kingdom experience. Am J Transplant. (2014)\n14:2846–54. doi: 10.1111/ajt.12927\n38. Watson CJE, Hunt F, Messer S, Currie I, Large S, Sutherland A, et al. In situ\nnormothermic perfusion of livers in controlled circulatory death donation\nmay prevent ischemic cholangiopathy and improve graft survival. Am J\nTransplant. (2019) 19:1745–58. doi: 10.1111/ajt.15241\n39. Hessheimer AJ, Coll E, Torres F, Ruiz P, Gastaca M, Rivas JI,\net al. Normothermic regional perfusion vs. super-rapid recovery in\ncontrolled donation after circulatory death liver transplantation. J Hepatol.\n(2019) 70:658–65. doi: 10.1016/j.jhep.2018.12.013\n40. Demiselle J, Augusto JF, Videcoq M, Legeard E, Dube L, Templier F, et al.\nTransplantation of kidneys from uncontrolled donation after circulatory\ndetermination of death: comparison with brain death donors with or without\nFrontiers in Immunology | www.frontiersin.org 17 May 2020 | Volume 11 | Article 631\n\nResch et al. Machine Perfusion for Marginal Organs\nextended criteria and impact of normothermic regional perfusion. Transpl\nInt. (2016) 29:432–42. doi: 10.1111/tri.12722\n41. Kerforne T, Allain G, Giraud S, Bon D, Ameteau V, Couturier P, et al.\nDefining the optimal duration for normothermic regional perfusion in the\nkidney donor: a porcine preclinical study. Am J Transplant. (2019) 19:737–\n51. doi: 10.1111/ajt.15063\n42. Weissenbacher A, Vrakas G, Nasralla D, Ceresa CDL. The future of\norgan perfusion and re-conditioning. Transpl Int. (2019) 32:586–97.\ndoi: 10.1111/tri.13441\n43. Ruiz P, Gastaca M, Bustamante FJ, Ventoso A, Palomares I, Prieto M, et al.\nFavorable outcomes after liver transplantation with normothermic regional\nperfusion from donors after circulatory death: a single-center experience.\nTransplantation. (2019) 103:938–43. doi: 10.1097/TP.0000000000002391\n44. Messer SJ, Axell RG, Colah S, White PA, Ryan M, Page AA, et al.\nFunctional assessment and transplantation of the donor heart after\ncirculatory death. J Heart Lung Transplant. (2016) 35:1443–52.\ndoi: 10.1016/j.healun.2016.07.004\n45. Ayorinde JO, Webb GJ, Richards JA. To NRP or not to NRP, that is the\nquestion. in response to: favorable outcomes after liver transplantation\nwith normothermic regional perfusion from donors after circulatory\ndeath: a single-center experience. Transplantation. (2019). 103:938–43.\ndoi: 10.1097/TP.0000000000002877\n46. Taylor R, Allen E, Richards JA, Goh MA, Neuberger J, Collett D, et al.\nSurvival advantage for patients accepting the offer of a circulatory death liver\ntransplant. J Hepatol. (2019) 70:855–65. doi: 10.1016/j.jhep.2018.12.033\n47. Moers C, Smits JM, Maathuis MH, Treckmann J, van Gelder F,\nNapieralski BP, et al. Machine perfusion or cold storage in deceased\ufffedonor kidney transplantation. N Engl J Med. (2009) 360:7–19.\ndoi: 10.1056/NEJMoa0802289\n48. Moers C, Pirenne J, Paul A, Ploeg RJ, Machine Preservation Trial\nStudy Group. Machine perfusion or cold storage in deceased\ufffedonor kidney transplantation. N Engl J Med. (2012) 366:770–1.\ndoi: 10.1056/NEJMc1111038\n49. Jochmans I, Moers C, Smits JM, Leuvenink HG, Treckmann J, Paul A,\net al. Machine perfusion versus cold storage for the preservation of kidneys\ndonated after cardiac death: a multicenter, randomized, controlled trial. Ann\nSurg. (2010) 252:756–64. doi: 10.1097/SLA.0b013e3181ffc256\n50. Jochmans I, O’Callaghan JM, Pirenne J, Ploeg RJ. Hypothermic machine\nperfusion of kidneys retrieved from standard and high-risk donors. Transpl\nInt. (2015) 28:665–76. doi: 10.1111/tri.12530\n51. Kox J, Moers C, Monbaliu D, Strelniece A, Treckmann J, Jochmans I, et al.\nThe benefits of hypothermic machine preservation and short cold ischemia\ntimes in deceased donor kidneys. Transplantation. (2018) 102:1344–50.\ndoi: 10.1097/TP.0000000000002188\n52. Treckmann J, Moers C, Smits JM, Gallinat A, Maathuis MH, van Kasterop\ufffeKutz M, et al. Machine perfusion versus cold storage for preservation of\nkidneys from expanded criteria donors after brain death. Transpl Int. (2011)\n24:548–54. doi: 10.1111/j.1432-2277.2011.01232.x\n53. Jochmans I, Akhtar MZ, Nasralla D, Kocabayoglu P, Boffa C, Kaisar M,\net al. Past, present, and future of dynamic kidney and liver preservation and\nresuscitation. Am J Transplant. (2016) 16:2545–55. doi: 10.1111/ajt.13778\n54. Prudhomme T, Kervella D, Le Bas-Bernardet S, Cantarovich D,\nKaram G, Blancho G, et al. Ex situ perfusion of pancreas for whole\ufffeorgan transplantation: is it safe and feasible? A systematic review.\nJ Diabetes Sci Technol. (2020) 14:120–34. doi: 10.1177/19322968198\n69312\n55. Barlow AD, Hamed MO, Mallon DH, Brais RJ, Gribble FM, Scott MA,\net al. Use of ex vivo normothermic perfusion for quality assessment of\ndiscarded human donor pancreases. Am J Transplant. (2015) 15:2475–82.\ndoi: 10.1111/ajt.13303\n56. Branchereau J, Renaudin K, Kervella D, Bernadet S, Karam G, Blancho\nG, et al. Hypothermic pulsatile perfusion of human pancreas: preliminary\ntechnical feasibility study based on histology. Cryobiology. (2018) 85:56–62.\ndoi: 10.1016/j.cryobiol.2018.10.002\n57. van Rijn R, Karimian N, Matton APM, Burlage LC, Westerkamp AC, van\nden Berg AP, et al. Dual hypothermic oxygenated machine perfusion in liver\ntransplants donated after circulatory death. Br J Surg. (2017) 104:907–17.\ndoi: 10.1002/bjs.10515\n58. Dutkowski P, Polak WG, Muiesan P, Schlegel A, Verhoeven CJ, Scalera\nI, et al. First comparison of hypothermic oxygenated perfusion versus\nstatic cold storage of human donation after cardiac death liver transplants:\nan international-matched case analysis. Ann Surg. (2015) 262:764–70.\ndoi: 10.1097/SLA.0000000000001473\n59. Muller X, Schlegel A, Wurdinger M, Wendt M, Kron P, Eshmuminov D,\net al. Can hypothermic oxygenated perfusion (HOPE) rescue futile DCD\nliver grafts? HPB. (2019) 21:1156–65. doi: 10.1016/j.hpb.2019.01.004\n60. Schlegel A, Muller X, Dutkowski P. Hypothermic liver perfusion. Curr Opin\nOrgan Transplant. (2017) 22:563–70. doi: 10.1097/MOT.0000000000000472\n61. Boteon YL, Laing RW, Schlegel A, Wallace L, Smith A, Attard J, et al.\nCombined hypothermic and normothermic machine perfusion improves\nfunctional recovery of extended criteria donor livers. Liver Transpl. (2018)\n24:1699–715. doi: 10.1002/lt.25315\n62. Nasralla D, Coussios CC, Mergental H, Akhtar MZ, Butler AJ, Ceresa\nCDL, et al. A randomized trial of normothermic preservation in liver\ntransplantation. Nature. (2018) 557:50–6. doi: 10.1038/s41586-018-0047-9\n63. Hosgood SA, Nicholson ML. The first clinical case of intermediate ex vivo\nnormothermic perfusion in renal transplantation. Am J Transplant. (2014)\n14:1690–2. doi: 10.1111/ajt.12766\n64. Hosgood SA, Nicholson ML. First in man renal transplantation after\nex vivo normothermic perfusion. Transplantation. (2011) 92:735–8.\ndoi: 10.1097/TP.0b013e31822d4e04\n65. Hosgood SA, Nicholson ML. An assessment of urinary biomarkers\nin a series of declined human kidneys measured during ex vivo\nnormothermic kidney perfusion. Transplantation. (2017) 101:2120–5.\ndoi: 10.1097/TP.0000000000001504\n66. Ravikumar R, Jassem W, Mergental H, Heaton N, Mirza D, Perera MT, et al.\nLiver transplantation after ex vivo normothermic machine preservation: a\nphase 1 (First-in-Man) clinical trial. Am J Transplant. (2016) 16:1779–87.\ndoi: 10.1111/ajt.13708\n67. Cotter EKH, Banayan JM, Song TH, Chaney MA, Ko H, Cantu E, et al. Lung\nin a box: ex vivo lung transplantation. J Cardiothorac Vasc Anesth. (2018)\n32:1971–81. doi: 10.1053/j.jvca.2017.12.019\n68. Cypel M, Yeung JC, Keshavjee S. Introducing the concept of semielective\nlung transplantation through the use of ex vivo lung perfusion. J Thorac\nCardiovasc Surg. (2018) 156:2350–2. doi: 10.1016/j.jtcvs.2018.05.056\n69. Ploeg RJ, D’Alessandro AM, Knechtle SJ, Stegall MD, Pirsch JD,\nHoffmann RM, et al. Risk factors for primary dysfunction after liver\ntransplantation–a multivariate analysis. Transplantation. (1993) 55:807–13.\ndoi: 10.1097/00007890-199304000-00024\n70. Uemura T, Randall HB, Sanchez EQ, Ikegami T, Narasimhan G, McKenna\nGJ, et al. Liver retransplantation for primary nonfunction: analysis\nof a 20-year single-center experience. Liver Transpl. (2007) 13:227–33.\ndoi: 10.1002/lt.20992\n71. Dutkowski P, Guarrera JV, de Jonge J, Martins PN, Porte RJ, Clavien\nPA. Evolving trends in machine perfusion for liver transplantation.\nGastroenterology. (2019) 156:1542–7. doi: 10.1053/j.gastro.2018.12.037\n72. Jing L, Yao L, Zhao M, Peng LP, Liu M. Organ preservation: from the past to\nthe future. Acta Pharmacol Sin. (2018) 39:845–57. doi: 10.1038/aps.2017.182\n73. Carrel A. The culture of whole organs : I. Technique of the culture of the\nthyroid gland. J Exp Med. (1937) 65:515–26. doi: 10.1084/jem.65.4.515\n74. Belzer FO, Ashby BS, Dunphy JE. 24-hour and 72-hour preservation of\ncanine kidneys. Lancet. (1967) 2:536–8. doi: 10.1016/S0140-6736(67)90498-9\n75. Cameron AM, Barandiaran Cornejo JF. Organ preservation review: history\nof organ preservation. Curr Opin Organ Transplant. (2015) 20:146–51.\ndoi: 10.1097/MOT.0000000000000175\n76. Kim J, Zimmerman MA, Hong JC. Emerging innovations in liver\npreservation and resuscitation. Transplant Proc. (2018) 50:2308–16.\ndoi: 10.1016/j.transproceed.2018.03.080\n77. Guibert EE, Petrenko AY, Balaban CL, Somov AY, Rodriguez JV, Fuller BJ.\nOrgan preservation: current concepts and new strategies for the next decade.\nTransfus Med Hemother. (2011) 38:125–42. doi: 10.1159/000327033\n78. Chouchani ET, Pell VR, Gaude E, Aksentijevic D, Sundier SY, Robb EL, et al.\nIschaemic accumulation of succinate controls reperfusion injury through\nmitochondrial ROS. Nature. (2014) 515:431–5. doi: 10.1038/nature13909\n79. Schneeberger S. Life of a liver awaiting transplantation. Nature. (2018)\n557:40–1. doi: 10.1038/d41586-018-04458-w\nFrontiers in Immunology | www.frontiersin.org 18 May 2020 | Volume 11 | Article 631\n\nResch et al. Machine Perfusion for Marginal Organs\n80. Weissenbacher A, Hunter J. Normothermic machine perfusion\nof the kidney. Curr Opin Organ Transplant. (2017) 22:571–6.\ndoi: 10.1097/MOT.0000000000000470\n81. Brockmann J, Reddy S, Coussios C, Pigott D, Guirriero D, Hughes D, et al.\nNormothermic perfusion: a new paradigm for organ preservation. Ann Surg.\n(2009) 250:1–6. doi: 10.1097/SLA.0b013e3181a63c10\n82. Schlegel A, Muller X, Dutkowski P. Hypothermic machine preservation\nof the liver: state of the art. Curr Transplant Rep. (2018) 5:93–102.\ndoi: 10.1007/s40472-018-0183-z\n83. Ionescu MI, Tillakaratne S, Hodson J, Gunson B, Nasralla D, Pinter\nCarvalheiro da Silva Boteon A, et al. Normothermic machine\nperfusion enhances intraoperative hepatocellular synthetic capacity: a\npropensity score-matched analysis. Transplantation. (2019) 103:e198–207.\ndoi: 10.1097/TP.0000000000002720\n84. Jassem W, Xystrakis E, Ghnewa YG, Yuksel M, Pop O, Martinez-Llordella\nM, et al. Normothermic machine perfusion (NMP) inhibits proinflammatory\nresponses in the liver and promotes regeneration. Hepatology. (2019) 70:682–\n95. doi: 10.1002/hep.30475\n85. Ceresa CDL, Nasralla D, Coussios CC, Friend PJ. The case for normothermic\nmachine perfusion in liver transplantation. Liver Transpl. (2018) 24:269–75.\ndoi: 10.1002/lt.25000\n86. Guenthart BA, O’Neill JD, Kim J, Queen D, Chicotka S, Fung\nK, et al. Regeneration of severely damaged lungs using an\ninterventional cross-circulation platform. Nat Commun. (2019) 10:1985.\ndoi: 10.1038/s41467-019-09908-1\n87. Parsons RF, Guarrera JV. Preservation solutions for static cold storage of\nabdominal allografts: which is best? Curr Opin Organ Transplant. (2014)\n19:100–7. doi: 10.1097/MOT.0000000000000063\n88. Guarrera JV, Henry SD, Samstein B, Odeh-Ramadan R, Kinkhabwala M,\nGoldstein MJ, et al. Hypothermic machine preservation in human liver\ntransplantation: the first clinical series. Am J Transplant. (2010) 10:372–81.\ndoi: 10.1111/j.1600-6143.2009.02932.x\n89. Guarrera JV, Henry SD, Samstein B, Reznik E, Musat C, Lukose TI, et al.\nHypothermic machine preservation facilitates successful transplantation of\n“orphan” extended criteria donor livers. Am J Transplant. (2015) 15:161–9.\ndoi: 10.1111/ajt.12958\n90. van Rijn R, van Leeuwen OB, Matton APM, Burlage LC, Wiersema\ufffeBuist J, van den Heuvel MC, et al. Hypothermic oxygenated machine\nperfusion reduces bile duct reperfusion injury after transplantation of\ndonation after circulatory death livers. Liver Transpl. (2018) 24:655–64.\ndoi: 10.1002/lt.25023\n91. Schlegel A, Muller X, Kalisvaart M, Muellhaupt B, Perera M, Isaac JR,\net al. Outcomes of DCD liver transplantation using organs treated by\nhypothermic oxygenated perfusion before implantation. J Hepatol. (2019)\n70:50–7. doi: 10.1016/j.jhep.2018.10.005\n92. Bral M, Gala-Lopez B, Bigam D, Kneteman N, Malcolm A, Livingstone\nS, et al. Preliminary single-center canadian experience of human\nnormothermic ex vivo liver perfusion: results of a clinical trial. Am J\nTransplant. (2017) 17:1071–80. doi: 10.1111/ajt.14049\n93. Watson CJE, Kosmoliaptsis V, Pley C, Randle L, Fear C, Crick K, et al.\nObservations on the ex situ perfusion of livers for transplantation. Am J\nTransplant. (2018) 18:2005–20. doi: 10.1111/ajt.14687\n94. Matos ACC, Requiao Moura LR, Borrelli M, Nogueira M, Clarizia G, Ongaro\nP, et al. Impact of machine perfusion after long static cold storage on delayed\ngraft function incidence and duration and time to hospital discharge. Clin\nTransplant. (2018) 32. doi: 10.1111/ctr.13130\n95. Tedesco-Silva HJ, Mello Offerni JC, Ayres Carneiro V, Ivani de Paula\nM, Neto ED, Brambate Carvalhinho Lemos F, et al. Randomized trial\nof machine perfusion versus cold storage in recipients of deceased\ndonor kidney transplants with high incidence of delayed graft function.\nTransplant Direct. (2017) 3:e155. doi: 10.1097/TXD.00000000000\n00672\n96. Gallinat A, Amrillaeva V, Hoyer DP, Kocabayoglu P, Benko T, Treckmann\nJW, et al. Reconditioning by end-ischemic hypothermic in-house machine\nperfusion: a promising strategy to improve outcome in expanded\ncriteria donors kidney transplantation. Clin Transplant. (2017) 31.\ndoi: 10.1111/ctr.12904\n97. Nicholson ML, Hosgood SA. Renal transplantation after ex vivo\nnormothermic perfusion: the first clinical study. Am J Transplant. (2013)\n13:1246–52. doi: 10.1111/ajt.12179\n98. Karcz M, Cook HT, Sibbons P, Gray C, Dorling A, Papalois V. An\nex-vivo model for hypothermic pulsatile perfusion of porcine pancreata:\nhemodynamic and morphologic characteristics. Exp Clin Transplant.\n(2010) 8:55–60.\n99. Wright FH, Wright C, Ames SA, Smith JL, Corry RJ. Pancreatic allograft\nthrombosis: donor and retrieval factors and early postperfusion graft\nfunction. Transplant Proc. (1990) 22:439–41.\n100. Hamaoui K, Papalois V. Machine perfusion and the pancreas:\nwill it increase the donor pool? Curr Diab Rep. (2019) 19:56.\ndoi: 10.1007/s11892-019-1165-y\n101. Hamaoui K, Gowers S, Sandhu B, Vallant N, Cook T, Boutelle M,\net al. Development of pancreatic machine perfusion: translational\nsteps from porcine to human models. J Surg Res. (2018) 223:263–74.\ndoi: 10.1016/j.jss.2017.11.052\n102. Leemkuil M, Lier G, Engelse MA, Ploeg RJ, de Koning EJP, Hart N’t, et al.\nHypothermic oxygenated machine perfusion of the human donor pancreas.\nTransplant Direct. (2018) 4:e388. doi: 10.1097/TXD.0000000000000829\n103. Possoz J, Neyrinck A, Van Raemdonck D. Ex vivo lung perfusion prior to\ntransplantation: an overview of current clinical practice worldwide. J Thorac\nDis. (2019) 11:1635–50. doi: 10.21037/jtd.2019.04.33\n104. Gottlieb J. Lung allocation. J Thorac Dis. (2017) 9:2670–4.\ndoi: 10.21037/jtd.2017.07.83\n105. Cypel M, Yeung JC, Liu M, Anraku M, Chen F, Karolak W, et al.\nNormothermic ex vivo lung perfusion in clinical lung transplantation. N Engl\nJ Med. (2011) 364:1431–40. doi: 10.1056/NEJMoa1014597\n106. Van Raemdonck D, Rega F, Rex S, Neyrinck A. Machine perfusion\nof thoracic organs. J Thorac Dis. (2018) 10(Suppl. 8):S910–23.\ndoi: 10.21037/jtd.2018.02.85\n107. Chew HC, Macdonald PS, Dhital KK. The donor heart and organ\nperfusion technology. J Thorac Dis. (2019) 11(Suppl. 6):S938–45.\ndoi: 10.21037/jtd.2019.02.59\n108. Ardehali A, Esmailian F, Deng M, Soltesz E, Hsich E, Naka Y, et al. Ex\ufffevivo perfusion of donor hearts for human heart transplantation (PROCEED\nII): a prospective, open-label, multicentre, randomised non-inferiority trial.\nLancet. (2015) 385:2577–84. doi: 10.1016/S0140-6736(15)60261-6\n109. Merion RM, Pelletier SJ, Goodrich N, Englesbe MJ, Delmonico FL. Donation\nafter cardiac death as a strategy to increase deceased donor liver availability.\nAnn Surg. (2006) 244:555–62. doi: 10.1097/01.sla.0000239006.33633.39\n110. Reiniers MJ, van Golen RF, van Gulik TM, Heger M. Reactive oxygen and\nnitrogen species in steatotic hepatocytes: a molecular perspective on the\npathophysiology of ischemia-reperfusion injury in the fatty liver. Antioxid\nRedox Signal. (2014) 21:1119–42. doi: 10.1089/ars.2013.5486\n111. Bruinsma BG, Sridharan GV, Weeder PD, Avruch JH, Saeidi N, Ozer S, et al.\nMetabolic profiling during ex vivo machine perfusion of the human liver. Sci\nRep. (2016) 6:22415. doi: 10.1038/srep22415\n112. Jochmans I, Moers C, Smits JM, Leuvenink HG, Treckmann J, Paul A,\net al. The prognostic value of renal resistance during hypothermic machine\nperfusion of deceased donor kidneys. Am J Transplant. (2011) 11:2214–20.\ndoi: 10.1111/j.1600-6143.2011.03685.x\n113. Jochmans I, Pirenne J. Graft quality assessment in kidney transplantation:\nnot an exact science yet! Curr Opin Organ Transplant. (2011) 16:174–9.\ndoi: 10.1097/MOT.0b013e3283446b31\n114. Dare AJ, Pettigrew GJ, Saeb-Parsy K. Preoperative assessment\nof the deceased-donor kidney: from macroscopic appearance\nto molecular biomarkers. Transplantation. (2014) 97:797–807.\ndoi: 10.1097/01.TP.0000441361.34103.53\n115. Moers C, Varnav OC, van Heurn E, Jochmans I, Kirste GR, Rahmel\nA, et al. The value of machine perfusion perfusate biomarkers for\npredicting kidney transplant outcome. Transplantation. (2010) 90:966–73.\ndoi: 10.1097/TP.0b013e3181f5c40c\n116. Nyberg SL, Baskin-Bey ES, Kremers W, Prieto M, Henry ML, Stegall\nMD. Improving the prediction of donor kidney quality: deceased\ndonor score and resistive indices. Transplantation. (2005) 80:925–9.\ndoi: 10.1097/01.TP.0000173798.04043.AF\nFrontiers in Immunology | www.frontiersin.org 19 May 2020 | Volume 11 | Article 631\n\nResch et al. Machine Perfusion for Marginal Organs\n117. Impedovo SV, Martino P, Palazzo S, Ditonno P, Tedeschi M, Giangrande F,\net al. Value of the resistive index in patient and graft survival after kidney\ntransplant. Arch Ital Urol Androl. (2012) 84:279–82.\n118. Hosgood SA, Barlow AD, Hunter JP, Nicholson ML. Ex vivo normothermic\nperfusion for quality assessment of marginal donor kidney transplants. Br J\nSurg. (2015) 102:1433–40. doi: 10.1002/bjs.9894\n119. Liu Q, Vekemans K, Iania L, Komuta M, Parkkinen J, Heedfeld V, et al.\nAssessing warm ischemic injury of pig livers at hypothermic machine\nperfusion. J Surg Res. (2014) 186:379–89. doi: 10.1016/j.jss.2013.07.034\n120. Liu Q, Monbaliu D, Vekemans K, Peeters R, De Keyzer F, Dresselaers\nT, et al. Can apparent diffusion coefficient discriminate ischemic from\nnonischemic livers? A pilot experimental study. Transplant Proc. (2007)\n39:2643–6. doi: 10.1016/j.transproceed.2007.08.003\n121. Liu Q, Vekemans K, van Pelt J, Pirenne J, Himmelreich U, Heedfeld\nV, et al. Discriminate liver warm ischemic injury during hypothermic\nmachine perfusion by proton magnetic resonance spectroscopy:\na study in a porcine model. Transplant Proc. (2009) 41:3383–6.\ndoi: 10.1016/j.transproceed.2009.09.025\n122. Obara H, Matsuno N, Enosawa S, Shigeta T, Huai-Che H, Hirano T, et al.\nPretransplant screening and evaluation of liver graft viability using machine\nperfusion preservation in porcine transplantation. Transplant Proc. (2012)\n44:959–61. doi: 10.1016/j.transproceed.2012.01.104\n123. Selzner M, Goldaracena N, Echeverri J, Kaths JM, Linares I, Selzner N, et al.\nNormothermic ex vivo liver perfusion using steen solution as perfusate for\nhuman liver transplantation: first north American results. Liver Transpl.\n(2016) 22:1501–8. doi: 10.1002/lt.24499\n124. Watson CJE, Kosmoliaptsis V, Randle LV, Gimson AE, Brais R, Klinck\nJR, et al. Normothermic perfusion in the assessment and preservation of\ndeclined livers before transplantation: hyperoxia and vasoplegia-important\nlessons from the first 12 cases. Transplantation. (2017) 101:1084–98.\ndoi: 10.1097/TP.0000000000001661\n125. Ceresa CDL, Nasralla D, Watson CJE, Butler AJ, Coussios CC, Crick K,\net al. Transient cold storage prior to normothermic liver perfusion may\nfacilitate adoption of a novel technology. Liver Transpl. (2019) 25:1503–13.\ndoi: 10.1002/lt.25584\n126. Laing RW, Mergental H, Yap C, Kirkham A, Whilku M, Barton D, et al.\nViability testing and transplantation of marginal livers (VITTAL) using\nnormothermic machine perfusion: study protocol for an open-label, non\uffferandomised, prospective, single-arm trial. BMJ Open. (2017) 7:e017733.\ndoi: 10.1136/bmjopen-2017-017733\n127. Imber CJ, St Peter SD, Lopez de Cenarruzabeitia I, Pigott D, James\nT, Taylor R, et al. Advantages of normothermic perfusion over\ncold storage in liver preservation. Transplantation. (2002) 73:701–9.\ndoi: 10.1097/00007890-200203150-00008\n128. Matton APM, de Vries Y, Burlage LC, van Rijn R, Fujiyoshi M, de\nMeijer VE, et al. Biliary bicarbonate, pH, and glucose are suitable\nbiomarkers of biliary viability during ex situ normothermic machine\nperfusion of human donor livers. Transplantation. (2019) 103:1405–13.\ndoi: 10.1097/TP.0000000000002500\n129. Op den Dries S, Karimian N, Porte RJ. Normothermic machine\nperfusion of discarded liver grafts. Am J Transplant. (2013) 13:2504.\ndoi: 10.1111/ajt.12374\n130. Mergental H, Perera MT, Laing RW, Muiesan P, Isaac JR, Smith A, et al.\nTransplantation of declined liver allografts following normothermic ex-situ\nevaluation. Am J Transplant. (2016) 16:3235–45. doi: 10.1111/ajt.13875\n131. Bruinsma BG, Yeh H, Ozer S, Martins PN, Farmer A, Wu W, et al.\nSubnormothermic machine perfusion for ex vivo preservation and recovery\nof the human liver for transplantation. Am J Transplant. (2014) 14:1400–9.\ndoi: 10.1111/ajt.12727\n132. Osaki S, Locher MR, Lushaj EB, Akhter SA, Kohmoto T. Functional\nevaluation of human donation after cardiac death donor hearts using a\ncontinuous isolated myocardial perfusion technique: potential for expansion\nof the cardiac donor population. J Thorac Cardiovasc Surg. (2014) 148:1123–\n30. doi: 10.1016/j.jtcvs.2014.06.050\n133. Machuca TN, Cypel M, Zhao Y, Grasemann H, Tavasoli F, Yeung JC,\net al. The role of the endothelin-1 pathway as a biomarker for donor lung\nassessment in clinical ex vivo lung perfusion. J Heart Lung Transplant. (2015)\n34:849–57. doi: 10.1016/j.healun.2015.01.003\n134. Machuca TN, Cypel M, Yeung JC, Bonato R, Zamel R, Chen M, et al. Protein\nexpression profiling predicts graft performance in clinical ex vivo lung\nperfusion. Ann Surg. (2015) 261:591–7. doi: 10.1097/SLA.0000000000000974\n135. Andreasson AS, Karamanou DM, Gillespie CS, Ozalp F, Butt T, Hill P,\net al. Profiling inflammation and tissue injury markers in perfusate and\nbronchoalveolar lavage fluid during human ex vivo lung perfusion. Eur J\nCardiothorac Surg. (2017) 51:577–86. doi: 10.1093/ejcts/ezw358\n136. Andreasson ASI, Borthwick LA, Gillespie C, Jiwa K, Scott J, Henderson P,\net al. The role of interleukin-1beta as a predictive biomarker and potential\ntherapeutic target during clinical ex vivo lung perfusion. J Heart Lung\nTransplant. (2017) 36:985–95. doi: 10.1016/j.healun.2017.05.012\n137. Port FK, Bragg-Gresham JL, Metzger RA, Dykstra DM, Gillespie BW, Young\nEW, et al. Donor characteristics associated with reduced graft survival: an\napproach to expanding the pool of kidney donors. Transplantation. (2002)\n74:1281–6. doi: 10.1097/00007890-200211150-00014\n138. Summers DM, Watson CJ, Pettigrew GJ, Johnson RJ, Collett D, Neuberger\nJM, et al. Kidney donation after circulatory death (DCD): state of the art.\nKidney Int. (2015) 88:241–9. doi: 10.1038/ki.2015.88\n139. Oberhuber R, Ge X, Tullius SG. Donor age-specific injury\nand immune responses. Am J Transplant. (2012) 12:38–42.\ndoi: 10.1111/j.1600-6143.2011.03798.x\n140. Heinbokel T, Hock K, Liu G, Edtinger K, Elkhal A, Tullius SG. Impact of\nimmunosenescence on transplant outcome. Transpl Int. (2013) 26:242–53.\ndoi: 10.1111/tri.12013\n141. Krenzien F, ElKhal A, Quante M, Rodriguez Cetina Biefer H, Hirofumi\nU, Gabardi S, et al. A rationale for age-adapted immunosuppression\nin organ transplantation. Transplantation. (2015) 99:2258–68.\ndoi: 10.1097/TP.0000000000000842\n142. Moreso F, Seron D, Gil-Vernet S, Riera L, Fulladosa X, Ramos R, et al.\nDonor age and delayed graft function as predictors of renal allograft\nsurvival in rejection-free patients. Nephrol Dial Transplant. (1999) 14:930–5.\ndoi: 10.1093/ndt/14.4.930\n143. Carrel A, Lindbergh CA. The culture of whole organs. Science. (1935)\n81:621–3. doi: 10.1126/science.81.2112.621\n144. Turner JE, Becker M, Mittrucker HW, Panzer U. Tissue-resident\nlymphocytes in the kidney. J Am Soc Nephrol. (2018) 29:389–99.\ndoi: 10.1681/ASN.2017060599\n145. Munro DAD, Hughes J. The origins and functions of tissue-resident\nmacrophages in kidney development. Front Physiol. (2017) 8:837.\ndoi: 10.3389/fphys.2017.00837\n146. Takada M, Nadeau KC, Hancock WW, Mackenzie HS, Shaw GD, Waaga\nAM, et al. Effects of explosive brain death on cytokine activation\nof peripheral organs in the rat. Transplantation. (1998) 65:1533–42.\ndoi: 10.1097/00007890-199806270-00001\n147. van der Hoeven JA, Molema G, Ter Horst GJ, Freund RL, Wiersema J,\nvan Schilfgaarde R, et al. Relationship between duration of brain death\nand hemodynamic (in)stability on progressive dysfunction and increased\nimmunologic activation of donor kidneys. Kidney Int. (2003) 64:1874–82.\ndoi: 10.1046/j.1523-1755.2003.00272.x\n148. Nijboer WN, Schuurs TA, van der Hoeven JA, Fekken S, Wiersema-Buist\nJ, Leuvenink HG, et al. Effect of brain death on gene expression and tissue\nactivation in human donor kidneys. Transplantation. (2004) 78:978–86.\ndoi: 10.1097/01.TP.0000135565.49535.60\n149. Boardman DA, Jacob J, Smyth LA, Lombardi G, Lechler RI. What\nis direct allorecognition? Curr Transplant Rep. (2016) 3:275–83.\ndoi: 10.1007/s40472-016-0115-8\n150. Lechler RI, Batchelor JR. Immunogenicity of retransplanted rat kidney\nallografts. Effect of inducing chimerism in the first recipient and quantitative\nstudies on immunosuppression of the second recipient. J Exp Med. (1982)\n156:1835–41. doi: 10.1084/jem.156.6.1835\n151. Fildes JE, Archer LD, Blaikley J, Ball AL, Stone JP, Sjoberg T, et al. Clinical\noutcome of patients transplanted with marginal donor lungs via ex vivo\nlung perfusion compared to standard lung transplantation. Transplantation.\n(2015) 99:1078–83. doi: 10.1097/TP.0000000000000462\n152. Stone JP, Critchley WR, Major T, Rajan G, Risnes I, Scott H, et al. Altered\nimmunogenicity of donor lungs via removal of passenger leukocytes using\nex vivo lung perfusion. Am J Transplant. (2016) 16:33–43. doi: 10.1111/ajt.\n13446\nFrontiers in Immunology | www.frontiersin.org 20 May 2020 | Volume 11 | Article 631\n\nResch et al. Machine Perfusion for Marginal Organs\n153. Amin KR, Wong JKF, Fildes JE. Strategies to reduce ischemia reperfusion\ninjury in vascularized composite allotransplantation of the limb. J Hand Surg\nAm. (2017) 42:1019–24. doi: 10.1016/j.jhsa.2017.09.013\n154. Schlegel A, Kron P, Graf R, Clavien PA, Dutkowski P. Hypothermic\noxygenated perfusion (HOPE) downregulates the immune response in\na rat model of liver transplantation. Ann Surg. (2014) 260:931–7.\ndoi: 10.1097/SLA.0000000000000941\n155. Boteon YL, Afford SC. Machine perfusion of the liver: which is the best\ntechnique to mitigate ischaemia-reperfusion injury? World J Transplant.\n(2019) 9:14–20. doi: 10.5500/wjt.v9.i1.14\n156. Yuan X, Theruvath AJ, Ge X, Floerchinger B, Jurisch A, Garcia-Cardena\nG, et al. Machine perfusion or cold storage in organ transplantation:\nindication, mechanisms, and future perspectives. Transpl Int. (2010) 23:561–\n70. doi: 10.1111/j.1432-2277.2009.01047.x\n157. Fuller BJ, Lee CY. Hypothermic perfusion preservation: the future\nof organ preservation revisited? Cryobiology. (2007) 54:129–45.\ndoi: 10.1016/j.cryobiol.2007.01.003\n158. Sierra Parraga JM, Rozenberg K, Eijken M, Leuvenink HG, Hunter\nJ, Merino A, et al. Effects of normothermic machine perfusion\nconditions on mesenchymal stromal cells. Front Immunol. (2019) 10:765.\ndoi: 10.3389/fimmu.2019.00765\n159. Ravikumar R, Leuvenink H, Friend PJ. Normothermic liver preservation: a\nnew paradigm? Transpl Int. (2015) 28:690–9. doi: 10.1111/tri.12576\n160. Reddy SP, Brockmann J, Friend PJ. Normothermic perfusion: a mini-review.\nTransplantation. (2009) 87:631–2. doi: 10.1097/TP.0b013e3181995e83\n161. Marecki H, Bozorgzadeh A, Porte RJ, Leuvenink HG, Uygun K, Martins PN.\nLiver ex situ machine perfusion preservation: a review of the methodology\nand results of large animal studies and clinical trials. Liver Transpl. (2017)\n23:679–95. doi: 10.1002/lt.24751\n162. Kumar R, Chung WY, Dennison AR, Garcea G. Ex vivo porcine organ\nperfusion models as a suitable platform for translational transplant research.\nArtif Organs. (2017) 41:E69–E79. doi: 10.1111/aor.12865\n163. Brasile L, Stubenitsky B. Will cell therapies provide the solution for the\nshortage of transplantable organs? Curr Opin Organ Transplant. (2019)\n24:568–73. doi: 10.1097/MOT.0000000000000686\n164. Yi T, Song SU. Immunomodulatory properties of mesenchymal stem cells\nand their therapeutic applications. Arch Pharm Res. (2012) 35:213–21.\ndoi: 10.1007/s12272-012-0202-z\n165. Kern S, Eichler H, Stoeve J, Kluter H, Bieback K. Comparative analysis of\nmesenchymal stem cells from bone marrow, umbilical cord blood, or adipose\ntissue. Stem Cells. (2006) 24:1294–301. doi: 10.1634/stemcells.2005-0342\n166. Dominici M, Le Blanc K, Mueller I, Slaper-Cortenbach I, Marini F, Krause\nD, et al. Minimal criteria for defining multipotent mesenchymal stromal\ncells. The international society for cellular therapy position statement.\nCytotherapy. (2006) 8:315–7. doi: 10.1080/14653240600855905\n167. Fernandez Vallone VB, Romaniuk MA, Choi H, Labovsky V,\nOtaegui J, Chasseing NA. Mesenchymal stem cells and their use\nin therapy: what has been achieved? Differentiation. (2013) 85:1–10.\ndoi: 10.1016/j.diff.2012.08.004\n168. de Vries DK, Schaapherder AF, Reinders ME. Mesenchymal stromal\ncells in renal ischemia/reperfusion injury. Front Immunol. (2012) 3:162.\ndoi: 10.3389/fimmu.2012.00162\n169. Mohamed MS. Mesenchymal stem cells transplantation during\nex vivo lung perfusion. J Heart Lung Transplant. (2017) 36:243.\ndoi: 10.1016/j.healun.2016.10.010\n170. Mordant P, Nakajima D, Kalaf R, Iskender I, Maahs L, Behrens P, et al.\nMesenchymal stem cell treatment is associated with decreased perfusate\nconcentration of interleukin-8 during ex vivo perfusion of donor lungs\nafter 18-hour preservation. J Heart Lung Transplant. (2016) 35:1245–54.\ndoi: 10.1016/j.healun.2016.04.017\n171. Brasile L, Henry N, Orlando G, Stubenitsky B. Potentiating renal\nregeneration using mesenchymal stem cells. Transplantation. (2019)\n103:307–13. doi: 10.1097/TP.0000000000002455\n172. Pool M, Eertman T, Sierra Parraga J, Hart N’t, Roemeling-van Rhijn M,\nEijken M, et al. Infusing mesenchymal stromal cells into porcine kidneys\nduring normothermic machine perfusion: intact MSCs can be traced and\nlocalised to glomeruli. Int J Mol Sci. (2019) 20:E3607. doi: 10.3390/ijms201\n43607\n173. Sierra-Parraga JM, Eijken M, Hunter J, Moers C, Leuvenink H, Moller B, et al.\nMesenchymal stromal cells as anti-inflammatory and regenerative mediators\nfor donor kidneys during normothermic machine perfusion. Stem Cells Dev.\n(2017) 26:1162–70. doi: 10.1089/scd.2017.0030\n174. Karimian N, Yeh H. Opportunities for therapeutic intervention\nduring machine perfusion. Curr Transplant Rep. (2017) 4:141–8.\ndoi: 10.1007/s40472-017-0144-y\n175. Donnahoo KK, Shames BD, Harken AH, Meldrum DR. Review article: the\nrole of tumor necrosis factor in renal ischemia-reperfusion injury. J Urol.\n(1999) 162:196–203. doi: 10.1097/00005392-199907000-00068\n176. Shuh M, Bohorquez H, Loss GE Jr, Cohen AJ. Tumor necrosis factor\ufffealpha: life and death of hepatocytes during liver ischemia/reperfusion injury.\nOchsner J. (2013) 13:119–30.\n177. Diuwe P, Domagala P, Durlik M, Trzebicki J, Chmura A, Kwiatkowski A.\nThe effect of the use of a TNF-alpha inhibitor in hypothermic machine\nperfusion on kidney function after transplantation. Contemp Clin Trials.\n(2017) 59:44–50. doi: 10.1016/j.cct.2017.05.013\n178. Ceresa CDL, Nasralla D, Jassem W. Normothermic machine preservation\nof the liver: state of the art. Curr Transplant Rep. (2018) 5:104–10.\ndoi: 10.1007/s40472-018-0186-9\n179. Goldaracena N, Echeverri J, Spetzler VN, Kaths JM, Barbas AS, Louis KS,\net al. Anti-inflammatory signaling during ex vivo liver perfusion improves\nthe preservation of pig liver grafts before transplantation. Liver Transpl.\n(2016) 22:1573–83. doi: 10.1002/lt.24603\n180. Gazoni LM, Laubach VE, Mulloy DP, Bellizzi A, Unger EB, Linden J, et al.\nAdditive protection against lung ischemia-reperfusion injury by adenosine\nA2A receptor activation before procurement and during reperfusion. J\nThorac Cardiovasc Surg. (2008) 135:156–65. doi: 10.1016/j.jtcvs.2007.08.041\n181. Wagner CE, Pope NH, Charles EJ, Huerter ME, Sharma AK, Salmon MD,\net al. Ex vivo lung perfusion with adenosine A2A receptor agonist allows\nprolonged cold preservation of lungs donated after cardiac death. J Thorac\nCardiovasc Surg. (2016) 151:538–45. doi: 10.1016/j.jtcvs.2015.07.075\n182. Yeung JC, Wagnetz D, Cypel M, Rubacha M, Koike T, Chun YM, et al. Ex\nvivo adenoviral vector gene delivery results in decreased vector-associated\ninflammation pre- and post-lung transplantation in the pig. Mol Ther. (2012)\n20:1204–11. doi: 10.1038/mt.2012.57\n183. de Perrot M, Fischer S, Liu M, Imai Y, Martins S, Sakiyama S, et al. Impact\nof human interleukin-10 on vector-induced inflammation and early graft\nfunction in rat lung transplantation. Am J Respir Cell Mol Biol. (2003)\n28:616–25. doi: 10.1165/rcmb.2002-0109OC\n184. Brasile L, Stubenitsky BM, Booster MH, Arenada D, Haisch C,\nKootstra G. Transfection and transgene expression in a human kidney\nduring ex vivo warm perfusion. Transplant Proc. (2002) 34:2624.\ndoi: 10.1016/S0041-1345(02)03449-8\n185. Lu S, Yu Y, Gao Y, Li GQ, Wang XH. Immunological inhibition of\ntransplanted liver allografts by adeno-associated virus vector encoding\nCTLA4Ig in rats. Hepatobiliary Pancreat Dis Int. (2008) 7:258–63.\n186. Morales-Ruiz M, Fondevila C, Munoz-Luque J, Tugues S, Rodriguez-Laiz\nG, Cejudo-Martin P, et al. Gene transduction of an active mutant of akt\nexerts cytoprotection and reduces graft injury after liver transplantation.\nAm J Transplant. (2007) 7:769–78. doi: 10.1111/j.1600-6143.2006.\n01720.x\n187. Figueiredo C, Carvalho Oliveira M, Chen-Wacker C, Jansson K, Hoffler K,\nYuzefovych Y, et al. Immunoengineering of the vascular endothelium to\nsilence MHC expression during normothermic ex vivo lung perfusion. Hum\nGene Ther. (2019) 30:485–96. doi: 10.1089/hum.2018.117\n188. Boteon YL, Attard J, Boteon A, Wallace L, Reynolds G, Hubscher S, et al.\nManipulation of lipid metabolism during normothermic machine perfusion:\neffect of defatting therapies on donor liver functional recovery. Liver Transpl.\n(2019) 25:1007–22. doi: 10.1002/lt.25439\n189. Echeverri J, Goldaracena N, Kaths JM, Linares I, Roizales R, Kollmann D,\net al. Comparison of BQ123, epoprostenol, and verapamil as vasodilators\nduring normothermic ex vivo liver machine perfusion. Transplantation.\n(2018) 102:601–8. doi: 10.1097/TP.0000000000002021\n190. Goldaracena N, Spetzler VN, Echeverri J, Kaths JM, Cherepanov V, Persson\nR, et al. Inducing hepatitis C virus resistance after pig liver transplantation\ufffea proof of concept of liver graft modification using warm ex vivo perfusion.\nAm J Transplant. (2017) 17:970–8. doi: 10.1111/ajt.14100\nFrontiers in Immunology | www.frontiersin.org 21 May 2020 | Volume 11 | Article 631\n\nResch et al. Machine Perfusion for Marginal Organs\n191. Galasso M, Feld JJ, Watanabe Y, Pipkin M, Summers C, Ali A, et al.\nInactivating hepatitis C virus in donor lungs using light therapies during\nnormothermic ex vivo lung perfusion. Nat Commun. (2019) 10:481.\ndoi: 10.1038/s41467-018-08261-z\n192. Detelich D, Markmann JF. The dawn of liver perfusion machines. Curr Opin\nOrgan Transplant. (2018) 23:151–61. doi: 10.1097/MOT.0000000000000500\n193. Sandal S, Luo X, Massie AB, Paraskevas S, Cantarovich M, Segev DL.\nMachine perfusion and long-term kidney transplant recipient outcomes\nacross allograft risk strata. Nephrol Dial Transplant. (2018) 33:1251–9.\ndoi: 10.1093/ndt/gfy010\n194. Rosen HR, Martin P, Goss J, Donovan J, Melinek J, Rudich S, et al.\nSignificance of early aminotransferase elevation after liver transplantation.\nTransplantation. (1998) 65:68–72. doi: 10.1097/00007890-199801150-00013\n195. Bral M, Dajani K, Leon Izquierdo D, Bigam D, Kneteman N, Ceresa\nCDL, et al. A back-to-base experience of human normothermic ex situ\nliver perfusion: does the chill kill? Liver Transpl. (2019) 25:848–58.\ndoi: 10.1002/lt.25464\n196. Tietjen GT, Hosgood SA, DiRito J, Cui J, Deep D, Song E, et al.\nNanoparticle targeting to the endothelium during normothermic machine\nperfusion of human kidneys. Sci Transl Med. (2017) 9:eaam6764.\ndoi: 10.1126/scitranslmed.aam6764\n197. DiRito JR, Hosgood SA, Tietjen GT, Nicholson ML. The future of\nmarginal kidney repair in the context of normothermic machine\nperfusion. Am J Transplant. (2018) 18:2400–8. doi: 10.1111/ajt.\n14963\nConflict of Interest: The authors declare that the research was conducted in the\nabsence of any commercial or financial relationships that could be construed as a\npotential conflict of interest.\nCopyright © 2020 Resch, Cardini, Oberhuber, Weissenbacher, Dumfarth, Krapf,\nBoesmueller, Oefner, Grimm and Schneeberger. This is an open-access article\ndistributed under the terms of the Creative Commons Attribution License (CC BY).\nThe use, distribution or reproduction in other forums is permitted, provided the\noriginal author(s) and the copyright owner(s) are credited and that the original\npublication in this journal is cited, in accordance with accepted academic practice.\nNo use, distribution or reproduction is permitted which does not comply with these\nterms.\nFrontiers in Immunology | www.frontiersin.org 22 May 2020 | Volume 11 | Article 631\n\n']","This article provides an overview of the current state of machine perfusion for marginal organs, focusing on the definitions and impacts of ""extended criteria"" for kidneys, livers, and lungs. The article discusses the challenges associated with expanding the donor pool due to aging populations and increased demand for organ transplants, leading to the use of marginal organs. The article highlights the importance of accurately defining marginal organs and addressing the reversibility and treatability of contributing factors. The article also touches upon the potential for immunomodulation and immunomasking during machine perfusion, as well as the possibility of treating diseases like hepatitis C and HIV through gene therapy during machine perfusion. The article concludes by emphasizing the need for further research and validation of machine perfusion techniques for marginal organs. Overall, the article suggests that machine perfusion holds promise for improving the utilization of marginal organs and expanding access to organ transplants. However, it also underscores the need for careful consideration of the complex factors involved in determining the suitability of organs for transplantation.",0.9333333333333333,0.8248868582632056,FULL_PAPER
How has the evidence changed regarding acceptable macro/microsteatosis in liver grafts?,"['nature publishing group\nHuman hepatocyte transplantation for liver disease: current\nstatus and future perspectives\nV Iansante1\n, R R Mitry1\n, C Filippi1\n, E Fitzpatrick1 and A Dhawan1\nLiver transplantation is the accepted treatment for patients\nwith acute liver failure and liver-based metabolic disorders.\nHowever, donor organ shortage and lifelong need for\nimmunosuppression are the main limitations to liver trans\ufffeplantation. In addition, loss of the native liver as a target organ\nfor future gene therapy for metabolic disorders limits the\nfuturistic treatment options, resulting in the need for\nalternative therapeutic strategies. A potential alternative to\nliver transplantation is allogeneic hepatocyte transplantation.\nOver the last two decades, hepatocyte transplantation has\nmade the transition from bench to bedside. Standardized\ntechniques have been established for isolation, culture, and\ncryopreservation of human hepatocytes. Clinical hepatocyte\ntransplantation safety and short-term efficacy have been\nproven; however, some major hurdles—mainly concerning\nshortage of donor organs, low cell engraftment, and lack of a\nlong-lasting effect—need to be overcome to widen its clinical\napplications. Current research is aimed at addressing these\nproblems, with the ultimate goal of increasing hepatocyte\ntransplantation efficacy in clinical applications.\nOrthotopic liver transplantation (OLT) is currently\nconsidered the gold standard treatment for end-stage\nliver disease, acute liver failure, and liver-based metabolic\ndisorders, and is the only intervention with proven clinical\nbenefits and long-lasting effects. However, the shortage of\ndonors limits the number of patients who may benefit from\nOLT and means that there is a significant waiting list and high\nmortality. OLT has several disadvantages, including the risks\nof complications related to surgery, the high cost of the\nprocedure, and the need for lifelong immunosuppression.\nTheoretically, a potential alternative to liver transplantation is\nhepatocyte transplantation (HT), in which transplanted cells\nprovide the missing/impaired hepatic function once engrafted\ninto the recipient’s liver. Mature hepatocytes are considered\nthe most obvious cell type for liver cell transplantation since\nthey are the major functional components of the liver. In\nprinciple, hepatocyte transplantation has several advantages\nover OLT: (i) it is less invasive and less expensive not\ninvolving a complex surgery; (ii) it can be performed\nrepeatedly if required; (iii) cryopreserved cells isolated from\ndonor livers are available immediately when needed; (iv)\nnative liver remains in place serving as a backup in case of cell\ngraft failure and allowing potential regeneration in patients\nwith acute liver failure (ALF), as well as representing a\npossible target for future gene therapy in patients with liver\ufffebased metabolic disorders; and (v) because this procedure\nonly requires a fraction of the cells isolated from a donor\norgan, multiple patients can be treated from one donor tissue,\nthus saving other organs for patients who do require OLT.\nThe first experimental attempt of hepatocyte transplanta\ufffetion was developed in 1976 (1) to treat the hyperbilirubinemic\nGunn rat, an animal model for Crigler–Najjar syndrome type\nI (CN), and along with other preclinical observations (2–4), it\nled to the first transplant of autologous hepatocytes in 10\npatients with liver cirrhosis in 1992 in Japan with uncertain\nresults (5). Since then, reports have been published of more\nthan 100 patients with liver disease treated by HT worldwide\n(6). To date, human hepatocytes transplantation has resulted\nin partial correction of a high number of liver diseases\nincluding urea cycle disorders (7–9), factor VII deficiency\n(10), glycogen storage disease type 1 (11), infantile Refsum’s\ndisease (12), phenylketonuria (13), severe infantile oxalosis\n(14), and acute liver failure (15–18) (Table 1). The level of cell\nreplacement required to achieve physiological benefit varies\ndepending on the disease, and it has been considered around\n5 − 10% of theoretical liver mass in the transplantations carried\nout so far. Although encouraging clinical improvements are\nseen in patients transplanted with allogeneic hepatocytes, long\ufffeterm efficacy is still hampered by insufficient engraftment/\nlong-term acceptance of cellular allografts, despite immuno\ufffesuppression (19). Even though promising, HT still faces\nlimitations. First, there is a limited supply of donor livers from\nwhich high-quality hepatocytes can be isolated, as the source is\nsuboptimal livers that are otherwise unsuitable for organ\ntransplantation (20). These cells are often poorly functioning.\nSecond, cryopreservation of hepatocytes results in impaired cell\nviability after thawing due to freeze–thaw damage (21). Third,\ncell engraftment is quite poor, estimated to be from 0.1 to 0.3%\n1\nDhawanLab, Paediatric Liver GI and Nutrition Center and MowatLabs, Institute of Liver Studies, King’s College London, Faculty of Life Sciences and Medicine, King’s College\nLondon, King’s College Hospital, London, UK. Correspondence: A. Dhawan (anil.dhawan@kcl.ac.uk)\nReceived 15 June 2017; accepted 2 October 2017; advance online publication 6 December 2017. doi:10.1038/pr.2017.284\n232 Pediatric RESEARCH Volume 83 | Number 1 | January 2018 Copyright © 2018 International Pediatric Research Foundation, Inc.\nReview\n\nof host liver mass in mice after infusion of 3 − 5% of the total\nrecipient liver cells (22). Finally, allogeneic rejection is most\nprobably the main cause for the observed decline of cell graft\nfunction within 1 year of HT (19). Although the safety of\nclinical HT has been very well established, therapeutic benefit\nhas been modest and only temporary so far. This is partially in\ncontrast with very convincing preclinical results obtained in a\nnumber of animal models of liver disease (2–4), possibly\nbecause these models do not properly mimic the disease in\nhumans. Animals usually develop liver injury within a few days\nor weeks, whereas in humans the injury is significantly more\nsevere occurring over many decades, thus highlighting a need\nof more realistic models of liver disease.\nPROCEDURES: HEPATOCYTE SOURCE, ISOLATION, QUALITY\nCONTROL, AND ADMINISTRATION FOR CELL\nTRANSPLANTATION\nHuman hepatocytes are isolated from (i) whole donor livers\nunsuitable/rejected for OLT, mostly because of severe\nsteatosis, prolonged ischemia time, older, or non-heart\ufffebeating donors, or (ii) from liver segments, mainly I and\nIV, which are available for cell isolation after split liver\ntransplantation. Alternatively, fetal and neonatal livers are\nbeing explored as a potential cell source (23,24) as they are\ncurrently not considered for OLT and may allow the isolation\nof very high-quality cells (9). Neonatal-derived hepatocytes,\nalthough not fully mature, show activity of some of the main\nenzymes responsible for hepatic-detoxifying functions (23).\nExplanted livers from patients with liver-based metabolic\ndisorders have also been considered as a potential source of\ncells. This concept was adopted from a similar approach used\nin the so-called “domino” liver transplantation performed\nsince the mid-1990s, in which a liver transplant recipient with\na known metabolic defect can donate his explanted native\nliver for use as liver graft in another patient (25). In a similar\nway, liver explants from patients with defined metabolic\ndisorders could become a source of hepatocytes, since their\nmissing enzymatic function would be performed by the\nrecipient’s native liver, left in place. This approach was used in\na 6-year-old boy with severe phenylketonuria transplanted\nwith hepatocytes isolated from a glycogen storage type 1b\nliver explant, with significant reduction of blood phenylala\ufffenine levels up to 3 months after transplantation (13).\nIn order to isolate the hepatocytes, a standardized three-step\ncollagenase perfusion technique originally developed by Berry\nand Friend and later modified (26–28) is used. First, major\nhepatic vessels are cannulated and perfused with Hank’s buffered\nsalt solution (HBSS) containing EGTA, which is able to chelate\ncalcium ions, thus disrupting the desmosomes, calcium\ufffedependent cell-to-cell adhesions. Second, the liver is flushed\nwith plain HBSS to remove any residue of EGTA. Third, the\ntissue is perfused with a calcium-dependent collagenase solution\nto digest the extracellular matrix. After breaking of the liver\ncapsule, the released liver cells are filtered and centrifuged at low\nspeed to separate hepatocytes from nonparenchymal cells.\nHepatocytes can be used fresh for transplantation or cryopre\ufffeserved. Several protocols have been described to cryopreserve\nhuman hepatocytes, with the best results being achieved\ncryopreserving 106\n–107 cells/ml in the University of Wisconsin\norgan preservation solution containing 10% dimethyl sulfoxide\nand 5% glucose, and using a controlled-rate freezer (29).\nCryopreserved hepatocytes are then stored at –140 °C until\nrequired for HT. Hepatocyte isolations for use in clinical HT\nmust be performed under good manufacturing practice (GMP)\nin an aseptic and accredited units.\nEvaluation of hepatocyte quality before transplantation is\nvital, especially on cryopreserved cells, as it has been shown\nthat freeze-thawing cycles damage mitochondria, affect cell\nrespiration with a dramatic drop of ATP levels (21), and may\ninduce apoptosis (unpublished data). Most centers use trypan\nblue exclusion test as the main and often only criterion to\nassess cell quality before transplantation, usually accepting\ncells with viability equal or higher than 60% for clinical\napplications. However, viability assessment does not detect\nany sign of early apoptosis in the cells or their functions,\nwhich should probably be included in the cell quality control\nto ensure that high-quality hepatocytes are transplanted (30).\nIn keeping with GMP standards, microbiological analysis\nmust be undertaken at each stage of cell preparation and the\nfinal product must be exempt from any contamination before\nrelease of hepatocytes for cell transplantation.\nThe most widely used administration route for clinical delivery\nof HT is intraportal infusion, with the catheter placed in the\nportal vein or in one of its branches. In newborn babies, the\nportal vein can be accessed by catheterization of the umbilical\nTable 1. List of human liver diseases treated with hepatocyte\ntransplantation\nDisease\nInborn error diseases\nAlpha1-antitrypsin (34)\nCrigler–Najjar syndrome type I (41–43)\nFamilial hypercholesterolemia (45)\nFactor VII deficiency (10)\nGlycogen storage diseases (11,44)\nInfantile Refsum’s disease (12)\nPrimary oxalosis (14)\nPhenylketonuria (13,40)\nProgressive familial intrahepatic cholestasis (Dhawan et al., unpublished\ndata)\nUrea cycle defects (7–9,36–40)\nAcute liver failure\nDrug (16)\nViral (16)\nIdiopathic (15)\nMushroom poisoning (18)\nAcute fatty liver of pregnancy (17)\nHepatocyte transplantation | Review\nCopyright © 2018 International Pediatric Research Foundation, Inc. Volume 83 | Number 1 | January 2018 Pediatric RESEARCH 233\n\nvein. In older children, a cut-down approach may be used or a\nlaparoscopic/mini laparotomy insertion of a central venous\ncannula into a tributory of the portal vein. Hepatocytes\n(~20 − 40 μM in diameter) move across the sinusoidal vessels\nand induce transient occlusions in the periportal vascular areas\ndependent on cell size, followed by restoration of normal blood\nflow by vascular permeabilization, which allows transplanted\ncells to reach the liver parenchyma (31,32). Hepatocytes\nremaining in the portal vessels are cleared by macrophages\nwithin 24 h. The number of cells injected is limited by portal\npressure, which should be monitored throughout by Doppler\nultrasound, and should not exceed 12 mm Hg to avoid the risk\nof portal hypertension (33). Cell dose and infusion rate depend\non the patient weight and clinical situation, with the aim of\ninjecting around 5% of the total liver mass. Most centers\nconsider a dose of 2 × 108 cells per kg of body weight as the\nupper safe limit for hepatocyte transplantation. In some\nsituations when a high number of cells is needed to ensure\nclinical benefits, multiple infusions can be performed. Intras\ufffeplenic administration has been suggested as an alternative to\nintraportal injection in patients with liver cirrhosis, in whom\naltered liver architecture impacts hepatocyte engraftment (34).\nThe peritoneal cavity represents an attractive administration\nroute as it is easily accessible and may contain a large number of\ncells. For these reasons, it has been used in patients with acute\nliver failure (15,17). However, lack of anchorage for the\ntransplanted cells and host immune response result in a rapid\ndecline in transplanted cell viability. A way to overcome this\nproblem is the encapsulation of hepatocytes in alginate\nmicrobeads so that immune cells cannot reach them, thus\nprolonging their survival (35).\nINDICATIONS\nHepatocyte transplantation has been used clinically both in\ncongenital metabolic disorders affecting the liver and acute\nliver failure (Table 1). The most encouraging outcomes have\nbeen shown in liver-based metabolic disorder, where the\nnumber of cells needed to compensate for a single gene defect\nis lower than that for acute liver failure.\nInborn Errors of Liver Metabolism\nUrea cycle defects represent the most common liver-based\nmetabolic disorders treated with hepatocyte transplantation. These\ndiseases are characterized by an incapacity of fully converting\nammonia into urea, with hyperammonemic crisis, frequently\nleading to death. To date, hepatocyte transplantation has been\nused in different types of urea cycle defects, including ornithine\ntranscarbamylase (OTC) deficiency (7,36–40), argininosuccinate\nlyase (ASL) deficiency (8), citrullinemia (7), and carbamoylpho\ufffesphate synthetase (CPS) deficiency (7,40). Although most patients\nshowed clinical benefits, the effects were not maintained over the\nlong term. Soltys et al. recently published findings from two\npatients with urea cycle defects, who underwent hepatocyte\ntransplantation after preconditioning with irradiation. The two\npatients, a 4-month-old girl with CPS1 deficiency and a 7-month\ufffeold child with OTC deficiency, received 1.25 and 2.0 × 108 viable\nhepatocytes/kg body weight, respectively. Clinical benefits were\nseen in the patient with OTC deficiency, however, after around\n40 days, the child developed frequent hyperammonemia. Both\nchildren received an OLT after a few months (40).\nCrigler–Najjar syndrome is due to a defective UDP\ufffeglucuronosyltransferase (UGT) enzyme determining increased\nserum-unconjugated bilirubin levels, which can lead to severe\nbrain damage and death. Current treatments include liver\ntransplantation and phototherapy. There are reports of patients\nwho have received up to 7.5 billion hepatocytes, showing up to\n50% reduction in bilirubin and increase in UGT activity. The\nmajority of these patients received an OLT within a year. One\npatient was transplanted 4 years later (41–43).\nGlycogen storage disease type I is due to mutations impairing\nthe activity of glucose-6-phosphatase complex, with abnormal\naccumulation of glycogen and fat in the liver and kidneys.\nHepatocyte transplantation was used in two adults with\nimproved glucose control up to 7 − 9 months (11,44).\nOther liver-based metabolic diseases shown to improve\nfollowing hepatocyte transplantation include factor VII (fVII)\ndeficiency, where there was a 70% reduction in the need for\nrecombinant fVII for 6 months (10), and familial hyperch\ufffeolesterolemia, where autologous ex vivo-corrected hepatocytes\nwere transplanted with not significant clinical improvement,\nprobably due to low efficiency of genetic correction (45). In\naddition, hepatocyte transplantation has been used to treat\npatients with alpha1-antitrypsin (34), infantile Refsum’s\ndisease (12), primary oxalosis (14), and phenylketonuria\n(13,40). Safety of the method was confirmed in all these\ntreatments, however, similarly to the other diseases treated,\nefficacy was not maintained over the long term.\nAcute Liver Failure\nHepatocyte transplantation aims to bridge patients with acute\nliver failure to recovery through regeneration of their own\nliver or to OLT in case an organ becomes available. Cell\nnumber necessary to provide hepatic function able to replace\nthe injured liver is slightly higher than for metabolic\ndisorders, estimated to be ~ 10 − 15% of liver cell mass (46).\nCell transplantation through the portal system is not always\npossible in these patients, due to frequent coagulopathy issues;\ntherefore, other administration routes have been used, such as\nintraperitoneally (15,17) or intrasplenic (16,34).\nIn many cases, hepatocyte transplantation in patients with\nfulminant liver failure resulted in clinical improvements with\nreduction in ammonia and bilirubin and hepatic encephalo\ufffepathy, as already extensively described in other reviews\n(34,47). However, it is difficult to conclude about the efficacy\nof this approach without randomized controlled trials.\nIMMUNOSUPPRESSION AND IMMUNE RESPONSE TO CELL\nGRAFT\nThere is no consensus regarding the optimum immunosup\ufffepressive treatment following HT. Most centers have adapted\nimmunosuppressive protocol used for orthotopic liver\ntransplantation to HT. Common immunosuppressive\nReview | Iansante et al.\n234 Pediatric RESEARCH Volume 83 | Number 1 | January 2018 Copyright © 2018 International Pediatric Research Foundation, Inc.\n\nregimens include induction with steroids and calcineurin\ninhibitors (tacrolimus or cyclosporine) (8,10,11,42). Some\ncenters have also included therapy with anti-interleukine-2\nreceptor antibodies (basiliximab) (7). Experiences with OLT\nhave highlighted that liver is an immune-privileged organ,\nleading in some cases to graft tolerance development and\npossibility of immunosuppression withdrawal. Hepatocyte\ntransplantation has been erroneously considered similar to\nliver transplantation in terms of immunogenicity and it was\ninitially assumed that hepatocytes would have the same\nimmune privilege as the whole liver. Unfortunately, allogeneic\nhepatocytes seem to be highly antigenic in vivo unlike the liver\n(20). This discrepancy between inherent tolerogenicity of\nwhole-liver and isolated hepatocytes may suggest that either\nother hepatic cells like stellate cells or liver sinusoid\nendothelial cells contribute to liver tolerance (48) or that\nhepatocytes lose their tolerogenic potential in an allogeneic\nenvironment (49). Rejection of hepatocytes is mediated by\nboth the innate and adoptive immunity, and detailed\nelucidation of the mechanisms involved will probably\nimprove HT outcome.\nThe innate immune system plays a critical role after HT, as\nit has been demonstrated that up to 70% of transplanted\nhepatocytes might be eliminated by early phagocytic immune\nresponse, without significant differences between allogeneic\nand syngeneic cell transplantation (50). Different mechanisms\nseem to be involved in hepatocyte early rejection. First, part of\nthe transplanted cells undergo cytolysis mediated by granu\ufffelocytes and monocytes activated by surface adhesion proteins\nexpressed on hepatocyte cell membrane, like cadherins,\notherwise hidden and inaccessible to them in case of whole\ufffeliver transplantation (51). Second, a process first described in\nislet transplantation and known as “instant blood-mediated\ninflammatory reaction” (IBMIR) is partly responsible for cell\nloss. The IBMIR is initiated by tissue factor expressed on\nhepatocyte cell membrane and is characterized by activation\nof the coagulation and complement systems, binding of\nactivated platelets to hepatocyte surfaces with formation of\nclots, and infiltration of polymorphonuclear leukocytes\nresulting in the loss of transplanted cells (52,53).\nIn addition to the innate immune response, hepatocytes are\nalso rejected by the adaptive immune system. It has been\nshown that injecting hepatocytes in T-cell-deficient mice\nimproved cell graft survival, not observed in case of\nB-deficient, or selectively CD4+ or CD8+ T-cell-deficient\nmice, suggesting that immunologic rejection of allogeneic\nhepatocytes is mediated primarily by T cells (54). More recent\nstudies showed a lack of donor-specific antibodies, confirming\nthat humoral B-cell-mediated response may be not involved\nin hepatocyte rejection (38).\nIMPROVEMENT IN ENGRAFTMENT/PROLIFERATION OF\nTRANSPLANTED CELLS\nThe outcome of HT is strictly dependent on the level of\nengraftment of transplanted hepatocytes into the recipient’s\nliver (Figure 1). This concept applies both to acute liver\nfailure and liver-based metabolic diseases. In case of metabolic\ndisorders, the ultimate goal is to achieve a long-lasting level of\ncell integration allowing a stable expression of the missing\nprotein/enzyme over time. Several strategies have been\ninvestigated to increase engraftment and/or proliferation of\ntransplanted hepatocytes. There has been much interest in\nusing the therapy in certain diseases that provide a natural\nselective advantage for transplanted cells, such as hereditary\ntyrosinemia type I (55), alpha1-antitrypsin deficiency (56),\nand Wilson’s disease (57). Unfortunately, most liver diseases\ndo not offer a selective advantage to transplanted cells, thus\nmaking necessary the development of new strategies to\nachieve this aim, including genetic modification of donor cells\nor induced injury to the recipient’s liver.\nA study aiming to enhance the proliferation capacity of\ndonor hepatocytes before transplantation showed that\ntransfecting freshly isolated murine hepatocytes ex vivo with\nthe nonviral sleeping beauty (SB) transposon vector carrying\nFoxM1 gene, a known cell-cycle regulator, significantly\nimproved liver repopulation without inducing tumorigenesis\n(58). Many attempts have been made to precondition the\nrecipient’s liver and give a selective advantage to the\ntransplanted cells, mainly partial hepatectomy (59), portal\nembolization (60), and liver irradiation (40), as suggested by a\nconsensus meeting held in London in 2009, where the main\nrepresentatives of the active clinical hepatocyte transplant\nprograms identified the main limitations of HT and suggested\nsolutions to overcome them (61).\nPartial hepatectomy has been successfully used in several\nanimal models of liver disease and showed significant liver\nrepopulation (62,63). Despite its clinical safety being reported\nmore than two decades ago (45), there are still some doubts\nabout its efficacy in humans. Recently, two patients with\nCrigler–Najjar syndrome type I underwent partial hepatect\ufffeomy followed by hepatocyte transplantation. Even though cell\ngraft function was lost in one patient for discontinuation of\nimmunosuppression, the other patient showed a decrease of\nbilirubin to ≈50% of pretransplant concentrations for more\nthan 6 months. However, he finally underwent liver\ntransplantation since graft functions were completely lost\n~ 600 days after HT (59).\nAnother approach to improve donor hepatocyte engraft\ufffement is partial embolization of the portal vein. This procedure\nis routinely used in patients undergoing liver resection in case\nthe remaining liver is too small to ensure hepatic function\n(64). Portal vein embolization (PVE) is safe, well tolerated by\npatients, and induces hypertrophy of nonembolized liver\nlobes. Dagher et al. (60) demonstrated that PVE of 50% of the\nliver mass followed by HT in Macaca monkeys resulted in\nreplacement of 10% of the organ total volume in the\nnonembolized lobe, and reversible PVE obtained with an\nabsorbable material determined similar results (65). Partial\nhepatectomy with PVE was used in nonhuman primates and\nin Watanabe-heritable hyperlipidemic rabbits, an animal\nmodel of familial hypercholesterolemia type IIa (FH),\nHepatocyte transplantation | Review\nCopyright © 2018 International Pediatric Research Foundation, Inc. Volume 83 | Number 1 | January 2018 Pediatric RESEARCH 235\n\nfollowed by transplantation of autologous hepatocytes\ntransduced ex vivo with lentiviral vectors (65,66).\nIrradiation of the native liver has been investigated as a way\nto inhibit native hepatocyte proliferation and enhance the\nengraftment and proliferation of donor hepatocytes. Pre\ufffeclinical studies of HT in the Gunn rat model of Crigler–Najjar\nsyndrome type I, showed that preparative hepatic irradiation\non a portion of the liver combined with stimulation of\nhepatocyte proliferation by administration of hepatocyte\ngrowth factor viral vector 24 h after HT led to a complete\ncorrection of the metabolic defect during the 16-week\nobservation period (67). A recent study showed that porcine\nhepatocytes were transplanted into immunosuppressed non\ufffehuman primates preconditioned with 10 Gy liver-directed\nirradiation targeting the right lobe, engrafted, and proliferated\nconstituting up to 15% of the irradiated lobe (40).\nFurthermore, irradiation as a host-preconditioning approach\nwas used in three patients treated with HT. Two infants with\nurea cycle defects preconditioned with irradiation on 1/3 of\nthe liver mass before HT showed early graft loss. Immune\nrejection was monitored through measurement of CD154+\nT-cytotoxic memory cells (TcM), shown to predict acute\ncellular rejection in children with intestine and liver\ntransplantation (68,69). CD154+ TcM were measured in a\n16-h mixed lymphocyte culture, consisting of recipient\nperipheral blood lymphocytes (PBL) cocultured with donor\nor third-party HLA-mismatched PBL. If donor lymphocytes\nwere not available, PBL from normal human HLA-matched\nsubjects were used. The immunoreactivity index (IR),\nrepresented by the ratio of donor-induced to third-party\ufffeinduced CD154+ TcM, was analyzed every 7 days after cell\ntransplantation and used as a sign of increased risk of\nrejection when IR≥ 1.3. An adult with classical phenylk\ufffeetonuria who received anti-lymphocyte antibody therapy and\nunderwent more frequent immune monitoring/immunosup\ufffepression adjustments in addition to the preparative radiation\nAllogeneic\nhepatocyte\ntransplantation\nHigh viability/quality cells\nProliferation of\ntransplanted hepatocytes Donor hepatocytes loss\nImmune rejection\nLack of tolerance\nImmunosuppression\nadjustment\nCo-transplantation\nwith immuno\ufffeprivileged cells Valeria Iansante\nEncapsulation in\nalginate (ALF)\nClinical\nbenefits\nHost hepatocyte\nDonor hepatocyte\nDonor hepatocyte loss\nImmune rejection\nLack of tolerance\nNatural graft advantage\nProliferative stimulus\n(partial hepatectomy,\nirradiation, partial\nembolization portal vein)\nInhibition of IBMIR\nAllogeneic\nhepatocyte\nengraftment\nAllogeneic\nhepatocyte liver\nrepopulation\nPre-transplant\nhost conditions\nGraft failure\nFigure 1. Fate of allogeneic hepatocytes after transplantation. After transplantation, allogeneic hepatocyte engrafts into the recipient’s liver. In case\nof selective advantage over the host cells or in the presence of proliferative stimuli, transplanted hepatocytes repopulate the liver. Immune rejection\nis the main cause of cell loss and graft failure. Potential ways to improve engraftment and inhibit allogeneic hepatocyte loss are listed. Intensity of\nblue in the background highlights the level of clinical benefits associated to the different conditions. ALF, acute liver failure.\nReview | Iansante et al.\n236 Pediatric RESEARCH Volume 83 | Number 1 | January 2018 Copyright © 2018 International Pediatric Research Foundation, Inc.\n\ntreatment, showed multiple clusters of proliferating trans\ufffeplanted hepatocytes and significant decrease of blood\nphenylalanine levels after HT, although graft loss occurred\nafter follow-up became inconsistent. Despite the encouraging\nresults, the authors of this study highlighted that the level of\ndonor hepatocyte replacement was lower than expected,\npresumably because HT was performed too early within 24 h\nafter preconditioning (40).\nAn additional difficulty in cell engraftment evaluation after\nHT is the lack of tracking methods to measure the number of\ntransplanted hepatocytes in an accurate and noninvasive way.\nIn preclinical studies, cells can be easily labeled with\ntransfection/transduction of a fluorescent protein or pre\ufffestained with a dye and monitored over time. However, this\napproach is not applicable in humans. Hepatocyte labeling\nwith radioactive indium-111 was used in a 5-year-old child\nwith OTC deficiency treated with HT and resulted in a\nnoninvasive analysis of the biodistribution of transplanted\nhepatocytes (70). Although promising, this technique can be\nuseful only for short-time tracking, being limited by the short\nhalf-life of the radioisotope. Labeling with magnetic resonance\ncontrast agents has also been proposed (71) and investigated\nin preclinical studies (72). In liver-based metabolic disorders,\nindirect evidence of engraftment after HT can be obtained\nfrom levels of metabolic products as a consequence of the\nintroduction of the missing enzyme/protein (e.g., decrease of\nammonia in urea cycle defects and bilirubin in Crigler–Najjar\npatients). However, these measures do not provide reliable\ninformation about the exact number of functioning engrafted\nhepatocytes. Direct evidence of engraftment can be obtained\nby analyzing liver biopsies for sex chromosome, short tandem\nrepeats, or HLA antigens, if different in a recipient and a\ndonor (22,73). However, biopsies are not always available,\nbeing invasive. Furthermore, they only sample a very small\nproportion of tissue, thus being unrepresentative of the entire\nliver. An alternative approach to quantify cell engraftment\nafter HT could be the quantification of proteins released in\nthe bloodstream carrying polymorphisms in a donor and\nrecipient detectable by mass spectrometry (e.g., apolipopro\ufffetein and haptoglobin). A similar approach may consist of the\ncharacterization of exosome cargos released by donor grafts,\nas shown in a xenogeneic islet transplant model (74). High\ninterest has been recently shown for the development of new\nmethods to measure graft rejection. Since cell-free circulating\nDNA (cf-DNA) is released into the bloodstream by necrotic\nand apoptotic cells and can be genotyped and matched to\ndonor cells, it has been successfully used as a marker of early\nrejection in patients after liver transplantation (75). However,\nadditional studies are required to investigate whether this\nmethod can be translated to the detection of rejection in case\nof cell transplantation, where the number of cells releasing cf\ufffeDNA is significantly lower than in organ transplantation.\nFUTURE DEVELOPMENTS\nThe improvement of cell engraftment by host conditioning or\ndonor cell modification, as well as a better understanding of\nthe immune responses involved in hepatocyte rejection are\ndefinitely needed in order to overcome the issues limiting HT\nefficacy. In addition to this, a limited source of hepatocytes\nand often poor quality of isolated cells still represent an issue\nfor wider clinical applications. Other cell sources, combina\ufffetion therapies, and cell transplantation strategies have been\nconsidered to improve HT outcome.\nMesenchymal stromal cells (MSCs) represent an attractive\ntool for regenerative medicine due to their ability to\nproliferate and differentiate, as well as their anti\ufffeinflammatory and immune-privileged status. MSCs exist in\nmany tissues, including bone marrow, umbilical cord, and\nadipose tissues, and are able to differentiate in mesenchymal\ntissue cells, i.e., adipocytes, osteoblasts, and chondrocytes.\nMSCs have recently been isolated from the liver and named\nliver-derived human MSCs (LHMSCs). Some studies have\nshown that these cells can be transdifferentiated into\nhepatocyte-like cells, thus potentially being used for cell\ntransplantation in liver-based disorders (76,77). Although it is\nstill debated whether LHMSCs may efficiently repopulate a\nhost liver and provide adequate hepatic function (78), their\nanti-inflammatory role is undoubted (79). Furthermore,\nMSCs derived from bone marrow or umbilical cord and\ncocultured in vitro with human hepatocytes have shown\nsignificant improvement of hepatic functions (80), suggesting\nthat cotransplanting these cells and/or possibly LHMSCs with\nhepatocytes might ameliorate HT outcome, decreasing\ninflammation and improving hepatocyte performance.\nThere has been worldwide interest in the reprogramming of\ndifferentiated somatic cells to induced pluripotent stem cells\n(iPSCs), which can be potentially differentiated into cells\nbelonging to any germ layer, including cells with hepatocyte\ufffelike morphology and function, known as hepatocyte-like cells\n(HLCs) (81). Several groups have developed efficient and\nstandardized protocols for the development of iPSC-derived\nHLCs, some with GMP-approved protocols and reagents.\nHowever, HLCs generated by current methods are not fully\nmature, being phenotypically and functionally more similar to\nfetal than adult hepatocytes, with low albumin and urea\nproduction, and persistent high expression of alpha-fetopro\ufffetein, despite showing some CYP450 activity, as well as\nglycogen and lipid storage activity (82). It is likely that these\nhurdles regarding iPSC-derived HLC production will be\novercome in the near future, with several groups working on\nthis worldwide (83). However, a main safety concern for\nclinical applications is their tumorigenic potential, which\nneeds to be solved before these cells can be used safely in\nhumans.\nIn an attempt to decrease the immune response against\ntransplanted allogeneic cells in patients with liver-based\nmetabolic defects and thus improving engraftment, ex vivo\ngenetic correction of hepatocytes for autologous transplanta\ufffetion may be considered. This approach was used more than\ntwo decades ago in five patients with familial hypercholester\ufffeolemia who underwent partial hepatectomy of the left lateral\nlobe, followed by hepatocyte isolation, retroviral transduction\nHepatocyte transplantation | Review\nCopyright © 2018 International Pediatric Research Foundation, Inc. Volume 83 | Number 1 | January 2018 Pediatric RESEARCH 237\n\nof the low-density lipoprotein (LDL) receptor, and autologous\ntransplantation. Although significant and prolonged reduc\ufffetions in LDL cholesterol were demonstrated in three out of\nfive patients, the use of retroviral viruses—unable to transduce\nnonproliferating cells—drastically impaired clinical efficacy\n(45). This approach has been recently reconsidered in a\nporcine model of hereditary tyrosinemia type I, in which\nex vivo transduction of hepatocytes with lentiviral vector\ncarrying FAH missing gene was performed followed by\nautologous transplantation, with very encouraging results\n(84). This approach would be even more promising if applied\nto HLC derived from iPSCs, thus decreasing the invasiveness\nof the method.\nFinally, a simple approach to avoid the immune reaction\nduring HT has been proposed for the management of patients\nwith ALF. Human hepatocytes can be encapsulated in alginate\nmicrobeads (85), and then transplanted intraperitoneally.\nThis approach would allow transplanted donor hepatocytes to\nperform all the hepatic functions absent in the failing liver,\nwithout the need of immunosuppression as the alginate would\nbe able to protect donor cells from the host immune cells. The\ntechnique has been proven successful in a rat model of acute\nliver injury (35), and has shown encouraging results when\nused in children with ALF (unpublished). Furthermore, a\nrecent study has shown that alginate microbeads containing\nhepatocytes can be cryopreserved with some maintenance of\nhepatic functions after thawing, figuring the possibility of an\noff-the-shelf product available in an emergency setting typical\nof fulminant liver failure (86).\nCONCLUSION\nThe last two decades have seen a considerable development of\nhepatocyte transplantation, with demonstration of short-term\nefficacy and safety. However, some hurdles still need to be\novercome to widen hepatocyte transplantation clinical\napplications, mainly regarding isolation of high-quality cells\nfrom marginal donor liver, improvement of cell engraftment,\nand long-lasting effects, as well as optimal immunosuppres\ufffesion regimen identification.\nNew challenges are needed to improve hepatocyte trans\ufffeplantation efficacy, and include mainly the identification of\nnew cell sources, which could overcome liver donor scarcity,\nand new approaches to decrease the impact of immune\nresponse against transplanted cells, hence improving cell\nengraftment in liver-based metabolic disorders.\nSTATEMENT OF FINANCIAL SUPPORT\nThe authors acknowledge “MowatLabs” for financial support.\nDisclosure: The authors declare no conflict of interest.\nREFERENCES\n1. Matas AJ, Sutherland DE, Steffes MW, et al. Hepatocellular\ntransplantation for metabolic deficiencies: decrease of plasma bilirubin\nin Gunn rats. Science 1976;192:892–4.\n2. Sutherland DE, Numata M, Matas AJ, Simmons RL, Najarian JS.\nHepatocellular transplantation in acute liver failure. Surgery 1977;82:\n124–32.\n3. Yoshida Y, Tokusashi Y, Lee GH, Ogawa K. Intrahepatic transplantation\nof normal hepatocytes prevents Wilson’s disease in Long-Evans\ncinnamon rats. Gastroenterology 1996;111:1654–60.\n4. De Vree JM, Ottenhoff R, Bosma PJ, Smith AJ, Aten J, Oude Elferink RP.\nCorrection of liver disease by hepatocyte transplantation in a mouse\nmodel of progressive familial intrahepatic cholestasis. Gastroenterology\n2000;119:1720–30.\n5. Mito M, Kusano M, Kawaura Y. Hepatocyte transplantation in man.\nTransplant Proc 1992;24:3052–3.\n6. Gramignoli R, Vosough M, Kannisto K, Srinivasan RC, Strom SC.\nClinical hepatocyte transplantation: practical limits and possible\nsolutions. Eur Surg Res 2015;54:162–77.\n7. Meyburg J, Das AM, Hoerster F, et al. One liver for four children: first\nclinical series of liver cell transplantation for severe neonatal urea cycle\ndefects. Transplantation 2009;87:636–41.\n8. Stéphenne X, Najimi M, Sibille C, Nassogne MC, Smets F, Sokal EM.\nSustained engraftment and tissue enzyme activity after liver cell\ntransplantation for argininosuccinate lyase deficiency. Gastroenterology\n2006;130:1317–23.\n9. Mitry RR, Dhawan A, Hughes RD, et al. One liver, three recipients:\nsegment IV from split-liver procedures as a source of hepatocytes for cell\ntransplantation. Transplantation 2004;77:1614–6.\n10. Dhawan A, Mitry RR, Hughes RD, et al. Hepatocyte transplantation for\ninherited factor VII deficiency. Transplantation 2004;78:1812–4.\n11. Muraca M, Gerunda G, Neri D, et al. Hepatocyte transplantation\nas a treatment for glycogen storage disease type 1a. Lancet 2002;359:\n317–8.\n12. Sokal EM, Smets F, Bourgois A, et al. Hepatocyte transplantation in a 4-\nyear-old girl with peroxisomal biogenesis disease: technique, safety, and\nmetabolic follow-up. Transplantation 2003;76:735–8.\n13. Stéphenne X, Debray FG, Smets F, et al. Hepatocyte transplantation using\nthe domino concept in a child with tetrabiopterin nonresponsive\nphenylketonuria. Cell Transplant 2012;21:2765–70.\n14. Beck BB, Habbig S, Dittrich K, et al. Liver cell transplantation in severe\ninfantile oxalosis–a potential bridging procedure to orthotopic liver\ntransplantation? Nephrol Dial Transplant 2012;27:2984–9.\n15. Habibullah C, Syed I, Qamar A, Taher-Uz Z. Human fetal hepatocyte\ntransplantation in patients with fulminant hepatic failure. Transplanta\ufffetion 1994;58:951–2.\n16. Bilir BM, Guinette D, Karrer F, et al. Hepatocyte transplantation in acute\nliver failure. Liver Transpl 2000;6:32–40.\n17. Khan AA, Habeeb A, Parveen N, et al. Peritoneal transplantation of\nhuman fetal hepatocytes for the treatment of acute fatty liver of\npregnancy: a case report. Trop Gastroenterol 2004;25:141–3.\n18. Schneider A, Attaran M, Meier PN, et al. Hepatocyte transplantation in\nan acute liver failure due to mushroom poisoning. Transplantation\n2006;82:1115–6.\n19. Dhawan A, Puppi J, Hughes RD, Mitry RR. Human hepatocyte\ntransplantation: current experience and futurie challenges. Nat Rev\nGastroenterol Hepatol 2010;7:288–98.\n20. Ibars EP, Cortes M, Tolosa L, et al. Hepatocyte transplantation program:\nlessons learned and future strategies. World J Gastroenterol. 2016;22:\n874–86.\n21. Stéphenne X, Najimi M, Ngoc DK, et al. Cryopreservation of human\nhepatocytes alters the mitochondrial respiratory chain complex 1. Cell\nTransplant 2007;16:409–19.\n22. Wang LJ, Chen YM, George D, et al. Engraftment assessment in human\nand mouse liver tissue after sex-mismatched liver cell transplantation by\nreal-time quantitative PCR for Y chromosome sequences. Liver Transpl\n2002;8:822–8.\n23. Tolosa L, Pareja-Ibars E, Teresa Donato M, et al. Neonatal livers: a source\nfor the isolation of good-performing hepatocytes for cell transplantation.\nCell Transplant 2014;23:1229–42.\nReview | Iansante et al.\n238 Pediatric RESEARCH Volume 83 | Number 1 | January 2018 Copyright © 2018 International Pediatric Research Foundation, Inc.\n\n24. Khan AA, Shaik MV, Parveen N, et al. Human fetal liver-derived stem cell\ntransplantation as supportive modality in the management of end-stage\ndecompensated liver cirrhosis. Cell Transplant 2010;19:409–18.\n25. Stangou AJ, Heaton ND, Rela M, Pepys MB, Hawkins PN, Williams R.\nDomino hepatic transplantation using the liver from a patient with\nfamilial amyloid polyneuropathy. Transplantation 1998;65:1496–8.\n26. Berry MN, Friend DS. High-yield preparation of isolated rat liver\nparenchymal cells: a biochemical and fine structural study. J Cell Biol\n1969;43:506–20.\n27. Seglen PO. Preparation of isolated rat liver cells. Methods Cell Biol\n1976;13:29–83.\n28. Mitry RR, Hughes RD, Aw MM, et al. Human hepatocyte isolation and\nrelationship of cell viability to early graft function. Cell Transplant\n2003;12:69–74.\n29. Terry C, Dhawan A, Mitry RR, Lehec SC, Hughes RD. Optimization of\nthe cryopreservation and thawing protocol for human hepatocytes for use\nin cell transplantation. Liver Transplant 2010;16:229–37.\n30. Gramignoli R, Tahan V, Dorko K, et al. Rapid and sensitive assessment of\nhuman hepatocyte functions. Cell Transplant 2014;23:1545–56.\n31. Rajvanshi P, Kerr A, Bhargava KK, Burk RD, Gupta S. Studies of liver\nrepopulation using the dipeptidyl peptidase IV-deficient rat and other\nrodent recipients: cell size and structure relationships regulate capacity for\nincreased transplanted hepatocyte mass in the liver lobule. Hepatology\n1996;23:482–96.\n32. Rajvanshi P, Kerr A, Bhargava KK, Burk RD, Gupta S. Efficacy and safety\nof repeated hepatocyte transplantation for significant liver repopulation\nin rodents. Gastroenterology 1996;111:1092–102.\n33. Dhawan A. Clinical human hepatocyte transplantation: current status and\nchallenges. Liver Transplant 2015;21:S39–44.\n34. Strom SC, Chowdhury JR, Fox IJ. Hepatocyte transplantation for the\ntreatment of human disease. Semin Liver Dis 1999;19:39–48.\n35. Jitraruch S, Dhawan A, Hughes RD, et al. Alginate microencapsulated\nhepatocytes optimised for transplantation in acute liver failure. PLoS\nONE 2014;9:e113609.\n36. Strom SC, Fisher RA, Rubinstein WS, et al. Transplantation of human\nhepatocytes. Transplant Proc 1997;29:2103–6.\n37. Horslen SP, McCowan TC, Goertzen TC, et al. Isolated hepatocyte\ntransplantation in an infant with a severe urea cycle disorder. Pediatrics\n2003;111 (6 Pt 1): 1262–7.\n38. Stéphenne X, Najimi M, Smets F, Reding R, De Ville De Goyet J, Sokal\nEM. Cryopreserved liver cell transplantation controls ornithine\ntranscarbamylase deficient patient while awaiting liver transplantation.\nAm J Transplant 2005;5:2058–61.\n39. Puppi J, Tan N, Mitry RR, et al. Hepatocyte transplantation followed by\nauxiliary liver transplantation–a novel treatment for ornithine\ntranscarbamylase deficiency. Am J Transpl 2008;8:452–7.\n40. Soltys KA, Setoyama K, Tafaleng EN, et al. Host conditioning and\nrejection monitoring in hepatocyte transplantation in humans. J Hepatol\n2017;66:987–1000.\n41. Fox IJ, Chowdhury JR, Kaufman SS, et al. Treatment of the Crigler–Najjar\nsyndrome type I with hepatocyte transplantation. N Engl J Med 1998;338:\n1422–7.\n42. Ambrosino G, Varotto S, Strom SC, et al. Isolated hepatocyte\ntransplantation for Crigler-Najjar syndrome type 1. Cell Transplant\n2005;14:151–7.\n43. Lysy P-A, Najimi M, Stephenne X, Bourgois A, Smets F, Sokal E-M. Liver\ncell transplantation for Crigler-Najjar syndrome type I: update and\nperspectives. World J Gastroenterol 2008;14:3464–70.\n44. Lee K-W, Lee J-H, Shin SW, et al. Hepatocyte transplantation for\nglycogen storage disease type Ib. Cell Transplant 2007;16:629–37.\n45. Grossman M, Rader DJ, Muller DWM, et al. A pilot study of ex vivo gene\ntherapy for homozygous familial hypercholesterolaemia. Nat Med 1995;1:\n1148–54.\n46. Asonuma K, Gilbert JC, Stein JE, Takeda T, Vacanti JP. Quantitation of\ntransplanted hepatic mass necessary to cure the gunn rat model of\nhyperbilirubinemia. J Pediatr Surg 1992;27:298–301.\n47. Bumgardner GL, Orosz CG. Unusual patterns of alloimmunity evoked by\nallogeneic liver parenchymal cells. Immunol Rev 2000;174:260–79.\n48. Thomson AW, Knolle PA. Antigen-presenting cell function in the\ntolerogenic liver environment. Nat Rev Immunol 2010;10:753–66.\n49. Oldhafer F, Bock M, Falk CS, Vondran FW. Immunological aspects of\nliver cell transplantation. World J Transplant 2016;6:42.\n50. Gupta S, Rajvanshi P, Sokhi R, et al. Entry and integration of transplanted\nhepatocytes in rat liver plates occur by disruption of hepatic sinusoidal\nendothelium. Hepatology 1999;29:509–19.\n51. Olszewski WL, Interewicz B, Durlik M, Rudowska A, Mecner B. Early loss\nof transplanted autologous hepatocytes-lysis by leukocytes in vivo and\nin vitro. Transplant Proc 2001;33:651–3.\n52. Gustafson EK, Elgue G, Hughes RD, et al. The instant blood-mediated\ninflammatory reaction characterized in hepatocyte transplantation.\nTransplantation 2011;91:632–8.\n53. Lee CA, Dhawan A, Smith RA, Mitry RR, Fitzpatrick E. Instant blood\ufffemediated inflammatory reaction in hepatocyte transplantation: current\nstatus and future perspectives. Cell Transplant 2016;25:1227–36.\n54. Bumgardner GL, Heininger M, Li J, et al. A functional model of\nhepatocyte transplantation for in vivo immunologic studies.\nTransplantation 1998;65:53–61.\n55. Overturf K, Al-Dhalimy M, Tanguay R, et al. Hepatocytes corrected by\ngene therapy are selected in vivo in a murine model of hereditary\ntyrosinaemia type I. Nat Genet 1996;12:266–73.\n56. Ding J, Yannam GR, Roy-Chowdhury N, et al. Spontaneous hepatic\nrepopulation in transgenic mice expressing mutant human α1-antitrypsin\nby wild-type donor hepatocytes. J Clin Invest 2011;121:1930–4.\n57. Gupta S. Cell therapy to remove excess copper in Wilson’s disease. Ann N\nY Acad Sci 2014;1315:70–80.\n58. Xiang D, Liu C, Wang M, et al. Non-viral FoxM1 gene delivery to\nhepatocytes enhances liver repopulation. Cell Death Dis 2014;5:e1252.\n59. Jorns C, Nowak G, Nemeth A, et al. De novo donor-specific HLA\nantibody formation in two patients with Crigler-Najjar Syndrome type I\nfollowing human hepatocyte transplantation with partial hepatectomy\npreconditioning. Am J Transplant 2016;16:1021–30.\n60. Dagher I, Boudechiche L, Branger J, et al. Efficient hepatocyte\nengraftment in a nonhuman primate model after partial portal vein\nembolization. Transplantation 2006;82:1067–73.\n61. Puppi J, Strom SC, Hughes RD, et al. Improving the techniques for\nhuman hepatocyte transplantation:Report from a consensus meeting\nin London. Cell Transplant 2012;21:1–10.\n62. Mochizuki S, Kawashita Y, Eguchi S, et al. Liver repopulation by\ntransplanted hepatocytes in a rat model of acute liver failure induced by\ncarbon tetrachloride and a partial hepatectomy. Ann Transpl 2010;15:\n49–55.\n63. Irani AN, Malhi H, Slehria S, et al. Correction of liver disease following\ntransplantation of normal rat hepatocytes into Long-Evans Cinnamon\nrats modeling Wilson’s disease. Mol Ther 2001;3:302–9.\n64. Abdalla EK. Portal vein embolization (prior to major hepatectomy) effects\non regeneration, resectability, and outcome. J Surg Oncol 2010;102:960–7.\n65. Dagher I, Nguyen TH, Groyer-Picard MT, et al. Efficient hepatocyte\nengraftment and long-term transgene expression after reversible portal\nembolization in nonhuman primates. Hepatology 2009;49:950–9.\n66. Goulinet-Mainot S, Tranchart H, Groyer-Picard MT, et al. Improved\nhepatocyte engraftment after portal vein occlusion in LDL receptor\ufffedeficient WHHL rabbits and lentiviral-mediated phenotypic correction\nin vitro. Cell Med 2012;4:85–98.\n67. Zhou H, Dong X, Kabarriti R, et al. Single liver lobe repopulation with\nwildtype hepatocytes using regional hepatic irradiation cures jaundice in\nGunn rats. PLoS ONE 2012;7:e46775.\n68. Ashokkumar C, Bentlejewski C, Sun Q, et al. Allospecific CD154+ B cells\nassociate with intestine allograft rejection in children. Transplantation\n2010;90:1226–31.\n69. Ashokkumar C, Talukdar A, Sun Q, et al. Allospecific CD154+ T cells\nassociate with rejection risk after pediatric liver transplantation. Am J\nTransplant 2009;9:179–91.\nHepatocyte transplantation | Review\nCopyright © 2018 International Pediatric Research Foundation, Inc. Volume 83 | Number 1 | January 2018 Pediatric RESEARCH 239\n\n70. Bohnen NI, Charron M, Reyes J, et al. Use of indium-111-labeled\nhepatocytes to determine the biodistribution of transplanted hepatocytes\nthrough portal vein infusion. Clin Nucl Med 2000;25:447–50.\n71. Puppi J, Mitry RR, Modo M, Dhawan A, Raja K, Hughes RD. Use of a\nclinically approved iron oxide MRI contrast agent to label human\nhepatocytes. Cell Transplant 2011;20:963–75.\n72. Raschzok N, Teichgräber U, Pratschke J, Sauer I. Preclinical swine models\nfor monitoring of hepatocyte transplantation by MRI. Methods Mol Biol\n2017;1506:201–14.\n73. Mas VR, Maluf DG, Thompson M, Ferreira-Gonzalez A, Fisher RA.\nEngraftment measurement in human liver tissue after liver cell\ntransplantation by short tandem repeats analysis. Cell Transplant\n2004;13:231–6.\n74. Vallabhajosyula P, Korutla L, Habertheuer A, et al. Tissue-specific\nexosome biomarkers for noninvasively monitoring immunologic rejection\nof transplanted tissue. J Clin Invest 2017;127:1–17.\n75. Schütz E, Fischer A, Beck J, et al. Graft-derived cell-free DNA, a\nnoninvasive early rejection and graft damage marker in liver transplanta\ufffetion: a prospective, observational, multicenter cohort study. PLoS Med\n2017;14:1–19.\n76. Nicolas C, Wang Y, Luebke-Wheeler J, Nyberg S. Stem cell therapies for\ntreatment of liver disease. Biomedicines 2016;4:2.\n77. Najimi M, Khuu DN, Lysy PA, et al. Adult-derived human liver\nmesenchymal-like cells as a potential progenitor reservoir of hepatocytes?\nCell Transplant 2007;16:717–28.\n78. Wu X-B, Tao R. Hepatocyte differentiation of mesenchymal stem cells.\nHepatobiliary Pancreat Dis Int 2012;11:360–71.\n79. Iyer SS, Rojas M. Anti-inflammatory effects of mesenchymal stem\ncells: novel concept for future therapies. Expert Opin Biol Ther 2008;8:\n569–81.\n80. Fitzpatrick E, Wu Y, Dhadda P, et al. Co-culture with mesenchymal stem\ncells results in improved viability and function of human hepatocytes.\nCell Transplant 2013;24:1–29.\n81. Roy-Chowdhury N, Wang X, Guha C, Roy-Chowdhury J. Hepatocyte-like\ncells derived from induced pluripotent stem cells. Hepatol Int 2016;11:\n1–16.\n82. Baxter M, Withey S, Harrison S, et al. Phenotypic and functional analyses\nshow stem cell-derived hepatocyte-like cells better mimic fetal rather than\nadult hepatocytes. J Hepatol 2015;62:581–9.\n83. Hannoun Z, Steichen C, Dianat N, Weber A, Dubart-Kupperschmitt A.\nThe potential of induced pluripotent stem cell derived hepatocytes.\nJ Hepatol 2016;65:182–99.\n84. Hickey RD, Mao SA, Glorioso J, et al. Curative ex vivo liver-directed gene\ntherapy in a pig model of hereditary tyrosinemia type 1. Sci Transl Med\n2016;8:1–10.\n85. Mitry RR, Jitraruch S, Iansante V, Dhawan A. Alginate encapsulation of\nhuman hepatocytes and assessment of microbeads. Methods Mol Biol\n2017: 273–81.\n86. Jitraruch S, Dhawan A, Hughes RD, et al. Cryopreservation of hepatocyte\nmicrobeads for clinical transplantation. Cell Transplant 2017;26:1341–54.\nReview | Iansante et al.\n240 Pediatric RESEARCH Volume 83 | Number 1 | January 2018 Copyright © 2018 International Pediatric Research Foundation, Inc.\n\n']","This article discusses recent advances in the field of hepatocyte transplantation, focusing on the improvement of hepatocyte engraftment and the use of stem cells and gene therapy to enhance liver repopulation. It highlights the challenges associated with hepatocyte transplantation, such as low cell viability during cryopreservation and storage, and proposes solutions such as the use of alginate microbeads to encapsulate hepatocytes and prevent immune responses. The article also touches upon the use of mesenchymal stem cells and induced pluripotent stem cells to generate hepatocyte-like cells, which may offer a potential alternative to traditional hepatocyte transplantation. Overall, the article emphasizes the importance of ongoing efforts to optimize hepatocyte transplantation techniques and improve clinical outcomes for patients with liver diseases.",1.0,0.8577089723490525,FULL_PAPER
How has the evidence changed regarding acceptable macro/microsteatosis in liver grafts?,"['REVIEW\npublished: 24 June 2020\ndoi: 10.3389/fimmu.2020.01326\nFrontiers in Immunology | www.frontiersin.org 1 June 2020 | Volume 11 | Article 1326\nEdited by:\nYe Htun Oo,\nUniversity of Birmingham,\nUnited Kingdom\nReviewed by:\nReem Al-Daccak,\nInstitut National de la Santé et de la\nRecherche Médicale\n(INSERM), France\nFederica Casiraghi,\nMario Negri Pharmacological\nResearch Institute, Italy\n*Correspondence:\nZhonghua Klaus Chen\nzc104126@126.com\nSpecialty section:\nThis article was submitted to\nAlloimmunity and Transplantation,\na section of the journal\nFrontiers in Immunology\nReceived: 24 March 2020\nAccepted: 26 May 2020\nPublished: 24 June 2020\nCitation:\nDu X, Chang S, Guo W, Zhang S and\nChen ZK (2020) Progress in Liver\nTransplant Tolerance and\nTolerance-Inducing Cellular Therapies.\nFront. Immunol. 11:1326.\ndoi: 10.3389/fimmu.2020.01326\nProgress in Liver Transplant\nTolerance and Tolerance-Inducing\nCellular Therapies\nXiaoxiao Du1\n, Sheng Chang2\n, Wenzhi Guo1\n, Shuijun Zhang1 and Zhonghua Klaus Chen2\n*\n1 Henan Key Laboratory of Digestive Organ Transplantation, Open and Key Laboratory of Hepatobiliary & Pancreatic Surgery\nand Digestive Organ Transplantation at Henan Universities, ZhengZhou Key Laboratory of Hepatobiliary & Pancreatic\nDiseases and Organ Transplantation, Department of Hepatobiliary and Pancreatic Surgery, The First Affiliated Hospital of\nZhengzhou University, Zhengzhou, China, 2 Key Laboratory of Organ Transplantation, Institute of Organ Transplantation,\nTongji Hospital, Tongji Medical College, Huazhong University of Science and Technology, Ministry of Education, NHC Key\nLaboratory of Organ Transplantation, Key Laboratory of Organ Transplantation, Chinese Academy of Medical Sciences,\nWuhan, China\nLiver transplantation is currently the most effective method for treating end-stage liver\ndisease. However, recipients still need long-term immunosuppressive drug treatment\nto control allogeneic immune rejection, which may cause various complications\nand affect the long-term survival of the recipient. Many liver transplant researchers\nconstantly pursue the induction of immune tolerance in liver transplant recipients,\nimmunosuppression withdrawal, and the maintenance of good and stable graft function.\nAlthough allogeneic liver transplantation is more tolerated than transplantation of other\nsolid organs, and it shows a certain incidence of spontaneous tolerance, there is\nstill great risk for general recipients. With the gradual progress in our understanding\nof immune regulatory mechanisms, a variety of immune regulatory cells have been\ndiscovered, and good results have been obtained in rodent and non-human primate\ntransplant models. As immune cell therapies can induce long-term stable tolerance, they\nprovide a good prospect for the induction of tolerance in clinical liver transplantation. At\npresent, many transplant centers have carried out tolerance-inducing clinical trials in liver\ntransplant recipients, and some have achieved gratifying results. This article will review the\ncurrent status of liver transplant tolerance and the research progress of different cellular\nimmunotherapies to induce this tolerance, which can provide more support for future\nclinical applications.\nKeywords: tolerance, liver transplantation, operational tolerance, cell therapy, hematopoietic stem cell\ntransplantation, regulatory T cells, regulatory dendritic cells\nINTRODUCTION\nLiver transplantation has been a preferred option for patients with end-stage liver disease. Since Dr.\nStarzl performed the first human liver transplantation in 1963, the short-term survival rate of liver\ntransplant recipients has improved significantly, which can be attributed to advances in surgical\ntechniques and immunosuppression (IS) agents (1). However, owing to the long-term use of IS\nagents, complications concerning the cardiovascular and cerebrovascular systems, diabetes, chronic\nrenal insufficiency, infection, or tumors seriously affect the long-term survival of liver transplant\nrecipients (2, 3).\n\nDu et al. Liver Transplant Tolerance\nImmunological self-tolerance refers to the ability of a healthy\nimmune system to produce a protective immune response to\npathogens and foreign antigens while maintaining tolerance to\nits own tissues. Therefore, transplant tolerance refers to accepting\norgans without the need for long-term IS and maintaining\nprotective immunity (4). Tolerance is usually classified as\ncomplete immune tolerance, operational tolerance (OT), and\nprope tolerance, referred to a condition with a low, non-toxic\ndose of IS (5). In clinical applications, the focus of the study is\nOT, that is, long-term functional graft survival in a patient not\nrequiring maintenance IS (6).\nThe liver is an immunologically privileged organ compared\nto other transplant organs such as the heart, kidney, or pancreas\n(7). Liver transplant recipients generally maintain a low level of\nIS and the hepatic graft can provide immunological protection\nwhen transplanted in combination with other solid organs (8).\nSince Calne first recognized the liver tolerance effect (8) in\n1969, people have been enthusiastic about the induction of liver\nimmune tolerance.\nAs the body’s largest digestive organ, the liver has two\nsets of blood supplies, the portal vein and the hepatic\nartery. It is constantly exposed to enterically-derived blood\ufffeborne pathogens, which gives the liver a unique form of\nimmune privilege (9). Numerous sinuses constitute the largest\nreticuloendothelial system in the human body and contain\nthe largest number of specialized and non-specialized antigen\ufffepresenting cells (APC) and cells that maintain liver immune\ntolerance, including resident macrophages (also known as\nKupffer cells), dendritic cells, hepatocytes, hepatic sinusoidal\nendothelial cells (LSECs), and hepatic stellate cells (HSCs) (10).\nWhen pathogen-derived products such as lipopolysaccharides\npass through the liver, like an immune filter, their concentration\ncould be reduced 100-fold, enabling the hepatic immune\nmicroenvironment to have sufficient capacity to regulate the\nnature and intensity of its response (11). Numerous immune\nregulatory mechanisms in the liver, including downregulation\nof co-stimulatory molecules, secretion of inhibitory cytokines,\ninhibition of effector T cell activation, and induction of\nregulatory T cells, predispose the immune response of the liver\nto tolerance rather than activation (12).\nCURRENT STATE IN SPONTANEOUS\nTOLERANCE\nFactually, in liver transplantation, spontaneous tolerance\ninitially came from the casual clinical observation. Owing\nto poor compliance, infection complications, posttransplant\nlymphoproliferative disease (PTLD) or doctor’s advice, some\nliver transplant recipients developed spontaneous tolerance after\nAbbreviations: IS, immunosuppression; OT, operational tolerance; APC, antigen\ufffepresenting cells; NK cells, natural killer cells; PBMC, peripheral blood\nmononuclear cells; HSCs, hematopoietic stem cells; HSCT, hematopoietic stem\ncell transplantation; GVHD, graft vs. host disease; Tregs, regulatory T cells; DC,\ndendritic cells; regDC, regulatory dendritic cells; tolDC, tolerogenic dendritic\ncells; GM-CSF, granulocyte-macrophage colony-stimulating factor; GMP, Good\nmanufacturing practice.\ndiscontinuing IS, which has aroused great interest of transplant\nresearchers. In 1993, Reyes et al. in Pittsburgh reported that\n8 liver transplant recipients with poor compliance ceased IS\nfrom 0.5 to 11 years after transplantation, but unexpectedly\ndeveloped OT. Among them, after weaving from IS, 7 recipients\nmaintained good allograft function for 1 to 14.3 years. The\nremaining recipient underwent liver retransplantation after 7.7\nyears of IS withdrawal for viral hepatitis. In addition, 6 recipients\nwere shown to have systemic chimerism (13).\nOver nearly three decades, many liver transplant centers\nhave conducted clinical trials of IS withdrawal in both adult\nand pediatric liver transplant recipients. It has been reported\nthat normal liver function was successfully maintained in adult\nand child liver transplant recipients, with ∼20% of patients\n(6–63%) achieving complete immunosuppressive withdrawal\n(Tables 1, 2) (14–33).\nSanchez-Fueyo et al. of the Hospital Clinic of Barcelona\nconducted a prospective and multicenter IS withdrawal clinical\ntrial in 98 liver transplant recipients (NCT00647283). Of these,\n41 achieved clinical tolerance (41.8%) and 57 developed mild\nrejection (58.2%), which was followed by remission within 5.6\nmonths. During the 3-year follow-up after IS withdrawal, no\nsignificant histological damage was found in liver biopsies of the\ntolerant recipients. Statistical analysis showed that years post\ufffetransplantation correlated positively with tolerance induction\nand could be the strongest predictor (27).\nComparing with calcineurin inhibitors (CNI), sirolimus,\na kind of rapamycin inhibitor (mTOR-I), has no significant\ndrug toxicity, such as nephrotoxicity, hypertension, diabetes,\ninfections and neoplasms (34). Another advantage of sirolimus\nis its immunomodulatory ability that could facilitate safe IS\nwithdrawal (35). To assess if sirolimus could increase the\ntolerability in liver transplant recipients, Levitsky et al., at\nNorthwestern University, performed a prospective clinical trial\nof single sirolimus withdrawal (NCT02062944). They recruited\n15 recipients with non-viral or immunological hepatitis more\nthan 3 years after liver transplantation. After 12 months from\nsirolimus withdraw, it showed that 8 recipients (53%) achieved\nOT. Of the other 7 patients, 3 failed IS withdrawal, 3 developed\nmoderate cellular rejection (TCMR) on liver biopsies at the end\nof the study, and 1 was withdrawn from the trial owing to\nadrenal metastasis of hepatocellular carcinoma (32). The current\nresult showed the OT rate of sirolimus was comparable to CNI\ufffewithdrawal studies. Except for free CNI toxicity, whether liver\nrecipients can benefit more from sirolimus withdrawal, it still\nneeds more and larger trials.\nFor pediatric liver transplant recipients, Feng et al. in the\nUniversity of California conducted a multicenter, prospective\nclinical trial of IS withdrawal (WISP-R, NCT00320606). A total\nof 12 (60%) of the 20 enrolled pediatric recipients achieved\nclinical tolerance, and during follow-up for more than 2 years\nafter IS withdrawal, the graft function was normal and there\nwas no significant change in biopsy compared with baseline.\nA total of 3 recipients underwent acute rejection (n = 2) or\nuncertain rejection (n = 1) during IS withdrawal, and 4 recipients\nfailed to achieve clinical tolerance owing to uncertain acute\nrejection within 1 year of drug withdrawal. Their graft function\nFrontiers in Immunology | www.frontiersin.org 2 June 2020 | Volume 11 | Article 1326\n\nDu et al. Liver Transplant Tolerance TABLE 1 | Immunosuppression withdrawal trials (≥10 recipients, single center). ID Year Author Transplant center Adult or pediatric No. of recipients Donor (DD or LD) HCV+ or AIH ? IS Time from LT to IS withdraw (Years) Follow-up after IS withdraw (Months) OT N (%) Rejecton N (%) References / 1997 Mazariegos Pittsburgh Both 95 DD Yes CsA/AZA/ Pred 8.4 ± 4.7 35.5 (10.1–57.2) 18 (19%) 18 (19%) (14) / 1998 2005 Devlin; Girlanda London Adult 18 DD Yes CsA/AZA/ Pred 7 (5∼11) 120 2 (11%) 7 (39%) (15, 16) / 2001 Takatsuki Kyoto University Pediatric 26 LD No TAC >2 25 (3∼69) 6(23%) 16 (25.4%) (17) / 2002 Oike Kyoto University Pediatric 115 LD No TAC / 4∼96 49(42%) 20 (17%) (18) / 2005 Eason New Orleans Adult 18 Yes TAC >0.5 6∼12 1 (6%) 11 (61%) (19) / 2005 2010 Tryphonopoulos Miami Adult 104 DD Yes TAC/CsA/ SRL 4.1 ± 0.3 7.27 ± 0.28 23(22%) 71 (68%) (20, 21) / 2006 2008 Tisone; Orlando University of Rome Adult 34 DD only HCV+ CsA 5.3 ± 1.7 63.5 ± 20.1 7 (20%) 26 (76.5%) (22, 23) / 2007 Assy Western Ontario Adult 26 DD Yes CsA/AZA 4.6 ± 1.8 12 2(8%) 15 (58%) (24) / 2009 Pons Murcia Adult 20 DD No CsA 40.8 ± 26.4 47.5 (10–131) 8(40%) 6 (30%) (25) / 2013 de la Garza Pamplona Adult 24 DD No TAC/CsA/ SRL 9.3 (6∼13.3) 14(8.5∼22.5) 15 (63%) 2 (8.3%) (28) 2011- 02-003IA 2015 Lin Taipei Pediatric 16 Both Yes TAC 7.8 ± 5.4 40.75 ± 5.98 5 (31%) 6 (38%) (29) NCT02062944 2019 Levitsky Transplant Center Adult 15 Both No SRL 8.1 (4.5∼12) 18 (12∼24)Months 8 (53%) 6 (40%) (32) CNI, calcineurin inhibitor; CsA, Cyclosporine A; Pred, prednisone; SRL, sirolimus; DD, deceased donor; LD, living donor; LT, liver transplant; IS, immunosuppression; OT, operational tolerance.\nFrontiers in Immunology | www.frontiersin.org\n3 June 2020 | Volume 11 | Article 1326\n\nDu et al. Liver Transplant Tolerance TABLE 2 | Immunosuppression withdrawal trials (≥10 recipients, Mul-Center). ID Year Author Country Adult or pediatric No. of recipients Donor (DD or LD) HCV\n+\nor AIH ?\nIS Time from\nLT to IS\nwithdraw\n(Years)\nFollow-up\nafter IS\nwithdraw\n(Months)\nOT N\n(%)\nRejection N\n(%)\nReferences\nNCT00647283 2012 Benitez Spain/UK/Italy Adults 98 Not mention No AIH,\nHCV\n+\nincluded\nTAC/CsA/AZA 8.6\n± 3.9 48.9\n± 7.7 41 (42%) 57 (58%) (27)\nWISP-R,\nNCT00320606\n2012 2017 Feng S U.S. Pediatric 20 LD No TAC/CsA 8.5 (6.4\n∼\n10.75)\n48(1 quit at\n33.3 Months)\n12(60%) 2(10%);\n5(25%)not\ncertain\nrejection\n(26, 30)\nITN030ST 2019 Jucaud U.S. Adults 31 Not mention No AIH,\nHCV\n+\nincluded\nSingle CNI 1 14(12.3\n∼24.3) 9(29%) 13(42%) (31)\nITN030ST\nA-WISH\nNCT00135694\n2019 Shaked U.S. Adults 77 DD No AIH,\nHCV\n+\nincluded\nsingle CNI or\nantimetabolite\n1∼2 24 10(18%) 32(42%) (33)\nCNI, calcineurin inhibitor; CsA, Cyclosporine A; Pred, prednisone; SRL, sirolimus; DD, deceased donor; LD, living donor; LT, liver transplant; IS, immunosuppression; OT, operational tolerance.\nrecovered to normal after increased or restarted IS. Another\nrecipient was withdrawn from the study after IS withdrawal for\nviolating exclusion criteria. Similar to the results of the adult\nstudy, the time after transplantation was significantly longer in\nthe tolerance group than in the non-tolerance group, suggesting\nthat the time after transplantation is an important predictor of\ntolerance formation (26). Of 12 OT recipients followed for 5\nyears, 9 cases were positive for class I or class II DSA, but no cases\nresulted in chronic rejection, graft loss, or death. According to the\ngraft biopsy, there was no progressive increase in inflammation\nor fibrosis, suggesting that liver grafts after immune retreat can\nmaintain stability during a certain period of time (30).\nThere are also many studies focused on biomarkers that can\npredict immune tolerance. Bohne, et al. found that recipients\nwith spontaneous tolerance show an increased number of natural\nkiller (NK) cells and γδT cells in peripheral blood. High levels of\nhepcidin in liver tissues and ferritin in the serum, increased iron\ndeposits in hepatocytes, and high expression of the related liver\ntissue genes can accurately predict the outcome for a group of\nindependent patients with IS withdrawal (36). Mazariegos et al.\nshowed that the ratio of monocytoid dendritic cells (mDC) and\nplasmacytoid dendritic cells (pDC) precursors in the peripheral\nblood of patients with tolerance increased significantly compared\nto the healthy control group and the IS maintenance group\n(37). Levitsky et al. also found that, compared with the baseline,\nthe tolerogenic dendritic cells (tolDC), regulatory B cells (Breg),\nand cell phenotypes associated with chronic antigen presentation\nin peripheral blood of the OT group was significantly higher\nthan that of the non-OT group. In addition, gene signatures\nin peripheral blood/biopsy tissue showed that 12/14 LTR could\naccurately predict tolerance (32). Chruscinski et al. performed\na clinical trial (NCT02541916) for the predictive value of gene\nsignatures in peripheral blood/biopsy tissue. Preliminary results\nsuggest that 5 of the 9 patients, consistent with the inclusion\ncriteria, had discontinued IS for more than 2 years (38). However,\nthe feasibility of this method still needs to be verified by adequate\nprospective, multicenter, large-scale follow-up trials.\nLong-term studies on the safety of immunosuppressive IS\nwithdrawal regimens are inconclusive, and most of them lack\nevidence of invasive liver biopsy. However, direct comparisons\nof these trials are difficult because of the lack of standardization.\nAccording to the current research results, the acute rejection rate\nafter IS withdrawal varies from 12 to 76% (Tables 1, 2), but it is\ngenerally moderate and almost reversible. Chronic rejection is\nrare (0–6%), and the incidence of graft loss owing to rejection\nis extremely low (39, 40). Over time, however, the prevalence\nand severity of chronic graft injury such as subclinical rejection,\nchronic portal inflammation, borderline hepatitis, and/or fibrosis\n(periportal and/or perivenous) would increase (41–51). Ten years\nafter transplantation, most studies report that normal histology\nis present in up to 30% of allografts; bridging fibrosis and/or\ncirrhosis may be equally common, accounting for about 60%\n(42, 45, 52). The transcriptome analysis of liver tissue revealed\nan expression profile very similar to that of T-cell mediated\nrejection (53). Notably, more than 90 percent of patients who\nstopped IS 20 years after the transplant did not experience\nrejection (27). To date, there is no definitive data suggesting that\nFrontiers in Immunology | www.frontiersin.org 4 June 2020 | Volume 11 | Article 1326\n\nDu et al. Liver Transplant Tolerance\nprogressively abnormal histology leads to loss of liver graft or\ndeath of recipient. However, the OT is not a permanent stable\nstate, still needed regular inspection and to deal with in time.\nBecause of the difficulty to conduct prospective, multicenter,\nand longitudinal long-term studies on clinical transplant\ntolerance, the risk of IS withdrawal in liver transplant\nrecipients remains uncertain. However, based upon a broad\nunderstanding of liver disease, increased fibrosis in the allograft\nindicates the development of portal hypertension and associated\ncomplications. IS withdrawal alone could make recipients at\nthe risk of re-transplantation after some years, especially for\npediatric recipients. Therefore, there is a wide area of research\nfor the development of induced liver tolerance, especially with\ncell therapies.\nHEMATOPOIETIC STEM CELL\nTRANSPLANTATION (HSCT) FOR THE\nINDUCTION OF LIVER TRANSPLANTATION\nTOLERANCE\nMixed hematopoietic chimerism is associated with alloantigen\ntolerance, a phenomenon first identified by Owen in freemartin\ncattle (fraternal twins sharing placental circulation retain\nallogeneic tolerance to each other after birth) in 1945\n(54). Subsequently, Kashiwagi and Starzl discovered donor\nimmunoglobulin in the peripheral blood of liver recipients\nin 1969, proposing the concept of chimerism in human\ntransplantation (55).\nIn a series of pioneering studies that began in 1961, Till\nand McCulloch demonstrated that bone marrow consists of a\ngroup of cells, known as hematopoietic stem cells (HSCs), which\nhave the ability to self-renew and differentiate into multiple\nmyeloid cell types (56–58). Afterward, Starzl et al. observed\npersistent multilineage hematopoietic microchimera (defined as\n<1% donor cells) in both lymphoid and non-lymphoid tissues\nof long-lived liver or kidney transplant recipients, including\npatients on IS for many years after transplantation in 1993 (59).\nOver the past 30 years, many researchers have been exploring\nways to induce tolerance of solid organ transplantation (SOT)\nusing HSCT. Both autologous and allogeneic HSCT have been\napplied to induce transplant tolerance clinically (60–63).\nClinically, hematopoietic stem cells were first harvested from\nthe bone marrow of the ilium (64). In the 1990s, the protocol to\nmobilize stem cells into peripheral circulation with granulocyte\ncolony-stimulating factor (G-CSF) and isolate from PBMC by\nmagnetic activated cell sorting (MACS) or flow sorting, thereby\nseparating CD34+ cells, greatly amplified the clinical application\nof HSCT. Subsequent studies show that combination with\nchemokine receptor 4 antagonist (AMD3100) and G-CSF can\nmobilize stem cells more effectively (65).\nAllogeneic HSCT Inducing Chimerism\nAfter lymphoablation of the recipient, transfusion of allogeneic\ndonor bone marrow can lead to mixed hematopoietic chimerism,\nwhere genetically different donor HSCs are implanted into\nthe host and differentiate into donor-derived lymphocytes that\ncoexist with the host. Central tolerance is a key mechanism\nof allograft tolerance induced by long-term HSCs (66). When\ndonor bone marrow is injected into the host that has undergone\nlymphoablation, such as total lymphoid irradiation (TLI) and\nanti-thymocyte globulin (ATG), HSCs are implanted into the\nrecipient bone marrow and thymus for differentiation, and the\nhost immune system is repopulated with various lymphocyte\ncells from the donor following by the immunoreconstitution.\nThe presence of donor progenitor cells in the thymus leads\nto the apoptosis of T cells that recognize the donor antigen\nexpressed by the transplanted organ itself without developing\nand donor-reactive T cells would undergo clonal deletion, so\nthe host can tolerate the allograft (67). The coexistence of host\nand donor hematopoietic cells is called chimera, and it is this\nchimera state in the host that drives central tolerance. According\nto the percentage of hematopoietic cells of donor origin, the\nchimerism was divided into microchimerism (donor <1%) and\ntwo forms of macrochimerism: full chimerism (donor ∼100%)\nand mixed chimerism (donor >1% but <100%) (68). Although\ncentral tolerance is the primary mechanism for HSCs-induced\ntolerance to homo-antigens, it may be incomplete, in part because\nnot all donor antigens are expressed by HSCs in the host thymus.\nFurthermore, T lymphocytes with low affinity for their own\nantigens may escape the selection process, thereby entering the\nperipheral lymphocyte cycle. In fact, peripheral mechanisms are\nneeded to maintain immune tolerance when the self-reactive\nT cell subsets evade the thymus selection process. In the\ntransplant environment, a mild pre-treatment regimen designed\nto induce chimerism can also control the survival of mature\nalloreactive T cells through peripheral regulation mechanisms,\nresulting in clone deletion, anergy, or apoptosis of the extra\ufffethymic alloreactive T lymphocytes (66, 67, 69–71). Persistent\nmicrochimerism may also be an important determinant for long\ufffeterm graft survival and transplant tolerance (72, 73).\nSince the mid-twentieth century, scientists have used HSC\ntransfusion by injecting donor bone marrow to alter host\nimmune responses in a variety of autoimmunity diseases and\nsolid organ transplantation (SOT) (74, 75). The ideal state of\nclinical transplant tolerance is to combine HSCT with SOT\nfrom the same donor to form a stable hematopoietic chimera\nof donor and recipient (76). However, myeloablative therapy\ncarries significant risks, most notably graft vs. host disease\n(GVHD) and severe infections, which are too high-risk to be\napplied in liver transplants routinely. Therefore, researchers\ninvestigated protocols for non-myeloablative bone marrow\ntransplant, including co-stimulatory molecules blockade, low\ndose irradiation, T cell depletion by monoclonal antibody,\netc. (77–79). Chimerism has always been the main method of\ninducing tolerance in renal transplantation. Clinical studies on\ntransplant tolerance induced by bone marrow chimerism in\nrenal allografts have also achieved gratifying results. In 2008,\nKawai et al. reported the first successful application of mixed\nchimerism tolerance in human kidney transplantation without\nlong-term maintenance of IS (80). The authors then reported that\n5 out of 10 kidney recipients had achieved transplant tolerance.\nAlthough the detectable duration of chimerism was transient,\nit was observed that donor-specific mixed lymphocyte response\nFrontiers in Immunology | www.frontiersin.org 5 June 2020 | Volume 11 | Article 1326\n\nDu et al. Liver Transplant Tolerance\n(MLR) and CTL activity decreased in vitro and FOXP3 mRNA\nlevel increased in vivo (81). Based on the enriching of HSC with\ntolerogenic CD8+/TCR− facilitating cells (FC) and the depleting\nof GVHD-producing cells, Leventhal et al. performed a clinical\ntrial in 19 patients with uremia undergoing combined HLA\ufffemismatched hematopoietic stem cell/kidney transplantation.\nThen 12 of them achieved stable chimerism and OT status of\n8–48 months without GVHD after IS withdraw (82). Scandling\net al. reported that 16 of 22 HLA-matched patients who had\nreceived the same treatment regimen established a persistent\nmixed chimera (>12 months), with successful withdrawal from\nimmunosuppressants. Renal graft function was stable for up to 7\nyears after withdrawal, and no incidence of GVHD or rejection\nwas observed (83).\nIn the field of liver transplantation, there have been some\ncase reports and clinical trials with HSCT transfusion. Ringden\net al. reported a liver cancer patient who received HSCT from the\nsame donor after liver transplantation, underwent preoperative\nmyeloablation, achieved chimerism, but subsequently died of\nopportunistic infection (84). Donckier et al. recruited 5 patients\nwith advanced hepatocellular carcinoma (HCC) who underwent\nliving liver transplantation and received donor CD34+ stem\ncell transfusion based on the induction regimen of non\ufffemyeloablative therapy. Two patients successfully stopped IS\nwithout allograft rejection. Three patients developed acute\ncellular rejection after immunosuppressant withdrawal, two of\nwhich were given steroid pulse therapy, whereas the other was\nreintroduced to calcineurin inhibitor (CNI) immunosuppressive\ntherapy, with no observation of macrochimerism (85, 86).\nTryphonopoulos et al. recruited 45 adults who received\ncadaver livers and subsequently underwent transfusion of donor\nbone marrow cells on the day of the transplant. IS were\ndiscontinued for more than 3 years, starting 3 years after\nsurgery. Acute rejection occurred in 69% of the treated patients,\nand immunosuppressive therapy was successfully withdrawn\nin 22.2% of the treated recipients. However, there was no\nsignificant increase in the success of withdrawal and chimerism\nlevels, compared to patients who did not receive bone marrow\ntransplants (20). Liver transplantation is mainly performed from\ncadaver donors, and recipients generally suffer from severe\ndiseases during the perioperative period, as well as postoperative\ncoagulation and circulatory dysfunction, which may lead to\nserious infection and tumor recurrence.\nSurprisingly, Alexander et al. reported a successful case that\na 9-year-old girl with type O, RhD negative underwent RhD\nblood type conversion to positive after receiving the liver graft\nof a male donor with type O, RhD positive. Furthermore, CD19\n+ B cells (XY) were found in the sample of bone marrow\npuncture. Peripheral blood lymphocyte analysis showed that\n94% of T cells came from male and 6% from female; 98% of\nthe B cells came from male and 2% from female; 100% of\nthe granulocytes and NK cells came from male. These results\nsupport the formation of chimera. When IS was withdrawn 14\nmonths after transplantation, both the graft and the recipient\nwere healthy for 5 years without GVHD or acute rejection. This\nindicates that fully tolerated chimera can still occur under certain\nconditions (87).\nFor the application of allogeneic HSCT in liver transplant\ntolerance and chimerism, there are some challenges to overcome,\ne.g., the risk of serious infection, coagulation and circulatory\ndysfunction following the myeloablative, the tumor recurrence\nand the permanence of existence in recipient.\nAutologous HSCT Inducing Chimerism\nAutologous HSCT is performed by pre-collecting and cryo\ufffepreserving autologous bone marrow or peripheral blood stem\ncells isolated from the patient and then re-transfusing after\nmyeloablative treatment to reconstruct the immune system,\nwhich could lead to a more tolerant immune system (88, 89).\nIn autologous stem cell transplantation, the cells come from the\nrecipient, which theoretically prevents the possibility of immune\nrejection or GVHD. Moreover, autologous bone marrow or\nperipheral stem cells are easier to obtain and store.\nAlthough there are some differences between allogeneic and\nautologous HSCT with regard to tolerance mechanisms, they\nboth attempt to reconstruct the recipient immune system and\nachieve immune tolerance through “re-education.” The basic\nprinciple of autologous HSCT is to first eliminate reactive and\nmemory immunity and then regenerate the immune system;\nthat is, to exhaust autoreactive and memory T and B cells\nthrough a myeloablative or non-myeloablative regimen, followed\nby reconstruction of immune tolerance (89, 90). The immune\nmonitoring analyses have shown that this can recreate new\nauto-tolerant immune T and B cell banks, enhance immune\nregulation mechanisms, and induce changes in the recipient’s\nanti-inflammatory environment (63, 91–95). Muraro et al. found\na large number of new T cell clones emerged after autologous\nHSCT in patients with multiple sclerosis (MS), substituting for\nthe original T cell receptor (TCR) bank and showing a greater\ndiversity of TCR spectrum (63). The immune cell gene expression\nprofiles showed that the number of CD3 + cells remained low\nafter autologous HSCT, and the number of CD8 + cells could\nreturn to normal after 3 months postoperatively (92). Another\nimportant phenotypic observation is that the recipient’s CD4 +\nCD25 + FoxP3 + regulatory T cells (Tregs) were significantly\nincreased (96–98) and so were the CD8 + Foxp3 + Tregs (99),\ncompared to the preoperative state. The ratio of Bregs increased\nbriefly after autologous HSCT and remained at a higher level for\nat least 2 years after transplantation, suggesting that Bregs may\nbe involved in the reconstruction of self-tolerance after AHSCT\n(95, 100). In addition, a variety of cells, such as IL-2, IL-4, IL-6, IL\ufffe8, IL-10, IL-17, IL-18, IFN-γ, TNF-α, and TGF-β play an essential\nrole in immune reconstruction and regulation (95, 97).\nIn recent years, autologous HSCT has been used in clinical\ntrials to eliminate various types of refractory autoimmune\ndiseases such as multiple sclerosis, systemic sclerosis (SSc),\nsystemic lupus erythematous (SLE), rheumatoid arthritis (RA),\nCrohn’s disease, juvenile arthritis, and type 1 diabetes (T1D),\npresenting better results than traditional therapies and showing\npromising prospects for long-term remission of autoimmune\ndiseases without IS (90, 93, 95, 101–105). At present, autologous\nHSCT has also been widely used in various types of liver\ncirrhosis, improving liver function in varying degrees (106–109).\nCoupled with the study of transplant animal models, these studies\nFrontiers in Immunology | www.frontiersin.org 6 June 2020 | Volume 11 | Article 1326\n\nDu et al. Liver Transplant Tolerance\nprovide abundant theoretical basis for expanding autologous\nHSCT application in organ transplantation (110–112).\nIn Toronto University (Canada), Levy et al. have performed a\nclinical trial on autologous HSCT for allogeneic organ transplant\ntolerance (ASCOTT) (NCT02549586) (38). Six liver transplant\nrecipients were recruited, five of whom were enrolled. The\nHSCs of patients were mobilized, purified, and cryopreserved\nahead of liver transplant. After immune ablation (Busulfan\n+ Cyclophosphamide + rabbit anti-thymocyte globulin), the\npatients received autologous HSCT and liver transplantation.\nIS was withdrawn in five patients with evidence of deletion of\nalloreactive T cell clones. Two of them were still healthy at 406\nand 518 days after HSCT; one died of heart failure at 212 days,\none patient received re-transplantation at 166 days after HSCT\nowing to complications of venous occlusive disease, and one\npatient died of erythrocytic syndrome at 87 days after HSCT.\nHowever, non-hematological toxicity in grades 3–4 was found\nin almost all patients. It is suggested that there is a certain\napplication prospect of HSCT-induced immune tolerance after\nliver transplantation, but the potential toxicity is an important\nproblem to be solved.\nCD4 + REGULATORY T CELLS IN LIVER\nTRANSPLANT TOLERANCE\nUnder physiological conditions, Tregs account for 5–10% of\nCD4 + T cells in peripheral blood. Tregs are characterized by\nhigh stable expression of CD25 and FoxP3, and are divided into\nnatural regulatory T cells (nTreg) produced in the thymus and\nperipherally induced regulatory T cells (iTreg) (113). Modern\nresearch shows that CD4 + Treg is the key to control self\ufffetolerance. The combination can induce peripheral tolerance to\nautoantigens and alloantigens through a variety of mechanisms,\nmainly cell-to-cell contact-induced cell lysis, local depletion of\nIL-2, inhibition of DC maturity, downregulation of DC function,\nsecretion of immunosuppressive cytokines (such as IL-10, IL-35,\nand TGF-β), etc. (114). In addition, Tregs can migrate to the\ninflammation site, and their inhibitory activity is usually located\nin the inflammation site, without significant effects on overall\nimmunity (115).\nIn rodent models of liver transplantation tolerance, Tregs\nare present in increased proportion in liver grafts and are\ninvolved in the induction of liver tolerance (116, 117). Relevant\nclinical studies have also shown that, in OT liver transplantation\nrecipients, the proportion of Tregs in peripheral blood and liver\nincreases, which shows a protective effect on liver allografts (118,\n119). Therefore, the use of Tregs to mediate transplant tolerance\nis an important part of transplant immunology research.\nTreg adoptive infusion is a method to induce tolerance,\nwhere the principle is to tilt the immune response toward Treg\ndominance, rather than to cause rejection of T effector cells, in\norder to reduce the dependence of patients receiving solid organ\ntransplantation on immunosuppressant drugs.\nIt is now generally accepted that the best method to make\nTreg clinically is to effectively expand it in vitro and maintain\nhigh purity and inhibitory activity (115). Under certain culture\nconditions, human Treg can be expanded to 100–1,000 times in\n2 weeks (120, 121). The required cell dose varies depending on\nthe type of disease and the presence or absence of combination\ntherapy (115, 122, 123). Treg separation and purification\nmethods mainly include MACS and flow cytometry sorting.\nSome researchers have used the chimeric antigen receptor\n(CAR) technology to produce donor antigen-specific Treg\n(CAR-Treg) and can overcome the limitation of alloantigen\ufffestimulation-based protocolsin vitro. In these studies, CARs could\nbe developed to redirect Tregs toward a specific donor leucocyte\nantigen (HLA) class I molecule (HLA-A2). Unlike HLA class\nII, the selected donor HLA class I is expressed ubiquitously in\ngrafts. Compared with polyclonal Tregs, CAR-Treg could have\nbetter safety, stability, and effectiveness in theory and have strong\ntherapeutic potential to protect allograft (124–127).\nClinical trials of various autoimmune diseases and GVHD\nhave confirmed the safety and feasibility of adoptive Treg\ninfusions (128–131). Clinical reports of adoptive infusion of Treg\nin kidney transplant recipients have demonstrated the safety of\nthis method in solid organ transplantation, and, through the\nmethod of isotope plutonium labeling (3H), it has been found\nthat Tregs can still be detectable for up to 1 year after infusion\n(132, 133).\nCurrently, multiple transplant centers around the world are\nconducting clinical trials of liver transplantation Treg treatment.\nTodo et al. from the Hokkaido University in Japan, studied\n10 liver transplant recipients who received a single dose of\ndonor antigen-specific Treg. Tregs from recipient lymphocytes\nwere amplified by co-culture with irradiated donor cells in the\npresence of anti-CD80/86 monoclonal antibodies in vitro for 2\nweeks. CD4 + CD25 + FoxP3 + Tregs were amplified 3–6-fold\nto 28.1% of CD4 + cells and still maintained inhibitory activity.\nOn the 13th day after the operation, the cells were infused back to\nthe recipient with 0.23∼6.37 × 106\ncell/Kg intravenously. IS was\ngradually reduced during 6 months and withdrawn 18 months\npostoperatively. These recipients were subjected to rigorous\nmonitoring, including liver biopsies, T cell activity assessments,\nand level of donor-specific antibodies. After 16 to 33 months\nof follow-up, 7 patients achieved OT without rejection and 4\nremained IS-free for 24 months. Mild rejection occurred in 3\npatients, and low dose IS was maintained afterward (121).\nSafinia et al., at London University (UK), performed a\ncombined I/IIa clinical trial ThRIL (NCT02166177) for the\napplication of Treg immunotherapy in the field of liver\ntransplantation. Tregs were isolated from liver transplant\nrecipients by Good manufacturing practice (GMP) separation\ntechnology based on CliniMACS sorting. IL-2 and rapamycin\nwere used for Tregs expansion in vitro. A stable Treg population\n(purity of CD4 + CD25 + FOXP3 + > 95%) can be\nobtained in 36 days, reaching a sufficient number for its clinical\napplication (120). With stimulation by rapamycin, the amplified\nTregs could maintain high levels of FOXP3, CD127lo, and\nCTLA4, and, with continued expression of CD62L and CXCR3,\nensure the stability and functionality of Treg amplification,\nwhich could prevent Treg from transforming into Th17 cells\nFrontiers in Immunology | www.frontiersin.org 7 June 2020 | Volume 11 | Article 1326\n\nDu et al. Liver Transplant Tolerance\nin the presence of pro-inflammatory cytokines (134). Nine\nliver transplant recipients have received autologous polyclonal\nTreg infusions, showing that the procedure is safe, does not\nincrease the incidence of infection or cancer, and can temporarily\nincrease circulating Treg pools and reduce anti-donor T cell\nreaction (135).\nThe current research has opened the door for adoptive\ninfusion of Treg in liver transplantation induction therapy,\nshowing good application prospects. Subsequent research may\nneed to focus on isolation purity, functional induction, CAR\ufffeTreg, and clinical induction protocols for OT of Treg in vitro.\nREGULATORY DENDRITIC CELLS IN\nLIVER TRANSPLANT TOLERANCE\nIn 1973, Steinman et al. found a cell type with a “star shape,”\nor dendritic morphology, found in the preparation of adherent\nspleen cells and named dendritic cell (DC) (136). It has been\nrecognized that DCs are a group of highly heterogeneous cell\npopulations derived from the myeloid or lymphoid, which\nare widely distributed in all tissues and organs and are the\nmost powerful APC in the body, regulating both innate and\nadaptive immunity and playing an important role in promoting\nself-tolerance in healthy homeostasis (137, 138). In humans,\naccording to their cell morphology and function, DCs are divided\ninto two mean lineages of CD11c + conventional DCs (cDCs)\n(HLA-DR + CD11c +) and CD11c- plasmocyte-like DCs (pDCs)\n(HLA-DR + CD123 +) (139).\nIn 1996, Steptoe and Thomson defined the DC population that\ncan induce immune tolerance in vivo as tolerogenic DC (tolDC)\n(140). However, it is still unclear whether tolDCs constitute a\nparticular lineage or just reflect a specific activation state of\nDCs (141). In 2003, Sato et al. named the tolerogenic DCs\nthey cultured in vitro as ""regulatory DCs (regDC),” because\nthey had the ability to inhibit T cell activation, induce T cell\nanergy, and induce Tregs. They could also maintain strong\nimmunoregulatory properties in inflammatory conditions and\nhave the potential to resist multiple immune diseases (142,\n143). This nomenclature has also been widely used in classic\ntolerogenic DCs and their derivatives (144–148). Currently, two\nmethods of naming such tolerant DCs are both widely used.\nOver the past 20 years, a large number of studies have found\nthat regDCs could be used to treat various autoimmune diseases\nin animal models, such as T1D, SSc, RA, Cohn’s Disease, etc.\n(149–152), and to induce tolerance of in GVHD and allografts\n(115, 143, 153, 154). They also have good clinical application\nprospects in the field of liver transplant tolerance (139, 155).\nThe phenotypic characteristics of regDC include low\nexpression of MHC class I and II molecules and T cell co\ufffestimulatory molecules (CD80/B7.1, CD86/B7.2, CD40, OX40L),\nT cell co-inhibition of ligands (such as programmed death\nLigand 1 PD-L1), high expression of death-inducing ligands\n(FasL), and low expression of adhesion molecules (156, 157).\nUnlike immature DCs, there are indications that tolerability of\nregDCs is the result of a specific transcription program, rather\nthan the preservation of immature status (158).\nRegDCs retain the ability to present antigens to specific\nT cells, and they can also build up peripheral tolerance\nthrough different immunoregulatory mechanisms. These related\npromotion mechanisms include the following:\n• T cell anergy and T cell clonal deletion (159, 160);\n• Apoptosis in naive and memory T cells through\nincreased expression of Fas (CD95)/FasL and indoleamine\n2,3-dioxygenase (IDO) (161, 162);\n• Inducing and expanding regulatory lymphocytes, including\nTregs (163, 164) and Bregs (165);\n• Producing double negative (CD3 [+] CD4 [−] CD8 [−]) T\ncells (166);\n• Development of tolerance by increasing the expression and\nrelease of immune regulatory molecules, such as the anti\ufffeinflammatory cytokines IL-10, TGF-b, NO, and HO-1 (167–\n170), the apoptosis-inducing PD-L 1, PD-L2, and human\nleukocytes Ag-G (HLA-G), and the tumor necrosis factor\n(TNF) (161, 164, 171, 172).\nRecent studies have shown that exosomes released by regDCs are\nalso involved in the induction and maintenance of peripheral T\ncell tolerance (172–174).\nAlthough DCs are widely distributed in tissues, their\nproportion is very low. Immature DCs (imDCs) are tolerogenic\nin the body, but they are also unstable and may differentiate\ninto immunogenic DCs in inflammatory conditions. Therefore,\nit is very important to establish a mature system for regDC\nculture in vitro to obtain a sufficient number of functional and\nstable regDCs.\nDCs in the immune system act as “immune checkpoints,” with\nthe key role of turning immune signals on or off. A large number\nof anti-inflammatory and immunosuppressive mediators can\npromote tolerogenic phenotypes by interfering with DC\ndifferentiation or activating checkpoints (157). Researchers\nhave explored different strategies for generating stable regDCs,\nsome of which have been performed in clinical trials, but\na consensus hasn’t been reached on the best approach\nyet (115, 157, 172, 175, 176).\nCurrently, regDCs in vitro are mainly derived from rodent\nbone marrow cells and human peripheral blood mononuclear\ncells, as it is easier and less invasive than to operate in humans,\nand abundant DC precursors are also available. Granulocyte\ufffemacrophage colony-stimulating factor (GM-CSF) ± IL-4 can\nbe added to fresh or frozen blood mononuclear cells or\ntheir precursors to promote the differentiation of myeloid\ntolDCs (143, 175). Then, one or more anti-inflammatory and\nimmunosuppressive agents should also be added to inhibit\ntheir maturation and promote tolerance. These agents include\nanti-inflammatory cytokines (such as IL-10, TGF-β, TNF-α),\nanti-inflammatory/IS drugs (CNI, rapamycin, mycophenolate,\ncorticosteroids, or aspirin), Vitamin D3, Prostaglandin E2,\nretinoids, and HLA-G, tissue factors, such as hepatocyte growth\nfactor (HGF) and vasoactive intestinal peptide (VIP), etc. (139,\n143, 153, 177–180).\nIn rodent and non-human primate transplantation models,\nadoptive infusion of DCreg prior to transplantation can prolong\nthe survival of allografts and promote specific tolerance to\nFrontiers in Immunology | www.frontiersin.org 8 June 2020 | Volume 11 | Article 1326\n\nDu et al. Liver Transplant Tolerance\nthe graft either alone, or in combination with short-term\nIS (144, 154, 181–183). Clinical trials on the safety and\neffectiveness of regDC have been conducted for a variety of\nautoimmune diseases, including T1D, RA, multiple sclerosis\n(MS), Crohn’s Disease (184–188) (NCT02618902, NCT02903537,\nNCT01352858, NCT00445913), and renal transplant rejection\n(137) (NCT 0364265, NCT02252055). So far, although there\nare no long-term results, it has been confirmed that a regDC\nregimen is safe and feasible without significant side effects, and\nthat the patient’s compliance is good. These results provide a\ngood theoretical guide for a regDC therapeutic schedule for\nliver transplantation.\nIn Pittsburgh University (USA), Thomson et al. performed a\nsingle-center, phase I/II clinical trial on regDC in living donor\nliver transplantation (NCT03164265). The study recruited low\uffferisk living donor liver transplantation (LDLT) recipients, isolated\nmonocytes from peripheral blood from potential living organ\ndonors, and cultured cells with GM-CSF, IL-4, VitD3, and IL\ufffe10 for 7 days in vitro. GMP-grade donor-derived regDCs could\nbe induced (153, 189), and a single intravenous infusion of 2.5–\n10 × 10 6 donor-derived regDCs/kg was administered 7 days\nbefore the surgery. Meanwhile, half a dose of mycophenolic\nacid (MPA) was given, without ATG or Ab. MPA and Tac\nwere administrated within 6 months after transplantation. At\n6 months after transplantation, recipients who meet specific\ncriteria [non-rejection and liver function allowance tests (LFTs)]\nmay gradually discontinue MPA. TAC withdrawal assessments\nare performed 1 year after transplantation and then discontinued\ngradually to achieve complete IS withdrawal 18 months after\nliver transplantation. The recipients will be followed up for 3\nyears from IS withdrawal. During the follow-up period, clinical\ndata and peripheral blood were regularly collected and analyzed\nto evaluate changes in liver function, renal function, donor\ufffespecific antigen (DSA) levels, cardiovascular risk factors, and\nquality of life. Meanwhile, liver biopsy is to be performed after\n1 and 3 years from the withdrawal of IS (146). This study\nis still in the research stage, but we are looking forward to\nthe results.\nAutologous DCs seem to be more feasible than donor-derived\nDCs, especially for liver transplantation from deceased donors, as\nit can avoid the risk of sensitization. Autologous regDC infusion\nwith or without donor antigen pulse has shown good tolerogenic\neffects in animal transplant model studies (179, 190). Some\nstudies have shown that autologous tolDC is more effective than\ndonor DC in delayed transplant rejection (180, 191). Under the\nleadership of the European Union, in Nantes University (France),\nMoreau A. et al. conducted a Phase I/II (feasibility/safety) “one\nstudy” (www. onestudy.org) on kidney transplant recipients with\nautologous tolDCs infusion (NCT0225055) (192), and its clinical\neffects are still being observed.\nThere are few clinical trials about regDC in the induction\nof liver transplantation tolerance, and still in the observation\nstage up to now. As a kind of powerful immune-regulating cell,\nthe prospect of regDC is still thrilling in liver transplantation\ntolerance. For the successful conversion from preclinical\nresearches to clinical application, researches still have\nmany issues to be studied extensively, such as the further\noptimization of the regDC induction scheme to extend its\nhalf-life, the stability of immunomodulatory function, and the\nadministration scheme of IS. However, the further exploration\nof methods to induce immune tolerance will also improve our\nunderstanding of the biological characteristics of DC and the\nmechanisms of tolerance.\nSUMMARY AND FUTURE DEVELOPMENT\nImmune tolerance has always been the “holy grail” in the field\nof organ transplantation. On the basis of a large number of\npreclinical studies, various cell therapies could hold promising\nprospects for inducing liver tolerance. This article reviews the\nrelated research and progress regarding spontaneous tolerance\nand the HSCT, Tregs, and regDCs strategies in the field of\nliver transplant tolerance. There are many other cells not\nreviewed that may also have the potential to induce liver\ntransplant tolerance, such as mesenchymal stem cells, regulatory\nmacrophages, regulatory B cells, and bone marrow-derived\nimmunosuppressive cells. At present, the clinical trials of various\ncell therapies are still in the early stages, and most of them are\nsingle-center studies. Thus, there is no clear clinical effect, the\npurity and stability of cell-induced therapy and its safety for long\ufffeterm recipients should still be explored for a long time, as many\nissues need to be observed.\nThe immune system is extremely delicate and complex. It may\nbe difficult to achieve immune tolerance using only one type of\ntolerant cell or one mechanism. It may be necessary to consider\ndifferent mechanisms in combination with different immune\ncells or drugs. The development of immunologic surveillance and\ntolerance markers is also critical. This could develop personalized\ntolerance induction programs for transplant recipients and could\nguide the timing of immunosuppressive drug withdrawal or early\ndetection of rejection, infection, or tumors.\nWith the in-depth development of multi-field, multi\ufffedisciplinary, and multi-level research, the application of various\nnew experimental methods can provide more possibilities and\ntheoretical guidance for liver transplant tolerance. With the\ndevelopment of multi-center clinical trials, we are optimistic\nabout the good prospects for liver transplant tolerance.\nAUTHOR CONTRIBUTIONS\nZC devised this topic. XD wrote the manuscript. ZC, SC, WG,\nand SZ helped to revise the manuscript. All authors contributed\nto the article and approved the submitted version.\nFUNDING\nThis work was supported by National Natural Science\nFoundation of China (No. 81873511).\nFrontiers in Immunology | www.frontiersin.org 9 June 2020 | Volume 11 | Article 1326\n\nDu et al. Liver Transplant Tolerance\nREFERENCES\n1. Starzl TE. The long reach of liver transplantation. Nat Med. (2012) 18:1489–\n92. doi: 10.1038/nm.2927\n2. Rabkin JM, de La Melena V, Orloff SL, Corless CL, Rosen HR, Olyaei AJ. Late\nmortality after orthotopic liver transplantation. Am J Surg. (2001) 181:475–9.\ndoi: 10.1016/S0002-9610(01)00595-5\n3. Dopazo C, Bilbao I, Castells LL, Sapisochin G, Moreiras C, Campos-Varela I,\net al. Analysis of adult 20-year survivors after liver transplantation. Hepatol\nInt. (2015) 9:461–70. doi: 10.1007/s12072-014-9577-x\n4. Lechler RI, Sykes M, Thomson AW, Turka LA. Organ transplantation–\nhow much of the promise has been realized? Nat Med. (2005) 11:605–13.\ndoi: 10.1038/nm1251\n5. Calne RY. Prope tolerance–the future of organ transplantation from\nthe laboratory to the clinic. Int Immunopharmacol. (2005) 5:163–7.\ndoi: 10.1016/j.intimp.2004.09.026\n6. Calne RY. The future of organ transplantation: from the laboratory\nto the clinic. Philos Trans R Soc Lond B Biol Sci. (2001) 356:767–71.\ndoi: 10.1098/rstb.2001.0848\n7. Crispe IN. Immune tolerance in liver disease. Hepatology. (2014) 60:2109–17.\ndoi: 10.1002/hep.27254\n8. Calne RY, Sells RA, Pena JR, Davis DR, Millard PR, Herbertson BM, et al.\nInduction of immunological tolerance by porcine liver allografts. Nature.\n(1969) 223:472–6. doi: 10.1038/223472a0\n9. Jenne CN, Kubes P. Immune surveillance by the liver. Nat Immunol. (2013)\n14:996–1006. doi: 10.1038/ni.2691\n10. Thomson AW, Knolle PA. Antigen-presenting cell function in the\ntolerogenic liver environment. Nat Rev Immunol. (2010) 10:753–66.\ndoi: 10.1038/nri2858\n11. Lumsden AB, Henderson JM, Kutner MH. Endotoxin levels measured by a\nchromogenic assay in portal, hepatic and peripheral venous blood in patients\nwith cirrhosis. Hepatology. (1988) 8:232–6. doi: 10.1002/hep.1840080207\n12. Feng S. Spontaneous and induced tolerance for liver transplant recipients.\nCurr Opin Organ Transplant. (2016) 21:53–8. doi: 10.1097/MOT.\n0000000000000268\n13. Reyes J, Zeevi A, Ramos H, Tzakis A, Todo S, Demetris AJ, et al. Frequent\nachievement of a drug-free state after orthotopic liver transplantation.\nTransplant Proc. (1993) 25:3315–9.\n14. Mazariegos GV, Reyes J, Marino I, Flynn B, Fung JJ, Starzl TE.\nRisks and benefits of weaning immunosuppression in liver transplant\nrecipients: long-term follow-up. Transplant Proc. (1997) 29:1174–7.\ndoi: 10.1016/S0041-1345(96)00535-0\n15. Devlin J, Doherty D, Thomson L, Wong T, Donaldson P, Portmann B,\net al. Defining the outcome of immunosuppression withdrawal after liver\ntransplantation. Hepatology. (1998) 27:926–33. doi: 10.1002/hep.510270406\n16. Girlanda R, Rela M, Williams R, O’Grady JG, Heaton ND. Long-term\noutcome of immunosuppression withdrawal after liver transplantation.\nTransplant Proc. (2005) 37:1708–9. doi: 10.1016/j.transproceed.2005.03.070\n17. Takatsuki M, Uemoto S, Inomata Y, Egawa H, Kiuchi T, Fujita\nS, et al. Weaning of immunosuppression in living donor\nliver transplant recipients. Transplantation. (2001) 72:449–54.\ndoi: 10.1097/00007890-200108150-00016\n18. Oike F, Yokoi A, Nishimura E, Ogura Y, Fujimoto Y, Kasahara\nM, et al. Complete withdrawal of immunosuppression in living\ndonor liver transplantation. Transplant Proc. (2002) 34:1521.\ndoi: 10.1016/S0041-1345(02)02980-9\n19. Eason JD, Cohen AJ, Nair S, Alcantera T, Loss GE. Tolerance: is it\nworth the risk? Transplantation. (2005) 79:1157–9. doi: 10.1097/01.TP.\n0000162084.46555.10\n20. Tryphonopoulos P, Tzakis AG, Weppler D, Garcia-Morales R, Kato T,\nMadariaga JR, et al. The role of donor bone marrow infusions in withdrawal\nof immunosuppression in adult liver allotransplantation. Am J Transplant.\n(2005) 5:608–13. doi: 10.1111/j.1600-6143.2004.00743.x\n21. Tryphonopoulos P, Ruiz P, Weppler D, Nishida S, Levi DM, Moon J, et al.\nLong-term follow-up of 23 operational tolerant liver transplant recipients.\nTransplantation. (2010) 90:1556–61. doi: 10.1097/TP.0b013e3182003db7\n22. Tisone G, Orlando G, Cardillo A, Palmieri G, Manzia TM, Baiocchi L,\net al. Complete weaning off immunosuppression in HCV liver transplant\nrecipients is feasible and favourably impacts on the progression of disease\nrecurrence. J Hepatol. (2006) 44:702–9. doi: 10.1016/j.jhep.2005.11.047\n23. Orlando G, Manzia T, Baiocchi L, Sanchez-Fueyo A, Angelico M, Tisone G.\nThe Tor Vergata weaning off immunosuppression protocol in stable HCV\nliver transplant patients: the updated follow up at 78 months. Transplant\nImmunol. (2008) 20:43–7. doi: 10.1016/j.trim.2008.08.007\n24. Assy N, Adams PC, Myers P, Simon V, Minuk GY, Wall W, et al. Randomized\ncontrolled trial of total immunosuppression withdrawal in liver transplant\nrecipients: role of ursodeoxycholic acid. Transplantation. (2007) 83:1571–6.\ndoi: 10.1097/01.tp.0000266678.32250.76\n25. Pons JA, Ramirez P, Revilla-Nuin B, Pascual D, Baroja-Mazo A,\nRobles R, et al. Immunosuppression withdrawal improves long\ufffeterm metabolic parameters, cardiovascular risk factors and renal\nfunction in liver transplant patients. Clin Transplant. (2009) 23:329–36.\ndoi: 10.1111/j.1399-0012.2008.00944.x\n26. Feng S, Ekong UD, Lobritto SJ, Demetris AJ, Roberts JP, Rosenthal P,\net al. Complete immunosuppression withdrawal and subsequent allograft\nfunction among pediatric recipients of parental living donor liver\ntransplants. JAMA. (2012) 307:283–93. doi: 10.1001/jama.2011.2014\n27. Benitez C, Londono MC, Miquel R, Manzia TM, Abraldes JG, Lozano JJ, et al.\nProspective multicenter clinical trial of immunosuppressive drug withdrawal\nin stable adult liver transplant recipients. Hepatology. (2013) 58:1824–35.\ndoi: 10.1002/hep.26426\n28. de la Garza RG, Sarobe P, Merino J, Lasarte JJ, D’Avola D, Belsue V, et al.\nTrial of complete weaning from immunosuppression for liver transplant\nrecipients: factors predictive of tolerance. Liver Transpl. (2013) 19:937–44.\ndoi: 10.1002/lt.23686\n29. Lin NC, Wang HK, Yeh YC, Liu CP, Loong CC, Tsai HL, et al.\nMinimization or withdrawal of immunosuppressants in pediatric\nliver transplant recipients. J Pediatr Surg. (2015) 50:2128–33.\ndoi: 10.1016/j.jpedsurg.2015.08.043\n30. Feng S, Demetris AJ, Spain KM, Kanaparthi S, Burrell BE, Ekong UD, et al.\nFive-year histological and serological follow-up of operationally tolerant\npediatric liver transplant recipients enrolled in WISP-R. Hepatology. (2017)\n65:647–60. doi: 10.1002/hep.28681\n31. Jucaud V, Shaked A, DesMarais M, Sayre P, Feng S, Levitsky J, et al.\nPrevalence and impact of de novo donor-specific antibodies during a\nmulticenter immunosuppression withdrawal trial in adult liver transplant\nrecipients. Hepatology. (2019) 69:1273–86. doi: 10.1002/hep.30281\n32. Levitsky J, Burrell BE, Kanaparthi S, Turka LA, Kurian S, Sanchez-Fueyo\nA, et al. Immunosuppression withdrawal in liver transplant recipients on\nsirolimus. Hepatology. (2019). doi: 10.1002/hep.31036. [Epub ahead of print].\n33. Shaked A, DesMarais MR, Kopetskie H, Feng S, Punch JD, Levitsky\nJ, et al. Outcomes of immunosuppression minimization and withdrawal\nearly after liver transplantation. Am J Transplant. (2019) 19:1397–409.\ndoi: 10.1111/ajt.15205\n34. Fairbanks KD, Eustace JA, Fine D, Thuluvath PJ. Renal function improves\nin liver transplant recipients when switched from a calcineurin inhibitor to\nsirolimus. Liver Transpl. (2003) 9:1079–85. doi: 10.1053/jlts.2003.50183\n35. Turnquist HR, Raimondi G, Zahorchak AF, Fischer RT, Wang Z, Thomson\nAW. Rapamycin-conditioned dendritic cells are poor stimulators of\nallogeneic CD4+ T cells, but enrich for antigen-specific Foxp3+ T regulatory\ncells and promote organ transplant tolerance. J Immunol. (2007) 178:7018–\n31. doi: 10.4049/jimmunol.178.11.7018\n36. Bohne F, Martinez-Llordella M, Lozano JJ, Miquel R, Benitez C, Londono\nMC, et al. Intra-graft expression of genes involved in iron homeostasis\npredicts the development of operational tolerance in human liver\ntransplantation. J Clin Invest. (2012) 122:368–82. doi: 10.1172/JCI59411\n37. Mazariegos GV, Zahorchak AF, Reyes J, Ostrowski L, Flynn B, Zeevi\nA, et al. Dendritic cell subset ratio in peripheral blood correlates\nwith successful withdrawal of immunosuppression in liver transplant\npatients. Am J Transplant. (2003) 3:689–96. doi: 10.1034/j.1600-6143.2003.\n00109.x\n38. Taner T, Martins PN, Ling Q, Ng KT, Huang KT, Eymard C, et al. What\nis hot and new in basic and translational science in liver transplantation\nin 2019? Report of the basic and translational research committee of the\ninternational liver transplantation society. Transplantation. (2019) 104:516–\n21. doi: 10.1097/TP.0000000000003058\nFrontiers in Immunology | www.frontiersin.org 10 June 2020 | Volume 11 | Article 1326\n\nDu et al. Liver Transplant Tolerance\n39. Lerut J, Sanchez-Fueyo A. An appraisal of tolerance in liver transplantation.\nAm J Transplant. (2006) 6:1774–80. doi: 10.1111/j.1600-6143.2006.01396.x\n40. Londono MC, Rimola A, O’Grady J, Sanchez-Fueyo A. Immunosuppression\nminimization vs. complete drug withdrawal in liver transplantation. J\nHepatol. (2013) 59:872–9. doi: 10.1016/j.jhep.2013.04.003\n41. Fouquet V, Alves A, Branchereau S, Grabar S, Debray D, Jacquemin E,\net al. Long-term outcome of pediatric liver transplantation for biliary atresia:\na 10-year follow-up in a single center. Liver Transpl. (2005) 11:152–60.\ndoi: 10.1002/lt.20358\n42. Evans HM, Kelly DA, McKiernan PJ, Hubscher S. Progressive histological\ndamage in liver allografts following pediatric liver transplantation.\nHepatology. (2006) 43:1109–17. doi: 10.1002/hep.21152\n43. Ekong UD, Melin-Aldana H, Seshadri R, Lokar J, Harris D, Whitington PF,\net al. Graft histology characteristics in long-term survivors of pediatric liver\ntransplantation. Liver Transpl. (2008) 14:1582–7. doi: 10.1002/lt.21549\n44. Hubscher S. What does the long-term liver allograft look like for the pediatric\nrecipient? Liver Transpl. (2009) 15(Suppl. 2):S19–24. doi: 10.1002/lt.21902\n45. Scheenstra R, Peeters PM, Verkade HJ, Gouw AS. Graft fibrosis after\npediatric liver transplantation: ten years of follow-up. Hepatology. (2009)\n49:880–6. doi: 10.1002/hep.22686\n46. Yoshitomi M, Koshiba T, Haga H, Li Y, Zhao X, Cheng D, et al.\nRequirement of protocol biopsy before and after complete cessation of\nimmunosuppression after liver transplantation. Transplantation. (2009)\n87:606–14. doi: 10.1097/TP.0b013e318195a7cb\n47. Banff Working Group on Liver Allograft P. Importance of liver biopsy\nfindings in immunosuppression management: biopsy monitoring and\nworking criteria for patients with operational tolerance. Liver Transpl. (2012)\n18:1154–70. doi: 10.1002/lt.23481\n48. Miyagawa-Hayashino A, Yoshizawa A, Uchida Y, Egawa H, Yurugi K,\nMasuda S, et al. Progressive graft fibrosis and donor-specific human\nleukocyte antigen antibodies in pediatric late liver allografts. Liver Transpl.\n(2012) 18:1333–42. doi: 10.1002/lt.23534\n49. Briem-Richter A, Ganschow R, Sornsakrin M, Brinkert F, Schirmer\nJ, Schaefer H, et al. Liver allograft pathology in healthy pediatric\nliver transplant recipients. Pediatr Transplant. (2013) 17:543–9.\ndoi: 10.1111/petr.12119\n50. Demetris AJ, Isse K. Tissue biopsy monitoring of operational tolerance in\nliver allograft recipients. Curr Opin Organ Transplant. (2013) 18:345–53.\ndoi: 10.1097/MOT.0b013e3283615d48\n51. Feng S, Bucuvalas JC, Demetris AJ, Burrell BE, Spain KM, Kanaparthi S, et al.\nEvidence of chronic allograft injury in liver biopsies from long-term pediatric\nrecipients of liver transplants. Gastroenterology. (2018) 155:1838–51 e7.\ndoi: 10.1053/j.gastro.2018.08.023\n52. Venturi C, Sempoux C, Quinones JA, Bourdeaux C, Hoyos SP, Sokal E,\net al. Dynamics of allograft fibrosis in pediatric liver transplantation. Am J\nTransplant. (2014) 14:1648–56. doi: 10.1111/ajt.12740\n53. Londono MC, Souza LN, Lozano JJ, Miquel R, Abraldes JG, Llovet LP,\net al. Molecular profiling of subclinical inflammatory lesions in long-term\nsurviving adult liver transplant recipients. J Hepatol. (2018) 69:626–34.\ndoi: 10.1016/j.jhep.2018.04.012\n54. Owen RD. Immunogenetic consequences of vascular anastomoses between\nbovine twins. Science. (1945) 102:400–1. doi: 10.1126/science.102.2651.400\n55. Kashiwagi N, Porter KA, Penn I, Brettschneider L, Starzl TE. Studies\nof homograft sex and of gamma globulin phenotypes after orthotopic\nhomotransplantation of the human liver. Surg Forum. (1969) 20:374–6.\n56. Till JE, Mc CE. A direct measurement of the radiation sensitivity of normal\nmouse bone marrow cells. Radiat Res. (1961) 14:213–22.\n57. Becker AJ, Mc CE, Till JE. Cytological demonstration of the clonal nature\nof spleen colonies derived from transplanted mouse marrow cells. Nature.\n(1963) 197:452–4. doi: 10.1038/197452a0\n58. Seita J, Weissman IL. Hematopoietic stem cell: self-renewal vs.\ndifferentiation. Wiley Interdiscip Rev Syst Biol Med. (2010) 2:640–53.\ndoi: 10.1002/wsbm.86\n59. Starzl TE, Demetris AJ, Trucco M, Murase N, Ricordi C, Ildstad S,\net al. Cell migration and chimerism after whole-organ transplantation:\nthe basis of graft acceptance. Hepatology. (1993) 17:1127–52.\ndoi: 10.1002/hep.1840170629\n60. Sykes M. Hematopoietic cell transplantation for tolerance induction:\nanimal models to clinical trials. Transplantation. (2009) 87:309–16.\ndoi: 10.1097/TP.0b013e31819535c2\n61. Jenq RR, van den Brink MR. Allogeneic haematopoietic stem cell\ntransplantation: individualized stem cell and immune therapy of cancer. Nat\nRev Cancer. (2010) 10:213–21. doi: 10.1038/nrc2804\n62. Daikeler T, Tichelli A, Passweg J. Complications of autologous hematopoietic\nstem cell transplantation for patients with autoimmune diseases. Pediatr Res.\n(2012) 71(4 Pt 2):439–44. doi: 10.1038/pr.2011.57\n63. Muraro PA, Robins H, Malhotra S, Howell M, Phippard D, Desmarais C, et al.\nT cell repertoire following autologous stem cell transplantation for multiple\nsclerosis. J Clin Invest. (2014) 124:1168–72. doi: 10.1172/JCI71691\n64. Notta F, Doulatov S, Laurenti E, Poeppl A, Jurisica I, Dick JE. Isolation of\nsingle human hematopoietic stem cells capable of long-term multilineage\nengraftment. Science. (2011) 333:218–21. doi: 10.1126/science.1201219\n65. Pelus LM. Peripheral blood stem cell mobilization: new regimens,\nnew cells, where do we stand. Curr Opin Hematol. (2008) 15:285–92.\ndoi: 10.1097/MOH.0b013e328302f43a\n66. Khan A, Tomita Y, Sykes M. Thymic dependence of loss of tolerance in\nmixed allogeneic bone marrow chimeras after depletion of donor antigen.\nPeripheral mechanisms do not contribute to maintenance of tolerance.\nTransplantation. (1996) 62:380–7. doi: 10.1097/00007890-199608150-00014\n67. Elahimehr R, Scheinok AT, McKay DB. Hematopoietic stem cells\nand solid organ transplantation. Transplant Rev. (2016) 30:227–34.\ndoi: 10.1016/j.trre.2016.07.005\n68. Wekerle T, Blaha P, Koporc Z, Bigenzahn S, Pusch M, Muehlbacher F.\nMechanisms of tolerance induction through the transplantation of donor\nhematopoietic stem cells: central vs. peripheral tolerance. Transplantation\n(2003) 75(Suppl. 9):21S-5S. doi: 10.1097/01.TP.0000067947.9\n0241.66\n69. Mueller DL. Mechanisms maintaining peripheral tolerance. Nat Immunol.\n(2010) 11:21–7. doi: 10.1038/ni.1817\n70. Xing Y, Hogquist KA. T-cell tolerance: central and peripheral. Cold Spring\nHarb Perspect Biol. (2012) 4. doi: 10.1101/cshperspect.a006957\n71. Salisbury EM, Game DS, Lechler RI. Transplantation tolerance. Pediatr\nNephrol. (2014) 29:2263–72. doi: 10.1007/s00467-013-2659-5\n72. Wood KJ. Passenger leukocytes and microchimerism: what role in\ntolerance induction? Transplantation. (2003) 75(Suppl. 9):17s−20.\ndoi: 10.1097/01.TP.0000067946.90241.2F\n73. Szabolcs P, Burlingham WJ, Thomson AW. Tolerance after solid organ and\nhematopoietic cell transplantation. Biol Blood Marrow Transplant. (2012)\n18(Suppl. 1):S193–200. doi: 10.1016/j.bbmt.2011.11.005\n74. Copelan EA. Hematopoietic stem-cell transplantation. N Engl J Med. (2006)\n354:1813–26. doi: 10.1056/NEJMra052638\n75. Sachs DH, Kawai T, Sykes M. Induction of tolerance through\nmixed chimerism. Cold Spring Harb Perspect Med. (2014) 4:a015529.\ndoi: 10.1101/cshperspect.a015529\n76. Fuchs EJ. Transplantation tolerance: from theory to clinic. Immunol Rev.\n(2014) 258:64–79. doi: 10.1111/imr.12154\n77. Cobbold SP, Martin G, Qin S, Waldmann H. Monoclonal antibodies to\npromote marrow engraftment and tissue graft tolerance. Nature. (1986)\n323:164–6. doi: 10.1038/323164a0\n78. Wekerle T, Kurtz J, Ito H, Ronquillo JV, Dong V, Zhao G, et al. Allogeneic\nbone marrow transplantation with co-stimulatory blockade induces\nmacrochimerism and tolerance without cytoreductive host treatment. Nat\nMed. (2000) 6:464–9. doi: 10.1038/74731\n79. Sykes M, Sachs DH. Mixed chimerism. Philos Trans R Soc Lond B Biol Sci.\n(2001) 356:707–26. doi: 10.1098/rstb.2001.0853\n80. Kawai T, Cosimi AB, Spitzer TR, Tolkoff-Rubin N, Suthanthiran M,\nSaidman SL, et al. HLA-mismatched renal transplantation without\nmaintenance immunosuppression. N Engl J Med. (2008) 358:353–61.\ndoi: 10.1056/NEJMoa071074\n81. Kawai T, Sachs DH, Sykes M, Cosimi AB. HLA-mismatched renal\ntransplantation without maintenance immunosuppression. N Engl J Med.\n(2013) 368:1850–2. doi: 10.1056/NEJMc1213779\n82. Leventhal JR, Elliott MJ, Yolcu ES, Bozulic LD, Tollerud DJ, Mathew JM,\net al. Immune reconstitution/immunocompetence in recipients of kidney\nFrontiers in Immunology | www.frontiersin.org 11 June 2020 | Volume 11 | Article 1326\n\nDu et al. Liver Transplant Tolerance\nplus hematopoietic stem/facilitating cell transplants. Transplantation. (2015)\n99:288–98. doi: 10.1097/TP.0000000000000605\n83. Scandling JD, Busque S, Shizuru JA, Lowsky R, Hoppe R, Dejbakhsh-Jones\nS, et al. Chimerism, graft survival, and withdrawal of immunosuppressive\ndrugs in HLA matched and mismatched patients after living donor kidney\nand hematopoietic cell transplantation. Am J Transplant. (2015) 15:695–704.\ndoi: 10.1111/ajt.13091\n84. Ringden O, Soderdahl G, Mattsson J, Uzunel M, Remberger M,\nHentschke P, et al. Transplantation of autologous and allogeneic bone\nmarrow with liver from a cadaveric donor for primary liver cancer.\nTransplantation. (2000) 69:2043–8. doi: 10.1097/00007890-200005270-\n00012\n85. Donckier V, Troisi R, Toungouz M, Colle I, Van Vlierberghe H, Jacquy\nC, et al. Donor stem cell infusion after non-myeloablative conditioning\nfor tolerance induction to HLA mismatched adult living-donor liver\ngraft. Transplant Immunol. (2004) 13:139–46. doi: 10.1016/j.trim.2004.\n05.004\n86. Donckier V, Troisi R, Le Moine A, Toungouz M, Ricciardi S, Colle\nI, et al. Early immunosuppression withdrawal after living donor liver\ntransplantation and donor stem cell infusion. Liver Transpl. (2006) 12:1523–\n8. doi: 10.1002/lt.20872\n87. Alexander SI, Smith N, Hu M, Verran D, Shun A, Dorney S, et al. Chimerism\nand tolerance in a recipient of a deceased-donor liver transplant. N Engl J\nMed. (2008) 358:369–74. doi: 10.1056/NEJMoa0707255\n88. Alexander T, Arnold R, Hiepe F, Radbruch A. Resetting the immune\nsystem with immunoablation and autologous haematopoietic stem cell\ntransplantation in autoimmune diseases. Clin Exp Rheumatol. (2016) 34(4\nSuppl. 98):53–7.\n89. Arruda LC, Clave E, Moins-Teisserenc H, Douay C, Farge D, Toubert\nA. Resetting the immune response after autologous hematopoietic stem\ncell transplantation for autoimmune diseases. Curr Res Transl Med. (2016)\n64:107–13. doi: 10.1016/j.retram.2016.03.004\n90. Snowden JA, Saccardi R, Allez M, Ardizzone S, Arnold R, Cervera R, et al.\nHaematopoietic SCT in severe autoimmune diseases: updated guidelines of\nthe European Group for Blood and Marrow Transplantation. Bone Marrow\nTransplant. (2012) 47:770–90. doi: 10.1038/bmt.2011.185\n91. Sun W, Popat U, Hutton G, Zang YC, Krance R, Carrum G, et al.\nCharacteristics of T-cell receptor repertoire and myelin-reactive T\ncells reconstituted from autologous haematopoietic stem-cell grafts in\nmultiple sclerosis. Brain. (2004) 127(Pt 5):996–1008. doi: 10.1093/brain/\nawh117\n92. Farge D, Henegar C, Carmagnat M, Daneshpouy M, Marjanovic Z, Rabian\nC, et al. Analysis of immune reconstitution after autologous bone marrow\ntransplantation in systemic sclerosis. Arthritis Rheum. (2005) 52:1555–63.\ndoi: 10.1002/art.21036\n93. Alexander T, Thiel A, Rosen O, Massenkeil G, Sattler A, Kohler S,\net al. Depletion of autoreactive immunologic memory followed by\nautologous hematopoietic stem cell transplantation in patients with\nrefractory SLE induces long-term remission through de novo generation\nof a juvenile and tolerant immune system. Blood. (2009) 113:214–23.\ndoi: 10.1182/blood-2008-07-168286\n94. Dubinsky AN, Burt RK, Martin R, Muraro PA. T-cell clones persisting in\nthe circulation after autologous hematopoietic SCT are undetectable in the\nperipheral CD34+ selected graft. Bone Marrow Transplant. (2010) 45:325–\n31. doi: 10.1038/bmt.2009.139\n95. Malmegrim KCR, Lima-Júnior JR, Arruda LCM, de Azevedo JTC,\nde Oliveira GLV, Oliveira MC. Autologous hematopoietic stem cell\ntransplantation for autoimmune diseases: from mechanistic insights to\nbiomarkers. Front Immunol. (2018) 9:02602. doi: 10.3389/fimmu.2018.\n02602\n96. de Kleer I, Vastert B, Klein M, Teklenburg G, Arkesteijn G, Yung GP,\net al. Autologous stem cell transplantation for autoimmunity induces\nimmunologic self-tolerance by reprogramming autoreactive T cells and\nrestoring the CD4+CD25+ immune regulatory network. Blood. (2006)\n107:1696–702. doi: 10.1182/blood-2005-07-2800\n97. Abrahamsson SV, Angelini DF, Dubinsky AN, Morel E, Oh U, Jones JL, et al.\nNon-myeloablative autologous haematopoietic stem cell transplantation\nexpands regulatory cells and depletes IL-17 producing mucosal-associated\ninvariant T cells in multiple sclerosis. Brain. (2013) 136(Pt 9):2888–903.\ndoi: 10.1093/brain/awt182\n98. Hendrawan K, Visweswaran M, Ma DDF, Moore JJ. Tolerance regeneration\nby T regulatory cells in autologous haematopoietic stem cell transplantation\nfor autoimmune diseases. Bone Marrow Transplant. (2019) 55:857–66.\ndoi: 10.1038/s41409-019-0710-2\n99. Zhang L, Bertucci AM, Ramsey-Goldman R, Burt RK, Datta SK. Regulatory\nT cell (Treg) subsets return in patients with refractory lupus following\nstem cell transplantation, and TGF-beta-producing CD8+ Treg cells are\nassociated with immunological remission of lupus. J Immunol. (2009)\n183:6346–58. doi: 10.4049/jimmunol.0901773\n100. Arruda LCM, Oliveira MC, Moraes DA, Covas DT, Voltarelli JC,\nMalmegrim KCR. THU0501 hematopoietic stem cell transplantation\nincreases naive and regulatory B cells while decreasing memory B\ncells in systemic sclerosis patients. Ann Rheum Dis. (2014) 73:492–509.\ndoi: 10.1136/annrheumdis-2014-eular.4148\n101. Snowden JA, Passweg J, Moore JJ, Milliken S, Cannell P, Van Laar J, et al.\nAutologous hemopoietic stem cell transplantation in severe rheumatoid\narthritis: a report from the EBMT and ABMTR. J Rheumatol. (2004)\n31:482–8.\n102. Burt RK, Shah SJ, Dill K, Grant T, Gheorghiade M, Schroeder J,\net al. Autologous non-myeloablative haemopoietic stem-cell transplantation\ncompared with pulse cyclophosphamide once per month for systemic\nsclerosis (ASSIST): an open-label, randomised phase 2 trial. Lancet. (2011)\n378:498–506. doi: 10.1016/S0140-6736(11)60982-3\n103. Hawkey CJ. Hematopoietic stem cell transplantation in crohn’s disease: state\ufffeof-the-art treatment. Digest Dis. (2017) 35:107–14. doi: 10.1159/000449090\n104. Leone A, Radin M, Almarzooqi AM, Al-Saleh J, Roccatello D, Sciascia\nS, et al. Autologous hematopoietic stem cell transplantation in systemic\nlupus erythematosus and antiphospholipid syndrome: a systematic\nreview. Autoimmunity Rev. (2017) 16:469–77. doi: 10.1016/j.autrev.2017.\n03.008\n105. van Megen KM, van ’t Wout ET, Forman SJ, Roep BO. A future for\nautologous hematopoietic stem cell transplantation in type 1 diabetes. Front\nImmunol. (2018) 9:690. doi: 10.3389/fimmu.2018.00690\n106. Terai S, Ishikawa T, Omori K, Aoyama K, Marumoto Y, Urata Y,\net al. Improved liver function in patients with liver cirrhosis after\nautologous bone marrow cell infusion therapy. Stem Cells. (2006) 24:2292–8.\ndoi: 10.1634/stemcells.2005-0542\n107. Pai M, Zacharoulis D, Milicevic MN, Helmy S, Jiao LR, Levicar N, et al.\nAutologous infusion of expanded mobilized adult bone marrow-derived\nCD34+ cells into patients with alcoholic liver cirrhosis. Am J Gastroenterol.\n(2008) 103:1952–8. doi: 10.1111/j.1572-0241.2008.01993.x\n108. Saito T, Okumoto K, Haga H, Nishise Y, Ishii R, Sato C, et al. Potential\ntherapeutic application of intravenous autologous bone marrow infusion in\npatients with alcoholic liver cirrhosis. Stem Cells Dev. (2011) 20:1503–10.\ndoi: 10.1089/scd.2011.0074\n109. Pankaj P, Zhang Q, Bai XL, Liang TB. Autologous bone marrow\ntransplantation in decompensated liver: systematic review\nand meta-analysis. World J Gastroenterol. (2015) 21:8697–710.\ndoi: 10.3748/wjg.v21.i28.8697\n110. Gorczynski R, Chen Z, Khatri I, Yu K. Long-term tolerance and skin\nallograft survival in cd200tg mice after autologous marrow transplantation.\nTransplantation. (2014) 98:1271–8. doi: 10.1097/TP.0000000000\n000456\n111. Gorczynski RM, Sadozai H, Zhu F, Khatri I. Effect of infusion of monoclonal\nantibodies to tumour necrosis factor-receptor super family 25 on graft\nrejection in allo-immune mice receiving autologous marrow transplantation.\nImmunology. (2017) 150:418–31. doi: 10.1111/imm.12693\n112. Gorczynski RM, Farrokhi K, Gorczynski C, Sadozai H, Zhu F, Khatri I.\nImportance of B cells to development of regulatory T cells and prolongation\nof tissue allograft survival in recipients receiving autologous bone marrow\ntransplantation. Immunology. (2018) 154:465–75. doi: 10.1111/imm.12895\n113. Vaikunthanathan T, Safinia N, Boardman D, Lechler RI, Lombardi G.\nRegulatory T cells: tolerance induction in solid organ transplantation. Clin\nExp Immunol. (2017) 189:197–210. doi: 10.1111/cei.12978\n114. Vignali DAA, Collison LW, Workman CJ. How regulatory T cells work. Nat\nRev Immunol. (2008) 8:523–32. doi: 10.1038/nri2343\nFrontiers in Immunology | www.frontiersin.org 12 June 2020 | Volume 11 | Article 1326\n\nDu et al. Liver Transplant Tolerance\n115. Ten Brinke A, Martinez-Llordella M, Cools N, Hilkens CMU, van Ham\nSM, Sawitzki B, et al. Ways forward for tolerance-inducing cellular\ntherapies- an AFACTT perspective. Front Immunol. (2019) 10:181.\ndoi: 10.3389/fimmu.2019.00181\n116. Li W, Zheng XX, Kuhr CS, Perkins JD. CTLA4 engagement is required for\ninduction of murine liver transplant spontaneous tolerance+. Am J Transpl.\n(2005) 5:978–86. doi: 10.1111/j.1600-6143.2005.00823.x\n117. Fujiki M, Esquivel CO, Martinez OM, Strober S, Uemoto S, Krams SM.\nInduced tolerance to rat liver allografts involves the apoptosis of intragraft\nT cells and the generation of CD4+CD25+FoxP3+T regulatory cells. Liver\nTranspl. (2010) 16:147–54. doi: 10.1002/lt.21963\n118. Li Y, Zhao X, Cheng D, Haga H, Tsuruyama T, Wood K, et al.\nThe presence of Foxp3 expressing T cells within grafts of tolerant\nhuman liver transplant recipients. Transplantation. (2008) 86:1837–43.\ndoi: 10.1097/TP.0b013e31818febc4\n119. Pons JA, Revilla-Nuin B, Baroja-Mazo A, Ramirez P, Martinez\ufffeAlarcon L, Sanchez-Bueno F, et al. FoxP3 in peripheral blood is\nassociated with operational tolerance in liver transplant patients during\nimmunosuppression withdrawal. Transplantation. (2008) 86:1370–8.\ndoi: 10.1097/TP.0b013e318188d3e6\n120. Safinia N, Vaikunthanathan T, Fraser H, Thirkell S, Lowe K, Blackmore\nL, et al. Successful expansion of functional and stable regulatory T cells\nfor immunotherapy in liver transplantation. Oncotarget. (2016) 7:7563–77.\ndoi: 10.18632/oncotarget.6927\n121. Todo S, Yamashita K, Goto R, Zaitsu M, Nagatsu A, Oura T, et al. A\npilot study of operational tolerance with a regulatory T-cell-based cell\ntherapy in living donor liver transplantation. Hepatology. (2016) 64:632–43.\ndoi: 10.1002/hep.28459\n122. Gregori S, Passerini L, Roncarolo MG. Clinical outlook for type-1 and\nFOXP3(+) T regulatory cell-based therapy. Front Immunol. (2015) 6:593.\ndoi: 10.3389/fimmu.2015.00593\n123. van der Net JB, Bushell A, Wood KJ, Harden PN. Regulatory T cells: first\nsteps of clinical application in solid organ transplantation. Transpl Int. (2016)\n29:3–11. doi: 10.1111/tri.12608\n124. Ellebrecht CT, Bhoj VG, Nace A, Choi EJ, Mao X, Cho MJ,\net al. Reengineering chimeric antigen receptor T cells for targeted\ntherapy of autoimmune disease. Science. (2016) 353:179–84.\ndoi: 10.1126/science.aaf6756\n125. MacDonald KG, Hoeppli RE, Huang Q, Gillies J, Luciani DS, Orban PC,\net al. Alloantigen-specific regulatory T cells generated with a chimeric\nantigen receptor. J Clin Invest. (2016) 126:1413–24. doi: 10.1172/JCI\n82771\n126. Boardman DA, Philippeos C, Fruhwirth GO, Ibrahim MAA, Hannen RF,\nCooper D, et al. Expression of a chimeric antigen receptor specific for\ndonor HLA class i enhances the potency of human regulatory t cells in\npreventing human skin transplant rejection. Am J Transpl. (2017) 17:931–43.\ndoi: 10.1111/ajt.14185\n127. Noyan F, Zimmermann K, Hardtke-Wolenski M, Knoefel A, Schulde E,\nGeffers R, et al. Prevention of allograft rejection by use of regulatory T\ncells with an MHC-specific chimeric antigen receptor. Am J Transpl. (2017)\n17:917–30. doi: 10.1111/ajt.14175\n128. Desreumaux P, Foussat A, Allez M, Beaugerie L, Hebuterne X, Bouhnik Y,\net al. Safety and efficacy of antigen-specific regulatory T-cell therapy for\npatients with refractory Crohn’s disease. Gastroenterology. (2012) 143:1207–\n17.e2. doi: 10.1053/j.gastro.2012.07.116\n129. Theil A, Tuve S, Oelschlagel U, Maiwald A, Dohler D, Ossmann D,\net al. Adoptive transfer of allogeneic regulatory T cells into patients\nwith chronic graft-versus-host disease. Cytotherapy. (2015) 17:473–86.\ndoi: 10.1016/j.jcyt.2014.11.005\n130. Bayry J, Gautier JF. Regulatory T cell immunotherapy for type\n1 diabetes: a step closer to success? Cell Metab. (2016) 23:231–3.\ndoi: 10.1016/j.cmet.2016.01.010\n131. Thonhoff JR, Beers DR, Zhao W, Pleitez M, Simpson EP, Berry\nJD, et al. Expanded autologous regulatory T-lymphocyte infusions\nin ALS. Neurol Neuroimmunol Neuroinflamm. (2018) 5:e465.\ndoi: 10.1212/NXI.0000000000000465\n132. Chandran S, Tang Q, Sarwal M, Laszik ZG, Putnam AL, Lee K, et al.\nPolyclonal regulatory T cell therapy for control of inflammation in\nkidney transplants. Am J Transplant. (2017) 17:2945–54. doi: 10.1111/ajt.\n14415\n133. Mathew JM, J HV, LeFever A, Konieczna I, Stratton C, He J, et al. A phase\nI clinical trial with ex vivo expanded recipient regulatory t cells in living\ndonor kidney transplants. Sci Rep. (2018) 8:7428. doi: 10.1038/s41598-018-\n25574-7\n134. Fraser H, Safinia N, Grageda N, Thirkell S, Lowe K, Fry LJ, et al. A rapamycin\ufffebased GMP-compatible process for the isolation and expansion of regulatory\nT cells for clinical trials. Mol Ther Methods Clin Dev. (2018) 8:198–209.\ndoi: 10.1016/j.omtm.2018.01.006\n135. Sanchez-Fueyo A, Whitehouse G, Grageda N, Cramp ME, Lim TY, Romano\nM, et al. Applicability, safety, and biological activity of regulatory T cell\ntherapy in liver transplantation. Am J Transplant. (2019) 20:1125–36.\ndoi: 10.1111/ajt.15700\n136. Steinman RM, Cohn ZA. Identification of a novel cell type in peripheral\nlymphoid organs of mice. I. morphology, quantitation, tissue distribution.\nJ Exp Med. (1973) 137:1142–62. doi: 10.1084/jem.137.5.1142\n137. Banchereau J, Steinman RM. Dendritic cells and the control of immunity.\nNature. (1998) 392:245–52. doi: 10.1038/32588\n138. Ohnmacht C, Pullner A, King SB, Drexler I, Meier S, Brocker T, et al.\nConstitutive ablation of dendritic cells breaks self-tolerance of CD4 T cells\nand results in spontaneous fatal autoimmunity. J Exp Med. (2009) 206:549–\n59. doi: 10.1084/jem.20082394\n139. Sato K, Fujita S. Dendritic cells: nature and classification. Allergol Int. (2007)\n56:183–91. doi: 10.2332/allergolint.R-06-139\n140. Steptoe RJ, Thomson AW. Dendritic cells and tolerance induction.\nClin Exp Immunol. (1996) 105:397–402. doi: 10.1046/j.1365-2249.1996.\nd01-779.x\n141. Takenaka MC, Quintana FJ. Tolerogenic dendritic cells. Semin\nImmunopathol. (2017) 39:113–20. doi: 10.1007/s00281-016-0587-8\n142. Sato K, Yamashita N, Baba M, Matsuyama T. Modified myeloid\ndendritic cells act as regulatory dendritic cells to induce anergic and\nregulatory T cells. Blood. (2003) 101:3581–9. doi: 10.1182/blood-2002-\n09-2712\n143. Sato K, Yamashita N, Yamashita N, Baba M, Matsuyama T.\nRegulatory dendritic cells protect mice from murine acute graft\ufffeversus-host disease and leukemia relapse. Immunity. (2003) 18:367–79.\ndoi: 10.1016/S1074-7613(03)00055-4\n144. Ezzelarab MB, Zahorchak AF, Lu L, Morelli AE, Chalasani G, Demetris\nAJ, et al. Regulatory dendritic cell infusion prolongs kidney allograft\nsurvival in nonhuman primates. Am J Transplant. (2013) 13:1989–2005.\ndoi: 10.1111/ajt.12310\n145. Raich-Regue D, Glancy M, Thomson AW. Regulatory dendritic cell therapy:\nfrom rodents to clinical application. Immunol Lett. (2014) 161:216–21.\ndoi: 10.1016/j.imlet.2013.11.016\n146. Thomson AW, Humar A, Lakkis FG, Metes DM. Regulatory\ndendritic cells for promotion of liver transplant operational tolerance:\nRationale for a clinical trial and accompanying mechanistic studies.\nHum Immunol. (2018) 79:314–21. doi: 10.1016/j.humimm.2017.\n10.017\n147. Thomson AW, Metes DM, Ezzelarab MB, Raïch-Regué D. Regulatory\ndendritic cells for human organ transplantation. Transplant Rev. (2019)\n33:130–6. doi: 10.1016/j.trre.2019.05.001\n148. Yu H, Tian Y, Wang Y, Mineishi S, Zhang Y. Dendritic cell regulation of graft\ufffevs.-host disease: immunostimulation and tolerance. Front Immunol. (2019)\n10: 93. doi: 10.3389/fimmu.2019.00093\n149. Lutz MB, Suri RM, Niimi M, Ogilvie AL, Kukutsch NA, Rossner S,\net al. Immature dendritic cells generated with low doses of GM-CSF\nin the absence of IL-4 are maturation resistant and prolong allograft\nsurvival in vivo. Eur J Immunol. (2000) 30:1813–22. doi: 10.1002/1521-\n4141(200007)30:7<1813::AID-IMMU1813>3.0.CO;2-8\n150. Thomson AW, Robbins PD. Tolerogenic dendritic cells for autoimmune\ndisease and transplantation. Ann Rheum Dis. (2008) 67(Suppl. 3):iii90–6.\ndoi: 10.1136/ard.2008.099176\n151. Natarajan S, Thomson AW. Tolerogenic dendritic cells and myeloid\ufffederived suppressor cells: potential for regulation and therapy of\nliver auto- and alloimmunity. Immunobiology. (2010) 215:698–703.\ndoi: 10.1016/j.imbio.2010.05.024\nFrontiers in Immunology | www.frontiersin.org 13 June 2020 | Volume 11 | Article 1326\n\nDu et al. Liver Transplant Tolerance\n152. Stoop JN, Robinson JH, Hilkens CM. Developing tolerogenic dendritic\ncell therapy for rheumatoid arthritis: what can we learn from mouse\nmodels? Ann Rheum Dis. (2011) 70:1526–33. doi: 10.1136/ard.2011.\n151654\n153. Thomson AW, Zahorchak AF, Ezzelarab MB, Butterfield LH,\nLakkis FG, Metes DM. Prospective clinical testing of regulatory\ndendritic cells in organ transplantation. Front Immunol. (2016) 7:15.\ndoi: 10.3389/fimmu.2016.00015\n154. Ezzelarab MB, Raich-Regue D, Lu L, Zahorchak AF, Perez-Gutierrez A,\nHumar A, et al. Renal allograft survival in nonhuman primates infused with\ndonor antigen-pulsed autologous regulatory dendritic cells. Am J Transplant.\n(2017) 17:1476–89. doi: 10.1111/ajt.14182\n155. Xia MJ, Shan J, Li YP, Zhou YN, Guo YJ, Sun GX, et al. Adoptive\ntransfusion of tolerogenic dendritic cells prolongs the survival of liver\nallograft: a systematic review. J Evid Based Med. (2014) 7:135–46.\ndoi: 10.1111/jebm.12094\n156. Raker VK, Domogalla MP, Steinbrink K. Tolerogenic dendritic cells\nfor regulatory T cell induction in man. Front Immunol. (2015) 6:569.\ndoi: 10.3389/fimmu.2015.00569\n157. Sato K, Uto T, Fukaya T, Takagi H. Regulatory dendritic cells. Curr Top\nMicrobiol Immunol. (2017) 410:47–71. doi: 10.1007/82_2017_60\n158. Schinnerling K, Garcia-Gonzalez P, Aguillon JC. Gene expression\nprofiling of human monocyte-derived dendritic cells - searching for\nmolecular regulators of tolerogenicity. Front Immunol. (2015) 6:528.\ndoi: 10.3389/fimmu.2015.00528\n159. Schwartz RH. T cell anergy. Ann Rev Immunol. (2003) 21:305–34.\ndoi: 10.1146/annurev.immunol.21.120601.141110\n160. Schietinger A, Greenberg PD. Tolerance and exhaustion: defining\nmechanisms of T cell dysfunction. Trends Immunol. (2014) 35:51–60.\ndoi: 10.1016/j.it.2013.10.001\n161. Lu L, Qian S, Hershberger PA, Rudert WA, Lynch DH, Thomson\nAW. Fas ligand (CD95L) and B7 expression on dendritic cells provide\ncounter-regulatory signals for T cell survival and proliferation. J Immunol.\n(1997) 158:5676–84.\n162. Mellor AL, Baban B, Chandler P, Marshall B, Jhaver K, Hansen A, et al.\nCutting edge: induced indoleamine 2,3 dioxygenase expression in dendritic\ncell subsets suppresses T cell clonal expansion. J Immunol. (2003) 171:1652–\n5. doi: 10.4049/jimmunol.171.4.1652\n163. Huang H, Dawicki W, Zhang X, Town J, Gordon JR. Tolerogenic dendritic\ncells induce CD4+CD25hiFoxp3+ regulatory T cell differentiation from\nCD4+CD25-/loFoxp3- effector T cells. J Immunol. (2010) 185:5003–10.\ndoi: 10.4049/jimmunol.0903446\n164. Hsu SM, Mathew R, Taylor AW, Stein-Streilein J. Ex-vivo tolerogenic\nF4/80(+) antigen-presenting cells (APC) induce efferent CD8(+) regulatory\nT cell-dependent suppression of experimental autoimmune uveitis. Clin Exp\nImmunol. (2014) 176:37–48. doi: 10.1111/cei.12243\n165. Qian L, Qian C, Chen Y, Bai Y, Bao Y, Lu L, et al. Regulatory\ndendritic cells program B cells to differentiate into CD19hiFcgammaIIbhi\nregulatory B cells through IFN-beta and CD40L. Blood. (2012) 120:581–91.\ndoi: 10.1182/blood-2011-08-377242\n166. Hill M, Thebault P, Segovia M, Louvet C, Beriou G, Tilly G, et al.\nCell therapy with autologous tolerogenic dendritic cells induces allograft\ntolerance through interferon-gamma and epstein-barr virus-induced gene\n3. Am J Transplant. (2011) 11:2036–45. doi: 10.1111/j.1600-6143.2011.\n03651.x\n167. Chauveau C, Remy S, Royer PJ, Hill M, Tanguy-Royer S, Hubert FX,\net al. Heme oxygenase-1 expression inhibits dendritic cell maturation and\nproinflammatory function but conserves IL-10 expression. Blood. (2005)\n106:1694–702. doi: 10.1182/blood-2005-02-0494\n168. Ilarregui JM, Croci DO, Bianco GA, Toscano MA, Salatino M, Vermeulen\nME, et al. Tolerogenic signals delivered by dendritic cells to T cells\nthrough a galectin-1-driven immunoregulatory circuit involving interleukin\n27 and interleukin 10. Nat Immunol. (2009) 10:981–91. doi: 10.1038/\nni.1772\n169. Moreau A, Hill M, Thebault P, Deschamps JY, Chiffoleau E, Chauveau\nC, et al. Tolerogenic dendritic cells actively inhibit T cells through heme\noxygenase-1 in rodents and in nonhuman primates. FASEB J. (2009)\n23:3070–7. doi: 10.1096/fj.08-128173\n170. Remy S, Blancou P, Tesson L, Tardif V, Brion R, Royer PJ, et al. Carbon\nmonoxide inhibits TLR-induced dendritic cell immunogenicity. J Immunol.\n(2009) 182:1877–84. doi: 10.4049/jimmunol.0802436\n171. Li H, Shi B. Tolerogenic dendritic cells and their applications in\ntransplantation. Cell Mol Immunol. (2015) 12:24–30. doi: 10.1038/cmi.\n2014.52\n172. Ochando J, Ordikhani F, Jordan S, Boros P, Thomson AW. Tolerogenic\ndendritic cells in organ transplantation. Transpl Int. (2020) 33:113–27.\ndoi: 10.1111/tri.13504\n173. Liu Q, Rojas-Canales DM, Divito SJ, Shufesky WJ, Stolz DB, Erdos G,\net al. Donor dendritic cell-derived exosomes promote allograft-targeting\nimmune response. J Clin Invest. (2016) 126:2805–20. doi: 10.1172/JCI\n84577\n174. Song J, Huang J, Chen X, Teng X, Song Z, Xing Y, et al. Donor\ufffederived exosomes induce specific regulatory T cells to suppress\nimmune inflammation in the allograft heart. Sci Rep. (2016) 7:20077.\ndoi: 10.1038/srep46389\n175. Nestle FO, Banchereau J, Hart D. Dendritic cells: on the move from bench to\nbedside. Nat Med. (2001) 7:761–5. doi: 10.1038/89863\n176. Kryczanowsky F, Raker V, Graulich E, Domogalla MP, Steinbrink K. IL-10-\nmodulated human dendritic cells for clinical use: identification of a stable\nand migratory subset with improved tolerogenic activity. J Immunol. (2016)\n197:3607–17. doi: 10.4049/jimmunol.1501769\n177. Adorini L, Penna G, Giarratana N, Uskokovic M. Tolerogenic dendritic cells\ninduced by vitamin D receptor ligands enhance regulatory T cells inhibiting\nallograft rejection and autoimmune diseases. J Cell Biochem. (2003) 88:227–\n33. doi: 10.1002/jcb.10340\n178. Rutella S, Danese S, Leone G. Tolerogenic dendritic cells: cytokine\nmodulation comes of age. Blood. (2006) 108:1435–40. doi: 10.1182/blood\ufffe2006-03-006403\n179. Morelli AE, Thomson AW. Tolerogenic dendritic cells and the\nquest for transplant tolerance. Nat Rev Immunol. (2007) 7:610–21.\ndoi: 10.1038/nri2132\n180. Marin E, Cuturi MC, Moreau A. Tolerogenic dendritic cells in solid\norgan transplantation: where do we stand? Front Immunol. (2018) 9:274.\ndoi: 10.3389/fimmu.2018.00274\n181. Fu F, Li Y, Qian S, Lu L, Chambers F, Starzl TE, et al.\nCostimulatory molecule-deficient dendritic cell progenitors (MHC\nclass II+, CD80dim, CD86-) prolong cardiac allograft survival in\nnonimmunosuppressed recipients. Transplantation. (1996) 62:659–65.\ndoi: 10.1097/00007890-199609150-00021\n182. Zhou Y, Shan J, Guo Y, Li S, Long D, Li Y, et al. Effects of adoptive\ntransfer of tolerogenic dendritic cells on allograft survival in organ\ntransplantation models: an overview of systematic reviews. J Immunol Res.\n(2016) 2016:5730674. doi: 10.1155/2016/5730674\n183. Stead SO, Kireta S, McInnes SJP, Kette FD, Sivanathan KN, Kim J, et al.\nMurine and non-human primate dendritic cell targeting nanoparticles for\nin vivo generation of regulatory T-cells. ACS Nano. (2018) 12:6637–47.\ndoi: 10.1021/acsnano.8b01625\n184. Giannoukakis N, Phillips B, Finegold D, Harnaha J, Trucco M. Phase\nI (safety) study of autologous tolerogenic dendritic cells in type\n1 diabetic patients. Diabetes Care. (2011) 34:2026–32. doi: 10.2337/\ndc11-0472\n185. Jauregui-Amezaga A, Cabezon R, Ramirez-Morros A, Espana C, Rimola\nJ, Bru C, et al. Intraperitoneal administration of autologous tolerogenic\ndendritic cells for refractory crohn’s disease: a phase I study. J Crohns Colitis.\n(2015) 9:1071–8. doi: 10.1093/ecco-jcc/jjv144\n186. Ten Brinke A, Hilkens CM, Cools N, Geissler EK, Hutchinson JA, Lombardi\nG, et al. Clinical use of tolerogenic dendritic cells-harmonization approach\nin european collaborative effort. Mediators Inflamm. (2015) 2015:471719.\ndoi: 10.1155/2015/471719\n187. Bell GM, Anderson AE, Diboll J, Reece R, Eltherington O, Harry\nRA, et al. Autologous tolerogenic dendritic cells for rheumatoid\nand inflammatory arthritis. Ann Rheum Dis. (2017) 76:227–34.\ndoi: 10.1136/annrheumdis-2015-208456\n188. Willekens B, Presas-Rodriguez S, Mansilla MJ, Derdelinckx J, Lee WP, Nijs\nG, et al. Tolerogenic dendritic cell-based treatment for multiple sclerosis\n(MS): a harmonised study protocol for two phase I clinical trials comparing\nFrontiers in Immunology | www.frontiersin.org 14 June 2020 | Volume 11 | Article 1326\n\nDu et al. Liver Transplant Tolerance\nintradermal and intranodal cell administration. BMJ Open. (2019) 9:e030309.\ndoi: 10.1136/bmjopen-2019-030309\n189. Zahorchak AF, Macedo C, Hamm DE, Butterfield LH, Metes DM,\nThomson AW. High PD-L1/CD86 MFI ratio and IL-10 secretion\ncharacterize human regulatory dendritic cells generated for clinical\ntesting in organ transplantation. Cell Immunol. (2018) 323:9–18.\ndoi: 10.1016/j.cellimm.2017.08.008\n190. Obregon C, Kumar R, Pascual MA, Vassalli G, Golshayan D.\nUpdate on dendritic cell-induced immunological and clinical\ntolerance. Front Immunol. (2017) 8:1514. doi: 10.3389/fimmu.2017.\n01514\n191. Peche H, Trinite B, Martinet B, Cuturi MC. Prolongation of heart\nallograft survival by immature dendritic cells generated from recipient\ntype bone marrow progenitors. Am J Transplant. (2005) 5:255–67.\ndoi: 10.1111/j.1600-6143.2004.00683.x\n192. Moreau A, Alliot-Licht B, Cuturi MC, Blancho G. Tolerogenic dendritic\ncell therapy in organ transplantation. Transpl Int. (2017) 30:754–64.\ndoi: 10.1111/tri.12889\nConflict of Interest: The authors declare that the research was conducted in the\nabsence of any commercial or financial relationships that could be construed as a\npotential conflict of interest.\nCopyright © 2020 Du, Chang, Guo, Zhang and Chen. This is an open-access article\ndistributed under the terms of the Creative Commons Attribution License (CC BY).\nThe use, distribution or reproduction in other forums is permitted, provided the\noriginal author(s) and the copyright owner(s) are credited and that the original\npublication in this journal is cited, in accordance with accepted academic practice.\nNo use, distribution or reproduction is permitted which does not comply with these\nterms.\nFrontiers in Immunology | www.frontiersin.org 15 June 2020 | Volume 11 | Article 1326\n\n']","This article provides a comprehensive review of the latest developments in the field of cell-based immunotherapy for liver transplantation. The review covers topics such as regulatory T cells, tolerogenic dendritic cells, mesenchymal stem cells, and hematopoietic stem cells. The article discusses the advantages and limitations of each type of cell therapy, as well as recent clinical trials and ongoing research efforts. The review also highlights the challenges associated with translational research in this area, including issues related to safety, efficacy, and cost-effectiveness. Overall, the article suggests that cell-based immunotherapy holds promise as a novel approach for promoting liver transplant tolerance, although further research is needed to fully realize its potential.",0.8666666666666667,0.8312378488707125,FULL_PAPER
