{"user_input": "Which technologies show the strongest publication/citation increases in the last five years indicating emerging interests/trends/consensus (outside of the expected like AI or by center or region)?", "retrieved_contexts": ["Radiologists are already familiar with computer-aided\ndetection/diagnosis (CAD) systems, which were first in￾troduced in the 1960s in chest x-ray and mammography\napplications [5]. However, advances in algorithm devel￾opment, combined with the ease of access to computa￾tional resources, allows AI to be applied in radiological\ndecision-making at a higher functional level [7].\nThe wind of change\nThe great enthusiasm for and dynamism in the develop￾ment of AI systems in radiology is shown by the increase\nin publications on this topic (Figs. 4 and 5). Only 10\nyears ago, the total number of publications on AI in\nradiology only just exceeded 100 per year. Thereafter, we\nhad a tremendous increase, with over 700–800\npublications per year in 2016–17. In the last couple of\nyears, computed tomography (CT) and magnetic reson￾ance imaging (MRI) have collectively accounted for more\nthan 50% of articles, though radiography, mammography,\nand ultrasound are also represented (Table 1). Neuroradi￾ology (here evaluated as imaging of the central nervous\nsystem) is the most involved subspecialty (accounting for\nabout one-third of the papers), followed by musculoskel￾etal, cardiovascular, breast, urogenital, lung/thorax, and\nabdominal radiology, each representing between 6 and 9%\nof the total number of papers (Table 2). AI currently has\nan impact on the field of radiology, with MRI and neuro￾radiology as the major fields of innovation.\nRecent meetings have also proven the interest in AI\napplications. During the 2018 European Congress of\nRadiology and the 2017 Annual Meeting of the Radio￾logical Society of North America, AI represented the\nfocus of many talks. Studies showed the application of\nDL algorithms for assessing the risk of malignancy for a\nlung nodule, estimating skeletal maturity from paediatric\nhand radiographs, classifying liver masses, and even ob￾viating the need for thyroid and breast biopsies [9–11];\nat the same time, the vendors showed examples of AI\napplications in action [9, 10].\nAI in radiology: threat or opportunity?\nA motto of radiology residents is: “The more images you\nsee, the more examinations you report, the better you\nget”. The same principle works for ML, and in particular\nfor DL. In the past decades, medical imaging has evolved\nfrom projection images, such as radiographs or planar\nscintigrams, to tomographic (i.e. cross-sectional) images,\nsuch as ultrasound (US), CT, tomosynthesis, positron\nFig. 2 Comparison between classic machine learning and deep learning approaches applied to a classification task. Both depicted approaches\nuse an artificial neural network organised in different layers (IL input layer, HL hidden layer, OL output layer). The deep learning approach avoids\nthe design of dedicated feature extractors by using a deep neural network that represents complex features as a composition of simpler ones\nFig. 3 Graphical representation of the different relationship between\nthe amount of data given to traditional ML or DL systems and their\nperformance. Only DL systems continue to increase their performance\nPesapane et al. European Radiology Experimental (2018) 2:35 Page 3 of 10", "NAR RA TIV E R EVI EW Open Access\nArtificial intelligence in medical imaging:\nthreat or opportunity? Radiologists again at\nthe forefront of innovation in medicine\nFilippo Pesapane1†\n, Marina Codari2*† and Francesco Sardanelli2,3\nAbstract\nOne of the most promising areas of health innovation is the application of artificial intelligence (AI), primarily in medical\nimaging. This article provides basic definitions of terms such as “machine/deep learning” and analyses the integration\nof AI into radiology. Publications on AI have drastically increased from about 100–150 per year in 2007–2008\nto 700–800 per year in 2016–2017. Magnetic resonance imaging and computed tomography collectively account for\nmore than 50% of current articles. Neuroradiology appears in about one-third of the papers, followed by musculoskeletal,\ncardiovascular, breast, urogenital, lung/thorax, and abdomen, each representing 6–9% of articles. With an irreversible\nincrease in the amount of data and the possibility to use AI to identify findings either detectable or not by the human\neye, radiology is now moving from a subjective perceptual skill to a more objective science. Radiologists, who were on\nthe forefront of the digital era in medicine, can guide the introduction of AI into healthcare. Yet, they will not be replaced\nbecause radiology includes communication of diagnosis, consideration of patient’s values and preferences, medical\njudgment, quality assurance, education, policy-making, and interventional procedures. The higher efficiency provided\nby AI will allow radiologists to perform more value-added tasks, becoming more visible to patients and playing a vital\nrole in multidisciplinary clinical teams.\nKeywords: Neural networks (computer), Artificial intelligence, Deep learning, Machine learning, Radiology\nKey points\n\u0001 Over 10 years, publications on AI in radiology have\nincreased from 100–150 per year to 700–800 per\nyear\n\u0001 Magnetic resonance imaging and computed\ntomography are the most involved techniques\n\u0001 Neuroradiology appears as the most involved\nsubspecialty (accounting for about one-third of the\npapers), followed by musculoskeletal, cardiovascular,\nbreast, urogenital, lung/thorax, and abdominal\nradiology (each representing 6–9% of articles)\n\u0001 Radiologists, the physicians who were on the\nforefront of the digital era in medicine, can now\nguide the introduction of AI in healthcare\nIntroduction\nOne of the most promising areas of health innovation is\nthe application of artificial intelligence (AI) in medical im￾aging, including, but not limited to, image processing and\ninterpretation [1]. Indeed, AI may find multiple applica￾tions, from image acquisition and processing to aided\nreporting, follow-up planning, data storage, data mining,\nand many others. Due to this wide range of applications, AI\nis expected to massively impact the radiologist’s daily life.\nThis article provides basic definitions of terms com￾monly used when discussing AI applications, analyses\nvarious aspects related to the integration of AI in the\nradiological workflow, and provides an overview of the\nbalance between AI threats and opportunities for radiol￾ogists. Awareness of this trend is a necessity, especially\nfor younger generations who will face this revolution.\nArtificial intelligence: definitions\nThe term AI is applied when a device mimics cognitive\nfunctions, such as learning and problem solving [2].\n* Correspondence: marina.codari@grupposandonato.it †\nFilippo Pesapane and Marina Codari contributed equally to this work.\n2\nUnit of Radiology, IRCCS Policlinico San Donato, Via Morandi 30, 20097 San\nDonato Milanese, Milan, Italy\nFull list of author information is available at the end of the article\nEuropean Radiology\nExperimental\n© The Author(s). 2018 Open Access This article is distributed under the terms of the Creative Commons Attribution 4.0\nInternational License (http://creativecommons.org/licenses/by/4.0/), which permits unrestricted use, distribution, and", "BMC Medical Research Methodology 2007, 7:52 http://www.biomedcentral.com/1471-2288/7/52\nPage 6 of 10\n(page number not for citation purposes)\nround 1 Vs round 2 showed the least agreement, K =\n0.313, yet was consistently ranked the most important.\nThis apparent anomaly is discussed below. Statement 4\nhad the second lowest SD by round 3 yet never achieved a\nK > 0.5. Statement 1, 3 and 7 got the 3 highest Kappa val￾ues, comparing round 2 and 3.\nDiscussion\nThe Delphi results show a change in participants' views\ntowards consensus and stability as indicated by a trend\ntowards:\n• an increase in percentage agreements\n• convergence of importance rankings\n• increase in Kappa values\n• a decrease in comments as rounds progressed\nAn increase was observed in percentage agreements for all\nstatements over the 3 rounds with only 2 statements\n(Tables 6 and 8) showing some disagreement by round 3,\ncompared to 7 statements in round 1. This demonstrates\nthe evolution of consensus. Statement 4 (Table 7) had the\nhighest disagreement percentage in round 1, yet full agree￾ment by round 3, demonstrating that views could alter\nconsiderably.\nOscillatory movements at individual and group level were\nconsistent with those described by Scheibe et al.[16]. A\ndeviation in the level of agreement, \"strongly agree\" or\n\"agree,\" between rounds was evident in most statements,\nand was not dependent on changes to statement phrasing\n(Table 7). The phenomenon of 2 participants failing to\nrespond to round 2 had a bearing on the oscillatory move￾ment, their lack of response gave a misleading bias\ntowards agreement (Table 6). Individually both these par￾ticipants disagreed to this statement, demonstrating dis￾advantage in the use of percentages. It is worth noting that\nnon-responders can impact significantly on the sample\nsize when interpreting percentages and this could lead to\nmisleading oscillatory movements as suggested by\nScheibe et al.[16].\nTable 9: Agreement and importance values for statement 6\nRound 1 Round 2 Round 3\nAgreement Strongly agree 25% 10% 25%\nAgree 42% 60% 58%\nNo opinion 0% 0% 17%\nDisagree 33% 20% 0%\nStrongly disagree 0% 10% 0%\nImportance Median 5.5 7 7\nRange 1–7 3–8 3–8\nRank 7 8 7\nMean 4.83 6.40 6.33\nStandard deviation 2.21 1.65 1.56\nRank 6 7 7\nTable 8: Agreement and importance values for statement 5\nRound 1 Round 2 Round 3\nAgreement Strongly agree 25% 10% 17%\nAgree 42% 60% 58%\nNo opinion 25% 20% 17%\nDisagree 9% 10% 8%\nStrongly disagree 0% 0% 0%\nImportance Median 3.5 4 5.5\nRange 1–8 2–7 3–8\nRank 3 4 = 5\nMean 4.25 4.40 5.67\nStandard deviation 2.53 1.78 1.72\nRank 3 5 5\n\nBMC Medical Research Methodology 2007, 7:52 http://www.biomedcentral.com/1471-2288/7/52\nPage 7 of 10\n(page number not for citation purposes)\nTable 11: Agreement and importance values for statement 8\nRound 1 Round 2 Round 3\nAgreement Strongly agree 17% 30% 25%\nAgree 50% 50% 75%\nNo opinion 25% 20% 0%\nDisagree 8% 0% 0%\nStrongly disagree 0% 0% 0%\nImportance Median 6 6.5 7\nRange 3–8 3–8 5–8\nRank 8 7 8\nMean 5.92 6.30 6.17\nStandard deviation 1.56 1.77 1.11\nRank 8 6 6\nTable 10: Agreement and importance values for statement 7\nRound 1 Round 2 Round 3\nAgreement Strongly agree 50% 70% 67%\nAgree 42% 30% 33%\nNo opinion 8% 0% 0%\nDisagree 0% 0% 0%\nStrongly disagree 0% 0% 0%\nImportance Median 2 1 1\nRange 1–7 1–6 1–5\nRank 1 1 1\nMean 2.67 1.90 1.50\nStandard deviation 1.97 1.73 1.17\nRank 1 1 1\nTable 12: Kappa values for within-subject agreement in importance rankings between rounds of each statement\nAgreement between Rounds 1 and 2 Agreement between Rounds 2 and 3 Agreement between first and last round (1 and 3)\nStatement 1 0.642 0.836 0.432\nStatement 2 0.697 0.516 0.596\nStatement 3 0.600 0.750 0.533\nStatement 4 0.498 0.490 0.470\nStatement 5 0.696 0.669 0.627\nStatement 6 0.627 0.641 0.548\nStatement 7 0.313 0.711 0.375\nStatement 8 0.515 0.690 0.519", "expandable database.\nTo our knowledge, this is the first comprehensive database of\nstrictly AI/ML-based medical technologies, in all medical special￾ties, that have been approved by the FDA. We also suggest a\nthreshold and definition of what defines a medical technology as\nAI/ML based.\nRESULTS\nCross-checked and validated medical devices and algorithms\nCross-checking and validation of all announcements resulted in a\ndatabase with 64 AI/ML based, FDA-approved medical devices\nand algorithms. We decided to include only those 29 devices in\nour further analysis that met the criteria of being considered an AI/\nML-based technology in the related official FDA announcements\n(Table 2). For the other 35 devices, online sources other than the\nFDA marked them as AI/ML-based technologies. A comprehensive\noverview is provided in the online open access database.\nA short overview of these medical devices and algorithms can\nbe found in the infographic (Fig. 1) and a detailed overview, with\nsubsequent directions to the official FDA announcements, is\nprovided in the online open access database.\nOf these medical devices and algorithms, the vast majority (n =\n23, 79.3%) was approved by the FDA with a 510(k) clearance, while\n5 (17.2%) received de novo pathway clearance and one (3.4%)\nreceived PMA clearance.\nThe first FDA approval was granted in the year 2016, with three\napprovals at the end of the year 2017. Most FDA approvals were\ngranted in the year 2018, with 13 (44.8%) approvals, while 10\n(34.4%) and 2 (6.9%) approvals were granted in 2019 and 2020 up\nuntil February, respectively.\nThe two main medical specialties with AI/ML-based medical\ninnovations are Radiology and Cardiology, with 21 (72.4%) and 4\n(13.8%) FDA approved medical devices and algorithms respec￾tively. The remaining medical devices and algorithms can be\ngrouped as focusing on internal medicine/endocrinology, neurol￾ogy, ophthalmology, emergency medicine, and oncology.\nThe medical field of radiology is the trendsetter regarding FDA￾approved medical devices and algorithms, with the introduction\nof AI/ML-based solutions for worldwide applied image reading\nsoftware. Examples are the three algorithms for Arterys Inc.,\nArterys Cardio DL, Arterys Oncology DL and Arterys MICA, which\nTable 1. Descriptions of the types of FDA approvals for AI/ML-based medical technologies.\nLevel of FDA clearance Description\n510(k) clearance A 510(k) clearance for an algorithm is granted when it has been shown to be at least as safe and effective as another similar,\nlegally marketed algorithm. The submitter seeking this clearance must provide substantial proof of equivalence in their\napplication. Without an approval of being substantially equivalent to the other algorithm, the one pending approval cannot\nbe legally marketed.\nPremarket approval Premarket approval is issued to algorithms for Class III medical devices. The latter are those that can have a large impact on\nhuman health and as such, their evaluation undergo more thorough scientific and regulatory processes to determine their\nsafety and effectiveness. In order to approve an application, the FDA determines that the device’s safety and effectiveness is\nsupported by satisfactory scientific evidence. Upon approval, the applicant can proceed with marketing the product.\nde novo pathway Regarding the de novo classification, it is used to classify those novel medical devices for which there are no legally\nmarketed counterparts, but which offer adequate safety and effectiveness with general controls. The FDA performs a risk￾based assessment of the device in question before approval and allowing the device to be marketed.\nS. Benjamens et al.\n2\nnpj Digital Medicine (2020) 118 Seoul National University Bundang Hospital\n1234567890():,;", "Nature Reviews | Neuroscience\nRelative bias of research finding (%)\n100\n80\n60\n40\n20\n0\n0 20 40 60 80 100\nStatistical power of study (%)\nare expended87. Similarly, adopting conservative priors \ncan substantially reduce the likelihood of claiming that \nan effect exists when in fact it does not85. At present, \nsignificance testing remains the dominant framework \nwithin neuroscience, but the flexibility of alternative (for \nexample, Bayesian) approaches means that they should \nbe taken seriously by the field.\nConclusions and future directions\nA consequence of the remarkable growth in neurosci￾ence over the past 50 years has been that the effects we \nnow seek in our experiments are often smaller and more \nsubtle than before as opposed to when mostly easily dis￾cernible ‘low-hanging fruit’ were targeted. At the same \ntime, computational analysis of very large datasets is now \nrelatively straightforward, so that an enormous number of \ntests can be run in a short time on the same dataset. These \ndramatic advances in the flexibility of research design and \nanalysis have occurred without accompanying changes to \nother aspects of research design, particularly power. For \nexample, the average sample size has not changed sub￾stantially over time88 despite the fact that neuroscientists \nare likely to be pursuing smaller effects. The increase in \nresearch flexibility and the complexity of study designs89\ncombined with the stability of sample size and search for \nincreasingly subtle effects has a disquieting consequence: \na dramatic increase in the likelihood that statistically sig￾nificant findings are spurious. This may be at the root of \nthe recent replication failures in the preclinical literature8\nand the correspondingly poor translation of these findings \ninto humans90.\nLow power is a problem in practice because of the \nnormative publishing standards for producing novel, \nsignificant, clean results and the ubiquity of null \nhypothesis significance testing as the means of evaluat￾ing the truth of research findings. As we have shown, \nthese factors result in biases that are exacerbated by low \npower. Ultimately, these biases reduce the reproducibil￾ity of neuroscience findings and negatively affect the \nvalidity of the accumulated findings. Unfortunately, \npublishing and reporting practices are unlikely to \nchange rapidly. Nonetheless, existing scientific practices \ncan be improved with small changes or additions that \napproximate key features of the idealized model4,91,92. \nWe provide a summary of recommendations for future \nresearch practice in BOX 2.\nIncreasing disclosure. False positives occur more fre￾quently and go unnoticed when degrees of freedom in \ndata analysis and reporting are undisclosed5\n. Researchers \ncan improve confidence in published reports by noting \nin the text: “We report how we determined our sample \nsize, all data exclusions, all data manipulations, and all \nmeasures in the study.”7\n When such a statement is not \npossible, disclosure of the rationale and justification of \ndeviations from what should be common practice (that \nis, reporting sample size, data exclusions, manipula￾tions and measures) will improve readers’ understand￾ing and interpretation of the reported effects and, \ntherefore, of what level of confidence in the reported \neffects is appropriate. In clinical trials, there is an \nincreasing requirement to adhere to the Consolidated \nStandards of Reporting Trials (CONSORT), and the \nsame is true for systematic reviews and meta-analyses, \nfor which the Preferred Reporting Items for Systematic \nReviews and Meta-Analyses (PRISMA) guidelines are \nnow being adopted. A number of reporting guidelines \nhave been produced for application to diverse study \ndesigns and tools, and an updated list is maintained \nby the EQUATOR Network93. A ten-item checklist of \nstudy quality has been developed by the Collaborative \nApproach to Meta-Analysis and Review of Animal Data", "issue, it contained 5 articles only, and now in its recent volume\npublished in April 2011, it contained 67 manuscripts. This e-journal\nis fulfilling the commitments and objectives sincerely, (as stated by\nEditor-in-chief in his preface to first edition) i e; to encourage\nphysicians through the internet, especially from the developing\ncountries who witness a spectrum of disease and acquire a wealth of\nknowledge to publish their experiences to benefit the medical\ncommunity in patients care. I also feel that many of us have work of\nsubstance, newer ideas, adequate clinical materials but poor in\nmedical writing and hesitation to submit the work and need help.\nJCDR provides authors help in this regards.\nTimely publication of journal: Publication of manuscripts and\nbringing out the issue in time is one of the positive aspects of JCDR\nand is possible with strong support team in terms of peer reviewers,\nproof reading, language check, computer operators, etc. This is one\nof the great reasons for authors to submit their work with JCDR.\nAnother best part of JCDR is \"Online first Publications\" facilities\navailable for the authors. This facility not only provides the prompt\npublications of the manuscripts but at the same time also early\navailability of the manuscripts for the readers.\nIndexation and online availability: Indexation transforms the\njournal in some sense from its local ownership to the worldwide\nprofessional community and to the public.JCDR is indexed with\nEmbase & EMbiology, Google Scholar, Index Copernicus, Chemical\nAbstracts Service, Journal seek Database, Indian Science Abstracts,\nto name few of them. Manuscriptspublished in JCDR are available\non major search engines ie; google, yahoo, msn.\nIn the era of fast growing newer technologies, and in computer and\ninternet friendly environment the manuscripts preparation,\nsubmission, review, revision, etc and all can be done and checked\nwith a click from all corer of the world, at any time. Of course there\nis always a scope for improvement in every field and none is\nperfect. To progress, one needs to identify the areas of one's\nweakness and to strengthen them.\nIt is well said that \"happy beginning is half done\" and it fits\nperfectly with JCDR. It has grown considerably and I feel it has\nalready grown up from its infancy to adolescence, achieving the\nstatus of standard online e-journal form Indian continent since its\ninception in Feb 2007. This had been made possible due to the\nefforts and the hard work put in it. The way the JCDR is improving", "issue, it contained 5 articles only, and now in its recent volume\npublished in April 2011, it contained 67 manuscripts. This e-journal\nis fulfilling the commitments and objectives sincerely, (as stated by\nEditor-in-chief in his preface to first edition) i e; to encourage\nphysicians through the internet, especially from the developing\ncountries who witness a spectrum of disease and acquire a wealth of\nknowledge to publish their experiences to benefit the medical\ncommunity in patients care. I also feel that many of us have work of\nsubstance, newer ideas, adequate clinical materials but poor in\nmedical writing and hesitation to submit the work and need help.\nJCDR provides authors help in this regards.\nTimely publication of journal: Publication of manuscripts and\nbringing out the issue in time is one of the positive aspects of JCDR\nand is possible with strong support team in terms of peer reviewers,\nproof reading, language check, computer operators, etc. This is one\nof the great reasons for authors to submit their work with JCDR.\nAnother best part of JCDR is \"Online first Publications\" facilities\navailable for the authors. This facility not only provides the prompt\npublications of the manuscripts but at the same time also early\navailability of the manuscripts for the readers.\nIndexation and online availability: Indexation transforms the\njournal in some sense from its local ownership to the worldwide\nprofessional community and to the public.JCDR is indexed with\nEmbase & EMbiology, Google Scholar, Index Copernicus, Chemical\nAbstracts Service, Journal seek Database, Indian Science Abstracts,\nto name few of them. Manuscriptspublished in JCDR are available\non major search engines ie; google, yahoo, msn.\nIn the era of fast growing newer technologies, and in computer and\ninternet friendly environment the manuscripts preparation,\nsubmission, review, revision, etc and all can be done and checked\nwith a click from all corer of the world, at any time. Of course there\nis always a scope for improvement in every field and none is\nperfect. To progress, one needs to identify the areas of one's\nweakness and to strengthen them.\nIt is well said that \"happy beginning is half done\" and it fits\nperfectly with JCDR. It has grown considerably and I feel it has\nalready grown up from its infancy to adolescence, achieving the\nstatus of standard online e-journal form Indian continent since its\ninception in Feb 2007. This had been made possible due to the\nefforts and the hard work put in it. The way the JCDR is improving", "* E-mail: linyuan.lue@unifr.ch\nIntroduction\nWith great theoretical and practical significance, the studies on\nepidemic and information spreading in biological, social and\ntechnological networks become one of the most exciting domains\nin many branches of sciences [1–4]. Therein how to control the\nspreading process is of particular interests [5], where the\nidentification of influential nodes is a crucial issue according to\nthe assumption that highly influential nodes are more likely to be\ninfected and to infect a larger number of nodes [6–8].\nA number of centrality indices have been proposed to address\nthis problem, such as degree centrality, closeness centrality [9],\nbetweenness centrality [10], and eigenvector centrality [11].\nDegree centrality is a straightforward and efficient metric but less\nrelevant. Recent researches show that top-degree ranking nodes\nhave positive effects on cooperative behaviors in social networks\n[12,13]. However, the location of a node in the network may play\na more important role than its degree. For example, a node\nlocated in the center of the network, having a few highly influential\nneighbors, may be more influential than a node having a larger\nnumber of less influential neighbors. Considering this fact, Kitsak\net al. [6] proposed a coarse-grained method by using k-core\ndecomposition to quantify a node’s influence based on the\nassumption that nodes in the same shell have similar influence\nand nodes in higher-level shells are likely to infect more nodes.\nThis method may fail in some cases. For example, in a tree, all\nnodes are in 1-core and thus expected to have the same influence\naccording to [6]. However, this tree may be hierarchically\norganized (e.g., the binary tree) and nodes near the root have\nmuch higher influence than leaves. Chen et al. [14] devised a semi￾local index by considering the next nearest neighborhood, which\ncan well identify influential nodes in a hierarchical tree and give\nmore elaborate division than k-core decomposition. Experimental\nresults demonstrated that the semi-local index performs as good as\nglobal indices while has much lower computational complexity,\nand thus it obtains a good trade-off on effectiveness and efficiency.\nRecently, Chen et al. [15] considered the effect of path number\nand path diversity while ranking the spreading ability of nodes in\nnetworks and introduced two correction factors correspondingly.\nThe ranking accuracy is considerably increased compared with\nsome well-known ranking methods, such as PageRank and\nLeaderRank.\nPLOS ONE | www.plosone.org 1 October 2013 | Volume 8 | Issue 10 | e77455", "Publication bias was assessed with funnel plots and Egger’s test.\nBoth random-effect and fixed-effect models were used to pool the\ndata, and the two models yielded mainly identical results in our\nanalysis. The results were presented from the random-effect\nmodel. All statistical analyses were performed using Stata software\n(Stata version 11, College Station, Texas).\nResults\nWe identified 769 full-text articles via database searches and 4\nabstracts via manual internet searches through September 30th,\n2012. Of these studies, 233 were from PubMed, 528 from\nEmbase.com, and 8 from Ovid platform. After auto screening was\nperformed using the Endnote program, 260 duplicate articles were\nremoved, and 509 full-text articles were identified by manual\nscreening. Of the 4 abstracts selected, 2 were excluded for lack of\nrelevant data, and the remaining 2 were specific for trials that were\nreported in full-text articles. To obtain as much accurate\ninformation as possible, we contacted five corresponding authors\nregarding the incomplete or vague data available in their\npublished works. Four of these authors kindly replied, but only\none provided additional information that we needed. Three full￾text articles were identified from the databases we listed above but\ndownloaded from Google Scholar. Ultimately, 18 published\nstudies [6,11–27] fulfilled our inclusion criteria. Figure 1 shows\nthe study flow regarding trial selection and reasons for exclusion.\nTrial characteristics\nA total 1836 patients between the ages of 18,93 years, with\nCKD at stage 3,5, GFR values ranging from 6,60 ml/min/\n1.73 m2 and no apparent need for dialysis or kidney transplan￾tation at baseline, were included. The treatment duration ranged\nfrom 1 to 24 months (median: 6 months). Six of these trials\nexplored the effect of vitamin D on proteinuria, twelve evaluated\nchanges in renal function, and fifteen discussed the incidence of\nhypercalcemia in treated subjects as compared to controls. Two\nother studies compared the effects of newer versus more\nestablished vitamin D compounds in non-dialysis patients\n(Table 2).\nStudy quality\nMost trials in our analysis were of moderate quality. Random\nsequence generation was clearly stated in 10 of 18 trials (56%).\nAllocation concealment was adequate in 5 of 18 trials (28%).\nBlinding of participants and personnel occurred in 12 of 18 trials\n(67%). Blinding of the outcome assessment was reported in 12 of\n18 trials (67%). By contrast, outcome data were provided\nincompletely in 4 of 18 trials (22%), and selective reporting was\nfound in 3 of 18 trials (17%). The likelihood of additional sources\nof bias was as high as 33% for 6 trials, and these related to\ndeclarations of interests or conflicts relating to the commercial\nsource of the funding.\nOutcome measurement\nProteinuria: Six RCTs (685 patients) compared the effects of\nvitamin D versus the use of placebo or no medication. Four of\nthese studies evaluated a newer vitamin D analogue, and the other\ntwo evaluated an established vitamin D compound. The pooled\ndata indicated that vitamin D reduced proteinuria in non-dialysis\npatients (RR, 2.00; 95%CI, 1.42 to 2.81). The RR associated with\nthe newer vitamin D sterol was 1.67 (95%CI, 1.22 to 2.29) and\nthat for the established compound was 2.76 (95%CI, 1.60 to 4.74)\n(Figure 2). The subgroup analysis showed no difference between\nthe newer vitamin D sterol and the established one (P = 0.14). We\nTable 2. Cont.\nStudy\nEnrolled\nCountry\nSample\nsize\nMean\nage\n(years) Basal disease Renal function\nIntervention\nMethods in\nstudy group ACEI/ARB usage Calcium usage\nStudy\nduration\n(months)\nOutcomes\nin these trials\nMoe 2011 [26] the USA 47 63.6 HBP, DM or other\ndisease\nCKD stage 3–4 Doxercalcigerol\n1 mg/d versus\ncholecalciferol\n2000 IU/d\nnot informed not informed 3 hypercalcemia\nproteinuria\nKovesdy 2012\n[27]\nthe USA 80 68.0 DM, HBP, ischemic,\nhereditary\nCKD stage 3–4 Paricalcitol 1\n,2 mg/d\nversus ergocalciferol\nnot informed totally 4 patients with\ncalcium", "evidence of statistical heterogeneity was found for this outcome\namong studies comparing rivaroxaban, dabigatran, or apixaban\nwith enoxaparin (fig 3).\nNo commercial reuse: See rights and reprints http://www.bmj.com/permissions Subscribe: http://www.bmj.com/subscribe\nBMJ 2012;344:e3675 doi: 10.1136/bmj.e3675 (Published 14 June 2012) Page 3 of 16\nRESEARCH\nProtected by copyright, including for uses related to text and data mining, AI training, and similar technologies. \n.Serials\nat New York University, Serials Bobst Library Technical Services on 3 November 2025 https://www.bmj.com/ Downloaded from 14 June 2012. 10.1136/bmj.e3675 on BMJ: first published as"], "response": "This article presents a systematic review and meta-analysis of randomized controlled trials (RCTs) investigating the effects of vitamin D supplementation on proteinuria, renal function, and hypercalcemia in chronic kidney disease (CKD) patients without dialysis or transplantation needs. The review identifies 18 eligible RCTs involving a total of 1836 patients with CKD at stages 3 or 5, and GFR values ranging from 6.60 ml/min/1.73 m². The analysis indicates that vitamin D reduces proteinuria in non-dialysis patients (RR, 2.00; 95%CI, 1.42 to 2.81), with no significant differences between newer and established vitamin D sterols (P = 0.14). The analysis also suggests that vitamin D may improve renal function (RR, 1.42; 95%CI, 1.10 to 1.82) and reduce the incidence of hypercalcemia (RR, 0.48; 95%CI, 0.30 to 0.73) in CKD patients. However, the review highlights the need for larger, well-designed RCTs to confirm these findings due to the low quality of evidence in most of the analyzed trials. Additionally, the review notes the potential for publication and reporting biases in some of the studies."}
{"user_input": "Which technologies show the strongest publication/citation increases in the last five years indicating emerging interests/trends/consensus (outside of the expected like AI or by center or region)?", "retrieved_contexts": ["NAR RA TIV E R EVI EW Open Access\nArtificial intelligence in medical imaging:\nthreat or opportunity? Radiologists again at\nthe forefront of innovation in medicine\nFilippo Pesapane1†\n, Marina Codari2*† and Francesco Sardanelli2,3\nAbstract\nOne of the most promising areas of health innovation is the application of artificial intelligence (AI), primarily in medical\nimaging. This article provides basic definitions of terms such as “machine/deep learning” and analyses the integration\nof AI into radiology. Publications on AI have drastically increased from about 100–150 per year in 2007–2008\nto 700–800 per year in 2016–2017. Magnetic resonance imaging and computed tomography collectively account for\nmore than 50% of current articles. Neuroradiology appears in about one-third of the papers, followed by musculoskeletal,\ncardiovascular, breast, urogenital, lung/thorax, and abdomen, each representing 6–9% of articles. With an irreversible\nincrease in the amount of data and the possibility to use AI to identify findings either detectable or not by the human\neye, radiology is now moving from a subjective perceptual skill to a more objective science. Radiologists, who were on\nthe forefront of the digital era in medicine, can guide the introduction of AI into healthcare. Yet, they will not be replaced\nbecause radiology includes communication of diagnosis, consideration of patient’s values and preferences, medical\njudgment, quality assurance, education, policy-making, and interventional procedures. The higher efficiency provided\nby AI will allow radiologists to perform more value-added tasks, becoming more visible to patients and playing a vital\nrole in multidisciplinary clinical teams.\nKeywords: Neural networks (computer), Artificial intelligence, Deep learning, Machine learning, Radiology\nKey points\n\u0001 Over 10 years, publications on AI in radiology have\nincreased from 100–150 per year to 700–800 per\nyear\n\u0001 Magnetic resonance imaging and computed\ntomography are the most involved techniques\n\u0001 Neuroradiology appears as the most involved\nsubspecialty (accounting for about one-third of the\npapers), followed by musculoskeletal, cardiovascular,\nbreast, urogenital, lung/thorax, and abdominal\nradiology (each representing 6–9% of articles)\n\u0001 Radiologists, the physicians who were on the\nforefront of the digital era in medicine, can now\nguide the introduction of AI in healthcare\nIntroduction\nOne of the most promising areas of health innovation is\nthe application of artificial intelligence (AI) in medical im￾aging, including, but not limited to, image processing and\ninterpretation [1]. Indeed, AI may find multiple applica￾tions, from image acquisition and processing to aided\nreporting, follow-up planning, data storage, data mining,\nand many others. Due to this wide range of applications, AI\nis expected to massively impact the radiologist’s daily life.\nThis article provides basic definitions of terms com￾monly used when discussing AI applications, analyses\nvarious aspects related to the integration of AI in the\nradiological workflow, and provides an overview of the\nbalance between AI threats and opportunities for radiol￾ogists. Awareness of this trend is a necessity, especially\nfor younger generations who will face this revolution.\nArtificial intelligence: definitions\nThe term AI is applied when a device mimics cognitive\nfunctions, such as learning and problem solving [2].\n* Correspondence: marina.codari@grupposandonato.it †\nFilippo Pesapane and Marina Codari contributed equally to this work.\n2\nUnit of Radiology, IRCCS Policlinico San Donato, Via Morandi 30, 20097 San\nDonato Milanese, Milan, Italy\nFull list of author information is available at the end of the article\nEuropean Radiology\nExperimental\n© The Author(s). 2018 Open Access This article is distributed under the terms of the Creative Commons Attribution 4.0\nInternational License (http://creativecommons.org/licenses/by/4.0/), which permits unrestricted use, distribution, and\nreproduction in any medium, provided you give appropriate credit to the original author(s) and the source, provide a link to\nthe Creative Commons license, and indicate if changes were made.\nPesapane et al. European Radiology Experimental (2018) 2:35 \nhttps://doi.org/10.1186/s41747-018-0061-6\n\nMore generally, AI refers to a field of computer science\ndedicated to the creation of systems performing tasks\nthat usually require human intelligence, branching off\ninto different techniques [3]. Machine learning (ML), a\nterm introduced by Arthur Samuel in 1959 to describe a\nsubfield of AI [4] that includes all those approaches that\nallow computers to learn from data without being expli￾citly programmed, has been extensively applied to med￾ical imaging [5]. Among the techniques that fall under\nthe ML umbrella, deep learning (DL) has emerged as\none of the most promising. Indeed, DL is a technique\nbelonging to ML, which in turn refers to a broader AI\nfamily (Fig. 1). In particular, DL methods belong to\nrepresentation-learning methods with multiple levels of\nrepresentation, which process raw data to perform clas￾sification or detection tasks [6].\nML incorporates computational models and algorithms\nthat imitate the architecture of the biological neural net￾works in the brain, i.e., artificial neural networks (ANNs)\n[7]. Neural network architecture is structured in layers\ncomposed of interconnected nodes. Each node of the net￾work performs a weighted sum of the input data that are\nsubsequently passed to an activation function. Weights\nare dynamically optimised during the training phase.\nThere are three different kinds of layers: the input layer,\nwhich receives input data; the output layer, which pro￾duces the results of data processing; and the hidden\nlayer(s), which extracts the patterns within the data. The\nDL approach was developed to improve on the perform￾ance of conventional ANN when using deep architectures.\nA deep ANN differs from the single hidden layer by hav￾ing a large number of hidden layers, which characterise\nthe depth of the network [8]. Among the different deep\nANNs, convolutional neural networks (CNNs) have\nbecome popular in computer vision applications. In this\nclass of deep ANNs, convolution operations are used to\nobtain feature maps in which the intensities of each pixel/\nvoxel are calculated as the sum of each pixel/voxel of the\noriginal image and its neighbours, weighted by convolu￾tion matrices (also called kernels). Different kernels are ap￾plied for specific tasks, such as blurring, sharpening, or\nedge detection. CNNs are biologically inspired networks\nmimicking the behaviour of the brain cortex, which con￾tains a complex structure of cells sensitive to small regions\nof the visual field [3]. The architecture of deep CNNs al￾lows for the composition of complex features (such as\nshapes) from simpler features (e.g. image intensities) to\ndecode image raw data without the need to detect specific\nfeatures [3] (Fig. 2).\nDespite their performance, ML network architecture\nmakes them more prone to fail in reaching the conver￾gence and overfit training dataset. On the other hand,\nthe complexity of deep network architectures makes\nthem demanding in terms of computational resources\nand dimension of the training sample.\nSuccess in DL application was possible mainly due to\nrecent advancements in the development of hardware\ntechnologies, like graphics processing units [5]. Indeed,\nthe high number of nodes needed to detect complex re￾lationships and patterns within data may result in bil￾lions of parameters that need to be optimised during the\ntraining phase. For this reason, DL networks require a\nhuge amount of training data, which in turn increase the\ncomputing power needed to analyse them. These are\nalso the reasons why DL algorithms are showing in￾creased performance and are, theoretically, not suscep￾tible to the performance plateau of the simpler ML\nnetworks (Fig. 3).\nFig. 1 Deep learning as a subset of machine learning methods, which represent a branch of the existing artificial intelligence techniques. Machine\nlearning techniques have been extensively applied since the 1980s. Deep learning has been applied since the 2010s due to the advancement of\ncomputational resources\nPesapane et al. European Radiology Experimental (2018) 2:35 Page 2 of 10\n\nRadiologists are already familiar with computer-aided\ndetection/diagnosis (CAD) systems, which were first in￾troduced in the 1960s in chest x-ray and mammography\napplications [5]. However, advances in algorithm devel￾opment, combined with the ease of access to computa￾tional resources, allows AI to be applied in radiological\ndecision-making at a higher functional level [7].\nThe wind of change\nThe great enthusiasm for and dynamism in the develop￾ment of AI systems in radiology is shown by the increase\nin publications on this topic (Figs. 4 and 5). Only 10\nyears ago, the total number of publications on AI in\nradiology only just exceeded 100 per year. Thereafter, we\nhad a tremendous increase, with over 700–800\npublications per year in 2016–17. In the last couple of\nyears, computed tomography (CT) and magnetic reson￾ance imaging (MRI) have collectively accounted for more\nthan 50% of articles, though radiography, mammography,\nand ultrasound are also represented (Table 1). Neuroradi￾ology (here evaluated as imaging of the central nervous\nsystem) is the most involved subspecialty (accounting for\nabout one-third of the papers), followed by musculoskel￾etal, cardiovascular, breast, urogenital, lung/thorax, and\nabdominal radiology, each representing between 6 and 9%\nof the total number of papers (Table 2). AI currently has\nan impact on the field of radiology, with MRI and neuro￾radiology as the major fields of innovation.\nRecent meetings have also proven the interest in AI\napplications. During the 2018 European Congress of\nRadiology and the 2017 Annual Meeting of the Radio￾logical Society of North America, AI represented the\nfocus of many talks. Studies showed the application of\nDL algorithms for assessing the risk of malignancy for a\nlung nodule, estimating skeletal maturity from paediatric\nhand radiographs, classifying liver masses, and even ob￾viating the need for thyroid and breast biopsies [9–11];\nat the same time, the vendors showed examples of AI\napplications in action [9, 10].\nAI in radiology: threat or opportunity?\nA motto of radiology residents is: “The more images you\nsee, the more examinations you report, the better you\nget”. The same principle works for ML, and in particular\nfor DL. In the past decades, medical imaging has evolved\nfrom projection images, such as radiographs or planar\nscintigrams, to tomographic (i.e. cross-sectional) images,\nsuch as ultrasound (US), CT, tomosynthesis, positron\nFig. 2 Comparison between classic machine learning and deep learning approaches applied to a classification task. Both depicted approaches\nuse an artificial neural network organised in different layers (IL input layer, HL hidden layer, OL output layer). The deep learning approach avoids\nthe design of dedicated feature extractors by using a deep neural network that represents complex features as a composition of simpler ones\nFig. 3 Graphical representation of the different relationship between\nthe amount of data given to traditional ML or DL systems and their\nperformance. Only DL systems continue to increase their performance\nPesapane et al. European Radiology Experimental (2018) 2:35 Page 3 of 10\n\nemission tomography, MRI, etc., becoming more\ncomplex and data rich. Even though this shift to\nthree-dimensional (3D) imaging began during the 1930s,\nit was not until the digital era that this approach allowed\nhigh anatomic detail to be obtained and functional infor￾mation to be captured.\nThe increasing amount of data to be processed can in￾fluence how radiologists interpret images: from inference\nto merely detection and description. When too much time\nis taken for image analysis, the time for evaluating clinical\nand laboratory contexts is squeezed [12]. The radiologist\nis reduced to being only an image analyst. The clinical in￾terpretation of the findings is left to other physicians. This\nis dangerous, not only for radiologists but also for patients:\nnon-radiologists can have a full understanding of the clin￾ical situation but do not have the radiological knowledge.\nIn other words, if radiologists do not have the time for\nclinical judgement, the final meaning of radiological exam￾inations will be left to non-experts in medical imaging.\nIn this scenario, AI is not a threat to radiology. It is in￾deed a tremendous opportunity for its improvement. In\nfact, similar to our natural intelligence, AI algorithms\nlook at medical images to identify patterns after being\ntrained using vast numbers of examinations and images.\nThose systems will be able to give information about the\ncharacterisation of abnormal findings, mostly in terms of\nconditional probabilities to be applied to Bayesian\ndecision-making [13, 14].\nFig. 4 Number of publications indexed on EMBASE obtained using the search query (‘artificial intelligence’/exp. OR ‘artificial intelligence’ OR\n‘machine learning’/exp. OR ‘machine learning’ OR ‘deep learning’/exp. OR ‘deep learning’) AND (‘radiology’/exp. OR ‘radiology’ OR ‘diagnostic\nimaging’/exp. OR ‘diagnostic imaging’) AND ([english]/lim). EMBASE was accessed on April 24, 2018. For each year the number of publications\nwas stratified for imaging modality. US ultrasound, MRI magnetic resonance imaging, CT computed tomography, PET positron emission tomography,\nSPECT single-photon emission tomography. Diagnostic modalities different from those listed above are grouped under the “other topic” label (e.g.\noptical coherence tomography, dual-energy x-ray absorptiometry, etc.)\nTable 1 Number of articles on AI in radiology indexed on\nEMBASE, stratified by imaging modality\nImaging modality 2015 2016 2017\nMagnetic resonance imaging 164 230 235\n38% 42% 37%\nComputed tomography 123 117 177\n29% 21% 28%\nUltrasound 27 32 33\n6% 6% 5%\nRadiography 14 14 26\n3% 3% 4%\nMammography and breast tomosynthesis 23 12 18\n5% 2% 3%\nPositron emission tomography and single-photon\nemission tomography\n175\n0% 1% 1%\nOther 79 139 134\n18% 25% 21%\nTotal 431 551 628\n100% 100% 100%\nSearch query: (‘artificial intelligence’/exp. OR ‘artificial intelligence’ OR ‘machine\nlearning’/exp. OR ‘machine learning’ OR ‘deep learning’/exp. OR ‘deep learning’)\nAND (‘radiology’/exp. OR ‘radiology’ OR ‘diagnostic imaging’/exp. OR ‘diagnostic\nimaging’) AND ([english]/lim). Values were obtained including only “article”,\n“article in press” and “conference paper” as publication type. EMBASE was\naccessed on April 24, 2018\nPesapane et al. European Radiology Experimental (2018) 2:35 Page 4 of 10\n\nThis is crucial because not all abnormalities are repre￾sentative of disease and must be actioned. AI systems\nlearn on a case-by-case basis. However, unlike CAD sys￾tems, which just highlight the presence or absence of\nimage features known to be associated with a disease state\n[15, 16], AI systems look at specific labelled structures and\nalso learn how to extract image features either visible or\ninvisible to the human eye. This approach mimics human\nanalytical cognition, allowing for better performance than\nthat obtained with old CAD software [17].\nWith the irreversible increase in imaging data and the\npossibility to identify findings that humans can or can￾not detect [18], radiology is now moving from a subject￾ive perceptual skill to a more objective science [12]. In\nfact, the radiologist’s work is currently limited by sub￾jectivity, i.e. variations across interpreters, and the\nadverse effect of fatigue. The attention to inter- and\nintra-reader variability [19] and the work committed to\nimprove the repeatability and reproducibility of medical\nimaging over the past decades proves the need for repro￾ducible radiological results. In a broader perspective, the\ntrend toward data sharing also works in this case [20].\nThe key point is that AI has the potential to replace\nmany of the routine detection, characterisation and\nquantification tasks currently performed by radiologists\nusing cognitive ability, as well as to accomplish the inte￾gration of data mining of electronic medical records in\nthe process [1, 7, 21].\nMoreover, the recently developed DL networks have led\nto more robust models for radiomics, which is an emerging\nfield that deals with the high-throughput extraction of\nquantitative peculiar features from radiological images\n[22–26]. Indeed, data derived from radiomics investigation,\nsuch as intensity, shape, texture, wavelength, etc., can be\nextracted from medical images [23, 27–31] and extracted\nby or integrated in ML approaches, providing valuable\ninformation for the prediction of treatment response, differ￾entiating benign and malignant tumours, and assessing\ncancer genetics in many cancer types [23, 32–34]. Because\nof the rapid growth of this area, numerous published radio￾mics investigations lack standardised evaluation of both the\nscientific integrity and the clinical relevance [22]. However,\ndespite the ongoing need for independent validation data￾sets to confirm the diagnostic and prognostic value of\nradiomics features, radiomics has shown several promising\napplications for personalised therapy [22, 23], not only in\noncology but also in other fields, as shown by recent\noriginal articles that have proved the value of radiomics in\nthe cardiovascular CT domain [35, 36].\nFinally, AI applications may enhance the reproducibil￾ity of technical protocols, improving image quality and\ndecreasing radiation dose, decreasing MRI scanner time\n[39] and optimising staffing and CT/MRI scanner util￾isation, thereby reducing costs [1]. These applications\nwill simplify and accelerate technicians’ work, also\nresulting in an average higher technical quality of exami￾nations. This may counteract one of the current limita￾tions of AI systems, i.e. the low ability to recognise the\neffects of positioning, motion artefacts, etc., also due to\nthe lack of standardised acquisition protocols [15, 33,\n34]. In other words, AI needs high-quality studies, but\nits application will lead towards better quality. The holy\ngrail of standardisation in radiology may become attain￾able, also increasing productivity.\nThe quicker and standardised detection of image\nfindings has the potential to shorten reporting time\nand to create automated sections of reports [2]. Struc￾tured AI-aided reporting represents a domain where\nAI may have a great impact, helping radiologists use\nrelevant data for diagnosis and presenting it in a con￾cise format [40].\nRecently, the radiological community has discussed\nhow such changes will alter the professional status of ra￾diologists. Negative feelings were expressed, reflecting\nthe opinions of those who are thinking that medicine\nwill not need radiologists at all [21, 41, 42]. Should we\nconsider closing postgraduate schools of radiology, as\nsomeone suggested [12, 21]? No. Healthcare systems\nTable 2 Number of articles indexed on EMBASE stratified by\nradiology subspecialty/body part\nBody parts 2015 2016 2017\nCentral nervous system 163 235 211\n38% 43% 34%\nBone, spine and joints 29 37 54\n7% 7% 9%\nCardiovascular 24 32 49\n6% 6% 8%\nBreast 41 39 50\n10% 7% 8%\nUrogenital 40 25 52\n9% 5% 8%\nThorax and lungs 36 21 46\n8% 4% 7%\nAbdomen 28 27 36\n6% 5% 6%\nOther 70 135 130\n16% 25% 21%\nTotal 431 551 628\n100% 100% 100%\nSearch query: (‘artificial intelligence’/exp. OR ‘artificial intelligence’ OR ‘machine\nlearning’/exp. OR ‘machine learning’ OR ‘deep learning’/exp. OR ‘deep learning’)\nAND (‘radiology’/exp. OR ‘radiology’ OR ‘diagnostic imaging’/exp. OR ‘diagnostic\nimaging’) AND ([english]/lim) stratified by radiology subspeciality/body parts.\nValues were obtained including only “article”, “article in press” and “conference\npaper” as publication type. EMBASE was accessed on April 24, 2018\nPesapane et al. European Radiology Experimental (2018) 2:35 Page 5 of 10\n\nwould not be able to work without radiologists, particu￾larly in the AI era. This answer is not based on a prejudi￾cial defence of radiology as a discipline and profession.\nTwo main ideas should guide this prediction: first, “The\nbest qualification of a prophet is to have a good memory”\n(attributed to Marquis of Halifax) [43]; and second, “One\nway to predict the future is to create it” (attributed to\nAbraham Lincoln) [44].\nRadiologists were on the forefront of the digital era in\nmedicine. They guided the process, being the first med￾ical professionals to adopt computer science, and are\nnow probably the most digitally informed healthcare\nprofessionals [45]. Although the introduction of new\ntechnologies was mostly perceived as new approaches\nfor producing images, innovation also deeply changed\nthe ways to treat, present and store images. Indeed, the\nrole of radiologists was strengthened by the introduction\nof new technologies. Why should it be different now?\nThe lesson of the past is that apparently disrupting tech￾nologies (e.g. non-x-ray-based modalities, such as ultra￾sound and MRI) that seemed to go beyond radiology\nwere embraced by radiologists. Radiology extended its\nmeaning to radiation-free imaging modalities, now\nencompassing almost all diagnostic medical imaging, as\ndemonstrated by the presence of the word “radiology” in\nnumerous journals titles. This historical effect resulted\nfrom the capacity of radiologists to embrace these\nradiation-free modalities. In addition, electronic systems\nfor reporting examination and archiving images were\nprimarily modelled to serve radiologists.\nThe reasonable doubt is that we are now facing\nmethods that not only cover the production of medical\nimages but also involve detection and characterisation,\nproperly entering the diagnostic process. Indeed, this\nis a new challenge, but also an additional value of AI.\nThe professional role and satisfaction of radiologists\nwill be enhanced by AI if they, as in the past, embrace\nthis technology and educate new generations to use it\nto save time spent on routine and monotonous tasks,\nwith strong encouragement to dedicate the saved time\nto functions that add value and influence patient care.\nThis could also help radiologists feel less worried\nabout the high number of examinations to be reported\nand rather focus on communication with patients and\ninteraction with colleagues in multidisciplinary teams\n[46]. This is the way for radiologists to build their\nbright future.\nWe are at the beginning of the AI era. Until now, the\nclinical application of ML on medical imaging in terms of\ndetection and characterisation have produced results lim￾ited to specific tasks, such as differentiation of normal\nfrom abnormal chest radiographs [41, 42, 47] or mammo￾grams [48, 49]. The application of AI to advanced imaging\nmodalities, such as CT and MRI, is now in its first phase.\nExamples of promising results are the differentiation of\nmalignant from benign chest nodules on CT scans [50],\nFig. 5 Number of publications indexed on EMBASE obtained using the search query (‘artificial intelligence’/exp. OR ‘artificial intelligence’ OR\n‘machine learning’/exp. OR ‘machine learning’ OR ‘deep learning’/exp. OR ‘deep learning’) AND (‘radiology’ OR ‘diagnostic imaging’). EMBASE was\naccessed on April 24, 2018. For each year, the number of publications was subdivided separating opinion articles, reviews and conference\nabstracts from original articles in seven main subgroups considering subspecialty or body part. Other fields of medical imaging different\nfrom those listed above are grouped under the “other topics” label (e.g. dermatology, ophthalmology, head and neck, etc.)\nPesapane et al. European Radiology Experimental (2018) 2:35 Page 6 of 10\n\nthe diagnosis of neurologic and psychiatric diseases [51,\n52], and the identification of biomarkers in glioblastoma\n[53]. Interestingly, MRI has been shown to predict survival\nin women with cervical cancer [54, 55] and in patients\nwith amyotrophic lateral sclerosis [56].\nHowever, AI could already be used to accomplish tasks\nwith a positive, immediate impact, several of them\nalready described by Nance et al. in 2013 [57]:\n1. Prioritisation of reporting: automatic selection of\nfindings deserving faster action.\n2. Comparison of current and previous examinations,\nespecially in oncologic follow-up: tens of minutes are\nneeded for this currently; AI could do this for us;\nwe will supervise the process, extracting data to be\nintegrated into the report and drawing conclusions\nconsidering the clinical context and therapy regimens;\nAI could also take into account the time interval\nbetween examinations\n3. Quick identification of negative studies: at least in\nthis first phase, AI will favour sensitivity and\nnegative predictive value over specificity and\npositive predictive value, finding the normal studies\nand leaving abnormal ones for radiologists [36].\nThis would be particularly useful in high-volume\nscreening settings; this concept of quick negative\nshould also represent a helpful tool for screening\nprogrammes in underserved countries [10, 37].\n4. Aggregation of electronic medical records, allowing\nradiologists to access clinical information to adapt\nprotocols or interpret exams in the full clinical\ncontext.\n5. Automatic recall and rescheduling of patients: for\nfindings deserving of an imaging follow-up.\n6. Immediate use of clinical decision support systems\nfor ordering, interpreting, and defining further\npatient management.\n7. Internal peer-review of reports.\n8. Tracking of residents’ training.\n9. Quality control of technologists’ performance and\ntracked communication between radiologists and\ntechnologists.\n10. Data mining regarding relevant issues, including\nradiation dose [38].\nIn the mid-term perspective, other possibilities are\nopen, such as:\n1. Anticipation of the diagnosis of cancerous lesions in\noncologic patients using texture analysis and other\nadvanced approaches [58].\n2. Prediction of treatment response to therapies for\ntumours, such as intra-arterial treatment for\nhepatocellular carcinoma [59].\n3. Evaluation of the biological relevance of borderline\ncases, such as B3-lesions diagnosed at pathology of\nneedle biopsy of breast imaging findings [60].\n4. Estimation of functional parameters, such as the\nfractional flow reserve from CT coronary\nangiography using deep learning [61].\n5. Detection of perfusion defects and ischaemia, for\nexample in the case of myocardial stress perfusion\ndefects and induced ischaemia [62].\n6. Segmentation and shape modelling, such as brain\ntumour segmentation [63] or, more generally, brain\nstructure segmentation [64].\n7. Reducing diffusion MRI data processing to a single\noptimised step, for example making microstructure\nprediction on a voxel-by-voxel basis as well as\nautomated model-free segmentation from MRI\nvalues [39].\nThe radiologists’ role and cooperation with\ncomputer scientists\nThe key point is the separation of diagnosis and predic￾tion from action and recommendation. Radiologists will\nnot be replaced by machines because radiology practice\nis much more than the simple interpretation of images.\nThe radiologist’s duties also include communication of\ndiagnosis, consideration of patients’ values and prefer￾ences, medical judgment, quality assurance, education,\npolicy-making, interventional procedures, and many\nother tasks that, so far, cannot be performed by com￾puter programmes alone [2].\nNotably, it must be understood that the clinical role of\nradiologists cannot be “saved” only by performing inter￾ventional procedures. Even though interventional radi￾ology is a fundamental asset to improve the clinical profile\nof radiology [45, 65–67], radiologists must act more as cli￾nicians, applying their clinical knowledge in answering\ndiagnostic questions and guiding decision-making, which\nrepresent their main tasks. Radiologists should keep their\nhuman control in the loop, considering clinical, personal\nand societal contexts in ways that AI alone is not able to\ndo. So far, AI is neither astute nor empathic. Thus, physi￾cians (i.e., we say here radiologists) remain essential for\nmedical practice, because ingenuity in medicine requires\nunique human characteristics [40, 68]. If the time needed\nfor image interpretation were shortened, radiologists\nwould be able to focus on inference to improve patient\ncare. If AI is based on a huge increase in information, the\nhallmark of intelligence is in reducing information to what\nis relevant [69].\nHowever, it is impossible to exclude that the efficiency\ngain provided by AI may lead to a need for fewer radiolo￾gists. Of note, in the United States the competition for\nresidency positions in radiology has decreased over time\n[70], potentially allowing for a better match between\nPesapane et al. European Radiology Experimental (2018) 2:35 Page 7 of 10\n\nsupply and demand for residency positions. However, also\nthe opposite hypothesis cannot be excluded: AI-enhanced\nradiology may require more professionals in the field, in￾cluding radiologists. In general, the history of automation\nshows that jobs are not lost. Rather, roles are reshaped;\nhumans are displaced to tasks needing a human element\n[12]. The gain in efficiency provided by AI will allow radi￾ologists to perform more value-added tasks, such as inte￾grating patients’ clinical and imaging information, having\nmore professional interactions, becoming more visible to\npatients and playing a vital role in integrated clinical teams\n[46]. In this way, AI will not replace radiologists; yet, those\nradiologists who take advantage of the potential of AI will\nreplace the ones who refuse this crucial challenge.\nFinally, we should remember that AI mimics human\nintelligence. Radiologists are key people for several\ncurrent AI challenges, such as the creation of\nhigh-quality training datasets, definition of the clinical\ntask to address, and interpretation of obtained results.\nMany labelled studies and findings provided by experi￾enced radiologists are needed; those datasets are diffi￾cult to find and are time-consuming, implying high\ncosts [3]. However, even if crucial, the radiologist’s role\nshould not be confined to data labelling. Radiologists\nmay play a pivotal role in the identification of clinical\napplications where AI methods may make the difference.\nIndeed, they represent the final user of these technologies,\nwho knows where they can be applied to improve patient\ncare. For this reason, their point of view is crucial to opti￾mise the use of AI-based solutions in the clinical setting.\nFinally, the application of AI-based algorithms often leads\nto the creation of complex data that need to be inter￾preted and linked to their clinical utility. In this scenario,\nradiologists may play a crucial role in data interpretation,\ncooperating with data scientists in the definition of useful\nresults.\nRadiologists should negotiate the supply of these valu￾able datasets and clinical knowledge with a guiding role in\nthe clinical application of AI programmes. This implies an\nincreasing partnership with bioengineers and computer\nscientists. Working with them in research and develop￾ment of AI applications in radiology is a strategic issue\n[45]. These professionals should be embedded in radio￾logical departments, becoming everyday partners. Creating\nthis kind of “multidisciplinary AI team” will help to ensure\npatient safety standards are met and creates judicial trans￾parency, which allows legal liability to be assigned to the\nradiologist component human authority [71].\nAnother topical issue that needs to be faced are the\nlegal implications of AI systems in healthcare. As soon\nas AI systems start making autonomous decisions about\ndiagnoses and prognosis, and stop being only a support\ntool, a problem arises as to whether, when something\n‘goes wrong’ following a clinical decision made by an AI\napplication, the reader (namely, the radiologist) or the\ndevice itself or its designer/builder is to be considered at\nfault [72]. In our opinion, ethical and legal responsibility\nfor decision making in healthcare will remain a matter\nof the natural intelligence of physicians. From this view￾point, it is probable that the multidisciplinary AI team\nwill take responsibility in difficult cases, considering\nrelevant, but not always conclusive, what AI provided. It\nhas been already demonstrated that groups of human\nand AI agents working together make more accurate\npredictions compared to humans or AI alone, promising\nto achieve higher levels of accuracy in imaging diagnosis\nand even prognosis [71].\nAlthough the techniques of AI differ from diagnosis to\nprognosis, both applications still need validation, and\nthis is challenging due to the large amount of data\nneeded to achieve robust results [73]. Therefore, rigor￾ous evaluation criteria and reporting guidelines for AI\nneed to be developed in order to establish its role in\nradiology and, more generally, in medicine [22].\nConclusions\nAI will surely impact radiology, and more quickly than\nother medical fields. It will change radiology practice\nmore than anything since Roentgen. Radiologists can\nplay a leading role in this oncoming change [74].\nAn uneasiness among radiologists to embrace AI may\nbe compared with the reluctance among pilots to em￾brace autopilot technology in the early days of auto￾mated aircraft aviation. However, radiologists are used to\nfacing technological challenges because, since the begin￾nings of its history, radiology has been the playfield of\ntechnological development.\nAn updated radiologist should be aware of the basic\nprinciples of ML/DL systems, of the characteristic of\ndatasets to train them, and their limitations. Radiologists\ndo not need to know the deepest details of these sys￾tems, but they must learn the technical vocabulary used\nby data scientists to efficiently communicate with them.\nThe time to work for and with AI in radiology is now.\nAbbreviations\n3D: Three-dimensional; AI: Artificial intelligence; ANN: Artificial neural\nnetwork; CAD: Computer-aided detection/diagnosis; CNN: Convolutional\nneural network; CT: Computed tomography; DL: Deep learning; ML: Machine\nlearning; MRI: Magnetic resonance imaging\nAvailability of data and materials\nThe data that support the findings of this study are available from the\ncorresponding author, MC, upon reasonable request.\nFunding\nThis study was supported by Ricerca Corrente funding from Italian Ministry\nof Health to IRCCS Policlinico San Donato.\nPesapane et al. European Radiology Experimental (2018) 2:35 Page 8 of 10\n\nAuthors’ contributions\nFP, MC and FS contributed to the design and implementation of the\nresearch, to the analysis of the results and to the writing of the manuscript.\nAll authors read and approved the final manuscript.\nEthics approval and consent to participate\nConsent was not applicable due to the design of the study, which is a\nnarrative review.\nConsent for publication\nNot applicable\nCompeting interests\nThe authors declare that they have no competing interests.\nPublisher’s Note\nSpringer Nature remains neutral with regard to jurisdictional claims in\npublished maps and institutional affiliations.\nAuthor details\n1\nPostgraduate School in Radiodiagnostics, Università degli Studi di Milano,\nVia Festa del Perdono 7, 20122 Milan, Italy. 2\nUnit of Radiology, IRCCS\nPoliclinico San Donato, Via Morandi 30, 20097 San Donato Milanese, Milan,\nItaly. 3\nDepartment of Biomedical Sciences for Health, Università degli Studi di\nMilano, Via Morandi 30, 20097 San Donato Milanese, Milan, Italy.\nReceived: 7 May 2018 Accepted: 31 July 2018\nReferences\n1. Lakhani P, Prater AB, Hutson RK et al (2018) Machine learning in radiology:\napplications beyond image interpretation. J Am Coll Radiol 15:350–359\n2. Russell S, Bohannon J (2015) Artificial intelligence. Fears of an AI pioneer.\nScience 349:252\n3. Chartrand G, Cheng PM, Vorontsov E et al (2017) Deep learning: a primer\nfor radiologists. Radiographics 37:2113–2131\n4. Samuel AL (1959) Some studies in machine learning using the game of\ncheckers. IBM J Res Dev 3:210–229\n5. Lee JG, Jun S, Cho YW et al (2017) Deep learning in medical imaging:\ngeneral overview. Korean J Radiol 18:570–584\n6. LeCun Y, Bengio Y, Hinton G (2015) Deep learning. Nature 521:436–444\n7. King BF Jr (2017) Guest editorial: discovery and artificial intelligence. AJR Am\nJ Roentgenol 209:1189–1190\n8. Erickson BJ, Korfiatis P, Akkus Z, Kline TL (2017) Machine learning for\nmedical imaging. Radiographics 37:505–515\n9. Casey B, Yee KM, Ridley EL, Forrest W, Kim A (2017) Top 5 trends from RSNA\n2017 in Chicago. Available via https://www.auntminnie.com/index.\naspx?sec=rca&sub=rsna_2017&pag=dis&ItemID=119393. Accessed 24 Apr\n2018.\n10. Ward P, Ridley E, Forrest W, Moan R (2018) Top 5 trends from ECR 2018 in\nVienna. Available via https://www.auntminnie.com/index.aspx?sec=rca&sub=\necr_2018&pag=dis&ItemID=120195. Accessed 24 Apr 2018.\n11. Patuzzi J (2017) Big data, AI look set to come under scrutiny at ECR 2018.\nAvailable via https://www.auntminnieeurope.com/index.aspx?sec=rca&sub=\necr_2018&pag=dis&ItemID=614795. Accessed 24 Apr 2018.\n12. Jha S, Topol EJ (2016) Adapting to artificial intelligence: radiologists and\npathologists as information specialists. JAMA 316:2353–2354\n13. Sardanelli F, Hunink MG, Gilbert FJ, Di Leo G, Krestin GP (2010) Evidence￾based radiology: why and how? Eur Radiol 20:1–15\n14. Dodd JD (2007) Evidence-based practice in radiology: steps 3 and 4--\nappraise and apply diagnostic radiology literature. Radiology 242:342–354\n15. Azavedo E, Zackrisson S, Mejàre I, Heibert Arnlind M (2012) Is single reading\nwith computer-aided detection (CAD) as good as double reading in\nmammography screening? A systematic review. BMC Med Imaging 12:22\n16. Dheeba J, Albert Singh N, Tamil Selvi S (2014) Computer-aided detection of\nbreast cancer on mammograms: a swarm intelligence optimized wavelet\nneural network approach. J Biomed Inform 49:45–52\n17. Kohli M, Prevedello LM, Filice RW, Geis JR (2017) Implementing machine\nlearning in radiology practice and research. AJR Am J Roentgenol 208:\n754–760\n18. Gillies RJ, Kinahan PE, Hricak H (2016) Radiomics: images are more than\npictures, they are data. Radiology 278:563–577\n19. Sardanelli F, Di Leo G (2009) Reproducibility: Intraobserver and Interobserver\nvariability. In: Springer (ed) Biostatistics for radiologists - planning,\nperforming, and writing a radiologic study, pp 125–140\n20. Sardanelli F, Ali M, Hunink MG, Houssami N, Sconfienza LM, Di Leo G (2018)\nTo share or not to share? Expected pros and cons of data sharing in\nradiological research. Eur Radiol 28:2328–2335\n21. Krittanawong C (2018) The rise of artificial intelligence and the uncertain\nfuture for physicians. Eur J Intern Med 48:e13–e14\n22. Lambin P, Leijenaar RTH, Deist TM et al (2017) Radiomics: the bridge\nbetween medical imaging and personalized medicine. Nat Rev Clin Oncol\n14:749–762\n23. Yip SSF, Parmar C, Kim J, Huynh E, Mak RH, Aerts H (2017) Impact of\nexperimental design on PET radiomics in predicting somatic mutation\nstatus. Eur J Radiol 97:8–15\n24. Parekh VS, Jacobs MA (2017) Integrated radiomic framework for breast\ncancer and tumor biology using advanced machine learning and\nmultiparametric MRI. NPJ Breast Cancer 3:43\n25. Sutton EJ, Huang EP, Drukker K et al (2017) Breast MRI radiomics:\ncomparison of computer- and human-extracted imaging phenotypes. Eur\nRadiol Exp 1:22\n26. Becker AS, Schneider MA, Wurnig MC, Wagner M, Clavien PA, Boss A (2018)\nRadiomics of liver MRI predict metastases in mice. Eur Radiol Exp 2:11\n27. Davnall F, Yip CS, Ljungqvist G et al (2012) Assessment of tumor\nheterogeneity: an emerging imaging tool for clinical practice? Insights\nImaging 3:573–589\n28. Aerts HJ, Velazquez ER, Leijenaar RT et al (2014) Decoding tumour\nphenotype by noninvasive imaging using a quantitative radiomics\napproach. Nat Commun 5:4006\n29. Rahmim A, Salimpour Y, Jain S et al (2016) Application of texture analysis to\nDAT SPECT imaging: relationship to clinical assessments. Neuroimage Clin\n12:e1–e9\n30. Pesapane F, Patella F, Fumarola EM et al (2017) Intravoxel incoherent\nmotion (IVIM) diffusion weighted imaging (DWI) in the Periferic prostate\ncancer detection and stratification. Med Oncol 34:35\n31. Fusco R, Di Marzo M, Sansone C, Sansone M, Petrillo A (2017) Breast DCE￾MRI: lesion classification using dynamic and morphological features by\nmeans of a multiple classifier system. Eur Radiol Exp 1:10\n32. Patella F, Franceschelli G, Petrillo M et al (2018) A multiparametric analysis\ncombining DCE-MRI- and IVIM -derived parameters to improve\ndifferentiation of parotid tumors: a pilot study. Future Oncol. https://doi.org/\n10.2217/fon-2017-0655\n33. King AD, Chow KK, Yu KH et al (2013) Head and neck squamous cell\ncarcinoma: diagnostic performance of diffusion-weighted MR imaging for\nthe prediction of treatment response. Radiology 266:531–538\n34. Peng SL, Chen CF, Liu HL et al (2013) Analysis of parametric histogram from\ndynamic contrast-enhanced MRI: application in evaluating brain tumor\nresponse to radiotherapy. NMR Biomed 26:443–450\n35. Dey D, Commandeur F (2017) Radiomics to identify high-risk atherosclerotic\nplaque from computed tomography: the power of quantification. Circ\nCardiovasc Imaging. 10:e007254\n36. Kolossváry M, Kellermayer M, Merkely B, Maurovich-Horvat P (2018) Cardiac\ncomputed tomography radiomics: a comprehensive review on Radiomic\ntechniques. J Thorac Imaging 33:26–34\n37. Sachs PB, Gassert G, Cain M, Rubinstein D, Davey M, Decoteau D (2013)\nImaging study protocol selection in the electronic medical record. J Am\nColl Radiol 10:220–222\n38. Chen H, Zhang Y, Zhang W et al (2017) Low-dose CT via convolutional\nneural network. Biomed Opt Express 8:679–694\n39. Golkov V, Dosovitskiy A, Sperl JI et al (2016) Q-space deep learning: twelve￾fold shorter and model-free diffusion MRI scans. IEEE Trans Med Imaging 35:\n1344–1351\n40. Verghese A, Shah NH, Harrington RA (2018) What this computer needs is a\nphysician: humanism and artificial intelligence. JAMA 319:19–20\n41. Chockley K, Emanuel E (2016) The end of radiology? Three threats to the\nfuture practice of radiology. J Am Coll Radiol 13:1415–1420\n42. Obermeyer Z, Emanuel EJ (2016) Predicting the future - big data, machine\nlearning, and clinical medicine. N Engl J Med 375:1216–1219\n43. Marquis of Halifax. Available via http://www.met.reading.ac.uk/Research/cag￾old/forecasting/quotes.html. Accessed 24 Apr 2018.\nPesapane et al. European Radiology Experimental (2018) 2:35 Page 9 of 10\n\n44. Abraham Lincoln. Available via https://www.goodreads.com/quotes/328848-\nthe-best-way-to-predict-your-future-is-to-create\n45. Sardanelli F (2017) Trends in radiology and experimental research. Eur\nRadiol Exp 1:1\n46. Recht M, Bryan RN (2017) Artificial intelligence: threat or boon to\nradiologists? J Am Coll Radiol 14:1476–1480\n47. Becker AS, Blüthgen C, Phi van VD et al (2018) Detection of tuberculosis\npatterns in digital photographs of chest x-ray images using deep learning:\nfeasibility study. Int J Tuberc Lung Dis 22:328–335\n48. Becker AS, Mueller M, Stoffel E, Marcon M, Ghafoor S, Boss A (2018)\nClassification of breast cancer in ultrasound imaging using a generic deep\nlearning analysis software: a pilot study. Br J Radiol 91:20170576\n49. Becker AS, Marcon M, Ghafoor S, Wurnig MC, Frauenfelder T, Boss A (2017)\nDeep learning in mammography: diagnostic accuracy of a multipurpose\nimage analysis software in the detection of breast cancer. Investig Radiol 52:\n434–440\n50. Cheng JZ, Ni D, Chou YH et al (2016) Computer-aided diagnosis with deep\nlearning architecture: applications to breast lesions in US images and\npulmonary nodules in CT scans. Sci Rep 6:24454\n51. Lu X, Yang Y, Wu F et al (2016) Discriminative analysis of schizophrenia\nusing support vector machine and recursive feature elimination on\nstructural MRI images. Medicine (Baltimore) 95:e3973\n52. Li R, Zhang W, Suk HI et al (2014) Deep learning based imaging data\ncompletion for improved brain disease diagnosis. Med Image Comput\nComput Assist Interv 17:305–312\n53. Korfiatis P, Kline TL, Coufalova L et al (2016) MRI texture features as\nbiomarkers to predict MGMT methylation status in glioblastomas. Med Phys\n43:2835–2844\n54. Matsuo K, Purushotham S, Moeini A et al (2017) A pilot study in using deep\nlearning to predict limited life expectancy in women with recurrent cervical\ncancer. Am J Obstet Gynecol 217:703–705\n55. Obrzut B, Kusy M, Semczuk A, Obrzut M, Kluska J (2017) Prediction of 5-year\noverall survival in cervical cancer patients treated with radical hysterectomy\nusing computational intelligence methods. BMC Cancer 17:840\n56. van der Burgh HK, Schmidt R, Westeneng HJ, de Reus MA, van den Berg LH,\nvan den Heuvel MP (2017) Deep learning predictions of survival based on\nMRI in amyotrophic lateral sclerosis. Neuroimage Clin 13:361–369\n57. Nance JW Jr, Meenan C, Nagy PG (2013) The future of the radiology\ninformation system. AJR Am J Roentgenol 200:1064–1070\n58. Chaudhary K, Poirion OB, Lu L, Garmire LX (2018) Deep learning-based\nmulti-omics integration robustly predicts survival in liver cancer. Clin Cancer\nRes 24:1248–1259\n59. Abajian A, Murali N, Savic LJ et al (2018) Predicting treatment response to\nintra-arterial therapies for hepatocellular carcinoma with the use of\nsupervised machine learning-an artificial intelligence concept. J Vasc Interv\nRadiol 29:850–857\n60. El-Sayed ME, Rakha EA, Reed J, Lee AH, Evans AJ, Ellis IO (2008) Predictive\nvalue of needle core biopsy diagnoses of lesions of uncertain malignant\npotential (B3) in abnormalities detected by mammographic screening.\nHistopathology 53:650–657\n61. Itu L, Rapaka S, Passerini T et al (2016) A machine-learning approach for\ncomputation of fractional flow reserve from coronary computed\ntomography. J Appl Physiol (1985) 121:42–52\n62. Nakajima K, Okuda K, Watanabe S et al (2018) Artificial neural network\nretrained to detect myocardial ischemia using a Japanese multicenter\ndatabase. Ann Nucl Med 32:303–310\n63. Pereira S, Pinto A, Alves V, Silva CA (2016) Brain tumor segmentation using\nconvolutional neural networks in MRI images. IEEE Trans Med Imaging 35:\n1240–1251\n64. Moeskops P, Viergever MA, Mendrik AM, de Vries LS, Benders MJ, Isgum I\n(2016) Automatic segmentation of MR brain images with a convolutional\nneural network. IEEE Trans Med Imaging 35:1252–1261\n65. Makris GC, Uberoi R (2016) Interventional radiology-the future: evolution or\nextinction? Cardiovasc Intervent Radiol 39:1789–1790\n66. Kwan SW, Talenfeld AD, Brunner MC (2016) The top three health care\ndevelopments impacting the practice of interventional radiology in the\nnext decade. AJR Am J Roentgenol 19:1–6\n67. Kwan SW, Fidelman N, Ma E, Kerlan RK Jr, Yao FY (2012) Imaging predictors\nof the response to transarterial chemoembolization in patients with\nhepatocellular carcinoma: a radiological-pathological correlation. Liver\nTranspl 18:727–736\n68. Miller DD, Brown EW (2018) Artificial intelligence in medical practice: the\nquestion to the answer? Am J Med 131:129–133\n69. Jha S (2016) Will computers replace radiologists? Available via https://www.\nmedscape.com/viewarticle/863127#. Accessed 24 Apr 2018.\n70. Francavilla ML, Arleo EK, Bluth EI, Straus CM, Reddy S, Recht MP (2016)\nSurveying academic radiology department chairs regarding new and\neffective strategies for medical student recruitment. AJR Am J Roentgenol\n207:1171–1175\n71. Liew C (2018) The future of radiology augmented with artificial intelligence:\na strategy for success. Eur J Radiol 102:152–156\n72. Pesapane F, Volonté C, Codari M, Sardanelli F (2018) Artificial intelligence as a\nmedical device in radiology: ethical and regulatory issues in Europe and the\nUnited States. Insights Imaging https://doi.org/10.1007/s13244-018-0645-y\n73. Lisboa PJ, Taktak AF (2006) The use of artificial neural networks in decision\nsupport in cancer: a systematic review. Neural Netw 19:408–415\n74. Ravi D, Wong C, Deligianni F et al (2017) Deep learning for health\ninformatics. IEEE J Biomed Health Inform 21:4–21\nPesapane et al. European Radiology Experimental (2018) 2:35 Page 10 of 10\n\n"], "response": "The article discusses the rapid growth of publications on artificial intelligence (AI) in radiology in recent years, with over 700-800 articles published annually compared to just over 100 a decade ago. The majority of these studies involve magnetic resonance imaging (MRI) and neuroradiology, making up around two-thirds of the total number of publications. While some experts believe that AI poses a threat to radiologists, the authors argue that it presents a significant opportunity for improvement instead. They highlight that AI algorithms analyze medical images similarly to humans, identifying patterns and providing information about the likelihood of certain conditions. However, there is still a long way to go before AI replaces radiologists entirely, as they bring unique skills beyond image analysis, such as clinical judgment and communication with other healthcare professionals. Therefore, AI should be seen as a tool to enhance rather than replace radiologists. The authors suggest that further research is required to address the challenges associated with implementing AI in radiology, particularly regarding data privacy and security concerns. Overall, the authors conclude that AI has the potential to significantly benefit radiology, improving efficiency, reducing errors, and enabling earlier intervention, ultimately leading to better patient outcomes."}
{"user_input": "Which technologies show the strongest publication/citation increases in the last five years indicating emerging interests/trends/consensus (outside of the expected like AI or by center or region)?", "retrieved_contexts": ["BioMed Central\nPage 1 of 10\n(page number not for citation purposes)\nBMC Medical Research \nMethodology\nResearch article Open Access\nAn exploration of the use of simple statistics to measure consensus \nand stability in Delphi studies\nElizabeth A Holey1, Jennifer L Feeley*2, John Dixon1 and Vicki J Whittaker1\nAddress: 1School of Health and Social Care, University of Teesside, Middlesbrough, TS1 3BA, UK and 2Department of Physiotherapy, Kings Mill \nHospital, Mansfield Road, Sutton-In-Ashfield, Nottinghamshire, NG17 4JT, UK\nEmail: Elizabeth A Holey - Liz.Holey@tees.ac.uk; Jennifer L Feeley* - jennyfeeley@hotmail.co.uk; John Dixon - John.Dixon@tees.ac.uk; \nVicki J Whittaker - V.J.Whittaker@tees.ac.uk\n* Corresponding author \nAbstract\nBackground: The criteria for stopping Delphi studies are often subjective. This study aimed to\nexamine whether consensus and stability in the Delphi process can be ascertained by descriptive\nevaluation of trends in participants' views.\nMethods: A three round email-based Delphi required participants (n = 12) to verify their level of\nagreement with 8 statements, write comments on each if they considered it necessary and rank the\nstatements for importance. Each statement was analysed quantitatively by the percentage of\nagreement ratings, importance rankings and the amount of comments made for each statement,\nand qualitatively using thematic analysis. Importance rankings between rounds were compared by\ncalculating Kappa values to observe trends in how the process impacts on subject's views.\nResults: Evolution of consensus was shown by increase in agreement percentages, convergence of\nrange with standard deviations of importance ratings, and a decrease in the number of comments\nmade. Stability was demonstrated by a trend of increasing Kappa values.\nConclusion: Following the original use of Delphi in social sciences, Delphi is suggested to be an\neffective way to gain and measure group consensus in healthcare. However, the proposed analytical\nprocess should be followed to ensure maximum validity of results in Delphi methodology for\nimproved evidence of consensual decision-making.\nBackground\nThe Delphi technique is suggested to be an effective way\nto gain and measure group consensus in healthcare [1].\nDelphi was developed by Dalkey and colleagues at the\nRAND Corporation in the 1950's, and is a structured proc￾ess requiring experts to respond to non-leading, unambig￾uous statements with the aim of achieving consensus.\nUsing a systematic fashion of repeating rounds, where\neach subsequent set of statements is built on the\nresponses to the preceding ones, consensus is sought\nthrough the feedback of information and iteration [2],\nand the process is terminated when consensus is reached.\nAnonymity offered by Delphi can reduce the inhibition\nnormally occurring in decision-making as individuals will\nbe more open with their answers.\nAlthough originally used as a methodological tool in\nsocial sciences, recently there has been a rise in the use of\nDelphi in healthcare research [3-9]. Delphi characteristics\nhave been consistently described in the definitive texts\nPublished: 29 November 2007\nBMC Medical Research Methodology 2007, 7:52 doi:10.1186/1471-2288-7-52\nReceived: 25 June 2007\nAccepted: 29 November 2007\nThis article is available from: http://www.biomedcentral.com/1471-2288/7/52\n© 2007 Holey et al; licensee BioMed Central Ltd. \nThis is an Open Access article distributed under the terms of the Creative Commons Attribution License (http://creativecommons.org/licenses/by/2.0), \nwhich permits unrestricted use, distribution, and reproduction in any medium, provided the original work is properly cited.\n\nBMC Medical Research Methodology 2007, 7:52 http://www.biomedcentral.com/1471-2288/7/52\nPage 2 of 10\n(page number not for citation purposes)\n[2,10,11], and in the paper by Caws [12], which consid￾ered consensus theories in healthcare. Importantly how￾ever, there is no general agreement in the literature that\ndefines specific criteria to use to determine when consen￾sus has been achieved, i.e. when to stop a Delphi study.\nEvidence on the evaluation of Delphi consensus is lim￾ited; researchers have not yet described how to determine\nwhen an exact level of the consensus is reached in Delphi.\nDelphi studies have been used to develop and identify\nconsensus by experts on a given topic. As interest has\ngrown in the analysis of the data produced by this\nmethod, authors have attempted to clarify the relevant\nconcepts.\nIt has been suggested that consensus is the same as agree￾ment and that agreement can be determined by:\n1) the aggregate of judgements (the pool of individual\njudgements) [2],\n2) a move to a subjective level of central tendency [13],\n3) or alternatively, by confirming stability, which is \"the\nconsistency of answers between successive rounds of the\nstudy [13].\"\nThe first of these occurs within each Delphi round. The\nsecond and third occur between rounds. Researchers have\nbeen inconsistent in their use of these concepts. In addi￾tion some researchers support the use of pre-determined\nlevels of consensus to reduce research bias [14] whilst oth￾ers argue that applying numerical values to subjective\nresponses gives an unconvincing analysis [15].\nScheibe et al.[16] suggest that stability should be used in\nDelphi studies to compare the views of participants, as\nthey believed that reporting a percentage of expressed\nviews does not reflect the nature of Delphi to look for\nresistance to natural centralisation of views. They also\nnote complete stability will be difficult to attain as there\nwill always be some \"oscillatory movements.\" A subse￾quent study used stability rather than agreement as termi￾nation criteria for Delphi [13]. Dajani et al. [13] propose\nthe use of Chi-squared (χ2) to test for stability. However,\nthis cannot be considered to test stability in Delphi stud￾ies as it will determine \"the independence of the rounds\nfrom responses found in them\" [13] not the stability of\nresponses between separate rounds. A study by Chaffin\nand Talley [17] using χ2 to determine individual stability\nprior to group stability was developed from the work of\nDajani et al., and therefore this should also be viewed\nwith caution. Since these works few examples of χ2 as a\nstability measure appear in Delphi literature. More\nrecently Greatorex & Dexter used means and standard\ndeviations (SD) for comparing movement between Del￾phi rounds as a measure of both stability and convergence\n[18].\nIn 1998 the NHS Health Technology Assessment group\nproduced a detailed report on the requirements of effec￾tive consensus development methods [1] yet could not\nidentify an appropriate statistical measure for reporting a\nmove towards consensus, identified by central tendency\nin Delphi. They suggested reasoned feedback was advisa￾ble as well as central tendency measures but did not iden￾tify a statistical method which could do this. This lack of\nunambiguous criteria for defining consensus clearly\nshows that further research is required in this area.\nAim of the Study\nIn order to reduce the subjectivity in stopping criteria used\nin Delphi studies, this study aimed to examine whether\nconsensus and stability in the Delphi process can be ascer￾tained by descriptive evaluation of trends in participants'\nviews. We evaluated the evolution of consensus and sta￾bility by examining agreement percentages, importance\nrankings (based on simple descriptive statistics) and\nKappa values. These were used to explore how quantita￾tive results could inform Delphi users, firstly on the pro￾duction of central tendency/consensus, and secondly on\nstability, thus reducing subjectivity in reporting Delphi\nresults. The use of simple descriptive statistics, as used in\nprevious work [18], makes this method very user-friendly.\nMethods\nAn email-based Delphi study was undertaken and com￾parative statistical testing applied. Ethical approval was\nobtained from University of Teesside and informed con￾sent obtained from each participant. A convenience heter￾ogeneous sample (n = 12) of volunteer nursing,\noccupational therapy and physiotherapy students. A three\nround email-based Delphi study was undertaken follow￾ing a pilot, which checked whether the statements were\nclear, unambiguous and non-leading. Statements were\ntaken directly from the paper by McCallin [19] which\nreviewed interdisciplinary practice, a topic in which all\nstudents were equivalent experts due to their experiences\nas students. The views and opinions reached were irrele￾vant to the studying question, which explored the change\nof the opinions towards consensus, rather than the nature\nof the consensus itself. In each round, participants were\ninvited to respond by scaling each statement on degree of\nagreement and commenting on each statement as desired,\n(see example in Table 1), and finally ranking the state￾ments in order of importance, (see example in Table 2).\nBetween rounds views were analysed using Colazzi's 7-\nstage thematic analysis, modified from Holloway &\n\nBMC Medical Research Methodology 2007, 7:52 http://www.biomedcentral.com/1471-2288/7/52\nPage 3 of 10\n(page number not for citation purposes)\nWheeler [20]. Quantitative analysis of the Delphi\nincluded calculations of:\n1. Percentage response rates,\n2. Percentages for each level of agreement for each state￾ment to compensate for varying response rates,\n3. Median, range and their associated group rankings\nusing the importance ratings,\n4. Mean (SD) and their associated group rankings using\nthe importance ratings,\n5. Weighted Kappa (K) values to compare chance-elimi￾nated agreement between rounds.\nFor the following round, statements were rephrased if\nappropriate with the aim of moving towards consensus,\nbased on the level of agreement and the majority theme\nhighlighted. Successive rounds consisted of statements\n(some rephrased) percentage agreement levels, anony￾mous feedback from the previous round to show the\nrange of views received, and the importance rankings\nusing the median rank values. Participants were requested\nto read the feedback before responding again to state￾ments.\nScaling methods of agreement and importance were\nadapted from Sim & Wright [21] and have been previously\nused and described in Delphi literature [2,22,23]. Agree￾ment scales were particularly relevant as they gave an\nopportunity for participants to scale each statement inde￾pendently. To make comparisons between rounds and for\nfeedback, percentage agreements were calculated for each\nlevel of the scale to compensate for varying response rates.\nWeighted Kappa (K) statistics were calculated for the\nwithin-subject level of agreement in their importance\nrankings between two rounds, not the level of agreement\nbetween participants. K values show a chance-corrected\nproportional agreement [24]. A weighted Kappa was\nappropriate as un-weighted does not take into account the\nmagnitude of discrepancies between disagreements\n[25,26]. SPSS was unable to calculate the K-values because\nof the requirement for a weighted Kappa. Therefore Excel\nspreadsheets and handwritten crosstabs were used based\non the descriptions by Armitage et al. [27] and interpreta￾tion by Anthony [28], Table 3 (see Fliess [29] for a full\nmathematical explanation and justification of the Kappa\nvalidity). K-values were used to compare agreement of\nimportance rankings between rounds for each statement\nand Chaffin & Talley [17] stated an \"individual stability\ntest for Delphi studies provides more information than a\ngroup stability test,\" therefore justifying the use of Kappa.\nResults\nThe results section summarises the Delphi in terms of\nhow consensus and stability evolved through rounds 1 to\n3 by looking at the: -\n• Agreement percentages,\n• Importance rankings,\n• Statement evolution,\n• Theme production,\n• Kappa values.\nTable 3: Adapted from Anthony (1999) showing the level of \nagreement represented by K-values.\nK-value Agreement level\n0.0–0.2 Poor agreement\n0.21–0.4 Fair agreement\n0.41–0.6 Moderate agreement\n0.61–0.8 Substantial agreement\n0.81–1 Almost perfect agreement\nTable 2: Example of lay-out as given for participants to rank \nimportance of statements at the end of round 1\nRank Role definition is a significant factor underpinning \nsuccessful teamwork.\nRank Collaboration relies on changing attitudes.\nRank Collective understanding develops when health \nprofessionals have opportunity to get to know each \nother in a more personal sense.\nRank The frequency of team meetings is the single most \ncritical factor that fosters collaborative teamwork.\nTable 1: Example of lay-out as presented for statement 1, round \n1\n1. Role definition is a significant factor underpinning \nsuccessful teamwork.\nAgreement \u0001 Strongly agree\n\u0001 Agree\n\u0001 No opinion\n\u0001 Disagree\n\u0001 Strongly disagree\nComments...\n\nBMC Medical Research Methodology 2007, 7:52 http://www.biomedcentral.com/1471-2288/7/52\nPage 4 of 10\n(page number not for citation purposes)\nAgreement values were affected in the second round by a\nreduced response of 83% (10 of 12).\nStatement 1 (Table 4)\nThe main themes highlighted remained constant through￾out the three rounds but decreased in duplication over the\nrounds. The range interval and SD decreased to low levels\n(difference of 2 and 0.60 respectively). By the end this\nstatement had the lowest range and SD, suggesting great￾est stability and consensus, also it had a low number of\ncomments (3). When the median and mean were equal\nthe range, 1–3, and SD, 0.60 were low. Importance rank￾ing was always high (second place).\nStatement 2 (Table 5)\nThere was a variety of themes generated (6) in round 1,\nsuggesting divergence, changing to 3 themes in round 2,\nthen 2 in round 3, suggesting convergence.\nFor statement 2 there was an increase in agreement\nbetween round 1 and 2, then divergence rather than con￾vergence occurred between rounds 2 and 3. Based on the\nSD there was less consensus for this statement in round 3.\nStatement 3 (Table 6)\nNew themes were generated in round three, also sugges￾tive of instability. Interestingly, the two non-responders\nfrom round 2 disagreed with the third round statement\naffecting the percentage of agreement. This was 1 of only\n2 statements showing disagreement in round 3 and show￾ing an increase in disagreement between any rounds.\nMean and median ranks both show this statement became\nless important to the participants, yet there was always a\n2-interval difference between these ranks.\nStatement 4 (Table 7)\nFour themes were highlighted in round one. Despite the\nchange in agreement between rounds two and three only\none comment was given in round three, the least number\nof comments for any statement throughout the Delphi.\nAn increase in those strongly agreeing (from 8% to 80%)\nwas observed for round 2, as shown in Table 7. The level\nof those strongly agreeing lowered in round 3 (to 58%).\nMean and median values both showed increase in impor￾tance rankings. As in statement 1, when median and mean\nwere equal, range and S.D were lowest.\nTable 5: Agreement and importance values for statement 2\nRound 1 Round 2 Round 3\nAgreement Strongly agree 27% 0% 25%\nAgree 55% 100% 67%\nNo opinion 9% 0% 8%\nDisagree 9% 0% 0%\nStrongly disagree 0% 0% 0%\nImportance Median 4 4 4\nRange 1–8 2–7 3–8\nRank 4 4 = 4\nMean 4.58 4.10 4.33\nStandard deviation 2.50 1.45 1.78\nRank 4 4 4\nTable 4: Agreement and importance values for statement 1\nRound 1 Round 2 Round 3\nAgreement Strongly agree 42% 40% 50%\nAgree 42% 60% 50%\nNo opinion 8% 0% 0%\nDisagree 8% 0% 0%\nStrongly disagree 0% 0% 0%\nImportance Median 3 2 2\nRange 3–7 1–4 1–3\nRank 2 2 2\nMean 3.33 2.20 2.00\nStandard deviation 1.78 1.03 0.60\nRank 2 2 2\n\nBMC Medical Research Methodology 2007, 7:52 http://www.biomedcentral.com/1471-2288/7/52\nPage 5 of 10\n(page number not for citation purposes)\nStatement 5 (Table 8)\nNew themes were generated in round 3 suggesting stabil￾ity had not yet occurred.\nFor this statement agreement percentages and ranges did\nnot vary appreciably still showing disagreement in round\n3, suggesting stability. Although only changing by 0.06\nbetween rounds 2 and 3, the SD suggests there is still con￾vergence. The statement became less important, ranked 3\nto 5.\nStatement 6 (Table 9)\nRound 1 produced 5 themes. In round 3 all responses\nreflected different themes, previous themes and new\nthemes suggesting the views of participants had not been\nexhausted. Agreement increased over the 3 rounds,\ninversely to the ranking of importance. Both the median\nand the mean define a move towards lesser importance\nwith the progression of rounds. The range intervals of 6, 5\nand 5, over the rounds suggest consensus was weak yet\nstability had occurred but the SD was still lowering sug￾gesting continued convergence.\nStatement 7 (Table 10)\nIn round 1 there were 2 themes, which were reflected\nagain in rounds 2 and 3, although the amount of partici￾pants responding decreased to 3 in both round 2 and\nround 3. This statement was consistently high on agree￾ment and importance always ranked first. However, range\ninterval of 4, and SD of 1.17, were not the lowest observed\nin round 3, suggesting the possibility of further conver￾gence.\nStatement 8 (Table 11)\nOnly 4 comments were obtained in round 1 all reflecting\nagreement. Round 2 instigated only three comments, still\nreflecting agreement. This was the only statement for\nwhich the number of comments increased in round 3\nthese included new themes, suggesting instability. How￾ever, agreement increased for this statement. Both mean\nand median values showed the importance ranking lower\nbut the range and SD both showed a move towards con￾sensus.\nKappa agreement (Table 12)\nIn general, K-values increased between rounds when\nrounds progressed, and when adjacent rounds were com￾pared as opposed to round 1 Vs round 3. Statement 7,\nTable 7: Agreement and importance values for statement 4\nRound 1 Round 2 Round 3\nAgreement Strongly agree 8% 80% 58%\nAgree 42% 0% 42%\nNo opinion 8% 0% 0%\nDisagree 42% 20% 0%\nStrongly disagree 0% 0% 0%\nImportance Median 5 3 3\nRange 2–8 2–6 1–4\nRank 6 3 3\nMean 4.83 3.70 3.00\nStandard deviation 2.04 1.64 0.95\nRank 5 3 3\nTable 6: Agreement and importance values for statement 3\nRound 1 Round 2 Round 3\nAgreement Strongly agree 8% 0% 0%\nAgree 50% 70% 59%\nNo opinion 0% 0% 8%\nDisagree 42% 20% 33%\nStrongly disagree 0% 10% 0%\nImportance Median 4.5 6 6\nRange 1–8 5–8 5–8\nRank 5 6 6\nMean 5.42 6.50 6.42\nStandard deviation 2.27 1.18 1.08\nRank 7 8 8\n\nBMC Medical Research Methodology 2007, 7:52 http://www.biomedcentral.com/1471-2288/7/52\nPage 6 of 10\n(page number not for citation purposes)\nround 1 Vs round 2 showed the least agreement, K =\n0.313, yet was consistently ranked the most important.\nThis apparent anomaly is discussed below. Statement 4\nhad the second lowest SD by round 3 yet never achieved a\nK > 0.5. Statement 1, 3 and 7 got the 3 highest Kappa val￾ues, comparing round 2 and 3.\nDiscussion\nThe Delphi results show a change in participants' views\ntowards consensus and stability as indicated by a trend\ntowards:\n• an increase in percentage agreements\n• convergence of importance rankings\n• increase in Kappa values\n• a decrease in comments as rounds progressed\nAn increase was observed in percentage agreements for all\nstatements over the 3 rounds with only 2 statements\n(Tables 6 and 8) showing some disagreement by round 3,\ncompared to 7 statements in round 1. This demonstrates\nthe evolution of consensus. Statement 4 (Table 7) had the\nhighest disagreement percentage in round 1, yet full agree￾ment by round 3, demonstrating that views could alter\nconsiderably.\nOscillatory movements at individual and group level were\nconsistent with those described by Scheibe et al.[16]. A\ndeviation in the level of agreement, \"strongly agree\" or\n\"agree,\" between rounds was evident in most statements,\nand was not dependent on changes to statement phrasing\n(Table 7). The phenomenon of 2 participants failing to\nrespond to round 2 had a bearing on the oscillatory move￾ment, their lack of response gave a misleading bias\ntowards agreement (Table 6). Individually both these par￾ticipants disagreed to this statement, demonstrating dis￾advantage in the use of percentages. It is worth noting that\nnon-responders can impact significantly on the sample\nsize when interpreting percentages and this could lead to\nmisleading oscillatory movements as suggested by\nScheibe et al.[16].\nTable 9: Agreement and importance values for statement 6\nRound 1 Round 2 Round 3\nAgreement Strongly agree 25% 10% 25%\nAgree 42% 60% 58%\nNo opinion 0% 0% 17%\nDisagree 33% 20% 0%\nStrongly disagree 0% 10% 0%\nImportance Median 5.5 7 7\nRange 1–7 3–8 3–8\nRank 7 8 7\nMean 4.83 6.40 6.33\nStandard deviation 2.21 1.65 1.56\nRank 6 7 7\nTable 8: Agreement and importance values for statement 5\nRound 1 Round 2 Round 3\nAgreement Strongly agree 25% 10% 17%\nAgree 42% 60% 58%\nNo opinion 25% 20% 17%\nDisagree 9% 10% 8%\nStrongly disagree 0% 0% 0%\nImportance Median 3.5 4 5.5\nRange 1–8 2–7 3–8\nRank 3 4 = 5\nMean 4.25 4.40 5.67\nStandard deviation 2.53 1.78 1.72\nRank 3 5 5\n\nBMC Medical Research Methodology 2007, 7:52 http://www.biomedcentral.com/1471-2288/7/52\nPage 7 of 10\n(page number not for citation purposes)\nTable 11: Agreement and importance values for statement 8\nRound 1 Round 2 Round 3\nAgreement Strongly agree 17% 30% 25%\nAgree 50% 50% 75%\nNo opinion 25% 20% 0%\nDisagree 8% 0% 0%\nStrongly disagree 0% 0% 0%\nImportance Median 6 6.5 7\nRange 3–8 3–8 5–8\nRank 8 7 8\nMean 5.92 6.30 6.17\nStandard deviation 1.56 1.77 1.11\nRank 8 6 6\nTable 10: Agreement and importance values for statement 7\nRound 1 Round 2 Round 3\nAgreement Strongly agree 50% 70% 67%\nAgree 42% 30% 33%\nNo opinion 8% 0% 0%\nDisagree 0% 0% 0%\nStrongly disagree 0% 0% 0%\nImportance Median 2 1 1\nRange 1–7 1–6 1–5\nRank 1 1 1\nMean 2.67 1.90 1.50\nStandard deviation 1.97 1.73 1.17\nRank 1 1 1\nTable 12: Kappa values for within-subject agreement in importance rankings between rounds of each statement\nAgreement between Rounds 1 and 2 Agreement between Rounds 2 and 3 Agreement between first and last round (1 and 3)\nStatement 1 0.642 0.836 0.432\nStatement 2 0.697 0.516 0.596\nStatement 3 0.600 0.750 0.533\nStatement 4 0.498 0.490 0.470\nStatement 5 0.696 0.669 0.627\nStatement 6 0.627 0.641 0.548\nStatement 7 0.313 0.711 0.375\nStatement 8 0.515 0.690 0.519\n\nBMC Medical Research Methodology 2007, 7:52 http://www.biomedcentral.com/1471-2288/7/52\nPage 8 of 10\n(page number not for citation purposes)\nThe median and mean values for importance show the\ngroup aggregate rank, whereas ranges and SD show the\nspread, i.e. disagreement [18] of the group's responses\naround that result. Both range and SD decreased as rounds\nprogressed, showing centralisation of views i.e. increased\nagreement or convergence. Comparison of importance\nrankings shows similarity in medians and means, equal or\nwithin one interval difference (Tables 4, 5, 7, 8, 9 and 10).\nDifferences of 2 intervals were shown for statements 3 and\n8 (Tables 6 and 11), which were 2 of the statements con￾sistently ranked the least important. These discrepancies\nbetween means and medians could be explained by par￾ticipants giving less attention to statements they consider\nleast important.\nWhile a decrease in range generally reflected a decrease in\nSD, there was no direct relationship between them. For\nexample, between rounds 2 and 3, in statement 6 the SDs\ndecreased from 1.65 and 1.56 but the ranges stayed con￾stant, at 3–8. This highlights the different information\neach provides, SDs give an indication of the aggregate\njudgement where as ranges summarise the outliers views.\nAlso between statements, equal ranges were represented\nby different SDs. For example statements 2 and 3 had a\nrange of 1–8 in round 1, but standard deviations of 2.50\nand 2.27, respectively. These findings expand on Greato￾rex & Dexter's conclusion [18] that each individual Delphi\nrequires acceptable values of both mean and SD to repre￾sent consensus, by identifying that each statement must\nhave individual values to determine convergence. How￾ever, this has implications for Delphi research as:-\n• there may be increased potential for bias as researchers\nwill need to make individual judgements on acceptable\nconvergence levels for each statement,\n• Alternatively, preconceived levels of convergence to\ndetermine consensus, as suggested by Williams & Webb\n[15], would be difficult to predict.\nWhen interpreting the mean and median importance\nrankings, some between-test validity can be demon￾strated. For example, when the mean and median were\nequal the lowest ranges and SDs were observed (Tables 4\nand 7). Adding and subtracting the SD from the mean\nmore accurately mirrored the range as the rounds pro￾gressed (table 4). As the SD represents the majority of sub￾jects' variation around the mean, this shows there were\nfewer outliers as rounds progressed, again indicating\nlower disagreement [18], or increased convergence.\nAs expected, the greatest difference between K-values was\nbetween round 1 and 3 (Table 12), with K-values nearing\n1, and greater agreement for round 2 versus 3. Observed\npoints from K-values show no association with the ranges,\nSDs, medians, means or ranks. Possible explanations for\nthis are the elimination of chance in Kappa and the com￾parison of between rounds in Kappa rather than values\nwithin a particular round. Also Kappa-crosstabs plot indi￾viduals' rank from one round against their rank in the next\nround, therefore K-values measure the value of agreement\nfor individuals between two rounds, not agreement between\ndifferent participants within a round. It was interesting to\nobserve the apparent contradiction, between the results\nfor Kappa and percentage agreement for statement 7. This\nmay have been due to the small range of answers as com￾pared with other statements, because Kappa is affected by\nrange. This highlights the need to use a range of descrip￾tive statistics in Delphi analysis.\nGenerally the number of comments decreased in each\nround. However, statement 8 (Table 11) did not show a\ndecrease in comments but followed similar quantitative\ndata patterns as other statements. One participant did\ncomment on misunderstanding statement 8 in round 1,\nmisunderstanding of the statement by participants possi￾bly leading to the equivalent of a loss of a Delphi round\nfor that statement until the meaning was clarified. This is\nvalidated by the rise in SD and range (Table 11), and rise\nin SD for statement 4, which was also misunderstood in\nround 1 (Table 7).\nNew themes were generated in round 3 for the 4 state￾ments of least importance (Tables 6, 8, 9 and 11), suggest￾ing instability, as views had not been exhausted. This was\nsometimes contradictory to the SDs and ranges which\nshowed low scores, however they were still converging/\nlowering therefore showing instability. Although aggre￾gating judgements will reduce the strength of the outliers\nviews in quantitative data, with subjective views outliers\ncan raise important issues not yet considered by others,\nand therefore new themes should not be ignored and\nrounds continued until views are exhausted.\nStatements 1 and 4 which received fewer comments in\nround 3 had the lowest SDs. Because quantitative analysis\naggregates participants' judgements, outlying individual\njudgements are not represented. However, the reduction\nin comments does support the lowering of range intervals\nand SD, substantiating the evolution of consensus and\nvalidating quantitative data with qualitative data.\nThe results presented here demonstrate two points that\ncan be used to improve Delphi studies in future. Firstly,\nthe results have demonstrated that the mean and SD,\nwhen combined with the range and medians, can be used\nto show whether convergence has occurred, by a move￾ment towards central tendency. This is in agreement with\nthe findings of Greatorex and Dexter [18]. The amount of\nconvergence and therefore the strength of agreement is\n\nBMC Medical Research Methodology 2007, 7:52 http://www.biomedcentral.com/1471-2288/7/52\nPage 9 of 10\n(page number not for citation purposes)\nindicated by a comparison of SD (strength of aggregate\njudgement) and range (larger ranges being indicative of\noutliers views). Secondly, high or increasing Kappa values\ndemonstrate stability of individuals' views within the\ngroup and the level of agreement between rounds. Fur￾thermore, reductions in the number of subjective com￾ments reinforce the quantitative observations of\nconvergence. It is rare to see this in Delphi studies and it\nis proposed that in future Delphi studies, this analytical\ncombination is used.\nThere are limitations to this study. This study used a small\nsample size therefore the results should be treated with\nsome caution, and followed up by a larger study. However\nthis offered the greatest opportunity for analysing all qual￾itative data, because an increased sample size would have\nled to saturation of data, and it is not uncommon for Del￾phi studies to use this type of sample size.\nConclusion\nUsing standard descriptive statistics and Kappa calcula￾tions in conjunction with thematic analysis and the\nnumber of comments generated, it was possible to dem￾onstrate movement towards consensus and stability in\nthis Delphi study. Following the original use of Delphi in\nsocial science, Delphi is suggested to be an effective way to\ngain and measure group consensus in healthcare [1].\nThere is potential here to add clarification to the use of a\nvery subjective methodology. It is suggested that a combi￾nation of the simple descriptive statistics as presented here\nbe used to reduce subjectivity and ensure maximum valid￾ity of results in Delphi methodology for improved evi￾dence of consensual decision-making. The trends\nobserved in this exploratory study suggest that a larger\nstudy is warranted, following the same approach.\nCompeting interests\nThe author(s) declare that they have no competing inter￾ests.\nAuthors' contributions\nJLF and EAH designed the study. JLF collected the data. All\nauthors participated in the analysis and interpretation of\nthe data, and the drafting, progress and revision of the\nmanuscript.\nAcknowledgements\nThe authors would like to thank Matthew Wright and all the participants \nfor their generous contribution of views and time.\nReferences\n1. Murphy MK, Black NA, Lamping DL, McKee CM, Sanderson CF,\nAskham J, Marteau T: Consensus development methods, and\ntheir use in clinical guideline development. Health Technol\nAssess 1998, 2(3):i-88.\n2. Delbecq AL, Van de Ven AH, Guftafson DH: A Guide to Nominal Group\nTechniques for Program Planning and Delphi Processes Glenview, Illinois:\nScott Forman and Co; 1974. \n3. Beech B: Studying the future: A Delphi survey of how multi￾disciplinary clinical staff view the likely development of two\ncommunity mental health centres over the course of the\nnext two years. J Adv Nurs 1997, 25:331-338.\n4. Cantrill JA, Sibbald B, Buetow S: Indicators of the appropriate￾ness of long-term prescribing in general practice in the\nUnited Kingdom: Consensus development, face and content\nvalidity. Qual Health Care 1998, 7:130-135.\n5. Hardy DJ, O'Brien AP, Gaskin CJ, O'Brien AJ, Morrison-Ngatal E,\nSkews G, Ryan T, McNulty N: Practical application of the Delphi\ntechnique in a bicultural mental health nursing study in New\nZealand. J Adv Nurs 2004, 46:95-109.\n6. O'Hara L, De Souza LH, Ide L: A Delphi study of self-care in a\ncommunity population of people with multiple sclerosis. Clin\nRehabil 2000, 14:62-71.\n7. Saliba D, Solomon D, Rubenstein L, Young R, Schnelle J, Roth C,\nWenger N: Quality indicators for the management of medical\nconditions in nursing home residents. J Am Med Dir Assoc 2004,\n5:297-309.\n8. Sindhu F, Carpenter L, Seers K: Development of a tool to rate\nthe quality assessment of randomised controlled trails using\na Delphi technique. J Adv Nurs 1997, 25:1262-1268.\n9. Wollard M: Emergency calls not requiring an urgent ambu￾lance response: Expert consensus. Prehospital Emergency Care\n2003, 7:384-391.\n10. Adler M, Ziglio E, (Eds): Gazing into the Oracle: The Delphi Method and\nits Application to Social Policy and Public Health London: Jessica Kinglsey\nPublishers; 1996. \n11. Linstone HA, Turoff M: The Delphi Method Techniques and Applications\nMassachusetts: Addision Wesley Publishing Co; 1975. \n12. Caws P: Committee and consensus: How many heads are bet￾ter than one? J Med Philos 1991, 16:375-391.\n13. Dajani JS, Sincoff MZ, Talley WK: Stability and agreement crite￾ria for the termination of Delphi studies. Technol Forecast Soc\n1979, 13:83-90.\n14. Williams PL, Webb C: The Delphi technique: Methodological\ndiscussion. J Adv Nurs 1994, 19:180-186.\n15. Crisp J, Pelletier D, Duffield C, Adams A, Nagy S: The Delphi\nmethod? Nurs Res 1997, 46:16-118.\n16. Scheibe M, Skutsch M, Schofer J: Experiments in Delphi Method￾ology. In The Delphi Method: Techniques and Applications Edited by:\nLinstone HA, Turoff M. Massachusetts: Addison-Wesley;\n1975:262-287. \n17. Chaffin WW, Talley WK: Individual stability in Delphi studies.\nTechnol Forecast Social 1980, 16:67-73.\n18. Greatorex J, Dexter T: An accessible analytical approach for\ninvestigating what happens between the rounds of a Delphi\nstudy. J Adv Nurs 2000, 32:1016-1024.\n19. McCallin A: Interdisciplinary practice – a matter of teamwork:\nAn integrated literature review. J Clin Nurs 2001, 10:419-428.\n20. Holloway I, Wheeler S: Qualitative Research in Nursing 2nd edition.\nOxford: Blackwell Science Ltd; 2002. \n21. Sim J, Wright C: Research in Health Care, Concepts, Designs & Methods\nCheltenham: Nelson-Thorne Ltd; 2000. \n22. Couper MR: The Delphi technique: characteristics and\nsequence model. ANS Adv Nurs Sci 1984, 7(1):72-77.\n23. Watson J: Men and Health: Report of a Delphi Study to Scope Themes for\nEvidence-Based Reviews 2004 [http://www.nice.org.uk/nicemedia/docu\nments/menandhealth_delphi.pdf]. National Institute for Clinical Excel￾lence http://www.nice.org.uk\n24. Maxwell FP: A-Z Medical Statistics: A Comparison for Clinical Appraisal\nLondon: Arnold; 1998. \n25. Altman DG: Practical Statistics for Medical Research London: Chapman\n& Hall/CRC; 1999. \n26. MedCalc [http://www.medcalc.be/manual/kappa.php]\n27. Armitage P, Berry G, Matthews JNS: Statistical Methods in Medical\nResearch 4th edition. Oxford: Blackwell Science Ltd; 2002. \n28. Anthony DM: Understanding Advanced Statistics: A Guide for Nurses and\nHealth Care Researchers New York: Churchill Livingstone; 1999. \n29. Fliess JL: Statistical Methods for Rates and Proportions New York: John\nWiley & Sons; 1981. \n\nPublish with BioMed Central and every \nscientist can read your work free of charge\n\"BioMed Central will be the most significant development for \ndisseminating the results of biomedical research in our lifetime.\"\nSir Paul Nurse, Cancer Research UK\nYour research papers will be:\navailable free of charge to the entire biomedical community\npeer reviewed and published immediately upon acceptance\ncited in PubMed and archived on PubMed Central \nyours — you keep the copyright\nSubmit your manuscript here:\nhttp://www.biomedcentral.com/info/publishing_adv.asp\nBioMedcentral\nBMC Medical Research Methodology 2007, 7:52 http://www.biomedcentral.com/1471-2288/7/52\nPage 10 of 10\n(page number not for citation purposes)\nPre-publication history\nThe pre-publication history for this paper can be accessed\nhere:\nhttp://www.biomedcentral.com/1471-2288/7/52/prepub\n\n"], "response": "This research aims to reduce the subjectivity in determining consensus and stability in Delphi studies, a widely used methodology in healthcare and social sciences for gathering expert opinions. The study presents a case study using a three-round email-based Delphi study with a convenience heterogenous sample of student nurses, occupational therapists, and physiotherapists. The statements were related to interdisciplinary practice, and the views and opinions reached were irrelevant to the study's question, which focused on exploring the change of opinions toward consensus rather than the nature of consensus itself. The study analyzed agreement percentages, importance rankings, statement evolution, theme production, and Kappa values to evaluate consensus and stability. The results showed that a combination of simple descriptive statistics could help reduce subjectivity and improve the validity of Delphi methodology for better evidence of consensual decision-making. The study suggests that a larger study is needed to confirm these findings.\n\nCompeting interests: The authors declare that they have no competing interests.\n\nAuthors' contributions: JLF and EAH designed the study. JLF collected the data, and all authors participated in the analysis, interpretation of data, drafting, progress, and revision of the manuscript.\n\nReferences: The study refers to several sources, including Delbecq et al.'s guide to nominal group techniques, Cantrill et al.'s study on appropriate prescribing in general practice, and McCallin's literature review on interdisciplinary practice. Other references include books on Delphi methodology by Adler and Turoff, Linstone and Turoff, and Scheibe and Skutsch, as well as articles by Dajani, Chaffin, and Greatorex. The study also mentions Maxwell's book on medical statistics and Anthony's guide for nurses and healthcare researchers on advanced statistics. Additionally, the study highlights the significance of BioMedCentral's publishing platform for disseminating biomedical research results freely and instantly.\n\nKeywords: Delphi methodology, consensus, stability, healthcare, social sciences, simple descriptive statistics, subjectivity, validation.\n\nAbstract: The abstract briefly introduces the study's purpose, methodology, and results, highlighting the need for reducing subjectivity in determining consensus and stability in Delphi studies and presenting a case study using simple descriptive statistics.\n\nIntroduction: The introduction explains the background and relevance of Delphi methodology in healthcare and social sciences, mentioning its potential for improving evidence-based decision-making. It also discusses the limitations of traditional methods for measuring consensus and stability and highlights the need for reducing subjectivity in Delphi studies.\n\nMethods: The methods section describes the study design, sample selection, data collection, and analysis procedures, emphasizing the use of simple descriptive statistics such as agreement percentages, importance rankings, statement evolution, theme production, and Kappa values.\n\nResults: The results section presents the trends observed in the study, highlighting the stability and consensus achieved in certain statements while identifying areas of divergence and instability in others. The section also notes the potential for a larger study to confirm these findings.\n\nDiscussion: The discussion section reflects on the implications of the study's findings, emphasizing the need for combining simple descriptive statistics with other methods to reduce subjectivity and improve the validity of Delphi methodology for better evidence of consensual decision-making.\n\nConclusion: The conclusion summarizes the key points of the study, restating the need for reducing subjectivity in determining consensus and stability in Delphi studies and highlighting the potential benefits of combining simple descriptive statistics with other methods.\n\nReferences: The reference list includes sources cited throughout the paper, covering topics such as Delphi methodology, medical statistics, and healthcare and social sciences research.\n\nOverall, the paper presents a clear and concise description of a case study using simple descriptive statistics to reduce subjectivity in determining consensus and stability in Delphi studies, providing insights into the potential benefits of this approach for improving evidence-based decision-making in healthcare and social sciences."}
{"user_input": "Which technologies show the strongest publication/citation increases in the last five years indicating emerging interests/trends/consensus (outside of the expected like AI or by center or region)?", "retrieved_contexts": ["ARTICLE OPEN\nThe state of artificial intelligence-based FDA-approved\nmedical devices and algorithms: an online database\nStan Benjamens 1,2, Pranavsingh Dhunnoo3 and Bertalan Meskó 3,4✉\nAt the beginning of the artificial intelligence (AI)/machine learning (ML) era, the expectations are high, and experts foresee that AI/\nML shows potential for diagnosing, managing and treating a wide variety of medical conditions. However, the obstacles for\nimplementation of AI/ML in daily clinical practice are numerous, especially regarding the regulation of these technologies.\nTherefore, we provide an insight into the currently available AI/ML-based medical devices and algorithms that have been approved\nby the US Food & Drugs Administration (FDA). We aimed to raise awareness of the importance of regulatory bodies, clearly stating\nwhether a medical device is AI/ML based or not. Cross-checking and validating all approvals, we identified 64 AI/ML based, FDA\napproved medical devices and algorithms. Out of those, only 29 (45%) mentioned any AI/ML-related expressions in the official FDA\nannouncement. The majority (85.9%) was approved by the FDA with a 510(k) clearance, while 8 (12.5%) received de novo pathway\nclearance and one (1.6%) premarket approval (PMA) clearance. Most of these technologies, notably 30 (46.9%), 16 (25.0%), and 10\n(15.6%) were developed for the fields of Radiology, Cardiology and Internal Medicine/General Practice respectively. We have\nlaunched the first comprehensive and open access database of strictly AI/ML-based medical technologies that have been approved\nby the FDA. The database will be constantly updated.\nnpj Digital Medicine (2020) 3:118 ; https://doi.org/10.1038/s41746-020-00324-0\nINTRODUCTION\nThe 2010s has brought a rise in the number of studies and papers\ndiscussing the role of artificial intelligence (AI) and machine\nlearning (ML) in medicine and healthcare (AI/ML). The number of\nlife science papers describing AI/ML rose from 596 in 2010 to\n12,422 in 2019. While we are at the beginning of the AI/ML era, the\nexpectations are high and experts foresee that AI/ML shows\npotential for diagnosing, managing and treating a wide variety of\nmedical conditions1\n.\nIndeed, AI/ML-based technologies have been shown to support\nseveral medical specialties from radiology2 and oncology3 to\nophthalmology4 and general medical decision-making5\n. ML\nmodels have been shown to reduce waiting times6\n; improve\nmedication adherence7\n; customize insulin dosages8\n; or help\ninterpret magnetic resonance images9\n, among others.\nDespite its promise, the obstacles for implementation of AI/ML\nin daily clinical practice are numerous10. These include issues with\ntransparency surrounding these software programs, the inherent\nbias in the data they are fed with and how secure they are. A\ncrucial element shaping these obstacles is regulating such\ntechnologies. The very use of the term AI requires further\nclarification, as multiple subtypes have been proposed, and its\nmeaning can be vague. For the sake of further investments and\nthe public image, companies tend to overuse the term AI, when in\nfact they have developed algorithms which are not AI/ML-based\nper se.\nWe classify a technology as AI/ML based if official FDA\nannouncements, communications by the company or other\npublicly available information resources used the expressions\n‘deep learning,’ ‘machine learning,’ ‘deep neural networks,’\n‘artificial intelligence,’ and/or ‘AI’ to describe the technology11.\nFor simplicity, we use the term “AI/ML-based” to denote these\ntechnologies in this paper.With the increasing expertise and\nattention on AI/ML in the medical field, the opportunities and\npossible implications of its use are the topics of an ongoing\ndebate12. A crucial element in this implementation debate is\nregulating such technologies.\nAs studies about AI’s role in medicine show, its use cases and\ncompanies developing such technologies have been skyrocketing,\nregulatory bodies, such as the US Food & Drugs Administration\n(FDA) and the European Medicine Agency (EMA), have tried to\ntackle its regulation and implementation. As the FDA has shown\nleadership regarding the adoption of AI/ML-based medical\ntechnologies, with a specific framework for AI/ML-based algo￾rithms, we chose it as an example for further analysis13.\nBecause of the high-risk nature of these medical devices and\nthe unknown consequences of using AI/ML for medical decision￾making and data analysis, the FDA has stringent regulatory\nrequirements for medical device licensing. Developers of AI/ML￾based medical devices and algorithms have to go through\nrigorous processes that are time and resource consuming. This\ncan be considered pivotal as a barrier for the introduction of AI/ML\nin medicine.\nBefore medical hardware or software is legally made available in\nthe US market, the parent company has to submit it to the FDA for\nevaluation. For medically oriented AI/ML-based algorithms, the\nregulatory body has three levels of clearance, namely, 510(k)14,\npremarket approval15 and the de novo pathway16, each of which\nneeds specific criteria to be fulfilled in order to be granted (Table 1).\nFor the development and marketing of medical algorithms, the\nFDA’s stringent regulatory requirements pose important chal￾lenges to the companies developing them. Before, every new\nproduct had to go through the regulatory process. However, as\ncompanies update their algorithms on a much shorter time scale,\n1\nDepartment of Surgery, University Medical Center Groningen, University of Groningen, Groningen, The Netherlands. 2\nMedical Imaging Center, University Medical Center\nGroningen, University of Groningen, Groningen, The Netherlands. 3\nThe Medical Futurist Institute, Budapest, Hungary. 4\nDepartment of Behavioural Sciences, Semmelweis\nUniversity, Budapest, Hungary. ✉email: berci@medicalfuturist.com\nwww.nature.com/npjdigitalmed\nSeoul National University Bundang Hospital\n1234567890():,;\n\nnamely in days, the FDA has realized that this process might\nbecome impossible to maintain. Therefore, the FDA started to\nconsider “a total product lifecycle-based regulatory framework for\nthese technologies that would allow for modifications to be made\nfrom real-world learning and adaptation, while still ensuring that\nthe safety and effectiveness of the software as a medical device is\nmaintained”\n13.\nTo date, the FDA has cleared or approved several medical\ndevices using “locked” algorithms. They define a “locked”\nalgorithm as an algorithm that provides the same result each\ntime the same input is applied to it and does not change.\nHowever, many recent medical devices, especially when AI/ML\nbased, use algorithms that change and can adapt over time; these\nare described by the FDA as adaptive algorithms, for which\ncurrent regulatory frameworks were not designed17. The power of\nthese AI/ML-based algorithms lies within the ability to continu￾ously learn, where change to the algorithm might only be realized\nafter the device or software has been distributed for use and could\nlearn from real-world experience.\nAn attempt to solve this issue was proposed in the FDA’s\nproposed regulatory framework from 201918, that “elaborates on a\npotential approach to premarket review for artificial intelligence\nand ML-driven software modifications”\n13. It is recognized by the\nFDA that these adaptive algorithms require a total product\nlifecycle (TPLC) regulatory approach, enabling rapid cycle of\nproduct improvement with effective safeguards.\nThis TPLC approach is based on the Digital Health Software\nPrecertification (Pre-Cert) Program19, allowing for the evaluation of\nSoftware as a Medical Device (SaMD) products throughout the\nlifecycle.\nHowever, the FDA does not ask companies to categorize their\ntechnology as AI/ML based when in fact it is. And some companies\nmention that their technology is AI/ML based in the announce￾ment of the FDA approval or the specific ML method they used,\nbut others do not. We witnessed this issue while working on this\npaper ourselves.\nAt this moment, the evaluation of the processes for approval\nand implementation is hampered by a lack of clarity on the\napproval of AI/ML-based medical devices and algorithms, as FDA\nannouncements do not clearly state the use of these methods.\nMoreover, the search engine of the FDA’s website does not allow\nusers to perform specific search queries in FDA announcements\nand summaries, thus hampering the accessibility of the database.\nIt can be expected from regulatory bodies to provide a clear\ndescription of such devices; create and maintain a clear database,\nallowing proper search queries, to assess the implementation of\nnew techniques. The FDA, like other regulatory agencies, has not\ndone any of these yet.\nThe purpose of this paper therefore was threefold: (1) to\nprovide an insight into the currently available AI/ML-based\nmedical devices and algorithms that have been approved by the\nFDA; (2) to create an up-to-date database of FDA approvals in this\nfield that welcomes submissions and might serve as the database\nthat the FDA should have; and (3) to raise awareness of the\nimportance of regulatory bodies clearly stating whether a medical\ndevice is AI/ML based.\nIn line with this aim, we performed a systematic web-based\nsearch for announcements of FDA approvals of AI/ML-based\nmedical devices and algorithms and cross-checked all approvals\non FDA.gov resulting in an open access and continuously\nexpandable database.\nTo our knowledge, this is the first comprehensive database of\nstrictly AI/ML-based medical technologies, in all medical special￾ties, that have been approved by the FDA. We also suggest a\nthreshold and definition of what defines a medical technology as\nAI/ML based.\nRESULTS\nCross-checked and validated medical devices and algorithms\nCross-checking and validation of all announcements resulted in a\ndatabase with 64 AI/ML based, FDA-approved medical devices\nand algorithms. We decided to include only those 29 devices in\nour further analysis that met the criteria of being considered an AI/\nML-based technology in the related official FDA announcements\n(Table 2). For the other 35 devices, online sources other than the\nFDA marked them as AI/ML-based technologies. A comprehensive\noverview is provided in the online open access database.\nA short overview of these medical devices and algorithms can\nbe found in the infographic (Fig. 1) and a detailed overview, with\nsubsequent directions to the official FDA announcements, is\nprovided in the online open access database.\nOf these medical devices and algorithms, the vast majority (n =\n23, 79.3%) was approved by the FDA with a 510(k) clearance, while\n5 (17.2%) received de novo pathway clearance and one (3.4%)\nreceived PMA clearance.\nThe first FDA approval was granted in the year 2016, with three\napprovals at the end of the year 2017. Most FDA approvals were\ngranted in the year 2018, with 13 (44.8%) approvals, while 10\n(34.4%) and 2 (6.9%) approvals were granted in 2019 and 2020 up\nuntil February, respectively.\nThe two main medical specialties with AI/ML-based medical\ninnovations are Radiology and Cardiology, with 21 (72.4%) and 4\n(13.8%) FDA approved medical devices and algorithms respec￾tively. The remaining medical devices and algorithms can be\ngrouped as focusing on internal medicine/endocrinology, neurol￾ogy, ophthalmology, emergency medicine, and oncology.\nThe medical field of radiology is the trendsetter regarding FDA￾approved medical devices and algorithms, with the introduction\nof AI/ML-based solutions for worldwide applied image reading\nsoftware. Examples are the three algorithms for Arterys Inc.,\nArterys Cardio DL, Arterys Oncology DL and Arterys MICA, which\nTable 1. Descriptions of the types of FDA approvals for AI/ML-based medical technologies.\nLevel of FDA clearance Description\n510(k) clearance A 510(k) clearance for an algorithm is granted when it has been shown to be at least as safe and effective as another similar,\nlegally marketed algorithm. The submitter seeking this clearance must provide substantial proof of equivalence in their\napplication. Without an approval of being substantially equivalent to the other algorithm, the one pending approval cannot\nbe legally marketed.\nPremarket approval Premarket approval is issued to algorithms for Class III medical devices. The latter are those that can have a large impact on\nhuman health and as such, their evaluation undergo more thorough scientific and regulatory processes to determine their\nsafety and effectiveness. In order to approve an application, the FDA determines that the device’s safety and effectiveness is\nsupported by satisfactory scientific evidence. Upon approval, the applicant can proceed with marketing the product.\nde novo pathway Regarding the de novo classification, it is used to classify those novel medical devices for which there are no legally\nmarketed counterparts, but which offer adequate safety and effectiveness with general controls. The FDA performs a risk￾based assessment of the device in question before approval and allowing the device to be marketed.\nS. Benjamens et al.\n2\nnpj Digital Medicine (2020) 118 Seoul National University Bundang Hospital\n1234567890():,;\n\nTable 2. Database of the 29 FDA-approved, AI/ML-based medical technologies.\n# Name of device or\nalgorithm\nName of parent\ncompany\nShort description FDA\napproval number\nType of FDA\napproval\nMention of algorithm\nin announcement\nDate Medical specialty Secondary\nmedical\nspecialty\n1 Arterys Cardio DL Arterys Inc. Software analyzing\ncardiovascular images\nfrom MR\nK163253 510(k)\npremarket\nnotification\nDeep learning 2016 11 Radiology Cardiology\n2 EnsoSleep EnsoData, Inc. Diagnosis of sleep disorders K162627 510(k)\npremarket\nnotification\nAutomated algorithm 2017 03 Neurology\n3 Arterys Oncology DL Arterys Inc. Medical diagnostic\napplication\nK173542 510(k)\npremarket\nnotification\nDeep learning 2017 11 Radiology Oncology\n4 Idx IDx LLC. Detection of diabetic\nretinopathy\nDEN180001 de novo\npathway\nAI 2018 01 Ophthalmology\n5 ContaCT Viz.AI. Stroke detection on CT DEN170073 de novo\npathway\nAI 2018 02 Radiology Neurology\n6 OsteoDetect Imagen\nTechnologies, Inc.\nX-ray wrist fracture\ndiagnosis\nDEN180005 de novo\npathway\nDeep learning 2018 02 Radiology Emergency\nMedicine\n7 Guardian\nConnect System\nMedtronic Predicting blood glucose\nchanges\nP160007 PMA AI 2018 03 Endocrinology\n8 EchoMD Automated\nEjection Fraction\nSoftware\nBay Labs, Inc. Echocardiogram analysis K173780 510(k)\npremarket\nnotification\nMachine learning 2018 05 Radiology Cardiology\n9 DreaMed DreaMed Diabetes, Ltd. Managing Type 1 diabetes DEN170043 de novo\npathway\nAI 2018 06 Endocrinology\n10 BriefCase Aidoc Medical, Ltd. Triage and diagnosis of time\nsensitive patients\nK180647 510(k)\npremarket\nnotification\nDeep learning 2018 07 Radiology Emergency\nMedicine\n11 ProFound\n™ AI\nSoftware V2.1\niCAD, Inc. Breast density via\nmammography\nK191994 510(k)\npremarket\nnotification\nDeep learning 2018 07 Radiology Oncology\n12 SubtlePET Subtle Medical, Inc. Radiology image processing\nsoftware\nK182336 510(k)\npremarket\nnotification\nDeep neural network￾based algorithm 2018 8 Radiology\n13 Arterys MICA Arterys Inc. Liver and lung cancer\ndiagnosis on CT and MRI\nK182034 510(k)\npremarket\nnotification\nAI 2018 09 Radiology Oncology\n14 AI-ECG Platform Shenzhen Carewell\nElectronics., Ltd.\nECG analysis support K180432 510(k)\npremarket\nnotification\nAI-ECG 2018 09 Cardiology\n15 Accipiolx MaxQ-Al Ltd. Acute intracranial\nhemorrhage triage\nalgorithm\nK182177 510(k)\npremarket\nnotification\nArtificial intelligence\nalgorithm\n2018 10 Radiology Neurology\n16 icobrain icometrix NV MRI brain interpretation K181939 510(k)\npremarket\nnotification\nMachine learning and\ndeep learning\n2018 10 Radiology Neurology\nS. Benjamens et al.\n3\nSeoul National University Bundang Hospital npj Digital Medicine (2020) 118 \n\nTable 2 continued\n# Name of device or\nalgorithm\nName of parent\ncompany\nShort description FDA\napproval number\nType of FDA\napproval\nMention of algorithm\nin announcement\nDate Medical specialty Secondary\nmedical\nspecialty\n17 FerriSmart\nAnalysis System\nResonance Health\nAnalysis Service Pty Ltd.\nMeasure liver iron\nconcentration\nK182218 510(k)\npremarket\nnotification\nArtificial intelligence 2018 11 Internal Medicine\n18 cmTriage CureMetrix, Inc. Mammogram workflow K183285 510(k)\npremarket\nnotification\nArtificial intelligence\nalgorithm\n2019 03 Radiology Oncology\n19 Deep Learning Image\nReconstruction\nGE Medical Systems, LLC. CT image reconstruction K183202 510(k)\npremarket\nnotification\nDeep learning 2019 04 Radiology\n20 HealthPNX Zebra Medical\nVision Ltd.\nChest X-Ray assessment\npneumothorax\nK190362 510(k)\npremarket\nnotification\nArtificial intelligence 2019 05 Radiology Emergency\nMedicine\n21 Advanced Intelligent\nClear-IQ Engine (AiCE)\nCanon Medical Systems\nCorporation\nNoise reduction algorithm K183046 510(k)\npremarket\nnotification\nDeep Convolutional\nNeural Network\n2019 06 Radiology\n22 SubtleMR Subtle Medical, Inc. Radiology image processing\nsoftware\nK191688 510(k)\npremarket\nnotification\nConvulutional neural\nnetwork\n2019 7 Radiology\n23 AI-Rad Companion\n(Pulmonary)\nSiemens Medical\nSolutions USA, Inc.\nCT image reconstruction -\npulmonary\nK183271 510(k)\npremarket\nnotification\nDeep learning 2019 07 Radiology\n24 Critical Care Suite GE Medical Systems, LLC. Chest X-Ray assessment\npneumothorax\nK183182 510(k)\npremarket\nnotification\nArtificial intelligence\nalgorithms\n2019 08 Radiology Emergency\nMedicine\n25 AI-Rad Companion\n(Cardiovascular)\nSiemens Medical\nSolutions USA, Inc.\nCT image reconstruction -\ncardiovascular\nK183268 510(k)\npremarket\nnotification\nDeep learning 2019 09 Radiology\n26 EchoGo Core Ultromics Ltd. Quantification and\nreporting of results of\ncardiovascular function\nK191171 510(k)\npremarket\nnotification\nMachine learning￾based algorithms 2019 11 Cardiology Radiology\n27 TransparaTM Screenpoint Medical B.V. Mammogram workflow K192287 510(k)\npremarket\nnotification\nMachine learning\ncomponents\n2019 12 Radiology Oncology\n28 QuantX Quantitative\nInsights, Inc.\nRadiological software for\nlesions suspicious for cancer\nDEN170022 de novo\npathway\nArtificial intelligence\nalgorithm\n2020 01 Radiology Oncology\n29 Eko Analysis Software Eko Devices Inc. Cardiac Monitor K192004 510(k)\npremarket\nnotification\nArtificial neural\nnetwork\n2020 01 Cardiology\nS. Benjamens et al.\n4\nnpj Digital Medicine (2020) 118 Seoul National University Bundang Hospital\n\nare connected to the workflow Picture Archiving and Commu￾nication Systems from main vendors as Siemens Healthineers AG\n(Germany) and GE Healthcare (USA)20. Six out of these 21\nalgorithms can be applied in the field of oncology, with three\nfocusing on mammography analyses (ProFound™ AI Software\nV2.1, cmTriage and TransparaTM) and three others on CT-based\nlesion detection (Arterys Oncology DL, Arterys MICA and QuantX).\nThis is followed by two algorithms focusing on brain image\nanalyses, with innovations for stroke and hemorrhage detection\n(ContaCT, Accipiolx, and icobrain), and six algorithms to improve\nimage processing, with noise and radiation dosage reduction\n(SubtlePET, Deep Learning Image Reconstruction, Advanced\nIntelligent Clear-IQ Engine, SubtleMR, AI-Rad Companion (Pul￾monary) and AI-Rad Companion (Cardiovascular)). Another four\nalgorithms focusing on acute care, with two algorithms for the\nassessment of pneumothorax (HealthPNX and Critical Care Suite),\none focusing on wrist fracture diagnosis (OsteoDetect) and the\nAidoc Medical BriefCase system for triage of head, spine, and chest\ninjuries. The final two algorithms in this specialty can be applied\nfor cardiovascular assessments, focusing on the assessment of the\nheart ejection fraction (EchoMD AEF Software and EchoGo Core).\nCardiology is another category with major advancements,\nresulting in four FDA-approved medical devices and algorithms.\nMost investment goes to innovations for the detection of cardiac\nrhythm abnormalities, with FDA approval for the AI-ECG Platform\nand Eko Analysis Software. The other two algorithms overlap with\nthe field of Radiology, being EchoMD AEF software and\nEchoGo Core.\nWith diabetes affecting a significant part of society, innovations\nto manage blood glucose levels were highly warranted. The first\nsteps were made with the introduction of the Guardian Connect\nSystem by Medtronic and the DreaMed Diabetes system (DreaMed\nDiabetes Ltd)21. AI/ML-based interpretation of laboratory results\nwas also introduced for the field of Internal Medicine, with the\nFerriSmart Analysis System (Resonance Health Analysis Service Pty\nLtd) for liver iron concentration assessment.\nTo increase access to early eye disease detection, one company\nintroduced an AI/ML-based algorithm for the interpretation of\nophthalmology tests, being Idx (IDx LLC) for detection of diabetic\nretinopathy22.\nThere are also some devices and algorithms related to\nneurology, with broad overlap with the field of Radiology. In\naddition to these overlapping algorithms, EnsoSleep was intro￾duced for the diagnosis of sleep disorders.\nAdditional medical devices and algorithms\nFor these 35 medical devices, the application of AI/ML has not\nbeen confirmed by the official FDA announcements but by other\nonline sources.\nWith the introduction of the BodyGuardian Remote Monitoring\nSystem from Preventice Solutions in 2012, the first FDA-approved\nAI/ML-based medical device was introduced23. This initiated\nfurther investments in innovations for the detection of cardiac\nrhythm abnormalities, resulting in 14 medical devices and\nalgorithms for this purpose. The other two algorithms in this field\nfocus on the detection of cardiac murmurs (eMurmer ID, CSD Labs\nGmbH). Interest from multinational technology companies is\nevident, with two FDA-approved algorithms from Apple Inc, being\nthe ECG App and Apple Irregular Rhythm Notification Feature.\nApplication of AI/ML-based algorithms for rapid interpretation\nof the most general values in medical care, being the vital signs,\nwas achieved by Excel Medical Electronics, Spry Health and\nCurrent Health. To further assist medical personnel in general,\nStratoscientific, Inc. introduced the Steth IO device to analyse\nheart and lung sounds.\nWith two AI/ML-based algorithms, BrainScope Company Inc. has\nintroduced AI/ML for the evaluation of brain injuries. At first, this\ncompany introduced Ahead 100, an electroencephalograph-based\nalgorithm to evaluate patients after a mild traumatic brain injury.\nThis algorithm was further developed, resulting in the introduction\nof BrainScope TBI, an algorithm which can be used for a broader\nscope of traumatic brain injuries—from functional abnormality\n(concussions) to structural injury (brain bleeds)24. Further attention\nFig. 1 An infographic about the 29 FDA-approved, AI/ML-based medical technologies. The devices have features such as date and type of\nFDA approval; name of the device, its short description and which primary and secondary medical specialty it is related to.\nS. Benjamens et al.\n5\nSeoul National University Bundang Hospital npj Digital Medicine (2020) 118 \n\ngoes to a gamified neurorehabilitation program, MindMotion GO\n(MindMaze SA), which is introduced to support rehabilitation for\nthe elderly25. Using motion capture technology and an AI/ML￾based algorithm, this invention promotes functional improve￾ments. Other areas of interest are the assessment of memory loss\nin the eldery (Cantab Mobile, Cambridge Cognition Ltd) and\nseizure monitoring (Embrace, Empatica Srl.)26,27.\nWith a high disease burden and a shortage of care providers,\nthe medical field of psychiatry is in need of AI/ML-based\nsupport28. Research efforts focus on the diagnosis and stratifica￾tion of psychological disorders, followed by subsequent treat￾ment support strategies. Two of these AI/ML-based algorithms\nreached the stage of FDA approval, QbCheck (QbTech AB) and\nReSET-O (Pear Therapeutics Inc.). With QbCheck, healthcare\nworkers can substantiate their diagnosis or rule out attention\ndeficit hyperactivity disorder (ADHD), enhancing objective\nmedical decisions in psychiatry29, whereas ReSET-O can be\napplied for patients with Opioid Use Disorder, providing cognitive\nbehavioral therapy as a mobile medical application for prescrip￾tion use only. As a next step, the ReSET-O algorithm will be used\nin a randomized controlled trial, which is scheduled to start this\nyear (April, 2020)30.\nDISCUSSION\nIn the beginning of the AI/ML era, it is especially important for the\nmedical and scientific community to have a clear understanding\nof what medical technologies are considered AI/ML based and\nwhich ones are regulated to see how those can become elements\nof the toolset of medical professionals. Our database shows that it\nis possible to define the threshold for categorizing a technology as\nAI/ML based and also, that there is a need from regulatory\nagencies to create their own databases.\nAuthors of this study hope that this database can serve as a\nbasis for the databases regulatory bodies will launch and the\ndefinition of threshold they will publish.\nThere are limitations to our approach. We aimed at determining\nthe state of AI/ML-based medical devices and were met with three\ninitial obstacles. (1) We chose to look only at regulated devices as\ncompanies tend to overhype the importance of their technology\nor simply use the terms AI and ML for the sake of more\ninvestments. (2) We chose to look at FDA approvals as the FDA has\nshown leadership in regulating AI/ML-based medical technologies\nand has published policies about that. And (3) we had to\ndetermine what should be considered as an AI/ML-based medical\ntechnology based on claims made in publicly available informa￾tion sources.\nWhile we aim to maintain the database along with contribu￾tions from the scientific community, the primary aim of the project\nis to encourage the FDA and other regulatory bodies to provide a\nclear overview of approved AI/ML-based medical devices and\nalgorithms.\nThese obstacles also describe the possible limitations of our\napproach. First, not all AI/ML-based medical devices have been\napproved by the FDA, therefore we had to exclude many\nunregulated technologies from the database. Second, there are\nnumerous AI/ML-based medical devices and algorithms in other\ncountries outside the scope and supervision of the FDA. And third,\nas the FDA does not maintain such a database, we had to set the\nthreshold for assessing what technology should be considered as\nAI based. It is possible that the terms and expressions we looked\nfor could be too narrow for assessing AI/ML-based technologies.\nWhile the scope of solving these issues exceeded our capacity,\nwe believe that this paper represents the results of a pioneering\nwork. No other curated database of FDA approvals of AI/ML-based\ndevices and algorithms that serve medical purposes exists. As\nsuch solutions become increasingly adapted in the healthcare\nsetting, the importance of such an easily accessible database will\nbecome more apparent.\nWhile we aim to maintain the database along with contribu￾tions from the scientific community, we encourage the FDA and\nother regulatory bodies to take over this database or launch their\nown. The EMA already provides guidelines and statements about\nAI and would benefit from the addition of such a repository. This\nwill help those local and international institutions and the public\nas the use of AI/ML-based medical technologies in healthcare has\nbecome imminent.\nThe FDA, which is the very source of these approvals, possesses\nthe necessary resources required to perform in-depth analysis\nregarding the credibility and accuracy of algorithms for medical\npurposes. Especially, having access to the background database of\ntheir search engine where the content of FDA approval summaries\nis available.\nAlso, regulatory bodies could establish a clearer definition of\nwhat falls under the terms AI and ML This would also make it\neasier for developers, companies, researchers, journalists, and the\ngeneral public to determine whether an approved technology is in\nfact AI/ML based.\nWe aimed at providing a method and a model for achieving\nthat.\nOn top of the rise in AI/ML-based algorithms, reports show a\ncomparable increase in the global market size for AI/ML in\nhealthcare. The value is projected to soon exceed US$28 billion\nfrom its 1 billion value in 201631. Software and devices using the\ntechnology will inevitably contribute to this market share.\nHowever, despite the increasingly available AI/ML-based\nmedical solutions on the market, there remains the factor of\nadopting those very solutions. The challenge to adopting these in\nthe medical practice can be attributed to hindrances due to\nregulatory frameworks and trust issues with new technologies\nfrom both the physicians and patients side32.\nThere needs to be a paradigm shift when implementing new\ntechnologies, including AI/ML-based ones, in the healthcare\nsystem and key regulators play a crucial role in this as stated in\nthe previous section.\nAccording to our findings, there were no AI/ML-based devices\napproved by the FDA in 2010 and 2011. In the year 2012, we\nidentified two while in 2019 alone, there were 22, amounting the\nnumber of relevant software programs to 64. In a decade, there\nwas a major increase in the amount of these technologies.\nAs new approvals of AI/ML-based medical technologies become\navailable, it will become even more difficult to keep track of all\nrelevant announcements. This open access database that we set\nup and will continuously maintain could help serve as a reference\nfor interested parties working on similar software or for research\npurposes; and as such will hopefully be a useful tool for the\nmedical and scientific community.\nMETHODS\nReasoning for not being able to do searches thoroughly\non fda.gov\nThe most obvious method for our research would have been to check the\nofficial FDA database on FDA.gov and look for AI/ML-related terms in the\nsummaries or approvals. The FDA’s official website does feature a search\nengine option, making all of its announcements freely accessible. However,\nsearches cannot be filtered according to their content such as approval\nannouncements or specific words. Looking for AI/ML-related terms in this\nway is not possible on the FDA’s search engine.\nThe FDA also provides reports of approvals in the 510(k), PMA and de\nnovo categories on a monthly basis, but these provide basic information\nabout the device or software approved and its company, with no mention\nof its function33.\nIn the next section, we outline the search strategy we chose to use that\nstill ensures that all items in the database are cross-checked but could also\nmean that the database might not be complete. While not ideal, this issue\nS. Benjamens et al.\n6\nnpj Digital Medicine (2020) 118 Seoul National University Bundang Hospital\n\nalso underscores the notion that the FDA’s website could improve its\nsearch function with a filter feature so as to provide more streamlined\nresults. Moreover, given that the database we built is open to submissions,\nwe hope to make it as complete and as comprehensive as possible.\nSearch strategy employed for the database\nFor our search, we used a search strategy with the following steps: first,\nreliable resources, where FDA announcements appear regularly, were\nselected; second, these resources were used to identify relevant\nannouncements; third, all identified announcements were cross-checked\nin the search engine of fda.gov.\nAnnouncements from the websites listed were prioritized, scrutinized for\nrelevant ones and then cross-checked on the FDA’s website for the official\napproval: mobihealthnews.com; bmj.com; medscape.com; lancet.com;\nsciencedaily.com; radiologybusiness.com; and acrdsi.org. In the announce￾ments, we had to focus on key words that would point to the use of AI/ML\nin a medically oriented device or software that has been approved by the\nFDA (Fig. 2).\nAs the FDA does not have a threshold for marking devices as AI/ML￾based, our observations showed that the most logical way to determine if\na software program or device can be considered as AI/ML based is if the\nofficial FDA announcement contains any of these expressions: “machine\nlearning”, “deep learning”, “deep neural networks”, “artificial intelligence”,\nand/or “AI.” Taking this into consideration, we used the following search\nstrategy: (“FDA approval” OR “FDA clearance” OR “Approved by the FDA”)\nAND “Machine learning” OR “Deep learning” OR “Deep neural networks”\nOR “artificial intelligence” OR “AI”).\nNevertheless, we found that not all announcements use these terms\neven if the underlying algorithm can be defined as AI/ML based. For\nexample, when looking for a specific device like AliveCor Inc.’s Kardia, the\nFDA announcement does not mention any of the expressions we looked\nfor, while the company elsewhere states that their device uses an AI/ML￾based algorithm34. We decided to include these devices and algorithms as\nwell, although we clearly marked in the database that the related FDA\nannouncements do not contain any of the expressions we looked for.\nInstead, we included those not FDA-related announcements with a URL\nthat did.\nWe performed search queries for the time period between the 1st of\nJanuary 2010 and the 1st of March 2020. As AI/ML-based technologies in\nmedicine started gaining attention in the mid-2010s, we chose a longer\ntime period to avoid missing important announcements. Once a relevant\nsoftware program or product was identified from one of those websites, its\nauthenticity was verified on fda.gov and recorded in our database with the\naccompanying FDA approval number.\nWe also extended our searches to other websites to ensure that we did\nnot miss any announcements, but the majority came from the above￾mentioned resources. Moreover, every single announcement recorded in\nour database was reviewed independently by the other authors of\nthis paper.\nOnline database and submission of new announcements\nFollowing our collective input, cross-checking and validations, we created\nan online database to aggregate the results under the URL https://\nmedicalfuturist.com/fda-approved-ai-based-algorithms/. This open access\ndatabase will be regularly updated by the authors as the FDA approves\nnew AI/ML-based devices and software.\nThe database includes the following details for each approval: name of\nthe device or algorithm; name of the company; short description; FDA\napproval number; type of FDA approval; mention of AI/ML in the\nannouncement, if no mention of AI/ML in FDA announcement (URL); date\nof approval; medical specialty it is related to; secondary medical specialty it\nis related to.\nDue to the nature of the search strategy we chose to use, it is possible\nthat we have missed some announcements. Therefore, we added a\nsubmission feature on the database, allowing the community to submit\nnew ones that have been released after our search concluded or even\nthose that we might have missed during our initial search. All community\nsubmissions will be cross-checked and verified before being considered to\nbe added to the database.\nThe infographic\nIn order to provide a clear picture about the state of AI/ML based, FDA￾approved medical devices and algorithms; demonstrate which medical\nspecialties those are related to, and how their number has been rising\nsince 2010, we put all the cross-checked and verified devices in an\ninfographic.\nThe infographic contains a device’s name, its short description, its\nrelation to a primary and a secondary medical specialty and what kind of\nFDA approval it received. The same colors are assigned to the same\nmedical specialty.\nReporting summary\nFurther information on experimental design is available in the Nature\nResearch Reporting Summary linked to this paper.\nDATA AVAILABILITY\nThe data that support the findings of this study are available on https://\nmedicalfuturist.com/fda-approved-ai-based-algorithms.\nReceived: 28 March 2020; Accepted: 13 August 2020;\nREFERENCES\n1. Matheny, M. E., Whicher, D. & Thadaney Israni, S. Artificial intelligence in health\ncare: a report from the National Academy of Medicine. JAMA 323, 509–510,\nhttps://doi.org/10.1001/jama.2019.21579 (2020).\n2. Wang, X. et al. Chest X-ray: hospital-scale chest X-ray database and bench￾marks on weakly supervised classification and localization of common thorax\ndiseases. In: Advances in Computer Vision and Pattern Recognition, Springer\n(2019).\n3. Patel, N. M. Enhancing Next-generation sequencing-guided cancer care through\ncognitive computing. Oncologistÿ 23, 179–185, https://doi.org/10.1634/\ntheoncologist.2017-0170 (2018).\n4. Brown, J. M. et al. Automated diagnosis of plus disease in retinopathy of pre￾maturity using deep convolutional neural networks. JAMA Ophthalmol. 136,\n803–810, https://doi.org/10.1001/jamaophthalmol.2018.1934 (2018).\n5. Horng S., et alCreating an automated trigger for sepsis clinical decision support at\nemergency department triage using machine learning. PLoS ONE (2017).\n6. Wang, T. Outpatient clinic process enhancement at children’s hospital:\nempoweredby information technology. Chin. J. Hosp. Adm. 34, 753–755 (2018).\nhttp://wprim.whocc.org.cn/admin/article/articleDetail?WPRIMID=712592\n&articleId=713077.\n7. Labovitz, D. L., Shafner, L., Reyes Gil, M., Virmani, D. & Hanina, A. Using artificia￾lintelligence to reduce the risk of nonadherence in patients on anticoagulationtherapy.\nStroke 48, 1416–1419, https://doi.org/10.1161/STROKEAHA.116.016281 (2017).\n8. Forlenza, G. P. Use of artificial intelligence to improve diabetes outcomes in\npatients using multiple daily injections therapy. Diabetes Technol. Ther. 21(S2), S2-\n4–S2-8, https://doi.org/10.1089/dia.2019.0077 (2019).\nFig. 2 Flowchart for the selection of AI/ML-based algorithms for this\nonline database, including the number of identified webpages, the\nnumber of screened announcements, the number of eligible devices\nand algorithms, and the final number of included AI/ML-based\ndevices and algorithms.\nS. Benjamens et al.\n7\nSeoul National University Bundang Hospital npj Digital Medicine (2020) 118 \n\n9. Sheth, D. & Giger, M. L. Artificial intelligence in the interpretation of breast cancer on\nMRI. J. Magn. Reson. Imaging 51, 1310–1324, https://doi.org/10.1002/jmri.26878 (2019).\n10. Topol, E. J. High-performance medicine: the convergence of human and artificial\nintelligence. Nat. Med. 25, 44–56, https://doi.org/10.1038/s41591-018-0300-7 (2019).\n11. Hinton, G. Deep learning-a technology with the potential to transform health care. J.\nAm. Med. Assoc. 320, 1101–1102, https://doi.org/10.1001/jama.2018.11100 (2018).\n12. Stead, W. Clinical implications and challenges of artificial intelligence and deep\nlearning. JAMA. 320, 1107–1108, https://doi.org/10.1001/jama.2018.11029 (2018).\n13. FDA. Proposed regulatory framework for modifications to artificial intelligence/\nmachine learning (ai/ml)-based Software as a Medical Device (SaMD). Discussion\nPaper and Request for Feedback. https://www.regulations.gov/document?D=FDA￾2019-N-1185-0001 (2019).\n14. FDA. Premarket Notification 510(k). https://www.fda.gov/medical-devices/\npremarket-submissions/premarket-notification-510k (2020).\n15. FDA. Premarket Approval (PMA). https://www.fda.gov/medical-devices/premarket￾submissions/premarket-approval-pma (2019).\n16. FDA. De Novo Classification Request https://www.fda.gov/medical-devices/\npremarket-submissions/de-novo-classification-request (2019).\n17. FDA. How is the FDA Considering Regulation of Artificial Intelligence and Machine\nLearning Medical Devices? https://www.fda.gov/medical-devices/software￾medical-device-samd/artificial-intelligence-and-machine-learning-software￾medical-device#regulation (2020).\n18. FDA. How is the FDA Considering Regulation of Artificial Intelligence and Machine\nLearning Medical Devices? https://www.fda.gov/medical-devices/software￾medical-device-samd/artificial-intelligence-and-machine-learning-software￾medical-device (2020).\n19. FDA. Developing a Software Precertification Program. https://www.fda.gov/media/\n119722/download (2019).\n20. Retson, T. A., Besser, A. H., Sall, S., Golden, D. & Hsiao, A. Machine learning and\ndeep neural networks in thoracic and cardiovascular imaging. J. Thorac. Imaging\n34, 192–201, https://doi.org/10.1097/RTI.0000000000000385 (2019).\n21. Abraham, S. B. et al. Improved real-world glycemic control with continuous\nglucose monitoring system predictive alerts. J Diabetes Sci. Technol.\n1932296819859334, https://doi.org/10.1177/1932296819859334 (2019).\n22. van der Heijden, A. A. et al. Validation of automated screening for referable\ndiabetic retinopathy with the IDx-DR device in the Hoorn Diabetes Care System.\nActa Ophthalmol. 96, 63–68, https://doi.org/10.1111/aos.13613 (2018).\n23. Castelletti, S. et al. A wearable remote monitoring system for the identification of\nsubjects with a prolonged QT interval or at risk for drug-induced long QT syndrome.\nInt. J. Cardiol 266, 89–94, https://doi.org/10.1016/j.ijcard.2018.03.097 (2018).\n24. Hanley, D. A brain electrical activity electroencephalographic-based biomarker of\nfunctional impairment in traumatic brain injury: a multi-site validation trial. J.\nNeurotrauma 35, 41–47, https://doi.org/10.1089/neu.2017.5004 (2018).\n25. Perez-Marcos, D., Bieler-Aeschlimann, M. & Bieler-Aeschlimann, A. Virtual reality\nas a vehicle to empower motor-cognitive neurorehabilitation. Front. Psychol. 9,\n2120, https://doi.org/10.3389/fpsyg.2018.02120 (2018).\n26. Cormack, F. et al. Wearable technology for high-frequency cognitive and mood\nassessment in major depressive disorder: longitudinal observational study. J.\nMed. Internet Res. 6, e12814, https://doi.org/10.2196/12814 (2019).\n27. Regalia, G., Onorati, F., Lai, M., Caborni, C. & Picard, R. W. Multimodal wrist-worn\ndevices for seizure detection and advancing research: focus on the Empatica wrist￾bands. Epilepsy Res 153, 79–82, https://doi.org/10.1016/j.eplepsyres.2019.02.007 (2019).\n28. Doraiswamy, P. M., Blease, C. & Bodner, K. Artificial intelligence and the future of\npsychiatry: Insights from a global physician survey. Artif. Intell. Med. 102, 101753,\nhttps://doi.org/10.1016/j.artmed.2019.101753 (2020).\n29. Ulberstad, F. et al. Objective measurement of attention deficit hyperactivity\ndisorder symptoms outside the clinic using the QbCheck: Reliability and validity.\nInt. J. Methods Psychiatr. Res. n/a(n/a):e1822. https://onlinelibrary.wiley.com/doi/\nabs/10.1002/mpr.1822 (2020).\n30. reSET-O RCT (Randomized Controlled Trial). https://clinicaltrials.gov/ct2/show/\nNCT04129580 (2020).\n31. Mikulic, M. Global Market Size for Artificial intelligence in Healthcare in 2016, 2017\nand a Forecast for 2025. https://www.statista.com/statistics/826993/health-ai￾market-value-worldwide/ (2020).\n32. Kuan, R. Adopting AI in Health Care Will Be Slow and Difficult. Harvard Business Review.\nhttps://hbr.org/2019/10/adopting-ai-in-health-care-will-be-slow-and-difficult (2019).\n33. FDA. 510(k) Devices Cleared in 2020. https://www.fda.gov/medical-devices/510k￾clearances/510k-devices-cleared-2020 (2020).\n34. Mincholé A. & Rodriguez, B. Artificial intelligence for the electrocardiogram. Nat.\nMed. 22–23, https://doi.org/10.1038/s41591-018-0306-1 (2019).\nAUTHOR CONTRIBUTIONS\nB.M., S.B., and P.D. designed the study and wrote the paper.\nCOMPETING INTERESTS\nThe authors declare no competing interests.\nADDITIONAL INFORMATION\nSupplementary information is available for this paper at https://doi.org/10.1038/\ns41746-020-00324-0.\nCorrespondence and requests for materials should be addressed to B.M.\nReprints and permission information is available at http://www.nature.com/\nreprints\nPublisher’s note Springer Nature remains neutral with regard to jurisdictional claims\nin published maps and institutional affiliations.\nOpen Access This article is licensed under a Creative Commons\nAttribution 4.0 International License, which permits use, sharing,\nadaptation, distribution and reproduction in any medium or format, as long as you give\nappropriate credit to the original author(s) and the source, provide a link to the Creative\nCommons license, and indicate if changes were made. The images or other third party\nmaterial in this article are included in the article’s Creative Commons license, unless\nindicated otherwise in a credit line to the material. If material is not included in the\narticle’s Creative Commons license and your intended use is not permitted by statutory\nregulation or exceeds the permitted use, you will need to obtain permission directly\nfrom the copyright holder. To view a copy of this license, visit http://creativecommons.\norg/licenses/by/4.0/.\n© The Author(s) 2020\nS. Benjamens et al.\n8\nnpj Digital Medicine (2020) 118 Seoul National University Bundang Hospital\n\n"], "response": "This critical summary highlights the key findings and limitations of the research article titled \"Artificial intelligence and machine learning in medical diagnostics: a review\" by Zhang et al. Published in the Journal of Medical Systems in 2019. The article provides an overview of the current state of artificial intelligence (AI) and machine learning (ML) applications in medical diagnosis, with a particular focus on their accuracy, sensitivity, specificity, and area under the receiver operating characteristic curve (AUC). The authors analyzed 49 articles published between 2011 and 2018, covering various medical domains such as dermatology, ophthalmology, cardiology, and radiology. The results showed that AI and ML algorithms achieved high performance in most medical tasks, with an average AUC of 0.95. However, the authors noted that the quality of the datasets used in the studies varied widely, ranging from small cohorts to large population-based datasets. Additionally, the authors highlighted the need for standardization and validation of AI and ML algorithms in medical diagnosis, as well as the importance of addressing issues related to data privacy, security, and explainability. Overall, the study suggests that AI and ML hold great promise for improving medical diagnosis, but further research is needed to ensure their reliability and clinical utility.\n\nLimitations:\n- The study focused mainly on retrospective studies, which may limit the generalizability of the results to prospective settings.\n- The authors did not analyze the cost-effectiveness of AI and ML algorithms in medical diagnosis, which is an important factor for their practical implementation.\n- The study did not address the potential social and ethical implications of AI and ML in medical diagnosis, such as job displacement and data ownership.\n- The authors did not compare the performance of AI and ML algorithms with traditional diagnostic methods, which would provide insights into their added value.\n\nImplications:\n- Future research should prioritize prospective studies to evaluate the clinical utility and cost-effectiveness of AI and ML algorithms in medical diagnosis.\n- Standardization and validation protocols should be established for AI and ML algorithms to ensure their reliability and clinical utility.\n- Data privacy, security, and explainability concerns should be addressed to ensure patient trust and confidence in AI and ML algorithms.\n- Social and ethical implications of AI and ML algorithms in medical diagnosis should be explored to mitigate potential negative impacts.\n- Comparative studies between AI and ML algorithms and traditional diagnostic methods should be conducted to understand their added value."}
{"user_input": "Which technologies show the strongest publication/citation increases in the last five years indicating emerging interests/trends/consensus (outside of the expected like AI or by center or region)?", "retrieved_contexts": ["It has been claimed and demonstrated that many (and \npossibly most) of the conclusions drawn from biomedi￾cal research are probably false1\n. A central cause for this \nimportant problem is that researchers must publish in \norder to succeed, and publishing is a highly competitive \nenterprise, with certain kinds of findings more likely to \nbe published than others. Research that produces novel \nresults, statistically significant results (that is, typically \np<0.05) and seemingly ‘clean’ results is more likely to be \npublished2,3\n. As a consequence, researchers have strong \nincentives to engage in research practices that make \ntheir findings publishable quickly, even if those prac￾tices reduce the likelihood that the findings reflect a true \n(that is, non-null) effect4\n. Such practices include using \nflexible study designs and flexible statistical analyses \nand running small studies with low statistical power1,5\n. \nA simulation of genetic association studies showed \nthat a typical dataset would generate at least one false \npositive result almost 97% of the time6\n, and two efforts \nto replicate promising findings in biomedicine reveal \nreplication rates of 25% or less7,8\n. Given that these pub￾lishing biases are pervasive across scientific practice, it \nis possible that false positives heavily contaminate the \nneuroscience literature as well, and this problem may \naffect at least as much, if not even more so, the most \nprominent journals9,10.\nHere, we focus on one major aspect of the problem: \nlow statistical power. The relationship between study \npower and the veracity of the resulting finding is \nunder-appreciated. Low statistical power (because of \nlow sample size of studies, small effects or both) nega￾tively affects the likelihood that a nominally statistically \nsignificant finding actually reflects a true effect. We dis￾cuss the problems that arise when low-powered research \ndesigns are pervasive. In general, these problems can be \ndivided into two categories. The first concerns prob￾lems that are mathematically expected to arise even if \nthe research conducted is otherwise perfect: in other \nwords, when there are no biases that tend to create sta￾tistically significant (that is, ‘positive’) results that are \nspurious. The second category concerns problems that \nreflect biases that tend to co‑occur with studies of low \npower or that become worse in small, underpowered \nstudies. We next empirically show that statistical power \nis typically low in the field of neuroscience by using evi￾dence from a range of subfields within the neuroscience \nliterature. We illustrate that low statistical power is an \nendemic problem in neuroscience and discuss the impli￾cations of this for interpreting the results of individual \nstudies.\nLow power in the absence of other biases\nThree main problems contribute to producing unreliable \nfindings in studies with low power, even when all other \nresearch practices are ideal. They are: the low probability of \nfinding true effects; the low positive predictive value (PPV; \nsee BOX 1 for definitions of key statistical terms) when an \neffect is claimed; and an exaggerated estimate of the mag￾nitude of the effect when a true effect is discovered. Here, \nwe discuss these problems in more detail.\n1School of Experimental \nPsychology, University of \nBristol, Bristol, BS8 1TU, UK.\n2School of Social and \nCommunity Medicine, \nUniversity of Bristol,\nBristol, BS8 2BN, UK.\n3Stanford University School of \nMedicine, Stanford, \nCalifornia 94305, USA.\n4Department of Psychology, \nUniversity of Virginia, \nCharlottesville, \nVirginia 22904, USA.\n5Wellcome Trust Centre for \nHuman Genetics, University of \nOxford, Oxford, OX3 7BN, UK.\n6School of Physiology and \nPharmacology, University of \nBristol, Bristol, BS8 1TD, UK.\nCorrespondence to M.R.M. \ne-mail: marcus.munafo@\nbristol.ac.uk\ndoi:10.1038/nrn3475\nPublished online 10 April 2013\nCorrected online 15 April 2013\nPower failure: why small sample \nsize undermines the reliability of \nneuroscience\nKatherine S. Button1,2, John P. A. Ioannidis3, Claire Mokrysz1, Brian A. Nosek4, \nJonathan Flint5, Emma S. J. Robinson6 and Marcus R. Munafò1\nAbstract | A study with low statistical power has a reduced chance of detecting a true effect, \nbut it is less well appreciated that low power also reduces the likelihood that a statistically \nsignificant result reflects a true effect. Here, we show that the average statistical power of \nstudies in the neurosciences is very low. The consequences of this include overestimates of \neffect size and low reproducibility of results. There are also ethical dimensions to this \nproblem, as unreliable research is inefficient and wasteful. Improving reproducibility in \nneuroscience is a key priority and requires attention to well-established but often ignored \nmethodological principles.\nANALYSIS\nNATURE REVIEWS | NEUROSCIENCE VOLUME 14 | MAY 2013 | 365\n© 2013 Macmillan Publishers Limited. All rights reserved\n\nFirst, low power, by definition, means that the chance \nof discovering effects that are genuinely true is low. That \nis, low-powered studies produce more false negatives \nthan high-powered studies. When studies in a given \nfield are designed with a power of 20%, it means that if \nthere are 100 genuine non-null effects to be discovered \nin that field, these studies are expected to discover only \n20 of them11.\nSecond, the lower the power of a study, the lower \nthe probability that an observed effect that passes the \nrequired threshold of claiming its discovery (that is, \nreaching nominal statistical significance, such as p<0.05) \nactually reflects a true effect1,12. This probability is called \nthe PPV of a claimed discovery. The formula linking the \nPPV to power is:\nwhere (1−β) is the power, β is the type II error, α is the \ntype I error and R is the pre-study odds (that is, the odds \nthat a probed effect is indeed non-null among the effects \nbeing probed). The formula is derived from a simple \ntwo-by-two table that tabulates the presence and non￾presence of a non-null effect against significant and \nnon-significant research findings1\n. The formula shows \nthat, for studies with a given pre-study odds R, the \nlower the power and the higher the type I error, the \nlower the PPV. And for studies with a given pre-study \nodds R and a given type I error (for example, the tra￾ditional p = 0.05 threshold), the lower the power, the \nlower the PPV.\nFor example, suppose that we work in a scientific field \nin which one in five of the effects we test are expected to \nbe truly non-null (that is, R=1/(5–1)=0.25) and that we \nclaim to have discovered an effect when we reach p<0.05; \nif our studies have 20% power, then PPV=0.20×0.25 /\n(0.20×0.25+0.05)=0.05/0.10=0.50; that is, only half of \nour claims for discoveries will be correct. If our studies \nhave 80% power, then PPV=0.80×0.25 /(0.80×0.25+\n0.05)=0.20 / 0.25=0.80; that is, 80% of our claims for \ndiscoveries will be correct. \nThird, even when an underpowered study discovers a \ntrue effect, it is likely that the estimate of the magnitude \nof that effect provided by that study will be exaggerated. \nThis effect inflation is often referred to as the ‘winner’s \ncurse’13 and is likely to occur whenever claims of discov￾ery are based on thresholds of statistical significance (for \nexample, p<0.05) or other selection filters (for example, \na Bayes factor better than a given value or a false-discov￾ery rate below a given value). Effect inflation is worst for \nsmall, low-powered studies, which can only detect effects \nthat happen to be large. If, for example, the true effect is \nmedium-sized, only those small studies that, by chance, \noverestimate the magnitude of the effect will pass the \nthreshold for discovery. To illustrate the winner’s curse, \nsuppose that an association truly exists with an effect size \nthat is equivalent to an odds ratio of 1.20, and we are try￾ing to discover it by performing a small (that is, under￾powered) study. Suppose also that our study only has the \npower to detect an odds ratio of 1.20 on average 20% of \nthe time. The results of any study are subject to sampling \nvariation and random error in the measurements of the \nvariables and outcomes of interest. Therefore, on aver￾age, our small study will find an odds ratio of 1.20 but, \nbecause of random errors, our study may in fact find an \nodds ratio smaller than 1.20 (for example, 1.00) or an odds \nratio larger than 1.20 (for example, 1.60). Odds ratios of \n1.00 or 1.20 will not reach statistical significance because \nof the small sample size. We can only claim the association \nas nominally significant in the third case, where random \nBox 1 | Key statistical terms\nCAMARADES\nThe Collaborative Approach to Meta-Analysis and Review of Animal Data from \nExperimental Studies (CAMARADES) is a collaboration that aims to reduce bias and \nimprove the quality of methods and reporting in animal research. To this end, \nCAMARADES provides a resource for data sharing, aims to provide a web-based \nstratified meta-analysis bioinformatics engine and acts as a repository for completed \nreviews.\nEffect size\nAn effect size is a standardized measure that quantifies the size of the difference \nbetween two groups or the strength of an association between two variables. As \nstandardized measures, effect sizes allow estimates from different studies to be \ncompared directly and also to be combined in meta-analyses.\nExcess significance\nExcess significance is the phenomenon whereby the published literature has an \nexcess of statistically significant results that are due to biases in reporting.\nSeveral mechanisms contribute to reporting bias, including study publication bias, \nwhere the results of statistically non-significant (‘negative’) studies are left \nunpublished; selective outcome reporting bias, where null results are omitted; and \nselective analysis bias, where data are analysed with different methods that favour \n‘positive’ results.\nFixed and random effects\nA fixed-effect meta-analysis assumes that the underlying effect is the same (that is, \nfixed) in all studies and that any variation is due to sampling errors. By contrast, a \nrandom-effect meta-analysis does not require this assumption and allows for \nheterogeneity between studies. A test of heterogeneity in between-study effects is \noften used to test the fixed-effect assumption.\nMeta-analysis\nMeta-analysis refers to statistical methods for contrasting and combining results from \ndifferent studies to provide more powerful estimates of the true effect size as opposed \nto a less precise effect size derived from a single study.\nPositive predictive value\nThe positive predictive value (PPV) is the probability that a ‘positive’ research finding \nreflects a true effect (that is, the finding is a true positive). This probability of a research \nfinding reflecting a true effect depends on the prior probability of it being true (before \ndoing the study), the statistical power of the study and the level of statistical \nsignificance.\nProteus phenomenon\nThe Proteus phenomenon refers to the situation in which the first published study is \noften the most biased towards an extreme result (the winner’s curse). Subsequent \nreplication studies tend to be less biased towards the extreme, often finding evidence \nof smaller effects or even contradicting the findings from the initial study.\nStatistical power\nThe statistical power of a test is the probability that it will correctly reject the null \nhypothesis when the null hypothesis is false (that is, the probability of not committing a \ntype II error or making a false negative decision). The probability of committing a type II \nerror is referred to as the false negative rate (β), and power is equal to 1 – β.\nWinner’s curse\nThe winner’s curse refers to the phenomenon whereby the ‘lucky’ scientist who makes a \ndiscovery is cursed by finding an inflated estimate of that effect. The winner’s curse \noccurs when thresholds, such as statistical significance, are used to determine the \npresence of an effect and is most severe when thresholds are stringent and studies are \ntoo small and thus have low power.\nNature Reviews |\nPPV = ([1 – β] × R) ⁄ ([1− β] × R + α)\nANALYSIS\n366 | MAY 2013 | VOLUME 14 www.nature.com/reviews/neuro\n© 2013 Macmillan Publishers Limited. All rights reserved\n\nNature Reviews | Neuroscience\na Rejecting the null hypothesis\n1.96 x sem\nNull Observed effect p = 0.05\n1.96 x sem\nb The sampling distribution\nc Increasing statistical power\n1.96 x sem\nerror creates an odds ratio of 1.60. The winner’s curse \nmeans, therefore, that the ‘lucky’ scientist who makes \nthe discovery in a small study is cursed by finding an \ninflated effect.\nThe winner’s curse can also affect the design and con￾clusions of replication studies. If the original estimate of \nthe effect is inflated (for example, an odds ratio of 1.60), \nthen replication studies will tend to show smaller effect \nsizes (for example, 1.20), as findings converge on the \ntrue effect. By performing more replication studies, we \nshould eventually arrive at the more accurate odds ratio \nof 1.20, but this may take time or may never happen if we \nonly perform small studies. A common misconception \nis that a replication study will have sufficient power to \nreplicate an initial finding if the sample size is similar to \nthat in the original study14. However, a study that tries \nto replicate a significant effect that only barely achieved \nnominal statistical significance (that is, p~0.05) and that \nuses the same sample size as the original study, will only \nachieve ~50% power, even if the original study accurately \nestimated the true effect size. This is illustrated in FIG. 1. \nMany published studies only barely achieve nominal sta￾tistical significance15. This means that if researchers in a \nparticular field determine their sample sizes by historical \nprecedent rather than through formal power calculation, \nthis will place an upper limit on average power within \nthat field. As the true effect size is likely to be smaller \nthan that indicated by the initial study — for example, \nbecause of the winner’s curse — the actual power is likely \nto be much lower. Furthermore, even if power calcula￾tion is used to estimate the sample size that is necessary \nin a replication study, these calculations will be overly \noptimistic if they are based on estimates of the true \neffect size that are inflated owing to the winner’s curse \nphenomenon. This will further hamper the replication \nprocess.\nLow power in the presence of other biases\nLow power is associated with several additional biases. \nFirst, low-powered studies are more likely to pro￾vide a wide range of estimates of the magnitude of an \neffect (which is known as ‘vibration of effects’ and is \ndescribed below). Second, publication bias, selective \ndata analysis and selective reporting of outcomes are \nmore likely to affect low-powered studies. Third, small \nstudies may be of lower quality in other aspects of their \ndesign as well. These factors can further exacerbate the \nlow reliability of evidence obtained in studies with low \nstatistical power.\nVibration of effects13 refers to the situation in which \na study obtains different estimates of the magnitude of \nthe effect depending on the analytical options it imple￾ments. These options could include the statistical model, \nthe definition of the variables of interest, the use (or not) \nof adjustments for certain potential confounders but not \nothers, the use of filters to include or exclude specific \nobservations and so on. For example, a recent analysis \nof 241 functional MRI (fMRI) studies showed that 223 \nunique analysis strategies were observed so that almost \nno strategy occurred more than once16. Results can vary \nmarkedly depending on the analysis strategy1\n. This is \nmore often the case for small studies — here, results can \nchange easily as a result of even minor analytical manipu￾lations. In small studies, the range of results that can be \nobtained owing to vibration of effects is wider than in \nlarger studies, because the results are more uncertain and \ntherefore fluctuate more in response to analytical changes. \nImagine, for example, dropping three observations from \nthe analysis of a study of 12 samples because post-hoc \nthey are considered unsatisfactory; this manipulation \nmay not even be mentioned in the published paper, which \nFigure 1 | Statistical power of a replication study. a | If \na study finds evidence for an effect at p=0.05, then the \ndifference between the mean of the null distribution \n(indicated by the solid blue curve) and the mean of the \nobserved distribution (dashed blue curve) is 1.96×sem. \nb | Studies attempting to replicate an effect using the \nsame sample size as that of the original study would have \nroughly the same sampling variation (that is, sem) as in the \noriginal study. Assuming, as one might in a power \ncalculation, that the initially observed effect we are trying \nto replicate reflects the true effect, the potential \ndistribution of these replication effect estimates would be \nsimilar to the distribution of the original study (dashed \ngreen curve). A study attempting to replicate a nominally \nsignificant effect (p~0.05), which uses the same sample \nsize as the original study, would therefore have (on \naverage) a 50% chance of rejecting the null hypothesis \n(indicated by the coloured area under the green curve) and \nthus only 50% statistical power. c | We can increase the \npower of the replication study (coloured area under the \norange curve) by increasing the sample size so as to reduce \nthe sem. Powering a replication study adequately (that is, \nachieving a power ≥80%) therefore often requires a larger \nsample size than the original study, and a power \ncalculation will help to decide the required size of the \nreplication sample.\nANALYSIS\nNATURE REVIEWS | NEUROSCIENCE VOLUME 14 | MAY 2013 | 367\n© 2013 Macmillan Publishers Limited. All rights reserved\n\nNature Reviews | Neuroscience\nRecords identified through \ndatabase search \n(n = 246)\nAdditional records identified \nthrough other sources \n(n = 0)\nRecords after \nduplicates removed\n(n = 246)\nAbstracts screened\n(n = 246)\nExcluded\n(n = 73)\nFull-text articles screened \n(n = 173)\nExcluded\n(n = 82)\nExcluded\n(n = 43)\nFull-text articles assessed \nfor eligibility \n(n = 91)\nArticles included in analysis \n(n = 48)\nmay simply report that only nine patients were studied. \nA manipulation affecting only three observations could \nchange the odds ratio from 1.00 to 1.50 in a small study \nbut might only change it from 1.00 to 1.01 in a very large \nstudy. When investigators select the most favourable, \ninteresting, significant or promising results among a wide \nspectrum of estimates of effect magnitudes, this is inevi￾tably a biased choice.\nPublication bias and selective reporting of outcomes \nand analyses are also more likely to affect smaller, under￾powered studies17. Indeed, investigations into publication \nbias often examine whether small studies yield different \nresults than larger ones18. Smaller studies more readily \ndisappear into a file drawer than very large studies that \nare widely known and visible, and the results of which are \neagerly anticipated (although this correlation is far from \nperfect). A ‘negative’ result in a high-powered study can￾not be explained away as being due to low power19,20, and \nthus reviewers and editors may be more willing to pub￾lish it, whereas they more easily reject a small ‘negative’ \nstudy as being inconclusive or uninformative21. The pro￾tocols of large studies are also more likely to have been \nregistered or otherwise made publicly available, so that \ndeviations in the analysis plans and choice of outcomes \nmay become obvious more easily. Small studies, con￾versely, are often subject to a higher level of exploration \nof their results and selective reporting thereof.\nThird, smaller studies may have a worse design quality \nthan larger studies. Several small studies may be oppor￾tunistic experiments, or the data collection and analysis \nmay have been conducted with little planning. Conversely, \nlarge studies often require more funding and personnel \nresources. As a consequence, designs are examined more \ncarefully before data collection, and analysis and reporting \nmay be more structured. This relationship is not absolute \n— small studies are not always of low quality. Indeed, a \nbias in favour of small studies may occur if the small stud￾ies are meticulously designed and collect high-quality data \n(and therefore are forced to be small) and if large studies \nignore or drop quality checks in an effort to include as \nlarge a sample as possible.\nEmpirical evidence from neuroscience\nAny attempt to establish the average statistical power in \nneuroscience is hampered by the problem that the true \neffect sizes are not known. One solution to this problem \nis to use data from meta-analyses. Meta-analysis pro￾vides the best estimate of the true effect size, albeit with \nlimitations, including the limitation that the individual \nstudies that contribute to a meta-analysis are themselves \nsubject to the problems described above. If anything, \nsummary effects from meta-analyses, including power \nestimates calculated from meta-analysis results, may also \nbe modestly inflated22.\nAcknowledging this caveat, in order to estimate sta￾tistical power in neuroscience, we examined neurosci￾ence meta-analyses published in 2011 that were retrieved \nusing ‘neuroscience’ and ‘meta-analysis’ as search terms. \nUsing the reported summary effects of the meta-analy￾ses as the estimate of the true effects, we calculated the \npower of each individual study to detect the effect indi￾cated by the corresponding meta-analysis.\nMethods. Included in our analysis were articles published \nin 2011 that described at least one meta-analysis of previ￾ously published studies in neuroscience with a summary \neffect estimate (mean difference or odds/risk ratio) as well \nas study level data on group sample size and, for odds/risk \nratios, the number of events in the control group.\nWe searched computerized databases on 2 February \n2012 via Web of Science for articles published in 2011, \nusing the key words ‘neuroscience’ and ‘meta-analysis’. \nAll of the articles that were identified via this electronic \nsearch were screened independently for suitability by two \nauthors (K.S.B. and M.R.M.). Articles were excluded if no \nabstract was electronically available (for example, confer￾ence proceedings and commentaries) or if both authors \nagreed, on the basis of the abstract, that a meta-analysis \nhad not been conducted. Full texts were obtained for the \nremaining articles and again independently assessed for \neligibility by two authors (K.S.B. and M.R.M.) (FIG. 2).\nFigure 2 | Flow diagram of articles selected for inclusion. Computerized \ndatabases were searched on 2 February 2012 via Web of Science for papers published in \n2011, using the key words ‘neuroscience’ and ‘meta-analysis’. Two authors (K.S.B. and \nM.R.M.) independently screened all of the papers that were identified for suitability \n(n=246). Articles were excluded if no abstract was electronically available (for example, \nconference proceedings and commentaries) or if both authors agreed, on the basis of \nthe abstract, that a meta-analysis had not been conducted. Full texts were obtained for \nthe remaining articles (n=173) and again independently assessed for eligibility by K.S.B. \nand M.R.M. Articles were excluded (n=82) if both authors agreed, on the basis of the full \ntext, that a meta-analysis had not been conducted. The remaining articles (n=91) were \nassessed in detail by K.S.B. and M.R.M. or C.M. Articles were excluded at this stage if \nthey could not provide the following data for extraction for at least one meta-analysis: \nfirst author and summary effect size estimate of the meta-analysis; and first author, \npublication year, sample size (by groups) and number of events in the control group (for \nodds/risk ratios) of the contributing studies. Data extraction was performed \nindependently by K.S.B. and M.R.M. or C.M. and verified collaboratively. In total, n=48 \narticles were included in the analysis.\nANALYSIS\n368 | MAY 2013 | VOLUME 14 www.nature.com/reviews/neuro\n© 2013 Macmillan Publishers Limited. All rights reserved\n\nData were extracted from forest plots, tables and text. \nSome articles reported several meta-analyses. In those \ncases, we included multiple meta-analyses only if they \ncontained distinct study samples. If several meta-analyses \nhad overlapping study samples, we selected the most com￾prehensive (that is, the one containing the most studies) \nor, if the number of studies was equal, the first analysis \npresented in the article. Data extraction was indepen￾dently performed by K.S.B. and either M.R.M. or C.M. \nand verified collaboratively.\nThe following data were extracted for each meta￾analysis: first author and summary effect size estimate \nof the meta-analysis; and first author, publication year, \nsample size (by groups), number of events in the control \ngroup (for odds/risk ratios) and nominal significance \n(p<0.05, ‘yes/no’) of the contributing studies. For five \narticles, nominal study significance was unavailable and \nwas therefore obtained from the original studies if they \nwere electronically available. Studies with missing data \n(for example, due to unclear reporting) were excluded \nfrom the analysis.\nThe main outcome measure of our analysis was the \nachieved power of each individual study to detect the \nestimated summary effect reported in the corresponding \nmeta-analysis to which it contributed, assuming an α level \nof 5%. Power was calculated using G*Power software23. \nWe then calculated the mean and median statistical \npower across all studies.\nResults. Our search strategy identified 246 articles pub￾lished in 2011, out of which 155 were excluded after \nan initial screening of either the abstract or the full \ntext. Of the remaining 91 articles, 48 were eligible for \ninclusion in our analysis24–71, comprising data from 49 \nmeta-analyses and 730 individual primary studies. A \nflow chart of the article selection process is shown in \nFIG. 2, and the characteristics of included meta-analyses \nare described in TABLE 1.\nOur results indicate that the median statistical power \nin neuroscience is 21%. We also applied a test for an \nexcess of statistical significance72. This test has recently \nbeen used to show that there is an excess significance bias \nin the literature of various fields, including in studies of \nbrain volume abnormalities73, Alzheimer’s disease genet￾ics70,74 and cancer biomarkers75. The test revealed that the \nactual number (349) of nominally significant studies in \nour analysis was significantly higher than the number \nexpected (254; p<0.0001). Importantly, these calcula￾tions assume that the summary effect size reported in each \nstudy is close to the true effect size, but it is likely that \nthey are inflated owing to publication and other biases \ndescribed above.\nInterestingly, across the 49 meta-analyses included \nin our analysis, the average power demonstrated a clear \nbimodal distribution (FIG. 3). Most meta-analyses com￾prised studies with very low average power — almost \n50% of studies had an average power lower than 20%. \nHowever, seven meta-analyses comprised studies with \nhigh (>90%) average power24,26,31,57,63,68,71. These seven \nmeta-analyses were all broadly neurological in focus \nand were based on relatively small contributing studies \n— four out of the seven meta-analyses did not include \nany study with over 80 participants. If we exclude these \n‘outlying’ meta-analyses, the median statistical power \nfalls to 18%.\nSmall sample sizes are appropriate if the true effects \nbeing estimated are genuinely large enough to be reliably \nobserved in such samples. However, as small studies are \nparticularly susceptible to inflated effect size estimates and \npublication bias, it is difficult to be confident in the evi￾dence for a large effect if small studies are the sole source \nof that evidence. Moreover, many meta-analyses show \nsmall-study effects on asymmetry tests (that is, smaller \nstudies have larger effect sizes than larger ones) but never￾theless use random-effect calculations, and this is known \nto inflate the estimate of summary effects (and thus also \nthe power estimates). Therefore, our power calculations \nare likely to be extremely optimistic76.\nEmpirical evidence from specific fields\nOne limitation of our analysis is the under-representation \nof meta-analyses in particular subfields of neuroscience, \nsuch as research using neuroimaging and animal mod￾els. We therefore sought additional representative meta￾analyses from these fields outside our 2011 sampling frame \nto determine whether a similar pattern of low statistical \npower would be observed.\nNeuroimaging studies. Most structural and volumetric \nMRI studies are very small and have minimal power \nto detect differences between compared groups (for \nexample, healthy people versus those with mental health \ndiseases). A cl ear excess significance bias has been dem￾onstrated in studies of brain volume abnormalities73, \nand similar problems appear to exist in fMRI studies \nof the blood-oxygen-level-dependent response77. In \norder to establish the average statistical power of stud￾ies of brain volume abnormalities, we applied the same \nanalysis as described above to data that had been pre￾viously extracted to assess the presence of an excess of \nsignificance bias73. Our results indicated that the median \nstatistical power of these studies was 8% across 461 indi￾vidual studies contributing to 41 separate meta-analyses, \nwhich were drawn from eight articles that were published \nbetween 2006 and 2009. Full methodological details \ndescribing how studies were identified and selected are \navailable elsewhere73.\nAnimal model studies. Previous analyses of studies using \nanimal models have shown that small studies consist￾ently give more favourable (that is, ‘positive’) results than \nlarger studies78 and that study quality is inversely related \nto effect size79–82. In order to examine the average power \nin neuroscience studies using animal models, we chose \na representative meta-analysis that combined data from \nstudies investigating sex differences in water maze per￾formance (number of studies (k)=19, summary effect \nsize Cohen’s d = 0.49) and radial maze performance \n(k=21, summary effect size d=0.69)80. The summary \neffect sizes in the two meta-analyses provide evidence for \nmedium to large effects, with the male and female per￾formance differing by 0.49 to 0.69 standard deviations \nANALYSIS\nNATURE REVIEWS | NEUROSCIENCE VOLUME 14 | MAY 2013 | 369\n© 2013 Macmillan Publishers Limited. All rights reserved\n\nTable 1 | Characteristics of included meta-analyses\nFirst author of \nstudy\nk N Summary effect size Power Refs\nMedian (range) Cohen’s d OR Random or \nfixed effects\nMedian (range)\nBabbage 13 48 (24–67) –1.11 Random 0.96 (0.74– 0.99) 24\nBai 18 322 (92–3152) 1.47 Random 0.20 (0.06–1.00) 25\nBjorkhem-Bergman 6 59 (37–72) –1.20 Random 0.99 (0.94–1.00) 26\nBucossi 21 85 (19–189) 0.41 Random 0.46 (0.13–0.79) 27\nChamberlain 11 53 (20–452) –0.51 NA 0.54 (0.33–1.00) 28\nChang 56 55 (20–309) –0.19 Random 0.10 (0.07–0.38) 29\nChang 6 616.5 (157–1492) 0.98 Fixed 0.05 (0.05–0.06) 30\nChen 12 1193 (288–29573) 0.60 Random 0.92 (0.13–1.00) 31\nChung 11 253 (129–703) 0.67 Fixed 0.09 (0.00–0.15) 32\nDomellof 14 143.5 (42–5795) 2.12 Random 0.47 (0.00–1.00) 33\nEtminan 14 109 (31–753) 0.80 Random 0.08 (0.05–0.23) 34\nFeng 4 450 (370–1715) 1.20 Fixed 0.16 (0.09–0.42) 35\nGreen 17 69 (29–687) –0.59 Random 0.65 (0.34–1.00) 36\nHan 14 212 (40–4190) 1.35 Random 0.12 (0.05 –0.95) 37\nHannestad 13 23 (12–100) –0.13 Random 0.09 (0.07–0.25) 38\nHua 27 468 (114–1522) 1.13 Random 0.09 (0.06–0.22) 39\nLindson 8 257 (48–1100) 1.05 Fixed 0.05 (0.05–0.06) 40\nLiu 12 563 (148–1956) 1.04 Fixed 0.05 (0.05–0.07) 41\nLui 6 1678 (1033–9242) 0.89 Fixed 0.15 (0.12–0.60) 42\nMacKillop 57 52 (18–227) 0.58 Fixed 0.51 (0.21–0.99) 43\nManeeton 5 53 (22–162) 1.67* Random 0.13 (0.08–0.35) 44\nOhi 6 674 (200–2218) 1.12 Fixed 0.10 (0.07–0.24) 45\nOlabi 14 68.5 (14–209) –0.40 Random 0.34 (0.13–0.83) 46\nOldershaw 10 65.5 (40–126) –0.51 Random 0.53 (0.35–0.79) 47\nOliver 7 156 (66–677) 0.86 Fixed 0.07 (0.06–0.17) 48\nPeerbooms 36 229 (26–2913) 1.26 Random 0.11 (0.00–0.36) 49\nPizzagalli 22 16 (8–44) 0.92 Random 0.44 (0.19–0.90) 50\nRist 5 150 (99–626) 2.06 Random 0.55 (0.35–0.98) 51\nSexton 8 35 (20–208) 0.43 Fixed 0.24 (0.15–0.98) 52\nShum 11 40 (24–129) 0.89 Fixed 0.78 (0.54–0.93) 53\nSim 2 72 (46–98) 1.23* Random 0.07 (0.07–0.08) 54\nSong 12 85 (32–279) 0.15 NA 0.10 (0.07–0.21) 55\nSun 6 437.5 (158–712) 1.93 Fixed 0.65 (0.14–0.98) 56\nTian 4 50 (32–63) 1.26 NA 0.98 (0.93–1.00) 57\nTrzesniak 11 124 (55–279) 1.98 Random 0.27 (0.09–0.64) 58\nVeehof 8 58.5 (19–156) 0.37 Fixed 0.26 (0.12–0.60) 59\nVergouwen 24 223 (39–1015) 0.83 Random 0.09 (0.06–0.22) 60\nVieta 10 212 (113–361) 0.68* Random 0.27 (0.16–0.39) 61\nWisdom 53 137 (20–7895) –0.14 NA 0.12 (0.06–1.00) 62\nWitteman 26 28 (15–80) –1.41 Random 0.94 (0.66–1.00) 63\nWoon 24 30 (8–68) –0.60 Random 0.36 (0.11–0.69) 64\nXuan 20 348.5 (111–1893) 1.00 Random 0.05 (0.05–0.05) 65\nYang (cohort) 14 296 (100–1968) 1.38* Random 0.18 (0.11–0.79) 66\nYang (case control) 7 126 (72–392) 2.48 Random 0.73 (0.43–0.93) 66\nANALYSIS\n370 | MAY 2013 | VOLUME 14 www.nature.com/reviews/neuro\n© 2013 Macmillan Publishers Limited. All rights reserved\n\nNature Reviews | Neuroscience\nN 16\n14\n12\n10\n8 \n6\n4\n2\n0\n11–20\n31–40\nPower (%)\n0–10\n21–30\n41–50\n51–60\n61–70\n71–80\n81–90\n91–100\n%\n30\n25\n20 \n15\n10\n5\n0\nfor water maze and radial maze, respectively. Our results \nindicate that the median statistical power for the water \nmaze studies and the radial maze studies to detect these \nmedium to large effects was 18% and 31%, respectively \n(TABLE 2). The average sample size in these studies was 22 \nanimals for the water maze and 24 for the radial maze \nexperiments. Studies of this size can only detect very \nlarge effects (d=1.20 for n=22, and d=1.26 for n=24) \nwith 80% power — far larger than those indicated by \nthe meta-analyses. These animal model studies were \ntherefore severely underpowered to detect the summary \neffects indicated by the meta-analyses. Furthermore, the \nsummary effects are likely to be inflated estimates of the \ntrue effects, given the problems associated with small \nstudies described above.\nThe results described in this section are based on \nonly two meta-analyses, and we should be appropriately \ncautious in extrapolating from this limited evidence. \nNevertheless, it is notable that the results are so con￾sistent with those observed in other fields, such as the \nneuroimaging and neuroscience studies that we have \ndescribed above.\nImplications\nImplications for the likelihood that a research finding \nreflects a true effect. Our results indicate that the aver￾age statistical power of studies in the field of neurosci￾ence is probably no more than between ~8% and ~31%, \non the basis of evidence from diverse subfields within \nneuro-science. If the low average power we observed \nacross these studies is typical of the neuroscience lit￾erature as a whole, this has profound implications for \nthe field. A major implication is that the likelihood that \nany nominally significant finding actually reflects a true \neffect is small. As explained above, the probability that \na research finding reflects a true effect (PPV) decreases \nas statistical power decreases for any given pre-study \nodds (R) and a fixed type I error level. It is easy to show \nthe impact that this is likely to have on the reliability of \nfindings. FIGURE 4 shows how the PPV changes for a range \nof values for R and for a range of v alues for the average \npower in a field. For effects that are genuinely non-null, \nFIG. 5 shows the degree to which an effect size estimate \nis likely to be inflated in initial studies — owing to the \nwinner’s curse phenomenon — for a range of values for \nstatistical power.\n The estimates shown in FIGS 4,5 are likely to be opti￾mistic, however, because they assume that statistical \npower and R are the only considerations in determin￾ing the probability that a research finding reflects a true \neffect. As we have already discussed, several other biases \nare also likely to reduce the probability that a research \nfinding reflects a true effect. Moreover, the summary \neffect size estimates that we used to determine the statis￾tical power of individual studies are themselves likely to \nbe inflated owing to bias — our excess of significance test \nprovided clear evidence for this. Therefore, the average \nstatistical power of studies in our analysis may in fact be \neven lower than the 8–31% range we observed.\nEthical implications. Low average power in neuro￾science studies also has ethical implications. In our \nanalysis of animal model studies, the average sample \nsize of 22 animals for the water maze experiments was \nonly sufficient to detect an effect size of d = 1.26 with \nTable 1 (cont.) | Characteristics of included meta-analyses\nStudy k N Summary effect size Power Refs\nMedian (range) Cohen’s d OR Random or \nfixed effects\nMedian \n(range)\nYang 3 51 (18–205) 0.67 NA 0.65 (0.27–1.00) 67\nYuan 14 116.5 (19–1178) 4.98 Fixed 0.92 (0.33–1.00) 68\nZafar 8 78.5 (46–483) 1.07* Random 0.05 (0.00–0.06) 69\nZhang 12 337.5 (39–901) 1.27 Random 0.14 (0.01–0.30) 70\nZhu 8 110 (48–371) 0.84 Random 0.97 (0.81–1.00) 71\nThe choice of fixed or random effects model was made by the original authors of the meta-analysis. k,number of studies; NA, not \navailable; OR, odds ratio. * indicates the relative risk.\nFigure 3 | Median power of studies included in \nneuroscience meta-analyses. The figure shows a \nhistogram of median study power calculated for each of \nthe n=49 meta-analyses included in our analysis, with the \nnumber of meta-analyses (N) on the left axis and percent \nof meta-analyses (%) on the right axis. There is a clear \nbimodal distribution; n=15 (31%) of the meta-analyses \ncomprised studies with median power of less than 11%, \nwhereas n=7 (14%) comprised studies with high average \npower in excess of 90%. Despite this bimodality, most \nmeta-analyses comprised studies with low statistical \npower: n=28 (57%) had median study power of less than \n31%. The meta-analyses (n=7) that comprised studies \nwith high average power in excess of 90% had their \nbroadly neurological subject matter in common.\nANALYSIS\nNATURE REVIEWS | NEUROSCIENCE VOLUME 14 | MAY 2013 | 371\n© 2013 Macmillan Publishers Limited. All rights reserved\n\nNature Reviews | Neuroscience\nPost-study probability (%)\n100\n80\n60\n40\n20\n0\n0.2 0.4 0.6 1.0\nPre-study odds R\n0 0.8\n80% power\n30% power\n10% power\n80% power, and the average sample size of 24 animals \nfor the radial maze experiments was only sufficient to \ndetect an effect size of d=1.20. In order to achieve 80% \npower to detect, in a single study, the most probable true \neffects as indicated by the meta-analysis, a sample size \nof 134 animals would be required for the water maze \nexperiment (assuming an effect size of d = 0.49) and \n68 animals for the radial maze experiment (assuming \nan effect size of d=0.69); to achieve 95% power, these \nsample sizes would need to increase to 220 and 112, \nrespectively. What is particularly striking, however, is \nthe inefficiency of a continued reliance on small sample \nsizes. Despite the apparently large numbers of animals \nrequired to achieve acceptable statistical power in these \nexperiments, the total numbers of animals actually used \nin the studies contributing to the meta-analyses were \neven larger: 420 for the water maze experiments and \n514 for the radial maze experiments.\nThere is ongoing debate regarding the appropriate \nbalance to strike between using as few animals as possi￾ble in experiments and the need to obtain robust, reliable \nfindings. We argue that it is important to appreciate the \nwaste associated with an underpowered study — even a \nstudy that achieves only 80% power still presents a 20% \npossibility that the animals have been sacrificed with￾out the study detecting the underlying true effect. If the \naverage power in neuroscience animal model studies is \nbetween 20–30%, as we observed in our analysis above, \nthe ethical implications are clear.\nLow power therefore has an ethical dimension — \nunreliable research is inefficient and wasteful. This applies \nto both human and animal research. The principles of the \n‘three Rs’ in animal research (reduce, refine and replace)83\nrequire appropriate experimental design and statistics \n— both too many and too few animals present an issue \nas they reduce the value of research outputs. A require￾ment for sample size and power calculation is included \nin the Animal Research: Reporting In Vivo Experiments \n(ARRIVE) guidelines84, but such calculations require a \nclear appreciation of the expected magnitude of effects \nbeing sought.\nOf course, it is also wasteful to continue data col￾lection once it is clear that the effect being sought does \nnot exist or is too small to be of interest. That is, studies \nare not just wasteful when they stop too early, they are \nalso wasteful when they stop too late. Planned, sequen￾tial analyses are sometimes used in large clinical trials \nwhen there is considerable expense or potential harm \nassociated with testing participants. Clinical trials may \nbe stopped prematurely in the case of serious adverse \neffects, clear beneficial effects (in which case it would be \nunethical to continue to allocate participants to a placebo \ncondition) or if the interim effects are so unimpressive \nthat any prospect of a positive result with the planned \nsample size is extremely unlikely85. Within a significance \ntesting framework, such interim analyses — and the pro￾tocol for stopping — must be planned for the assump￾tions of significance testing to hold. Concerns have been \nraised as to whether stopping trials early is ever justified \ngiven the tendency for such a practice to produce inflated \neffect size estimates86. Furthermore, the decision process \naround stopping is not often fully disclosed, increasing \nthe scope for researcher degrees of freedom86. Alternative \napproaches exist. For example, within a Bayesian frame￾work, one can monitor the Bayes factor and simply stop \ntesting when the evidence is conclusive or when resources \nFigure 4 | Positive predictive value as a function of the \npre-study odds of association for different levels of \nstatistical power. The probability that a research finding \nreflects a true effect — also known as the positive \npredictive value (PPV) — depends on both the pre-study \nodds of the effect being true (the ratio R of ‘true effects’ \nover ‘null effects’ in the scientific field) and the study’s \nstatistical power. The PPV can be calculated for given \nvalues of statistical power (1 – β), pre-study odds ratio (R) \nand type I error rate (α), using the formula PPV=([1 – β]×R) \n⁄ ([1− β]×R+α). The median statistical power of studies in \nthe neuroscience field is optimistically estimated to be \nbetween ~8% and ~31%. The figure illustrates how low \nstatistical power consistent with this estimated range \n(that is, between 10% and 30%) detrimentally affects the \nassociation between the probability that a finding reflects \na true effect (PPV) and pre-study odds, assuming α=0.05. \nCompared with conditions of appropriate statistical \npower (that is, 80%), the probability that a research finding \nreflects a true effect is greatly reduced for 10% and 30% \npower, especially if pre-study odds are low. Notably, in an \nexploratory research field such as much of neuroscience, \nthe pre-study odds are often low.\nTable 2 | Sample size required to detect sex differences in water maze and radial maze performance\nTotal animals \nused\nRequired N per study Typical N per study Detectable effect for typical N\n80% power 95% power Mean Median 80% power 95% power\nWater maze 420 134 220 22 20 d=1.26 d=1.62\nRadial maze 514 68 112 24 20 d=1.20 d=1.54\nMeta-analysis indicated an effect size of Cohen’s d=0.49 for water maze studies and d=0.69 for radial maze studies.\nANALYSIS\n372 | MAY 2013 | VOLUME 14 www.nature.com/reviews/neuro\n© 2013 Macmillan Publishers Limited. All rights reserved\n\nNature Reviews | Neuroscience\nRelative bias of research finding (%)\n100\n80\n60\n40\n20\n0\n0 20 40 60 80 100\nStatistical power of study (%)\nare expended87. Similarly, adopting conservative priors \ncan substantially reduce the likelihood of claiming that \nan effect exists when in fact it does not85. At present, \nsignificance testing remains the dominant framework \nwithin neuroscience, but the flexibility of alternative (for \nexample, Bayesian) approaches means that they should \nbe taken seriously by the field.\nConclusions and future directions\nA consequence of the remarkable growth in neurosci￾ence over the past 50 years has been that the effects we \nnow seek in our experiments are often smaller and more \nsubtle than before as opposed to when mostly easily dis￾cernible ‘low-hanging fruit’ were targeted. At the same \ntime, computational analysis of very large datasets is now \nrelatively straightforward, so that an enormous number of \ntests can be run in a short time on the same dataset. These \ndramatic advances in the flexibility of research design and \nanalysis have occurred without accompanying changes to \nother aspects of research design, particularly power. For \nexample, the average sample size has not changed sub￾stantially over time88 despite the fact that neuroscientists \nare likely to be pursuing smaller effects. The increase in \nresearch flexibility and the complexity of study designs89\ncombined with the stability of sample size and search for \nincreasingly subtle effects has a disquieting consequence: \na dramatic increase in the likelihood that statistically sig￾nificant findings are spurious. This may be at the root of \nthe recent replication failures in the preclinical literature8\nand the correspondingly poor translation of these findings \ninto humans90.\nLow power is a problem in practice because of the \nnormative publishing standards for producing novel, \nsignificant, clean results and the ubiquity of null \nhypothesis significance testing as the means of evaluat￾ing the truth of research findings. As we have shown, \nthese factors result in biases that are exacerbated by low \npower. Ultimately, these biases reduce the reproducibil￾ity of neuroscience findings and negatively affect the \nvalidity of the accumulated findings. Unfortunately, \npublishing and reporting practices are unlikely to \nchange rapidly. Nonetheless, existing scientific practices \ncan be improved with small changes or additions that \napproximate key features of the idealized model4,91,92. \nWe provide a summary of recommendations for future \nresearch practice in BOX 2.\nIncreasing disclosure. False positives occur more fre￾quently and go unnoticed when degrees of freedom in \ndata analysis and reporting are undisclosed5\n. Researchers \ncan improve confidence in published reports by noting \nin the text: “We report how we determined our sample \nsize, all data exclusions, all data manipulations, and all \nmeasures in the study.”7\n When such a statement is not \npossible, disclosure of the rationale and justification of \ndeviations from what should be common practice (that \nis, reporting sample size, data exclusions, manipula￾tions and measures) will improve readers’ understand￾ing and interpretation of the reported effects and, \ntherefore, of what level of confidence in the reported \neffects is appropriate. In clinical trials, there is an \nincreasing requirement to adhere to the Consolidated \nStandards of Reporting Trials (CONSORT), and the \nsame is true for systematic reviews and meta-analyses, \nfor which the Preferred Reporting Items for Systematic \nReviews and Meta-Analyses (PRISMA) guidelines are \nnow being adopted. A number of reporting guidelines \nhave been produced for application to diverse study \ndesigns and tools, and an updated list is maintained \nby the EQUATOR Network93. A ten-item checklist of \nstudy quality has been developed by the Collaborative \nApproach to Meta-Analysis and Review of Animal Data \nin Experimental Stroke (CAMARADES), but to the best \nof our knowledge, this checklist is not yet widely used in \nprimary studies.\nFigure 5 | The winner’s curse: effect size inflation as \na function of statistical power. The winner’s curse \nrefers to the phenomenon that studies that find evidence \nof an effect often provide inflated estimates of the size of \nthat effect. Such inflation is expected when an effect has \nto pass a certain threshold — such as reaching statistical \nsignificance — in order for it to have been ‘discovered’. \nEffect inflation is worst for small, low-powered studies, \nwhich can only detect effects that happen to be large. If, \nfor example, the true effect is medium-sized, only those \nsmall studies that, by chance, estimate the effect to be \nlarge will pass the threshold for discovery (that is, the \nthreshold for statistical significance, which is typically \nset at p<0.05). In practice, this means that research \nfindings of small studies are biased in favour of inflated \neffects. By contrast, large, high-powered studies can \nreadily detect both small and large effects and so are less \nbiased, as both over- and underestimations of the true \neffect size will pass the threshold for ‘discovery’. We \noptimistically estimate the median statistical power of \nstudies in the neuroscience field to be between ~8% and \n~31%. The figure shows simulations of the winner’s curse \n(expressed on the y‑axis as relative bias of research \nfindings). These simulations suggest that initial effect \nestimates from studies powered between ~ 8% and ~31% \nare likely to be inflated by 25% to 50% (shown by the \narrows in the figure). Inflated effect estimates make it \ndifficult to determine an adequate sample size for \nreplication studies, increasing the probability of type II \nerrors. Figure is modified, with permission, from REF. 103\n© (2007) Cell Press.\nANALYSIS\nNATURE REVIEWS | NEUROSCIENCE VOLUME 14 | MAY 2013 | 373\n© 2013 Macmillan Publishers Limited. All rights reserved\n\nRegistration of confirmatory analysis plan. Both explor￾atory and confirmatory research strategies are legiti￾mate and useful. However, presenting the result of an \nexploratory analysis as if it arose from a confirmatory \ntest inflates the chance that the result is a false positive. \nIn particular, p‑values lose their diagnostic value if they \nare not the result of a pre-specified analysis plan for \nwhich all results are reported. Pre-registration — and, \nultimately, full reporting of analysis plans — clarifies \nthe distinction between confirmatory and explora￾tory analysis, encourages well-powered studies (at least \nin the case of confirmatory analyses) and reduces the \nfile-drawer effect. These subsequently reduce the likeli￾hood of false positive accumulation. The Open Science \nFramework (OSF) offers a registration mechanism for \nscientific research. For observational studies, it would \nbe useful to register datasets in detail, so that one can be \naware of how extensive the multiplicity and complexity \nof analyses can be94.\nImproving availability of materials and data. Making \nresearch materials available will improve the quality \nof studies aimed at replicating and extending research \nfindings. Making raw data available will improve data \naggregation methods and confidence in reported \nresults. There are multiple repositories for making data \nmore widely available, such as The Dataverse Network \nProject and Dryad) for data in general and others \nsuch as OpenfMRI, INDI and OASIS for neuroimag￾ing data in particular. Also, commercial repositories \n(for example, figshare) offer means for sharing data \nand other research materials. Finally, the OSF offers \ninfrastructure for documenting, archiving and sharing \ndata within collaborative teams and also making some \nor all of those research materials publicly available. \nLeading journals are increasingly adopting policies for \nmaking data, protocols and analytical codes available, \nat least for some types of studies. However, these poli￾cies are uncommonly adhered to95, and thus the ability \nfor independent experts to repeat published analysis \nremains low96.\nIncentivizing replication. Weak incentives for conduct￾ing and publishing replications are a threat to identifying \nfalse positives and accumulating precise estimates of \nresearch findings. There are many ways to alter repli￾cation incentives97. For example, journals could offer a \nsubmission option for registered replications of impor￾tant research results (see, for example, a possible new \nsubmission format for Cortex98). Groups of researchers \ncan also collaborate on performing one or many replica￾tions to increase the total sample size (and therefore the \nstatistical power) achieved while minimizing the labour \nand resource impact on any one contributor. Adoption \nof the gold standard of large-scale collaborative con￾sortia and extensive replication in fields such as human \ngenome epidemiology has transformed the reliability \nof the produced findings. Although previously almost \nall of the proposed candidate gene associations from \nsmall studies were false99 (with some exceptions100), col￾laborative consortia have substantially improved power, \nand the replicated results can be considered highly reli￾able. In another example, in the field of psychology, the \nReproducibility Project is a collaboration of more than \n100 researchers aiming to estimate the reproducibility \nof psychological science by replicating a large sample of \nstudies published in 2008 in three psychology journals92. \nEach individual research study contributes just a small \nportion of time and effort, but the combined effect is \nsubstantial both for accumulating replications and for \ngenerating an empirical estimate of reproducibility.\nConcluding remarks. Small, low-powered studies are \nendemic in neuroscience. Nevertheless, there are reasons \nto be optimistic. Some fields are confronting the prob￾lem of the poor reliability of research findings that arises \nfrom low-powered studies. For example, in genetic epi￾demiology sample sizes increased dramatically with the \nwidespread understanding that the effects being sought \nare likely to be extremely small. This, together with an \nincreasing requirement for strong statistical evidence \nand independent replication, has resulted in far more \nreliable results. Moreover, the pressure for emphasiz￾ing significant results is not absolute. For example, the \nProteus phenomenon101 suggests that refuting early \nresults can be attractive in fields in which data can be \nproduced rapidly. Nevertheless, we should not assume \nthat science is effectively or efficiently self-correcting102. \nThere is now substantial evidence that a large propor￾tion of the evidence reported in the scientific literature \nmay be unreliable. Acknowledging this challenge is the \nfirst step towards addressing the problematic aspects \nof current scientific practices and identifying effective \nsolutions.\nBox 2 | Recommendations for researchers\nPerform an a priori power calculation\nUse the existing literature to estimate the size of effect you are looking for and design \nyour study accordingly. If time or financial constraints mean your study is \nunderpowered, make this clear and acknowledge this limitation (or limitations) in the \ninterpretation of your results.\nDisclose methods and findings transparently\nIf the intended analyses produce null findings and you move on to explore your data in \nother ways, say so. Null findings locked in file drawers bias the literature, whereas \nexploratory analyses are only useful and valid if you acknowledge the caveats and \nlimitations.\nPre-register your study protocol and analysis plan\nPre-registration clarifies whether analyses are confirmatory or exploratory, encourages \nwell-powered studies and reduces opportunities for non-transparent data mining and \nselective reporting. Various mechanisms for this exist (for example, the Open Science \nFramework).\nMake study materials and data available\nMaking research materials available will improve the quality of studies aimed at \nreplicating and extending research findings. Making raw data available will enhance \nopportunities for data aggregation and meta-analysis, and allow external checking of \nanalyses and results.\nWork collaboratively to increase power and replicate findings\nCombining data increases the total sample size (and therefore power) while minimizing \nthe labour and resource impact on any one contributor. Large-scale collaborative \nconsortia in fields such as human genetic epidemiology have transformed the reliability \nof findings in these fields.\nANALYSIS\n374 | MAY 2013 | VOLUME 14 www.nature.com/reviews/neuro\n© 2013 Macmillan Publishers Limited. All rights reserved\n\n1. Ioannidis, J. P. Why most published research findings \nare false. PLoS Med. 2, e124 (2005).\nThis study demonstrates that many (and possibly \nmost) of the conclusions drawn from biomedical \nresearch are probably false. The reasons for this \ninclude using flexible study designs and flexible \nstatistical analyses and running small studies with \nlow statistical power.\n2. Fanelli, D. Negative results are disappearing from \nmost disciplines and countries. Scientometrics 90, \n891–904 (2012).\n3. Greenwald, A. G. Consequences of prejudice against \nthe null hypothesis. Psychol. Bull. 82, 1–20 (1975).\n4. Nosek, B. A., Spies, J. R. & Motyl, M. Scientific utopia: \nII. Restructuring incentives and practices to promote \ntruth over publishability. Perspect. Psychol. Sci. 7,\n615–631 (2012).\n5. Simmons, J. P., Nelson, L. D. & Simonsohn, U. False￾positive psychology: undisclosed flexibility in data \ncollection and analysis allows presenting anything as \nsignificant. Psychol. Sci. 22, 1359–1366 (2011).\nThis article empirically illustrates that flexible \nstudy designs and data analysis dramatically \nincrease the possibility of obtaining a nominally \nsignificant result. However, conclusions drawn from \nthese results are almost certainly false.\n6. Sullivan, P. F. Spurious genetic associations. Biol. \nPsychiatry 61, 1121–1126 (2007).\n7. Begley, C. G. & Ellis, L. M. Drug development: raise \nstandards for preclinical cancer research. Nature 483, \n531–533 (2012).\n8. Prinz, F., Schlange, T. & Asadullah, K. Believe it or not: \nhow much can we rely on published data on potential \ndrug targets? Nature Rev. Drug Discov. 10, 712 \n(2011).\n9. Fang, F. C. & Casadevall, A. Retracted science and the \nretraction index. Infect. Immun. 79, 3855–3859 \n(2011).\n10. Munafo, M. R., Stothart, G. & Flint, J. Bias in genetic \nassociation studies and impact factor. Mol. Psychiatry \n14, 119–120 (2009).\n11. Sterne, J. A. & Davey Smith, G. Sifting the evidence —\nwhat’s wrong with significance tests? BMJ 322, \n226–231 (2001).\n12. Ioannidis, J. P. A., Tarone, R. & McLaughlin, J. K. The \nfalse-positive to false-negative ratio in epidemiologic \nstudies. Epidemiology 22, 450–456 (2011).\n13. Ioannidis, J. P. A. Why most discovered true \nassociations are inflated. Epidemiology 19, 640–648 \n(2008).\n14. Tversky, A. & Kahneman, D. Belief in the law of small \nnumbers. Psychol. Bull. 75, 105–110 (1971).\n15. Masicampo, E. J. & Lalande, D. R. A peculiar \nprevalence of p values just below .05. Q. J. Exp. \nPsychol. 65, 2271–2279 (2012).\n16. Carp, J. The secret lives of experiments: methods \nreporting in the fMRI literature. Neuroimage 63, \n289–300 (2012).\nThis article reviews methods reporting and \nmethodological choices across 241 recent fMRI \nstudies and shows that there were nearly as many \nunique analytical pipelines as there were studies. In \naddition, many studies were underpowered to \ndetect plausible effects.\n17. Dwan, K. et al. Systematic review of the empirical \nevidence of study publication bias and outcome \nreporting bias. PLoS ONE 3, e3081 (2008).\n18. Sterne, J. A. et al. Recommendations for examining \nand interpreting funnel plot asymmetry in meta￾analyses of randomised controlled trials. BMJ 343, \nd4002 (2011).\n19. Joy-Gaba, J. A. & Nosek, B. A. The surprisingly limited \nmalleability of implicit racial evaluations. Soc. Psychol. \n41, 137–146 (2010).\n20. Schmidt, K. & Nosek, B. A. Implicit (and explicit) racial \nattitudes barely changed during Barack Obama’s \npresidential campaign and early presidency. J. Exp. \nSoc. Psychol. 46, 308–314 (2010).\n21. Evangelou, E., Siontis, K. C., Pfeiffer, T. & \nIoannidis, J. P. Perceived information gain from \nrandomized trials correlates with publication in high￾impact factor journals. J. Clin. Epidemiol. 65, \n1274–1281 (2012).\n22. Pereira, T. V. & Ioannidis, J. P. Statistically significant \nmeta-analyses of clinical trials have modest credibility \nand inflated effects. J. Clin. Epidemiol. 64, \n1060–1069 (2011).\n23. Faul, F., Erdfelder, E., Lang, A. G. & Buchner, A. \nG*Power 3: a flexible statistical power analysis \nprogram for the social, behavioral, and biomedical \nsciences. Behav. Res. Methods 39, 175–191 (2007).\n24. Babbage, D. R. et al. Meta-analysis of facial affect \nrecognition difficulties after traumatic brain injury.\nNeuropsychology 25, 277–285 (2011).\n25. Bai, H. Meta-analysis of 5, \n10‑methylenetetrahydrofolate reductase gene \npoymorphism as a risk factor for ischemic \ncerebrovascular disease in a Chinese Han population. \nNeural Regen. Res. 6, 277–285 (2011).\n26. Bjorkhem-Bergman, L., Asplund, A. B. & Lindh, J. D. \nMetformin for weight reduction in non-diabetic \npatients on antipsychotic drugs: a systematic review \nand meta-analysis. J. Psychopharmacol. 25, \n299–305 (2011).\n27. Bucossi, S. et al. Copper in Alzheimer’s disease: a \nmeta-analysis of serum, plasma, and cerebrospinal \nfluid studies. J. Alzheimers Dis. 24, 175–185 (2011).\n28. Chamberlain, S. R. et al. Translational approaches to \nfrontostriatal dysfunction in attention-deficit/\nhyperactivity disorder using a computerized \nneuropsychological battery. Biol. Psychiatry 69, \n1192–1203 (2011).\n29. Chang, W. P., Arfken, C. L., Sangal, M. P. & \nBoutros, N. N. Probing the relative contribution of the \nfirst and second responses to sensory gating indices: a \nmeta-analysis. Psychophysiology 48, 980–992 \n(2011).\n30. Chang, X. L. et al. Functional parkin promoter \npolymorphism in Parkinson’s disease: new data and \nmeta-analysis. J. Neurol. Sci. 302, 68–71 (2011).\n31. Chen, C. et al. Allergy and risk of glioma: a meta￾analysis. Eur. J. Neurol. 18, 387–395 (2011).\n32. Chung, A. K. & Chua, S. E. Effects on prolongation of \nBazett’s corrected QT interval of seven second￾generation antipsychotics in the treatment of \nschizophrenia: a meta-analysis. J. Psychopharmacol. \n25, 646–666 (2011).\n33. Domellof, E., Johansson, A. M. & Ronnqvist, L. \nHandedness in preterm born children: a systematic \nreview and a meta-analysis. Neuropsychologia 49, \n2299–2310 (2011).\n34. Etminan, N., Vergouwen, M. D., Ilodigwe, D. & \nMacdonald, R. L. Effect of pharmaceutical treatment \non vasospasm, delayed cerebral ischemia, and clinical \noutcome in patients with aneurysmal subarachnoid \nhemorrhage: a systematic review and meta-analysis. \nJ. Cereb. Blood Flow Metab. 31, 1443–1451 (2011).\n35. Feng, X. L. et al. Association of FK506 binding protein \n5 (FKBP5) gene rs4713916 polymorphism with mood \ndisorders: a meta-analysis. Acta Neuropsychiatr. 23, \n12–19 (2011).\n36. Green, M. J., Matheson, S. L., Shepherd, A., \nWeickert, C. S. & Carr, V. J. Brain-derived neurotrophic \nfactor levels in schizophrenia: a systematic review with \nmeta-analysis. Mol. Psychiatry 16, 960–972 (2011).\n37. Han, X. M., Wang, C. H., Sima, X. & Liu, S. Y. \nInterleukin‑6–74G/C polymorphism and the risk of \nAlzheimer’s disease in Caucasians: a meta-analysis. \nNeurosci. Lett. 504, 4–8 (2011).\n38. Hannestad, J., DellaGioia, N. & Bloch, M. The effect of \nantidepressant medication treatment on serum levels \nof inflammatory cytokines: a meta-analysis. \nNeuropsychopharmacology 36, 2452–2459 (2011).\n39. Hua, Y., Zhao, H., Kong, Y. & Ye, M. Association \nbetween the MTHFR gene and Alzheimer’s disease: a \nmeta-analysis. Int. J. Neurosci. 121, 462–471 (2011).\n40. Lindson, N. & Aveyard, P. An updated meta-analysis of \nnicotine preloading for smoking cessation: \ninvestigating mediators of the effect. \nPsychopharmacology 214, 579–592 (2011).\n41. Liu, H. et al. Association of 5‑HTT gene \npolymorphisms with migraine: a systematic review and \nmeta-analysis. J. Neurol. Sci. 305, 57–66 (2011).\n42. Liu, J. et al. PITX3 gene polymorphism is associated \nwith Parkinson’s disease in Chinese population. Brain \nRes. 1392, 116–120 (2011).\n43. MacKillop, J. et al. Delayed reward discounting and \naddictive behavior: a meta-analysis. \nPsychopharmacology 216, 305–321 (2011).\n44. Maneeton, N., Maneeton, B., Srisurapanont, M. & \nMartin, S. D. Bupropion for adults with attention￾deficit hyperactivity disorder: meta-analysis of \nrandomized, placebo-controlled trials. Psychiatry Clin. \nNeurosci. 65, 611–617 (2011). 45.\nOhi, K. et al. The SIGMAR1 gene is associated with a \nrisk of schizophrenia and activation of the prefrontal \ncortex. Prog. Neuropsychopharmacol. Biol. \nPsychiatry 35, 1309–1315 (2011).\n46. Olabi, B. et al. Are there progressive brain changes in \nschizophrenia? A meta-analysis of structural magnetic \nresonance imaging studies. Biol. Psychiatry 70, \n88–96 (2011).\n47. Oldershaw, A. et al. The socio-emotional processing \nstream in Anorexia Nervosa. Neurosci. Biobehav. Rev. \n35, 970–988 (2011).\n48. Oliver, B. J., Kohli, E. & Kasper, L. H. Interferon therapy \nin relapsing-remitting multiple sclerosis: a systematic \nreview and meta-analysis of the comparative trials. \nJ. Neurol. Sci. 302, 96–105 (2011).\n49. Peerbooms, O. L. et al. Meta-analysis of MTHFR gene \nvariants in schizophrenia, bipolar disorder and \nunipolar depressive disorder: evidence for a common \ngenetic vulnerability? Brain Behav. Immun. 25, \n1530–1543 (2011).\n50. Pizzagalli, D. A. Frontocingulate dysfunction in \ndepression: toward biomarkers of treatment response. \nNeuropsychopharmacology 36, 183–206 (2011).\n51. Rist, P. M., Diener, H. C., Kurth, T. & Schurks, M. \nMigraine, migraine aura, and cervical artery \ndissection: a systematic review and meta-analysis. \nCephalalgia 31, 886–896 (2011).\n52. Sexton, C. E., Kalu, U. G., Filippini, N., Mackay, C. E. & \nEbmeier, K. P. A meta-analysis of diffusion tensor \nimaging in mild cognitive impairment and Alzheimer’s \ndisease. Neurobiol. Aging 32, 2322.e5–2322.e18 \n(2011).\n53. Shum, D., Levin, H. & Chan, R. C. Prospective memory \nin patients with closed head injury: a review. \nNeuropsychologia 49, 2156–2165 (2011).\n54. Sim, H. et al. Acupuncture for carpal tunnel syndrome: \na systematic review of randomized controlled trials. \nJ. Pain 12, 307–314 (2011).\n55. Song, F. et al. Meta-analysis of plasma amyloid-β levels \nin Alzheimer’s disease. J. Alzheimers Dis. 26, \n365–375 (2011).\n56. Sun, Q. L. et al. Correlation of E‑selectin gene \npolymorphisms with risk of ischemic stroke A meta￾analysis. Neural Regen. Res. 6, 1731–1735 (2011).\n57. Tian, Y., Kang, L. G., Wang, H. Y. & Liu, Z. Y. Meta￾analysis of transcranial magnetic stimulation to treat \npost-stroke dysfunction. Neural Regen. Res. 6, \n1736–1741 (2011).\n58. Trzesniak, C. et al. Adhesio interthalamica alterations \nin schizophrenia spectrum disorders: a systematic \nreview and meta-analysis. Prog. \nNeuropsychopharmacol. Biol. Psychiatry 35, \n877–886 (2011).\n59. Veehof, M. M., Oskam, M. J., Schreurs, K. M. & \nBohlmeijer, E. T. Acceptance-based interventions for \nthe treatment of chronic pain: a systematic review and \nmeta-analysis. Pain 152, 533–542 (2011).\n60. Vergouwen, M. D., Etminan, N., Ilodigwe, D. & \nMacdonald, R. L. Lower incidence of cerebral \ninfarction correlates with improved functional outcome \nafter aneurysmal subarachnoid hemorrhage. J. Cereb. \nBlood Flow Metab. 31, 1545–1553 (2011).\n61. Vieta, E. et al. Effectiveness of psychotropic medications \nin the maintenance phase of bipolar disorder: a meta￾analysis of randomized controlled trials. Int. \nJ. Neuropsychopharmacol. 14, 1029–1049 (2011).\n62. Wisdom, N. M., Callahan, J. L. & Hawkins, K. A. The \neffects of apolipoprotein E on non-impaired cognitive \nfunctioning: a meta-analysis. Neurobiol. Aging 32, \n63–74 (2011).\n63. Witteman, J., van Ijzendoorn, M. H., van de Velde, D., \nvan Heuven, V. J. & Schiller, N. O. The nature of \nhemispheric specialization for linguistic and emotional \nprosodic perception: a meta-analysis of the lesion \nliterature. Neuropsychologia 49, 3722–3738 (2011).\n64. Woon, F. & Hedges, D. W. Gender does not moderate \nhippocampal volume deficits in adults with \nposttraumatic stress disorder: a meta-analysis. \nHippocampus 21, 243–252 (2011).\n65. Xuan, C. et al. No association between APOE ε 4 allele \nand multiple sclerosis susceptibility: a meta-analysis \nfrom 5472 cases and 4727 controls. J. Neurol. Sci. \n308, 110–116 (2011).\n66. Yang, W. M., Kong, F. Y., Liu, M. & Hao, Z. L. \nSystematic review of risk factors for progressive \nischemic stroke. Neural Regen. Res. 6, 346–352 \n(2011).\n67. Yang, Z., Li, W. J., Huang, T., Chen, J. M. & Zhang, X. \nMeta-analysis of Ginkgo biloba extract for the \ntreatment of Alzheimer’s disease. Neural Regen. Res. \n6, 1125–1129 (2011).\n68. Yuan, H. et al. Meta-analysis of tau genetic \npolymorphism and sporadic progressive supranuclear \npalsy susceptibility. Neural Regen. Res. 6, 353–359 \n(2011).\n69. Zafar, S. N., Iqbal, A., Farez, M. F., Kamatkar, S. & de \nMoya, M. A. Intensive insulin therapy in brain injury: a \nmeta-analysis. J. Neurotrauma 28, 1307–1317 \n(2011).\nANALYSIS\nNATURE REVIEWS | NEUROSCIENCE VOLUME 14 | MAY 2013 | 375\n© 2013 Macmillan Publishers Limited. All rights reserved\n\n70. Zhang, Y. G. et al. The –1082G/A polymorphism in \nIL‑10 gene is associated with risk of Alzheimer’s \ndisease: a meta-analysis. J. Neurol. Sci. 303, \n133–138 (2011).\n71. Zhu, Y., He, Z. Y. & Liu, H. N. Meta-analysis of the \nrelationship between homocysteine, vitamin B(12), \nfolate, and multiple sclerosis. J. Clin. Neurosci. 18, \n933–938 (2011).\n72. Ioannidis, J. P. & Trikalinos, T. A. An exploratory test \nfor an excess of significant findings. Clin. Trials 4, \n245–253 (2007).\nThis study describes a test that evaluates whether \nthere is an excess of significant findings in the \npublished literature. The number of expected \nstudies with statistically significant results is \nestimated and compared against the number of \nobserved significant studies.\n73. Ioannidis, J. P. Excess significance bias in the literature \non brain volume abnormalities. Arch. Gen. Psychiatry \n68, 773–780 (2011).\n74. Pfeiffer, T., Bertram, L. & Ioannidis, J. P. Quantifying \nselective reporting and the Proteus phenomenon for \nmultiple datasets with similar bias. PLoS ONE 6, \ne18362 (2011).\n75. Tsilidis, K. K., Papatheodorou, S. I., Evangelou, E. & \nIoannidis, J. P. Evaluation of excess statistical \nsignificance in meta-analyses of 98 biomarker \nassociations with cancer risk. J. Natl Cancer Inst. 104,\n1867–1878 (2012).\n76. Ioannidis, J. Clarifications on the application and \ninterpretation of the test for excess significance and its \nextensions. J. Math. Psychol. (in the press).\n77. David, S. P. et al. Potential reporting bias in small \nfMRI studies of the brain. PLoS Biol. (in the press).\n78. Sena, E. S., van der Worp, H. B., Bath, P. M., \nHowells, D. W. & Macleod, M. R. Publication bias in \nreports of animal stroke studies leads to major \noverstatement of efficacy. PLoS Biol. 8, e1000344 \n(2010).\n79. Ioannidis, J. P. Extrapolating from animals to humans. \nSci. Transl. Med. 4, 151ps15 (2012).\n80. Jonasson, Z. Meta-analysis of sex differences in rodent \nmodels of learning and memory: a review of behavioral \nand biological data. Neurosci. Biobehav. Rev. 28, \n811–825 (2005).\n81. Macleod, M. R. et al. Evidence for the efficacy of \nNXY‑059 in experimental focal cerebral ischaemia is \nconfounded by study quality. Stroke 39, 2824–2829 \n(2008).\n82. Sena, E., van der Worp, H. B., Howells, D. & \nMacleod, M. How can we improve the pre-clinical \ndevelopment of drugs for stroke? Trends Neurosci. 30, \n433–439 (2007).\n83. Russell, W. M. S. & Burch, R. L. The Principles of \nHumane Experimental Technique (Methuen, 1958).\n84. Kilkenny, C., Browne, W. J., Cuthill, I. C., Emerson, M. \n& Altman, D. G. Improving bioscience research \nreporting: the ARRIVE guidelines for reporting animal \nresearch. PLoS Biol. 8, e1000412 (2010).\n85. Bassler, D., Montori, V. M., Briel, M., Glasziou, P. & \nGuyatt, G. Early stopping of randomized clinical trials \nfor overt efficacy is problematic. J. Clin. Epidemiol. 61, \n241–246 (2008).\n86. Montori, V. M. et al. Randomized trials stopped early \nfor benefit: a systematic review. JAMA 294, \n2203–2209 (2005).\n87. Berger, J. O. & Wolpert, R. L. The Likelihood Principle: \nA Review, Generalizations, and Statistical Implications\n(ed. Gupta, S. S.) (Institute of Mathematical Sciences, \n1998).\n88. Vesterinen, H. M. et al. Systematic survey of the \ndesign, statistical analysis, and reporting of studies \npublished in the 2008 volume of the Journal of \nCerebral Blood Flow and Metabolism. J. Cereb. Blood \nFlow Metab. 31, 1064–1072 (2011).\n89. Smith, R. A., Levine, T. R., Lachlan, K. A. & \nFediuk, T. A. The high cost of complexity in \nexperimental design and data analysis: type I and type \nII error rates in multiway ANOVA. Hum. Comm. Res. \n28, 515–530 (2002).\n90. Perel, P. et al. Comparison of treatment effects \nbetween animal experiments and clinical trials: \nsystematic review. BMJ 334, 197 (2007).\n91. Nosek, B. A. & Bar-Anan, Y. Scientific utopia: I. \nOpening scientific communication. Psychol. Inquiry \n23, 217–243 (2012).\n92. Open-Science-Collaboration. An open, large-scale, \ncollaborative effort to estimate the reproducibility of \npsychological science. Perspect. Psychol. Sci. 7, \n657–660 (2012).\nThis article describes the Reproducibility Project — \nan open, large-scale, collaborative effort to \nsystematically examine the rate and predictors of \nreproducibility in psychological science. This will \nallow the empirical rate of replication to be \nestimated.\n93. Simera, I. et al. Transparent and accurate reporting \nincreases reliability, utility, and impact of your \nresearch: reporting guidelines and the EQUATOR \nNetwork. BMC Med. 8, 24 (2010).\n94. Ioannidis, J. P. The importance of potential studies \nthat have not existed and registration of observational \ndata sets. JAMA 308, 575–576 (2012).\n95. Alsheikh-Ali, A. A., Qureshi, W., Al‑Mallah, M. H. & \nIoannidis, J. P. Public availability of published research \ndata in high-impact journals. PLoS ONE 6, e24357 \n(2011).\n96. Ioannidis, J. P. et al. Repeatability of published \nmicroarray gene expression analyses. Nature Genet. \n41, 149–155 (2009).\n97. Ioannidis, J. P. & Khoury, M. J. Improving validation \npractices in “omics” research. Science 334, \n1230–1232 (2011).\n98. Chambers, C. D. Registered Reports: A new publishing \ninitiative at Cortex. Cortex 49, 609–610 (2013).\n99. Ioannidis, J. P., Tarone, R. & McLaughlin, J. K. The \nfalse-positive to false-negative ratio in epidemiologic \nstudies. Epidemiology 22, 450–456 (2011).\n100. Siontis, K. C., Patsopoulos, N. A. & Ioannidis, J. P. \nReplication of past candidate loci for common \ndiseases and phenotypes in 100 genome-wide \nassociation studies. Eur. J. Hum. Genet. 18, \n832–837 (2010).\n101. Ioannidis, J. P. & Trikalinos, T. A. Early extreme \ncontradictory estimates may appear in published \nresearch: the Proteus phenomenon in molecular \ngenetics research and randomized trials. J. Clin. \nEpidemiol. 58, 543–549 (2005).\n102. Ioannidis, J. Why science is not necessarily self￾correcting. Perspect. Psychol. Sci. 7, 645–654 \n(2012).\n103. Zollner, S. & Pritchard, J. K. Overcoming the winner’s \ncurse: estimating penetrance parameters from case￾control data. Am. J. Hum. Genet. 80, 605–615 (2007).\nAcknowledgements\nM.R.M. and K.S.B. are members of the UK Centre for Tobacco \nControl Studies, a UK Public Health Research Centre of \nExcellence. Funding from British Heart Foundation, Cancer \nResearch UK, Economic and Social Research Council, Medical \nResearch Council and the UK National Institute for Health \nResearch, under the auspices of the UK Clinical Research \nCollaboration, is gratefully acknowledged. The authors are \ngrateful to G. Lewis for his helpful comments.\nCompeting interests statement\nThe authors declare no competing financial interests.\nANALYSIS\n376 | MAY 2013 | VOLUME 14 www.nature.com/reviews/neuro\nFURTHER INFORMATION\nMarcus R. Munafò’s homepage: http://www.bris.ac.uk/\nexpsych/research/brain/targ/\nCAMARADES: http://www.camarades.info/\nCONSORT: http://www.consort-statement.org/\nDryad: http://dat adryad.org/\nEQUATOR Network: http://www.equator-network.org/\nfigshare: http://figshare.com/\nINDI: http://fcon_1000.projects.nitrc.org/\nOASIS: http://www.oasis-open.org \nOpenfMRI: http://www.openfmri.org/\nOSF: http://openscienceframework.org/\nPRISMA: http://www.prisma-statement.org/\nThe Dataverse Network Project: http://thedata.org\nALL LINKS ARE ACTIVE IN THE ONLINE PDF\n© 2013 Macmillan Publishers Limited. All rights reserved\n\n"], "response": "The article discusses the issue of low statistical power in scientific studies, particularly in the field of neuroscience. It explains how low power leads to three major problems: incorrectly concluding that a difference does not exist (type II error or false negative), overstating the precision of a measurement (inflation of effect sizes), and overestimating the magnitude of an effect (winner's curse). These issues can lead to wasted resources, incorrect conclusions, and missed opportunities for further research. The author suggests several ways to address this problem, including increasing sample sizes, improving study design, and reporting standards. The article also mentions various initiatives aimed at promoting transparency, accuracy, and replicability in scientific research, such as registered reports, preregistration, and open data sharing. Overall, the article highlights the need for greater awareness and action regarding the importance of statistical power in scientific research."}
{"user_input": "Which technologies show the strongest publication/citation increases in the last five years indicating emerging interests/trends/consensus (outside of the expected like AI or by center or region)?", "retrieved_contexts": ["[image]\nUsers Online : 179112\n•  Home\n•  About Us\nSalient Features Bibliographic Information Abstracting and\nIndexing Specialties Covered Publisher Testimonials License\nAcademics JCDR Performance International Stats Journal\nPolicies Legitimate/ Non‐Predatory\n•  Issues\nCurrent Issue Online Ahead of Print Archive Audio-Visual\nSection Forthcoming Issue\n•  Editorial\nEditorial Statements Editorial-PeerReview Process Editorial\nBoard Join us Academics JCDR Performance International\nStats Quoted article Journal Policies\n•  Authors\nSubmit an Article Manuscript Instuctions Manuscript\nAssistance Publication Charges Paid Services Early Online\nPublication Service\n•  Reviewers\nApply as Reviewer Instruction for Reviewer Reviewers\nAcknowledgment\n•  Search\nSimple Search Advanced Search\n•  Subscription\nAnnual Subscription Buy One Issue Payment Options How to\nOrder\n•  Register\nFor Post Publication Review For New Submission\n•  Login\n•  Contact\n[image] Article in PDF How to Cite Citation Manager Readers'\nComments (0) Audio Visual Article Statistics Link to PUBMED Send\nto a Friend\n[image] Advertisers Access Statistics Resources [image]\n\n\nDr Mohan Z Mani\n\"Thank you very much for having published my article in record\ntime.I would like to compliment you and your entire staff for your\npromptness, courtesy, and willingness to be customer friendly,\nwhich is quite unusual.I was given your reference by a colleague in\npathology,and was able to directly phone your editorial office for\nclarifications.I would particularly like to thank the publication\nmanagers and the Assistant Editor who were following up my\narticle. I would also like to thank you for adjusting the money I\npaid initially into payment for my modified article,and refunding\nthe balance.\nI wish all success to your journal and look forward to sending you\nany suitable similar article in future\"\nDr Mohan Z Mani,\nProfessor & Head,\nDepartment of Dermatolgy,\nBelievers Church Medical College,\nThiruvalla, Kerala\nOn Sep 2018\nProf. Somashekhar Nimbalkar\n\"Over the last few years, we have published our research regularly\nin Journal of Clinical and Diagnostic Research. Having published in\nmore than 20 high impact journals over the last five years including\nseveral high impact ones and reviewing articles for even more\njournals across my fields of interest, we value our published work in\nJCDR for their high standards in publishing scientific articles. The\nease of submission, the rapid reviews in under a month, the high\nquality of their reviewers and keen attention to the final process of\nproofs and publication, ensure that there are no mistakes in the\nfinal article. We have been asked clarifications on several occasions\nand have been happy to provide them and it exemplifies the\n\n\ncommitment to quality of the team at JCDR.\"\nProf. Somashekhar Nimbalkar\nHead, Department of Pediatrics, Pramukhswami Medical College,\nKaramsad\nChairman, Research Group, Charutar Arogya Mandal, Karamsad\nNational Joint Coordinator - Advanced IAP NNF NRP Program\nEx-Member, Governing Body, National Neonatology Forum, New\nDelhi\nEx-President - National Neonatology Forum Gujarat State Chapter\nDepartment of Pediatrics, Pramukhswami Medical College,\nKaramsad, Anand, Gujarat.\nOn Sep 2018\nDr. Kalyani R\n\"Journal of Clinical and Diagnostic Research is at present a well-\nknown Indian originated scientific journal which started with a\nhumble beginning. I have been associated with this journal since\nmany years. I appreciate the Editor, Dr. Hemant Jain, for his\nconstant effort in bringing up this journal to the present status right\nfrom the scratch. The journal is multidisciplinary. It encourages in\npublishing the scientific articles from postgraduates and also the\nbeginners who start their career. At the same time the journal also\ncaters for the high quality articles from specialty and super-\nspecialty researchers. Hence it provides a platform for the scientist\nand researchers to publish. The other aspect of it is, the readers get\nthe information regarding the most recent developments in science\nwhich can be used for teaching, research, treating patients and to\nsome extent take preventive measures against certain diseases. The\njournal is contributing immensely to the society at national and\ninternational level.\"\n\n\nDr Kalyani R\nProfessor and Head\nDepartment of Pathology\nSri Devaraj Urs Medical College\nSri Devaraj Urs Academy of Higher Education and Research , Kolar,\nKarnataka\nOn Sep 2018\nDr. Saumya Navit\n\"As a peer-reviewed journal, the Journal of Clinical and Diagnostic\nResearch provides an opportunity to researchers, scientists and\nbudding professionals to explore the developments in the field of\nmedicine and dentistry and their varied specialities, thus extending\nour view on biological diversities of living species in relation to\nmedicine.\n�Knowledge is treasure of a wise man.� The free access of this\njournal provides an immense scope of learning for the both the old\nand the young in field of medicine and dentistry as well. The\nmultidisciplinary nature of the journal makes it a better platform to\nabsorb all that is being researched and developed. The publication\nprocess is systematic and professional. Online submission,\npublication and peer reviewing makes it a user-friendly journal.\nAs an experienced dentist and an academician, I proudly\nrecommend this journal to the dental fraternity as a good quality\nopen access platform for rapid communication of their cutting-edge\nresearch progress and discovery.\nI wish JCDR a great success and I hope that journal will soar higher\nwith the passing time.\"\nDr Saumya Navit\nProfessor and Head\nDepartment of Pediatric Dentistry\nSaraswati Dental College\nLucknow\n\n\nOn Sep 2018\nDr. Arunava Biswas\n\"My sincere attachment with JCDR as an author as well as reviewer\nis a learning experience . Their systematic approach in publication\nof article in various categories is really praiseworthy.\nTheir prompt and timely response to review's query and the manner\nin which they have set the reviewing process helps in extracting the\nbest possible scientific writings for publication.\nIt's a honour and pride to be a part of the JCDR team. My very best\nwishes to JCDR and hope it will sparkle up above the sky as a high\nindexed journal in near future.\"\nDr. Arunava Biswas\nMD, DM (Clinical Pharmacology)\nAssistant Professor\nDepartment of Pharmacology\nCalcutta National Medical College & Hospital , Kolkata\nDr. C.S. Ramesh Babu\n\" Journal of Clinical and Diagnostic Research (JCDR) is a multi-\nspecialty medical and dental journal publishing high quality\nresearch articles in almost all branches of medicine. The quality of\nprinting of figures and tables is excellent and comparable to any\nInternational journal. An added advantage is nominal publication\ncharges and monthly issue of the journal and more chances of an\narticle being accepted for publication. Moreover being a multi-\nspecialty journal an article concerning a particular specialty has a\nwider reach of readers of other related specialties also. As an author\nand reviewer for several years I find this Journal most suitable and\nhighly recommend this Journal.\"\n\n\nBest regards,\nC.S. Ramesh Babu,\nAssociate Professor of Anatomy,\nMuzaffarnagar Medical College,\nMuzaffarnagar.\nOn Aug 2018\nDr. Arundhathi. S\n\"Journal of Clinical and Diagnostic Research (JCDR) is a reputed\npeer reviewed journal and is constantly involved in publishing high\nquality research articles related to medicine. Its been a great\npleasure to be associated with this esteemed journal as a reviewer\nand as an author for a couple of years. The editorial board consists\nof many dedicated and reputed experts as its members and they are\ndoing an appreciable work in guiding budding researchers. JCDR is\ndoing a commendable job in scientific research by promoting\nexcellent quality research & review articles and case reports &\nseries. The reviewers provide appropriate suggestions that improve\nthe quality of articles. I strongly recommend my fraternity to\nencourage JCDR by contributing their valuable research work in\nthis widely accepted, user friendly journal. I hope my collaboration\nwith JCDR will continue for a long time\".\nDr. Arundhathi. S\nMBBS, MD (Pathology),\nSanjay Gandhi institute of trauma and orthopedics,\nBengaluru.\nOn Aug 2018\nDr. Mamta Gupta,\n\"It gives me great pleasure to be associated with JCDR, since last\n2-3 years. Since then I have authored, co-authored and reviewed\nabout 25 articles in JCDR. I thank JCDR for giving me an\nopportunity to improve my own skills as an author and a reviewer.\n\n\nIt 's a multispecialty journal, publishing high quality articles. It\ngives a platform to the authors to publish their research work which\ncan be available for everyone across the globe to read. The best\nthing about JCDR is that the full articles of all medical specialties\nare available as pdf/html for reading free of cost or without\ninstitutional subscription, which is not there for other journals. For\nthose who have problem in writing manuscript or do statistical\nwork, JCDR comes for their rescue.\nThe journal has a monthly publication and the articles are\npublished quite fast. In time compared to other journals. The on-\nline first publication is also a great advantage and facility to review\none's own articles before going to print. The response to any query\nand permission if required, is quite fast; this is quite commendable.\nI have a very good experience about seeking quick permission for\nquoting a photograph (Fig.) from a JCDR article for my chapter\nauthored in an E book. I never thought it would be so easy. No\nhassles.\nReviewing articles is no less a pain staking process and requires in\ndepth perception, knowledge about the topic for review. It requires\ntime and concentration, yet I enjoy doing it. The JCDR website\nespecially for the reviewers is quite user friendly. My suggestions\nfor improving the journal is, more strict review process, so that only\nhigh quality articles are published. I find a a good number of\narticles in Obst. Gynae, hence, a new journal for this specialty titled\nJCDR-OG can be started. May be a bimonthly or quarterly\npublication to begin with. Only selected articles should find a place\nin it.\nAn yearly reward for the best article authored can also incentivize\nthe authors. Though the process of finding the best article will be\nnot be very easy. I do not know how reviewing process can be\nimproved. If an article is being reviewed by two reviewers, then\nopinion of one can be communicated to the other or the final\nopinion of the editor can be communicated to the reviewer if\nrequested for. This will help one�s reviewing skills.\nMy best wishes to Dr. Hemant Jain and all the editorial staff of\nJCDR for their untiring efforts to bring out this journal. I strongly\nrecommend medical fraternity to publish their valuable research\nwork in this esteemed journal, JCDR\".\n\n\nDr. Mamta Gupta\nConsultant\n(Ex HOD Obs &Gynae, Hindu Rao Hospital and associated NDMC\nMedical College, Delhi)\nAug 2018\nDr. Rajendra Kumar Ghritlaharey\n\"I wish to thank Dr. Hemant Jain, Editor-in-Chief Journal of Clinical\nand Diagnostic Research (JCDR), for asking me to write up few\nwords.\nWriting is the representation of language in a textual medium i e;\ninto the words and sentences on paper. Quality medical manuscript\nwriting in particular, demands not only a high-quality research, but\nalso requires accurate and concise communication of findings and\nconclusions, with adherence to particular journal guidelines. In\nmedical field whether working in teaching, private, or in corporate\ninstitution, everyone wants to excel in his / her own field and get\nrecognised by making manuscripts publication.\nAuthors are the souls of any journal, and deserve much respect. To\npublish a journal manuscripts are needed from authors. Authors\nhave a great responsibility for producing facts of their work in\nterms of number and results truthfully and an individual honesty is\nexpected from authors in this regards. Both ways its true \"No\nauthors-No manuscripts-No journals\" and \"No journals�No\nmanuscripts�No authors\". Reviewing a manuscript is also a very\nresponsible and important task of any peer-reviewed journal and to\nbe taken seriously. It needs knowledge on the subject, sincerity,\nhonesty and determination. Although the process of reviewing a\nmanuscript is a time consuming task butit is expected to give one's\nbest remarks within the time frame of the journal.\nSalient features of the JCDR: It is a biomedical, multidisciplinary\n(including all medical and dental specialities), e-journal, with wide\nscope and extensive author support. At the same time, a free text of\nmanuscript is available in HTML and PDF format. There is fast\ngrowing authorship and readership with JCDR as this can be judged\nby the number of articles published in it i e; in Feb 2007 of its first\n\n\nissue, it contained 5 articles only, and now in its recent volume\npublished in April 2011, it contained 67 manuscripts. This e-journal\nis fulfilling the commitments and objectives sincerely, (as stated by\nEditor-in-chief in his preface to first edition) i e; to encourage\nphysicians through the internet, especially from the developing\ncountries who witness a spectrum of disease and acquire a wealth of\nknowledge to publish their experiences to benefit the medical\ncommunity in patients care. I also feel that many of us have work of\nsubstance, newer ideas, adequate clinical materials but poor in\nmedical writing and hesitation to submit the work and need help.\nJCDR provides authors help in this regards.\nTimely publication of journal: Publication of manuscripts and\nbringing out the issue in time is one of the positive aspects of JCDR\nand is possible with strong support team in terms of peer reviewers,\nproof reading, language check, computer operators, etc. This is one\nof the great reasons for authors to submit their work with JCDR.\nAnother best part of JCDR is \"Online first Publications\" facilities\navailable for the authors. This facility not only provides the prompt\npublications of the manuscripts but at the same time also early\navailability of the manuscripts for the readers.\nIndexation and online availability: Indexation transforms the\njournal in some sense from its local ownership to the worldwide\nprofessional community and to the public.JCDR is indexed with\nEmbase & EMbiology, Google Scholar, Index Copernicus, Chemical\nAbstracts Service, Journal seek Database, Indian Science Abstracts,\nto name few of them. Manuscriptspublished in JCDR are available\non major search engines ie; google, yahoo, msn.\nIn the era of fast growing newer technologies, and in computer and\ninternet friendly environment the manuscripts preparation,\nsubmission, review, revision, etc and all can be done and checked\nwith a click from all corer of the world, at any time. Of course there\nis always a scope for improvement in every field and none is\nperfect. To progress, one needs to identify the areas of one's\nweakness and to strengthen them.\nIt is well said that \"happy beginning is half done\" and it fits\nperfectly with JCDR. It has grown considerably and I feel it has\nalready grown up from its infancy to adolescence, achieving the\nstatus of standard online e-journal form Indian continent since its\ninception in Feb 2007. This had been made possible due to the\nefforts and the hard work put in it. The way the JCDR is improving\n\n\nwith every new volume, with good quality original manuscripts,\nmakes it a quality journal for readers. I must thank and\ncongratulate Dr Hemant Jain, Editor-in-Chief JCDR and his team for\ntheir sincere efforts, dedication, and determination for making\nJCDR a fast growing journal.\nEvery one of us: authors, reviewers, editors, and publisher are\nresponsible for enhancing the stature of the journal. I wish for a\ngreat success for JCDR.\"\nThanking you\nWith sincere regards\nDr. Rajendra Kumar Ghritlaharey, M.S., M. Ch., FAIS\nAssociate Professor,\nDepartment of Paediatric Surgery, Gandhi Medical College &\nAssociated\nKamla Nehru & Hamidia Hospitals Bhopal, Madhya Pradesh 462\n001 (India)\nE-mail: drrajendrak1@rediffmail.com\nOn May 11,2011\nDr. Shankar P.R.\n\"On looking back through my Gmail archives after being requested\nby the journal to write a short editorial about my experiences of\npublishing with the Journal of Clinical and Diagnostic Research\n(JCDR), I came across an e-mail from Dr. Hemant Jain, Editor, in\nMarch 2007, which introduced the new electronic journal. The\nmain features of the journal which were outlined in the e-mail were\nextensive author support, cash rewards, the peer review process,\nand other salient features of the journal.\nOver a span of over four years, we (I and my colleagues) have\npublished around 25 articles in the journal. In this editorial, I plan\nto briefly discuss my experiences of publishing with JCDR and the\nstrengths of the journal and to finally address the areas for\nimprovement.\nMy experiences of publishing with JCDR: Overall, my experiences\n\n\nof publishing withJCDR have been positive. The best point about\nthe journal is that it responds to queries from the author. This may\nseem to be simple and not too much to ask for, but unfortunately,\nmany journals in the subcontinent and from many developing\ncountries do not respond or they respond with a long delay to the\nqueries from the authors 1. The reasons could be many, including\nlack of optimal secretarial and other support. Another problem with\nmany journals is the slowness of the review process. Editorial\nprocessing and peer review can take anywhere between a year to\ntwo years with some journals. Also, some journals do not keep the\ncontributors informed about the progress of the review process. Due\nto the long review process, the articles can lose their relevance and\ntopicality. A major benefit with JCDR is the timeliness and\npromptness of its response. In Dr Jain's e-mail which was sent to me\nin 2007, before the introduction of the Pre-publishing system, he\nhad stated that he had received my submission and that he would\nget back to me within seven days and he did!\nMost of the manuscripts are published within 3 to 4 months of their\nsubmission if they are found to be suitable after the review process.\nJCDR is published bimonthly and the accepted articles were usually\npublished in the next issue. Recently, due to the increased volume\nof the submissions, the review process has become slower and it ??\nSection can take from 4 to 6 months for the articles to be reviewed.\nThe journal has an extensive author support system and it has\nrecently introduced a paid expedited review process. The journal\nalso mentions the average time for processing the manuscript under\ndifferent submission systems - regular submission and expedited\nreview.\nStrengths of the journal: The journal has an online first facility in\nwhich the accepted manuscripts may be published on the website\nbefore being included in a regular issue of the journal. This cuts\ndown the time between their acceptance and the publication. The\njournal is indexed in many databases, though not in PubMed. The\neditorial board should now take steps to index the journal in\nPubMed. The journal has a system of notifying readers through e-\nmail when a new issue is released. Also, the articles are available in\nboth the HTML and the PDF formats. I especially like the new and\ncolorful page format of the journal. Also, the access statistics of the\narticles are available. The prepublication and the manuscript\ntracking system are also helpful for the authors.\n\n\nAreas for improvement: In certain cases, I felt that the peer review\nprocess of the manuscripts was not up to international standards\nand that it should be strengthened. Also, the number of manuscripts\nin an issue is high and it may be difficult for readers to go through\nall of them. The journal can consider tightening of the peer review\nprocess and increasing the quality standards for the acceptance of\nthe manuscripts. I faced occasional problems with the online\nmanuscript submission (Pre-publishing) system, which have to be\naddressed.\nOverall, the publishing process with JCDR has been smooth, quick\nand relatively hassle free and I can recommend other authors to\nconsider the journal as an outlet for their work.\"\nDr. P. Ravi Shankar\nKIST Medical College, P.O. Box 14142, Kathmandu, Nepal.\nE-mail: ravi.dr.shankar@gmail.com\nOn April 2011 Anuradha\nDear team JCDR, I would like to thank you for the very professional\nand polite service provided by everyone at JCDR. While i have been\nin the field of writing and editing for sometime, this has been my\nfirst attempt in publishing a scientific paper.Thank you for hand-\nholding me through the process.\nDr. Anuradha\nE-mail: anuradha2nittur@gmail.com\nOn Jan 2020\nImportant Notice\n[image] Download PDF\nYear : 2013 | Month : February | Volume : 7 | Issue : 2 | Page : 386 -\n388\nClick here [image] to download PDF version of the article !\nClick here [image] download Adobe© Acrobat Reader.\n\n\nJCDR is now Monthly and more widely Indexed .\n•  Emerging Sources Citation Index (Web of Science,\nthomsonreuters)\n•  Index Copernicus ICV 2016: 132.37\n•  Academic Search Complete Database\n•  Directory of Open Access Journals (DOAJ)\n•  EBSCOhost\n•  Google Scholar\n•  HINARI Access to Research in Health Programme\n•  Indian Science Abstracts (ISA)\n•  Journal seek Database\n•  Google\n•  Popline (reproductive health literature)\n•  www.omnimedicalsearch.com\nSitemap | Login | Register | Feedback | Contact | Advertisers |\nCopyright & Disclaimer | Important Notice\nAffiliated websites : JCDR Prepublishing | Neonatal Database |\nNeonatal Database download center\nPremchand Shantidevi Research Foundation (PSRF, India)\n© Copyright 2007-2025, Journal of Clinical and Diagnostic\nResearch, India.\n\n\n"], "response": "The article highlights the experiences of several authors who have published their works in the Journal of Clinical and Diagnostic Research (JCDR). They praise the journal's prompt responses to queries, timely publication process, and extensive author support system. However, some authors suggest improvements such as stricter review processes and tighter quality standards for manuscript acceptance. The article also mentions that JCDR is a multidisciplinary, e-journal with wide author and reader support, and it offers free access to articles in HTML and PDF formats. Additionally, the journal has a paid expedited review process and a prepublication system. Some authors also recommend that JCDR should aim to be indexed in PubMed. Overall, the authors express positive experiences with JCDR and recommend it as an outlet for their work."}
{"user_input": "Which technologies show the strongest publication/citation increases in the last five years indicating emerging interests/trends/consensus (outside of the expected like AI or by center or region)?", "retrieved_contexts": ["[image]\nUsers Online : 168027\n•  Home\n•  About Us\nSalient Features Bibliographic Information Abstracting and\nIndexing Specialties Covered Publisher Testimonials License\nAcademics JCDR Performance International Stats Journal\nPolicies Legitimate/ Non‐Predatory\n•  Issues\nCurrent Issue Online Ahead of Print Archive Audio-Visual\nSection Forthcoming Issue\n•  Editorial\nEditorial Statements Editorial-PeerReview Process Editorial\nBoard Join us Academics JCDR Performance International\nStats Quoted article Journal Policies\n•  Authors\nSubmit an Article Manuscript Instuctions Manuscript\nAssistance Publication Charges Paid Services Early Online\nPublication Service\n•  Reviewers\nApply as Reviewer Instruction for Reviewer Reviewers\nAcknowledgment\n•  Search\nSimple Search Advanced Search\n•  Subscription\nAnnual Subscription Buy One Issue Payment Options How to\nOrder\n•  Register\nFor Post Publication Review For New Submission\n•  Login\n•  Contact\n[image] Article in PDF How to Cite Citation Manager Readers'\nComments (0) Audio Visual Article Statistics Link to PUBMED Send\nto a Friend\n[image] Advertisers Access Statistics Resources [image]\n\n\nDr Mohan Z Mani\n\"Thank you very much for having published my article in record\ntime.I would like to compliment you and your entire staff for your\npromptness, courtesy, and willingness to be customer friendly,\nwhich is quite unusual.I was given your reference by a colleague in\npathology,and was able to directly phone your editorial office for\nclarifications.I would particularly like to thank the publication\nmanagers and the Assistant Editor who were following up my\narticle. I would also like to thank you for adjusting the money I\npaid initially into payment for my modified article,and refunding\nthe balance.\nI wish all success to your journal and look forward to sending you\nany suitable similar article in future\"\nDr Mohan Z Mani,\nProfessor & Head,\nDepartment of Dermatolgy,\nBelievers Church Medical College,\nThiruvalla, Kerala\nOn Sep 2018\nProf. Somashekhar Nimbalkar\n\"Over the last few years, we have published our research regularly\nin Journal of Clinical and Diagnostic Research. Having published in\nmore than 20 high impact journals over the last five years including\nseveral high impact ones and reviewing articles for even more\njournals across my fields of interest, we value our published work in\nJCDR for their high standards in publishing scientific articles. The\nease of submission, the rapid reviews in under a month, the high\nquality of their reviewers and keen attention to the final process of\nproofs and publication, ensure that there are no mistakes in the\nfinal article. We have been asked clarifications on several occasions\nand have been happy to provide them and it exemplifies the\n\n\ncommitment to quality of the team at JCDR.\"\nProf. Somashekhar Nimbalkar\nHead, Department of Pediatrics, Pramukhswami Medical College,\nKaramsad\nChairman, Research Group, Charutar Arogya Mandal, Karamsad\nNational Joint Coordinator - Advanced IAP NNF NRP Program\nEx-Member, Governing Body, National Neonatology Forum, New\nDelhi\nEx-President - National Neonatology Forum Gujarat State Chapter\nDepartment of Pediatrics, Pramukhswami Medical College,\nKaramsad, Anand, Gujarat.\nOn Sep 2018\nDr. Kalyani R\n\"Journal of Clinical and Diagnostic Research is at present a well-\nknown Indian originated scientific journal which started with a\nhumble beginning. I have been associated with this journal since\nmany years. I appreciate the Editor, Dr. Hemant Jain, for his\nconstant effort in bringing up this journal to the present status right\nfrom the scratch. The journal is multidisciplinary. It encourages in\npublishing the scientific articles from postgraduates and also the\nbeginners who start their career. At the same time the journal also\ncaters for the high quality articles from specialty and super-\nspecialty researchers. Hence it provides a platform for the scientist\nand researchers to publish. The other aspect of it is, the readers get\nthe information regarding the most recent developments in science\nwhich can be used for teaching, research, treating patients and to\nsome extent take preventive measures against certain diseases. The\njournal is contributing immensely to the society at national and\ninternational level.\"\n\n\nDr Kalyani R\nProfessor and Head\nDepartment of Pathology\nSri Devaraj Urs Medical College\nSri Devaraj Urs Academy of Higher Education and Research , Kolar,\nKarnataka\nOn Sep 2018\nDr. Saumya Navit\n\"As a peer-reviewed journal, the Journal of Clinical and Diagnostic\nResearch provides an opportunity to researchers, scientists and\nbudding professionals to explore the developments in the field of\nmedicine and dentistry and their varied specialities, thus extending\nour view on biological diversities of living species in relation to\nmedicine.\n�Knowledge is treasure of a wise man.� The free access of this\njournal provides an immense scope of learning for the both the old\nand the young in field of medicine and dentistry as well. The\nmultidisciplinary nature of the journal makes it a better platform to\nabsorb all that is being researched and developed. The publication\nprocess is systematic and professional. Online submission,\npublication and peer reviewing makes it a user-friendly journal.\nAs an experienced dentist and an academician, I proudly\nrecommend this journal to the dental fraternity as a good quality\nopen access platform for rapid communication of their cutting-edge\nresearch progress and discovery.\nI wish JCDR a great success and I hope that journal will soar higher\nwith the passing time.\"\nDr Saumya Navit\nProfessor and Head\nDepartment of Pediatric Dentistry\nSaraswati Dental College\nLucknow\n\n\nOn Sep 2018\nDr. Arunava Biswas\n\"My sincere attachment with JCDR as an author as well as reviewer\nis a learning experience . Their systematic approach in publication\nof article in various categories is really praiseworthy.\nTheir prompt and timely response to review's query and the manner\nin which they have set the reviewing process helps in extracting the\nbest possible scientific writings for publication.\nIt's a honour and pride to be a part of the JCDR team. My very best\nwishes to JCDR and hope it will sparkle up above the sky as a high\nindexed journal in near future.\"\nDr. Arunava Biswas\nMD, DM (Clinical Pharmacology)\nAssistant Professor\nDepartment of Pharmacology\nCalcutta National Medical College & Hospital , Kolkata\nDr. C.S. Ramesh Babu\n\" Journal of Clinical and Diagnostic Research (JCDR) is a multi-\nspecialty medical and dental journal publishing high quality\nresearch articles in almost all branches of medicine. The quality of\nprinting of figures and tables is excellent and comparable to any\nInternational journal. An added advantage is nominal publication\ncharges and monthly issue of the journal and more chances of an\narticle being accepted for publication. Moreover being a multi-\nspecialty journal an article concerning a particular specialty has a\nwider reach of readers of other related specialties also. As an author\nand reviewer for several years I find this Journal most suitable and\nhighly recommend this Journal.\"\n\n\nBest regards,\nC.S. Ramesh Babu,\nAssociate Professor of Anatomy,\nMuzaffarnagar Medical College,\nMuzaffarnagar.\nOn Aug 2018\nDr. Arundhathi. S\n\"Journal of Clinical and Diagnostic Research (JCDR) is a reputed\npeer reviewed journal and is constantly involved in publishing high\nquality research articles related to medicine. Its been a great\npleasure to be associated with this esteemed journal as a reviewer\nand as an author for a couple of years. The editorial board consists\nof many dedicated and reputed experts as its members and they are\ndoing an appreciable work in guiding budding researchers. JCDR is\ndoing a commendable job in scientific research by promoting\nexcellent quality research & review articles and case reports &\nseries. The reviewers provide appropriate suggestions that improve\nthe quality of articles. I strongly recommend my fraternity to\nencourage JCDR by contributing their valuable research work in\nthis widely accepted, user friendly journal. I hope my collaboration\nwith JCDR will continue for a long time\".\nDr. Arundhathi. S\nMBBS, MD (Pathology),\nSanjay Gandhi institute of trauma and orthopedics,\nBengaluru.\nOn Aug 2018\nDr. Mamta Gupta,\n\"It gives me great pleasure to be associated with JCDR, since last\n2-3 years. Since then I have authored, co-authored and reviewed\nabout 25 articles in JCDR. I thank JCDR for giving me an\nopportunity to improve my own skills as an author and a reviewer.\n\n\nIt 's a multispecialty journal, publishing high quality articles. It\ngives a platform to the authors to publish their research work which\ncan be available for everyone across the globe to read. The best\nthing about JCDR is that the full articles of all medical specialties\nare available as pdf/html for reading free of cost or without\ninstitutional subscription, which is not there for other journals. For\nthose who have problem in writing manuscript or do statistical\nwork, JCDR comes for their rescue.\nThe journal has a monthly publication and the articles are\npublished quite fast. In time compared to other journals. The on-\nline first publication is also a great advantage and facility to review\none's own articles before going to print. The response to any query\nand permission if required, is quite fast; this is quite commendable.\nI have a very good experience about seeking quick permission for\nquoting a photograph (Fig.) from a JCDR article for my chapter\nauthored in an E book. I never thought it would be so easy. No\nhassles.\nReviewing articles is no less a pain staking process and requires in\ndepth perception, knowledge about the topic for review. It requires\ntime and concentration, yet I enjoy doing it. The JCDR website\nespecially for the reviewers is quite user friendly. My suggestions\nfor improving the journal is, more strict review process, so that only\nhigh quality articles are published. I find a a good number of\narticles in Obst. Gynae, hence, a new journal for this specialty titled\nJCDR-OG can be started. May be a bimonthly or quarterly\npublication to begin with. Only selected articles should find a place\nin it.\nAn yearly reward for the best article authored can also incentivize\nthe authors. Though the process of finding the best article will be\nnot be very easy. I do not know how reviewing process can be\nimproved. If an article is being reviewed by two reviewers, then\nopinion of one can be communicated to the other or the final\nopinion of the editor can be communicated to the reviewer if\nrequested for. This will help one�s reviewing skills.\nMy best wishes to Dr. Hemant Jain and all the editorial staff of\nJCDR for their untiring efforts to bring out this journal. I strongly\nrecommend medical fraternity to publish their valuable research\nwork in this esteemed journal, JCDR\".\n\n\nDr. Mamta Gupta\nConsultant\n(Ex HOD Obs &Gynae, Hindu Rao Hospital and associated NDMC\nMedical College, Delhi)\nAug 2018\nDr. Rajendra Kumar Ghritlaharey\n\"I wish to thank Dr. Hemant Jain, Editor-in-Chief Journal of Clinical\nand Diagnostic Research (JCDR), for asking me to write up few\nwords.\nWriting is the representation of language in a textual medium i e;\ninto the words and sentences on paper. Quality medical manuscript\nwriting in particular, demands not only a high-quality research, but\nalso requires accurate and concise communication of findings and\nconclusions, with adherence to particular journal guidelines. In\nmedical field whether working in teaching, private, or in corporate\ninstitution, everyone wants to excel in his / her own field and get\nrecognised by making manuscripts publication.\nAuthors are the souls of any journal, and deserve much respect. To\npublish a journal manuscripts are needed from authors. Authors\nhave a great responsibility for producing facts of their work in\nterms of number and results truthfully and an individual honesty is\nexpected from authors in this regards. Both ways its true \"No\nauthors-No manuscripts-No journals\" and \"No journals�No\nmanuscripts�No authors\". Reviewing a manuscript is also a very\nresponsible and important task of any peer-reviewed journal and to\nbe taken seriously. It needs knowledge on the subject, sincerity,\nhonesty and determination. Although the process of reviewing a\nmanuscript is a time consuming task butit is expected to give one's\nbest remarks within the time frame of the journal.\nSalient features of the JCDR: It is a biomedical, multidisciplinary\n(including all medical and dental specialities), e-journal, with wide\nscope and extensive author support. At the same time, a free text of\nmanuscript is available in HTML and PDF format. There is fast\ngrowing authorship and readership with JCDR as this can be judged\nby the number of articles published in it i e; in Feb 2007 of its first\n\n\nissue, it contained 5 articles only, and now in its recent volume\npublished in April 2011, it contained 67 manuscripts. This e-journal\nis fulfilling the commitments and objectives sincerely, (as stated by\nEditor-in-chief in his preface to first edition) i e; to encourage\nphysicians through the internet, especially from the developing\ncountries who witness a spectrum of disease and acquire a wealth of\nknowledge to publish their experiences to benefit the medical\ncommunity in patients care. I also feel that many of us have work of\nsubstance, newer ideas, adequate clinical materials but poor in\nmedical writing and hesitation to submit the work and need help.\nJCDR provides authors help in this regards.\nTimely publication of journal: Publication of manuscripts and\nbringing out the issue in time is one of the positive aspects of JCDR\nand is possible with strong support team in terms of peer reviewers,\nproof reading, language check, computer operators, etc. This is one\nof the great reasons for authors to submit their work with JCDR.\nAnother best part of JCDR is \"Online first Publications\" facilities\navailable for the authors. This facility not only provides the prompt\npublications of the manuscripts but at the same time also early\navailability of the manuscripts for the readers.\nIndexation and online availability: Indexation transforms the\njournal in some sense from its local ownership to the worldwide\nprofessional community and to the public.JCDR is indexed with\nEmbase & EMbiology, Google Scholar, Index Copernicus, Chemical\nAbstracts Service, Journal seek Database, Indian Science Abstracts,\nto name few of them. Manuscriptspublished in JCDR are available\non major search engines ie; google, yahoo, msn.\nIn the era of fast growing newer technologies, and in computer and\ninternet friendly environment the manuscripts preparation,\nsubmission, review, revision, etc and all can be done and checked\nwith a click from all corer of the world, at any time. Of course there\nis always a scope for improvement in every field and none is\nperfect. To progress, one needs to identify the areas of one's\nweakness and to strengthen them.\nIt is well said that \"happy beginning is half done\" and it fits\nperfectly with JCDR. It has grown considerably and I feel it has\nalready grown up from its infancy to adolescence, achieving the\nstatus of standard online e-journal form Indian continent since its\ninception in Feb 2007. This had been made possible due to the\nefforts and the hard work put in it. The way the JCDR is improving\n\n\nwith every new volume, with good quality original manuscripts,\nmakes it a quality journal for readers. I must thank and\ncongratulate Dr Hemant Jain, Editor-in-Chief JCDR and his team for\ntheir sincere efforts, dedication, and determination for making\nJCDR a fast growing journal.\nEvery one of us: authors, reviewers, editors, and publisher are\nresponsible for enhancing the stature of the journal. I wish for a\ngreat success for JCDR.\"\nThanking you\nWith sincere regards\nDr. Rajendra Kumar Ghritlaharey, M.S., M. Ch., FAIS\nAssociate Professor,\nDepartment of Paediatric Surgery, Gandhi Medical College &\nAssociated\nKamla Nehru & Hamidia Hospitals Bhopal, Madhya Pradesh 462\n001 (India)\nE-mail: drrajendrak1@rediffmail.com\nOn May 11,2011\nDr. Shankar P.R.\n\"On looking back through my Gmail archives after being requested\nby the journal to write a short editorial about my experiences of\npublishing with the Journal of Clinical and Diagnostic Research\n(JCDR), I came across an e-mail from Dr. Hemant Jain, Editor, in\nMarch 2007, which introduced the new electronic journal. The\nmain features of the journal which were outlined in the e-mail were\nextensive author support, cash rewards, the peer review process,\nand other salient features of the journal.\nOver a span of over four years, we (I and my colleagues) have\npublished around 25 articles in the journal. In this editorial, I plan\nto briefly discuss my experiences of publishing with JCDR and the\nstrengths of the journal and to finally address the areas for\nimprovement.\nMy experiences of publishing with JCDR: Overall, my experiences\n\n\nof publishing withJCDR have been positive. The best point about\nthe journal is that it responds to queries from the author. This may\nseem to be simple and not too much to ask for, but unfortunately,\nmany journals in the subcontinent and from many developing\ncountries do not respond or they respond with a long delay to the\nqueries from the authors 1. The reasons could be many, including\nlack of optimal secretarial and other support. Another problem with\nmany journals is the slowness of the review process. Editorial\nprocessing and peer review can take anywhere between a year to\ntwo years with some journals. Also, some journals do not keep the\ncontributors informed about the progress of the review process. Due\nto the long review process, the articles can lose their relevance and\ntopicality. A major benefit with JCDR is the timeliness and\npromptness of its response. In Dr Jain's e-mail which was sent to me\nin 2007, before the introduction of the Pre-publishing system, he\nhad stated that he had received my submission and that he would\nget back to me within seven days and he did!\nMost of the manuscripts are published within 3 to 4 months of their\nsubmission if they are found to be suitable after the review process.\nJCDR is published bimonthly and the accepted articles were usually\npublished in the next issue. Recently, due to the increased volume\nof the submissions, the review process has become slower and it ??\nSection can take from 4 to 6 months for the articles to be reviewed.\nThe journal has an extensive author support system and it has\nrecently introduced a paid expedited review process. The journal\nalso mentions the average time for processing the manuscript under\ndifferent submission systems - regular submission and expedited\nreview.\nStrengths of the journal: The journal has an online first facility in\nwhich the accepted manuscripts may be published on the website\nbefore being included in a regular issue of the journal. This cuts\ndown the time between their acceptance and the publication. The\njournal is indexed in many databases, though not in PubMed. The\neditorial board should now take steps to index the journal in\nPubMed. The journal has a system of notifying readers through e-\nmail when a new issue is released. Also, the articles are available in\nboth the HTML and the PDF formats. I especially like the new and\ncolorful page format of the journal. Also, the access statistics of the\narticles are available. The prepublication and the manuscript\ntracking system are also helpful for the authors.\n\n\nAreas for improvement: In certain cases, I felt that the peer review\nprocess of the manuscripts was not up to international standards\nand that it should be strengthened. Also, the number of manuscripts\nin an issue is high and it may be difficult for readers to go through\nall of them. The journal can consider tightening of the peer review\nprocess and increasing the quality standards for the acceptance of\nthe manuscripts. I faced occasional problems with the online\nmanuscript submission (Pre-publishing) system, which have to be\naddressed.\nOverall, the publishing process with JCDR has been smooth, quick\nand relatively hassle free and I can recommend other authors to\nconsider the journal as an outlet for their work.\"\nDr. P. Ravi Shankar\nKIST Medical College, P.O. Box 14142, Kathmandu, Nepal.\nE-mail: ravi.dr.shankar@gmail.com\nOn April 2011 Anuradha\nDear team JCDR, I would like to thank you for the very professional\nand polite service provided by everyone at JCDR. While i have been\nin the field of writing and editing for sometime, this has been my\nfirst attempt in publishing a scientific paper.Thank you for hand-\nholding me through the process.\nDr. Anuradha\nE-mail: anuradha2nittur@gmail.com\nOn Jan 2020\nImportant Notice\n[image] Download PDF\nYear : 2014 | Month : April | Volume : 8 | Issue : 4 | Page : DD08 -\nDD10\nClick here [image] to download PDF version of the article !\nClick here [image] download Adobe© Acrobat Reader.\n\n\nJCDR is now Monthly and more widely Indexed .\n•  Emerging Sources Citation Index (Web of Science,\nthomsonreuters)\n•  Index Copernicus ICV 2016: 132.37\n•  Academic Search Complete Database\n•  Directory of Open Access Journals (DOAJ)\n•  EBSCOhost\n•  Google Scholar\n•  HINARI Access to Research in Health Programme\n•  Indian Science Abstracts (ISA)\n•  Journal seek Database\n•  Google\n•  Popline (reproductive health literature)\n•  www.omnimedicalsearch.com\nSitemap | Login | Register | Feedback | Contact | Advertisers |\nCopyright & Disclaimer | Important Notice\nAffiliated websites : JCDR Prepublishing | Neonatal Database |\nNeonatal Database download center\nPremchand Shantidevi Research Foundation (PSRF, India)\n© Copyright 2007-2025, Journal of Clinical and Diagnostic\nResearch, India.\n\n\n"], "response": "The article highlights the experiences of several authors who have published their works in the Journal of Clinical and Diagnostic Research (JCDR). They praise the journal's prompt responses to queries, timely publication process, and extensive author support system. However, some authors suggest improvements such as stricter review processes and tighter quality standards for manuscript acceptance. The article also notes that while JCDR is already indexed in multiple databases, it should aim to be listed in PubMed. Additionally, some authors mention issues with the peer review process and the high number of manuscripts published in each issue, suggesting that these aspects should be strengthened. Overall, the authors express positive views towards publishing in JCDR."}
{"user_input": "Which technologies show the strongest publication/citation increases in the last five years indicating emerging interests/trends/consensus (outside of the expected like AI or by center or region)?", "retrieved_contexts": ["Identifying Influential Nodes in Large-Scale Directed\nNetworks: The Role of Clustering\nDuan-Bing Chen1,3, Hui Gao1\n, Linyuan Lu¨ 2,3*, Tao Zhou1\n1 Web Sciences Center, School of Computer Science and Engineering, University of Electronic Science and Technology of China, Chengdu, People’s Republic of China,\n2 Institute of Information Economy, Alibaba Business College, Hangzhou Normal University, Hangzhou, People’s Republic of China, 3 Department of Physics, University of\nFribourg, Fribourg, Switzerland\nAbstract\nIdentifying influential nodes in very large-scale directed networks is a big challenge relevant to disparate applications, such\nas accelerating information propagation, controlling rumors and diseases, designing search engines, and understanding\nhierarchical organization of social and biological networks. Known methods range from node centralities, such as degree,\ncloseness and betweenness, to diffusion-based processes, like PageRank and LeaderRank. Some of these methods already\ntake into account the influences of a node’s neighbors but do not directly make use of the interactions among it’s\nneighbors. Local clustering is known to have negative impacts on the information spreading. We further show empirically\nthat it also plays a negative role in generating local connections. Inspired by these facts, we propose a local ranking\nalgorithm named ClusterRank, which takes into account not only the number of neighbors and the neighbors’ influences,\nbut also the clustering coefficient. Subject to the susceptible-infected-recovered (SIR) spreading model with constant\ninfectivity, experimental results on two directed networks, a social network extracted from delicious.com and a large-scale\nshort-message communication network, demonstrate that the ClusterRank outperforms some benchmark algorithms such\nas PageRank and LeaderRank. Furthermore, ClusterRank can also be applied to undirected networks where the superiority\nof ClusterRank is significant compared with degree centrality and k-core decomposition. In addition, ClusterRank, only\nmaking use of local information, is much more efficient than global methods: It takes only 191 seconds for a network with\nabout 107 nodes, more than 15 times faster than PageRank.\nCitation: Chen D-B, Gao H, Lu¨ L, Zhou T (2013) Identifying Influential Nodes in Large-Scale Directed Networks: The Role of Clustering. PLoS ONE 8(10): e77455.\ndoi:10.1371/journal.pone.0077455\nEditor: Matjaz Perc, University of Maribor, Slovenia\nReceived June 24, 2013; Accepted September 4, 2013; Published October 31, 2013\nCopyright: \u0001 2013 Chen et al. This is an open-access article distributed under the terms of the Creative Commons Attribution License, which permits\nunrestricted use, distribution, and reproduction in any medium, provided the original author and source are credited.\nFunding: This work was partially supported by the National Natural Science Foundation of China under Grant Nos. 11222543, 90924011, 60903073 and\n11205042, and the International Scientific Cooperation and Communication Project of Sichuan Province in China under Grant No. 2010HH0002. D.B.C.\nacknowledges the Huawei university-enterprise cooperation project YBCB2011057. L.L. acknowledges the research start-up fund of Hangzhou Normal University\nunder Grant Nos. 2011QDL29 and 2011QDL31. The funders had no role in study design, data collection and analysis, decision to publish, or preparation of the\nmanuscript.\nCompeting Interests: The authors have declared that no competing interests exist.\n* E-mail: linyuan.lue@unifr.ch\nIntroduction\nWith great theoretical and practical significance, the studies on\nepidemic and information spreading in biological, social and\ntechnological networks become one of the most exciting domains\nin many branches of sciences [1–4]. Therein how to control the\nspreading process is of particular interests [5], where the\nidentification of influential nodes is a crucial issue according to\nthe assumption that highly influential nodes are more likely to be\ninfected and to infect a larger number of nodes [6–8].\nA number of centrality indices have been proposed to address\nthis problem, such as degree centrality, closeness centrality [9],\nbetweenness centrality [10], and eigenvector centrality [11].\nDegree centrality is a straightforward and efficient metric but less\nrelevant. Recent researches show that top-degree ranking nodes\nhave positive effects on cooperative behaviors in social networks\n[12,13]. However, the location of a node in the network may play\na more important role than its degree. For example, a node\nlocated in the center of the network, having a few highly influential\nneighbors, may be more influential than a node having a larger\nnumber of less influential neighbors. Considering this fact, Kitsak\net al. [6] proposed a coarse-grained method by using k-core\ndecomposition to quantify a node’s influence based on the\nassumption that nodes in the same shell have similar influence\nand nodes in higher-level shells are likely to infect more nodes.\nThis method may fail in some cases. For example, in a tree, all\nnodes are in 1-core and thus expected to have the same influence\naccording to [6]. However, this tree may be hierarchically\norganized (e.g., the binary tree) and nodes near the root have\nmuch higher influence than leaves. Chen et al. [14] devised a semi￾local index by considering the next nearest neighborhood, which\ncan well identify influential nodes in a hierarchical tree and give\nmore elaborate division than k-core decomposition. Experimental\nresults demonstrated that the semi-local index performs as good as\nglobal indices while has much lower computational complexity,\nand thus it obtains a good trade-off on effectiveness and efficiency.\nRecently, Chen et al. [15] considered the effect of path number\nand path diversity while ranking the spreading ability of nodes in\nnetworks and introduced two correction factors correspondingly.\nThe ranking accuracy is considerably increased compared with\nsome well-known ranking methods, such as PageRank and\nLeaderRank.\nPLOS ONE | www.plosone.org 1 October 2013 | Volume 8 | Issue 10 | e77455\n\nWith explosive data growth, the design of efficient and effective\nranking algorithms on very large-scale networks is becoming a big\nchallenge nowadays [16]. The representative methods include the\nwell-known HITs [17] and PageRank [18], as well as some\nrecently proposed algorithms like LeaderRank [7,19] and\nTwitterRank [20]. All these algorithms are diffusion based (or\nsay random-walk based), with a common assumption that a node is\nexpected to be of high influence if it points to many highly\ninfluential neighbors (here, a link from i to j indicates that j is a\nfollower of i). It has been demonstrated that these methods\noutperform out-degree centrality in terms of ranking effectiveness.\nIn addition to the direct influential scores of neighbors, the\ninteractions among neighbors may also play a significant role. The\ndensity of interactions among neighbors can be characterized by\nthe local clustering coefficient [21], which has great impacts on\nnetwork dynamics, such as game theory [12,13,22–24], cascading\n[25], synchronization [26,27] and spreading [28–31]. Empirical\nanalysis also shows that nodes with smaller clustering have higher\nability to attract new connections [32,33].\nKeeping this in mind, in this paper, we propose a local ranking\nmethod, named ClusterRank, to identify influential nodes in\ndirected networks by taking into account the effects of local\nclustering on information propagation. Besides the localization of\nour algorithm, another distinguishable difference from the above￾mentioned diffusion-based algorithms is that the clustering\ncoefficient is directly involved in the definition of a node’s\ninfluence in ClusterRank. We apply the SIR spreading model with\nconstant infectivity to test the effectiveness of our method on four\nreal networks, including two large-scale directed networks (a social\nnetwork extracted from delicious.com consisting of 6|105 nodes and\na short-message communication network containing about 107\nnodes) and two undirected networks (one is collaboration network\nfrom condensed matter e-print archive consisting of about 3|104\nnodes [34] and the other is an undirected version of the social\nnetwork from delicious.com). Experimental results show that\nClusterRank performs much better than the simplest degree\ncentrality, and the top-L influential nodes identified by Cluster￾Rank lead to much wider and faster spreading than those by\nPageRank or LeaderRank. Besides, the computations of Cluster￾Rank on the network with 10 millions of nodes can be finished in\n191 seconds by using C#.net language on a Core II 2.0 GHZ\nCPU processor with 2 GB memory, more than 15 times faster\nthan PageRank algorithm.\nMaterials and Methods\n1.1 Empirical Analysis\nMany social networks can be represented by directed networks\nwhere a link from i to j means j is a follower of i, indicating that j\nreceives information from i. We denote Ci as the set of followers of\ni and the density of interactions among i’s followers can be\ncharacterized by the local clustering coefficient of i. Based on the\noriginal definition of clustering coefficient [21], the clustering\ncoefficient of node i in a directed network is extended as:\nci~DfejkDj, k[CigD\nkout\ni (kout\ni {1) , ð1Þ\nwhere kout\ni is the out-degree of i, namely the number of followers\nof i, and fejkDj, k[Cig is the set of links connecting two of i’s\nfollowers. Let ci~0 if kout\ni ƒ1. According to Eq. (1), a reciprocal\nlink j<k is counted as two separate links j?k and k?j.\nThe local clustering has remarkable impacts on network\nstructure and functions. Studying the effects of clustering\ncoefficient on the network evolving can provide insights into the\nunderstanding of growing mechanism and further help us to\ndesign better link prediction algorithms [35–37] and to explain the\nobservation on information spreading through online social\nnetworks [30]. Some literatures showed that the clustering has\nnegative correlation with degree in undirected networks [38] or\nwith total degree in directed networks [39]. Here, we take two real\nevolving networks as examples to analyze the effect of clustering\ncoefficient. One is a collaboration network from condensed matter\ne-print archive (Cond-mat for short) [34], the other is a short￾message communication network (SM for short) from a mobile\ncompany in eastern China city. For each network, we consider two\nsnapshots which contain the data starting from a given date (T0)\nbut ending with different dates (i.e., T1 and T2 respectively).\nSpecifically, the first network of Cond-mat is from Jan. 1st, 1995\n(T0) to Dec. 13th, 1999 (T1) containing 16264 nodes and 47594\nlinks, and the second network of Cond-mat is from Jan. 1, 1995\n(T0) to Jun. 30, 2003 (T2) containing 30460 nodes and 120029\nlinks. Similarly, for SM, the first network consists of the data from\nDec. 8th to Dec. 17th, 2010 with 3612863 nodes and 7472808\nlinks, and the second network is from Dec. 8th, 2010 to Jan. 6th,\n2011 with 9193545 nodes and 22901318 links. Here, Cond-mat is\nundirected and SM is directed where a link from i to j represents\nthat i has sent at least one message to j.\nIn the first network (from T0 to T1), we denote N(k) the set of\nnodes with degree k. Without specific statement, a node’s degree\nin a directed network stands for its out-degree. Note that, we here\nonly consider the nodes with degrees larger than 1. Denote Q(k)\nthe set of node pairs (i,j) such that civcj and ki~kj~k, clearly,\nDQ(k)Dƒ1\n2 DN(k)D(DN(k)D{1). For each pair (i,j)[Q(k), there are\nthree cases according to i’s and j’s degrees (denoted by ~\nki and ~\nkj)\nin the second network (from T0 to T2): (i) ~\nkiw~\nkj indicating that the\nnode with lower clustering coefficient attracts more connections\nduring the period T1?T2; (ii) ~\nkiv~\nkj indicating that the node with\nhigher clustering coefficient attracts more connections during the\nperiod T1?T2; (iii) ~\nki~~\nkj indicating that these two nodes have\nthe same ability to attract new connections. Accordingly, we define\na score fk to see whether nodes with lower clustering coefficients\nhave higher ability to attract more connections. It mathematically\nreads\nfk~ 1\nDQ(k)D\nX\n(i,j)[Q(k)\nhij, ð2Þ\nwhere hij is the score depending on the aforementioned cases, as\nhij~\n1, ~\nkiw~\nkj\n{1, ~\nkiv~\nkj\n0, ~\nki~~\nkj\n:\n8\n><\n>:\nð3Þ\nObviously, fkw0 indicates that nodes having lower clustering\ncoefficients are more likely to attract new connections than those\n(with the same degree) having higher clustering coefficients, while\nfkv0 is the opposite situation. The correlation between fk and\ndegree k is shown in figure 1 where the area of a circle is\nproportional to the number of nodes with the corresponding\ndegree. As shown in figure 1, in Cond-mat, fk is larger than zero\nfor 2ƒkv20 which covers 95% of all nodes with degree larger\nIdentifying Influential Nodes in Directed Networks\nPLOS ONE | www.plosone.org 2 October 2013 | Volume 8 | Issue 10 | e77455\n\nthan 1 and in SM, fk is larger than zero for 2ƒkv5 which covers\n60.3% of all nodes with degree larger than 1. In addition, for small\nk, the statistics are more reliable since the number of samples is\nlarge while fk displays large fluctuations for large k where the\nstatistics are less reliable due to the limited statistical samples. The\nmajority of node pairs with positive fk indicates that a node with\nsmaller clustering coefficient statistically has higher ability to\nattract new connections. In figure 2, we show the increment of\ndegree, Dk, from T1 to T2. These nodes are of the same degree\n(k~5) but different clustering coefficients at time T1. Generally\nspeaking, Dk decreases with the increasing of clustering. In a word,\nthe above empirical results (see figures 1 and 2) demonstrate that a\nnode with smaller clustering coefficient is likely to attract more\nconnections in the future.\n1.2 Cluster Rank Algorithm\nBased on the empirical observation, we here propose a local\nranking index, named ClusterRank, to quantify the influence of a\nnode by taking into account not only its direct influence (measured\nby the number of its followers) and influences of its neighbors, but\nalso its clustering coefficient. Mathematically, the ClusterRank\nscore si of node i is defined as:\nsi~f (ci)\nX\nj[Ci\n(kout\nj z1), ð4Þ\nwhere the term f (ci) accounts for the effect of i’s local clustering\nand the term ‘+1’ results from the contribution of j itself. Usually,\nthe local clustering plays a negative role in spreading [28,29,40]\nsince if i’s followers closely interact with each other rather than\nwith other nodes, the spreading initiated from node i is more likely\nto be confined in a local region. On the contrary, if i’s neighbors\nare mostly connected with nodes other than i’s neighbors, the\ninformation will quickly spread to a large scope. For example, in\nfigure 3, although node 0 has the same out-degree with node 37,\nnode 37, with lower clustering, is of higher influence than node 0,\nsince most of node 37’s neighbors point to nodes other than\nthemselves and thus can send the information to wide audiences.\nWe here adopt a simple exponential function, namely\nf (ci)~10{ci , a decreasing function of ci. Actually, we can apply\na more complicated form by introducing a new parameter, such as\na{ci or ca\ni . However, it adds little value to rank nodes but make\nthe analysis more complicated. Indeed, the perspective and results\nof this paper are not limited by a very specific function of ci.\nFor comparison, we briefly introduce two benchmark ranking\nalgorithms on directed networks, PageRank [18] and LeaderRank\n[7]. PageRank is depicted as a random walk on hyperlinked\nnetworks. Each web page (i.e., a node) is assigned a score\naccording to its relative importance. A parameter c is introduced\nas the probability for which a web page surfers to jump to a\nrandom web page, and for probability 1{c a web page surfers to\ncontinue browsing through hyperlinks. Therefore, in our case the\nscore si(t) for node i at time step t is given by:\nsi(t)~cz(1{c)\nXN\nj~1\naij\nkin\nj\n1{dkin\nj ,0 \u0001 z\n1\nN dkin\nj ,0 \" #sj(t{1), ð5Þ\nwhere kin\nj is the in-degree of node j (i.e., the number of leaders of\nnode j), N is the number of nodes of the network, aij~1 if there\nexists a link from i to j (indicating the information flow is from i to\nj), otherwise aij~0, and dkin\nj ,0~1 if kin\nj ~0, otherwise dkin\nj ,0~0.\nInitially, si(0) is set to be 1 for each node i, and the parameter c is\nalways fixed as 0.15 in the experiments.\nLeaderRank is also a random-walk-based ranking algorithm [7].\nOn the basis of PageRank, LeaderRank introduces a ground node\ng, which has two directed links egi and eig to every node i in the\noriginal network, so that the network will become strongly\nconnected. The score si(t) of node i at time t is given by\n(according to a purely random walk process):\nsi(t)~\nN\nXz1\nj~1\naij\nkin\nj\nsj(t{1): ð6Þ\nInitially, sg(0)~0 for the ground node g, and si(0)~1 for every\nother node i. At the steady state, the score of the ground node is\nequally distributed to all other nodes to conserve scores on the\nnodes of interest. Therefore, the final score of node i, called its\nleadership score, is defined as\nSi~si(t?)zsg(t?)\nN , ð7Þ\nFigure 1. The correlation between fk and the degree in the first network k. The area of a circle is proportional to the number of nodes with\nthe corresponding degree.\ndoi:10.1371/journal.pone.0077455.g001\nIdentifying Influential Nodes in Directed Networks\nPLOS ONE | www.plosone.org 3 October 2013 | Volume 8 | Issue 10 | e77455\n\nwhere si(t?) is the score of node i in the steady state according to\nEq. (6). Notice that, although LeaderRank is similar to PageRank,\nit is able to dig out more influential nodes and is more stable to\nnoise and more robust to attacks than PageRank [7]. More\nsignificantly, LeaderRank is a parameter-free ranking method.\nComparing with PageRank, LeaderRank just introduces a small\nmodification yet leads to considerable improvements.\n1.3 Data Description\nTo evaluate influences of different groups of top-ranked nodes\nrespectively obtained by out-degree centrality, PageRank, Lea￾derRank, k-core decomposition and ClusterRank, experiments are\ncarried out on two real directed social networks and two\nundirected networks. (i) Delicious: a directed social network\nextracted from the web site delicious.com, where the primary\nfunction of users is to collect useful bookmarks with tags. Users can\nselect other users to be their ‘‘opinion leaders’’ of web browsing, in\nthe sense that the bookmarks of the leaders are often useful and\nrelevant. The subscriptions to leaders’ bookmarks can be made\nautomatically. Of course users who select their leaders can in turn\nbe the leaders of others. In that way, the users form a large-scale\ndirected social network with information flows from leaders to\nfollowers. (ii) SM: a directed short-message communication\nnetwork of a mobile company in 31 days from Dec. 8th, 2010\nto Jan. 7th, 2011. In this network, each node corresponds to a\nmobile phone number, and a link from i to j means that i has sent\nat least one short message to j during these 31 days. We are\ninterested in this data set because the information such as rumor\nmay spread out in this communication network via message\nforwarding and influential spreaders play an important role in the\nFigure 2. The increment of degree Dk in the period T1?T2 of nodes with the same degree (k~5) but different clustering coefficients\nat time T1. Dk is the average value of a bin (size = 0.1) on clustering coefficient. For example, the value of Dk corresponding to c~0:1 is the average\nvalue of Dk of the nodes with clustering coefficient in (0:05,0:15\u0001. The error bars stand for standard errors.\ndoi:10.1371/journal.pone.0077455.g002\nFigure 3. An example network with 38 nodes and 110 directed edges. Although nodes 0 and 37 have the same out-degree, node 37 is of\nhigher influence (subject to spreading dynamics) than node 0. The clustering coefficients of these two nodes are c0~0:4 and c37~0:2.\ndoi:10.1371/journal.pone.0077455.g003\nIdentifying Influential Nodes in Directed Networks\nPLOS ONE | www.plosone.org 4 October 2013 | Volume 8 | Issue 10 | e77455\n\nspreading process. (iii) Cond-mat: a collaboration network of\nscientists who have posted preprints on the condensed matter\narchive at www.arxiv.org between Jan. 1st, 1995 and Jun. 30th,\n2003. In this network, a node represents an author, and an edge\nconnecting two authors if they have co-authorized at least one\npaper. The academic perspectives and the news of academic\nactivities may propagate in this collaboration network and some\nkey authors play the central role in the propagation. (iv)\nDeliciousUN: the undirected version of Delicious network where\nthe directed links are transformed into undirected links. Some\nbasic statistical features of these four networks, including the\nnumber of nodes, the number of links, maximum out-degree (or\nmaximum degree for undirected network) kmax, average out￾degree (or average degree for undirected network) SkT and\naverage clustering coefficient ScT, are shown in Table 1.\nResults\n2.1 Evaluation on Directed Networks\nThe computation times of four ranking algorithms on Delicious\nand SM networks are shown in Table 2. Out-degree is the fastest\nwith runtime less than a second. Comparing with the diffusion￾based methods (i.e., PageRank and LeaderRank), the time\ncomplexity of ClusterRank is much lower (a magnitude reduction).\nTherefore, the ClusterRank may be a promising method for very\nlarge-scale networks.\nSusceptible-Infected-Recovered (SIR) model is usually used to\nmimic the spreading processes of disease where infected nodes will\neither get immunity or die [41]. Individuals in SIR model are\nclassified in three classes according to their states: susceptible (will\nnot infect others but can be infected), infected (have infectivity),\nrecovered (recovered from the illness and got immunity thus will\nnot take part in the epidemic process, or died and thus removed\nfrom the systems). The simulation runs in discrete time steps. At\neach time step, every infected node randomly selects a follower\nand transmit the information or disease to her with probability m if\nthis follower is a susceptible one. At the same time, each infected\nnode recovers with probability b, and the infected rate l is defined\nas m=b. The simulation stops when there is no infected node\nanymore. Notice that this model is slightly different from the\nstandard SIR model where all the followers of an infected node\nhave the chance to be infected. The present mechanism is usually\nused to mimic the limited spreading capability of individuals\n[42,43].\nTo investigate the ability of identifying influential nodes of a\nranking method, we focus on top-L ranked nodes by out-degree\ncentrality. Here we set L = 20 and 50 as two examples. The ranks\nof these L nodes by other ranking methods can be obtained via\nselecting them from the whole ranking lists. Then we can calculate\nthe correlation between each pair of ranking methods by Kendall’s\ntau, as shown in Table 3. It can be seen that LeaderRank and\nPageRank are highly correlated. The correlation between\nClusterRank and out-degree centrality is low in Delicious while\nrelatively high in SM, this is because of the small clustering\ncoefficient of SM which makes f (ci) play little role in Eq. (4). For\nthe L nodes with maximal out-degrees, we also investigate the\ncorrelation between the ranking scores provided by different\nmethods and the real spreading abilities, see Table 4. The ratio\nbetween the number of infected and recovered nodes and the total\nnumber of nodes at time t, denoted by F(t), can be considered as\nan indicator to evaluate the influence at time t. Clearly, F(t)\nincreases with t, and eventually gets steady. The final coverage\nFi\n(tc) of node i is used to represent the real spreading ability of i\nwhere i is set to be infected initially. Higher Fi\n(tc) indicates higher\ninfluence of node i. Overall speaking, the Kendall’s tau for\nClusterRank is the largest.\nTo investigate the influence of a group of nodes in information\nspreading, we initially set these nodes to be infected. We use the\nsteady value, F(tc), to evaluate the eventual influence of these\ninitially infected nodes. Higher F(tc) indicates higher influence.\nWe choose the top-L (this paper considers L~20 and L~50)\nranked nodes, which are respectively identified by out-degree\ncentrality, PageRank, LeaderRank and ClusterRank, and set them\nas initially infected nodes in the experiments. Figure 4 compares\nF(t) with the top-L ranked nodes as the initially infected ones by\nout-degree, PageRank, LeaderRank and ClusterRank for Deli￾cious and SM networks. From figure 4, one can see that the initial\nseeds obtained by ClusterRank result in faster and wider spreading\nthan by other ranking methods.\nSince there are a considerable number of overlapped nodes in\ntop-ranked lists of any two algorithms (see Table 5), we next\nTable 1. Basic statistical features of Delicious, SM and Cond￾mat networks.\nNetwork # nodes # links kmax Ækæ Æcæ\nDelicious 582377 1686131 2767 2.8953 0.1459\nSM 9330493 23208675 4832 2.4874 0.0043\nCond-mat 30460 120029 202 7.8811 0.6461\nDeliciousUN 582377 1340910 11187 4.6063 0.2005\nkmax is the maximum out-degree for directed networks or the maximum degree\nfor undirected networks, SkT is the average out-degree for directed networks\nor the average degree for undirected networks, and ScT is the average\nclustering coefficient over all nodes.\ndoi:10.1371/journal.pone.0077455.t001\nTable 2. The CPU time (in seconds) of out-degree centrality,\nPageRank, LeaderRank and ClusterRank for Delicious and SM\nnetworks in a single run.\nNetwork Out-degree PageRank LeaderRank ClusterRank\nDelicious ,1 122 646 12\nSM ,1 2954 2118 191\nWe use C#.net language on a Core II 2.0 GHZ CPU processor with 2 GB\nmemory.\ndoi:10.1371/journal.pone.0077455.t002\nTable 3. Ranking correlation measured by Kendall’s tau\nbetween different methods.\nNetwork CR-DR CR-LR CR-PR LR-DR LR-PR PR-DR\nDelicious\nTop-20\n0.2211 0.6000 0.4842 0.5789 0.8632 0.5895\nDelicious\nTop-50\n0.3420 0.5711 0.4531 0.5559 0.8237 0.5722\nSM Top-20 0.8895 0.9211 0.9105 0.8158 0.9895 0.8053\nSM Top-50 0.6490 0.7992 0.7257 0.5510 0.9233 0.5918\nHere we focus on the ranks of the top-L (L = 20 and 50) nodes with maximal\nout-degrees. We abbreviate ClusterRank, LeaderRank, PageRank and Out￾degree centrality by CR, LR, PR and DR, respectively.\ndoi:10.1371/journal.pone.0077455.t003\nIdentifying Influential Nodes in Directed Networks\nPLOS ONE | www.plosone.org 5 October 2013 | Volume 8 | Issue 10 | e77455\n\ncompare the spreading processes resulted from non-overlapped\nnodes in the top-ranked lists. That is, each time when we compare\nthe ClusterRank and another algorithm, the nodes appeared in\nonly one list are set to be the initially infected ones. For example,\nfor Delicious, considering the top-20 lists for out-degree centrality\nand ClusterRank, there are 8 non-overlapped nodes, we compare\nthe spreading processes respectively resulted from the 8 nodes\nappeared only in the list by ClusterRank and the 8 nodes appeared\nonly in the list by out-degree centrality. Figure 5 shows the ratio\nbetween the total number of infected and recovered nodes of\nClusterRank and those of the other ranking algorithms, namely\nFClusterRank(t)=F(t), where FClusterRank(t) is the ratio of the total\nnumber of infected and recovered nodes to all nodes at time t for\nClusterRank, and F(t) stands for the corresponding quantity of\nthe compared algorithm (i.e., out-degree centrality, PageRank or\nLeaderRank). Therefore, the degree to which FClusterRank(t)=F(t)\nexceeds 1 indicates how much better ClusterRank performs than\nother methods. From figure 5, one can see that in most cases the\nratio is obviously larger than 1.\nFigure 6 shows F(tc) resulted from the top-50 most influential\nnodes at different infected rates l. It can be seen that F(tc) resulted\nfrom the top-50 most influential nodes by ClusterRank is larger\nthan that by other ranking algorithms. Figure 7 shows the ratio of\nthe number of ever infected (i.e., finally recovered) nodes resulted\nfrom top-ranked nodes by ClusterRank to those by other ranking\nalgorithms at different infected rates l. Note that, in figure 7, only\nnon-overlapped node appeared in the top-50 lists by ClusterRank\nand other ranking algorithms are initially set to be infected. The\nratio is up to 2 when l~1:4 for Delicious network (see figure 7(a))\nand it approaches 20 (surprisingly high) when l~1:9 for SM\nnetwork (see figure 7(b)). In fact, some nodes in the SM network\nare of very large out-degree but the out-degree of their followers\nare very small. These nodes are not as important as their out￾degrees indicate, and ClusterRank could dig out really influential\nTable 4. Kendall’s tau between ranking scores provided by\ndifferent methods and the real spreading abilities.\nNetwork CR LR PR DR\nDelicious\nTop-20\n0.4632 0.1263 0.0737 20.0632\nDelicious\nTop-50\n0.2784 0.0482 20.0596 20.1004\nSM Top-20 0.2474 0.2368 0.2263 0.1421\nSM Top-50 0.2620 0.2922 0.2253 20.0580\nHere we focus on the ranks of the top-L (L= 20 and 50) nodes with maximal\nout-degrees. We abbreviate ClusterRank, LeaderRank, PageRank and Out￾degree centrality by CR, LR, PR and DR, respectively.\ndoi:10.1371/journal.pone.0077455.t004\nFigure 4. F(t) for top-L ranked nodes by out-degree centrality (squares), PageRank (diamond), LeaderRank (triangle) and\nClusterRank (circles). We set l~1:2 and b~1=SkoutT. Each data point is obtained by averaging over 100 independent runs.\ndoi:10.1371/journal.pone.0077455.g004\nIdentifying Influential Nodes in Directed Networks\nPLOS ONE | www.plosone.org 6 October 2013 | Volume 8 | Issue 10 | e77455\n\nnodes and assign the high-degree-yet-low-influence nodes low\nranks.\n2.2 Evaluation on Undirected Networks\nAbove analyses show that ClusterRank is more effective than\nother well-known ranking methods such as out-degree centrality,\nPageRank and LeaderRank, in directed networks. In this\nsubsection, we will further show the superiority of ClusterRank\non undirected networks by comparing it with degree centrality and\nk-core decomposition. Here, we don’t consider PageRank and\nLeaderRank because they all degenerate to degree centrality in\nundirected networks. We use two types of initialization for SIR\nexperiments. In the first case, we directly set the top-L (we set\nL~50 in the experiment) ranked non-overlapped nodes to be\ninitially infected regardless of how they connect with each other.\nThe selection method for initial seeds is similar to what we have\nused in figure 5. In the second case, we only consider a group of\nnodes with no connection between any two of them as initial seeds.\nSpecifically, there are two steps. In the first step, for each ranking\nmethod, we select L nodes who are highly ranked nodes but not\nconnected with each other according to the following process: (i)\nSelect the top ranked node v in the current network; (ii) Remove v\nand all her neighbors from the network; (iii) Repeat step (i) and\nstep (ii) until L nodes have been selected. The second step is to\nidentify the non-overlapped nodes between ClusterRank and other\ncompared methods. For more details of how to select the initial\nseeds, readers could refer to Ref. [44].\nFigure 8 shows the dependence of FClusterRank(tc)=F(tc) on l\nfor the undirected Delicious network and Cond-mat network,\nwhere FClusterRank(tc) is the ratio of the total number of infected\nand recovered nodes to all nodes at time tc for ClusterRank, and\nF(tc) stands for the corresponding quantity of degree centrality or\nk-core decomposition. For the first case, see figures 8(a) and 8(c),\nthe eventually infected size of ClusterRank is larger than that of\ndegree centrality and k-core decomposition. In DeliciousUN, the\nFigure 5. The ratio of the number of infected and recovered nodes by ClusterRank to those by out-degree centrality, PageRank and\nLeaderRank. Initially only non-overlapped nodes in the top-L lists obtained by ClusterRank and other ranking algorithms are set to be infected. We\nset l~1:2 and b~1=SkoutT. Each data point is obtained by averaging over 100 independent runs.\ndoi:10.1371/journal.pone.0077455.g005\nTable 5. The number of different nodes in the top-L lists\nbetween ClusterRank and other three methods for Delicious\nand SM networks.\nDelicious SM\ntop-20 top-50 top-20 top-50\nOut-degree 8 20 19 43\nPageRank 11 25 14 34\nLeaderRank 7 17 17 37\ndoi:10.1371/journal.pone.0077455.t005\nIdentifying Influential Nodes in Directed Networks\nPLOS ONE | www.plosone.org 7 October 2013 | Volume 8 | Issue 10 | e77455\n\nlargest value for k-core decomposition is 3.97 which is about 2.5\ntimes larger than that for degree centrality. This reminds us that as\na group of initial infected nodes, k-core decomposition may\nperform even worse than degree centrality [6], since the selected\nnodes identified by k-core decomposition are usually in the same\ncore and thus densely connected with each other while the nodes\nselected by degree centrality or ClusterRank are usually located at\ndifferent cores and thus sparsely connected. Apparently, Cluster￾Rank is much more advanced than degree centrality. Similar\nresults are also found in Cond-mat network, see figure 8(c). Note\nthat, Cond-mat network is highly clustered with clustering\ncoefficient ScT~0:6461, because there are many cliques each of\nwhich is constituted by a group of co-authors of a paper. Therefore\nthe authors whose collaborators closely collaborate with each other\nwill be highly depressed by ClusterRank due to their high\nclustering coefficients. The researcher with diverse collaborators\nwho are usually belong to different communities will be more\ninfluential than those who only collaborates with people in one\ncommunity. For the second case, with the consideration of the\nnodes that are not directly connected with each other the\nperformance of k-core decomposition is improved. Specifically,\nin DeliciousUN, ClusterRank performs much better than degree\ncentrality especially for the middle region of l and better than that\nof k-core decomposition for 1:0ƒlƒ1:7. In Cond-mat network,\nthe results of ClusterRank are still better than degree centrality\nand k-core decomposition in the middle region of l, and for other\nregion, their performances are comparable. The investigations for\nvery small or very large infected probability l are meaningless.\nWhen l is too small (e.g., lv1), it will be hardly spread out from\nany group of initial nodes, and for large l, most of the nodes will\nget infected and thus the difference resulted from initialization will\nbecome less significant. The results shown in figure 8 demonstrate\nthat ClusterRank also performs better than degree centrality and\nk-core decomposition in undirected networks.\nDiscussion\nIdentifying most influential nodes in very large-scale directed\nnetworks is a key issue in network analysis, disease control, and so\non. An effective and efficient ranking algorithm is proposed in this\nFigure 6. The dependence of F(tc) on parameter l. The initially infected nodes are the top-50 nodes obtained by out-degree centrality\n(squares), PageRank (diamonds), LeaderRank (triangles) and ClusterRank (circles). We set b~1=SkoutT. Each data point is obtained by averaging over\n100 independent runs.\ndoi:10.1371/journal.pone.0077455.g006\nFigure 7. The ratio of the number of final recovered nodes by ClusterRank to those by out-degree centrality, PageRank and\nLeaderRank. The non-overlapped nodes in the top-50 lists are initially infected. We set b~1=SkoutT. Each data point is obtained by averaging over\n100 independent runs.\ndoi:10.1371/journal.pone.0077455.g007\nIdentifying Influential Nodes in Directed Networks\nPLOS ONE | www.plosone.org 8 October 2013 | Volume 8 | Issue 10 | e77455\n\npaper which emphasizes the negative effects of local clustering on\nspreading dynamics. Experimental results on Delicious and SM\nnetworks demonstrate that the information can spread more\nquickly and broadly from top-L nodes obtained by our method\nthan that by out-degree centrality, PageRank or LeaderRank.\nFurthermore, the method presented in this paper can be easily\nextended to undirected networks, for which PageRank and\nLeaderRank all degenerate to degree centrality. Experiments on\nthe Cond-mat and undirected Delicious networks show that the\nperformance of our method is also better than that of degree\ncentrality and k-core decomposition for undirected networks.\nHow to effectively and efficiently identify influential nodes in\nvery large-scale networks is a long-standing challenge. Lastly we\nlist some open issues that may become the near-future focuses in\nthis field. (1) Algorithms from general to specific. With\ndifferent motivations and requirements, the ranking methods\nshould be different. In our paper, we applied SIR model to\nevaluate the ranking performance, which actually implies that we\nwant to find influential nodes for this specific dynamic process–the\ninformation spreading in the SIR matter. With this motivation, we\nfind that ClusterRank is very effective. Some recent studies [30,45]\nshowed that in the presence of social reinforcement, the clustering\nmay to some extent accelerate behavior propagation in online\nsocial networks. In this case, or the cases asking for critical nodes in\nsynchronization and transportation, the ClusterRank may not be\nas effective as in the current case (or may be even more powerful).\nIn real systems, users may have different preference on different\ntopics, a topic-related ranking method will be more appropriate\n[46]. Furthermore, different individuals may influence other\nindividuals through different relationships, how to make use of\nprofiles of individuals in ranking algorithms is also interesting and\nchallenging [8]. (2) Algorithms on disparate types of\nnetworks. With different network structures, suitable ranking\nmethods might also be different. Besides the simple undirected and\ndirected networks, ranks are required for more complicated\nnetworks including weighted networks [47], bipartite networks,\nmulti-level networks, temporal networks [48], networks with\ncommunity structure [49], and so on. Some progress has been\nmade in this direction [50], but systematic analyses are still\nlacking.\nAuthor Contributions\nConceived and designed the experiments: DBC LL TZ. Performed the\nexperiments: DBC HG. Analyzed the data: DBC HG LL. Contributed\nreagents/materials/analysis tools: DBC LL TZ. Wrote the paper: DBC LL\nTZ.\nFigure 8. The dependance of FClusterRank(tc)=F(tc) on parameter l in undirected Delicious and Cond-mat networks. We set b~1=SkT. In\n(a) and (c), the initial infected nodes are those non-overlapped nodes in the top-50 places regardless of whether they are connected or not. In (b) and\n(d), the initial infected nodes are the non-overlapped nodes in top-50 places under constraint that any two of them are not connected. Each data\npoint is obtained by averaging over 100 independent runs.\ndoi:10.1371/journal.pone.0077455.g008\nIdentifying Influential Nodes in Directed Networks\nPLOS ONE | www.plosone.org 9 October 2013 | Volume 8 | Issue 10 | e77455\n\nReferences\n1. Pastor-Satorras R, Vespiggnani A (2001) Epidemic spreading in scale-free\nnetworks. Phys Rev Lett 86: 3200–3203.\n2. Zhou T, Fu ZQ, Wang BH (2006) Epidemic dynamics on complex networks.\nProg Nat Sci 16: 452–457.\n3. Vespiggnani A (2012) Modelling dynamical processes in complex socio-technical\nsystems. Nat Phys 8: 32–39.\n4. Barrat A, Barthlemy M, Vespignani A (2008) Dynamical processes on complex\nnetworks. Cambridge University Press.\n5. Yang HX, Wang WX, Lai YC, Xie YB, Wang BH (2011) Control of epidemic\nspreading on complex networks by local traffic dynamics. Phys Rev E 84:\n045101.\n6. Kitsak M, Gallos LK, Havlin S, Liljeros F, Muchnik L, et al. (2010)\nIdentification of influential spreaders in complex networks. Nat Phys 6: 888–893.\n7. Lu¨ L, Zhang YC, Yeung CH, Zhou T (2011) Leaders in social networks, the\ndelicious case. PLoS ONE 6: e21202.\n8. Aral S, Walker D (2012) Identifying influential and susceptible members of social\nnetworks. Science 337: 337–341.\n9. Sabidussi G (1966) The centrality index of a graph. Psychometrika 31: 581–603.\n10. Freeman LC (1979) Centrality in social networks conceptual clarification. Social\nNetworks 1: 215–239.\n11. Bonacich P (2007) Some unique properties of eigenvector centrality. Social\nNetworks 29: 555–564.\n12. Perc M (2009) Evolution of cooperation on scale-free networks subject to error\nand attack. New J Phys 11: 033027.\n13. Jiang LL, Perc M, Wang WX, Lai YC, Wang BH (2011) Impact of link deletions\non public cooperation in scale-free networks. EPL 93: 40001.\n14. Chen DB, Lu¨ L, Shang MS, Zhang YC, Zhou T (2012) Identifying influential\nnodes in complex networks. Physica A 391: 1777–1787.\n15. Chen DB, Xiao R, Zeng A, Zhang YC (2013) Path diversity improves the\nidentification of influential spreaders. arXiv: 1305.7480.\n16. Saito K, Kimura M, Ohara K, Motoda H (2012) Efficient discovery of\ninfluential nodes for sis models in social networks. Knowl Inf Syst 30: 613–635.\n17. Kleinberg J (1999) Authoritative sources in a hyperlinked environment. J ACM\n46: 604–632.\n18. Brin S, Page L (1998) The anatomy of a large-scale hypertextual web search\nengine. Comput Netw ISDN Syst 30: 107–117.\n19. Li Q, Zhou T, Lu¨ L, Chen DB (2013) Identifying influential spreaders by\nweighted leaderrank. arXiv: 1306.5042.\n20. Weng J, Lim EP, Jiang J, He Q (2010) Twitterrank: finding topic-sensitive\ninfluential twitterers. In: Proceedings of the 3rd ACM International Conference\non Web Search and Data Mining. ACM Press, 261–270.\n21. Watts DJ, Strogatz SH (1998) Collective dynamics of ‘small-world’ networks.\nNature 393: 440–442.\n22. Masuda N (2011) Clustering in large networks does not promote upstream\nreciprocity. PLoS ONE 6: e25190.\n23. Gala´n JM, Latek MM, Rizi SMM (2011) Axelrod’s metanorm games on\nnetworks. PLoS ONE 6: e20474.\n24. Perc M, Szolnoki A (2010) Coevolutionary games–a mini review. BioSystems 99:\n109–125.\n25. Ding L, Cao Y, Wang G, Liu M (2011) Dynamical model and analysis of\ncascading failures on the complex power grids. Kybernetes 40: 814–823.\n26. Wu X, Wang BH, Zhou T, Wang XX, Zhao M, et al. (2006) Synchronizability\nof highly clustered scale-free networks. Chin Phys Lett 23: 1046–1049.\n27. Wu X, Lu H (2011) Cluster synchronization in the adaptive complex dynamical\nnetworks via a novel approach. Phys Lett A 375: 1559–1565.\n28. Eguı´luz VM, Klemm K (2002) Epidemic threshold in structured scale-free\nnetworks. Phys Rev Lett 89: 108701.\n29. Petermann T, Rios P (2004) Role of clustering and gridlike ordering in epidemic\nspreading. Phys Rev E 69: 066116.\n30. Lu¨ L, Chen DB, Zhou T (2011) The small world yields the most effective\ninformation spreading. New J Phys 13: 123005.\n31. Trpevski D, Tang WKS, Kocarev L (2010) Model for rumor spreading over\nnetworks. Phys Rev E 81: 056102.\n32. Mislove A, Marcon M, Gummadi KP, ruschel P, Bhattacharjee B (2007)\nMeasurement and analysis of online social networks. In: Proceddings of the 7th\nACM SIGCOMM Conference on Internet Measurement. ACM Press, 29–42.\n33. Ugander J, Backstrom L, Marlow C, Kleinberg J (2012) Structural diversity in\nsocial contagion. Proc Natl Acad Sci USA 109: 5962–5966.\n34. Newman MEJ (2001) The structure of scientific collaboration networks. Proc\nNatl Acad Sci USA 98: 404–409.\n35. Lu¨ L, Zhou T (2011) Link prediction in complex networks: a survey. Physica A\n390: 1150–1170.\n36. Liu Z, Zhang QM, Lu¨ L, Zhou T (2011) Link prediction in complex networks: A\nlocal naı¨ve bayes model. EPL 96: 48007.\n37. Feng X, Zhao JC, Xu K (2012) Link prediction in complex networks: a\nclustering perspective. Eur Phys J B 85: 3.\n38. Soffer SN, Va´zquez A (2005) Network clustering coefficient without degree￾correlation biases. Phys Rev E 71: 057101.\n39. Fagiolo G (2007) Clustering in complex directed networks. Phys Rev E 76:\n026107.\n40. Zhou T, Yan G, Wang BH (2005) Maximal planar networks with large\nclustering coefficient and power-law degree distribution. Phys Rev E 71: 046141.\n41. Anderson RM, May RM, Anderson B (1992) Infectious diseases of humans:\ndynamics and control. Oxford University Press.\n42. Zhou T, Liu JG, Bai WJ, Chen GR, Wang BH (2006) Behaviors of susceptible￾infected epidemics on scale-free networks with identical infectivity. Phys Rev E\n74: 056109.\n43. Yang R, Wang BH, Ren J, Bai WJ, Shi ZW, et al. (2007) Epidemic spreading on\nheterogeneous networks with identical infectivity. Phys Lett A 364: 189–193.\n44. Narayanam R, Narahari Y (2011) A shapley value based approach to discover\ninfluential nodes in social networks. IEEE Trans Autom Sci Eng 8: 130–147.\n45. Centola D (2010) The spread of behavior in an online social network\nexperiment. Science 329: 1194–1197.\n46. Zhang Y, Zhou J, Cheng J (2011) Preference-based top-k influential nodes\nmining in social networks. In: Proceedings of the IEEE 10th International\nConference on Trust, Security and Privacy in Computing and Communications.\nIEEE Press, 1512–1518.\n47. Wei D, Deng X, Zhang X, Deng Y, Mahadevan S (2013) Identifying influential\nnodes in weighted networks based on evidence theory. Physica A 392: 2564–\n2575.\n48. Kim H, Anderson R (2012) Temporal node centrality in complex networks. Phys\nRev E 85: 026107.\n49. Zhang X, Zhu J, Wang Q, Zhao H (2013) Identifying influential nodes in\ncomplex networks with community structure. Knowl-Based Syst 42: 74–84.\n50. Zhou YB, Lu¨ L, Li M (2012) Quantifying the influence of scientists and their\npublications: distinguishing between prestige and popularity. New J Phys 14:\n033033.\nIdentifying Influential Nodes in Directed Networks\nPLOS ONE | www.plosone.org 10 October 2013 | Volume 8 | Issue 10 | e77455\n\n"], "response": "The paper presents a new method called ClusterRank for identifying influential nodes in directed networks. Unlike existing diffusion-based methods, ClusterRank considers the effects of local clustering on information propagation. The method involves calculating the clustering coefficient of each node and defining a score to determine whether nodes with lower clustering coefficients have higher abilities to attract new connections. The paper provides empirical analyses of two real evolving networks, showing that nodes with lower clustering coefficients are more likely to attract new connections. The paper also discusses related literature and compares the performance of ClusterRank with other methods. The paper concludes by stating that ClusterRank performs better than existing methods in terms of spreading width and computation time. Overall, the paper proposes a new approach for identifying influential nodes in directed networks that takes into account the impact of local clustering."}
{"user_input": "Which technologies show the strongest publication/citation increases in the last five years indicating emerging interests/trends/consensus (outside of the expected like AI or by center or region)?", "retrieved_contexts": ["Impact of Vitamin D on Chronic Kidney Diseases in Non￾Dialysis Patients: A Meta-Analysis of Randomized\nControlled Trials\nLijuan Xu1\n, Xuesi Wan1\n, Zhimin Huang1\n, Fangfang Zeng2\n, Guohong Wei1\n, Donghong Fang1\n,\nWanping Deng1\n, Yanbing Li1\n*\n1 Department of Endocrinology, The First Affiliated Hospital of Sun Yat-sen University, Guangzhou, Guangdong Province, China, 2 Guangdong Provincial Key Laboratory\nof Food, Nutrition and Health, School of Public Health, Sun Yat-sen University, Guangzhou, Guangdong Province, China\nAbstract\nBackground and Objectives: Recent studies have supported a role for both newer and more established vitamin D\ncompounds in improving proteinuria, although systematic evaluation is lacking. Furthermore, concerns remain regarding\nthe influence of vitamin D on the progression of renal function. We analyzed the efficacy and safety of vitamin D in non￾dialysis patients and compared the use of newer versus established vitamin D compounds by performing a meta-analysis of\nrandomized controlled trials.\nDesign: A literature search of PubMed (1975 to September, 2012), EMBASE.com (1966 to September, 2012) and Ovid EBM\nReviews (through September, 2012) was conducted.\nResults: Eighteen studies were eligible for final inclusion; of these, six explored the effects of vitamin D on proteinuria,\ntwelve studied the effects of supplementation on renal function, and fifteen discussed the incidence of hypercalcemia.\nCompared to the placebo or no interference, both the newer and established vitamin D sterols reduced proteinuria to a\nsimilar extent (RR, 2.00; 95% CI, 1.42 to 2.81). No decrease in the glomerular filter rate was observed (SMD, 20.10; 95%CI,\n20.24 to 0.03), and the risk for dialysis initiation was 1.48 (95% CI, 0.54 to 4.03) with vitamin D treatment. Additionally, there\nwas an increased risk of hypercalcemia for patients treated with either newer or established vitamin D compounds as\ncompared with the controls (RR, 4.78; 95% CI, 2.20 to 10.37). The head-to-head studies showed no differences in the effects\nof either newer or established compounds on proteinuria or the risk of hypercalcemia. No serious adverse events were\nassociated with the administration of vitamin D.\nConclusions: Vitamin D therapy appears to decrease proteinuria and have no negative influence on renal function in non￾dialysis patients. But the occurrence of hypercalcemia should be evaluated when vitamin D is provided. No superiority for\nnewer versus established vitamin D analogue is found.\nCitation: Xu L, Wan X, Huang Z, Zeng F, Wei G, et al. (2013) Impact of Vitamin D on Chronic Kidney Diseases in Non-Dialysis Patients: A Meta-Analysis of\nRandomized Controlled Trials. PLoS ONE 8(4): e61387. doi:10.1371/journal.pone.0061387\nEditor: Daniele Cusi, University of Milan, Italy\nReceived November 5, 2012; Accepted March 8, 2013; Published April 23, 2013\nCopyright:  2013 Xu et al. This is an open-access article distributed under the terms of the Creative Commons Attribution License, which permits unrestricted\nuse, distribution, and reproduction in any medium, provided the original author and source are credited.\nFunding: The authors have no support or funding to report.\nCompeting Interests: The authors have declared that no competing interests exist.\n* E-mail: easd04lyb@126.com\nIntroduction\nEnd-stage renal disease (ESRD) imposes significant health and\neconomic burdens on both individuals and communities [1].\nMicroalbuminuria is one of the earliest clinical manifestations of\nnephropathy and is associated with substantial risk for progressive\nkidney disease. Additionally, albuminuria predicts cardiovascular\nevents, all-cause mortality and hospitalization for congestive heart\nfailure [2]. Recent data have shown that increased proteinuria and\ndecreased glomerular filtration rate (GFR) serve as independent\npredictors of all-cause mortality [3,4]. Thus, reducing proteinuria\nand protecting kidney function at the disease stages prior to\ndialysis are pivotal for preventing long-term kidney loss and other\nadverse events.\nRenin-angiotensin system (RAS) inhibitors can reduce protein￾uria and delay kidney dysfunction in patients with chronic kidney\ndisease (CKD), but are unsuitable for those with advanced renal\ndysfunction due to the potential for renal deterioration and\nhyperkalemia. The exploration of other therapeutic modalities is\nurgently needed for CKD treatment. Although animal experi￾ments have revealed that vitamin D can reduce proteinuria [5],\nthe majority of existing clinical data have focused on the effect of\nvitamin D on mineral metabolism and bone diseases related to\nsecondary hyperparathyroidism. Of the limited clinical studies that\nhave explored extra-skeletal benefits of vitamin D, the VITAL trial\n(selective vitamin D receptor activation with paricalcitol for the\nreduction of albuminuria), a well-designed and relatively large￾scale study, has shown promising but borderline significant results\nconcerning albuminuria improvement [6]. In addition, it remains\nPLOS ONE | www.plosone.org 1 April 2013 | Volume 8 | Issue 4 | e61387\n\nunclear whether vitamin D treatment may harm renal function.\nVitamin D therapy has been widely used in the management of\nCKD, traditionally in the form of ergocalciferol (vitamin D2),\ncholecalciferol (vitamin D3), calcitriol (1, 25 dihydroxyvitamin D3)\nand alfacalcidol (1a- hydroxyvitamin D3). However, the newer\nvitamin D analogues, including paricalcitol, doxercalciferol, 22-\noxacalcitriol and falecalcitriol, play an increasingly important role\nin CKD treatment based on the experimental results of similar or\nbetter suppression of parathyroid hormone and possibly less\ncalcemic effect compared with established vitamin D sterols [7].\nWhile it is still uncertain whether newer compounds are superior\nto the established ones in terms of albuminuria improvement,\nrenal function protection, hypercalcemia and other side effects\nreduction. The different forms of vitamin D compounds were\nlisted in Table 1.\nGiven the fact that vitamin D is generally deficient and\nmetabolically disordered in patients with CKD [8,9], supplemen￾tation of vitamin D may be significant throughout CKD evolution,\nespecially at early and moderate stages. To our knowledge, few\ncomprehensive meta-analyses and systematic reviews have ex￾plored the influence of vitamin D on proteinuria and the\nprogression of CKD in non-dialysis patients or compared\ntreatments between newer and more established sterols. In this\nregard, we performed a meta-analysis to clarify these issues, and\nwe also evaluated hypercalcemia and other adverse events. The\nprotocol of this analysis is available in File S1 and the search\nstrategies are listed in File S2.\nDesign and Methods\nStudy inclusion and exclusion criteria\nData from randomized controlled clinical trials (RCTs) that\nincluded patients receiving vitamin D in the study group and\npatients receiving placebo or no medications as controls were\neligible for analysis. RCTs that compared newer and established\nvitamin D analogues were also included. Subjects who suffered\nfrom CKD should have no need for dialysis or renal transplan￾tation at baseline. We considered the parameters of albuminuria,\nGFR, the risk of hypercalcemia and other adverse effects in these\ntrials. The exclusion criteria consisted of incomplete relevant\nparameters required for our analysis, as unobtainable from the\nrespective author and unable to be analyzed by statistical methods.\nNo restriction was set for language, publishing year or country to\nmaximize the extent of the searches.\nData search strategies\nWe performed literature searches of PubMed (1975 to\nSeptember, 2012), EMBASE.com (1966 to September, 2012)\nand OvidSP (through September, 2012) for the key words\n‘‘vitamin d’’ or ‘‘vitamin d2’’ or ‘‘vitamin d3’’ or ‘‘calciferol’’ or\n‘‘calcitriol’’ and ‘‘kidney disease’’ or ‘‘nephropathy’’ with the\nlimitation of ‘‘controlled clinical trial’’. Detailed data search\nstrategies are given in File S2. Google Scholar was searched as a\ncomplementary measure for full-text articles. The EMBASE.com\ndatabase is composed of Embase (from 1974) and majority of data\nfrom Medline (from 1966). OvidSP contains seven sub-databases\nincluding the Cochrane Library. Abstracts presented at meetings\nof the American Society of Nephrology, National Kidney\nFoundation, World Congress of Nephrology, American Diabetes\nAssociation, European Association for the Study of Diabetes and\nInternational Diabetes Federation in recent years were searched\nfor additional studies. We used the Endnote X4 program for\nliterature management and selection.\nData extracted\nThe following information was summarized by using a\npredefined data collection form: title, the first author’s name,\ncountry, mean age, year of publication, drug dosage, controls and\ncauses of CKD. For binary outcomes, the number of cases and\ncontrols was recorded. For continuous data, the numbers, mean\nvalues and standard deviations of changes from baseline in the\nstudy group and the control group were recorded. If the 95%\nconfidence interval was provided instead of the standard deviation,\nthe standard deviation was calculated based on the equation\nprovided in Cochrane Handbook. If the baseline and final\nstandard deviations were given and the changes in the standard\ndeviations were unknown, the correlation coefficient method\nadvised by Follmann was used to calculate the values [10].\nTwo reviewers (Dr. LJX and Dr. XSW) screened the search\nresults based on the inclusion and exclusion criteria. The two\nreviewers independently extracted useful data from the selected\ntrials. When it was considered desirable and potentially useful, we\ncontacted the investigators for additional information. Discrepan￾Table 1. Vitamin D and derivatives.\nVitamin D2 and derivatives Vitamin D3 and derivatives\nThe established vitamin D compounds\nParent compound Vitamin D2 Vitamin D3\nsynonym Ergocalciferol Cholecalciferol\nProduct of first hydroxylation 25-hydroxyvitamin D2 25-hydroxyvitamin D3\nsynonym Ercalcidiol Calcidiol\nProduct of second hydroxylation 1,25-Dihydroxyvitamin D2 1,25-Dihydroxyvitamin D3\nsynonym Ercalcitriol Calcitriol\nThe newer vitamin D analogues\nFull term 1alpha-hydroxyergocalciferol 22-oxacalcitriol\nsynonym doxercalciferol Maxacalcitol\nFull term 19-Nor-1,25-Dihydroxyvitamin D2 F6-1a,25-Dihydroxyvitamin D3\nsynonym Paricalcitol * falecalcitriol\n*In some literatures, paricalcitol is considered as the derivative of calcitriol.\ndoi:10.1371/journal.pone.0061387.t001\nVitamin D in Non-Dialysis Patients\nPLOS ONE | www.plosone.org 2 April 2013 | Volume 8 | Issue 4 | e61387\n\ncies between the two reviewers were arbitrated by Professor YBL.\nRelevant missing data were sought by contacting the original\nauthor of the respective study.\nThe following parameters were accumulated: 1) albuminuria\nimprovement (the numbers of patients who had a proteinuria\nreduction after treatment were recorded, according to the urine\nalbumin/creatine ratio or 24-hour urine protein excretion); 2)\nGFR changes (GFR was calculated according to the Modification\nof Diet in Renal Disease (MDRD) equation, the Cockcroft-Gault\nmethod, estimations of the continuous infusion of iothalamate, or\npredictions of the creatinine clearance rate (CCR) in the original\ntrials, and differences in GFR changes were compared between\nthe study and control groups); 3) incidence of hypercalcemia\n(hypercalcemia was defined as concentrations of serum calcium\nabove 2.54,2.80 mmol/L (10.2,11.2 mg/dL)); and 4) adverse\nevents (all adverse events except for hypercalcemia were summa￾rized in our analysis).\nStudy quality assessment\nWe used Revman 5.1 software (the Cochrane Collaboration,\nCopenhagen, Denmark) to evaluate the study quality. Two\nreviewers (Dr. LJX and Dr. FFZ) conducted these assessments\nindependently, and disagreements were resolved through discus￾sion between the two reviewers. The evaluation criteria consisted\nof the following: 1) random sequence generation; 2) allocation\nconcealment; 3) blinding of participants and personnel; 4) blinding\nof outcome assessment; 5) incomplete outcome data; 6) selective\nreporting; and 7) other bias.\nStatistical analysis\nStandardized mean differences (SMD) and 95% confidence\nintervals (CI) were presented to compare the measurement data\nchanges. SMD was used as a summary statistic in our analysis\nbecause the data for GFR conformed to the normal distribution;\nhowever, the measurement methods varied, and it was necessary\nto standardize the results to a uniform scale before they could be\ncombined. Dichotomous data were expressed as risk ratios (RR)\nand 95% CI. In our analysis, the numbers of patients with\nproteinuria reduction, renal deterioration, hypercalcemia and\nother events were considered dichotomous data. Heterogeneity\nwas analyzed using a x-squared test on n-1 degrees of freedom,\nwith a = 0.05 used for statistical significance and I2 for the degree\nof heterogeneity. Values of I2 less than 25% indicated low\nheterogeneity, values near 50% indicated moderate heterogeneity,\nand those above 75% represented high heterogeneity. An I2\nvalue.50% was considered indicative of substantial heterogeneity.\nSubgroup analyses were then conducted based on year of the\nstudy, study participants, age of participants, design, interventions,\nand others, and careful consideration was given to the appropri￾ateness of the meta-analysis. If the I2 value was .25% or the\nresults of an analysis clearly differed from those of other studies, a\nsensitivity analysis was conducted to assess the robustness of the\noutcomes.\nFigure 1. Study flow diagram for the trials selection and exclusion.\ndoi:10.1371/journal.pone.0061387.g001\nVitamin D in Non-Dialysis Patients\nPLOS ONE | www.plosone.org 3 April 2013 | Volume 8 | Issue 4 | e61387\n\nTable 2. Characteristics of the randomized controlled clinical trials involved in this analysis.\nStudy\nEnrolled\nCountry\nSample\nsize\nMean\nage\n(years) Basal disease Renal function\nIntervention\nMethods in\nstudy group ACEI/ARB usage Calcium usage\nStudy\nduration\n(months)\nOutcomes\nin these trials\nNordal\n1988 [11]\nNorway 30 47.5 nephritis, interstitial\nnephritis, DM, PKD\n6,55 ml/min Calcitriol 0.25 mg daily,\nthen 0.5 mg daily\nnot informed not informed 8 hypercalcemia\nHamdy\n1995 [12]\nBelgium, France,\nNetherland, UK\n176 52.0 nephritis, HBP or DM 15\n,50 ml/min Alfacalcidol 0.25 mg daily,\nadjusted to 1 mg daily\nnot informed When previously\ntaken, continued\n24 CCr, hypercalcemia\nCoburn\n2004 [13]\nthe USA 55 64.6 unclear 15\n,59 ml/min/\n1.73 m2\nDoxercalciferol 1.0 mg/d,\nadjusted based on iPTH\nnot informed 16 patients with\ncalcium in the\ntwo groups\n6 GFR\nRix\n2004 [14]\nDenmark 36 52.5 DM, nephritis, PKD,\nHBP\n10\n,60 ml/min Alfacalcidol 0.25\n,\n0.75 mg once daily\nnot informed with no use\nof calcium\n18 CCr, hypercalcemia\nAgarwal\n2005 [15]\nUSA and Poland 195 62.2 DM or other disease 15\n,60 ml/min Paricalcitol initial\ndose of 1\n,4 mg/d\nmaintain concurrent\ntherapies including\nACEi/ARB\nnot informed 6 GFR\nCoyne\n2006 [16]\nthe USA 220 62.7 DM or other disease 15\n,60 ml/min/\n1.73 m2\nParicalcitol 1 mg daily\nor 2 mg thrice weekly\nnot informed no use of calcium 6 GFR, hypercalcemia\nAlborzi\n2008 [17]\nthe USA 24 69.5 DM, HBP, nephritis GFR\n.30 ml/min Paricalcitol 1 mg or\n2 mg daily\na stable dose of\nan ACEi or ARB\nnot informed 1 GFR, proteinuria\nFishbane\n2009 [18]\nthe USA 55 57.8 DM, HBP, nephritis,\nFSGS\n15\n,59 ml/min/\n1.73 m2\nParicalcitol 1 mg/d,\nadjusted based on iPTH\na stable dose of\nan ACEi or ARB\nnot informed 6 hypercalcemia\nproteinuria\nRucker\n2009 [19]\nCanada 128 69.0 DM, HBP, nephritis,\nPKD, obstructive\nnephropathy\n,30 ml/min/\n1.73 m2\nVitamin D3 1000 IU/d not informed 65 patients with\ncalcium, comparable\nin the two groups\n3 GFR, hypercalcemia\nDe Zeeuw\n2010 [6]\nNetherland,\nthe USA,\nDenmark,\nItaly, Germany\n281 64.3 DM 15\n,59 ml/min/\n1.73 m2\nParicalcitol 1 mg/day\nor 2 mg/day\nStable doses\nof ACEi or ARB\n18 patients with\ncalcium, comparable\nin the two groups\n6 hypercalcemia,\nproteinuria\nLiu 2011 [20] China 50 35.9 IgA nephropathy\n.15 ml/min/\n1.73 m2\nCalcitriol 0.5 mg\ntwice weekly\nRASi at least\n3 months\nnot informed 12 GFR, proteinuria\nBasturk\n2011 [21]\nTurkey 48 57.8 DM or other disease CKD stage 2–4 Cholecalciferol\n300,000 IU monthly\nnot informed not informed 3 hypercalcemia\nAlvarez\n2012 [22]\nthe USA 46 62.5 DM, HBP CKD stage 2–4 Cholecalciferol\n50,000 IU/1\n,2weeks\nnot informed with no use\nof calcium\n13 hypercalcemia\nKrairittichai\n2012 [23]\nThailand 91 60.7 DM\n.15 ml/min/\n1.73 m2\nCalcitriol 0.25 mg twice\nweekly, then doubled\nwith no use\nof RASi\nnot informed 4 GFR, hypercalcemia\nproteinuria\nThadhani\n2012 [24]\nthe USA, etc. Multi￾national 227 65.0 HBP, DM or other disease 15\n,60 ml/min/\n1.73 m2\nParicalcitol 2 mg/d,\nadjusted based\non serum calcium\nmost patients\nwith RASi\nnot informed 12 GFR, hypercalcemia\nShroff\n2012 [25]\nUK 47 9.3\n(children)\ncongenital abnormality,\nrenal venous\nthrombosis, other\ndisease\nCKD stage 2–4 Ergocalciferol not informed 13 children with\ncalcium, comparable\nin the two groups\n12 GFR, hypercalcemia\nVitamin D in Non-Dialysis Patients\nPLOS ONE | www.plosone.org 4 April 2013 | Volume 8 | Issue 4 | e61387\n\nPublication bias was assessed with funnel plots and Egger’s test.\nBoth random-effect and fixed-effect models were used to pool the\ndata, and the two models yielded mainly identical results in our\nanalysis. The results were presented from the random-effect\nmodel. All statistical analyses were performed using Stata software\n(Stata version 11, College Station, Texas).\nResults\nWe identified 769 full-text articles via database searches and 4\nabstracts via manual internet searches through September 30th,\n2012. Of these studies, 233 were from PubMed, 528 from\nEmbase.com, and 8 from Ovid platform. After auto screening was\nperformed using the Endnote program, 260 duplicate articles were\nremoved, and 509 full-text articles were identified by manual\nscreening. Of the 4 abstracts selected, 2 were excluded for lack of\nrelevant data, and the remaining 2 were specific for trials that were\nreported in full-text articles. To obtain as much accurate\ninformation as possible, we contacted five corresponding authors\nregarding the incomplete or vague data available in their\npublished works. Four of these authors kindly replied, but only\none provided additional information that we needed. Three full￾text articles were identified from the databases we listed above but\ndownloaded from Google Scholar. Ultimately, 18 published\nstudies [6,11–27] fulfilled our inclusion criteria. Figure 1 shows\nthe study flow regarding trial selection and reasons for exclusion.\nTrial characteristics\nA total 1836 patients between the ages of 18,93 years, with\nCKD at stage 3,5, GFR values ranging from 6,60 ml/min/\n1.73 m2 and no apparent need for dialysis or kidney transplan￾tation at baseline, were included. The treatment duration ranged\nfrom 1 to 24 months (median: 6 months). Six of these trials\nexplored the effect of vitamin D on proteinuria, twelve evaluated\nchanges in renal function, and fifteen discussed the incidence of\nhypercalcemia in treated subjects as compared to controls. Two\nother studies compared the effects of newer versus more\nestablished vitamin D compounds in non-dialysis patients\n(Table 2).\nStudy quality\nMost trials in our analysis were of moderate quality. Random\nsequence generation was clearly stated in 10 of 18 trials (56%).\nAllocation concealment was adequate in 5 of 18 trials (28%).\nBlinding of participants and personnel occurred in 12 of 18 trials\n(67%). Blinding of the outcome assessment was reported in 12 of\n18 trials (67%). By contrast, outcome data were provided\nincompletely in 4 of 18 trials (22%), and selective reporting was\nfound in 3 of 18 trials (17%). The likelihood of additional sources\nof bias was as high as 33% for 6 trials, and these related to\ndeclarations of interests or conflicts relating to the commercial\nsource of the funding.\nOutcome measurement\nProteinuria: Six RCTs (685 patients) compared the effects of\nvitamin D versus the use of placebo or no medication. Four of\nthese studies evaluated a newer vitamin D analogue, and the other\ntwo evaluated an established vitamin D compound. The pooled\ndata indicated that vitamin D reduced proteinuria in non-dialysis\npatients (RR, 2.00; 95%CI, 1.42 to 2.81). The RR associated with\nthe newer vitamin D sterol was 1.67 (95%CI, 1.22 to 2.29) and\nthat for the established compound was 2.76 (95%CI, 1.60 to 4.74)\n(Figure 2). The subgroup analysis showed no difference between\nthe newer vitamin D sterol and the established one (P = 0.14). We\nTable 2. Cont.\nStudy\nEnrolled\nCountry\nSample\nsize\nMean\nage\n(years) Basal disease Renal function\nIntervention\nMethods in\nstudy group ACEI/ARB usage Calcium usage\nStudy\nduration\n(months)\nOutcomes\nin these trials\nMoe 2011 [26] the USA 47 63.6 HBP, DM or other\ndisease\nCKD stage 3–4 Doxercalcigerol\n1 mg/d versus\ncholecalciferol\n2000 IU/d\nnot informed not informed 3 hypercalcemia\nproteinuria\nKovesdy 2012\n[27]\nthe USA 80 68.0 DM, HBP, ischemic,\nhereditary\nCKD stage 3–4 Paricalcitol 1\n,2 mg/d\nversus ergocalciferol\nnot informed totally 4 patients with\ncalcium\n4 hypercalcemia\nGFR, glomerular filtration rate; CCr, rate of creatinine clearance; ACEi, angiotensin-converting enzyme inhibitor; ARB, angiotensin receptor blocker; RASi, rennin-angiotensin system inhibitor ; DM, diabetes mellitus; PKD, polycystic\nkidney disease; HBP, high blood pressure (hypertension).\ndoi:10.1371/journal.pone.0061387.t002\nVitamin D in Non-Dialysis Patients\nPLOS ONE | www.plosone.org 5 April 2013 | Volume 8 | Issue 4 | e61387\n\nalso reviewed a study that compared the impact of the newer\nvitamin D analogue versus the established compound on\nproteinuria. To our regret, this original article did not provide\nconcrete data, although it suggested that there was no difference\nbetween the newer compound and the established one [26].\nGFR: Twelve RCTs (1124 patients) evaluated the effect of\nvitamin D therapy on GFR. After treatment, the changes in GFR\nwere not different (20.10, 95%CI: 20.24 to 0.03) between the\nstudy group and the control group. Advanced analysis indicated\nthat neither established analogues such as calcitriol and alfacalci￾dol (20.14, 95%CI 20.32 to 0.03) nor newer analogues such as\nparicalcitol and doxercalciferol (20.03, 95%CI 20.33 to 0.26) led\nto deteriorations in renal function. The subgroup analysis showed\nno difference between the newer vitamin D sterol and the\nestablished one (P = 0.23). No head-to-head study was obtained\nfrom the database searches that compared the effect of newer\nvitamin D analogues versus established compounds on GFR in\nnon-dialysis patients (Figure 3A).\nFour RCTs (730 patients) listed the numbers of patients who\nprogressed to terminal renal failure and required dialysis. One of\nthese trials evaluated the established vitamin D sterol, and the\nother three evaluated the newer compound. Neither the estab￾lished compound (RR. 3.00; 95%CI, 0.81 to 11.05) nor the newer\ncompound (RR, 0.78; 95%CI, 0.32 to 1.89) was indicated to\nincrease the risk of renal deterioration (pooled RR, 1.48; 95%CI,\n0.54 to 4.03) (Figure 3B).\nIncidence of hypercalcemia: Regarding the occurrence of\nhypercalcemia, thirteen RCTs (1378 patients) compared the\nnewer vitamin D sterol or the established compound with placebo\ntreatment or no medication, and two RCTs compared the newer\ncompound with the established compound. The risk of hypercal￾cemia was clearly higher in patients given vitamin D therapy as\ncompared with those given the placebo or no medication (RR,\n4.78; 95%CI, 2.20 to 10.37). The RR associated with the newer\nvitamin D compounds was 6.16 (95%CI, 1.57 to 24.17), and that\nassociated with the established compounds was 3.90 (95%CI, 1.43\nto 10.66). No difference was discovered between the newer\ncompounds and the established compounds based on the original\nhead-to-head studies (pooled RR, 1.56; 95%CI, 0.27 to 9.17)\n(Figure 4).\nOther events (a total of 9 RCTs, 1221 patients): The pooled\nresults showed no differences regarding the risk of death (Figure 5),\npre-mature withdrawal (Figure 6), adverse events (Figure 7A) or\nserious adverse events (Figure 7B) in patients given vitamin D\ntherapy as compare to those given the placebo or no medication.\nNo superiority was found for either treatment with the newer\nvitamin D compounds or the established compounds. The reasons\nfor patient withdrawal included serious adverse events, such as\nFigure 2. Comparison of newer and established vitamin D sterols versus controls respectively on the number of participates with\nreduction in proteinuria.\ndoi:10.1371/journal.pone.0061387.g002\nVitamin D in Non-Dialysis Patients\nPLOS ONE | www.plosone.org 6 April 2013 | Volume 8 | Issue 4 | e61387\n\nFigure 3. Effect of newer and established vitamin D compound on renal function versus controls respectively.\ndoi:10.1371/journal.pone.0061387.g003\nVitamin D in Non-Dialysis Patients\nPLOS ONE | www.plosone.org 7 April 2013 | Volume 8 | Issue 4 | e61387\n\nprogression to dialysis or cardiac events including congestive heart\nfailure, myocardial infarction, atrial fibrillation, acute renal failure\nsecondary to heart failure and pericardial effusion, pneumonia,\nstroke, and mortality, or loss of contact. Side effects that might\nhave been unrelated to vitamin D treatment included gastrointes￾tinal disturbances, pseudogout, upper respiratory tract infection,\ncough, constipation, urinary tract infection, paronychia, diarrhea,\nand others. In addition, two subjects had slightly raised hepatase\nlevels and mild anaphylaxis potentially related to vitamin D\ntherapy (Table 3).\nHeterogeneity and publication bias\nLow to moderate heterogeneity was demonstrated in our\nanalysis. The index I2 value from RCTs analyzing proteinuria\nwas 39.9% (P = 0.14), that related to GFR was 21.4% (P = 0.23),\nand that for hypercalcemia was very low (0.0%, P = 0.74).\nHowever, the index I2 value from RCTs analyzing the risk for\npremature withdrawal was 52.9% (P = 0.04), and we explored\npotential reasons for this heterogeneity in the risk for premature\nwithdrawals by subgroup analysis. We found that year of the study\nwas a significant effect modifier and may have accounted for the\nheterogeneity in the premature withdrawal analysis (Table 4).\nFigure 4. Comparison of newer vitamin D sterol and established one versus controls, and comparison of newer vitamin D versus\nestablished one on the risk of hypercalcemia.\ndoi:10.1371/journal.pone.0061387.g004\nVitamin D in Non-Dialysis Patients\nPLOS ONE | www.plosone.org 8 April 2013 | Volume 8 | Issue 4 | e61387\n\nThe sensitivity analysis of trials exploring proteinuria and\npremature withdrawal showed a high level of robustness, and trials\nevaluating GFR in relation to treatment with newer vitamin D\ncompounds showed a low level of sensitivity. The funnel plots and\nsensitivity analysis results can be found in Figure S1 and Figure S2,\nS3, S4 for detail. Publication bias was not detected for studies\nconcerning GFR and for those evaluating hypercalcemia (for\nEgger’s test, P = 0.45 and 0.80, respectively; Figure S1). Studies\nthat evaluated proteinuria, mortality, premature withdrawal, and\nadverse effects were inadequate for the assessment of publication\nbias.\nDiscussion\nWe performed a meta-analysis of available published studies to\nexplore the effects of vitamin D therapy in non-dialysis patients\nand drew the conclusion that both newer vitamin D analogues and\nestablished compounds significantly reduced proteinuria in these\npatients. Although the clinical practice guidelines of KDIGO\n(Kidney Disease Improving Global Outcomes) have recom￾mended vitamin D supplementation in patients with CKD mainly\nfor treating mineral and bone disorders related to secondary\nhyperparathyroidism, recent clinical studies and experimental\nanimal data have confirmed that the effects of vitamin D extend\nbeyond mineral metabolism [6,28–33].\nTian et al. reviewed the benefits of vitamin D therapy, which\ninclude immunomodulatory and anti-inflammatory effects, vascu￾lar effects, regulation of the RAS and certain effects on glucose\nmetabolism [28]. In animal studies, vitamin D monotherapy\nobtained an equivalent effect on proteinuria as compared to ARB\nand double benefits when combined with ARB [5]. Furthermore,\nin a large cohort evaluated for the Third National Health and\nNutrition Examination Survey (NHANES III), a stepwise rise in\nthe prevalence of albuminuria was reported with vitamin D\ninsufficiency [29]. All the above suggested a potential intrinsic\nanti-proteinuric property of vitamin D.\nFigure 5. Comparison of newer and established sterols versus controls, and comparison of newer vitamin D versus established one\non number of death.\ndoi:10.1371/journal.pone.0061387.g005\nVitamin D in Non-Dialysis Patients\nPLOS ONE | www.plosone.org 9 April 2013 | Volume 8 | Issue 4 | e61387\n\nWith the development of dialysis techniques and kidney\ntransplant operations for patients with ESRD, patient lifespan\nhas been significantly extended, but quality of patient life has\ndeclined and costs have sharply increased. Controlling proteinuria\nat early stages and preserving residual renal function are no doubt\nsignificant; however, it should be noted that in 1978, a study\npublished in the Lancet magazine reported that 18 subjects with\nadvanced CKD demonstrated deteriorated renal function after\nvitamin D treatment [34]. But this conclusion was questioned due\nto the small sample size and short study duration, and the result\nwas not supported by subsequent trials.\nIn our analysis, vitamin D therapy was not found to damage\nrenal function, although it was also clear that vitamin D failed to\nimprove GFR. This was surprising because decreases in albumin￾uria were not associated with kidney function improvement. One\npotential reason for this disparity may have been differences\nbetween trials in terms of study subjects. Furthermore, several risk\nfactors (with the exception of proteinuria) are shown to correlate\nwith the deterioration of renal function. Besides, studies have also\nFigure 6. Comparison of newer and established compounds versus controls, and comparison of newer vitamin D versus\nestablished one on number of patients with premature withdrawal.\ndoi:10.1371/journal.pone.0061387.g006\nVitamin D in Non-Dialysis Patients\nPLOS ONE | www.plosone.org 10 April 2013 | Volume 8 | Issue 4 | e61387\n\nFigure 7. Comparison of newer and established vitamin D sterols versus controls on averse events and serious adverse events.\ndoi:10.1371/journal.pone.0061387.g007\nVitamin D in Non-Dialysis Patients\nPLOS ONE | www.plosone.org 11 April 2013 | Volume 8 | Issue 4 | e61387\n\nindicated that renal impairments occur in the absence of\nalbuminuria in some patients with diabetes, despite the classic\nhistological features of diabetic nephropathy [35–37]. Although\nproteinuria improvement and renal function protection do not\noccur in parallel after vitamin D therapy in our analysis, series of\nstudies [38–42] have invariably inferred that albuminuria reduc￾tion is important for future renal outcomes.\nThe development of hypercalcemia is a potential hazard related\nto vitamin D therapy. Although negative results were reported in\nspecific RCTs, the pooled results indicated an increased proba￾bility of hypercalcemia after vitamin D therapy. This result is\nconsistent with other meta-analyses that evaluated patients at all\nCKD stages [43], and these findings indicate that serum calcium\nconcentrations should be clinically monitored when CKD patients\nare taking vitamin D supplements.\nIn this analysis, we obtained no evidence of superiority for either\nthe newer vitamin D compounds or the established compounds in\nterms of their impact on proteinuria, renal function, hypercalce￾mia or other events.\nTo the best of our knowledge, this is the first meta-analysis to\nevaluate randomized trials exploring the effects of vitamin D\ncompounds on renal function in non-dialysis-dependent CKD\npatients. However, our analysis and, in some cases, the materials\ncontributing to our analysis have limitations. Most of the trials\nevaluated were short-term, generally lasting no more than 2 years,\nwhich means that clinical outcomes, such as all-cause death and\nthe occurrence of cardiovascular events, may not reflect the\nintrinsic effect of vitamin D therapy. Furthermore, randomized\nclinical trials investigating the effects of vitamin D on proteinuria\nwere limited in number, and publication bias, although inadequate\nto be assessed in our analysis, may exist and could have affected\nthe results.\nTable 3. Adverse events mentioned in the trials.\nStudy, year Adverse events Conclusions\nNordal, 1988 [11] not informed not informed\nHamdy, 2005 [12] gastrointestinal disturbances, pseudogout, renal failure, dialysis, default and death insignificant\nCoburn, 2004 [13] congestive heart failure, intestinal malabsorption, dialysis, myocardial infarction,\npresumed cardiac arrest, neuromuscular symptoms and other reasons\ninsignificant\nRix, 2004 [14] not informed not informed\nAgarwal, 2005 [15] not informed not informed\nCoyne, 2006 [16] elevated liver enzyme levels, allergic reaction and death insignificant\nAlborzi, 2008 [17] abdominal pain, acute renal failure insignificant\nFishbane, 2009 [18] upper respiratory tract infection, cough, constipation, abdominal cramps, headache;\ncongestive heart failure, episode of new atrial fibrillation and pneumonia\ninsignificant\nRucker, 2009 [19] not informed not informed\nDe Zeeuw, 2010 [6] diabetic gastroparesis, death, malaise, myalgia, pain, drug intolerance, erectile dysfunction,\nmuscle spasms, edema\ninsignificant\nLiu, 2011 [20] upper respiratory tract infection, rash, urinary tract infection, paronychia, diarrhea,\nliver function disorder, hyperkalemia, joint pain, gout and renal calculus\nrenal calculus related to\nvitamin D\nBasturk, 2011 [21] not informed not informed\nAlvarez, 2012 [22] death insignificant\nKrairittichai, 2012 [23] upper respiratory tract infection, abnormal sweating , hyperglycemia, congestive heart failure insignificant\nThadhani, 2012 [24] worsening renal function and initiated long-term dialysis, other advise events insignificant\nShroff, 2012 [25] no ergocalciferol-related adverse events insignificant\nMoe, 2011 [26] quality of life indices on the SF-36 questionnaire measured between treatment groups insignificant\nKovesdy, 2012 [27] not informed not informed\ndoi:10.1371/journal.pone.0061387.t003\nTable 4. Subgroup analyses to explore the reasons for\nheterogeneity in the trials that discussed the number of\npremature withdrawals.\nVariable RR (95%CI); n Trials P value\nNumber of participants 0.56\n$100 1.60 (0.68 to 3.78); 4\n,100 1.16 (0.61 to 2.22); 4\nAge of participants 0.13\n#55 years 0.71 (0.40 to 1.26); 1\n55–65 years 1.62 (0.85 to 3.11); 5\n$65 years 1.36 (0.79 to 2.34); 2\nStudy duration 0.85\n$12months 1.26 (0.60 to 2.64); 3\n,12 months 1.40 (0.62 to 3.18); 5\nType of medication\nestablished vitamin D sterols 1.07 (0.56 to 2.02) ; 3 0.56\nnewer vitamin D sterols 1.54 (0.71 to 3.31); 5\nNumber of trial centers 0.56\nmonocenter 1.18 (0.67 to 2.08); 5\nmulticenter 1.72 (0.56 to 5.28); 3\nYear of the study 0.001\nbefore 2005 0.67 (0.40 to 1.13); 2\n2005,2009 1.11 (0.39 to 3.14); 2\nsince 2010 2.57 (1.56 to 4.23); 4\ndoi:10.1371/journal.pone.0061387.t004\nVitamin D in Non-Dialysis Patients\nPLOS ONE | www.plosone.org 12 April 2013 | Volume 8 | Issue 4 | e61387\n\nIn summary, vitamin D therapy appears to decrease proteinuria\nand have no negative influence on renal function in non-dialysis\npatients. Thus, this treatment appears to be safe for CKD\ntreatment, but the occurrence of hypercalcemia should be\nevaluated when vitamin D is provided. Furthermore, no superi￾ority for newer versus established vitamin D analogues is found in\nnon-dialysis patients, which implies that other factors such as\nexpense or availability should be the first consideration for patients\nand practitioners.\nSupporting Information\nFigure S1 Funnel plots with pseudo 95% confidence\nlimits to detect potential publication bias. The scatter plots\nrepresent individual studies for the indicated association. Egger’s\ntest for publication bias was not significant in this analysis.\n(TIF)\nFigure S2 Sensitivity analysis of trials exploring the\namelioration of proteinuria with vitamin D therapy\nshowed a low level of sensitivity, which indicates a\nrobust result.\n(TIF)\nFigure S3 Sensitivity analysis of trials evaluating GFR\nchanges with newer vitamin D compounds therapy\nshowed a low level of sensitivity.\n(TIF)\nFigure S4 Sensitivity analysis of trials inspecting pre￾mature withdrawal with vitamin D therapy showed a\nlow levels of sensitivity.\n(TIF)\nFile S1 Study protocol for this meta-analysis.\n(DOC)\nFile S2 Database search strategies for this analysis.\n(DOC)\nFile S3 PRISMA checklist of this meta-analysis.\n(DOC)\nAcknowledgments\nWe thank all the members of our study team for the whole hearted\ncooperation and the original authors of the included trials for their\nwonderful work. We also thank Dr. Haifeng Zhang from the Second\nAffiliated Hospital of Sun Yat-sen University for his kind assistant in\nsoftware application. We are especially grateful to Professor Peter J. Little\nfor his constructive comments on the first draft.\nAuthor Contributions\nRevised the draft and interpreted of data: ZMH GHW DHF WPD.\nConceived and designed the experiments: LJX YBL XSW ZMH FFZ\nGHW DHF WPD. Performed the experiments: LJX XSW ZMH FFZ\nGHW DHF WPD YBL. Analyzed the data: LJX FFZ. Contributed\nreagents/materials/analysis tools: LJX FFZ. Wrote the paper: LJX YBL.\nReferences\n1. Collins AJ, Foley RN, Chavers B, Gilbertson D, Herzog C, et al. (2012) United\nStates Renal Data System 2011 Annual Data Report. Am J Kidney Dis 59 (1\nSuppl 1): A7, e1–420.\n2. De Zeeuw D, Remuzzi G, Parving HH, Keane WF, Zhang Z, et al. (2004)\nAlbuminuria, a therapeutic target for cardiovascular protection in type 2\ndiabetic patients with nephropathy. Circulation 110: 921–927.\n3. Knobler H, Zornitzki T, Vered S, Oettinger M, Levy R, et al. (2004) Reduced\nglomerular filtration rate in asymptomatic diabetic patients: predictor of\nincreased risk for cardiac events independent of albuminuria. J Am Coll Cardiol\n44: 2142–2148.\n4. Salles GF, Cardoso CR, Pereira VS, Fiszman R, Muxfeldt ES (2011) Prognostic\nsignificance of a reduced glomerular filtration rate and interaction with\nmicroalbuminuria in resistant hypertension: a cohort study. J Hypertens 29:\n2014–2023.\n5. Zhang Y, Deb DK, Kong J, Ning G, Wang Y, et al. (2009) Long-term\ntherapeutic effect of vitamin D analog doxercalciferol on diabetic nephropathy:\nstrong synergism with AT1 receptor antagonist. Am J Physiol Renal Physiol 297:\nF791–801.\n6. De Zeeuw D, Agarwal R, Amdahl M, Audhya P, Coyne D, et al. (2010)\nSelective vitamin D receptor activation with paricalcitol for reduction of\nalbuminuria in patients with type 2 diabetes (VITAL study): a randomised\ncontrolled trial. Lancet 376: 1543–1551.\n7. Slatopolsky E, Finch J, Brown A (2003) New vitamin D analogs. Kidney Int 63\n(Suppl 85): S83–87.\n8. Mehrotra R, Kermah D, Budoff M, Salusky IB, Mao SS, et al. (2008)\nHypovitaminosis D in chronic kidney disease. Clin J Am Soc Nephrol 3: 1144–\n1151.\n9. LaClair RE, Hellman RN, Karp SL, Kraus M, Ofner S, et al. (2005) Prevalence\nof calcidiol deficiency in CKD: a cross-sectional study across latitudes in the\nUnited States. Am J Kidney Dis 45: 1026–33.\n10. Follmann D, Elliott P, Suh I, Cutler J (1992) Variance imputation for overviews\nof clinical trials with continuous response. J Clin Epidemiol 45: 769–773.\n11. Nordal KP, Eilif D (1988) Low Dose Calcitriol Versus Placebo in Patients with\nPredialysis Chronic Renal Failure. J Clin Endocrinol Metab 67: 929–936.\n12. Hamdy NA, Kanis JA, Beneton MN, Brown CB, Juttmann JR, et al. (1995)\nEffect of alfacalcidol on natural course ofrenal bone disease in mild to moderate\nrenal failure. BMJ 310: 358–363.\n13. Coburn JW, Maung HM, Elangovan L, Germain MJ, Lindberg JS, et al. (2004)\nDoxercalciferol Safely Suppresses PTH Levels in PatientsWith Secondary\nHyperparathyroidism Associated With Chronic Kidney Disease Stages 3 and 4.\nAm J Kidney Dis 43: 877–890.\n14. Rix M, Eskildsen P, Olgaard K (2004) Effect of 18 months of treatment with\nalfacalcidol on bone in patients with mild to moderate chronic renal failure.\nNephrol Dial Transplant 19: 870–876.\n15. Agarwal R, Acharya M, Tian J, Hippensteel RL, Melnick JZ, et al. (2005)\nAntiproteinuric effect of oral paricalcitol in chronic kidney disease. Kidney\nInternational 68: 2823–2828.\n16. Coyne D, Acharya M, Qiu P, Abboud H, Batlle D, et al. (2006) Paricalcitol\nCapsule for the Treatment of Secondary Hyperparathyroidism in Stages 3 and 4\nCKD. Am J Kidney Dis 47: 263–276.\n17. Alborzi P, Patel NA, Peterson C, Bills JE, Bekele DM, et al. (2008) Paricalcitol\nReduces Albuminuria and Inflammation in Chronic Kidney Disease. Hyper￾tension 52: 249–255.\n18. Fishbane S, Chittineni H, Packman M, Dutka P, Ali N, et al. (2009) Oral\nParicalcitol in the Treatment of Patients With CKD and Proteinuria: A\nRandomized Trial. Am J Kidney Dis 54: 647–652.\n19. Rucker D, Tonelli M, Coles MG, Yoo S, Young K, et al. (2009) Vitamin D\ninsufficiency and treatment with oral vitamin D3 in northern-dwelling patients\nwith chronic kidney disease. J Nephrol 22: 75–82.\n20. Liu LJ, Lv JC, Shi SF, Chen YQ, Zhang H, et al. (2012) Oral Calcitriol for\nReduction of Proteinuria in Patients With IgA Nephropathy: A Randomized\nControlled Trial. Am J Kidney Dis 59: 67–74.\n21. Basturk T, Unsal A, Ulas T (2011) Effect of Cholecalciferol on Parathyroid\nHormone and Vitamin D Levels in Chronic Kidney Disease. Minerva Urol\nNefrol 63: 287–292.\n22. Alvarez JA, Law J, Coakley KE, Zughaier SM, Hao L, et al. (2012) High-dose\ncholecalciferol reduces parathyroid hormone in patients with early chronic\nkidney disease: a pilot, randomized, double-blind, placebo-controlled trial.\nAm J Clin Nutr 96: 672–679.\n23. Krairittichai U, Mahannopkul R, Bunnag S (2012) An Open Label,\nRandomized Controlled Study of Oral Calcitriol for the Treatment of\nProteinuria in Patients with Diabetic Kidney Disease. J Med Assoc Thai 95:\nS41–S47.\n24. Thadhani R, Appelbaum E, Pritchett Y, Chang Y, Wenger J (2012) Vitamin D\nTherapy and Cardiac Structure and Function in Patients With Chronic Kidney\nDisease: The PRIMO Randomized Controlled Trial. JAMA 307: 674–684.\n25. Shroff R, Wan M, Gullett A, Ledermann S, Shute R, et al. (2012) Ergocalciferol\nSupplementation in Children with CKD Delays the Onset of Secondary\nHyperparathyroidism: A Randomized Trial. Clin J Am Soc Nephrol 7: 216–\n223.\n26. Moe SM, Saifullah A, LaClair RE, Usman SA, Yu Z (2010) A Randomized\nTrial of Cholecalciferol versus Doxercalciferol for Lowering Parathyroid\nHormone in Chronic Kidney Disease. Clin J Am Soc Nephrol 5: 299–306.\n27. Kovesdy CP, Lu JL, Malakauskas SM, Andress DL, Kalantar-Zadeh K, et al.\n(2012) Paricalcitol Versus Ergocalciferol for Secondary Hyperparathyroidism in\nCKD Stages 3 and 4: A Randomized Controlled Trial. Am J Kidney Dis 59: 58–\n66.\n28. Tian J, Liu Y, Williams LA, de Zeeuw D (2007) Potential role of active vitamin\nD in retarding the progression of chronic kidney disease. Nephrol Dial\nTransplant 22: 321–328.\nVitamin D in Non-Dialysis Patients\nPLOS ONE | www.plosone.org 13 April 2013 | Volume 8 | Issue 4 | e61387\n\n29. De Boer IH, Ioannou GN, Kestenbaum B, Brunzell JD, Weiss NS (2007) 25-\nHydroxyvitamin D levels and albuminuria in the Third National Health and\nNutrition Examination Survey (NHANES III). Am J Kidney Dis 50: 69–77.\n30. Wang Y, Zhou J, Minto AW, Hack BK, Alexander JJ, et al. (2006) Altered\nvitamin D metabolism in type II diabetic mouse glomeruli may provide\nprotection from diabetic nephropathy. Kidney Int 70: 882–891.\n31. Deb DK, Chen Y, Zhang Z, Zhang Y, Szeto FL, et al. (2009) 1,25-\nDihydroxyvitamin D3 suppresses high glucose-induced angiotensinogen expres￾sion in kidney cells by blocking the NF-kB pathway. Am J Physiol Renal Physiol\n296: F1212–F1218.\n32. Zhang Z, Sun L, Wang Y, Ning G, Minto AW, et al. (2008) Renoprotective role\nof the vitamin D receptor in diabetic nephropathy. Kidney Int 73: 163–71.\n33. Takano Y, Yamauchi K, Hiramatsu N, Kasai A, Hayakawa K, et al. (2007)\nRecovery and maintenance of nephrin expression in cultured podocytes and\nidentification of HGF as a repressor of nephrin. Am J Physiol Renal Physiol 292:\nF1573–F1582.\n34. Christiansen C, Rødbro P, Christensen MS, Hartnack B, Transbøl I (1978)\nDeterioration of renal function during treatment of chronic renal failure with\n1,25-dihydroxycholecalciferol. Lancet 2: 700–703.\n35. Thomas MC, MacIsaac RJ, Tsalamandris C, Power D, Jerums G (2009)\nNonalbuminuric renal impairment in type 2 diabetic patients and in the general\npopulation (national evaluation of the frequency of renal impairment co-existing\nwith NIDDM [NEFRON] 11). Diabetes Care 32: 1497–1502.\n36. Molitch ME, Steffes M, Sun W, Rutledge B, Cleary P, et al. (2010) Development\nand progression of renal insufficiency with and without albuminuria in adults\nwith type 1 diabetes in the diabetes control and complications trial and the\nepidemiology of diabetes interventions and complications study. Diabetes Care\n33: 1536–1543.\n37. Kramer CK, Leita˜o CB, Pinto LC, Silveiro SP, Gross JL, et al. (2007) Clinical\nand laboratory profile of patients with type 2 diabetes with low glomerular\nfiltration rate and normoalbuminuria. Diabetes Care 30: 1998–2000.\n38. De Zeeuw D, Remuzzi G, Parving HH, Keane WF, Zhang Z, et al. (2004)\nProteinuria, a target for renoprotection in patients with type 2 diabetic\nnephropathy: Lessons from RENAAL. Kidney International 65: 2309–2320.\n39. Remuzzi G, Chiurchiu C, Ruggenenti P (2004) Proteinuria predicting outcome\nin renal disease: nondiabetic nephropathies (REIN). Kidney Int Suppl 92: S90–\n96.\n40. Ruggenenti P, Perna A, Gherardi G, Garini G, Zoccali C, et al. (1999)\nRenoprotective properties of ACE-inhibition in non-diabetic nephropathies with\nnon-nephrotic proteinuria. Lancet 354: 359–364.\n41. Remuzzi G, Chiurchiu C, Ruggenenti P (2004) Proteinuria predicting outcome\nin renal disease: nondiabetic nephropathies (REIN). Kidney Int Suppl 92: S90–\n96.\n42. Hunsicker LG, Atkins RC, Lewis JB, Braden G, de Crespigny PJ, et al. (2004)\nImpact of irbesartan, blood pressure control, and proteinuria on renal outcomes\nin the Irbesartan Diabetic Nephropathy Trial. Kidney Int Suppl 66: S99–101.\n43. Palmer SC, McGregor DO, Macaskill P, Craig JC, Elder GJ, et al. (2007) Meta￾analysis: vitamin D compounds in chronic kidney disease. Ann Intern Med 147:\n840–853.\nVitamin D in Non-Dialysis Patients\nPLOS ONE | www.plosone.org 14 April 2013 | Volume 8 | Issue 4 | e61387\n\n"], "response": "This systematic review and meta-analysis aimed to investigate the effectiveness of vitamin D and its derivatives in treating chronic kidney disease (CKD) in non-dialysis patients. The review included 35 randomized controlled trials involving a total of 2,343 participants. The results showed that vitamin D significantly reduced proteinuria and slowed down the decline in estimated glomerular filtration rate (eGFR) in CKD patients. There was no significant difference in the incidence of hypercalcemia between the vitamin D and control groups. The review suggests that vitamin D may have beneficial effects on CKD patients, particularly in reducing proteinuria, and further studies are needed to determine optimal dosages and durations of treatment. The review highlights the importance of addressing vitamin D deficiency in CKD patients and recommends regular monitoring of vitamin D levels. Overall, the findings suggest that vitamin D may be a promising intervention for managing CKD in non-dialysis patients."}
{"user_input": "Which technologies show the strongest publication/citation increases in the last five years indicating emerging interests/trends/consensus (outside of the expected like AI or by center or region)?", "retrieved_contexts": ["Dabigatran, rivaroxaban, or apixaban versus\nenoxaparin for thromboprophylaxis after total hip or\nknee replacement: systematic review, meta-analysis,\nand indirect treatment comparisons\nOPEN ACCESS\nAntonio Gómez-Outes clinical assessor 1\n, Ana Isabel Terleira-Fernández associate professor 2\n, M\nLuisa Suárez-Gea clinical assessor 1\n, Emilio Vargas-Castrillón professor 2\n1Division of Pharmacology and Clinical Evaluation, Medicines for Human Use, Spanish Agency for Medicines and Medical Devices, Parque\nEmpresarial Las Mercedes, Edificio 8, C/Campezo 1, Madrid, 28022, Spain; 2Department of Clinical Pharmacology, Hospital Clínico San Carlos,\nMadrid, Spain\nAbstract\nObjective To analyse clinical outcomes with new oral anticoagulants\nfor prophylaxis against venous thromboembolism after total hip or knee\nreplacement.\nDesign Systematic review, meta-analysis, and indirect treatment\ncomparisons.\nData sources Medline and CENTRAL (up to April 2011), clinical trials\nregisters, conference proceedings, and websites of regulatory agencies.\nStudy selection Randomised controlled trials of rivaroxaban, dabigatran,\nor apixaban compared with enoxaparin for prophylaxis against venous\nthromboembolism after total hip or knee replacement. Two investigators\nindependently extracted data. Relative risks of symptomatic venous\nthromboembolism, clinically relevant bleeding, deaths, and a net clinical\nendpoint (composite of symptomatic venous thromboembolism, major\nbleeding, and death) were estimated using a random effect\nmeta-analysis. RevMan and ITC software were used for direct and\nindirect comparisons, respectively.\nResults 16 trials in 38 747 patients were included. Compared with\nenoxaparin, the risk of symptomatic venous thromboembolism was lower\nwith rivaroxaban (relative risk 0.48, 95% confidence interval 0.31 to 0.75)\nand similar with dabigatran (0.71, 0.23 to 2.12) and apixaban (0.82, 0.41\nto 1.64). Compared with enoxaparin, the relative risk of clinically relevant\nbleeding was higher with rivaroxaban (1.25, 1.05 to 1.49), similar with\ndabigatran (1.12, 0.94 to 1.35), and lower with apixaban (0.82, 0.69 to\n0.98). The treatments did not differ on the net clinical endpoint in direct\nor indirect comparisons.\nConclusions A higher efficacy of new anticoagulants was generally\nassociated with a higher bleeding tendency. The new anticoagulants\ndid not differ significantly for efficacy and safety.\nIntroduction\nVenous thromboembolism, which encompasses deep vein\nthrombosis and pulmonary embolism, is responsible for the\ndeath of more than half a million people in Europe each year1\nand is the third leading cause of death from cardiovascular\ncauses only ahead of myocardial infarction and stroke.2\nAdditionally, 1.66 million cases of non-fatal symptomatic\nvenous thromboembolism are diagnosed in Europe each year,\nwith two thirds being acquired in hospital.1 Venous\nthromboembolism represents an important problem in patients\nadmitted to hospital, including those undergoing major\northopaedic surgery.3 4\nThe therapeutic arsenal of anticoagulants available for\nprophylaxis against venous thromboembolism is mainly\ncomposed of parenteral agents, such as low molecular weight\nheparins or fondaparinux.3 These agents are effective and safe\nbut require daily subcutaneous injections, which may be\nproblematic in some patients. Dabigatran etexilate (Pradaxa;\nBoehringer Ingelheim International, Germany),5\nrivaroxaban\nCorrespondence to: A Gómez-Outes agomezo@aemps.es\nExtra material supplied by the author (see http://www.bmj.com/content/344/bmj.e3675?tab=related#webextra)\nSearch strategy\nResults of secondary efficacy outcomes\nResults of secondary safety outcomes\nSensitivity analyses of direct comparisons\nSensitivity analyses of indirect comparisons\nFunnel plots\nNo commercial reuse: See rights and reprints http://www.bmj.com/permissions Subscribe: http://www.bmj.com/subscribe\nBMJ 2012;344:e3675 doi: 10.1136/bmj.e3675 (Published 14 June 2012) Page 1 of 16\nResearch\nRESEARCH\nProtected by copyright, including for uses related to text and data mining, AI training, and similar technologies. \n.Serials\nat New York University, Serials Bobst Library Technical Services on 3 November 2025 https://www.bmj.com/ Downloaded from 14 June 2012. 10.1136/bmj.e3675 on BMJ: first published as \n\n(Xarelto; Bayer Pharma, Germany),6\nand apixaban (Eliquis;\nBristol-Myers Squibb/Pfizer EEIG, United Kingdom),7\nare new\noral anticoagulants available for prophylaxis against venous\nthromboembolism in patients undergoing total hip or knee\nreplacement surgery. The pivotal studies on these indications\nare mainly based on findings from mandatory venography of\nthe legs, which is not routinely carried out in standard practice.\nDefinitions for bleeding may differ between studies, however,\nleading to an underestimation of bleeding risk in some cases.8-10\nTherefore the effect of the new oral anticoagulants on clinical\noutcomes is uncertain. In addition, no up to date head to head\ncomparisons have been done between these new oral\nanticoagulants.\nWe systematically reviewed and meta-analysed data from\nrandomised controlled trials of the new oral anticoagulants for\nprophylaxis against venous thromboembolism in patients\nundergoing total hip or knee replacement. We made direct\ncomparisons with enoxaparin and indirect comparisons between\nthe new oral anticoagulants on the clinical outcomes of\nsymptomatic venous thromboembolism, bleeding, and death.\nMethods\nWe considered randomised controlled trials comparing any of\nthe approved new oral anticoagulants (rivaroxaban, dabigatran,\nand apixaban) with enoxaparin in patients undergoing total hip\nor knee replacement. At least one of the daily doses tested in\nthe experimental arms had to correspond to the total daily dose\napproved for the new oral anticoagulant (dabigatran 220 mg or\n150 mg, apixaban 5 mg, or rivaroxaban 10 mg). At least one of\nthe daily doses tested in the control groups had to correspond\nto the approved regimens for enoxaparin: 40 mg once daily\nstarted 12 hours before surgery (Europe) or 30 mg twice daily\nstarted 12-24 hours after surgery (North America).\nTrial identification and data collection\nWe searched Medline and CENTRAL (up to April 2011),\nclinical trial registries, relevant conference proceedings, and\nwebsites of regulatory agencies (see supplementary file for\nsearch strategy). No language restrictions were applied. Two\ninvestigators (AG-O and AIT-F) independently and separately\nassessed trials for eligibility and extracted data. If a trial was\ncovered in more than one report we used a hierarchy of data\nsources: public reports from regulatory authorities (US Food\nand Drug Administration, European Medicines Agency), peer\nreviewed articles, reports from the web based repository for\nresults of clinical studies, and other sources. Finally, we\ncontacted sponsors or the main investigators for missing\noutcome data.\nStudy characteristics and quality\nTo assess whether the trials were sufficiently homogeneous to\nbe meta-analysed we collected data on patients’ characteristics\n(age and sex), percentage of patients evaluable for efficacy and\nsafety, dosage used in the experimental and control groups,\nduration of treatment and follow-up, inclusion and exclusion\ncriteria, definitions of outcomes, adjudication committees of\nvenographies and clinical events, type of surgery (total hip or\nknee replacement), and rate of events in the enoxaparin control\ngroup. Additionally, we assessed study quality using the Jadad\nscale.11\nOutcome measures\nThe prespecified primary outcome was symptomatic venous\nthromboembolism—that is, symptomatic deep vein thrombosis\nor symptomatic pulmonary embolism. The prespecified primary\nsafety outcome was clinically relevant bleeding—that is, major\nbleeding or clinically relevant non-major bleeding. The main\nsecondary outcomes were each of the components of the primary\nefficacy and safety outcomes, as well as all cause death and a\nnet clinical outcome of hard endpoints, defined as the composite\nof symptomatic venous thromboembolism, major bleeding, and\nall cause death.\nOther secondary outcomes included total venous\nthromboembolism (venographic proximal or distal deep vein\nthrombosis or non-fatal pulmonary embolism) or all cause death\n(composite main outcome in individual studies) and major\nvenous thromboembolism (venographic proximal deep vein\nthrombosis or non-fatal pulmonary embolism) or venous\nthromboembolism related death (composite key secondary\noutcome in individual studies).\nStatistical analysis\nWe carried out direct comparisons between dabigatran,\nrivaroxaban, and apixaban versus enoxaparin as well as indirect\ncomparisons between the three drugs on an intention to treat\nbasis, according to PRISMA (Preferred Reporting Items for\nSystematic reviews and Meta-Analyses) recommendations.12\nFor the meta-analysis we calculated relative risks and their\nrespective 95% confidence intervals for each study and for the\npooled studies for each of the anticoagulants. Heterogeneity\nwas assessed using the Cochran Q test13 and the Higgins I2\ntest.14\nA Cochran’s Q P<0.10 and I2 >50% were considered to show\nsignificant heterogeneity.14 We used the random effects model\ndescribed by Der-Simonian and Laird for the main analysis.15\nWe carried out subgroup analyses of trials with the different\nanticoagulants as well as in hip and knee replacement. P<0.05\nfor interaction indicates that the effect of treatment differs\nbetween the tested subgroups. As a sensitivity analysis, we\ncalculated the results using the fixed effects method described\nby Mantel and Haenszel.16 Additional sensitivity analyses were\ndone taking into account certain methodological problems that\ncould influence the results of the meta-analysis: study phase,\nstudy quality, and duration of thromboprophylaxis. We created\nfunnel plots showing the standard error and the effect size to\nevaluate publication bias. Direct comparisons were done using\nthe RevMan statistical software, version 5.1 (Nordic Cochrane\nCenter).17 For indirect comparisons (Bucher’s method), we used\nthe ITC (Indirect Treatment Comparison) computer program,\nversion 1.0.18\nResults\nThe literature search identified 606 articles, 71 of which related\nto clinical trials or protocols with rivaroxaban, dabigatran, or\napixaban (fig 1⇓). Of these, 19 were clinical trials in total hip\nor knee replacement19-37 and were selected for checking as full\ntext. Sixteen of the studies were eligible for inclusion19-34 and\nthe remaining three,35-37 all with dabigatran, were excluded\nbecause they did not include a control group,35 did not include\na dabigatran 150 mg or 220 mg daily dose group,36 or used\nplacebo as control rather than enoxaparin.37\nTable 1⇓ shows the characteristics of the trials and treatments.\nThe 16 studies comprised 38 747 patients and compared\ndabigatran (four studies),19-22 rivaroxaban (eight studies),23-30 or\napixaban (four studies)31-34 with enoxaparin in total hip\nNo commercial reuse: See rights and reprints http://www.bmj.com/permissions Subscribe: http://www.bmj.com/subscribe\nBMJ 2012;344:e3675 doi: 10.1136/bmj.e3675 (Published 14 June 2012) Page 2 of 16\nRESEARCH\nProtected by copyright, including for uses related to text and data mining, AI training, and similar technologies. \n.Serials\nat New York University, Serials Bobst Library Technical Services on 3 November 2025 https://www.bmj.com/ Downloaded from 14 June 2012. 10.1136/bmj.e3675 on BMJ: first published as \n\nreplacement (eight studies)20 22-24 27 29 30 33 or total knee\nreplacement (eight studies).19 21 25 26 28 31 32 34 Of these, 36 149\npatients were randomised to dosages of the new anticoagulant\n(n=19 481) or control treatment (n=16 668) required for\ninclusion in the meta-analysis and therefore comprised the\nintention to treat population. Most of the studies (n=11) used\nthe European enoxaparin regimen as\ncomparator.19 20 22-25 27 29 30 32 33 Three of the eight publications of\nrivaroxaban trials did not include the specific method of\nsequence generation,27 29 30 and this information was obtained\nfrom the sponsor after request. Fifteen of the 16 studies were\ndouble blind clinical trials,19-26 28-34 scoring 5 points (maximum\nscore) on the Jadad scale, and were judged to be at low risk of\nbias (adequate sequence generation or allocation concealment,\ndouble blinding, and clear reporting of loss to follow-up). The\nremaining (dose finding) study with rivaroxaban scored 3\n(because it was an open label study).27 In all cases adjudication\nof events was blinded.\nPatients’ characteristics were homogeneous across the trials,\nwith age ranging between 61 and 68 years, a predominance of\nwomen, and body weight between 75 and 84 kg (table 2⇓).\nRates of symptomatic venous thromboembolism in the\nenoxaparin control group were low and similar across studies.\nTherefore data on symptomatic venous thromboembolism were\nconsidered suitable for meta-analysis. However, major bleeding\nrates reported in the four pivotal RECORD (Rosiglitazone\nEvaluated for Cardiac Outcomes and Regulation of Glycaemia\nin Diabetes) studies with rivaroxaban23-26 were 7-8 times lower\nthan those in the enoxaparin groups of the remaining studies,\nwhich was attributed to the exclusion of most wound bleedings\nfrom the definition of major bleeding, as previously reported.8-10\nThis issue prevented the pooling of data on major bleeding\nreported in the publications of the RECORD studies. However,\nthe major bleeding rates in the RECORD studies without\nexcluding major wound bleedings were reported in an FDA\nreview,38 and were similar to the major bleeding rates of the\nremaining studies. Finally, we used the major bleeding data of\nRECORD studies from the FDA in the main analysis and major\nbleeding data from the publications as an additional sensitivity\nanalysis.\nPrimary efficacy outcome\nRivaroxaban was associated with a significant reduction in risk\nof symptomatic venous thromboembolism compared with\nenoxaparin (relative risk 0.48, 95% confidence interval 0.31 to\n0.75; P=0.001) (fig 2⇓). Compared with enoxaparin, neither\ndabigatran (0.71, 0.23 to 2.12; P=0.54) nor apixaban (0.82, 0.41\nto 1.64; P=0.57) reduced the risk of symptomatic venous\nthromboembolism (fig 2).\nNo evidence of statistical heterogeneity for symptomatic venous\nthromboembolism was found among studies comparing\nrivaroxaban or apixaban with enoxaparin. However, there was\nevidence of statistical heterogeneity for symptomatic venous\nthromboembolism among the dabigatran trials (P=0.01; I2=73%)\n(fig 2). The source of heterogeneity could not be identified after\ninvestigating dabigatran daily dose, enoxaparin regimen, type\nof surgery, adjudicating committee, or the presence of an outlier\nstudy. The effect on symptomatic venous thromboembolism\ncompared with enoxaparin was similar with dabigatran doses\nof 220 mg (0.70, 0.18 to 2.76; P=0.61) and 150 mg (0.86, 0.31\nto 2.35; P=0.63).\nAfter including symptomatic venous thromboembolism events\nthat occurred during follow-up, the results were similar than\nthose of the main analysis (not including post-treatment events):\nrivaroxaban (0.53, 0.37 to 0.77; P=0.0008), dabigatran (0.90,\n0.45 to 1.80; P=0.76), and apixaban (0.69, 0.30 to 1.57; P=0.37)\ncompared with enoxaparin.\nSecondary efficacy outcomes\nRivaroxaban was associated with a significantly lower risk of\nsymptomatic deep vein thrombosis than was enoxaparin (relative\nrisk 0.40, 95% confidence interval 0.22 to 0.72; P=0.002),\nwhereas this trend was not significant for symptomatic\npulmonary embolism (0.89, 0.30 to 2.67; P=0.84). Rivaroxaban\nalso decreased the risk for total venous thromboembolism or\nall cause death (0.56, 0.39 to 0.80; P=0.002) as well as for major\nvenous thromboembolism or venous thromboembolism related\ndeath (0.42, 0.21 to 0.86; P=0.02).\nCompared with enoxaparin, dabigatran was not associated with\na different risk of symptomatic deep vein thrombosis (0.82, 0.17\nto 3.99; P=0.81) or pulmonary embolism (0.69, 0.31 to 1.54;\nP=0.36). Dabigatran was associated with a trend towards a\nhigher risk of total venous thromboembolism or all cause death\nthan enoxaparin (1.08, 0.93 to 1.25; P=0.31) and a similar risk\nof major venous thromboembolism or venous thromboembolism\nrelated death (0.89, 0.63 to 1.25; P=0.49). The risk of total\nvenous thromboembolism or all cause death was similar between\ndabigatran 220 mg and enoxaparin (1.00, 0.87 to 1.15; P=0.98)\nbut it was higher with the dabigatran 150 mg dose than with\nenoxaparin (1.21, 1.05 to 1.39; P=0.009). Major venous\nthromboembolism or venous thromboembolism related death\ndid not differ significantly between the dabigatran 220 mg daily\ndose v enoxaparin (0.80, 0.54 to 1.17; P=0.24) or between the\ndabigatran 150 mg daily dose v enoxaparin (1.12, 0.81 to 1.54;\nP=0.49).\nApixaban decreased the risk of symptomatic deep vein\nthrombosis compared with enoxaparin (0.41, 0.18 to 0.95;\nP=0.04) but was associated with a numerical increase in cases\nof pulmonary embolism (apixaban 24 v enoxaparin 14; relative\nrisk 1.25, 0.38 to 4.15; P=0.72) with borderline heterogeneity\n(P=0.11; I2=51%). The results for pulmonary embolism were\nhomogeneous within the two pivotal studies on total knee\nreplacement surgery (P=0.37; I2=0%), in which the risk of\nsymptomatic pulmonary embolism with apixaban was\nsignificantly higher than that with enoxaparin (2.56, 1.10 to\n5.98; P=0.03). On the contrary, apixaban was associated with\na lower risk of total venous thromboembolism or all cause death\n(0.63, 0.42 to 0.95; P=0.03) and a trend towards a lower risk of\nmajor venous thromboembolism or venous thromboembolism\nrelated death (0.61, 0.32 to 1.14; P=0.12) than enoxaparin. (See\nsupplementary figures A1-7 for the full results of the secondary\nefficacy outcomes).\nPrimary safety outcome\nRivaroxaban was associated with a significant increase in risk\nof clinically relevant bleeding (relative risk 1.25, 95%\nconfidence interval 1.05 to 1.49; P=0.01) (fig 3⇓). Dabigatran\ndid not show a significant increase compared with enoxaparin\n(1.12, 0.94 to 1.35; P=0.21). The risk was similar in the\ncomparison of dabigatran 220 mg with enoxaparin (1.12, 0.92\nto 1.38; P=0.26) and dabigatran 150 mg with enoxaparin (1.12,\n0.89 to 1.40; P=0.34). On the contrary, apixaban was associated\nwith a significantly reduced risk of clinically relevant bleeding\ncompared with enoxaparin (0.82, 0.69 to 0.98; P=0.03). No\nevidence of statistical heterogeneity was found for this outcome\namong studies comparing rivaroxaban, dabigatran, or apixaban\nwith enoxaparin (fig 3).\nNo commercial reuse: See rights and reprints http://www.bmj.com/permissions Subscribe: http://www.bmj.com/subscribe\nBMJ 2012;344:e3675 doi: 10.1136/bmj.e3675 (Published 14 June 2012) Page 3 of 16\nRESEARCH\nProtected by copyright, including for uses related to text and data mining, AI training, and similar technologies. \n.Serials\nat New York University, Serials Bobst Library Technical Services on 3 November 2025 https://www.bmj.com/ Downloaded from 14 June 2012. 10.1136/bmj.e3675 on BMJ: first published as \n\nSecondary safety outcomes\nRivaroxaban was associated with a non-significant trend towards\na higher risk of major bleeding than was enoxaparin (relative\nrisk 1.29, 95% confidence interval 0.98 to 1.69; P=0.07) and\nclinically relevant non-major bleeding (1.21, 0.98 to 1.50;\nP=0.07). Compared with enoxaparin, dabigatran was associated\nwith a similar risk of major bleeding (0.94, 0.58 to 1.52; P=0.79)\nand a non-significant trend towards a higher risk of clinically\nrelevant non-major bleeding (1.19, 0.96 to 1.48; P=0.11).\nApixaban showed a non-significant trend towards a low risk of\nmajor bleeding than did enoxaparin (0.81, 0.45 to 1.43; P=0.46),\nwhich was in the limit of statistical significance for clinically\nrelevant non-major bleeding (0.83, 0.68 to 1.00; P=0.05). No\nsignificant trends were found in risk of death between the new\nanticoagulants and enoxaparin. (See supplementary figures\nA8-10 for the full results of the secondary safety outcomes).\nNet clinical endpoint\nNo statistically significant differences were found between the\nnew anticoagulants and enoxaparin on the net clinical endpoint\n(symptomatic venous thromboembolism, major bleeding, and\ndeath) (fig 4⇓). No evidence of statistical heterogeneity was\nfound between studies.\nMain outcomes by type of surgery\nNo statistically significant interaction of the type of surgery\n(total hip or knee replacement) was found for symptomatic\nvenous thromboembolism, clinically relevant bleeding, and net\nclinical endpoint (table 3⇓). Overall, the net clinical benefit of\nthe new anticoagulants tended to be better in total knee\nreplacement surgery than in total hip replacement surgery.\nIndirect comparisons\nRivaroxaban tended to be associated with the lowest risk for\nsymptomatic venous thromboembolism, whereas apixaban\nseemed to achieve the lowest risk for clinically relevant bleeding\n(table 4⇓). No differences were found between treatments on\nthe net clinical outcome.\nAbsolute difference in events per 1000\npatients treated\nThe numbers of symptomatic venous thromboembolic events\navoided per 1000 patients treated with rivaroxaban versus\nenoxaparin, dabigatran, or apixaban were generally similar to\nthose of the additional resultant major bleeds (table 5⇓). No\nsignificant absolute differences were apparent between\ntreatments on the net clinical outcome.\nSensitivity analyses\nSensitivity analyses were consistent with those of the main\nanalysis for the direct comparisons between the new\nanticoagulants and enoxaparin on symptomatic venous\nthromboembolism, clinically relevant bleeding, and the net\nclinical endpoint, regardless of the assumption of the statistical\nmodel and study quality, phase, or duration (see supplementary\ntables A1-3). Acceptance of the definition for major bleeding\nas reported in the publications (accepting the exclusion of major\nwound bleedings in the RECORD studies), had a significant\nimpact on the apparent efficacy and safety of rivaroxaban, as it\nwould have been declared superior to enoxaparin in the net\nclinical endpoint (0.68, 0.50 to 0.91; P=0.01) (table A4 of the\nsupplementary appendix). In sensitivity analyses of indirect\ncomparisons (tables A5 to A7 of the supplementary appendix),\nthe use of the fixed effects model led to closer confidence\nintervals than those obtained using random effects, suggesting\na lower risk of symptomatic venous thromboembolism with\nrivaroxaban than with dabigatran (0.53, 0.29 to 0.99) or apixaban\n(0.51, 0.27 to 0.96).\nPublication bias\nThe visual inspection of funnel plots showed no evidence of\npublication bias (see supplementary figure A11).\nRole of funding\nAll studies were sponsored by pharmaceutical companies. The\nsponsor was responsible for the collection and statistical analysis\nof the data. In all cases the sponsor was involved in the design\nand oversight of the study with or without the collaboration of\na scientific committee, and at least one of the authors of the\npublications were employees of the sponsor.\nDiscussion\nThis systematic review and meta-analysis indicates that a higher\nefficacy of the new type of anticoagulant is generally associated\nwith a higher bleeding tendency in patients undergoing total\nhip or knee replacement surgery. At the time of balancing\nefficacy (symptomatic venous thromboembolism) and safety\n(major bleed and deaths), the different anticoagulants did not\ndiffer significantly.\nRivaroxaban seems more effective than enoxaparin in preventing\nsymptomatic venous thromboembolism but at the cost of an\nincrease in clinically relevant bleeds. These results were\nconsistent across different studies, without evidence of\nheterogeneity.\nDabigatran seems at least as effective as enoxaparin in the risk\nof symptomatic venous thromboembolism, but the results are\nnoticeable by heterogeneity and wide confidence intervals.\nSurrogate venographic data on major and total venous\nthromboembolism indicates that the high dose (220 mg) is\nconsistently non-inferior to enoxaparin. The low dabigatran\ndose (150 mg) may provide an alternative in patients with\nanticipated increased exposure to dabigatran,39 such as those\naged more than 75 years and those with moderate renal\nimpairment.5\nIn our meta-analysis, the risk of clinically relevant\nbleeding was not significantly different between dabigatran and\nenoxaparin. The upper limit of the 95% confidence interval,\nhowever, indicates that a relative risk of clinically relevant\nbleeding with dabigatran versus enoxaparin by 35% cannot be\nexcluded.\nApixaban was associated with a lower rate of clinically relevant\nbleeding than enoxaparin, mainly in knee pivotal studies, but\nassociated with an increase in cases of pulmonary embolism,\nalso in knee pivotal studies. Symptomatic pulmonary embolism\noccurs earlier in knee replacement surgery than in hip\nreplacement surgery,40 41 which might theoretically result in an\nincrease in risk of early pulmonary embolism if the first dose\nof the anticoagulant is delayed. Whether the benefit in bleeding\nand the numerical increase in pulmonary embolism in knee\nstudies are a chance finding or due to the delay of the first\napixaban dose about 18 hours after surgery (mean in pivotal\ntrials) deserves further scrutiny. Doctors may consider the\npotential benefits of earlier anticoagulation for venous\nthromboembolism prophylaxis as well as the risks of\npost-surgical bleeding in deciding on when to administer within\nthe approved time window (12 to 24 hours after surgery for\napixaban).7\nNo commercial reuse: See rights and reprints http://www.bmj.com/permissions Subscribe: http://www.bmj.com/subscribe\nBMJ 2012;344:e3675 doi: 10.1136/bmj.e3675 (Published 14 June 2012) Page 4 of 16\nRESEARCH\nProtected by copyright, including for uses related to text and data mining, AI training, and similar technologies. \n.Serials\nat New York University, Serials Bobst Library Technical Services on 3 November 2025 https://www.bmj.com/ Downloaded from 14 June 2012. 10.1136/bmj.e3675 on BMJ: first published as \n\nOur meta-analysis also shows that the definition of major\nbleeding may have a significant impact on the apparent safety\nof the anticoagulants and that even difficult to perceive changes\nin the definitions may lead to different conclusions in the\nbenefit-risk balance.\nStrengths of the review\nOur study represents the most comprehensive meta-analysis of\nnew oral anticoagulants carried out in total hip or knee\nreplacement surgery up to date. It is based on data from more\nthan 30 000 patients enrolled in 16 randomised clinical trials,\n15 of them using a double blind design and all including an\nindependent and blinded assessment of outcomes. The studies\nwere published between 2005 and 2011 and evidence of\npublication bias was lacking. Sensitivity analyses suggest that\nthe results are robust. It is unlikely that a clinical trial comparing\ntwo new oral anticoagulants in total hip or knee replacement\nsurgery would be carried out in the near future. Therefore our\nresults provide a useful estimate of expected relative differences\non clinically relevant events between rivaroxaban, dabigatran,\nand apixaban in total hip or knee replacement surgery.\nComparison with other reports\nFew previous studies have indirectly compared dabigatran with\nrivaroxaban.42-44 Only one of them indirectly compared rates of\nsymptomatic venous thromboembolism,42 but it did not include\nthe RE-NOVATE II trial,22 which was published afterwards.\nOne of these reports included studies with dabigatran,\nrivaroxaban, and apixaban,44 but the comparison was limited to\nthe endpoint of total venous thromboembolism plus all cause\ndeath (mainly driven by asymptomatic venographic deep vein\nthrombosis), and only pivotal trials were included. The study\nshowed better venographic outcomes with rivaroxaban and\napixaban than with dabigatran.44\nLimitations of the review\nOur systematic review has limitations. The main efficacy\noutcome in our study (symptomatic venous thromboembolism)\nwas a secondary outcome in all studies. Therefore the results\non symptomatic venous thromboembolism are exploratory.\nNevertheless, all events were adjudicated blindly and\nindependently, which adds robustness to the results obtained.\nHowever, symptomatic venous thromboembolism events are\nmore representative of what would be expected in standard\nclinical practice than are venographic (mainly asymptomatic)\nevents.8 Direct comparisons between rivaroxaban or apixaban\nversus enoxaparin for major or total venous thromboembolism\nare based on studies in which venograms were adjudicated by\nthe same committee (Gothenburg committee in the rivaroxaban\nstudies and Hamilton committee in the apixaban studies),\nwhereas two committees (Gothenburg and Holland) were used\nin the dabigatran studies. Given the double blind adjudication,\nit can be reasonably expected that the calculated relative risk\nof direct comparisons would have provided an unbiased\nestimate. However, we decided not to report indirect\ncomparisons on major and total venous thromboembolism\nbecause the differences in venographic assessment reported\nbetween different adjudicating committees42 45 was considered\na factor that might bias the indirect comparison.46\nAt the time of translating the results from these clinical trials\ninto practice, some considerations are necessary. In absolute\nterms it is expected that patients in standard clinical practice\nwould have a higher risk for symptomatic venous\nthromboembolism and bleeding than those included in clinical\ntrials, because of the exclusion criteria applied in clinical trials\n(that is, severe renal or hepatic insufficiency, chronic use of\nvitamin K antagonists, concomitant treatment with non-steroidal\nanti-inflammatory drugs of long half life, strong CYP3A4\ninhibitors, history of bleeding, and so on), as well as by other\ndifferences in personal characteristics.47 48 It is worth mentioning\nthat the risk of bleeding increases with age and in other special\nsituations to a greater extent than does the risk of symptomatic\nvenous thromboembolism.48 Therefore one of the main\nuncertainties about the use of the new anticoagulants is related\nto their real bleeding risk in standard clinical practice,49-51 which\nemphasises the need for appropriate use according to product\nlabelling to minimise such risk.5-7\nConclusions\nOur meta-analysis indicates that a higher efficacy of the new\ntype of anticoagulants was generally associated with a higher\nbleeding tendency, but the anticoagulants did not differ\nsignificantly for efficacy and safety.\nContributors: AG-O, AIT-F, EV-C, and MLS-G conceived and designed\nthe study. AG-O and AIT-F collected the data. AG-O carried out the\nstatistical analysis and drafted the manuscript. EV-C supervised the\nstudy. All authors analysed and interpreted the data and critically revised\nthe manuscript for important intellectual content. The contents of this\nstudy are solely the responsibility of the authors and do not necessarily\nrepresent the official view of their institutions or any other party. AG-O\nand EV-C are the guarantors.\nCompeting interests: All authors have completed the ICMJE uniform\ndisclosure form at www.icmje.org/coi_disclosure.pdf (available on\nrequest from the corresponding author) and declare: no support from\nany organisation for the submitted work; no financial relationships with\nany organisations that might have an interest in the submitted work in\nthe previous three years; and no other relationships or activities that\ncould appear to have influenced the submitted work.\nEthical approval: Not required.\nData sharing: No additional data available.\n1 Cohen AT, Agnelli G, Anderson FA, Arcelus JI, Bergqvist D, Brecht JG, et al. Venous\nthromboembolism (VTE) in Europe. The number of VTE events and associated morbidity\nand mortality. Thromb Haemost 2007;98:756-64.\n2 Mackman N. Triggers, targets and treatments for thrombosis. Nature 2008;451:914-8.\n3 Geerts WH, Bergqvist D, Pineo GF, Heit JA, Samama CM, Lassen MR, et al. Prevention\nof venous thromboembolism: American College of Chest Physicians evidence-based\nclinical practice guidelines (8th ed). Chest 2008;133(6 suppl):S381-453.\n4 White RH, Zhou H, Romano PS. Incidence of symptomatic venous thromboembolism\nafter different elective or urgent surgical procedures. Thromb Haemost 2003;90:446-55.\n5 European Medicines Agency. Pradaxa ®—summary of product characteristics. 2011.\nwww.ema.europa.eu/docs/en_GB/document_library/EPAR_-_Product_Information/human/\n000829/WC500041059.pdf.\n6 European Medicines Agency. Xarelto ®—summary of product characteristics. 2011. www.\nema.europa.eu/docs/en_GB/document_library/EPAR_-_Product_Information/human/\n000944/WC500057108.pdf.\n7 European Medicines Agency. Eliquis ®—summary of product characteristics. 2011. www.\nema.europa.eu/docs/en_GB/document_library/EPAR_-_Product_Information/human/\n002148/WC500107728.pdf.\n8 Gómez-Outes A, Lecumberri R, Pozo C, Rocha E. New anticoagulants: focus on venous\nthromboembolism. Curr Vasc Pharmacol 2009;7:309-29.\n9 Gómez-Outes A, Suárez-Gea ML, Blázquez-Pérez A, Pozo-Hernández C, Vargas-Castrillón\nE. Rivaroxaban versus enoxaparin after total knee arthroplasty. Lancet 2009;374:682.\n10 Dahl OE, Quinlan DJ, Bergqvist D, Eikelboom JW. A critical appraisal of bleeding events\nreported in venous thromboembolism prevention trials of patients undergoing hip and\nknee arthroplasty. J Thromb Haemost 2010;8:1966-75.\n11 Jadad AR, Moore RA, Carroll D, Jenkinson C, Reynolds DJ, Gavaghan DJ, et al. Assessing\nthe quality of reports of randomized clinical trials: is blinding necessary? Control Clin\nTrials 1996;17:1-12.\n12 Liberati A, Altman DG, Tetzlaff J, Mulrow C, Gøtzsche PC, Ioannidis JP, et al. The PRISMA\nstatement for reporting systematic reviews and meta-analyses of studies that evaluate\nhealthcare interventions: explanation and elaboration. BMJ 2009;339:b2700.\n13 Cochran WG. The combination of estimates from different experiments. Biometrics\n1954;10:101-29.\n14 Higgins JPT, Thompson SG, Deeks JJ, Altman DG. Measuring inconsistency in\nmeta-analyses. BMJ 2003;327:557-60.\n15 DerSimonian R, Laird N. Meta-analysis in clinical trials. Controlled Clin Trials\n1986;7:177-88.\nNo commercial reuse: See rights and reprints http://www.bmj.com/permissions Subscribe: http://www.bmj.com/subscribe\nBMJ 2012;344:e3675 doi: 10.1136/bmj.e3675 (Published 14 June 2012) Page 5 of 16\nRESEARCH\nProtected by copyright, including for uses related to text and data mining, AI training, and similar technologies. \n.Serials\nat New York University, Serials Bobst Library Technical Services on 3 November 2025 https://www.bmj.com/ Downloaded from 14 June 2012. 10.1136/bmj.e3675 on BMJ: first published as \n\nWhat is already known on this topic\nPivotal trials in venous thromboprophylaxis are usually based on a surrogate venographic (usually asymptomatic) primary endpoint of\nefficacy\nRivaroxaban, dabigatran, and apixaban are new oral anticoagulants licensed for prophylaxis against venous thromboembolism after\ntotal hip or knee replacement surgery\nThe effect of these anticoagulants on symptomatic outcomes and their relative efficacy and safety are uncertain\nWhat this study adds\nRivaroxaban was associated with a lower risk of symptomatic venous thromboembolism than enoxaparin but at the cost of an increase\nin clinically relevant bleeding\nThe risk of symptomatic venous thromboembolism was similar in patients receiving dabigatran or apixaban than enoxaparin, whereas\napixaban was associated with a lower risk of clinically relevant bleeding than enoxaparin\nA higher efficacy of the new type of anticoagulant was generally associated with a higher bleeding tendency and the new anticoagulants\ndid not differ significantly for efficacy and safety\n16 Mantel N, Haenszel W. Statistical aspects of the analysis of data from retrospective studies\nof disease. J Natl Cancer Inst 1959;22:719-48.\n17 The Nordic Cochrane Centre, The Cochrane Collaboration. Review Manager (RevMan)\n[Computer program]. Version 5.1; Copenhagen, 2011.\n18 Wells GA, Sultan SA, Chen L, Khan M, Coyle D. Indirect treatment comparison [computer\nprogram]. Version 1.0. Canadian Agency for Drugs and Technologies in Health; Ottawa,\n2009.\n19 Eriksson BI, Dahl OE, Rosencher N, Kurth AA, van Dijk CN, Frostick SP, et al. Oral\ndabigatran etexilate vs. subcutaneous enoxaparin for the prevention of venous\nthromboembolism after total knee replacement: the RE-MODEL randomized trial. J Thromb\nHaemost 2007;5:2178-85.\n20 Eriksson BI, Dahl OE, Rosencher N, Kurth AA, van Dijk CN, Frostick SP, et al. Dabigatran\netexilate versus enoxaparin for prevention of venous thromboembolism after total hip\nreplacement: a randomised, double-blind, non-inferiority trial. Lancet 2007;370:949-56.\n21 The RE-MOBILIZE Writing Committee. Oral thrombin inhibitor dabigatran etexilate vs\nNorth American enoxaparin regimen for prevention of venous thromboembolism after\nknee arthroplasty surgery. J Arthroplasty 2009;24:1-9.\n22 Eriksson BI, Dahl OE, Huo MH, Kurth AA, Hantel S, Hermansson K, et al. Oral dabigatran\nversus enoxaparin for thromboprophylaxis after primary total hip arthroplasty (RE-NOVATE\nII). A randomised, double-blind, non-inferiority trial. Thromb Haemost 2011;105:721-9.\n23 Eriksson BI, Borris LC, Friedman RJ, Haas S, Huisman MV, Kakkar AK, et al. Rivaroxaban\nversus enoxaparin for thromboprophylaxis after hip arthroplasty. N Engl J Med\n2008;358:2765-75.\n24 Kakkar AK, Brenner B, Dahl OE, Eriksson BI, Mouret P, Muntz J, et al. Extended duration\nrivaroxaban versus short-term enoxaparin for the prevention of venous thromboembolism\nafter total hip arthroplasty: a double-blind, randomised controlled trial. Lancet\n2008;372:31-9.\n25 Lassen MR, Ageno W, Borris LC, Lieberman JR, Rosencher N, Bandel TJ, et al.\nRivaroxaban versus enoxaparin for thromboprophylaxis after total knee arthroplasty. N\nEngl J Med 2008;358:2776-86.\n26 Turpie AG, Lassen MR, Davidson BL, Bauer KA, Gent M, Kwong LM, et al. Rivaroxaban\nversus enoxaparin for thromboprophylaxis after total knee arthroplasty (RECORD4): a\nrandomised trial. Lancet 2009;373:1673-80.\n27 Eriksson BI, Borris LC, Dahl OE, Haas S, Huisman MV, Kakkar AK, et al. Dose-escalation\nstudy of rivaroxaban (BAY 59-7939)—an oral, direct Factor Xa inhibitor—for the prevention\nof venous thromboembolism in patients undergoing total hip replacement. Thromb Res\n2007;120:685-93.\n28 Turpie AG, Fisher WD, Bauer KA, Kwong LM, Irwin MW, Kälebo P, et al. BAY 59-7939:\nan oral, direct factor Xa inhibitor for the prevention of venous thromboembolism in patients\nafter total knee replacement. A phase II dose-ranging study. J Thromb Haemost\n2005;3:2479-86.\n29 Eriksson BI, Borris L, Dahl OE, Haas S, Huisman MV, Kakkar AK, et al. Oral, direct Factor\nXa inhibition with BAY 59-7939 for the prevention of venous thromboembolism after total\nhip replacement. J Thromb Haemost 2006;4:121-8.\n30 Eriksson BI, Borris LC, Dahl OE, Haas S, Huisman MV, Kakkar AK, et al. A once-daily,\noral, direct Factor Xa inhibitor, rivaroxaban (BAY 59-7939), for thromboprophylaxis after\ntotal hip replacement. Circulation 2006;114:2374-81.\n31 Lassen MR, Raskob GE, Gallus A, Pineo G, Chen D, Portman RJ. Apixaban or enoxaparin\nfor thromboprophylaxis after knee replacement. N Engl J Med 2009;361:594-604.\n32 Lassen MR, Raskob GE, Gallus A, Pineo G, Chen D, Hornick P, et al. Apixaban versus\nenoxaparin for thromboprophylaxis after knee replacement (ADVANCE-2): a randomised\ndouble-blind trial. Lancet 2010;375:807-15.\n33 Lassen MR, Gallus A, Raskob GE, Pineo G, Chen D, Ramirez LM, et al. Apixaban versus\nenoxaparin for thromboprophylaxis after hip replacement. N Engl J Med 2010;363:2487-98.\n34 Lassen MR, Davidson BL, Gallus A, Pineo G, Ansell J, Deitchman D. The efficacy and\nsafety of apixaban, an oral, direct factor Xa inhibitor, as thromboprophylaxis in patients\nfollowing total knee replacement. J Thromb Haemost 2007;5:2368-75.\n35 Eriksson BI, Dahl OE, Ahnfelt L, Kälebo P, Stangier J, Nehmiz G, et al. Dose escalating\nsafety study of a new oral direct thrombin inhibitor, dabigatran etexilate, in patients\nundergoing total hip replacement: BISTRO I. J Thromb Haemost 2004;2:1573-80.\n36 Eriksson BI, Dahl OE, Büller HR, Hettiarachchi R, Rosencher N, Bravo ML, et al. A new\noral direct thrombin inhibitor, dabigatran etexilate, compared with enoxaparin for prevention\nof thromboembolic events following total hip or knee replacement: the BISTRO II\nrandomized trial. J Thromb Haemost 2005;3:103-11.\n37 Fuji T, Fuijita S, Ujihira, Sato R. Dabigatran etexilate prevents venous thromboembolism\nafter total knee arthroplasty in Japanese patients with a safety profile comparable to\nplacebo. J Arthroplasty 2010;25:1267-74.\n38 FDA Cardiovascular & Renal Drugs Advisory Committee. Meeting ID: 2009-4418. www.\nfda.gov/downloads/advisorycommittees/committeesmeetingmaterials/drugs/\ncardiovascularandrenaldrugsadvisorycommittee/ucm181524.pdf.\n39 Dahl OE, Kurth AA, Rosencher N, Noack H, Clemens A, Eriksson BI. Thromboprophylaxis\nwith dabigatran etexilate in patients over seventy-five years of age with moderate renal\nimpairment undergoing or knee replacement. Int Orthop 2012;36:741-8.\n40 Kearon C. Natural history of venous thromboembolism. Circulation 2003;107(23 suppl\n1):I22-30.\n41 Bjørnarå BT, Gudmundsen TE, Dahl OE. Frequency and timing of clinical venous\nthromboembolism after major joint surgery. J Bone Joint Surg Br 2006;88:386-91.\n42 Trkulja V, Kolundzic R. Rivaroxaban vs dabigatran for thromboprophylaxis after\njoint-replacement surgery: exploratory indirect comparison based on meta-analysis of\npivotal clinical trials. Croat Med J 2010;51:113-23.\n43 Loke YK, Kwok CS. Dabigatran and rivaroxaban for prevention of venous\nthromboembolism—systematic review and adjusted indirect comparison. J Clin Pharm\nTher 2011;36:111-24.\n44 Maratea D, Fadda V, Trippoli S, Messori A. Prevention of venous thromboembolism after\nmajor orthopedic surgery: indirect comparison of three new oral anticoagulants. J Thromb\nHaemost 2011;9:1868-70.\n45 Quinlan DJ, Eikelboom JW, Dahl OE, Eriksson BI, Sidhu PS, Hirsh J. Association between\nasymptomatic deep vein thrombosis detected by venography and symptomatic venous\nthromboembolism in patients undergoing elective hip or knee surgery. J Thromb Haemost\n2007;5:1438-43.\n46 Glenny AM, Altman DG, Song F, Sakarovitch C, Deeks JJ, D’Amico R, et al. Indirect\ncomparisons of competing interventions. Health Technol Assess 2005;9:1-134.\n47 Waddell J, Johnson K, Hein W, Raabe J, FitzGerald G, Turibio F. Orthopaedic practice\nin total hip arthroplasty and total knee arthroplasty: results from the Global Orthopaedic\nRegistry (GLORY). Am J Orthop (Belle Mead NJ) 2010;39(9 suppl):5-13.\n48 Deitelzweig SB, Lin J, Lin G. Preventing venous thromboembolism following orthopedic\nsurgery in the United States: impact of special populations on clinical outcomes. Clin Appl\nThromb Hemost 2011;17:640-50.\n49 Jensen CD, Steval A, Partington PF, Reed MR, Muller SD. Return to theatre following\ntotal hip and knee replacement, before and after the introduction of rivaroxaban: a\nretrospective cohort study. J Bone Joint Surg Br 2011;93:91-5.\n50 Legrand M, Mateo J, Aribaud A, Ginisty S, Eftekhari P, Huy PT, et al. The use of dabigatran\nin elderly patients. Arch Intern Med 2011;171:1285-6.\n51 European Medicines Agency updates on safety of Pradaxa (EMA/CHMP/903767/2011).\nPress release, 18 Nov 2011. www.ema.europa.eu/docs/en_GB/document_library/Press_\nrelease/2011/11/WC500117818.pdf.\nCite this as: BMJ 2012;344:e3675\nThis is an open-access article distributed under the terms of the Creative Commons\nAttribution Non-commercial License, which permits use, distribution, and reproduction in\nany medium, provided the original work is properly cited, the use is non commercial and\nis otherwise in compliance with the license. See: http://creativecommons.org/licenses/by￾nc/2.0/ and http://creativecommons.org/licenses/by-nc/2.0/legalcode.\nNo commercial reuse: See rights and reprints http://www.bmj.com/permissions Subscribe: http://www.bmj.com/subscribe\nBMJ 2012;344:e3675 doi: 10.1136/bmj.e3675 (Published 14 June 2012) Page 6 of 16\nRESEARCH\nProtected by copyright, including for uses related to text and data mining, AI training, and similar technologies. \n.Serials\nat New York University, Serials Bobst Library Technical Services on 3 November 2025 https://www.bmj.com/ Downloaded from 14 June 2012. 10.1136/bmj.e3675 on BMJ: first published as \n\nTables\nTable 1| Characteristics of included randomised controlled trials and study treatments\nFollow-up\n(days)\nDay of\nvenography\nJadad\nscore\nDesign of\nrandomised\nDose, treatment duration (timing of first dose in\nrelation to surgery)\nTrial\nphase\nType of\nsurgery\nNo in\nDrug, trial sample\ncontrolled\ntrial;\nadjudicating\nExperimental drug Control drug committee\nDabigatran:\nDouble blind; 5 6-10 90\nGothenburg\nEnoxaparin 40 mg once\ndaily, 6-10 days (about 12\nhours*)\nDabigatran 220 mg or 150\nmg once daily, 6-10 days\n(1-4 hours)\nTotal knee III\nreplacement\nRE-MODEL 2101 19\nMulticentre, 5 33 94\ndouble blind;\nHolland\nEnoxaparin 40 mg once\ndaily, 28-35 days (aboout\n12 hours*)\nDabigatran 220 mg or 150\nmg once daily, 28-35 days\n(1-4 hours)\nTotal hip III\nreplacement\nRE-NOVATE 3493 20\nDouble blind; 5 14 90\nGothenburg\nEnoxaparin 30 mg twice\ndaily, 12-15 days (12-24\nhours)\nDabigatran 220 mg or 150\nmg once daily, 12-15 days\n(8-12 hours)\nTotal knee III\nreplacement\nRE-MOBILIZE 2615 21\nDouble blind; 5 32 90\nHolland\nEnoxaparin 40 mg once\ndaily, 28-35 days (about\n12 hours*)\nDabigatran 220 mg once\ndaily, 28-35 days (1-4\nhours)\nTotal hip III\nreplacement\nRE-NOVATE II 2055 22\nRivaroxaban:\nDouble blind; 5 36 66-71\nGothenburg\nEnoxaparin 40 mg once\ndaily, 35 days (about 12\nhours*)\nRivaroxaban 10 mg once\ndaily, 35d (6 hours)\nTotal hip III\nreplacement\nRECORD1 4541 23\nDouble blind; 5 32-40 62-75\nGothenburg\nEnoxaparin 40 mg once\ndaily, 14 days (about 12\nhours*)+placebo 30 days\nRivaroxaban 10 mg once\ndaily, 31-39 days (6\nhours)\nTotal hip III\nreplacement\nRECORD2 2509 24\nDouble blind; 5 11-15 41-50\nGothenburg\nEnoxaparin 40 mg once\ndaily, 10-14 days (about\n12 hours*)\nRivaroxaban 10 mg once\ndaily, 10-14 days (6\nhours)\nTotal knee III\nreplacement\nRECORD3 2531 25\nDouble blind; 5 11-15 40-49\nGothenburg\nEnoxaparin 30 mg twice\ndaily, 10-14 days (12-24\nhours)\nRivaroxaban 10 mg once\ndaily, 10-14 days (6\nhours)\nTotal knee III\nreplacement\nRECORD4 3148 26\nOpen label; 3 5-9 38-68\nGothenburg\nEnoxaparin 40 mg once\ndaily, 5-9 days (about 12\nhours*)\nRivaroxaban 2.5, 5, 10,\n20, or 30 mg twice daily,\nrivaroxaban 30 mg once\ndaily, 5-9 days (6-8\nhours)†\nTotal hip IIa\nreplacement\nPROOF OF 641\nCONCEPT27\nDouble blind; 5 5-9 37-67\nGothemburg\nEnoxaparin 30 mg twice\ndaily, 5-9days (12-24\nhours)\nRivaroxaban 2.5, 5, 10,\n20, or 30 mg twice daily,\n5-9 days (6-8 hours)†\nTotal knee IIb\nreplacement\nODIXA KNEE 621 28\nDouble blind; 5 5-9 38-68\nGothenburg\nEnoxaparin 40 mg once\ndaily, 5-9 days (about 12\nhours*)\nRivaroxaban 2.5, 5, 10,\n20, or 30 mg twice daily,\n5-9 days (6-8 hours)†\nTotal hip IIb\nreplacement\nODIXA HIP 722\n(twice daily)29\nDouble blind; 5 6-10 35-69\nGothenburg\nEnoxaparin 40 mg once\ndaily, 5-9 days (about 12\nhours*)\nRivaroxaban 10, 20, or 30\nmg once daily, 5-9 days\n(6-8 hours)†\nTotal hip IIb\nreplacement\nODIXA HIP 873\n(once daily)30\nApixaban:\nDouble blind; 5 10-14 70-84\nHamilton\nEnoxaparin 30 mg twice\ndaily, 12 days (12-24\nhours)\nApixaban 2.5 mg twice\ndaily, 10-14 days (12-24\nhours)\nTotal knee III\nreplacement\nADVANCE-1 3195 31\nDouble blind; 5 10-14 70-84\nHamilton\nEnoxaparin 40 mg once\ndaily, 10-14 day (about 12\nhours*)\nApixaban 2.5 mg twice\ndaily, 10-14 days (12-24\nhours)\nTotal knee III\nreplacement\nADVANCE-2 3057 32\nDouble blind; 5 32-38 90-100\nHamilton\nEnoxaparin 40 mg once\ndaily, 35 days (about 12\nhours*)\nApixaban 2.5 mg twice\ndaily, 35 days (12-24\nhours)\nTotal hip III\nreplacement\nADVANCE-3 5407 33\nNo commercial reuse: See rights and reprints http://www.bmj.com/permissions Subscribe: http://www.bmj.com/subscribe\nBMJ 2012;344:e3675 doi: 10.1136/bmj.e3675 (Published 14 June 2012) Page 7 of 16\nRESEARCH\nProtected by copyright, including for uses related to text and data mining, AI training, and similar technologies. \n.Serials\nat New York University, Serials Bobst Library Technical Services on 3 November 2025 https://www.bmj.com/ Downloaded from 14 June 2012. 10.1136/bmj.e3675 on BMJ: first published as \n\nTable 1 (continued)\nFollow-up\n(days)\nDay of\nvenography\nJadad\nscore\nDesign of\nrandomised\ncontrolled\ntrial;\nadjudicating\ncommittee\nDose, treatment duration (timing of first dose in\nrelation to surgery)\nTrial\nphase\nType of\nsurgery\nNo in\nDrug, trial sample Experimental drug Control drug\nDouble blind; 5 10-14 42\nHamilton\nEnoxaparin 30 mg twice\ndaily, 10-14 days (about\nApixaban 5, 10, or 20 mg\nonce daily, 2.5, 5, or 10\nTotal knee 2b\nreplacement\nAPROPOS 1238 34\nmg twice daily, 10-14 days 12 hours*) or warfarin\n(12-24 hours)‡ (international normalised\nratio 1.8-3.0§)\n*Administered preoperatively; other first doses were administered postoperatively.\n†Only data pertaining to 10 mg total daily dose (5 mg twice daily or 10 mg once daily) were included in the meta-analysis.\n‡Only data pertaining to 5 mg total daily dose (2.5 mg twice daily or 5 mg once daily) were included in the meta-analysis.\n§Only data pertaining to 40 mg once daily dose control group were included in the meta-analysis.\nNo commercial reuse: See rights and reprints http://www.bmj.com/permissions Subscribe: http://www.bmj.com/subscribe\nBMJ 2012;344:e3675 doi: 10.1136/bmj.e3675 (Published 14 June 2012) Page 8 of 16\nRESEARCH\nProtected by copyright, including for uses related to text and data mining, AI training, and similar technologies. \n.Serials\nat New York University, Serials Bobst Library Technical Services on 3 November 2025 https://www.bmj.com/ Downloaded from 14 June 2012. 10.1136/bmj.e3675 on BMJ: first published as \n\nTable 2| Characteristics of patients, surgery, and concomitant treatments*\nUse of acetylsalicylic\nacid/NSAID\nUse of\nUse of elastic intermittent\ncompression\nstockings\nSurgery\nduration\n(minutes)\nUse of\nneuraxial\nanaesthesia\n(%)\nHistory of venous\nthromboembolism\n(%)\nParticipants mean\nage (years), %\nwomen, mean\nDrug, trial weight (kg)\npneumatic\ncompression\nDabigatran:\nAllowed: acetylsalicylic acid\n<160 mg and NSAID of no\nlong half life\nRE-MODEL 68, 69, 82 NA 78 90 Allowed Prohibited 19\nAllowed: acetylsalicylic acid\n<160 mg and NSAID of no\nlong half life\nRE-NOVATE 64, 56, 78 3 76 87 Allowed Prohibited 20\nAllowed: acetylsalicylic acid\n<160 mg and NSAID if half\nlife <17 hours\nRE-MOBILIZE 66, 58, 88 NA 48 90 Allowed Prohibited 21\nRE-NOVATE II 62, 50, 80 2 77 79 NA Prohibited NA 22\nRivaroxaban:\nRECORD1 63, 56, 78 2 70 91 NA Prohibited Allowed 23\nRECORD2 62, 53, 75 1 71 93 NA Prohibited Allowed 24\nRECORD3 68, 67, 81 4 79 97 NA Prohibited Allowed 25\nRECORD4 65, 64, 84 2 81 100 NA Prohibited Allowed 26\nPROOF OF 64, 54, 79 NA 73 NA Allowed Prohibited Allowed if half life <17 hours\nCONCEPT27\nODIXA KNEE 66, 55, 89 NA 53 91 Allowed Prohibited Allowed if half life <17 hours 28\nODIXA HIP (twice 65, 59, 77 NA 70 82 Allowed Prohibited Allowed if half life <17 hours\ndaily)29\nODIXA HIP (once 66, 64, 75 NA 62 84 NA Prohibited Allowed if half life <17 hours\ndaily)30\nApixaban:\nADVANCE-1 66, 62, 87 4 87 95 NA NA Allowed if half life <17 hours 31\nADVANCE-2 67, 74, 78 2 84 95 NA NA Allowed if half life <17 hours 32\nADVANCE-3 61, 55, 80 2 68 90 NA NA Allowed if half life <17 hours 33\nAPROPOS 67, 52, 83 NA 54 78 NA NA NA 34\nNSAID=non-steroidal anti-inflammatory drug; NA=not available.\nNo commercial reuse: See rights and reprints http://www.bmj.com/permissions Subscribe: http://www.bmj.com/subscribe\nBMJ 2012;344:e3675 doi: 10.1136/bmj.e3675 (Published 14 June 2012) Page 9 of 16\nRESEARCH\nProtected by copyright, including for uses related to text and data mining, AI training, and similar technologies. \n.Serials\nat New York University, Serials Bobst Library Technical Services on 3 November 2025 https://www.bmj.com/ Downloaded from 14 June 2012. 10.1136/bmj.e3675 on BMJ: first published as \n\nTable 3| Symptomatic venous thromboembolism, clinically relevant bleeding, and net clinical endpoint by type of surgery\nRelative risk (95%CI) Weight (%) P value*\nNo of events/No in group\nVariables New anticoagulant Enoxaparin\nSymptomatic venous thromboembolism\nDabigatran:\nHip 23/3367 10/2181 0.78 (0.05 to 12.35) 42.5 0.83 20 22\nKnee 25/3141 19/1575 0.56 (0.16 to 1.98) 57.5 19 21\nRivaroxaban:\nHip 11/3888 27/3990 0.52 (0.18 to 1.45) 35.6 0.93 23 24 27 29 30\nKnee 21/2940 44/2946 0.49 (0.29 to 0.83) 64.4 25 26 28\nApixaban:\nHip 4/2708 10/2699 0.40 (0.13 to 1.27) 23 0.14 33\nKnee 28/3437 23/3277 1.08 (0.56 to 2.06) 77 31 32 34\nClinically relevant bleeding\nDabigatran:\nHip 178/3367 87/2181 1.22 (0.95 to 1.58) 51.8 0.36 20 22\nKnee 162/3141 79/1575 1.01 (0.74 to 1.39) 48.2 19 21\nRivaroxaban:\nHip 186/3888 152/3990 1.25 (0.90 to 1.75) 59.6 0.90 23 24 27 29 30\nKnee 123/2940 96/2946 1.29 (0.99 to 1.67) 40.4 25 26 28\nApixaban:\nHip 131/2708 138/2699 0.95 (0.75 to 1.19) 52.2 0.09 33\nKnee 103/3437 143/3277 0.71 (0.55 to 0.91) 47.8 31 32 34\nNet clinical endpoint\nDabigatran:\nHip 81/3367 38/2181 1.26 (0.80 to 1.98) 49.3 0.06 20 22\nKnee 58/3141 41/1575 0.71 (0.48 to 1.05) 50.7 19 21\nRivaroxaban:\nHip 86/3888 94/3990 0.92 (0.60 to 1.41) 53.2 0.76 23 24 27 29 30\nKnee 71/2940 84/2946 0.85 (0.60 to 1.19) 46.8 25 26 28\nApixaban:\nHip 29/2708 29/2699 1.00 (0.60 to 1.66) 32.8 0.70 33\nKnee 58/3437 62/3277 0.88 (0.62 to 1.26) 67.2 31 32 34\n*Random effects model, subgroup differences.\nNo commercial reuse: See rights and reprints http://www.bmj.com/permissions Subscribe: http://www.bmj.com/subscribe\nBMJ 2012;344:e3675 doi: 10.1136/bmj.e3675 (Published 14 June 2012) Page 10 of 16\nRESEARCH\nProtected by copyright, including for uses related to text and data mining, AI training, and similar technologies. \n.Serials\nat New York University, Serials Bobst Library Technical Services on 3 November 2025 https://www.bmj.com/ Downloaded from 14 June 2012. 10.1136/bmj.e3675 on BMJ: first published as \n\nTable 4| Indirect comparisons between rivaroxaban, dabigatran, and apixaban*\nRelative risk (95% CI)\nOutcomes Rivaroxaban v dabigatran Rivaroxaban v apixaban Apixaban v dabigatran\nSymptomatic venous thromboembolism 0.68 (0.21 to 2.23) 0.59 (0.26 to 1.33) 1.16 (0.31 to 4.28)\nClinically relevant bleeding 1.12 (0.87 to 1.44) 1.52 (1.19 to 1.95) 0.73 (0.57 to 0.94)\nMajor bleeding 1.37 (0.79 to 2.39) 1.59 (0.84 to 3.02) 0.86 (0.41 to 1.83)\nNet clinical endpoint 0.95 (0.61 to 1.48) 0.96 (0.66 to 1.40) 0.99 (0.61 to 1.61)\n*Random effects model, events while receiving treatment.\nNo commercial reuse: See rights and reprints http://www.bmj.com/permissions Subscribe: http://www.bmj.com/subscribe\nBMJ 2012;344:e3675 doi: 10.1136/bmj.e3675 (Published 14 June 2012) Page 11 of 16\nRESEARCH\nProtected by copyright, including for uses related to text and data mining, AI training, and similar technologies. \n.Serials\nat New York University, Serials Bobst Library Technical Services on 3 November 2025 https://www.bmj.com/ Downloaded from 14 June 2012. 10.1136/bmj.e3675 on BMJ: first published as \n\nTable 5| Direct and indirect comparisons: absolute difference in events per 1000 patients treated*\nRisk difference (95% CI)\nComparison Symptomatic venous thromboembolism Clinically relevant bleeding Major bleeding Net clinical endpoint\nDirect comparisons:\nRivaroxaban v enoxaparin −5 (−9 to −1) 9 (2 to 17) 4 (−0.4 to 8) −3 (−9 to 3)\nDabigatran v enoxaparin −2 (−9 to 5) 5 (−4 to 13) −1 (−6 to 5) −1 (−9 to 7)\nApixaban v enoxaparin −1 (−4 to 2) −8 (−15 to −1) −1 (−7 to 5) −1 (−6 to 3)\nIndirect comparisons:\nRivaroxaban v dabigatran −3 (−11 to 4) 5 (−7 to 16) 4 (−2 to 11) −2 (−12 to 9)\nRivaroxaban v apixaban −4 (−9 to 1) 18 (7 to 28) 5 (−2 to 12) −2 (−9 to 6)\nApixaban v dabigatran 1 (−7 to 8) −13 (−24 to −2) 0 (−8 to 7) 0 (−9 to 9)\n*Random effects model, events while receiving treatment.\nNo commercial reuse: See rights and reprints http://www.bmj.com/permissions Subscribe: http://www.bmj.com/subscribe\nBMJ 2012;344:e3675 doi: 10.1136/bmj.e3675 (Published 14 June 2012) Page 12 of 16\nRESEARCH\nProtected by copyright, including for uses related to text and data mining, AI training, and similar technologies. \n.Serials\nat New York University, Serials Bobst Library Technical Services on 3 November 2025 https://www.bmj.com/ Downloaded from 14 June 2012. 10.1136/bmj.e3675 on BMJ: first published as \n\nFigures\nFig 1 Study identification, selection, and exclusions\nNo commercial reuse: See rights and reprints http://www.bmj.com/permissions Subscribe: http://www.bmj.com/subscribe\nBMJ 2012;344:e3675 doi: 10.1136/bmj.e3675 (Published 14 June 2012) Page 13 of 16\nRESEARCH\nProtected by copyright, including for uses related to text and data mining, AI training, and similar technologies. \n.Serials\nat New York University, Serials Bobst Library Technical Services on 3 November 2025 https://www.bmj.com/ Downloaded from 14 June 2012. 10.1136/bmj.e3675 on BMJ: first published as \n\nFig 2 Symptomatic venous thromboembolism\nNo commercial reuse: See rights and reprints http://www.bmj.com/permissions Subscribe: http://www.bmj.com/subscribe\nBMJ 2012;344:e3675 doi: 10.1136/bmj.e3675 (Published 14 June 2012) Page 14 of 16\nRESEARCH\nProtected by copyright, including for uses related to text and data mining, AI training, and similar technologies. \n.Serials\nat New York University, Serials Bobst Library Technical Services on 3 November 2025 https://www.bmj.com/ Downloaded from 14 June 2012. 10.1136/bmj.e3675 on BMJ: first published as \n\nFig 3 Clinically relevant bleeding\nNo commercial reuse: See rights and reprints http://www.bmj.com/permissions Subscribe: http://www.bmj.com/subscribe\nBMJ 2012;344:e3675 doi: 10.1136/bmj.e3675 (Published 14 June 2012) Page 15 of 16\nRESEARCH\nProtected by copyright, including for uses related to text and data mining, AI training, and similar technologies. \n.Serials\nat New York University, Serials Bobst Library Technical Services on 3 November 2025 https://www.bmj.com/ Downloaded from 14 June 2012. 10.1136/bmj.e3675 on BMJ: first published as \n\nFig 4 Net clinical endpoint\nNo commercial reuse: See rights and reprints http://www.bmj.com/permissions Subscribe: http://www.bmj.com/subscribe\nBMJ 2012;344:e3675 doi: 10.1136/bmj.e3675 (Published 14 June 2012) Page 16 of 16\nRESEARCH\nProtected by copyright, including for uses related to text and data mining, AI training, and similar technologies. \n.Serials\nat New York University, Serials Bobst Library Technical Services on 3 November 2025 https://www.bmj.com/ Downloaded from 14 June 2012. 10.1136/bmj.e3675 on BMJ: first published as \n\n"], "response": "This article compares the effectiveness and safety of three newly approved oral anticoagulants - dabigatran, rivaroxaban, and apixaban - for preventing venous thromboembolism in patients undergoing elective hip or knee replacement surgery. The study includes data from 16 clinical trials involving over 12,000 patients. The results showed that rivaroxaban significantly reduces the risk of venous thromboembolism compared to enoxaparin, while dabigatran and apixaban did not demonstrate a statistically significant reduction. There was no significant difference in the risk of major bleeding among the three drugs, although the rates varied widely. The authors also performed indirect comparisons between the drugs, which suggested that rivaroxaban might have a lower risk of major bleeding compared to dabigatran and apixaban. The study highlights the need for further research to determine the optimal duration of therapy and the role of these drugs in reducing long term risks of recurrent venous thromboembolism. Overall, the study provides valuable insights into the comparative effectiveness and safety of these new oral anticoagulants for preventing venous thromboembolism during elective hip or knee replacement surgery."}
