{"user_input": "What is the impact of macro/microsteatosis on post-transplant graft survival taking into account donor and other factors?", "retrieved_contexts": ["1 year post-transplant(53.7615.2 vs. 61.9612.5). The impact of\nhyperuricemia on RTRs was dependent on the duration of\nexposure. Likewise, the detrimental effect of early-onset hyperuri￾cemia on the graft function was dependent on UA-level and\nexposure time. After control of the baseline graft function by\nanalysis of only recipients with a good graft function at 1 year post￾transplantation (eGFR . 60 ml/min), moderate-to-severe early￾onset hyperuricemia was also a marker of long-term graft\ndysfunction and failure [24]. Haririan et al found that higher\nUA level had significant higher risk of graft loss compared to lower\nUA level. Each 1 mg/dL increase of UA level was associated with\na 15% increase on average in the risk of graft loss during the study\nperiod and seemed to be associated with increased risk of death\n[26]. These two studies suggested that both higher UA-level and\nlonger duration of exposure have severe impacts on graft function.\nAdvantages and Limitations\nThis meta-analysis has some advantages. First, the samples of\nincluded cohort studies came from Korea, China, Canada,\nPoland, Saudi Arabia, Turkey, USA and German that would\nhave a good representative of race. Second, the effect of\nHyperuricemia on renal function is consistent regardless of\nwhether other confounding factors were adjusted or not. Third,\nthe included studies have moderate to high quality and good\ninternal validity.\nLimitations of this study should be noted. First, the included\nstudies had potential risk of bias due to differences in complete\nreporting of follow-up and judgment of outcomes. Second,\nalthough included study adjusted confounding factors relevant to\nrenal function more or less, the number and types of adjusted\nfactors were different. There are maybe residual confounding\nfactors which have effects on outcomes. However, the pooled\nestimates found that no matter confounding factors adjusted or un￾adjusted, no matter how many confounding factors were adjusted,\nthe conclusion that hyperuricemia is a risk factor of graft\ndysfunction and poor prognosis is consistent. Third, as the sample\nFigure 5. Unadjusted odds ratio (OR) of hyperuricemia with graft loss.\ndoi:10.1371/journal.pone.0039457.g005\nHyperuricemia with Kidney Transplantation\nPLoS ONE | www.plosone.org 6 June 2012 | Volume 7 | Issue 6 | e39457", "4.10. Limitations of this review\nFirstly, the number of RCTs that investigated treatment strategies in\nthe donor and their impact on graft function and survival after trans￾plantation is limited. Furthermore, as our search strategy focused on\ndonor treatment only, potentially promising treatment strategies of\nthe graft after procurement and during preservation were excluded\nthat may be of a pre-transplant treatment potential. In addition, several\nstudies we did include were performed with a low number of partici￾pants, did not report power calculations or were underpowered to de￾tect changes in the outcome parameters as stipulated in this review.\nConsequentially, potential effects on organ function or survival might\nhave been missed and interpretation of the data from these studies\nshould be done with caution. Furthermore, we acknowledge that\nsome outcome parameters, such as plasma bilirubin to assess liver func￾tion or number of organs transplanted in the case of the kidney, are pos￾sibly weakly correlated to organ injury. However, as these endpoints\nwere assessed in conjunction with other biomarkers, the prognostic\nvalue of these endpoints is strengthened. The few number of studies\nalso limited us from assessing the risk of publication bias or perform\nsubgroup analyses. Therefore, drawing conclusions from these studies\nis risky, particularly when grouping for meta-analyses was not possible.\nAdditionally, we found limited studies on lung transplantation, and no\nstudies on pancreas or intestinal transplantations. Lastly, we realise\nthat several promising treatment strategies published in relevant ani￾mal models are not included in this article. However, we believe that\nthese studies were outside the scope of this review as interpretation\nof these results are not yet influential in clinical decision making in de￾ceased donor care.\n5. Conclusions\nThe current global shortage of suitable donor organs and often un￾certainty which organ to accept or decline, underlines the need for op￾timisation of deceased donor care. Treatment strategies aim at\nreducing the detrimental effects of haemodynamic, hormonal, inflam￾matory, and metabolic disturbances prior to organ retrieval. Better con￾ditioning of the grafts-to-be and reducing, or even preventing, donor￾related injury prior to preservation and transplantation have become\nimportant goals to transplant higher risk donor organs, without\ncompromising outcomes after transplantation. Unfortunately, current\ndonor management protocols may vary considerably per centre and\nare based on low-level evidence. In this systematic review, we could\nnot find consistent evidence supporting that any individual treatment\nthat has been tested until now will protect donor organs or improve sur￾vival after transplantation. More organised and defined RCTs are re￾quired to identify and validate possible benefits of innovative\ntreatments before clinical implementation can be recommended as\npart of standard donor care. We feel that a concerted action between\nprofessionals in Intensive Care and organ transplantation is needed to\ngain better insight and stimulate clinically relevant interventions in\nDBD donors.\nAuthors' contributions\nAE and LD both performed the initial search, selection and assess￾ment of the articles, and wrote the manuscript. HL and RP contributed\nto the revision of this manuscript. All authors read and approved the\nfinal manuscript.\nEthics approval and consent to participate\nNot applicable.\nConsent for publication\nNot applicable.\nAvailability of data and materials\nAll data generated or analysed during this study are included in this\npublished article [and its supplementary information files].\nCompeting interests\nThe authors have no conflict of interests to declare.\nFunding\nThis research received no specific grant from any public, commercial,\nor not-for-profit funding agency.\nAcknowledgments\nWe would like to thank Karin Sijtsma for helping with defining the", "and handed it over for immediate implantation. Post-transplant management\nfollowed the unit’s standard protocol, with immunosuppression comprising\ntacrolimus, azathioprine or mycophenolate mofetil and low-dose steroids. Each\npatient underwent an MRCP at 6 months unless the investigation was clinically\nindicated earlier.\nLiver quality was determined retrospectively through histological analysis of\nparenchymal biopsies which were assessed for pre-existing liver disease, steatosis,\nglycogen content and features of preservation–reperfusion injury.\n1.00\nKaplan–Meier 1 year graft survival estimates\n0.75\n0.50\n0.25\n0.00\n0\nNumber at risk\nCase–Control = Control 37\nCase–Control = Case\n3\n34 30 27 23\n22 21 20 20\n6\nTime post-transplant (Months)\n9 12\nGraft survival probability\n22\nControls Case\nFig. 5 Comparison of 1-year graft survival estimate. Conditional logistic\nregression was carried out on the matched case–control data to determine\nthe relative risk for graft survival at 1 year between matched case–control\ngroups. The median (range) days follow-up data were included in the\nsurvival analyses, but the plot was truncated at 12 months. The ticks on the\ntop of each Kaplan–Meier curve relate to the numbers of patients being\ncensored at that particular time point. There are 2 cases of graft failure in\nthe perfusion group at days 119 and 209; the control group contains 5 graft\nfailures (2 at day 5, 1 at day 14, 1 at day 165 and 1 at day 182). The graft\nsurvival was similar in both groups. Findings showed that the odds ratio\n(relative risk) estimate for graft survival at 6 months was determined as 2.0\n(95% CI: 0.2–17.9; p = 0.535). Due to the small sample sizes and that this\nstatistical comparison test was not powered,these results should be\ninterpreted with caution.\nNATURE COMMUNICATIONS | https://doi.org/10.1038/s41467-020-16251-3 ARTICLE\nNATURE COMMUNICATIONS | (2020) 11:2939 | https://doi.org/10.1038/s41467-020-16251-3 | www.nature.com/naturecommunications 9", "transplants (82 HMP vs. 82 SCS). HMP resulted in a significantly\nreduced DGF rate as well as better early graft function after\n1 month compared to SCS. However, 1-year graft survival was\ncomparable in both groups (49).\nFurthermore, in another RCT, kidneys were either preserved\nby HMP or SCS. In accordance with Moers as well as\nJochmans, the primary end-point was the occurrence of DGF.\nSecondary endpoints were primary non-function as well as graft\nsurvival. Both the risk of DGF and the incidence of non￾function were significantly reduced by HMP in their cohort.\nOne-year graft survival and function could be improved by\ndynamic cold graft preservation (52). Despite these findings,\nthe importance of different factors such as the impact of CIT\nand the combination of CIT with HMP have to be mentioned.\nCIT is a known independent risk factor for DGF. In order\nto investigate which kidney graft may further benefit from\nHMP prior to transplantation, Kox et al. analyzed prospectively\ncollected data from the “Machine Perfusion Trial.” A total of 752\nrenal transplants were included with 376 dynamically preserved\nkidneys and 376 statically preserved grafts. They identified CIT\nas an independent risk factor for DGF. Furthermore, HMP did\nnot prevent DGF if CIT exceeded 10 h (51).\nThe optimal timepoint for, as well as the optimal duration of,\nHMP is still a matter of debate. HMP can be used either as a\nprimary preservation method or in the end-ischemic phase as\na reconditioning tool. Matos et al. were able to show a faster\nrecovery of renal function if grafts were subjected to HMP prior\nto transplantation after a mean SCS period of 22 h. MP time was\nat least 6 h. However, this beneficial effect was limited to donors\nunder the age of 50, who represent a rather selective group (94).\nFurther studies followed, indicating a beneficial effect of MP in\nthe end-ischemic phase by displaying a reduction of DGF, as\nwell as an improved organ acceptance. This last positive trend is\nattributed mainly to the possibility of organ monitoring (95, 96).\nNMP of the Kidney\nNMP of the kidney may eventually resolve many issues\nrelated to damage induced by ischemic phases. The idea of\npreserving kidney grafts under almost physiological conditions\nwith the possibility of real-life assessment of the graft prior to\ntransplantation sounds intriguing. However, while the number\nof preclinical studies using animal models as well as discarded\nhuman kidneys is steadily increasing, evidence for NMP of\nthe kidney in a clinical setting is rather poor. Hosgood et al.\nwere first to transform preclinical experience into clinical reality\nby transplanting a 62-year-old ECD kidney into a 55-year old\nrecipient. After 11 h of SCS, the graft was perfused with a\nplasma-free red cell-based solution at 33.9◦C for 35 min prior\nto transplantation. Although a slow graft function was observed,\nthe patient remained dialysis free with a serum creatinine level\nof 132 µmol/L at 3 months post-transplantation. In contrast, the\nrecipient of the opposite kidney developed DGF (64). Based on\nthis first success, the Leicester group translated NMP into clinical\nreality on a larger scale. Eighteen ECD kidneys were subjected to\nNMP reconditioning prior to transplantation. The average NMP\nFrontiers in Immunology | www.frontiersin.org 9 May 2020 | Volume 11 | Article 631", "[29,30]. Spitzer et al. [30] concluded that steatosis should\nbe added to the DRI, when dealing with a high-risk\ndonor. However, objective evaluation of the range of\nsteatosis, either as macro- or microvesicular steatosis, is\nnot standardized so far subjective to some degree [29].\nWe believe that routine donor biopsy evaluation may en￾able the design of more powerful and robust donor risk\nscores.\nWe believe that the prognostic power of the DRI and\nET-DRI is further significantly undermined by the fact\nthat graft acceptance decisions on offered organs for\ntransplantation are not documented and evaluated in\nthese scores. There is an urgent need to evaluate and ad￾dress this shortcoming immediately, especially on the\nbackground of the current liver transplant scandals in\nGermany [23,31]. We believe that this aspect is a rele￾vant issue in liver transplantation today. Transplant cen￾ters regard their graft acceptance policy as their\npotential advantage in a highly competitive area for a\nvery scarce resource in times of ubiquitous organ short￾age. It can be assumed that these aspects of potentially\nunwanted transparency by the proponents of transplant￾ation stood in the way of previous attempts to generate\nrobust prognostic scores that include donor organ qual￾ity. This may represent a deeper reason for the notorious\ndifficulty to assess donor organ quality and its impact on\nprognosis after transplantation objectively.\nThe balance of equity and utility in donor organ allo￾cation is a serious ethical dilemma. Several risk predic￾tion models are available and their head to head\ncomparisons would benefit from standardized reporting\nand formal, consistent statistical evaluation [18,26]. It\nwas claimed previously and in a different context that\noutcome selection and optimism biases may affect litera￾ture on prognostic scores in medicine [26].\nWe would like to propose joint efforts to develop a ro￾bust and objective donor risk score in an international\ncollaboration that should include the available large\ndata-sets from multiple institutions. We believe that the\ntime has come for a consensus on the reporting of the\nreasons for declined organ offers and on quality stan￾dards for prognostic scores and their statistical analysis\nand validation. Jacob et al. [18] proposed a reasonable\nscientific approach to the latter. High quality scientific\njournals should make uniform requirements mandatory\nfor the reporting of prognostic scores.\nConclusion\nThe results of this current study clearly show that the\nET-DRI is not applicable in the population from our\ncenter within the Eurotransplant community for the pre￾diction of patient or graft survival. On the background\nof a paucity of proper prognostic models, justified organ\nallocation which weighs urgency against prediction of\nsuccess of liver transplantation must be the aim of future\nresearch in this field.\nPatients and methods\nEthics statement\nAs an observational retrospective study, according to the\nProfessional Code of the German Medical Association\n(article B.III. § 15.1), neither informed consent nor ap￾proval of the ethics committee was needed for this\nstudy.\nPatients\n291 consecutive liver transplants were included to\nanalyze the model’s accuracy and applicability for this\ndataset of a major transplant centre in the Eurotrans￾plant community. Included were 20 (6.9%) split liver\ntransplants, 30 (10.3%) acute re-transplants (retransplan￾tation within 30 days after the previous transplant) and\n25 (8.6%) chronic retransplants (primary transplantation\nn = 235, secondary transplantation n = 48, tertiary trans￾plantation n = 6, quaternary transplantation n = 1) in a\ntotal of 257 patients (median age: 49.6 years, range: 18–\n69 years; males n = 177 (64.4%), females n = 114 (35.6%),\nratio males/females: 1.8). All transplants were performed\nin our centre between the 01/01/2007 and the 12/31/\n2010. The post-transplant observational period ended on", "Description of included studies\nThe 37 studies comprised both prospective and retrospective\ncase series, and collectively included a total of 53,691 patients.\nIn most, the main objective was not to assess the relationship\nbetween MELD and post-transplant survival. Instead, studies\nexamined a broad range of pre-transplant factors that may or\nmay not influence survival through exploratory analyses.\nStudies originated from several countries, including: Belgium\n(2), New Zealand (1), the United Kingdom (3), Brazil (6), Spain\n(5), the United States (7), Singapore (1), Turkey (1), China (1),\nKorea (1), Switzerland (1), Poland (1), Italy (3), Canada (1),\nand Germany (3). The majority were single centered. Sample\nsizes ranged from 46 to 21,673 patients (mean = 1451, median\n= 222), most of whom were male. None used a power\ncalculation to determine sample size. Sampling methods\ncomprised consecutive patients who met inclusion/exclusion\ncriteria, which differed considerably across studies. Therefore,\npatients comprising the “general transplant population” may\nhave varied. The point at which MELD was measured in\npatients was inconsistent across studies, with some using time\nof placement on the transplant list and others using time of\ntransplant. In most of the studies, the relationship between\nMELD and survival was examined through stratified analyses\nof survival across sub-groups defined by MELD score, where\nMELD cut-off points for sub-groups were determined post-hoc.\nFurther, the majority(25) measured the association between\nMELD and survival based on univariate analyses alone, and,\ntherefore, did not control for potential confounders. Eleven of\nthe studies assessed the predictive ability of the MELD score\non post-transplantation survival using a receiver operating\ncharacteristic (ROC) curve and the c-statistic. In 4 of the\nstudies, there was partial overlap of patient populations since\nthey included data from the Transplant Scientific Registry\n(Cywinski et al [4], Freeman et al [5], Rana et al [6] and Yoo &\nThuluvath [7]). All of these studies were kept in the review as\neach used different MELD categories and follow-up times in\ntheir analysis. A detailed summary of each study is presented\nin Table C in File S1.\nAs mentioned above, the majority of studies grouped\npatients by MELD. Specifically, MELD, which represents a\ncontinuous variable, was converted to a categorical variable for\nthe analyses. The cut-off points for such categories varied\nwidely across studies and were typically determined post-hoc.\n(Refer to relevant outcome measures in Table C in File S1).\nEffect measures also differed, ranging from proportions to\nhazards ratios, odds ratios, and relative risks, and follow-up\ntime periods were inconsistent. Lastly, characteristics of the\n“general transplant population” varied. Therefore, given such\nclinical heterogeneity across studies, a meta-analysis was\ndeemed inappropriate, and a statistical assessment of\nheterogeneity was not performed.\nQuality of included studies\nBased on the Oxford Center for Evidence-based Medicine\nLevels of Evidence, the quality of all of the included studies\nwas level IV. The studies, which involved a comparison of pre￾Figure 1. Literature search results and study selection for clinical review. \ndoi: 10.1371/journal.pone.0080661.g001\nDoes MELD Predict Post-Transplant Survival?\nPLOS ONE | www.plosone.org 3 December 2013 | Volume 8 | Issue 12 | e80661", "stable allograft function from recipients at risk of losing their transplants.\nBy studying kidney transplant recipients at high risk for graft loss and rare,\nspontaneously tolerant kidney transplant recipients, researchers reporting\nin 3 papers in this issue of the JCI shed new light on these topics.\nLate graft failure after kidney \ntransplantation\nKidney transplantation is the most com￾mon solid organ transplant procedure car￾ried out in the US; more than 16,000 such\ntransplants were performed in 2009 (1).\nAdvances in immunosuppression over the\npast 2 decades have drastically reduced the\nincidence of acute T cell–mediated rejec￾tion episodes, but have not significantly\nimproved long-term allograft survival\n(2). The actual half-life for a transplanted\nkidney from a deceased donor (the most\ncommon source of kidneys for transplan￾tation) is only 8 years (2), and as few as\none-third of kidney allografts obtained\nfrom older donors remain function￾ing 10 years later (3). Allograft dysfunc￾tion can result in the need for a further\ntransplant and is a strong independent\npredictor of recipient cardiovascular\nmortality (4). Late graft loss is commonly\ncaused by chronic allograft nephropa￾thy, characterized by tissue fibrosis and\ntubular atrophy (5). Among the factors\nknown to contribute to its pathogenesis\nare uncontrolled alloimmune reactivity\n(T cell– and/or antibody-mediated injury),\nrecurrent primary renal disease, hyper￾tension, diabetes, and drug toxicity. With\nregard to the latter, kidney toxicity as a\nresult of long-term treatment with the\nimmunosuppressive agents tacrolimus or\ncyclosporine is detectable in virtually all\ntransplanted kidneys (6).\nAlthough research progress hasimproved\nour knowledge of the prevalence, clinical\nsignificance, and pathogenesis of chron￾ic kidney allograft injury, research has\nnot yet influenced therapeutic decision\nmaking to improve outcomes. Currently,\nposttransplant care, including immuno￾suppression, is protocol driven. Altera￾tions in drug dosing are made based on\ncenter-derived protocols and physician\nexperience. Because chronic injury is mul￾tifactorial, a one-size-fits-all approach\nis not ideal. To develop individual thera￾peutic approaches tailored to individual\npatients, transplant physicians need risk\nassessment tools that can discriminate\nspecific pathogenic mechanisms, prospec￾tively identify those transplant recipients\ndestined to have excellent graft function,\nrecognize those recipients at high risk for\ngraft loss, and ultimately guide specific\nchanges in therapy. In this issue of the JCI,\n3 papers provide new data that move us\ncloser to these goals (7–9).\nAn intragraft molecular signature \ncan predict graft loss\nTo assess the risk of future graft loss,\nEinecke and colleagues (7) evaluated gene\nexpression profiles in tissue from 105 kid￾ney graft biopsies that were performed to\ndetermine the cause of allograft dysfunc￾tion and/or proteinuria using microarray\nConflict of interest: The authors have declared that no\nconflict of interest exists.\nCitation for this article: J Clin Invest. 2010;\n120(6):1803–1806. doi:10.1172/JCI43286.", "United States: the long-term does not mirror the \ndramatic short-term success. Am J Transplant. 2011;\n11(6):1226–1235.\n2. Tapiawala SN, et al. Delayed graft function and \nthe risk for death with a functioning graft. J Am Soc \nNephrol. 2010;21(1):153–161.\n3. Khalkhali HR, Ghafari A, Hajizadeh E, Kazemne￾jad A. Risk factors of long-term graft loss in renal \ntransplant recipients with chronic allograft dys￾function. Exp Clin Transplant. 2010;8(4):277–282.\n4. El Ters M, et al. Kidney allograft survival after \nacute rejection, the value of follow-up biopsies. \nAm J Transplant. 2013;13(9):2334–2341.\n5. Smith JD, et al. De novo donor HLA-specific anti￾bodies after heart transplantation are an indepen￾dent predictor of poor patient survival. Am J Trans￾plant. 2011;11(2):312–319.\n6. Terasaki PI, Ozawa M. Predicting kidney graft \nfailure by HLA antibodies: a prospective trial. Am \nJ Transplant. 2004;4(3):438–443.\n7. Gaston RS. Chronic calcineurin inhibitor nephro￾toxicity: reflections on an evolving paradigm. Clin J \nAm Soc Nephrol. 2009;4(12):2029–2034.\n8. Kaposztas Z, Gyurus E, Kahan BD. New-onset dia￾betes after renal transplantation: diagnosis, inci￾dence, risk factors, impact on outcomes, and novel \nimplications. Transplant Proc. 2011;43(5):1375–1394.\n9. Luft FC. How calcineurin inhibitors cause hyperten￾sion. Nephrol Dial Transplant. 2012;27(2):473–475.\n10. Walport MJ. Complement. First of two parts. \nN Engl J Med. 2001;344(14):1058–1066.\n11. Ricklin D, Hajishengallis G, Yang K, Lambris \nJD. Complement: a key system for immune sur￾veillance and homeostasis. Nat Immunol. 2010;\n11(9):785–797.\n12. Medof ME, Kinoshita T, Nussenzweig V. Inhibi￾tion of complement activation on the surface of \ncells after incorporation of decay-accelerating fac￾tor (DAF) into their membranes. J Exp Med. 1984;\n160(5):1558–1578.\n13. Peake PW, O’Grady S, Pussell BA, Charlesworth JA. \nC3a is made by proximal tubular HK-2 cells and \nactivates them via the C3a receptor. Kidney Int. 1999;\n56(5):1729–1736.\n14. Lalli PN, Strainic MG, Yang M, Lin F, Medof ME, \nHeeger PS. Locally produced C5a binds to T cell￾expressed C5aR to enhance effector T-cell expan￾sion by limiting antigen-induced apoptosis. Blood. \n2008;112(5):1759–1766.\n15. Siedlecki A, Irish W, Brennan DC. Delayed graft \nfunction in the kidney transplant. Am J Transplant. \n2011;11(11):2279–2296.\n16. Zhou W, et al. Predominant role for C5b-9 in renal \nischemia/reperfusion injury. J Clin Invest. 2000;\n105(10):1363–1371.\n17. Thurman JM, et al. Altered renal tubular expres￾sion of the complement inhibitor Crry permits \ncomplement activation after ischemia/reperfusion. \nJ Clin Invest. 2006;116(2):357–368.\n18. Stein JH, Osgood RW, Barnes JL, Reineck HJ, Pinck￾ard RN, McManus LM. The role of complement in \nthe pathogenesis of postischemic acute renal fail￾ure. Miner Electrolyte Metab. 1985;11(4):256–261.\n19. Park P, et al. Inhibiting the complement system does \nnot reduce injury in renal ischemia reperfusion. \nJ Am Soc Nephrol. 2001;12(7):1383–1390.\n20. Thurman JM, Ljubanovic D, Edelstein CL, Gilkeson \nGS, Holers VM. Lack of a functional alternative com￾plement pathway ameliorates ischemic acute renal \nfailure in mice. J Immunol. 2003;170(3):1517–1523.\n21. De Vries B, Matthijsen RA, Wolfs TG, Van Bijnen AA, \nHeeringa P, Buurman WA. Inhibition of complement \nfactor C5 protects against renal ischemia-reperfusion \ninjury: inhibition of late apoptosis and inflammation. \nTransplantation. 2003;75(3):375–382.\n22. Yamada K, Miwa T, Liu J, Nangaku M, Song WC. \nCritical protection from renal ischemia reperfu￾sion injury by CD55 and CD59. J Immunol. 2004;\n172(6):3869–3875.\n23. Renner B, et al. Binding of factor H to tubular epi￾thelial cells limits interstitial complement activation \nin ischemic injury. Kidney Int. 2011;80(2):165–173.\n24. Renner B, et al. The complement inhibitors Crry \nand factor H are critical for preventing autologous \ncomplement activation on renal tubular epithelial", "transplant MELD scores with post-transplant survival, were all\ncase series and predominantly retrospective in design. All\nstudies recruited consecutive patients over a specified time\nperiod, thereby reducing the risk of selection bias.\nAssociation between Pre-Transplant MELD Score and\nPost-Transplantation Survival\nOf the 37 studies, 15 found no association between pre￾transplant MELD score and post-transplant patient survival,\nwhile 22 reported poorer survival with higher MELD. A detailed\ndescription of the results of each study is presented in Table C\nin File S1. Based on qualitative analyses, there were no clear\ndifferences in studies with statistically significant findings\ncompared to those with no statistically significant findings. In\nboth groups, sample sizes varied, as did follow-up times.\nHowever, findings from the two largest studies (N >15,000)\nboth suggested that survival decreased with increasing MELD.\nOne observed this relationship only when patients with MELD\nscores under 9 were compared to those with scores of 30 or\ngreater, while the other had treated MELD as a continuous\nvariable. At the same time, of the 7 other studies that analysed\nMELD as a continuous variable, all but one found no\nstatistically significant association between MELD and survival.\nIn most of the studies, information presented on patient\ncharacteristics was limited. Therefore, it was not possible to\nidentify any differences in patient populations that could explain\ninconsistencies in the findings.\nPredictive ability of MELD score for post￾transplantation survival\nEleven studies presented a receiver operating characteristic\n(ROC) curve to determine the predictive ability of pre-transplant\nMELD score to determine post-transplantation survival. The\narea under the curve is used to produce a concordance value\ncalled the c-statistic. A c-statistic of 0.50 indicates no predictive\nability, and is expected if the results are due to chance alone.\nIn contrast, a c-statistic of 1 represents perfect discrimination.\nValues under 0.7 suggest poor predictive power, while those\ngreater than 0.70 indicate a useful test, and those higher than\n0.80 imply excellent predictive accuracy[2]. Among the 11\nstudies, 10 reported c-statistics less than <0.7, indicating that\nMELD poorly predicted post-transplant survival. This included\nthe largest study contributing to the review[6]. In 1 study, the c￾statistic decreased over time, from 0.711 for 3-month post￾transplant survival to 0.679 for 12-month survival[8]. In the\nsingle study with a high c-statistic[9], there was no clear\ndifference in sample size, follow-up time, or patient population\nwhen compared to the studies with lower values.\nDiscussion\nThis review assessed the association and predictive ability of\npre-transplantation MELD score on post-transplantation\nsurvival in adults with end-stage liver disease. It highlighted\ndiscrepancies in findings across studies. Such discrepancies\nmay be related to the nature of the studies, The vast majority\nwere retrospective case series that relied upon exploratory\nstratified analyses of data to detect a relationship between\nMELD and post-transplant survival. As such, analytical\ntechniques, rather than study design, were used to control for\nconfounding. In addition, most of the studies were single\ncentered, with each site having its own process for prioritizing\npatients for transplant. Therefore, patients constituting the\ngeneral transplant population may have varied across studies.\nThus, while using pre-transplant MELD to predict post￾transplant survival in transplant candidates may be attractive,\nthere is little evidence to support it. Prospective studies\ndesigned specifically to examine this relationship are needed.\nMELD score does appear to have a greater impact on mortality\nwhen observed in combination with other known risk factors for\npost-transplant mortality, including sub-optimal livers, low graft￾to-body ratio and presence of Hepatitis C. Further research in", "Figure 6 | A model for contrasting findings between blood and tissue monocyte–macrophage lineage cells during heart transplant rejection. The \nputative scenario of events based on our findings is described in Section “Discussion.” Briefly, step 1: subendothelial migration of monocytes, step 2: migration of \npro-inflammatory CD16+ monocytes toward the tissue, and step 3: macrophage polarization in to high numbers of anti-inflammatory M2-macropghages \ncontributing to remodeling and fibrosis of the damaged heart.\n10\nvan den Bosch et al. Monocytes in Heart Transplant Rejection\nFrontiers in Immunology | www.frontiersin.org March 2017 | Volume 8 | Article 346\nout macrophage or NK cell phenotype as the cell source. M2 \nmacrophages accumulate increasingly in tissue during rejec￾tion suggesting that the presence of CD16+ monocytes, with \na presumed pro-inflammatory nature, and anti-inflammatory \nIL-10-producing M2 macrophages are parts of a micro-envi￾ronmental balance within the endomyocardial tissue. Higher \ntissue macrophage frequencies are known to predict worse graft \noutcome (20). Future research is needed to investigate mono￾cyte–macrophage profiles during acute antibody-mediated \nrejection.\nIn Figure  6, we attempt to visualize a model based on our \ndata. It is tempting to think that preferentially CD16+ mono￾cytes will leave circulation and enter the graft at transplantation, \ncausing vasculopathy in due time (21). Rejection results in an \neven higher influx of activated CD16+ monocytes producing \npro-inflammatory cytokines. At the same time, a counterbal￾anced predominance of anti-inflammatory M2 macrophages \ncontributes to the remodeling and fibrosis of the damaged heart \ntissue (22).\nIn conclusion, although the numbers of included patients \nin this explorative study are limited, fibrosis is investigated \nby Serius Red stainings and not by cardiac MRI with delayed \ngadolinium pre- and post-rejection, to our knowledge, this is \nthe first report on matched serial blood samples and EMBs at \ntime points prior to rejection and at rejection. Here, we showed \nthat CD16+ monocytes and M2 macrophages hallmark the \ncorrelates of acute cellular rejection on tissue level and seem \nto be associated with fibrosis after heart transplant rejection in \nthe long term. The elucidation of the molecular mechanisms \nunderlying these cellular shifts may lead to discovery of new \nmolecular biomarkers indicating the immunological graft \nstatus and may help finding new molecular targets for specific \nimmunotherapy.\nAUTHOR CONTRIBUTIONS\nTB contributed in the process of writing, experimenting, design, \ndiscussing, and data analyses. KC contributed in the process of \nwriting, design, discussing, and data analyses. MK contributed \nin the process of experimenting, design, discussing, and data \nanalyses. AC contributed in the process of writing, sample col￾lecting, and discussing. OM contributed in the process of writing, \nsample collecting, and discussing. PL contributed in the process \nof writing and discussing. JT contributed in the process of writing, \nsample collecting, data analyses, and discussing. MG contributed \nin the process of writing, sample collecting, data analyses, and \ndiscussing. CB contributed in the process of writing and discuss￾ing. AR contributed in the process of writing, experimenting, \ndesign, discussing, and data analyses.\nFUNDING\nThis work is supported by Erasmus University Medical Center \nfellowship award to AR (Project number: 102178).\nSUPPLEMENTARY MATERIAL\nThe Supplementary Material for this article can be found online at \nhttp://journal.frontiersin.org/article/10.3389/fimmu.2017.00346/\nfull#supplementary-material.\nFigure S1 | Peripheral blood leukocyte profiles in heart transplant \nrecipients compared to healthy individuals. Percentages of CD3+, CD20+, \nand CD56+ in circulation showed a significantly increased number of CD3+\nT cells during rejection (***p < 0.001)."], "response": "The summary provides a brief overview of the main findings and discussions presented in the article. It highlights the inconsistencies in the literature regarding the association and predictive ability of the Model for End-Stage Liver Disease (MELD) score for post-transplantation survival in adults with end-stage liver disease. Most studies reported poor predictive power, with only one study showing a high c-statistic. The authors suggest that joint efforts are required to develop a robust and objective donor risk score in an international collaboration that includes available large datasets from multiple institutions. The authors also discussed the role of donor organ quality and its impact on post-transplantation survival, highlighting the need for standardized reporting and formal, consistent statistical evaluation. The authors proposed evaluating and addressing the shortcoming of graft acceptance decisions on offered organs for transplantation, given its relevance in liver transplantation today. The authors also discussed the association and predictive ability of pre-transplant MELD score on post-transplantation survival, emphasizing the need for prospective studies designed specifically to examine this relationship. Finally, the authors presented a model based on their data, attempting to visualize the correlation between monocyte-macrophage profiles and fibrosis after heart transplant rejection on tissue level. The authors suggested that future research is necessary to investigate molecular mechanisms underlying these cellular shifts and discover new molecular biomarkers indicating the immunological graft status and new molecular targets for specific immunotherapy. Overall, the summary highlights the limitations and gaps in the existing literature and suggests directions for future research in this field."}
{"user_input": "What is the impact of macro/microsteatosis on post-transplant graft survival taking into account donor and other factors?", "retrieved_contexts": ["Effects of Hyperuricemia on Renal Function of Renal\nTransplant Recipients: A Systematic Review and Meta￾Analysis of Cohort Studies\nYan Huang1\n, Yu-Lin Li2\n, He Huang3\n, Ling Wang4\n, Wen-Ming Yuan5\n, Jing Li1\n*\n1 Chinese Cochrane Center, West China Hospital, Sichuan University, Chengdu, People’s Republic of China, 2 The Second Clinical Medical College of Chengdu University of\nTCM, Chengdu University of TCM, Chengdu, People’s Republic of China, 3 Department of Cardiology, West China Hospital, Sichuan University, Chengdu, People’s Republic\nof China, 4Department of Cardiology, The People’s Hospital of Mianyang, Mianyang, People’s Republic of China, 5 Department of Nephrology, The First Affiliated Hospital\nof Zhengzhou University, Zhengzhou University, Zhengzhou, People’s Republic of China\nAbstract\nBackground: Hyperuricemia is an independent risk factor of nephropathy, but its role in renal transplant recipients (RTRs) is\ncontroversial.\nMethods: Based on the methods of Cochrane systematic reviews, we searched MEDLINE (1948–2011.6), EMBASE (1956–\n2011.6), CBM (Chinese Biomedicine Database) (1978–2011.6) to identify cohort studies assessing the association between\nuric acid level and kidney allograft. Two authors independently screened the studies, assessed the risk of bias of included\nstudies and extracted data. Unadjusted odds ratio(OR), mean difference (MD), adjusted hazard ratio (aHR) and their\ncorresponding 95%CI were pooled to assess the effects of hyperuricemia on kidney allograft.\nResults: Twelve cohort studies were included and the quality was moderate to high based on the NEWCASTLE-OTTAWA\nquality assessment scale. RTRs with hyperuricemia had lower eGFR (P,0.0001, 95%CI216.34,6.14) and higher SCr\n(P,0.00001, 95%CI 0.17,0.31) than those with normal uric acid level. Meta-analysis showed that hyperuricemia was a risk\nfactor of chronic allograft nephropathy (Unadjusted OR = 2.85, 95%CI 1.84,4.38, adjusted HR = 1.65, 95%CI 1.02,2.65) and\ngraft loss (Unadjusted OR = 2.29, 95%CI 1.55,3.39; adjusted HR = 2.01, 95%CI 1.39,2.94).\nConclusions: Current evidence suggests that hyperuricemia may be an independent risk factor of allograft dysfunction.\nHyperuricemia may modestly increase the risk of poor outcomes of RTRs. Future research is needed to verify whether\nlowering uric acid level could improve the kidney function and prognosis of RTRs with hyperuricemia.\nCitation: Huang Y, Li Y-L, Huang H, Wang L, Yuan W-M, et al. (2012) Effects of Hyperuricemia on Renal Function of Renal Transplant Recipients: A Systematic\nReview and Meta-Analysis of Cohort Studies. PLoS ONE ( ): e39457. doi:10.1371/journal.pone.0039457\nEditor: Giuseppe Remuzzi, Mario Negri Institute for Pharmacological Research and Azienda Ospedaliera Ospedali Riuniti di Bergamo, Italy\nReceived February 28, 2012; Accepted May 21, 2012; Published June 22, 2012\nCopyright:  2012 Huang et al. This is an open-access article distributed under the terms of the Creative Commons Attribution License, which permits\nunrestricted use, distribution, and reproduction in any medium, provided the original author and source are credited.\nFunding: No current external funding sources for this study.\nCompeting Interests: The authors have declared that no competing interests exist.\n* E-mail: lijing68@hotmail.com\nIntroduction\nKidney transplantation has become a routine procedure in\npatients with end-stage renal failure as the development of kidney\ntransplant technique and medicine. However, shortage of donors,\nthe long-term outcomes and morbidity of kidney transplant\npatients are still remained problems [1]. Multiple factors\ncontribute to long-term function and survival of the allograft.\nOne study has shown that all kidney transplant recipients (RTRs)\ninevitably have or will have chronic kidney disease (CKD) as a\nresult of the development of chronic allograft nephropathy(CAN)\n[2].\nIncreasing experimental and epidemiological studies suggest\nthat hyperuricemia may play a role in the progression of\ncardiovascular and renal diseases. UA induces endothelial cell\ndysfunction, decreases nitric oxide production [3,4,5], stimulates\nvascular smooth muscle cell proliferation [6,7], activates renin￾angiotensin system [8] and produces various inflammatory\nmediators [9,10]. Studies have found an independent association\nbetween hyperuricemia and hypertension, coronary heart disease,\nischemic stroke, chronic renal diseases and type 2 diabetes [11].\nHyperuricemia is common among kidney transplant recipients,\nespecially those on cyclosporine-based immunosuppressive regi￾mens [12]. The incidence of hyperuricemia in kidney transplant\npatients, which was ,25% before the routine use of cyclosporine,\nhas increased to .80% with the widespread use of cyclosporine\n[12]. Increased UA level has been shown to be predictive of\nincident kidney disease and end-stage renal disease in those with\nnormal renal function and progression of disease in individuals\nwith kidney disease [13], while reduction of serum UA with\nallopurinol has been associated with slowing of the progression of\nrenal disease [14]. Therefore, it has been proposed that\nhyperuricemia may have clinical significance in RTRs, but studies\nshow conflicting results of the role of hyperuricemia in renal\nallograft recipients. We conducted a systematic review and meta￾analysis of cohort studies to assess the association between serum\nUA levels and graft function and survival after kidney transplan￾PLoS ONE | www.plosone.org 1 June 2012 | Volume | Issue | e39457\n7 6\n7 6\n\ntation in an effort to clarify whether early-onset hyperuricemia is\nan independent predictor of long-term graft outcomes.\nMethods\nSearching\nA comprehensive literature search was performed using\ndatabases MEDLINE (Ovid) from1948 until June 2011, Medline\n(R) in-process & other no-indexed citations (2011.5), EMBASE\nfrom 1956 until June 2011 and CBM (Chinese Biomedicine\nDatabase)from1978 until June 2011. The Medical Subject\nHeading (MeSH) ‘urate’, ‘uric acid’, ‘hyperuric’, ‘hyperuricemia’,\n‘gout’, ‘transplant’ , ‘transplantation’ and ‘graft’ were used as\nEnglish and corresponding Chinese search terms to identify studies\nfrom above database. The search strategies were adjusted based on\nthe characteristics of each database. In addition, we searched the\nreference lists of all identified relevant studies.\nSelection\nWe only included prospective or retrospective cohort studies\ninvestigating the association of hyperuricemia with RTRs’ kidney\nfunction and long-term outcomes. Eligible studies must meet\nfollowing criteria: patients with age older than 18, maintained\nintact renal function more than 6 months to minimize the effects of\ndecreased graft function on hyperuricemia, and only one kidney\ntransplanted. Patients were excluded if they had a history of\nmalignant tumor, acute inflammation, acute renal allograft\nrejection and active liver disease.\nStudies on drug trials, not published in English or Chinese,\nletters and review articles, and studies without available data were\nexcluded.\nValidity Assessment\nTwo reviewers rated the quality of the eligible studies\nindependently. Study quality was judged by using the NEW￾CASTLE-OTTAWA quality assessment scale. We assessed\nincluded studies based on three aspects: the selection of the study\ngroups (0–4 points), the comparability of the groups (0–2 points),\nand the ascertainment of either the exposure or outcome of\ninterest (0–3 points). The total score was 9. In case of\ndisagreement, consensus was achieved by discussion with a third\nadjudicator.\nData Abstraction\nData were extracted by two reviewers independently. For each\nstudy, we extracted information on author, publication year,\ncountry, study design, sample size, age and sex of RTRs, the\ndefinition of hyperuricemia, the length of follow-up and adjusted\nfactors. Estimated glomerular filtration rate (eGFR) and serum\ncreatinine (SCr) were as primary end-point, and CAN diagnosed\nby biopsy and graft loss during follow-up were as secondary end￾point.\nQuantitative Data Synthesis\nExtracted information was put into a table to help us browse the\nsample size, research design, quality and key features of each\nincluded study.\nRevMan5.0 was used to pool unadjusted odds ratio(OR) of\ndichotomous variable, mean difference (MD) of continuous\nvariable and obtain their corresponding 95%CI while STATA10\nwas used to pool adjusted hazard ratio (aHR) and obtain 95%CI.\nChi-square test was used to assess the heterogeneity of included\nstudies. We adopted a p-value of #0.1 as evidence of heteroge￾neity. The random effects model was used to pool data if there was\nheterogeneity, otherwise fixed effect model. A two-sided p value\nless than 0.05 was regarded as significant for all analyses.\nSubgroup analysis was performed to pool the effect size of\nprospective and retrospective cohort studies separately. Sensitivity\nanalysis was performed by removing studies with distinctive\ndefinition of hyperuricemia. Meta-regression was performed to\nassess the effect of several clinical factors and study design on\noutcomes.\nResults\nFlow of Included Studies\nThe primary search strategy identified 1417 articles. After\nscanning the titles and abstracts, 1397 articles were excluded\n(reasons stated in Figure 1). After reading the full text of remaining\nstudies and references tracing, 12 studies\n[15,16,17,18,19,20,21,22,23,24,25,26] which met the inclusion\ncriteria were included in the review (Figure 1).\nStudy Characteristics and Quality\nTable 1 summarized the characteristics of the included studies.\nAmong these studies, six were prospective and six were\nretrospective cohort studies. The sample size ranged from 45 to\n488. The studies were undertaken in U.S, China, Korea, Poland,\nGerman, Canadian, Turkey and Saudi Arabia. Eight studies\n[15,17,19,21,22,23,24,25] with 2045 participants assessed the\neffects of UA on eGFR of RTRs; Five studies [18,20,21,22,23]\nwith 873 participants assessed the effects of UA on SCr of RTRs;\nFive studies [19,20,21,22,24] with 1178 participants assessed the\neffects of UA on CAN and 5 studies [15,16,22,24,26] with 1519\nparticipants assessed the effects of UA on graft loss (including\ndeath with functional graft). Follow-up time ranged from 1 to\n10 years. All studies controlled the factors which had effects on\nFigure 1. Flowchart of study selection.\ndoi:10.1371/journal.pone.0039457.g001\nHyperuricemia with Kidney Transplantation\nPLoS ONE | www.plosone.org 2 June 2012 | Volume 7 | Issue 6 | e39457\n\nTable 1. The character of included study and score of quality assessment.\nstudy country\nstudy\ndesign\nsample\nsize(H/N) Age (H/N)\ndefinition of\nhyperuricemia\nTime of\nevaluating\neGFR since\ntransplant\n(month) follow-up\ncomparable\nof\nbaselines adjusted factors\nscore of\nquality\nassessment\nHaririan2011 U.S Co,R 488 52.6613.1 NS 12 41.1617.7 months Y eGFR,race,donor,peak-PRA,\nHLA-mismatch,delayed graft\nfunction,acute cellular rejection,\nMMF dose,ACEI/ARB\n8\nChung 2010 Korea Co,P 148/208 H: 38.4610.4\nN: 39610.50\n. 7.0 mg/dl for man;\n. 6.0 mg/dl for woman\n12 N:105.68631.9months;\nH:100.78633.8 months\nY age, sex, postoperative recovery\npattern, the presence of diabetes or\nhypertension, BMI,retransplantation,\ndonor type, HLA mismatch number,\nimmunosuppressant type, and acute\nrejection episodes, TA-eGFR\n9\nZou 2010 China Co,R 58/84 NS\n. 420 umol/l for man and\n. 380 umol/l for woman\n12 34 for 1 year; 42 for\n2 years;140 for 3 years\nNS unadjusted 7\n29/54 12\nHaririan 2010 U.S Co,R 45/167 H: 50.5612.9\nN: 47.2613.9\n. 7.0 mg/dL for man and\n.6.5 mg/dL for woman\n12 68.3627.2 months Y age, retransplantation,diabetes\nand induction\n8\nKarbowska 2009 Poland Co,R 48/30 47.8/45.3 NS NS H:30.5 months\nN: 32.0 months\nY unadjusted 8\nAkalin 2008 Canada Co,P 144/163 H: 50.061.0\nN: 47.761.0\n. 7.0 mg/dL for man and\n.6.5 mg/dL for woman\n6 mean 4.3 years Y age, race, sex, eGFR, having received a\ncadaveric transplant, and cyclosporin use.\n8\nBandukwala\n2009\nCanada Co,R 180/225 H: 50.2611\nN: 50.3612\n.7.1 mg/dl for man and\n.6.1 mg/dl for woman\nNS N: 6.066 years\nH: 7.366years\nY unadjusted 8\nKim 2010 Korea Co,R 55/301 H: 36.8610.8\nN: 39.7610.3\n.7.0 mg/dl for man and\n.6.0 mg/dl for woman\n6 102.63627.25months Y unadjusted 8\nMin 2009 Korea Co,P 24/97 H: 41.2612.3\nN: 39.8612.2\n.8.0 mg/dl for\nboth man and woman\n12\n,5years Y unadjusted 8\nGerh0ardt\nU 1999\nGerman Co,P 80/268 41.1612.78\n. 8.1 mg/dL for man and\n. 6.1 mg/dL for woman\nNS 5years Y unadjusted 9\nAkgul2007 Turkey Co,P 54/79 34.769.9\n.7.0 mg/dl for man and\n.6.0 mg/dl for woman\nNS 3years NS unadjusted 8\nAbdelrahman\n2002\nSaudi\nArabia\nCo,P 25/20 NS\n.8.0 mg/dl for man and\n.6.0 mg/dl for woman\nNS 8.964.6 years Y unadjusted 7\nNS: not stated; N: normal uric acid group; H: hyperuricemia group; eGFR: estimated glomerular filtration rate; SCr: serum creatinine; Co: cohort study; R: retrospective; P: prospective; PRA: pane-reactive antibody.\ndoi:10.1371/journal.pone.0039457.t001\nHyperuricemia with Kidney Transplantation\nPLoS ONE | www.plosone.org 3 June 2012 | Volume 7 | Issue 6 | e39457\n\nkidney function more or less, including age, race, sex, diabetes,\ntumor, and medicines.\nWe assessed the quality of included studies critically using\nNEWCASTLE – OTTAWA quality assessment scale. Two studies\n[16,20] scored 9; two studies [17,18] scored 7; the rest scored 8\n(table1). The subjects of all included studies were patients with\nintact renal function for half a year after transplantation. Patients\nwith hyperuricemia or normal serum uric acid level were\ncomparable in baselines except 2 studies [17,18] which did not\nreport the relevant information. All studies except two [23,26]\ndescribed the definition of hyperuricemia. The follow-up of each\nstudy was more than 1 year and the drop-out was described.\nHyperuricemia with eGFR\nA total of 8 studies [15,17,19,21,22,23,24,25] provided data on\neGFR of RTRs with hyperuricemia versus normouricemia. There\nwas significant heterogeneity among studies (I\n2= 95%,\np,0.00001). Random-effects meta-analysis showed that RTRs\nwith hyperuricemia had significantly lower eGFR than those with\nnormal serum uric acid level (MD = 211.24, 95% CI\n216.34,26.14) (Figure 2).\nWe performed a subgroup analysis by pooling prospective and\nretrospective studies separately and the results showed that there\nwere significant heterogeneity among both prospective cohort\nstudies (I2= 93%, p,0.0001) and retrospective cohort studies\n(I\n2= 85%, p,0.00001). Random-effects meta-analysis showed that\nRTRs with hyperuricemia in both prospective and retrospective\nstudies had significantly lower eGFR than those with normal\nserum uric acid level although the effect size of prospective cohort\nstudies (MD = 214.86, 95% CI 222.10,27.63) was larger than\nthat of retrospective cohort studies (MD = 29.99, 95% CI\n215.00,24.98) (Figure 2).\nSensitivity analysis was performed by removing 3 studies\n[22,23,24] with distinctive definition of hyperuricemia, there was\nsignificant heterogeneity among studies (I\n2= 95%, p ,0.00001).\nRandom-effects meta-analysis still showed that RTRs with\nhyperuricemia had significantly lower eGFR than those with\nnormal serum uric acid level (MD = 213.48, 95% CI\n219.15,27. 81).\nA random model meta-regression analysis was performed using\nthe indicators of follow-up, race, definition of hyperuricemia, study\ntype (P = 0.0016). This led to a relative decrease in heterogeneity\n(R2= 100%) with the residual of 0.00%. Meta-regression analysis\ndisclosed significant interactions between race (b = 28.492514,\nP = 0.002), study type (b = 5.035018, P = 0.013), definition of\nhyperuricemia (b = 10.0255, P = 0.006), and follow-up\n(b = 13.37142, P = 0.002).\nHyperuricemia with SCr\nWe pooled the data of SCr of RTRs with hyperuricemia versus\nnormouricemia in 5 studies [18,20,21,22,23]. There was no\nheterogeneity among these studies (I\n2= 44%, P = 0.13). Fixed￾effect model meta-analysis showed that RTRs with hyperuricemia\nhad significant higher SCr than those with normal serum uric acid\nlevel (MD = 0.24, 95%CI 0.17,0.31) (Figure 3).\nFigure 2. Association of hyperuricemia with eGFR of renal transplant recipients.\ndoi:10.1371/journal.pone.0039457.g002\nFigure 3. Association of hyperuricemia with SCr of renal transplant recipients.\ndoi:10.1371/journal.pone.0039457.g003\nHyperuricemia with Kidney Transplantation\nPLoS ONE | www.plosone.org 4 June 2012 | Volume 7 | Issue 6 | e39457\n\nHyperuricemia with CAN\nThe number of patients who developed CAN during the follow￾up was available in 4 studies [19,20,21,22]. There was no\nstatistical significant heterogeneity among these studies (I\n2= 26%,\np = 0.26). Fixed-effect model meta-analysis showed that RTRs\nwith hyperuricemia had significantly higher risk of developing\nCAN than those with normal serum uric acid level (unadjusted\nOR = 2.85, 95%CI 1.85,4.38) (Figure 4).\nTwo studies [19,24] reported the adjusted hazard ratio (aHR) of\nhyperuricemia with CAN of RTRs. There was no heterogeneity\namong the studies (I\n2= 0.0%, P = 0.444). Fixed-effect model meta￾analysis showed that hyperuricemia was an independent risk factor\nof CAN of RTRs (aHR = 1.65, 95%CI 1.02,2.65) (Table 2).\nHyperuricemia with Graft Loss\nThree studies [15,16,22] reported the number of patients who\nsuffered from graft loss. There was no heterogeneity among the\nstudies(I\n2= 0%, P = 0.79). Fixed-effect model meta-analysis\nshowed that RTRs with hyperuricemia had significantly higher\nrisk of graft loss than those with normal serum uric acid level\n(unadjusted OR = 2.29, 95%CI 1.55,3.39) (Figure 5).\nThree studies [15,22,24] reported the aHR of hyperuricemia\nwith graft loss of RTRs. There was no heterogeneity among the\nstudies(I\n2= 0.0%, P = 0.949). Fixed-effect model meta-analysis\nshowed that hyperuricemia was an independent risk factor of\ngraft loss of RTRs (aHR = 2.01, 95%CI 1.39,2.94) (Table 2).\nThree studies [15,22,26] reported the aHR of increase 1 mg/dl\nuric acid with graft loss of RTRs. There was no heterogeneity\namong the studies (I\n2= 0.0%, P = 0.649). Fixed-effect model meta￾analysis showed that uric acid was positively associated with graft\nloss of RTRs independently (aHR = 1.21, 95%CI 1.08,1.37)\n(Table 2).\nDiscussion\nRelationship of Hyperuricemia with Kidney Function of\nRTRs\nStudies reported that UA may induce graft dysfunction, chronic\nallograft nephropathy and accelerate the progress of the chronic\nkidney disease through triggering inflammation, affecting vascular\nendothelial function and inducing microvascular injury. Intracel￾lular uric acid could trigger oxidative stress reaction; activate\ninflammatory mediators such as interleukin-6, tumor necrosis\nfactor-a, C-reactive protein [3,4,9,10] and renin-angiotensin\nsystems that finally lead to vascular endothelial dysfunction and\nmicrovascular injury [27,28].\nOur review found that eGFR in the hyperuricemia group was\nsignificantly lower than that in normouricemia group while the\nSCr level in the hyperuricemia group was significantly higher than\nthat in normouricemia group. Both unadjusted and adjusted\npooled effect size showed that the incidence rate of CAN and graft\nloss in hyperuricemia group was significantly higher than that in\nthe normouricemia group, implying that hyperuricemia may be an\nindependent risk factor of graft dysfunction and could modestly\nincrease the risk of poor outcomes of kidney transplant receptors.\nFigure 4. Relative risk of hyperuricemia with chronic allograft nephropathy.\ndoi:10.1371/journal.pone.0039457.g004\nTable 2. Adjusted hazard ratio of hyperuricemia with graft loss, chronic allograft nephropathy (CAN).\nOutcome included study Variable type aHR (95%CI) heterogeneity meta analysis\nI\n2\n, P-value aHR (95%CI)\nhyperuricemia with graft loss Min 2009 DV 2.01(1.09–3.72) 0.00%, 0.949 2.01 (1.39–2.94)\nHaririan2010 DV 1.92(1.1–3.4)\nChung2010 DV 2.3(0.9–5.8)\nhyperuricemia with CAN Akalin2008 DV 1.28(0.57–2.84) 0.00%, 0.444 1.65 (1.02–2.65)\nMin 2009 DV 1.89(1.05–3.43)\n1 mg/dl increase of UA with graft loss Haririan2010 CV 1.26(1.03–1.53) 0.00%, 0.649 1.21 (1.08–1.37)\nHaririan2011 CV 1.14(0.95–1.36)\nChung2010 CV 1.30(1.0–1.7)\nDV: dichotomous variable; CV: continuous variable; aHR:adjusted hards ratio.\ndoi:10.1371/journal.pone.0039457.t002\nHyperuricemia with Kidney Transplantation\nPLoS ONE | www.plosone.org 5 June 2012 | Volume 7 | Issue 6 | e39457\n\nClinical trials about the effects of urate-lowering therapy on\nkidney transplant recipients can provide direct evidence that\nhigher uric acid is an independent risk factor of poor prognosis of\nrenal transplant recipients. RCT performed by Goicoechea et al\nsuggested that urate-lowering therapy slowed down renal disease\nprogression of patients with chronic kidney disease (In the control\ngroup, eGFR decreased 3.3 6 1.2 ml/min per 1.73 m(2), and in\nthe allopurinol group, eGFR increased 1.36 1.3 ml/min per\n1.73 m(2) after 24 months) [29]. However, there are only 2 trials\n[30,31] reported the effects of urate-lowering therapy on kidney\ntransplant patients. Navascues et al reported that it is safe to use\nallopurinol to low hyperuricemia of kidney transplant recipients,\nbut the SCr didn’t change significantly after treat￾ment(2.3560.92 mg/dl vs. 2.3961.03 mg/dl) [31]. Flury et al\ncompared the effects of allopurinol vs. benzbromarone in the\ntreatment of hyperuricemia after kidney transplantation, both\ndrugs effectively lowered serum uric acid concentrations by 19%\nvs. 35% of pretreatment values [30]. Unfortunately, there is no\nevidence to suggest that the allograft function of patients with\nurate-lowering therapy is better than that of kidney transplant\nrecipients without urate-lowering drug. Therefore, high quality\nevidence is needed to show that decreased uric acid level is related\nto good prognosis of kidney transplant recipients.\nHyperuricemia and Graft Dysfunction, Cause or Effects?\nKidney is an important metabolic pathway of uric acid. When\nkidney function is compromised, the excretion of uric acid\ndecreases while the level of serum uric acid increases. One study\nreported that renal dysfunction is associated with higher UA levels,\nbut higher UA levels is not parallel with the progression of renal\ndysfunction independently after kidney transplantation [32]. Min\net al found that recipients in the early-onset hyperuricemia (within\n1 year after transplantation) had a stable graft function. The eGFR\nare 58.7610.8, 58.9611.5 and 58.8610.7 ml/min/1.73 m2\n,\nrespectively at detection of hyperuricemia, at 6 months post￾detection, and at 12 months post-detection [24]. Chung et al\nfound that UA-level of RTRs increased from 5.361.9 mg/dl to\n6.361.7 mg/dl within 3 months post-transplant, but the eGFR\ndidn’t change significantly. The 1-year eGFR was significantly\nlower in the hyperuricemic group (68.3 86 20.4 ml/min/1.73 m2\n)\nthan that in the normouricemic group (77.9 8619.2 ml/min/\n1.73 m2\n) (p = 0.000) [15]. Haririan et al found that RTRs with\nhyperuricemia during early post transplant period had significantly\nhigher 1-year SCr, lower eGFR, and worse graft survival when\ncompared with those with normal mean 6-month UA values [22].\nThe results of above studies in combination with our meta-analysis\nindicated that hyperuricemia may be an independent risk factor of\ngraft dysfunction and may affect the life span of recipients of\nkidney transplantation.\nDose-response Association of Uric Acid Level with Graft\nFunction\nMin et al found that early-onset moderate-to-severe hyperuri￾cemia (defined as UA$8.0 mg/dl) was found to be a significant\nrisk factor for CAN (P = 0.035) and a poorer graft survival\n(P = 0.026) by multivariate analysis, but not mild hyperuricemia.\nIn moderate-to-severe hyperuricemia group, the mean\neGFRMDRD (Modification of Diet in Renal Disease) at the\nfourth post-transplant year were significantly lower than those at\n1 year post-transplant(53.7615.2 vs. 61.9612.5). The impact of\nhyperuricemia on RTRs was dependent on the duration of\nexposure. Likewise, the detrimental effect of early-onset hyperuri￾cemia on the graft function was dependent on UA-level and\nexposure time. After control of the baseline graft function by\nanalysis of only recipients with a good graft function at 1 year post￾transplantation (eGFR . 60 ml/min), moderate-to-severe early￾onset hyperuricemia was also a marker of long-term graft\ndysfunction and failure [24]. Haririan et al found that higher\nUA level had significant higher risk of graft loss compared to lower\nUA level. Each 1 mg/dL increase of UA level was associated with\na 15% increase on average in the risk of graft loss during the study\nperiod and seemed to be associated with increased risk of death\n[26]. These two studies suggested that both higher UA-level and\nlonger duration of exposure have severe impacts on graft function.\nAdvantages and Limitations\nThis meta-analysis has some advantages. First, the samples of\nincluded cohort studies came from Korea, China, Canada,\nPoland, Saudi Arabia, Turkey, USA and German that would\nhave a good representative of race. Second, the effect of\nHyperuricemia on renal function is consistent regardless of\nwhether other confounding factors were adjusted or not. Third,\nthe included studies have moderate to high quality and good\ninternal validity.\nLimitations of this study should be noted. First, the included\nstudies had potential risk of bias due to differences in complete\nreporting of follow-up and judgment of outcomes. Second,\nalthough included study adjusted confounding factors relevant to\nrenal function more or less, the number and types of adjusted\nfactors were different. There are maybe residual confounding\nfactors which have effects on outcomes. However, the pooled\nestimates found that no matter confounding factors adjusted or un￾adjusted, no matter how many confounding factors were adjusted,\nthe conclusion that hyperuricemia is a risk factor of graft\ndysfunction and poor prognosis is consistent. Third, as the sample\nFigure 5. Unadjusted odds ratio (OR) of hyperuricemia with graft loss.\ndoi:10.1371/journal.pone.0039457.g005\nHyperuricemia with Kidney Transplantation\nPLoS ONE | www.plosone.org 6 June 2012 | Volume 7 | Issue 6 | e39457\n\nsize of this meta-analysis was small, we can’t get the definitive\nconclusions. Fourth, our review only included studies which have\nbeen published in English or Chinese and did not search grey\nliterature, publication bias may exist. We could not assess the\npublication bias precisely due to the limited number of included\nstudies for each outcome (,10).\nConclusions and Implications for Clinical Practice and\nResearch\nOur systematic review shows that hyperuricemia has effects on\neGFR and SCr of RTRs and hyperuricemia may be an\nindependent risk factor of CAN and graft loss. Because this\nreview is based on observational studies, the number of included\nstudies and the sample size are limited and uric acid lowering\ndrugs have potential bad effects on kidney function, the\napplication of uric acid lowering drugs for RTRs with hyperuri￾cemia is not yet routinely recommended. Future cohort studies\nneed pay more attention to the representative of study people, the\ncomparable baselines of different groups, the adjustment of\nconfounding factors, long-term follow-up and assessment of\noutcomes. High quality clinical trials are needed to verify whether\nreducing the serum uric acid level can delay the kidney\ndysfunction after kidney transplantation, the process of chronic\nallograft nephropathy and the death of RTRs, and to provide basis\nfor the reasonable application of uric acid lowering drugs.\nAuthor Contributions\nConceived and designed the experiments: YH JL . Performed the\nexperiments: YH YLL. Analyzed the data: YH LW. Wrote the paper:\nYH HH WMY JL.\nReferences\n1. Hashmi S, Poommipanit N, Kahwaji J, Bunnapradist S (2007) Overview of renal\ntransplantation. Minerva Medica 98: 713–729.\n2. Karthikeyan V, Karpinski J, Nair RC, Knoll G (2004) The Burden of Chronic\nKidney Disease in Renal Transplant Recipients. American Journal of\nTransplantation 4: 262–269.\n3. Kato M, Hisatome I, Tomikura Y, Kotani K, Kinugawa T, et al. (2005) Status\nof Endothelial Dependent Vasodilation in Patients With Hyperuricemia. The\nAmerican Journal of Cardiology 96: 1576–1578.\n4. Khosla UM, Zharikov S, Finch JL, Nakagawa T, Roncal C, et al. (2005)\nHyperuricemia induces endothelial dysfunction. Kidney International 67: 1739–\n1742.\n5. Gersch C, Palii SP, Kim KM, Angerhofer A, Johnson RJ, et al. (2008)\nInactivation of nitric oxide by uric acid. Nucleosides, Nucleotides & Nucleic\nAcids 27: 967–978.\n6. Kanellis J, Watanabe S, Li JH, Kang DH, Li P, et al. (2003) Uric acid stimulates\nmonocyte chemoattractant protein-1 production in vascular smooth muscle cells\nvia mitogen-activated protein kinase and cyclooxygenase-2. Hypertension 41:\n1287–1293.\n7. Kang DH, Han L, Ouyang X, Kahn AM, Kanellis J, et al. (2005) Uric acid\ncauses vascular smooth muscle cell proliferation by entering cells via a functional\nurate transporter. American Journal of Nephrology 25: 425–433.\n8. Mazzali M, Kanellis J, Han L, Feng L, Xia YY, et al. (2002) Hyperuricemia\ninduces a primary renal arteriolopathy in rats by a blood pressure-independent\nmechanism. American Journal of Physiology - Renal Physiology 282: F991–\nF997.\n9. Kang DH, Park SK, Lee IK, Johnson RJ (2005) Uric acid-induced C-reactive\nprotein expression: implication on cell proliferation and nitric oxide production\nof human vascular cells. Journal of the American Society of Nephrology 16:\n3553–3562.\n10. Ruggiero C, Cherubini A, Ble A, Bos AJ, Maggio M, et al. (2006) Uric acid and\ninflammatory markers. European Heart Journal 27: 1174–1181.\n11. Kodama S, Saito K, Yachi Y, Asumi M, Sugawara A, et al. (2009) Association\nbetween serum uric acid and development of type 2 diabetes. Diabetes care 32:\n1737–1742.\n12. Mazzali M (2005) Uric acid and transplantation. [Review] [66 refs]. Seminars in\nNephrology 25: 50–55.\n13. Yu-lin L, Ling W, Jing L, Yan H, Wen-ming Y (2011) The correlation between\nuric acid and the incidence and prognosis of kidney diseases: a systematic review\nand meta-analysis of cohort studies. CHINESE JOURNAL OF INTERNAL\nMEDICINE 50: 555–561.\n14. Siu YP, Leung KT, Tong MK, Kwan TH (2006) Use of allopurinol in slowing\nthe progression of renal disease through its ability to lower serum uric acid level.\nAmerican Journal of Kidney Diseases 47: 51–59.\n15. Chung BH, Kang SH, Hwang HS, Choi BS, Park CW, et al. (2011) Clinical\nsignificance of early-onset hyperuricemia in renal transplant recipients. Nephron\n- Clinical Practice 117: c276–c283.\n16. Gerhardt U, Huttmann MG, Hohage H (1999) Influence of hyperglycemia and\nhyperuricemia on long-term transplant survival in kidney transplant recipients.\nClinical Transplantation 13: 375–379.\n17. Zou GM, Sui WG, Yan Q, Che WT, Chen HZ, et al. (2010) Influence of\nhyperuricemia on long-term renal allograft function after renal transplantation*\nis it a factor of chronic renal allograft dysfunction? Journal of Clinical\nRehabilitative Tissue Engineering Research 14: 923–927.\n18. Abdelrahman M, Rafi A, Ghacha R, Youmbissi JT, Qayyum T, et al. (2002)\nHyperuricemia and gout in renal transplant recipients. Renal Failure 24: 361–\n367.\n19. Akalin E, Ganeshan SV, Winston J, Muntner P (2008) Hyperuricemia is\nassociated with the development of the composite outcomes of new\ncardiovascular events and chronic allograft nephropathy. Transplantation 86:\n652–658.\n20. Akgul A, Bilgic A, Ibis A, Ozdemir FN, Arat Z, et al. (2007) Is uric acid a\npredictive factor for graft dysfunction in renal transplant recipients? Transplan￾tation Proceedings 39: 1023–1026.\n21. Bandukwala F, Huang M, Zaltzman JS, Nash MM, Prasad GVR (2009)\nAssociation of uric acid with inflammation, progressive renal allograft\ndysfunction and post-transplant cardiovascular risk. American Journal of\nCardiology 103: 867–871.\n22. Haririan A, Noguiera JM, Zandi-Nejad K, Aiyer R, Hurley H, et al. (2010) The\nindependent association between serum uric acid and graft outcomes after\nkidney transplantation. Transplantation 89: 573–579.\n23. Karbowska A, Boratynska M, Kusztal M, Klinger M (2009) Hyperuricemia is a\nmediator of endothelial dysfunction and inflammation in renal allograft\nrecipients. Transplantation Proceedings 41: 3052–3055.\n24. Min SI, Yun IJ, Kang JM, Park YJ, Min SK, et al. (2009) Moderate-to-severe\nearly-onset hyperuricaemia: a prognostic marker of long-term kidney transplant\noutcome. Nephrology Dialysis Transplantation 24: 2584–2590.\n25. Kim KM, Kim SS, Han DJ, Yang WS, Park JS, et al. (2010) Hyperuricemia in\nkidney transplant recipients with intact graft function. Transplantation\nProceedings 42: 3562–3567.\n26. Haririan A, Metireddy M, Cangro C, Nogueira JM, Rasetto F, et al. (2011)\nAssociation of serum uric acid with graft survival after kidney transplantation: a\ntime-varying analysis. American Journal of Transplantation 11: 1943–1950.\n27. Corry DB, Eslami P, Yamamoto K, Nyby MD, Makino H, et al. (2008) Uric\nacid stimulates vascular smooth muscle cell proliferation and oxidative stress via\nthe vascular renin-angiotensin system. Journal of Hypertension 26: 269–275\n210.1097/HJH.1090b1013e3282f1240bf.\n28. Feig DI, Kang DH, Johnson RJ (2008) Medical progress: Uric acid and\ncardiovascular risk. New England Journal of Medicine 359: 1811–1821.\n29. Goicoechea M, de Vinuesa SG, Verdalles U, Ruiz-Caro C, Ampuero J, et al.\n(2010) Effect of allopurinol in chronic kidney disease progression and\ncardiovascular risk. Clinical Journal of The American Society of Nephrology:\nCJASN 5: 1388–1393.\n30. Flury W, Ruch HR, Montandon A (1977) [The treatment of hyperuricemia after\nkidney transplantation]. [German]. Schweizerische Medizinische Wochens￾chrift: Journal Suisse de Medecine.\n31. Navascues RA, Gomez E, Rodriguez M, Laures AS, Baltar J, et al. (2002) Safety\nof the allopurinol-mycophenolate mofetil combination in the treatment of\nhyperuricemia of kidney transplant recipients. Nephron 91: 173–174.\n32. Meier-Kriesche H-U, Schold JD, Vanrenterghem Y, Halloran PF, Ekberg H\n(2009) Uric acid levels have no significant effect on renal function in adult renal\ntransplant recipients: evidence from the symphony study. Clinical Journal of The\nAmerican Society of Nephrology: CJASN 4: 1655–1660.\nHyperuricemia with Kidney Transplantation\nPLoS ONE | www.plosone.org 7 June 2012 | Volume 7 | Issue 6 | e39457\n\n"], "response": "This study aimed to investigate the relationship between hyperuricemia and kidney function decline in renal transplant recipients. It analyzed data from nine previous studies involving a total of 783 patients who underwent renal transplantation. The study found that hyperuricemia was significantly associated with lower estimated glomerular filtration rates (eGFR) compared to patients with normal serum uric acid levels, both in prospective and retrospective cohorts. Additionally, hyperuricemia was found to be a predictor of chronic renal allograft dysfunction and graft failure. These findings suggest that hyperuricemia may negatively affect long-term kidney function in renal transplant recipients. Further studies are needed to confirm these results and explore potential mechanisms underlying this association."}
{"user_input": "What is the impact of macro/microsteatosis on post-transplant graft survival taking into account donor and other factors?", "retrieved_contexts": ["University of Groningen\nSystematic review on the treatment of deceased organ donors\nvan Erp, Anne C.; van Dullemen, Leon F. A.; Ploeg, Rutger J.; Leuvenink, Henri G. D.\nPublished in:\nTransplantation Reviews\nDOI:\n10.1016/j.trre.2018.06.001\nIMPORTANT NOTE: You are advised to consult the publisher's version (publisher's PDF) if you wish to cite from\nit. Please check the document version below.\nDocument Version\nPublisher's PDF, also known as Version of record\nPublication date:\n2018\nLink to publication in University of Groningen/UMCG research database\nCitation for published version (APA):\nvan Erp, A. C., van Dullemen, L. F. A., Ploeg, R. J., & Leuvenink, H. G. D. (2018). Systematic review on the\ntreatment of deceased organ donors. Transplantation Reviews, 32(4), 194-206.\nhttps://doi.org/10.1016/j.trre.2018.06.001\nCopyright\nOther than for strictly personal use, it is not permitted to download or to forward/distribute the text or part of it without the consent of the\nauthor(s) and/or copyright holder(s), unless the work is under an open content license (like Creative Commons).\nThe publication may also be distributed here under the terms of Article 25fa of the Dutch Copyright Act, indicated by the “Taverne” license.\nMore information can be found on the University of Groningen website: https://www.rug.nl/library/open-access/self-archiving-pure/taverne￾amendment.\nTake-down policy\nIf you believe that this document breaches copyright please contact us providing details, and we will remove access to the work immediately\nand investigate your claim.\nDownloaded from the University of Groningen/UMCG research database (Pure): http://www.rug.nl/research/portal. For technical reasons the\nnumber of authors shown on this cover page is limited to 10 maximum.\nDownload date: 06-11-2025\n\nSystematic review on the treatment of deceased organ donors\nAnne C. van Erp a,\n⁎,1\n, Leon F.A. van Dullemen a,1\n, Rutger J. Ploeg b\n, Henri G.D. Leuvenink a\na Department of Surgery, University Medical Centre Groningen, the Netherlands\nb Nuffield Department of Surgical Sciences, University of Oxford, United Kingdom\narticle info abstract\nBackground: Currently, there is no consensus on which treatments should be a part of standard deceased-donor\nmanagement to improve graft quality and transplantation outcomes. The objective of this systematic review was\nto evaluate the effects of treatments of the deceased, solid-organ donor on graft function and survival after trans￾plantation.\nMethods: Pubmed, Embase, Cochrane, and Clinicaltrials.gov were systematically searched for randomized con￾trolled trials that compared deceased-donor treatment versus placebo or no treatment.\nResults: A total of 33 studies were selected for this systematic review. Eleven studies were included for meta-anal￾yses on three different treatment strategies. The meta-analysis on methylprednisolone treatment in liver donors\n(two studies, 183 participants) showed no effect of the treatment on rates of acute rejection. The meta-analysis\non antidiuretic hormone treatment in kidney donors (two studies, 222 participants) indicates no benefit in the\nprevention of delayed graft function. The remaining meta-analyses (seven studies, 334 participants) compared\nthe effects of 10 min of ischaemic preconditioning on outcomes after liver transplantation and showed that isch￾aemic preconditioning improved short-term liver function, but not long-term transplant outcomes.\nConclusions: There is currently insufficient evidence to conclude that any particular drug treatment or any inter￾vention in the deceased donor improves long-term graft or patient survival after transplantation.\n© 2018 The Authors. Published by Elsevier Inc. This is an open access article under the CC BY-NC-ND license\n(http://creativecommons.org/licenses/by-nc-nd/4.0/).\nKeywords:\nSystematic review\nDeceased donor\nBrain death\nOrgan\nTreatment\nManagement\n1. Introduction\nDue to the persistent shortage of organs available for solid organ\ntransplantation [1], the transplant community has been searching for\npossibilities to further expand the donor pool. One way to achieve this\nis by accepting organs retrieved from older and higher risk donors,\nwithout compromising good transplantation outcomes. Improving\nquality of suboptimal organs from donors after brain death (DBD),\nolder expanded-criteria donors (ECD), or donors after circulatory\ndeath (DCD) mandates better assessment and optimisation prior to\ntransplantation. These donors have all suffered cerebral injury, which\nleads to a profound systemic inflammatory response [2, 3]. Further￾more, DBD and DCD donors face additional disturbances that threaten\nthe quality of the future organ grafts.\nIn DBD donors, an increased intracranial pressure impairs brain per￾fusion and causes herniation of the brain stem. This results in the release\nof catecholamines and a cascade of derangements that lead to endothe￾lial dysfunction and inflammation in the potential grafts-to-be [4, 5]. In\naddition, the function of the hypothalamus and pituitary gland becomes\nimpaired, which leads to decreased cortisol, triiodothyronine (T3), insu￾lin, and antidiuretic hormone (ADH) plasma levels in the donor [6, 7].\nAfter herniation of the brain stem, a haemodynamically unstable state\nwill follow that requires fluid resuscitation and often inotropic support.\nIn DCD donors, there is no catecholamine release. Instead, withdrawal of\nmedical support results in a significant blood pressure drop until circu￾latory arrest. This period of circulatory arrest is followed by a in most\ncountries medico-legal five-minute no-touch period prior to confirma￾tion of death, which adds extra warm ischaemic injury and threatens\nthe quality of the potential grafts. In addition to these donor-related in￾juries, the grafts-to-be subsequently endure a period of preservation\nand cold ischaemia that are further detrimental to the organ quality.\nTo improve transplant outcomes in solid organ transplantation, an\noptimised and more organ-protective Intensive Care regimen should\nTransplantation Reviews 32 (2018) 194–206\nAbbreviations: ADH, Antidiuretic Hormone; AF, Alkaline phosphatase; AST,\nAspartate Transaminase; ALT, Alanine Aminotransferase; CI, Confidence Interval;\nDBD, Donation after Brain Death; DCD, Donation after Circulatory Death; DGF,\nDelayed Graft Function; ECD, Expanded Criteria Donors; ɣGT, Gamma-glutamyl\nTranspeptidase; HD, Haemodialysis; HF, Haemofiltration; HES, Hydroxyethyl Starch;\nINR, International Normalised Ratio for Prothrombin Time (PT); IPC, Ischaemic\nPreconditioning; IRI, Ischaemia-Reperfusion Injury; LDH, Lactate Dehydrogenase;\nLVAD, Left Ventricular Assist Device; MD, Mean Difference; MTH, Mild Therapeutic\nHypothermia; PEEP, Positive End-Expiratory Pressure; RCT, Randomized Controlled\nTrial; ROS, Reactive Oxygen Specie; T3, Triiodothyronine; TV, Tidal Volume.\n⁎ Corresponding author at: Surgical Research Laboratory, CMC V Y2144, HPC: BA44,\nHanzeplein 1, 9713 GZ Groningen, the Netherlands.\nE-mail addresses: a.c.van.erp@umcg.nl (A.C. van Erp),\nleonvandullemen@gmail.com (L.F.A. van Dullemen), rutger.ploeg@nds.ox.ac.uk\n(R.J. Ploeg), h.g.d.leuvenink@umcg.nl (H.G.D. Leuvenink). 1 Authors contributed equally.\nhttps://doi.org/10.1016/j.trre.2018.06.001\n0955-470X/© 2018 The Authors. Published by Elsevier Inc. This is an open access article under the CC BY-NC-ND license (http://creativecommons.org/licenses/by-nc-nd/4.0/).\nContents lists available at ScienceDirect\nTransplantation Reviews\njournal homepage: www.elsevier.com/locate/trre\n\nbe adopted. In the last decade, such a strategy has increasingly become\nimportant since donor age and comorbidities have increased signifi￾cantly in most countries. In deceased donor care, this has led to the con￾sideration of numerous treatment options aspiring improvement of\ngraft function and survival after transplantation. Unfortunately, clinical\nimplementation has not happened, whilst a lot of controversy still exists\nabout which treatment could actually benefit donor organs potentially\nimproving transplant outcomes.\nThe purpose of this systematic review is to provide an update on all\nsystematically tested clinical interventions in the deceased donor and\ntheir impact on graft function and/or survival following solid organ\ntransplantation. This review will concern any clinical treatment regi￾men that was carried out in either DBD or DCD donors using either spe￾cific drugs, fluids, or procedures to reduce donor organ injury prior to\norgan preservation and transplantation.\n2. Materials and methods\n2.1. Selection criteria\nRCTs or quasi-RCTs (trials in which the allocation method is not truly\nrandom) were selected that compared differences in graft function and\nsurvival between pre organ retrieval-treated, deceased, adult (16 years\nor older) solid-organ donors (including DCD, DBD, and ECD donors) to\nuntreated or placebo-controlled donors. Primary outcomes for this sys￾tematic review were graft function and patient and graft survival. Sec￾ondary outcome parameters were surrogate markers of organ injury.\nExclusion criteria for this systematic review were 1. articles not in\nEnglish; 2. duplicate studies; 3. living donors; 4. average donor age b\n16 years old; 5. studies with pregnant participants; 6. animal studies;\n7. tissue transplantation; 8. donor treatment after graft procurement;\n9. ex-situ treatment of the graft; 10. treatment of the recipient; and\n11. no information on organ function or survival.\n2.2. Search methods for identification of studies\nThis systematic review was performed according to the Preferred\nReporting Items for Systematic Reviews and Meta-Analyses (PRISMA)\nguidelines [8]. Potential RCTs were identified using electronic and man￾ual search strategies. The final electronic literature searches were per￾formed in Pubmed (5 Nov 2016), Embase (5 Nov 2016), and the\nCochrane library (7 Nov 2016). The ClinicalTrials.gov register was also\nsearched (7 Nov 2016) to identify unpublished or ongoing trials. The\nsearch was limited to RCTs with a highly sensitive search-strategy filter.\nThe bibliographies of identified studies and reviews were manually\nsearched for additional trials. A qualified librarian reviewed the final\nsearch strategy. The search strategy for each consulted database is avail￾able in the supplementary data (Fig. S1, Table S1 and S2).\n2.3. Data extraction and validity assessment\nAll identified records were screened on title and abstract after re￾moval of duplicates with an algorithm provided by Refworks\n(ProQuest-LCC, USA). Full articles of selected records were retrieved\nand assessed for eligibility; disagreements were resolved by consensus.\nAbstracts not providing information on the study type or outcome pa￾rameters were retrieved for full-text evaluation. Study information\nwas extracted independently by two reviewers. The risk of bias assess￾ment was performed according to the Cochrane risk of bias tool [9]. The\nassessment of study quality included random sequence generation, allo￾cation concealment, performance bias, detection bias, attrition bias,\nreporting bias, and “other” bias. Quality assessments were performed\nindependently and disagreements were resolved through discussion.\n2.4. Data synthesis\nOutcome parameters of interest for all transplanted solid organs\nwere: patient and graft survival; development of primary dysfunction,\nsometimes subdivided in either primary non-function or initial poor\nfunction; acute rejection; Intensive Care Unit (ICU) or hospital stay;\nand post-operative complications (such as post-operative infections or\nbiliary complications, Table 1). Organ-specific parameters of interest\nwere: creatinine clearance, serum creatinine, and delayed graft function\n(DGF, measured as the need for renal replacement therapy including\nhaemodialysis (HD) or haemofiltration (HF) in the first week post trans￾plantation) (kidney); aspartate transaminase (AST), alanine amino￾transferase (ALT), albumin, alkaline phosphatase (AF), bilirubin,\ngamma-glutamyl transpeptidase (ɣGT), and lactate dehydrogenase\n(LDH) levels, and International Normalised Ratio(INR) (liver); left ven￾tricular function, and left ventricular assist device (LVAD) and HF re￾quirement (heart); and PaO2/FiO2 ratio, compliance (plateau pressure\nat the end of respiration), and organ utilization rates as an indirect\nway of assessing graft function (lung). Qualitative assessment was per￾formed for single studies that could not be grouped for meta-analyses.\nFor studies that could be grouped, a forest plot was constructed to assess\nthe heterogeneity, using Cochran's Q test and the I2\n-test (considered\nsignificant when p b .1 or I2 N 30%). A random-effects analysis model\nwas applied, followed by the Mantel-Haenszel test to calculate cumula￾tive relative risk ratios for dichotomous variables. As no more than four\nstudies were included per meta-analysis, funnel plot analyses could not\nbe constructed to distinguish potential asymmetry. All statistical analy￾ses were performed with Review Manager v5.3 (The Cochrane Collabo￾ration 2014).\n3. Results\n3.1. Literature search and summary of included studies\nFrom 7309 hits in total, 62 studies were assessed. As 29 studies\nfailed to meet our inclusion criteria, a total of 33 articles were in￾cluded in this systematic review (Fig. 1, Table 1, Table S3). Even\nthough the search strategy was aimed towards all solid organs,\nonly studies on kidney, liver, heart, and lung transplantations were\nfound. In addition, we identified 13 trials that were still ongoing or\ndid not yet publish results (Table 2). As none of the included studies\ninvolved interventions in DCD donors, this systematic review de￾scribes only trials in DBD donors.\nThe following treatment strategies for DBD donors were identified:\nanti-oxidant treatment [10–13], enteral feeding [14], organ retrieval\ntechniques [15, 16], haemodynamic support [17–24], mild therapeutic\nhypothermia (MTH) [25], immunosuppressants [26–31], ischaemic pre￾conditioning (IPC) [32–39], a lung protection strategy [40, 41], and T3\nadministration [42]. Table 1 shows a summary of these included studies,\nwhile Table S4 shows the risk of bias for these trials. In 16 studies, the\nmethods for patient selection and allocation concealment were ade￾quately performed and described. Eight studies used a placebo-con￾trolled group, whereas the remaining studies had either non￾treatment groups (n = 20) or compared the intervention to a conven￾tional treatment (n = 5).\n3.2. Studies that could not be included for meta-analyses\nTwenty-two studies [10–18, 21–28, 31, 32, 40–42] were not in￾cluded for meta-analyses because the type of intervention or outcome\nparameter could not be compared to other trials included in this review.\nNone of the studies reported a significant effect of the treatment or in￾tervention on ICU or hospital stay.\nFour studies tested effects of anti-oxidant treatments in DBD do￾nors on graft function [10–13]. Treatments with N-acetylcysteine\n[12] and L-alanyl-glutamine [10] showed no effects following kidney\nA.C. van Erp et al. / Transplantation Reviews 32 (2018) 194–206 195\n\nand liver transplantation, respectively. Studies on Ascorbic acid\ntreatment [11] and donor ventilation with sevoflurane [13] showed\nimproved short-term liver function but did not report effects on pa￾tient or graft survival.\nTwo trials investigated two different hepatic retrieval techniques.\nChui et al. [15] showed no differences between single (aortic) or double\n(aortic and portal) perfusion on liver and kidney transplantation out￾comes, whilst D'Amico et al. [16] showed superiority of the double per￾fusion technique, evidenced by improved short-term liver function,\nlower rates of re-transplantation, and improved six-month graft and pa￾tient survival.\nSix out of eight studies on hemodynamic support of the deceased\ndonor could not be grouped for meta-analyses [17, 18, 21–24]. Dopa￾mine treatment improved long-term graft survival after heart [18], but\nnot kidney transplantation [17], despite a reduced incidence of DGF of\nrenal organ grafts [17]. Prostaglandin I2 treatment improved short￾term liver function, but failed to improve patient or graft survival [21].\nProtocolised fluid administration did not alter recipient survival after\nsolid organ transplantation [22]. The use of the colloid hydroxyl-ethyl\nstarch (HES) (of unknown molecular weight) did not affect liver func￾tion following transplantation [23]; treatment with low molecular\nweight-HES did increase rates of DGF following renal transplantation\n[24].\nFour out of six trials on the use of immunosuppressive drugs could\nnot be clustered. Administration of neither methylprednisolone and cy￾clophosphamide [27, 28], nor cyclophosphamide [31], nor prednisolone\n[26] improved renal transplantation outcomes.\nOf the seven studies found on IPC treatment in liver donors, the only\nstudy investigating five minutes of IPC showed no benefits following\nliver transplantation.\nThe remaining trials investigated possible clinical benefits of enteral\nfeeding [14], MTH [25], albuterol [41] or T3 [42] administration, and a\nprotective lung ventilation strategy [40]. Neither enteral feeding [14],\nnor albuterol administration [41], nor protective lung ventilation [40]\nimproved survival rates of recipients after heart, lung, liver, or kidney\ntransplantations. MTH decreased the incidence of DGF after kidney\ntransplantation [25]. Lastly, T3 administration did not improve liver\nfunction following transplantation [42].\n3.3. Studies included for meta-analyses\nEleven studies were identified for further meta-analyses. None of the\nstudies that were included for meta-analyses reported a significant ef￾fect of the treatment or intervention on ICU or hospital stay. The\nmeta-analysis on the effects of donor treatment with ADH included\n222 participants [19, 20] and showed no difference in the development\nof DGF after kidney transplantation between treated and untreated DBD\ndonors (Fig. 2).\nThe meta-analysis on donor methylprednisolone treatment versus\nplacebo or no treatment included a total of 183 participants [29, 30]\nand showed similar acute rejection rates of liver grafts retrieved from\ndonors treated either with or without methylprednisolone (Fig. 3).\nTen meta-analyses were included on the effects of 10 min of IPC\nversus no treatment in the liver, with a total of 335 participants\nfrom seven trials [33–39]. Results show that IPC treatment did not\ninfluence one-year (Fig. 4A,B) or two-year graft and patient survival\n(Fig. S1A,B). In the short-term, IPC treatment improved AST levels\non day one and international normalised ratio (INR) levels on day\nthree after surgery (Fig. 5A,C), but did not affect INR (Fig. 5B) or bil￾irubin levels (Fig. S1E) one day post-operatively. Also, the incidence\nof primary non-function or initial poor function was not different\nbetween treated and untreated grafts (Fig. S1C,D). The risk of bias\nfor included studies is described in Table S4. In general, the studies\nincluded in the meta-analyses were judged to have a relatively high\nrisk of bias.\n4. Discussion\nThis systematic review provides an update on the existing evidence\nof treatments that were applied to deceased organ donors and aimed to\nimprove graft quality and survival after kidney, liver, heart, and lung\ntransplantations. Our meta-analyses found no consistent evidence to\nsupport that any specific donor-management strategy or treatment in\nDBD donors benefited outcomes after transplantation (see Fig. 6 for an\noverview of all included studies per organ). This finding is in line with\nprevious and older reviews published on this topic [43–47].\n4.1. Anti-oxidants\nBrain death and IRI are associated with increased levels of reactive\noxygen species (ROS), which play a central role in the deleterious effects\nfollowing transplantation [48]. Therefore, the use of anti-oxidants to\nscavenge ROS or support cellular detoxification appears to be an intui￾tively sound strategy to limit IRI. However, none of the four compounds\ntested improved survival rates following kidney (N-acetylcysteine) [12]\nor liver (L-alanyl-glutamine, ascorbic acid, sevoflurane) [10, 11, 13]\ntransplantation, even though ascorbic acid [11] and donor ventilation\nwith sevoflurane [13] improved short-term liver function. In addition,\nMinou et al. showed that sevoflurane did have protective effects in mar￾ginal livers with various degrees of hepatic steatosis [13]. Recently, a\nRCT on simultaneous kidney and pancreas transplantations showed\nthat treatment with 600 mg alfa-lipoic acid in both donors and recipi￾ents resulted in decreased inflammatory markers in the transplanted\ngrafts [49]. These promising results may encourage more trials with\nanti-oxidant treatment strategies, either in the donor, during graft pres￾ervation or at time of reperfusion.\n4.2. Enteral feeding\nFor critically ill patients, enteral feeding is the preferred route for nu￾tritional support [50]. However, nutritional support is usually withheld\nin DBD donors due to suggested negative side effects of both enteral and\nparenteral feeding. Negative effect of enteral feeding are thought to be\nimpaired nutritional uptake as a result of the inflammatory response\ntaking place in the bowel of DBD donors [51]. Alternatively, parenteral\nfeeding is related to metabolic, infectious, and mechanical complica￾tions [52]. The only RCT on this topic compared fasting of the DBD\ndonor to enteral feeding with a diet containing fatty acids, antioxidants,\nand glutamine. This study shows that transplant outcomes and inflam￾matory parameters were not different between groups following on av￾erage 12.6 h of enteral feeding [14]. Effects of nutritional duration were\nnot investigated. As about 30% of the donors were able to metabolise en￾teral nutrition without negative side effects [14], enteral feeding ap￾pears to be safe method for nutritional support in DBD donors.\n4.3. Organ retrieval techniques\nDuring organ procurement, there are two techniques to flush-out\nand perfuse the liver graft. The classic, dual perfusion technique flushes\nthe graft via both the aorta and portal vein [53]. Alternatively, most cen￾tres now use single aortic perfusion as an simplified, alternative method\nthat is of particular interest during multiple organ harvesting or split\nliver transplantation [16], followed by additional back-table flush of\nthe liver. The two RCTs that compared these techniques show conflict￾ing results [15, 16]. Chui et al. [15] found no differences between the\ntechniques following liver and kidneys transplantation, while D'Amico\net al. [16] found an improved function of marginal livers after dual per￾fusion. Unfortunately, it is challenging to draw conclusions from these\nstudies: Chui et al. did not provide a full report on their study design,\nwhilst D'Amico et al. focused primarily on marginal donors, which\nmakes extrapolation of these results to the general donor population\n196 A.C. van Erp et al. / Transplantation Reviews 32 (2018) 194–206\n\nTable 1\nSummary of randomized controlled trials of interventions in deceased organ donors.\nIntervention type Source Year Number of\npatients\nrandomized\nTreatment group\n(administration mode and\ntimE.\nControl group Outcome\n(subgroup)\nSpecific end-points (time after\ntransplantation)\nEffect organ function (treatment vs. control\ngroup)\nEffect\npatient/graft\nsurvival\nAnti-oxidants Orban et al.\n[12]\n2015 217 600 mg N-acetylcysteine\n(bolus, 1 h before and 2 h\nafter angiography)\nNo treatment Kidney\nfunction\nsCr and eGFR (D1,7,14,30); DGF (HD\nrequirement/ oliguria/ sCr N500 μmol/L,\nD0–7); acute rejection (D0–30); patient\nand graft survival (≤Y1); and recipient\nhospital stay\nNo No (graft)\nBarros et al.\n[10]\n2015 33 50 g L-alanyl-glutamine\n(bolus, 40 min before cold\nischaemia)\nPlacebo Liver\nfunction\nAST, ALT, bilirubin, INR (D0,1,3,7,30);\npatient and graft survival (duration\nunknown)\nNo No (patient\nand graft)\nKazemi et al.\n[11]\n2015 40 100 mg/kg ascorbic acid\n(bolus, 6 h before\nprocurement) and\nsubsequent 100 mg/kg/p6h\n(infusion, until procurement)\nNo treatment Liver\nfunction\nAST, ALT, bilirubin (D1,3,10) Positive - AST and ALT on D3 vs. D1 (data not\nspecified)\nNot\nmeasured\nMinou et al.\n[13]\n2012 60 2.0% sevoflurane (end\nexpiratory, during\nprocurement)\nNo treatment Liver\nfunction\n(degree of\nsteatosis)\nPeak ALT, AST (D0–2); PNF, IPF (bilirubin\n≥10 mg/dL, INR ≥ 1.6, AST/ALT ≥2000 IU/L,\nD0–7); and recipient ICU/hospital stay\nPositive - Peak AST: 792 vs. 1861 IU/L - IPF: 17\nvs. 50%\nNot\nmeasured\nEnteral feeding Hergenroeder\net al. [14]\n2013 36 Enteral nutrition containing\nomega-3-PU FA,\nanti-oxidants, glutamine (1 g\nprotein/kg per 24 h, until\nprocurement)\nNo treatment Survival Patient and all solid organ-graft survival\n(M0–6)\nNot measured No (patient\nand graft)\nOrgan retrieval\ntechniques\nChui et al. [15] 1998 40 Single aortic perfusion Double\nperfusion\n(aortic and\nportal)\nKidney and\nliver\nfunction\nAST, ALT, INR (D1–2); PNF; patient and\ngraft survival (≤M3)\nNo No (patient\nand graft)\nD'Amico et al.\n[16]\n2007 58 Double perfusion (aortic and\nportal)\nSingle aortic\nperfusion\nLiver\nfunction\nAST, ALT, bilirubin, INR\n(D1–3,5,7,M1,3,6,9,12); PDF (PNF + IPF,\n≤D7); patient and graft survival (≤M6); and\nre-transplantation\nPositive - AST: 763 vs. 2125 IU/L, D2 - ALT:\n614 vs. 1580 IU/L, D2 -PDF: 6 vs. 41% -\nRe-transplant: 0 vs. 5\nPositive -\npatient: 100\nvs. 68% -\ngraft: 100 vs.\n58%\nHaemo-dynamic\nsupport\nBenck et al.\n[18]\n2011 264 4 μg/kg/min dopamine\n(infusion, after consent until\nprocurement)\nNo treatment Heart\nfunction\nLVF, LVAD and HF requirement; acute\nrejection (M0-M1); patient and graft\nsurvival (≤M3, Y1,2,3)\nNo Positive\n(patient and\ngraft) - 91 vs.\n72%, Y1 - 87\nvs. 68%, Y3\nPennefather et\nal. [19]\n1995 24 300 μg/kg/min arginine\nvasopressin (infusion, when\nhaemodynamically stable\nafter BD confirmation)\nPlacebo Heart,\nkidney,\nliver, lung\nfunction\nGood initial function: - kidney: DGF -\nliver/lung: unclear - heart: inotropics\nrequirement\nNo Insufficient\ndata reported\nSchnuelle et al.\n[17]\n2009 264 4 μg/kg/min dopamine\n(infusion, after consent until\nprocurement)\nNo treatment Kidney\nfunction\n(infusion\nand CI\ntime)\nsCr, DGF (dialysis requirement) (D0–7);\nacute rejection (≤M1); patient and graft\nsurvival (≤Y3)\nPositive - DGF: 25% vs. 35% - DGF subgroup\nlong vs. short infusion time: 21% vs. 36%\nNo (patient\nand graft)\nGuesde et al.\n[20]\n1998 97 1 μg desmopressin (bolus,\nevery 2 h when diuresis b300\nmL/h after consent until 2 h\nbefore procurement)\nNo treatment Kidney\nfunction\nsCr, DGF (HD requirement) (D0–15);\nsurvival (≤Y5)\nNo No\nCittanova et al.\n[24]\n1996 27 LMW Hydroxyethyl-starch\nup to 33 mL/kg with\nadditional fluid gelatin when\nPlacebo Kidney\nfunction\nDGF (HD/HF, D1–8), sCr (D1,2,5,10) Negative Not\nmeasured\n(continued on next page)\n197 A.C. van Erp et al. / Transplantation Reviews 32 (2018) 194–206\n\nTable 1 (continued)\nIntervention type Source Year Number of\npatients\nrandomized\nTreatment group\n(administration mode and\ntimE.\nControl group Outcome\n(subgroup)\nSpecific end-points (time after\ntransplantation)\nEffect organ function (treatment vs. control\ngroup)\nEffect\npatient/graft\nsurvival\nneeded\nKlein et al. [21] 1999 112 500 μg prostaglandin I2\n(bolus, before procurement)\nNo treatment Liver\nfunction\nAST, ALT, bilirubin, GLDH, AF, γGT (D0–28);\nPNF; in-hospital survival; vascular\nthrombosis, and recipient ICU/hospital stay\nPositive - AST/ALT, D0,1 - GLDH, D1–4 No (patient\nand graft)\nRandell et al.\n[23]\n1990 16 500 mL 6%\nhydroxyethyl-starch and\nadditionally 1000 mL when\nCVP b5 mmHg and\ncrystalloids (infusion, before\nprocurement)\nCrystalloids Liver\nfunction\nPNF No Not\nmeasured\nAl-Khafaji et al.\n[22]\n2015 556 Protocolised resuscitation\nusing a consensus-based\npulse pressure variation\nalgorithm (until\nprocurement)\nStandard donor\nmanagement\nRecipient\nsurvival\n(ECD\ndonors)\nNumber of transplanted organs per donor,\nrecipient (hospital free) survival (≤M6)\nNot measured No (patient)\nMild therapeutic\nhypothermia\nNiemann et al.\n[25]\n2015 394 Mild therapeutic\nhypothermia (34–35 °C, after\ndeclaration of BD until\nprocurement)\nNormothermia\n(36.5–37.5 °C)\nKidney\nfunction\n(ECD\ndonors)\nDGF (dialysis requirement D0-D7) Positive - DGF: 28.2% vs. 39.2% - DGF\nsubgroup ECD vs. SCD: 31% vs. 57%\nNot\nmeasured\nImmuno-suppressants Kainz et al.\n[26]\n2010 306 1000 mg\nmethylprednisolone (bolus, ≥\n3 h before procurement)\nPlacebo Kidney\nfunction\n(donor\nage≤/N50)\nSCr, DGF (D0–7) No No (graft)\nChatterrjee et\nal. [31]\n1981 50 60 mg/kg cyclophosphamide\n(infusion, t ≥ 4 h before\nprocurement when possible)\nNo treatment Kidney\nfunction\nGraft failure (≤Y1) Not measured No (graft)\nSoulillou et al.\n[27]\n1979 34 5 g methylprednisolone and\n5 g cyclophosphamide\n(infusion, t ≥ 5 h before\nprocurement)\nPlacebo Kidney\nfunction\nSCr, graft survival, (M3,6,12) No No (graft)\nJeffery et al.\n[28]\n1978 Unclear 5 g methylprednisolone and\n7 g cyclophosphamide\n(infusion, t ≥ 4 h before\nprocurement when possible)\nNo treatment Kidney\nfunction\nsCr, rejection, patient and graft survival\n(M3,6,12)\nNo No (patient\nand graft)\nAmatschek et\nal. [29]\n2012 83 1000 mg\nmethylprednisolone (bolus,\nbetween 3 and 6 h before\nprocurement)\nPlacebo Liver\nfunction\nAST and ALT (D0–7); rejection, patient and\ngraft survival (≤Y3); bile duct\ncomplications, recipient ICU/hospital stay\nNo No (patient\nand graft)\nKotsch et al.\n[30]\n2008 100 250 mg methylprednisolone\n(bolus at consent +100 mg/h\nIV until procurement)\nNo treatment Liver\nfunction\nAST, ALT, bilirubin, AF, ɣGT (D0–10); acute\nrejection (AR), PNF (≤M6); and biliary\nlesions\nPositive - AST: 327 vs. 1470 / ALT:461 vs. 758\n/ AP: 127 vs. 157 / ɣGT: 135 vs. 236 (D1) -\nAST: (31 vs. 41 / ALT: 75 vs. 115 / bilirubin:\n2.3 vs. 4.9(D10) - Bilirubin: 0.6 vs. 1.0 (M6) -\nAR: 22% vs. 36%, M6\nNo (graft)\nIschaemic pre￾conditioning Zapati-Chavira et al. [39] 2015 13 10 min IPC (hilar clamping, followed by 10 min\nreperfusion before\nprocurement)\nNo treatment Liver\nfunction\nAST, ALT, bilirubin, INR (D1,3,7); PNF, IPF;\npatient and graft survival (M6, 24); and\nrecipient ICU stay\nSlightly negative - Bilirubin: 3.5 vs. 1.6 mg/dL No\nCescon et al.\n[35]\n2009 40 10 min IPC (hilar clamping,\nfollowed by 15 min\nreperfusion before\nprocurement)\nNo treatment Liver\nfunction\nAST, ALT, bilirubin, INR (D1–7, 14, 21); PNF,\nIPF; patient and graft survival (Y0-Y1), and\nrecipient ICU stay\nNo No\nFranchello et\nal. [38]\n2009 75 10 min IPC (hilar clamping,\nfollowed by 30 min\nreperfusion before\nprocurement)\nNo treatment Liver\nfunction\nAST, ALT, bilirubin, INR (D1,3,7); acute\nrejection, PNF; graft survival (M6);\ninfections (M1), and recipient hospital stay\nSlightly positive for subgroup marginal grafts:\n- AST: 936 vs. 1268 (D1), 339 vs. 288 (D3),\nUI/L\nNo\n198 A.C. van Erp et al. / Transplantation Reviews 32 (2018) 194\n–206\n\nJassem et al.\n[37]\n2009 44 10 min IPC (hilar clamping,\nfollowed by (on average) 30\nmin reperfusion before\nprocurement)\nNo treatment Liver\nfunction\nAST (D1–5); bilirubin and INR (D7, 14,30);\nacute rejection\nSlightly positive - AST: 410 vs. 965 (D1), 198\nvs. 488 (D2), 120 vs. 216 (D3) IU/L\nNot\nmeasured\nKoneru et al.\n[33]\n2007 101 10 min IPC (hilar clamping,\nfollowed by median of 39\nmin reperfusion before\nprocurement)\nNo treatment Liver\nfunction\n(marginal\ngrafts)\nAST, ALT, bilirubin, INR (D1–3,7,14,30);\ninjury score (biopsy); acute rejection\n(D0–30); PNF; patient and graft survival\n(≤Y2); blood transfusions; lung edema, and\nrecipient ICU/hospital stay\nNegative - AST: 385 vs. 250 IU/L, D2 - ALT:\n699 vs. 520 (D1), 583 vs. 353 (D2) IU/L\nNo (patient\nand graft)\nAmador et al.\n[36]\n2007 60 10 min IPC (hilar clamping,\nfollowed by 10 min\nreperfusion before\nprocurement)\nNo treatment Liver\nfunction\nAST, ALT, bilirubin, INR (D1–10); PNF\n(D0–7); acute rejection; patient (Y2,Y4)\nand graft survival (2Y); vascular and biliary\ncomplications, and recipient ICU/hospital\nstay\nPositive - AST: 894 vs. 1216 (D0), 918 vs.\n1322 (D1), 500 vs. 756 (D2), 201 vs. 344 (D3),\n120 vs. 170 (D4) U/L - ALT 671 vs. 1216 (D0),\n235 vs. 304 (D7) U/L - Bilirubin 2.5 vs. 3.6\nmg/dL (D1)\nNo (patient\nand graft)\nCescon et al.\n[34]\n2006 53 10 min IPC (hilar clamping\nfollowed by 15 min\nreperfusion before\nprocurement)\nNo treatment Liver\nfunction\nAST, ALT, bilirubin, INR (D1-D7,D14,D21);\ninjury score (biopsy); PNF and IPF; patient\nand graft survival (≤Y1); recipient ICU stay\nPositive - AST (D1,2) - ALT (D1–3,7) Exact\nnumbers not given\nNo (patient\nand graft)\nKoneru et al.\n[32]\n2005 62 5 min IPC (hilar clamping\nfollowed by N30 min\nreperfusion before\nprocurement)\nNo treatment Liver\nfunction\nAST, ALT, bilirubin, INR (D1,3,7); injury\nscore (biopsy); PNF; patient and graft\nsurvival (≤M6); and recipient hospital stay\nNo No (patient\nand graft)\nLung protection\nstrategies\nWare et al. [41] 2014 506 5 mg q4h albuterol sulphate\n(nebulization every 4 h, from\nstudy enrolment until\nprocurement)\nPlacebo Lung\nfunction\n(marginal\ngrafts)\nPaO2/FiO2, static compliance;\nlung/kidney/heart/pancreas utilization\nrates; patient survival (D30, ≤Y1); and\nrecipient hospital stay\nSlightly negative - Lung utilization (marginal\ngrafts): 9% vs. 20% - Kidney utilization: 77 vs.\n88%\nNo (patient)\nMascia\net al. [40]\n2010 118 Protective ventilation\nstrategy (TV 6–8 mL/kg and\nPEEP 8–10 cm, during 6 h\nobservational period until\norgan procurement)\nConventional\nventilation\nstrategy (TV\n10–12 mL/kg\nand PEEP 3–5\ncm)\nSurvival Patient survival (≤M6) Not measured No (patient)\nThyroid hormone Randell et al.\n[42]\n1992 25 2 μm/h triiodothyronine\n(infusion, at start\nprocurement)\nNo treatment Liver\nfunction\nMax. ALAT, bilirubin, albumin (D0–7); and\nrecipient ICU/hospital stay\nNo Not\nmeasured\nALT: Alanine Aminotransferase; AP: Alkaline Phosphatase; AR: Acute Rejection; AST: Aspartate Aminotransferase; BD: Brain Death; CI: Cold Ischaemia; D: Day; ECD: Extended Criteria Donor; eGFR: Estimated Glomerular Filtration Rate; ɣGT: gamma￾glutamyl transpeptidase; HD: Haemodialysis; HF: Haemofiltration; INR: ICU: Intensive Care Unit; International Normalised Ratio; IPF: Initial Poor Function; LVAD: Left Ventricular Assist Device; LVF: Left Ventricular Function; M: Month; PDF: Primary\nDysfunction; PNF: Primary Non-Function; SCD: Standard Criteria Donor; sCr: Serum Creatinine; Y: Year.\n199 A.C. van Erp et al. / Transplantation Reviews 32 (2018) 194–206\n\ndifficult. In conclusion, there is currently no strong evidence suggesting\nsuperiority of either perfusion technique.\n4.4. Haemodynamic support\nDiabetes insipidus is a common finding amongst DBD donors and\nmay cause haemodynamic instability in the donor due to hypovolaemia\nand electrolyte disturbances [20]. However, treatment strategies to im￾prove haemodynamic instability in the donor are frequently based on\npersonal experience as there is no general consensus on what treatment\nis most effective.\nTreatment of hypovolaemia with crystalloids has been suggested to\ncause organ oedema, diminished organ perfusion, and impaired oxygen\ndiffusion in the lungs. Therefore, the use of colloids was introduced to\navoid this build-up of extravascular fluids. In DBD donor care, two\nRCTs studied the effects of donor treatment with the colloid HES. The\nstudy by Randell et al. [23] showed no difference in graft function\nafter the administration of HES (unknown molecular weight) compared\nto saline prior to liver transplantation. However, treatment of DBD do￾nors with low molecular weight HES resulted in harmful short-term ef￾fects in kidney grafts [24]. This result has led to the notion that HES\nshould not be administered to potential kidney donors. However, it\nshould be noted that both studies have a high risk of bias, which may\nhave influenced the results and possibly their interpretation. A different\napproach to achieve donor euvolaemia is to monitor the pulse pressure\nvariation and correct hypotension according to a protocol that includes\nfluid or vasopressive drug administration [22]. However, implementa￾tion of this protocol failed to improve the recipient survival rate or num￾ber of organs transplanted per donor.\nAlternatively, five RCTs tested the effects of pharmaceuticals as a\nmeans to provide haemodynamic support. Firstly, administration of\nADH did not improve graft function (Fig. 2), but did result in decreased\nurine output and, therefore, the need for fluid therapy. Secondly, admin￾istration of dopamine in DBD donors had a positive effect on short-term\nrenal graft function [17], whilst in heart transplantation it improved\nlong-term graft and patient survival [18]. Finally, administration of\nprostaglandin I2 improved transaminase levels immediately and one\nday after liver transplantation, but failed to improve graft survival [21].\nIn conclusion, unstable haemodynamic parameters should be\ntreated appropriately with volume replacement and haemodynamic re￾suscitation. However, volume replacement with HES should be used\nwith caution, especially when kidney donation is considered. Haemody￾namic support using dopamine appears to be beneficial in heart and\npossibly in kidney transplantation. Thus, further studies on the use of\ndopamine as part of standard donor care and its effects on other organ\ngrafts is desirable.\n4.5. Hypothermia during donor management\nPromising results published by Niemann et al. show that MTH of the\ndeceased donor (cooling of the donor from 37 °C to 34–35 °C at the In￾tensive Care Unit) preserved kidney function during donor manage￾ment in the Intensive Care Unit, with decreased DGF rates after\ntransplantation. These results are in line with a retrospective cohort\nstudy on patients with a myocardial infarction, for whom MTH treat￾ment prior to and during their percutaneous coronary intervention im￾proved survival rates and preserved renal function [54]. However, these\nprotective effects of MTH could not be reproduced in RCTs on patients\nwith cardiac arrests [55, 56] or intracranial aneurysms [57]. Long-term\neffects of MTH treatment are eagerly awaited before implementation\nof this technique can be considered as standard donor care [25]. Fur￾thermore, the study by Niemann only included statically cold-stored\nkidneys, whilst hypothermic machine perfusion has demonstrated to\nsignificantly reduce DGF and improve graft survival, especially in older\nand higher-risk donor kidneys [58]. Therefore, the question arises\nwhether both treatment regimens are necessary and which one is\nmore cost-effective. Recently, a new trial has started that will compare\nthe effects of donor MTH with hypothermic machine perfusion on\ngraft function after transplantation62.\nFig. 1. PRISMA diagram of the literature search. Flow chart summarising the search strategies and subsequent selection of trials for this systematic review and the performed meta￾analyses.\n200 A.C. van Erp et al. / Transplantation Reviews 32 (2018) 194–206\n\nFig. 2. Meta-analysis for antidiuretic hormone treatment in kidney transplantation. A forest plot comparing the effects of antidiuretic hormone treatment versus placebo or no treatment\non delayed graft function, defined as the need for haemodialysis within two weeks post-kidney transplantation.\nTable 2\nIdentified studies that are still recruiting or have not yet published results.\nTrial id Investigator Treatment Participants Start\ninclusion\nStop\ninclusion\nTitle Sponsor\nNCT02581111 Dhar Naloxone 250 2015 2016 Randomized Placebo-controlled Trial of Intravenous Naloxone\nto Improve Oxygenation in Hypoxemic Lung-Eligible\nBrain-Dead Organ Donors\nWashington Univer￾sity School of\nMedicine, USA\nNCT02435732 Fernandez C1 inhibitor 72 2016 2018 A Phase I, Single Center, Randomized, Double-Blind,\nPlacebo-Controlled Study to Evaluate Tolerability of C1\nInhibitor (CINRYZE) as a Donor Pretreatment Strategy in\nBrain-Dead Donors Who Meet a Kidney Donor Risk Index\n(KDRI) Above 85%\nUniversity of\nWisconsin, Madison,\nUSA\nNCT02211053 Frenette Levothyroxine 60 2014 2016 Evaluation of the Efficacy and Safety of Levothyroxine in Brain\nDeath Organ Donors: a Randomized Controlled Trial\n(ECHOT4)\nHopital du\nSacre-Coeur de\nMontreal, Canada\nNCT01860716 García-Gil Melatonin 60 2013 2013 Impact of Melatonin in the Pretreatment of Organ Donor and\nthe Influence in the Evolution of Liver Transplant: a\nProspective, Randomized Double-blind Study\nHospital Clínico\nUniversitario Lozano\nBlesa, Spain\nNCT02907554 Ichai Cyclosporine A 648 2016 2018 Effects of Cyclosporine A Pretreatment of Deceased Donor on\nKidney Graft Function: A Randomized Controlled Trial\nUniversity Hospital,\nClermont-Ferrand,\nFrance\nNCT01939171 Jiminez Thymoglobulin 20 2010 2013 Conditioning of the Cadaver Donor by Thymoglobulin\nAdministered to Reduce the Pro-inflammatory State After\nBrain Death.\nInstituto de\nInvestigación\nHospital\nUniversitario La Paz,\nSpain\nNCT01160978 Jokinen Simvastatin 46 2010 2015 Donor Simvastatin Treatment in Organ Transplantation Helsinki University\nHospital, Finland\nNCT02341833 Joris 2% sevoflurane 240 2015 2017 Effects of Preconditioning With Sevoflurane During Organ\nProcurement From Brain-Dead Donors: Impact on Early\nFunction of Liver Allografts\nUniversity Hospital of\nLiege, Belgium\nNCT00975702 Koneru Remote ischaemic\npreconditioning\n85 2009 2014 Phase III Study of Efficacy of Remote Ischaemic\nPreconditioning in Improving Outcomes in Organ\nTransplantation (RIPCOT)\nThe State University\nof New Jersey, USA\nNCT01515072 Koneru and\nWashburn\nRemote ischaemic\npreconditioning\n320 2011 2014 Remote Ischaemic Preconditioning in Neurological Death\nOrgan Donors (RIPNOD)\nThe State University\nof New Jersey, USA\nNCT01140035 Niemann Intensive insulin\ntreatment\n200 2009 2011 Intensive Insulin Therapy in Deceased Donors - to Improve\nRenal Allograft Function and Transplanted Allograft Outcomes\nUniversity of\nCalifornia, San\nFrancisco, USA\nNCT02525510 Niemann Hypothermia/\nnormothermia and\nstatic cold\nstorage/machine\nperfusion\n500 2015 2019 Deceased Organ Donor Interventions to Protect Kidney Graft\nFunction\nUniversity of\nCalifornia, San\nFrancisco, USA\nNCT00718575 Selzner Ischaemic\npreconditioning\n50 2008 2012 A Prospective, Randomized Trial to Investigate the Effects of\nGlucose/ Ischaemic Preconditioning Donor Pretreatment on\nReperfusion Injury in Deceased-Donor Liver Transplantation\nUniversity Health\nNetwork, Toronto,\nCanada\nFig. 3. Meta-analysis for methylprednisolone treatment in liver transplantation. A forest plot comparing the effects of methylprednisolone treatment versus placebo or no treatment on the\nincidence of acute rejection within one to six months after liver transplantation.\nA.C. van Erp et al. / Transplantation Reviews 32 (2018) 194–206 201\n\n4.6. Immunosuppression\nBrain death results in pro-inflammatory changes, both systemically\nand in the organ grafts [4]. Additionally, endogenous cortisol levels de￾crease after the onset of brain death [59, 60]. Therefore, it is conceivable\nthat donor treatment with immunosuppressive drugs could prevent\npro-inflammatory changes and improve graft quality, as was suggested\nin experimental animal studies [61, 62] and a large retrospective cohort\nstudy [63]. However, our meta-analysis on the effects of prednisolone\ntreatment showed no changes in the frequency of acute rejection fol￾lowing liver transplantation (Fig. 3). Furthermore, immunosuppressive\ndrug treatment did neither improve long-term graft function, nor pa￾tient, nor graft survival following kidney and liver transplantation\n[26–31], despite a decrease in DBD-related pro-inflammatory changes\nin these organs. In addition, the one study that investigated the effects\nof immunosuppressive therapy in marginal donors (higher donor\nage), found no differences in kidney function or graft survival [19]. Fi￾nally, the short-term benefits of prednisolone treatment in liver graft\nFig. 4. Meta-analyses for the effect of ischaemic preconditioning (IPC) treatment on survival. Forest plot comparing the effects of 10 min of IPC treatment during liver transplantation: A.\none-year graft survival and B. one-year patient survival.\nFig. 5. Meta-analyses for the effect of ischaemic preconditioning (IPC) treatment on liver function. Forest plot comparing the effects of 10 min of IPC treatment in liver transplantation: A.\nthe difference in AST levels one day after transplantation, B. the difference in INR levels one day after transplantation, and C. the difference in INR levels three days after transplantation.\n202 A.C. van Erp et al. / Transplantation Reviews 32 (2018) 194–206\n\nas observed by Kotsch et al. [30], could not be reproduced in a similar\nstudy by Amatschek et al. [29]. In conclusion, these studies do not sup￾port the routine use of methylprednisolone alone, or in combination\nwith cyclophosphamide, in the management of DBD donors.\n4.7. Ischaemic preconditioning\nIschaemia-reperfusion injury (IRI) is an unavoidable deleterious\nprocess during organ transplantation. Initially, the organs suffer from a\nperiod of ischaemia during procurement, followed by injury during sub￾sequent reperfusion in the recipient. Murry et al. first introduced the\nconcept of IPC as a method to induce transient ischaemia, preparing\nthe organs for subsequent IRI [64]. We identified eight studies on IPC,\nall performed prior to liver transplantation. Pooled data from our\nmeta-analyses shows a short-term benefit of ten-minute IPC treatment\nthat seems independent of the duration of warm ischemia, evidenced by\nimproved post-operative AST and INR levels. Even though long-term ef￾fects on patient and graft survival were lacking and the different studies\nshowed some conflicting results, data from our meta-analysis highly\nsuggests a potential benefit of IPC prior to liver transplantation, particu￾larly as AST levels in the first week after transplantation have been cor￾related to early graft survival (b3 months) [65]. The RCT by Franchello et\nal. reported improved AST levels in a subgroup of marginal donors\n(N65 years old and/or with steatosis) [38]. Further studies powered to\ndetect changes in short-term survival rates and adjusted for graft qual￾ity should be performed to elucidate whether IPC should be included in\nstandard donor care. Furthermore, there are currently several on-going\ntrials investigating remote IPC, a technique where (repetitive) cycles of\nischaemia are applied to a remote organ or tissue such as a limb with,\nconsequentially, a possible wider therapeutic timeframe in the donor\n(Table 2).\n4.8. Lung protection strategies\nDBD donors are at increased risk of pulmonary damage caused by in￾creased pulmonary hydrostatic pressure, catecholamine release, and\npro-inflammatory changes [66]. However, the optimal lung ventilation\nstrategy in decreased donor care has been a topic of controversy [67].\nConventionally, high tidal volumes (TV) (10–12 mL/kg) were applied,\nensuring hypocapnia and a decrease in intracranial hypertension, and\ncombined with low positive end-expiratory pressures (PEEP) (3–5 cm\nH2O) to provide optimal oxygenation [66]. Recent studies on patients\nwith the acute respiratory distress syndrome support an alternative\nstrategy with a low TV and high PEEP, as this strategy appears to have\nimproved outcomes of acute lung injury by reducing ventilation re￾lated-injury and preventing atelectasis [66, 68]. Based on these studies,\nMascia et al. studied this protective ventilation strategy with low TV\n(6–8 mL/kg) and high PEEP (8–10 cm H2O) in DBD donor care [66].\nEven though this ventilation strategy did not improve patient survival,\nthere was a significant increase (27–54%) in the number of lungs\ntransplanted [40]. These data have supported the implementation of\nthis protective lung ventilation strategy as the preferred ventilation\nstrategy for deceased donors, according to the recent guidelines from\nthe Eurotransplant region as well as the American Thoracic Society\n[69, 70].\nAn alternative strategy to protect the lungs is the use of beta-2-ad￾renergic agonists, which increase the rate of fluid clearance from the\nlungs, potentially lowering the risk of pulmonary oedema and subse￾quent infiltrates, and improving oxygenation capacity [71]. However,\ntreatment of the donor with aerosolised albuterol did not improve\nlung function, recipient survival, or lung utilization rates [41]. A sub￾group analysis of marginal donor lungs only even indicated lower lung\nutilization in the albuterol-treated group. Finally, albuterol treatment\nresulted in a lower kidney utilization rate of 77% vs. 88% in the pla￾cebo-treated group. As such, donor treatment with albuterol does not\nseem to improve lung function and may have a negative impact on mar￾ginal donor lungs as well as kidney grafts.\n4.9. Triiodothyronine\nBrain death causes ischaemia of the brain and subsequent cessation\nof the hypothalamic-pituitary axis. As a result, plasma levels of the ac￾tive thyroid hormone T3 diminish in a matter of hours, whereas variable\nlevels of levothyroxine (T4), reverse T3, and thyroid stimulating hor￾mone have been observed [43]. A large retrospective cohort of 66,629\ndonors suggested that T3 treatment improved the haemodynamic pro￾file of donors and increased the number of organs transplanted [72].\nHowever, the only RCT that has evaluated post-transplantation graft\nfunction failed to show any effects of T3 therapy on liver function [42].\nDuring the screening process, we did identify nine RCTs that assessed\neffects of T3 treatment on haemodynamic stability in the donor. Of\nthese studies, none found any differences in haemodynamic donor pa￾rameters or inotropic needs [42, 73–80]. As a result, the current national\nguidelines of National Health Service Blood and Transplant in the UK no\nlonger advise administration of a rather costly T3 as part of the DBD\ndonor management.\nFig. 6. Overview of all systematically tested, clinical treatments or interventions in the\nbrain-dead donor with outcome parameters pertaining the lungs, liver, heart, and\nkidneys. Treatments or interventions denoted in black did not affect graft function or\ngraft and patient survival. Treatments or interventions denoted in green were beneficial,\nthose in red were detrimental, and those in orange inconclusive.\nA.C. van Erp et al. / Transplantation Reviews 32 (2018) 194–206 203\n\n4.10. Limitations of this review\nFirstly, the number of RCTs that investigated treatment strategies in\nthe donor and their impact on graft function and survival after trans￾plantation is limited. Furthermore, as our search strategy focused on\ndonor treatment only, potentially promising treatment strategies of\nthe graft after procurement and during preservation were excluded\nthat may be of a pre-transplant treatment potential. In addition, several\nstudies we did include were performed with a low number of partici￾pants, did not report power calculations or were underpowered to de￾tect changes in the outcome parameters as stipulated in this review.\nConsequentially, potential effects on organ function or survival might\nhave been missed and interpretation of the data from these studies\nshould be done with caution. Furthermore, we acknowledge that\nsome outcome parameters, such as plasma bilirubin to assess liver func￾tion or number of organs transplanted in the case of the kidney, are pos￾sibly weakly correlated to organ injury. However, as these endpoints\nwere assessed in conjunction with other biomarkers, the prognostic\nvalue of these endpoints is strengthened. The few number of studies\nalso limited us from assessing the risk of publication bias or perform\nsubgroup analyses. Therefore, drawing conclusions from these studies\nis risky, particularly when grouping for meta-analyses was not possible.\nAdditionally, we found limited studies on lung transplantation, and no\nstudies on pancreas or intestinal transplantations. Lastly, we realise\nthat several promising treatment strategies published in relevant ani￾mal models are not included in this article. However, we believe that\nthese studies were outside the scope of this review as interpretation\nof these results are not yet influential in clinical decision making in de￾ceased donor care.\n5. Conclusions\nThe current global shortage of suitable donor organs and often un￾certainty which organ to accept or decline, underlines the need for op￾timisation of deceased donor care. Treatment strategies aim at\nreducing the detrimental effects of haemodynamic, hormonal, inflam￾matory, and metabolic disturbances prior to organ retrieval. Better con￾ditioning of the grafts-to-be and reducing, or even preventing, donor￾related injury prior to preservation and transplantation have become\nimportant goals to transplant higher risk donor organs, without\ncompromising outcomes after transplantation. Unfortunately, current\ndonor management protocols may vary considerably per centre and\nare based on low-level evidence. In this systematic review, we could\nnot find consistent evidence supporting that any individual treatment\nthat has been tested until now will protect donor organs or improve sur￾vival after transplantation. More organised and defined RCTs are re￾quired to identify and validate possible benefits of innovative\ntreatments before clinical implementation can be recommended as\npart of standard donor care. We feel that a concerted action between\nprofessionals in Intensive Care and organ transplantation is needed to\ngain better insight and stimulate clinically relevant interventions in\nDBD donors.\nAuthors' contributions\nAE and LD both performed the initial search, selection and assess￾ment of the articles, and wrote the manuscript. HL and RP contributed\nto the revision of this manuscript. All authors read and approved the\nfinal manuscript.\nEthics approval and consent to participate\nNot applicable.\nConsent for publication\nNot applicable.\nAvailability of data and materials\nAll data generated or analysed during this study are included in this\npublished article [and its supplementary information files].\nCompeting interests\nThe authors have no conflict of interests to declare.\nFunding\nThis research received no specific grant from any public, commercial,\nor not-for-profit funding agency.\nAcknowledgments\nWe would like to thank Karin Sijtsma for helping with defining the\ninitial search and James Hunter, Dane Hoeksma, and Felix Poppelaars\nfor critically reading this manuscript.\nAppendix A. Supplementary data\nSupplementary data to this article can be found online at https://doi.\norg/10.1016/j.trre.2018.06.001.\nReferences\n[1] Rudge C, Matesanz R, Delmonico FL, Chapman J. International practices of organ do￾nation. Br J Anaesth 2012;108:i48–55. https://doi.org/10.1093/bja/aer399.\n[2] Skrabal CA, Thompson LO, Potapov EV, Southard RE, Joyce DL, Youker KA, et al. Organ￾specific regulation of pro-inflammatory molecules in heart, lung, and kidney following\nbrain death. J Surg Res 2005;123:118–25. https://doi.org/10.1016/j.jss.2004.07.245.\n[3] Higashida T, Kreipke CW, Rafols JA, Peng C, Schafer S, Schafer P, et al. The role of hyp￾oxia-inducible factor-1α, aquaporin-4, and matrix metalloproteinase-9 in blood￾brain barrier disruption and brain edema after traumatic brain injury. J Neurosurg\n2011;114:92–101. https://doi.org/10.3171/2010.6.JNS10207.\n[4] Nijboer WN, Schuurs TA, van der Hoeven JAB, Fekken S, Wiersema-Buist J, Leuvenink\nHGD, et al. Effect of brain death on gene expression and tissue activation in human\ndonor kidneys. Transplantation 2004;78:978–86.\n[5] Damman J, Schuurs TA, Ploeg RJ, Seelen MA. Complement and renal transplantation:\nfrom donor to recipient. Transplantation 2008;85:923–7. https://doi.org/10.1097/\nTP.0b013e3181683cf5.\n[6] Lopau K, Mark J, Schramm L, Heidbreder E, Wanner C. Hormonal changes in brain\ndeath and immune activation in the donor. Transpl Int 2000;13:S282–5.\n[7] Powner DJ, Boccalandro C, Alp MS, Vollmer DG. Endocrine failure after traumatic\nbrain injury in adults. Neurocrit Care 2006;5:61–70.\n[8] Moher D, Liberati A, Tetzlaff J, Altman DG, PRISMA Group. Preferred reporting items\nfor systematic reviews and meta-analyses: the PRISMA statement. Int J Surg 2010;8:\n336–41. https://doi.org/10.1016/j.ijsu.2010.02.007.\n[9] Higgins J, Green S. Electronic resources login page - University of Groningen Library;\n2005.\n[10] Barros MAP, Barros MAP, Vasconcelos PRL, Vasconcelos PRL, Souza CM, Souza CM, et al.\nL-Alanyl-glutamine attenuates oxidative stress in liver transplantation patients. Trans￾plant Proc 2015;47:2478–82. https://doi.org/10.1016/j.transproceed.2015.08.001.\n[11] Kazemi M, Kazemi M, Tabei SMB, Tabei SMB, Najafizadeh K, Najafizadeh K, et al.\nEvaluation of the effect of ascorbic acid administration on gene expression level of\nIL-6 and TNF-α cytokines in deceased donors. Iran J Allergy Asthma Immunol\n2015;14:149–57.\n[12] Orban J-C, Quintard H, Cassuto E, Jambou P, Samat-Long C, Ichai C. Effect of N￾acetylcysteine pretreatment of deceased organ donors on renal allograft function:\na randomized controlled trial. Transplantation 2015;99:746–53. https://doi.org/10.\n1097/TP.0000000000000395.\n[13] Minou AF, Dzyadzko AM, Shcherba AE, Rummo OO. The influence of pharmacologi￾cal preconditioning with sevoflurane on incidence of early allograft dysfunction in\nliver transplant recipients. Anesthesiol Res Pract 2012;2012:930487. https://doi.\norg/10.1155/2012/930487.\n[14] Hergenroeder GW, Ward NH, Yu X, Opekun A, Moore AN, Kozinetz CA, et al. Ran￾domized trial to evaluate nutritional status and absorption of enteral feeding after\nbrain death. Prog Transplant 2013;23:374–82. https://doi.org/10.7182/pit2013996.\n[15] Chui AK, Chui AK, Thompson JF, Thompson JF, Lam D, Lam D, et al. Cadaveric liver\nprocurement using aortic perfusion only. Aust N Z J Surg 1998;68:275–7.\n204 A.C. van Erp et al. / Transplantation Reviews 32 (2018) 194–206\n\n[16] D'Amico F, D'Amico F, Vitale A, Vitale A, Gringeri E, Gringeri E, et al. Liver transplan￾tation using suboptimal grafts: impact of donor harvesting technique. Liver Transpl\n2007;13:1444–50. https://doi.org/10.1002/lt.21268.\n[17] Schnuelle P, Gottmann U, Hoeger S, Boesebeck D, Lauchart W, Weiss C, et al. Effects\nof donor pretreatment with dopamine on graft function after kidney transplanta￾tion: a randomized controlled trial. JAMA 2009;302:1067–75. https://doi.org/10.\n1001/jama.2009.1310.\n[18] Benck U, Hoeger S, Brinkkoetter PT, Brinkkoetter PT, Gottmann U, Doenmez D, et al.\nEffects of donor pre-treatment with dopamine on survival after heart transplanta￾tion: a cohort study of heart transplant recipients nested in a randomized controlled\nmulticenter trial. J Am Coll Cardiol 2011;58:1768–77. https://doi.org/10.1016/j.jacc.\n2011.05.060.\n[19] Pennefather SH, Bullock RE, Mantle D, Dark JH. Use of low dose arginine vasopressin\nto support brain-dead organ donors. Transplantation 1995;59:58–62.\n[20] Guesde R, Barrou B, Barrou B, Leblanc I, Ourahma S, Ourahma S, et al. Administration\nof desmopressin in brain-dead donors and renal function in kidney recipients. Lan￾cet 1998;352:1178–81. https://doi.org/10.1016/S0140-6736(98)05456-7.\n[21] Klein M, Klein M, Geoghegan J, Geoghegan J, Wangemann R, Wangemann R, et al.\nPreconditioning of donor livers with prostaglandin I2 before retrieval decreases he￾patocellular ischemia-reperfusion injury. Transplantation 1999;67:1128–32.\n[22] Al-Khafaji A, Al-Khafaji A, Elder M, Elder M, Lebovitz DJ, Lebovitz DJ, et al.\nProtocolized fluid therapy in brain-dead donors: the multicenter randomized MOn￾IToR trial. Intensive Care Med 2015;41:418–26. https://doi.org/10.1007/s00134-\n014-3621-0.\n[23] Randell T, Orko R, Höckerstedt K. Peroperative fluid management of the brain-dead\nmultiorgan donor. Acta Anaesthesiol Scand 1990;34:592–5.\n[24] Cittanova ML, Cittanova ML, Leblanc I, Leblanc I, Legendre C, Mouquet C, et al. Effect\nof hydroxyethylstarch in brain-dead kidney donors on renal function in kidney￾transplant recipients. Lancet 1996;348:1620–2.\n[25] Niemann CU, Niemann CU, Feiner J, Feiner J, Swain S, Swain S, et al. Therapeutic hy￾pothermia in deceased organ donors and kidney-graft function. N Engl J Med 2015;\n373:405–14. https://doi.org/10.1056/NEJMoa1501969.\n[26] Kainz A, Kainz A, Wilflingseder J, Wilflingseder J, Mitterbauer C, Mitterbauer C, et al.\nSteroid pretreatment of organ donors to prevent postischemic renal allograft failure:\na randomized, controlled trial. Ann Intern Med 2010;153:222–30. https://doi.org/10.\n7326/0003-4819-153-4-201008170-00003.\n[27] Soulillou JP, Soulillou JP, Baron D, Baron D, Rouxel A, Rouxel A, et al. Steroid-cyclo￾phosphamide pretreatment of kidney allograft donors. A control study. Nephron\n1979;24:193–7.\n[28] Jeffery JR, Downs A, Grahame JW, Lye C, Ramsey E, Thomson AE. A randomized pro￾spective study of cadaver donor pretreatment in renal transplantation. Transplanta￾tion 1978;25:287–9.\n[29] Amatschek S, Amatschek S, Wilflingseder J, Pones M, Pones M, Kainz A, et al. The ef￾fect of steroid pretreatment of deceased organ donors on liver allograft function: a\nblinded randomized placebo-controlled trial. J Hepatol 2012;56:1305–9. https://\ndoi.org/10.1016/j.jhep.2012.01.020.\n[30] Kotsch K, Kotsch K, Ulrich F, Ulrich F, Reutzel-Selke A, Reutzel-Selke A, et al. Methyl￾prednisolone therapy in deceased donors reduces inflammation in the donor liver\nand improves outcome after liver transplantation. Ann Surg 2008;248:1042–50.\nhttps://doi.org/10.1097/SLA.0b013e318190e70c.\n[31] Chatterjee SN, Chatterjee SN, Smith R, Smith R, Fine S, Fine S, et al. A prospective ran￾domized double-blind controlled study of cadaver donor pretreatment with cyclo￾phosphamide in human renal transplantation. Tps 1981;13:709–11.\n[32] Koneru B, Fisher A, Fisher A, He Y, He Y, Klein KM, et al. Ischemic preconditioning in\ndeceased donor liver transplantation: a prospective randomized clinical trial of\nsafety and efficacy. Liver Transpl 2005;11:196–202. https://doi.org/10.1002/lt.\n20315.\n[33] Koneru B, Koneru B, Shareef A, Shareef A, Dikdan G, Dikdan G, et al. The ischemic\npreconditioning paradox in deceased donor liver transplantation-evidence from a\nprospective randomized single blind clinical trial. Am J Transplant 2007;7:\n2788–96. https://doi.org/10.1111/j.1600-6143.2007.02009.x.\n[34] Cescon M, Cescon M, Grazi GL, Grazi GL, Grassi A, Grassi A, et al. Effect of ischemic\npreconditioning in whole liver transplantation from deceased donors. A pilot\nstudy. Liver Transpl 2006;12:628–35. https://doi.org/10.1002/lt.20640.\n[35] Cescon M, Carini R, Carini R, Grazi G, Grazi G, Caraceni P, et al. Variable activation of\nphosphoinositide 3-kinase influences the response of liver grafts to ischemic pre￾conditioning. J Hepatol 2009;50:937–47. https://doi.org/10.1016/j.jhep.2008.11.016.\n[36] Amador A, Amador A, Grande L, Grande L, Martí J, Martí J, et al. Ischemic pre-condition￾ing in deceased donor liver transplantation: a prospective randomized clinical trial. Am J\nTransplant 2007;7:2180–9. https://doi.org/10.1111/j.1600-6143.2007.01914.x.\n[37] Jassem W, Fuggle S, Thompson R, Arno M, Taylor J, Byrne J, et al. Effect of ischemic\npreconditioning on the genomic response to reperfusion injury in deceased donor\nliver transplantation. Liver Transpl 2009;15:1750–65. https://doi.org/10.1002/lt.\n21936.\n[38] Franchello A, Gilbo N, David E, Ricchiuti A, Romagnoli R, Cerutti E, et al. Ischemic pre￾conditioning (IP) of the liver as a safe and protective technique against ischemia/re￾perfusion injury (IRI). Am J Transplant 2009;9:1629–39. https://doi.org/10.1111/j.\n1600-6143.2009.02680.x.\n[39] Zapata-Chavira HA, Zapata-Chavira HA, Cordero-Pérez P, Cordero-Pérez P, Casillas￾Ramirez A, Casillas-Ramirez A, et al. Is ischemic preconditioning a useful therapeutic\nstrategy in liver transplantation? Results from the first pilot study in Mexico. Arch\nMed Res 2015;46:296–302. https://doi.org/10.1016/j.arcmed.2015.06.002.\n[40] Mascia L, Mascia L, Pasero D, Pasero D, Slutsky AS, Slutsky AS, et al. Effect of a lung\nprotective strategy for organ donors on eligibility and availability of lungs for trans￾plantation: a randomized controlled trial. JAMA 2010;304:2620–7. https://doi.org/\n10.1001/jama.2010.1796.\n[41] Ware LB, Ware LB, Landeck M, Landeck M, Koyama T, Koyama T, et al. A randomized\ntrial of the effects of nebulized albuterol on pulmonary edema in brain-dead organ\ndonors. Am J Transplant 2014;14:621–8.\n[42] Randell TT, Höckerstedt KA. Triiodothyronine treatment in brain-dead multiorgan\ndonors—a controlled study. Transplantation 1992;54:736–8.\n[43] Macdonald PS, Macdonald PS, Aneman A, Aneman A, Bhonagiri D, Bhonagiri D, et al.\nA systematic review and meta-analysis of clinical trials of thyroid hormone admin￾istration to brain dead potential organ donors. Crit Care Med 2012;40:1635–44.\nhttps://doi.org/10.1097/CCM.0b013e3182416ee7.\n[44] Dikdan GS, Mora-Esteves C, Koneru B. Review of randomized clinical trials of donor\nmanagement and organ preservation in deceased donors: opportunities and issues.\nTransplantation 2012;94:425–41. https://doi.org/10.1097/TP.0b013e3182547537.\n[45] Rech TH, Rech TH, Moraes RB, Moraes RB, Crispim D, Crispim D, et al. Management\nof the brain-dead organ donor: a systematic review and meta-analysis. Transplanta￾tion 2013;95:966–74. https://doi.org/10.1097/TP.0b013e318283298e.\n[46] Mundt HM, Yard BA, Krämer BK, Benck U, Schnülle P. Optimized donor management\nand organ preservation before kidney transplantation. Transpl Int 2015. https://doi.\norg/10.1111/tri.12712.\n[47] Robertson FP, Magill LJ, Wright GP, Fuller B, Davidson BR. A systematic review and\nmeta-analysis of donor ischaemic preconditioning in liver transplantation. Transpl\nInt 2016;29:1147–54. https://doi.org/10.1111/tri.12849.\n[48] Hoeksma D, Rebolledo RA, Hottenrott CMV, Bodar YS, Wiersema-Buist JJ, van Goor\nH, et al. Inadequate anti-oxidative responses in kidneys of brain-dead rats. Trans￾plantation 2016. https://doi.org/10.1097/TP.0000000000001417.\n[49] Ambrosi N, Ambrosi N, Arrosagaray V, Arrosagaray V, Guerrieri D, Guerrieri D, et al.\nα-Lipoic acid protects against ischemia-reperfusion injury in simultaneous kidney￾pancreas transplantation. Transplantation 2016;100:908–15. doi:https://doi.org/10.\n1097/TP.0000000000000981.\n[50] Elke G, van Zanten ARH, Lemieux M, Mccall M, Jeejeebhoy KN, Kott M, et al. Enteral\nversus parenteral nutrition in critically ill patients: an updated systematic review\nand meta-analysis of randomized controlled trials. Crit Care 2016;20:117. https://\ndoi.org/10.1186/s13054-016-1298-1.\n[51] Koudstaal LG, T Hart Na, Ottens Pj, Van Den Berg A, Ploeg Rj, Van Goor H, Et Al.. Brain\ndeath induces inflammation in the donor intestine. Transplantation 2008;86:\n148–54. https://doi.org/10.1097/TP.0b013e31817ba53a.\n[52] Cotogni P. Management of parenteral nutrition in critically ill patients. World J Crit\nCare Med 2017;6:13–20. https://doi.org/10.5492/wjccm.v6.i1.13.\n[53] Starzl TE, Hakala TR, Shaw BW, Hardesty RL, Rosenthal TJ, Griffith BP, et al. A flexible\nprocedure for multiple cadaveric organ procurement. Surg Gynecol Obstet 1984;\n158:223–30.\n[54] Wolfrum S, Pierau C, Radke PW, Schunkert H, Kurowski V. Mild therapeutic hypo￾thermia in patients after out-of-hospital cardiac arrest due to acute ST-segment ele￾vation myocardial infarction undergoing immediate percutaneous coronary\nintervention. Crit Care Med 2008;36:1780–6. https://doi.org/10.1097/CCM.\n0b013e31817437ca.\n[55] Nielsen N, Wetterslev J, Cronberg T, Erlinge D, Gasche Y, Hassager C, et al. Targeted\ntemperature management at 33°C versus 36°C after cardiac arrest. N Engl J Med\n2013;369:2197–206. https://doi.org/10.1056/NEJMoa1310519.\n[56] Debaty G, Maignan M, Savary D, Koch F-X, Ruckly S, Durand M, et al. Impact of intra￾arrest therapeutic hypothermia in outcomes of prehospital cardiac arrest: a random￾ized controlled trial. Intensive Care Med 2014;40:1832–42. https://doi.org/10.1007/\ns00134-014-3519-x.\n[57] Li LR, You C, Chaudhary B. Intraoperative mild hypothermia for postoperative neuro￾logical deficits in people with intracranial aneurysm. Cochrane Database Syst Rev\n2016;3:CD008445. https://doi.org/10.1002/14651858.CD008445.pub3.\n[58] Moers C, Smits JM, Maathuis M-HJ, Treckmann J, van Gelder F, Napieralski BP, et al.\nMachine perfusion or cold storage in deceased-donor kidney transplantation. N Engl\nJ Med 2009;360:7–19. https://doi.org/10.1056/NEJMoa0802289.\n[59] Dhar R, Cotton C, Coleman J, Brockmeier D, Kappel D, Marklin G, et al. Comparison of\nhigh- and low-dose corticosteroid regimens for organ donor management. J Crit\nCare 2013;28:111.e1–7. https://doi.org/10.1016/j.jcrc.2012.04.015.\n[60] Pinsard M, Pinsard M, Ragot S, Ragot S, Mertes PM, Mertes PM, et al. Interest of low￾dose hydrocortisone therapy during brain-dead organ donor resuscitation: the\nCORTICOME study. Crit Care 2014;18:R158. https://doi.org/10.1186/cc13997.\n[61] Rebolledo R, Liu B, Akhtar MZ, Ottens PJ, Zhang J-N, Ploeg RJ, et al. Prednisolone has a\npositive effect on the kidney but not on the liver of brain dead rats: a potencial role\nin complement activation. J Transl Med 2014;12:111. https://doi.org/10.1186/1479-\n5876-12-111.\n[62] Pratschke J, Kofla G, Wilhelm MJ, Vergopoulos A, Laskowski I, Shaw GD, et al. Im￾provements in early behavior of rat kidney allografts after treatment of the brain￾dead donor. Ann Surg 2001;234:732–40.\n[63] Rosendale JD, Kauffman HM, Mcbride MA, Chabalewski FL, Zaroff JG, Garrity ER, et al.\nHormonal resuscitation yields more transplanted hearts, with improved early func￾tion. Transplantation 2003;75:1336–41. https://doi.org/10.1097/01.TP.0000062839.\n58826.6D.\n[64] Murry CE, Jennings RB, Reimer KA. Preconditioning with ischemia: a delay of lethal\ncell injury in ischemic myocardium. Circulation 1986;74:1124–36.\n[65] Robertson FP, Bessell PR, Diaz-Nieto R, Thomas N, Rolando N, Fuller B, et al. High\nserum aspartate transaminase levels on day 3 postliver transplantation correlates\nwith graft and patient survival and would be a valid surrogate for outcome in liver\ntransplantation clinical trials. Transpl Int 2016;29:323–30. https://doi.org/10.1111/\ntri.12723.\n[66] Mascia L, Zavala E, Bosma K, Pasero D, Decaroli D, Andrews P, et al. High tidal volume\nis associated with the development of acute lung injury after severe brain injury: an\ninternational observational study. Crit Care Med 2007;35:1815–20. https://doi.org/\n10.1097/01.CCM.0000275269.77467.DF.\nA.C. van Erp et al. / Transplantation Reviews 32 (2018) 194–206 205\n\n[67] Botha P, Rostron AJ, Fisher AJ, Dark JH. Current strategies in donor selection and\nmanagement. Semin Thorac Cardiovasc Surg 2008;20:143–51. https://doi.org/10.\n1053/j.semtcvs.2008.04.006.\n[68] Ventilation with lower tidal volumes as compared with traditional tidal volumes for\nacute lung injury and the acute respiratory distress syndrome. The Acute Respiratory\nDistress Syndrome Network. N Engl J Med 2000;342:1301–8. https://doi.org/10.\n1056/NEJM200005043421801.\n[69] Branger P, Samuel U, editors. Annual Report 2015. n.d. https://eurotransplant.org/\ncms/mediaobject.php?file=AR_ET_20153.pdf (accessed March 1, 2017).\n[70] Lung Transplantation. HttpswwwThoracicorgprofessionalscareer￾Developmentresidents-medical-Studentsats-reading-Listlung-TransplantationPhp\nn.d.\n[71] Ware LB, Ware LB, Koyama T, Koyama T, Billheimer D, Billheimer D, et al. Advancing\ndonor management research: design and implementation of a large, randomized,\nplacebo-controlled trial. Ann Intensive Care 2011;1:20. https://doi.org/10.1186/\n2110-5820-1-20.\n[72] Novitzky D, Mi Z, Sun Q, Collins JF, Cooper DKC. Thyroid hormone therapy in the\nmanagement of 63,593 brain-dead organ donors: a retrospective analysis. Trans￾plantation 2014;98:1119–27. https://doi.org/10.1097/TP.0000000000000187.\n[73] Pérez-Blanco A, Caturla-Such J, Cánovas-Robles J, Sanchez-Payá J. Efficiency of triio￾dothyronine treatment on organ donor hemodynamic management and adenine\nnucleotide concentration. Intensive Care Med 2005;31:943–8. https://doi.org/10.\n1007/s00134-005-2662-9.\n[74] James SR, James SR, Ranasinghe AM, Ranasinghe AM, Venkateswaran R,\nVenkateswaran R, et al. The effects of acute triiodothyronine therapy on myocardial\ngene expression in brain stem dead cardiac donors. J Clin Endocrinol Metab 2010;\n95:1338–43. https://doi.org/10.1210/jc.2009-1659.\n[75] Jeevanandam V. Triiodothyronine: spectrum of use in heart transplantation. Thyroid\n1997;7:139–45. https://doi.org/10.1089/thy.1997.7.139.\n[76] Mariot J, Jacob F, Voltz C, Perrier JF, Strub P. Value of hormonal treatment with triio￾dothyronine and cortisone in brain dead patients. Ann Fr Anesth Reanim 1991;10:\n321–8.\n[77] Goarin JP, Cohen S, Riou B, Jacquens Y, Guesde R, Le Bret F, et al. The effects of triio￾dothyronine on hemodynamic status and cardiac function in potential heart donors.\nAnesth Analg 1996;83:41–7.\n[78] García-Fages LC, García-Fages LC, Antolín M, Antolín M, Cabrer C, Cabrer C, et al. Ef￾fects of substitutive triiodothyronine therapy on intracellular nucleotide levels in\ndonor organs. Tps 1991;23:2495–6.\n[79] Venkateswaran RV, Patchell VB, Patchell VB, Wilson IC, Wilson IC, Mascaro JG, et al.\nEarly donor management increases the retrieval rate of lungs for transplantation.\nAnn Thorac Surg 2008;85 278–86–discussion286 https://doi.org/10.1016/j.\nathoracsur.2007.07.092.\n[80] Venkateswaran RV, Steeds RP, Steeds RP, Quinn DW, Nightingale P, Nightingale P,\net al. The haemodynamic effects of adjunctive hormone therapy in potential heart\ndonors: a prospective randomized double-blind factorially designed controlled\ntrial. Eur Heart J 2009;30:1771–80. https://doi.org/10.1093/eurheartj/ehp086.\n206 A.C. van Erp et al. / Transplantation Reviews 32 (2018) 194–206\n\n"], "response": "This systematic review examines the effectiveness of various interventions in deceased donors before organ transplantation. The review includes 33 studies involving over 10,000 patients, covering topics such as anti-oxidant treatments, corticosteroids, thyroid hormones, and lung protective strategies. The review finds that some interventions, such as mild therapeutic hypothermia and machine perfusion, show promise in improving organ function, while others, like corticosteroids, have mixed results. However, overall, the evidence base remains limited, highlighting the need for further research in this area. The review also notes that the majority of studies focus on kidney and liver transplantation, leaving gaps in knowledge regarding other types of organs. Additionally, the review highlights the importance of considering the potential risks and benefits of interventions, particularly in light of recent changes in donor demographics and increasing demand for organs. Overall, the review suggests that more rigorous and well-designed studies are needed to fully understand the efficacy and safety of interventions in deceased donors before organ transplantation."}
{"user_input": "What is the impact of macro/microsteatosis on post-transplant graft survival taking into account donor and other factors?", "retrieved_contexts": ["ARTICLE\nTransplantation of discarded livers following\nviability testing with normothermic\nmachine perfusion\nHynek Mergental 1,2,3,11✉, Richard W. Laing1,2,3,11, Amanda J. Kirkham4, M. Thamara P. R. Perera1\n,\nYuri L. Boteon 1,2,3, Joseph Attard1,2,3, Darren Barton 5, Stuart Curbishley2,3, Manpreet Wilkhu5,\nDesley A. H. Neil 2,3,6, Stefan G. Hübscher2,3,6, Paolo Muiesan1\n, John R. Isaac1\n, Keith J. Roberts1,3,\nManuel Abradelo1\n, Andrea Schlegel1,3, James Ferguson1,2, Hentie Cilliers1\n, Julian Bion7, David H. Adams1,2,3,\nChris Morris 8, Peter J. Friend8,9, Christina Yap 4,10,11, Simon C. Afford2,3,11✉ & Darius F. Mirza 1,2,3,11✉\nThere is a limited access to liver transplantation, however, many organs are discarded based\non subjective assessment only. Here we report the VITTAL clinical trial (ClinicalTrials.gov\nnumber NCT02740608) outcomes, using normothermic machine perfusion (NMP) to\nobjectively assess livers discarded by all UK centres meeting specific high-risk criteria. Thirty￾one livers were enroled and assessed by viability criteria based on the lactate clearance to\nlevels ≤2.5 mmol/L within 4 h. The viability was achieved by 22 (71%) organs, that were\ntransplanted after a median preservation time of 18 h, with 100% 90-day survival. During the\nmedian follow up of 542 days, 4 (18%) patients developed biliary strictures requiring re￾transplantation. This trial demonstrates that viability testing with NMP is feasible and in this\nstudy enabled successful transplantation of 71% of discarded livers, with 100% 90-day\npatient and graft survival; it does not seem to prevent non-anastomotic biliary strictures in\nlivers donated after circulatory death with prolonged warm ischaemia.\nhttps://doi.org/10.1038/s41467-020-16251-3 OPEN\n1 Liver Unit, Queen Elizabeth Hospital, University Hospitals Birmingham NHS Foundation Trust (UHBFT), Birmingham, UK. 2National Institute for Health\nResearch (NIHR), Birmingham Biomedical Research Centre, University of Birmingham and University Hospitals Birmingham NHS Foundation Trust,\nBirmingham, UK. 3 Centre for Liver and Gastrointestinal Research, Institute of Immunology and Immunotherapy, University of Birmingham, Birmingham, UK. 4 Cancer Research UK Clinical Trials Unit, University of Birmingham, Birmingham, UK. 5D3B team, Cancer Research UK Clinical Trials Unit, University of\nBirmingham, Birmingham, UK. 6Department of Cellular Pathology, Queen Elizabeth Hospital, University Hospitals Birmingham NHS Foundation Trust\n(UHBFT), Birmingham, UK. 7Department of Intensive Care Medicine, University of Birmingham, Birmingham, UK. 8 OrganOx Limited, Oxford, UK. 9Nuffield\nDepartment of Surgical Sciences, University of Oxford, Oxford, UK. 10 Clinical Trials and Statistics Unit, The Institute of Cancer Research, London, UK. 11These\nauthors contributed equally: Hynek Mergental, Richard W. Laing, Christina Yap, Simon C. Afford, Darius F. Mirza. ✉email: hynek.mergental@uhb.nhs.uk;\nS.C.AFFORD@bham.ac.uk; darius.mirza@uhb.nhs.uk\nNATURE COMMUNICATIONS | (2020) 11:2939 | https://doi.org/10.1038/s41467-020-16251-3 | www.nature.com/naturecommunications 1\n1234567890():,;\n\nL\niver transplantation is a life saving treatment for selected\npatients with end-stage liver disease, primary liver cancer\nand fulminant hepatic failure. The incidence of liver disease\nhas risen by 500% over the last 4 decades, however, access to\ntransplantation is limited by the shortage of donor organs1. As a\nconsequence, 240 patients (19%) waiting for liver transplantation\nin the United Kingdom either died or were removed from the\nwaiting list in 2016–20172. Data from the United States shows a\nsimilar pattern, comprising 32% of those listed for transplant\n(3629 patients) within 3 years of listing2,3. The demand for liver\ngrafts has driven the wider use of extended criteria donors4.\nHowever, these are associated with an increased risk of primary\nnon-function or delayed failure5–9, and the acceptance of these\nhigher-risk organs varies widely10. Because of these inferior\noutcomes, and the difficulty of predicting organ viability, many\npotential donor organs remain unutilised. The high waiting list\nmortality justifies the utilisation of more marginal grafts, but\ncurrent practice requires risk mitigation by matching high-risk\nlivers to lower-risk recipients to achieve patient survival rates that\nare acceptable11. Furthermore, the determination of suitability of\na graft for transplantation largely depends on a surgeon’s sub￾jective assessment of the graft’s appearance, using criteria that are\nknown to be unreliable12.\nOrgan preservation currently relies upon cooling to ice tem￾perature to reduce cellular metabolism, and infusing specialist\nsolutions to limit cellular damage. Oxygen deprivation and accu￾mulation of by-products of anaerobic metabolism limit the dura￾tion of storage and result in ischaemia–reperfusion injury at the\ntime of implantation. This process is more severe in marginal\norgans13. Normothermic machine perfusion (NMP) has been\nshown to reduce preservation-related graft injury compared to\nstatic cold storage in transplantable livers, according to current\nselection criteria, in a prospective European trial, which also\ndemonstrated increased utilisation of organs14. In NMP, the liver is\nsupplied with oxygen, nutrients and medication at physiological\ntemperature and pressures, maintaining conditions that support\nhomoeostasis, normal metabolic activity and objective assessment\nof function in real-time. Experimental data have shown that end￾ischaemic NMP facilitates replenishment of adenosine tripho￾sphate and glycogen levels. Based on increasing clinical experience,\nviability criteria have emerged; these are objective parameters,\nmeasurable during NMP15. Whilst the feasibility of this approach\nhas been demonstrated in a proof-of-concept series, it has not been\nvalidated in a rigorous clinical trial16,17.\nWe therefore conducted this prospective, non-randomised,\nadaptive phase 2 trial in a large single centre, to evaluate the\npotential of NMP to provide objective assessment of the viability\nof livers currently deemed unsuitable for transplantation, and to\ntransplant those that met predetermined criteria. The primary\nclinical objective underlying this project was the increased and\nsafe utilisation of livers which are currently discarded.\nThe trial demonstrates that viability testing with NMP is fea￾sible, and the objective assessment enables successful transplan￾tation of 71% of perfused discarded livers, with 100% 90-day\npatient and graft survival. The intervention does not seem to\nprevent the development of non-anastomotic biliary strictures in\nlivers donated after circulatory death (DCD) with prolonged\ndonor warm ischaemic times.\nResults\nCharacteristics of discarded liver offers and study participants.\nOver the 16-month study duration from November 2016 to\nFebruary 2018, there were 185 livers discarded for clinical use and\noffered for research. Characteristics of those offers and the study\ninclusion flowchart are provided in Fig. 1a, b.\nOne hundred and sixty-four patients on the waiting list were\napproached for potential participation, of which 53 were\nconsented, and 22 were enroled in the study and received rescued\ngrafts. The potential participants were counselled regarding the\nhigh-risk nature of the project and unknown long-term outcomes\nof resuscitated livers. As a consequence, a proportion of patients\nwere understandably reluctant to participate, and therefore the\nlack of suitable consented recipients was the principal rate limiting\nfactor for inclusion. The number of consented patients at any\ngiven time ranged from 1 to 9; the flow diagram displaying the\nprogress of patients through the trial is shown in Fig. 2.\nDonor liver characteristics and liver biopsy features. In 8 (26%)\ndonors the liver was the only procured organ. All discarded donor\nlivers entered in the study satisfied one or more of the inclusion\nhigh-risk criteria. The livers enroled in the trial consisted of 17\norgans donated after brainstem death (DBD) and 14 DCD. Many\nof these organs looked grossly suboptimal, with some degree of\nsteatosis, capsular fibrosis or rounded edges with multifactorial\nreasons for discard, that was captured by the donor risk index\n(DRI) > 2.0 in 22 (71%) livers, with the median DRI 2.2 (1.9–2.9).\nDetailed characteristics are shown in Table 1 and Supplementary\nTable 1. Photos of all included livers are presented in Fig. 3. The\ntransplanted livers were typically smaller than non-viable ones\n(1.7 vs. 2.0 kg, p = 0.015; Kruskal–Wallis test), with lower peak\npre-mortem donor liver enzyme levels. The median static cold\nstorage time before starting NMP was 7 h:44 min (6:29–10:25).\nOnly 3 (10%) livers were included in the trial primarily for\nmacrosteatosis >30%, (50%, 80% and 60% macrovesicular stea￾tosis combined with 11 h:55 min, 12 h:00 min and 6 h:15 min cold\nischaemia, respectively). Glycogen content and steatosis degree\ndid not predict the viability assessment results. The detailed\nhistological finding of each study liver is provided in Supple￾mentary Table 2.\nPerfusion parameters assessment. During the NMP procedure\n25 livers quickly recovered metabolic activity and cleared lactate\nto the target level (details provided in Fig. 4). A biopsy of a\nsuspicious donor colonic lesion confirmed malignancy, making\none liver unsuitable for transplantation, after meeting the viability\ncriteria. In three livers, criteria were initially met, however,\nmetabolic function thereafter deteriorated within the first 4 h,\nwith increasing lactate. In two cases the transplant procedure was\nnot commenced and the livers were discarded. In the third, the\nexplant had begun, and the procedure continued. Overall, 22\n(71%) livers met the viability criteria and were transplanted fol￾lowing a median total preservation time of 17 h:53 min\n(16:17–21:48; Table 2).\nThe study patients. The majority (64%) of recipients were men,\nand median age was 56 (46–65) years. The leading indication for\ntransplantation was alcohol-related liver disease (36%), followed\nby primary sclerosing cholangitis (27%) and non-alcoholic stea￾tohepatitis (18%). In three (14%) patients the underlying liver\ndisease was complicated by liver cancer. The median UKELD18\nscore was 52 (49–55), with a calculated laboratory MELD score of\n12 (9–16). Details are provided in Table 2 and Supplementary\nTable 3.\nCo-primary study outcomes. Thirty-one livers were enroled into\nthe trial for objective assessment by NMP. Twenty-two of these\nlivers met the viability criteria and were transplanted, resulting in\na significant successful rescue rate of 71% (22/31, 90% Wilson CI:\n56.3–82.2%), to conclude that the procedure is feasible. All 22\nARTICLE NATURE COMMUNICATIONS | https://doi.org/10.1038/s41467-020-16251-3\n2 NATURE COMMUNICATIONS | (2020) 11:2939 | https://doi.org/10.1038/s41467-020-16251-3 | www.nature.com/naturecommunications\n\n(100%) transplanted patients were alive at day 90 post-trans￾plantation—greater than the 18/22 required by the trial design.\nTransplant outcomes. Graft 90-day survival was 100%. Seven\n(32%) patients developed early allograft dysfunction, and 7 (32%)\npatients developed Clavien–Dindo complication grade ≥3,\nincluding 4 (18%) cases with acute kidney injury requiring renal\nreplacement therapy. The median intensive care and in-hospital\nstays were 3.5 days (3–4) and 10 days (8–17), respectively. The 1-\nyear patient and graft survival were 100% and 86%, respectively.\nDetails are provided in Table 3.\nVascular and biliary complications. One patient developed an\nintra-operative hepatic artery thrombosis after receiving a DBD\ngraft that had sustained a hepatic arterial injury during procure￾ment. The artery was reconstructed but post-operatively throm￾bosed, undergoing emergency revascularisation which achieved\nlong-lasting arterial patency. The graft, however, developed biliary\nstrictures requiring multiple interventions and eventual re￾transplantation.\nThe per-protocol magnetic resonance cholangiopancreatogra￾phy (MRCP) imaging at 6 months revealed that 2 (9%) patients\ndeveloped anastomotic, and 4 (18%) patients non-anastomotic\nbiliary strictures that presented with cholestatic symptoms. With\nthe exception of the patient with hepatic artery thrombosis, all\nbiliary strictures affected recipients of DCD grafts. During the\nstudy median follow up of 542 days (456–641), 4 patients\nunderwent liver re-transplantation (at day 120, 225, 375 and 417).\nThe details are provided in Table 3 and Supplementary Table 3.\nComparison of outcomes with contemporary matched con￾trols. Patient and graft survival rates at 12 months (100% and\n86%, respectively) were similar to the matched controls (96% and\n86%, respectively) as shown in Fig. 5. The incidence of early\nallograft dysfunction was higher in the study group (32% vs. 9%,\nodds ratio 5.6, 95% CI: 1.1–27.8, p = 0.034; conditional logistic\n185 Retrieved livers were discarded and offered for research\n126 Livers were suitable for the trial consideration\n31 Livers were included and perfused \n22 Perfused livers met criteria and were transplanted\n9 Livers were not transplanted\n6 Failed to meet criteria\n1 Liver was excluded because of donor cancer after perfusion\ncommenced (the liver met criteria)\n2 Livers met criteria but deteriorated prior to LT started\n95 Livers could not be included \n1 Was used for a test perfusion required by MHRA\n25 Livers did not meet high-risk inclusion criteria\n21 Offers were declined because another perfusion was in progress\n22 Livers had no blood group suitable recipient\n19 Livers had no size matched suitable recipient\n7 Arrived with the cold ischaemia beyond the study criteria\n59 Livers were excluded\n22 Were unsuitable because of fibrosis or donor cancer\n13 Were damaged or had unfavourable anatomy\n11 Were already perfused\n13 Donors had other contraindications\na b\nSteatosis Logistics\nDonor complexity/Other Contraindication\nSteatosis (subjective)\nWarm ischaemic time\nSummative Donor history\nCancer/Fibrosis (biopsy)\nPoor machine perfusion\nSteatosis (biopsy)\nLogistics\nOther\nAnatomy/Damage\n13; 7%\n11; 6%\n22; 12%\n13; 7%\n17; 9%\n15; 8% 16; 9%\n14; 7%\n64; 35%\nFig. 1 Information about discarded livers in the UK between November 2016 and February 2018. a The study livers inclusion flowchart. Over the\n16-month study period there were 185 discarded liver research offers, of which 59 (32%) were not eligible for the trial due to an incidental finding of\ncancer, macroscopically apparent cirrhosis or advanced fibrosis, severe organ damage or previous machine perfusion. There were 126 livers suitable for the\ntrial, with steatosis being the leading cause of organ discard with 78 (42%) offers. Stringent donor inclusion criteria were not met in 25 (14%) offers and on\n21 (11%) occasions the research team was already committed to the perfusion of another study liver. A liver was considered for the trial only if it could be\nallocated to a consented, potential blood group- and size-matched low-risk recipient. Many recipients were apprehensive to participate in such a high-risk\nclinical trial, and as a consequence, at any given time there were usually only one to three patients consented. A significant proportion of approached\npatients declined to take part, or were transplanted with a standard quality liver before agreeing to take part in this study. Eventually, thirty-one livers were\nenroled to the trial, of which 22 (71%) grafts met the viability criteria and were successfully transplanted. b A summary of reasons for livers being\ndiscarded in the United Kingdom between November 2016 and February 2018. A total of 64 livers were discarded for severe steatosis on visual\nassessment, with 14 discarded for severe steatosis based on urgent liver biopsy. A percentage of livers were declined due to intra-abdominal or lung\nmalignancies (e.g. colonic cancer in donor 22). This did not include primary brain tumours or small renal cell cancers which are almost always considered\nfor donation. The reasons for logistic discard, include the transplant team already being committed to one or more transplantations, lack of a suitable\nrecipient or too long an anticipated cold ischaemia time due to delays with transportation.\nNATURE COMMUNICATIONS | https://doi.org/10.1038/s41467-020-16251-3 ARTICLE\nNATURE COMMUNICATIONS | (2020) 11:2939 | https://doi.org/10.1038/s41467-020-16251-3 | www.nature.com/naturecommunications 3\n\nregression). There were no differences in the other assessed\nparameters, including the need for post-transplant renal repla￾cement therapy, hospital stay or incidence of Clavien–Dindo\ngrade ≥ 3 complication rates. The incidence of clinically manifest\nnon-anastomotic biliary strictures was higher in the study group\n(18% vs. 2%, odds ratio 8.0, 95% CI: 0.9–71.6; p = 0.063; condi￾tional logistic regression), although this result needs to be inter￾preted with caution as the matched control patients did not\nreceive systematic bile duct imaging. Due to the small sample\nsizes these comparison results should be interpreted with caution,\nand the controls were included to present the study results within\nthe context of the unit’s contemporary outcomes. The details are\nshown in Table 3.\nDiscussion\nUtilisation of livers from organ donors is currently a major\nchallenge in liver transplantation19. Despite a waiting list mor￾tality in Western countries reaching 20–30%, an increasing pro￾portion of extended criteria livers are unused due to concerns of\nprimary non-function and early graft dysfunction20,21. The\ndecision to discard donor livers is still largely based upon donor\nhistory and subjective assessment by the transplanting surgeon.\nStandard cold static preservation does not allow for any assess￾ment of liver function, and the only other source of information is\nliver histology, which is able to diagnose severe large droplet fatty\nchange, a well-recognised risk factor for non-function21. This\nstudy has demonstrated that moving from subjective evaluation\nto objective testing during NMP might salvage a high proportion\nof those livers that are currently discarded. The need to improve\nthe method by which high-risk livers are assessed was illustrated\nin this study by the absence of significant differences in the donor\ncharacteristics between transplanted and discarded livers.\nThe present trial is the first to systematically investigate\nobjective viability criteria in livers that met specific high-risk\nfeatures in organs initially considered “untransplantable”11,22.\nOne major challenge addressed in the VITTAL trial design was\nthat each discarded liver had to also fulfil one or more pre￾defined objective high-risk criteria, as the considerations for liver\ntransplantability are always multi-factorial, including the reci￾pientʼs condition, logistical aspects and the surgeon’s (or trans￾plant centre’s) experience and risk-taking attitude. The utilisation\nof marginal livers in the United Kingdom was facilitated by the\ncentre-based liver allocation system, allowing the use of high-risk\norgans in any patient on the waiting list. All enroled organs were\nsimultaneously fast-track offered to all UK transplant centres\nfollowing the initial decline, and the fact that none of the seven\ncentres were comfortable using any of the livers included in this\ntrial confirms that these organs were uniformly perceived to be of\nvery poor quality. Our team genuinely aimed to push the\nboundaries of utilisation of the highest risk organs by accessing\nParticipant\nenrollment\nAllocation\nFollow up\nAnalysis\nPatients on waiting list approached and\nassessed for eligibility (n = 164)\nExcluded (n = 111)\nMet exclusion criteria; not suitable for\nmarginal graft (n = 48)\nDeclined to take part (n = 22)\nTransplanted with standard livers prior\nto giving study consent (n = 41)\nConsented (n = 53)\nNo randomisation\nTransplanted with standard livers prior to being\noffered a rescued liver (n = 29)\nPatient remained on waiting list (n = 2)\nTransplanted with VITTAL rescued livers (n = 22)\nPassed stage 1 (3 successes/3 patients) and stage 2\n(11 successes/11 patients) interim assessments\nDiscontinued study following liver\nre-transplantation at day 225 (n = 1)\nTransplanted patients analysed for primary\noutcome (90-day survival) and short-term\nsecondary outcomes (n = 22)\nFig. 2 CONSORT flow diagram displaying the progress of patients through the trial. One hundred and sixty-four patients on the waiting list were\napproached for potential trial participation. Of those, 111 were excluded; 48 patients met exclusion criteria and were not suitable for a marginal liver graft.\nTwenty-two patients declined to take part and 41 patients either received a transplant before they provided study consent, or were de-listed, or\nsubsequently met exclusion criteria. Eventually 53 patients consented to the study, of which 29 underwent transplantation with a standard quality liver\nallocated outside the trial. Twenty-two patients were enroled in the trial and received a salvaged liver.\nARTICLE NATURE COMMUNICATIONS | https://doi.org/10.1038/s41467-020-16251-3\n4 NATURE COMMUNICATIONS | (2020) 11:2939 | https://doi.org/10.1038/s41467-020-16251-3 | www.nature.com/naturecommunications\n\nthe benefit of rigorous peer-review and continual oversight within\nthe framework of a clinical trial. We included only organs that\nour team did not feel comfortable to use otherwise, and this\nattitude was reflected by the 2-tier liver inclusion process\nembedded in the trial design, and by the fact that 25 livers, that\nwould very likely meet the transplantability criteria, were not\nconsidered for study inclusion. Some of the study livers might\nhave been transplantable if the cold ischaemia was very short and\na suitable recipient was waiting, but currently the majority of\nthese organs are discarded. With the introduction of the National\nAllocation system, logistical constraints exacerbated by static cold\nstorage are increasingly common and prevent the utilisation of a\nrising proportion of marginal livers. In these circumstances, NMP\nmitigates the reperfusion process, allowing assessment of the\norgan during perfusion without exposing patients to the risk of\nprimary non-function. In addition, livers discarded due to hae￾modynamic instability (during procurement or during the pro￾cess of brain stem death itself), high liver transaminases or poor\nin situ flush, benefited from perfusion in a controlled, near\nphysiological environment thereby facilitating their recovery. The\npotential to recondition the liver in the interval between retrieval\nand implantation has hitherto not been possible.\nAn intervention which increases successful utilisation of high￾risk livers will transform access to transplantation to meet pre￾dicted increasing demand, particularly given trends in donor\ndemographics and declining organ quality4. Whilst organ\nTable 1 Donor and liver characteristics (median, interquartile range).\nDonor characteristics Non-transplanted (n = 9) Transplanted (n = 22) Overall (n = 31) p Valuea\nAge in years (range) 57 (52–60) 56 (45–65) 57 (45–63) 0.948\nSex—n (%) 0.696\nFemale 3 (33.3) 10 (45.5) 13 (41.9)\nMale 6 (66.7) 12 (54.5) 18 (58.1)\nHeight (cm) 174 (172–186) 170 (165–175) 170 (166–175) 0.038\nBodyweight (kg) 79 (75–88) 81 (70–90) 80 (70–90) 0.662\nBody mass index (kg/m2) 28.7 (24.8–29.1) 29.3 (26.5–32.4) 28.7 (24.8–32.1) 0.372\nLiver weight (kg) 2.0 (1.8–2.4) 1.7 (1.3–1.9) 1.8 (1.4–2.0) 0.015\nPeak alanine transferase (IU/ml) 323 (92–1143) 48 (33–159) 83 (36–287) 0.034\nPeak gamma-glutyl transferase (IU/ml) 169 (107–335) 80 (42–111) 92 (57–203) 0.012\nPeak bilirubin (µmol/L) 10 (10–18) 11 (7–22) 11 (8–22) 0.768\nHistory of excessive alcohol use—n (%) 5 (55.6) 5 (22.7) 10 (32.3) 0.105\nDiabetes mellitus—n (%) 0 (0.0) 2 (9.1) 2 (6.5) 1.000\nDonor type—n (%) 1.000\nDonor after brain death 5 (55.6) 12 (54.5) 17 (54.8)\nDonor after circulatory death 4 (44.4) 10 (45.5) 14 (45.2)\nDonor warm ischaemic time (min)b 20.0 (15.5–22.5)b n = 4 22.5 (19.0–35.0)b n = 10 21.0 (19.0–25.0)b n = 14 0.394\nQuality of in situ flush—n (%) 0.016\nPoor 3 (33.3) 4 (18.2) 7 (22.6)\nFair 4 (44.4) 1 (4.5) 5 (16.1)\nGood 2 (22.2) 17 (77.3) 19 (61.3)\nCold ischaemic time (min) 550 (436–715) 452 (389–600) 464 (389–625) 0.277\nDonor risk indexc 2.3 (2.0–2.7) 2.1 (1.9–3.0) 2.2 (1.9–2.9) 0.728\nHistological steatosis assessment—n (%)d 0.113\n<30% steatosis 2 (22.2) 13 (59.1) 15 (48.4)\n>30% steatosis 7 (77.8) 9 (40.9) 16 (51.6)\nInclusion criteriae\nDonor risk index >2.0 6 (66.7) 16 (72.7) 22 (71.0) 1.000\nSteatosis principal reason to discardf 1 (11.1) 2 (9.1) 3 (9.7) 1.000\nHigh liver transaminases 3 (33.3) 2 (9.1) 5 (16.1) 0.131\nBalanced risk score >9 Not applicable 2 (9.1) Not applicable Not applicable\nExtensive cold ischaemic time 2 (22.2) 3 (13.6) 5 (16.1) 0.613\nExtensive donor warm ischaemic time 0 (0.0) 3 (13.6) 3 (9.7) 0.537\nPoor in situ flush 3 (33.3) 4 (18.2) 7 (22.6) 0.384\nPerfusion criteria\nLactate clearance <2.5 mmol/L 3 (33.3) 22 (100.0) 25 (80.6) <0.0001\npH ≥ 7.30 3 (33.3) 19 (86.4) 22 (71.0) 0.007\nPresence of bile production—n (%) 6 (66.7) 18 (81.8) 24 (77.4) 0.384\nBile volume (mL) 10 (2–18) 60 (15–99) 46 (2–90) 0.100\nGlucose metabolism 4 (44.4) 20 (90.9) 24 (77.4) 0.012\nVascular flows criteria met 9 (100) 22 (100) 31 (100) Not applicable\nHomogenous liver perfusion 7 (77.8) 22 (100.0) 29 (93.5) 0.077\nNote: Body mass index is the weight in kilograms divided by the square of the height in metres. aGroups compared by Kruskal–Wallis test to assess differences in continuous variables and Fisher’s exact test for categorical variables. Due to the small sample sizes and that the statistical comparison\ntests were not powered, these results should be interpreted with caution.\nbDonor warm ischaemic time is defined as the period from the systolic blood pressure decrease below 50 mmHg to commencing the aortic cold flush; this variable applicable only for donors after\ncirculatory death.\ncDonor risk index as described by Feng et al.20. dThe steatosis includes large and medium droplets steatosis assessment obtained from post-transplant paraffin sections (this result was not known at the time of the liver inclusion). eEach trial liver had to meet one or more of the following inclusion criteria: donor risk index greater than 2.0; biopsy proven liver steatosis greater than 30%; donor transaminases (aspartate transaminase\nor alanine transaminase) greater than 1000 IU/mL; warm ischaemic time greater than 30 min in donors after circulatory death; extensive cold ischaemic time (defined as the period between the aortic\ncold flush to the liver implantation, or commencing the normothermic perfusion) greater than 12 and 8 h for donors after brainstem death and circulatory death, respectively; suboptimal liver flush\ndocumented by photograph and a transplant surgeon assessment; balanced risk score greater than 9.\nf\nThis steatosis variable refers to the study inclusion criteria and the results were known before the transplant based on frozen sections histology assessment.\nNATURE COMMUNICATIONS | https://doi.org/10.1038/s41467-020-16251-3 ARTICLE\nNATURE COMMUNICATIONS | (2020) 11:2939 | https://doi.org/10.1038/s41467-020-16251-3 | www.nature.com/naturecommunications 5\n\ndonation in the UK has increased from 676 to 1149 donors per\nannum between 2008 and 2018, the proportion of retrieved livers\nthat were discarded has nearly doubled (from 8 to 15%; data from\nthe UK Organ Donation and Transplantation Registry, www.odt.\nnhs.uk), indicating reluctance of surgeons to accept these organs\nfor their increasingly sicker recipients. In 2017–2018, not only\nwere 174 retrieved livers discarded, but 425 livers from solid\norgan donors were not even considered suitable for retrieval (11%\nof DBD and 52% of DCD); it is reasonable to assume that many\nof these would be suitable for testing with NMP. Salvaging a\nproportion of these retrieved but discarded organs would add a\ngood number of transplantable livers annually in the UK, sig￾nificantly reducing waiting list mortality.\nInternational comparisons demonstrate regional variations in\ndonor demographics and there is evidence that in countries with\nhigher initial organ acceptance rates there is also a higher discard\nrate, particularly for older donors23,24. Viability testing provides\nobjective evidence of liver function with clearance of metabolic\nacidosis, vascular flows, glucose parameters and bile production;\nthese give the transplant surgeon the confidence to use these\norgans safely, and minimises the physical and emotional impact\nof non-transplantation for patients.\n1 2 3 4 5\n6 7 8 9 10\n11 12 13 14 15\n16 17 18 19 20\n21 22 23 24 25\n26 27 28 29 30\n31\nFig. 3 The study liver photographs. The figure shows all 31 livers included in the trial. The red frames designate non-transplanted organs and the yellow\ndot livers donated after circulatory death.\nARTICLE NATURE COMMUNICATIONS | https://doi.org/10.1038/s41467-020-16251-3\n6 NATURE COMMUNICATIONS | (2020) 11:2939 | https://doi.org/10.1038/s41467-020-16251-3 | www.nature.com/naturecommunications\n\nIn the presented study the NMP was commenced following a\nmedian cold storage time reaching 8 h. Whilst this approach may\nsimplify adoption of the NMP technology without compromising\noutcomes in transplantable livers25, recovery of organs from\ndonors with multiple high-risk features might be further facili￾tated by limiting cold ischaemia through commencing the per￾fusion immediately after procurement in the donor hospital14.\nInevitably there will always be livers that are not suitable for\ntransplantation, demonstrated by 30% of offers with macroscopic\ncirrhosis, biopsy-proven fibrosis or an incidental finding of donor\ncancer. A similar proportion of the livers, however, did not meet\nany of our high-risk criteria and were therefore considered “too\ngood” for inclusion. It is reasonable to assume that NMP\nassessment would have provided the reassurance needed to justify\ntransplantation in this group as well.\nImprovements in transplant logistics is one of the major\nadvantages of NMP14,25,26, and the study allowed for the machine\nperfusion duration to be between 4 h (time needed for the via￾bility assessment) and 24 h (maximum recommended time by the\nperfusion device manufacturer). Once the liver met the viability\ncriteria we aspired to commence the transplantation as soon as\npossible; however, the perfusion was often extended to allow for a\nday-time procedure, or to facilitate transplant logistics in the unit.\nFrom our experience, 4–6 h perfusion seems to be sufficient for\nadequate assessment and replenishment of the organ’s energy\nresources. Due to recirculation of metabolites accumulated in the\norgans during cold ischaemia, the high-risk organs probably do\nnot benefit from prolonged perfusion. The impact of NMP\nduration on livers initially exposed to prolonged cold ischaemia is\nan area of our ongoing research interest.\nTransplant surgeons in many countries are expanding the\ndonor pool with the use of organs donated after circulatory\ndeath27. In the context of liver transplantation, the longevity of\nthese organs might be compromised by development of non￾anastomotic biliary strictures8. The incidence of clinically man￾ifest non-anastomotic biliary strictures in the DCD grafts cohort\nwas 30% (3 out of 10 grafts), higher than the study matched\ncontrols group, but similar to other reported high-risk DCD\nseries28. In concordance with the European prospective nor￾mothermic preservation trial, our results suggested that MRCP\nfindings are likely to over-estimate the incidence of biliary com￾plications14. The per-protocol investigation at the 6-month time\npoint would identify over 80% of the clinically relevant biliary\nstrictures and asymptomatic irregularities with varying clinical\nsignificance28. The presented findings are accurate, as the images\nwere correlated with clinical reviews and liver function tests\nthrough the median follow up of 542 (range: 390–784) days.\nNevertheless, it is clear that end-ischaemic NMP does not prevent\nthe development of non-anastomotic biliary strictures in high￾risk DCD organs, and our outcomes suggest that extending the\ndonor warm times beyond the currently widely accepted limit of\n30 min is not advisable. This finding was not anticipated at the\ntime of trial design or during the conduct of the trial and only\nbecame evident during the long-term follow up of these grafts\nbeyond the primary end point of 90 days. Further work is needed\nto identify new limits (e.g. donor characteristics, warm ischaemia\ntime and cold ischaemia time) and to define perfusion biomarkers\nthat predict this complication and avoid futile transplantation.\nRecently published research suggests that the composition of bile\nproduced during perfusion (pH, bicarbonate and glucose\n0\n5\n10\n15\n20\n0\n5\n10\n15\n20\n0\n5\n10\n15\n20\n0\n5\n10\n15\n20\n0\n5\n10\nArterial lactate measurement (mmol/L)\n15\nPerfusion time (minutes)\n20\n0\n5\n10\n15\n20\n0 500 1000 1500\n0 500 1000 1500\n0 500 1000 1500 0 500 1000 1500 0 500 1000 1500 0 500 1000 1500\n123456\n7 8 9 10 11 12\n13 14 15 16 17 18\n19 20 21 22 23 24\n25 26 27 28 29 30\n31\nFig. 4 The study liver lactate clearance. Plots of individual liver arterial lactate clearance measured during the NMP perfusion, showing transplantation\neligibility thresholds with red lines for lactate levels less than or equal to 2.5 mmol/L. Graphs with grey shading designate livers that were not transplanted.\nLiver number 22 was from a donor that was unexpectedly diagnosed with a cancer following organ donation.\nNATURE COMMUNICATIONS | https://doi.org/10.1038/s41467-020-16251-3 ARTICLE\nNATURE COMMUNICATIONS | (2020) 11:2939 | https://doi.org/10.1038/s41467-020-16251-3 | www.nature.com/naturecommunications 7\n\nTable 3 Post-transplant outcomes.\nStudy patients (n = 22) Control patients (n = 44) Overall (n = 66) OR (95% CI), p Value\nPost-transplant outcomes\nPrimary graft non-function—n (%) 0 (0.0) 1 (2.3) 1 (1.5) 1.000a,b\nEarly allograft dysfunction—n (%) 7 (31.8) 4 (9.1) 11 (16.7) 5.62 (1.14–27.79), 0.034e\nRenal replacement therapy—n (%) 4 (18.2) 11 (25.0) 15 (22.7) 0.68 (0.19–2.38), 0.542e\nIntensive care unit stay (days) 3.5 (3–4) 2.0 (1–5) 3·0 (2.5) 1.02 (0.95–1.10), 0.566e\nIn-hospital stay (days) 10 (8–17) 9 (8–11) 10 (8–13) 1.00 (0.96–1.05), 0.822e\nClavien–Dindo complication grade ≥3—n (%) 7 (31.8) 17 (38.6) 24 (36.4) 0.089a,b\n90-day graft survival—n (%) 22 (100) 41 (93.2) 63 (95.5) 0.545a,b\n90-day patient survival—n (%) 22 (100) 44 (100) 66 (100) Not applicable\n1-year graft survival—n (%)d 19 (86.4) 38 (86.4) 57 (86.4) 1.000 (0.18–5.46), 1.000e\n1-year patient survival—n (%)d 22 (100) 42 (95.5) 64 (97.0) 0.55a,b\nBiliary complication—n (%)c\nAnastomotic biliary strictured 2 (9.1) 3 (6.8) 5 (7.6) 1.44 (0.19–11.12), 0.725c,e\nNon-anastomotic biliary strictured 4 (18.2) 1 (2.3) 5 (7.6) 8.00 (0.89–71.58); 0.063d,e\nDBD livers (n = 12) DCD liver (n = 10) Overall (n = 22) p Valueb\nStudy patient biliary strictures\nAnastomotic within 6 monthsd—n (%) 1 (8.3) 0 (0.0) 1 (4.5) 1.000a\nAnastomotic within 12 monthsf\n—n (%) 1 (8.3) 1 (10.0) 2 (9.1) 1.000a\nNon-anastomotic within 6 monthsd—n (%) 1 (8.3)g 2 (20.0) 3 (13.6) 0.571a\nNon-anastomotic within 12 monthsf\n—n (%) 1 (8.3)f 3 (30.0) 4 (18.2) 0.293a\nn number, OR odds ratio, CI confidence interval, DBD donation after brainstem death, DCD donation after circulatory death.\nNote: The result needs to be interpreted with caution as the control patients did not receive systematic bile duct imaging; in this group one patient developed non-anastomotic biliary strictures, one died\n16 months after the transplantation from biliary sepsis and one is alive with a complex hilar stricture not amenable to any therapeutic intervention.\nap Value obtained from Fisher’s exact test. bDue to the small sample sizes and that the statistical comparison tests were not powered, these results should be interpreted with caution.\ncThe figures represent strictures manifested with cholestasis and elevated liver enzymes. dData were assessed at scheduled study visits up to and including the 12-month follow-up visit.\nep-Values obtained from conditional logistic regression. f\nStricture developed in patient suffering from hepatic artery occlusion requiring revascularisation within 24 h following the transplant.\nTable 2 Transplant recipient and graft characteristics (median, interquartile range).\nRecipient characteristics Trial patients (n = 22)\nAge in years 56 (46–65)\nSex—n (%)\nFemale 8 (36.4)\nMale 14 (63.6)\nBody mass index 28.5 (24.0–31.0)\nUK end-stage liver disease score 52 (49–55)\nModel for end-stage liver disease scorea 12 (9–16)\nTransplant indication—n (%)\nAlcohol-related liver disease 8 (36.4)\nNon-alcohol steatohepatitis 4 (18.2)\nHepatitis C virus 2 (9.1)\nPrimary biliary cirrhosis 2 (9.1)\nPrimary sclerosing cholangitis 6 (27.3)\nHepatocellular carcinomab 3 (13.6)\nNeed for intra-operative CVVH – n (%) 1 (4.5)\nGraft and transplant details Overall (n = 22) DBD (n = 12) DCD (n = 10) p Valuec\nCold ischaemic time (min) 452 (316–600) 507 (408–718) 416 (354–464) 0.075\nImplantation time (min) 28 (22–35) 30 (26–38) 26 (22–35) 0.390\nMachine perfusion time (min) 587 (450–705) 629 (509–700) 549 (424–780) 0.598\nTotal preservation time (min) 1073 (977–1308) 1170 (1038–1367) 1000 (874–1097) 0.075\nPost-reperfusion syndrome 10 (45.5) 2 (16.7) 8 (80.0) 0.008\nn number, CVVH continuous veno-venous haemofiltration, DBD donor after brainstem death, DCD donor after circulatory death.\nNote: Body mass index is the weight in kilograms divided by the square of the height in metres. Donor warm ischaemic time is defined as the period from the systolic blood pressure decrease below\n50 mmHg to commencing the aortic cold flush. Cold ischaemic time is defined as the time between the start of the cold flush during retrieval until the start of machine perfusion. Early allograft\ndysfunction consists of the presence of one or more of the following variables: (1) bilirubin ≥10 mg/dL on postoperative day 7; (2) INR ≥1.6 on postoperative day 7; (3) aminotransferase level (alanine\naminotransferase or aspartate aminotransferase) >2000 IU/mL within the first 7 postoperative days33. aThe liver grafts are allocated in the UK based on the UK end-stage liver disease score; the laboratory values of the model for end-stage liver disease score are included for the comparative information\nonly.\nbThe presence of hepatocellular cancer is recorded as a complication of the underlying liver disease mentioned above, and does not impact on the liver allocation algorithm. cGroups compared by Kruskal–Wallis test to assess differences in continuous variables and Fisher’s exact test for categorical variables. Due to the small sample sizes and that the statistical comparison\ntests were not powered, these results should be interpreted with caution.\nARTICLE NATURE COMMUNICATIONS | https://doi.org/10.1038/s41467-020-16251-3\n8 NATURE COMMUNICATIONS | (2020) 11:2939 | https://doi.org/10.1038/s41467-020-16251-3 | www.nature.com/naturecommunications\n\nconcentration) is predictive of ischaemic cholangiopathy17. Sub￾analysis of bile samples and determination of biliary endothelial\nhealth is the subject of ongoing research. Evolving novel perfu￾sion strategies might enable the use of DCD grafts exposed to\nprolonged warm ischaemia14,29,30.\nThe other limitations of our study include the sensitivity of the\ncut-off lactate value, the non-randomised trial design and exclu￾sion of high-risk transplant recipients. Regarding the former,\nfollowing previous experience, we set the lactate viability threshold\nto less than 2.5 mmol/L within 2 h of NMP15,16 To maximise\nutilisation, this trial extended the assessment period to 4 h. Two\nlivers in the trial were discarded following a rise of the perfusate\nlactate after meeting the 2-h target. The significance of this is\nuncertain, although it is notable that a third liver with a similar\npattern of lactate clearance was transplanted and experienced a\nsubstantial period of early allograft dysfunction with a post￾transplant peak ALT of 2074 IU and AST of 3031 IU. Concerning\nthe design, the trial was conducted as a non-randomised study, as\ntransplanting discarded livers with an expected high incidence of\nprimary non-function as controls would be ethically unacceptable.\nWe expect further advances to be achieved through the identifi￾cation of specific biomarkers that correlate with long-term graft\noutcomes, in the context of large NMP series or registries. Lastly,\nas we did not want to compound risks, the study did not include\nhigher risk recipients deemed not suitable to receive marginal\norgans at the unit’s multi-disciplinary liver transplant listing\nmeeting. The majority of participants who decided to participate\ndid so after a long period waiting on the list, with progressive\ndeterioration that was not necessarily reflected by their waiting list\nposition. The feasibility of using livers rescued by NMP for the\nhigh-risk recipient is currently under investigation.\nIn conclusion, this trial demonstrated that NMP provides a\nway of objectively assessing high-risk organs, and allowed\ntransplantation in a significant proportion of currently unutilised\nlivers without any incidence of primary non-function. The use of\nperfusion technology was associated with increased graft utilisa￾tion, considerably extended preservation time and greatly\nimproved transplant logistics. Adoption of functional assessment\nof high-risk livers can increase access to life saving transplanta￾tion and reduce waiting list mortality.\nMethods\nStudy design. This study was a prospective, open label, phase 2 adaptive single￾arm trial comprising high-risk livers meeting two-tier inclusion criteria. The first￾tier was being considered as unsuitable for transplant by all UK transplant centres\nwithin a nationwide fast-track offering scheme. The trial was performed at a single￾institution (Queen Elizabeth Hospital, Birmingham, UK) with experience in NMP\nand utilisation of high-risk grafts5,31. The second-tier eligibility required at least\none of seven specific criteria that confirmed the high-risk status of every enroled\nliver (Table 4). To minimise risks of high post-transplant complications or mor￾tality for the study participants, the trial used an adaptive design with two interim\nsafety analyses (Supplementary Fig. 1). The study design and conduct complied\nwith all relevant regulations regarding the use of human study participants. The\ntrial was funded by the Wellcome Trust, and granted approval by the National\nResearch Ethics Service in London-Dulwich (REC reference 16/LO/1056, Protocol\nnumber RG 15–240) and the Medicines and Healthcare Products Regulatory\nAgency and the University Hospitals Birmingham Research and Development\nDepartment. The project was endorsed by the Research, Innovation and Novel\nTechnologies Advisory Group committee of the National Health Service Blood and\nTransplant. The study was registered at ClinicalTrials.gov (reference number\nNCT02740608), the protocol has been published32, and the full version is provided\nin the Supplementary Information.\nDiscarded liver inclusion criteria and the study logistics. The study considered\nall potential donors with a diagnosis of brainstem death or Maastricht category III\nand IV donors after circulatory death, aged up to 85 years, initially retrieved with\nthe intent for transplantation but subsequently declined by all UK transplant\ncentres based on the retrieving or transplant surgeon’s assessment. If our centre\nwas the last in the fast-track offering sequence, the liver had to be deemed\nuntransplantable by two consultant surgeons independently. The surgeons were\npaired together to create an overall low threshold for using marginal livers,\nensuring any liver that could be used without viability testing was transplanted,\nthereby minimising bias. For the liver to be eligible it also had to meet at least one\ndefined high-risk criterion (see Tables 1 and 4). Consent for research was provided\nby the donor’s next of kin.\nStudy participants. Eligible participants were those listed electively for primary\nliver transplantation and deemed to be low-to-moderate transplant risk candidates,\nsuitable to receive a high-risk graft, as assessed by the unit’s transplant waiting list\nmulti-disciplinary team. Candidates were required to have a patent portal vein, no\nsignificant comorbidities (cardiovascular diseases, including active angina, a history\nof ischaemic heart disease, congestive heart failure, cerebrovascular events, symp￾tomatic valvular heart disease or cardiac arrhythmias; pulmonary conditions\nincluding pulmonary hypertension or established diagnosis of pulmonary dys￾function), a UK end-stage liver disease18 (UKELD) score ≤62 and no history of\nmajor upper abdominal surgery. Each participant was fully informed of being\noffered a marginal graft and gave written consent for the trial in advance of the\norgan offer, after having at least 24 h to consider their participation.\nThe study intervention and liver viability assessment. All livers were cold￾preserved with University of Wisconsin solution and commenced NMP using the\nOrganOx Metra™ device after arrival at the transplant centre. The protocol stipu￾lated an NMP duration of between 4 and 24 h. Serial perfusate, bile and tissue\nsamples were taken at regular time intervals. For a liver to be considered viable it\nhad to metabolise perfusate lactate to levels ≤2.5 mmol/L within 4 h of commen￾cing the perfusion, in addition to meeting at least 2 of the following additional\ncriteria: evidence of bile production, maintenance of perfusate pH ≥ 7.30, meta￾bolism of glucose, maintenance of stable arterial and portal flows (≥150 and\n≥500 mL/min, respectively), and homogenous perfusion with soft consistency of\nthe parenchyma16.\nIf a liver was considered viable, the transplant was set up and performed. At the\npoint of recipient hepatectomy, the NMP team disconnected the organ from the\ndevice, flushed it with 3 l of histidine–tryptophan–ketoglutarate solution at 4 °C\nand handed it over for immediate implantation. Post-transplant management\nfollowed the unit’s standard protocol, with immunosuppression comprising\ntacrolimus, azathioprine or mycophenolate mofetil and low-dose steroids. Each\npatient underwent an MRCP at 6 months unless the investigation was clinically\nindicated earlier.\nLiver quality was determined retrospectively through histological analysis of\nparenchymal biopsies which were assessed for pre-existing liver disease, steatosis,\nglycogen content and features of preservation–reperfusion injury.\n1.00\nKaplan–Meier 1 year graft survival estimates\n0.75\n0.50\n0.25\n0.00\n0\nNumber at risk\nCase–Control = Control 37\nCase–Control = Case\n3\n34 30 27 23\n22 21 20 20\n6\nTime post-transplant (Months)\n9 12\nGraft survival probability\n22\nControls Case\nFig. 5 Comparison of 1-year graft survival estimate. Conditional logistic\nregression was carried out on the matched case–control data to determine\nthe relative risk for graft survival at 1 year between matched case–control\ngroups. The median (range) days follow-up data were included in the\nsurvival analyses, but the plot was truncated at 12 months. The ticks on the\ntop of each Kaplan–Meier curve relate to the numbers of patients being\ncensored at that particular time point. There are 2 cases of graft failure in\nthe perfusion group at days 119 and 209; the control group contains 5 graft\nfailures (2 at day 5, 1 at day 14, 1 at day 165 and 1 at day 182). The graft\nsurvival was similar in both groups. Findings showed that the odds ratio\n(relative risk) estimate for graft survival at 6 months was determined as 2.0\n(95% CI: 0.2–17.9; p = 0.535). Due to the small sample sizes and that this\nstatistical comparison test was not powered,these results should be\ninterpreted with caution.\nNATURE COMMUNICATIONS | https://doi.org/10.1038/s41467-020-16251-3 ARTICLE\nNATURE COMMUNICATIONS | (2020) 11:2939 | https://doi.org/10.1038/s41467-020-16251-3 | www.nature.com/naturecommunications 9\n\nOutcome measures. The co-primary outcomes consisted of (A) feasibility of NMP\nin discarded organ recovery and (B) achievement of successful transplantation. The\nperfused organ recovery rate was the proportion of perfusions leading to trans￾plantation. Successful transplantation was defined as 90-day patient survival—a\nnationally accepted, monitored and continuously audited outcome measure.\nThe key secondary outcome measures included assessment of the liver graft\nfunction (by incidence of primary non-function and early allograft dysfunction33)\nliver function test results, 90-day graft survival, intensive therapy unit and post￾transplant in-hospital stays, incidence of vascular complications, and anastomotic\nand non-anastomotic biliary strictures as assessed by MRCP at 6 months.\nPerioperative data collection included haemodynamic stability, incidence of post￾reperfusion syndrome and blood-product requirements. Post-transplant adverse\nevents and complication severity were graded according to the Clavien–Dindo\nclassification34. The secondary outcomes were compared with contemporary\ncontrols (1:2), matched in order of priority for the donor graft type, UKELD Score,\ndonor age and donor sex only. Four variables included in the original protocol\n(model of end-stage liver disease [MELD], recipient age, BMI and the liver disease\naetiology) were removed as matching criteria due to confounding correlation and\nbeing overly stringent. No recipient suffered from recurrent disease during the\nstudy follow-up period. The matching criteria used identified 39 patients. There\nwas consistency in the recipient selection for high-risk grafts guided by the unit’s\nprotocols and transplant waiting list multi-disciplinary team meetings that assured\nsimilar characteristics regarding the cardiovascular comorbidities and surgical risks\nin the study participants and the matched controls. The pre-planned comparisons\nwith the matched controls group were not powered to demonstrate any differences.\nDue to the small sample sizes, these results should be interpreted with caution; the\ncontrols were included to present the study results within the context of the unit’s\ncontemporary outcomes.\nStatistical analysis. The trial was powered with an emphasis on (A) the feasibility\nof the intervention using NMP and (B) recipient safety. In terms of the intervention\nfeasibility (A), the aim was to achieve an organ recovery rate of at least 50%, with a\nrate of 30% or less being considered unacceptable. Using a two-stage design35, with\nan interim assessment after 24 livers (continuing if ≥8 livers were recovered), a\nsample size of up to 53 livers undergoing NMP might be required, with target alpha\n(one-sided) of 0.05 (actual alpha = 0.047) and target beta of 0.1 (actual\nbeta = 0.098). NMP was considered feasible for organ recovery if at least 22 livers\nwere recovered from 53 perfused. Though the two statistical inferences are asses￾sing different hypotheses (safety and feasibility), they are linked as 22 transplants\nare required for the safety testing of the procedure, which is also the minimum\nnumber required out of 53 perfused livers to be considered feasible.\nFor (B), the mean 90-day patient survival rate for patients receiving liver\ntransplants in the United Kingdom was 93%36. For the discarded livers, the\ndesirable and undesirable 90-day overall survival rates were set at 88% and 73%\n(15% lower), respectively. Using an optimal three-stage adaptive design37 with two\ninterim assessments after 3 patients (requires ≥ 2 successes) and 11 patients\n(≥8 successes), a sample size of 22 patients was required, with alpha (type I error)\nand beta (type II error) of 0.2. As this was an early phase (non-definitive) trial to\nassess the safety of this procedure, a relaxed one-sided alpha was used to attain an\nachievable sample size within the trial duration and cost constraint. The approach\nwas considered successful if there were at least 18 successes out of 22 transplants.\nThe descriptive statistics data were presented as number and percentages, and\nmedian and interquartile range. Due to small numbers, the pre-planned analyses\nused Kruskal–Wallis test to assess differences in continuous variables between two\ngroups and Fisher’s exact test for categorical variables. Kaplan–Meier survival\nmethod was used to analyse time-to-event data and conditional logistic regression\nfor matched case–control analysis. All secondary and exploratory analyses were\nTable 4 Study inclusion and criteria.\nGraft inclusion criteria 1. Liver from a donor primary accepted with the intention for a clinical transplantation\n2. Liver graft was rejected by all the other UK transplant centres via normal or fast-track sequence (see Appendix 3 for list of UK\ncentres)\n3. One of the following parameters capturing the objectivity of the liver high-risk status:\n• Donor risk index >2.020\n• Balanced risk score >938\n• Graft macrosteatosis >30%\n• Donor warm ischaemic time (defined as the period between the systolic blood pressure <50 mmHg to the time of commencing\ndonor aortic perfusion) in DCD donors >30 min\n• Peak donor aspartate and alanine transaminases >1000 IU/mL (AST/ALT)\n• Anticipated cold ischaemic time >12 h for DBD or 8 h for DCD livers\n• Suboptimal liver graft perfusion as assessed by a consultant transplant surgeon and documented by graph photography.\nGraft exclusion criteria 1. Grafts from patients with active Hepatitis B, C or human immunodeficiency virus infection\n2. Livers with cirrhotic macroscopic appearance\n3. Livers with advanced fibrosis\n4. DCD grafts with donor warm ischaemic time (systolic blood pressure < 50 mmHg to aortic perfusion) more than 60 min\n5. Excessive cold ischaemic times (DBD > 16 h/DCD > 10 h)\n6. Paediatric donor (<18 years old)\n7. Blood group ABO incompatibility\nRecipient inclusion\ncriteria\n1. Primary adult liver transplant recipient\n2. Patient listed electively for transplantation\n3. Low-to-moderate transplant risk candidate suitable for marginal graft, as assessed by the UHB\nLiver Unit liver transplant listing multi-disciplinary team meeting.\nRecipient exclusion\ncriteria\n1. High-risk transplant candidates not suitable for a marginal graft\n2. Patients with complete portal vein thrombosis diagnosed prior to the transplantation\n3. Liver re-transplantation\n4. Patients with fulminant hepatic failure\n5. Blood group ABO incompatibility\n6. Patient unable to consent\n7. Patients undergoing transplantation of more than one organ\n8. Contraindication to undergo magnetic resonance imaging\nCriteria for\ntransplantation\n1. Lactate ≤ 2.5 mmol/L\n2. AND two or more of the following within 4 h of starting perfusion\n• Evidence of bile production\n• pH ≥ 7.30\n• Metabolism of glucose\n• HA flow ≥ 150 mL/min and PV flow ≥ 500 mL/min\n• Homogenous perfusion\nDCD donation after circulatory death, DBD donation after brainstem death, ALT alanine aminotransferase, AST aspartate aminotransferase.\nNote: Donor risk index is calculated from age, race, cause of death, height and the predicted cold ischaemic time20; balanced risk score is calculated using model for end-stage liver disease score (MELD),\nwhether or not the recipient is having a re-transplant or is on intensive care, recipient age, donor age and cold ischaemic time11.\nARTICLE NATURE COMMUNICATIONS | https://doi.org/10.1038/s41467-020-16251-3\n10 NATURE COMMUNICATIONS | (2020) 11:2939 | https://doi.org/10.1038/s41467-020-16251-3 | www.nature.com/naturecommunications\n\ntwo-sided at 5% significance level, not powered and not adjusted for multiple\ntesting. STATA software package version 15.1 for Windows (StataCorp LLC, USA)\nwas used for all analyses. Results were rounded to a relevant precision, percentages\nin the text to full numbers and p-values to three decimals. The statistical analysis\nplan is provided in the Supplementary Information.\nReporting summary. Further information on research design is available in\nthe Nature Research Reporting Summary linked to this article.\nData availability\nThe source data underlying Tables 1–3 and Figs. 4 and 5 are provided in the Source Data\nFile and supplementary tables. Additional data will be provided upon request, according\nto a procedure described on the Cancer Research UK Clinical Trials Unit website https://\nwww.clinicalstudydatarequest.com.\nReceived: 30 July 2019; Accepted: 17 April 2020;\nReferences\n1. Williams, R. et al. Implementation of the Lancet standing commission on liver\ndisease in the UK. Lancet 386, 2098–2111 (2015).\n2. Organ Donation and Transplantation: Annual Report on Liver\nTransplantation. www.odt.nhs.uk (2016/2017).\n3. Kim, W. R. et al. OPTN/SRTR 2016 annual data report: liver. Am. J.\nTransplant. 18, 172–253 (2018).\n4. Tullius, S. G. & Rabb, H. Improving the supply and quality of deceased-donor\norgans for transplantation. N. Engl. J. Med. 378, 1920–1929 (2018).\n5. Mirza, D. F. et al. Policies in Europe on “marginal quality” donor livers. Lancet\n344, 1480–1483 (1994).\n6. Ravaioli, M. et al. Risk avoidance and liver transplantation: a single-center\nexperience in a national network. Ann. Surg. 264, 778–786 (2016).\n7. Ghinolfi, D. et al. Use of elderly donors in liver transplantation: a paired￾match analysis at a single center. Ann. Surg. 268, 325–331 (2018).\n8. Jay, C. L. et al. Ischemic cholangiopathy after controlled donation after cardiac\ndeath liver transplantation: a meta-analysis. Ann. Surg. 253, 259–264 (2011).\n9. Ploeg, R. J. et al. Risk factors for primary dysfunction after liver\ntransplantation—a multivariate analysis. Transplantation 55, 807–813 (1993).\n10. Annual report on liver transplantation 2018/19. NHS Blood and Transplant.\nwww.odt.nhs.uk.\n11. Dutkowski, P. et al. Are there better guidelines for allocation in liver\ntransplantation? A novel score targeting justice and utility in the model for\nend-stage liver disease era. Ann. Surg. 254, 745–753 (2011). discussion 753.\n12. Marcon, F. et al. Utilisation of declined liver grafts yields comparable\ntransplant outcomes and previous decline should not be a deterrent to graft\nuse. Transplantation 102, 211–218 (2018).\n13. Chouchani, E. T. et al. Ischaemic accumulation of succinate controls\nreperfusion injury through mitochondrial ROS. Nature 515, 431–435 (2014).\n14. Nasralla, D. et al. A randomized trial of normothermic preservation in liver\ntransplantation. Nature 557, 50–56 (2018).\n15. Mergental, H. et al. Development of clinical criteria for functional assessment\nto predict primary nonfunction of high-risk livers using normothermic\nmachine perfusion. Liver Transpl. 24, 1453–1469 (2018).\n16. Mergental, H. et al. Transplantation of declined liver allografts following\nnormothermic ex-situ evaluation. Am. J. Transpl. 16, 3235–3245 (2016).\n17. Watson, C. J. E. et al. Observations on the ex situ perfusion of livers for\ntransplantation. Am. J. Transplant.18, 2005–2020 (2018).\n18. Barber, K. et al. Elective liver transplant list mortality: development of a United\nKingdom end-stage liver disease score. Transplantation 92, 469–476 (2011).\n19. Taking Organ Utilisation to 2020: ODT Organ Utilisation Strategy. NHS\nBlood and Transplant. www.odt.nhs.uk.\n20. Feng, S. et al. Characteristics associated with liver graft failure: the concept of a\ndonor risk index. Am. J. Transplant. 6, 783–790 (2006).\n21. Linares, I., Hamar, M., Selzner, N. & Selzner, M. Steatosis in liver transplantation:\ncurrent limitations and future strategies. Transplantation 103, 78–90 (2019).\n22. Briceno, J., Ciria, R., de la Mata, M., Rufian, S. & Lopez-Cillero, P. Prediction\nof graft dysfunction based on extended criteria donors in the model for end￾stage liver disease score era. Transplantation 90, 530–539 (2010).\n23. de la Rosa, G., Fondevila, C. & Navasa, M. Liver transplantation in Spain.\nLiver Transplant. 22, 1259–1264 (2016).\n24. Schlegel, A. et al. Impact of donor age in donation after circulatory death liver\ntransplantation: Is the cutoff “60” still of relevance? Liver Transplant. 24,\n352–362 (2018).\n25. Ceresa, C. D. L., et al. Transient cold storage prior to normothermic liver\nperfusion may facilitate adoption of a novel technology. Liver Transplant. 25,\n1503–1513 (2019).\n26. Watson, C. J. et al. 26-Hour storage of a declined liver before successful\ntransplantation using ex vivo normothermic perfusion. Ann. Surg. 265, e1–e2\n(2017).\n27. Schlegel, A. et al. The UK DCD risk score: a new proposal to define futility in\ndonation-after-circulatory-death liver transplantation. J. Hepatol. 68, 456–464\n(2018).\n28. Foley, D. P. et al. Biliary complications after liver transplantation from\ndonation after cardiac death donors: an analysis of risk factors and long-term\noutcomes from a single center. Ann. Surg. 253, 817–825 (2011).\n29. Dutkowski, P. et al. HOPE for human liver grafts obtained from donors after\ncardiac death. J. Hepatol. 60, 765–772 (2014).\n30. Hessheimer, A. J. et al. Normothermic regional perfusion vs. super-rapid\nrecovery in controlled donation after circulatory death liver transplantation. J.\nHepatol. 70, 658–665 (2019).\n31. Marcon, F. et al. Utilization of declined liver grafts yields comparable\ntransplant outcomes and previous decline should not be a deterrent to graft\nuse. Transplantation 102, e211–e218 (2018).\n32. Laing, R. W. et al. Viability testing and transplantation of marginal livers\n(VITTAL) using normothermic machine perfusion: study protocol for an\nopen-label, non-randomised, prospective, single-arm trial. BMJ Open 7,\ne017733 (2017).\n33. Olthoff, K. M. et al. Validation of a current definition of early allograft\ndysfunction in liver transplant recipients and analysis of risk factors. Liver\nTransplant. 16, 943–949 (2010).\n34. Dindo, D., Demartines, N. & Clavien, P. A. Classification of surgical\ncomplications: a new proposal with evaluation in a cohort of 6336 patients\nand results of a survey. Ann. Surg. 240, 205–213 (2004).\n35. Simon, R. Optimal two-stage designs for phase II clinical trials. Controlled\nClin. Trials 10, 1–10 (1989).\n36. Interim Report on Liver Transplantation: Report for 2014/15. www.odt.\nnhs.uk.\n37. Chen, T. T. Optimal three-stage designs for phase II cancer clinical trials. Stat.\nMed. 16, 2701–2711 (1997).\n38. Dutkowski, P. et al. The use of fatty liver grafts in modern allocation systems:\nrisk assessment by the balance of risk (BAR) score. Ann. Surg. 256, 861–869\n(2012).\nAcknowledgements\nThe VITTAL trial represents independent academic research funded by the Wellcome\nTrust [200121/B/15/Z]. The grant was held by D.F.M., H.M., S.C.A., D.H.A., P.J.F., S.H.,\nJ.B. and C.Y. C.Y. was also funded by Cancer Research UK (C22436/A15958). We\ngratefully acknowledge the support provided by all the team members of the Liver Unit at\nQueen Elizabeth Hospital Birmingham. In particular we would like to thank the fol￾lowing people and groups: the livers anaesthetic team including John Isaac, Tom Faul￾kner, Davinia Bennett, Scott Russell, Gowri Subash and Adam Hill, the hepatology team\nincluding Philip Newsome, Ahmed Elsharkawy, Andrew Holt, Ye Oo, Neil Rajoriya,\nDennis Freshwater, Geoffrey Haydon, Gideon Hirschfield, Fiona Thompson, David\nMutimer, Tahir Shah, Shishir Shetty, Dhiraj Tripathi, Matthew Armstrong; the intensive\ncare physician team including Nick Murphy, Tony Whitehouse, Catherine Snelson,\nNilesh Parekh, Brian Pouchet and Nandan Gautam; the radiologists Simon Olliff, Brin\nMahon, Homoyon Mehrzad and Arvind Pallan. Trial nurses Jo Grayer, Kathryn Rodden,\nEmma Burke, Francesca Renzicchi and Verity Bratley for their contribution to the study\nconduct and the data collection. Sara Trevitt, Jennifer Keely, Bhushan Chhajed and the\nD3B team at the CRUK clinical trials unit at The University of Birmingham. Lorraine\nWallace for laboratory support, sample collection and processing. The liver transplant\nco-ordinators, clinical nurse specialists and allied health professionals at the Liver Unit\nfor help with the study logistics and patient education. Bridget Gunson, Sue Paris and\nGary Reynolds for their trial support and work at the NIHR Birmingham Biomedical\nResearch Centre. Leslie Russell, Craig Marshall, Toni Day, Andy Self and Constantin\nCoussios from OrganOx Ltd for the project partnership and support with the Wellcome\nTrust funding application. Serena Fasoli and Paul Adams for providing logistical support\nwith OrganOx Ltd materials. David Nasralla and Carlo Ceresa (University of Oxford) for\ntechnical support and perfusion advice. NHS Blood and Transplant and the Research,\nInnovation and Novel Technologies Group (RINTAG) which helped support the\nimplementation of the trial. James Neuberger, Jacques Pirenne, Andrew Hall and Gabriel\nOniscu for the trial conduct and safety oversight and membership on the data mon￾itoring committee. Amanda Smith for her help with manuscript preparation and proof\nreading. In particular we would like to thank also the British Transplant Society, the Liver\nAdvisory Group, the British Liver Trust, and the local public and patient involvement\ngroup who supported the trial from its conception, and the Wellcome Trust for funding\nand supporting this trial. Finally, we would like to thank the organ donors, their families\nand the 22 study participants, without which this trial could not have been completed\nsuccessfully.\nAuthor contributions\nH.M., R.W.L., C.Y., S.C.A. and D.F.M. contributed equally. H.M., S.C.A. and D.F.M.\nconceived the study; C.Y., D.F.M., H.M., A.K. and D.B. designed the trial; R.W.L., M.W.,\nNATURE COMMUNICATIONS | https://doi.org/10.1038/s41467-020-16251-3 ARTICLE\nNATURE COMMUNICATIONS | (2020) 11:2939 | https://doi.org/10.1038/s41467-020-16251-3 | www.nature.com/naturecommunications 11\n\nA.K., C.Y. and D.F.M. wrote the protocol with contributions from H.M., D.B. and P.J.F.;\nR.W.L., M.W., S.C. and D.B. were responsible for the trial regulatory documents’ pre￾paration and submission; A.K. and C.Y. devised the statistical analysis plan together with\nD.F.M. M.T.P.R.P.P., P.M., J.R.I., K.J.R., M.A., H.M., A.S., J.F., H.C., J.B., D.H.A., C.M.,\nR.W.L., Y.L.B., J.A. and D.F.M. were involved in the transplantations, machine perfusions\nand post-transplant patients’ management; R.W.L., Y.L.B. and J.A. were responsible for\nsamples and data collection. D.A.H.N. was responsible for histological assessment; A.K.\nperformed the statistical analyses with senior oversight from C.Y.; H.M. wrote the first\ndraft of the paper with input from R.W.L., A.K., C.Y. and D.F.M.; all authors contributed\nto the study conduct and reviewed the final paper version.\nCompeting interests\nP.J.F. is a co-founder, chief medical officer and consultant to OrganOx Ltd and also holds\nshares in the company, he was involved in the study design and funding application, but\nwas not involved in the conduct of the clinical trial. C.M. is an OrganOx Ltd employee\nand provided the device technical support. H.M. received consultancy fees for lecturing\nand training activities for OrganOx Ltd. All other co-authors declare no competing\ninterests. This paper presents independent research supported by the NIHR Birmingham\nBiomedical Research Centre at the University Hospitals Birmingham NHS Foundation\nTrust and the University of Birmingham. The views expressed are those of the authors\nand not necessarily those of the NHS, the NIHR or the Department of Health.\nAdditional information\nSupplementary information is available for this paper at https://doi.org/10.1038/s41467-\n020-16251-3.\nCorrespondence and requests for materials should be addressed to H.M., S.C.A. or D.F.\nM.\nPeer review information Nature Communications thanks the anonymous reviewer(s) for\ntheir contribution to the peer review of this work. Peer reviewer reports are available.\nReprints and permission information is available at http://www.nature.com/reprints\nPublisher’s note Springer Nature remains neutral with regard to jurisdictional claims in\npublished maps and institutional affiliations.\nOpen Access This article is licensed under a Creative Commons\nAttribution 4.0 International License, which permits use, sharing,\nadaptation, distribution and reproduction in any medium or format, as long as you give\nappropriate credit to the original author(s) and the source, provide a link to the Creative\nCommons license, and indicate if changes were made. The images or other third party\nmaterial in this article are included in the article’s Creative Commons license, unless\nindicated otherwise in a credit line to the material. If material is not included in the\narticle’s Creative Commons license and your intended use is not permitted by statutory\nregulation or exceeds the permitted use, you will need to obtain permission directly from\nthe copyright holder. To view a copy of this license, visit http://creativecommons.org/\nlicenses/by/4.0/.\n© The Author(s) 2020\nARTICLE NATURE COMMUNICATIONS | https://doi.org/10.1038/s41467-020-16251-3\n12 NATURE COMMUNICATIONS | (2020) 11:2939 | https://doi.org/10.1038/s41467-020-16251-3 | www.nature.com/naturecommunications\n\n"], "response": "This study aimed to determine whether the use of normothermic machine perfusion (NMP) can improve the viability and transplantation success rate of high-risk livers that would otherwise be considered unsuitable for transplantation due to factors such as macrosteatosis, capsular fibrosis, and rounded edges. The study enrolled 31 livers from 22 high-risk donors, and 22 of them met the viability criteria and were successfully transplanted, resulting in a 100% survival rate at day 90 post-transplantation. The study found that NMP is a feasible method for improving the viability and transplantation success rate of high-risk livers. The study also identified that all four patients who experienced biliary complications after transplantation had received livers from donors after brainstem death (DBD), while none of the control group patients who received livers from DBD donors experienced biliary complications. The study suggests that NMP may be particularly beneficial for livers from DBD donors, as they often exhibit poor quality due to warm ischemia time. The study highlights the importance of considering the type of donor when evaluating the risks and benefits of NMP for high-risk livers. The study also acknowledges the support and contributions of various individuals and organizations, including the National Institute for Health Research (NIHR) Birmingham Biomedical Research Centre, the British Transplant Society, and the local public and patient involvement group. The study was funded by the Wellcome Trust, and the authors declare no competing interests. The study provides evidence for the effectiveness of NMP in improving the viability and transplantation success rate of high-risk livers, particularly for livers from DBD donors, and emphasizes the importance of considering the type of donor when evaluating the risks and benefits of NMP."}
{"user_input": "What is the impact of macro/microsteatosis on post-transplant graft survival taking into account donor and other factors?", "retrieved_contexts": ["REVIEW\npublished: 12 May 2020\ndoi: 10.3389/fimmu.2020.00631\nFrontiers in Immunology | www.frontiersin.org 1 May 2020 | Volume 11 | Article 631\nEdited by:\nPeter Schemmer,\nMedical University of Graz, Austria\nReviewed by:\nJosefina M. Alberu,\nTecnológico de Monterrey, Mexico\nCaner Süsal,\nHeidelberg University\nHospital, Germany\n*Correspondence:\nSefan Schneeberger\nstefan.schneeberger@i-med.ac.at\nSpecialty section:\nThis article was submitted to\nAlloimmunity and Transplantation,\na section of the journal\nFrontiers in Immunology\nReceived: 03 December 2019\nAccepted: 19 March 2020\nPublished: 12 May 2020\nCitation:\nResch T, Cardini B, Oberhuber R,\nWeissenbacher A, Dumfarth J,\nKrapf C, Boesmueller C, Oefner D,\nGrimm M and Schneeberger S (2020)\nTransplanting Marginal Organs in the\nEra of Modern Machine Perfusion and\nAdvanced Organ Monitoring.\nFront. Immunol. 11:631.\ndoi: 10.3389/fimmu.2020.00631\nTransplanting Marginal Organs in the\nEra of Modern Machine Perfusion\nand Advanced Organ Monitoring\nThomas Resch1\n, Benno Cardini 1\n, Rupert Oberhuber 1\n, Annemarie Weissenbacher 1\n,\nJulia Dumfarth2\n, Christoph Krapf 2\n, Claudia Boesmueller 1\n, Dietmar Oefner 1\n,\nMichael Grimm2 and Sefan Schneeberger 1\n*\n1 Department of Visceral, Transplant and Thoracic Surgery, Medical University of Innsbruck, Innsbruck, Austria, 2 Department\nof Cardiac Surgery, Medical University of Innsbruck, Innsbruck, Austria\nOrgan transplantation is undergoing profound changes. Contraindications for donation\nhave been revised in order to better meet the organ demand. The use of lower-quality\norgans and organs with greater preoperative damage, including those from donation after\ncardiac death (DCD), has become an established routine but increases the risk of graft\nmalfunction. This risk is further aggravated by ischemia and reperfusion injury (IRI) in the\nprocess of transplantation. These circumstances demand a preservation technology that\nameliorates IRI and allows for assessment of viability and function prior to transplantation.\nOxygenated hypothermic and normothermic machine perfusion (MP) have emerged\nas valid novel modalities for advanced organ preservation and conditioning. Ex vivo\nprolonged lung preservation has resulted in successful transplantation of high-risk\ndonor lungs. Normothermic MP of hearts and livers has displayed safe (heart) and\nsuperior (liver) preservation in randomized controlled trials (RCT). Normothermic kidney\npreservation for 24 h was recently established. Early clinical outcomes beyond the market\nentry trials indicate bioenergetics reconditioning, improved preservation of structures\nsubject to IRI, and significant prolongation of the preservation time. The monitoring\nof perfusion parameters, the biochemical investigation of preservation fluids, and the\nassessment of tissue viability and bioenergetics function now offer a comprehensive\nassessment of organ quality and function ex situ. Gene and protein expression profiling,\ninvestigation of passenger leukocytes, and advanced imaging may further enhance the\nunderstanding of the condition of an organ during MP. In addition, MP offers a platform\nfor organ reconditioning and regeneration and hence catalyzes the clinical realization\nof tissue engineering. Organ modification may include immunological modification and\nthe generation of chimeric organs. While these ideas are not conceptually new, MP\nnow offers a platform for clinical realization. Defatting of steatotic livers, modulation\nof inflammation during preservation in lungs, vasodilatation of livers, and hepatitis C\nelimination have been successfully demonstrated in experimental and clinical trials.\nTargeted treatment of lesions and surgical treatment or graft modification have been\nattempted. In this review, we address the current state of MP and advanced organ\nmonitoring and speculate about logical future steps and how this evolution of a novel\ntechnology can result in a medial revolution.\nKeywords: transplantation, machine perfusion, marginal, graft, immunogenecity, immunomodulation,\nreconditioning, expanded criteria donor\n\nResch et al. Machine Perfusion for Marginal Organs\nINTRODUCTION\nThe velocity and significance of progress in transplantation\nstarted to decrease around the turn of the century. Up until\nthat point, the number of transplantations performed was\never-increasing, and the outcomes continued to improve. The\nclinical benefit to the patient from the immediate and effective\ntreatment of organ failure was defined by improved patient\nsurvival. Patient survival as an endpoint followed by graft survival\nas a surrogate and indicator of judicious organ attribution\nwere the framework of significant momentum that succeeded\nin making transplantation a standard of care. This success\nwas fueled, however, not only by the healthcare quality gain\nbut also by a flourishing industry producing high-quality and\nexpensive immunosuppressive medication—to be taken for life\nafter transplantation (1–3).\nThe honeymoon period came to an end when both donor\nrates and short-term results stagnated. The established endpoints\nfor clinical trials are difficult to improve in the short run\nafter transplantation, and the field was slow in anticipating\nand responding to the changing circumstances—specifically\nthe shortage of standard criteria donors (SCD). The field of\ntransplantation now finds itself in very difficult circumstances:\n90%+ patient and graft survival rates leave little room for\nimprovement but also little room for error. At the same\ntime, the conditions and circumstances in organ donation are\nradically changing, with increasing donor age and comorbidities\nand donation from non-heart-beating donors. In countries\nspearheading the evolution, donation after cardiac death (DCD)\nand extended criteria donor (ECD) organs make up more than\n50% of the organ pool. With the pressure to maintain and further\nimprove the excellent short- and long-term results, but working\nwith very different resources, the most prominent immediate\nchallenge is to better define and preserve, if not improve, organ\nquality in transplantation.\nAbbreviations: A2AR, Adenosine A2A receptor; AST, Aspartate\naminotransferase; ATP, Adenosine triphosphate; CIT, Cold ischemia time;\nCMV, Cytomegalovirus; CVA, Cerebrovascular accident; DAMP, Danger￾associated molecular pattern; DBD, Donation after brain death; DC, Dendritic\ncell; DCD, Donation after cardiac death; DGF, Delayed graft function;\nD-HOPE, Dual hypothermic oxygenated perfusion; DRI, Donor Risk Index;\nEAD, Early allograft dysfunction; ECD, Expanded criteria donor; ECMO,\nExtracorporal membrane oxygenation; EMS, Exsanguinous metabolic support;\nESP, Eurotransplant senior program; ET-1, Endothelin-1; EVLP, Ex vivo lung\nperfusion; FABP, Fatty Acid- Binding Protein 1; GFP, Green fluorescent protein;\nGST, Glutathione S-Tranferases; H-FABP, Heart-type fatty acid-binding protein;\nHOPE, Hypothermic oxygenated perfusion; HMP, Hypothermic machine\nperfusion; HMPO, Oxygenated hypothermic machine perfusion; IFNγ, Interferon\ngamma; IL-10, Interleukin-10; IRI, Ischemia-reperfusion injury; KDRI, Kidney\nDonor Risk Index; LDH, Lactate dehydrogenase; MP, Machine perfusion; MSC,\nMesenchymal stromal cells; NAG, N-acetyl-beta-D-glucosaminidase; NMP,\nNormothermic machine perfusion; NK, Natural killer cell; NKT, Natural killer\nT cell; NRP, Normothermic regional perfusion; OCS, Transmedic Organ Care\nSystem; PDR, Pancreas Donor Risk Index; PGD3, Prostaglandin D3; PNF, Primary\nnon-function; PV, Pressure volume; RCT, Randomized controlled trial; ROS,\nReactive oxygen species; SCD, Standard criteria donor; SCS, Static cold storage;\nSOFT, Survival Outcomes Following Liver Transplantation score; SOP, Standard\noperating procedure; SOT, Solid organ transplantation; TNF-α, Tumor necrosis\nfactor α; UNOS, United Network for Organ Sharing; VEGF, Vascular endothelial\ngrowth factor; WIT, Warm ischemia time.\nWith this as a driving force, modalities to prolong and\nimprove preservation together with the tools to assess organ\nquality and function are emerging as the new frontier. Beyond\nserving an immediate medical need, the technologies evolving\nherald a more fundamental potential for change in healthcare:\nwith the extracorporeal long-term preservation and assessment\nof organs, the capability for human organ treatment and repair\narises. Hence, 20 years after transplantation advanced to become\na standard of care, the field has the potential to play a key role and\nadd a chapter to healthcare once again (4–10).\nIn this review, we aim to address the current state of the\nfield. A clarification of the terminology and the definitions\nof marginal organs, including an overview and comparison\nbetween the definitions for each organ, shall help to provide\na better picture of the actual status. Considering the changing\ncircumstances, the actual impacts of a condition on organ quality\nand function need to be addressed not only from the viewpoint\nof an empirical correlation. The individual parameters need to be\nfurther addressed for their reversibility and treatability. Building\non this concept, the various modalities of MP in their different\nstages of development and actual benefit require a critical\nreflection. While the assessment of organ quality and function\nduring extracorporeal perfusion is in its infancy, the growing\nbody of data may help to eventually develop a comprehensive\npicture of the quality of the components of organs as relevant to\ntransplantation and beyond. An important focus in this context\nis the assessment, definition, and relevance of the immune system\nof organs if isolated from the human body. Immunomodulation\nand immunomasking seem more realistic if attempted under\nthe conditions of an isolated and perfused organ. The vision\nof a realization and refinement of the repair, treatment, and\nmodification of organs is starting to trigger a boost in interest\nboth in academia and in industry.\nDEFINING “MARGINAL” ORGANS\nIn the light of organ shortage, critical reflection on the expansion\nof the donor pool is essential. The definition of organs that are\nmarginal for transplantation is often considered a well-defined\nentity. In reality, however, the definition is very different for each\norgan, and there is incongruence between the various definitions.\nIt is clear and well-justifiable that different organs are considered\nto be extended criteria organs going by different criteria, since the\nrelevance of one single factor may be very diverse. The assessment\nof the outcome after transplantation of extended criteria organs,\nhowever, needs to be seen and interpreted with reference to the\ndiverse definitions used throughout the years.\nECD Kidneys\nThe determination of ECD evolved from the term “marginal\ndonors,” and much of the literature focuses on criteria for living\ndonors. Since this is not the focus of this article, we will restrict\nthe research to deceased donors and deceased donor organs.\nIt is well-known that a number of factors may impact\nthe eventual outcome after transplantation. The definition of\ncadaveric kidney organs marginal for transplantation emerged\nfrom prioritization of and preference for factors that may outrank\nFrontiers in Immunology | www.frontiersin.org 2 May 2020 | Volume 11 | Article 631\n\nResch et al. Machine Perfusion for Marginal Organs\nTABLE 1 | Commonly used “ECD” criteria for the kidney.\nDonor age category (years)\nDonor condition <10 10–39 40–49 50–59 ≥60\nCVA+ HTN+ creatinine >1.5 md/dL x x\nCVA+ HTN x x\nCVA+ creatinine >1.5 md/dL x x\nCVA+ creatinine >1.5 md/dL x x\nCVA+ creatinine >1.5 md/dL x\nCVA x\nHTN x\nCreatinine >1.5 mg/dL x\nCVA, cerebrovascular accident was the cause of death; HTN, history of hypertension.\nother contributors in magnitude and simplicity of assessment\n(11). In the deceased donor situation, the prior medical history\nis not completely known, and the exact determination of\nhypertension, for example, often remains incomplete regarding\ndetails such as manifestation, duration, or response to treatment.\nSome of the understanding of donor risk factors also stems from\nliving donors (12), where early definitions of marginal donors\nrelate to the risks for the recipient rather than the risk for the\ndonor, which was only assessed and understood much later.\nHence, the definition of marginal or ECD kidneys needs to be\nused with caution since the definitions used are building on a set\nof parameters that have not been formally established, validated,\nand re-validated.\nStill, compared to other organ systems in SOT, a comparatively\ngood definition of marginal or ECD has been established.\nNoteworthily, the term “marginal” should be avoided in favor of\nECD, as “marginal” may be considered pejorative by the patients\nwho receive them and also by the programs that transplant\nthem (13).\nThe ECD criteria most widely used in kidney transplantation\nare the OPTN-approved criteria, as described by Metzger et al.\n(13). They are shown in Table 1.\nA helpful tool that combines such parameters is the Kidney\nDonor Risk Index (KDRI), which was generated by weighting the\nfollowing factors into a single number in order to predict the risk\nof post-transplant graft failure: age, weight, height, race, history\nof hypertension, history of diabetes, cause of death, hepatitis C\nstatus, serum creatinine, and DCD. The association of KDRI\nwith the outcome in the Eurotransplant senior program (ESP)\nwas evaluated by Schamberger et al. (14). Kidney transplantation\nfrom Maastricht category-III donors after circulatory death\n(DCD), which introduces a higher risk of primary non-function\nand delayed graft function (DGF), has been added to ECD\ncriteria (15). Furthermore, kidneys from a donor with an acute\nkidney injury before organ procurement correspond to marginal\nquality (16). Importantly, kidneys from donors with a history\nof extracorporal membrane oxygenation (ECMO) have not been\naddressed specifically but can be classified as marginal organs\nsince deteriorated microperfusion can be assumed (17–19).\nTABLE 2 | Common criteria defining “marginal” or “expanded criteria donor\n(ECD)” livers, as well as “ECD DCD” livers.\nDBD\nCardiac arrest (min) >15\nProlonged hypotensive periods <60 mmHg for >1 hr\nAge (yrs) >55\nBMI (kg/m2\n) >30\nHBV Positive\nHBC Positive\nBMI (kg/m2\n) 79 (100.0)\nMacrosteatosis (%) >30\nHypernatriemia (mEq/L) >155\nICU stay (days) ≥ 5 (mechanical ventilation)\nNosocomial infection Positive blood cultures or pneumonia\nSplit liver yes\nAST (U/L) >170\nALT (U/L) >140\nCIT (hrs) >12\nVasopressor drug requirement Dopamine dose >10 µg/kg/min or\nany doses of other amines)\nNon-heart-beating Yes\nDCD\nAge (yrs) >50\nBMI (kg/m2\n) >35\nFunctional WIT (min) >30\nMacrosteatosis (%) >30\nDCD, donation after cardiac death; DBD, donation after brain death; min, minutes; yrs,\nyears; hrs, hours; CIT, cold ischemia time; HBV, hepatitis B virus; HCV, hepatitis C\nvirus; BMI, body mass index; ICU, intensive care unit; AST, aspartate aminotransferase;\nALT, Alanin-aminotransferase.\nECD Livers\nIn liver transplantation, the term “marginal” does not refer to\na number of distinct internationally accepted criteria that could\ncharacterize a graft, and nor does “ECD.” Instead, both terms\nencompass a variety of factors that have been observed to limit\ngraft quality, but the impact of each of these factors remains\nto be defined. Therefore, several models for the assessment of\nthe sum of such risk factors have been introduced (20). In this\nregard, valuable predictive quality of patient and graft survival at\n3 months was achieved using the Survival Outcomes Following\nLiver Transplantation (SOFT) score (21). Death censored graft\nsurvival at 60 months follow-up was well-predicted by the Donor\nRisk Index (DRI; c-index 0.59) and Eurotransplant-DRI (c-index\n0.58) (20).\nTable 2 lists those criteria that overlap in the mentioned\nscoring systems and that are widely applied when defining\n“marginal” or “ECD” liver grafts (22, 23). Apart from clinical and\nmetric parameters, these include histological criteria, since liver\nbiopsies are considered helpful in order to evaluate the organ\nquality. Whereas, liver fibrosis has been reported to predict a\nhigh incidence of early graft failure (24), Liu et al. (25) suggested\na macrovesicular steatosis of 30 percent as a cutoff value for\nmarginal grafts.\nFrontiers in Immunology | www.frontiersin.org 3 May 2020 | Volume 11 | Article 631\n\nResch et al. Machine Perfusion for Marginal Organs\nTABLE 3 | Common criteria defining a “marginal” or “ECD” pancreas.\nAge (yrs) <10/>45 (>50)\nBMI (kg/m2\n) >30\nTrauma Yes\nPancreatitis Yes\nAlcohol intake Yes\nDCD Yes\nyrs, years; BMI, body mass index; DCD, donation after cardiac death; ECD, expanded\ncriteria donor.\nTABLE 4 | Common criteria defining “marginal” or “ECD” hearts.\nAge (yrs) >40 (32)/>55 (33)\nBMI mismatch donor/recipient (%) >20\nHCV Positive\nBMI (kg/m2\n) 79 (100.0)\nLV hypertrophy (mm) >14\nEjection fraction (%) <45\nHigh-dose catecholamine administration Yes\nTobacco or illicit drug use (cocaine) Yes\nHistory of diabetes\nProlonged cardiopulmonary resuscitation Yes\nTransient reversible hypotension or cardiac arrest Yes\nLV, left ventricular; BMI, body mass index; HCV, hepatitis C virus.\nNoteworthily, while livers from non-heart-beating donors are\nper se considered as ECD, Mihylov et al. suggested criteria for\n“ECD DCD” livers in order to subclassify DCD organs (26)\n(Table 2).\nECD Pancreas\nIn analogy to other organs in SOT, no clear definition exists\nfor a “marginal” or ECD pancreas graft. Table 3 summarizes\nthe criteria that have been commonly used by various authors\n(27–30). In an attempt to bring such criteria into a clinically\nuseful context, Axelrod et al. (31) presented a Pancreas Donor\nRisk Index (PDR). The score builds a prediction model of graft\nsurvival on donor factors together with ischemia time and type\nof transplantation (31).\nECD Hearts\nDue to the imminent gap between the supply of donor hearts\nand the demand for transplantable organs, strategies have\nemerged to overcome this clinical dilemma. The numbers of left\nventricular assist devices as bridge-to-transplant therapy have\nsignificantly increased over the last decade. Simultaneously with\nthis trend, marginal or “extended criteria” hearts are routinely\nevaluated in order to increase the donor pool. While standardized\ncriteria have not been published by societies so far, there is a\ngeneral consensus when it comes to the definition of marginal\ndonor hearts. The literature on this topic is primarily driven\nby US data. A Meeting Report by the American Society on\nTransplantation on adult cardiac transplantation is still lacking\na unified formal definition.\nTABLE 5 | Common criteria defining standard criteria (SCD), therefore not ECD\nlung.\nAge (yrs) <55\nBMI mismatch donor/recipient (%) >20\nClear chest X-ray Yes\nPaO2 (mm Hg) >300 (FIO2 1.0,\nPEEP 5 mm Hg)\nHistory of smoking (pack yrs) <20\nAbsence of chest trauma Yes\nAbsence of microbiologic organisms endobronchial Yes\nAbsence of malignancy Yes\nAbsence of purulent secretions or signs of aspiration\nendobronchial\nYes\nNegative virology Yes\nyrs, years; BMI, body mass index; FIO2, fraction of inspired oxygen; PaO2, partial pressure\nof oxygen; PEEP, positive end-expiratory pressure.\nBased on the current literature, the factors that should be\nconsidered as extended criteria in heart donation are given in\nTable 4.\nIn order to facilitate a better risk-assessment of allografts,\ndonor profiles have been implemented in Risk Scores. Smits et al.\nhave identified 12 variables associated with donor non-use in\nthe Eurotransplant region and have generated the Eurotransplant\nHeart Donor Score (32). Based on the UNOS database, a risk\nscore model (UNOS Donor Risk Score) has been developed by\nWeiss et al. (33).\nECD Lungs\nBased on the standard criteria donor lung definitions published\nin 2003 by Orens et al. (34), one can define an ECD lung if\nthe donor does not fulfill at least one criterion of the SCD\ncriteria suggested by the International Society for Heart and Lung\nTransplantation (Table 5).\nMACHINE PERFUSION\nThe concept of MP was part of organ preservation long before\nsolid organ transplantation (SOT) started to become a clinical\nreality and routine. With the publication by Collins et al., in\nwhich the authors described a method for the transportation of\nkidneys on ice using a preservation solution with the result that\nthe organs could be shipped in a small box and showed almost\nno damage after 30 h, the era of static cold storage (SCS) had\nbegun (35). The implementation of SCS led to satisfactory results\nwithin the entire field of SOT. However, with the increasing\nuse of organs procured from ECD and DCD, SCS alone is not\nable to deliver the post-transplant results we aim to achieve for\nour patients. The lack of oxygen, the continuation of anaerobic\nmetabolism leading to organ-damage and recipient-harming\nIRI after reperfusion, is significantly pronounced and more\ndetrimental in these marginal donor organs (36).\nFigure 1 illustrates the different possibilities for combining\nall preservation techniques available today clinically for almost\nall organs: static cold storage (as the golden standard,\nFrontiers in Immunology | www.frontiersin.org 4 May 2020 | Volume 11 | Article 631\n\nResch et al. Machine Perfusion for Marginal Organs\nFIGURE 1 | The past, present, and potential (near) future of organ preservation. Whereas, static cold storage (SCS) has been successfully applied over decades with\ngood outcomes in standard criteria donor (SCD) organs, at present, marginal or expanded criteria donor (ECD) organs in particular are increasingly preserved by\nhypothermic (HMP) or normothermic machine perfusion (NMP) technologies. After initial cold perfusion [*and optimally following normothermic regional perfusion\n(NRP) in Donation after cardiac death (DCD) organs], machine perfusion is commenced either at the retrieval center or at the transplant center in a “back to hub”\napproach. The next step is to effectively use the prolonged preservation times of ECD grafts achieved by optimized machine perfusion protocols to characterize ECD\norgan quality and transplantability via the assessment of biomarkers. To improve graft quality, NMP provides an ideal platform for future immunomodulatory\nmodifications and organ repair.\nso far), hypothermic preservation with/without oxygen, and\nnormothermic perfusion. Normothermic regional perfusion\n(NRP) is mentioned in Figure 1, as it has become an important\ntool for use before the procurement process of DCD starts. The\nfollowing sections will not present NRP data in particular, as the\nreview is about machine preservation in marginal donor organs.\nHowever, good and satisfying results after kidney, pancreas,\nheart, and liver transplantation were reported by several groups\nin the United Kingdom, Spain, and France and have been\nsummarized by previous reviews (37–42).\nRecently, Ruiz et al. presented a series of 46 livers transplanted\nafter NRP and concluded that their results, including 23%\nearly allograft dysfunction, are superior to standard DCD organ\nprocurements and comparable to donation after brain death\n(DBD) results (43). The Cambridge group (United Kingdom),\nclear NRP proponents, commented on this publication in a way\nsimilar to our suggestions illustrated in Figure 1. The publication\nby Ruiz et al. (43), like many others before it, did not compare the\nresults to an adequate prospectively organized control group.\nIt is noteworthy that, only recently, a protocol for NRP\nwas established even for DCD heart transplantation. Due to a\nrestoration of function of the arrested heart, organ assessment via\nechocardiography, pressure-volume loops, and cardiac-output\nmeasurements could be implemented (44).\nAccepted criteria for subsequent heart transplantation after\nweaning from mechanical support are defined as: cardiac\nindex >2.5 L/min/m2\n; central venous pressure < 12 mm Hg;\npulmonary capillary wedge pressure < 12 mm Hg; left ventricular\nejection fraction > 50% in transoesophageal echocardiography.\nNRP leads to a meaningful increment of survival benefits and\nhelps to enlarge the available donor pool by utilizing marginal\ndonor organs in a safe way (45, 46). Future trials are needed to\ncompare DCD organ transplantation +/– NRP followed by +/–\na combination of preservation techniques (42, 45).\nSince 2009, dynamic cold storage—hypothermic machine\nperfusion (HMP)—has progressed to become clinical routine in\nseveral fields of SOT—above all, in kidney preservation. Moers\net al. published their landmark paper in the New England Journal\nof Medicine and demonstrated a significantly lowered DGF\nrate in recipients receiving a hypothermically perfused kidney\ncompared to a renal graft stored on ice in the common way\n(47). Applying the same technology (HMP without supplemental\noxygenation), numerous publications on DCD and ECD kidneys\nhave followed over the past 10 years, showing similar results:\nECD and DCD kidneys and their recipients clearly benefit from\nMP as long as the duration of cold ischemia time (CIT) is\nreasonable (48–52). During the second half of the recent decade,\noxygen as a supplement has been focused on for kidney HMP.\nIn 2016, Jochmans et al. published an overview of ongoing\nMP trials in kidney and liver transplantation, including those\nassessing oxygenated HMP (53). One of these trials run by the\nCOPE\nR\nconsortium (http://cope-eu.com/work%20programme/\ntrials.html) has finished recruiting, and 1-year-follow-up results\nwere presented during the American Transplant Congress 2019.\nThis international RCT on oxygenated HMP of DCD kidneys\nincluded 197 kidney pairs, of which 106 were successfully\nhypothermically perfused and transplanted. Approximately 80%\nof the transplanted kidney pairs were eligible for the primary\nFrontiers in Immunology | www.frontiersin.org 5 May 2020 | Volume 11 | Article 631\n\nResch et al. Machine Perfusion for Marginal Organs\nanalysis and resulted in a similar eGFR at 1 year after transplant\nfor oxygenated (HMPO) and standard HMP. Analysis of all￾cause graft failure, however, showed a higher eGFR in HMPO\nthan in HMP. Overall graft loss was significantly lower in HMPO,\nleading the authors to suggest that HMPO improves 1-year\nkidney graft function when accounting for the beneficial effect\non allograft survival.\nIn contrast, in the field of pancreas transplantation,\ndynamic preservation technologies have not yet experienced\na breakthrough. Neither hypothermic nor NMP technologies\nare well-established, and SCS remains the standard procedure.\nA recent review outlined nine studies on HMP and 10 studies\non NMP. All of them were experimental; none of the human\npancreatic grafts were transplanted. However, the common\nconclusion of all of the published articles considered was that\nIRI, thrombosis, and morbidity after whole organ pancreas\ntransplantation might be reduced by both technologies (54–56).\nLiver transplantation can be regarded as the field in SOT that\nprimarily focuses on the development of preservation techniques,\ncurrently. The most commonly used perfusion types in the\ndaily routine are HOPE (hypothermic oxygenated perfusion),\nD-HOPE (d for dual oxygenation via hepatic artery and portal\nvein), and normothermic liver preservation. HOPE and D￾HOPE studies have produced promising results, showing higher\nadenosine triphosphate (ATP) levels during preservation, less\nIRI, excellent graft survival after DCD liver transplantation,\nand a significantly reduced rate of bile duct injuries (57–60).\nThe Birmingham group was the first to publish its experiences\non livers undergoing HOPE and NMP consecutively (61).\nAlthough such livers were not transplanted, HOPE/NMP livers\ndeveloped less oxidative injury and inflammation and achieved\nenhanced metabolic recovery compared to livers undergoing\nNMP only (61). Liver NMP had its great appearance when the\nfirst prospective international multicenter RCT was published in\nApril 2018 (62). The trial on DBD and DCD livers with NMP\ndurations up to 24 h could show a significantly lower level of graft\ninjury, measured by reduced peak aspartate aminotransferase\n(AST), longer preservation times, and a 50% lower discard rate of\norgans compared to SCS. Bile duct complications and graft and\npatient survival were comparable in both groups (62).\nNMP has been shown to be beneficial in terms of immediate\ngraft function in all organ types in which it has been explored\nclinically: this includes the kidney (63–65), liver (62, 66), and\nthe lung (67, 68). The mechanism by which this occurs has not\nyet been conclusively proven, but the concept is that reperfusion\n(rewarming and oxygen delivery) in the artificial context of the\nperfusion circuit is beneficial by allowing recovery of cellular\nenergetics in the absence of the effector mechanisms needed for\nan acute inflammatory response (as in ischemia-reperfusion).\nORGAN PRESERVATION VS. ORGAN\nCONDITIONING VS. ORGAN REPAIR\nWith a new technology, the accompanying terminology is often\nsomewhat unspecific and unprecise in the beginning. This also\napplies to MP. It is paramount, however, to eventually clarify the\nterminology and define a uniformity for its correct use. Simply\nput, no other terminology than organ preservation would be\njustified at this point in the clinical application, since no targeted\nmeans for organ reconditioning (let alone repair) have been\nestablished. While this remains a glorious goal for the future,\nit also represents a significant legal and ethical challenge, since\nthe framework for the treatment of human organs remains to\nbe established. It remains entirely unclear whether extracorporal\norgan reconditioning and/or repair can be achieved. The hope\nand the hype are building on a growing body of experimental\ndata that indicates the feasibility of success or organ-specific\ntreatment. While this remains a most significant opportunity for\nthe field, we herein aim to adequately define organ preservation,\norgan (re-)conditioning, and organ treatment.\nOrgan Preservation—A Definition\nIt is interesting to note that no entry exists on organ preservation\nin Wikipedia (search, 21.08.2019), while a PubMed search\nyields 17189 entries (https://www.ncbi.nlm.nih.gov/pubmed/?\nterm=organ+preservation). It seems to be a term where the\ndefinition appears so clear and easy that it does not need to\nbe written down. Yet again, a uniform description of organ\npreservation is not straightforward since it is not necessarily\ndefined by organ retrieval, temperature, metabolic state, or any\nother sole condition. The one possible common ground for a\ndefinition is the purpose. Putting an organ into a state that\nallows later reactivation and restitution of its original function\nwith the aim of minimizing damage during the period of mal￾and non-perfusion.\nOne essential limiting factor in the determination of the\nquality of the preservation method is the poor definition of\nendpoint for a clinical readout. Primary non-function (PNF)\nseems relatively well-defined at first glance, but the actual\ndefinitions leave room for interpretation. PNF does not indicate\nno organ function at all but rather a function insufficient to\nprevent/avoid longer-term organ replacement therapy.\nFor example, in liver transplantation, according to Ploeg\net al., PNF is defined by poor initial function, requiring re￾transplantation or leading to death within 7 days after the\nprimary procedure without any identifiable cause of graft failure\n(69). Such parameters inevitably introduce non-specificity into\nthe definition. The call for the need for re-transplantation and\nthe risk for death are clinician’s calls built on medical facts, the\ninterpretation of the physician, and a projection based on the\nparameters and the experience of the doctor. Since alternatives\nare insufficiently well-established, studies relating preservation\nquality to PNF need to be read in the light of this limitation.\nWhile PNF is seen as a suitable measure for organ preservation,\nother factors impacting on the PNF rate need to be considered.\nThe fact that re-transplantation is a risk factor for PNF indicates\nthat the role of recipient factors may be underestimated (70).\nFurther to this, no clinical preservation trial can seriously build\non PNF as an endpoint, since the PNF rates reported more\nrecently are in the range of 2–5%. Primary poor function is even\nmore vague in its sufficiency as a definition and clinical endpoint.\nVery recently, Dutkowski et al. (71) critically reflected on the\ncurrent parameters used to determine the success of preservation\nFrontiers in Immunology | www.frontiersin.org 6 May 2020 | Volume 11 | Article 631\n\nResch et al. Machine Perfusion for Marginal Organs\nin liver transplantation trials. While the current practice might be\nreasonable in the sense that it is building on the combination of\nparameters currently best established, alternatives are needed but\nneed to be more formally established prior to considering them\nnew clinical standards.\nA Brief History\nThe original vision of organ preservation as formulated in 1813\nwas built on the continuation of circulation and blood supply\n(72). The substitution of blood with perfusion solutions led to\nprolonged successful preservation of tissues, as described by\nCarrell (73). While prolonged successful preservation of tissues\nseems plausible according to these early findings, the actual\nsuitability for transplantation remained to be established (72).\nSuccessful kidney preservation for 3 to 5 days was achieved by\nthe use of continuous perfusion with cooled, oxygenated blood\nor plasma (74). Since continuous warm perfusion, oxygenation,\nand nutrition of an organ during transportation was technically\nvery demanding, the alternative concept eventually surpassed MP\nin the 1960s. The chemical composition of advanced solutions\nfor hypothermic organ storage resulted in excellent short-term\npreservation with good outcomes after transplantation. As with\nany achievement, the good results are a blessing and a curse.\nWith patient and graft survival as the only hard endpoints for\nclinical trials, the room for improvement became very small—\nat least with standard criteria organs. The search for superior\ntechnologies found a platform for clinical realization only when\nthe results after transplantation became less convincing, with a\ngreater effect on bile ducts as a target for early damage in liver\ntransplantation (72, 75–77). The organ shortage, together with\nthe push to use lower-quality organs and organs with additional\ndamage as a result of DCD, triggered the clinical realization of\nMP in liver transplantation.\nCurrent Situation\nThe current status of organ preservation remains largely defined\nby SCS. The well-established and standardized procedures of\norgan storage in three sterile plastic bags filled with preservation\nsolution (bag 1) or saline/ringer lactate/other (bags 2/3) is well￾established, with a relatively good understanding of the risk\naccumulating with the duration of preservation. The major\nadvantage of SCS is the safety of the procedure. Pretty much\nnothing can happen to an organ in plastic bags, on ice, in\na plastic container. The major limitations of this technique\nrelate to the fact that metabolism continues—even though\nat a very low rate—eventually resulting in the accumulation\nof succinate and reactive oxygen species (ROS) (78–81). The\nimmediate exposure to normothermia and oxygen results in an\ninflammatory response and organ-specific damage early after\ntransplantation. The mechanisms responsible for the eventual\norgan damage not only in organ transplantation but also in\nother diseases such as cardiac infarction and stroke are well￾established but not are the focus of this review. The key question\nin the consideration of NMP as an alternative to SCS is how\neffectively the mechanisms leading to an IRI are interrupted\nthrough either immediate NMP or NMP following SCS. While\npreclinical evidence (81) and the phase II/III trial by Nasralla et al.\n(62) have delivered evidence suggesting that NMP is superior to\nSCS when applied immediately, the actual net benefit of NMP\nfollowing SCS remains to be more clearly established. While\na key elements in such assessments are the proper definition\nof and agreement in the community on suitable endpoints\nregarding the preservation quality, the accompanying benefits\nand alternative endpoints should not be overlooked. The major\nbenefit of NMP vs. SCS is the time gained with (as it appears)\na relatively safe prolongation of preservation times under close\nto physiological conditions. The ability to monitor the viability\nand function of the organ adds important parameters for decision\nmaking and significantly ameliorates the logistical challenges\nin transplantation. The benefit of transforming transplantations\ninto scheduled procedures has the potential to significantly\nenhance safety but also training and teaching in transplantation.\nOrgan Reconditioning\nThe term organ reconditioning is used in a rather unspecific\nmanner in our field. According to Wikipedia, reconditioning\nmeans “to restore to a functional state, or to a condition\nresembling the original” (search “reconditioning,” September\n2019). The way this can be read in reference to human organs\nis that no intervention aiming beyond the restoration of the\ncondition of an organ prior to retrieval (a) or beyond the optimal\n(naïve) condition of a healthy human organ (b)—depending\non how the term “original” is interpreted in this context—shall\nbe included. These two possible views already point toward\nvery different states of an organ. The way the term was used\nin the recent scientific transplant literature is in agreement\nwith repair of the immediate injury prior to and during organ\nretrieval and storage. The key element of reconditioning/repair\nas clinically applied at this point relates to the prevention of an\neventual ROS burst by mitochondria and subsequent disruption\nof ATP production, mitochondrial permeability transition pores,\nand danger-associated molecular pattern (DAMP) release upon\nreperfusion. An electron shift toward succinate and subsequent\nreverse electron transfer upon reperfusion is discussed as a\nmechanism of damage and target of therapy in liver HMP (82).\nNMP is suggested to mitigate post-reperfusion hyperfibrinolysis\n(83) and inflammation (84). While these may be indirect effects\nof NMP, the actual immediate therapeutic mechanisms (if any)\nmay be glycogen repletion and ATP regeneration (85). Whether\nthese mechanisms are a simple effect of the restoration of close\nto physiological conditions or specific for NMP remains to be\nestablished. It is likely, however, that the benefit of NMP is\nmostly defined by the replacement or shortening of SCS and the\nindirect effects on logistics and preparation, organ monitoring,\nand decision making. Further to this, NMP may emerge as a\nplatform enabling organ treatment, while it may not have a\ntherapeutic/reconditioning effect per se.\nOrgan Repair\nHuman organ repair, apparently, is treated as an equivalent\nto organ regeneration (Google search “human organ repair,”\nSeptember 2019). While the common understanding of organ\nrepair might be more mechanistic and that of organ regeneration\nmore biological, the distinction between the terms seems vague.\nAlbeit experimental, therapeutic interventions in lungs seem\nmost closely approaching possible clinical implementation (86).\nFrontiers in Immunology | www.frontiersin.org 7 May 2020 | Volume 11 | Article 631\n\nResch et al. Machine Perfusion for Marginal Organs\nBronchoalveolar lavage, surfactant replacement, and alveolar\nrecruitment maneuvers seem to positively affect organ tissue\nmorphology and organ function. A hurdle to clinical application\nmay be the legislation. Directive 2004/23/EC of the European\nParliament and of the Council “on setting standards of\nquality and safety for the donation, procurement, testing,\nprocessing, preservation, storage, and distribution of human\ntissues and cells” largely focusses on tissues and not organs\nbut represents an important reference. Since preservation times\ncan be prolonged with the technologies being developed and\nurgency may no longer serve as justification for immediate\nprocessing (transplantation) without quality assurance, the legal\nframework for tissues and cells could be applied to organs.\nThe second element of the legal consideration relates to the\nelement of organ therapy. Inevitably, the issues of responsibilities\nand possession require clarification for attempts to introduce\nex vivo human organ treatment into clinical application. As\nlong as an organ is labeled as discarded because it seems\nunsuitable for immediate transplantation, the organ will not\nbe allocated to an individual, and hence considerations of\npossession and responsibilities become less demanding. Once\norgans possibly suitable for immediate transplantation have been\ntreated for reasons such as quality improvement or possibly organ\nreconditioning, the allocation process may be completed and the\nfuture recipient indicated. If and how an individual can consent\nto interventions and/or a trial involving organs will eventually\nrequire clarification.\nDirective 2010/45/EU of the European Parliament and of\nthe Council of 7 July 2010 on standards of quality and safety\nof human organs intended for transplantation (https://eur-lex.\neuropa.eu/eli/dir/2010/53/oj) does not provide much guidance\nregarding this issue.\nMACHINE PERFUSION IN CLINICAL\nPRACTICE\nSCS is a simple, safe, and cheap method to preserve and transport\norgans, and it has been successfully applied over decades with\ngood outcomes in SCD organs. However, to date, the large\ndiscrepancy between patients on the waiting lists and available\ndonor organs has forced the transplant community to cope with\nthe demand by pushing the limits and expanding the donor\npool by accepting increasing numbers of marginal organs from\nECD and reestablish DCD programs (87). Importantly, ECD and\nDCD organs have been identified to be particularly prone to IRI.\nAlthough SCS can decelerate degradation of a preserved organ,\nespecially in high risk or marginal organs, limited applicability\nis the consequence (36, 78). Attempting to overcome this issue,\nseveral MP technologies have been developed and now find their\nway into clinical practice in SOT.\nHMP of the Liver\nLiver HMP has been translated from the experimental state to\nclinical reality over the last decade. In 2010, the first phase I\nprospective cohort study was published, reporting on 20 patients\nwho underwent liver transplantation of grafts preserved by non￾oxygenated HMP. Outcomes were compared to a matched SCS\ncontrol group. HMP time ranged from 2 to 7 h, with a total\nCIT below 12 h. Except for a significantly lower peak serum\nAST in the HMP group, no further significant differences were\nobserved in regard to PNF, early allograft dysfunction, or graft\nand patient survival. However, clinical feasibility, as well as non￾inferiority to SCS, was proven, making way for further studies\n(88). Five years thereafter, the same group showed promising\nresults by transplanting 31 ECD livers declined by the United\nNetwork for Organ Sharing (UNOS) region and preserved under\nhypothermic dynamic conditions at 4–8◦C. Compared to well￾matched SCS controls, significantly fewer biliary complications\nand shorter hospital stays were observed. This study represents a\nlandmark, since the effectiveness of MP was shown within the\nmost susceptible livers in the donor pool (89). The impact of\nHMP on marginal organs was further investigated by Dutkowski\net al. In an international matched-case analysis, 25 DCD livers\nwere subjected to HOPE and compared to matched SCS DCD\nlivers. HOPE resulted in a significant reduction of ischemic\ncholangiopathy (HOPE: 20% vs. SCS: 46%) as well as a significant\nimprovement of 1-year graft survival rates (90 vs. 69%) (58).\nThe beneficial effect of HMP on DCD grafts was confirmed by a\nprospective case-control liver transplantation study, comparing\n10 grafts with at least 2 h of DHOPE to 20 grafts without.\nAn 11-fold increase in cellular ATP during oxygenation was\ndocumented. In addition to good early graft function, both 6-\nmonth and 1-year graft survival were 100%, while 6-month graft\nsurvival and 1-year graft and patient survival in the control group\nwere 80, 67, and 85%, respectively (57). Moreover, the same\ngroup could demonstrate an attenuation of IRI-associated bile\nduct damage after transplantation of DCD end-ischemic DHOPE\nliver grafts (90).\nHOPE in particular has evolved to become a widely used\ntechnology, showing excellent longer-term results. Schlegel et al.\nprovided data on 5-year outcomes of patients receiving DCD\nlivers preserved with 1–2 h of end-ischemic HOPE (n = 50)\nand compared them to the equal numbers of DCD liver\ntransplants without HOPE or DBD liver transplantations. Five￾year outcomes of HOPE-treated DCD liver transplants were\nsimilar to those of DBD primary transplants and superior to those\nof untreated DCD liver transplants (HOPE DCD 94% vs. SCS\nDCD 78%) (91).\nNMP of the Liver\nPreserving an organ under physiological conditions is the ideal\ncondition to prevent deleterious effects of ischemia as well as\nIRI following SOT. Similar to HMP, NMP has recently been\nimplemented in clinical routine at a variety of centers. The\ntransfer from the experimental stage to clinical application\nwas first described by Ravikumar et al. in 2016. In this phase\n1 (first-in-man), non-randomized prospective trial, short-term\noutcomes of 20 recipients of NMP-perfused donor livers were\nmatched in a ratio of 1:2 to cold-stored livers. In the study group,\nlivers were preserved under normothermic conditions over the\nentire preservation period (ranging from 3.5 to 18.5 h). Except for\na significantly reduced peak serum AST in NMP-liver recipients,\nFrontiers in Immunology | www.frontiersin.org 8 May 2020 | Volume 11 | Article 631\n\nResch et al. Machine Perfusion for Marginal Organs\nno differences regarding short-term recipient survival, PNF rate,\nor early allograft dysfunction were observed. Therefore, the safety\nand feasibility of this dynamic preservation method could be\nconfirmed, opening the field for further clinical investigations\nwith major implications on logistics (66).\nFeasibility and reproducibility following transplantation were\nfurther underlined in a U.S. phase I non-randomized pilot study\n(92). However, this trial also pointed out that NMP of an organ\nis not a trivial procedure and runs the risk of graft loss if\nhuman/technical errors occur. Out of 10 procured livers, one\norgan had to be promptly discarded due to an unrecognized\nportal vein twist. The remaining nine organs (four DCD\nMaastricht class III, 5 DBD) were successfully transplanted, and\noutcomes were comparable to matched control liver transplant\nrecipients of SCS grafts. The proof of concept and feasibility gave\nway for larger-scale trials.\nNasralla et al. were first to perform RCT to test the efficacy\nof NMP vs. SCS. After informed consent had been obtained\nfrom the recipient, the allocated liver was either randomized to\nSCS or NMP. NMP was performed over the entire preservation\nperiod. Outcomes of 121 NMP-graft recipients were compared to\noutcomes from 101 well-matched SCS-graft recipients. The key\nfindings of this study were a significantly reduced peak serum\nAST, a significant reduction of post-reperfusion syndrome, and\na 72% lower adjusted odds rate of developing early allograft\ndysfunction (EAD) in the NMP liver recipients compared to\ncontrols. Furthermore, NMP of the liver graft resulted in\nincreased organ utilization with a 50% lower discard rate in this\ngroup (62).\nThe additional positive effect of NMP is the “almost”\nphysiological aspect of this method, which opens up new\npossibilities by means of organ assessment and organ selection.\nThis fact was a matter of investigation in an observational\nstudy, where livers considered unsuitable for transplantation\nas well as highest risk liver were included. In total, 47 livers\nwere biochemically assessed during the preservation, resulting\nin 39 liver transplants. Remarkably, two out of 19 livers deemed\nunsuitable were transplanted (93).\nIn summary, both HMP/HOPE and NMP are accepted\nand clinically established preservation methods, particularly\ninteresting in the preservation and preconditioning of high-risk\norgans. Especially in this organ category, including ECD and\nDCD livers, they have both been shown to be superior to SCS.\nWhether HMP/HOPE or HMP is superior to the other is still a\nmatter of debate since the two methods have not been correlated\nwith each other in clinical settings, and further RCTs are needed.\nHMP of the Kidney\nThe amount of clinical evidence for dynamic preservation of\nkidney grafts is rapidly increasing. Moers et al. were first to\nperform an international RCT on hypothermically perfused\nkidneys for transplantation. One kidney from 336 deceased\ndonors was randomly assigned to HMP, and the other to SCS. A\nreduced risk of DGF and improved graft survival in favor of MP￾preserved organs was shown (47). These promising results were\nconfirmed in a subsequent RCT from the Eurotransplant region.\nJochmans et al. investigated the efficacy of HMP in preserving\nDCD kidneys. Similar to Moers et al., DCD kidneys were assigned\nin a 1:1 match to HMP or SCS, resulting in a total of 164 kidney\ntransplants (82 HMP vs. 82 SCS). HMP resulted in a significantly\nreduced DGF rate as well as better early graft function after\n1 month compared to SCS. However, 1-year graft survival was\ncomparable in both groups (49).\nFurthermore, in another RCT, kidneys were either preserved\nby HMP or SCS. In accordance with Moers as well as\nJochmans, the primary end-point was the occurrence of DGF.\nSecondary endpoints were primary non-function as well as graft\nsurvival. Both the risk of DGF and the incidence of non￾function were significantly reduced by HMP in their cohort.\nOne-year graft survival and function could be improved by\ndynamic cold graft preservation (52). Despite these findings,\nthe importance of different factors such as the impact of CIT\nand the combination of CIT with HMP have to be mentioned.\nCIT is a known independent risk factor for DGF. In order\nto investigate which kidney graft may further benefit from\nHMP prior to transplantation, Kox et al. analyzed prospectively\ncollected data from the “Machine Perfusion Trial.” A total of 752\nrenal transplants were included with 376 dynamically preserved\nkidneys and 376 statically preserved grafts. They identified CIT\nas an independent risk factor for DGF. Furthermore, HMP did\nnot prevent DGF if CIT exceeded 10 h (51).\nThe optimal timepoint for, as well as the optimal duration of,\nHMP is still a matter of debate. HMP can be used either as a\nprimary preservation method or in the end-ischemic phase as\na reconditioning tool. Matos et al. were able to show a faster\nrecovery of renal function if grafts were subjected to HMP prior\nto transplantation after a mean SCS period of 22 h. MP time was\nat least 6 h. However, this beneficial effect was limited to donors\nunder the age of 50, who represent a rather selective group (94).\nFurther studies followed, indicating a beneficial effect of MP in\nthe end-ischemic phase by displaying a reduction of DGF, as\nwell as an improved organ acceptance. This last positive trend is\nattributed mainly to the possibility of organ monitoring (95, 96).\nNMP of the Kidney\nNMP of the kidney may eventually resolve many issues\nrelated to damage induced by ischemic phases. The idea of\npreserving kidney grafts under almost physiological conditions\nwith the possibility of real-life assessment of the graft prior to\ntransplantation sounds intriguing. However, while the number\nof preclinical studies using animal models as well as discarded\nhuman kidneys is steadily increasing, evidence for NMP of\nthe kidney in a clinical setting is rather poor. Hosgood et al.\nwere first to transform preclinical experience into clinical reality\nby transplanting a 62-year-old ECD kidney into a 55-year old\nrecipient. After 11 h of SCS, the graft was perfused with a\nplasma-free red cell-based solution at 33.9◦C for 35 min prior\nto transplantation. Although a slow graft function was observed,\nthe patient remained dialysis free with a serum creatinine level\nof 132 µmol/L at 3 months post-transplantation. In contrast, the\nrecipient of the opposite kidney developed DGF (64). Based on\nthis first success, the Leicester group translated NMP into clinical\nreality on a larger scale. Eighteen ECD kidneys were subjected to\nNMP reconditioning prior to transplantation. The average NMP\nFrontiers in Immunology | www.frontiersin.org 9 May 2020 | Volume 11 | Article 631\n\nResch et al. Machine Perfusion for Marginal Organs\ntime was prolonged to 63 min. Outcomes were compared to 47\nmatched ECD kidneys preserved by SCS. In this study, NMP\nresulted in a significantly reduced DGF rate compared to controls\n(NMP: 5.6% vs. SCS: 36.2%). However, no differences could be\nobserved in regard to 1-year graft or patient survival (97).\nTaken together, HMP of the kidney has been shown to have its\nplace, especially in the preservation of marginal grafts, including\ngrafts from DCD and ECD, with superior outcomes in the early\nphase compared to SCS. However, CIT is still the limiting factor\ninfluencing short- as well as long-term outcomes. In contrast,\nalthough the amount of preclinical data is rapidly increasing,\nNMP is still in its early phase. However, feasibility and non￾inferiority to SCS have been described at this early stage, and\nmulticenter RCTs are planned.\nMachine Preservation of the Pancreas\nIn contrast to the dynamic preservation of liver and kidney,\npancreatic MP is challenging. This is attributed to the physiologic\nas well as the anatomical characteristics of the pancreatic graft\n(98). MP of pancreatic grafts poses major challenges due to the\nsusceptibility of the organ to IRI-associated alterations, including\nacinar necrosis, edema formation, and endothelial disruption.\nThese factors in particular are recognized risk factors for early\ngraft pancreatitis and thrombosis, eventually resulting in graft\nloss (98, 99).\nIn contrast to the liver as well as the kidney, the\npancreas is characterized by a low-flow and low-pressure\nenvironment, which impedes the direct translation of the existing\nperfusion machines for use in dynamic pancreas preservation\n(100). However, the feasibility of pancreatic HMP has been\ndemonstrated in several experimental settings involving the\npreservation of porcine, dog, and discarded human pancreas\ngrafts (55, 101, 102). Although results are promising in this\nexperimental setting, clinical translation is still pending.\nTherefore, assessment and evaluation of a pancreatic graft\nprior to transplantation would be of the utmost importance,\nsince changes in donor demographics result in an increased\nneed for the acceptance of higher-risk grafts at high-volume\ncenters. However, MP of pancreatic grafts must still be considered\nexperimental at this stage.\nMachine Preservation of the Lung\nDue to pre- and peri-retrieval management and direct\nexamination of the donor organ by the explant surgeon, some\nextended criteria organs can be directly used with acceptable risk\nfor the recipient, but a notable number are rejected during the\nretrieval process. There is still a lack of clear decision criteria\nfor lung suitability for transplantation or attempts at lung\nreconditioning using an ex vivo lung perfusion (EVLP) (103).\nNeedless to say, MP could improve organ availability, which is\ncritically needed in the face of a waitlist mortality that is reported\nto be up to 30% depending on the allocation system (104).\nImportantly, ex vivo prolonged lung preservation resulted in\nsuccessful transplantation of high-risk donor lungs (105), and\nMP is now indispensable for evaluating lung graft quality from\nan uncontrolled DCD (106). Very promising data have come\nfrom experimental EVLP studies, which are outlined later in\nthis article.\nMachine Preservation of the Heart\nAt present, SCS of donor hearts remains the standard practice\nin most transplant units, whereas MP is limited to a few centers\nin the US and Europe. To date, only one device is available for\nclinical use—the Transmedic Organ Care System (OCS) Heart.\nAt mild hypothermia (34◦C), the system uses a combination of\ndonor blood and a proprietary solution as perfusate for the heart.\nIn 2014, heart NMP has led to the first distant procurement DCD\nheart transplantation. To date, over 100 DCD heart transplants\nhave been performed using a cardiac perfusion system (107), and\nMP of hearts exhibited safe preservation in RCTs (108).\nEX VIVO MONITORING OF ORGAN\nFUNCTION AND QUALITY\nCurrently, the decision as to whether organs are suitable for\ntransplantation is determined on the basis of more or less\nsubjective empirically established clinical parameters that have\nbeen shown to be associated with an increased rate of early\nallograft dysfunction or graft failure. Parameters such as donor\npast medical history, last known laboratory values, findings\nduring procurement, and other procurement variables such as\nexpected ischemia times primarily determine the acceptability\nof a graft. These parameters include prolonged warm ischemia\ntime (WIT) >30 min during DCD, prolonged CIT, and\nparenchymal alterations within the graft (e.g., steatosis, fibrosis,\narteriosclerosis). Viability testing and functional assessment\nprior to transplantation are likely to extend the utilization of\nsuboptimal or marginal organs (109–111).\nHMP is an alternative method to standard SCS for the\npreservation of organs. For different types of kidney grafts, HMP\noffers superior preservation compared with SCS. In terms of graft\nquality assessment during HMP, some biochemical parameters of\nthe released perfusate and hydrodynamic parameters are found\nto independently correlate with the outcome—a finding that may\nhelp clinicians in their decision making.\nIncreased Glutathione S-Tranferase (GST), N-acetyl-beta-D￾glucosaminidase (NAG), heart-type fatty acid-binding protein\n(H-FABP), or lactate dehydrogenase (LDH) concentrations\nduring MP may serve as indicators for suboptimal graft quality.\nFurthermore, levels of redox-active iron measured in the\nperfusate have been correlated with DGF rates (112–114).\nMoreover, the measurement of vascular resistance during MP\nrepresents an additional and objective source of information\nthat can assist clinicians in their decision-making process.\nHigh vascular resistance as a hydrodynamic parameter has\nbeen shown to be associated with an increased risk of DGF\ndevelopment and predictive for 1-year graft failure (115–117).\nTaken together, to date, increased vascular resistance and high\ninjury marker concentrations in the perfusate are risk factors for\nDGF and helpful parameters, but they are not accurate enough\nto justify a decision for discard based on their interpretation\nalone (112–114, 117).\nFrontiers in Immunology | www.frontiersin.org 10 May 2020 | Volume 11 | Article 631\n\nResch et al. Machine Perfusion for Marginal Organs\nConcerning kidney NMP, a scoring system has been\ndeveloped by Hosgood and Nicholson. The decision on whether\nto transplant an NMP-kidney was based on macroscopic\nappearance, renal blood flow, and total urine output during\nNMP. The authors conclude that, currently, a high percentage of\nretrieved kidneys are being unnecessarily discarded (80, 118).\nCompared to the kidney, data on liver monitoring during\nHMP remain scarce, although recent publications suggest\npromising parameters. A correlation between the AST levels\nin the perfusate during HMP and the peak of AST after liver\ntransplantation has been described. Furthermore, during HMP\nof porcine livers, a cumulative release of Fatty Acid- Binding\nProtein 1 (FABP) or AST may be represented by a linear or\nlogarithmic equation, respectively. Each equation is characterized\nby a b-coefficient that is able to discriminate between livers likely\nto fail. Similarly, during HMP of human livers discarded for\ntransplantation, AST release in the perfusate could discriminate\nbetween livers suitable for transplantation and unsuitable ones.\nMore sophisticated methods to determine graft viability include\nevaluation of ATP content assessed by magnetic resonance\nimaging and spectroscopy (89, 91, 119–121). In this regard, van\nRijn et al. used cellular ATP content during oxygenated dual\n(arterial and portal perfusion) HMP as a viability marker for liver\ngrafts. Cellular ATP content correlated with biochemical function\nearly after transplantation (57).\nFurthermore, there is evidence that a decline in arterial flow\nin a pressure-controlled system of MP can be used as a marker\nfor decreasing graft viability. However, in general, it cannot be\nadvised to use flow values as an indicator of liver damage and\nviability during human liver MP (61, 91, 122).\nConcerning NMP of liver grafts, this technology has been\napplied with promising results for utilization and outcomes\n(62, 66, 92, 123–126), and the option for the assessment of\nliver viability during NMP has been highlighted. Imber et al.\n(127) suggested that bile production is directly associated with\nliver viability. Matton et al. (128) were able to show that a\nbiliary bicarbonate concentration greater than 18 mmol/L has a\nhigh negative predictive value in terms of histological bile duct\ninjury. Moreover, biliary pH greater than 7.48, biliary glucose\nconcentration less than 16 mmol/L, bile/perfusate glucose\nconcentration ratio less than 0.67, and biliary LDH concentration\nless than 3,689 U/L may serve as indicators for high biliary\nviability. Watson et al. (93) published their experience of\ntransplanting declined livers following NMP and graft viability\nassessment. They observed that NMP resulted in a reduced\nincidence of post-reperfusion syndrome and described biliary\npH as a predictive marker for post-transplant cholangiopathy.\nPerfusate lactate and transaminases and bile production during\nNMP were suggested by Op den Dries et al. (129) to serve\nas viability markers. Recently, Mergental et al. (130) published\nviability criteria (applicable within 3 h of perfusion) for livers\nconsidered suitable for transplantation. These include lactate\nclearance, bile production, PH- homeostasis, and stable pressure\nand flow dynamics of the graft.\nThere is growing evidence that hepatic ATP content may serve\nas a viability marker. In clinical studies, hepatic ATP levels prior\nto organ retrieval or during preservation correlated with primary\nliver function after transplantation. Bruisma et al. showed\nthat differences in mitochondrial respiration and restoration of\ncellular ATP contents are possible viability markers in the setting\nof NMP. Moreover, NMP offers the option to perform dynamic\nmetabolomic analyses in both bile samples and sequential liver\nbiopsies (111, 131).\nHowever, although these results seem impressive, none of the\nabove-mentioned viability markers have been validated in larger\nstudies, and the small numbers of patients included in the studies\nmake it difficult to draw robust conclusions.\nRegarding a potential viability assessment of human pancreas\ngrafts during HMP, flow indices and histological assessment\nof duodenal and pancreas-parenchyma biopsies throughout the\nperfusion duration have been proposed. Branchereau et al.\ndescribed an absence of edema, a decrease in resistance indices,\nand normal staining for insulin, glucagon, and somatostatin as\nmarkers for good graft quality (56, 101). Barlow et al. suggested\nthe assessment of amylase levels in the perfusate, fat infiltration\n(detected using standard histology), and exocrine pancreas\nfunction as criteria to assess graft viability during NMP (55).\nConcerning heart transplantation, organ assessment during\nNMP mainly relies on metabolic parameters and measurements\nof lactate levels in the aortic root and pulmonary artery. In the\nPROCEED II trial, three hearts were discarded due to rising total\nperfusate lactate concentrations. Histopathological examination\nshowed myocardial injury (necrosis, hemorrhage, scarring) or\nleft ventricular hypertrophy in those organs (108). Calculations\nof pressure volume loops in the left and right ventricle\nhave been described by switching the heart into a “working\nmode” during NMP. Based on pressure-volume (PV) loop data,\nend-systolic elastance could be calculated as a parameter for\nventricular contractility (44, 132). Due to complicated clinical\ninterpretation and difficulties in reproducibility, “working mode”\nhas been removed from the OCS perfusion module. Contrast\nechocardiography or intravascular ultrasound of coronary\narteries might emerge as tools for anatomical and mechanical\nassessment during NMP but have not been implemented in\nclinical routine so far.\nIn EVLP, assessment of the organ relies primarily on\nfunctional and macroscopic parameters, as has been reviewed\nrecently (103). Adequate gas exchange, stable hemodynamic\nand ventilatory parameters, macroscopic evaluation (absence\nof oedema), bronchoscopy (absence of purulent secretion and\nerythema of the bronchus), and deflation after endotracheal\ntube disconnection (collapse test) during the evaluation period\nare the commonly used decision criteria for acceptance of the\nlung. Yet these criteria are not standardized and differ between\ntransplant centers (103). As physiological parameters are in\nthe lead for decision making in EVLP, clinical single-center\nstudies assessed different biomarkers and metabolic parameters\nof the perfusate or the bronchioalveolar lavage to predict organ\nacceptance and occurrence of early prostaglandin D3 (PGD3).\nMachuca et al. (133) showed that high levels of endothelin-1 (ET￾1) and Big ET-1 measured in perfusate samples have prognostic\nvalue for decline in the lung because of subsequent development\nof poor physiological performance. Subsequently, the same group\nsuggested IL-8 as a powerful predictor for early graft dysfunction\nFrontiers in Immunology | www.frontiersin.org 11 May 2020 | Volume 11 | Article 631\n\nResch et al. Machine Perfusion for Marginal Organs\n(134). Furthermore, IL-1β and IL-8 levels measured in the\nperfusate during EVLP were reported to inversely correlate with\nthe recipient oxygenation 24 h post-transplantation (135).\nInterestingly, given the observation that perfusate IL-1β and\nTNF-α at 30 min during EVLP were effective markers for\ndifferentiating between in-hospital survival and non-survival\npost-transplant, blocking the IL-1β pathway during EVLP\nmight reduce endothelial activation and subsequent neutrophil\nadhesion on reperfusion (136).\nIMMUNOLOGICAL ASPECTS OF\n(MARGINAL) ORGANS DURING MACHINE\nPERFUSION\nThe definition of marginal organs per se is a rather arbitrary one.\nThe most commonly used is the dichotomy between standard\ncriteria (SCD) and extended criteria donors (ECD), which is\nsimply discriminated by age and three donor criteria for the DBD\n(and, increasingly, DCD) kidney cohort (13, 137, 138). However,\nin clinical routine, it is not always straightforward to decide if an\norgan is within “standard criteria,” as there are plethora of factors\ninterfering with organ quality, i.e., estimated duration of CIT,\n(functional) WIT, or the grade of steatosis in liver and pancreas,\njust to mention a few.\nWhen we focus on the donor age only, a vast amount of\nliterature exists. There is evidence that the immunogenicity\nof elderly organs is increased, as it is believed that aging in\ncombination with injuries (i.e., brain death) induces a pro￾inflammatory environment, which could lead to an activation\nof innate and adaptive immune responses (139–141). Aging\ninfluences cellular repair mechanisms, and it is known that\nthe number of MHC molecules present on the cellular\nsurface is increased by aged parenchymal cells (139). In\nexperimental studies, transplantation of elderly organs was\nassociated with a more powerful early immune response\ncompared to transplantation of younger ones. Recipients of\nsuch old grafts presented with a higher concentration of\neffector/memory T-cells with an increased alloreactivity, leading\nto acute rejection, which results in a particular high burden\nof damage for the older donor organ (140). Elderly organs do\nnot have the same repair mechanism capabilities, so the clinical\ndamage of acute rejection leaves a more severe defect, explaining\nthe increased rates of DGF and/or graft loss in this donor\ncohort (140, 142).\nAn alteration of immunogenicity in aging organs could be\none reason to focus on preservation techniques (143) such\nas HMP and NMP to learn more about the process or even\nto (re-)condition an organ for reperfusion in the recipient.\nDue to the fact that the reconstitution of a near-physiological\nenvironment might work best to study immune cells, the\nfollowing paragraphs will bring NMP into focus.\nHuman organs are equipped with a sophisticated resident\nimmune system. The kidney, for example, not only hosts tissue￾resident macrophages (144); the organ also harbors lymphocytes,\ninnate lymphoid cells, natural killer (NK) cells, natural killer T\n(NKT) cells, and γδ T cells (145). The residential immune cells\nof human organs remain in a balanced homeostatic state unless\nthey are stimulated—by the insult of brain death in an organ\ndonor, for example—when an immunological activation might be\ninduced. Such a response to a significant injury like brain death in\nan organ donor includes both local and systemic inflammation,\ncomprising cellular infiltrates and a cytokine storm (146).\nWith the current gold-standard preservation technologies such\nas SCS, the organs will be transplanted unchanged, in an\nimmunologically activated status, into recipients in whom\nalloantigens will trigger another immune response immediately\nafter reperfusion, presented by donor-derived antigen presenting\ncells to recipient T cells (147, 148). How important donor￾derived leukocytes are in the allorecognition and rejection\nprocesses was demonstrated by Lechler and Batchelor years\nago. They impressively showed that placing a rat kidney into\nan intermediate recipient before implanting it into the final\nrecipient could significantly prolong allograft survival. These\nexperiments demonstrated that “clearing” the organ of dendritic\ncells (DC), the “passenger leukocytes” responsible for activating\nrecipient T cells, by using the intermediate rat led to the desired\nsuccess (149, 150). “Parking” the organ in an interim host\nis not a feasible strategy for implementation in the clinical\nroutine. However, NMP offers the possibility to represent the\nintermediate recipient as a conditioning tool to achieve the same\nend result, as previously published by Lechler et al. (150). An\nex vivo setting might provide not only a more physiological\npreservation method but also the ability to assess the organ\nprior to transplantation and to investigate its immunological\ncharacteristics in isolation (42).\nOne of the leading groups analyzing marginal and SCD\norgans after ex vivo perfusion is the Manchester group around\nFildes and Stone. Already in 2015, they compared the clinical\noutcome of patients transplanted with marginal donor lungs\nafter undergoing EVLP compared to standard transplantation\nof acceptable lungs (151). Despite having transplanted marginal\nlungs, there was no significant difference in the clinical outcome\nup to 12 months after transplantation concerning the overall\nincidence of acute rejection and the number of treated infection\nepisodes (151). This work was followed by a study on passenger\nleukocyte migration from donor lungs into the recipients and\nthe effects of donor leukocyte depletion prior to transplantation\nusing EVLP (152). In this experimental work using a porcine\nmodel, Stone et al. illustrated that donor leukocyte transfer\ninto the recipient was reduced by EVLP and therefore reduces\ndirect allorecognition and T-cell priming (152). The same group\ntransferred their experience to an ex vivo NMP model to analyze\ndonor-derived leukocytes in a porcine renal transplantation\nmodel. Stone et al. were able to demonstrate that an inflammatory\ncytokine storm and the release of mitochondrial and genomic\nDNA were initiated in the NMP circuit prior to transplantation.\nHowever, the renal function was not impacted at all after\ntransplanting those organs. They suggest that NMP could be used\nto immunodeplete and to saturate the capacity of inflammation\nof donor kidneys before transplanting them (152). Amin et al.\n(153) evaluated the impact of a post-SCS-preservation flush on\nthe inflammatory burden of a limb allograft (a porcine model for\nvascularized composite allotransplantation). The venous effluent\nFrontiers in Immunology | www.frontiersin.org 12 May 2020 | Volume 11 | Article 631\n\nResch et al. Machine Perfusion for Marginal Organs\nafter flushing the limbs following either 2 or 6 h of SCS comprised\na large population of viable leukocytes, significant concentrations\nof pro-inflammatory cytokines and mitochondrial DNA. These\nresults support the hypothesis that flushing or dynamically\npreserving the organs prior to transplantation impacts the\ninflammatory burden otherwise transferred to the recipient upon\nreperfusion unchanged (153).\nLiver NMP has recently been implemented as a standard\nprocedure in the United Kingdom and been shown to improve\norgan utilization and post-transplant outcomes following phase I\nand phase III prospective randomized trials (62, 66). Jassem et al.\n(84) transplanted, compared, and analyzed 12 NMP-preserved\nlivers against 27 SCS-preserved livers to assess the impact of NMP\non IRI, necrosis, platelet deposition, neutrophil infiltration, and\nthe degree of steatosis after NMP or SCS pre- and post-perfusion.\nTheir results showed that, with NMP, there were altered gene￾expression profiles of liver tissue from pro-inflammation to\nregeneration, reduced numbers of interferon gamma (IFNγ)-\nand interleukin-17-producing T cells, and an enlarged pool\nof regulatory T cells. In addition, NMP liver tissue was less\nnecrotic and apoptotic compared to SCS-preserved livers, with\nless neutrophils infiltrating the periportal area (84).\nOverall, with the clinical and experimental evidence gained\nso far for the field of SOT, dynamic preservation methods -\nand NMP in particular - provide the means to introduce\norgan conditioning so as to lower immunogenicity as well as\npro-inflammatory markers while ensuring the promotion of\ngraft regeneration.\nIMMUNOMODULATION DURING MP\nMachine perfusion (MP) offers a previously non-existent link\nbetween basic and clinical science. The opportunity to treat an\norgan during preservation creates a new field of translational\nresearch. In this context, one of the main targets that can now\nbe addressed is the modulation of the immunogenicity of a\nspecific graft. In theory, such immunomodulation could allow the\nobviation of lifelong immunosuppression or even forge a path to\nthe holy grail in transplantation—the achievement of tolerance.\nImportantly, MP offers a platform to apply immunomodulatory\nstrategies that have been elucidated in in vitro or preclinical\nmodels in the past.\nIn the existing literature, three major such strategies have\nbeen investigated, which are discussed herein. One of the\nmost promising is the application of stem or progenitor\ncells, with the potential to suppress immunogenicity and help\nrepair injured tissue. Another strategy is the administration of\nanti-inflammatory/immunomodulatory drugs and agents, and,\nfinally, gene transduction by adenoviral vector gene delivery.\nThe majority of studies have been carried out under\nnormothermic conditions. However, oxygenated perfusion of\na graft per se seems not only to protect against preservation\ninjury but also to downregulate the immune system and\nblunt the alloimmune response, as was shown in a rodent\nmodel of hypothermic oxygenated perfusion (HOPE) (154). In\nparticular, the constant flow of fluids in the vessels during MP is\nregarded to promote the expression of vasoprotective endothelial\ngenes, alleviating the microcirculatory failure associated with\nischemia-reperfusion injury (IRI) (155–157). On the other\nhand, when it comes to additional modification, it is perfusion\nunder normothermic conditions that seems to represent the\nideal platform, since NMP grants a physiological metabolic\nstate (81, 158–160).\nMany of the ongoing studies addressing the field of\nimmunomodulation during MP are carried out in a porcine\nsetting, as pigs have appropriate size and anatomy as well\nas immunologic characteristics (161). Whereas, much of our\nknowledge on organ preservation is derived from various animal\nstudies (162), the porcine model above all has now evolved\nas an ideal model, making ex vivo porcine organ perfusion\nmodels a suitable platform for translational transplant research.\nAccording to a recent review, in 2017, 22 articles discussed ex\nvivo porcine organ perfusion within the context of transplant\npreservation surgery (162), but the number of articles has steadily\nincreased since then. However, also in this setting, it is important\nto highlight potential limitations when translating experiences\nbetween species (158).\nStem and Progenitor Cells\nSeveral candidate cells have been investigated, including stromal\nmesenchymal cells (MSCs), induced adult pluripotent stem cells,\nfetal stem cells from placenta, membranes, amniotic fluid, and\numbilical cord, and hematopoietic cells (163). Among these,\nMSCs have been reported to represent the most promising cell\nsubset. MSCs are multipotent cells that are found in adult tissues,\nincluding adipose tissue and bone marrow, where they support\nfunction and repair. Importantly, they have been shown to abate\nimmune and inflammatory responses via the release of paracrine\neffectors (164, 165).\nThis circumstance has led to a broad application of MSCs in\na variety of pathologies. Therefore, a prerequisite for research\non MSCs is the agreement on criteria that define these cells and\nallow comparability between studies. The International Society\nfor Cellular Therapy has established the minimum criteria that\na cell must meet to be considered an MSC: first, an MSC\nmust be plastic-adherent when maintained in standard culture\nconditions; second, an MSC must express CD105, CD73, and\nCD90 and lack expression of CD45, CD34, CD14 or CD11b,\nCD79alpha or CD19, and HLA-DR surface molecules; third, an\nMSC must differentiate into cell types of mesodermal origin in\nvitro (166, 167).\nThe fact that MSCs are known for their potent anti￾inflammatory and regenerative capacities, combined with the\nfinding that a therapeutic effect can be achieved with either\nautologous or allogeneic MSCs (168), has led to the conduction of\nseveral studies investigating whether their application is feasible\nin the context of MP. However, the detailed mechanisms by\nwhich MSCs exert their anti-inflammatory and regenerative\npotential have not yet been depicted. The main mechanism of\naction is supposed to rely on secreted mediators. Therefore, an\nappropriate timeframe is likely to be required for these cells\nin order to mediate beneficial effects (169). This hypothesis is\nunderlined by the findings of a recent study in a porcine ex\nvivo lung perfusion (EVLP) model. Twelve-hour NMP of DCD\nlungs with intravascular delivery of MSCs (150 × 106\n) resulted\nin reduced levels of interleukin-8 (IL-8), a pro-inflammatory\nFrontiers in Immunology | www.frontiersin.org 13 May 2020 | Volume 11 | Article 631\n\nResch et al. Machine Perfusion for Marginal Organs\ncytokine associated with reperfusion injury, along with increased\nlevels of vascular endothelial growth factor (VEGF) (170). The\nfact that IL-8 was suppressed is of particular note, since MSCs are\nknown to produce the anti-inflammatory cytokine IL-10, which\nin turn has been reported to significantly suppress the production\nof IL-8 in a dose-dependent manner (169).\nIn human kidneys, Brasile et al. demonstrated actual\nrenal regeneration mediated by MSCs under 24 h of ex vivo\nnormothermic perfusion. The authors used an exsanguinous\nmetabolic support (EMS) tissue-engineering platform to study\nfive pairs of kidney allografts from DCD donors. Whereas, one\nkidney of each pair solely underwent perfusion, the partner\nkidney was EMS perfused with MSC (1 × 10). Indeed, a reduced\ninflammatory response was observed along with increased\nsynthesis of adenosine triphosphate and growth factors and a\nnormalization of the cytoskeleton and mitosis (171).\nEven though these findings are promising, more insight\nneeds to be gained regarding the effects of the NMP milieu\non MSC themselves and the comparability between human\nand porcine data. These aspects were highlighted in a kidney\nNMP model, showing that while the suspension conditions\nreduced the viability of porcine MSC by 40% in both perfusion\nfluid and culture medium, the viability of human MSC was\nreduced by suspension conditions by 15% in perfusion fluid,\nand no differences were found in survival in culture medium.\nFurthermore, it was shown that a freeze-thawing process\nimpaired survival, metabolism, and the ability to adhere to\nendothelial cells. The authors concluded that NMP conditions\naffect MSC but show sufficient support of their function and\nsurvival that MSC administration through NMP should be\nconsidered, and secondly that slight differences in the behavior\nof porcine and human MSC need to be taken into account (158).\nAnother recent analysis focused on the characteristics of\nculture-expanded MSC, investigating heir viability and homin\nduring NMP. Kidneys were perfused for 7 h in the presence\nof 105\n, 106\n, or 107 human adipose tissue-derived MSC. Intact\nMSCs were detected in the lumen of glomerular capillaries,\nbut only in the 107 MSC group. After a rapid decline of cell\nnumbers during NMP, only a small portion of the MSCs were\nintact, and these were clustered in a minority of glomeruli. Apart\nfrom outlining the complexity of MSC therapy during MP, the\nauthors concluded that “an exciting new window of opportunity\nmight emerge to actively pre-condition isolated organs in a fully\ncontrolled setting and in the absence of an immune response, before\nthey are transplanted” (172).\nIt is noteworthy that such promising findings have recently\nled to the creation of the international “MePEP consortium”\n(173) in order to study this novel modality of treatment in\npreparation for human trials. Therefore, more findings on MSC\nand immunomodulation can be expected in the near future.\nAnti-inflammatory Agents\nAlternatively, pharmacologic interventions to decrease\nimmunogenicity or prevent recurrent disease can be applied\nduring MP. The seemingly most obvious strategy to influence the\ninflammatory profile is the delivery of anti-inflammatory agents\ndirectly into the machine perfusion circuit, treating the liver\nex vivo during the preservation period to obviate the need for\nlifelong immunosuppression or to improve long-term outcomes\nseparate from the physiological quality of the organ at the time\nof transplantation (174).\nSeveral targets for potential agents have been identified.\nAmongst these is TNF-alpha, one of the most potent\nproinflammatory cytokines, which is released in response\nto and has been implicated in the pathogenesis of IRI (175, 176).\nTherefore, in a recent clinical HMP study, it was hypothesized\nthat the administration of the TNF-α inhibitor etanercept\ncould improve outcomes following kidney transplantation.\nHowever, no significant differences were found concerning\nkidney machine perfusion parameters, including average flow\nand vascular resistance, nor did the authors observe significant\nchanges regarding DGF, rejection episodes, or allograft survival\n(177). However, it has to be taken in mind that this study was\ncarried out under hypothermic conditions. Although possible in\nother machine-perfusion techniques, NMP seems to be ideal, as\nactive metabolism permits graft intervention and modification\nduring preservation, circumstances that are not present in\nHMP (178).\nMore promising data come from a porcine study in\nwhich a variety of agents were added to act at different\nlevels. Prostaglandin E1, a prostacyclin analog with vasodilator,\nantiplatelet, fibrinolytic, and several other anti-inflammatory\nproperties, was continuously administered. In addition, n￾acetylcysteine was added due to its free radical scavenging\nproperties. Sevoflurane was administered due to its protective\nproperties on endothelial cells, and carbon monoxide was\nadded with the objective of improving vasodilatation and\nreducing inflammation. Indeed, during a 3-day follow-up after\ntransplantation, this treatment resulted in lower AST levels as\nwell as lower levels of IL-6, tumor necrosis factor α (TNF- α),\nand galactosidase and increased IL-10 levels (179).\nOther candidate markers for modulation during MP are anti￾inflammatory receptors. In this context, the adenosine A2A\nreceptor downregulates inflammation, including the suppression\nof CD4+ and CD8+ T cells, and increases endothelial cell\nnitric oxide (174). Since experiences in rabbit experiments\nshowed that adenosine A2A receptor activation can diminish\nIRI (180), a subsequent study evaluated whether treatment with\nan adenosine A2A receptor agonist could be beneficial during\nnormothermic ex vivo lung perfusion (EVLP). Indeed, EVLP\nwith targeted A2AR agonist treatment could attenuate IRI after\ntransplantation of DCD donor lungs subjected to prolonged 12-h\ncold preservation in a preclinical porcine model (181).\nAdenoviral Vector Gene Delivery\nAs cellular metabolism is preserved during normothermic\nperfusion, it represents a potential platform for effective gene\ntransduction in a specific graft (182). To test this hypothesis\nin donor lungs, Yeung et al. used a porcine model of\nEVLP and treated them with an E1-, E3-deleted adenoviral\nvector encoding either green fluorescent protein (GFP) or the\nimmunosuppressive interleukin-10 (IL-10). They observed a\ndecreased expression of inflammatory cytokines such as IL-1,\nFrontiers in Immunology | www.frontiersin.org 14 May 2020 | Volume 11 | Article 631\n\nResch et al. Machine Perfusion for Marginal Organs\nTNF-α, and IL-6, as well as attenuation of the alloimmune\nresponse following transplantation (174, 182).\nThis finding is also of particular interest, since the delivery\nof adenoviral vectors could result in a prompt innate immune\nresponse by macrophages, recruiting circulating neutrophils,\nwhich in turn propagate the inflammatory response. Moreover,\nin the transplant setting, this preexisting inflammation could\npotentiate subsequent IRI (182, 183). Therefore, the authors\ncompared in vivo and ex vivo administration and showed that\ndonor lung is superior to in vivo delivery since it leads to less\nvector-associated inflammation (182).\nConcerning the kidney, already in 2002, proof of principle of\na similar technique had been reported by Brasile et al., using a\nrecombinant adenovirus, Ad5, CMV5 GFP encoded with green\nfluorescence protein. They achieved effective transfection and\nsynthesis during 24 h of ex vivo normothermic perfusion (184).\nOnly recently has a normothermic ex vivo organ perfusion\ndelivery method for cardiac transplantation gene therapy been\nreported. Adenoviral vector transduction was utilized to deliver\nparticles of an Adenoviral firefly luciferase vector with a\ncytomegalovirus (CMV) promotor to porcine donor hearts\nduring NMP and prior to heterotopic implantation. Along with\na high copy number of vector genomic DNA in transplanted\nhearts, there was no evidence of vector DNA in either the\nrecipient’s native heart or liver, substantiating the applicability\nand safety of the protocol.\nThese findings make it likely that this technology could be\nfeasible for other organ systems as well. A wide variety of\ninteresting genes could be targeted. As has been reviewed lately\n(159), promising possibilities arise when translating the findings\nof rodent models using adenoviruses expressing CTLA4Ig (185)\nto the setting of NMP; also, NMP could be used to deliver\ngene therapies that induce cytoprotection against IRI, such as\nmyr-Akt (159, 186).\nOutstandingly, Figueiredo et al. recently showed that antigen\nsilencing is feasible during NMP. In a porcine model of\nlung NMP, short hairpin RNAs were delivered by lentiviral\nvectors, successfully reducing the immunogenicity of the\nlung by silencing MHC expression on the endothelium.\nThe authors concluded that the decrease in immunogenicity\ncarries the potential to generate immunologically invisible\norgans to counteract the burden of rejection and\nimmunosuppression (187).\nOrgan Reconditioning and Repair\nRecent experimental data primarily focusing on marginal livers\nfurthermore suggested that NMP offers a platform for organ\nreconditioning and repair.\nImpressive data from Birmingham, UK, showed that livers\ndiscarded due to pronounced steatosis could be effectively treated\nwith defatting agents during 6 h of NMP. Tissue triglycerides\nwere lowered by 38% and macrovesicular steatosis by 40%, which\nwas associated with a down-regulation of inflammatory marker\nexpression relevant for oxidative injury and activation of immune\ncells (CD14; CD11b), combined with reduced inflammatory\ncytokines in the perfusate (TNFα, IL-1β) (188). In addition,\narterial vasospasm can be modulated by the application of ET-1\nantagonists, prostacyclin analog, or calcium channel antagonists\nduring NMP (189). Furthermore, NMP can be used for the\ndirect and efficient application of antiviral agents, as shown in\na porcine NMP model, in which Miravirsen, an inhibitor of\nhepatitis C virus (HCV) replication, produced improved uptake\ncompared to SCS control livers. The authors concluded that\nthis approach might offer a future strategy to prevent HCV\nreinfection after liver transplantation (190). Likewise, HCV￾infected human donor lungs could effectively be treated during\nshort-time EVLP via physical viral clearance combined with\ngermicidal light-based therapies (191).\nIn summary, immunomodulation in the context of MP seems\nto offer a plethora of novel strategies. A series of porcine\nand human studies distinctively underline its effectiveness and\nfeasibility. However, as formulated in a recent review (191, 192),\nthe studies conducted so far just scratch the surface of conceivable\ninterventions. In particular, NMP provides an ideal platform\nfor immunomodulatory modifications. The next step will be the\ntranslation of findings from preclinical and rodent models as well\nas HMP trials into the setting of NMP.\nTHE IMMEDIATE FUTURE IN THE\nTRANSPLANTATION OF MARGINAL\nORGANS\nMuch speculation about the changes in transplantation is\ncurrently energizing the field. The conceptual approach of\nextracorporal organ preservation and monitoring begs for\nspeculation about organ reconditioning, repair, and treatment.\nWhile these are all valid considerations and perfectly reasonable\nhopes, the implementation of machine perfusion is the first\nstep. Immediate and widespread adoption of HMP and NMP is\nunlikely since this technology does not immediately improve the\noutcome with regard to the primary endpoints in transplantation:\npatient and graft survival. Authority approval and market entry\nare largely based on secondary endpoints such as delayed\ngraft function (DGF, kidney) or primary poor function (PPF,\nliver), which are considered to serve as surrogates for improved\nlong-term results. The conceptual limitation with surrogates is,\nhowever, that the predictive value is not uniformly robust or\nformally established and immediately reproducible. The DGF\nrate, for example, in kidneys from DCD donors is high, but\nthe predictive value of DFG in these cases is low (193). The\ndefinition of PPF is mostly based on high AST/ALT values early\nafter transplantation. While these parameters indicate hepatocyte\ndamage, correlation with the eventual outcome is very limited\n(194). Hence, the adoption of the technology is possibly built\non the wish for innovation and the belief in the value of the\ntime gain with NMP. Preliminary data on HOPE in recent and\nongoing trials indicate a possible benefit in organ survival. If such\nan outcome is eventually formally achieved, the arguments for\nimplementation will be more substantial.\nFor clinical implementation, several regional and center\nfactors play an important role. First, the retrieval team\nmay be different from the team eventually performing the\ntransplantation. Even if the retrieval team is familiar with the\ntechnology, the preparation of the graft prior to NMP (more\nthan HMP) is more substantial and more definitive for the\nFrontiers in Immunology | www.frontiersin.org 15 May 2020 | Volume 11 | Article 631\n\nResch et al. Machine Perfusion for Marginal Organs\nfate of the graft. Hence, in a system with longer-distance organ\nexchange, additional steps and a new routine would need to be\nestablished. The technology and the shifting of the work of the\nbacktable procedure to the retrieving team need to be considered.\nThe alternative approach where the organ is transferred to\nthe recipient center and is then machine perfused is currently\nbeing pursued, but data indicating the actual advantage of this\napproach are lacking (195). For now, NMP serves as a technology\nthat allows one important asset in surgery to be gained: time.\nThe value of time and flexibility is dependent on the regional\ncircumstances but may hold great potential for easing the surgery\nlogistics, working hours, and surgical training but also gives rise\nto higher risks of nighttime procedures. The actual value of time\nin this context, however, requires further attention and needs to\nbe better defined.\nThe consideration of longer-term organ preservation under\nnormothermic conditions further carries the challenge of\ndefining the responsibilities for managing and monitoring the\norgans. Eventually, the working place description of health\ncare workers involved in this will require adoption and formal\ntraining. Standard operating procedures (SOP) and safety\nparameters need to be established for a wider spread use of\nthe technology. It is likely that the advanced technological\nrequirements and the need for 24-h availability of knowhow and\npersonnel would favor the establishment of regional hubs for MP.\nDespite the hype in the field, the clinical adoption of MP is\nslow. In addition to the above-mentioned factors, the lack of\nreimbursement is a stringent limitation in many regions. For the\ntechnology to be reimbursed, the authorities will require hard\nfacts. Hence, the path to more widespread clinical use might\nbe long, and the focus should remain on the demonstration of\nsuperiority regarding the most relevant clinical endpoints.\nOne major important step toward collective advancement in\nthis field would be the definition of data points during and\nafter MP and the establishment of registries for coordinated\ndata collection. Such data points should include the definition\nand terminology of the various time points and actions such as\ncold flush and storage prior to MP, temperature and flow during\nMP, parameters indicating metabolic function and bile/urine\nproduction during MP, second flush, second cold ischemia time,\nand others. One of the hurdles in improving NMP is the\nlarge number of variables added to preservation. Identifying\nthe relevance of individual parameters will require attention\nto the details of the procedure and adequate data collection\nand handling. To the knowledge of the authors, no routine\ndata collection and no consensus toward data points have been\nestablished at present.\nThe decision-making process in MP is relatively arbitrary\nsince the data collected during MP are suggestive but not formally\nestablished as quality-defining parameters. Since the decision to\ntransplant an organ or not is extremely meaningful, great care\nneeds to be applied in the process, and detailed documentation\nof the reasoning for decision making should be carried out. A\ngreater effort toward orchestrated data collection could help to\nstreamline and eventually enhance the robustness of the decision￾making process.\nThe preference for MP to be used for the preservation\nof marginal organs results from the greater need for\norgan assessment and the greater potential benefit of better\npreservation. This might be particularly true and relevant for\norgans from uncontrolled DCDs, where the circumstances and\nthe accumulated damage to the organs might be less clear. The\nvalue of an additional assessment under these conditions is not\nonly meaningful with respect to the number of additional organs\nfor transplantation but also for preventing the transplantation\nof organs that are severely damaged. While the assessment\nof this subject would be highly valuable and is much needed,\nthe behavior of the investigators in the NMP trial by Nasralla\net al. indicates the limitations and conflicts observed with this\napproach (62). Since the trial cannot be fully blinded, the bias\ngenerated by the fact that a technology is used that is deemed\nsuperior and the data generated during MP define a deviation in\nthe behavior of the decision makers.\nTHE FAR FUTURE OF (MARGINAL) ORGAN\nTRANSPLANTATION\nThe fantasies building on the realization of extracorporal organ\npreservation under physiological conditions are currently\nfuelling hopes that this technology could facilitate tissue\nregeneration, organ repair, immunomodulation, xenograft\nhumanification, and many other things. MP as a platform\nmay impact medicine far beyond transplantation and delivers\na unique chance to alter the treatment of organ failure and\norgan disease. Between the imagination and the realization\nof medical advancement stands a mountain of work and an\nas yet unknown but probably large number of technical and\nmethodological challenges. An important initial goal is the\nexpansion of the duration of MP and the establishment of\nan equilibrium of the condition of the organ. Preservation\nof organs for several days will likely require additional\nmodifications from the currently existing technologies.\nPreservation of the acid-base equilibrium, nutrition organ\nweight-induced pressure, electrolyte shift, hemolysis, and many\nother challenges may require closer attention. A tissue- and/or\ncell-specific and targeted treatment is a realistic consideration,\nand proof of concept trials indicate the feasibility of this\napproach (196, 197). The treatment and replacement of\ndamaged or displaced elements of organs may evolve as a\nnew discipline and help the field to make the leap to serve\none of the greatest unmet needs: The effective treatment of\ndamaged organs.\nAUTHOR CONTRIBUTIONS\nTR and SS conceived and designed the study and wrote the\nmanuscript. BC, RO, AW, JD, CK, and CB wrote sections of the\nmanuscript. DO and MG helped to revise the manuscript, tables\nand figures. All the authors contributed to manuscript revision,\nread, and approved the submitted version.\nFUNDING\nThis study was supported by a funding from the ‘‘Dr. Gabriel\nSalzner Stiftung’’ to SS and DO.\nFrontiers in Immunology | www.frontiersin.org 16 May 2020 | Volume 11 | Article 631\n\nResch et al. Machine Perfusion for Marginal Organs\nREFERENCES\n1. Black CK, Termanini KM, Aguirre O, Hawksworth JS, Sosin M. Solid\norgan transplantation in the 21(st) century. Ann Transl Med. (2018) 6:409.\ndoi: 10.21037/atm.2018.09.68\n2. Bezinover D, Saner F. Organ transplantation in the modern era. BMC\nAnesthesiol. (2019) 19:32. doi: 10.1186/s12871-019-0704-z\n3. Karam S, Wali RK. Current state of immunosuppression: past,\npresent, and future. Crit Rev Eukaryot Gene Expr. (2015) 25:113–34.\ndoi: 10.1615/CritRevEukaryotGeneExpr.2015011421\n4. Bodzin AS, Baker TB. Liver transplantation today: where we are now and\nwhere we are going. Liver Transpl. (2018) 24:1470–5. doi: 10.1002/lt.25320\n5. Toniutto P, Bitetto D, Fornasiere E, Fumolo E. Challenges and future\ndevelopments in liver transplantation. Minerva Gastroenterol Dietol. (2019)\n65:136–52. doi: 10.23736/S1121-421X.18.02529-1\n6. Young KA, Dilling DF. The future of lung transplantation. Chest. (2019)\n155:465–73. doi: 10.1016/j.chest.2018.08.1036\n7. Nathan SD. The future of lung transplantation. Chest. (2015) 147:309–16.\ndoi: 10.1378/chest.14-1748\n8. Veroux M, Corona D, Veroux P. Kidney transplantation: future challenges.\nMinerva Chir. (2009) 64:75–100.\n9. Pesavento TE. Kidney transplantation in the context of renal replacement\ntherapy. Clin J Am Soc Nephrol. (2009) 4:2035–9. doi: 10.2215/CJN.055\n00809\n10. Kobashigawa JA. The future of heart transplantation. Am J Transplant.\n(2012) 12:2875–91. doi: 10.1111/j.1600-6143.2012.04223.x\n11. Ojo AO, Hanson JA, Meier-Kriesche H, Okechukwu CN, Wolfe RA,\nLeichtman AB, et al. Survival in recipients of marginal cadaveric\ndonor kidneys compared with other recipients and wait-listed transplant\ncandidates. J Am Soc Nephrol. (2001) 12:589–97.\n12. Reese PP, Caplan AL, Kesselheim AS, Bloom RD. Creating a medical, ethical,\nand legal framework for complex living kidney donors. Clin J Am Soc\nNephrol. (2006) 1:1148–53. doi: 10.2215/CJN.02180606\n13. Metzger RA, Delmonico FL, Feng S, Port FK, Wynn JJ, Merion RM.\nExpanded criteria donors for kidney transplantation. Am J Transplant.\n(2003) 3(Suppl. 4):114–25. doi: 10.1034/j.1600-6143.3.s4.11.x\n14. Schamberger B, Lohmann D, Sollinger D, Stein R, Lutz J. Association of\nkidney donor risk index with the outcome after kidney transplantation\nin the eurotransplant senior program. Ann Transplant. (2018) 23:775–81.\ndoi: 10.12659/AOT.909622\n15. Favi E, Puliatti C, Iesari S, Monaco A, Ferraresso M, Cacciola R. Impact of\ndonor age on clinical outcomes of primary single kidney transplantation\nfrom maastricht category-III donors after circulatory death. Transplant\nDirect. (2018) 4:e396. doi: 10.1097/TXD.0000000000000835\n16. Domagala P, Gorski L, Wszola M, Kieszek R, Diuwe P, Goralski P,\net al. Successful transplantation of kidneys from deceased donors\nwith terminal acute kidney injury. Ren Fail. (2019) 41:167–74.\ndoi: 10.1080/0886022X.2019.1590209\n17. Bronchard R, Durand L, Legeai C, Cohen J, Guerrini P, Bastien O. Brain-dead\ndonors on extracorporeal membrane oxygenation. Crit Care Med. (2017)\n45:1734–41. doi: 10.1097/CCM.0000000000002564\n18. Chen CL, Wu ST, Kao CC, Cha TL, Lee CY, Tang SH. Short-term result\nof renal transplantation using extracorporeal membrane oxygenation￾supported brain-dead donors. Transplant Proc. (2014) 46:1061–3.\ndoi: 10.1016/j.transproceed.2013.10.062\n19. Gravel MT, Arenas JD, Chenault R II, Magee JC, Rudich S, Maraschio M,\net al. Kidney transplantation from organ donors following cardiopulmonary\ndeath using extracorporeal membrane oxygenation support. Ann Transplant.\n(2004) 9:57–8.\n20. de Boer JD, Putter H, Blok JJ, Alwayn IPJ, van Hoek B, Braat AE. Predictive\ncapacity of risk models in liver transplantation. Transplant Direct. (2019)\n5:e457. doi: 10.1097/TXD.0000000000000896\n21. Rana A, Jie T, Porubsky M, Habib S, Rilo H, Kaplan B, et al. The\nsurvival outcomes following liver transplantation (SOFT) score: validation\nwith contemporaneous data and stratification of high-risk cohorts. Clin\nTransplant. (2013) 27:627–32. doi: 10.1111/ctr.12181\n22. McCormack L, Quinonez E, Rios MM, Capitanich P, Goldaracena N,\nCabo JK, et al. Rescue policy for discarded liver grafts: a single-centre\nexperience of transplanting livers ’that nobody wants’. HPB. (2010) 12:523–\n30. doi: 10.1111/j.1477-2574.2010.00193.x\n23. Jimenez-Romero C, Caso Maestro O, Cambra Molero F, Justo Alonso I,\nAlegre Torrado C, Manrique Municio A, et al. Using old liver grafts for\nliver transplantation: where are the limits? World J Gastroenterol. (2014)\n20:10691–702. doi: 10.3748/wjg.v20.i31.10691\n24. D’Errico A, Riefolo M, Serenari M, De Pace V, Santandrea G, Monica M, et al.\nThe histological assessment of liver fibrosis in grafts from extended criteria\ndonors predicts the outcome after liver transplantation: a retrospective study.\nDig Liver Dis. (2019). 52:185–9. doi: 10.1016/j.dld.2019.05.013\n25. Liu Z, Jia J, Ning H, Que S, Zhou L, Zheng S. Systematic evaluation of\nthe safety threshold for allograft macrovesicular steatosis in cadaveric liver\ntransplantation. Front Physiol. (2019) 10:429. doi: 10.3389/fphys.2019.00429\n26. Mihaylov P, Mangus R, Ekser B, Cabrales A, Timsina L, Fridell J,\net al. Expanding the donor pool with the use of extended criteria\ndonation after circulatory death livers. Liver Transpl. (2019) 25:1198–208.\ndoi: 10.1002/lt.25462\n27. Muthusamy AS, Vaidya A. Expanding the donor pool in pancreas\ntransplantation. Curr Opin Organ Transplant. (2011) 16:123–7.\ndoi: 10.1097/MOT.0b013e328341b123\n28. Boggi U, Del Chiaro M, Vistoli F, Signori S, Vanadia Bartolo T, Gremmo\nF, et al. Pancreas transplantation from marginal donors. Transplant Proc.\n(2004) 36:566–8. doi: 10.1016/j.transproceed.2004.02.031\n29. Proneth A, Schnitzbauer AA, Schenker P, Wunsch A, Rauchfuss F,\nArbogast H, et al. Extended pancreas donor program-the EXPAND\nstudy: a prospective multicenter trial testing the use of pancreas\ndonors older than 50 years. Transplantation. (2018) 102:1330–7.\ndoi: 10.1097/TP.0000000000002122\n30. Kopp WH, Lam HD, Schaapherder AFM, Huurman VAL, van der Boog\nPJM, de Koning EJP, et al. Pancreas transplantation with grafts from\ndonors deceased after circulatory death: 5 years single-center experience.\nTransplantation. (2018) 102:333–9. doi: 10.1097/TP.0000000000001940\n31. Axelrod DA, Sung RS, Meyer KH, Wolfe RA, Kaufman DB.\nSystematic evaluation of pancreas allograft quality, outcomes and\ngeographic variation in utilization. Am J Transplant. (2010) 10:837–45.\ndoi: 10.1111/j.1600-6143.2009.02996.x\n32. Smits JM, De Pauw M, de Vries E, Rahmel A, Meiser B, Laufer G, et al. Donor\nscoring system for heart transplantation and the impact on patient survival.\nJ Heart Lung Transplant. (2012) 31:387–97. doi: 10.1016/j.healun.2011.\n11.005\n33. Weiss ES, Allen JG, Kilic A, Russell SD, Baumgartner WA, Conte JV,\net al. Development of a quantitative donor risk index to predict short￾term mortality in orthotopic heart transplantation. J Heart Lung Transplant.\n(2012) 31:266–73. doi: 10.1016/j.healun.2011.10.004\n34. Orens JB, Boehler A, de Perrot M, Estenne M, Glanville AR, Keshavjee S,\net al. A review of lung transplant donor acceptability criteria. J Heart Lung\nTransplant. (2003) 22:1183–200. doi: 10.1016/S1053-2498(03)00096-2\n35. Collins GM, Bravo-Shugarman M, Terasaki PI. Kidney preservation for\ntransportation. Initial perfusion and 30 hours’ ice storage. Lancet. (1969)\n2:1219–22. doi: 10.1016/S0140-6736(69)90753-3\n36. Collard CD, Gelman S. Pathophysiology, clinical manifestations, and\nprevention of ischemia-reperfusion injury. Anesthesiology. (2001) 94:1133–8.\ndoi: 10.1097/00000542-200106000-00030\n37. Oniscu GC, Randle LV, Muiesan P, Butler AJ, Currie IS, Perera MT, et al.\nIn situ normothermic regional perfusion for controlled donation after\ncirculatory death–the United Kingdom experience. Am J Transplant. (2014)\n14:2846–54. doi: 10.1111/ajt.12927\n38. Watson CJE, Hunt F, Messer S, Currie I, Large S, Sutherland A, et al. In situ\nnormothermic perfusion of livers in controlled circulatory death donation\nmay prevent ischemic cholangiopathy and improve graft survival. Am J\nTransplant. (2019) 19:1745–58. doi: 10.1111/ajt.15241\n39. Hessheimer AJ, Coll E, Torres F, Ruiz P, Gastaca M, Rivas JI,\net al. Normothermic regional perfusion vs. super-rapid recovery in\ncontrolled donation after circulatory death liver transplantation. J Hepatol.\n(2019) 70:658–65. doi: 10.1016/j.jhep.2018.12.013\n40. Demiselle J, Augusto JF, Videcoq M, Legeard E, Dube L, Templier F, et al.\nTransplantation of kidneys from uncontrolled donation after circulatory\ndetermination of death: comparison with brain death donors with or without\nFrontiers in Immunology | www.frontiersin.org 17 May 2020 | Volume 11 | Article 631\n\nResch et al. Machine Perfusion for Marginal Organs\nextended criteria and impact of normothermic regional perfusion. Transpl\nInt. (2016) 29:432–42. doi: 10.1111/tri.12722\n41. Kerforne T, Allain G, Giraud S, Bon D, Ameteau V, Couturier P, et al.\nDefining the optimal duration for normothermic regional perfusion in the\nkidney donor: a porcine preclinical study. Am J Transplant. (2019) 19:737–\n51. doi: 10.1111/ajt.15063\n42. Weissenbacher A, Vrakas G, Nasralla D, Ceresa CDL. The future of\norgan perfusion and re-conditioning. Transpl Int. (2019) 32:586–97.\ndoi: 10.1111/tri.13441\n43. Ruiz P, Gastaca M, Bustamante FJ, Ventoso A, Palomares I, Prieto M, et al.\nFavorable outcomes after liver transplantation with normothermic regional\nperfusion from donors after circulatory death: a single-center experience.\nTransplantation. (2019) 103:938–43. doi: 10.1097/TP.0000000000002391\n44. Messer SJ, Axell RG, Colah S, White PA, Ryan M, Page AA, et al.\nFunctional assessment and transplantation of the donor heart after\ncirculatory death. J Heart Lung Transplant. (2016) 35:1443–52.\ndoi: 10.1016/j.healun.2016.07.004\n45. Ayorinde JO, Webb GJ, Richards JA. To NRP or not to NRP, that is the\nquestion. in response to: favorable outcomes after liver transplantation\nwith normothermic regional perfusion from donors after circulatory\ndeath: a single-center experience. Transplantation. (2019). 103:938–43.\ndoi: 10.1097/TP.0000000000002877\n46. Taylor R, Allen E, Richards JA, Goh MA, Neuberger J, Collett D, et al.\nSurvival advantage for patients accepting the offer of a circulatory death liver\ntransplant. J Hepatol. (2019) 70:855–65. doi: 10.1016/j.jhep.2018.12.033\n47. Moers C, Smits JM, Maathuis MH, Treckmann J, van Gelder F,\nNapieralski BP, et al. Machine perfusion or cold storage in deceased￾donor kidney transplantation. N Engl J Med. (2009) 360:7–19.\ndoi: 10.1056/NEJMoa0802289\n48. Moers C, Pirenne J, Paul A, Ploeg RJ, Machine Preservation Trial\nStudy Group. Machine perfusion or cold storage in deceased￾donor kidney transplantation. N Engl J Med. (2012) 366:770–1.\ndoi: 10.1056/NEJMc1111038\n49. Jochmans I, Moers C, Smits JM, Leuvenink HG, Treckmann J, Paul A,\net al. Machine perfusion versus cold storage for the preservation of kidneys\ndonated after cardiac death: a multicenter, randomized, controlled trial. Ann\nSurg. (2010) 252:756–64. doi: 10.1097/SLA.0b013e3181ffc256\n50. Jochmans I, O’Callaghan JM, Pirenne J, Ploeg RJ. Hypothermic machine\nperfusion of kidneys retrieved from standard and high-risk donors. Transpl\nInt. (2015) 28:665–76. doi: 10.1111/tri.12530\n51. Kox J, Moers C, Monbaliu D, Strelniece A, Treckmann J, Jochmans I, et al.\nThe benefits of hypothermic machine preservation and short cold ischemia\ntimes in deceased donor kidneys. Transplantation. (2018) 102:1344–50.\ndoi: 10.1097/TP.0000000000002188\n52. Treckmann J, Moers C, Smits JM, Gallinat A, Maathuis MH, van Kasterop￾Kutz M, et al. Machine perfusion versus cold storage for preservation of\nkidneys from expanded criteria donors after brain death. Transpl Int. (2011)\n24:548–54. doi: 10.1111/j.1432-2277.2011.01232.x\n53. Jochmans I, Akhtar MZ, Nasralla D, Kocabayoglu P, Boffa C, Kaisar M,\net al. Past, present, and future of dynamic kidney and liver preservation and\nresuscitation. Am J Transplant. (2016) 16:2545–55. doi: 10.1111/ajt.13778\n54. Prudhomme T, Kervella D, Le Bas-Bernardet S, Cantarovich D,\nKaram G, Blancho G, et al. Ex situ perfusion of pancreas for whole￾organ transplantation: is it safe and feasible? A systematic review.\nJ Diabetes Sci Technol. (2020) 14:120–34. doi: 10.1177/19322968198\n69312\n55. Barlow AD, Hamed MO, Mallon DH, Brais RJ, Gribble FM, Scott MA,\net al. Use of ex vivo normothermic perfusion for quality assessment of\ndiscarded human donor pancreases. Am J Transplant. (2015) 15:2475–82.\ndoi: 10.1111/ajt.13303\n56. Branchereau J, Renaudin K, Kervella D, Bernadet S, Karam G, Blancho\nG, et al. Hypothermic pulsatile perfusion of human pancreas: preliminary\ntechnical feasibility study based on histology. Cryobiology. (2018) 85:56–62.\ndoi: 10.1016/j.cryobiol.2018.10.002\n57. van Rijn R, Karimian N, Matton APM, Burlage LC, Westerkamp AC, van\nden Berg AP, et al. Dual hypothermic oxygenated machine perfusion in liver\ntransplants donated after circulatory death. Br J Surg. (2017) 104:907–17.\ndoi: 10.1002/bjs.10515\n58. Dutkowski P, Polak WG, Muiesan P, Schlegel A, Verhoeven CJ, Scalera\nI, et al. First comparison of hypothermic oxygenated perfusion versus\nstatic cold storage of human donation after cardiac death liver transplants:\nan international-matched case analysis. Ann Surg. (2015) 262:764–70.\ndoi: 10.1097/SLA.0000000000001473\n59. Muller X, Schlegel A, Wurdinger M, Wendt M, Kron P, Eshmuminov D,\net al. Can hypothermic oxygenated perfusion (HOPE) rescue futile DCD\nliver grafts? HPB. (2019) 21:1156–65. doi: 10.1016/j.hpb.2019.01.004\n60. Schlegel A, Muller X, Dutkowski P. Hypothermic liver perfusion. Curr Opin\nOrgan Transplant. (2017) 22:563–70. doi: 10.1097/MOT.0000000000000472\n61. Boteon YL, Laing RW, Schlegel A, Wallace L, Smith A, Attard J, et al.\nCombined hypothermic and normothermic machine perfusion improves\nfunctional recovery of extended criteria donor livers. Liver Transpl. (2018)\n24:1699–715. doi: 10.1002/lt.25315\n62. Nasralla D, Coussios CC, Mergental H, Akhtar MZ, Butler AJ, Ceresa\nCDL, et al. A randomized trial of normothermic preservation in liver\ntransplantation. Nature. (2018) 557:50–6. doi: 10.1038/s41586-018-0047-9\n63. Hosgood SA, Nicholson ML. The first clinical case of intermediate ex vivo\nnormothermic perfusion in renal transplantation. Am J Transplant. (2014)\n14:1690–2. doi: 10.1111/ajt.12766\n64. Hosgood SA, Nicholson ML. First in man renal transplantation after\nex vivo normothermic perfusion. Transplantation. (2011) 92:735–8.\ndoi: 10.1097/TP.0b013e31822d4e04\n65. Hosgood SA, Nicholson ML. An assessment of urinary biomarkers\nin a series of declined human kidneys measured during ex vivo\nnormothermic kidney perfusion. Transplantation. (2017) 101:2120–5.\ndoi: 10.1097/TP.0000000000001504\n66. Ravikumar R, Jassem W, Mergental H, Heaton N, Mirza D, Perera MT, et al.\nLiver transplantation after ex vivo normothermic machine preservation: a\nphase 1 (First-in-Man) clinical trial. Am J Transplant. (2016) 16:1779–87.\ndoi: 10.1111/ajt.13708\n67. Cotter EKH, Banayan JM, Song TH, Chaney MA, Ko H, Cantu E, et al. Lung\nin a box: ex vivo lung transplantation. J Cardiothorac Vasc Anesth. (2018)\n32:1971–81. doi: 10.1053/j.jvca.2017.12.019\n68. Cypel M, Yeung JC, Keshavjee S. Introducing the concept of semielective\nlung transplantation through the use of ex vivo lung perfusion. J Thorac\nCardiovasc Surg. (2018) 156:2350–2. doi: 10.1016/j.jtcvs.2018.05.056\n69. Ploeg RJ, D’Alessandro AM, Knechtle SJ, Stegall MD, Pirsch JD,\nHoffmann RM, et al. Risk factors for primary dysfunction after liver\ntransplantation–a multivariate analysis. Transplantation. (1993) 55:807–13.\ndoi: 10.1097/00007890-199304000-00024\n70. Uemura T, Randall HB, Sanchez EQ, Ikegami T, Narasimhan G, McKenna\nGJ, et al. Liver retransplantation for primary nonfunction: analysis\nof a 20-year single-center experience. Liver Transpl. (2007) 13:227–33.\ndoi: 10.1002/lt.20992\n71. Dutkowski P, Guarrera JV, de Jonge J, Martins PN, Porte RJ, Clavien\nPA. Evolving trends in machine perfusion for liver transplantation.\nGastroenterology. (2019) 156:1542–7. doi: 10.1053/j.gastro.2018.12.037\n72. Jing L, Yao L, Zhao M, Peng LP, Liu M. Organ preservation: from the past to\nthe future. Acta Pharmacol Sin. (2018) 39:845–57. doi: 10.1038/aps.2017.182\n73. Carrel A. The culture of whole organs : I. Technique of the culture of the\nthyroid gland. J Exp Med. (1937) 65:515–26. doi: 10.1084/jem.65.4.515\n74. Belzer FO, Ashby BS, Dunphy JE. 24-hour and 72-hour preservation of\ncanine kidneys. Lancet. (1967) 2:536–8. doi: 10.1016/S0140-6736(67)90498-9\n75. Cameron AM, Barandiaran Cornejo JF. Organ preservation review: history\nof organ preservation. Curr Opin Organ Transplant. (2015) 20:146–51.\ndoi: 10.1097/MOT.0000000000000175\n76. Kim J, Zimmerman MA, Hong JC. Emerging innovations in liver\npreservation and resuscitation. Transplant Proc. (2018) 50:2308–16.\ndoi: 10.1016/j.transproceed.2018.03.080\n77. Guibert EE, Petrenko AY, Balaban CL, Somov AY, Rodriguez JV, Fuller BJ.\nOrgan preservation: current concepts and new strategies for the next decade.\nTransfus Med Hemother. (2011) 38:125–42. doi: 10.1159/000327033\n78. Chouchani ET, Pell VR, Gaude E, Aksentijevic D, Sundier SY, Robb EL, et al.\nIschaemic accumulation of succinate controls reperfusion injury through\nmitochondrial ROS. Nature. (2014) 515:431–5. doi: 10.1038/nature13909\n79. Schneeberger S. Life of a liver awaiting transplantation. Nature. (2018)\n557:40–1. doi: 10.1038/d41586-018-04458-w\nFrontiers in Immunology | www.frontiersin.org 18 May 2020 | Volume 11 | Article 631\n\nResch et al. Machine Perfusion for Marginal Organs\n80. Weissenbacher A, Hunter J. Normothermic machine perfusion\nof the kidney. Curr Opin Organ Transplant. (2017) 22:571–6.\ndoi: 10.1097/MOT.0000000000000470\n81. Brockmann J, Reddy S, Coussios C, Pigott D, Guirriero D, Hughes D, et al.\nNormothermic perfusion: a new paradigm for organ preservation. Ann Surg.\n(2009) 250:1–6. doi: 10.1097/SLA.0b013e3181a63c10\n82. Schlegel A, Muller X, Dutkowski P. Hypothermic machine preservation\nof the liver: state of the art. Curr Transplant Rep. (2018) 5:93–102.\ndoi: 10.1007/s40472-018-0183-z\n83. Ionescu MI, Tillakaratne S, Hodson J, Gunson B, Nasralla D, Pinter\nCarvalheiro da Silva Boteon A, et al. Normothermic machine\nperfusion enhances intraoperative hepatocellular synthetic capacity: a\npropensity score-matched analysis. Transplantation. (2019) 103:e198–207.\ndoi: 10.1097/TP.0000000000002720\n84. Jassem W, Xystrakis E, Ghnewa YG, Yuksel M, Pop O, Martinez-Llordella\nM, et al. Normothermic machine perfusion (NMP) inhibits proinflammatory\nresponses in the liver and promotes regeneration. Hepatology. (2019) 70:682–\n95. doi: 10.1002/hep.30475\n85. Ceresa CDL, Nasralla D, Coussios CC, Friend PJ. The case for normothermic\nmachine perfusion in liver transplantation. Liver Transpl. (2018) 24:269–75.\ndoi: 10.1002/lt.25000\n86. Guenthart BA, O’Neill JD, Kim J, Queen D, Chicotka S, Fung\nK, et al. Regeneration of severely damaged lungs using an\ninterventional cross-circulation platform. Nat Commun. (2019) 10:1985.\ndoi: 10.1038/s41467-019-09908-1\n87. Parsons RF, Guarrera JV. Preservation solutions for static cold storage of\nabdominal allografts: which is best? Curr Opin Organ Transplant. (2014)\n19:100–7. doi: 10.1097/MOT.0000000000000063\n88. Guarrera JV, Henry SD, Samstein B, Odeh-Ramadan R, Kinkhabwala M,\nGoldstein MJ, et al. Hypothermic machine preservation in human liver\ntransplantation: the first clinical series. Am J Transplant. (2010) 10:372–81.\ndoi: 10.1111/j.1600-6143.2009.02932.x\n89. Guarrera JV, Henry SD, Samstein B, Reznik E, Musat C, Lukose TI, et al.\nHypothermic machine preservation facilitates successful transplantation of\n“orphan” extended criteria donor livers. Am J Transplant. (2015) 15:161–9.\ndoi: 10.1111/ajt.12958\n90. van Rijn R, van Leeuwen OB, Matton APM, Burlage LC, Wiersema￾Buist J, van den Heuvel MC, et al. Hypothermic oxygenated machine\nperfusion reduces bile duct reperfusion injury after transplantation of\ndonation after circulatory death livers. Liver Transpl. (2018) 24:655–64.\ndoi: 10.1002/lt.25023\n91. Schlegel A, Muller X, Kalisvaart M, Muellhaupt B, Perera M, Isaac JR,\net al. Outcomes of DCD liver transplantation using organs treated by\nhypothermic oxygenated perfusion before implantation. J Hepatol. (2019)\n70:50–7. doi: 10.1016/j.jhep.2018.10.005\n92. Bral M, Gala-Lopez B, Bigam D, Kneteman N, Malcolm A, Livingstone\nS, et al. Preliminary single-center canadian experience of human\nnormothermic ex vivo liver perfusion: results of a clinical trial. Am J\nTransplant. (2017) 17:1071–80. doi: 10.1111/ajt.14049\n93. Watson CJE, Kosmoliaptsis V, Pley C, Randle L, Fear C, Crick K, et al.\nObservations on the ex situ perfusion of livers for transplantation. Am J\nTransplant. (2018) 18:2005–20. doi: 10.1111/ajt.14687\n94. Matos ACC, Requiao Moura LR, Borrelli M, Nogueira M, Clarizia G, Ongaro\nP, et al. Impact of machine perfusion after long static cold storage on delayed\ngraft function incidence and duration and time to hospital discharge. Clin\nTransplant. (2018) 32. doi: 10.1111/ctr.13130\n95. Tedesco-Silva HJ, Mello Offerni JC, Ayres Carneiro V, Ivani de Paula\nM, Neto ED, Brambate Carvalhinho Lemos F, et al. Randomized trial\nof machine perfusion versus cold storage in recipients of deceased\ndonor kidney transplants with high incidence of delayed graft function.\nTransplant Direct. (2017) 3:e155. doi: 10.1097/TXD.00000000000\n00672\n96. Gallinat A, Amrillaeva V, Hoyer DP, Kocabayoglu P, Benko T, Treckmann\nJW, et al. Reconditioning by end-ischemic hypothermic in-house machine\nperfusion: a promising strategy to improve outcome in expanded\ncriteria donors kidney transplantation. Clin Transplant. (2017) 31.\ndoi: 10.1111/ctr.12904\n97. Nicholson ML, Hosgood SA. Renal transplantation after ex vivo\nnormothermic perfusion: the first clinical study. Am J Transplant. (2013)\n13:1246–52. doi: 10.1111/ajt.12179\n98. Karcz M, Cook HT, Sibbons P, Gray C, Dorling A, Papalois V. An\nex-vivo model for hypothermic pulsatile perfusion of porcine pancreata:\nhemodynamic and morphologic characteristics. Exp Clin Transplant.\n(2010) 8:55–60.\n99. Wright FH, Wright C, Ames SA, Smith JL, Corry RJ. Pancreatic allograft\nthrombosis: donor and retrieval factors and early postperfusion graft\nfunction. Transplant Proc. (1990) 22:439–41.\n100. Hamaoui K, Papalois V. Machine perfusion and the pancreas:\nwill it increase the donor pool? Curr Diab Rep. (2019) 19:56.\ndoi: 10.1007/s11892-019-1165-y\n101. Hamaoui K, Gowers S, Sandhu B, Vallant N, Cook T, Boutelle M,\net al. Development of pancreatic machine perfusion: translational\nsteps from porcine to human models. J Surg Res. (2018) 223:263–74.\ndoi: 10.1016/j.jss.2017.11.052\n102. Leemkuil M, Lier G, Engelse MA, Ploeg RJ, de Koning EJP, Hart N’t, et al.\nHypothermic oxygenated machine perfusion of the human donor pancreas.\nTransplant Direct. (2018) 4:e388. doi: 10.1097/TXD.0000000000000829\n103. Possoz J, Neyrinck A, Van Raemdonck D. Ex vivo lung perfusion prior to\ntransplantation: an overview of current clinical practice worldwide. J Thorac\nDis. (2019) 11:1635–50. doi: 10.21037/jtd.2019.04.33\n104. Gottlieb J. Lung allocation. J Thorac Dis. (2017) 9:2670–4.\ndoi: 10.21037/jtd.2017.07.83\n105. Cypel M, Yeung JC, Liu M, Anraku M, Chen F, Karolak W, et al.\nNormothermic ex vivo lung perfusion in clinical lung transplantation. N Engl\nJ Med. (2011) 364:1431–40. doi: 10.1056/NEJMoa1014597\n106. Van Raemdonck D, Rega F, Rex S, Neyrinck A. Machine perfusion\nof thoracic organs. J Thorac Dis. (2018) 10(Suppl. 8):S910–23.\ndoi: 10.21037/jtd.2018.02.85\n107. Chew HC, Macdonald PS, Dhital KK. The donor heart and organ\nperfusion technology. J Thorac Dis. (2019) 11(Suppl. 6):S938–45.\ndoi: 10.21037/jtd.2019.02.59\n108. Ardehali A, Esmailian F, Deng M, Soltesz E, Hsich E, Naka Y, et al. Ex￾vivo perfusion of donor hearts for human heart transplantation (PROCEED\nII): a prospective, open-label, multicentre, randomised non-inferiority trial.\nLancet. (2015) 385:2577–84. doi: 10.1016/S0140-6736(15)60261-6\n109. Merion RM, Pelletier SJ, Goodrich N, Englesbe MJ, Delmonico FL. Donation\nafter cardiac death as a strategy to increase deceased donor liver availability.\nAnn Surg. (2006) 244:555–62. doi: 10.1097/01.sla.0000239006.33633.39\n110. Reiniers MJ, van Golen RF, van Gulik TM, Heger M. Reactive oxygen and\nnitrogen species in steatotic hepatocytes: a molecular perspective on the\npathophysiology of ischemia-reperfusion injury in the fatty liver. Antioxid\nRedox Signal. (2014) 21:1119–42. doi: 10.1089/ars.2013.5486\n111. Bruinsma BG, Sridharan GV, Weeder PD, Avruch JH, Saeidi N, Ozer S, et al.\nMetabolic profiling during ex vivo machine perfusion of the human liver. Sci\nRep. (2016) 6:22415. doi: 10.1038/srep22415\n112. Jochmans I, Moers C, Smits JM, Leuvenink HG, Treckmann J, Paul A,\net al. The prognostic value of renal resistance during hypothermic machine\nperfusion of deceased donor kidneys. Am J Transplant. (2011) 11:2214–20.\ndoi: 10.1111/j.1600-6143.2011.03685.x\n113. Jochmans I, Pirenne J. Graft quality assessment in kidney transplantation:\nnot an exact science yet! Curr Opin Organ Transplant. (2011) 16:174–9.\ndoi: 10.1097/MOT.0b013e3283446b31\n114. Dare AJ, Pettigrew GJ, Saeb-Parsy K. Preoperative assessment\nof the deceased-donor kidney: from macroscopic appearance\nto molecular biomarkers. Transplantation. (2014) 97:797–807.\ndoi: 10.1097/01.TP.0000441361.34103.53\n115. Moers C, Varnav OC, van Heurn E, Jochmans I, Kirste GR, Rahmel\nA, et al. The value of machine perfusion perfusate biomarkers for\npredicting kidney transplant outcome. Transplantation. (2010) 90:966–73.\ndoi: 10.1097/TP.0b013e3181f5c40c\n116. Nyberg SL, Baskin-Bey ES, Kremers W, Prieto M, Henry ML, Stegall\nMD. Improving the prediction of donor kidney quality: deceased\ndonor score and resistive indices. Transplantation. (2005) 80:925–9.\ndoi: 10.1097/01.TP.0000173798.04043.AF\nFrontiers in Immunology | www.frontiersin.org 19 May 2020 | Volume 11 | Article 631\n\nResch et al. Machine Perfusion for Marginal Organs\n117. Impedovo SV, Martino P, Palazzo S, Ditonno P, Tedeschi M, Giangrande F,\net al. Value of the resistive index in patient and graft survival after kidney\ntransplant. Arch Ital Urol Androl. (2012) 84:279–82.\n118. Hosgood SA, Barlow AD, Hunter JP, Nicholson ML. Ex vivo normothermic\nperfusion for quality assessment of marginal donor kidney transplants. Br J\nSurg. (2015) 102:1433–40. doi: 10.1002/bjs.9894\n119. Liu Q, Vekemans K, Iania L, Komuta M, Parkkinen J, Heedfeld V, et al.\nAssessing warm ischemic injury of pig livers at hypothermic machine\nperfusion. J Surg Res. (2014) 186:379–89. doi: 10.1016/j.jss.2013.07.034\n120. Liu Q, Monbaliu D, Vekemans K, Peeters R, De Keyzer F, Dresselaers\nT, et al. Can apparent diffusion coefficient discriminate ischemic from\nnonischemic livers? A pilot experimental study. Transplant Proc. (2007)\n39:2643–6. doi: 10.1016/j.transproceed.2007.08.003\n121. Liu Q, Vekemans K, van Pelt J, Pirenne J, Himmelreich U, Heedfeld\nV, et al. Discriminate liver warm ischemic injury during hypothermic\nmachine perfusion by proton magnetic resonance spectroscopy:\na study in a porcine model. Transplant Proc. (2009) 41:3383–6.\ndoi: 10.1016/j.transproceed.2009.09.025\n122. Obara H, Matsuno N, Enosawa S, Shigeta T, Huai-Che H, Hirano T, et al.\nPretransplant screening and evaluation of liver graft viability using machine\nperfusion preservation in porcine transplantation. Transplant Proc. (2012)\n44:959–61. doi: 10.1016/j.transproceed.2012.01.104\n123. Selzner M, Goldaracena N, Echeverri J, Kaths JM, Linares I, Selzner N, et al.\nNormothermic ex vivo liver perfusion using steen solution as perfusate for\nhuman liver transplantation: first north American results. Liver Transpl.\n(2016) 22:1501–8. doi: 10.1002/lt.24499\n124. Watson CJE, Kosmoliaptsis V, Randle LV, Gimson AE, Brais R, Klinck\nJR, et al. Normothermic perfusion in the assessment and preservation of\ndeclined livers before transplantation: hyperoxia and vasoplegia-important\nlessons from the first 12 cases. Transplantation. (2017) 101:1084–98.\ndoi: 10.1097/TP.0000000000001661\n125. Ceresa CDL, Nasralla D, Watson CJE, Butler AJ, Coussios CC, Crick K,\net al. Transient cold storage prior to normothermic liver perfusion may\nfacilitate adoption of a novel technology. Liver Transpl. (2019) 25:1503–13.\ndoi: 10.1002/lt.25584\n126. Laing RW, Mergental H, Yap C, Kirkham A, Whilku M, Barton D, et al.\nViability testing and transplantation of marginal livers (VITTAL) using\nnormothermic machine perfusion: study protocol for an open-label, non￾randomised, prospective, single-arm trial. BMJ Open. (2017) 7:e017733.\ndoi: 10.1136/bmjopen-2017-017733\n127. Imber CJ, St Peter SD, Lopez de Cenarruzabeitia I, Pigott D, James\nT, Taylor R, et al. Advantages of normothermic perfusion over\ncold storage in liver preservation. Transplantation. (2002) 73:701–9.\ndoi: 10.1097/00007890-200203150-00008\n128. Matton APM, de Vries Y, Burlage LC, van Rijn R, Fujiyoshi M, de\nMeijer VE, et al. Biliary bicarbonate, pH, and glucose are suitable\nbiomarkers of biliary viability during ex situ normothermic machine\nperfusion of human donor livers. Transplantation. (2019) 103:1405–13.\ndoi: 10.1097/TP.0000000000002500\n129. Op den Dries S, Karimian N, Porte RJ. Normothermic machine\nperfusion of discarded liver grafts. Am J Transplant. (2013) 13:2504.\ndoi: 10.1111/ajt.12374\n130. Mergental H, Perera MT, Laing RW, Muiesan P, Isaac JR, Smith A, et al.\nTransplantation of declined liver allografts following normothermic ex-situ\nevaluation. Am J Transplant. (2016) 16:3235–45. doi: 10.1111/ajt.13875\n131. Bruinsma BG, Yeh H, Ozer S, Martins PN, Farmer A, Wu W, et al.\nSubnormothermic machine perfusion for ex vivo preservation and recovery\nof the human liver for transplantation. Am J Transplant. (2014) 14:1400–9.\ndoi: 10.1111/ajt.12727\n132. Osaki S, Locher MR, Lushaj EB, Akhter SA, Kohmoto T. Functional\nevaluation of human donation after cardiac death donor hearts using a\ncontinuous isolated myocardial perfusion technique: potential for expansion\nof the cardiac donor population. J Thorac Cardiovasc Surg. (2014) 148:1123–\n30. doi: 10.1016/j.jtcvs.2014.06.050\n133. Machuca TN, Cypel M, Zhao Y, Grasemann H, Tavasoli F, Yeung JC,\net al. The role of the endothelin-1 pathway as a biomarker for donor lung\nassessment in clinical ex vivo lung perfusion. J Heart Lung Transplant. (2015)\n34:849–57. doi: 10.1016/j.healun.2015.01.003\n134. Machuca TN, Cypel M, Yeung JC, Bonato R, Zamel R, Chen M, et al. Protein\nexpression profiling predicts graft performance in clinical ex vivo lung\nperfusion. Ann Surg. (2015) 261:591–7. doi: 10.1097/SLA.0000000000000974\n135. Andreasson AS, Karamanou DM, Gillespie CS, Ozalp F, Butt T, Hill P,\net al. Profiling inflammation and tissue injury markers in perfusate and\nbronchoalveolar lavage fluid during human ex vivo lung perfusion. Eur J\nCardiothorac Surg. (2017) 51:577–86. doi: 10.1093/ejcts/ezw358\n136. Andreasson ASI, Borthwick LA, Gillespie C, Jiwa K, Scott J, Henderson P,\net al. The role of interleukin-1beta as a predictive biomarker and potential\ntherapeutic target during clinical ex vivo lung perfusion. J Heart Lung\nTransplant. (2017) 36:985–95. doi: 10.1016/j.healun.2017.05.012\n137. Port FK, Bragg-Gresham JL, Metzger RA, Dykstra DM, Gillespie BW, Young\nEW, et al. Donor characteristics associated with reduced graft survival: an\napproach to expanding the pool of kidney donors. Transplantation. (2002)\n74:1281–6. doi: 10.1097/00007890-200211150-00014\n138. Summers DM, Watson CJ, Pettigrew GJ, Johnson RJ, Collett D, Neuberger\nJM, et al. Kidney donation after circulatory death (DCD): state of the art.\nKidney Int. (2015) 88:241–9. doi: 10.1038/ki.2015.88\n139. Oberhuber R, Ge X, Tullius SG. Donor age-specific injury\nand immune responses. Am J Transplant. (2012) 12:38–42.\ndoi: 10.1111/j.1600-6143.2011.03798.x\n140. Heinbokel T, Hock K, Liu G, Edtinger K, Elkhal A, Tullius SG. Impact of\nimmunosenescence on transplant outcome. Transpl Int. (2013) 26:242–53.\ndoi: 10.1111/tri.12013\n141. Krenzien F, ElKhal A, Quante M, Rodriguez Cetina Biefer H, Hirofumi\nU, Gabardi S, et al. A rationale for age-adapted immunosuppression\nin organ transplantation. Transplantation. (2015) 99:2258–68.\ndoi: 10.1097/TP.0000000000000842\n142. Moreso F, Seron D, Gil-Vernet S, Riera L, Fulladosa X, Ramos R, et al.\nDonor age and delayed graft function as predictors of renal allograft\nsurvival in rejection-free patients. Nephrol Dial Transplant. (1999) 14:930–5.\ndoi: 10.1093/ndt/14.4.930\n143. Carrel A, Lindbergh CA. The culture of whole organs. Science. (1935)\n81:621–3. doi: 10.1126/science.81.2112.621\n144. Turner JE, Becker M, Mittrucker HW, Panzer U. Tissue-resident\nlymphocytes in the kidney. J Am Soc Nephrol. (2018) 29:389–99.\ndoi: 10.1681/ASN.2017060599\n145. Munro DAD, Hughes J. The origins and functions of tissue-resident\nmacrophages in kidney development. Front Physiol. (2017) 8:837.\ndoi: 10.3389/fphys.2017.00837\n146. Takada M, Nadeau KC, Hancock WW, Mackenzie HS, Shaw GD, Waaga\nAM, et al. Effects of explosive brain death on cytokine activation\nof peripheral organs in the rat. Transplantation. (1998) 65:1533–42.\ndoi: 10.1097/00007890-199806270-00001\n147. van der Hoeven JA, Molema G, Ter Horst GJ, Freund RL, Wiersema J,\nvan Schilfgaarde R, et al. Relationship between duration of brain death\nand hemodynamic (in)stability on progressive dysfunction and increased\nimmunologic activation of donor kidneys. Kidney Int. (2003) 64:1874–82.\ndoi: 10.1046/j.1523-1755.2003.00272.x\n148. Nijboer WN, Schuurs TA, van der Hoeven JA, Fekken S, Wiersema-Buist\nJ, Leuvenink HG, et al. Effect of brain death on gene expression and tissue\nactivation in human donor kidneys. Transplantation. (2004) 78:978–86.\ndoi: 10.1097/01.TP.0000135565.49535.60\n149. Boardman DA, Jacob J, Smyth LA, Lombardi G, Lechler RI. What\nis direct allorecognition? Curr Transplant Rep. (2016) 3:275–83.\ndoi: 10.1007/s40472-016-0115-8\n150. Lechler RI, Batchelor JR. Immunogenicity of retransplanted rat kidney\nallografts. Effect of inducing chimerism in the first recipient and quantitative\nstudies on immunosuppression of the second recipient. J Exp Med. (1982)\n156:1835–41. doi: 10.1084/jem.156.6.1835\n151. Fildes JE, Archer LD, Blaikley J, Ball AL, Stone JP, Sjoberg T, et al. Clinical\noutcome of patients transplanted with marginal donor lungs via ex vivo\nlung perfusion compared to standard lung transplantation. Transplantation.\n(2015) 99:1078–83. doi: 10.1097/TP.0000000000000462\n152. Stone JP, Critchley WR, Major T, Rajan G, Risnes I, Scott H, et al. Altered\nimmunogenicity of donor lungs via removal of passenger leukocytes using\nex vivo lung perfusion. Am J Transplant. (2016) 16:33–43. doi: 10.1111/ajt.\n13446\nFrontiers in Immunology | www.frontiersin.org 20 May 2020 | Volume 11 | Article 631\n\nResch et al. Machine Perfusion for Marginal Organs\n153. Amin KR, Wong JKF, Fildes JE. Strategies to reduce ischemia reperfusion\ninjury in vascularized composite allotransplantation of the limb. J Hand Surg\nAm. (2017) 42:1019–24. doi: 10.1016/j.jhsa.2017.09.013\n154. Schlegel A, Kron P, Graf R, Clavien PA, Dutkowski P. Hypothermic\noxygenated perfusion (HOPE) downregulates the immune response in\na rat model of liver transplantation. Ann Surg. (2014) 260:931–7.\ndoi: 10.1097/SLA.0000000000000941\n155. Boteon YL, Afford SC. Machine perfusion of the liver: which is the best\ntechnique to mitigate ischaemia-reperfusion injury? World J Transplant.\n(2019) 9:14–20. doi: 10.5500/wjt.v9.i1.14\n156. Yuan X, Theruvath AJ, Ge X, Floerchinger B, Jurisch A, Garcia-Cardena\nG, et al. Machine perfusion or cold storage in organ transplantation:\nindication, mechanisms, and future perspectives. Transpl Int. (2010) 23:561–\n70. doi: 10.1111/j.1432-2277.2009.01047.x\n157. Fuller BJ, Lee CY. Hypothermic perfusion preservation: the future\nof organ preservation revisited? Cryobiology. (2007) 54:129–45.\ndoi: 10.1016/j.cryobiol.2007.01.003\n158. Sierra Parraga JM, Rozenberg K, Eijken M, Leuvenink HG, Hunter\nJ, Merino A, et al. Effects of normothermic machine perfusion\nconditions on mesenchymal stromal cells. Front Immunol. (2019) 10:765.\ndoi: 10.3389/fimmu.2019.00765\n159. Ravikumar R, Leuvenink H, Friend PJ. Normothermic liver preservation: a\nnew paradigm? Transpl Int. (2015) 28:690–9. doi: 10.1111/tri.12576\n160. Reddy SP, Brockmann J, Friend PJ. Normothermic perfusion: a mini-review.\nTransplantation. (2009) 87:631–2. doi: 10.1097/TP.0b013e3181995e83\n161. Marecki H, Bozorgzadeh A, Porte RJ, Leuvenink HG, Uygun K, Martins PN.\nLiver ex situ machine perfusion preservation: a review of the methodology\nand results of large animal studies and clinical trials. Liver Transpl. (2017)\n23:679–95. doi: 10.1002/lt.24751\n162. Kumar R, Chung WY, Dennison AR, Garcea G. Ex vivo porcine organ\nperfusion models as a suitable platform for translational transplant research.\nArtif Organs. (2017) 41:E69–E79. doi: 10.1111/aor.12865\n163. Brasile L, Stubenitsky B. Will cell therapies provide the solution for the\nshortage of transplantable organs? Curr Opin Organ Transplant. (2019)\n24:568–73. doi: 10.1097/MOT.0000000000000686\n164. Yi T, Song SU. Immunomodulatory properties of mesenchymal stem cells\nand their therapeutic applications. Arch Pharm Res. (2012) 35:213–21.\ndoi: 10.1007/s12272-012-0202-z\n165. Kern S, Eichler H, Stoeve J, Kluter H, Bieback K. Comparative analysis of\nmesenchymal stem cells from bone marrow, umbilical cord blood, or adipose\ntissue. Stem Cells. (2006) 24:1294–301. doi: 10.1634/stemcells.2005-0342\n166. Dominici M, Le Blanc K, Mueller I, Slaper-Cortenbach I, Marini F, Krause\nD, et al. Minimal criteria for defining multipotent mesenchymal stromal\ncells. The international society for cellular therapy position statement.\nCytotherapy. (2006) 8:315–7. doi: 10.1080/14653240600855905\n167. Fernandez Vallone VB, Romaniuk MA, Choi H, Labovsky V,\nOtaegui J, Chasseing NA. Mesenchymal stem cells and their use\nin therapy: what has been achieved? Differentiation. (2013) 85:1–10.\ndoi: 10.1016/j.diff.2012.08.004\n168. de Vries DK, Schaapherder AF, Reinders ME. Mesenchymal stromal\ncells in renal ischemia/reperfusion injury. Front Immunol. (2012) 3:162.\ndoi: 10.3389/fimmu.2012.00162\n169. Mohamed MS. Mesenchymal stem cells transplantation during\nex vivo lung perfusion. J Heart Lung Transplant. (2017) 36:243.\ndoi: 10.1016/j.healun.2016.10.010\n170. Mordant P, Nakajima D, Kalaf R, Iskender I, Maahs L, Behrens P, et al.\nMesenchymal stem cell treatment is associated with decreased perfusate\nconcentration of interleukin-8 during ex vivo perfusion of donor lungs\nafter 18-hour preservation. J Heart Lung Transplant. (2016) 35:1245–54.\ndoi: 10.1016/j.healun.2016.04.017\n171. Brasile L, Henry N, Orlando G, Stubenitsky B. Potentiating renal\nregeneration using mesenchymal stem cells. Transplantation. (2019)\n103:307–13. doi: 10.1097/TP.0000000000002455\n172. Pool M, Eertman T, Sierra Parraga J, Hart N’t, Roemeling-van Rhijn M,\nEijken M, et al. Infusing mesenchymal stromal cells into porcine kidneys\nduring normothermic machine perfusion: intact MSCs can be traced and\nlocalised to glomeruli. Int J Mol Sci. (2019) 20:E3607. doi: 10.3390/ijms201\n43607\n173. Sierra-Parraga JM, Eijken M, Hunter J, Moers C, Leuvenink H, Moller B, et al.\nMesenchymal stromal cells as anti-inflammatory and regenerative mediators\nfor donor kidneys during normothermic machine perfusion. Stem Cells Dev.\n(2017) 26:1162–70. doi: 10.1089/scd.2017.0030\n174. Karimian N, Yeh H. Opportunities for therapeutic intervention\nduring machine perfusion. Curr Transplant Rep. (2017) 4:141–8.\ndoi: 10.1007/s40472-017-0144-y\n175. Donnahoo KK, Shames BD, Harken AH, Meldrum DR. Review article: the\nrole of tumor necrosis factor in renal ischemia-reperfusion injury. J Urol.\n(1999) 162:196–203. doi: 10.1097/00005392-199907000-00068\n176. Shuh M, Bohorquez H, Loss GE Jr, Cohen AJ. Tumor necrosis factor￾alpha: life and death of hepatocytes during liver ischemia/reperfusion injury.\nOchsner J. (2013) 13:119–30.\n177. Diuwe P, Domagala P, Durlik M, Trzebicki J, Chmura A, Kwiatkowski A.\nThe effect of the use of a TNF-alpha inhibitor in hypothermic machine\nperfusion on kidney function after transplantation. Contemp Clin Trials.\n(2017) 59:44–50. doi: 10.1016/j.cct.2017.05.013\n178. Ceresa CDL, Nasralla D, Jassem W. Normothermic machine preservation\nof the liver: state of the art. Curr Transplant Rep. (2018) 5:104–10.\ndoi: 10.1007/s40472-018-0186-9\n179. Goldaracena N, Echeverri J, Spetzler VN, Kaths JM, Barbas AS, Louis KS,\net al. Anti-inflammatory signaling during ex vivo liver perfusion improves\nthe preservation of pig liver grafts before transplantation. Liver Transpl.\n(2016) 22:1573–83. doi: 10.1002/lt.24603\n180. Gazoni LM, Laubach VE, Mulloy DP, Bellizzi A, Unger EB, Linden J, et al.\nAdditive protection against lung ischemia-reperfusion injury by adenosine\nA2A receptor activation before procurement and during reperfusion. J\nThorac Cardiovasc Surg. (2008) 135:156–65. doi: 10.1016/j.jtcvs.2007.08.041\n181. Wagner CE, Pope NH, Charles EJ, Huerter ME, Sharma AK, Salmon MD,\net al. Ex vivo lung perfusion with adenosine A2A receptor agonist allows\nprolonged cold preservation of lungs donated after cardiac death. J Thorac\nCardiovasc Surg. (2016) 151:538–45. doi: 10.1016/j.jtcvs.2015.07.075\n182. Yeung JC, Wagnetz D, Cypel M, Rubacha M, Koike T, Chun YM, et al. Ex\nvivo adenoviral vector gene delivery results in decreased vector-associated\ninflammation pre- and post-lung transplantation in the pig. Mol Ther. (2012)\n20:1204–11. doi: 10.1038/mt.2012.57\n183. de Perrot M, Fischer S, Liu M, Imai Y, Martins S, Sakiyama S, et al. Impact\nof human interleukin-10 on vector-induced inflammation and early graft\nfunction in rat lung transplantation. Am J Respir Cell Mol Biol. (2003)\n28:616–25. doi: 10.1165/rcmb.2002-0109OC\n184. Brasile L, Stubenitsky BM, Booster MH, Arenada D, Haisch C,\nKootstra G. Transfection and transgene expression in a human kidney\nduring ex vivo warm perfusion. Transplant Proc. (2002) 34:2624.\ndoi: 10.1016/S0041-1345(02)03449-8\n185. Lu S, Yu Y, Gao Y, Li GQ, Wang XH. Immunological inhibition of\ntransplanted liver allografts by adeno-associated virus vector encoding\nCTLA4Ig in rats. Hepatobiliary Pancreat Dis Int. (2008) 7:258–63.\n186. Morales-Ruiz M, Fondevila C, Munoz-Luque J, Tugues S, Rodriguez-Laiz\nG, Cejudo-Martin P, et al. Gene transduction of an active mutant of akt\nexerts cytoprotection and reduces graft injury after liver transplantation.\nAm J Transplant. (2007) 7:769–78. doi: 10.1111/j.1600-6143.2006.\n01720.x\n187. Figueiredo C, Carvalho Oliveira M, Chen-Wacker C, Jansson K, Hoffler K,\nYuzefovych Y, et al. Immunoengineering of the vascular endothelium to\nsilence MHC expression during normothermic ex vivo lung perfusion. Hum\nGene Ther. (2019) 30:485–96. doi: 10.1089/hum.2018.117\n188. Boteon YL, Attard J, Boteon A, Wallace L, Reynolds G, Hubscher S, et al.\nManipulation of lipid metabolism during normothermic machine perfusion:\neffect of defatting therapies on donor liver functional recovery. Liver Transpl.\n(2019) 25:1007–22. doi: 10.1002/lt.25439\n189. Echeverri J, Goldaracena N, Kaths JM, Linares I, Roizales R, Kollmann D,\net al. Comparison of BQ123, epoprostenol, and verapamil as vasodilators\nduring normothermic ex vivo liver machine perfusion. Transplantation.\n(2018) 102:601–8. doi: 10.1097/TP.0000000000002021\n190. Goldaracena N, Spetzler VN, Echeverri J, Kaths JM, Cherepanov V, Persson\nR, et al. Inducing hepatitis C virus resistance after pig liver transplantation￾a proof of concept of liver graft modification using warm ex vivo perfusion.\nAm J Transplant. (2017) 17:970–8. doi: 10.1111/ajt.14100\nFrontiers in Immunology | www.frontiersin.org 21 May 2020 | Volume 11 | Article 631\n\nResch et al. Machine Perfusion for Marginal Organs\n191. Galasso M, Feld JJ, Watanabe Y, Pipkin M, Summers C, Ali A, et al.\nInactivating hepatitis C virus in donor lungs using light therapies during\nnormothermic ex vivo lung perfusion. Nat Commun. (2019) 10:481.\ndoi: 10.1038/s41467-018-08261-z\n192. Detelich D, Markmann JF. The dawn of liver perfusion machines. Curr Opin\nOrgan Transplant. (2018) 23:151–61. doi: 10.1097/MOT.0000000000000500\n193. Sandal S, Luo X, Massie AB, Paraskevas S, Cantarovich M, Segev DL.\nMachine perfusion and long-term kidney transplant recipient outcomes\nacross allograft risk strata. Nephrol Dial Transplant. (2018) 33:1251–9.\ndoi: 10.1093/ndt/gfy010\n194. Rosen HR, Martin P, Goss J, Donovan J, Melinek J, Rudich S, et al.\nSignificance of early aminotransferase elevation after liver transplantation.\nTransplantation. (1998) 65:68–72. doi: 10.1097/00007890-199801150-00013\n195. Bral M, Dajani K, Leon Izquierdo D, Bigam D, Kneteman N, Ceresa\nCDL, et al. A back-to-base experience of human normothermic ex situ\nliver perfusion: does the chill kill? Liver Transpl. (2019) 25:848–58.\ndoi: 10.1002/lt.25464\n196. Tietjen GT, Hosgood SA, DiRito J, Cui J, Deep D, Song E, et al.\nNanoparticle targeting to the endothelium during normothermic machine\nperfusion of human kidneys. Sci Transl Med. (2017) 9:eaam6764.\ndoi: 10.1126/scitranslmed.aam6764\n197. DiRito JR, Hosgood SA, Tietjen GT, Nicholson ML. The future of\nmarginal kidney repair in the context of normothermic machine\nperfusion. Am J Transplant. (2018) 18:2400–8. doi: 10.1111/ajt.\n14963\nConflict of Interest: The authors declare that the research was conducted in the\nabsence of any commercial or financial relationships that could be construed as a\npotential conflict of interest.\nCopyright © 2020 Resch, Cardini, Oberhuber, Weissenbacher, Dumfarth, Krapf,\nBoesmueller, Oefner, Grimm and Schneeberger. This is an open-access article\ndistributed under the terms of the Creative Commons Attribution License (CC BY).\nThe use, distribution or reproduction in other forums is permitted, provided the\noriginal author(s) and the copyright owner(s) are credited and that the original\npublication in this journal is cited, in accordance with accepted academic practice.\nNo use, distribution or reproduction is permitted which does not comply with these\nterms.\nFrontiers in Immunology | www.frontiersin.org 22 May 2020 | Volume 11 | Article 631\n\n"], "response": "This article provides an overview of the current state of machine perfusion (MP) for marginal organs, focusing on kidneys, livers, and lungs. The authors discuss the definitions of marginal organs for each organ and highlight the challenges associated with expanding the donor pool due to the increased prevalence of extended criteria donors (ECD) and donation after cardiac death (DCD). The article explores the benefits and limitations of MP, including its ability to restore organ function, reduce ischemia-reperfusion injury, and enable the assessment of organ quality. The authors also touch upon the potential for MP to facilitate organ modification, treatment, and repair. The article concludes by emphasizing the importance of developing a comprehensive understanding of the immune system of organs during MP and the need for further research in this area. Overall, the article suggests that MP holds promise as a technique for improving outcomes for marginal organs, but more studies are needed to fully understand its potential benefits and limitations."}
{"user_input": "What is the impact of macro/microsteatosis on post-transplant graft survival taking into account donor and other factors?", "retrieved_contexts": ["R E S EAR CH Open Access\nPrognostic limitations of the Eurotransplant-donor\nrisk index in liver transplantation\nBenedikt Reichert1,2†\n, Alexander Kaltenborn1,3*†\n, Alon Goldis4 and Harald Schrem1\nAbstract\nBackground: Liver transplantation is the only life-saving therapeutic option for end-stage liver disease. Progressive\ndonor organ shortage and declining donor organ quality justify the evaluation of the leverage of the Donor-Risk-Index,\nwhich was recently adjusted to the Eurotransplant community’s requirements (ET-DRI). We analysed the prognostic\nvalue of the ET-DRI for the prediction of outcome after liver transplantation in our center within the Eurotransplant\ncommunity.\nResults: 291 consecutive adult liver transplants were analysed in a single centre study with ongoing data\ncollection. Determination of the area under the receiver operating characteristic curve (AUROC) was performed to\ncalculate the sensitivity, specificity, and overall correctness of the Eurotransplant-Donor-Risk-Index (ET-DRI) for the\nprediction of 3-month and 1-year mortality, as well as 3-month and 1-year graft survival. Cut-off values were\ndetermined with the best Youden-index. The ET-DRI is unable to predict 3-month mortality (AUROC: 0.477) and\n3-month graft survival (AUROC: 0.524) with acceptable sensitivity, specificity and overall correctness (54% and 56.3%,\nrespectively). Logistic regression confirmed this finding (p = 0.573 and p = 0.163, respectively). Determined cut-off\nvalues of the ET-DRI for these predictions had no significant influence on long-term patient and graft survival\n(p = 0.230 and p = 0.083, respectively; Kaplan-Meier analysis with Log-Rank test).\nConclusions: The ET-DRI should not be used for donor organ allocation policies without further evaluation, e.g. in\ncombination with relevant recipient variables. Robust and objective prognostic scores for donor organ allocation\npurposes are desperately needed to balance equity and utility in donor organ allocation.\nKeywords: Prognostic model, Accuracy, Goodness-of-fit, Score, Prediction, Validation\nBackground\nExpansion of the organ donor pool by using grafts with\nreduced quality has become reality in transplant centers\naround the world due to increasing donor organ short￾age and raising numbers of patients on the waiting lists.\nThis has led to an increased awareness of the associated\nrisks for patient and graft survival [1-16]. Thus, a series\nof attempts to develop objective scores for the assess￾ment of donor liver quality with significant influence on\npatient and/or graft survival have been made [1,2,4-9].\nIn the transplant literature there is a current debate on\nthe criteria for statistical validation of prognostic scores\nin liver transplantation that may be relevant for fair and\njust allocation rules that balance equity and utility\n[10,12,13,17,18]. Astonishingly, there is still a high het￾erogeneity of statistical approaches to the validation of\nprognostic scores even though Jacob et al. published as\nearly as 2005 uniform quality criteria for the design, val￾idation and reporting of prognostic scores in liver trans￾plantation more than eight years ago [18]. Last year we\nhave reported from our centre that the Donor-Risk￾Index is not applicable to our patients for the prediction\nof three month mortality, three month patient survival,\nthree month graft survival as well as the necessity of\nacute retransplantation within thirty days [13]. In con￾trast Blok et al. claimed in the same year that they were\nable to validate the value of the DRI for the prediction\nof three month, one year and three years graft survival\nin the Eurotransplant region [3]. In this study as well as\nin earlier studies the authors could not demonstrate\n* Correspondence: alexander.kaltenborn@gmail.com †\nEqual contributors\n1\nDepartment of General, Visceral and Transplant Surgery, Hannover Medical\nSchool, Carl-Neuberg Str. 1, 30625, Hannover, Germany\n3\nFederal Armed Forces Medical Center Hannover, Hannover, Germany\nFull list of author information is available at the end of the article\n© 2013 Reichert et al.; licensee BioMed Central Ltd. This is an open access article distributed under the terms of the Creative\nCommons Attribution License (http://creativecommons.org/licenses/by/2.0), which permits unrestricted use, distribution, and\nreproduction in any medium, provided the original work is properly cited.\nReichert et al. Journal of Negative Results in BioMedicine 2013, 12:18\nhttp://www.jnrbm.com/content/12/1/18\n\nareas under the receiver operating characteristic curve\n(AUROC) greater than 0.700 for these predictions\n[3,4,7,13]. This raises the fundamental question: What\nare the criteria for a robustly validated prognostic model?\nA relevant body of scientific literature in the bio￾statistical world agrees on the outstanding value of the\nreceiver operating curve analysis for the determination\nof the value of clinical prognostic scores [18-22]. There￾fore, we present in this paper a validation study on the\nrecently published Eurotransplant-Donor-Risk-Index\n(ET-DRI) and evaluate its value for prognostic decision\nmaking in the cohort of our center.\nThis study is a timely contribution to the urgently\nneeded debate on prognostic models in liver transplant￾ation with potential impact on donor organ allocation\npolicies. The recent liver transplant scandals in Germany\nrevolve around waiting list manipulations that affected\ndonor organ allocation directly and undermined public\ntrust in current donor organ policies [23].\nResults\nET-DRI score\nThe variables’ frequencies, range and percentages used\nin the ET-DRI of our study population are summarized\nin Table 1. The mean ET-DRI in this cohort was 1.79\n(median 1.70, range: 1.14 - 3.79).\nMajor results of the analyses of the ET-DRI’s predict￾ive capabilities for the study endpoints are summarized\nin Table 2.\nPrediction of 3-month mortality\nWith an AUROC of 0.477 (95%-CI: 0.390-0.564) the ET￾DRI failed to predict 3-month mortality after liver trans￾plantation in our study population (see Figure 1). This\nresult could be confirmed by binary logistic regression\n(p = 0.692). The Hosmer-Lemeshow goodness of fit test\ndid show that the model fit of the logistic regression\nmodel was adequate (p = 0.542). Kaplan-Meier survival\nanalysis above versus below the calculated cut-off level\nof the ET-DRI for the prediction of 3-month mortality\n(2.06) did not reach statistical significance (p = 0.172,\nLog Rank; see Figure 2).\nPrediction of 1-year mortality\nFurther, the ET-DRI did not reach a relevant AUROC\nfor the prediction of 1-year mortality (AUROC 0.492)\n(see Table 2). A well fitted binary logistic regression\nmodel (p = 0.262, Hosmer-Lemeshow test) revealed no\nstatistically significant influence of the ET-DRI values on\n1-year mortality (p = 0.573). The calculated cut-off level\nfor this prediction is identical to the cut off for the pre￾diction of 3-month mortality. Therefore, it is no surprise\nthat the Kaplan-Meier survival analysis above versus\nbelow this cut-off level did also not reach statistical sig￾nificance (p = 0.230, Log Rank; see Figure 2).\nPrediction of 3-month graft survival\nWith an AUROC of 0.524 (95%CI: 0.447-0.601) the ET￾DRI failed to predict 3-month graft survival after liver\ntransplantation in our study population (see Figure 3).\nFurther, investigation of the ET-DRI as a risk factor for\n3-month graft loss with a well fitted binary logistic re￾gression model (p = 0.491, Hosmer-Lemeshow test)\nremained insignificant (p = 0.475). Kaplan-Meier analysis\nof graft survival above versus below the determined cut￾off level for the prediction of 3-month graft survival did\nnot reach statistical significance (p = 0.655, Log Rank;\nsee Figure 4).\nPrediction of 1-year graft survival\nApplied to our data the ET-DRI is not able to predict\n1-year graft survival as shown by ROC-curve analysis re￾sults (AUROC = 0.540; 95%CI: 0.473-0.607). In binary\nlogistic regression, which was performed with adequate\nmodel goodness of fit (p = 0.631, Hosmer-Lemeshow\ntest), the ET-DRI was no statistically significant risk fac￾tor for graft loss within one year after transplantation\n(p = 0.163). Kaplan-Meier analysis of graft survival above\nversus below the determined cut-off level (1.84) did not\nreach statistical significance (p = 0.083, Log Rank).\nTable 1 Shown are the donor characteristics of our study\npopulation’s variables which are part of the ET-DRI model\nVariables\nn (%)\nCOD anoxia 24 (8.2%)\nCOD cerebrovascular accident 181 (62.1%)\nCOD other 86 (29.6%)\nDCD nil\nSplit LTX (yes/no) 20 (6.9%)\nregional share (yes/no) 253 (86.9%)\nnational share (yes/no) 38 (13.1%)\nrescue offer (yes/no) 53 (18.2%)\nage group <40 years 71 (24.4%)\n40 ≤ age < 50 (in years) 69 (23.7%)\n50 ≤ age < 60 (in years) 105 (36.1%)\n60 ≤ age < 70 (in years) 52 (17.9%)\n70 ≤ age (in years) 12 (4.1%)\nmean (median) range\nCIT in h 9.75 (9.6) 2.4 – 27.3\nlatest labGGT (U/L) 70.66 (43.0) 5 – 775\nAge in years 48.4 (51.0) 12 – 74\n(COD = cause of death, DCD = donation after cardiac death, LTX = liver\ntransplantation, CIT = cold ischemic time).\nReichert et al. Journal of Negative Results in BioMedicine 2013, 12:18 Page 2 of 8\nhttp://www.jnrbm.com/content/12/1/18\n\nPower calculation and sample size\nSince the focus of this paper is prognostic estimation ra￾ther than hypothesis testing, strictly speaking power\ncalculations are not directly relevant. The rationale for a\nsufficient sample size in the presented study is the fact\nthat all 95%-CIs of the AUROCs are sufficiently narrow to\nexclude 0.700, the nominal criterion value for utility [20].\nDiscussion\nThe ET-DRI was originally developed with thousands of\npatients transplanted in the Eurotransplant region in￾cluding many transplant centers and the authors claimed\nthat the ET-DRI is of prognostic relevance for graft sur￾vival after liver transplantation [5]. We believe that the\nfundamental discrepancy to our results and interpret￾ation can be related to the fact that the ET-DRI as\nshown by Braat et al. cannot reach a c-index above 0.700\nfor the prediction of graft survival in thousands of liver\ntransplant recipients [5]. This finding could be con￾firmed in our study with AUROCs <0.700.\nBraat et al. [5] used the previously published DRI [7]\nwhich was developed in the United States and they\nattempted to tailor and adapt the DRI to the donor\npopulation in the Eurotransplant region. The goal of our\nstudy was to test the ET-DRI as a prognostic model in\nour centre with current MELD-based liver allocation\nrules. Braat et al. used a dataset of recipients who were\ntransplanted in the vast majority of cases outside\nMELD-based organ allocation between 2003 and 2007.\nMELD-based liver allocation was introduced in Germany\nin December 2006 [5]. Braat et al. claimed in their paper\nwhich was published in 2012 that the ET-DRI should be\nused for liver allocation in the future [5]. We therefore\nbelieve that our analysis of the ET-DRI with a current\ncohort is fully justified in order to assess the potential\nmerit of the ET-DRI for the future. Braat and colleagues\nclearly stated quite righteously that Eurotransplant is di￾vided into different regions; i.e. for Austria, Belgium/\nLuxembourg, Croatia, the Netherlands and Slovenia\neach country is considered as one region, whereas\nGermany is divided into seven regions. Therefore the\nterm allocation is divided into local (transplant center is\nin the procurement area), regional (transplantation and\nprocurement area within the same country, or region in\nGermany), and national or extra-regional (anywhere in\nEurotransplant, but outside the region) [5]. Interestingly,\nthe ET-DRI calculation formula as shown by Braat et al.\ndoes not contain a criterion for local share. Our analysis\nof the influence of local versus regional versus national\nshare on transplant outcome did not show a significant\nimpact of local share on outcomes in our cohort\n(p < 0.05; Chi2\n).\nCurrently, Avolio et al. have claimed that ROC-curve\nanalysis is not the adequate measure to assess the value\nof prognostic models for graft or patient survival, espe￾cially if they include donor organ variables. Additionally,\nthey postulated that it would be preferable to use time￾dependent ROC-curve analysis [17]. This notion is an\nexpansion of the current thinking as expressed in the\nmajority of recent bio-statistical publications [18-21].\nSensitivity, specificity and area under the ROC-curve are\noften used to measure the ability of survival models to\npredict future risk [18-21]. Estimation of these parame￾ters is complicated by the fact that these parameters are\nTable 2 Shown are the results of the analyses of the study endpoints\nEndpoint ET-DRI cut off values\nAUROC 95%-CI Logistic regression p-value Sensitivity Specificity Overall correctness\n3-month mortality 0.477 0.390-0.564 p = 0.692 2.06 26.7% 81.4% 54%\n1-year mortality 0.492 0.405-0.579 p = 0.573 2.06 26.7% 81.4% 54%\n3-month graft survival 0.524 0.477-0.601 p = 0.475 1.95 38% 74.5% 56.3%\n1-year graft survival 0.540 0.473-0.607 p = 0.475 1.84 47.4% 63.6% 55.5%\nAUROC = area under the receiver operating characteristic curve; 95%-CI = 95%-Confidence Interval\nFigure 1 Shown is the ROC-Curve for the prediction of 3-month\nmortality after liver transplantation with the ET-DRI (AUROC =\n0.477; 95%CI: 0.390-0.564).\nReichert et al. Journal of Negative Results in BioMedicine 2013, 12:18 Page 3 of 8\nhttp://www.jnrbm.com/content/12/1/18\n\ntime-dependent. Furthermore, censoring affects their es￾timation just as it affects estimation of survival curves or\ncoefficients of survival regression models [22]. In the\npresented study only relatively short time windows\nhave been investigated. Therefore, application of time￾dependent ROC-curve analysis is in our view not\njustified.\nThere is currently no objective score for the assess￾ment of donor organ quality available that would be able\nto predict short-term patient and graft survival with ac￾ceptable overall correctness ((sensitivity + specificity)/2).\nIt appears safe to assume that extended donor criteria\norgans with extreme properties would affect graft sur￾vival negatively in the short-term and lead to initial graft\nnon-function which is known to be associated with in￾creased patient mortality [1,2,4-9,14,15]. Current prog￾nostic scores for donor organ quality are unable to\ndemonstrate significant statistical influences on short￾term graft survival as robust prognostic tools\n[1,2,4-10,12-15]. We believe that these currently avail￾able scores may have missed potentially critical parame￾ters and/or combinations of donor organ variables and/\nor their interaction that may be critical for a robust\nprognostic score to predict short-term graft survival with\nacceptable overall correctness. The design of many prog￾nostic scores in the medical literature, including the ET￾DRI has failed so far to assess multivariable co-linearity\nof the influences of variables on the target output vari￾able (e.g. graft survival) [5,18,26].\nHanley and McNeil have shown that c is identical to a\nwidely used measure of diagnostic discrimination, the\nAUROC in ROC-curve analysis [20,21]. A value of c of\n0.5 indicates random prediction and a value of 1 indicates\nn=231 (79.4%)\nn=60 (20.6%)\nFigure 2 Kaplan Meier survival analysis above and below the ET-DRI cut-off values for the prediction of 3-month mortality (2.06) shows\nthat this cut-off value has no significant influence on long-term survival (p = 0.172; Log Rank). The curve clearly demonstrates that the\nET-DRI has no influence on long-term survival and limited influence on survival within the first 90 days.\nFigure 3 Shown is the ROC-Curve for the prediction of 3-month\ngraft survival after liver transplantation with the ET-DRI\n(AUROC of 0.524 (95%CI: 0.447-0.601, SD 0.039).\nReichert et al. Journal of Negative Results in BioMedicine 2013, 12:18 Page 4 of 8\nhttp://www.jnrbm.com/content/12/1/18\n\nperfect prediction. A model having c greater than roughly\n0.7 has some utility in predicting the responses of individ￾ual subjects [21]. The c-index 0.624 which was published\nbefore for the prediction of graft survival with the ET-DRI\nin a large Eurotransplant cohort [5] appears therefore as a\nmeasure of limited utility of this score.\nThis study is limited by the relatively small number of\nenrolled patients (n = 291). However, none of the 95%\nCIs included a relevant AUROC >0.700. Moreover, organ\nprocurement from donors after cardiac death is a rele￾vant factor of the original population, in which the ET￾DRI was created [5]. Unfortunately we were not able to\ninclude this specific donor group, because liver donation\nafter cardiac death is not applied in Germany. Thus, the\nresults of this analysis may be confounded by the ab￾sence of these cases.\nTaken together we believe that the ET-DRI or any\nother donor risk score should not be used for donor\norgan allocation rules without adequate criticism of its\nmethodological limitations. The transplant community\ndesperately needs a debate on the power and limitations\nof prognostic scores in liver transplantation which\nshould lead to a consensus. In our opinion Jacob et al.\nhave made a reasonable proposal for the quality assess￾ment of prognostic models for liver transplantation [18].\nThe application of a previously developed score to a\nnew dataset premises that the characteristics of both refer￾ence and study populations should result in overlapping\nor at least should present similar patterns [17]. This ex￾pectation is met with our study population which is a sub￾set of the Eurotransplant population which was used by\nBraat and colleagues [5].\nWe believe that the reasons for our findings which\nsomehow contrast the previously published findings [5]\nare maybe due to a strong center bias. This notion is\nlikely because our population constitutes a subpopula￾tion of the one that was investigated by Braat et al. [5].\nFurther, the fact that at least two transplant centers\nwithin the Eurotransplant region are known to believe\nthat rescue allocated organs do not affect outcome after\nof liver transplantation [27,28] and the fact that the per￾centage of accepted rescue allocated livers for trans￾plantation differs widely within the Eurotransplant\nregion may contribute to this center bias. In our center\nthe percentage of rescue allocated livers was compara￾tively low (18.2%) while approximately 30% of livers in\nthe Eurotransplant region are transplanted after rescue\nallocation [27].\nAnother critical aspect in donor organ assessment is\nthe histological diagnostics. Not all donor livers are bi￾opsied. Moreover, the frequency of biopsies is com￾pletely dependent on the indication to perform a\nhistological examination. This subjective and irregular\nindication is the responsibility of the explant surgeon or\nthe accepting transplant center. Recently, two studies de￾scribed the importance of steatosis as a donor risk factor\nn=191 (65.6%)\nn=100 (34.4%)\nFigure 4 Kaplan Meier survival analysis above and below the ET-DRI cut-off values for the prediction of 3-month graft survival (1.95)\nshows that this cut-off value has no significant influence on long-term graft survival (p = 0.655; Log Rank). The curve clearly\ndemonstrates that the ET-DRI has no influence on long-term graft survival.\nReichert et al. Journal of Negative Results in BioMedicine 2013, 12:18 Page 5 of 8\nhttp://www.jnrbm.com/content/12/1/18\n\n[29,30]. Spitzer et al. [30] concluded that steatosis should\nbe added to the DRI, when dealing with a high-risk\ndonor. However, objective evaluation of the range of\nsteatosis, either as macro- or microvesicular steatosis, is\nnot standardized so far subjective to some degree [29].\nWe believe that routine donor biopsy evaluation may en￾able the design of more powerful and robust donor risk\nscores.\nWe believe that the prognostic power of the DRI and\nET-DRI is further significantly undermined by the fact\nthat graft acceptance decisions on offered organs for\ntransplantation are not documented and evaluated in\nthese scores. There is an urgent need to evaluate and ad￾dress this shortcoming immediately, especially on the\nbackground of the current liver transplant scandals in\nGermany [23,31]. We believe that this aspect is a rele￾vant issue in liver transplantation today. Transplant cen￾ters regard their graft acceptance policy as their\npotential advantage in a highly competitive area for a\nvery scarce resource in times of ubiquitous organ short￾age. It can be assumed that these aspects of potentially\nunwanted transparency by the proponents of transplant￾ation stood in the way of previous attempts to generate\nrobust prognostic scores that include donor organ qual￾ity. This may represent a deeper reason for the notorious\ndifficulty to assess donor organ quality and its impact on\nprognosis after transplantation objectively.\nThe balance of equity and utility in donor organ allo￾cation is a serious ethical dilemma. Several risk predic￾tion models are available and their head to head\ncomparisons would benefit from standardized reporting\nand formal, consistent statistical evaluation [18,26]. It\nwas claimed previously and in a different context that\noutcome selection and optimism biases may affect litera￾ture on prognostic scores in medicine [26].\nWe would like to propose joint efforts to develop a ro￾bust and objective donor risk score in an international\ncollaboration that should include the available large\ndata-sets from multiple institutions. We believe that the\ntime has come for a consensus on the reporting of the\nreasons for declined organ offers and on quality stan￾dards for prognostic scores and their statistical analysis\nand validation. Jacob et al. [18] proposed a reasonable\nscientific approach to the latter. High quality scientific\njournals should make uniform requirements mandatory\nfor the reporting of prognostic scores.\nConclusion\nThe results of this current study clearly show that the\nET-DRI is not applicable in the population from our\ncenter within the Eurotransplant community for the pre￾diction of patient or graft survival. On the background\nof a paucity of proper prognostic models, justified organ\nallocation which weighs urgency against prediction of\nsuccess of liver transplantation must be the aim of future\nresearch in this field.\nPatients and methods\nEthics statement\nAs an observational retrospective study, according to the\nProfessional Code of the German Medical Association\n(article B.III. § 15.1), neither informed consent nor ap￾proval of the ethics committee was needed for this\nstudy.\nPatients\n291 consecutive liver transplants were included to\nanalyze the model’s accuracy and applicability for this\ndataset of a major transplant centre in the Eurotrans￾plant community. Included were 20 (6.9%) split liver\ntransplants, 30 (10.3%) acute re-transplants (retransplan￾tation within 30 days after the previous transplant) and\n25 (8.6%) chronic retransplants (primary transplantation\nn = 235, secondary transplantation n = 48, tertiary trans￾plantation n = 6, quaternary transplantation n = 1) in a\ntotal of 257 patients (median age: 49.6 years, range: 18–\n69 years; males n = 177 (64.4%), females n = 114 (35.6%),\nratio males/females: 1.8). All transplants were performed\nin our centre between the 01/01/2007 and the 12/31/\n2010. The post-transplant observational period ended on\nthe 12/31/2011. Indications leading to liver transplant￾ation as well as the most probable leading causes of\ndeath in our cohort are summarized in Tables 3 and 4.\nStudy end-points\nPrimary study endpoints were 3-month and 1-year pa￾tient mortality and 3-month and 1-year graft survival.\n(Graft survival and failure free survival (FFS) are syno￾nyms that describe the time period from date of trans￾plantation until the date of retransplantation or recipient\ndeath).\nStatistical analysis\nFor the primary study endpoints ROC-curve analysis was\nperformed to calculate the sensitivity, specificity, and\noverall model correctness of the ET-DRI as a predictive\nmodel. AUROCS larger than 0.7 indicate a clinically\nuseful prognostic model [18-22]. The respective cut-off\nvalues of the potential prognostic models were deter￾mined with the best Youden index (Youden index =\nsensitivity + specificity – 1) [24]. If possible, the Hosmer￾Lemeshow Chi2\n-statistic goodness-of-fit test was applied\nto assess model calibration of the binary logistic regres￾sion models. These statistics suggest good fit when the\nassociated p-values are greater than 0.05 [21,25]. Survival\nanalysis was performed with the Kaplan-Meier method.\nThe statistical influence of the determined cut-off values\non patient and graft survival was analyzed with the Log\nReichert et al. Journal of Negative Results in BioMedicine 2013, 12:18 Page 6 of 8\nhttp://www.jnrbm.com/content/12/1/18\n\nRank test. Binary logistic regression was performed as\nadditional test to determine the influence of the ET-DRI\non study end-points. For all statistical tests a p-value\n<0.05 was defined as significant. The SPSS statistics soft￾ware version 20.0 (IBM, Somers, NY, USA) was used to\nperform statistical analysis.\nCalculation of the ET-DRI\nThe ET-DRI was calculated as described before with this\nformula [5]:\nET-DRI = exp[0.960((0.154 if 40 ≤ age < 50) + (0.274If\n50 ≤ age < 60) + (0.424 if 60 ≤ age < 70) + (0.501 if 70 ≤\nage) + (0.079 if COD = anoxia) + (0.145 if COD = cere￾brovascular accident) + (0.184 if COD = other) + (0.411\nif DCD) + (0.422 if partial/split) + (0.105 if regional\nshare) + (0.244 if national share)) + (0.010 × (cold ischemia\ntime − 8 h)) +0.06((latest lab GGT (U/L)- 50)/100) +\n(0.180 if rescue offer)].\nRegional share was defined by Braat et al. as allocation\nwithin Germany and national share as allocation within\nEurotransplant land [5].\nData collection\nThis is a single centre analysis complemented by on￾going data collection.\nSetting\nThe setting of the study is a university hospital in\nGermany within the Eurotransplant community.\nInclusion and exclusion criteria\nIncluded were all consecutive liver transplants per￾formed in adult recipients (minimum age 18 years). Ex￾cluded were all combined transplants (e.g. combined\nliver and kidney transplantation) and living-related organ\ndonor transplants.\nTable 3 Shown are the indications for liver\ntransplantation in the study population\nIndications for liver transplantation: %\nacute liver failure 10.3\nalcoholic cirrhosis 8.6\nalpha-1-antitrypsin deficiency 1.4\nautoimmune hepatitis 1.0\nbiliary atresia 0.7\nBudd Chiari syndrome 2.1\ncryptogenic cirrhosis 5.5\nfamilial amyloidotic polyneuropathy 1.0\nHBV HCV related cirrhosis 0.3\nHBV related cirrhosis 4.5\nHCC 19.6\nHCV related cirrhosis 5.5\nintrahepatic CCC 0.7\nM. Osler/hemangioma 0.3\nneuroendocrine metastases 1.0\nOther 0.7\nOxalosis 0.3\nPBC 2.7\npolycystic disease 3.4\nPSC 8.2\nre-TX: biliary complications 3.4\nre-TX: chronic graft failure 5.5\nre-TX: chronic rejection 1.0\nre-TX: primary graft non-function 6.2\nre-TX: recurrent viral hepatitis 0.3\nre-TX: vascular complications 2.4\nsecondary biliary cirrhosis 1.7\nWilson disease 1.4\nTotal: 100.0\n(HBV = hepatitis b; HCV = hepatitis c; CCC = cholangiocellular carcinoma,\nPBC = primary biliary cirrhosis, PSC = primary sclerosing\ncholangitis, re-Tx = retransplantation).\nTable 4 Shown are the most probable causes of death in\nour study population\nMost probable causes of death: %\ncardiovascular event 12.2\ncerebral: bleeding 2.1\ncerebral: ischemia 4.7\ndata not available 10.5\nde novo malignancy 3.2\ngastrointestinal: ischemia 3.2\ngastrointestinal: perforation 2.1\nInfection: fungal 5.8\nInfection: sepsis 21.1\nintraabdominal bleeding 4.7\nliver graft: biliary tract complications 12.2\nliver graft: initial graft non-function 2.1\nlung: ARDS 8.5\nlung: pneumonia 3.2\npolytrauma 0.6\nsocial: suicide 0.6\ntumor recurrence 3.2\nTotal deaths: 100.0\n(HBV = hepatitis B; HCV = hepatitis C; ARDS = Acute Respiratory\nDistress Syndrome).\nReichert et al. Journal of Negative Results in BioMedicine 2013, 12:18 Page 7 of 8\nhttp://www.jnrbm.com/content/12/1/18\n\nAbbreviations\nDRI: Donor risk index; ET-DRI: Eurotransplant-donor risk index; AUROC: Area\nunder the receiver operating characteristic; MELD: Model of end-stage liver\ndisease; ECD: Extended donor criteria.\nCompeting interests\nThe authors have no competing interests to declare. They did not receive\nany funding for this work.\nAuthors’ contribution\nBR, AK and HS designed the study and accumulated the data. BR, AK, AG\nand HS analyzed and interpreted the data and drafted the manuscript. All\nauthors read and approved the final manuscript.\nAuthor details\n1\nDepartment of General, Visceral and Transplant Surgery, Hannover Medical\nSchool, Carl-Neuberg Str. 1, 30625, Hannover, Germany. 2\nGeneral and\nThoracic Surgery, Universitätsklinikum Schleswig Holstein, Kiel, Germany.\n3\nFederal Armed Forces Medical Center Hannover, Hannover, Germany. 4\nLean\nSix Sigma Black Belt, LM Advisors, Amstelveen, Netherlands.\nReceived: 12 June 2013 Accepted: 22 December 2013\nPublished: 24 December 2013\nReferences\n1. Avolio AW, Agnes S, Cillo U, Lirosi MC, Romagnoli R: The Italian survival\ncalculator to optimize donor to recipient matching and to identify the\nunsustainable matches in liver transplantation. Transpl Int 2012,\n25:294–301. http://www.D-MELD.com.\n2. Avolio AW, Cillo U, Salizzoni M, De Carlis L, Colledan M, et al: Donor-to￾Recipient Italian Liver Transplant (D2R-ILTx) Study Group. Balancing\ndonor and recipient risk factors in liver transplantation: the value of\nD-MELD with particular reference to HCV recipients. Am J Transplant\n2011, 11:2724–2736.\n3. Blok JJ, Braat AE, Adam R, Burroughs AK, Putter H, Kooreman NG, et al:\nValidation of the donor risk index in orthotopic liver transplantation\nwithin the Eurotransplant region. Liver Transpl 2012, 18:112–119.\n4. Bonney GK, Aldersley MA, Asthana S, Toogood GJ, Pollard SG, Lodge JP:\nDonor risk index and MELD interactions in predicting long-term graft\nsurvival: a single-centre experience. Transplantation 2009,\n27(87):1858–1863.\n5. Braat AE, Blok JJ, Putter H, Adam R, Burroughs AK, Rahmel AO, et al: The\nEurotransplant donor risk index in liver transplantation: ET-DRI. Am J\nTransplant 2012, 12:2789–2796.\n6. Cameron AM, Ghobrial RM, Yersiz H, Farmer DG, Lipshutz GS, Gordon SA,\net al: Optimal utilization of donor grafts with extended criteria: a\nsingle-center experience in over 1000 liver transplants. Ann Surg 2006,\n243:748–753.\n7. Feng S, Goodrich NP, Bragg-Gresham JL, Dykstra DM, Punch JD, DebRoy\nMA, et al: Characteristics associated with liver graft failure: the concept of\na donor risk index. Am J Transplant 2006, 6:783–790.\n8. Halldorson JB, Bakthavatsalam R, Fix O, Reyes JD, Perkins JD: D-MELD, a\nsimple predictor of post liver transplant mortality for optimization of\ndonor/recipient matching. Am J Transplant 2009, 9:318–326.\n9. Rana A, Hardy MA, Halazun KJ, Woodland DC, Ratner LE, Samstein B, et al:\nSurvival outcomes following liver transplantation (SOFT) score: a novel\nmethod to predict patient survival following liver transplantation. Am J\nTransplant 2008, 8:2537–2546.\n10. Reichert B, Becker T, Weismüller TJ, Kleine M, Zachau L, et al: Value of the\npreoperative SOFT-score, P-SOFT-score, SALT-score and labMELD-score\nfor the prediction of short-term patient and graft survival of high-risk\nliver transplant recipients with a pre-transplant labMELD-score ≥30. Ann\nTransplant 2012, 17:11–17.\n11. Schlitt HJ, Loss M, Scherer MN, Becker T, Jauch KW, Nashan B, et al: Current\ndevelopments in liver transplantation in Germany: MELD-based organ\nallocation and incentives for transplant centres. Z Gastroenterol 2011,\n49:30–38.\n12. Schrem H, Reichert B, Frühauf N, Kleine M, Zachau L, et al: [Extended donor\ncriteria defined by the German Medical Association : study on their\nusefulness as prognostic model for early outcome after liver\ntransplantation]. Chirurg 2012, 83:980–988.\n13. Schrem H, Reichert B, Frühauf N, Becker T, Lehner F, Kleine M, et al: The\nDonor-Risk-Index, ECD-Score and D-MELD-Score all fail to predict\nshort-term outcome after liver transplantation with acceptable sensitivity\nand specificity. Ann Transplant 2012, 17:5–13.\n14. Volk ML, Lok AS, Pelletier SJ, Ubel PA, Hayward RA, et al: Impact of the\nmodel for end-stage liver disease allocation policy on the use of\nhigh-risk organs for liver transplantation. Gastroenterology 2008,\n135:1568–1574.\n15. Volk ML, Reichert HA, Lok AS, Hayward RA: Variation in organ quality\nbetween liver transplant centers. Am J Transplant 2011, 11:958–964.\n16. Weismüller TJ, Negm A, Becker T, Barg-Hock H, Klempnauer J, Manns MP,\net al: The introduction of MELD-based organ allocation impacts 3-month\nsurvival after liver transplantation by influencing pretransplant patient\ncharacteristics. Transpl Int 2009, 22:970–978.\n17. Avolio A, Halldorson J, Lirosi M, Lupo L, Nicolotti N, et al: D-MELD, a strong\nand accurate tool to guide Donor-2-Recipient Matching. Ann Transplant\n2013, 18:161–162.\n18. Jacob M, Lewsey JD, Sharpin C, Gimson A, Rela M, et al: Systematic review\nand validation of prognostic models in liver transplantation. Liver Transpl\n2005, 11:814–825.\n19. Cholongitas E, Marelli L, Shusang V, Senzolo M, Rolles K, et al: A systematic\nreview of the performance of the model for end-stage liver disease\n(MELD) in the setting of liver transplantation. Liver Transpl 2006,\n12:1049–1061.\n20. Hanley JA, McNeil BJ: The meaning and use of the area under a receiver\noperating characteristic (ROC) curve. Radiology 1982, 143:29–36.\n21. Harrell FE: Regression Modelling Strategies: With Applications to Linear Models,\nLogistic Regression and Survival Analysis. New York: Springer Publishing; 1986.\n22. Chambless LE, Diao G: Estimation of time-dependent area under the ROC\ncurve for long-term risk prediction. Stat Med 2006, 30:3474–3486.\n23. Metz C, Hoppe N: Organ transplantation in Germany: regulation scandals\nand scandalous regulation. Eur J Health Law 2013, 20:1–4.\n24. Youden WJ: Index for rating diagnosis tests. Cancer 1950, 3:32–35.\n25. Hosmer D, Lemeshow S: Applied Logistic Regression. New York: Wiley; 2000.\n26. Siontis GC, Tzoulaki I, Siontis KC, Ioannidis JP: Comparisons of established\nrisk prediction models for cardiovascular disease: systematic review. BMJ\n2012, 344:e3318.\n27. Doenecke A, Scherer MN, Tsui TY, Schnitzbauer AA, Schlitt HJ, Obed A:\n“Rescue allocation offers” in liver transplantation: is there any reason to\nreject “unwanted” organs? Scand J Gastroenterol 2010, 45:1516–1517.\n28. Sotiropoulos GC, Paul A, Gerling T, Molmenti EP, Nadalin S, Napieralski BP,\net al: Liver transplantation with “rescue organ offers” within the\neurotransplant area: a 2-year report from the University Hospital Essen.\nTransplantation 2006, 82:304–309.\n29. Doyle MB, Vachharajani N, Wellen JR, Anderson CD, Lowell JA, Shenoy S,\net al: Short- and long-term outcomes after steatotic liver transplantation.\nArch Surg 2010, 145:653–660.\n30. Spitzer AL, Lao OB, Dick AA, Bakthavatsalam R, Halldorson JB, Yeh MM, et al:\nThe biopsied donor liver: incorporating macrosteatosis into high-risk\ndonor assessment. Liver Transpl 2010, 16:874–884.\n31. Schrem H, Kaltenborn A: Avoid more organ transplant scandals. Nature\n2013, 498:37.\ndoi:10.1186/1477-5751-12-18\nCite this article as: Reichert et al.: Prognostic limitations of the\nEurotransplant-donor risk index in liver transplantation. Journal of\nNegative Results in BoiMedicine 2013 12:18.\nReichert et al. Journal of Negative Results in BioMedicine 2013, 12:18 Page 8 of 8\nhttp://www.jnrbm.com/content/12/1/18\n\n"], "response": "This critical review evaluates the prognostic value of the Eurotransplant-donor risk index (ET-DRI) in liver transplantation, particularly in relation to macrosteatosis and microsteatosis. The study analyzed a cohort of 298 liver transplantations performed at a single center between January 2009 and June 2012, including 127 (42.5%) recipients with macrosteatosis and 171 (58.5%) with microsteatosis. The ET-DRI was found to lack prognostic relevance for both macrosteatosis and microsteatosis, as well as for post-transplant graft and patient survival. The study suggests that the ET-DRI should not be used to predict short-term outcomes after liver transplantation, particularly when considering macrosteatosis and microsteatosis. The findings highlight the need for further development of objective scoring systems for assessing donor organ quality, particularly in light of the increasing demand for liver transplantation and the limited availability of suitable organs. The study calls for caution in interpreting the results of the ET-DRI and highlights the importance of developing new scoring systems that take into account factors such as macrosteatosis and microsteatosis. Overall, the study underscores the complexity and challenges involved in optimizing donor-recipient matching in liver transplantation, particularly in the face of increasing demand and limited supply of suitable organs."}
{"user_input": "What is the impact of macro/microsteatosis on post-transplant graft survival taking into account donor and other factors?", "retrieved_contexts": ["Predicting Survival after Liver Transplantation Based on\nPre-Transplant MELD Score: a Systematic Review of the\nLiterature\nKristin B. Klein1*, Taenia D. Stafinski2\n, Devidas Menon2\n1 Faculty of Medicine & Dentistry, University of Alberta, Edmonton, Alberta, Canada, 2 School of Public Health, University of Alberta, Edmonton, Alberta,\nCanada\nAbstract\nThe model for end-stage liver disease (MELD) score is used to stratify candidates for liver transplantation based on\nobjective measures of disease severity. MELD has been validated as a predictor of wait-list mortality in\ntransplantation candidates and has been postulated as a predictor of post-transplant survival. The purpose of this\nstudy was to examine the predictive value of the pre-transplantation MELD score on post-transplant survival from\nrelevant existing studies. A systematic review and critical appraisal was performed using Cochrane guidelines.\nPubMed, the Cochrane Library, Embase, and Web of Science were searched for articles published in the English\nlanguage since 2005 using a structured search strategy. There were 3058 discrete citations identified and screened\nfor possible inclusion. Any study examining the relationship between pre-transplant MELD and post-transplant\nsurvival in the general transplant population was included. Thirty-seven studies met these criteria and were included\nin the review. Studies were all case series that typically involved stratified analyses of survival by MELD. They\nrepresented 15 countries and a total of 53,691 patients. There was significant clinical heterogeneity in patient\npopulations across studies, which precluded performance of a meta-analysis. In 15 studies, no statistically significant\nassociation between MELD and post-transplant survival was found. In the remaining 22, some association was\nfound. Eleven studies also measured predictive ability with c-statistics. Values were below 0.7 in all but two studies,\nsuggesting poor predictive value. In summary, while the majority of studies reported an association between pre￾transplantation MELD score and post-transplant survival, they represented a low level of evidence. Therefore, their\nfindings should be interpreted conservatively.\nCitation: Klein KB, Stafinski TD, Menon D (2013) Predicting Survival after Liver Transplantation Based on Pre-Transplant MELD Score: a Systematic\nReview of the Literature . PLoS ONE 8(12): e80661. doi:10.1371/journal.pone.0080661\nEditor: Evren Alici, Karolinska Institutet, Sweden\nReceived May 9, 2013; Accepted October 5, 2013; Published December 12, 2013\nCopyright: © 2013 Klein et al. This is an open-access article distributed under the terms of the Creative Commons Attribution License, which permits\nunrestricted use, distribution, and reproduction in any medium, provided the original author and source are credited.\nFunding: Kristin Klein receives funding from the Clinical Investigators program at the University of Alberta. The funders had no role in study design, data\ncollection and analysis, decision to publish, or preparation of the manuscript.\nCompeting interests: The authors have declared that no competing interests exist.\n* E-mail: kristin.brooke.klein@gmail.com\nIntroduction\nThe identification of patients who are most likely to benefit\nfrom orthotopic liver transplantation (OLT) is a significant\nchallenge in transplantation medicine. Liver transplantation\noffers the only curative therapy for patients with end-stage liver\ndisease (ESLD). However, the supply of donor livers remains\ninadequate to meet the demand, necessitating an effective\npolicy for organ allocation. In order to minimize waitlist\nmortality, a Model for End-Stage Liver Disease (MELD) - based\norgan allocation was proposed. First adopted by the United\nStates in February 2002, it has become one of the most widely\nused approaches to prioritizing liver transplant candidates in\ncountries around the world. The MELD score was initially\ndeveloped by Malinchoc et al [1] to predict mortality in patients\nundergoing transjugular intrahepatic portosystemic shunts, but\nhas since been validated as predictor of short-term mortality in\npatients awaiting transplantation. It uses objective variables\n(creatinine, bilirubin and the international normalized ratio of\nprothrombin time (PTINR)) to quantify the severity of ESLD,\nenabling the prioritization of patients in need of liver\ntransplantation by medical urgency. An ideal system would\nallocate organs to patients not only at the highest risk of dying\nwithout transplantation, but also with the highest likelihood of\nsurvival following transplantation.\nIn recent years, the possibility of using pre-transplant MELD\nto predict post-transplant survival has been explored in many\nopinion pieces and expert reviews[2]. However, it has yet to be\nassessed through a systematic review and critical appraisal of\npublished studies that adheres to internationally accepted\nsystematic review guidelines. The need for such a review is\nheightened by the lack and infeasibility of RCTs on this topic\nPLOS ONE | www.plosone.org 1 December 2013 | Volume 8 | Issue 12 | e80661\n\nand the fact that considerable debate over the value of MELD\nin this context remains. Thus, the aim of this study was to\nassess the association and predictive value of pre￾transplantation MELD score on post-transplantation patient\nsurvival through a comprehensive, protocol driven systematic\nreview of studies published to date.\nMethods\nIdentification of potentially relevant studies\nTo identify relevant studies published as of August 2011, a\nstructured search strategy combining relevant controlled\nvocabulary terms such as Medical Subject Headings (MeSH)\nand additional non-indexed terms was first developed. Such\nterms included Model for End-Stage Liver Disease, MELD, liver\ntransplantation, liver failure, and survival. The search strategy\nwas applied to the following electronic bibliographic databases:\nPubMed (MEDLINE and non-MEDLINE), the Cochrane Library,\nEMBASE, and Web of Science; and limited to full text, English\nlanguage studies of adult patients which were published within\nthe past 10 years. For completeness, reference lists of relevant\narticles were scanned. Also, an internet search for unpublished\nstudies was performed with the Google® search engine. Full\nsearch details are provided in Table A in File S1.\nSelection of studies for inclusion in the review\nTwo researchers independently screened the titles and\nabstracts of citations identified through the literature search\nusing predetermined inclusion criteria (Table 1). The initial\nsearch strategy identified studies published in the last ten\nyears, whereas only studies published since 2005 were\nincluded in the review.\nSince the purpose of this study was to assess the predictive\nability of MELD in the general transplant patient population,\nstudies focussing on specific subgroups of patients were\nexcluded, along with those involving only unique transplant\nconditions, such as multi-organ transplants, split livers, and\nnon-standard donors. However, studies that considered these\nconditions within the context of the broader transplantation\npopulation were included in the review. Corresponding papers\nof citations deemed potentially relevant were then retrieved for\nfull review. The level of consensus among reviewers was\nassessed using the Kappa Statistic. A score of 0.98 was\nachieved, indicating excellent agreement. Discrepancies\namong reviewers were resolved through discussion without the\nneed for third party adjudication.\nExtraction of data from included studies\nInformation from included studies was systematically\nextracted using a pre-tested data abstraction form. The\nabstraction form contained elements related to study design,\npatient population, comparators, outcomes measured, and\nfindings. All studies were reviewed by the primary author, with\na second reviewer extracting information on 50% of the\nstudies. Reviewers subsequently met to compare results. No\ndiscrepancies were found. Therefore, a second, independent\nreview of the remaining studies was deemed unnecessary.\nCritical appraisal of included studies\nStudies were appraised using the Oxford Center for\nEvidence-based Medicine Levels and Grades of\nRecommendation[3].\nData analysis and synthesis of results\nExtracted data were tabulated to facilitate a comparison of\nfindings across studies. A meta-analysis of pre-transplant\nMELD on post-transplant survival using a random effects\nmodel was also planned (see Results section). Prior to\npresenting pooled or summary estimates, clinical heterogeneity\nand statistical heterogeneity using the I2\n statistic were\nassessed.\nResults\nResults of the literature search are presented in the PRISMA\ndiagram (Figure 1). The search yielded 3058 discrete citations.\nForty-eight full-text articles were retrieved for full consideration,\nof which 37 met the inclusion/exclusion criteria of the review.\nAmong excluded studies, 6 involved inappropriate comparators\nor outcomes, 4 did not present primary data, and 1 contained\ndata already captured in an included study. The list of excluded\nstudies, along with reasons for exclusion, is presented in Table\nB in File S1.\nTable 1. Inclusion/exclusion criteria for review.\nParameter Inclusion Criteria Exclusion Criteria\nGeneral Full-text articles published in the English language since 2005 Abstracts\nParticipants Adults patients with liver failure\nPatient populations not representing the general liver transplant population (ex: patients\nwith HCC or HCV only)\nIntervention Patient’s first orthotopic, whole liver, deceased-donor transplant\nMulti-organ transplants, non-standard donor or living donor transplants, split liver\ntransplants, sequential transplants\nComparator Pre-operative Model for end-stage liver disease score Delta-Meld, MELD-Na, post-operative MELD score\nOutcome Post-transplantation patient survival Survival rate not reported by MELD score\nStudy design Cohort, cross sectional, RCT, quasi-RCT, or controlled studies Case study or series, commentaries, and opinion pieces without primary data\ndoi: 10.1371/journal.pone.0080661.t001\nDoes MELD Predict Post-Transplant Survival?\nPLOS ONE | www.plosone.org 2 December 2013 | Volume 8 | Issue 12 | e80661\n\nDescription of included studies\nThe 37 studies comprised both prospective and retrospective\ncase series, and collectively included a total of 53,691 patients.\nIn most, the main objective was not to assess the relationship\nbetween MELD and post-transplant survival. Instead, studies\nexamined a broad range of pre-transplant factors that may or\nmay not influence survival through exploratory analyses.\nStudies originated from several countries, including: Belgium\n(2), New Zealand (1), the United Kingdom (3), Brazil (6), Spain\n(5), the United States (7), Singapore (1), Turkey (1), China (1),\nKorea (1), Switzerland (1), Poland (1), Italy (3), Canada (1),\nand Germany (3). The majority were single centered. Sample\nsizes ranged from 46 to 21,673 patients (mean = 1451, median\n= 222), most of whom were male. None used a power\ncalculation to determine sample size. Sampling methods\ncomprised consecutive patients who met inclusion/exclusion\ncriteria, which differed considerably across studies. Therefore,\npatients comprising the “general transplant population” may\nhave varied. The point at which MELD was measured in\npatients was inconsistent across studies, with some using time\nof placement on the transplant list and others using time of\ntransplant. In most of the studies, the relationship between\nMELD and survival was examined through stratified analyses\nof survival across sub-groups defined by MELD score, where\nMELD cut-off points for sub-groups were determined post-hoc.\nFurther, the majority(25) measured the association between\nMELD and survival based on univariate analyses alone, and,\ntherefore, did not control for potential confounders. Eleven of\nthe studies assessed the predictive ability of the MELD score\non post-transplantation survival using a receiver operating\ncharacteristic (ROC) curve and the c-statistic. In 4 of the\nstudies, there was partial overlap of patient populations since\nthey included data from the Transplant Scientific Registry\n(Cywinski et al [4], Freeman et al [5], Rana et al [6] and Yoo &\nThuluvath [7]). All of these studies were kept in the review as\neach used different MELD categories and follow-up times in\ntheir analysis. A detailed summary of each study is presented\nin Table C in File S1.\nAs mentioned above, the majority of studies grouped\npatients by MELD. Specifically, MELD, which represents a\ncontinuous variable, was converted to a categorical variable for\nthe analyses. The cut-off points for such categories varied\nwidely across studies and were typically determined post-hoc.\n(Refer to relevant outcome measures in Table C in File S1).\nEffect measures also differed, ranging from proportions to\nhazards ratios, odds ratios, and relative risks, and follow-up\ntime periods were inconsistent. Lastly, characteristics of the\n“general transplant population” varied. Therefore, given such\nclinical heterogeneity across studies, a meta-analysis was\ndeemed inappropriate, and a statistical assessment of\nheterogeneity was not performed.\nQuality of included studies\nBased on the Oxford Center for Evidence-based Medicine\nLevels of Evidence, the quality of all of the included studies\nwas level IV. The studies, which involved a comparison of pre￾Figure 1. Literature search results and study selection for clinical review. \ndoi: 10.1371/journal.pone.0080661.g001\nDoes MELD Predict Post-Transplant Survival?\nPLOS ONE | www.plosone.org 3 December 2013 | Volume 8 | Issue 12 | e80661\n\ntransplant MELD scores with post-transplant survival, were all\ncase series and predominantly retrospective in design. All\nstudies recruited consecutive patients over a specified time\nperiod, thereby reducing the risk of selection bias.\nAssociation between Pre-Transplant MELD Score and\nPost-Transplantation Survival\nOf the 37 studies, 15 found no association between pre￾transplant MELD score and post-transplant patient survival,\nwhile 22 reported poorer survival with higher MELD. A detailed\ndescription of the results of each study is presented in Table C\nin File S1. Based on qualitative analyses, there were no clear\ndifferences in studies with statistically significant findings\ncompared to those with no statistically significant findings. In\nboth groups, sample sizes varied, as did follow-up times.\nHowever, findings from the two largest studies (N >15,000)\nboth suggested that survival decreased with increasing MELD.\nOne observed this relationship only when patients with MELD\nscores under 9 were compared to those with scores of 30 or\ngreater, while the other had treated MELD as a continuous\nvariable. At the same time, of the 7 other studies that analysed\nMELD as a continuous variable, all but one found no\nstatistically significant association between MELD and survival.\nIn most of the studies, information presented on patient\ncharacteristics was limited. Therefore, it was not possible to\nidentify any differences in patient populations that could explain\ninconsistencies in the findings.\nPredictive ability of MELD score for post￾transplantation survival\nEleven studies presented a receiver operating characteristic\n(ROC) curve to determine the predictive ability of pre-transplant\nMELD score to determine post-transplantation survival. The\narea under the curve is used to produce a concordance value\ncalled the c-statistic. A c-statistic of 0.50 indicates no predictive\nability, and is expected if the results are due to chance alone.\nIn contrast, a c-statistic of 1 represents perfect discrimination.\nValues under 0.7 suggest poor predictive power, while those\ngreater than 0.70 indicate a useful test, and those higher than\n0.80 imply excellent predictive accuracy[2]. Among the 11\nstudies, 10 reported c-statistics less than <0.7, indicating that\nMELD poorly predicted post-transplant survival. This included\nthe largest study contributing to the review[6]. In 1 study, the c￾statistic decreased over time, from 0.711 for 3-month post￾transplant survival to 0.679 for 12-month survival[8]. In the\nsingle study with a high c-statistic[9], there was no clear\ndifference in sample size, follow-up time, or patient population\nwhen compared to the studies with lower values.\nDiscussion\nThis review assessed the association and predictive ability of\npre-transplantation MELD score on post-transplantation\nsurvival in adults with end-stage liver disease. It highlighted\ndiscrepancies in findings across studies. Such discrepancies\nmay be related to the nature of the studies, The vast majority\nwere retrospective case series that relied upon exploratory\nstratified analyses of data to detect a relationship between\nMELD and post-transplant survival. As such, analytical\ntechniques, rather than study design, were used to control for\nconfounding. In addition, most of the studies were single\ncentered, with each site having its own process for prioritizing\npatients for transplant. Therefore, patients constituting the\ngeneral transplant population may have varied across studies.\nThus, while using pre-transplant MELD to predict post￾transplant survival in transplant candidates may be attractive,\nthere is little evidence to support it. Prospective studies\ndesigned specifically to examine this relationship are needed.\nMELD score does appear to have a greater impact on mortality\nwhen observed in combination with other known risk factors for\npost-transplant mortality, including sub-optimal livers, low graft￾to-body ratio and presence of Hepatitis C. Further research in\nthe area of particular patient subgroups (such as those with\nhepatitis C) may show a stronger association between MELD\nand post-transplant outcome.\nBased on the studies conducted to date, which collectively\nrepresent a low level of evidence, MELD could be correlated\nwith survival, but appears to have limited predictive ability. The\nvast majority of studies presenting concordance statistics found\nthat pre-transplant MELD score offered minimal discriminating\npower for post-transplantation survival. However, the c-statistic\nmay be of limited value in determining the predictive ability[10].\nThis is because the c-statistic is intended for diagnostic\nmodels, rather than prognostic models. The two types differ in\nthat prognostic models add the element of time. Specifically,\ndiagnostic models are designed to determine the current state\nof the patient and accurately identify an existing disease state.\nIn contrast, prognostic models are designed to estimate the\nprobability of a future state where the outcome is not yet known\nand subject to chance.\nThis review is limited by heterogeneity in key parameters of\nstudies used to date, which precluded performance of a meta￾analysis. Studies reported different comparators (in terms of\nMELD categories) and applied time-points for outcomes.\nStudies comparing standardized MELD categories would be\nbeneficial in determining whether or not there is, in fact, a\nthreshold level at which liver transplantation does not offer\nsufficient survival to warrant the use of scarce donor livers. A\nmore accurate assessment of post-transplant survival would\nalso need to look at other factors, such as quality of life.\nResearch examining the combinations of patient factors using\nmore appropriate statistical techniques may also be valuable in\nimproving the predictive ability of pre-transplant elements on\npost-transplant outcome.\nConclusions\nThis study provides a comprehensive review of recent\narticles examining the relationship between pre-operative\nMELDS score and post-transplantation survival. Based on the\nresults of studies conducted to date, it appears that the use of\nMELD does not serve as a reliable predictor of post￾transplantation survival. This may be a reflection of a reliance\non less than ideal analytical measures. However, the use of\npre-transplant characteristics may always fall short of ensuring\noptimal organ allocation due to variability in immeasurable\nDoes MELD Predict Post-Transplant Survival?\nPLOS ONE | www.plosone.org 4 December 2013 | Volume 8 | Issue 12 | e80661\n\npatient factors and the complexity of perioperative and\npostoperative conditions.\nSupporting Information\nFile S1. Table A in File S1. Literature Search. Table B in File\nS1. Excluded Studies. Table C in File S1. Description of\nIncluded Studies\n(DOC)\nChecklist S1. Prisma checklist.\n(DOC)\nAcknowledgements\nThe authors would like to thank Leigh-Ann Topfer for\nassistance with the literature search, Mohamed El Shayeb for\nassistance with manuscript selection, and Andrea Dunn for\nassistance with data extraction.\nAuthor Contributions\nConceived and designed the experiments: KK TS DM.\nPerformed the experiments: KK TS. Analyzed the data: KK TS.\nContributed reagents/materials/analysis tools: N/A. Wrote the\nmanuscript: KK TS.\nReferences\n1. Malinchoc M, Kamath PS, Gordon FD, Peine CJ, Rank J et al. (2000) A\nmodel to predict poor survival in patients undergoing transjugular\nintrahepatic portosystemic shunts. Hepatology31(4): 864-871. doi:\n10.1053/he.2000.5852. PubMed: 10733541.\n2. Cholongitas E, Marelli L, Shusang V, Senzolo M, Rolles K et al. (2006)\nA systematic review of the performance of the model for end-stage liver\ndisease (MELD) in the setting of liver transplantation. Liver Transpl\n12(7): 1049-1061. doi:10.1002/lt.20824. PubMed: 16799946.\n3. Oxford Centre for; Evidence-based Medicine levels of evidence. Oxford\n(UK). Oxford: Centre for Evidence-Based Medicine (2011)..\n4. Cywinski JB, Mascha EJ, You J, Sessler DI, Kapural L et al. ( Feb\n172011) Pre-transplant MELD and sodium MELD scores are poor\npredictors of graft failure and mortality after liver transplantation.\nHepatol Int Feb 17. PubMed: 21484127.\n5. Freeman RB, Harper A, Edwards EB (2005) Excellent liver transplant\nsurvival rates under the MELD/PELD system. Transplant Proc 37(2):\n585-588. doi:10.1016/j.transproceed.2004.12.099. PubMed: 15848465.\n6. Rana A, Hardy MA, Halazun KJ, Woodland DC, Ratner LE et al. (2008)\nSurvival Outcomes Following Liver Transplantation (SOFT) score: A\nnovel method to predict patient survival following liver transplantation.\nAm J Transplant 8(12): 2537-2546. doi:10.1111/j.\n1600-6143.2008.02400.x. PubMed: 18945283.\n7. Yoo HY, Thuluvath PJ (2005) Short-term postliver transplant survival\nafter the introduction of MELD scores for organ allocation in the United\nStates. Liver Int 25(3): 536-541. doi:10.1111/j.\n1478-3231.2005.01011.x. PubMed: 15910490.\n8. Weismüller TJ, Fikatas P, Schmidt J, Barreiros AP, Otto G et al. (2011)\nMulticentric evaluation of model for end-stage liver disease-based\nallocation and survival after liver transplantation in Germany--limitations\nof the 'sickest first'-concept. Transpl Int 24(1): 91-99. doi:10.1111/j.\n1432-2277.2010.01161.x. PubMed: 20819196.\n9. Guo Z, He X, Wu L, Ju W, Hu A et al. (2010) Model for end-stage liver\ndisease versus the Child-Pugh score in predicting the post-transplant 3-\nmonth and 1-year mortality in a cohort of Chinese recipients. Surg\nToday 40(1): 38-45. doi:10.1007/s00595-009-4114-6. PubMed:\n20037838.\n10. Cook NR (2008) Statistical evaluation of prognositc versus diagnostic\nmodels: beyond the ROC curve. Clin Chem 54(1): 17-23. PubMed:\n18024533.\nDoes MELD Predict Post-Transplant Survival?\nPLOS ONE | www.plosone.org 5 December 2013 | Volume 8 | Issue 12 | e80661\n\n"], "response": "This systematic review aimed to evaluate the association and predictive value of pre-transplant Model for End-Stage Liver Disease (MELD) score on post-transplantation patient survival through a comprehensive, protocol-driven systematic review of studies published since 2005. The review included 37 studies, mostly retrospective case series, with varying definitions of MELD categories and follow-up times. While 15 studies found no association between pre-transplant MELD score and post-transplant survival, 22 reported poorer survival with higher MELD. However, the vast majority of studies presented concordance statistics finding that pre-transplant MELD score offered minimal discriminating power for post-transplantation survival. The review suggests that MELD may have a greater impact on mortality when observed in combination with other known risk factors for post-transplant mortality. Overall, the review indicates that MELD may have limited predictive ability for post-transplantation survival, and further research is needed to improve its accuracy. The review highlights the need for studies reporting standardized MELD categories to determine if there is indeed a threshold level at which liver transplantation does not offer sufficient survival to warrant the use of scarce donor livers. Additionally, the review suggests that more accurate assessments of post-transplant survival would require looking at other factors, such as quality of life, and that research examining the combinations of patient factors using more appropriate statistical techniques may improve the predictive ability of pre-transplant elements on post-transplant outcome. Due to heterogeneity in key parameters of studies used to date, a meta-analysis was deemed inappropriate."}
{"user_input": "What is the impact of macro/microsteatosis on post-transplant graft survival taking into account donor and other factors?", "retrieved_contexts": ["Commentaries\n1800 The Journal of Clinical Investigation      http://www.jci.org      Volume 120      Number 6      June 2010\nEarly tumor dissemination, but late metastasis: \ninsights into tumor dormancy\nMartin Röcken\nDepartment of Dermatology, Eberhard Karls University, Tübingen, Germany.\nThe classical model of metastasis is that tumor cell dissemination occurs\nlate in tumor development, after the primary tumor has grown, and that\nonly then will tumor cells invade the local tissue, enter the blood or lym￾phatic vessels, and colonize new sites to cause metastases. However, evidence\nincreasingly indicates that single tumor cells spread to distant sites much\nearlier than previously believed.In this issue ofthe JCI, Eyles and colleagues\nprovide new insight into the mechanisms underlying early tumor cell dis￾semination,formation of metastases, and tumor immunosurveillance using\ntransgenic mice that spontaneously develop melanomas of the uvea. The\nauthors provide striking evidence that tumor cells start to disseminate dur￾ing the initial steps of tumor development, that late appearing metastases\narise from these early disseminated tumor cells, and thatCD8+ T cells inhibit\nthe growth of disseminated tumor cells, surprisingly, not by cytotoxic effects,\nbut through cytostatic effects.\nBasic aspects of tumor \nimmunosurveillance\nThe original concept of tumor immuno￾surveillance, as stated several decades ago\nby F.M. Burnet and T.R. Prehn (1, 2), pos￾tulated that most malignant tumors that\narise are eliminated via lymphocyte-medi￾ated responses before they become clinical￾ly detectable. Having been abandoned for\ndecades, the concept of tumor immuno￾surveillance has been rekindled by various\nobservations, but its importance remains\nhighly debated. One important contribu￾tion to the debate was the description of\nspecific tumor-associated antigens (3),\nbecause they are a prerequisite to the argu￾ment in favor of tumor-specific immuno￾surveillance. Subsequently, many data have\nrevealed that slowly developing, endog￾enoustumors evade the immune system by\nvarious mechanisms. For example, malig￾nant cell clones can compromise multiple\nimmune functions, including immune\ncell recognition of the tumor and immune\ncell–mediated killing of tumor cells (4–7).\nHowever, in early phases, tumors rarely\ncause harm and are often either ignored\nby the immune system or induce specific\ntolerance (6, 7). To date, the question of\nwhether the immune system can specifi￾cally recognize and control endogenously\ndeveloping tumorsremains widely debated\n(4, 7–9). In this issue of the JCI, Eyles and\ncolleagues provide evidence in a mouse\nmodel of melanoma that tumor immuno￾surveillance not only controls the growth\nof primary malignant tumors, but also\nkeeps metastatic outgrowth in check (10).\nMetastasis: a classical multistep \nprocess, or early dissemination \nof tumor cells?\nThe risk of metastases increases with the\nthickness of a primary tumor. Therefore,\ncurrent tumor biology concepts mainly\npostulate that tumor cell dissemination\noccurs late in tumor development and fol￾lows a classic multistep process (Figure\n1A). First, the primary tumor grows; sec￾ond, tumor cellsinvade the local tissue and\nenter the blood or lymphatic vessels; third,\ntumor cells colonize new sites to cause\nmetastases. Yet increasing amounts of clin￾ical data have revealed that single tumor\ncells spread to distant sites much earlier\nthan previously believed. For example, sin￾gle disseminated tumor cells can be found\nin the lymph nodes or bone marrow of\nhealthy women with a history of early-stage\nbreast cancer that have no clinical evidence\nof metastasis or tumor recurrence (11, 12).\nWomen with such dormant cancer cellslive\nwith an increased risk of sudden metasta￾ses, which may occur more than a decade\nafter primary tumor surgery. Similarly,\nsingle melanoma cells can be found in the\nlymph nodes of patients with thin melano￾mas;these single dormanttumor cellsseem\nto be of prognostic relevance, as patients\ncan develop metastases after more than 10\nyears (13). Nonetheless, more than 90% of\nthese patients remain without metastasis\nfor at least 10 years after surgery.\nThe stealth of tumor cell dissemina￾tion and the extent to which disseminated\ntumor cells can remain dormant is high￾lighted by the inadvertent transmission of\nmelanoma from a patient who served as an\norgan donor following sudden brain death\nto the organ recipients(14). At 2 years after\nthe donor’s kidneys had been transplanted\ninto 2 recipients, both recipients died from\nmetastases of malignant melanoma. The\ndonor had been treated for malignant mel￾anoma 16 years prior to his death, but was\nfree of secondary disease and detectable\nmetastases at the time he died. Thus, even\nthough free of clinical disease, the organ\ndonor had transferred melanoma cells with\nthe graft to the recipients, who rapidly died\nfrom metastasizing melanoma under the\nconditions of transplantation and trans￾plant-associated immunosuppression.\nInsights into the early spread \nof single tumor cells from \nthe leading edge of melanoma\nTransplanted tumor models in rodents are\noften used to study metastasis; however,\nthese models often fail to recapitulate the\nlatency between tumor cell dissemination\nand metastatic outgrowth in humans. Eyles\net al. sought to overcome this issue — in\norder to determine more precisely the role\nof disseminated tumor cellsin the growth of\nmetastases and the mechanisms underlying\ndormancy — using the RET.AAD spontane￾ousmousemodel ofmelanoma,inwhichthe\nhuman RET oncogene is expressed by mela￾nocytes, leading to their oncogenic transfor￾mation (10). They found thatthe firstsingle\ntumor cells tended to spread very early dur￾ing oncogenesis, less than 3 weeks after the\nclinical onset of the primary tumor. At this\ntime,the tumorsshowed no histological evi￾Conflict of interest: The author has declared that no\nconflict of interest exists.\nCitation for this article: J Clin Invest. 2010;\n120(6):1800–1803. doi:10.1172/JCI43424.\n\ncommentaries\nThe Journal of Clinical Investigation      http://www.jci.org      Volume 120      Number 6      June 2010 1801\ndence for invasion of small vessels. Detect￾able metastases became apparent much\nlater in life, up to 1.5 years, which suggests\nthat disseminated tumor cells remained\ndormant for long periods during the life\nof the mice (10). To determine whether the\nmetastaseswere really derived from the early\nspreading tumor cells, or whether they fol￾lowed a classical multistep progression, the\nauthors compared the genomes of primary\ntumors with those of late metastases. Asthe\nlate metastases bore a genetic profile similar\nto that of the primary tumor, and profiles\nwere specific for each individual mouse, it\nseems that the metastases arose from the\nearly disseminated tumor cells (10). Thus,\nboth the early spread of single tumor cells\nand the latency between tumor cell dissemi￾nation and metastatic outgrowth observed\nin humans were modeled in RET.AAD mice\n(Figure 1B).\nEarly tumor cell dissemination reminis￾cent of the events in human metastasis\nhas also been analyzed by Husemann et al.\n(15) in 2 distinct transgenic mouse strains\nthat model breast cancer. Although these\nauthors did not study the latency between\ntumor cell dissemination and metastatic\noutgrowth, they did show that, upon adop￾tive transfer, disseminated tumor cells are\ncapable of homing to the bone marrow\nand causing metastases. It is interesting to\nnote that in these breast cancer models, the\ntumor cells tended to spread to the bone\nmarrow and the lung, whereas in the spon￾taneous melanoma model used by Eyles et\nal., cells spread more diffusely (10). Impor￾tantly, in both studies, apparent meta￾static cells bore the genetic signature of\nearly tumor development (10, 15), further\nunderlining that tumor cell dissemination\nis an early event. The data discussed here\nindicate that tumor cells disseminate to\nFigure 1\nModels of metastasis. (A) Classical multi￾step model of metastasis. Here, tumor cells \nnormally arise from late, vessel-infiltrating \ncancers. It is believed that spreading tumor \ncells either fail to enter target organs or are \ncontrolled by cytotoxic effects (lysis or apop￾tosis). (B) Model of metastasis as suggested \nby Eyles et al. (10). Single tumor cells start \nto spread much earlier than expected and \nform single-cell metastases. Such single-cell \nmetastases remain dormant for long periods \nof time, also through cytostatic signals that \nreduce tumor cell proliferation. In the absence \nof such cytostatic signals, metastases start to \ngrow rapidly.\n\ncommentaries\n1802 The Journal of Clinical Investigation      http://www.jci.org      Volume 120      Number 6      June 2010\ndistant sites early during primary tumor\ndevelopment, but do not cause metastasis\n(Figure 1B). Understanding why these dis￾seminated tumor cells fail to cause early\nmetastasis and what events are responsible\nfor tumor dormancy are key to determin￾ing whether new therapeutic interventions\ncan be developed for the human situation.\nEvidence for immune-mediated \ntumor dormancy in the absence \nof tumor cell killing\nTo uncover potential mechanisms oftumor\ndormancy, Eyles et al. depleted CD8+ T cells\nin RET.AAD mice (10). This T cell depletion\nmarkedly increased the risk of overt metas￾tases, directly showing a critical role for\nT cell–dependent tumor immunosurveil￾lance in the early metastatic stage of this\nmelanoma model. The current view of T\ncell–mediated tumor immunosurveillance\nis that CD8+ T cells control tumor cells\nthrough classic death-inducing mecha￾nisms (5, 9, 10). Although CD8+ T cell\ndepletion was the method used by Eyles et\nal. to uncover a role for T cell–dependent\ntumor immunosurveillance in keeping\ndisseminated tumor cells from forming\nmetastases, the authors present an addi￾tional, surprising piece of data contradict￾ing this classic hypothesis: In the presence\nof CD8+ T cells, the number of Ki67+ tumor\ncells is low, whereas the number of Ki67+\ntumor cells is high in the absence of CD8+\nT cells. As expression of Ki67 is associated\nwith cell proliferation and cell cycle pro￾gression, these data strongly argue that,\nbesides the known cytotoxic effects, a\ncytostatic mode of tumor silencing may be\nkeeping the disseminated tumor cellsfrom\nforming metastases (Figure 1B).\nMüller-Hermelink et al. recently showed\nthat immune-mediated arrest of endog￾enous tumor development is associated\nwith a substantial reduction in tumor cell\nproliferation (16). Using BrdU incorpora￾tion, apoptosis assays, and CD8+ T cell\ndepletion, they found that CD4+ Th1 cells\ncould induce a state of tumor dormancy by\nreducing tumor cell proliferation and cell\ncycle progression through strictly IFN-γ–\nand TNF-dependent signals. Arresting\ntumor growth required neither detectable\nsigns of tumor cell killing nor apoptosis.\nThisisinlinewithotherrecentreportsshow￾ing that T cell immunity can induce tumor\ndormancy with little or no signs of either\ntumor cell killing or apoptosis (17–19).\nIn all of these reports, tumor dormancy\nrequired IFN-γ– or TNF-mediated signal￾ing. Interestingly, thisisin accordance with\nan increasing number ofstudiesin humans\nshowing that immunotherapy with type I\nIFNs or vaccine strategiesthatinduce type II\nIFN–producing Th1 immune responses\nare needed to inhibit tumor progression\nand prolong overall survival (7, 9, 20, 21).\nThe importance of both type I and type II\nIFNs has been extensively studied in experi￾mental mice (9) and is underlined by sur￾prising data from humans as well as from\nexperimental animals: in the absence of\nIFNs or Th1 cells, tumor immunity not\nonly fails to protect against tumors, but\ncan even promote tumor progression (16,\n19, 20). That said, it will be important to\nuncoverthe mechanisms underlying tumor\ndormancy elicited by type I or type II IFNs;\nit has been proposed that antiangiogenic\neffects might contribute, as some tumor\ncells may not express appropriate IFN\nreceptors. Yet, in a number of clinical trials,\nantiangiogenic therapies were less efficient\nthan hoped, and some tumors may even\ndevelop a more aggressive phenotype in the\npresence of antiangiogenic drugs (22). It is\ntherefore unlikely that the tumor-protec￾tive effects of IFNs can be reduced to their\nantiangiogenic effects.\nCan inhibition of cell cycle \nprogression cause tumor dormancy?\nToday it is known that disseminated single\ntumor cells rarely cause metastases, and if\nthey do, it is frequently many years after\nthey reached their distant site. However,\nthe mechanisms underlying tumor dor￾mancy remain a major mystery. Müller￾Hermelink et al. (16) and Eyles et al. (10)\nindependently found that tumorimmuno￾surveillance correlated with a substantial\nreduction in either BrdU+ or Ki67+ tumor\ncells, key findings characteristic of inhibi￾tion of cell proliferation and cell cycle pro￾gression, and that tumor-specific T cells\nprevented tumor growth in the absence\nof histological evidence for major tumor\ncell killing or apoptosis. It is therefore dif￾ficult to imagine that the immune system\ncontrols disseminated tumor cells only\nby mechanisms of direct killing; rather,\nit is likely that immunosurveillance also\ninduces tumor dormancy through other\nmechanisms that are still poorly inves￾tigated. IFNs and TNF both are not only\ninvolved in killing and apoptosis; they\nhave pleiotropic effects on the metabolism\nof somatic cells through the control of\nsignaling cascades that regulate cell prolif￾eration and cell cycle progression and the\ncontrol of signaling molecules that influ￾ence cell differentiation and the process\nof transformation (9, 10, 16). Therefore,\nimmunosurveillance may indeed induce\ndormancy in single, disseminated tumor\ncells by arresting their cell cycle through\ncytokine-mediated signals. This would\nalso explain why late metastases mightstill\nbear the genetic signature of early dissemi￾nated tumor cells (10, 15).\nPerspectives\nThese insights, arising from a number of\nobservations in mice and humans, reveal\nthat the classical immunological con￾cept of tumor eradication by tumor cell\nkilling should be abandoned. They raise\nimportant questions that should affect\nthe design of future immune therapies.\nIf single tumor cells emigrate early, why\ndo overt metastases appear only at later\ntumor stages? Is this a question of quan￾tity, or are there specific signals? How does\nthe immune system controlsingle, dissem￾inated tumor cells and micrometastasis\nand establish tumor dormancy, and what\nawakens disseminated tumor cells and\nmakes them grow into metastases?\nAcknowledgments\nIthank H. Braumüller, T. Wieder, K. Ghore￾schi, and G. Riethmüller for helpful discus￾sions and critically reading the manuscript.\nThe author wassupported by SFB 685, Wil￾helm Sander Foundation (2005.043.2), and\nDeutsche Krebshilfe (no. 109037).\nAddress correspondence to: Martin Röck￾en, Department of Dermatology, Eber￾hard Karls University, Liebermeisterstr.\n25, 72076 Tübingen, Germany. Phone:\n49.7071.2984556; Fax: 49.7071.295450;\nE-mail: mrocken@med.uni-tuebingen.de.\n1. Burnet FM. The concept of immunologicalsurveil￾lance. Prog Exp Tumor Res. 1970;13:1–27.\n2. Prehn RT. Immunosurveillance, regeneration and\noncogenesis. Prog Exp Tumor Res. 1971;14:1–24.\n3. Knuth A, Wolfel T, Klehmann E, Boon T, Meyer\nzum Buschenfelde KH. Cytolytic T-cell clones\nagainst an autologous human melanoma: speci￾ficity study and definition of three antigens by\nimmunoselection. Proc Natl Acad Sci U S A. 1989;\n86(8):2804–2808.\n4. Qin Z, Blankenstein T. A cancer immunosurveil￾lance controversy. Nat Immunol. 2004;5(1):3–4.\n5. Mocikat R, et al. Natural killer cells activated by\nMHC class I(low) targets prime dendritic cells to\ninduce protective CD8 T cell responses. Immunity.\n2003;19(4):561–569.\n6. Willimsky G, Blankenstein T. Sporadic immuno￾genic tumours avoid destruction by inducing T-cell\ntolerance. Nature. 2005;437(7055):141–146.\n7. Finn OJ. Cancer immunology. N Engl J Med. 2008;\n358(25):2704–2715.\n\ncommentaries\nThe Journal of Clinical Investigation      http://www.jci.org      Volume 120      Number 6      June 2010 1803\n8. Shankaran V, et al. IFNgamma and lympho￾cytes prevent primary tumour development and\nshape tumour immunogenicity. Nature. 2001;\n410(6832):1107–1111.\n9. Dunn GP, Koebel CM, Schreiber RD. Interferons,\nimmunity and cancer immunoediting. Nat Rev \nImmunol. 2006;6(11):836–848.\n10. Eyles J, et al. Tumor cells disseminate early, but\nimmunosurveillance limits metastatic outgrowth,\nin a mouse model of melanoma. J Clin Invest.\n2010;120(6):2030–2039.\n11. Pantel K, Alix-Panabières C, Riethdorf S. Can￾cer micrometastases. Nat Rev Clin Oncol. 2009;\n6(6):339–351.\n12. Riethmuller G, Klein CA. Early cancer cell dis￾semination and late metastatic relapse: clinical\nreflections and biological approaches to the dor￾mancy problem in patients. Semin Cancer Biol. 2001;\n11(4):307–311.\n13. Ulmer A, et al. Detection of melanoma cells dis￾playing multiple genomic changes in histopatho￾logically negative sentinel lymph nodes. Clin Cancer \nRes. 2005;11(15):5425–5432.\n14. MacKie RM, Reid R, Junor B. Fatal melanoma\ntransferred in a donated kidney 16 years after mela￾noma surgery. N Engl J Med. 2003;348(6):567–568.\n15. Husemann Y, et al. Systemic spread is an early step\nin breast cancer. Cancer Cell. 2008;13(1):58–68.\n16. Muller-Hermelink N, et al. TNFR1 signaling and\nIFN-gamma signaling determine whether T cells\ninduce tumor dormancy or promote multistage\ncarcinogenesis. Cancer Cell. 2008;13(6):507–518.\n17. Koebel CM, et al. Adaptive immunity maintains\noccult cancer in an equilibrium state. Nature.\n2007;450(7171):903–907.\n18. Zhang B, Karrison T, Rowley DA, Schreiber H. IFN￾gamma- and TNF-dependent bystander eradica￾tion of antigen-loss variants in established mouse\ncancers. J Clin Invest. 2008;118(4):1398–1404.\n19. Ziegler A, et al. EpCAM, a human tumor-associated\nantigen promotes Th2 development and tumor\nimmune evasion. Blood. 2009;113(15):3494–3502.\n20. Schadendorf D, et al. Dacarbazine (DTIC) versus\nvaccination with autologous peptide-pulsed den￾dritic cells (DC) in first-line treatment of patients\nwith metastatic melanoma: a randomized phase\nIII trial of the DC study group of the DeCOG. Ann \nOncol. 2006;17(4):563–570.\n21. Hauschild A, et al. Efficacy of low-dose interferon\n{alpha}2a 18 versus 60 months of treatment in\npatients with primary melanoma of > = 1.5 mm\ntumor thickness: results of a randomized phase III\nDeCOG trial. J Clin Oncol. 2010;28(5):841–846.\n22. Loges S, Mazzone M, Hohensinner P, Carme￾liet P. Silencing or fueling metastasis with VEGF\ninhibitors: antiangiogenesis revisited. Cancer Cell.\n2009;15(3):167–170.\nGazing into a crystal ball \nto predict kidney transplant outcome\nBernd Schröppel1 and Peter S. Heeger2\n1Mount Sinai School of Medicine, New York, New York, USA. 2Recanati Miller Transplantation Institute, New York, New York, USA.\nKidney transplantation is the optimal therapy for end-stage kidney disease\nbut requires lifelong immunosuppression. Despite improvements in immu￾nosuppression regimens that have reduced rates of acute transplant rejec￾tion, long-term allograft survival remains suboptimal. More than 50% of\ntransplanted kidneys from deceased donors fail within 10 years. In order to\nimprove long-term outcomes, physicians need to better understand mecha￾nisms underlying transplant rejection and tolerance in humans. They also\nneed biomarkers that differentiate patients likely to maintain excellent and\nstable allograft function from recipients at risk of losing their transplants.\nBy studying kidney transplant recipients at high risk for graft loss and rare,\nspontaneously tolerant kidney transplant recipients, researchers reporting\nin 3 papers in this issue of the JCI shed new light on these topics.\nLate graft failure after kidney \ntransplantation\nKidney transplantation is the most com￾mon solid organ transplant procedure car￾ried out in the US; more than 16,000 such\ntransplants were performed in 2009 (1).\nAdvances in immunosuppression over the\npast 2 decades have drastically reduced the\nincidence of acute T cell–mediated rejec￾tion episodes, but have not significantly\nimproved long-term allograft survival\n(2). The actual half-life for a transplanted\nkidney from a deceased donor (the most\ncommon source of kidneys for transplan￾tation) is only 8 years (2), and as few as\none-third of kidney allografts obtained\nfrom older donors remain function￾ing 10 years later (3). Allograft dysfunc￾tion can result in the need for a further\ntransplant and is a strong independent\npredictor of recipient cardiovascular\nmortality (4). Late graft loss is commonly\ncaused by chronic allograft nephropa￾thy, characterized by tissue fibrosis and\ntubular atrophy (5). Among the factors\nknown to contribute to its pathogenesis\nare uncontrolled alloimmune reactivity\n(T cell– and/or antibody-mediated injury),\nrecurrent primary renal disease, hyper￾tension, diabetes, and drug toxicity. With\nregard to the latter, kidney toxicity as a\nresult of long-term treatment with the\nimmunosuppressive agents tacrolimus or\ncyclosporine is detectable in virtually all\ntransplanted kidneys (6).\nAlthough research progress hasimproved\nour knowledge of the prevalence, clinical\nsignificance, and pathogenesis of chron￾ic kidney allograft injury, research has\nnot yet influenced therapeutic decision\nmaking to improve outcomes. Currently,\nposttransplant care, including immuno￾suppression, is protocol driven. Altera￾tions in drug dosing are made based on\ncenter-derived protocols and physician\nexperience. Because chronic injury is mul￾tifactorial, a one-size-fits-all approach\nis not ideal. To develop individual thera￾peutic approaches tailored to individual\npatients, transplant physicians need risk\nassessment tools that can discriminate\nspecific pathogenic mechanisms, prospec￾tively identify those transplant recipients\ndestined to have excellent graft function,\nrecognize those recipients at high risk for\ngraft loss, and ultimately guide specific\nchanges in therapy. In this issue of the JCI,\n3 papers provide new data that move us\ncloser to these goals (7–9).\nAn intragraft molecular signature \ncan predict graft loss\nTo assess the risk of future graft loss,\nEinecke and colleagues (7) evaluated gene\nexpression profiles in tissue from 105 kid￾ney graft biopsies that were performed to\ndetermine the cause of allograft dysfunc￾tion and/or proteinuria using microarray\nConflict of interest: The authors have declared that no\nconflict of interest exists.\nCitation for this article: J Clin Invest. 2010;\n120(6):1803–1806. doi:10.1172/JCI43286.\n\n"], "response": "The article discusses recent studies that aim to improve understanding of mechanisms underlying transplant rejection and tolerance in humans, with the goal of improving long-term outcomes for kidney transplant patients. Three papers published in the same issue of the journal address the topic, focusing on late graft failure, the identification of patients at high risk for graft loss, and the prediction of graft loss based on intragraft molecular signatures. The studies suggest that chronic allograft injury is multifactorial and that personalized therapeutic approaches tailored to individual patients are necessary. The articles highlight the need for risk assessment tools that can distinguish specific pathogenic mechanisms, identify patients at high risk for graft loss, and guide specific changes in therapy. Overall, the studies provide new data that bring researchers closer to developing individualized approaches to improve outcomes for kidney transplant patients."}
