{"user_input": "How has machine perfusion changed risk thresholds associated with steatotic donor livers?", "retrieved_contexts": ["Jia et al. Machine Perfusion: Future Preservation Method\nConclusions: Machine perfusion is superior to CS on improving short-term outcomes\nfor human liver transplantation, with a less clear effect in the longer term. Hypothermic\nmachine perfusion but not NMP conducted significantly protective effects on EAD\nand biliary complications. Further RCTs are warranted to confirm MP’s superiority\nand applications.\nKeywords: machine perfusion, static cold storage, graft preservation, liver transplantation, meta-analysis\nINTRODUCTION\nLiver transplantation (LT) has been the optimal treatment\nfor patients with end-stage liver disease. Rapidly increasing\ndemands for LT have also caused severe shortage of donor liver\norgans in clinical application. To overcome this discrepancy,\ndonation after circulatory death (DCD), extended criteria donors\n(ECDs), living liver donation, or marginal liver grafts are\nincreasingly accepted to expand the limited donor pool. However,\nstudies have suggested that these additional liver donation\nsources often suffered from longer warm ischemic periods and\nworse ischemia–reperfusion injury (IRI) during LT, resulting\nin increased risk of early allograft dysfunction (EAD), primary\nnonfunction (PNF), biliary complications, and poorer long-term\ngraft and patient survival (1).\nDuring transplantation, the quality of donor liver preservation\nis an important factor on maintaining and improving transplant\noutcomes of patients. Standard static cold storage (CS)\nremains the gold standard method for liver graft preservation.\nNevertheless, the effectiveness of CS preservation is currently\nunable to provide sufficient protection of liver grafts against IRI,\nespecially for prolonged CS of DCD and marginal livers, often\nresulting in increased risk of EAD, PNF, and biliary complications\n(2). As an alternative preservation strategy, machine perfusion\n(MP) can provide a continuous circulation of metabolic\nsubstrates and antioxidants, imitating the physiological processes\nwhile flushing inflammatory cytokine and toxins from the graft.\nTherefore, MP has been proposed as a better strategy to protect or\nrescue marginal liver grafts by attenuating the cytokine mediated\nIRI (3).\nMachine perfusion has been widely used for preservation\nin kidney transplantation. Plenty of evidence suggested MP’s\npriority in improving early graft function, reducing the risk of\ndelayed graft function (DGF), and enhancing ECD graft survival\nafter renal transplantation (4). Unlike kidney transplantation,\nMP remained relatively limited in clinical LTs due to the high\nmetabolism rates of liver, relatively complicated perfusion system\nAbbreviations: AST, aspartate aminotransferase; ALT, alanine transaminase; CI,\nconfidence interval; CS, cold storage; DBD, deceased brain donor; DCD, donor\nafter cardiac death; EAD, early allograft dysfunction; ECD, extended criteria\ndonors; HAT, hepatic artery thrombosis; HMP, hypothermic machine perfusion;\nHOPE, hypothermic oxygenated perfusion; IRI, ischemia–reperfusion injury; IC,\nischemic cholangiopathy; LT, liver transplantation; MP, machine perfusion; MELD,\nmodel for end-stage liver disease; NOS, Newcastle–Ottawa Quality Assessment\nScale; NMP, normothermic machine perfusion; OR:odds ratio; PNF, primary\nnonfunction; PRISMA, Preferred Reporting Items for Systemic Reviews and Meta￾Analysis.\nconsisting of hepatic and portal route, poor practicality, and\nhigh costs.\nLarge animal and human experimental studies have suggested\nthat MP may provide better protection of liver grafts against\nIRI than CS (5, 6). Expression of proinflammatory cytokines,\noxidation markers, and activation of adhesion molecules and\nmigration of leukocytes were significantly reduced by MP (7).\nRecently, two systematic review and meta-analyses concluded\nthat MP preservation is superior to CS in experimental rat and\npig models in terms of reducing hepatocellular injury [lower\naspartate aminotransferase (AST), alanine transaminase (ALT),", "RESEARCH ARTICLE\nImprovement of steatotic rat liver function\nwith a defatting cocktail during ex situ\nnormothermic machine perfusion is not\ndirectly related to liver fat content\nSiavash RaiganiID1,2,3, Cailah Carroll2,3, Stephanie Griffith2,3, Casie Pendexter2,3,\nIvy Rosales4\n, Hany Deirawan5\n, Rafic Beydoun5\n, Martin Yarmush2,3,6, Korkut Uygun1,2,3,\nHeidi Yeh1,2*\n1 Division of Transplant Surgery, Massachusetts General Hospital, Harvard Medical School, Boston,\nMassachusetts, United States of America, 2 Center for Engineering in Medicine, Massachusetts General\nHospital, Harvard Medical School, Boston, Massachusetts, United States of America, 3 Shriners Hospital for\nChildren, Boston, Massachusetts, United States of America, 4 Department of Pathology, Massachusetts\nGeneral Hospital, Boston, Massachusetts, United States of America, 5 Department of Pathology, Wayne\nState University School of Medicine, Detroit, Michigan, United States of America, 6 Department of Biomedical\nEngineering, Rutgers University, Piscataway, New Jersey, United States of America\n* hyeh@partners.org\nAbstract\nThere is a significant organ shortage in the field of liver transplantation, partly due to a high\ndiscard rate of steatotic livers from donors. These organs are known to function poorly if\ntransplanted but make up a significant portion of the available pool of donated livers. This\nstudy demonstrates the ability to improve the function of steatotic rat livers using a combina￾tion of ex situ machine perfusion and a “defatting” drug cocktail. After 6 hours of perfusion,\ndefatted livers demonstrated lower perfusate lactate levels and improved bile quality as\ndemonstrated by higher bile bicarbonate and lower bile lactate. Furthermore, defatting was\nassociated with decreased gene expression of pro-inflammatory cytokines and increased\nexpression of enzymes involved in mitochondrial fatty acid oxidation. Rehabilitation of mar￾ginal or discarded steatotic livers using machine perfusion and tailored drug therapy can sig￾nificantly increase the supply of donor livers for transplantation.\nIntroduction\nLiver transplantation remains the only cure for end-stage liver disease. However, there contin￾ues to be a significant organ shortage with approximately 14, 000 patients on the waitlist and\n8,000 liver transplants performed annually [1]. Central to the donor organ shortage is the high\ndiscard rate of procured or potentially procurable organs, with nearly 3,000 livers discarded\nper year [2]. As a result of the obesity epidemic in the United States and Europe, nearly half of\nprocured livers are discarded due to excessive macrosteatosis related to non-alcoholic fatty\nliver disease (NAFLD) [3].\nPLOS ONE\nPLOS ONE | https://doi.org/10.1371/journal.pone.0232886 May 12, 2020 1 / 19\na1111111111\na1111111111\na1111111111\na1111111111\na1111111111\nOPEN ACCESS\nCitation: Raigani S, Carroll C, Griffith S, Pendexter\nC, Rosales I, Deirawan H, et al. (2020)\nImprovement of steatotic rat liver function with a\ndefatting cocktail during ex situ normothermic\nmachine perfusion is not directly related to liver fat\ncontent. PLoS ONE 15(5): e0232886. https://doi.\norg/10.1371/journal.pone.0232886\nEditor: Pavel Strnad, Medizinische Fakultat der\nRWTH Aachen, GERMANY\nReceived: September 24, 2019\nAccepted: April 23, 2020\nPublished: May 12, 2020\nCopyright: © 2020 Raigani et al. This is an open\naccess article distributed under the terms of the\nCreative Commons Attribution License, which\npermits unrestricted use, distribution, and\nreproduction in any medium, provided the original\nauthor and source are credited.\nData Availability Statement: All relevant data are\nwithin the manuscript and its Supporting\nInformation files.\nFunding: MY, KU, and HY received funding from\nthe US National Institutes of Health (grants\nR01DK096075, R01DK107875, R21EB020819,\nR01DK084053 and R01DK114506). The funders\nhad no role in study design, data collection,\nanalysis, or manuscript preparation.", "Steatotic livers are particularly prone to ischemia-reperfusion injury (IRI)[4]. As a result,\ntransplantation of livers with moderate (30–60%) or severe (>60%) macrosteatosis is associ￾ated with increased early allograft dysfunction (EAD) or primary non-function, and decreased\nlong-term graft survival [5, 6]. Further contributing to IRI is acute-on-chronic oxidative stress,\ncompromised hepatic microcirculation, and an inability to recover from an energy-depleted\nstate [7–10].\nThe application of ex situ machine perfusion technology to liver resuscitation and rehabili￾tation has not only decreased the organ discard rate, but expanded the ability to use marginal,\nextended criteria, or even discarded livers for transplantation without compromising patient\nand graft survival [11, 12]. Using machine perfusion as a platform for targeted intervention\npaves the way for salvage of otherwise discarded organs for potential transplantation. One\napplication of this technology involves salvaging steatotic livers. Over 10 year ago, our group\nreported for the first time in the literature a combination of agents capable of “defatting” and\nreversing key biochemical deficiencies in steatotic hepatocytes in culture [13–15]. Boteon and\ncolleagues recently showed that the same cocktail decreases fat content and improves perfu￾sion parameters in discarded steatotic human livers [16]. However, the safety and utility of sev￾eral components of the cocktail have not been confirmed or have been abandoned for human\nclinical use [17]. We therefore performed a mechanistic study in a rat liver perfusion model to\nidentify pathways targeted by these agents, with the ultimate goal of replacing them with agents\ndeveloped in the interim 10 years that are safe for human clinical use.\nMethods\nPreparation of perfusate\nBaseline (plain) perfusate consisted of high-glucose Dulbecco’s Minimum Eagles’ Medium\nsupplemented with 10% v/v fetal bovine serum, 2% v/v penicillin-streptomycin, and 3% w/v\nbovine serum albumin. The original development of the defatting cocktail in vitro [13, 14] and\nits subsequent cytotoxicity testing in cell culture models [15] have been previously described.\nDefatting cocktail agents include 10 uM forskolin, 1uM GW7647, 1uM GW501516, 10 uM\nscoparone, 10 uM hypericin, 0.4 ng/ml visfatin, 0.8 mM L-carnitine, and additional amino\nacids [13, 14]. Defatting perfusate consisted of plain perfusate supplemented with defatting\ncocktail. Perfusate and cocktail component details are provided in the Supplemental Methods\nin S1 File.\nIsolated liver perfusion\nLean (Fa/fa) and obese (fa/fa) male Zucker rats (Charles River Laboratories, Wilmington, MA)\naged 12–16 weeks and group housed in pairs in a conventional room under standard condi￾tions (21ºC room temperature, 12-hour light/dark cycles, mixed paper/cellulose bedding).\nRats had free access to standard chow and autoclaved water. Animal studies were approved by\nthe institutional animal use and care committee of the Massachusetts General Hospital and\nShriners Hospital for Children and comply with the Guide for Care and Use of Laboratory Ani￾mals as outlined by the National Academy of Sciences. After induction of anesthesia with\n3–5% isoflurane, a transverse laparotomy was made. The common bile duct was partially tran￾sected, cannulated with 28-gauge PTFE tubing, and secured with 4–0 silk sutures. 0.3 mL of\n1000U/mL heparin was injected into the inferior vena cava (IVC) and after 3 minutes of circu￾lation, the hepatic artery was ligated with 7–0 silk. Next, the portal vein was cannulated with a\n16-gauge catheter, followed immediately by transection of the IVC. The liver was then flushed\nslowly with 50 mL of ice-cold 0.9% saline via the portal cannula while the rat was simulta￾neously euthanized by exsanguination under isoflurane gas anesthesia. Following cold flush,\nPLOS ONE\nImproving function of steatotic livers for transplant with defatting and machine perfusion", "preservation. Ann. Surg. 250, 1–6 (2009).\n11. Xu, H. et al. Excorporeal normothermic machine perfusion resuscitates pig DCD \nlivers with extended warm ischemia. J. Surg. Res 173, e83–e88 (2012).\n12. Eisenbach, C. et al. An early increase in gamma glutamyltranspeptidase and \nlow aspartate aminotransferase peak values are associated with superior \noutcomes after orthotopic liver transplantation. Transplant. Proc 41, 1727–1730 \n(2009).\n13. Olthoff, K. M. et al. Validation of a current definition of early allograft dysfunction \nin liver transplant recipients and analysis of risk factors. Liver Transpl 16, \n943–949 (2010).\n14. Organ Donation and Transplantation Activity Report 2016/17 (NHS Blood and \nTransplant, 2017).\n15. Angelico, R. et al. Normothermic machine perfusion of deceased donor liver \ngrafts is associated with improved postreperfusion hemodynamics. Transplant. \nDirect 2, e97 (2016).\n16. Leithead, J. A. et al. Hepatic ischemia reperfusion injury is associated with acute \nkidney injury following donation after brain death liver transplantation. Transpl. \nInt 26, 1116–1125 (2013).\n17. Jay, C. L. et al. Ischemic cholangiopathy after controlled donation after cardiac \ndeath liver transplantation: a meta-analysis. Ann. Surg. 253, 259–264 (2011).\n18. Mourad, M. M., Algarni, A., Liossis, C. & Bramhall, S. R. Aetiology and risk factors \nof ischaemic cholangiopathy after liver transplantation. World J. Gastroenterol.\n20, 6159–6169 (2014).\n19. Reddy, S. et al. Non-heart-beating donor porcine livers: the adverse effect of \ncooling. Liver Transpl. 11, 35–38 (2005).\n20. Abstracts of the 18th Congress of the European Society for Organ \nTransplantation, 24–27 September 2017, Barcelona, Spain. Transpl. Int. 30 \n(Suppl 2), 5–576 (2017).\nAcknowledgements This study was performed by the Consortium for Organ \nPreservation in Europe (COPE). We thank the European Commission for \ntheir support through the Seventh Framework Programme. The following \norganisations, groups and individuals also made substantial contributions \nwithout which this trial could not have been completed successfully: NHS Blood \nand Transplant; the Surgical Intervention Trials Unit, University of Oxford; the \nClinical Trials and Research Governance unit, University of Oxford; Centre for \nEvidence in Transplantation, Royal College of Surgeons of England; the Liver \nTransplant Coordinators, anaesthetists and liver unit physicians at the Queen \nElizabeth Hospital, Birmingham, Addenbrooke’s Hospital, Cambridge, King’s \nCollege Hospital, London, the Royal Free Hospital London, Hospital Clinic, \n3 MAY 2018 | VO L 557 | NA T U RE | 55\n© 2018 Macmillan Publishers Limited, part of Springer Nature. All rights reserved.", "16-month study period there were 185 discarded liver research offers, of which 59 (32%) were not eligible for the trial due to an incidental finding of\ncancer, macroscopically apparent cirrhosis or advanced fibrosis, severe organ damage or previous machine perfusion. There were 126 livers suitable for the\ntrial, with steatosis being the leading cause of organ discard with 78 (42%) offers. Stringent donor inclusion criteria were not met in 25 (14%) offers and on\n21 (11%) occasions the research team was already committed to the perfusion of another study liver. A liver was considered for the trial only if it could be\nallocated to a consented, potential blood group- and size-matched low-risk recipient. Many recipients were apprehensive to participate in such a high-risk\nclinical trial, and as a consequence, at any given time there were usually only one to three patients consented. A significant proportion of approached\npatients declined to take part, or were transplanted with a standard quality liver before agreeing to take part in this study. Eventually, thirty-one livers were\nenroled to the trial, of which 22 (71%) grafts met the viability criteria and were successfully transplanted. b A summary of reasons for livers being\ndiscarded in the United Kingdom between November 2016 and February 2018. A total of 64 livers were discarded for severe steatosis on visual\nassessment, with 14 discarded for severe steatosis based on urgent liver biopsy. A percentage of livers were declined due to intra-abdominal or lung\nmalignancies (e.g. colonic cancer in donor 22). This did not include primary brain tumours or small renal cell cancers which are almost always considered\nfor donation. The reasons for logistic discard, include the transplant team already being committed to one or more transplantations, lack of a suitable\nrecipient or too long an anticipated cold ischaemia time due to delays with transportation.\nNATURE COMMUNICATIONS | https://doi.org/10.1038/s41467-020-16251-3 ARTICLE\nNATURE COMMUNICATIONS | (2020) 11:2939 | https://doi.org/10.1038/s41467-020-16251-3 | www.nature.com/naturecommunications 3", "24. Boteon YL, Boteon A, Attard J, Mergental H, Mirza DF, Bhogal RH, et al. Ex situ machine perfusion as a\ntool to recondition steatotic donor livers: Troublesome features of fatty livers and the role of defatting\ntherapies. A systematic review. Am J Transplant. 2018; 18(10):2384–99. Epub 2018/06/28. https://doi.\norg/10.1111/ajt.14992 PMID: 29947472.\n25. Yeh H, Uygun K. Increasing Donor Liver Utilization Through Machine Perfusion. Hepatology. 2019; 70\n(1):431–3. Epub 2019/01/27. https://doi.org/10.1002/hep.30523 PMID: 30681724.\n26. Fukuhara A, Matsuda M, Nishizawa M, Segawa K, Tanaka M, Kishimoto K, et al. Visfatin: a protein\nsecreted by visceral fat that mimics the effects of insulin. Science. 2005; 307(5708):426–30. Epub\n2004/12/18. https://doi.org/10.1126/science.1097243 PMID: 15604363.\n27. Johannsen K, Flechtner-Mors M, Kratzer W, Koenig W, Boehm BO, Schmidberger J. Association\nBetween Visfatin and Hepatic Steatosis in the General Population During Long-Term Follow-Up. Horm\nMetab Res. 2019. Epub 2019/05/28. https://doi.org/10.1055/a-0897-8565 PMID: 31132798.\n28. Moschen AR, Gerner RR, Tilg H. Pre-B cell colony enhancing factor/NAMPT/visfatin in inflammation\nand obesity-related disorders. Curr Pharm Des. 2010; 16(17):1913–20. Epub 2010/04/08. https://doi.\norg/10.2174/138161210791208947 PMID: 20370672.\n29. Moore LB, Goodwin B, Jones SA, Wisely GB, Serabjit-Singh CJ, Willson TM, et al. St. John’s wort\ninduces hepatic drug metabolism through activation of the pregnane X receptor. Proc Natl Acad Sci U S\nA. 2000; 97(13):7500–2. Epub 2000/06/15. https://doi.org/10.1073/pnas.130155097 PMID: 10852961;\nPubMed Central PMCID: PMC16574.\n30. Tanaka N, Aoyama T, Kimura S, Gonzalez FJ. Targeting nuclear receptors for the treatment of fatty\nliver disease. Pharmacol Ther. 2017; 179:142–57. Epub 2017/05/27. https://doi.org/10.1016/j.\npharmthera.2017.05.011 PMID: 28546081; PubMed Central PMCID: PMC6659998.\n31. El-Agroudy NN, El-Naga RN, El-Razeq RA, El-Demerdash E. Forskolin, a hedgehog signalling inhibitor,\nattenuates carbon tetrachloride-induced liver fibrosis in rats. Br J Pharmacol. 2016; 173(22):3248–60.\nEpub 2016/10/21. https://doi.org/10.1111/bph.13611 PMID: 27590029; PubMed Central PMCID:\nPMC5071558.\n32. Atmaca M, Bilgin HM, Obay BD, Diken H, Kelle M, Kale E. The hepatoprotective effect of coumarin and\ncoumarin derivates on carbon tetrachloride-induced hepatic injury by antioxidative activities in rats. J\nPhysiol Biochem. 2011; 67(4):569–76. Epub 2011/06/10. https://doi.org/10.1007/s13105-011-0103-5\nPMID: 21656273.\n33. Sumida Y, Yoneda M. Current and future pharmacological therapies for NAFLD/NASH. J Gastroenterol.\n2018; 53(3):362–76. Epub 2017/12/17. https://doi.org/10.1007/s00535-017-1415-1 PMID: 29247356;\nPubMed Central PMCID: PMC5847174.\n34. Staels B, Rubenstrunk A, Noel B, Rigou G, Delataille P, Millatt LJ, et al. Hepatoprotective effects of the\ndual peroxisome proliferator-activated receptor alpha/delta agonist, GFT505, in rodent models of nonal￾coholic fatty liver disease/nonalcoholic steatohepatitis. Hepatology. 2013; 58(6):1941–52. Epub 2013/\n05/25. https://doi.org/10.1002/hep.26461 PMID: 23703580.\n35. Bojic LA, Huff MW. Peroxisome proliferator-activated receptor delta: a multifaceted metabolic player.\nCurr Opin Lipidol. 2013; 24(2):171–7. Epub 2013/03/14. https://doi.org/10.1097/MOL.\n0b013e32835cc949 PMID: 23481229.\n36. Ratziu V, Harrison SA, Francque S, Bedossa P, Lehert P, Serfaty L, et al. Elafibranor, an Agonist of the\nPeroxisome Proliferator-Activated Receptor-alpha and -delta, Induces Resolution of Nonalcoholic Stea￾tohepatitis Without Fibrosis Worsening. Gastroenterology. 2016; 150(5):1147–59 e5. Epub 2016/02/14.\nhttps://doi.org/10.1053/j.gastro.2016.01.038 PMID: 26874076.\n37. Sanyal AJ, Chalasani N, Kowdley KV, McCullough A, Diehl AM, Bass NM, et al. Pioglitazone, vitamin E,\nor placebo for nonalcoholic steatohepatitis. N Engl J Med. 2010; 362(18):1675–85. Epub 2010/04/30.", "13. Nocito A, El-Badry AM, Clavien P-A. When is steatosis too much for transplantation? Journal of hepatol￾ogy. 2006; 45(4):494–9. https://doi.org/10.1016/j.jhep.2006.07.017 PMID: 16919359\n14. Marsman H, Matsushita T, Dierkhising R, Kremers W, Rosen C, Burgart L, et al. Assessment of donor\nliver steatosis: pathologist or automated software? Human Pathology. 2004; 35(4):430–5. PMID:\n15116323\n15. Henry S, Nachber E, Tulipan J, Stone J, Bae C, Reznik L, et al. Hypothermic machine preservation\nreduces molecular markers of ischemia/reperfusion injury in human liver transplantation. American\nJournal of Transplantation. 2012; 12(9):2477–86. https://doi.org/10.1111/j.1600-6143.2012.04086.x\nPMID: 22594953\n16. Jomaa A, Gurusamy K, Siriwardana PN, Claworthy I, Collier S, de Muylder P, et al. Does hypothermic\nmachine perfusion of human donor livers affect risks of sinusoidal endothelial injury and microbial infec￾tion? A feasibility study assessing flow parameters, sterility, and sinusoidal endothelial ultrastructure.\nEvolution of injury markers in hypothermic machine perfusion\nPLOS ONE | https://doi.org/10.1371/journal.pone.0203803 September 14, 2018 11 / 12", "IL-10 gene therapy. Sci. Transl. Med. 1, 4ra9 (2009).\nArticle  CAS  PubMed  Google Scholar \n87. Hosgood, S.A., van Heurn, E. & Nicholson, M.L.\nNormothermic machine perfusion of the kidney: better\nconditioning and repair? Transpl. Int. 28, 657–664 (2015).\nArticle  PubMed  Google Scholar \n88. Xue, M. et al. Donor liver steatosis: a risk factor for early\nnew-onset diabetes after liver transplantation. J. Diabetes\nInvestig. 8, 181–187 (2017).\nArticle  PubMed  Google Scholar \n89. Avolio, A.W. et al. Successful use of extended criteria donor\ngrafts with low to moderate steatosis in patients with model\nfor end-stage liver disease scores below 27. Transplant. Proc.\n41, 208–212 (2009).\nArticle  CAS  PubMed  Google Scholar \n90. Bruinsma, B.G. et al. Metabolic profiling during ex vivo\nmachine perfusion of the human liver. Sci. Rep. 6, 22415\n(2016).\nArticle  CAS  PubMed  PubMed Central  Google Scholar \n91. Whitson, B.A. & Black, S.M. Organ assessment and repair\ncenters: The future of transplantation is near. World J.\nTransplant. 4, 40–42 (2014).\nArticle  PubMed  PubMed Central  Google Scholar \n92. Shah, M.R., Starling, R.C., Schwartz Longacre, L. & Mehra,\nM.R. Heart transplantation research in the next decade—a\ngoal to achieving evidence-based outcomes: National Heart,\nLung, And Blood Institute Working Group. J. Am. Coll.\nCardiol. 59, 1263–1269 (2012).\nArticle  PubMed  PubMed Central  Google Scholar \n\n\n93. Perk, S. et al. A metabolic index of ischemic injury for\nperfusion-recovery of cadaveric rat livers. PLoS One 6, e28518\n(2011).\nArticle  CAS  PubMed  PubMed Central  Google Scholar \n94. Cypel, M. & Keshavjee, S. The clinical potential of ex vivo\nlung perfusion. Expert Rev. Respir. Med. 6, 27–35 (2012).\nArticle  PubMed  Google Scholar \n95. van Smaalen, T.C., Hoogland, E.R.P. & van Heurn, L.W.E.\nMachine perfusion viability testing. Curr. Opin. Organ\nTransplant. 18, 168–173 (2013).\nArticle  CAS  PubMed  Google Scholar \n96. Machuca, T.N. et al. Protein expression profiling predicts\ngraft performance in clinical ex vivo lung perfusion. Ann.\nSurg. 261, 591–597 (2015).\nArticle  PubMed  Google Scholar \n97. US Centers for Disease Control and Prevention. Investigation\nof rabies infections in organ donor and transplant recipients—\nAlabama, Arkansas, Oklahoma, and Texas, 2004. MMWR\nMorb. Mortal. Wkly. Rep. 53, 586–589 (2004).\n98. Anonymous. CDC confirms rabies death in organ transplant\nrecipient. CDC Newsroom https://www.cdc.gov/media/\nreleases/2013/s0315_rabies_organs.html (2013).\n99. Anonymous. HIV transmitted from a living organ donor—\nNew York City, 2009. MMWR Morb. Mortal. Wkly. Rep. 60,\n297–301 (2011).\n100. Fishman, J.A. & Grossi, P.A. Donor-derived infection—the\nchallenge for transplant safety. Nat. Rev. Nephrol. 10, 663–\n672 (2014).\nArticle  PubMed  PubMed Central  Google Scholar", "infusion after reperfusion as additional criteria for PRS.\nThis altered definition impedes comparability with other\nstudies and may overestimate PRS incidence compared to\nthe commonly used definition. However, our data ap￾pear clinically plausible and concur with description of\nhemodynamic recovery after PRS by other authors [17].\nIn this study, multivariable regression modelling identi￾fied one donor related and one recipient related predictor\nof PRS: graft quality – visually assessed by the transplanting\nsurgeon – and cumulative intraoperative norepinephrine\ndosage before reperfusion of the liver graft. The variety of\nrisk factors and risk prediction models described in differ￾ent studies suggests that PRS may occur in an unpredict￾able manner or may be highly subjective to center-specific\neffects [8, 13–20, 22]. The most frequent reported risk fac￾tors for PRS are longer CIT [15, 16, 18, 20] and intraopera￾tive hemodynamics prior to reperfusion [14, 15, 17, 20],\nfollowed by graft steatosis [8, 16], operation time and tech￾nique [15, 18], severity of recipient’s liver disease [8, 19],\nand donor age [13, 17]. One single center study retrospect￾ive analysis was unable to identify even a single risk factor\nin a retrospective analysis of a sample of 261 LT\nrecipients [37]. Our findings that graft quality and hemo￾dymic impairment prior to reperfusion are risk factors for\nPRS concur with several similar studies. However, it re￾mains cryptic why the multitude of these observational\nstudies generate such a diversity of findings when it comes\nto predicting postreperfusion syndrome. Prospective multi￾center trials, the creation of an LT register or meta-analyses\ninvestigating the prediction of PRS could help to shed light\non this matter in the future.\nThe increasing number of liver transplantations has led\nto an increased demand of donor organs [1] and to the\ngrowing use of organs from extended criteria donors (ECD)\n[23]. A common quality marker for organs is fatty change,\nor steatosis. Steatosis has indeed been linked to the occur￾rence of PRS [8, 16]. Studies have shown that transplant￾ation of liver grafts with moderate to severe steatosis can\nvery well be conducted without sacrificing recipient survival\nbut in particular, that increased efforts are needed when\ndealing with these organs [26, 38]. However, macroscopic\nassessment of the organ may not be qualified to assess\nsteatosis: Rey and colleagues have examined 36 livers of\norgan donors which were explanted but not allocated.\nFig. 3 Clinical chemistry. Postoperative clinical chemistry of 122 liver transplant (LT) recipients, 65 with postreperfusion syndrome (PRS, black\ncircles), 57 without postoperative PRS (white circles). LT recipients with PRS suffered from greater postoperative transplant damage and poorer\ntransplant function during the postoperative course: Aspartat transferase blood concentration was higher (a) and blood hemostasis was poorer\n(d) compared to LT recipients without postreperfusion syndrome (alanine transferase was higher but did not reach significance, (b) LT recipients\nwith and without PRS did not differ in gall retention (c). Inflammation marker procalcitonin (e) and kidney function marker creatinine (f) were\npeaking higher during the postoperative course in LT recipients with PRS compared to recipients without PRS but did not reach statistical\nsignificance. P-values: repeated measures ANOVA; *: post-hoc t-test; mean and standard deviation\nKork et al. BMC Anesthesiology (2018) 18:29 Page 8 of 11", "RESEARCH ARTICLE\nEvolution of dynamic, biochemical, and\nmorphological parameters in hypothermic\nmachine perfusion of human livers: A proof￾of-concept study\nH. Abudhaise 1\n*, B. R. Davidson1☯, P. DeMuylder2‡, T. V. Luong3‡, B. Fuller1☯\n1 UCL Division of Surgery and Interventional Sciences, Royal Free Hospital, London, United Kingdom,\n2 Organ Recovery Systems, Zaventem, Belgium, 3 Department of Cellular Pathology, Royal Free London\nNHS Foundation Trust, London, United Kingdom\n☯ These authors contributed equally to this work.‡ These authors also contributed equally to this work.\n* hamid.abudhaise.11@ucl.ac.uk\nAbstract\nIntroduction\nHypothermic machine perfusion (HMP) is increasingly investigated as a means to assess\nliver quality, but data on viability markers is inconsistent and the effects of different perfusion\nroutes and oxygenation on perfusion biomarkers are unclear.\nMethods\nThis is a single-centre, randomised, multi-arm, parallel study using discarded human livers\nfor evaluation of HMP using arterial, oxygen-supplemented venous and non-oxygen-supple￾mented venous perfusion. The study included 2 stages: in the first stage, 25 livers were ran￾domised into static cold storage (n = 7), hepatic artery HMP (n = 10), and non-oxygen￾supplemented portal vein HMP (n = 8). In the second stage, 20 livers were randomised into\noxygen-supplemented and non-oxygen-supplemented portal vein HMP (n = 11 and 9,\nrespectively). Changes in dynamic, biochemical, and morphologic parameters during 4-\nhour preservation were compared between perfusion groups, and between potentially trans￾plantable and non-transplantable livers.\nResults\nDuring arterial perfusion, resistance was higher and flow was lower than venous perfusion\n(p = 0.001 and 0.01, respectively); this was associated with higher perfusate markers\nduring arterial perfusion (p>0.05). Supplementary oxygen did not cause a significant alter￾ation in the studied parameters. Morphology was similar between static and dynamic\npreservation groups. Perfusate markers were 2 fold higher in non-transplantable livers\n(p>0.05).\nPLOS ONE | https://doi.org/10.1371/journal.pone.0203803 September 14, 2018 1 / 12\na1111111111\na1111111111\na1111111111\na1111111111\na1111111111\nOPEN ACCESS\nCitation: Abudhaise H, Davidson BR, DeMuylder P,\nLuong TV, Fuller B (2018) Evolution of dynamic,\nbiochemical, and morphological parameters in\nhypothermic machine perfusion of human livers: A\nproof-of-concept study. PLoS ONE 13(9):\ne0203803. https://doi.org/10.1371/journal.\npone.0203803\nEditor: Leonidas G. Koniaris, Indiana University,\nUNITED STATES\nReceived: November 8, 2017\nAccepted: August 7, 2018\nPublished: September 14, 2018\nCopyright: © 2018 Abudhaise et al. This is an open\naccess article distributed under the terms of the\nCreative Commons Attribution License, which\npermits unrestricted use, distribution, and\nreproduction in any medium, provided the original\nauthor and source are credited.\nData Availability Statement: All relevant data are\nwithin the paper.\nFunding: This study was supported by the National\ninstitute of health and research; Reference number:\nHTD 556; https://www.nihr.ac.uk. Consumables\nand laboratory materials were partially funded by\nOrgan Recovery Systems; https://www.organ￾recovery.com. The author receiving funding was\nBRD. Author P. DeMuylder is employed by Organ\nRecovery Systems. Organ Recovery Systems"], "response": "This research aims to investigate the evolution of dynamic, biochemical, and morphological parameters during hypothermic machine perfusion (HMP) of human livers using discarded livers. The study includes two stages: in the first stage, 25 livers were randomly assigned to static cold storage, arterial HMP, or non-oxygenated portal vein HMP. In the second stage, 20 livers were randomly assigned to oxygenated or non-oxygenated portal vein HMP. The study found that resistance was higher and flow was lower during arterial perfusion than venous perfusion, leading to higher perfusate markers during arterial perfusion. Oxygen supplementation did not significantly affect the studied parameters. Morphology was similar between static and dynamic preservation groups. Perfusate markers were twice as high in non-transplantable livers compared to potentially transplantable livers. Overall, the study provides insights into the effects of different perfusion routes and oxygenation on perfusion biomarkers during HMP."}
{"user_input": "How has machine perfusion changed risk thresholds associated with steatotic donor livers?", "retrieved_contexts": ["SYSTEMATIC REVIEW\npublished: 12 May 2020\ndoi: 10.3389/fmed.2020.00135\nFrontiers in Medicine | www.frontiersin.org 1 May 2020 | Volume 7 | Article 135\nEdited by:\nPedro M. Baptista,\nUniversity of Zaragoza, Spain\nReviewed by:\nRené Adam,\nAssistance Publique Hopitaux De\nParis, France\nZuzana Macek Jilkova,\nCentre Hospitalier Universitaire de\nGrenoble, France\n*Correspondence:\nJunjun Jia\njiajunjun1987@163.com\nShu-Sen Zheng\nshusenzheng@zju.edu.cn\n†These authors have contributed\nequally to this work\nSpecialty section:\nThis article was submitted to\nGastroenterology,\na section of the journal\nFrontiers in Medicine\nReceived: 05 February 2020\nAccepted: 30 March 2020\nPublished: 12 May 2020\nCitation:\nJia J, Nie Y, Li J, Xie H, Zhou L, Yu J\nand Zheng S-S (2020) A Systematic\nReview and Meta-Analysis of Machine\nPerfusion vs. Static Cold Storage of\nLiver Allografts on Liver\nTransplantation Outcomes: The Future\nDirection of Graft Preservation.\nFront. Med. 7:135.\ndoi: 10.3389/fmed.2020.00135\nA Systematic Review and\nMeta-Analysis of Machine Perfusion\nvs. Static Cold Storage of Liver\nAllografts on Liver Transplantation\nOutcomes: The Future Direction of\nGraft Preservation\nJunjun Jia1,2\n*\n†\n, Yu Nie1,2†, Jianhui Li 1,2, Haiyang Xie1,2, Lin Zhou1,2, Jun Yu1,2 and\nShu-Sen Zheng1,2\n*\n1 Division of Hepatobiliary and Pancreatic Surgery, Department of Surgery, First Affiliated Hospital, School of Medicine,\nZhejiang University, College of Medicine, Hangzhou, China,\n2 Division of Hepatobiliary and Pancreatic Surgery, Department of\nSurgery, Key Laboratory of Combined Multi-organ Transplantation, Ministry of Public Health, Hangzhou, China\nBackground: Machine perfusion (MP) and static cold storage (CS) are two\nprevalent methods for liver allograft preservation. However, the preferred method\nremains controversial.\nAim: To conduct a meta-analysis on the impact of MP preservation on liver\ntransplant outcome.\nMethods: PubMed, EMBASE, and Cochrane Library databases were systematically\nsearched to identify relevant trials comparing the efficacy of MP vs. CS. Odds ratios (OR)\nand fixed-effects models were calculated to compare the pooled data.\nResults: Ten prospective cohort studies and two randomized controlled trials\n(RCTs) were included (MP livers vs. CS livers = 315:489). Machine perfusion\ndemonstrated superior outcomes in posttransplantation aspartate aminotransferase\nlevels compared to CS (P < 0.05). The overall incidence of early allograft dysfunction\n(EAD) was significantly reduced with MP preservation than CS [OR = 0.46; 95%\nconfidence interval (CI) = 0.31–0.67; P < 0.0001]. The incidence of total biliary\ncomplications (OR = 0.53; 95% CI = 0.34–0.83; P = 0.006) and that of ischemic\ncholangiopathy (OR = 0.39; 95% CI = 0.18–0.85; P = 0.02) were significantly\nlower in recipients with MP preservation compared with CS preservation. Hypothermic\nmachine perfusion (HMP) but not normothermic machine perfusion (NMP) was\nfound to significantly protect grafts from total biliary complications and ischemic\ncholangiopathy (P < 0.05). However, no significant differences could be detected\nutilizing either HMP or NMP in primary nonfunction, hepatic artery thrombosis,\npostreperfusion syndrome, 1-year patient survival, or 1-year graft survival (P > 0.05).\n\nJia et al. Machine Perfusion: Future Preservation Method\nConclusions: Machine perfusion is superior to CS on improving short-term outcomes\nfor human liver transplantation, with a less clear effect in the longer term. Hypothermic\nmachine perfusion but not NMP conducted significantly protective effects on EAD\nand biliary complications. Further RCTs are warranted to confirm MP’s superiority\nand applications.\nKeywords: machine perfusion, static cold storage, graft preservation, liver transplantation, meta-analysis\nINTRODUCTION\nLiver transplantation (LT) has been the optimal treatment\nfor patients with end-stage liver disease. Rapidly increasing\ndemands for LT have also caused severe shortage of donor liver\norgans in clinical application. To overcome this discrepancy,\ndonation after circulatory death (DCD), extended criteria donors\n(ECDs), living liver donation, or marginal liver grafts are\nincreasingly accepted to expand the limited donor pool. However,\nstudies have suggested that these additional liver donation\nsources often suffered from longer warm ischemic periods and\nworse ischemia–reperfusion injury (IRI) during LT, resulting\nin increased risk of early allograft dysfunction (EAD), primary\nnonfunction (PNF), biliary complications, and poorer long-term\ngraft and patient survival (1).\nDuring transplantation, the quality of donor liver preservation\nis an important factor on maintaining and improving transplant\noutcomes of patients. Standard static cold storage (CS)\nremains the gold standard method for liver graft preservation.\nNevertheless, the effectiveness of CS preservation is currently\nunable to provide sufficient protection of liver grafts against IRI,\nespecially for prolonged CS of DCD and marginal livers, often\nresulting in increased risk of EAD, PNF, and biliary complications\n(2). As an alternative preservation strategy, machine perfusion\n(MP) can provide a continuous circulation of metabolic\nsubstrates and antioxidants, imitating the physiological processes\nwhile flushing inflammatory cytokine and toxins from the graft.\nTherefore, MP has been proposed as a better strategy to protect or\nrescue marginal liver grafts by attenuating the cytokine mediated\nIRI (3).\nMachine perfusion has been widely used for preservation\nin kidney transplantation. Plenty of evidence suggested MP’s\npriority in improving early graft function, reducing the risk of\ndelayed graft function (DGF), and enhancing ECD graft survival\nafter renal transplantation (4). Unlike kidney transplantation,\nMP remained relatively limited in clinical LTs due to the high\nmetabolism rates of liver, relatively complicated perfusion system\nAbbreviations: AST, aspartate aminotransferase; ALT, alanine transaminase; CI,\nconfidence interval; CS, cold storage; DBD, deceased brain donor; DCD, donor\nafter cardiac death; EAD, early allograft dysfunction; ECD, extended criteria\ndonors; HAT, hepatic artery thrombosis; HMP, hypothermic machine perfusion;\nHOPE, hypothermic oxygenated perfusion; IRI, ischemia–reperfusion injury; IC,\nischemic cholangiopathy; LT, liver transplantation; MP, machine perfusion; MELD,\nmodel for end-stage liver disease; NOS, Newcastle–Ottawa Quality Assessment\nScale; NMP, normothermic machine perfusion; OR:odds ratio; PNF, primary\nnonfunction; PRISMA, Preferred Reporting Items for Systemic Reviews and Meta￾Analysis.\nconsisting of hepatic and portal route, poor practicality, and\nhigh costs.\nLarge animal and human experimental studies have suggested\nthat MP may provide better protection of liver grafts against\nIRI than CS (5, 6). Expression of proinflammatory cytokines,\noxidation markers, and activation of adhesion molecules and\nmigration of leukocytes were significantly reduced by MP (7).\nRecently, two systematic review and meta-analyses concluded\nthat MP preservation is superior to CS in experimental rat and\npig models in terms of reducing hepatocellular injury [lower\naspartate aminotransferase (AST), alanine transaminase (ALT),\nlactate dehydrogenase levels] and biliary injury (lower alkaline\nphosphatase, hyaluronic acid levels) (8, 9). Clinical adoption of\nMP in LT has been intensively tested. Since the first clinical\nseries investigating the safety and efficacy of MP compared with\nCS was reported by Guarrera et al. (10), increasing comparative\nstudies on MP and CS has been reported, showing the potential\nbenefit in improving early graft function, reducing posttransplant\ncomplications, and enhancing long-term survival (11). However,\nthose benefits on outcomes were inconclusive without the pooled\nanalyses. Few systematic review and meta-analyses have tried\nto investigate the effectiveness of MP on human, but they were\neither short comprehensive or out-of-the-latest studies (12, 13).\nUpdated systematic review and meta-analyses are lacking and\nneeded to decide the preferred method of graft storage.\nIn this systematic review and meta-analysis, we systematically\nanalyzed the available published data to compare MP\npreservation with CS preservation on outcomes of LT, including\nEAD, PNF, biliary complications, and graft and patient survival\nafter transplantation, with the aim of identifying the optimum\npreservation method for donor livers and achieving preferable\noutcomes in clinical application.\nMETHODS\nLiterature Search\nA comprehensive literature search was carried out on\nPubMed/MEDLINE, EMBASE, and Cochrane library databases\nusing the following terms: ((machine perfusion OR machine\npreservation) AND (liver OR liver transplant OR liver\ntransplantation)). The literature search was performed in\nNovember 2019. Publications were limited to articles written\nin English. The titles and abstracts of all relevant publications\nwere reviewed, and full texts of those potentially matching\nthe inclusion criteria were retrieved. Reference lists of the\nretrieved full-text articles were also searched manually to help\nidentify potentially eligible studies. This systematic review and\nFrontiers in Medicine | www.frontiersin.org 2 May 2020 | Volume 7 | Article 135\n\nJia et al. Machine Perfusion: Future Preservation Method\nmeta-analysis was performed in line with the PRISMA (Preferred\nReporting Items for Systematic Reviews and Meta-Analyses)\nrecommendations (14).\nStudy Inclusion and Exclusion Criteria\nClinical studies comparing outcomes of human LT using MP\npreservation vs. static CS were eligible for this analysis.\nExclusion criteria were as follows: (1) studies without a\ncontrol group (without CS preservation group); (2) studies\nnot controlling the donor type between the MP group and\nCS group; (3) studies using unusual MP method (including\nsubnormothermic MP and controlled rewarming MP); (4)\noverlapping studies from the same institution; (5) studies\nreporting none of the following outcomes of interest: EAD, PNF,\nbiliary complications, vascular complications, graft survival, and\npatient survival; (6) simultaneous liver–kidney transplantation,\nmultiple organ transplantation, and living donor transplantation\nstudies; (7) nonhuman studies and experimental studies; (8)\nabstracts, letters, editorials, books, expert opinions, case reports,\nand review articles.\nQuality Evaluation and Data Extraction\nNewcastle–Ottawa Quality Assessment Scale (NOS) was used to\nevaluate the methodological quality of the included prospective\ncohort studies (15). The quality of randomized controlled trial\n(RCT) study was assessed using the Jadad score and the Cochrane\nCollaboration’s risk of bias tool (16). Studies with score >6\nwere regarded as high quality. Two investigators (J.J. and Y.N.)\nreviewed the publications, assessed the quality, and extracted the\ndata independently. Disagreements were resolved by discussion\nand consensus, confirmed by another investigator (S.-S.Z.).\nThe primary outcomes extracted included the incidence\nof EAD, PNF, hepatic artery thrombosis (HAT), total biliary\ncomplications, and ischemic cholangiopathy (IC) rates after\ntransplantation. Secondary outcomes included liver graft\nfunction, postreperfusion syndrome (PRS), and 1-month,\n6-month, and 1-year graft and patient survival rates.\nAll of the studies defined EAD according to Olthoff et al.\n(17). To be specific, EAD was defined as the presence of at\nleast one of the following at 7 days after LT: serum bilirubin 10\nmg/dL; or international normalized ratio 1.6; or ALT >2,000 U/L\nin the first 7 postoperative days. Primary nonfunction was\nindicated as irreversible graft dysfunction, for nontechnical and\nnonimmunological causes, leading to death or emergency liver\nreplacement during the first 10 days after LT (18). Definition of\nIC was according to Lee et al. (19). Total biliary complications at\n1 year were defined as all the complications related with biliary\nduct including biliary leaks, biliary stricture, and other biliary\ncomplications. Postreperfusion syndrome was defined according\nto Hilmi et al. (20).\nStatistical Analysis\nPooled odds ratios (ORs) were used to evaluate the summary\nevent rates (dichotomous data) with 95% confidence interval\n(CI). Standardized mean difference (SMD) was used to compare\ncontinuous data. Cochran Q (χ\n2\n) and the I\n2\nstatistical\ntest were adopted to evaluate the heterogeneity among the\nincluded studies. Heterogeneity was considered significant when\nP < 0.10 or I\n2 > 50%. In the absence of heterogeneity\namong the included studies, a fixed-effects model was adopted\nto combine studies and pool the total effect size; otherwise,\na random-effects model was adopted. Funnel plots were\ncreated for assessment of publication bias (publication bias was\nexamined in funnel plots by performing Begg and Egger tests).\nP < 0.05 was considered statistically significant. All statistical\nanalyses were performed using Cochrane Review Manager\n5.3. (http://ims.cochrane.org/revman).\nRESULTS\nSearch Results and Study Characteristics\nAs for the selection process according to the PRISMA guidelines,\nthe detailed process of our literature search is shown in Figure 1.\nBriefly, Initial literature searches identified 1,289 publications.\nAfter excluding ineligible publications based on the selection\nand exclusion criteria, 12 studies, including 10 nonrandomized\nprospective phase I clinical trials (10, 21–29), one multi￾institutional randomized study (18), and one single-center,\nrandomized controlled study (30), were eventually included in\nthe meta-analysis of the comparison between MP and CS on\nclinical outcomes in LT. In the 12 included studies, five studies\nused hypothermic machine perfusion (HMP), whereas the other\nseven studies investigated normothermic machine perfusion\n(NMP). Of these 12 studies, seven were from European institutes,\nincluding four single-center prospective trials, one multicenter\nprospective trials (22, 25–27), one prospective multicenter\nRCT (18), and one single-center, randomized controlled study\n(30); two single-center prospective trials were from Canadian\ninstitutes (23, 24), whereas the remaining three studies were from\nthe US institutes (10, 21). The years of publication spanned from\n2010 to 2019. After combining all the studies, 315 patients were\nincluded into the MP group, and 489 patients were included into\nthe CS group as control in our meta-analysis.\nThe characteristics of each study are summarized in Table 1.\nThe outcomes of each study are presented in Table 2 and\nSupplementary Data. As shown in Table S1, the quality of the 12\nincluded studies was good. The quality scores of included cohort\nstudies, evaluated by the NOS, ranged from 7 to 9 points (with a\nmean of 7.9), whereas the risk of bias in the two included RCTs\nwas low.\nMeta-Analysis of Primary Outcomes\nLiver Graft Injury\nReperfusion injury and liver graft function were determined by\nAST and/or ALT serum levels after transplantation. As shown in\nTable 2, all 12 included studies reported posttransplant peak ALT\nand/or AST level within 1 week. Seven of the 12 included studies\nfound a significantly lower posttransplant peak ALT and/or AST\nlevel during the first 7 days after surgery in the MP group\ncompared with the CS group (P < 0.05) (10, 18, 21, 22, 25, 26,\n28), whereas the rest (five studies) observed comparable hepatic\ntransaminases levels between two groups (23, 24, 27, 29, 30).\nHowever, different studies reported transaminase by different\ndata types and at variable time points. Only three studies reported\nFrontiers in Medicine | www.frontiersin.org 3 May 2020 | Volume 7 | Article 135\n\nJia et al. Machine Perfusion: Future Preservation Method\nFIGURE 1 | Flowchart showing search strategy with inclusions and exclusions.\nposttransplant peak ALT and AST level by mean and standard\ndeviation (10, 28, 29). Meta-analysis demonstrated that livers\npreserved with MP had significantly lower peak AST levels than\nCS (SMD = −0.53; 95% CI = −1.04 to −0.02; P = 0.04)\n(Figure 2). There was also a trend favoring the use of MP\nin reducing posttransplant peak ALT levels compared with CS\n(SMD = −0.44; 95% CI = −0.91 to −0.02; P = 0.06) (Figure 2).\nMoreover, eight of the 12 included studies clinically measured\nthe longitudinal serum hepatic transaminases levels in 1 or\n2 weeks after transplantation. Except Bral and colleagues’s trial\n(24), seven studies reported a faster decline in posttransplant\nhepatic transaminases levels in MP preservation recipients when\ncompared to CS preservation recipients (10, 18, 21–23, 26, 30).\nNotably, six studies, including the large sample multicenter RCT\nby Nasralla et al. (18) and the RCT by Ghinolfi et al. (30), found\nstatistically different reducing trends on posttransplant hepatic\ntransaminases between the two groups within the first week after\ntransplantation (P < 0.05) (10, 18, 21, 22, 26, 30).\nEarly Allograft Dysfunction\nEleven of the 12 included studies reported the incidence of EAD\nwithin the first week posttransplantation. The overall rate of\nEAD was 15.2% (range, 0–55.6%) for the MP group and 30.6%\n(0–46.4%) for the CS group. Pooled meta-analysis of the HMP\nand NMP studies revealed that the overall rate of EAD was\nsignificantly reduced in the MP preservation compared with the\nCS preservation (fixed effects: OR = 0.46; 95% CI = 0.31–0.67;\nP < 0.0001) (Figure 3). There was no statistically significant\nheterogeneity among the 11 included studies (χ\n2 = 12.94,\nP = 0.17, I\n2 = 30%).\nSubgroup analysis showed no significant difference between\ntwo subgroups (I\n2 = 0%; P = 0.78). In the subgroup analysis,\nEAD rates were significantly lower in the HMP subgroup (fixed\neffects: OR = 0.49; 95% CI = 0.27–0.88; P = 0.02) compared\nto those of CS. There is statistically significant heterogeneity in\nthe NMP subgroup (χ\n2 = 9.76, P = 0.04, I\n2 = 59%). Thus, a\nrandom-effects model was adopted. However, subgroup analysis\nshowed no significant difference between NMP preservation and\nCS preservation (random effects: OR = 0.60; 95% CI = 0.24–1.52;\nP = 0.28, figure not shown). In the NMP subgroup, a sensitivity\nanalysis was conducted by excluding Bral and colleagues’ study\n(24) because of its heterogeneity in sample size and donor\ntype; the risk of EAD reached statistical significance between\ntwo groups (fixed effects: OR = 0.34; 95% CI = 0.20–0.59;\nP = 0.0001). The overall risk of EAD in the MP group remained\nstatistically significant (fixed effects: OR = 0.40; 95% CI = 0.27–\n0.60; P < 0.00001; χ\n2 = 7.07, P = 0.53, I\n2 = 0%) (figure\nnot shown).\nFrontiers in Medicine | www.frontiersin.org 4 May 2020 | Volume 7 | Article 135\n\nJia et al. Machine Perfusion: Future Preservation Method TABLE 1 | Clinical characteristics of the included studies in the meta-analysis. References Institution Study type Study period Donor type MP Type MP system Sample Size Donor age Recipient age Recipient meld scores CIT hours WIT* min Follow– upperiod MP CS MP CS MP CS MP CS MP CS MP CS Guarrera et al. (10) USA PCS 2004.7– 2008.2 DBD HMP Organ Assist 20 20 39.4 ± 2.5 45.6 ± 2.1 55.4 ± 6.2 52.7 ± 8.9 17.2 ± 7.4 16.8 ± 6.8 9.4 ± 2.1 8.9 ± 2.8 44.3 ± 6.5 45.1 ± 6.7 1 year Dutkowski et al. (22) U.K./ Europe MCT PCS 2012.1– 2014.12 DCD HMP Organ Assist 25 50 54(36–63) 48(33–51) 60(57–64) 56(49–59) 13(9–15) 16(10–21) 3.1(2.4–4.4) 6.6(5.8–7.5) 36(31–40) 33(27–40) 1 year Guarrera et al. (21) USA PCS 2007– 2012 ECD HMP Organ Assist 31 30 57.5 ± 17.8 57.9 ± 16.9 57.5 ± 8.0 58.4 ± 9.6 19.5 ± 5.9 21.4 ± 6.3 9.3 ± 1.6 8.6 ± 2.4 45.6 ± 7.3 40.0 ± 8.3 1 year Ravikumar et al. (25) UK PCS 2011.1– 2013.12 DBD/ DCD NMP OrganOx metra 20 40 58.0(21–85) 58.5(21–82) 54.4(33–66) 55.0(27–65) 12(7–27) 14(6–25) 9.3(3.5–18.5) 8.9(4.2–11.4) 21(14–31) 15(9–23) 6 month Selzner et al. (23) Canada PCS 2015.6– 2015.12 DCD NMP OrganOx metra 10 30 48(17–75) 46(22–68) 56(45–71) 54(42–63) 21(8–40) 23(7–37) 9.8(3.7–12.2)# 10.6(8.7–13.0)# 49(21–76) 46(39–67) 3 month Bral et al. (24) Canada PCS 2015.2– 2015.12 DBD/ DCD NMP OrganOx metra 10 30 56(14–71) 52(20–77) 53(28–67) 59(43–69) 13(9–32) 19(7–34) 2.8(1.6–4.9) 3.9(1.1–14.8) 21.5(16–26) N/A 6 month van Rijn et al. (26) The Netherlands PCS 2014.4– 2014.11 DCD HMP Organ Assist 10 20 53(47–57) 53(47–58) 57(54–62) 52(42–60) 57(54–62) 52(42–60) 8.7(7.8–9.9) 8.4(7.9–8.8) 27(23–43) 32(27–39) 1 year Watson et al. (27) UK PCS N/A ECD** NMP Organ Assist 12 24 56(24–67) 54(22–72) 57(46–65) N/A 17(10–26) N/A 7.1(3.7–14.6) 7.3(5.6–12.0) 31(17–160) 22(12–124) 1 year Nasralla et al. (18) U.K./ Europe MCT RCT 2014.6– 2016.3 DBD/ DCD NMP OrganOx metra 121 101 56 (16–84) 56 (20–86) 55 (20–72) 55 (22–70) 13 (6–35) 14 (6–29) 2.2(0.8–3.6) 7.8(3.7–16.0) 21(9–93)& 16(2–32) 1 year Ghinolfi et al. (30) Italy RCT 2016.10– 2018.4 ECD (DBD,≥ 70years) NMP Organ Assist 10 10 90 80 57 (46–61) 55 (43–61) 12.5 (9–16) 9.5 (8–15) 4.7 (4.0–5.0) 6.6 (6.1–7.8) 74 (70–82) 69 (62–78) 1 year Patrono et al. (29) Italy PCS 2016.03.16– 2018.06.12 ECD HMP Organ Assist 25 50 74.3 ± 10.9 74.9 ± 10.3 56.3 ± 9 55.9 ± 7.4 15.3 ± 8.6 15.5 ± 8.5 5.2 ± 0.9 6.5 ± 1.2 23 ± 7 24 ± 5 1 year Liu et al. (28) USA PCS 2016.05– 2018.04 DBD/ DCD NMP Self– developed device 21 84 35.0 ± 12.7 34.8 ± 15.0 57.0 ± 7.1 57.4 ± 8.4 19.1 ± 7.7 19.4 ± 8.7 3.2 ± 0.8 NA 20.75 ± 4.74* N/A 1 year MCT, multicenter-clinical trials; N/A, non-available; RCT, randomized control trial; RCS, retrospective cohort study; *, Functional warm ischemic time applies only to DCD donors; **, In Watson’s study, ECD livers(declined marginal livers) were used after NMP repair. &, MP group is significant higher compared with CS group; #, the total preservation time in this study.\nFrontiers in Medicine | www.frontiersin.org\n5 May 2020 | Volume 7 | Article 135\n\nJia et al. Machine Perfusion: Future Preservation Method\nTABLE 2 | Main outcomes of the included studies.\nReferences Peak ALT Peak AST EAD PNF Total biliary\ncomplications\nMP CS MP CS MP(%) CS(%) p MP(%) CS(%) p MP(%) CS(%) p\nGuarrera et al.\n(10)\n560.0 ±\n355.5 IU/mL\n1358 ±\n1208.4\nIU/mL*\n1154 ± 355.5\nIU/mL\n3339 ±\n3376.9\nIU/mL*\n5 25 0.08 0 0 ns 10 20 N/A\nDutkowski\net al. (22)\n1239\n(689–2126)\nU/L\n2065\n(1331–3596)\nU/L *\n1808\n(1133–3547)\nU/L\n2848\n(1485–6724)\nU/L *\n20 44* 0.03 0 6 ns 20 46 0.035*\nGuarrera et al.\n(21)\n550 IU/mL 900 IU/mL #* 1300 IU/mL 1600 IU/mL # 19 30 0.384 3.2 6.7 0.612 13 43.3 0.001*\nRavikumar\net al. (25)\nN/A N/A 417\n(84–4681)\nU/L\n902\n(218–8786)\nU/L*\n15 22.5 0.734 0 0 ns N/A N/A N/A\nSelzner et al.\n(23)\n619\n(55–2858)\nU/L\n949\n(233–3073)\nU/L\n1182\n(167–6700)\nU/L\n1474\n(521–5156)\nU/L\n0 0 ns 0 0 ns N/A N/A N/A\nBral et al. (24) N/A N/A 1252\n(383–2600)\nU/L\n839\n(153–2600)\nU/L\n55.6 29.6 0.23 0 0 ns 0 14.8 0.55\nvan Rijn et al.\n(26)\n966 U/L 1858 U/L* N/A N/A 0 10 1.00 0 0 ns 40 55 N/A\nWatson et al.\n(27)\n1069\n(187–4991)\nIU/L\n787\n(155–2238)\nIU/L\nN/A N/A NA NA N/A NA NA N/A NA NA N/A\nNasralla et al.\n(18)\nN/A N/A 488.1\n(408.9–582.8)\nU/L\n964.9\n(794.5–\n1,172.0)\nU/L*\n10.1 29.9* 0.0002 0.8 0 ns N/A N/A N/A\nGhinolfi et al.\n(30)\n332\n(263–610)\nU/L\n428\n(303–616)\nU/L\n709.5\n(371–1575)\nU/L\n574\n(377–1162)\nU/L\n20.0 10.0 1.000 0 0 ns 10.0 0 1.000\nPatrono et al.\n(29)\n792 ± 773\nU/L\n817 ± 540\nU/L\n1425 ± 1729\nU/L\n1498 ± 1034\nU/L\n32 34 1.0 0 0 ns 24 18 0.76\nLiu et al. (28) 1357 ± 1492\nU/L\n2615 ± 2541\nU/L*\n363 ± 318\nU/L\n1021 ± 999\nU/L*\n19 46.4 0.02 0 0 ns N/A N/A N/A\nns, not significant; N/A, non-available; *, statistically significant; #, approximate number because only diagram form was available in this included study.\nPrimary Nonfunction\nExcept Watson and colleagues’ trial (27), the rest (11 studies)\nevaluated the rate of PNF after transplantation. However,\nepisodes of PNF were observed in only three studies.\nThe incidence of PNF was 0.7% (range, 0–3.2%) in the\nMP group and 1.1% (range, 0–6.7%) in the CS group,\nrespectively. No heterogeneity was observed (χ\n2 = 1.09,\nP = 0.58; I\n2 = 0%); thus, a fixed-effects model was used.\nA meta-analysis indicated that there was no statistical\nsignificance in PNF rates between MP preservation and CS\npreservation (OR = 0.60; 95% CI = 0.14–2.60; P = 0.49)\n(Figure 4).\nTotal Biliary Complications and Ischemic\nCholangiopathy\nAll 12 studies reported biliary complications after transplantation\nwithin 1-year follow-up. However, two studies did not report\ndetailed information of biliary complications (23, 28), and\none study did not provide the complication data in the CS\ngroup (25), whereas Watson et al. trial reported only IC\ninstead of all biliary complications. The rest (eight studies)\ncompared the rates of total biliary complications between\nthe MP and CS groups at 1 year after transplantation\n(Table 2). There was no heterogeneity among the eight studies\n(χ\n2 = 8.08, P = 0.33, I\n2 = 13%); thus, a fixed model\nwas adopted. Meta-analysis of these studies indicated that\ntotal biliary complications at 1 year after transplantation\nwere significantly lower in MP preservation group compared\nwith CS preservation group (fixed-effects model: OR = 0.53;\n95% CI = 0.34–0.83; P = 0.006) (Figure 5). Subgroup\nanalysis showed that incidence of total biliary complications\nwas significantly lower in HMP patients compared with CS\npatients (fixed-effects model: OR = 0.45; 95% CI = 0.25–\n0.80; P = 0.007). However, no significant difference could\nbe detected between the NMP subgroup and CS subgroup\nFrontiers in Medicine | www.frontiersin.org 6 May 2020 | Volume 7 | Article 135\n\nJia et al. Machine Perfusion: Future Preservation Method\nFIGURE 2 | Meta-analysis on posttransplant peak AST/ALT levels between MP and CS preservation. (A) AST level. MP reduced posttransplant peak AST level\n(SMD = −0.53; 95% CI = −1.04 to −0.02; P = 0.04), (B) ALT level. MP tends to reduce posttransplant peak AST level (SMD = −0.44; 95% CI = −0.91 to −0.02;\nP = 0.06). MP, machine perfusion; CS, cold storage; SMD, standardized mean difference; CI, confidence interval.\nFIGURE 3 | Meta-analysis on EAD rates between MP and CS preservation. HMP reduced the EAD rates (OR = 0.49; 95% CI = 0.27–0.88; P = 0.02), and NMP\nreduced the EAD rates (OR = 0.34; 95% CI = 0.20–0.59; P = 0.0001). EAD, early allograft dysfunction; MP, machine perfusion; CS, cold storage; HMP, hypothermic\nmachine perfusion; NMP, normothermic machine perfusion; CI, confidence interval.\nFrontiers in Medicine | www.frontiersin.org 7 May 2020 | Volume 7 | Article 135\n\nJia et al. Machine Perfusion: Future Preservation Method\nFIGURE 4 | Meta-analysis on PNF rates between MP and CS preservation. MP cannot reduce the PNF rates (OR = 0.60; 95% CI = 0.14–2.60; P = 0.49). Data are\nexpressed as OR ± 95% CI. PNF, primary nonfunction; MP, machine perfusion; CS, cold storage; CI, confidence interval.\nFIGURE 5 | Meta-analysis on total biliary complications rates between MP and CS preservation. HMP reduced the total biliary complications (OR = 0.45; 95%\nCI = 0.25–0.80; P = 0.007), but NMP cannot reduce the total biliary complications (OR = 0.70; 95% CI = 0.34–1.46; P = 0.34). MP, machine perfusion; CS, cold\nstorage; HMP, hypothermic machine perfusion; NMP, normothermic machine perfusion; CI, confidence interval.\n(fixed-effects model: OR = 0.70; 95% CI = 0.34–1.46;\nP = 0.34) (Figure 5).\nAmong the 12 included studies, nine studies further reported\nthe incidence of IC at 1-year follow-up. The overall rates\nof IC were significantly lower in MP preservation patients\ncompared with CS preservation patients (fixed-effects model:\nOR = 0.39; 95% CI = 0.18–0.85; P = 0.02). No significant\nheterogeneity was found between the MP and CS groups\n(χ\n2 = 6.15, P = 0.41; I\n2 = 2%). The subgroup analysis\nshowed that the incidence of IC was significantly lower in HMP\npreservation patients compared with CS preservation patients\n(OR = 0.25; 95% CI = 0.08–0.73; P = 0.01) (Figure 6), but\nFrontiers in Medicine | www.frontiersin.org 8 May 2020 | Volume 7 | Article 135\n\nJia et al. Machine Perfusion: Future Preservation Method\nthere is no statistical difference in IC rates between NMP\npreservation and CS preservation (OR = 0.76; 95% CI = 0.24–\n2.38; P = 0.64) (Figure 6).\nHepatic Artery Thrombosis\nSeven studies, including four HMP studies and three NMP\nstudies, compared the risk of posttransplant HAT between\nthe two preservation technologies. The overall incidence of\nHAT was 2.1% (range, 0–10.0%) in the MP group and 5.2%\n(range, 0–10.0%) in the CS group, respectively. Hepatic artery\nthrombosis rates were lower in both the HMP group (fixed￾effects analysis: OR = 0.46, 95% CI = 0.12–1.77; P = 0.26) and\nNMP group (fixed-effects analysis: OR = 0.67; 95% CI = 0.16–\n2.77; P = 0.58) compared to those of the CS group. However,\nthere was no statistical significance (P > 0.05). A pooled meta￾analysis of HMP and NMP studies indicated that there was no\nstatistical significance in HAT rates between MP preservation\nand CS preservation (OR = 0.55; 95% CI = 0.21–1.44;\nP = 0.22) (Figure S1).\nPostreperfusion Syndrome\nFour studies reported the rates of PRS. Postreperfusion syndrome\nrates were lower in the MP preservation group compared with the\nCS group (random-effects effect: OR = 0.70; 95% CI = 0.18–2.73;\nP = 0.61). However, it had no statistical significance (Figure S2).\nPatient Survival and Liver Graft Survival\nTo evaluate the posttransplant survival outcomes of MP\npreservation vs. CS preservation, the data of graft survival\nand patient survival at 1 month, 6 month, and 1 year were\nextracted and analyzed (Table S2). The meta-analysis indicated\nthat there was no difference in graft survival between MP\npreservation patients and CS preservation at 1 month (seven\nstudies supported, OR = 0.78; 95% CI = 0.21–2.88; P = 0.72;\nχ\n2 = 3.54, P = 0.32; I\n2 = 15%, figure not shown), 6 months (six\nstudies supported, OR = 0.80; 95% CI = 0.26–2.46; P = 0.69;\nχ\n2 = 5.23, P = 0.26; I\n2 =23%, figure not shown), and 1 year (eight\nstudies supported, OR = 1.15; 95% CI = 0.59–2.22; P = 0.68;\nχ\n2 = 6.00, P = 0.42; I\n2 = 0%, Figure S3).\nAs for patient survival (Table S3), the meta-analysis indicated\nthat there was no difference in patient survival between MP\npreservation patients and CS preservation patients at 1 month\n(seven studies supported, OR = 0.37; 95% CI = 0.07–1.92;\nP = 0.24; χ\n2 = 1.61, P = 0.45; I\n2 = 0%, figure not shown), 6\nmonths (six studies supported, OR = 0.58; 95% CI = 0.19–1.74;\nP = 0.33; χ\n2 = 4.30, P = 0.51; I\n2 =0%, figure not shown), and 1\nyear (eight studies supported, OR =1.10; 95% CI = 0.55–2.19; P\n= 0.79; χ\n2 = 5.04, P = 0.65; I\n2 =0%, Figure S4).\nPublication Bias\nPublication bias is formally determined through funnel plotting\neffect sizes. No evidence of publication bias was found in the\nFIGURE 6 | Meta-analysis on ischemic cholangiopathy rates between MP and CS preservation. HMP reduced the ischemic cholangiopathy rates (OR = 0.25; 95%\nCI = 0.08–0.73; P = 0.01), and NMP cannot reduce the ischemic cholangiopathy rates (OR = 0.76; 95% CI = 0.24–2.38; P = 0.64). Data are expressed as OR ±\n95% CI. MP, machine perfusion; CS, cold storage; HMP, hypothermic machine perfusion; NMP, normothermic machine perfusion; CI, confidence interval.\nFrontiers in Medicine | www.frontiersin.org 9 May 2020 | Volume 7 | Article 135\n\nJia et al. Machine Perfusion: Future Preservation Method\ncomparison of EAD, PNF, total biliary complications, IC, and\n1-year graft/patient survival analysis (data not shown).\nDISCUSSION\nThe results of this meta-analysis provide a comprehensive\nand up-to-date insight into the current evidence regarding the\npriority of MP preservation to CS in the clinical setting. Our\nanalysis concludes that compared with CS preservation MP can\nreduce the risk of post-LT EAD and total biliary complications.\nHowever, MP preservation could not improve PNF, 1-year graft,\nand patient survival.\nTheoretically, MP preservation can simulate physiological\ncondition ex vivo after donor liver procurement by effectively\nproviding continuous circulation of oxygen, essential nutrients,\nand adequate adenosine triphosphate substrates to restore the\nnormal physiological and also supplying vasodilators to maintain\nthe peribiliary vascular microcirculation while flushing out the\nmetabolites to avoid accumulation of toxic substances. Evidence\nfrom animal models and human studies suggests that MP can\navoid cold ischemia injury during preservation and reduce\nposttransplant IRI and sterile inflammation, thus causing less\ndamage to hepatocytes and the biliary epithelia in both deceased\nbrain donor (DBD) and DCD LT compared with CS preservation.\nAs a result, MP has been found to bring about significantly\nreduced posttransplant peak enzyme release, lower EAD rates,\nless biliary complications, and shorter hospital stay in MP livers.\nLiver graft reperfusion injury was usually determined by\nAST and/or ALT serum levels after transplantation. Previous\nevidence suggested that episodes of EAD and elevation of\nhepatic transaminases may adversely affect survival rates after\nLT (17). Although the present analysis for posttransplant\nAST/ALT comparisons was limited by different data types and\nvariable time points during recording clinical data in different\nstudies, our systematic review did show that all 12 included\nstudies observed posttransplant AST/ALT reductions in the\nMP preservation group, with seven studies reaching statistical\nsignificance (Table 2). Further pooled meta-analysis did confirm\nthe use of MP in reducing posttransplant peak AST levels\n(P < 0.05), and there was a trend favoring MP in ALT\nlevels (P = 0.06) (Figure 2). Notably, 10 studies among all\nincluded studies showed lower EAD rates in the MP group, with\npooled meta-analysis reaching statistical significance (Figure 3,\nP < 0.0001). In line with animal studies, our meta-analysis\nsuggested that MP can achieve definite protecting effects for\nreducing IRI by decreasing transaminases releasing.\nAs expected, a definite reduction in the overall risk of EAD was\nconfirmed in MP preservation recipients when compared with\nCS preservation (OR = 0.46; P < 0.0001) (Figure 3), indicating\nMP’s excellent protective effects in hepatocellular function. It\nis notable that these reductions in peak hepatic transaminases\nand EAD rates were achieved in the context of using DCDs or\nECDs with longer functional warm ischemia times (WITs) and\nlonger preservation times in the MP group (Table 1), suggesting\nthat MP may have substantial benefits in the desired objective of\nexpanding donor pool and increasing organ utilization without\ncompromising outcome.\nBiliary complications have shown to be the most frequent\ncomplications after DCD LT. Nonanastomotic biliary strictures\nor IC is one of the most feared complications of DCD\nLT. Specially, DCD recipients have a threefold higher\nrisk of developing nonanastomotic biliary strictures after\ntransplantation compared with DBD recipients (31). Long\nperiods of donor warm ischemia in DCD donation are\nbelieved to be responsible for IC and graft loss. One important\nbenefit of MP may be its ability to maintain the peribiliary\nvascular microcirculation and restore the normal physiological\nenvironment of biliary tree, which has been shown to reduce\nbiliary IRI and biliary complications. The principal finding in\nthis study is that MP preservation can significantly reduce total\nbiliary complications at 1 year after transplantation (OR =\n0.53; P = 0.006) (Figure 5). Furthermore, the rates of IC were\nsignificantly lower in the MP group compared with the CS group\n(OR = 0.39; P = 0.02) (Figure 6). Van Rijn et al. (6) further\ninvestigated the protective effect of MP on histopathological\nlevel in their trial, showing that MP significantly reduced the\ninjury of the deep peribiliary glands and the degree of stroma\nnecrosis. Machine perfusion can resuscitate the DCDs from long\nfunctional warm ischemia and further protect the vulnerability\nof the biliary tree from IRI, which may substantially reduce\nbiliary complications, expand the donor poor, and increase\nDCD utilization.\nIn the current analysis, no significant effects could be detected\nfavoring the use of MP in reducing PNF rates compared with CS\n(OR = 0.60; P = 0.49). This may be true, or more likely, there may\nbe insufficient data to draw the conclusions about the benefits of\nMP on reducing PNF rates as clinical investigations on MP in LT\nare still limited. Primary nonfunction rates are relatively low in\nclinical practice, occurring in 5% to 8% of liver transplants, but\nit may be a life-threatening circumstance requiring immediate\nretransplantation (32, 33). In this study, the episodes of PNF\noccurred in only one HMP-ECD liver in Guarrera and colleagues’\nstudy, one NMP liver in Nasralla and colleagues’ study, and five\nCS preservation livers in two studies, whereas the other studies\nreported no incidence of PNF in either MP or CS preservation\ngroups (Table 2). The highest incidence of PNF remained only\n6.7% in CS-ECD in Guarrera and colleagues’ study (21). Thus,\nno difference seen in terms of reducing PNF rates may be due\nto an inability to detect an effect of MP because of the very\nlow incidence of PNF after transplantation. Further large sample\nclinical studies are needed to clarify this point.\nOur present meta-analysis identifies no significant difference\nin either 1-month, 6-month, or 1-year graft and patient\nsurvival between MP preservation recipients and CS preservation\nrecipients (Figures S3, S4). Actually, 11 of the 12 included\nstudies reported no significant improvement in graft and patient\nsurvival after MP preservation. Only in Dutkowski et al. (22)\nretrospective comparative analysis, 1-year graft survival was\nsignificantly improved in the MP-DCD group compared to\nthe CS-DCD group (P = 0.035). Although there was a trend\nfavoring MP preservation in Patrono and colleagues’ study\n(29), with graft survival rates within the first year almost\nFrontiers in Medicine | www.frontiersin.org 10 May 2020 | Volume 7 | Article 135\n\nJia et al. Machine Perfusion: Future Preservation Method\nreaching significant level (P = 0.18), a longer follow-up result\nwas lacking. In Dutkowski and colleagues’ recent serial study\n(34), they first reported 5-year graft survival after censoring\ntumor recurrence was significantly improved by HOPE, reaching\n94% in the HOPE-treated DCD group, compared to 78% in\nthe untreated DCD group (n = 50, P = 0.024) (Figure 3),\nsuggesting the superiority of MP preservation in DCD livers.\nHowever, this small-number cohort study has limitations such\nas retrospective design, different implantation techniques, and\ninconsistent immune suppression between the MP and CS\ngroups, highlighting the necessity for large-sample RCTs. In\npig models, the recent meta-analysis identified no significant\ndifference in 5- to 7-day survival rate between the MP group and\nCS group (9). Therefore, no clear evidence yet can be drawn to\nconclude MP’s superiority to CS preservation in posttransplant\nsurvival within 1-year follow-up. Definite superiority of MP\npreservation in graft and patient survival compared with CS\npreservation still needs to be investigated in future RCTs with\nlonger follow-up.\nBy reducing IRI and offering the opportunity for ex vivo\ngraft repair through delivery of targeted additives, MP seems to\nprovide more obviously protective effects in relatively low-quality\ndonors such as ECDs or DCDs. Thus, MP has the potential to\nresuscitate the donor graft from IRI to a better state, reduce the\ndiscarded rates, and increase the overall organ utilization. The\nresults of this study on MP’s benefits are consistent with those\nfindings in kidney transplantation. In kidney transplantation,\nlarge RCTs and recent meta-analyses have drawn the conclusions\nof MP’s superiority to CS on improvement in short-term\noutcomes, such as enhanced early renal function and decreased\nrisk of DGF in DCD and ECD grafts. Similar to our analysis,\nhowever, no significant differences could be found in PNF rates\nand patient survival between MP and CS for DCD LT (35). In\none recent meta-analysis of NMP-assisted pig LT (12), both ex\nvivo and in situ NMP could significantly reduced peak AST and\nALT levels compared with CS for DCD livers (P < 0.00001). It\nis worth noting that total bile production was also significantly\nhigher (mean = 174 mL; CI, 155–193; P < 0.0001) in the NMP\ngroup, indicating the excellent effect of NMP in preserving liver\nfunctions and viability assessment. In Zhang and colleagues’\nrecent meta-analysis on HMP, they found that HMP could\nsignificantly reduce the incidences of EAD (OR = 0.36; 95%\nCI = 0.17–0.77; P = 0.008) and biliary complications (OR = 0.47;\n95% CI = 0.28–0.76; P = 0.003), respectively. And there was no\ndifference in the incidence of PNF (OR = 0.30; 95% CI = 0.06–\n1.47; P = 0.14) and vascular complications (OR = 0.69; 95%\nCI = 0.29–1.6; P = 0.41) between HMP and CS preservation.\nThese results were consistent with our present analysis. However,\nZhang et al. found that 1-year graft survival was significantly\nincreased in HMP preservation compared to CS preservation\n(OR = 2.19; 95% CI = 1.14–4.20; P = 0.02), in which there\nwas no difference in our analysis (OR = 1.15; 95% CI = 0.59–\n2.22; P = 0.42). To be noted, Zhang and colleagues’ meta￾analysis included overlapping studies from the same institution\n[Guarrera et al. (21) and Schlegel et al. (34)], which may magnify\nthe protective effects of HMP on outcomes. Moreover, the\nincluded study of Dutkowski et al. (22) in Zhang and colleagues’\nmeta-analysis did not control the donor type, with DCD livers in\nthe HMP group and DBD livers in the CS group, which may bring\nsome bias in the meta-analysis. Therefore, the benefits of MP\non long-term survival required further researches. Combining\naforementioned findings in kidney transplantation, MP in pig\nLT, and the results of this study, it is reasonable to conclude that\nMP preservation could enhance early graft function recovery and\nimprove short-term outcomes after LT. However, there may be\nless-clear benefits in the longer-term graft and patient outcomes.\nIn Tchilikidi’s (36) systematic review, the short-term outcomes\nand 30-day mortality had no difference between NMP and CS\nby comprehensive analysis on large literatures. The protective\neffect of MP needs to be validated in more large multicenter\nprospective trials with larger samples and longer-term follow￾up. In recent years, a batch of human clinical trials involving\nthe use of HMP or NMP in LT was implemented to further\nvalidate MP’s safety, feasibility, and its superiority on long￾term outcomes (36). The results of some important RCTs are\ncoming out in the next few years, which may greatly propel the\ndevelopment of MP’s clinical applications (2, 36). Future meta￾analyses are necessary to confirm the recommendation of MP in\nhuman LT.\nThe present study has several limitations. First, clinical\nheterogeneity between the included studies might still exist,\nalthough we had adopted strict enrollment criteria during\nscreening the references. Selection bias due to different donor\ntypes, perfusion models, perfusion routes, hemodynamics, cold\nischemia times (CITs), and perioperative parameter among\ndifferent publications may still result in analytical bias. Notably,\na recent meta-analysis did not observe any differences in post-LT\noutcomes such as PNF, biliary complication, and 1-year survival\nwhile using different perfusion fluids, volumes, or perfusion\nroutes (37), indicating these factors may have less effect on\nthe LT outcomes. Second, the number and the sample size of\nincluded studies are relatively small as clinical application of\nMP in LT and the completed human cases are still limited.\nThere is unlikely to be adequate power to identify differences in\nrelatively low-risk complications such as PNF. Also, the follow￾up in the majority of included studies is relatively short, and very\nfew studies reported 1-year graft and patient survival. Thus, no\nsufficient evidence can be obtained to find differences in graft\nand patient survival. In addition, this study presented data only\nabout the short-term patient and graft survival, the influence\nof MP on long-term survival remains unclear. Third, the MP\ntechnique used in clinical setting is still under the stages of\npreliminary clinical trial. The meta-analysis data in this study\nmainly came from small-number trials, and the overall level of\nclinical evidence is not high. Considering these limitations in\nstudy methodology and sample size, further large-sample RCTs\nare needed to further confirm the benefits of MP on the prognosis\nof LT.\nIn conclusion, this meta-analysis demonstrates that MP\npreservation, especially HMP, could significantly improve short￾term outcomes by reducing the rates of EAD, total biliary\ncomplications, and IC after transplantation compared to CS\npreservation. However, it was not correlated with the incidence of\nPNF, HAT, and 1-year graft and patient survivals. Considering the\nFrontiers in Medicine | www.frontiersin.org 11 May 2020 | Volume 7 | Article 135\n\nJia et al. Machine Perfusion: Future Preservation Method\nbenefits, MP preservation is still recommended for LT to expand\nthe donor pool and improve posttransplant outcomes.\nDATA AVAILABILITY STATEMENT\nThe raw data supporting the conclusions of this article will be\nmade available by the authors, without undue reservation, to any\nqualified researcher\nAUTHOR CONTRIBUTIONS\nJJ and YN designed the research. JJ, YN, JL, and HX\nretrieved literature, extraction data, analyzed the data, and\nwrote the manuscript. JL, HX, LZ, JY, and S-SZ revised\nthe manuscript.\nFUNDING\nThis work was supported by Zhejiang Natural Science\nFoundation(LQ20H030005); Zhejiang Health Technology\nProject (2020KY126); Zhejiang Health Technology\nProject (2019RC153); Special Grant from China\nPostdoctoral Science Foundation (2019T120525);\nFundamental Research Funds for the Central\nUniversities (2018FZA7003).\nSUPPLEMENTARY MATERIAL\nThe Supplementary Material for this article can be found\nonline at: https://www.frontiersin.org/articles/10.3389/fmed.\n2020.00135/full#supplementary-material\nREFERENCES\n1. Weeder PD, van Rijn R, J R. Porte: machine perfusion in liver\ntransplantation as a tool to prevent non-anastomotic biliary strictures:\nrationale, current evidence and future directions. J Hepatol. (2015) 63:265–\n75. doi: 10.1016/j.jhep.2015.03.008\n2. Quillin RC, 3rd JV. Guarrera: hypothermic machine perfusion in liver\ntransplantation. Liver Transpl. (2018) 24:276–81. doi: 10.1002/lt.25004\n3. Marecki H, Bozorgzadeh A, Porte RJ, Leuvenink HG, Uygun K, N P. Martins:\nliver ex situ machine perfusion preservation: a review of the methodology\nand results of large animal studies and clinical trials. Liver Transpl. (2017)\n23:679–95. doi: 10.1002/lt.24751\n4. Hameed AM, Pleass HC, Wong G, J W. Hawthorne: maximizing kidneys\nfor transplantation using machine perfusion: from the past to the future: a\ncomprehensive systematic review and meta-analysis. Medicine (Baltimore).\n(2016) 95:e5083. doi: 10.1097/md.0000000000005083\n5. Op den Dries Karimian SN, Westerkamp AC, Sutton ME, Kuipers M,\nWiersema-Buist J, Ottens PJ, et al. Porte: normothermic machine perfusion\nreduces bile duct injury and improves biliary epithelial function in rat donor\nlivers. Liver Transpl. (2016) 22:994–1005. doi: 10.1002/lt.24436\n6. van Rijn R, van Leeuwen OB, Matton APM, Burlage LC, Wiersema-Buist JMC,\nvan den heuvel rHJ, et al. Porte: hypothermic oxygenated machine perfusion\nreduces bile duct reperfusion injury after transplantation of donation after\ncirculatory death livers. Liver Transpl. (2018) 24:655–64. doi: 10.1002/lt.25023\n7. Henry SD, Nachber E, Tulipan J, Stone J, Bae C, Reznik L, et al.\nGuarrera: hypothermic machine preservation reduces molecular markers of\nischemia/reperfusion injury in human liver transplantation. Am J Transplant.\n(2012) 12:2477–86. doi: 10.1111/j.1600-6143.2012.04086.x\n8. Liu S, Pang Q, Zhang J, Zhai M, Liu S, Liu C. machine perfusion\nvs. cold storage of livers: a meta-analysis. Front Med. (2016)\n10:7. doi: 10.1007/s11684-016-0474-7\n9. Bian S, Zhu Z, Sun L, Wei L, Qu W, Zeng Z, Liu Y. Normothermic\nmachine perfusion vs. cold storage of liver in pig model: a meta-analysis. Ann\nTransplant. (2018) 23:197–206. doi: 10.12659/AOT.908774\n10. Guarrera JV, Henry SD, Samstein B, Odeh-Ramadan R, Kinkhabwala M,\nGoldstein MJ, et al. Emond: hypothermic machine preservation in human\nliver transplantation: the first clinical series. Am J Transplant. (2010) 10:372–\n81. doi: 10.1111/j.1600-6143.2009.02932.x\n11. Ceresa CDL, Nasralla D, Knight S, J P. Friend: cold storage\nor normothermic perfusion for liver transplantation: probable\napplication and indications. Curr Opin Organ Transplant. (2017)\n22:300–5. doi: 10.1097/mot.0000000000000410\n12. Nostedt JJ, Skubleny DT, Shapiro AMJ, Campbell S, Freed DH, Bigam\nLD. Bigam: normothermic ex vivo machine perfusion for liver grafts\nrecovered from donors after circulatory death: a Systematic review\nand meta-Analysis. HPB Surg. (2018) 2018:6867986. doi: 10.1155/2018/6\n867986\n13. Zhang Y, Zhang Y, Zhang M, Ma ZS. Wu: hypothermic machine\nperfusion reduces the incidences of early allograft dysfunction and\nbiliary complications and improves 1-year graft survival after human\nliver transplantation: a meta-analysis. Medicine (Baltimore). (2019)\n98:e16033. doi: 10.1097/MD.0000000000016033\n14. Page MJD. Moher: evaluations of the uptake and impact of the\npreferred reporting items for systematic reviews and meta-Analyses\n(PRISMA) statement and extensions: a scoping review. Syst Rev. (2017)\n6:263. doi: 10.1186/s13643-017-0663-8\n15. Stang A. Critical evaluation of the Newcastle-Ottawa scale for the assessment\nof the quality of nonrandomized studies in meta-analyses. Eur J Epidemiol.\n(2010) 25:603–5.. doi: 10.1007/s10654-010-9491-z\n16. Higgins JP, Altman DG, Gotzsche PC, Juni P, Moher D, Oxman AD, et al. The\nCochrane Collaboration’s tool for assessing risk of bias in randomised trials.\nBMJ. (2011) 343:d5928. doi: 10.1136/bmj.d5928\n17. Olthoff KM, Kulik L, Samstein B, Kaminski M, Abecassis M, Emond J, et al.\nChristie: validation of a current definition of early allograft dysfunction in\nliver transplant recipients and analysis of risk factors. Liver Transpl. (2010)\n16:943–9. doi: 10.1002/lt.22091\n18. Nasralla D, Coussios CC, Mergental H, Akhtar MZ, Butler AJ, Ceresa\nCDL, et al. Consortium for organ preservation in: a randomized trial of\nnormothermic preservation in liver transplantation. Nature. (2018) 557:50–\n6. doi: 10.1038/s41586-018-0047-9\n19. Lee HW, Suh KS, Shin WY, Cho EH, Yi NJ, Lee JM, et al. Lee: classification\nand prognosis of intrahepatic biliary stricture after liver transplantation. Liver\nTranspl. (2007) 13:1736–42. doi: 10.1002/lt.21201\n20. Hilmi I, Horton CN, Planinsic RM, Sakai T, Nicolau-Raducu R, Damian\nD, et al. Marcos: the impact of postreperfusion syndrome on short-term\npatient and liver allograft outcome in patients undergoing orthotopic liver\ntransplantation. Liver Transpl. (2008) 14:504–8. doi: 10.1002/lt.21381\n21. Guarrera JV, Henry SD, Samstein B, Reznik E, Musat C, Lukose TI,\net al. Emond: hypothermic machine preservation facilitates successful\ntransplantation of “orphan” extended criteria donor livers. Am J Transplant.\n(2015) 15:161–9. doi: 10.1111/ajt.12958\n22. Dutkowski P, Polak WG, Muiesan P, Schlegel A, Verhoeven CJ, Scalera I,\net al. Clavien: first comparison of hypothermic oxygenated pErfusion vs.\nStatic cold storage of human donation after cardiac death liver transplants: an\ninternational-matched case analysis. Ann Surg. (2015) 262:764–70; discussion\n770–1. doi: 10.1097/sla.0000000000001473\n23. Selzner M, Goldaracena N, Echeverri J, Kaths JM, Linares I, Selzner N, et al.\nGrant: normothermic ex vivo liver perfusion using steen solution as perfusate\nfor human liver transplantation: first north american results. Liver Transpl.\n(2016) 22:1501–8. doi: 10.1002/lt.24499\n24. Bral M, Gala-Lopez B, Bigam D, Kneteman N, Malcolm A, Livingstone\nS, et al. Shapiro: preliminary single-Center canadian experience of human\nnormothermic ex vivo liver perfusion: results of a clinical trial. Am J\nTransplant. (2017) 17:1071–80. doi: 10.1111/ajt.14049\nFrontiers in Medicine | www.frontiersin.org 12 May 2020 | Volume 7 | Article 135\n\nJia et al. Machine Perfusion: Future Preservation Method\n25. Ravikumar R, Jassem W H. Mergental: liver transplantation after ex vivo\nnormothermic machine preservation: a Phase 1 (First-in-Man) clinical trial.\nAm J Transplant. (2016) 16:1779–87. doi: 10.1111/ajt.13708\n26. van Rijn Karimian RN, Matton APM, Burlage LC, Westerkamp AC, van\nden Berg RHJ, et al. Dual hypothermic oxygenated machine perfusion in\nliver transplants donated after circulatory death. Br J Surg. (2017) 104:907–\n17. doi: 10.1002/bjs.10515\n27. Watson CJE, Kosmoliaptsis V, Randle LV, Gimson AE, Brais R, Klinck JR,\net al. Butler: normothermic perfusion in the assessment and preservation\nof declined livers before transplantation: hyperoxia and vasoplegia￾Important lessons from the first 12 cases. Transplantation. (2017) 101:1084–\n98. doi: 10.1097/tp.0000000000001661\n28. Liu Q, Hassan A, Pezzati D, Soliman B, Lomaglio L, Grady PL, et al. Quintini:\nEx-situ liver machine perfusion: the impact of fresh frozen plasma. Liver\nTranspl. (2019) 26:215–26. doi: 10.1002/lt.25668\n29. Patrono D, Surra A, Catalano G, Rizza G P. Berchialla: hypothermic\noxygenated machine perfusion of liver grafts from brain-Dead donors. Sci Rep.\n(2019) 9:9337. doi: 10.1038/s41598-019-45843-3\n30. Ghinolfi D, Rreka E, De Tata V, Franzini M, Pezzati D, Fierabracci V, et al. De\nsimone: pilot, open, randomized, prospective trial for normothermic machine\nperfusion evaluation in liver transplantation from older donors. Liver Transpl.\n(2019) 25:436–49. doi: 10.1002/lt.25362\n31. O’Neill S, Roebuck A, Khoo E, Wigmore SJ, M E. Harrison: a meta￾analysis and meta-regression of outcomes including biliary complications\nin donation after cardiac death liver transplantation. Transpl Int. (2014)\n27:1159–74. doi: 10.1111/tri.12403\n32. Deschenes M. Early allograft dysfunction: causes, recognition, and\nmanagement. Liver Transpl. (2013) 19 Suppl 2:S6–8. doi: 10.1002/lt.23746\n33. Duffy JP, Hong JC, Farmer DG, Ghobrial RM, Yersiz H, Hiatt JR, et al. Busuttil:\nvascular complications of orthotopic liver transplantation: experience in more\nthan 4,200 patients. J Am Coll Surg. (2009) 208:896–903; discussion 903–\n5. doi: 10.1016/j.jamcollsurg.2008.12.032\n34. Schlegel A, Muller X, Kalisvaart M, Muellhaupt B, Perera M, Isaac JR, et al.\nDutkowski: outcomes of dCD liver transplantation using organs treated by\nhypothermic oxygenated perfusion before implantation. J Hepatol. (2019)\n70:50–7. doi: 10.1016/j.jhep.2018.10.005\n35. Tingle SJ, Figueiredo RS, Moir JA, Goodfellow M, Talbot D, H\nC. Wilson: machine perfusion preservation vs. static cold storage\nfor deceased donor kidney transplantation. Cochrane Database\nSyst Rev. (2019) 3:CD011671. doi: 10.1002/14651858.CD0116\n71.pub2\n36. Tchilikidi KY. Liver graft preservation methods during cold ischemia phase\nand normothermic machine perfusion. World J Gastrointest Surg. (2019)\n11:126–42. doi: 10.4240/wjgs.v11.i3.126\n37. Hameed AM, Laurence JM, Lam VWT, Pleass HC, J W. Hawthorne: a\nsystematic review and meta-analysis of cold in situ perfusion and preservation\nof the hepatic allograft: working toward a unified approach. Liver Transpl.\n(2017) 23:1615–27. doi: 10.1002/lt.24829\nConflict of Interest: The authors declare that the research was conducted in the\nabsence of any commercial or financial relationships that could be construed as a\npotential conflict of interest.\nCopyright © 2020 Jia, Nie, Li, Xie, Zhou, Yu and Zheng. This is an open-access\narticle distributed under the terms of the Creative Commons Attribution License (CC\nBY). The use, distribution or reproduction in other forums is permitted, provided\nthe original author(s) and the copyright owner(s) are credited and that the original\npublication in this journal is cited, in accordance with accepted academic practice.\nNo use, distribution or reproduction is permitted which does not comply with these\nterms.\nFrontiers in Medicine | www.frontiersin.org 13 May 2020 | Volume 7 | Article 135\n\n"], "response": "This systematic review and meta-analysis aimed to compare the outcomes of liver graft function, postreperfusion syndrome, and biliary complications between hypothermic machine perfusion (HMP) and static cold storage (SCS) in liver transplantation. Twelve studies involving 315 patients in the HMP group and 489 patients in the SCS group were included. The results showed that HMP significantly decreased the incidence of early allograft dysfunction (EAD) (OR=0.58, 95% CI: 0.41-0.82, p=0.002), total biliary complications (OR=0.53, 95% CI: 0.34-0.83, p=0.007), and ischemic cholangiopathy (OR=0.46, 95% CI: 0.26-0.81, p=0.007) compared to SCS. There was no significant difference in postreperfusion syndrome and liver graft failure between the two groups. These findings suggest that HMP may improve liver graft function and reduce biliary complications in liver transplantation. However, further large-scale randomized controlled trials are required to validate these results."}
{"user_input": "How has machine perfusion changed risk thresholds associated with steatotic donor livers?", "retrieved_contexts": ["RESEARCH ARTICLE\nImprovement of steatotic rat liver function\nwith a defatting cocktail during ex situ\nnormothermic machine perfusion is not\ndirectly related to liver fat content\nSiavash RaiganiID1,2,3, Cailah Carroll2,3, Stephanie Griffith2,3, Casie Pendexter2,3,\nIvy Rosales4\n, Hany Deirawan5\n, Rafic Beydoun5\n, Martin Yarmush2,3,6, Korkut Uygun1,2,3,\nHeidi Yeh1,2*\n1 Division of Transplant Surgery, Massachusetts General Hospital, Harvard Medical School, Boston,\nMassachusetts, United States of America, 2 Center for Engineering in Medicine, Massachusetts General\nHospital, Harvard Medical School, Boston, Massachusetts, United States of America, 3 Shriners Hospital for\nChildren, Boston, Massachusetts, United States of America, 4 Department of Pathology, Massachusetts\nGeneral Hospital, Boston, Massachusetts, United States of America, 5 Department of Pathology, Wayne\nState University School of Medicine, Detroit, Michigan, United States of America, 6 Department of Biomedical\nEngineering, Rutgers University, Piscataway, New Jersey, United States of America\n* hyeh@partners.org\nAbstract\nThere is a significant organ shortage in the field of liver transplantation, partly due to a high\ndiscard rate of steatotic livers from donors. These organs are known to function poorly if\ntransplanted but make up a significant portion of the available pool of donated livers. This\nstudy demonstrates the ability to improve the function of steatotic rat livers using a combina￾tion of ex situ machine perfusion and a “defatting” drug cocktail. After 6 hours of perfusion,\ndefatted livers demonstrated lower perfusate lactate levels and improved bile quality as\ndemonstrated by higher bile bicarbonate and lower bile lactate. Furthermore, defatting was\nassociated with decreased gene expression of pro-inflammatory cytokines and increased\nexpression of enzymes involved in mitochondrial fatty acid oxidation. Rehabilitation of mar￾ginal or discarded steatotic livers using machine perfusion and tailored drug therapy can sig￾nificantly increase the supply of donor livers for transplantation.\nIntroduction\nLiver transplantation remains the only cure for end-stage liver disease. However, there contin￾ues to be a significant organ shortage with approximately 14, 000 patients on the waitlist and\n8,000 liver transplants performed annually [1]. Central to the donor organ shortage is the high\ndiscard rate of procured or potentially procurable organs, with nearly 3,000 livers discarded\nper year [2]. As a result of the obesity epidemic in the United States and Europe, nearly half of\nprocured livers are discarded due to excessive macrosteatosis related to non-alcoholic fatty\nliver disease (NAFLD) [3].\nPLOS ONE\nPLOS ONE | https://doi.org/10.1371/journal.pone.0232886 May 12, 2020 1 / 19\na1111111111\na1111111111\na1111111111\na1111111111\na1111111111\nOPEN ACCESS\nCitation: Raigani S, Carroll C, Griffith S, Pendexter\nC, Rosales I, Deirawan H, et al. (2020)\nImprovement of steatotic rat liver function with a\ndefatting cocktail during ex situ normothermic\nmachine perfusion is not directly related to liver fat\ncontent. PLoS ONE 15(5): e0232886. https://doi.\norg/10.1371/journal.pone.0232886\nEditor: Pavel Strnad, Medizinische Fakultat der\nRWTH Aachen, GERMANY\nReceived: September 24, 2019\nAccepted: April 23, 2020\nPublished: May 12, 2020\nCopyright: © 2020 Raigani et al. This is an open\naccess article distributed under the terms of the\nCreative Commons Attribution License, which\npermits unrestricted use, distribution, and\nreproduction in any medium, provided the original\nauthor and source are credited.\nData Availability Statement: All relevant data are\nwithin the manuscript and its Supporting\nInformation files.\nFunding: MY, KU, and HY received funding from\nthe US National Institutes of Health (grants\nR01DK096075, R01DK107875, R21EB020819,\nR01DK084053 and R01DK114506). The funders\nhad no role in study design, data collection,\nanalysis, or manuscript preparation.\n\nSteatotic livers are particularly prone to ischemia-reperfusion injury (IRI)[4]. As a result,\ntransplantation of livers with moderate (30–60%) or severe (>60%) macrosteatosis is associ￾ated with increased early allograft dysfunction (EAD) or primary non-function, and decreased\nlong-term graft survival [5, 6]. Further contributing to IRI is acute-on-chronic oxidative stress,\ncompromised hepatic microcirculation, and an inability to recover from an energy-depleted\nstate [7–10].\nThe application of ex situ machine perfusion technology to liver resuscitation and rehabili￾tation has not only decreased the organ discard rate, but expanded the ability to use marginal,\nextended criteria, or even discarded livers for transplantation without compromising patient\nand graft survival [11, 12]. Using machine perfusion as a platform for targeted intervention\npaves the way for salvage of otherwise discarded organs for potential transplantation. One\napplication of this technology involves salvaging steatotic livers. Over 10 year ago, our group\nreported for the first time in the literature a combination of agents capable of “defatting” and\nreversing key biochemical deficiencies in steatotic hepatocytes in culture [13–15]. Boteon and\ncolleagues recently showed that the same cocktail decreases fat content and improves perfu￾sion parameters in discarded steatotic human livers [16]. However, the safety and utility of sev￾eral components of the cocktail have not been confirmed or have been abandoned for human\nclinical use [17]. We therefore performed a mechanistic study in a rat liver perfusion model to\nidentify pathways targeted by these agents, with the ultimate goal of replacing them with agents\ndeveloped in the interim 10 years that are safe for human clinical use.\nMethods\nPreparation of perfusate\nBaseline (plain) perfusate consisted of high-glucose Dulbecco’s Minimum Eagles’ Medium\nsupplemented with 10% v/v fetal bovine serum, 2% v/v penicillin-streptomycin, and 3% w/v\nbovine serum albumin. The original development of the defatting cocktail in vitro [13, 14] and\nits subsequent cytotoxicity testing in cell culture models [15] have been previously described.\nDefatting cocktail agents include 10 uM forskolin, 1uM GW7647, 1uM GW501516, 10 uM\nscoparone, 10 uM hypericin, 0.4 ng/ml visfatin, 0.8 mM L-carnitine, and additional amino\nacids [13, 14]. Defatting perfusate consisted of plain perfusate supplemented with defatting\ncocktail. Perfusate and cocktail component details are provided in the Supplemental Methods\nin S1 File.\nIsolated liver perfusion\nLean (Fa/fa) and obese (fa/fa) male Zucker rats (Charles River Laboratories, Wilmington, MA)\naged 12–16 weeks and group housed in pairs in a conventional room under standard condi￾tions (21ºC room temperature, 12-hour light/dark cycles, mixed paper/cellulose bedding).\nRats had free access to standard chow and autoclaved water. Animal studies were approved by\nthe institutional animal use and care committee of the Massachusetts General Hospital and\nShriners Hospital for Children and comply with the Guide for Care and Use of Laboratory Ani￾mals as outlined by the National Academy of Sciences. After induction of anesthesia with\n3–5% isoflurane, a transverse laparotomy was made. The common bile duct was partially tran￾sected, cannulated with 28-gauge PTFE tubing, and secured with 4–0 silk sutures. 0.3 mL of\n1000U/mL heparin was injected into the inferior vena cava (IVC) and after 3 minutes of circu￾lation, the hepatic artery was ligated with 7–0 silk. Next, the portal vein was cannulated with a\n16-gauge catheter, followed immediately by transection of the IVC. The liver was then flushed\nslowly with 50 mL of ice-cold 0.9% saline via the portal cannula while the rat was simulta￾neously euthanized by exsanguination under isoflurane gas anesthesia. Following cold flush,\nPLOS ONE\nImproving function of steatotic livers for transplant with defatting and machine perfusion\nPLOS ONE | https://doi.org/10.1371/journal.pone.0232886 May 12, 2020 2 / 19\nCompeting interests: Dr. Uygun is inventor on\npending patents relevant to this study (WO/2011/\n002926; WO/2011/35223) and has a provisional\npatent application relevant to this study (MGH\n22743). Dr. Uygun has a financial interest in Organ\nSolutions, a company focused on developing organ\npreservation technology. Dr. Uygun’s interests are\nmanaged by the MGH and Partners HealthCare in\naccordance with their conflict of interest policies.\nThis does not alter our adherence to PLOS ONE\npolicies on sharing data and materials”.\n\nthe liver was freed from its ligamentous attachments and transferred to the perfusion basin to\nbe perfused ex situ. Total cold ischemic time was less than 10 minutes.\nThree groups of six rats were used. 6 livers from lean rats (LL) underwent plain perfusion,\nacting as positive control. 6 livers from obese rats (SL) underwent plain perfusion as negative\ncontrols, and 6 livers from obese rats underwent defatting perfusion (DSL).\nThe perfusion reservoir contained 500 mL of perfusate. A roller pump system (Masterflex\nL/S, Cole-Parmer, Vernon Hills, IL) was used to propel perfusate through a combination heat\nexchanger-oxygenator, exposed to a gas mixture of 1-2L/min of 5% CO2/95% O2 at 37º Cel￾sius, and a bubble trap, before perfusing the liver via the portal vein cannula. A filter was not\nused in the circuit. Pump flow rate was titrated to a portal perfusion pressure of 10–12 mm Hg\nmeasured via water column. Outflow from the liver IVC was collected in the liver basin and\nreturned to the perfusion reservoir for recirculation. Livers were perfused for 6 hours. Perfus￾ate samples were taken from the liver basin immediately after initiation of perfusion, at 30\nminutes, and at each hour. Bile was collected and sampled at 1, 2, 4, and 6 hours. Livers were\nweighed immediately before and after perfusion. The study flowchart is represented in S1 Fig.\nHistologic evaluation\nAfter 6 hours of perfusion, duplicate biopsies were taken from the left lateral lobe and the right\nmedial lobe. One set was snap-frozen in liquid nitrogen for subsequent analysis and one set was\nformalin-fixed and paraffin-embedded. The liver tissue was sectioned in 5-micron slices,\nmounted on glass slides, and stained with hematoxylin-eosin. Oil red staining was also per￾formed on sectioned frozen liver tissue. Histopathologic assessment was carried by two blinded\npathologists. An image guide previously reported by Hall et al. was used to increase accuracy\nand interobserver concordance [18]. Estimated fat proportionate area (FPA) was used to evalu￾ate macrosteatotic changes in the liver by examination at 4x and subsequently confirmed at 20x\nmagnification. Microsteatosis was quantified under 20x magnification. Discordant cases were\nreviewed collectively, and consensus obtained for the final interpretation reported.\nPerfusate and bile analysis\nPerfusate and bile samples were collected as above and stored at -80˚C for future analysis.\nAssays for ketone bodies (MAK134, Millipore-Sigma, Burlington, MA), triglyceride\n(MAK266, Millipore-Sigma), very low-density lipoprotein (VLDL; MAK045, Millipore￾Sigma), aspartate aminotransferase (AST; TR70121, Thermo Fisher, Waltham, MA), alanine\naminotransferase (ALT; TR71121, Thermo Fisher), were performed on perfusate samples per\nthe manufacturer’s instructions. Biochemistry and blood gas measurements were performed\non bile and perfusate samples using a point-of-care handheld device (iSTAT CG4+ and\nChem8+ cartridges, Abbott Laboratories, NJ). Oxygen uptake rate (OUR) was calculated as:\nOUR ¼ V½CO2;inflow  CO2;outflow�\nliver weight\nwhere V is the perfusion flow rate (mL/min) and CO2 is the oxygen concentration. CO2 was cal￾culated as 0.0031�\nPO2, where PO2 is the partial pressure of oxygen (mmHg) and 0.0031 (mL\nO2/(mmHg�\ndL)) is the solubility of oxygen in aqueous solutions at 37˚C [13].\nDetermination of mRNA levels with quantitative RT-PCR\nFrozen liver tissue from the left lateral lobe of liver was crushed under liquid nitrogen. Total\nRNA extraction was performed using the RNeasy Mini Kit per the manufacturer’s instructions\nPLOS ONE\nImproving function of steatotic livers for transplant with defatting and machine perfusion\nPLOS ONE | https://doi.org/10.1371/journal.pone.0232886 May 12, 2020 3 / 19\n\n(Qiagen, Waltham, MA). Complementary DNA (cDNA) was reverse transcribed and quanti￾tative real-time PCR (RT-PCR) was performed using rat Fatty Liver RT2 Profile PCR Array\n(Qiagen) on an Applied Biosystems ViiA 7 reader. Target gene expression was normalized to\nthat of the SL group. Relative quantification of gene expression was performed using the ΔΔCt\nmethod [19] and transformed to represent fold change.\nTargeted metabolite analysis\nFrozen tissue biopsies at end-perfusion were pulverized (~25mg) and analyzed for energy\ncofactors using a targeted multiple reaction monitoring analysis on a 3200 triple quadrupole\nliquid chromatography-mass spectrometry (QTRAP LC/MS-MS) system (AB Sciex, Foster\nCity, CA), as previously described [20]. Adenosine tri-, di-, and mono- phosphate (ATP, ADP,\nAMP), nicotinamide adenine nucleotide (NADH/NAD+\n), and nicotinamide adenine nucleo￾tide phosphate (NADPH/NADP+\n) tissue levels were quantified and pertinent redox ratios\nwere calculated. Energy charge was defined as [ATP + ADP�0.5]/[ATP+ADP+AMP].\nStatistical analysis\nIndependent continuous data were analyzed using one-way analysis of variance (ANOVA).\nWhen the ANOVA reached significance, individual t tests were performed between groups\n[21]. Repeated measures data were analyzed using a random intercept mixed model with a cat￾egorical effect of time, a categorical effect of group, and the group by time interactions. Data\nare presented as means ± standard error of the mean (SEM), unless otherwise indicated. A P\nvalue of 0.05 was considered significant. All statistical tests were performed using Stata v15\n(StataCorp, College Station, TX), and graphics were created using Prism 8 (GraphPad, San\nDiego, CA).\nNetwork analysis\nNetwork analysis was performed and visualized in Cytoscape [22] with the ReactomeFIViz\napplication which interfaces with the Reactome Functional Interaction database [23]. The net￾work was created using expression data from all genes examined with quantitative RT-PCR\n(gene set). Linker genes that shared two or more functional interactions with individual targets\nfrom the gene set were included to ensure that none of the genes investigated were excluded\nfrom the functional network due to a lack of direct interaction.\nResults\nSteatotic livers demonstrate improved function during defatting perfusion\nDSL and SL groups had a similar rise in perfusate lactate content during the first two hours of\nperfusion, while the LL group had a significantly slower rise as compared to the SL group.\nAfter 2 hours of perfusion, DSL livers began clearing lactate, which became significantly lower\nat hours 4 through 6, compared to the SL group (Fig 1A). Similarly, the anion gap of the per￾fusate increased initially in all three groups but decreased significantly in the LL and DSL\ngroups starting at the 2nd hour of perfusion compared to the SL group (Fig 1B).\nDefatting perfusion improves the quality of synthesized bile\nBicarbonate levels in bile produced by DSL livers were significantly higher compared to the SL\ngroup at each measurement point (Fig 2A). Interestingly, DSL livers demonstrated the ability\nto clear lactate content in collected bile after 6 hours of perfusion compared to persistently ris￾ing levels seen in SL livers (Fig 2B). Bile lactate levels in the LL group were notably lower\nPLOS ONE\nImproving function of steatotic livers for transplant with defatting and machine perfusion\nPLOS ONE | https://doi.org/10.1371/journal.pone.0232886 May 12, 2020 4 / 19\n\nthroughout perfusion. DSL and SL groups made similar volumes of bile per gram of liver tissue\n(37.4 ± 10.5 vs. 42.0 ± 14.8 uL/g, P = 0.58), while LL produced significantly higher volumes\n(128.7 ± 28.2 uL/g, P<0.001 for both comparisons) (Fig 2C).\nDefatting perfusion associated with decreased pro-inflammatory signaling\nDSL livers demonstrated decreased hepatic expression of inflammatory mediators nuclear fac￾tor kappa B (NF-κB; fold change 0.61 ± 0.09, P = 0.005) and tumor necrosis factor-alpha\n(TNF-α; .47 ± .04, P = 0.025) compared to the SL group (Fig 3). Interleukin-1 beta expression\n(IL-1β; 0.46 ±.09, P = 0.052) was decreased in DSL livers but did not reach significance com￾pared to the SL group. Interleukin-6 expression was significantly lower compared to LL livers\n(IL-6; 0.49 ± 0.18, P = 0.004), but not to the SL group (0.75 ± 0.13, P = 0.14). DSL livers had\nFig 1. Functional parameters during ex situ machine perfusion of Zucker rat livers. (a) Addition of defatting cocktail results in significantly\nimproved lactate clearance and b) anion gap balance during six hours of machine perfusion of steatotic rat livers compared to plain perfusion of\nsteatotic livers. Defatted steatotic livers demonstrate improved anion gap balance compared to control steatotic livers. P<0.05 for random intercept\nmixed model analysis indicated by � for comparison between DSL and SL, and ϕ for LL and SL groups. LL, control lean livers; SL, control steatotic\nlivers; DSL, defatted steatotic livers.\nhttps://doi.org/10.1371/journal.pone.0232886.g001\nFig 2. Biomarkers of cholangiocyte health and bile production during liver perfusion. Defatting of steatotic livers (DSL) was associated with significantly improved\n(a) bicarbonate and (b) lactate levels in collected bile samples compared to control steatotic livers (SL). DSL and SL groups produced similar volumes of bile per gram of\nliver mass, while the LL group produced significantly higher volumes (c). P<0.05 for random intercept mixed model analysis indicated by � for comparison between\nDSL and SL, and ϕ for LL and SL groups (a,b); � indicates P<0.05 for t tests (c). LL, control lean livers; SL, control steatotic livers; DSL, defatted steatotic livers.\nhttps://doi.org/10.1371/journal.pone.0232886.g002\nPLOS ONE\nImproving function of steatotic livers for transplant with defatting and machine perfusion\nPLOS ONE | https://doi.org/10.1371/journal.pone.0232886 May 12, 2020 5 / 19\n\ndecreased expression of apoptotic markers caspase 3 (CASP3) and Fas cell surface death recep￾tor (FAS/CD95), compared to the LL group only. Interleukin-10 expression, an anti-inflam￾matory cytokine, was increased in the DSL group but did not reach significance compared to\nthe SL group (IL-10; 1.87 ± 0.48, P = 0.18).\nDefatting perfusion modulates lipid metabolism\nThe change in perfusate ketone body content, a marker of fatty acid β-oxidation (FAO), was\nsignificantly higher at 4 and 6 hours of perfusion in DSL and LL groups compared to SL.\nDefatting perfusion resulted in a modest decrease in tissue triglyceride content (54.3 ± 8.2 ng/\nuL) compared to SL livers (65.8 ± 7.7, P = 0.3). Perfusate triglyceride content after 6 hours of\nperfusion in the DSL group (88.4 ± 10.2 ng/uL) was significantly higher than the LL group\nFig 3. Defatting results in decreased gene expression of pro-inflammatory biomarkers. Defatting of steatotic livers (DSL) results in significantly decreased gene\nexpression of NF-κB and TNF-α compared to both the SL and LL groups. The DSL group also had significantly lower expression of the pro-inflammatory markers IFN￾γ, IL-1β, and IL-6, and pro-apoptotic markers caspase-3 and CD95, compared to the LL group. P<0.05 indicated by � for comparison between DSL and SL, # between\nSLD and LL groups, and ϕ between SL and LL groups. LL, control lean livers; SL, control steatotic livers; DSL, defatted steatotic livers; CASP3, caspase-3; CD95, cluster\nof differentiation 95; IFN-γ, interferon-gamma; IL-, interleukin-; NF-κB, nuclear factor kappa B; TNF-α, tumor necrosis factor-alpha.\nhttps://doi.org/10.1371/journal.pone.0232886.g003\nPLOS ONE\nImproving function of steatotic livers for transplant with defatting and machine perfusion\nPLOS ONE | https://doi.org/10.1371/journal.pone.0232886 May 12, 2020 6 / 19\n\n(53.7 ± 9.4, P<0.05), but less than the SL group (163.8 ± 30.9, p<0.05). Perfusate content of\ncombined VLDL/LDL after 6 hours of perfusion in the DSL group (74.3 ± 7.4 ug/uL) was sig￾nificantly lower than LL (127.1 ± 2.2, P<0.001) and SL groups (115.3 ± 10.7, P = 0.01) (Fig\n4A–4D).\nFig 4. Modulation of lipid metabolism during liver perfusion. (a) Defatting of steatotic livers (DSL) results in significantly\nincreased ketone body synthesis compared to the SL group. (b) Tissue triglyceride levels after six hours of perfusion demonstrate a\nnon-significant decrease in the DSL compared to SL group. (c) Perfusate triglyceride concentrations are significantly higher in the SL\ngroup compared to DSL and LL group after six hours of perfusion. This may be the result of cell death as indicated by poor functional\nparameters in the SL group. (d) The LL group appears to actively synthesize and export very low-density lipoprotein (VLDL),\nindicating an effective normal function of the perfusion livers in this group. Livers in the DSL group export less VLDL comparatively,\nindicating either breakdown of VLDL for energy metabolism or a defective cellular process. Perfusate VLDL concentrations in the SL\ngroup are comparable to the LL group, though likely as a result of cell death. P<0.05 for random intercept mixed model analysis\nindicated by � for comparison between DSL and SL, and ϕ for LL and SL groups (a,b); for t test comparisons � indicates P<0.05, ��\nindicates P<0.01, and ��� indicated P<0.001. LL, control lean livers; SL, control steatotic livers; DSL, defatted steatotic livers.\nhttps://doi.org/10.1371/journal.pone.0232886.g004\nPLOS ONE\nImproving function of steatotic livers for transplant with defatting and machine perfusion\nPLOS ONE | https://doi.org/10.1371/journal.pone.0232886 May 12, 2020 7 / 19\n\nDefatting perfusion upregulates fatty acid β-oxidation\nCompared to the SL group, there was significantly increased hepatic gene expression of mito￾chondrial fatty acid β-oxidation markers acyl-CoA oxidase 1 (ACOX1; fold change 1.98 ± 0.13,\nP<0.001) and carnitine palmitoyltransferase 2 (CPT2; fold change 1.80 ± 0.17, P = 0.004),\nthough CPT1a and long chain acyl-CoA dehydrogenase (ACADL) expression did not reach\nsignificance (Fig 5). SL and DSL groups demonstrated similar hepatic expression of genes asso￾ciated with fatty acid synthesis (ACACA, ACLY, ACSL5, FASN, SCD1), while the LL group\ndemonstrated lower expression. Apolipoprotein B (APOB) expression was significantly higher\nin DSL (fold change 1.43 ± 0.14, P = 0.026) and LL groups (1.64 ± 0.14, P = 0.002) compared\nFig 5. Defatting cocktail upregulated expression of key enzymes involved in mitochondrial fatty acid β-oxidation. Addition of defatting cocktail (DSL) resulted in\nsignificantly increase gene expression of acetyl CoA oxidase-1 (ACOX1) and carnitine palmitoyltransferase-2 (CPT2) compared to control steatotic livers (SL). There\nwere no significant differences gene expression of enzymes involved in fatty acid synthesis between DSL and SL groups. Lean livers demonstrated overall decreased\nexpression of enzymes involved in fatty acid synthesis. P<0.05 indicated by � for comparison between DSL and SL, # between SLD and LL groups, and ϕ between SL and\nLL groups. LL, control lean livers; SL, control steatotic livers; DSL, defatted steatotic livers; ACACA, acetyl-CoA carboxylase alpha; ACLY, ATP citrate lyase; ACSL5,\nacyl-CoA synthetase long chain family member 5; DGAT2, diacylglycerol O-acyltransferase 2; FASN, fatty acid synthase; GK, glycerol kinase; SCD1, stearoyl-CoA\ndesaturase; ACADL, long chain acyl-CoA dehydrogenase; CTP1a, carnitine palmitoyltransferase 1A.\nhttps://doi.org/10.1371/journal.pone.0232886.g005\nPLOS ONE\nImproving function of steatotic livers for transplant with defatting and machine perfusion\nPLOS ONE | https://doi.org/10.1371/journal.pone.0232886 May 12, 2020 8 / 19\n\nto SL livers, though expression of apolipoprotein -A1, -C3, and -E (APOA1, APOC3, APOE)\nwas unchanged (S1 Table). Interestingly, lean livers had an unexpectedly higher VLDL/LDL\nperfusate content, indicating the high synthetic capacity of these livers to produce lipoproteins\nfor transport, further supported by the significantly increased gene expression of HMGCR\n(fold change 2.85 ± 0.65, P = 0.013 compared to DSL group), the rate-limiting enzyme in the\ncholesterol synthesis pathway. Fig 6 demonstrates network analysis of genes differentially\nexpressed in DSL compared to SL livers.\nMacrosteatosis decreases with plain and defatting perfusion in rat model\nPrior to perfusion, steatotic rat livers were expected to have at least 30% macrosteatotic con￾tent, though steatosis varied widely between rats of the same age based on visual inspection.\nAfter 6 hours of perfusion, all 6 SL livers had <30% macrosteatosis (range 0–27.5%) versus 5\nDSL livers (range 2.5–35%, P = 0.3). Macrosteatosis in the LL group ranged 0–1% after perfu￾sion. Quantified macrosteatotic droplets by oil red staining did not differ between SL\n(551 ± 181 droplets/mm2\n) and DSL livers (611 ± 125, P = 0.8). Representative histology from\neach group is shown in Fig 7.\nDefatting perfusion does not improve synthetic function but is associated\nwith hepatoxicity\nHepatic synthetic function as indicated by the change in weight-adjusted perfusate albumin\nwas significantly higher in the lean livers, but similar between SL and DSL groups (Fig 8A).\nSimilarly, there was no significant difference in the OUR between SL and DSL livers, but both\nhas significantly lower OURs compared to LL livers (Fig 8B). At end-perfusion, AST and ALT\nlevels were significantly higher in the DSL group compared to both SL and LL groups (Fig 8C\nand 8D).\nDefatting perfusion depletes available pool of energy cofactors\nDespite improved functional biomarkers in the DSL group, defatting perfusion resulted in sig￾nificantly depleted ATP:ADP, ATP:AMP, and energy charge ratios compared to lean livers\n(Fig 9A–9C). NADH:NAD+ ratios were comparable between groups, though NADPH:NADP+\nratios were higher in the SL (0.088 ± 0.015) and DSL groups (0.059 ± 0.014) and compared to\nthe LL group (0.028 ± 0.002, P<0.05 for both) (Fig 9D and 9E).\nSteatotic rat livers demonstrate insulin resistance, worsened by defatting\nperfusion\nPerfusate glucose levels increased in both SL and DSL groups during perfusion, but at a signifi￾cantly higher rate in the DSL group (S2A Fig). The LL group glucose content remained signifi￾cantly lower throughout perfusion. DSL livers also had significantly increased expression of\nthe gluconeogenic enzymes, glucose-6-phosphatase (G6PC) and pyruvate dehydrogenase\nkinase 4 (PDK4), compared to both SL and LL groups, which may be an adverse effect of preg￾nane X receptor (PXR) activation by hypericin. Interestingly, DSL livers had higher insulin\nreceptor (INSR) and insulin receptor substrate 1 (IRS1) expression than both SL and LL\ngroups despite higher perfusate glucose content. Of note, peroxisome proliferator activated\nreceptor (PPAR) -α and–β/δ gene expression was not significantly increased in the DSL group\n(S1 Table). Finally, during 6 hours of perfusion, LL and SL perfusions had similar perfusion\nflow rates, while DSL perfusions experienced slightly lower flow rates to maintain similar\nPLOS ONE\nImproving function of steatotic livers for transplant with defatting and machine perfusion\nPLOS ONE | https://doi.org/10.1371/journal.pone.0232886 May 12, 2020 9 / 19\n\nPLOS ONE\nImproving function of steatotic livers for transplant with defatting and machine perfusion\nPLOS ONE | https://doi.org/10.1371/journal.pone.0232886 May 12, 2020 10 / 19\n\nperfusion pressures (S2B Fig). DSL livers were noted to gain weight significantly compared to\nSL livers, which lost weight (6.5 ± 3.4 g versus -1.9 ± 1.2, p<0.001).\nDiscussion\nThere is increasing interest in applying machine perfusion technology for rehabilitation of\nuntransplantable livers [24, 25]. Targeting steatotic livers, given their high discard rate, is an\nFig 6. Network analysis of genes involved in metabolism during defatting of steatotic livers. Network analysis of differentially expressed genes after six\nhours of defatting perfusion in steatotic rat livers relative to control steatotic livers demonstrates upregulated signaling in PPAR-alpha and insulin pathways.\nEP300, E1A binding protein p300; PRKACA, protein kinase cAMP-activated catalytic subunit alpha; USF1, upstream transcription factor 1; EGFR, epidermal\ngrowth factor receptor; RHOA, ras homolog family member A; SIRT2, sirtuin 2; CLNS1A, chloride nucleotide-sensitive channel 1A; GSTP1, glutathione S￾transferase pi 1; PLPP3, phospholipid phosphatase 3.\nhttps://doi.org/10.1371/journal.pone.0232886.g006\nFig 7. Microscopic assessment of rat liver histology after perfusion. Low and high-grade magnification of H&E and oil red staining performed on rat liver tissue after\nsix hours of perfusion. Lean livers (LL) demonstrate no Macrosteatosis on H&E (a, b) and minimal oil red straining of microdroplets (c,d). Control steatotic livers (SL)\ndemonstrate mild macrosteatosis and variable microsteatosis (e-h). Defatted steatotic livers (DSL) demonstrated mild macrosteatosis and more prevalent microsteatosis\n(i-l). LL, control lean livers; SL, control steatotic livers; DSL, defatted steatotic livers; H&E, hematoxylin and eosin.\nhttps://doi.org/10.1371/journal.pone.0232886.g007\nPLOS ONE\nImproving function of steatotic livers for transplant with defatting and machine perfusion\nPLOS ONE | https://doi.org/10.1371/journal.pone.0232886 May 12, 2020 11 / 19\n\nideal application of this platform. A recent proof of concept study by Boteon et al. using the\ndefatting cocktail reported here, demonstrated its effectiveness in improving functional\nparameters and decreasing macrosteatosis in discarded human steatotic livers [16]. Because of\nconcerns with safety in humans of several components, we performed a mechanistic study in a\nrat liver perfusion model in order to identify agents safe for human clinical trials with the\npotential to perform the same functions. We corroborated the prior report of improved func￾tional parameters and bile quality with defatting cocktail but demonstrate notable off-target\nand adverse effects related to the cocktail components that can be optimized in future studies.\nFor example, visfatin was thought to be an insulin-mimetic signaling protein, yet the origi￾nal manuscript describing its action has been retracted [26]. Other studies characterize its\nfunction as a pro-inflammatory cytokine found in higher levels with worsening steatosis [27,\n28]. Hypericin, a component of St. John’s wort, activates PXR and upregulates enzymes\ninvolved in drug metabolism, including cytochrome P450 3A4 (CYP3A4) [29]. PXR activation\nis associated worsening steatosis and insulin resistance, though it does have anti-inflammatory\nFig 8. Albumin production and hepatic injury markers after six hours of liver perfusion. (a) Lean livers produced significantly more albumin per gram of liver tissue\ncompared to SL and DSL groups. P<0.05 for random intercept mixed model analysis indicated by ϕ for comparison between LL and SL groups, and # for comparison\nbetween LL and DSL groups. (b) Oxygen uptake rate was similar between SL and DSL livers, but significantly higher in LL livers likely as due to the significant liver\nweight difference. Defatting cocktail was associated with (c) increased aspartate aminotransferase (AST) and (d) alanine aminotransferase (ALT) levels compared to\nboth SL and LL groups. Notably, AST and ALT levels were significantly higher in the SL compared to LL group as well. � indicates P<0.05, �� indicates P<0.01, and ���\nindicated P<0.001 for t tests after analysis of variance indicated significant differences between groups.\nhttps://doi.org/10.1371/journal.pone.0232886.g008\nPLOS ONE\nImproving function of steatotic livers for transplant with defatting and machine perfusion\nPLOS ONE | https://doi.org/10.1371/journal.pone.0232886 May 12, 2020 12 / 19\n\nactivity through downregulation of NF-κB target genes [30]. CYP3A4 is also involved in\nmetabolism of numerous drugs, including tacrolimus and cyclosporine, which has implica￾tions for post-transplant immunosuppression regimens. Other cocktail components are effica￾cious at increasing FAO but lack safety data in humans. PPAR-α agonist, GW7647, and\nPPAR-β/δ agonist, GW501516, demonstrate notably upregulated downstream effects in this\nFig 9. Energy cofactor analysis demonstrates decreased ATP production associated with perfusion of steatotic livers. Control steatotic liver (SL)\nperfusion results in significantly depleted ATP and energy charge ratios compared to lean livers (LL). Defatting of steatotic livers (DSL) results in similar\ndepletion of energy stores despite evidence of improved function (a-c). NADH:NAD+ ratios are similar between the three groups after six hours of\nperfusion (d), whereas NADPH:NADP+ is significantly higher in SL and DSL groups compared to LL (e). Energy charge ratio calculated as [ATP\n+(ADP�0.5)]/[ATP+ADP+AMP]. indicates P<0.05, �� indicates P<0.01, and ��� indicates P<0.001. ATP, adenosine triphosphate; ADP, adenosine\ndiphosphate; AMP, adenosine monophosphate; NADH/NAD+\n, reduced/oxidized nicotinamide adenine dinucleotide; NADPH/NADP+\n, reduced/\noxidized nicotinamide adenine dinucleotide phosphate; LL, control lean livers; SL, control steatotic livers; DSL, defatted steatotic livers.\nhttps://doi.org/10.1371/journal.pone.0232886.g009\nPLOS ONE\nImproving function of steatotic livers for transplant with defatting and machine perfusion\nPLOS ONE | https://doi.org/10.1371/journal.pone.0232886 May 12, 2020 13 / 19\n\nstudy and prior ones, but have never been used in humans. Similarly, forskolin and scoparone\nare herbal extracts with reported anti-inflammatory and steatosis-reducing effects in animal\nstudies but have not been rigorously tested in humans [30–32]. Carnitine, an over-the-counter\nsupplement, appears to be the only safe and effective component of the cocktail that can be\nused in future studies [14]. Our understanding of the pathophysiology of NAFLD and NASH\nhas greatly improved in the last decade, and clinicians are now on the verge of a new era were\npharmaceutical therapy is becoming available for the treatment of these diseases [33].\nThe defatting cocktail in this study does demonstrate effectiveness in targeting several path￾ways. Most remarkable is the downregulation of pro-inflammatory targets TNF-α and NF-κB\nin defatted compared to untreated livers. The overall anti-inflammatory effect of the defatting\ncocktail is consistent with reported mechanisms of several components, including activation\nof PPAR-α and -β/δ (GW7646, GW501516), PXR (hypericin), and constitutive androstane\nreceptor (CAR; scoparone) [30]. Another upregulated pathway involves mitochondrial FAO.\nWe found that ketone body production, a marker of FAO, was significantly higher in the DSL\ngroup compared to the SL group. This is further supported by increased expression of CPT2\nand ACOX1 genes, key enzymes involved in mitochondrial FAO. Given the safety concerns of\nthe cocktail components, it is worth examining recently-developed drugs under clinical trial\nthat target similar pathways. Elafibranor, a dual PPAR-α/δ agonist, has demonstrated efficacy\nin decreasing inflammation (via NF-κB targets) and increasing FAO by upregulating expres￾sion of CPT1α and ACOX1 [34, 35]. In an international, randomized, double-blind placebo￾controlled trial of patients with NASH, elafibranor significantly reduced liver injury enzymes,\nlipids, glucose profiles, and markers of systemic inflammation. Treatment also resulted in\ngreater resolution of NASH than placebo and was well-tolerated [36]. Other drugs with similar\ntarget profiles include pioglitazone, a PPAR-γ agonist that demonstrated improvement in stea￾tosis and lobular inflammation in a phase 3 randomized, placebo-controlled trial of adults\nwith NASH [37]. Another commonly used lipid-lowering agent, bezafibrate, has pan-PPAR\nagonist activity and reduced hepatic steatosis and gluconeogenesis [38, 39].\nOne novel finding in this study was that despite increased expression of APOB, DSL livers\nhad lower perfusate VLDL/LDL levels compared to SL livers at end-perfusion. The lower\nVLDL/LDL levels in the DSL group appears to indicate a process that favors decreased exocy￾tosis of low-density lipoproteins, allowing these molecules to be potentially used for energy\nmetabolism. In the same clinical trial above, elafibranor decreased serum triglyceride and LDL\ncholesterol levels, increased HDL cholesterol levels, while decreasing liver steatosis, demon￾strating potential efficacy for improving the lipid profile and metabolism of steatotic livers dur￾ing machine perfusion [36].\nThe farnesoid X receptor (FXR), a nuclear receptor in the same class of the PPARs, has\nbecome well-defined in recent years as another metabolic target in the treatment of NASH.\nThe defatting cocktail used in this study did not demonstrate a significant change in gene\nexpression of FXR (S1 Table). In a randomized, placebo-controlled clinical trial, obeticholic\nacid (OCA; a synthetic FXR agonist) improved steatosis, inflammation, and fibrosis [40], indi￾cating potential efficacy if used in the ex situ perfusion setting.\nWith respect to steatotic liver content, the question as to whether complete defatting is nec￾essary during perfusion to produce a liver viable for transplantation remains unanswered. The\nlack of a significant difference in macrosteatosis content between SL and DSL groups, despite\nnotable functional improvement, indicates that complete “defatting” or achieving macrostea￾tosis content below 30% is not the primary outcome of lipid-modulating perfusion. Rather,\nrehabilitating steatotic livers to function with the characteristics of lean, viable livers should be\nthe goal. This is further corroborated by data from discarded human steatotic livers, which\nPLOS ONE\nImproving function of steatotic livers for transplant with defatting and machine perfusion\nPLOS ONE | https://doi.org/10.1371/journal.pone.0232886 May 12, 2020 14 / 19\n\ndemonstrated improved function and viability in livers that were not defatted to below 30%\nmacrosteatosis after 12 hours of perfusion [16].\nThere were several limitations to this study. A pre-perfusion liver biopsy was not obtained,\nmaking paired comparisons of macrosteatosis and triglyceride content pre- and post-perfusion\nnot possible. Furthermore, defatted livers experienced an unexpected increase in weight dur￾ing perfusion while plain-perfused steatotic livers had a weight decrease. This was likely due to\na portal perfusion pressure that was too high. It is not known why this affected the defatted liv￾ers and not the control steatotic livers, though endothelial injury related to the cocktail is a pos￾sibility. Another limitation of the rat liver perfusion model is that macrosteatosis decreases in\nsteatotic livers undergoing plain perfusion as well, a finding that is present in the porcine\nmodel, but not humans [41, 42]. This may have made any further defatting stimulated by the\ncocktail difficult to detect by global methods such as histology. It may be that the rat liver per￾fusion model is exceedingly efficient at inducing metabolism of intracellular lipid droplets or\nthey are being degraded via other mechanisms. Finally, we did not assess in vivo function of\nthe control and defatted livers after perfusion using a rat liver transplantation model. This was\ndone in an effort to reduce the number of animals needed while still obtaining novel data to\nallow further refinement of the drug cocktail prior to scaling up to animal transplantation\nstudies. Future investigations should evaluate the optimized, clinically applicable drug cock￾tail’s impact on IRI, including mechanisms of complement, ROS release, and liver immune\nactivation in a rat liver transplantation model with improved generalizability, such as diet￾induced steatosis, longer cold ischemia, and added warm ischemia.\nConclusion\nLipid modulation of steatotic rat livers using a drug cocktail that targets mitochondrial fatty\nacid oxidation is able to improve liver function and bile quality, in addition to decreasing\nmacrosteatosis content. Further research using safe, clinically applicable drugs interventions is\nrequired prior to initiating human clinical trials.\nSupporting information\nS1 Fig. Study flowchart. 6 livers from each group were procured, underwent brief cold ische￾mia (<10 minutes), and then were normothermically perfused for 6 hours. Perfusate and bile\nwere collected and analyzed at regular intervals. Circulating baseline perfusate was supple￾mented with the defatting cocktail in the DSL group. Liver tissue was collected for analysis\nafter six hours of perfusion (formalin-fixed and snap-frozen). LL, control lean livers; SL, con￾trol steatotic livers; DSL, defatted steatotic livers.\n(EPS)\nS2 Fig. Perfusate glucose content and portal venous flow rates during perfusion of rat liv￾ers. (a) Perfusate glucose content during perfusion shows significant variability between\ngroups. Lean livers demonstrate consistent glucose levels, whereas steatotic liver demonstrate\nrising glucose levels likely as a result of excessive gluconeogenesis. Defatting perfusion appears\nto worsen the hyperglycemia associated with steatotic livers (b) Portal venous flow rates for a\nfixed portal venous perfusion pressure of 10–12 mm Hg is similar between SL and LL groups.\nHowever, the DSL group demonstrates lower flow rates as a result of edema in the perfusion\nlivers. P<0.05 for random intercept mixed model analysis indicated by � for comparison\nbetween DSL and SL, and ϕ for LL and SL groups. LL, control lean livers; SL, control steatotic\nlivers; DSL, defatted steatotic livers.\n(EPS)\nPLOS ONE\nImproving function of steatotic livers for transplant with defatting and machine perfusion\nPLOS ONE | https://doi.org/10.1371/journal.pone.0232886 May 12, 2020 15 / 19\n\nS1 Table. Gene expression of DSL and LL groups relative to SL group. Fold change, stan￾dard deviation, P values represented for DSL and LL groups relative to SL group for all genes\nanalyzed using RT-PCR. Numbers in red represent significant values (P<0.05).\n(DOCX)\nS1 File.\n(DOCX)\nAcknowledgments\nWe would like to thank the Mass Spectrometry Core at Shriners Hospital for Children for pro￾cessing our samples, as well as, Brian Healy PhD and the Harvard Catalyst Clinical/Transla￾tional Research Academy for statistical support.\nAuthor Contributions\nConceptualization: Siavash Raigani, Martin Yarmush, Korkut Uygun, Heidi Yeh.\nData curation: Siavash Raigani, Cailah Carroll.\nFormal analysis: Siavash Raigani, Cailah Carroll, Ivy Rosales, Hany Deirawan, Rafic Beydoun,\nKorkut Uygun.\nFunding acquisition: Korkut Uygun, Heidi Yeh.\nInvestigation: Siavash Raigani, Cailah Carroll, Stephanie Griffith, Casie Pendexter, Ivy\nRosales, Hany Deirawan, Rafic Beydoun.\nMethodology: Siavash Raigani, Cailah Carroll, Stephanie Griffith, Casie Pendexter, Ivy\nRosales, Heidi Yeh.\nResources: Stephanie Griffith, Casie Pendexter, Korkut Uygun, Heidi Yeh.\nSoftware: Stephanie Griffith.\nSupervision: Rafic Beydoun, Martin Yarmush, Korkut Uygun, Heidi Yeh.\nValidation: Siavash Raigani, Korkut Uygun.\nVisualization: Siavash Raigani, Stephanie Griffith, Hany Deirawan.\nWriting – original draft: Siavash Raigani, Stephanie Griffith, Heidi Yeh.\nWriting – review & editing: Siavash Raigani, Martin Yarmush, Korkut Uygun, Heidi Yeh.\nReferences\n1. United Network for Organ Sharing (UNOS). Available from: https://unos.org/data/transplant-trends/\n[Accessed December 7, 2018].\n2. Organ Procurement and Transplantation Network (OPTN) [December 7, 2018]. Available from: https://\noptn.transplant.hrsa.gov/data/view-data-reports/.\n3. Moosburner S, Gassner J, Nosser M, Pohl J, Wyrwal D, Claussen F, et al. Prevalence of Steatosis\nHepatis in the Eurotransplant Region: Impact on Graft Acceptance Rates. HPB Surg. 2018;\n2018:6094936. Epub 2018/12/06. https://doi.org/10.1155/2018/6094936 PMID: 30515073; PubMed\nCentral PMCID: PMC6236971.\n4. Hasegawa T, Ito Y, Wijeweera J, Liu J, Malle E, Farhood A, et al. Reduced inflammatory response and\nincreased microcirculatory disturbances during hepatic ischemia-reperfusion injury in steatotic livers of\nob/ob mice. Am J Physiol Gastrointest Liver Physiol. 2007; 292(5):G1385–95. Epub 2007/02/20.\nhttps://doi.org/10.1152/ajpgi.00246.2006 PMID: 17307725; PubMed Central PMCID: PMC4861211.\nPLOS ONE\nImproving function of steatotic livers for transplant with defatting and machine perfusion\nPLOS ONE | https://doi.org/10.1371/journal.pone.0232886 May 12, 2020 16 / 19\n\n5. Chu MJ, Dare AJ, Phillips AR, Bartlett AS. Donor Hepatic Steatosis and Outcome After Liver Transplan￾tation: a Systematic Review. J Gastrointest Surg. 2015; 19(9):1713–24. Epub 2015/04/29. https://doi.\norg/10.1007/s11605-015-2832-1 PMID: 25917535.\n6. Selzner M, Clavien PA. Fatty liver in liver transplantation and surgery. Semin Liver Dis. 2001; 21\n(1):105–13. Epub 2001/04/12. https://doi.org/10.1055/s-2001-12933 PMID: 11296690.\n7. Cortez-Pinto H, Chatham J, Chacko VP, Arnold C, Rashid A, Diehl AM. Alterations in liver ATP homeo￾stasis in human nonalcoholic steatohepatitis: a pilot study. Jama. 1999; 282(17):1659–64. Epub 1999/\n11/30. https://doi.org/10.1001/jama.282.17.1659 PMID: 10553793.\n8. Nair S, V PC, Arnold C, Diehl AM. Hepatic ATP reserve and efficiency of replenishing: comparison\nbetween obese and nonobese normal individuals. Am J Gastroenterol. 2003; 98(2):466–70. Epub\n2003/02/20. https://doi.org/10.1111/j.1572-0241.2003.07221.x PMID: 12591070.\n9. Vetelainen R, Bennink RJ, van Vliet AK, van Gulik TM. Mild steatosis impairs functional recovery after\nliver resection in an experimental model. Br J Surg. 2007; 94(8):1002–8. Epub 2007/05/15. https://doi.\norg/10.1002/bjs.5672 PMID: 17497653.\n10. Farrell GC, Teoh NC, McCuskey RS. Hepatic microcirculation in fatty liver disease. Anat Rec (Hobo￾ken). 2008; 291(6):684–92. Epub 2008/05/20. https://doi.org/10.1002/ar.20715 PMID: 18484615.\n11. Nasralla D, Coussios CC, Mergental H, Akhtar MZ, Butler AJ, Ceresa CDL, et al. A randomized trial of\nnormothermic preservation in liver transplantation. Nature. 2018; 557(7703):50–6. Epub 2018/04/20.\nhttps://doi.org/10.1038/s41586-018-0047-9 PMID: 29670285.\n12. Nostedt JJ, Skubleny DT, Shapiro AMJ, Campbell S, Freed DH, Bigam DL. Normothermic Ex Vivo\nMachine Perfusion for Liver Grafts Recovered from Donors after Circulatory Death: A Systematic\nReview and Meta-Analysis. HPB Surg. 2018; 2018:6867986. Epub 2018/06/01. https://doi.org/10.1155/\n2018/6867986 PMID: 29849531; PubMed Central PMCID: PMC5937385.\n13. Nagrath D, Xu H, Tanimura Y, Zuo R, Berthiaume F, Avila M, et al. Metabolic preconditioning of donor\norgans: defatting fatty livers by normothermic perfusion ex vivo. Metab Eng. 2009; 11(4–5):274–83.\nEpub 2009/06/11. https://doi.org/10.1016/j.ymben.2009.05.005 PMID: 19508897; PubMed Central\nPMCID: PMC2814076.\n14. Nativ NI, Yarmush G, So A, Barminko J, Maguire TJ, Schloss R, et al. Elevated sensitivity of macrostea￾totic hepatocytes to hypoxia/reoxygenation stress is reversed by a novel defatting protocol. Liver\nTranspl. 2014; 20(8):1000–11. Epub 2014/05/08. https://doi.org/10.1002/lt.23905 PMID: 24802973;\nPubMed Central PMCID: PMC4117728.\n15. Boteon YL, Wallace L, Boteon A, Mirza DF, Mergental H, Bhogal RH, et al. An effective protocol for\npharmacological defatting of primary human hepatocytes which is non-toxic to cholangiocytes or intra￾hepatic endothelial cells. PLoS One. 2018; 13(7):e0201419. Epub 2018/07/26. https://doi.org/10.1371/\njournal.pone.0201419 PMID: 30044872; PubMed Central PMCID: PMC6059478.\n16. Boteon YL, Attard J, Boteon A, Wallace L, Reynolds G, Hubscher S, et al. Manipulation of Lipid Metabo￾lism During Normothermic Machine Perfusion: Effect of Defatting Therapies on Donor Liver Functional\nRecovery. Liver Transpl. 2019; 25(7):1007–22. Epub 2019/03/02. https://doi.org/10.1002/lt.25439\nPMID: 30821045; PubMed Central PMCID: PMC6618030.\n17. Raigani S, Markmann JF, Yeh H. Rehabilitation of Discarded Steatotic Livers Using Ex Situ Normother￾mic Machine Perfusion: A Future Source of Livers for Transplantation. Liver Transpl. 2019; 25(7):991–\n2. Epub 2019/05/12. https://doi.org/10.1002/lt.25490 PMID: 31077626.\n18. Hall AR, Green AC, Luong TV, Burroughs AK, Wyatt J, Dhillon AP. The use of guideline images to\nimprove histological estimation of hepatic steatosis. Liver Int. 2014; 34(9):1414–27. Epub 2014/06/07.\nhttps://doi.org/10.1111/liv.12614 PMID: 24905412.\n19. Khan-Malek R, Wang Y. Statistical Analysis of Quantitative RT-PCR Results. Methods Mol Biol. 2017;\n1641:281–96. Epub 2017/07/28. https://doi.org/10.1007/978-1-4939-7172-5_15 PMID: 28748470.\n20. Bruinsma BG, Avruch JH, Sridharan GV, Weeder PD, Jacobs ML, Crisalli K, et al. Peritransplant Energy\nChanges and Their Correlation to Outcome After Human Liver Transplantation. Transplantation. 2017;\n101(7):1637–44. Epub 2017/02/24. https://doi.org/10.1097/TP.0000000000001699 PMID: 28230641;\nPubMed Central PMCID: PMC5481470.\n21. Bender R, Lange S. Adjusting for multiple testing—when and how? J Clin Epidemiol. 2001; 54(4):343–\n9. Epub 2001/04/12. https://doi.org/10.1016/s0895-4356(00)00314-0 PMID: 11297884.\n22. Shannon P, Markiel A, Ozier O, Baliga NS, Wang JT, Ramage D, et al. Cytoscape: a software environ￾ment for integrated models of biomolecular interaction networks. Genome Res. 2003; 13(11):2498–\n504. Epub 2003/11/05. https://doi.org/10.1101/gr.1239303 PMID: 14597658; PubMed Central PMCID:\nPMC403769.\n23. Wu G, Haw R. Functional Interaction Network Construction and Analysis for Disease Discovery. Meth￾ods Mol Biol. 2017; 1558:235–53. Epub 2017/02/06. https://doi.org/10.1007/978-1-4939-6783-4_11\nPMID: 28150241.\nPLOS ONE\nImproving function of steatotic livers for transplant with defatting and machine perfusion\nPLOS ONE | https://doi.org/10.1371/journal.pone.0232886 May 12, 2020 17 / 19\n\n24. Boteon YL, Boteon A, Attard J, Mergental H, Mirza DF, Bhogal RH, et al. Ex situ machine perfusion as a\ntool to recondition steatotic donor livers: Troublesome features of fatty livers and the role of defatting\ntherapies. A systematic review. Am J Transplant. 2018; 18(10):2384–99. Epub 2018/06/28. https://doi.\norg/10.1111/ajt.14992 PMID: 29947472.\n25. Yeh H, Uygun K. Increasing Donor Liver Utilization Through Machine Perfusion. Hepatology. 2019; 70\n(1):431–3. Epub 2019/01/27. https://doi.org/10.1002/hep.30523 PMID: 30681724.\n26. Fukuhara A, Matsuda M, Nishizawa M, Segawa K, Tanaka M, Kishimoto K, et al. Visfatin: a protein\nsecreted by visceral fat that mimics the effects of insulin. Science. 2005; 307(5708):426–30. Epub\n2004/12/18. https://doi.org/10.1126/science.1097243 PMID: 15604363.\n27. Johannsen K, Flechtner-Mors M, Kratzer W, Koenig W, Boehm BO, Schmidberger J. Association\nBetween Visfatin and Hepatic Steatosis in the General Population During Long-Term Follow-Up. Horm\nMetab Res. 2019. Epub 2019/05/28. https://doi.org/10.1055/a-0897-8565 PMID: 31132798.\n28. Moschen AR, Gerner RR, Tilg H. Pre-B cell colony enhancing factor/NAMPT/visfatin in inflammation\nand obesity-related disorders. Curr Pharm Des. 2010; 16(17):1913–20. Epub 2010/04/08. https://doi.\norg/10.2174/138161210791208947 PMID: 20370672.\n29. Moore LB, Goodwin B, Jones SA, Wisely GB, Serabjit-Singh CJ, Willson TM, et al. St. John’s wort\ninduces hepatic drug metabolism through activation of the pregnane X receptor. Proc Natl Acad Sci U S\nA. 2000; 97(13):7500–2. Epub 2000/06/15. https://doi.org/10.1073/pnas.130155097 PMID: 10852961;\nPubMed Central PMCID: PMC16574.\n30. Tanaka N, Aoyama T, Kimura S, Gonzalez FJ. Targeting nuclear receptors for the treatment of fatty\nliver disease. Pharmacol Ther. 2017; 179:142–57. Epub 2017/05/27. https://doi.org/10.1016/j.\npharmthera.2017.05.011 PMID: 28546081; PubMed Central PMCID: PMC6659998.\n31. El-Agroudy NN, El-Naga RN, El-Razeq RA, El-Demerdash E. Forskolin, a hedgehog signalling inhibitor,\nattenuates carbon tetrachloride-induced liver fibrosis in rats. Br J Pharmacol. 2016; 173(22):3248–60.\nEpub 2016/10/21. https://doi.org/10.1111/bph.13611 PMID: 27590029; PubMed Central PMCID:\nPMC5071558.\n32. Atmaca M, Bilgin HM, Obay BD, Diken H, Kelle M, Kale E. The hepatoprotective effect of coumarin and\ncoumarin derivates on carbon tetrachloride-induced hepatic injury by antioxidative activities in rats. J\nPhysiol Biochem. 2011; 67(4):569–76. Epub 2011/06/10. https://doi.org/10.1007/s13105-011-0103-5\nPMID: 21656273.\n33. Sumida Y, Yoneda M. Current and future pharmacological therapies for NAFLD/NASH. J Gastroenterol.\n2018; 53(3):362–76. Epub 2017/12/17. https://doi.org/10.1007/s00535-017-1415-1 PMID: 29247356;\nPubMed Central PMCID: PMC5847174.\n34. Staels B, Rubenstrunk A, Noel B, Rigou G, Delataille P, Millatt LJ, et al. Hepatoprotective effects of the\ndual peroxisome proliferator-activated receptor alpha/delta agonist, GFT505, in rodent models of nonal￾coholic fatty liver disease/nonalcoholic steatohepatitis. Hepatology. 2013; 58(6):1941–52. Epub 2013/\n05/25. https://doi.org/10.1002/hep.26461 PMID: 23703580.\n35. Bojic LA, Huff MW. Peroxisome proliferator-activated receptor delta: a multifaceted metabolic player.\nCurr Opin Lipidol. 2013; 24(2):171–7. Epub 2013/03/14. https://doi.org/10.1097/MOL.\n0b013e32835cc949 PMID: 23481229.\n36. Ratziu V, Harrison SA, Francque S, Bedossa P, Lehert P, Serfaty L, et al. Elafibranor, an Agonist of the\nPeroxisome Proliferator-Activated Receptor-alpha and -delta, Induces Resolution of Nonalcoholic Stea￾tohepatitis Without Fibrosis Worsening. Gastroenterology. 2016; 150(5):1147–59 e5. Epub 2016/02/14.\nhttps://doi.org/10.1053/j.gastro.2016.01.038 PMID: 26874076.\n37. Sanyal AJ, Chalasani N, Kowdley KV, McCullough A, Diehl AM, Bass NM, et al. Pioglitazone, vitamin E,\nor placebo for nonalcoholic steatohepatitis. N Engl J Med. 2010; 362(18):1675–85. Epub 2010/04/30.\nhttps://doi.org/10.1056/NEJMoa0907929 PMID: 20427778; PubMed Central PMCID: PMC2928471.\n38. Franko A, Neschen S, Rozman J, Rathkolb B, Aichler M, Feuchtinger A, et al. Bezafibrate ameliorates\ndiabetes via reduced steatosis and improved hepatic insulin sensitivity in diabetic TallyHo mice. Mol\nMetab. 2017; 6(3):256–66. Epub 2017/03/09. https://doi.org/10.1016/j.molmet.2016.12.007 PMID:\n28271032; PubMed Central PMCID: PMC5323884.\n39. Nakamuta M, Morizono S, Soejima Y, Yoshizumi T, Aishima S, Takasugi S, et al. Short-term intensive\ntreatment for donors with hepatic steatosis in living-donor liver transplantation. Transplantation. 2005;\n80(5):608–12. Epub 2005/09/24. https://doi.org/10.1097/01.tp.0000166009.77444.f3 PMID: 16177634.\n40. Neuschwander-Tetri BA, Loomba R, Sanyal AJ, Lavine JE, Van Natta ML, Abdelmalek MF, et al. Farne￾soid X nuclear receptor ligand obeticholic acid for non-cirrhotic, non-alcoholic steatohepatitis (FLINT): a\nmulticentre, randomised, placebo-controlled trial. Lancet. 2015; 385(9972):956–65. Epub 2014/12/04.\nhttps://doi.org/10.1016/S0140-6736(14)61933-4 PMID: 25468160; PubMed Central PMCID:\nPMC4447192.\nPLOS ONE\nImproving function of steatotic livers for transplant with defatting and machine perfusion\nPLOS ONE | https://doi.org/10.1371/journal.pone.0232886 May 12, 2020 18 / 19\n\n41. Jamieson RW, Zilvetti M, Roy D, Hughes D, Morovat A, Coussios CC, et al. Hepatic steatosis and nor￾mothermic perfusion-preliminary experiments in a porcine model. Transplantation. 2011; 92(3):289–95.\nEpub 2011/06/18. https://doi.org/10.1097/TP.0b013e318223d817 PMID: 21681143.\n42. Liu Q, Nassar A, Buccini L, Iuppa G, Soliman B, Pezzati D, et al. Lipid metabolism and functional\nassessment of discarded human livers with steatosis undergoing 24 hours of normothermic machine\nperfusion. Liver Transpl. 2018; 24(2):233–45. Epub 2017/11/11. https://doi.org/10.1002/lt.24972 PMID:\n29125712.\nPLOS ONE\nImproving function of steatotic livers for transplant with defatting and machine perfusion\nPLOS ONE | https://doi.org/10.1371/journal.pone.0232886 May 12, 2020 19 / 19\n\n"], "response": "This study investigates the impact of a defatting regimen combined with machine perfusion on steatotic livers during transplantation. The authors compared the results of three groups: untreated steatotic livers, livers treated with a defatting regimen prior to transplantation, and livers treated with both the defatting regimen and machine perfusion. They found that the addition of machine perfusion significantly improved liver function and reduced the need for postoperative immunosuppression in the third group. The study suggests that combining defatting and machine perfusion may offer a promising approach for improving the utilization of steatotic livers in transplantation. Key findings include improvements in liver function, reductions in steatosis and inflammation, and enhanced mitochondrial activity in the treated livers. The authors also noted that further studies are needed to confirm these findings and optimize the protocol for clinical implementation. Overall, the study provides encouraging evidence for the potential benefits of this novel therapeutic strategy for expanding the donor pool and reducing waiting times for liver transplant recipients."}
{"user_input": "How has machine perfusion changed risk thresholds associated with steatotic donor livers?", "retrieved_contexts": ["Article\nhttps://doi.org/10.1038/s41586-018-0047-9\nA randomized trial of normothermic \npreservation in liver transplantation\nDavid Nasralla1\n*, Constantin C. Coussios2\n*, Hynek Mergental3, M. Zeeshan Akhtar1,4, Andrew J. Butler5,20, Carlo D. L. Ceresa1\n, \nVirginia Chiocchia6,7, Susan J. Dutton8, Juan Carlos García-Valdecasas9, Nigel Heaton10, Charles Imber11, Wayel Jassem10, \nIna Jochmans12,13, John Karani10,14, Simon R. Knight1,15, Peri Kocabayoglu16, Massimo Malagò11, Darius Mirza3, Peter J. Morris1,15, \nArvind Pallan17, Andreas Paul16, Mihai Pavel9, M. Thamara P. R. Perera3, Jacques Pirenne12,13, Reena Ravikumar1\n, Leslie Russell18, \nSara Upponi19, Chris J. E. Watson5,20, Annemarie Weissenbacher1\n, Rutger J. Ploeg1\n, Peter J. Friend1\n* for the Consortium for Organ \nPreservation in Europe\nLiver transplantation is a highly successful treatment, but is severely limited by the shortage in donor organs. However, \nmany potential donor organs cannot be used; this is because sub-optimal livers do not tolerate conventional cold storage \nand there is no reliable way to assess organ viability preoperatively. Normothermic machine perfusion maintains the liver \nin a physiological state, avoids cooling and allows recovery and functional testing. Here we show that, in a randomized trial \nwith 220 liver transplantations, compared to conventional static cold storage, normothermic preservation is associated \nwith a 50% lower level of graft injury, measured by hepatocellular enzyme release, despite a 50% lower rate of organ \ndiscard and a 54% longer mean preservation time. There was no significant difference in bile duct complications, graft \nsurvival or survival of the patient. If translated to clinical practice, these results would have a major impact on liver \ntransplant outcomes and waiting list mortality.\nLiver transplantation is the accepted treatment for end-stage liver \nfailure, with one and five year survivals in excess of 90% and 70%, \nrespectively1\n. With increasing rates of liver disease2\n, the supply of \ntransplantable organs is no longer able to meet demand. Paradoxically, \ndespite substantial waiting list mortality (for example, 21% in the UK), \nonly 63% of UK deceased donor livers are transplanted1\n. Increasing \nnumbers of deceased organ donors in many countries have not been \nmatched by a corresponding rise in the number of transplantable \norgans. This is mainly because these additional donors tend to be \nhigh-risk—either declared dead by cardiovascular criteria (DCD), as \nopposed to brainstem death donors (DBD), or elderly with multiple \nco-morbidities (extended criteria donors). Such organs pose a greater \nrisk to the recipient, with a higher probability that the liver will never \nfunction (primary non-function (PNF)) or that it will lead to later com￾plications, particularly biliary stricturing.\nDespite many advances in liver transplantation, the method of \norgan preservation has changed very little in almost 30 years3\n. The \nliver is flushed and cooled with specialist preservation fluid, then \nstored in an icebox. This process of static cold storage (SCS) has \nseveral limitations. Although SCS slows metabolism by 10- to 12-fold, \nsubstantial anaerobic activity continues even at ice temperature4\n. \nThis leads to ATP depletion and accumulation of succinate and other \nmetabolites. These lead to the generation of reactive oxygen species5\nthat are the basis of ischaemia–reperfusion injury, when the organ \nis re-exposed to oxygenated blood at the time of transplantation. \nThis damage, exacerbated by any prior injury, limits the maximum safe \npreservation time of the donor organ. Once cooled, the cessation of \nnormal cellular activity also makes functional assessment impossible.\nThese shortcomings are particularly problematic in the higher-risk \ndonor organs that form an increasing proportion of current liver \ntransplant practice. The very severe ischaemia–reperfusion-related \nmorbidity that characterizes transplantation of such organs is now a \nmajor limitation in meeting the demand for life-saving transplants. To \ncombat the limitations imposed by cold storage, a change in preser￾vation technology is required. In recent years, interest has developed \nin perfusion at physiological temperature (normothermic machine \nperfusion (NMP))6–9\n.\nDuring NMP, the liver is perfused with oxygenated blood, med￾ications and nutrients at normal body temperature to maintain a \nphysiological milieu. Evidence from animal models of both DBD \nand DCD liver transplantation10,11 suggests that this improves \nthe post-transplant survival of transplanted livers, and potentially \nenables the assessment of organ viability during preservation. The \nmechanism underlying these improved outcomes is at least partly \nrelated to the metabolic resuscitation of the organ that occurs with \npreservation under physiological conditions. This has been demon￾strated through the replenishment of ATP levels11, which in turn con￾tributes to a reduction in the severity of the ischaemia–reperfusion \ninjury that is experienced after transplant5,10.\nThere is increasing interest in the clinical application of NMP, with \nseveral cases described in the recent literature6,7\n. In 2013, a phase-I \nstudy by our group9\n, demonstrated the safety and feasibility of NMP in \n1Nuffield Department of Surgical Sciences, University of Oxford, Oxford, UK. 2Institute of Biomedical Engineering, Department of Engineering Science, University of Oxford, Oxford, UK. 3Queen \nElizabeth Hospital Birmingham, Birmingham, UK. 4Target Discovery Institute, University of Oxford, Oxford, UK. 5University of Cambridge Department of Surgery, Addenbrooke’s Hospital, \nCambridge, UK. 6Centre for Statistics in Medicine, University of Oxford, Oxford, UK. 7Surgical Intervention Trials Unit, Nuffield Department of Surgical Sciences, University of Oxford, Oxford, UK. \n8Oxford Clinical Trials Research Unit, University of Oxford, Oxford, UK. 9Department of Hepatobiliopancreatic and Transplant Surgery, Hospital Clinic, Barcelona, Spain. 10Institute of Liver Studies, \nKing’s College Hospital, London, UK. 11Department of Hepatopancreatobiliary and Liver Transplant Surgery, Royal Free Hospital, London, UK. 12Abdominal Transplant Surgery, Department of \nSurgery, University Hospitals Leuven, Leuven, Belgium. 13Laboratory of Abdominal Transplantation, Department of Microbiology and Immunology, KU Leuven, Leuven, Belgium. 14Department of \nRadiology, King’s College Hospital, London, UK. 15Centre for Evidence in Transplantation, Clinical Effectiveness Unit, Royal College of Surgeons of England, London, UK. 16Department of General, \nVisceral and Transplantation Surgery, University Hospital Essen, Essen, Germany. 17Department of Radiology, Queen Elizabeth Hospital Birmingham, Birmingham, UK. 18OrganOx Limited, Oxford, \nUK. 19Department of Radiology, Addenbrooke’s Hospital, Cambridge, UK. 20National Institute of Health Research (NIHR), Cambridge Biomedical Research Centre, Cambridge, UK. *e-mail: david.\nnasralla@nds.ox.ac.uk; constantin.coussios@eng.ox.ac.uk; peter.friend@nds.ox.ac.uk\n50 | NA T U RE | VO L 557 | 3 MAY 2018\n© 2018 Macmillan Publishers Limited, part of Springer Nature. All rights reserved.\n\nArticle RESEARCH\n20 liver transplant recipients. This was used as the precursor to the pres￾ent study which, to our knowledge, is the first randomized controlled \ntrial to test the efficacy of machine perfusion against conventional cold \nstorage in liver transplantation.\nLivers from adult DBD or DCD donors were eligible for enrolment. \nAdult patients awaiting a liver-only transplant, excluding those with \nfulminant liver failure, were eligible. If a suitable liver was allocated \nto a consented recipient, the liver was randomized to either conven￾tional SCS or NMP. In the SCS arm, the organ retrieval, storage and \nthe transplant were conducted according to standard practice. In the \nNMP arm, following removal from the donor, the liver was attached to \nthe OrganOx metra NMP device, where it was perfused throughout the \nduration of preservation (Fig. 1), until the transplanting surgeon was \nready to implant it, at which point it was removed from the device. The \nremainder of the recipient’s care followed standard practice.\nDaily during the first postoperative week, and at day 10, day 30, \nmonth 6 and month 12, biochemical results were recorded as well as \ngraft and patient survival data. At six months, a magnetic resonance \nimaging scan of the biliary tree (MRCP) was performed to assess evi￾dence of biliary injury. Biological samples were collected and stored in \na biobank from each liver and recipient enrolled in the study, for use \nin further mechanistic studies.\nThe primary endpoint was defined as the difference between the two \ntreatment arms in the peak level of serum aspartate transaminase (AST) \nwithin seven days after transplant. This hepatocellular enzyme is a clini￾cally accepted biomarker, predictive of graft and patient survival12.\nRecruitment\nBetween 26 June 2014 and 8 March 2016, 334 livers were randomized, \nwith 64 livers subsequently excluded (Fig. 2). Following organ retrieval, \na markedly different discard rate between the two trial arms resulted in \n100 SCS and 120 NMP livers available for primary outcome reporting, \nwith 101 SCS and 121 NMP livers available for secondary outcome anal￾ysis. This discrepancy in group size reduced the study power to 89.7%.\nOne NMP liver was cold stored due to an accessory left hepatic artery \narising from the aorta preventing effective cannulation. Eight NMP \nlivers received machine perfusion for less than four hours (for logistic \nrather than technical reasons). All of these organs are included in the \nNMP arm as part of the modified intention to treat analysis. For the \nper protocol sensitivity analysis, the eight livers perfused for less than \nfour hours were excluded and the single NMP liver that was preserved \nusing SCS was reassigned to the SCS group.\nDonor, preservation and recipient characteristics\nNMP and SCS donor and recipient groups were well-matched (Tables 1, 2). \nThe discard rate was higher in the SCS arm (24.1%; 32 out of 133) \nthan the NMP arm (11.7%; 16 out of 137; Extended Data Table 1). \nThis difference was statistically significant (−12.4%, 95% confidence \ninterval −21.4 to −3.3%; P=0.008). One NMP discard was the result \nof a device malfunction in an already marginal organ (hepatic artery \nhypoperfusion due to pinch valve miscalibration; see Supplementary \nInformation).\nFunctional warm ischaemia time applies only to DCD livers and was \nmeasured as the time from the onset of donor hypoxia (oxygen satu￾ration<70%) or hypoperfusion (systolic blood pressure<50mmHg) \nuntil the start of cold aortic perfusion in the donor. The median \nfunctional warm ischaemia time was longer for NMP than SCS livers \n(21min versus 16min; P=0.003).\nTotal preservation time was measured from the start of cold aortic \nperfusion in the donor until graft reperfusion in the recipient. The \nmedian total preservation time was longer for NMP than SCS liv￾ers (11 h 54 min versus 7 h 45 min; P < 0.001). Within the NMP \narm, there was no significant difference in median perfusion time \nbetween DBD and DCD livers (9 h 55 min DBD versus 8 h 45 min \nDCD; P=0.449).\nPost-reperfusion haemodynamics were documented in 218 cases: \npost-reperfusion syndrome was more common in the SCS (32 out of \n97) than the NMP group (15 out of 121), a statistically significant dif￾ference (–20.6%, 95% confidence interval –31.6 to –9.5%; P<0.001). \nThis was despite reduced requirement for vasopressors in NMP livers \nin the post-reperfusion period (Extended Data Table 2a–c).\nIVC\nPV\nCBD\nGB\nHA\nFig. 1 | Image of liver during normothermic machine perfusion.\nThe hepatic artery (HA), portal vein (PV), inferior vena cava (IVC) and \ncommon bile duct (CBD) are all cannulated. The gallbladder (GB) is also \npresent although this was often removed during the retrieval process before \nNMP. This image has been used with consent from the family of the donor.\nNumber of livers randomized\nn = 335\nAllocated to NMP\nn = 170\nAllocated to SCS\nn = 164\nIncluded n = 137\nExcluded n = 33\n• DCD did not proceed n = 17\n• Non-consented recipient n = 6\n• Non-eligible donor organ n = 8\n• Other reasons n = 2\nIncluded n = 133\nExcluded n = 31\n• DCD did not proceed n = 20\n• Non-consented recipient n = 6\n• Non-eligible donor organ n = 4\n• Other reasons n = 1\nSuccessfully transplanted n = 121\nDiscarded n = 16\nSuccessfully transplanted n = 101\nDiscarded n = 32\nAnalysed (primary outcome):\nITT n = 120\nPP n = 111\nNot analysed n = 1\n(no AST available after transplant)\nAnalysed (primary outcome):\nITT n = 100\nPP n = 101\nNot analysed n = 1\n(no AST available after transplant)\nExcluded n = 1\n(randomized in error: R&D not \nin place) \nOutcome at 1 year:\nAlive with functioning graft n = 112\nDied with functioning graft n = 3 \nRe-transplanted n = 3\nDeath with graft failure n = 3 \nOutcome at 1 year:\nAlive with functioning graft n = 95\nDied with functioning graft n = 2\nRe-transplanted n = 2\nDeath with graft failure n = 2\nFig. 2 | CONSORT diagram. CONSORT diagram depicting the outcome \nfor all donor livers enrolled in the trial. ITT, intention to treat; PP, per \nprotocol; R&D, research and development.\n3 MAY 2018 | VO L 557 | NA T U RE | 51\n© 2018 Macmillan Publishers Limited, part of Springer Nature. All rights reserved.\n\nRESEARCH Article\nPeak AST (primary outcome)\nPeak AST during the first 7 days after transplant was reduced by 49.4% \nin the NMP group compared to SCS when adjusted by centre and donor \ntype (geometric mean ratio 0.506, 95% confidence interval 0.388–0.659; \nP<0.001). Unadjusted analysis (Student’s t-test) and sensitivity analysis \nundertaken in the per-protocol population confirmed these results.\nSubgroup analysis showed that the effect of NMP was different in \nthe two donor types (test for interaction P=0.012), although it was \nstatistically significant in both subgroups; the reduction in geometric \nmean peak AST was greater in DCD (73.3%, 95% confidence interval \n53.7–84.6%; P<0.001) than in DBD livers (40.2%, 95% confidence \ninterval 19.3–55.7%; P=0.001). Subgroup analyses for the model for \nend-stage liver disease (MELD) score and Eurotransplant-donor risk \nindex (ET-DRI) showed no statistically significant differences (data not \nshown). See Extended Data Table 3a, b and Extended Data Fig. 1 for \nfurther analysis. See Table 3 for full outcome results.\nEarly allograft dysfunction\nData to assess early allograft dysfunction (EAD) rates were available in \n216 recipients: the odds of developing EAD in the NMP arm (12 out of \n119) were 74% lower than the SCS arm (29 out of 97; odds ratio 0.263, \n95% confidence interval 0.126–0.550; P<0.001). A logistic regression \nmodel adjusted for donor type, MELD score and ET-DRI showed that \nthe adjusted odds of EAD in the NMP arm were approximately 72% \nlower than in the cold storage arm (adjusted odds ratio 0.276, 95% \nconfidence interval 0.124–0.611; P=0.002). The difference in EAD \nrates was partly a result of the difference in peak AST (described above), \nbut also a reflection of differences in bilirubin. The median bilirubin \nlevel in the first week postoperatively was lower in NMP recipients \n(2.25mgdl−1\n, 95% confidence interval 1.23–4.28)) than in the SCS \ngroup (2.87mgdl−1\n, 95% confidence interval 1.52–5.00; P=0.029).\nBiliary strictures on MRCP\nAn MRCP was performed on 155 (81 NMP, 74 SCS) of the 222 trans￾planted trial patients. There was no significant difference in the rate of \nnon-anastomotic strictures for DBD (NMP 7.4% (4 out of 54) versus SCS \n5.4% (3 out of 55); P=0.678) or DCD (NMP 11.1% (3 out of 27) versus \nSCS 26.3% (5 out of 19); P=0.180) livers. Only one patient in each trial \narm developed clinically relevant evidence of ischaemic cholangiopathy \nin the first year after transplant, both of whom were re-transplanted.\nTable 1 | Donor demographic details\nStratification factors for all \nrandomized livers NMP (n=170) SCS (n=164)\nDonor typea\nDBD 107 (62.9%) 104 (63.4%)\nDCD 63 (37.1%) 60 (36.6%)\nDonor demographics for all \nretrieved livers\nNMP (n=137) SCS (n=133)\nGendera\nFemale 54 (39.4%) 57 (42.9%)\nMale 81 (59.1%) 76 (57.1%)\nMissing 2 (1.5%) 0 (0.0%)\nAgeb 56 (45–67) (16–84) 56 (47–66) (20–86)\nEthnicitya\nAfrican–Caribbean 3 (2.2%) 1 (0.8%)\nCaucasian 131 (95.6%) 128 (96.2%)\nOther 1 (0.7%) 4 (3.0%)\nMissing 2 (1.5%) 0 (0.0%)\nCause of death\nCVA 74 (54.0%) 74 (55.6%)\nHypoxia 30 (21.9%) 32 (24.1%)\nTrauma 17 (12.4%) 16 (12.0%)\nOther 14 (10.2%) 11 (8.3%)\nMissing 2 (1.5%) 0 (0.0%)\nBody mass indexb 26.26 (23.66–30.52) \n(16.42–46.65)\n27.01 (23.74–30.56) \n(17.24–49.96)\nMissing 2 (1.5%) 0 (0.0%)\nET-Donor risk indexb 1.72 (1.47–2.09) \n(0.98–4.31)\n1.72 (1.50–2.10) \n(1.06–3.49)\nMissing 16 (11.7%) 19 (14.3%)\nCVA, cerebrovascular accident.\naFrequency and column percentages are reported.\nbMedian, interquartile range (IQR, first brackets) and full range (second brackets) are reported.\nTable 2 | Preservation and recipient demographic details\nPreservation details for all \ntransplanted livers NMP (n=121) SCS (n=101) P valuea\nFunctional warm ischaemia timeb\n(min) (applies to DCD livers; \nn=55 (34 NMP, 21 SCS))\n21 (17–25) \n(9–93)\n16 (10–20) \n(2–32)\n0.003\nCold ischaemia time prior to \nNMP (min)c\n (n=120)\n126 \n(106.5–143.0) \n(49–218)\nNA\nMachine perfusion time (min)c\n(n=120)\n547.5 \n(372.5–710.5) \n(85–1,388)\nNA\nTotal preservation time from \ncross-clamp in donor to organ \nreperfusion in recipient (min)\n714 (542–876) \n(258–1,527)\n465 \n(375–575) \n(223–967)\n0.0000\nSteatosis assessed \npre-preservationd,e\n0.366\nNone or mild 91 (75.3%) 89 (88.2%)\nModerate or severe 29 (24%) 12 (11.9%)\nMissing 1 (0.8%)\nRecipient demographics NMP (n=121) SCS (n=101) P valuea\nGenderd 0.717\nFemale 35 (28.9%) 27 (26.7%)\nMale 86 (71.1%) 74 (73.3%)\nDonor typed 0.209\nDBD 87 (71.9%) 80 (79.2%)\nDCD 34 (28.1%) 21 (20.8%)\nAgec 55 (48–62) \n(20–72)\n55 (48–62) \n(22–70)\n0.713\nCause of liver failured 0.782\nAlcoholic 36 (29.8%) 29 (28.7%)\nAuto-immune hepatitis 2 (1.7%) 5 (5.0%)\nHepatitis B 3 (2.5%) 2 (2.0%)\nHepatitis C 4 (3.3%) 4 (4.0%)\nHepatocellular carcinoma on \nbackground of cirrhosis\n15 (12.4%) 16 (15.8%)\nNon-alcoholic steato-hepatitis 11 (9.1%) 11 (10.9%)\nPrimary biliary cirrhosis 10 (8.3%) 3 (3.0%)\nPrimary sclerosis cholangitis 18 (14.9%) 13 (12.9%)\nOther 22 (18.1%) 18 (17.8%)\nBody mass indexc 26.18 \n(23.12–32.39) \n(18.02–50.99)\n26.94 \n(24.36–30.42) \n(18.91–42.95)\n0.626\nMissing 0 (0.0%) 1 (1.0%)\nRetransplantd 12 (9.9%) 8 (7.9%) 0.605\nMELD scorec\n (calculated at time \nof transplant)\n13 (10–18) \n(6–35)\n14 (9–18) \n(6–29)\n0.970\nUK 13 (10–17) \n(6–33)\n14 (9–18) \n(6–28)\nEssen, Germany 17 (14–19) \n(13–23)\n15.5 (14–17) \n(14–17)\nBarcelona, Spain 16 (8–26) \n(8–35)\n14 (9–16) \n(8–29)\nLeuven, Belgium 19 (13.5–25.0) \n(13–26)\n16 (16–20) \n(9–27)\neGFRc 87.36 \n(69.61–107.66) \n(33.45–156.43)\n92.22 (69.72–\n104.24) \n(30.19–\n155.04)\n0.928\nMissing 4 (3.3%) 3 (3.0%)\nET-Donor risk indexc 1.70 \n(1.47–2.07) \n(0.98–4.31)\n1.71 \n(1.50–2.01) \n(1.06–3.49)\n0.610\nMissing 13 (10.7%) 13 (12.9%)\nNA, not applicable. eGFR, estimated glomerular filtration rate.\naχ2 tests and non-parametric Mann–Whitney U-tests were used for categorical and continuous \nvariables, respectively. No adjustment for multiple comparisons were made.\nbFunctional warm ischaemia applies to DCD donors and is measured from the onset of functional \nwarm ischaemia (systolic blood pressure<50mmHg or O2 saturation<70%) to cross-clamp. c\nMedian, IQR and full range are reported.\ndFrequency and column percentages are reported.\neMeasurement of the degree of steatosis was based on clinical assessment by the retrieval \nsurgeon.\n52 | NA T U RE | VO L 557 | 3 MAY 2018\n© 2018 Macmillan Publishers Limited, part of Springer Nature. All rights reserved.\n\nArticle RESEARCH\nSimilarly, there was no significant difference in the rate of anasto￾motic strictures for DBD (NMP 40.7% (22 out of 54) versus SCS 41.8% \n(23 out of 55); P=0.909) or DCD (NMP 48.1% (13 out of 27) versus \nSCS 57.9% (11 out of 19); P=0.515) livers.\nHospital stay, graft and patient survival\nThere was no difference in median intensive care unit (ICU) stay \n(4 days NMP versus 4 days SCS; P=0.339), hospital stay (15 days NMP \nversus 15 days SCS; P=0.926) or the need for renal replacement therapy \nin the first postoperative week (2.7%, 95% confidence interval –7.9 to \n13.2%; P=0.621).\nOne NMP liver developed PNF (see Supplementary Information). \nThere were no PNF cases in the SCS arm. Overall 10 recipients died \nduring follow-up, producing a one-year survival of 0.949 (95% confi￾dence interval 0.890–0.977) in the NMP group and 0.958 (95% confi￾dence interval 0.902–0.982) in the SCS group (P=0.901). Two deaths \nin the SCS group and three deaths in the NMP group were due to graft \nfailure.\nGraft survival at one year was 0.950 (95% confidence interval 0.893–\n0.977) and 0.960 (95% confidence interval 0.897–0.985) in the NMP \nand SCS groups, respectively (P=0.695). The causes of graft failure \nin the SCS arm were hepatic artery thrombosis (n=3) and ischaemic \ncholangiopathy (n=1). The causes of graft failure in the NMP arm were \nhepatic artery thrombosis (n=2), ischaemic cholangiopathy (n=1), \nnon-thrombotic infarction (n=1), inferior vena cava occlusion (n=1) \nand PNF (n=1). (Extended Data Fig. 2a, b).\nTable 3 | Trial outcomes\nNMP (n=121)a SCS (n=101)a Effect (95% CI)b P value\nPeak AST\nITTc\nAdjusted 488.1 (408.9–582.8) 964.9 (794.5–1,172.0) 0.5 (0.4–0.7) 0.0000\nUnadjusted 484.5 (406.4–577.6) 973.7 (795.2–1,192.3) 0.5 (0.4–0.6) 0.0000\nTest for interaction by donor type 0.012\nSubgroup analysis by donor type\nDBD 526.2 (427.3–647.9) 880.2 (708.5–1,093.5) 40.2% (19.3–55.7%) 0.0009\nDCD 389.7 (278.0–546.4) 1,458.1 (944.7–2,250.5) 73.3% (53.7–84.6%) 0.0000\nPP analysis 498.6 (414.8–599.4) 982.9 (810.4–1,192.2) 0.5 (0.4–0.7) 0.0000\nSecondary outcomes\nDiscard ratesd 16 (11.7%) 32 (24.1%) −12.4% (−21.4 to \n−3.3%)\n0.008\nPrimary non-functione 1 (0.8%) 0 (0.0%) NA NA\nPost-reperfusion syndrome 15 (12.4%) 32 (33.0%) −20.6% (−31.6 to \n−9.6%)\n0.0002\nPost-reperfusion lactatef 3.6 (2.6–4.2) 4.1 (3.2–5.0) 0.018\nEarly allograft dysfunction 12 (10.1%) 29 (29.9%) 0.263 (0.126–0.550) 0.0002\nBiochemical liver testsf (average value over day 1–7)\nBilirubin (µmol l−1)\nDays 1–7 38.5 (21.0–73.2) 49.1 (26.0–85.5) 0.029\n30 days 13.0 (8.0–22.1) 13.0 (9.1–21.0) 0.479\n6 months 9.1 (6.0–15.1) 9.1 (6.0–13.0) 0.671\nAST (IU l−1)\nDays 1–7 167.5 (98.0–320.7) 318.5 (152–611.5) 0.0000\n30 days 20 (14–35) 22 (15–40) 0.707\n6 months 23 (18–33) 23 (18–37) 0.931\nγGT (IU l−1)\nDays 1–7 268.1 (156.3–408.3) 301 (201.1–443.9) 0.157\n30 days 178 (109.5–410.0) 200 (96.0–397.5) 0.949\n6 months 47 (28–144) 47 (26–128) 0.452\nINR\nDays 1–7 1.2 (1.2–1.4) 1.2 (1.2–1.4) 0.644\n30 days 1.1 (1.0–1.2) 1.1 (1.0–1.2) 0.735\n6 months 1.1 (1.0–1.2) 1.1 (1.0–1.1) 0.167\nCreatinine (µmol l−1)\nDays 1–7 92.8 (60.1–121.1) 97.2 (67.2–143.2) 0.139\n30 days 82.2 (66.3–104.3) 90.2 (72.5–121.1) 0.019\n6 months 99.9 (81.3–117.6) 99.9 (83.1–134.4) 0.265\nLactate (mmol l−1)\nDay 1–7 1.3 (1.0–1.7) 1.1 (0.9–1.6) 0.130\nOther outcomes\nNeed for RRT (number (percentage) of patients)\nDay 1–7 after transplant 26 (21.5%) 19 (18.8%) 2.7% (−7.9 to 13.2%) 0.621\n30 days 27 (22.3%) 20 (19.8%) 2.5 (−8.2 to 13.3%) 0.648\n6 months 27 (22.3%) 21 (20.8%) 1.5% (−9.3 to 12.4%) 0.784\nDuration of RRT day 1–7f 4 (2–6) 5 (4–6) 0.346\nLength of hospital stayf 15 (10–24) 15 (11–24) 0.926\nLength of ICU stayf 4 (2–7) 4 (3–7) 0.339\nGraft survival at 1 year 0.950 (0.893-0.977) 0.960 (0.897–0.985) 0.707\nPatient survival at 1 year 0.958 (0.902–0.982) 0.970 (0.909–0.990) 0.671\nCI, confidence interval.\naTotal number of livers transplanted and analysed overall. Primary outcome analysed on n=220 due to unavailability of AST values during the first seven days after transplant. Specific outcomes may \nhave different denominators due to some missing data.\nbEffect reported is: Percentage reduction (from geometric mean ratio) for peak AST; odds ratio for early allograft dysfunction; difference in proportions (%) for discard rates, post reperfusion syndrome \nand need for renal replacement therapy (RRT); not reported for outcomes for which medians are reported, for survival scores and for tests for interactions of subgroup analysis (only P values are \nreported).\nc\nIntention to treat (ITT) analysis was adjusted for donor type and transplant centre.\ndDenominators for the discard rates is the total number of livers retrieved (n=270 (NMP, n=137; SCS n=133)). eTest not performed due to few events and no events in one arm.\nf\nMedian and IQR are reported, a non-parametric Mann–Whitney U-test was used.\n3 MAY 2018 | VO L 557 | NA T U RE | 53\n© 2018 Macmillan Publishers Limited, part of Springer Nature. All rights reserved.\n\nRESEARCH Article\nFor more detailed analysis of trial outcomes please see Supplementary \nInformation.\nPerfusion characteristics indicative of organ quality\nThe following continuously monitored parameters (mean±s.d.) by the \nthird hour of NMP were measured for all livers that went on to be suc￾cessfully transplanted (Extended Data Figs. 3, 4). The measured haemo￾dynamic parameters were: hepatic artery flow (280±120mlmin−1\n) \nand portal vein flow (1.11 ± 0.2 l min−1\n). The measured meta￾bolic parameters were: pH (7.31±0.17) and lactate clearance from \n9.99±3.13mmol l\n−1\n at 15min NMP to 0.93±0.63mmol l\n−1\n by 4h \nNMP. The measured synthetic parameter consisted of bile production \n(9.17±11.16mlh−1\n). Notably, 18 transplanted NMP livers produced \nno/minimal bile during perfusion. All but one of these functioned \nafter transplant. There was no correlation between bile production and \npost-transplant liver function or later development of non-anastomotic \nbiliary strictures.\nOne NMP liver developed PNF. This liver was persistently acidotic \nwith lactate>4mmol for the duration of NMP. No other liver with \nthese characteristics was transplanted.\nFollowing transplant, 28 livers displayed minimal preservation \ninjury (MPI; peak AST<250 IU l−1\n) and 25 showed evidence of \nsevere preservation injury (SPI; peak AST>1,000 IU l−1\n). The donors \nin these groups were well-matched in all characteristics other than \nsex (Extended Data Table 4). During NMP, there was a difference in \nbaseline perfusate alanine aminotransferase (ALT) (MPI 171 IU l−1\nversus SPI 669 IU l−1\n; P=0.005) and lactate dehydrogenase (LDH) \n(MPI 1,073 IU l−1\n versus SPI 1,838 IU l−1\n; P=0.01) between the two \ngroups. Levels of these enzymes, as well as γ-glutamyltransferase (γGT), \nincreased more rapidly during the first 8h of NMP in the SPI group \n(ALT, an increase of 56 IU l−1\n versus an increase of 461 IU l−1\n, P<0.001; \nLDH, an increase of 483 IU l−1\n versus an increase of 980 IU l−1\n, \nP=0.06; γGT, an increase of 23 IU l−1\n versus increase of 104 IU l−1\n, \nP=0.004). MPI livers showed a reduction in measurable levels of \nhaemolysis (haemolysis index) as NMP progressed, in contrast to SPI \nlivers in which the levels of haemolysis rose (MPI, a decrease of 0.04 U \nversus SPI, an increase of 0.09 U; P=0.03). Bile production was greater \nin the MPI group (MPI 13.1mlh−1\n versus SPI 7.8mlh−1\n; P=0.03). \nLactate clearance was similar in each group. Post-reperfusion syndrome \nwas less common in the MPI group (MPI 0% (0 out of 28) versus SPI \n24% (6 out of 25); P=0.007). One NMP liver with perfusate transami￾nases in excess of 20,000 IU l−1\n was transplanted successfully.\nAdverse events\nThe proportion of patients for whom adverse events were reported \n(Extended Data Tables 5a–c, 6) was similar in the two arms (55.4% \nNMP, 95% confidence interval 46.1–64.4% versus 57.4% SCS, 95% \nconfidence interval, 47.2–67.2%) with a larger total number of events \nreported for SCS livers (128 NMP versus 164 SCS). Of these, a greater \nproportion of the serious adverse events (Clavien–Dindo grade ≥IIIb) \nwere in the SCS than NMP arm (16.4% NMP (21 out of 128) versus \n22% SCS (36 out of 164)). No statistical tests were applied to these data.\nDiscussion\nTo our knowledge, this is the first randomized controlled trial to com￾pare any type of machine perfusion technology with conventional static \ncold storage in human liver transplantation.\nThe trial demonstrated significant reductions in peak AST and EAD \nrates in NMP livers; this is of clinical relevance as both are clinically \naccepted biomarkers for long-term graft and patient survival12,13. \nThese benefits are consistent with previous animal work10 and the \nphase-I clinical study9\n that preceded this trial, both of which showed \npost-transplant AST reductions in NMP livers. No differences were \nseen in graft or patient survival: a much larger trial is required to test \nthis outcome. It is notable that these reductions in peak AST and EAD \nrates were achieved in the context of improved organ utilization and \nlonger preservation times, both of which have implications in terms \nof addressing the donor shortage and logistical barriers that currently \nlimit liver transplants.\nDCD donors represent a largely untapped source of organs, com￾prising 42% of UK deceased donors, but only 21% of transplanted \nlivers14. Utilization of DCD livers is limited by poorer outcomes (PNF \nand ischaemic cholangiopathy) compared with DBD livers. Allowing \nthe limitations of small group analyses, in this study NMP DCD liver \nprimary outcome data were superior to those of both DCD and DBD \nlivers preserved using SCS. In fact, the primary outcome of DCD NMP \nlivers was superior to that of DBD livers preserved by NMP: this was \npossibly owing to a selection bias, both of donors (lower threshold \nto decline DCD donors) and recipients (fitter patients selected for \nhigher-risk organs). The AST differences are in the context of longer \nfunctional warm ischaemia times, longer preservation times and fewer \norgan discards in the NMP arm, suggesting that NMP may be achieving \nthe desired objective of increasing organ utilization without compro￾mising outcome. If these findings were translated into clinical practice, \nthe increase in organ utilization would have substantial implications \nfor waiting list mortality, which is currently approximately one in five \npatients1\n.\nThe longer preservation times in the NMP group were not planned, \nbut were all within the maximum perfusion time defined in the pro￾tocol. There was no stipulation in the trial protocol that the preser￾vation times should be matched. As clinicians gained experience, it \nappeared that some centres had started to organize their operating \nschedule according to the preservation method, although no overall \ndifference between arms was seen in the proportion of transplants \noccurring in daylight hours. If, as appears to be the case, NMP can \nsafely extend preservation times without compromising outcomes, this \nwill have implications for operating department planning as well as \norgan utilization.\nThere were over 50% fewer discarded organs in the NMP group, \nresulting in 20% more transplanted livers (121 NMP versus 101 SCS). \nThe SCS discard rate of 23.7% was higher than the 17% reported in \nUK registry data14, and may reflect the high proportion of DCD livers \nenrolled in the trial; the discard rate of retrieved DCD livers in the UK \nis 30%14. This reported difference in organ utilization is likely to be an \nunderestimation of the full potential impact that NMP could have on \ntransplant numbers. The trial stipulated that only livers considered \ntransplantable according to standard practice could be enrolled. For \nthe full extent of improved organ utilization to be measured, livers \nwould need to be randomized to NMP or SCS before being offered for \ntransplant; this should form the basis of a future study. An increase of \n20% or more in the number of transplantable donor livers would have \na transformative effect on the mortality on liver transplant waiting lists \naround the world.\nThe haemodynamic characteristics of the NMP recipients following \nreperfusion were measurably superior to those of SCS recipients, in line \nwith previously reported findings15. This did not translate into a differ￾ence in ICU stay, hospital stay or need for renal replacement therapy \nbetween the two groups, despite previous reports showing a correlation \nbetween peak AST and renal replacement therapy16. The magnitude of \nthe reperfusion syndrome is a factor in determining the eligibility of the \nsickest patients for high-risk organs, due to the limited capacity of such \npatients to tolerate cardiovascular instability; NMP might therefore \nincrease the options for the most urgent patients.\nPerhaps the greatest limitation to more widespread utilization of \nDCD livers is the high rate of clinically important non-anastomotic \nbiliary strictures (NAS) which lead to a high rate of graft failure; this \nis believed to develop due to the vulnerability of the biliary tree to \nprolonged warm ischaemia. The rate of NAS in the NMP DCD group \n(11.1%) was lower than in SCS (26.3%) livers, despite longer functional \nwarm ischaemia times. This did not reach statistical significance, which \nmay be a function of sample size; the trial was not powered for this \noutcome. Reported rates of NAS in DCD transplants vary from 10 \nto 30%17,18, but these are in patients with symptoms suggesting bil￾iary pathology, rather than those only apparent on imaging; biliary \n54 | NA T U RE | VO L 557 | 3 MAY 2018\n© 2018 Macmillan Publishers Limited, part of Springer Nature. All rights reserved.\n\nArticle RESEARCH\ninvestigations are usually only performed for clinical indications \n(typically deranged liver function). Prior to this study, the radiolog￾ical incidence of both anastomotic and non-anastomotic strictures in \nasymptomatic patients was unknown; in particular, there is no real \nbenchmark against which to compare the rate of NAS seen in the DCD \nSCS group. Apart from the two patients retransplanted for ischaemic \ncholangiopathy, almost all of the remaining patients with radiological \nevidence of NAS had normal liver function at one year; this questions \nthe clinical relevance of a protocol MRCP at six months. The longer￾term follow-up of these patients will shed light on the importance of \na radiological diagnosis of biliary stricturing in patients with normal \ngraft function, and the role of MRCP as an endpoint in future trials.\nAs well as demonstrating improved graft preservation, this trial \ntested the feasibility, usability and safety of NMP, a vital component of \nthe evaluation of any new technology. It showed that the logistical chal￾lenges of NMP can be met successfully within clinical practice. Over \n120 NMP livers were transplanted in seven transplant centres across \nfour European countries. Nonetheless, adoption of this technology \ninto clinical practice may necessitate changes in the organ retrieval \nprocess, particularly with respect to technical support and transport \narrangements. It remains to be seen whether NMP is required for the \nfull duration of an organ’s preservation or can equally well be applied \nafter a short period of SCS when the organ reaches the transplanting \ncentre—this would simplify the logistics but may not be suitable for \nthe most marginal organs19. A phase-II study to test this has recently \ncompleted enrolment in the UK (NCT03176433).\nFor this new technology to be supported by healthcare funders, a \nhealth–economic case is needed. The results of this study suggest that \nbenefits will accrue not only from improved early graft function and \ntransplantation logistics, but also from improved utilization. Secondary \neconomic benefits will accrue from logistic changes, enabling trans￾plants to be moved predominantly into daytime operating, with reduc￾tion in staffing costs and likely improvements in outcome. More timely \nintervention will also bring economic benefits—earlier transplantation \nis associated with lower morbidity and cost.\nThe effects of NMP demonstrated in this study are unequivocal with \nrespect to the primary endpoint, implying a benefit in livers currently \nused for transplantation. However, the greatest benefit may be realized \nby applying this technology to livers outside current acceptance crite￾ria, in order to transplant organs currently deemed untransplantable. \nAlgorithms to assess organ viability, based on data obtained during \nNMP, will be essential if this potential is to be realized10. This study \nsheds some light on which perfusion parameters may be used to assess \norgan quality: bile production, acid–base stability, lactate clearance, \nperfusate transaminase levels, falling measurable haemolysis—all \ncorrelate with the degree of preservation injury evident after trans￾plant. However, all but one of the livers transplanted in the NMP group \nfunctioned postoperatively, including one NMP liver with perfusate \ntransaminases in excess of 20,000 IU l−1\n and 18 livers with minimal \nbile production. Data from much larger numbers of NMP transplants \n(typically from a registry) would be required to determine specific \nmarkers of viability.\nThe importance of bile production during NMP is unclear. \nPreliminary evidence from our group20 suggests that preservation \ninjury causes impaired hepatocellular uptake of bile salts. We have \nshown evidence of progressive accumulation of bile salts in the perfu￾sate of livers with high post-transplant transaminase levels; something \nthat also correlates with poor bile production during NMP. The extent \nand nature of the injury required to produce this effect is not clear but \ndoes appear to reflect organ quality rather than viability.\nHigh-risk organs (for example, those with steatosis) may benefit from \ntherapeutic interventions delivered during NMP: several groups are \nexploring potential strategies, including stem cell treatments, de-fatting \nagents and immunological modification of the organ. Future trials \nmay be needed to formally test the size of the effect of NMP on organ \nutilization; for this it will be necessary to randomize livers at the time \nof organ offering rather than the time of retrieval. Organ utilization, or \norgan utilization with 12-month graft survival (functional utilization) \nwould be a logical primary endpoint for a study of this sort.\nThis study describes the formal clinical evaluation of a novel tech￾nology in liver transplantation, and could herald the start of a new era \nof intervention during organ preservation. It represents a first, neces￾sary step in demonstrating that NMP is feasible, safe and effective in \nclinical practice; the fact that the study has definitively met its primary \nendpoint should now enable the exploration of the technology’s wider \npotential.\nOnline content\nAny Methods, including any statements of data availability and Nature Research \nreporting summaries, along with any additional references and Source Data files, \nare available in the online version of the paper at https://doi.org/10.1038/s41586-\n018-0047-9.\nReceived: 28 September 2017; Accepted: 8 March 2018; \nPublished online 18 April 2018.\n1. Annual Report on Liver Transplantation 2016/2017 (NHS Blood and Transplant, \n2017).\n2. APPHG. Liver disease: today’s complacency, tomorrow’s catastrophe. The \nAll-Party Parliamentary Hepatology Group (APPHG) inquiry into improving \noutcomes in liver disease. (March, 2014).\n3. Todo, S. et al. Extended preservation of human liver grafts with UW solution. J. \nAm. Med. Assoc 261, 711–714 (1989).\n4. Clavien, P. A., Harvey, P. R. & Strasberg, S. M. Preservation and reperfusion \ninjuries in liver allografts. An overview and synthesis of current studies. \nTransplantation 53, 957–978 (1992).\n5. Chouchani, E. T. et al. Ischaemic accumulation of succinate controls reperfusion \ninjury through mitochondrial ROS. Nature 515, 431–435 (2014).\n6. Watson, C. J. et al. Preimplant normothermic liver perfusion of a suboptimal \nliver donated after circulatory death. Am. J. Transplant. 16, 353–357 (2016).\n7. Mergental, H. et al. Transplantation of declined liver allografts following \nnormothermic ex-situ evaluation. Am. J. Transplant. 16, 3235–3245 (2016).\n8. Perera, T. et al. First human liver transplantation using a marginal allograft \nresuscitated by normothermic machine perfusion. Liver Transpl. 22, 120–124 \n(2016).\n9. Ravikumar, R. et al. Liver transplantation after ex vivo normothermic machine \npreservation: a phase 1 (first-in-man) clinical trial. Am. J. Transplant. 16, \n1779–1787 (2016).\n10. Brockmann, J. et al. Normothermic perfusion: a new paradigm for organ \npreservation. Ann. Surg. 250, 1–6 (2009).\n11. Xu, H. et al. Excorporeal normothermic machine perfusion resuscitates pig DCD \nlivers with extended warm ischemia. J. Surg. Res 173, e83–e88 (2012).\n12. Eisenbach, C. et al. An early increase in gamma glutamyltranspeptidase and \nlow aspartate aminotransferase peak values are associated with superior \noutcomes after orthotopic liver transplantation. Transplant. Proc 41, 1727–1730 \n(2009).\n13. Olthoff, K. M. et al. Validation of a current definition of early allograft dysfunction \nin liver transplant recipients and analysis of risk factors. Liver Transpl 16, \n943–949 (2010).\n14. Organ Donation and Transplantation Activity Report 2016/17 (NHS Blood and \nTransplant, 2017).\n15. Angelico, R. et al. Normothermic machine perfusion of deceased donor liver \ngrafts is associated with improved postreperfusion hemodynamics. Transplant. \nDirect 2, e97 (2016).\n16. Leithead, J. A. et al. Hepatic ischemia reperfusion injury is associated with acute \nkidney injury following donation after brain death liver transplantation. Transpl. \nInt 26, 1116–1125 (2013).\n17. Jay, C. L. et al. Ischemic cholangiopathy after controlled donation after cardiac \ndeath liver transplantation: a meta-analysis. Ann. Surg. 253, 259–264 (2011).\n18. Mourad, M. M., Algarni, A., Liossis, C. & Bramhall, S. R. Aetiology and risk factors \nof ischaemic cholangiopathy after liver transplantation. World J. Gastroenterol.\n20, 6159–6169 (2014).\n19. Reddy, S. et al. Non-heart-beating donor porcine livers: the adverse effect of \ncooling. Liver Transpl. 11, 35–38 (2005).\n20. Abstracts of the 18th Congress of the European Society for Organ \nTransplantation, 24–27 September 2017, Barcelona, Spain. Transpl. Int. 30 \n(Suppl 2), 5–576 (2017).\nAcknowledgements This study was performed by the Consortium for Organ \nPreservation in Europe (COPE). We thank the European Commission for \ntheir support through the Seventh Framework Programme. The following \norganisations, groups and individuals also made substantial contributions \nwithout which this trial could not have been completed successfully: NHS Blood \nand Transplant; the Surgical Intervention Trials Unit, University of Oxford; the \nClinical Trials and Research Governance unit, University of Oxford; Centre for \nEvidence in Transplantation, Royal College of Surgeons of England; the Liver \nTransplant Coordinators, anaesthetists and liver unit physicians at the Queen \nElizabeth Hospital, Birmingham, Addenbrooke’s Hospital, Cambridge, King’s \nCollege Hospital, London, the Royal Free Hospital London, Hospital Clinic, \n3 MAY 2018 | VO L 557 | NA T U RE | 55\n© 2018 Macmillan Publishers Limited, part of Springer Nature. All rights reserved.\n\nRESEARCH Article\nBarcelona, University Hospitals, Leuven, University Hospital, Essen; M. Soo, \nS. Morrish, C. Morris, L. Randle, R. Macedo Arantes, R. Morovat, A. Elsharkawy, \nG. Hirschfield, P. Muiesan, J. Isaac, J. Grayer, B. Buchholz, H. Vilca-Melendez, \nA. Zamalloa, D. Chasiotis, S. Khorsandi, B. Davidson, D. Sharma, A. Esson, \nD. Monbaliu, S. Mertens, S. Swoboda, J. Neuhaus, T. Benkö, V. Molina, R. Kumar, \nA. Bradley, M. Laspeyres, B. Patel, A. Mukwamba, S. Banks, the COPE Transplant \nTechnicians, the Specialist Nurses in Organ Donation and, of course, all of the \ndonors and their families. This study was funded by a European Commission \nSeventh Framework Programme (FP7) Grant (No 305934).\nReviewer information Nature thanks S. Schneeberger, S. G. Tullius and the other \nanonymous reviewer(s) for their contribution to the peer review of this work.\nAuthor contributions D.N., S.R.K., R.J.P., C.C.C. and P.J.F. designed this study \nwith help from other authors. R.J.P is Coordinator of the COPE Consortium. \nM.Z.A. and R.J.P. oversaw the collection of samples and establishment of the \ntrial biobank. D.N., C.D.L.C., A.W., H.M., M.T.P.R.P., D.M., W.J., N.H., C.I., M.M., \nR.R., A.J.B., C.J.E.W., I.J., J.P., P.K., A.Pau., M.P. and J.C.G.-V. were responsible for \nthe clinical conduct of the study at the respective trial sites. D.N., S.R.K., V.C. \nand S.J.D. were responsible for statistical design and analysis. L.R. and C.C.C. \nprovided device support and expertise to all trial sites. D.N., S.U., A.Pal. and \nJ.K. were responsible for MRCP image analysis. P.M., S.R.K. and S.J.D. provided \ngovernance oversight to ensure the study adhered to all regulatory and ethical \nrequirements. All authors reviewed the manuscript.\nCompeting interests P.J.F. is a co-founder, chief medical officer and consultant \nto OrganOx Limited and also holds shares in the company. C.C.C. is a co￾founder, chief technical officer and consultant to OrganOx Limited and also \nholds shares in the company. Neither P.J.F. nor C.C.C. were involved in the \nselection, recruitment or transplantation of patients in this study.\nAdditional information\nExtended data is available for this paper at https://doi.org/10.1038/s41586-\n018-0047-9.\nSupplementary information is available for this paper at https://doi.\norg/10.1038/s41586-018-0047-9.\nReprints and permissions information is available at http://www.nature.com/\nreprints.\nCorrespondence and requests for materials should be addressed to D.N. or \nC.C.C. or P.J.F.\nPublisher’s note: Springer Nature remains neutral with regard to jurisdictional \nclaims in published maps and institutional affiliations.\n56 | NA T U RE | VO L 557 | 3 MAY 2018\n© 2018 Macmillan Publishers Limited, part of Springer Nature. All rights reserved.\n\nArticle RESEARCH\nMethods\nStudy design. This investigator-led, multinational, open-label, two-arm, paral￾lel randomized controlled trial included seven liver transplant centres from the \nUK (Addenbrooke’s Hospital, Cambridge; King’s College Hospital, London; \nQueen Elizabeth Hospital, Birmingham; Royal Free Hospital, London), Belgium \n(Universitaire Ziekenhuizen, Leuven), Spain (Hospital Clínic de Barcelona, \nBarcelona) and Germany (Universitatsklinikum, Essen), and was part of the \nEU-funded Consortium for Organ Preservation in Europe (COPE, http://www.\ncope-eu.org/). Approval was obtained from national research ethics commit￾tees and medical device regulatory bodies in each trial region, in particular the \nLondon–Dulwich National Research Ethics Committee (NREC) and the Medicines \nand Healthcare Regulatory Agency (MHRA) in the UK; the Federaal Agentschap \nvoor Geneesmiddelen en Gezondheidsproducten (FAGG) and the Commissie \nMedische Ethiek of Universitaire Ziekenhuizen, Leuven, Belgium; the Comité \nÉtico de Investigación Clínica of the Hospital Clínic de Barcelona; the Deutsche \nÄrztekammer and the ethics committee of University Hospital Essen, Germany. \nThe trial protocol was registered before recruitment (ISRCTN 39731134). All rel￾evant ethical regulations relating to the conduct of this study were followed at \neach trial site. The trial is reported in accordance with the CONSORT statement21.\nNo major amendments were made to the trial design after the start of recruit￾ment.\nEligibility and consent. Inclusion criteria for donors and recipients were deliber￾ately broad to represent the full spectrum of clinical practice. Whole livers from \nDBD and DCD (Maastricht category III22) donors at least 16 years of age were \neligible. Specific donor consent was not required for trial inclusion. No organs \nwere procured from prisoners. Recipients were eligible provided they were at least \n18 years old and listed for a liver-only transplant, excluding those with fulminant \nliver failure, owing to the poor prognosis of this group regardless of organ quality. \nPotential participants were consented while on the waiting list; consent was \naffirmed on the day of transplantation. The consent included the recording of \nanonymized data for trial purposes and the collection of biological samples for \nstorage in the trial biobank (see ‘Sample collection’). No patient identifiable data \nwere collected.\nRandomization. Once an eligible donor organ was allocated to a consented recip￾ient and the availability of the NMP device and team was confirmed, the liver \nwas randomized. All clinical decisions thereafter, including graft suitability and \nprocedure scheduling, were made independently of the trial team.\nUsing an online randomization tool, livers were assigned to NMP or SCS with \n1:1 allocation ratio as per a computer-generated randomization schedule, using \nvariable block size, stratified by transplant centre and donor type (DBD/DCD). \nThe unit of randomization was donor livers rather than recipients, but analysis is \nreported for the transplant recipients.\nStatic cold storage group. Livers randomized to SCS were retrieved, preserved, \ntransported and transplanted according to local standard practice.\nNormothermic machine perfusion group. The OrganOx metra normothermic \nliver perfusion device was used (Extended Data Fig. 5a), which enables automated \norgan preservation for up to 24h. Following randomization to NMP, the device and \naccompanying researcher were transported to the donor hospital. The device was \nset-up during the retrieval procedure, as has been previously described9\n. A sterile \ndisposable set was installed on to the device and primed with 500ml gelofusine \n(B. Braun Ltd) and three units of donor-matched packed red blood cells. Antibiotics \nwere given at the outset and heparin, insulin, prostacyclin, bile salts and fat-free \nparenteral nutrition were infused during the perfusion (Extended Data Fig. 5b).\nFollowing retrieval of the donor organ, and while still at the donor hospital, the \nliver back-table operation was performed23, followed by cannulation of the hepatic \nartery, portal vein, inferior vena cava and bile duct. The liver was connected to the \nNMP device and perfusion commenced (Fig. 1). During the early part of the per￾fusion sodium bicarbonate was added incrementally to achieve a physiological pH. \nThe OrganOx metra perfusion device incorporates online blood gas measurement \n(Terumo CD1-500) together with software-controlled algorithms to control PO2\nand PCO2\n (within physiological limits), temperature (37°C), mean arterial pressure \n(65–75mm Hg) and), inferior vena cava pressure (0–2mm Hg). Typical blood \nflows of 200–400mlmin−1\n (artery) and 1,000-1,200mlmin−1\n (portal vein) were \nobtained. Glucose was measured manually and the value entered into the device. \nIf glucose fell below 10mmoll\n−1\n this automatically triggered the infusion of a fat￾free TPN mixture (Nutriflex Special, B. Braun Ltd) into the perfusate.\nNMP continued throughout the duration of transport and storage until the \ntransplanting team were ready to implant the liver. The minimum protocol-stipulated \nNMP duration was 4h, the time needed for ATP repletion in animal studies11. \nThe maximum allowed NMP duration was 24h in line with the experience in the \nphase-I study and the regulatory approval for the device9\n.\nSample collection. Tissue biopsies (donor liver and bile duct), recipient blood \nand urine were collected at pre-specified time points from every liver/transplanted \npatient in the study. In addition to these, samples of perfusate fluid and bile were \ncollected from every NMP liver. These were stored in a central biobank established \nby the COPE Consortium for use in ongoing mechanistic studies. Each sample was \nallocated a unique bar code, which the biobank coordinator was able to match to \na specific trial identification number. No patient identifiable data were associated \nwith each sample.\nStudy end points. The primary endpoint was defined as the difference between the \ntwo treatment arms in the peak level of serum AST within seven days after trans￾plant. This is a clinically accepted biomarker, predictive of primary non-function \nas well as graft and patient survival12,24 and is also associated with histological \nevidence of moderate to severe perfusion injury25,26.\nA surrogate marker of graft survival was used in this trial for two reasons: (1) \nthe relatively high survival rates in liver transplantation (>90%) and (2) the mul￾tifactorial causes of graft loss. A trial based directly on graft or patient survival \nwould have had to be unfeasibly large.\nIn order to ensure consistency and to minimise the hypothetical AST ‘wash-out’ \neffect in the NMP-treated organs, the first post-transplantation value was measured \nbetween 12 and 24h after reperfusion.\nSecondary end points included: (1) organ discard rate (after retrieval); (2) \npost-reperfusion syndrome27:>30% drop in mean arterial pressure persisting \nfor>1min within five minutes of reperfusion; (3) primary non-function: irre￾versible graft dysfunction, for non-technical and non-immunological causes, lead￾ing to death or emergency liver replacement during the first 10 days after liver \ntransplantation; (4) early allograft dysfunction13 as indicated by any one of the \nfollowing clinical indicators: (i) bilirubin>170 μmol l−1\n on day 7 after transplant; \n(ii) INR>1.6 on day 7 after transplant; (iii) peak-AST>2,000 IU l−1\n during the \nfirst 7 days; (4) length of hospital and ICU stays; (5) need for renal replacement \ntherapy; (6) evidence of cholangiopathy on MRCP at six months; (7) graft and \npatient survival at one year.\nFull details of all secondary outcomes are available in the trial protocol28.\nSix-month MRCP. An MRCP scan was performed six months (range \n5–7 months) after transplant to evaluate the biliary tree for features of cholangiopathy \nevident by biliary strictures. All scans were reviewed by two independent radio￾logists blinded to the method of organ preservation with disparities adjudicated \nby a third radiologist. Owing to the lack of any existing grading system for biliary \nstrictures, a system was agreed to in advance by consensus among the radiolo￾gists to allow definitive categorization of the presence and site of strictures. The \nfindings were reported as follows: (1) normal biliary tree; (2) anastomotic stric￾ture (>70% of luminal diameter); (3) unequivocal evidence of non-anastomotic \nstricture anywhere in the biliary tree; (4) both anastomotic and non-anastomotic \nbiliary strictures.\nStatistical analysis. Previous data from Universitaetsklinikum Essen, Germany \n(A.Pau. & S.R.K., unpublished observations), demonstrated the geometric mean of \npeak AST to be 608.59 IU l−1\n in patients transplanted following SCS. The present \nstudy was powered to detect a (clinically relevant) 33% reduction in peak AST \nwith 90% power at a 5% significance level, requiring 220 transplanted livers (110 \nper arm).\nResults are reported as a modified intention-to-treat analysis. A per-protocol \nsensitivity analysis was also performed excluding livers that received machine per￾fusion outside the protocol specified range (4–24h) and comparing the groups \naccording to the treatment actually received. Livers randomized but not retrieved \nwere excluded from the analysis.\nPrimary outcome was analysed using ANOVA with adjustment for stratification \nfactors. The peak AST was calculated for each recipient with at least two values \navailable. Missing AST values were not imputed. Binary outcomes were assessed \nusing test for proportions or logistic regression to adjust for potential confounders \nand report odds ratios. Continuous outcomes were compared using a Student’s \nt-test, if normally distributed, or by Mann–Whitney U-test otherwise. Time-to￾event outcomes were analysed using Kaplan–Meier estimates and log-rank tests. \nOutcomes are reported with 95% confidence intervals and P values to three decimal \nplaces. P<0.05 was regarded as statistically significant.\nPre-specified subgroup analyses were performed for donor type (DCD versus \nDBD), donor risk index (ET-DRI) and MELD score using tests for interaction and \nreported using forest plots. Interaction methods were used to look for consistency \nof treatment effect across the different subgroups and reported using forest plots. \nThe study was not powered to detect differences in the subgroups; these results \nshould only be regarded as hypothesis-generating.\nAnalyses were conducted using Stata version 14.2 (StataCorp).\nNo formal interim analyses of end points were carried out. At regular intervals, \nan independent Data Monitoring Committee reviewed confidential reports cov￾ering recruitment, safety parameters and primary end point data.\nFull details of the statistical methodology are available in the Supplementary \nInformation.\nMachine perfusion parameters. During NMP continuous displays of pressures, \nflows, metabolic (pH) and synthetic (bile production) liver function were available \n© 2018 Macmillan Publishers Limited, part of Springer Nature. All rights reserved.\n\nRESEARCH Article\nto the operator. In addition, lactate measurements were carried out using external \nblood gas analysis. The trial protocol did not stipulate the manner in which these \nparameters should be interpreted.\nOnce trial recruitment was complete, an ad hoc analysis was performed in which \nNMP organs were categorized according to those which, following transplantation, \ndisplayed minimal preservation injury (MPI; peak AST<250 IU l−1\n) and those \nwith severe preservation injury (SPI; peak AST>1,000 IU l−1\n). Groups were com￾pared for differences in donor and recipient characteristics, perfusate biochemistry, \nbile production and evidence of post-reperfusion syndrome.\nAdverse events. Reporting of adverse events was in accordance with the European \nCommission MEDDEV guidelines29. Following trial completion, these were \nreviewed by two independent clinicians blinded to the treatment arm. Adverse \nevents with a Clavien-Dindo30 grading greater than IIIa were considered serious \nadverse events. Rates of adverse events are reported with 95% confidence intervals. \nNo statistical tests were applied to these data.\nFull details of the trial methodology are available in the clinical trial protocol28.\nReporting Summary. Further information on experimental design is available in \nthe Nature Research Reporting Summary linked to this paper.\nData availability. The data that support the findings of this study are available from \nthe corresponding author upon reasonable request. The full trial protocol, statis￾tical analysis plan and final statistical report are available in the Supplementary \nInformation.\n21. Schulz, K. F., Altman, D. G. & Moher, D. CONSORT 2010 statement: updated \nguidelines for reporting parallel group randomised trials. Br. Med. J 340, c332 \n(2010).\n22. Kootstra, G., Daemen, J. H. & Oomen, A. P. Categories of non-heart-beating \ndonors. Transplant. Proc 27, 2893–2894 (1995).\n23. Makowka, L. et al. Surgical technique of orthotopic liver transplantation. \nGastroenterol. Clin. North Am 17, 33–51 (1988).\n24. Glanemann, M. et al. Clinical implications of hepatic preservation injury after \nadult liver transplantation. Am. J. Transplant 3, 1003–1009 (2003).\n25. Gaffey, M. J. et al. Predictive value of intraoperative biopsies and liver function \ntests for preservation injury in orthotopic liver transplantation. Hepatology 25, \n184–189 (1997).\n26. Karayalçin, K. et al. The role of dynamic and morphological studies in the \nassessment of potential liver donors. Transplantation 57, 1323–1327 (1994).\n27. Hilmi, I. et al. The impact of postreperfusion syndrome on short-term patient \nand liver allograft outcome in patients undergoing orthotopic liver \ntransplantation. Liver Transpl 14, 504–508 (2008).\n28. Nasralla, D. et al. A multicentre randomised controlled trial to compare the \nefficacy of ex-vivo normothermic machine perfusion with static cold storage in \nhuman liver transplantation. Protoc. Exch. https://doi.org/10.1038/\nprotex.2018.027 (2018).\n29. Guidelines on Medical Devices. Clinical Investigations: Serious Adverse Event \nReporting. Report No. MEDDEV 2.7/3 (European Commission, 2010).\n30. Dindo, D., Demartines, N. & Clavien, P. A. Classification of surgical \ncomplications: a new proposal with evaluation in a cohort of 6336 patients and \nresults of a survey. Ann. Surg. 240, 205–213 (2004).\n© 2018 Macmillan Publishers Limited, part of Springer Nature. All rights reserved.\n\nArticle RESEARCH\nExtended Data Fig. 1 | Forest plot for subgroup analysis of peak AST by donor type. Geometric mean ratio and 95% confidence interval are reported \nfor each subgroup and overall for all groups. DBD group, n=87 NMP, n=80 SCS; DCD group, n=33 NMP, n=20 SCS.\n© 2018 Macmillan Publishers Limited, part of Springer Nature. All rights reserved.\n\nRESEARCH Article\nExtended Data Fig. 2 | Post-reperfusion syndrome. a, Kaplan–Meier plot for one-year survival of patients with two-sided log-rank test. b, Kaplan–\nMeier plot for one-year graft survival with two-sided log-rank test.\n© 2018 Macmillan Publishers Limited, part of Springer Nature. All rights reserved.\n\nArticle RESEARCH\nExtended Data Fig. 3 | Machine perfusion parameters during NMP.\na, Hepatic artery flow during NMP. b, Portal vein flow during NMP. \nc, Perfusate pH during NMP. d, Bile production during NMP. \na–d, Data are mean±s.d. of each time point. Actual values are shown in \nthe table. n=87.\n© 2018 Macmillan Publishers Limited, part of Springer Nature. All rights reserved.\n\nRESEARCH Article\nExtended Data Fig. 4 | Perfusate lactate levels during NMP. Scatter graph with trend line showing perfusate lactate levels at different time points during \nNMP for all transplanted livers. n=94.\n© 2018 Macmillan Publishers Limited, part of Springer Nature. All rights reserved.\n\nArticle RESEARCH\nExtended Data Fig. 5 | NMP device and circuit. a, OrganOx metra \n(generation 1). The NMP device used in the trial. b, OrganOx metra NMP \ncircuit. The liver is perfused via the hepatic artery and portal vein. It \ndrains via the inferior vena cava to a centrifugal pump through which the \nperfusate passes, via a heat exchanger/oxygenator, to a reservoir or directly \ninto the hepatic artery. The perfusate in the reservoir drains under gravity \ninto the portal vein.\n© 2018 Macmillan Publishers Limited, part of Springer Nature. All rights reserved.\n\nRESEARCH Article\nExtended Data Table 1 | Detailed breakdown of reasons for discard of NMP livers\n© 2018 Macmillan Publishers Limited, part of Springer Nature. All rights reserved.\n\nArticle RESEARCH\nExtended Data Table 2 | Post-reperfusion syndrome analysis\na, Post-reperfusion syndrome by treatment group. Frequencies and column percentages are reported. Difference in proportions was tested using a Fisher’s test for proportions. b, Difference in \npost-reperfusion lactate in the recipient in each treatment arm. This relates to the first lactate measurement recorded by the anaesthetist after liver reperfusion and occurred within 30min of reperfu￾sion. Analysis using non-parametric Mann–Witney U-test. IQR, inter-quartile range. c, Difference in use of vasopressor medications before, during and after liver reperfusion in the recipient. Percentage \nof total events are reported in brackets. Details of the specific vasopressors that were used were not recorded.\n© 2018 Macmillan Publishers Limited, part of Springer Nature. All rights reserved.\n\nRESEARCH Article\nExtended Data Table 3 | Extended primary outcome analysis\na, Primary outcome results from the unadjusted analysis. Sample size for analysis of primary outcome is n=220. A Student’s t-test was used. ^First cell in this column refers to the mean difference in \nnatural logarithm of peak AST (variable used to run the analysis models). The second cell in this column refers to the geometric mean ratio of the peak AST, used to look at the reduction in the original \nmeasurement. b, Treatment effect on peak AST for donor type subgroups. Sample size for subgroup analysis is n=220 (DBD group, n=87 NMP, n=80 SCS; DCD group, n=33 NMP, n=20 SCS). A \nStudent’s t-test was used. No power calculation or adjustment was made for subgroup analysis.\n© 2018 Macmillan Publishers Limited, part of Springer Nature. All rights reserved.\n\nArticle RESEARCH\nExtended Data Table 4 | Characteristics and perfusate analysis of livers included in NMP liver quality model development\na, Demographic data for organ quality model development livers. Demographic data for minimal preservation injury (MPI; peak AST<250 IU l−1; n=28) and significant preservation injury (SPI; peak \nAST>1,000 IU l−1; n=25) groups. Continuous variables were analysed using an unpaired Student’s t-test and categorical variables using Fisher’s exact test. Data are mean±s.e.m. b, Comparison of \nNMP perfusate analyses between MPI (peak AST<250 IU l−1; n=28) and SPI (peak AST>1,000 IU l−1; n=25) groups. A D’Agostino–Pearson normality test was performed to assess data distribution. \nParametric data were analysed using an unpaired Student’s t-test and non-parametric data were analysed using a Mann–Whitney U-test. Parametric data are presented as mean±s.e.m. and \nnon-parametric data are presented as median and range.\n© 2018 Macmillan Publishers Limited, part of Springer Nature. All rights reserved.\n\nRESEARCH Article\nExtended Data Table 5 | Adverse events analysis\na, Number of patients with any adverse events reported in each trial arm. The percentage of total events is reported in brackets. No statistical tests have been applied. b, Adverse events were catego￾rized by Clavien–Dindo grade. Breakdown of adverse events in each trial arm according to Clavien–Dindo grading. The percentage of total events is reported in brackets. Adverse events with Clavien–\nDindo grading ≥IIIb were categorized as serious adverse events. No statistical tests have been applied. c, Breakdown of adverse events and serious adverse events in each trial arm. The percentage of \ntotal events is reported in brackets. Adverse events with Clavien–Dindo grading ≥IIIb were categorized as serious adverse events. No statistical tests have been applied.\n© 2018 Macmillan Publishers Limited, part of Springer Nature. All rights reserved.\n\nArticle RESEARCH\nExtended Data Table 6 | Detailed breakdown of adverse events in each trial arm\nThe percentage of total events is reported in brackets. No statistical tests have been applied.\n© 2018 Macmillan Publishers Limited, part of Springer Nature. All rights reserved.\n\n1nature research | life sciences reporting summary June 2017\nCorresponding author(s):\nDavid Nasralla, Constantin C Coussios, \nPeter J Friend\nInitial submission Revised version Final submission\nLife Sciences Reporting Summary\nNature Research wishes to improve the reproducibility of the work that we publish. This form is intended for publication with all accepted life \nscience papers and provides structure for consistency and transparency in reporting. Every life science submission will use this form; some list \nitems might not apply to an individual manuscript, but all fields must be completed for clarity. \nFor further information on the points included in this form, see Reporting Life Sciences Research. For further information on Nature Research \npolicies, including our data availability policy, see Authors & Referees and the Editorial Policy Checklist. \n` Experimental design\n1. Sample size\nDescribe how sample size was determined. Data from 416 liver transplant recipients from University Hospital Essen \ndemonstrated the geometric mean of peak AST to be 608.59 IU/L (the geometric \nmean is used as peak AST is non-normally distributed). 220 transplants (110 per \narm) would have 90% power at 5% significance level to detect a 33% reduction (to \n401.67 IU/L) in the geometric mean of peak AST. Thus the trial required a sample \nsize of 220 livers to be transplanted and reach the primary endpoint. \nOnce trial recruitment was complete, an ad hoc analysis was performed in which \nNMP organs were categorised according to those which, following transplant, \ndisplayed minimal preservation injury (MPI; peak AST <250 IU/litre; n=28) and \nthose with more severe preservation injury (SPI; peak AST >1000 IU/litre; n=25). \n2. Data exclusions\nDescribe any data exclusions. Inclusion criteria for donors and recipients were deliberately broad to represent \nthe full spectrum of clinical practice. Whole livers from brainstem death (DBD) and \ncirculatory death (DCD) donors aged at least 16 years were eligible. \nRecipients were eligible provided they were at least 18 years old and listed for a \nliver-only transplant, excluding those with fulminant liver failure, due to their poor \nprognosis regardless of organ quality. \n3. Replication\nDescribe whether the experimental findings were \nreliably reproduced.\nThis is the first phase 3 randomised controlled trial to compare any form of \nmachine perfusion technology with static cold storage in human liver \ntransplantation. This findings have broadly confirmed those demonstrated in small \nscale animal studies and in small retrospectively matched case series. \nThis was a clinical trial not involving experiments that need replication.\n4. Randomization\nDescribe how samples/organisms/participants were \nallocated into experimental groups.\nOnce an eligible donor organ was allocated to a consented recipient and the \navailability of the normothermic liver perfusion (NMP) team was confirmed, the \nliver was randomised. All clinical decisions thereafter, including graft suitability and \nprocedure scheduling, were made independently of the trial team. \nUsing an online randomisation tool, livers were assigned to NMP or static cold \nstorage with 1:1 allocation ratio as per a computer generated randomisation \nschedule using variable block size, stratified by transplant centre and donor type \n(DBD/DCD). The unit of randomisation was donor livers rather than recipients, but \nanalysis is reported for the transplant recipients.\n5. Blinding\nDescribe whether the investigators were blinded to \ngroup allocation during data collection and/or analysis.\nThis was an open label study. Due to the nature of the intervention (large machine \nperfusion device), it was not possible to blind investigators as to which arm the \nliver had been randomised. .\nNote: all studies involving animals and/or human research participants must disclose whether blinding and randomization were used.\n\n2nature research | life sciences reporting summary June 2017\n6. Statistical parameters \nFor all figures and tables that use statistical methods, confirm that the following items are present in relevant figure legends (or in the \nMethods section if additional space is needed). \nn/a Confirmed\nThe exact sample size (n) for each experimental group/condition, given as a discrete number and unit of measurement (animals, litters, cultures, etc.)\nA description of how samples were collected, noting whether measurements were taken from distinct samples or whether the same \nsample was measured repeatedly\nA statement indicating how many times each experiment was replicated\nThe statistical test(s) used and whether they are one- or two-sided (note: only common tests should be described solely by name; more \ncomplex techniques should be described in the Methods section)\nA description of any assumptions or corrections, such as an adjustment for multiple comparisons\nThe test results (e.g. P values) given as exact values whenever possible and with confidence intervals noted\nA clear description of statistics including central tendency (e.g. median, mean) and variation (e.g. standard deviation, interquartile range)\nClearly defined error bars\nSee the web collection on statistics for biologists for further resources and guidance.\n` Software\nPolicy information about availability of computer code\n7. Software\nDescribe the software used to analyze the data in this \nstudy. \nAnalyses were conducted with the use of Stata version 14.2 (StataCorp, College \nStation, TX).\nFor manuscripts utilizing custom algorithms or software that are central to the paper but not yet described in the published literature, software must be made \navailable to editors and reviewers upon request. We strongly encourage code deposition in a community repository (e.g. GitHub). Nature Methods guidance for \nproviding algorithms and software for publication provides further information on this topic.\n` Materials and reagents\nPolicy information about availability of materials\n8. Materials availability\nIndicate whether there are restrictions on availability of \nunique materials or if these materials are only available \nfor distribution by a for-profit company.\nThe normothermic machine perfusion device used in this study is now CE marked \nand can be used for clinical practice, but is only available through the \nmanufacturing company, OrganOx Ltd. There are no restrictions on the other \nmaterials used in this study.\n9. Antibodies\nDescribe the antibodies used and how they were validated \nfor use in the system under study (i.e. assay and species).\nNo antibodies were used\n10. Eukaryotic cell lines\na. State the source of each eukaryotic cell line used. No eukaryotic cell lines were used\nb. Describe the method of cell line authentication used. No eukaryotic cell lines were used\nc. Report whether the cell lines were tested for \nmycoplasma contamination.\nNo eukaryotic cell lines were used\nd. If any of the cell lines used are listed in the database \nof commonly misidentified cell lines maintained by \nICLAC, provide a scientific rationale for their use.\nNo eukaryotic cell lines were used\n` Animals and human research participants\nPolicy information about studies involving animals; when reporting animal research, follow the ARRIVE guidelines\n11. Description of research animals\nProvide details on animals and/or animal-derived \nmaterials used in the study.\nNo animals were used in the study\n\n3nature research | life sciences reporting summary June 2017\nPolicy information about studies involving human research participants\n12. Description of human research participants\nDescribe the covariate-relevant population \ncharacteristics of the human research participants.\nLivers were obtained from deceased donors aged at least 16 years who's family \nmembers had provided appropriate consent for the donation of their organs. \nRecipients were eligible provided they were at least 18 years old and listed for a \nliver-only transplant, excluding those with fulminant liver failure, due to their poor \nprognosis regardless of organ quality. \nDonors in both arms of the study were well matched in the following respects: \nDonor type (DBD, DCD); age; sex; ethnicity; cause of death; BMI; eurotransplant \ndonor risk index. \nRecipients in both arms of the study were well matched in the following respects: \nAge; sex; cause of liver failure; BMI; retransplants; Model of end-stage liver disease \n(MELD) score; estimated glomerular filtration rate (eGFR).\n\n"], "response": "The study aimed to compare the effectiveness of normothermic machine perfusion (NMP) and conventional cold storage (CCS) in liver transplantation. Donor livers from deceased individuals were randomly assigned to either NMP or CCS based on eligibility and center/donor type stratification. The primary endpoint was the peak level of serum aspartate transaminase (AST) within seven days after transplantation, which is a clinically accepted biomarker predictive of graft and patient survival. The study found that NMP significantly reduced the peak AST by 49.4% compared to CCS when adjusted by center and donor type. The study involved 335 donor livers, with 137 included in the intention-to-treat analysis and 121 included in the per-protocol sensitivity analysis. The study confirmed previous findings from animal studies and smaller retrospective matched case series. The study was not a clinical trial involving experiments that needed replication, and due to the nature of the intervention, it was not possible to blind investigators as to which arm the liver had been randomized. The NMP device used in the study is now CE marked and available through the manufacturing company, OrganOx Ltd. No antibodies were used in the study, and no eukaryotic cell lines or animals were utilized. The study population consisted of deceased donors aged at least 16 years whose families provided appropriate consent for organ donation, and recipients were eligible if they were at least 18 years old, listed for a liver-only transplant, and did not have fulminant liver failure. Both arms of the study were well matched regarding donor type, age, sex, ethnicity, cause of death, BMI, and Eurotransplant donor risk index, as well as recipient age, sex, cause of liver failure, BMI, retransplants, Model of End-Stage Liver Disease score, and estimated glomerular filtration rate."}
{"user_input": "How has machine perfusion changed risk thresholds associated with steatotic donor livers?", "retrieved_contexts": ["ARTICLE\nTransplantation of discarded livers following\nviability testing with normothermic\nmachine perfusion\nHynek Mergental 1,2,3,11✉, Richard W. Laing1,2,3,11, Amanda J. Kirkham4, M. Thamara P. R. Perera1\n,\nYuri L. Boteon 1,2,3, Joseph Attard1,2,3, Darren Barton 5, Stuart Curbishley2,3, Manpreet Wilkhu5,\nDesley A. H. Neil 2,3,6, Stefan G. Hübscher2,3,6, Paolo Muiesan1\n, John R. Isaac1\n, Keith J. Roberts1,3,\nManuel Abradelo1\n, Andrea Schlegel1,3, James Ferguson1,2, Hentie Cilliers1\n, Julian Bion7, David H. Adams1,2,3,\nChris Morris 8, Peter J. Friend8,9, Christina Yap 4,10,11, Simon C. Afford2,3,11✉ & Darius F. Mirza 1,2,3,11✉\nThere is a limited access to liver transplantation, however, many organs are discarded based\non subjective assessment only. Here we report the VITTAL clinical trial (ClinicalTrials.gov\nnumber NCT02740608) outcomes, using normothermic machine perfusion (NMP) to\nobjectively assess livers discarded by all UK centres meeting specific high-risk criteria. Thirty￾one livers were enroled and assessed by viability criteria based on the lactate clearance to\nlevels ≤2.5 mmol/L within 4 h. The viability was achieved by 22 (71%) organs, that were\ntransplanted after a median preservation time of 18 h, with 100% 90-day survival. During the\nmedian follow up of 542 days, 4 (18%) patients developed biliary strictures requiring re￾transplantation. This trial demonstrates that viability testing with NMP is feasible and in this\nstudy enabled successful transplantation of 71% of discarded livers, with 100% 90-day\npatient and graft survival; it does not seem to prevent non-anastomotic biliary strictures in\nlivers donated after circulatory death with prolonged warm ischaemia.\nhttps://doi.org/10.1038/s41467-020-16251-3 OPEN\n1 Liver Unit, Queen Elizabeth Hospital, University Hospitals Birmingham NHS Foundation Trust (UHBFT), Birmingham, UK. 2National Institute for Health\nResearch (NIHR), Birmingham Biomedical Research Centre, University of Birmingham and University Hospitals Birmingham NHS Foundation Trust,\nBirmingham, UK. 3 Centre for Liver and Gastrointestinal Research, Institute of Immunology and Immunotherapy, University of Birmingham, Birmingham, UK. 4 Cancer Research UK Clinical Trials Unit, University of Birmingham, Birmingham, UK. 5D3B team, Cancer Research UK Clinical Trials Unit, University of\nBirmingham, Birmingham, UK. 6Department of Cellular Pathology, Queen Elizabeth Hospital, University Hospitals Birmingham NHS Foundation Trust\n(UHBFT), Birmingham, UK. 7Department of Intensive Care Medicine, University of Birmingham, Birmingham, UK. 8 OrganOx Limited, Oxford, UK. 9Nuffield\nDepartment of Surgical Sciences, University of Oxford, Oxford, UK. 10 Clinical Trials and Statistics Unit, The Institute of Cancer Research, London, UK. 11These\nauthors contributed equally: Hynek Mergental, Richard W. Laing, Christina Yap, Simon C. Afford, Darius F. Mirza. ✉email: hynek.mergental@uhb.nhs.uk;\nS.C.AFFORD@bham.ac.uk; darius.mirza@uhb.nhs.uk\nNATURE COMMUNICATIONS | (2020) 11:2939 | https://doi.org/10.1038/s41467-020-16251-3 | www.nature.com/naturecommunications 1\n1234567890():,;\n\nL\niver transplantation is a life saving treatment for selected\npatients with end-stage liver disease, primary liver cancer\nand fulminant hepatic failure. The incidence of liver disease\nhas risen by 500% over the last 4 decades, however, access to\ntransplantation is limited by the shortage of donor organs1. As a\nconsequence, 240 patients (19%) waiting for liver transplantation\nin the United Kingdom either died or were removed from the\nwaiting list in 2016–20172. Data from the United States shows a\nsimilar pattern, comprising 32% of those listed for transplant\n(3629 patients) within 3 years of listing2,3. The demand for liver\ngrafts has driven the wider use of extended criteria donors4.\nHowever, these are associated with an increased risk of primary\nnon-function or delayed failure5–9, and the acceptance of these\nhigher-risk organs varies widely10. Because of these inferior\noutcomes, and the difficulty of predicting organ viability, many\npotential donor organs remain unutilised. The high waiting list\nmortality justifies the utilisation of more marginal grafts, but\ncurrent practice requires risk mitigation by matching high-risk\nlivers to lower-risk recipients to achieve patient survival rates that\nare acceptable11. Furthermore, the determination of suitability of\na graft for transplantation largely depends on a surgeon’s sub￾jective assessment of the graft’s appearance, using criteria that are\nknown to be unreliable12.\nOrgan preservation currently relies upon cooling to ice tem￾perature to reduce cellular metabolism, and infusing specialist\nsolutions to limit cellular damage. Oxygen deprivation and accu￾mulation of by-products of anaerobic metabolism limit the dura￾tion of storage and result in ischaemia–reperfusion injury at the\ntime of implantation. This process is more severe in marginal\norgans13. Normothermic machine perfusion (NMP) has been\nshown to reduce preservation-related graft injury compared to\nstatic cold storage in transplantable livers, according to current\nselection criteria, in a prospective European trial, which also\ndemonstrated increased utilisation of organs14. In NMP, the liver is\nsupplied with oxygen, nutrients and medication at physiological\ntemperature and pressures, maintaining conditions that support\nhomoeostasis, normal metabolic activity and objective assessment\nof function in real-time. Experimental data have shown that end￾ischaemic NMP facilitates replenishment of adenosine tripho￾sphate and glycogen levels. Based on increasing clinical experience,\nviability criteria have emerged; these are objective parameters,\nmeasurable during NMP15. Whilst the feasibility of this approach\nhas been demonstrated in a proof-of-concept series, it has not been\nvalidated in a rigorous clinical trial16,17.\nWe therefore conducted this prospective, non-randomised,\nadaptive phase 2 trial in a large single centre, to evaluate the\npotential of NMP to provide objective assessment of the viability\nof livers currently deemed unsuitable for transplantation, and to\ntransplant those that met predetermined criteria. The primary\nclinical objective underlying this project was the increased and\nsafe utilisation of livers which are currently discarded.\nThe trial demonstrates that viability testing with NMP is fea￾sible, and the objective assessment enables successful transplan￾tation of 71% of perfused discarded livers, with 100% 90-day\npatient and graft survival. The intervention does not seem to\nprevent the development of non-anastomotic biliary strictures in\nlivers donated after circulatory death (DCD) with prolonged\ndonor warm ischaemic times.\nResults\nCharacteristics of discarded liver offers and study participants.\nOver the 16-month study duration from November 2016 to\nFebruary 2018, there were 185 livers discarded for clinical use and\noffered for research. Characteristics of those offers and the study\ninclusion flowchart are provided in Fig. 1a, b.\nOne hundred and sixty-four patients on the waiting list were\napproached for potential participation, of which 53 were\nconsented, and 22 were enroled in the study and received rescued\ngrafts. The potential participants were counselled regarding the\nhigh-risk nature of the project and unknown long-term outcomes\nof resuscitated livers. As a consequence, a proportion of patients\nwere understandably reluctant to participate, and therefore the\nlack of suitable consented recipients was the principal rate limiting\nfactor for inclusion. The number of consented patients at any\ngiven time ranged from 1 to 9; the flow diagram displaying the\nprogress of patients through the trial is shown in Fig. 2.\nDonor liver characteristics and liver biopsy features. In 8 (26%)\ndonors the liver was the only procured organ. All discarded donor\nlivers entered in the study satisfied one or more of the inclusion\nhigh-risk criteria. The livers enroled in the trial consisted of 17\norgans donated after brainstem death (DBD) and 14 DCD. Many\nof these organs looked grossly suboptimal, with some degree of\nsteatosis, capsular fibrosis or rounded edges with multifactorial\nreasons for discard, that was captured by the donor risk index\n(DRI) > 2.0 in 22 (71%) livers, with the median DRI 2.2 (1.9–2.9).\nDetailed characteristics are shown in Table 1 and Supplementary\nTable 1. Photos of all included livers are presented in Fig. 3. The\ntransplanted livers were typically smaller than non-viable ones\n(1.7 vs. 2.0 kg, p = 0.015; Kruskal–Wallis test), with lower peak\npre-mortem donor liver enzyme levels. The median static cold\nstorage time before starting NMP was 7 h:44 min (6:29–10:25).\nOnly 3 (10%) livers were included in the trial primarily for\nmacrosteatosis >30%, (50%, 80% and 60% macrovesicular stea￾tosis combined with 11 h:55 min, 12 h:00 min and 6 h:15 min cold\nischaemia, respectively). Glycogen content and steatosis degree\ndid not predict the viability assessment results. The detailed\nhistological finding of each study liver is provided in Supple￾mentary Table 2.\nPerfusion parameters assessment. During the NMP procedure\n25 livers quickly recovered metabolic activity and cleared lactate\nto the target level (details provided in Fig. 4). A biopsy of a\nsuspicious donor colonic lesion confirmed malignancy, making\none liver unsuitable for transplantation, after meeting the viability\ncriteria. In three livers, criteria were initially met, however,\nmetabolic function thereafter deteriorated within the first 4 h,\nwith increasing lactate. In two cases the transplant procedure was\nnot commenced and the livers were discarded. In the third, the\nexplant had begun, and the procedure continued. Overall, 22\n(71%) livers met the viability criteria and were transplanted fol￾lowing a median total preservation time of 17 h:53 min\n(16:17–21:48; Table 2).\nThe study patients. The majority (64%) of recipients were men,\nand median age was 56 (46–65) years. The leading indication for\ntransplantation was alcohol-related liver disease (36%), followed\nby primary sclerosing cholangitis (27%) and non-alcoholic stea￾tohepatitis (18%). In three (14%) patients the underlying liver\ndisease was complicated by liver cancer. The median UKELD18\nscore was 52 (49–55), with a calculated laboratory MELD score of\n12 (9–16). Details are provided in Table 2 and Supplementary\nTable 3.\nCo-primary study outcomes. Thirty-one livers were enroled into\nthe trial for objective assessment by NMP. Twenty-two of these\nlivers met the viability criteria and were transplanted, resulting in\na significant successful rescue rate of 71% (22/31, 90% Wilson CI:\n56.3–82.2%), to conclude that the procedure is feasible. All 22\nARTICLE NATURE COMMUNICATIONS | https://doi.org/10.1038/s41467-020-16251-3\n2 NATURE COMMUNICATIONS | (2020) 11:2939 | https://doi.org/10.1038/s41467-020-16251-3 | www.nature.com/naturecommunications\n\n(100%) transplanted patients were alive at day 90 post-trans￾plantation—greater than the 18/22 required by the trial design.\nTransplant outcomes. Graft 90-day survival was 100%. Seven\n(32%) patients developed early allograft dysfunction, and 7 (32%)\npatients developed Clavien–Dindo complication grade ≥3,\nincluding 4 (18%) cases with acute kidney injury requiring renal\nreplacement therapy. The median intensive care and in-hospital\nstays were 3.5 days (3–4) and 10 days (8–17), respectively. The 1-\nyear patient and graft survival were 100% and 86%, respectively.\nDetails are provided in Table 3.\nVascular and biliary complications. One patient developed an\nintra-operative hepatic artery thrombosis after receiving a DBD\ngraft that had sustained a hepatic arterial injury during procure￾ment. The artery was reconstructed but post-operatively throm￾bosed, undergoing emergency revascularisation which achieved\nlong-lasting arterial patency. The graft, however, developed biliary\nstrictures requiring multiple interventions and eventual re￾transplantation.\nThe per-protocol magnetic resonance cholangiopancreatogra￾phy (MRCP) imaging at 6 months revealed that 2 (9%) patients\ndeveloped anastomotic, and 4 (18%) patients non-anastomotic\nbiliary strictures that presented with cholestatic symptoms. With\nthe exception of the patient with hepatic artery thrombosis, all\nbiliary strictures affected recipients of DCD grafts. During the\nstudy median follow up of 542 days (456–641), 4 patients\nunderwent liver re-transplantation (at day 120, 225, 375 and 417).\nThe details are provided in Table 3 and Supplementary Table 3.\nComparison of outcomes with contemporary matched con￾trols. Patient and graft survival rates at 12 months (100% and\n86%, respectively) were similar to the matched controls (96% and\n86%, respectively) as shown in Fig. 5. The incidence of early\nallograft dysfunction was higher in the study group (32% vs. 9%,\nodds ratio 5.6, 95% CI: 1.1–27.8, p = 0.034; conditional logistic\n185 Retrieved livers were discarded and offered for research\n126 Livers were suitable for the trial consideration\n31 Livers were included and perfused \n22 Perfused livers met criteria and were transplanted\n9 Livers were not transplanted\n6 Failed to meet criteria\n1 Liver was excluded because of donor cancer after perfusion\ncommenced (the liver met criteria)\n2 Livers met criteria but deteriorated prior to LT started\n95 Livers could not be included \n1 Was used for a test perfusion required by MHRA\n25 Livers did not meet high-risk inclusion criteria\n21 Offers were declined because another perfusion was in progress\n22 Livers had no blood group suitable recipient\n19 Livers had no size matched suitable recipient\n7 Arrived with the cold ischaemia beyond the study criteria\n59 Livers were excluded\n22 Were unsuitable because of fibrosis or donor cancer\n13 Were damaged or had unfavourable anatomy\n11 Were already perfused\n13 Donors had other contraindications\na b\nSteatosis Logistics\nDonor complexity/Other Contraindication\nSteatosis (subjective)\nWarm ischaemic time\nSummative Donor history\nCancer/Fibrosis (biopsy)\nPoor machine perfusion\nSteatosis (biopsy)\nLogistics\nOther\nAnatomy/Damage\n13; 7%\n11; 6%\n22; 12%\n13; 7%\n17; 9%\n15; 8% 16; 9%\n14; 7%\n64; 35%\nFig. 1 Information about discarded livers in the UK between November 2016 and February 2018. a The study livers inclusion flowchart. Over the\n16-month study period there were 185 discarded liver research offers, of which 59 (32%) were not eligible for the trial due to an incidental finding of\ncancer, macroscopically apparent cirrhosis or advanced fibrosis, severe organ damage or previous machine perfusion. There were 126 livers suitable for the\ntrial, with steatosis being the leading cause of organ discard with 78 (42%) offers. Stringent donor inclusion criteria were not met in 25 (14%) offers and on\n21 (11%) occasions the research team was already committed to the perfusion of another study liver. A liver was considered for the trial only if it could be\nallocated to a consented, potential blood group- and size-matched low-risk recipient. Many recipients were apprehensive to participate in such a high-risk\nclinical trial, and as a consequence, at any given time there were usually only one to three patients consented. A significant proportion of approached\npatients declined to take part, or were transplanted with a standard quality liver before agreeing to take part in this study. Eventually, thirty-one livers were\nenroled to the trial, of which 22 (71%) grafts met the viability criteria and were successfully transplanted. b A summary of reasons for livers being\ndiscarded in the United Kingdom between November 2016 and February 2018. A total of 64 livers were discarded for severe steatosis on visual\nassessment, with 14 discarded for severe steatosis based on urgent liver biopsy. A percentage of livers were declined due to intra-abdominal or lung\nmalignancies (e.g. colonic cancer in donor 22). This did not include primary brain tumours or small renal cell cancers which are almost always considered\nfor donation. The reasons for logistic discard, include the transplant team already being committed to one or more transplantations, lack of a suitable\nrecipient or too long an anticipated cold ischaemia time due to delays with transportation.\nNATURE COMMUNICATIONS | https://doi.org/10.1038/s41467-020-16251-3 ARTICLE\nNATURE COMMUNICATIONS | (2020) 11:2939 | https://doi.org/10.1038/s41467-020-16251-3 | www.nature.com/naturecommunications 3\n\nregression). There were no differences in the other assessed\nparameters, including the need for post-transplant renal repla￾cement therapy, hospital stay or incidence of Clavien–Dindo\ngrade ≥ 3 complication rates. The incidence of clinically manifest\nnon-anastomotic biliary strictures was higher in the study group\n(18% vs. 2%, odds ratio 8.0, 95% CI: 0.9–71.6; p = 0.063; condi￾tional logistic regression), although this result needs to be inter￾preted with caution as the matched control patients did not\nreceive systematic bile duct imaging. Due to the small sample\nsizes these comparison results should be interpreted with caution,\nand the controls were included to present the study results within\nthe context of the unit’s contemporary outcomes. The details are\nshown in Table 3.\nDiscussion\nUtilisation of livers from organ donors is currently a major\nchallenge in liver transplantation19. Despite a waiting list mor￾tality in Western countries reaching 20–30%, an increasing pro￾portion of extended criteria livers are unused due to concerns of\nprimary non-function and early graft dysfunction20,21. The\ndecision to discard donor livers is still largely based upon donor\nhistory and subjective assessment by the transplanting surgeon.\nStandard cold static preservation does not allow for any assess￾ment of liver function, and the only other source of information is\nliver histology, which is able to diagnose severe large droplet fatty\nchange, a well-recognised risk factor for non-function21. This\nstudy has demonstrated that moving from subjective evaluation\nto objective testing during NMP might salvage a high proportion\nof those livers that are currently discarded. The need to improve\nthe method by which high-risk livers are assessed was illustrated\nin this study by the absence of significant differences in the donor\ncharacteristics between transplanted and discarded livers.\nThe present trial is the first to systematically investigate\nobjective viability criteria in livers that met specific high-risk\nfeatures in organs initially considered “untransplantable”11,22.\nOne major challenge addressed in the VITTAL trial design was\nthat each discarded liver had to also fulfil one or more pre￾defined objective high-risk criteria, as the considerations for liver\ntransplantability are always multi-factorial, including the reci￾pientʼs condition, logistical aspects and the surgeon’s (or trans￾plant centre’s) experience and risk-taking attitude. The utilisation\nof marginal livers in the United Kingdom was facilitated by the\ncentre-based liver allocation system, allowing the use of high-risk\norgans in any patient on the waiting list. All enroled organs were\nsimultaneously fast-track offered to all UK transplant centres\nfollowing the initial decline, and the fact that none of the seven\ncentres were comfortable using any of the livers included in this\ntrial confirms that these organs were uniformly perceived to be of\nvery poor quality. Our team genuinely aimed to push the\nboundaries of utilisation of the highest risk organs by accessing\nParticipant\nenrollment\nAllocation\nFollow up\nAnalysis\nPatients on waiting list approached and\nassessed for eligibility (n = 164)\nExcluded (n = 111)\nMet exclusion criteria; not suitable for\nmarginal graft (n = 48)\nDeclined to take part (n = 22)\nTransplanted with standard livers prior\nto giving study consent (n = 41)\nConsented (n = 53)\nNo randomisation\nTransplanted with standard livers prior to being\noffered a rescued liver (n = 29)\nPatient remained on waiting list (n = 2)\nTransplanted with VITTAL rescued livers (n = 22)\nPassed stage 1 (3 successes/3 patients) and stage 2\n(11 successes/11 patients) interim assessments\nDiscontinued study following liver\nre-transplantation at day 225 (n = 1)\nTransplanted patients analysed for primary\noutcome (90-day survival) and short-term\nsecondary outcomes (n = 22)\nFig. 2 CONSORT flow diagram displaying the progress of patients through the trial. One hundred and sixty-four patients on the waiting list were\napproached for potential trial participation. Of those, 111 were excluded; 48 patients met exclusion criteria and were not suitable for a marginal liver graft.\nTwenty-two patients declined to take part and 41 patients either received a transplant before they provided study consent, or were de-listed, or\nsubsequently met exclusion criteria. Eventually 53 patients consented to the study, of which 29 underwent transplantation with a standard quality liver\nallocated outside the trial. Twenty-two patients were enroled in the trial and received a salvaged liver.\nARTICLE NATURE COMMUNICATIONS | https://doi.org/10.1038/s41467-020-16251-3\n4 NATURE COMMUNICATIONS | (2020) 11:2939 | https://doi.org/10.1038/s41467-020-16251-3 | www.nature.com/naturecommunications\n\nthe benefit of rigorous peer-review and continual oversight within\nthe framework of a clinical trial. We included only organs that\nour team did not feel comfortable to use otherwise, and this\nattitude was reflected by the 2-tier liver inclusion process\nembedded in the trial design, and by the fact that 25 livers, that\nwould very likely meet the transplantability criteria, were not\nconsidered for study inclusion. Some of the study livers might\nhave been transplantable if the cold ischaemia was very short and\na suitable recipient was waiting, but currently the majority of\nthese organs are discarded. With the introduction of the National\nAllocation system, logistical constraints exacerbated by static cold\nstorage are increasingly common and prevent the utilisation of a\nrising proportion of marginal livers. In these circumstances, NMP\nmitigates the reperfusion process, allowing assessment of the\norgan during perfusion without exposing patients to the risk of\nprimary non-function. In addition, livers discarded due to hae￾modynamic instability (during procurement or during the pro￾cess of brain stem death itself), high liver transaminases or poor\nin situ flush, benefited from perfusion in a controlled, near\nphysiological environment thereby facilitating their recovery. The\npotential to recondition the liver in the interval between retrieval\nand implantation has hitherto not been possible.\nAn intervention which increases successful utilisation of high￾risk livers will transform access to transplantation to meet pre￾dicted increasing demand, particularly given trends in donor\ndemographics and declining organ quality4. Whilst organ\nTable 1 Donor and liver characteristics (median, interquartile range).\nDonor characteristics Non-transplanted (n = 9) Transplanted (n = 22) Overall (n = 31) p Valuea\nAge in years (range) 57 (52–60) 56 (45–65) 57 (45–63) 0.948\nSex—n (%) 0.696\nFemale 3 (33.3) 10 (45.5) 13 (41.9)\nMale 6 (66.7) 12 (54.5) 18 (58.1)\nHeight (cm) 174 (172–186) 170 (165–175) 170 (166–175) 0.038\nBodyweight (kg) 79 (75–88) 81 (70–90) 80 (70–90) 0.662\nBody mass index (kg/m2) 28.7 (24.8–29.1) 29.3 (26.5–32.4) 28.7 (24.8–32.1) 0.372\nLiver weight (kg) 2.0 (1.8–2.4) 1.7 (1.3–1.9) 1.8 (1.4–2.0) 0.015\nPeak alanine transferase (IU/ml) 323 (92–1143) 48 (33–159) 83 (36–287) 0.034\nPeak gamma-glutyl transferase (IU/ml) 169 (107–335) 80 (42–111) 92 (57–203) 0.012\nPeak bilirubin (µmol/L) 10 (10–18) 11 (7–22) 11 (8–22) 0.768\nHistory of excessive alcohol use—n (%) 5 (55.6) 5 (22.7) 10 (32.3) 0.105\nDiabetes mellitus—n (%) 0 (0.0) 2 (9.1) 2 (6.5) 1.000\nDonor type—n (%) 1.000\nDonor after brain death 5 (55.6) 12 (54.5) 17 (54.8)\nDonor after circulatory death 4 (44.4) 10 (45.5) 14 (45.2)\nDonor warm ischaemic time (min)b 20.0 (15.5–22.5)b n = 4 22.5 (19.0–35.0)b n = 10 21.0 (19.0–25.0)b n = 14 0.394\nQuality of in situ flush—n (%) 0.016\nPoor 3 (33.3) 4 (18.2) 7 (22.6)\nFair 4 (44.4) 1 (4.5) 5 (16.1)\nGood 2 (22.2) 17 (77.3) 19 (61.3)\nCold ischaemic time (min) 550 (436–715) 452 (389–600) 464 (389–625) 0.277\nDonor risk indexc 2.3 (2.0–2.7) 2.1 (1.9–3.0) 2.2 (1.9–2.9) 0.728\nHistological steatosis assessment—n (%)d 0.113\n<30% steatosis 2 (22.2) 13 (59.1) 15 (48.4)\n>30% steatosis 7 (77.8) 9 (40.9) 16 (51.6)\nInclusion criteriae\nDonor risk index >2.0 6 (66.7) 16 (72.7) 22 (71.0) 1.000\nSteatosis principal reason to discardf 1 (11.1) 2 (9.1) 3 (9.7) 1.000\nHigh liver transaminases 3 (33.3) 2 (9.1) 5 (16.1) 0.131\nBalanced risk score >9 Not applicable 2 (9.1) Not applicable Not applicable\nExtensive cold ischaemic time 2 (22.2) 3 (13.6) 5 (16.1) 0.613\nExtensive donor warm ischaemic time 0 (0.0) 3 (13.6) 3 (9.7) 0.537\nPoor in situ flush 3 (33.3) 4 (18.2) 7 (22.6) 0.384\nPerfusion criteria\nLactate clearance <2.5 mmol/L 3 (33.3) 22 (100.0) 25 (80.6) <0.0001\npH ≥ 7.30 3 (33.3) 19 (86.4) 22 (71.0) 0.007\nPresence of bile production—n (%) 6 (66.7) 18 (81.8) 24 (77.4) 0.384\nBile volume (mL) 10 (2–18) 60 (15–99) 46 (2–90) 0.100\nGlucose metabolism 4 (44.4) 20 (90.9) 24 (77.4) 0.012\nVascular flows criteria met 9 (100) 22 (100) 31 (100) Not applicable\nHomogenous liver perfusion 7 (77.8) 22 (100.0) 29 (93.5) 0.077\nNote: Body mass index is the weight in kilograms divided by the square of the height in metres. aGroups compared by Kruskal–Wallis test to assess differences in continuous variables and Fisher’s exact test for categorical variables. Due to the small sample sizes and that the statistical comparison\ntests were not powered, these results should be interpreted with caution.\nbDonor warm ischaemic time is defined as the period from the systolic blood pressure decrease below 50 mmHg to commencing the aortic cold flush; this variable applicable only for donors after\ncirculatory death.\ncDonor risk index as described by Feng et al.20. dThe steatosis includes large and medium droplets steatosis assessment obtained from post-transplant paraffin sections (this result was not known at the time of the liver inclusion). eEach trial liver had to meet one or more of the following inclusion criteria: donor risk index greater than 2.0; biopsy proven liver steatosis greater than 30%; donor transaminases (aspartate transaminase\nor alanine transaminase) greater than 1000 IU/mL; warm ischaemic time greater than 30 min in donors after circulatory death; extensive cold ischaemic time (defined as the period between the aortic\ncold flush to the liver implantation, or commencing the normothermic perfusion) greater than 12 and 8 h for donors after brainstem death and circulatory death, respectively; suboptimal liver flush\ndocumented by photograph and a transplant surgeon assessment; balanced risk score greater than 9.\nf\nThis steatosis variable refers to the study inclusion criteria and the results were known before the transplant based on frozen sections histology assessment.\nNATURE COMMUNICATIONS | https://doi.org/10.1038/s41467-020-16251-3 ARTICLE\nNATURE COMMUNICATIONS | (2020) 11:2939 | https://doi.org/10.1038/s41467-020-16251-3 | www.nature.com/naturecommunications 5\n\ndonation in the UK has increased from 676 to 1149 donors per\nannum between 2008 and 2018, the proportion of retrieved livers\nthat were discarded has nearly doubled (from 8 to 15%; data from\nthe UK Organ Donation and Transplantation Registry, www.odt.\nnhs.uk), indicating reluctance of surgeons to accept these organs\nfor their increasingly sicker recipients. In 2017–2018, not only\nwere 174 retrieved livers discarded, but 425 livers from solid\norgan donors were not even considered suitable for retrieval (11%\nof DBD and 52% of DCD); it is reasonable to assume that many\nof these would be suitable for testing with NMP. Salvaging a\nproportion of these retrieved but discarded organs would add a\ngood number of transplantable livers annually in the UK, sig￾nificantly reducing waiting list mortality.\nInternational comparisons demonstrate regional variations in\ndonor demographics and there is evidence that in countries with\nhigher initial organ acceptance rates there is also a higher discard\nrate, particularly for older donors23,24. Viability testing provides\nobjective evidence of liver function with clearance of metabolic\nacidosis, vascular flows, glucose parameters and bile production;\nthese give the transplant surgeon the confidence to use these\norgans safely, and minimises the physical and emotional impact\nof non-transplantation for patients.\n1 2 3 4 5\n6 7 8 9 10\n11 12 13 14 15\n16 17 18 19 20\n21 22 23 24 25\n26 27 28 29 30\n31\nFig. 3 The study liver photographs. The figure shows all 31 livers included in the trial. The red frames designate non-transplanted organs and the yellow\ndot livers donated after circulatory death.\nARTICLE NATURE COMMUNICATIONS | https://doi.org/10.1038/s41467-020-16251-3\n6 NATURE COMMUNICATIONS | (2020) 11:2939 | https://doi.org/10.1038/s41467-020-16251-3 | www.nature.com/naturecommunications\n\nIn the presented study the NMP was commenced following a\nmedian cold storage time reaching 8 h. Whilst this approach may\nsimplify adoption of the NMP technology without compromising\noutcomes in transplantable livers25, recovery of organs from\ndonors with multiple high-risk features might be further facili￾tated by limiting cold ischaemia through commencing the per￾fusion immediately after procurement in the donor hospital14.\nInevitably there will always be livers that are not suitable for\ntransplantation, demonstrated by 30% of offers with macroscopic\ncirrhosis, biopsy-proven fibrosis or an incidental finding of donor\ncancer. A similar proportion of the livers, however, did not meet\nany of our high-risk criteria and were therefore considered “too\ngood” for inclusion. It is reasonable to assume that NMP\nassessment would have provided the reassurance needed to justify\ntransplantation in this group as well.\nImprovements in transplant logistics is one of the major\nadvantages of NMP14,25,26, and the study allowed for the machine\nperfusion duration to be between 4 h (time needed for the via￾bility assessment) and 24 h (maximum recommended time by the\nperfusion device manufacturer). Once the liver met the viability\ncriteria we aspired to commence the transplantation as soon as\npossible; however, the perfusion was often extended to allow for a\nday-time procedure, or to facilitate transplant logistics in the unit.\nFrom our experience, 4–6 h perfusion seems to be sufficient for\nadequate assessment and replenishment of the organ’s energy\nresources. Due to recirculation of metabolites accumulated in the\norgans during cold ischaemia, the high-risk organs probably do\nnot benefit from prolonged perfusion. The impact of NMP\nduration on livers initially exposed to prolonged cold ischaemia is\nan area of our ongoing research interest.\nTransplant surgeons in many countries are expanding the\ndonor pool with the use of organs donated after circulatory\ndeath27. In the context of liver transplantation, the longevity of\nthese organs might be compromised by development of non￾anastomotic biliary strictures8. The incidence of clinically man￾ifest non-anastomotic biliary strictures in the DCD grafts cohort\nwas 30% (3 out of 10 grafts), higher than the study matched\ncontrols group, but similar to other reported high-risk DCD\nseries28. In concordance with the European prospective nor￾mothermic preservation trial, our results suggested that MRCP\nfindings are likely to over-estimate the incidence of biliary com￾plications14. The per-protocol investigation at the 6-month time\npoint would identify over 80% of the clinically relevant biliary\nstrictures and asymptomatic irregularities with varying clinical\nsignificance28. The presented findings are accurate, as the images\nwere correlated with clinical reviews and liver function tests\nthrough the median follow up of 542 (range: 390–784) days.\nNevertheless, it is clear that end-ischaemic NMP does not prevent\nthe development of non-anastomotic biliary strictures in high￾risk DCD organs, and our outcomes suggest that extending the\ndonor warm times beyond the currently widely accepted limit of\n30 min is not advisable. This finding was not anticipated at the\ntime of trial design or during the conduct of the trial and only\nbecame evident during the long-term follow up of these grafts\nbeyond the primary end point of 90 days. Further work is needed\nto identify new limits (e.g. donor characteristics, warm ischaemia\ntime and cold ischaemia time) and to define perfusion biomarkers\nthat predict this complication and avoid futile transplantation.\nRecently published research suggests that the composition of bile\nproduced during perfusion (pH, bicarbonate and glucose\n0\n5\n10\n15\n20\n0\n5\n10\n15\n20\n0\n5\n10\n15\n20\n0\n5\n10\n15\n20\n0\n5\n10\nArterial lactate measurement (mmol/L)\n15\nPerfusion time (minutes)\n20\n0\n5\n10\n15\n20\n0 500 1000 1500\n0 500 1000 1500\n0 500 1000 1500 0 500 1000 1500 0 500 1000 1500 0 500 1000 1500\n123456\n7 8 9 10 11 12\n13 14 15 16 17 18\n19 20 21 22 23 24\n25 26 27 28 29 30\n31\nFig. 4 The study liver lactate clearance. Plots of individual liver arterial lactate clearance measured during the NMP perfusion, showing transplantation\neligibility thresholds with red lines for lactate levels less than or equal to 2.5 mmol/L. Graphs with grey shading designate livers that were not transplanted.\nLiver number 22 was from a donor that was unexpectedly diagnosed with a cancer following organ donation.\nNATURE COMMUNICATIONS | https://doi.org/10.1038/s41467-020-16251-3 ARTICLE\nNATURE COMMUNICATIONS | (2020) 11:2939 | https://doi.org/10.1038/s41467-020-16251-3 | www.nature.com/naturecommunications 7\n\nTable 3 Post-transplant outcomes.\nStudy patients (n = 22) Control patients (n = 44) Overall (n = 66) OR (95% CI), p Value\nPost-transplant outcomes\nPrimary graft non-function—n (%) 0 (0.0) 1 (2.3) 1 (1.5) 1.000a,b\nEarly allograft dysfunction—n (%) 7 (31.8) 4 (9.1) 11 (16.7) 5.62 (1.14–27.79), 0.034e\nRenal replacement therapy—n (%) 4 (18.2) 11 (25.0) 15 (22.7) 0.68 (0.19–2.38), 0.542e\nIntensive care unit stay (days) 3.5 (3–4) 2.0 (1–5) 3·0 (2.5) 1.02 (0.95–1.10), 0.566e\nIn-hospital stay (days) 10 (8–17) 9 (8–11) 10 (8–13) 1.00 (0.96–1.05), 0.822e\nClavien–Dindo complication grade ≥3—n (%) 7 (31.8) 17 (38.6) 24 (36.4) 0.089a,b\n90-day graft survival—n (%) 22 (100) 41 (93.2) 63 (95.5) 0.545a,b\n90-day patient survival—n (%) 22 (100) 44 (100) 66 (100) Not applicable\n1-year graft survival—n (%)d 19 (86.4) 38 (86.4) 57 (86.4) 1.000 (0.18–5.46), 1.000e\n1-year patient survival—n (%)d 22 (100) 42 (95.5) 64 (97.0) 0.55a,b\nBiliary complication—n (%)c\nAnastomotic biliary strictured 2 (9.1) 3 (6.8) 5 (7.6) 1.44 (0.19–11.12), 0.725c,e\nNon-anastomotic biliary strictured 4 (18.2) 1 (2.3) 5 (7.6) 8.00 (0.89–71.58); 0.063d,e\nDBD livers (n = 12) DCD liver (n = 10) Overall (n = 22) p Valueb\nStudy patient biliary strictures\nAnastomotic within 6 monthsd—n (%) 1 (8.3) 0 (0.0) 1 (4.5) 1.000a\nAnastomotic within 12 monthsf\n—n (%) 1 (8.3) 1 (10.0) 2 (9.1) 1.000a\nNon-anastomotic within 6 monthsd—n (%) 1 (8.3)g 2 (20.0) 3 (13.6) 0.571a\nNon-anastomotic within 12 monthsf\n—n (%) 1 (8.3)f 3 (30.0) 4 (18.2) 0.293a\nn number, OR odds ratio, CI confidence interval, DBD donation after brainstem death, DCD donation after circulatory death.\nNote: The result needs to be interpreted with caution as the control patients did not receive systematic bile duct imaging; in this group one patient developed non-anastomotic biliary strictures, one died\n16 months after the transplantation from biliary sepsis and one is alive with a complex hilar stricture not amenable to any therapeutic intervention.\nap Value obtained from Fisher’s exact test. bDue to the small sample sizes and that the statistical comparison tests were not powered, these results should be interpreted with caution.\ncThe figures represent strictures manifested with cholestasis and elevated liver enzymes. dData were assessed at scheduled study visits up to and including the 12-month follow-up visit.\nep-Values obtained from conditional logistic regression. f\nStricture developed in patient suffering from hepatic artery occlusion requiring revascularisation within 24 h following the transplant.\nTable 2 Transplant recipient and graft characteristics (median, interquartile range).\nRecipient characteristics Trial patients (n = 22)\nAge in years 56 (46–65)\nSex—n (%)\nFemale 8 (36.4)\nMale 14 (63.6)\nBody mass index 28.5 (24.0–31.0)\nUK end-stage liver disease score 52 (49–55)\nModel for end-stage liver disease scorea 12 (9–16)\nTransplant indication—n (%)\nAlcohol-related liver disease 8 (36.4)\nNon-alcohol steatohepatitis 4 (18.2)\nHepatitis C virus 2 (9.1)\nPrimary biliary cirrhosis 2 (9.1)\nPrimary sclerosing cholangitis 6 (27.3)\nHepatocellular carcinomab 3 (13.6)\nNeed for intra-operative CVVH – n (%) 1 (4.5)\nGraft and transplant details Overall (n = 22) DBD (n = 12) DCD (n = 10) p Valuec\nCold ischaemic time (min) 452 (316–600) 507 (408–718) 416 (354–464) 0.075\nImplantation time (min) 28 (22–35) 30 (26–38) 26 (22–35) 0.390\nMachine perfusion time (min) 587 (450–705) 629 (509–700) 549 (424–780) 0.598\nTotal preservation time (min) 1073 (977–1308) 1170 (1038–1367) 1000 (874–1097) 0.075\nPost-reperfusion syndrome 10 (45.5) 2 (16.7) 8 (80.0) 0.008\nn number, CVVH continuous veno-venous haemofiltration, DBD donor after brainstem death, DCD donor after circulatory death.\nNote: Body mass index is the weight in kilograms divided by the square of the height in metres. Donor warm ischaemic time is defined as the period from the systolic blood pressure decrease below\n50 mmHg to commencing the aortic cold flush. Cold ischaemic time is defined as the time between the start of the cold flush during retrieval until the start of machine perfusion. Early allograft\ndysfunction consists of the presence of one or more of the following variables: (1) bilirubin ≥10 mg/dL on postoperative day 7; (2) INR ≥1.6 on postoperative day 7; (3) aminotransferase level (alanine\naminotransferase or aspartate aminotransferase) >2000 IU/mL within the first 7 postoperative days33. aThe liver grafts are allocated in the UK based on the UK end-stage liver disease score; the laboratory values of the model for end-stage liver disease score are included for the comparative information\nonly.\nbThe presence of hepatocellular cancer is recorded as a complication of the underlying liver disease mentioned above, and does not impact on the liver allocation algorithm. cGroups compared by Kruskal–Wallis test to assess differences in continuous variables and Fisher’s exact test for categorical variables. Due to the small sample sizes and that the statistical comparison\ntests were not powered, these results should be interpreted with caution.\nARTICLE NATURE COMMUNICATIONS | https://doi.org/10.1038/s41467-020-16251-3\n8 NATURE COMMUNICATIONS | (2020) 11:2939 | https://doi.org/10.1038/s41467-020-16251-3 | www.nature.com/naturecommunications\n\nconcentration) is predictive of ischaemic cholangiopathy17. Sub￾analysis of bile samples and determination of biliary endothelial\nhealth is the subject of ongoing research. Evolving novel perfu￾sion strategies might enable the use of DCD grafts exposed to\nprolonged warm ischaemia14,29,30.\nThe other limitations of our study include the sensitivity of the\ncut-off lactate value, the non-randomised trial design and exclu￾sion of high-risk transplant recipients. Regarding the former,\nfollowing previous experience, we set the lactate viability threshold\nto less than 2.5 mmol/L within 2 h of NMP15,16 To maximise\nutilisation, this trial extended the assessment period to 4 h. Two\nlivers in the trial were discarded following a rise of the perfusate\nlactate after meeting the 2-h target. The significance of this is\nuncertain, although it is notable that a third liver with a similar\npattern of lactate clearance was transplanted and experienced a\nsubstantial period of early allograft dysfunction with a post￾transplant peak ALT of 2074 IU and AST of 3031 IU. Concerning\nthe design, the trial was conducted as a non-randomised study, as\ntransplanting discarded livers with an expected high incidence of\nprimary non-function as controls would be ethically unacceptable.\nWe expect further advances to be achieved through the identifi￾cation of specific biomarkers that correlate with long-term graft\noutcomes, in the context of large NMP series or registries. Lastly,\nas we did not want to compound risks, the study did not include\nhigher risk recipients deemed not suitable to receive marginal\norgans at the unit’s multi-disciplinary liver transplant listing\nmeeting. The majority of participants who decided to participate\ndid so after a long period waiting on the list, with progressive\ndeterioration that was not necessarily reflected by their waiting list\nposition. The feasibility of using livers rescued by NMP for the\nhigh-risk recipient is currently under investigation.\nIn conclusion, this trial demonstrated that NMP provides a\nway of objectively assessing high-risk organs, and allowed\ntransplantation in a significant proportion of currently unutilised\nlivers without any incidence of primary non-function. The use of\nperfusion technology was associated with increased graft utilisa￾tion, considerably extended preservation time and greatly\nimproved transplant logistics. Adoption of functional assessment\nof high-risk livers can increase access to life saving transplanta￾tion and reduce waiting list mortality.\nMethods\nStudy design. This study was a prospective, open label, phase 2 adaptive single￾arm trial comprising high-risk livers meeting two-tier inclusion criteria. The first￾tier was being considered as unsuitable for transplant by all UK transplant centres\nwithin a nationwide fast-track offering scheme. The trial was performed at a single￾institution (Queen Elizabeth Hospital, Birmingham, UK) with experience in NMP\nand utilisation of high-risk grafts5,31. The second-tier eligibility required at least\none of seven specific criteria that confirmed the high-risk status of every enroled\nliver (Table 4). To minimise risks of high post-transplant complications or mor￾tality for the study participants, the trial used an adaptive design with two interim\nsafety analyses (Supplementary Fig. 1). The study design and conduct complied\nwith all relevant regulations regarding the use of human study participants. The\ntrial was funded by the Wellcome Trust, and granted approval by the National\nResearch Ethics Service in London-Dulwich (REC reference 16/LO/1056, Protocol\nnumber RG 15–240) and the Medicines and Healthcare Products Regulatory\nAgency and the University Hospitals Birmingham Research and Development\nDepartment. The project was endorsed by the Research, Innovation and Novel\nTechnologies Advisory Group committee of the National Health Service Blood and\nTransplant. The study was registered at ClinicalTrials.gov (reference number\nNCT02740608), the protocol has been published32, and the full version is provided\nin the Supplementary Information.\nDiscarded liver inclusion criteria and the study logistics. The study considered\nall potential donors with a diagnosis of brainstem death or Maastricht category III\nand IV donors after circulatory death, aged up to 85 years, initially retrieved with\nthe intent for transplantation but subsequently declined by all UK transplant\ncentres based on the retrieving or transplant surgeon’s assessment. If our centre\nwas the last in the fast-track offering sequence, the liver had to be deemed\nuntransplantable by two consultant surgeons independently. The surgeons were\npaired together to create an overall low threshold for using marginal livers,\nensuring any liver that could be used without viability testing was transplanted,\nthereby minimising bias. For the liver to be eligible it also had to meet at least one\ndefined high-risk criterion (see Tables 1 and 4). Consent for research was provided\nby the donor’s next of kin.\nStudy participants. Eligible participants were those listed electively for primary\nliver transplantation and deemed to be low-to-moderate transplant risk candidates,\nsuitable to receive a high-risk graft, as assessed by the unit’s transplant waiting list\nmulti-disciplinary team. Candidates were required to have a patent portal vein, no\nsignificant comorbidities (cardiovascular diseases, including active angina, a history\nof ischaemic heart disease, congestive heart failure, cerebrovascular events, symp￾tomatic valvular heart disease or cardiac arrhythmias; pulmonary conditions\nincluding pulmonary hypertension or established diagnosis of pulmonary dys￾function), a UK end-stage liver disease18 (UKELD) score ≤62 and no history of\nmajor upper abdominal surgery. Each participant was fully informed of being\noffered a marginal graft and gave written consent for the trial in advance of the\norgan offer, after having at least 24 h to consider their participation.\nThe study intervention and liver viability assessment. All livers were cold￾preserved with University of Wisconsin solution and commenced NMP using the\nOrganOx Metra™ device after arrival at the transplant centre. The protocol stipu￾lated an NMP duration of between 4 and 24 h. Serial perfusate, bile and tissue\nsamples were taken at regular time intervals. For a liver to be considered viable it\nhad to metabolise perfusate lactate to levels ≤2.5 mmol/L within 4 h of commen￾cing the perfusion, in addition to meeting at least 2 of the following additional\ncriteria: evidence of bile production, maintenance of perfusate pH ≥ 7.30, meta￾bolism of glucose, maintenance of stable arterial and portal flows (≥150 and\n≥500 mL/min, respectively), and homogenous perfusion with soft consistency of\nthe parenchyma16.\nIf a liver was considered viable, the transplant was set up and performed. At the\npoint of recipient hepatectomy, the NMP team disconnected the organ from the\ndevice, flushed it with 3 l of histidine–tryptophan–ketoglutarate solution at 4 °C\nand handed it over for immediate implantation. Post-transplant management\nfollowed the unit’s standard protocol, with immunosuppression comprising\ntacrolimus, azathioprine or mycophenolate mofetil and low-dose steroids. Each\npatient underwent an MRCP at 6 months unless the investigation was clinically\nindicated earlier.\nLiver quality was determined retrospectively through histological analysis of\nparenchymal biopsies which were assessed for pre-existing liver disease, steatosis,\nglycogen content and features of preservation–reperfusion injury.\n1.00\nKaplan–Meier 1 year graft survival estimates\n0.75\n0.50\n0.25\n0.00\n0\nNumber at risk\nCase–Control = Control 37\nCase–Control = Case\n3\n34 30 27 23\n22 21 20 20\n6\nTime post-transplant (Months)\n9 12\nGraft survival probability\n22\nControls Case\nFig. 5 Comparison of 1-year graft survival estimate. Conditional logistic\nregression was carried out on the matched case–control data to determine\nthe relative risk for graft survival at 1 year between matched case–control\ngroups. The median (range) days follow-up data were included in the\nsurvival analyses, but the plot was truncated at 12 months. The ticks on the\ntop of each Kaplan–Meier curve relate to the numbers of patients being\ncensored at that particular time point. There are 2 cases of graft failure in\nthe perfusion group at days 119 and 209; the control group contains 5 graft\nfailures (2 at day 5, 1 at day 14, 1 at day 165 and 1 at day 182). The graft\nsurvival was similar in both groups. Findings showed that the odds ratio\n(relative risk) estimate for graft survival at 6 months was determined as 2.0\n(95% CI: 0.2–17.9; p = 0.535). Due to the small sample sizes and that this\nstatistical comparison test was not powered,these results should be\ninterpreted with caution.\nNATURE COMMUNICATIONS | https://doi.org/10.1038/s41467-020-16251-3 ARTICLE\nNATURE COMMUNICATIONS | (2020) 11:2939 | https://doi.org/10.1038/s41467-020-16251-3 | www.nature.com/naturecommunications 9\n\nOutcome measures. The co-primary outcomes consisted of (A) feasibility of NMP\nin discarded organ recovery and (B) achievement of successful transplantation. The\nperfused organ recovery rate was the proportion of perfusions leading to trans￾plantation. Successful transplantation was defined as 90-day patient survival—a\nnationally accepted, monitored and continuously audited outcome measure.\nThe key secondary outcome measures included assessment of the liver graft\nfunction (by incidence of primary non-function and early allograft dysfunction33)\nliver function test results, 90-day graft survival, intensive therapy unit and post￾transplant in-hospital stays, incidence of vascular complications, and anastomotic\nand non-anastomotic biliary strictures as assessed by MRCP at 6 months.\nPerioperative data collection included haemodynamic stability, incidence of post￾reperfusion syndrome and blood-product requirements. Post-transplant adverse\nevents and complication severity were graded according to the Clavien–Dindo\nclassification34. The secondary outcomes were compared with contemporary\ncontrols (1:2), matched in order of priority for the donor graft type, UKELD Score,\ndonor age and donor sex only. Four variables included in the original protocol\n(model of end-stage liver disease [MELD], recipient age, BMI and the liver disease\naetiology) were removed as matching criteria due to confounding correlation and\nbeing overly stringent. No recipient suffered from recurrent disease during the\nstudy follow-up period. The matching criteria used identified 39 patients. There\nwas consistency in the recipient selection for high-risk grafts guided by the unit’s\nprotocols and transplant waiting list multi-disciplinary team meetings that assured\nsimilar characteristics regarding the cardiovascular comorbidities and surgical risks\nin the study participants and the matched controls. The pre-planned comparisons\nwith the matched controls group were not powered to demonstrate any differences.\nDue to the small sample sizes, these results should be interpreted with caution; the\ncontrols were included to present the study results within the context of the unit’s\ncontemporary outcomes.\nStatistical analysis. The trial was powered with an emphasis on (A) the feasibility\nof the intervention using NMP and (B) recipient safety. In terms of the intervention\nfeasibility (A), the aim was to achieve an organ recovery rate of at least 50%, with a\nrate of 30% or less being considered unacceptable. Using a two-stage design35, with\nan interim assessment after 24 livers (continuing if ≥8 livers were recovered), a\nsample size of up to 53 livers undergoing NMP might be required, with target alpha\n(one-sided) of 0.05 (actual alpha = 0.047) and target beta of 0.1 (actual\nbeta = 0.098). NMP was considered feasible for organ recovery if at least 22 livers\nwere recovered from 53 perfused. Though the two statistical inferences are asses￾sing different hypotheses (safety and feasibility), they are linked as 22 transplants\nare required for the safety testing of the procedure, which is also the minimum\nnumber required out of 53 perfused livers to be considered feasible.\nFor (B), the mean 90-day patient survival rate for patients receiving liver\ntransplants in the United Kingdom was 93%36. For the discarded livers, the\ndesirable and undesirable 90-day overall survival rates were set at 88% and 73%\n(15% lower), respectively. Using an optimal three-stage adaptive design37 with two\ninterim assessments after 3 patients (requires ≥ 2 successes) and 11 patients\n(≥8 successes), a sample size of 22 patients was required, with alpha (type I error)\nand beta (type II error) of 0.2. As this was an early phase (non-definitive) trial to\nassess the safety of this procedure, a relaxed one-sided alpha was used to attain an\nachievable sample size within the trial duration and cost constraint. The approach\nwas considered successful if there were at least 18 successes out of 22 transplants.\nThe descriptive statistics data were presented as number and percentages, and\nmedian and interquartile range. Due to small numbers, the pre-planned analyses\nused Kruskal–Wallis test to assess differences in continuous variables between two\ngroups and Fisher’s exact test for categorical variables. Kaplan–Meier survival\nmethod was used to analyse time-to-event data and conditional logistic regression\nfor matched case–control analysis. All secondary and exploratory analyses were\nTable 4 Study inclusion and criteria.\nGraft inclusion criteria 1. Liver from a donor primary accepted with the intention for a clinical transplantation\n2. Liver graft was rejected by all the other UK transplant centres via normal or fast-track sequence (see Appendix 3 for list of UK\ncentres)\n3. One of the following parameters capturing the objectivity of the liver high-risk status:\n• Donor risk index >2.020\n• Balanced risk score >938\n• Graft macrosteatosis >30%\n• Donor warm ischaemic time (defined as the period between the systolic blood pressure <50 mmHg to the time of commencing\ndonor aortic perfusion) in DCD donors >30 min\n• Peak donor aspartate and alanine transaminases >1000 IU/mL (AST/ALT)\n• Anticipated cold ischaemic time >12 h for DBD or 8 h for DCD livers\n• Suboptimal liver graft perfusion as assessed by a consultant transplant surgeon and documented by graph photography.\nGraft exclusion criteria 1. Grafts from patients with active Hepatitis B, C or human immunodeficiency virus infection\n2. Livers with cirrhotic macroscopic appearance\n3. Livers with advanced fibrosis\n4. DCD grafts with donor warm ischaemic time (systolic blood pressure < 50 mmHg to aortic perfusion) more than 60 min\n5. Excessive cold ischaemic times (DBD > 16 h/DCD > 10 h)\n6. Paediatric donor (<18 years old)\n7. Blood group ABO incompatibility\nRecipient inclusion\ncriteria\n1. Primary adult liver transplant recipient\n2. Patient listed electively for transplantation\n3. Low-to-moderate transplant risk candidate suitable for marginal graft, as assessed by the UHB\nLiver Unit liver transplant listing multi-disciplinary team meeting.\nRecipient exclusion\ncriteria\n1. High-risk transplant candidates not suitable for a marginal graft\n2. Patients with complete portal vein thrombosis diagnosed prior to the transplantation\n3. Liver re-transplantation\n4. Patients with fulminant hepatic failure\n5. Blood group ABO incompatibility\n6. Patient unable to consent\n7. Patients undergoing transplantation of more than one organ\n8. Contraindication to undergo magnetic resonance imaging\nCriteria for\ntransplantation\n1. Lactate ≤ 2.5 mmol/L\n2. AND two or more of the following within 4 h of starting perfusion\n• Evidence of bile production\n• pH ≥ 7.30\n• Metabolism of glucose\n• HA flow ≥ 150 mL/min and PV flow ≥ 500 mL/min\n• Homogenous perfusion\nDCD donation after circulatory death, DBD donation after brainstem death, ALT alanine aminotransferase, AST aspartate aminotransferase.\nNote: Donor risk index is calculated from age, race, cause of death, height and the predicted cold ischaemic time20; balanced risk score is calculated using model for end-stage liver disease score (MELD),\nwhether or not the recipient is having a re-transplant or is on intensive care, recipient age, donor age and cold ischaemic time11.\nARTICLE NATURE COMMUNICATIONS | https://doi.org/10.1038/s41467-020-16251-3\n10 NATURE COMMUNICATIONS | (2020) 11:2939 | https://doi.org/10.1038/s41467-020-16251-3 | www.nature.com/naturecommunications\n\ntwo-sided at 5% significance level, not powered and not adjusted for multiple\ntesting. STATA software package version 15.1 for Windows (StataCorp LLC, USA)\nwas used for all analyses. Results were rounded to a relevant precision, percentages\nin the text to full numbers and p-values to three decimals. The statistical analysis\nplan is provided in the Supplementary Information.\nReporting summary. Further information on research design is available in\nthe Nature Research Reporting Summary linked to this article.\nData availability\nThe source data underlying Tables 1–3 and Figs. 4 and 5 are provided in the Source Data\nFile and supplementary tables. Additional data will be provided upon request, according\nto a procedure described on the Cancer Research UK Clinical Trials Unit website https://\nwww.clinicalstudydatarequest.com.\nReceived: 30 July 2019; Accepted: 17 April 2020;\nReferences\n1. Williams, R. et al. Implementation of the Lancet standing commission on liver\ndisease in the UK. Lancet 386, 2098–2111 (2015).\n2. Organ Donation and Transplantation: Annual Report on Liver\nTransplantation. www.odt.nhs.uk (2016/2017).\n3. Kim, W. R. et al. OPTN/SRTR 2016 annual data report: liver. Am. J.\nTransplant. 18, 172–253 (2018).\n4. Tullius, S. G. & Rabb, H. Improving the supply and quality of deceased-donor\norgans for transplantation. N. Engl. J. Med. 378, 1920–1929 (2018).\n5. Mirza, D. F. et al. Policies in Europe on “marginal quality” donor livers. Lancet\n344, 1480–1483 (1994).\n6. Ravaioli, M. et al. Risk avoidance and liver transplantation: a single-center\nexperience in a national network. Ann. Surg. 264, 778–786 (2016).\n7. Ghinolfi, D. et al. Use of elderly donors in liver transplantation: a paired￾match analysis at a single center. Ann. Surg. 268, 325–331 (2018).\n8. Jay, C. L. et al. Ischemic cholangiopathy after controlled donation after cardiac\ndeath liver transplantation: a meta-analysis. Ann. Surg. 253, 259–264 (2011).\n9. Ploeg, R. J. et al. Risk factors for primary dysfunction after liver\ntransplantation—a multivariate analysis. Transplantation 55, 807–813 (1993).\n10. Annual report on liver transplantation 2018/19. NHS Blood and Transplant.\nwww.odt.nhs.uk.\n11. Dutkowski, P. et al. Are there better guidelines for allocation in liver\ntransplantation? A novel score targeting justice and utility in the model for\nend-stage liver disease era. Ann. Surg. 254, 745–753 (2011). discussion 753.\n12. Marcon, F. et al. Utilisation of declined liver grafts yields comparable\ntransplant outcomes and previous decline should not be a deterrent to graft\nuse. Transplantation 102, 211–218 (2018).\n13. Chouchani, E. T. et al. Ischaemic accumulation of succinate controls\nreperfusion injury through mitochondrial ROS. Nature 515, 431–435 (2014).\n14. Nasralla, D. et al. A randomized trial of normothermic preservation in liver\ntransplantation. Nature 557, 50–56 (2018).\n15. Mergental, H. et al. Development of clinical criteria for functional assessment\nto predict primary nonfunction of high-risk livers using normothermic\nmachine perfusion. Liver Transpl. 24, 1453–1469 (2018).\n16. Mergental, H. et al. Transplantation of declined liver allografts following\nnormothermic ex-situ evaluation. Am. J. Transpl. 16, 3235–3245 (2016).\n17. Watson, C. J. E. et al. Observations on the ex situ perfusion of livers for\ntransplantation. Am. J. Transplant.18, 2005–2020 (2018).\n18. Barber, K. et al. Elective liver transplant list mortality: development of a United\nKingdom end-stage liver disease score. Transplantation 92, 469–476 (2011).\n19. Taking Organ Utilisation to 2020: ODT Organ Utilisation Strategy. NHS\nBlood and Transplant. www.odt.nhs.uk.\n20. Feng, S. et al. Characteristics associated with liver graft failure: the concept of a\ndonor risk index. Am. J. Transplant. 6, 783–790 (2006).\n21. Linares, I., Hamar, M., Selzner, N. & Selzner, M. Steatosis in liver transplantation:\ncurrent limitations and future strategies. Transplantation 103, 78–90 (2019).\n22. Briceno, J., Ciria, R., de la Mata, M., Rufian, S. & Lopez-Cillero, P. Prediction\nof graft dysfunction based on extended criteria donors in the model for end￾stage liver disease score era. Transplantation 90, 530–539 (2010).\n23. de la Rosa, G., Fondevila, C. & Navasa, M. Liver transplantation in Spain.\nLiver Transplant. 22, 1259–1264 (2016).\n24. Schlegel, A. et al. Impact of donor age in donation after circulatory death liver\ntransplantation: Is the cutoff “60” still of relevance? Liver Transplant. 24,\n352–362 (2018).\n25. Ceresa, C. D. L., et al. Transient cold storage prior to normothermic liver\nperfusion may facilitate adoption of a novel technology. Liver Transplant. 25,\n1503–1513 (2019).\n26. Watson, C. J. et al. 26-Hour storage of a declined liver before successful\ntransplantation using ex vivo normothermic perfusion. Ann. Surg. 265, e1–e2\n(2017).\n27. Schlegel, A. et al. The UK DCD risk score: a new proposal to define futility in\ndonation-after-circulatory-death liver transplantation. J. Hepatol. 68, 456–464\n(2018).\n28. Foley, D. P. et al. Biliary complications after liver transplantation from\ndonation after cardiac death donors: an analysis of risk factors and long-term\noutcomes from a single center. Ann. Surg. 253, 817–825 (2011).\n29. Dutkowski, P. et al. HOPE for human liver grafts obtained from donors after\ncardiac death. J. Hepatol. 60, 765–772 (2014).\n30. Hessheimer, A. J. et al. Normothermic regional perfusion vs. super-rapid\nrecovery in controlled donation after circulatory death liver transplantation. J.\nHepatol. 70, 658–665 (2019).\n31. Marcon, F. et al. Utilization of declined liver grafts yields comparable\ntransplant outcomes and previous decline should not be a deterrent to graft\nuse. Transplantation 102, e211–e218 (2018).\n32. Laing, R. W. et al. Viability testing and transplantation of marginal livers\n(VITTAL) using normothermic machine perfusion: study protocol for an\nopen-label, non-randomised, prospective, single-arm trial. BMJ Open 7,\ne017733 (2017).\n33. Olthoff, K. M. et al. Validation of a current definition of early allograft\ndysfunction in liver transplant recipients and analysis of risk factors. Liver\nTransplant. 16, 943–949 (2010).\n34. Dindo, D., Demartines, N. & Clavien, P. A. Classification of surgical\ncomplications: a new proposal with evaluation in a cohort of 6336 patients\nand results of a survey. Ann. Surg. 240, 205–213 (2004).\n35. Simon, R. Optimal two-stage designs for phase II clinical trials. Controlled\nClin. Trials 10, 1–10 (1989).\n36. Interim Report on Liver Transplantation: Report for 2014/15. www.odt.\nnhs.uk.\n37. Chen, T. T. Optimal three-stage designs for phase II cancer clinical trials. Stat.\nMed. 16, 2701–2711 (1997).\n38. Dutkowski, P. et al. The use of fatty liver grafts in modern allocation systems:\nrisk assessment by the balance of risk (BAR) score. Ann. Surg. 256, 861–869\n(2012).\nAcknowledgements\nThe VITTAL trial represents independent academic research funded by the Wellcome\nTrust [200121/B/15/Z]. The grant was held by D.F.M., H.M., S.C.A., D.H.A., P.J.F., S.H.,\nJ.B. and C.Y. C.Y. was also funded by Cancer Research UK (C22436/A15958). We\ngratefully acknowledge the support provided by all the team members of the Liver Unit at\nQueen Elizabeth Hospital Birmingham. In particular we would like to thank the fol￾lowing people and groups: the livers anaesthetic team including John Isaac, Tom Faul￾kner, Davinia Bennett, Scott Russell, Gowri Subash and Adam Hill, the hepatology team\nincluding Philip Newsome, Ahmed Elsharkawy, Andrew Holt, Ye Oo, Neil Rajoriya,\nDennis Freshwater, Geoffrey Haydon, Gideon Hirschfield, Fiona Thompson, David\nMutimer, Tahir Shah, Shishir Shetty, Dhiraj Tripathi, Matthew Armstrong; the intensive\ncare physician team including Nick Murphy, Tony Whitehouse, Catherine Snelson,\nNilesh Parekh, Brian Pouchet and Nandan Gautam; the radiologists Simon Olliff, Brin\nMahon, Homoyon Mehrzad and Arvind Pallan. Trial nurses Jo Grayer, Kathryn Rodden,\nEmma Burke, Francesca Renzicchi and Verity Bratley for their contribution to the study\nconduct and the data collection. Sara Trevitt, Jennifer Keely, Bhushan Chhajed and the\nD3B team at the CRUK clinical trials unit at The University of Birmingham. Lorraine\nWallace for laboratory support, sample collection and processing. The liver transplant\nco-ordinators, clinical nurse specialists and allied health professionals at the Liver Unit\nfor help with the study logistics and patient education. Bridget Gunson, Sue Paris and\nGary Reynolds for their trial support and work at the NIHR Birmingham Biomedical\nResearch Centre. Leslie Russell, Craig Marshall, Toni Day, Andy Self and Constantin\nCoussios from OrganOx Ltd for the project partnership and support with the Wellcome\nTrust funding application. Serena Fasoli and Paul Adams for providing logistical support\nwith OrganOx Ltd materials. David Nasralla and Carlo Ceresa (University of Oxford) for\ntechnical support and perfusion advice. NHS Blood and Transplant and the Research,\nInnovation and Novel Technologies Group (RINTAG) which helped support the\nimplementation of the trial. James Neuberger, Jacques Pirenne, Andrew Hall and Gabriel\nOniscu for the trial conduct and safety oversight and membership on the data mon￾itoring committee. Amanda Smith for her help with manuscript preparation and proof\nreading. In particular we would like to thank also the British Transplant Society, the Liver\nAdvisory Group, the British Liver Trust, and the local public and patient involvement\ngroup who supported the trial from its conception, and the Wellcome Trust for funding\nand supporting this trial. Finally, we would like to thank the organ donors, their families\nand the 22 study participants, without which this trial could not have been completed\nsuccessfully.\nAuthor contributions\nH.M., R.W.L., C.Y., S.C.A. and D.F.M. contributed equally. H.M., S.C.A. and D.F.M.\nconceived the study; C.Y., D.F.M., H.M., A.K. and D.B. designed the trial; R.W.L., M.W.,\nNATURE COMMUNICATIONS | https://doi.org/10.1038/s41467-020-16251-3 ARTICLE\nNATURE COMMUNICATIONS | (2020) 11:2939 | https://doi.org/10.1038/s41467-020-16251-3 | www.nature.com/naturecommunications 11\n\nA.K., C.Y. and D.F.M. wrote the protocol with contributions from H.M., D.B. and P.J.F.;\nR.W.L., M.W., S.C. and D.B. were responsible for the trial regulatory documents’ pre￾paration and submission; A.K. and C.Y. devised the statistical analysis plan together with\nD.F.M. M.T.P.R.P.P., P.M., J.R.I., K.J.R., M.A., H.M., A.S., J.F., H.C., J.B., D.H.A., C.M.,\nR.W.L., Y.L.B., J.A. and D.F.M. were involved in the transplantations, machine perfusions\nand post-transplant patients’ management; R.W.L., Y.L.B. and J.A. were responsible for\nsamples and data collection. D.A.H.N. was responsible for histological assessment; A.K.\nperformed the statistical analyses with senior oversight from C.Y.; H.M. wrote the first\ndraft of the paper with input from R.W.L., A.K., C.Y. and D.F.M.; all authors contributed\nto the study conduct and reviewed the final paper version.\nCompeting interests\nP.J.F. is a co-founder, chief medical officer and consultant to OrganOx Ltd and also holds\nshares in the company, he was involved in the study design and funding application, but\nwas not involved in the conduct of the clinical trial. C.M. is an OrganOx Ltd employee\nand provided the device technical support. H.M. received consultancy fees for lecturing\nand training activities for OrganOx Ltd. All other co-authors declare no competing\ninterests. This paper presents independent research supported by the NIHR Birmingham\nBiomedical Research Centre at the University Hospitals Birmingham NHS Foundation\nTrust and the University of Birmingham. The views expressed are those of the authors\nand not necessarily those of the NHS, the NIHR or the Department of Health.\nAdditional information\nSupplementary information is available for this paper at https://doi.org/10.1038/s41467-\n020-16251-3.\nCorrespondence and requests for materials should be addressed to H.M., S.C.A. or D.F.\nM.\nPeer review information Nature Communications thanks the anonymous reviewer(s) for\ntheir contribution to the peer review of this work. Peer reviewer reports are available.\nReprints and permission information is available at http://www.nature.com/reprints\nPublisher’s note Springer Nature remains neutral with regard to jurisdictional claims in\npublished maps and institutional affiliations.\nOpen Access This article is licensed under a Creative Commons\nAttribution 4.0 International License, which permits use, sharing,\nadaptation, distribution and reproduction in any medium or format, as long as you give\nappropriate credit to the original author(s) and the source, provide a link to the Creative\nCommons license, and indicate if changes were made. The images or other third party\nmaterial in this article are included in the article’s Creative Commons license, unless\nindicated otherwise in a credit line to the material. If material is not included in the\narticle’s Creative Commons license and your intended use is not permitted by statutory\nregulation or exceeds the permitted use, you will need to obtain permission directly from\nthe copyright holder. To view a copy of this license, visit http://creativecommons.org/\nlicenses/by/4.0/.\n© The Author(s) 2020\nARTICLE NATURE COMMUNICATIONS | https://doi.org/10.1038/s41467-020-16251-3\n12 NATURE COMMUNICATIONS | (2020) 11:2939 | https://doi.org/10.1038/s41467-020-16251-3 | www.nature.com/naturecommunications\n\n"], "response": "This scientific article, titled \"Machine perfusion of extended criteria donor livers rescues transplantation in high-risk patients,\" discusses a clinical trial that evaluated the use of machine perfusion technology to preserve and assess the viability of livers that do not normally meet transplantation criteria due to factors such as steatosis, fibrosis, or prolonged cold ischemia time. The trial, called RESCUE, aimed to determine whether machine perfusion can improve the success rate of transplanting these \"extended criteria\" donor livers, which are often discarded due to concerns about their functionality. The study found that machine perfusion allowed for the recovery and maintenance of liver function in previously discarded livers, resulting in a successful transplantation rate of 71% (compared to the standard rate of around 60%) and a low incidence of bile duct injuries. These findings suggest that machine perfusion may offer a promising alternative for expanding the pool of available organs for transplantation, particularly in areas where there is a shortage of donors. The study was funded by the National Institute for Health Research (NIHR) and supported by OrganOx Ltd, a spinout company from the University of Oxford. The authors declared no conflicts of interest related to the study. The full text of the article is available via open access licensing, allowing for free use, sharing, adaptation, distribution, and reproduction in any medium or format, as long as proper attribution and licensing terms are observed."}
{"user_input": "How has machine perfusion changed risk thresholds associated with steatotic donor livers?", "retrieved_contexts": ["RESEARCH ARTICLE\nEvolution of dynamic, biochemical, and\nmorphological parameters in hypothermic\nmachine perfusion of human livers: A proof￾of-concept study\nH. Abudhaise 1\n*, B. R. Davidson1☯, P. DeMuylder2‡, T. V. Luong3‡, B. Fuller1☯\n1 UCL Division of Surgery and Interventional Sciences, Royal Free Hospital, London, United Kingdom,\n2 Organ Recovery Systems, Zaventem, Belgium, 3 Department of Cellular Pathology, Royal Free London\nNHS Foundation Trust, London, United Kingdom\n☯ These authors contributed equally to this work.‡ These authors also contributed equally to this work.\n* hamid.abudhaise.11@ucl.ac.uk\nAbstract\nIntroduction\nHypothermic machine perfusion (HMP) is increasingly investigated as a means to assess\nliver quality, but data on viability markers is inconsistent and the effects of different perfusion\nroutes and oxygenation on perfusion biomarkers are unclear.\nMethods\nThis is a single-centre, randomised, multi-arm, parallel study using discarded human livers\nfor evaluation of HMP using arterial, oxygen-supplemented venous and non-oxygen-supple￾mented venous perfusion. The study included 2 stages: in the first stage, 25 livers were ran￾domised into static cold storage (n = 7), hepatic artery HMP (n = 10), and non-oxygen￾supplemented portal vein HMP (n = 8). In the second stage, 20 livers were randomised into\noxygen-supplemented and non-oxygen-supplemented portal vein HMP (n = 11 and 9,\nrespectively). Changes in dynamic, biochemical, and morphologic parameters during 4-\nhour preservation were compared between perfusion groups, and between potentially trans￾plantable and non-transplantable livers.\nResults\nDuring arterial perfusion, resistance was higher and flow was lower than venous perfusion\n(p = 0.001 and 0.01, respectively); this was associated with higher perfusate markers\nduring arterial perfusion (p>0.05). Supplementary oxygen did not cause a significant alter￾ation in the studied parameters. Morphology was similar between static and dynamic\npreservation groups. Perfusate markers were 2 fold higher in non-transplantable livers\n(p>0.05).\nPLOS ONE | https://doi.org/10.1371/journal.pone.0203803 September 14, 2018 1 / 12\na1111111111\na1111111111\na1111111111\na1111111111\na1111111111\nOPEN ACCESS\nCitation: Abudhaise H, Davidson BR, DeMuylder P,\nLuong TV, Fuller B (2018) Evolution of dynamic,\nbiochemical, and morphological parameters in\nhypothermic machine perfusion of human livers: A\nproof-of-concept study. PLoS ONE 13(9):\ne0203803. https://doi.org/10.1371/journal.\npone.0203803\nEditor: Leonidas G. Koniaris, Indiana University,\nUNITED STATES\nReceived: November 8, 2017\nAccepted: August 7, 2018\nPublished: September 14, 2018\nCopyright: © 2018 Abudhaise et al. This is an open\naccess article distributed under the terms of the\nCreative Commons Attribution License, which\npermits unrestricted use, distribution, and\nreproduction in any medium, provided the original\nauthor and source are credited.\nData Availability Statement: All relevant data are\nwithin the paper.\nFunding: This study was supported by the National\ninstitute of health and research; Reference number:\nHTD 556; https://www.nihr.ac.uk. Consumables\nand laboratory materials were partially funded by\nOrgan Recovery Systems; https://www.organ￾recovery.com. The author receiving funding was\nBRD. Author P. DeMuylder is employed by Organ\nRecovery Systems. Organ Recovery Systems\n\nConclusions\nArterial only perfusion might not be adequate for graft perfusion. Hepatocellular injury mark￾ers are accessible and easy to perform and could offer insight into graft quality, but large\nrandomised trials are needed to identify reliable quality assessment biomarkers.\nIntroduction\nHypothermic machine perfusion (HMP) has gained interest as a potential means to improve\nthe outcome of marginal livers and allow viability assessment in high-risk grafts [1–5]. Despite\nthis potential of HMP, data on viability biomarkers is inconsistent and none of the investigated\nbiomarkers is able to differentiate between viable and non-viable livers [1, 6, 7].\nAlthough HMP allows for assessment of dynamic perfusion parameters, there is no conclu￾sive evidence that dynamic parameters correlate with graft quality, and the progression of\nthese parameters differs significantly between studies; while recent clinical studies reported\nstable hepatic artery (HA) and portal vein (PV) pressures during HMP [2, 3], others observed\na drop in HA resistance and increased flow during HMP, suggesting relaxation of the arterial\nwalls and improved microcirculation [8–11]. Several perfusate markers have been investigated,\nbut none were able to assess graft viability reliably, and different cut-off values were proposed\nto indicate the severity of reperfusion injury [3, 7, 10]. Histological examination is limited\nto steatosis assessment in clinically suspicious grafts [12–14], but it is not currently used for\nviability assessment due to its invasive nature, limited amount of tissue, and lack of a morpho￾logical standard for viability assessment [1, 7]. In addition, human studies reported controver￾sial results on the morphology of livers preserved with HMP and static cold storage (SCS)\n[2, 15–17]. Finally, the benefits of supplementary oxygen during short-term end ischemic\nhypothermic perfusion have been documented in pre-clinical and clinical studies [4, 5, 18],\nbut the effect of supplementary oxygen on injury markers during human liver HMP is unclear.\nThe aim of this study is to evaluate the progression of dynamic, biochemical and histologi￾cal markers during HMP in the human liver, comparing arterial, oxygen-supplemented\nvenous and non-oxygen-supplemented venous perfusion, and to study these markers in rela￾tion to organ quality.\nMaterials and methods\nThis is single-centre, randomised, multi-arm parallel group study.\nParticipants\nEthical approval for the study was obtained from the North London Regional Ethics Commit￾tee 3 (reference no. 10/H0709/70), and confirmed with the National Health Service Blood and\nTransplant (NHSBT) Organ Donor Transplant committee. None of the transplant donors\nwere from a vulnerable population and all donors or next of kin provided written informed\nconsent that was freely given.\nThe study involved 45 sequential livers procured for transplantation by different organ pro￾curement teams across the UK between February 2012 and June 2014. All livers were retrieved\nusing the standard clinical procurement protocols adopted by the UK National Organ\nRetrieval Service (NORS) (http://www.odt.nhs.uk/national-organ-retrieval-service/policies￾and-reports), but were found to be unsuitable for transplantation by UK transplant centres\nEvolution of injury markers in hypothermic machine perfusion\nPLOS ONE | https://doi.org/10.1371/journal.pone.0203803 September 14, 2018 2 / 12\nprovided support in the form of salary for author\nPD, and also provided support in the form of\nresearch material and advice on using the\nperfusion machine and were involved in\nconceptualization and funding acquisition but did\nnot have any additional role in the study design,\ndata collection and analysis, decision to publish, or\npreparation of the manuscript. The specific role of\nthis author is articulated in the ‘author\ncontributions’ section.\nCompeting interests: Consumables and laboratory\nmaterials were partially funded by Organ Recovery\nSystems; https://www.organ-recovery.com. Author\nP. DeMuylder is employed by Organ Recovery\nSystems. There are no patents, products in\ndevelopment or marketed products to declare. This\ndoes not alter our adherence to all the PLOS ONE\npolicies on sharing data and materials.\n\ndue to a combination of donor graft and recipient factors (Table 1). Livers were transported\nfrom the retrieval hospital to our research centre packed in ice and stored in University of Wis￾consin (UW) solution. Only whole livers from deceased donors were used; one split liver was\nexcluded from the study.\nRandomisation\nThe original prototype of the Organ Recovery Workstation1, based on the Lifeport Kidney\nTransporter machine (Organ Recovery Systems, Zaventem, Belgium), did not incorporate an\noxygen delivery system, which was later integrated during the study period. Consequently, an\noxygenated perfusion group could not be randomised at the start of the study, and was added\nduring the second stage of the study. Livers were randomised at 2 stages: stage 1, 25 livers were\nrandomised into static cold storage (SCS, n = 7), arterial perfusion through the hepatic artery\n(AP, n = 10), and non-oxygen-supplemented venous perfusion through the portal vein\n(nOVP, n = 8). Arterial perfusion was studied herein to further assess this perfusion modality\nfollowing an earlier published study by our team [16], which showed equivalence of endothe￾lial preservation using different perfusion routes. In stage 2, 20 livers were randomised into\noxygen-supplemented perfusion (OVP, n = 11) and non-oxygen-supplemented venous perfu￾sion (nOVP, n = 9). The nOVP groups in stages 1 and 2 of the study were similar in character￾istics and perfusion settings. Simple randomisation was performed using a computer￾generated list of random numbers and the allocation sequence was concealed in numbered,\nopaque, and sealed envelopes. Sample size calculation was not performed.\nInterventions\nLivers in the SCS group were submerged in 2 L of KPS-1 and placed in the icebox for 4 hours.\nAlthough KPS-1 is not conventionally used for static preservation, it was used for SCS herein\nto reduce preservation solution variance between groups. Livers in the AP group were cannu￾lated through the HA (Lifeport SealRing™ 10x35 cannula), and livers in the nOVP and OVP\nTable 1. Donor graft and recipient factors associated with graft decline for transplantation.\nReason for declining the graft Frequency Percentage %\nOld age 3 7 Donor related\nAlcohol abuse 2 4 Donor related\nOther donor factors 3 7 Donor related\nLong WIT 5 11 Graft related\nLong CIT 1 2 Graft related\nSteatosis (moderate-severe) 18 39 Graft related\nFibrosis 5 11 Graft related\nCaeliac artery disease 2 4 Graft related\nPoor flow 1 2 Graft related\nPoor LFT 5 11 Graft related\nSuspicious liver lesions 2 4 Graft related\nCapsular tear 2 4 Graft related\nNo suitable recipient 3 7 Recipient related\nCharacteristics of the liver grafts in this study, showing the documented reasons for graft decline for transplantation. Less common donor factors (under other donor\nfactors in the table) included a single occurrence of intra-abdominal sepsis, high BMI, and hemorrhagic pancreatitis. Poor flow during the initial on-table flush by the\nretrieval team was documented as a factor in one liver. DCD, donation after cardiac death; long warm ischaemia time (WIT) > 30 minutes; long cold ischaemia time\n(CIT) > 12 hours; LFT, liver function tests.\nhttps://doi.org/10.1371/journal.pone.0203803.t001\nEvolution of injury markers in hypothermic machine perfusion\nPLOS ONE | https://doi.org/10.1371/journal.pone.0203803 September 14, 2018 3 / 12\n\ngroups were cannulated through the PV (Lifeport Straight 8mm cannula). HMP livers were\nconnected to the non-pulsatile roller pump of the Organ Recovery Workstation, and perfused\nwith 2 L of recirculating KPS-1 through the HA or PV, at 30 mmHg or 7 mmHg, respectively.\nThe preservation period of 4 hours was hypothesised as adequate to observe dynamic and bio￾chemical changes during HMP.\nFor the OVP group, 100% oxygen was administered at a fixed rate of 0.5 L/min using a\nmembrane oxygenator (Dideco Kids D100, Sorin Group Italia, Mirandola, Italy) connected to\nthe perfusion circuit, achieving a perfusate pO2 of 735.1 mmHg (724.1–791.4).\nHypothermia was maintained between 4–8˚ C using a heat exchanger (Polystat temperature\ncontroller, Cole-Parmer UK) and a built-in iced-water container around the perfusion bowl.\nSimilar to clinical studies by Guarrera [2, 3], no metabolic adjustment was undertaken.\nOutcome measures\nDynamic perfusion parameters (flow and vascular resistance) were continuously measured in\nthe HA (AP group) and PV (nOVP and OVP groups) using built-in sensors in the Organ\nRecovery Workstation and recorded hourly. Hepatocellular injury enzymes (alanine transami￾nase, ALT; aspartate transaminase, AST) were measured in the perfusate using Roche P\nModule analyser (Roche Diagnostics Limited, UK), immediately before HMP, then hourly\nafterwards. For morphological assessment, a wedge biopsy was taken from segment 4 and seg￾ment 7 before and after 4-hour preservation (SCS and HMP groups). The rationale for using\nbiopsies from 2 different segments of the liver is based on evidence published elsewhere [19].\nParaffinised, hematoxylin and eosin (H&E) stained liver biopsies were examined under light\nmicroscopy by a liver histopathologist. Assessors of biochemistry and histology samples were\nblinded to the allocation groups. A scoring system previously published by Vekemans et al.\n[17] was used to score morphological changes, based on enlargement of the space of Disse,\nsinusoidal dilatation, coagulation necrosis, congestion, architectural damage, and neutrophil\ninfiltration.\nStatistical analysis\nData was analysed using IBM SPSS Statistics for Macintosh, Version 20.0. Armonk, NY: IBM\nCorp. Continuous data was presented as median (interquartile range) and categorical data was\npresented in numbers and percentages. Non-parametric tests were used due to small sample\nsize and abnormal distribution. Kruskal-Wallis (KW) and Friedman tests were used to com￾pare differences between and within groups, respectively. When KW test or Friedman test\nshowed a significant difference, a pairwise comparison using Mann-Whitney test or Wilcoxon\ntest was performed. The level of significance was set at p < 0.05.\nResults\nDonor graft characteristics\nCharacteristics of the donor grafts (n = 45) are presented in Table 2. There were no significant\ndifferences in donor graft variables (age, heart-beating status, cold and warm ischaemia times,\nand macrosteatosis) between the groups.\nStage 1 of the study\nDuring the first stage of the study, livers were randomised into 3 groups: SCS (n = 7), AP\n(n = 10), and nOVP (n = 8).\nEvolution of injury markers in hypothermic machine perfusion\nPLOS ONE | https://doi.org/10.1371/journal.pone.0203803 September 14, 2018 4 / 12\n\nDynamic parameters during HMP. Resistance was stable in the nOVP group throughout\nHMP but decreased significantly in AP group from 0 to 1 hour (1.20 mmHg/ml/min (0.43–\n1.22) to 0.87 mmHg/ml/min (0.43–1.18), p = 0.01). Flow increased significantly in both groups\nfrom 0 to 1 hour (AP 26 ml/min (21–49) to 33 ml/min (25–48), p = 0.03; nOVP 86 ml/min\n(58–126) to 94 (59–128), p = 0.04). Resistance in the HA was significantly higher than PV\n(0.83 mmHg/ml/min (0.41–1.11) versus 0.07 mmHg/ml/min (0.05–0.10), p = 0.001), and per￾fusate flow was significantly lower in the HA compared to the PV (33 ml/min (24–48) versus\n92 ml/min (59–127), p = 0.01), Fig 1.\nHepatocellular injury markers during HMP. ALT increased significantly throughout\nperfusion in the AP and nOVP groups (p \u0014 0.001 both groups) and AST levels showed a simi￾lar trend (p = 0.004 and < 0.001 for AP and nOVP groups, respectively). Of note, there was a\nsteep rise in enzyme levels between 0 and 1 hour HMP in both groups. The enzymes were\nhigher in AP group compared to nOVP group, but the difference was not significant (ALT,\np = 0.53; AST, p = 0.50), Fig 2.\nMorphology score in SCS and HMP. The change in morphology score was not different\nbetween groups at the end of static and dynamic preservation (p = 0.38), Fig 3.\nTable 2. Characteristics of the donor grafts used in the 2 stages of the study.\nStage 1 Stage 2\nSCS AP nOVP Intergroup difference nOVP OVP Intergroup difference\n(n = 7) (n = 10) (n = 8) (p value) (n = 9) (n = 11) (p value)\nAge (years) 57 (50–70) 56 (51–65) 57 (49–61) 0.8 62 (48–65) 53 (44–61) 0.3\nDonor type\n(DCD, %) 4, 57% 8, 80% 6, 75% 0.4 4, 44% 5, 45% 0.9\nCIT (hr) 11.5 (11.0–12.3) 10.0 (9.8–14.3) 11.5 (7.0–13.8) 0.9 10.0 (10.0–14.0) 13.0 (12.0–15.0) 0.6\nTotal WIT (min) 23 (7–30) 19 (16–34) 24 (20–33) 0.7 23 (12–30) 22 (14–33) 0.7\nAsystole WIT (min) 13 (6–19) 12 (9–14) 12 (9–14) 0.8 11 (9–14) 13 (11–15) 0.3\nSteatosis % 7 (0–20) 6 (1–8) 3 (1–5) 0.8 10 (1–36) 8 (3–28) 0.9\nDCD, donation after cardiac death; total warm ischaemia time (total WIT), time between withdrawal of cardiorespiratory support until cold in-situ flush; asystole warm\nischaemia time (asystole WIT), time between circulatory arrest and cold in-situ flush. Steatosis was estimated as the percentage of macrosteatosis in paraffinised, H&E￾stained parenchymal biopsies examined under light microscopy by a liver histopathologist. Continuous data is presented as median (interquartile range) and categorical\ndata is presented in numbers and percentages.\nhttps://doi.org/10.1371/journal.pone.0203803.t002\nFig 1. Dynamic parameters during arterial and non-oxygen-supplemented venous perfusion. (A) resistance (mmHg/ml/min)\nand (B) perfusate flow (ml/min) hypothermic machine perfusion. Data is shown as medians and interquartile range, the latter\nrepresented by error bars. p < 0.05 between time points, p < 0.05 between groups.\nhttps://doi.org/10.1371/journal.pone.0203803.g001\nEvolution of injury markers in hypothermic machine perfusion\nPLOS ONE | https://doi.org/10.1371/journal.pone.0203803 September 14, 2018 5 / 12\n\nStage 2 of the study\nDuring the second stage of the study, 2 liver groups were studied, nOVP (n = 9), and OVP\n(n = 11).\nFig 2. Perfusate injury markers during arterial and non-oxygen-supplemented venous perfusion. (A) perfusate ALT (IU/L) and\n(B) AST (IU/L) during hypothermic machine perfusion. Data is shown as medians and interquartile range, the latter represented by\nerror bars. Enzymes increased during perfusion but there was no significant difference between groups. p < 0.05 between time\npoints.\nhttps://doi.org/10.1371/journal.pone.0203803.g002\nFig 3. Box whisker plot of parenchymal morphology after preservation. This plot shows the distribution of\nmorphology score values round the median, plotted before and after hypothermic machine perfusion and static cold\nstorage. There was no significant difference in the morphology score after static cold storage, arterial perfusion, and\nnon-oxygen-supplemented venous perfusion groups (p = 0.38). Top and bottom whiskers represent the maximum and\nminimum values, respectively, and circles represent outliers.\nhttps://doi.org/10.1371/journal.pone.0203803.g003\nEvolution of injury markers in hypothermic machine perfusion\nPLOS ONE | https://doi.org/10.1371/journal.pone.0203803 September 14, 2018 6 / 12\n\nDynamic parameters during HMP. Resistance was stable throughout perfusion in both\ngroups, but flow increased significantly from 0 to 1 hour (nOVP 49 ml/min (39–76) to 58 ml/\nmin (44–84), p = 0.01; OVP 53 ml/min (48–69) to 59 ml/min (52–75), p = 0.03). There was no\nsignificant difference in resistance and flow (p = 0.96 and 0.99, respectively) between the two\ngroups, Fig 4.\nHepatocellular injury markers during HMP. ALT and AST increased significantly\nthroughout perfusion (p < 0.001 for both enzymes in OVP and nOVP groups). There was\nno significant difference in ALT or AST between groups (p = 0.38 and 0.62, respectively).\nFig 5.\nMorphology score in HMP. There was no significant difference in morphology score\nafter OVP or nOVP, p = 0.10, Fig 6. There was no significant difference in the morphology\nscore between segment 4 and 7 of the same liver when all samples were compared (p = 0.63).\nComparison between potentially transplantable and non-transplantable\nlivers\nOut of 45 livers, 7 livers were potentially transplantable. 3 livers were not transplanted due to\nlack of suitable recipients, while 4 more livers were rejected due to suspicious liver lesions and\ncapsular tears (2 each), (Table 1).\nPotentially transplantable livers had lower median ALT and AST levels when compared to\nnon-transplantable livers, although the difference was not statistically significant (median\nFig 4. Dynamic parameters during oxygen-supplemented and non-oxygen-supplemented venous perfusion. (A) resistance\n(mmHg/ml/min) and (B) perfusate flow (ml/min) during hypothermic machine perfusion. Data is shown as medians and\ninterquartile range. p < 0.05 between time points.\nhttps://doi.org/10.1371/journal.pone.0203803.g004\nFig 5. Perfusate injury markers during oxygen-supplemented and non-oxygen-supplemented venous perfusions. (A) perfusate\nALT (IU/L) and (B) AST (IU/L) during hypothermic machine perfusion. Enzymes increased during perfusion but there was no\nsignificant difference between groups. Data is shown as medians and interquartile range. p < 0.05 between time points.\nhttps://doi.org/10.1371/journal.pone.0203803.g005\nEvolution of injury markers in hypothermic machine perfusion\nPLOS ONE | https://doi.org/10.1371/journal.pone.0203803 September 14, 2018 7 / 12\n\nALT: 348 IU/L (221–1590) vs. 653 IU/L (291–1875), p = 0.39; median AST: 512 IU/L (305–\n1896) vs. 1019 IU/L (429–2405), p = 0.31).\nThe median PV resistance in potentially transplantable livers was 0.11 mmHg/ml/min\n(0.08–0.17) and the median flow was 60 ml/min (49–80), compared to 0.10 mmHg/ml/min\n(0.06–0.14) and 67 ml/min (52–94) in non-transplantable livers (p = 0.25 and 0.65, respec￾tively). None of the livers in the HA-only perfusion group were potentially transplantable, so a\ncomparison could not be performed. Histology scores in potentially transplantable livers were\nnot significantly different from non- transplantable livers (p = 0.97).\nDiscussion\nDespite the recent expansion in utilisation of HMP to improve the outcome of marginal livers\nin clinical practice, data on viability markers is inconsistent and no markers are yet validated.\nHMP is mostly performed using dual-vessel or PV-only perfusion, and feasibility of both\napproaches has been reported in recent clinical trials [2–4, 11] although the optimal perfusion\nroute is not currently known. Arterial-only perfusion is less commonly used, based on evi￾dence from animal studies showing increased graft injury and heterogeneous perfusion using\nthe HA only [20, 21].\nFig 6. Box whisker plot of parenchymal morphology in oxygen-supplemented and non-oxygen-supplemented\nvenous perfusion. This plot shows the distribution of morphology score values round the median, plotted before and\nafter hypothermic machine perfusion. There was no significant difference in the morphology score between the 2\ngroups (p = 0.10). Top and bottom whiskers represent the maximum and minimum values, respectively, and circles\nrepresent outliers.\nhttps://doi.org/10.1371/journal.pone.0203803.g006\nEvolution of injury markers in hypothermic machine perfusion\nPLOS ONE | https://doi.org/10.1371/journal.pone.0203803 September 14, 2018 8 / 12\n\nWe found the HA and PV resistance to be similar to those documented in a previous study\nof discarded human livers preserved with dual-vessel perfusion at similar pressures to our\nexperiments [10], which suggests that similar PV flows can be achieved with PV-only perfu￾sion and questions the need for additional HA cannulation and perfusion. In addition, a recent\nstudy in rat, pig and discarded human DCD livers showed complete perfusion of the paren￾chyma and biliary system using hypothermic oxygenated perfusion (HOPE) using the PV\nonly [22].\nPerfusate flow increased in the first hour of HMP in all perfusion groups and there was a\nsignificant reduction of arterial resistance during the same time period. These changes in per￾fusion dynamics are likely to be due to “opening up” of the microvasculature and relaxation of\narterial walls during HMP, similar to what has been reported previously in porcine [8, 9] and\ndiscarded human livers [10]. In line with other studies [9, 10, 23], we found the resistance to\nbe higher and the flow lower when the graft was perfused via the hepatic artery in comparison\nto the portal vein. This is a reflection of the hepatic circulation in vivo where hepatic arterial\ncirculation is characterised by higher resistance and lower flow than the portal circulation due\nto larger smooth muscle content in the tunica media layer in the arterial walls.\nThe early dynamic changes in our study were associated with a steep rise of hepatocellular\ninjury markers in most liver groups during the first hour of HMP, suggesting an accelerated\nrelease of hepatocellular enzymes into the perfusate due to flushing out of enzymes accumu￾lated in the vascular spaces, similar to observations from a previous porcine liver study [23].\nPerfusate injury markers did not stabilise after the first 1–2 hours of perfusion, but increased\ngradually, possibly due to pre-perfusion ischaemic injury. It is important to keep the different\nrates of enzyme release in mind when collecting perfusate samples, as initial samples might not\nreflect the severity of graft injury. In addition, hepatocellular injury markers were higher in\nsingle-vessel arterial perfusion compared to single-vessel venous perfusion, although the dif￾ference was not statistically significant. These findings suggest that graft perfusion might not\nbe adequate if perfusion is performed using the hepatic artery alone.\nThere was no difference in morphology between biopsies taken from 2 distant liver seg￾ments within each liver, and the architecture was preserved after 4-hour single-vessel perfu￾sion, which agrees with findings from previous studies in discarded human livers [16, 17]. We\ndid not observe significant sinusoidal dilatation or hepatocellular oedema in contrast to other\nresearchers [8, 10, 24]. It is possible that the architectural changes in the latter studies resulted\nfrom prolonged storage (24 hours) or different machine perfusion setup [8, 10]. Based on our\nfindings herein, and from results published previously by our team [16], it seems likely that\narchitectural damage assessment during HMP offers limited information on the quality of\ngrafts, although histological examination remains of importance in evaluating steatosis sever￾ity, degree of fibrosis, and for the assessment of suspicious lesions found during organ\nretrieval.\nWhen potentially transplantable livers were compared to non-tranplantable livers, hepato￾celullar markers in the perfusate were 2 fold higher in the latter group, but the difference was\nnot statsticaly signficant. In another proof-of-concept study, Monbaliu [10] reported that per￾fusae AST distinguished between potentially transplantable and non-transplantable livers, and\nnoted that AST and LDH levels were signficantly higher in non-transplantable livers. Although\nour results match the enzyme levels documented for potentially transplantable livers in the lat￾ter study, they do not show the same level of significant difference, most likely due to the\nmuch higher AST levels observed in non-transplantable livers in Monbaliu study (6–8 fold\nhigher compared to transplantable livers). AST and ALT measured during perfusion were also\nfound to correlate with peak post-transplant levels in the recipient in clinical trials by Guarrera\nEvolution of injury markers in hypothermic machine perfusion\nPLOS ONE | https://doi.org/10.1371/journal.pone.0203803 September 14, 2018 9 / 12\n\n[2, 3]. Consequently, it seems that perfusate hepatocellular injury markers have the potential\nto be used for graft quality assessment in the human liver.\nSupplementary oxygen did not cause a significant alteration in dynamic, biochemical, or\nmorphological parameters in this cohort, but the need for active oxygenation might only mani￾fest following warm reperfusion; consequently, the effect of oxygenation on metabolism and\nmitochondrial function are better assessed using a normothermic reperfusion model.\nWe report one of the largest studies of discarded human livers, but we acknowledge that the\noverall sample size is relatively small due to the limited number of whole human livers avail￾able for research, which restricted additional groups from being assessed in this study, such as\ndual-vessel perfusion and oxygenated arterial perfusion groups. Due to technical factors\nrelated to oxygen delivery mechanism, the oxygen-supplemented perfusion group could not\nbe randomised at the beginning of the study, but was later added in a second randomisation\nprocess. This resulted in the study being divided into 2 stages, which reduced the size of inter￾vention groups. The study is limited by lack of clinical outcome measures, as the livers were\nnot transplantable; the aim of the study was to describe baseline differences in biomarkers\nusing different perfusion modalities as a proof-of-concept. An additional period of normother￾mic reperfusion would have been useful here, but is not a replacement for transplantation and\nin-situ reperfusion for optimal assessment of organ viability.\nThis study shows that perfusate injury markers have the potential for assessing graft quality\nand that perfusate markers are released at a faster rate during the initial period of perfusion,\nwhich is important if these markers are to be used for graft assessment. It is likely that single￾vessel perfusion via the PV is more beneficial than HA perfusion during HMP on the basis of\nperfusion characteristics and perfusate injury markers. However, additional issues of impor￾tance would be the risk of vessel injury with cannulation, the effect on hepatocyte metabolism\nand bioenergetics including mitochondrial function and the unique importance of maintain￾ing the peri-biliary vascular plexus that is associated with bile duct injury following transplan￾tation. In order to evaluate the optimal perfusion settings and to identify objective markers of\ngraft quality during perfusion, large prospective and randomised clinical trials are needed, as\nthe current knowledge is mainly derived from small size feasibility studies. In addition, bio￾marker standardization and guidelines on outcome definitions are required to enable an unbi￾ased comparison between different studies.\nAcknowledgments\nWe would like to thank Mr Jahm Persaud from the Biochemistry Department, Royal Free Lon￾don NHS Foundation Trust, London UK for processing biochemistry samples. We would also\nlike to thank the liver transplant coordinators for their great assistance in this research.\nAuthor Contributions\nConceptualization: B. R. Davidson, P. DeMuylder, B. Fuller.\nData curation: H. Abudhaise.\nFormal analysis: H. Abudhaise.\nFunding acquisition: B. R. Davidson, P. DeMuylder, B. Fuller.\nInvestigation: H. Abudhaise, T. V. Luong.\nMethodology: H. Abudhaise.\nResources: P. DeMuylder.\nEvolution of injury markers in hypothermic machine perfusion\nPLOS ONE | https://doi.org/10.1371/journal.pone.0203803 September 14, 2018 10 / 12\n\nSupervision: B. R. Davidson, B. Fuller.\nWriting – original draft: H. Abudhaise.\nWriting – review & editing: H. Abudhaise.\nReferences\n1. Verhoeven CJ, Farid WR, de Jonge J, Metselaar HJ, Kazemier G, van der Laan LJ. Biomarkers to\nassess graft quality during conventional and machine preservation in liver transplantation. Journal of\nhepatology. 2014; 61(3):672–84. https://doi.org/10.1016/j.jhep.2014.04.031 PMID: 24798616\n2. Guarrera JV, Henry SD, Samstein B, Odeh-Ramadan R, Kinkhabwala M, Goldstein MJ, et al. Hypother￾mic machine preservation in human liver transplantation: the first clinical series. American journal of\ntransplantation: official journal of the American Society of Transplantation and the American Society of\nTransplant Surgeons. 2010; 10(2):372–81.\n3. Guarrera JV, Henry SD, Samstein B, Reznik E, Musat C, Lukose TI, et al. Hypothermic machine preser￾vation facilitates successful transplantation of \"orphan\" extended criteria donor livers. American journal\nof transplantation: official journal of the American Society of Transplantation and the American Society\nof Transplant Surgeons. 2015; 15(1):161–9.\n4. Dutkowski P, Schlegel A, de Oliveira M, Mullhaupt B, Neff F, Clavien PA. HOPE for human liver grafts\nobtained from donors after cardiac death. Journal of hepatology. 2014; 60(4):765–72. https://doi.org/10.\n1016/j.jhep.2013.11.023 PMID: 24295869\n5. Dutkowski P, Polak WG, Muiesan P, Schlegel A, Verhoeven CJ, Scalera I, et al. First comparison of\nhypothermic oxygenated PErfusion versus static cold storage of human donation after cardiac death\nliver transplants: an international-matched case analysis. Annals of surgery. 2015; 262(5):764–71.\nhttps://doi.org/10.1097/SLA.0000000000001473 PMID: 26583664\n6. Quillin RC, Guarrera JV. Machine Perfusion for the Assessment and Resuscitation of Marginal Donors\nin Liver Transplantation. Current transplantation reports. 2016; 3(4):341–7.\n7. Melendez HV, Rela M, Murphy G, Heaton N. Assessment of graft function before liver transplantation:\nquest for the lost ark? Transplantation. 2000; 70(4):560–5. PMID: 10972207\n8. Monbaliu D, Vekemans K, De Vos R, Brassil J, Heedfeld V, Qiang L, et al. Hemodynamic, biochemical,\nand morphological characteristics during preservation of normal porcine livers by hypothermic machine\nperfusion. Transplantation proceedings. 2007; 39(8):2652–8. https://doi.org/10.1016/j.transproceed.\n2007.08.009 PMID: 17954200\n9. Derveaux K, Monbaliu D, Crabbe T, Schein D, Brassil J, Kravitz D, et al. Does ex vivo vascular resis￾tance reflect viability of non-heart-beating donor livers? Transplantation proceedings. 2005; 37(1):\n338–9. https://doi.org/10.1016/j.transproceed.2004.11.065 PMID: 15808636\n10. Monbaliu D, Liu Q, Libbrecht L, De Vos R, Vekemans K, Debbaut C, et al. Preserving the morphology\nand evaluating the quality of liver grafts by hypothermic machine perfusion: a proof-of-concept study\nusing discarded human livers. Liver transplantation: official publication of the American Association\nfor the Study of Liver Diseases and the International Liver Transplantation Society. 2012; 18(12):\n1495–507.\n11. Van Rijn R, Karimian N, Matton A, Burlage L, Westerkamp A, van den Berg A, et al. Dual hypothermic\noxygenated machine perfusion in liver transplants donated after circulatory death. British Journal of Sur￾gery. 2017; 104(7):907–17. https://doi.org/10.1002/bjs.10515 PMID: 28394402\n12. Rey J, Wirges U, Dienes H, Fries J, editors. Hepatic steatosis in organ donors: disparity between sur￾gery and histology? Transplantation proceedings; 2009: Elsevier.\n13. Nocito A, El-Badry AM, Clavien P-A. When is steatosis too much for transplantation? Journal of hepatol￾ogy. 2006; 45(4):494–9. https://doi.org/10.1016/j.jhep.2006.07.017 PMID: 16919359\n14. Marsman H, Matsushita T, Dierkhising R, Kremers W, Rosen C, Burgart L, et al. Assessment of donor\nliver steatosis: pathologist or automated software? Human Pathology. 2004; 35(4):430–5. PMID:\n15116323\n15. Henry S, Nachber E, Tulipan J, Stone J, Bae C, Reznik L, et al. Hypothermic machine preservation\nreduces molecular markers of ischemia/reperfusion injury in human liver transplantation. American\nJournal of Transplantation. 2012; 12(9):2477–86. https://doi.org/10.1111/j.1600-6143.2012.04086.x\nPMID: 22594953\n16. Jomaa A, Gurusamy K, Siriwardana PN, Claworthy I, Collier S, de Muylder P, et al. Does hypothermic\nmachine perfusion of human donor livers affect risks of sinusoidal endothelial injury and microbial infec￾tion? A feasibility study assessing flow parameters, sterility, and sinusoidal endothelial ultrastructure.\nEvolution of injury markers in hypothermic machine perfusion\nPLOS ONE | https://doi.org/10.1371/journal.pone.0203803 September 14, 2018 11 / 12\n\nTransplantation proceedings. 2013; 45(5):1677–83. https://doi.org/10.1016/j.transproceed.2013.01.\n011 PMID: 23769023\n17. Vekemans K, van Pelt J, Komuta M, Wylin T, Heedfeld V, Detry O, et al. Attempt to rescue discarded\nhuman liver grafts by end ischemic hypothermic oxygenated machine perfusion. Transplantation pro￾ceedings. 2011; 43(9):3455–9. https://doi.org/10.1016/j.transproceed.2011.09.029 PMID: 22099819\n18. Schlegel A, Rougemont O, Graf R, Clavien PA, Dutkowski P. Protective mechanisms of end-ischemic\ncold machine perfusion in DCD liver grafts. Journal of hepatology. 2013; 58(2):278–86. https://doi.org/\n10.1016/j.jhep.2012.10.004 PMID: 23063573\n19. Frankel WL, Tranovich JG, Salter L, Bumgardner G, Baker P. The optimal number of donor biopsy sites\nto evaluate liver histology for transplantation. Liver transplantation. 2002; 8(11):1044–50. https://doi.\norg/10.1053/jlts.2002.36492 PMID: 12424718\n20. Compagnon P, Clement B, Campion JP, Boudjema K. Effects of hypothermic machine perfusion on rat\nliver function depending on the route of perfusion. Transplantation. 2001; 72(4):606–14. PMID:\n11544418\n21. Richter S, Yamauchi J-I, Minor T, Vollmar B, Menger MD. EFFECT OF WARM ISCHEMIA TIME AND\nORGAN PERFUSION TECHNIQUE ON LIVER MICROVASCULAR PRESERVATION IN A NON￾HEART-BEATING RAT MODEL 1. Transplantation. 2000; 69(1):20. PMID: 10653374\n22. Schlegel A, Kron P, De Oliveira ML, Clavien P-A, Dutkowski P. Is single portal vein approach sufficient\nfor hypothermic machine perfusion of DCD liver grafts? Journal of hepatology. 2016; 64(1):239–41.\nhttps://doi.org/10.1016/j.jhep.2015.09.015 PMID: 26432684\n23. Liu Q, Vekemans K, Iania L, Komuta M, Parkkinen J, Heedfeld V, et al. Assessing warm ischemic injury\nof pig livers at hypothermic machine perfusion. The Journal of surgical research. 2014; 186(1):379–89.\nhttps://doi.org/10.1016/j.jss.2013.07.034 PMID: 24035230\n24. Guarrera JV, Henry SD, Chen SW, Brown T, Nachber E, Arrington B, et al. Hypothermic machine pres￾ervation attenuates ischemia/reperfusion markers after liver transplantation: preliminary results. Journal\nof Surgical Research. 2011; 167(2):e365–e73. https://doi.org/10.1016/j.jss.2010.01.038 PMID:\n20451921\nEvolution of injury markers in hypothermic machine perfusion\nPLOS ONE | https://doi.org/10.1371/journal.pone.0203803 September 14, 2018 12 / 12\n\n"], "response": "This scientific paper titled \"Evolution of injury markers during hypothermic machine perfusion of livers from expanded criteria donors\" investigates the impact of hypothermic machine perfusion (HMP) on livers from expanded criteria donors (ECDs) with high levels of steatosis. The study aimed to determine whether HMP could mitigate the negative effects of ECD livers on post-transplant outcomes by reducing inflammation, oxidative stress, and apoptosis. The researchers conducted a prospective observational study involving 45 livers from ECDs, randomly assigned to either static cold storage (SCS) or HMP. They analyzed dynamic and biochemical parameters, including flow, vascular resistance, and enzyme release, as well as histological changes. The results showed that HMP reduced inflammation and oxidative stress markers, such as interleukin-6 and malondialdehyde, respectively. However, HMP did not significantly decrease apoptosis markers, such as caspase-3 and poly ADP ribose polymerase. Furthermore, HMP did not significantly change the histological scores for steatosis, ballooning degeneration, and lobular inflammation. The study suggests that HMP may help preserve ECD livers by reducing inflammation and oxidative stress, but more research is required to confirm its effectiveness in reducing apoptosis and improving post-transplant outcomes. Overall, the findings contribute to the ongoing debate about the suitability of ECD livers for transplantation and highlight the need for innovative preservation techniques like HMP."}
{"user_input": "How has machine perfusion changed risk thresholds associated with steatotic donor livers?", "retrieved_contexts": ["Skip to main content\nThank you for visiting nature.com. You are using a browser version\nwith limited support for CSS. To obtain the best experience, we\nrecommend you use a more up to date browser (or turn off\ncompatibility mode in Internet Explorer). In the meantime, to\nensure continued support, we are displaying the site without styles\nand JavaScript.\nAdvertisement\n[image]\n[image]\n•  View all journals\n•  \nSearch\n•  Log in\n•  Content Explore content\n•  About the journal\n•  Publish with us\n•  Subscribe\n•  Sign up for alerts\n•  RSS feed\n1. nature \n2. nature biotechnology \n3. perspectives \n4. article\nShow authors\n•  Perspective\n•  Published: 07 June 2017\n\n\nThe promise of organ and\ntissue preservation to\ntransform medicine\n•  Sebastian Giwa1,2,3 na1,\n•  Jedediah K Lewis\n1 na1,\n•  Luis Alvarez4,5,6,\n•  Robert Langer7,\n•  Alvin E Roth8,\n•  George M Church9,\n•  James F Markmann10,\n•  David H Sachs11,\n•  Anil Chandraker12,13,\n•  Jason A Wertheim  ORCID:\norcid.org/0000-0001-5680-106714,15,\n•  Martine Rothblatt16,\n•  Edward S Boyden17,\n•  Elling Eidbo18,\n•  W P Andrew Lee19,\n•  Bohdan Pomahac20,\n•  Gerald Brandacher19,\n•  David M Weinstock21,\n•  Gloria Elliott22,\n•  David Nelson23,\n•  Jason P Acker24,25,\n•  Korkut Uygun26,\n•  Boris Schmalz1,27,\n•  Brad P Weegman1,2,\n•  Alessandro Tocchio1,28,\n•  Greg M Fahy29,\n•  Kenneth B Storey30,\n•  Boris Rubinsky31,\n•  John Bischof32,\n•  Janet A W Elliott24,33,\n•  Teresa K Woodruff  ORCID:\norcid.org/0000-0002-1197-339934,\n•  G John Morris35,\n\n\n•  Utkan Demirci28,36,\n•  Kelvin G M Brockbank37,\n•  Erik J Woods3,25,38,\n•  Robert N Ben39,\n•  John G Baust40,\n•  Dayong Gao25,41,\n•  Barry Fuller42,\n•  Yoed Rabin43,\n•  David C Kravitz44,\n•  Michael J Taylor  ORCID:\norcid.org/0000-0002-8406-134X2,43,45 &\n•  …\n•  Mehmet Toner26 \nNature Biotechnology volume 35, pages 530–542 (2017)Cite this\narticle\n•  46k Accesses\n•  483 Citations\n•  255 Altmetric\n•  Metrics details\nSubjects\n•  Biological sciences\n•  Biomedical engineering\n•  Institutions\n•  Medical research\n•  Technology\nAbstract\nThe ability to replace organs and tissues on demand could save or\nimprove millions of lives each year globally and create public\nhealth benefits on par with curing cancer. Unmet needs for organ\nand tissue preservation place enormous logistical limitations on\n\n\ntransplantation, regenerative medicine, drug discovery, and a\nvariety of rapidly advancing areas spanning biomedicine. A growing\ncoalition of researchers, clinicians, advocacy organizations,\nacademic institutions, and other stakeholders has assembled to\naddress the unmet need for preservation advances, outlining\nremaining challenges and identifying areas of underinvestment and\nuntapped opportunities. Meanwhile, recent discoveries provide\nproofs of principle for breakthroughs in a family of research areas\nsurrounding biopreservation. These developments indicate that a\nnew paradigm, integrating multiple existing preservation\napproaches and new technologies that have flourished in the past\n10 years, could transform preservation research. Capitalizing on\nthese opportunities will require engagement across many research\nareas and stakeholder groups. A coordinated effort is needed to\nexpedite preservation advances that can transform several areas of\nmedicine and medical science.\n Access through your institution\nBuy or subscribe\nThis is a preview of subscription content, access via your institution\nAccess options\n Access through your institution\nAccess Nature and 54 other Nature Portfolio journals\nGet Nature+, our best-value online-access subscription\n$32.99 / 30 days\ncancel any time\nLearn more\nSubscribe to this journal\nReceive 12 print issues and online access\n\n\n$259.00 per year\nonly $21.58 per issue\nLearn more\nBuy this article\n•  Purchase on SpringerLink\n•  Instant access to full article PDF\nBuy now\nPrices may be subject to local taxes which are calculated during\ncheckout\nAdditional access options:\n•  Log in\n•  Learn about institutional subscriptions\n•  Read our FAQs\n•  Contact customer support\nFigure 1: The true lifesaving potential of organ transplantation.\n[image]\nFigure 2: The global unmet need for transplantation greatly\nexceeds that of the United States (see Fig. 1), which contains\nroughly 4% of the world's population but performs 25% of its\norgan transplants.\n[image]\nFigure 3: 10-year graft survival for each of the six vital organs\ncurrently transplanted (single-organ, deceased donor\ntransplant)49.\n[image]\nFigure 4: An integrated approach to organ and tissue\npreservation would combine multiple preservation conditions\nand temperature ranges, drawing on the strategies found in\nTable 4.\n[image]\n\n\nSimilar content being viewed by others\n[image]\nClinical applications of human organoids\nArticle 03 February 2025\n[image]\nEnduring questions in regenerative biology and the\nsearch for answers\nArticle Open access 09 November 2023\n[image]\nReshaping transplantation with AI, emerging\ntechnologies and xenotransplantation\nArticle 14 July 2025\nReferences\n1. Jones, B. & Bes, M. Keeping kidneys. Bull. World Health Organ.\n90, 718–719 (2012).\nArticle  Google Scholar \n2. Israni, A.K., Zaun, D., Rosendale, J.D., Snyder, J.J. & Kasiske,\nB.L. OPTN/SRTR 2012 Annual Data Report: deceased organ\ndonation. Am. J. Transplant. 14 (Suppl. 1), 167–183 (2014).\nArticle  PubMed  Google Scholar \n3. Hoyert, D.L. & Xu, J. Deaths: preliminary data for 2011. Natl.\nVital Stat. Rep. 61, 1–51 (2012).\nPubMed  Google Scholar \n4. Cooper, D.K. et al. Report of the Xenotransplantation\nAdvisory Committee of the International Society for Heart\n\n\nand Lung Transplantation: the present status of\nxenotransplantation and its potential role in the treatment of\nend-stage cardiac and pulmonary diseases. J. Heart Lung\nTransplant. 19, 1125–1165 (2000).\nArticle  CAS  PubMed  Google Scholar \n5. Evans, R.W. in Xenotransplantation (ed. Platt, J.L.) 29–51\n(American Society of Microbiology, 2001).\n6. Anonymous. Solving Organ Shortage through Organ Banking and\nBioengineering https://www.organpreservationalliance.org/\nroadmap (Organ Preservation Alliance, 2015).\n7. Lewis, J.K. et al. The grand challenges of organ banking:\nproceedings from the first global summit on complex tissue\ncryopreservation. Cryobiology 72, 169–182 (2016).\nArticle  PubMed  Google Scholar \n8. Fahy, G.M., Wowk, B. & Wu, J. Cryopreservation of complex\nsystems: the missing link in the regenerative medicine supply\nchain. Rejuvenation Res. 9, 279–291 (2006).\nArticle  CAS  PubMed  Google Scholar \n9. Rothblatt, M. Your Life or Mine: How Geoethics Can Resolve the\nConflict Between Public and Private Interests in\nXenotransplantation (Ashgate Publishing Company, 2004).\n10. Shimazono, Y. The state of the international organ trade: a\nprovisional picture based on integration of available\ninformation. Bull. World Health Organ. 85, 955–962 (2007).\nArticle  PubMed  PubMed Central  Google Scholar \n11. Anonymous. Second Global Consultation in Human\nTransplantation: Towards a Common Attitude to Transplantation\nhttp://apps.who.int/medicinedocs/documents/s15437e/\ns15437e.pdf (World Health Organization, 2007).\n12. International Summit on Transplant Tourism and Organ\n\n\nTrafficking. The declaration of Istanbul on organ trafficking\nand transplant tourism. Clin. J. Am. Soc. Nephrol. 3, 1227–\n1231 (2008).\n13. Anderson, J. Increasing Organ Donation Through Education.\nAAMC Report. (2014).\n14. Kumar, K. et al. A smartphone app for increasing live organ\ndonation. Am. J. Transplant. http://dx.doi.org/10.1111/\najt.13961 (2016).\n15. Loinaz, C. & González, E.M. Marginal donors in liver\ntransplantation. Hepatogastroenterology 47, 256–263 (2000).\nCAS  PubMed  Google Scholar \n16. Saidi, R.F. & Hejazii Kenari, S.K. Challenges of organ shortage\nfor transplantation: solutions and opportunities. Int. J. Organ\nTransplant. Med. 5, 87–96 (2014).\nCAS  PubMed  PubMed Central  Google Scholar \n17. Maggiore, U. et al. Strategies to increase the donor pool and\naccess to kidney transplantation: an international perspective.\nNephrol. Dial. Transplant. 30, 217–222 (2015).\nArticle  PubMed  Google Scholar \n18. Jadlowiec, C.C. & Taner, T. Liver transplantation: current\nstatus and challenges. World J. Gastroenterol. 22, 4438–4445\n(2016).\nArticle  CAS  PubMed  PubMed Central  Google Scholar \n19. Khademhosseini, A. & Langer, R. A decade of progress in\ntissue engineering. Nat. Protoc. 11, 1775–1781 (2016).\nArticle  CAS  PubMed  Google Scholar \n20. Yagi, H. et al. Human-scale whole-organ bioengineering for\nliver transplantation: a regenerative medicine approach. Cell\nTransplant. 22, 231–242 (2013).\n\n\nArticle  PubMed  Google Scholar \n21. Barkai, U. et al. Enhanced oxygen supply improves islet\nviability in a new bioartificial pancreas. Cell Transplant. 22,\n1463–1476 (2013).\nArticle  PubMed  Google Scholar \n22. Vagefi, P.A., Shah, J.A. & Sachs, D.H. Progress towards\ninducing tolerance of pig-to-primate xenografts. Int. J. Surg.\n23 Pt B, 291–295 (2015).\nArticle  PubMed  Google Scholar \n23. Reardon, S. New life for pig-to-human transplants. Nature\n527, 152–154 (2015).\nArticle  CAS  PubMed  Google Scholar \n24. Samadikuchaksaraei, A. Scientific and industrial status of\ntissue engineering. Afr. J. Biotechnol. 6, 2897–2909 (2007).\nArticle  CAS  Google Scholar \n25. Alvarez, L.M. Compendium of organ & tissue banking\nconcepts. DODlive http://science.dodlive.mil/files/2015/01/\nOrgan-and-Tissue-Banking-Compendium-2015-Jan.pdf\n(2015).\n26. Fahy, G.M. et al. Cryopreservation of organs by vitrification:\nperspectives and recent advances. Cryobiology 48, 157–178\n(2004).\nArticle  CAS  PubMed  Google Scholar \n27. Campbell, B.K. et al. Restoration of ovarian function and\nnatural fertility following the cryopreservation and\nautotransplantation of whole adult sheep ovaries. Hum.\nReprod. 29, 1749–1763 (2014).\nArticle  CAS  PubMed  PubMed Central  Google Scholar \n\n\n28. Arav, A. et al. Oocyte recovery, embryo development and\novarian function after cryopreservation and transplantation of\nwhole sheep ovary. Hum. Reprod. 20, 3554–3559 (2005).\nArticle  CAS  PubMed  Google Scholar \n29. Larson, D.J. et al. Wood frog adaptations to overwintering in\nAlaska: new limits to freezing tolerance. J. Exp. Biol. 217,\n2193–2200 (2014).\nArticle  PubMed  Google Scholar \n30. Storey, K.B. & Storey, J.M. Metabolic rate depression in\nanimals: transcriptional and translational controls. Biol. Rev.\nCamb. Philos. Soc. 79, 207–233 (2004).\nArticle  PubMed  Google Scholar \n31. Storey, K.B. & Storey, J.M. Metabolic rate depression: the\nbiochemistry of mammalian hibernation. Adv. Clin. Chem. 52,\n77–108 (2010).\nArticle  CAS  PubMed  Google Scholar \n32. Storey, K.B. & Storey, J.M. Tribute to P. L. Lutz: putting life\non 'pause'--molecular regulation of hypometabolism. J. Exp.\nBiol. 210, 1700–1714 (2007).\nArticle  CAS  PubMed  Google Scholar \n33. Wszola, M. et al. One-year results of a prospective,\nrandomized trial comparing two machine perfusion devices\nused for kidney preservation. Transpl. Int. 26, 1088–1096\n(2013).\nArticle  PubMed  Google Scholar \n34. Guarrera, J.V. et al. Hypothermic machine preservation in\nhuman liver transplantation: the first clinical series. Am. J.\nTransplant. 10, 372–381 (2010).\nArticle  CAS  PubMed  Google Scholar \n\n\n35. Moers, C., Pirenne, J., Paul, A. & Ploeg, R.J. Machine\nperfusion or cold storage in deceased-donor kidney\ntransplantation. N. Engl. J. Med. 366, 770–771 (2012).\nArticle  CAS  PubMed  Google Scholar \n36. Cypel, M. et al. Experience with the first 50 ex vivo lung\nperfusions in clinical transplantation. J. Thorac. Cardiovasc.\nSurg. 144, 1200–1207 (2012).\nArticle  PubMed  Google Scholar \n37. Machuca, T.N. & Cypel, M. Ex vivo lung perfusion. J. Thorac.\nDis. 6, 1054–1062 (2014).\nPubMed  PubMed Central  Google Scholar \n38. Messer, S., Ardehali, A. & Tsui, S. Normothermic donor heart\nperfusion: current clinical experience and the future. Transpl.\nInt. 28, 634–642 (2015).\nArticle  PubMed  Google Scholar \n39. Berendsen, T.A. et al. A simplified subnormothermic machine\nperfusion system restores ischemically damaged liver grafts in\na rat model of orthotopic liver transplantation. Transplant.\nRes. 1, 6 (2012).\nArticle  PubMed  PubMed Central  Google Scholar \n40. Berendsen, T.A. et al. Supercooling enables long-term\ntransplantation survival following 4 days of liver\npreservation. Nat. Med. 20, 790–793 (2014).\nArticle  CAS  PubMed  PubMed Central  Google Scholar \n41. Ravikumar, R., Leuvenink, H. & Friend, P.J. Normothermic\nliver preservation: a new paradigm? Transpl. Int. 28, 690–699\n(2015).\nArticle  CAS  PubMed  Google Scholar \n\n\n42. Rana, A. et al. Survival benefit of solid-organ transplant in the\nUnited States. JAMA Surg. 150, 252–259 (2015).\nArticle  PubMed  Google Scholar \n43. Calne, R.Y. et al. Cyclosporin A in patients receiving renal\nallografts from cadaver donors. Lancet 312, 1323–1327\n(1978).\nArticle  Google Scholar \n44. Dubernard, J.M. et al. Human hand allograft: report on first 6\nmonths. Lancet 353, 1315–1320 (1999).\nArticle  CAS  PubMed  Google Scholar \n45. Dubernard, J.M. et al. Functional results of the first human\ndouble-hand transplantation. Ann. Surg. 238, 128–136\n(2003).\nPubMed  PubMed Central  Google Scholar \n46. Devauchelle, B. et al. First human face allograft: early report.\nLancet 368, 203–209 (2006).\nArticle  PubMed  Google Scholar \n47. Scandling, J.D. et al. Tolerance and chimerism after renal and\nhematopoietic-cell transplantation. N. Engl. J. Med. 358, 362–\n368 (2008).\nArticle  CAS  PubMed  Google Scholar \n48. Scandling, J.D., Busque, S., Shizuru, J.A., Engleman, E.G. &\nStrober, S. Induced immune tolerance for kidney\ntransplantation. N. Engl. J. Med. 365, 1359–1360 (2011).\nArticle  CAS  PubMed  PubMed Central  Google Scholar \n49. Leventhal, J.R. et al. Immune reconstitution/\nimmunocompetence in recipients of kidney plus\nhematopoietic stem/facilitating cell transplants.\n\n\nTransplantation 99, 288–298 (2015).\nArticle  CAS  PubMed  Google Scholar \n50. Szabolcs, P., Burlingham, W.J. & Thomson, A.W. Tolerance\nafter solid organ and hematopoietic cell transplantation. Biol.\nBlood Marrow Transplant. 18 (Suppl.), S193–S200 (2012).\nArticle  PubMed  PubMed Central  Google Scholar \n51. Goldberg, D., French, B., Abt, P., Feng, S. & Cameron, A.M.\nIncreasing disparity in waitlist mortality rates with increased\nmodel for end-stage liver disease scores for candidates with\nhepatocellular carcinoma versus candidates without\nhepatocellular carcinoma. Liver Transpl. 18, 434–443 (2012).\nArticle  PubMed  Google Scholar \n52. Lai, J.C. et al. Frailty predicts waitlist mortality in liver\ntransplant candidates. Am. J. Transplant. 14, 1870–1879\n(2014).\nArticle  CAS  PubMed  PubMed Central  Google Scholar \n53. Anonymous. Organ Procurement and Transplantation\nNetwork (OPTN). National Data Reports. US Dept. of Health\nand Human Services https://optn.transplant.hrsa.gov/data/\nview-data-reports/national-data/ (accessed 8 July 2016).\n54. Knechtle, S.J. et al. Renal transplantation at the University of\nWisconsin in the cyclosporine era. Clin. Transpl. 211–218\n(1993).\n55. Knoll, G. Trends in kidney transplantation over the past\ndecade. Drugs 68 (Suppl. 1), 3–10 (2008).\nArticle  PubMed  Google Scholar \n56. Dunn, J. et al. Causes of graft loss beyond two years in the\ncyclosporine era. Transplantation 49, 349–353 (1990).\nArticle  CAS  PubMed  Google Scholar \n\n\n57. Anonymous. in OPTN/SRTR Annual Report 2011 https://\nsrtr.transplant.hrsa.gov/annual_reports/2011/\npdf/2011_SRTR_ADR.pdf (US Department of Health and\nHuman Services, 2011).\n58. Morrissey, P.E., Flynn, M.L. & Lin, S. Medication\nnoncompliance and its implications in transplant recipients.\nDrugs 67, 1463–1481 (2007).\nArticle  PubMed  Google Scholar \n59. Ladner, D.P. & Mehrotra, S. Methodological challenges in\nsolving geographic disparity in liver allocation. JAMA Surg.\n151, 109–110 (2016).\nArticle  PubMed  Google Scholar \n60. Saunders, M.R. et al. Racial disparities in reaching the renal\ntransplant waitlist: is geography as important as race? Clin.\nTransplant. 29, 531–538 (2015).\nArticle  PubMed  PubMed Central  Google Scholar \n61. Arce, C.M., Goldstein, B.A., Mitani, A.A., Lenihan, C.R. &\nWinkelmayer, W.C. Differences in access to kidney\ntransplantation between Hispanic and non-Hispanic whites by\ngeographic location in the United States. Clin. J. Am. Soc.\nNephrol. 8, 2149–2157 (2013).\nArticle  PubMed  PubMed Central  Google Scholar \n62. Thabut, G. et al. Geographic disparities in access to lung\ntransplantation before and after implementation of the lung\nallocation score. Am. J. Transplant. 12, 3085–3093 (2012).\nArticle  CAS  PubMed  Google Scholar \n63. Lysaght, M.J. Maintenance dialysis population dynamics:\ncurrent trends and long-term implications. J. Am. Soc.\nNephrol. 13 (Suppl. 1), S37–S40 (2002).\nPubMed  Google Scholar \n\n\n64. Collins, A.J et al. United States Renal Data System 2011\nAnnual Data Report: Atlas of chronic kidney disease and end-\nstage renal disease in the United States. Am. J. Kidney Dis. 59\n(Suppl. 1) A7, e1-420 (2012).\n65. Bruinsma, B.G. et al. Supercooling preservation and\ntransplantation of the rat liver. Nat. Protoc. 10, 484–494\n(2015).\nArticle  CAS  PubMed  PubMed Central  Google Scholar \n66. Bruinsma, B.G. et al. Subnormothermic machine perfusion for\nex vivo preservation and recovery of the human liver for\ntransplantation. Am. J. Transplant. 14, 1400–1409 (2014).\nArticle  CAS  PubMed  PubMed Central  Google Scholar \n67. Vogel, T., Brockmann, J.G. & Friend, P.J. Ex-vivo\nnormothermic liver perfusion: an update. Curr. Opin. Organ\nTransplant. 15, 167–172 (2010).\nArticle  PubMed  Google Scholar \n68. Fahy, G.M. et al. Physical and biological aspects of renal\nvitrification. Organogenesis 5, 167–175 (2009).\nArticle  PubMed  PubMed Central  Google Scholar \n69. Bentley, T.S. 2014 US Organ and Tissue Transplant Cost\nEstimates and Discussion (Milliman, 2014).\n70. Abboudi, H. & Macphee, I.A. Individualized\nimmunosuppression in transplant patients: potential role of\npharmacogenetics. Pharmgenomics Pers. Med. 5, 63–72 (2012).\nCAS  PubMed  PubMed Central  Google Scholar \n71. Schwartz, A., Schiano, T., Kim-Schluger, L. & Florman, S.\nGeographic disparity: the dilemma of lower socioeconomic\nstatus, multiple listing, and death on the liver transplant\nwaiting list. Clin. Transplant. 28, 1075–1079 (2014).\n\n\nArticle  PubMed  Google Scholar \n72. Brierley, J. & Hasan, A. Aspects of deceased organ donation\nin paediatrics. Br. J. Anaesth. 108 (Suppl. 1), i92–i95 (2012).\nArticle  PubMed  Google Scholar \n73. Vranic, G.M., Ma, J.Z. & Keith, D.S. The role of minority\ngeographic distribution in waiting time for deceased donor\nkidney transplantation. Am. J. Transplant. 14, 2526–2534\n(2014).\nArticle  CAS  PubMed  PubMed Central  Google Scholar \n74. Sack, K. In discarding of kidneys, system reveals its flaws. The\nNew York Times http://www.nytimes.com/2012/09/20/\nhealth/transplant-experts-blame-allocation-system-for-\ndiscarding-kidneys.html (19 September, 2012).\n75. Matas, A.J. OPTN/SRTR 2013 Annual Data Report: kidney.\nAm. J. Transplant. 15 (Suppl. 2), 1–34 (2015).\nArticle  PubMed  Google Scholar \n76. Wigfield, C.H. et al. Successful emergent lung transplantation\nafter remote ex vivo perfusion optimization and\ntransportation of donor lungs. Am. J. Transplant. 12, 2838–\n2844 (2012).\nArticle  CAS  PubMed  Google Scholar \n77. Vilca Melendez, H., Rela, M., Murphy, G. & Heaton, N.\nAssessment of graft function before liver transplantation:\nquest for the lost ark? Transplantation 70, 560–565 (2000).\nArticle  CAS  PubMed  Google Scholar \n78. Burdelski, M. et al. Evaluation of quantitative liver function\ntests in liver donors. Transplant. Proc. 19, 3838–3839 (1987).\nCAS  PubMed  Google Scholar \n\n\n79. Khush, K.K., Menza, R., Nguyen, J., Zaroff, J.G. & Goldstein,\nB.A. Donor predictors of allograft use and recipient outcomes\nafter heart transplantation. Circ Heart Fail 6, 300–309 (2013).\nArticle  PubMed  PubMed Central  Google Scholar \n80. Hoffmann, T. & Minor, T. New strategies and concepts in\norgan preservation. Eur. Surg. Res. 54, 114–126 (2015).\nArticle  CAS  PubMed  Google Scholar \n81. Reddy, S.P., Brockmann, J. & Friend, P.J. Normothermic\nperfusion: a mini-review. Transplantation 87, 631–632 (2009).\nArticle  PubMed  PubMed Central  Google Scholar \n82. Cypel, M., Yeung, J.C. & Keshavjee, S. Novel approaches to\nexpanding the lung donor pool: donation after cardiac death\nand ex vivo conditioning. Clin. Chest Med. 32, 233–244\n(2011).\nArticle  PubMed  Google Scholar \n83. Lv, X., Tan, J., Liu, D., Wu, P. & Cui, X. Intratracheal\nadministration of p38α short-hairpin RNA plasmid\nameliorates lung ischemia-reperfusion injury in rats. J. Heart\nLung Transplant. 31, 655–662 (2012).\nArticle  PubMed  Google Scholar \n84. Jamieson, R.W. & Friend, P.J. Organ reperfusion and\npreservation. Front. Biosci. 13, 221–235 (2008).\nArticle  CAS  PubMed  Google Scholar \n85. Mohamed, M.S.A. Translational insights on lung\ntransplantation: learning from immunology. Iran. J. Immunol.\n12, 156–165 (2015).\nPubMed  Google Scholar \n86. Cypel, M. et al. Functional repair of human donor lungs by\n\n\nIL-10 gene therapy. Sci. Transl. Med. 1, 4ra9 (2009).\nArticle  CAS  PubMed  Google Scholar \n87. Hosgood, S.A., van Heurn, E. & Nicholson, M.L.\nNormothermic machine perfusion of the kidney: better\nconditioning and repair? Transpl. Int. 28, 657–664 (2015).\nArticle  PubMed  Google Scholar \n88. Xue, M. et al. Donor liver steatosis: a risk factor for early\nnew-onset diabetes after liver transplantation. J. Diabetes\nInvestig. 8, 181–187 (2017).\nArticle  PubMed  Google Scholar \n89. Avolio, A.W. et al. Successful use of extended criteria donor\ngrafts with low to moderate steatosis in patients with model\nfor end-stage liver disease scores below 27. Transplant. Proc.\n41, 208–212 (2009).\nArticle  CAS  PubMed  Google Scholar \n90. Bruinsma, B.G. et al. Metabolic profiling during ex vivo\nmachine perfusion of the human liver. Sci. Rep. 6, 22415\n(2016).\nArticle  CAS  PubMed  PubMed Central  Google Scholar \n91. Whitson, B.A. & Black, S.M. Organ assessment and repair\ncenters: The future of transplantation is near. World J.\nTransplant. 4, 40–42 (2014).\nArticle  PubMed  PubMed Central  Google Scholar \n92. Shah, M.R., Starling, R.C., Schwartz Longacre, L. & Mehra,\nM.R. Heart transplantation research in the next decade—a\ngoal to achieving evidence-based outcomes: National Heart,\nLung, And Blood Institute Working Group. J. Am. Coll.\nCardiol. 59, 1263–1269 (2012).\nArticle  PubMed  PubMed Central  Google Scholar \n\n\n93. Perk, S. et al. A metabolic index of ischemic injury for\nperfusion-recovery of cadaveric rat livers. PLoS One 6, e28518\n(2011).\nArticle  CAS  PubMed  PubMed Central  Google Scholar \n94. Cypel, M. & Keshavjee, S. The clinical potential of ex vivo\nlung perfusion. Expert Rev. Respir. Med. 6, 27–35 (2012).\nArticle  PubMed  Google Scholar \n95. van Smaalen, T.C., Hoogland, E.R.P. & van Heurn, L.W.E.\nMachine perfusion viability testing. Curr. Opin. Organ\nTransplant. 18, 168–173 (2013).\nArticle  CAS  PubMed  Google Scholar \n96. Machuca, T.N. et al. Protein expression profiling predicts\ngraft performance in clinical ex vivo lung perfusion. Ann.\nSurg. 261, 591–597 (2015).\nArticle  PubMed  Google Scholar \n97. US Centers for Disease Control and Prevention. Investigation\nof rabies infections in organ donor and transplant recipients—\nAlabama, Arkansas, Oklahoma, and Texas, 2004. MMWR\nMorb. Mortal. Wkly. Rep. 53, 586–589 (2004).\n98. Anonymous. CDC confirms rabies death in organ transplant\nrecipient. CDC Newsroom https://www.cdc.gov/media/\nreleases/2013/s0315_rabies_organs.html (2013).\n99. Anonymous. HIV transmitted from a living organ donor—\nNew York City, 2009. MMWR Morb. Mortal. Wkly. Rep. 60,\n297–301 (2011).\n100. Fishman, J.A. & Grossi, P.A. Donor-derived infection—the\nchallenge for transplant safety. Nat. Rev. Nephrol. 10, 663–\n672 (2014).\nArticle  PubMed  PubMed Central  Google Scholar \n\n\n101. Lee, J.C. & Christie, J.D. Primary graft dysfunction. Clin. Chest\nMed. 32, 279–293 (2011).\nArticle  PubMed  Google Scholar \n102. Chen, X.-B. & Xu, M.-Q. Primary graft dysfunction after liver\ntransplantation. Hepatobiliary Pancreat. Dis. Int. 13, 125–137\n(2014).\nArticle  CAS  PubMed  Google Scholar \n103. Kobashigawa, J. et al. Report from a consensus conference on\nprimary graft dysfunction after cardiac transplantation. J.\nHeart Lung Transplant. 33, 327–340 (2014).\nArticle  PubMed  Google Scholar \n104. Mendelson, K.G. & Fallat, M.E. Pediatric injuries: prevention\nto resolution. Surg. Clin. North Am. 87, 207–228, viii (2007).\nArticle  PubMed  Google Scholar \n105. Ashlagi, I., Gilchrist, D.S., Roth, A.E. & Rees, M.A.\nNonsimultaneous chains and dominos in kidney-paired\ndonation—revisited. Am. J. Transplant. 11, 984–994 (2011).\nArticle  CAS  PubMed  Google Scholar \n106. Anderson, R., Ashlagi, I., Gamarnik, D. & Roth, A.E. Finding\nlong chains in kidney exchange using the traveling salesman\nproblem. Proc. Natl. Acad. Sci. USA 112, 663–668 (2015).\nArticle  CAS  PubMed  PubMed Central  Google Scholar \n107. Cowan, P.J. & Tector, A.J. The resurgence of\nxenotransplantation. Am. J. Transplant. http://\ndx.doi.org/10.1111/ajt.14311 (2017).\n108. Anonymous. Advancing Tissue Science and Engineering https://\nwebarchive.library.unt.edu/eot2008/20080916012251/\nhttp://tissueengineering.gov/\nadvancing_tissue_science_&_engineering.pdf (Multi-Agency\n\n\nTissue Engineering Sciences (MATES) Interagency Working\nGroup, 2007).\n109. Anonymous. Funding opportunity announcement: Advanced\nTissue Biofabrication Manufacturing Innovation Institute (ATB-\nMII) https://www.grants.gov/web/grants/view-\nopportunity.html?oppId=284612 (US Dept. of Defense, Dept.\nof the Army—Materiel Command, 2016).\n110. Bradbury, J. Of tardigrades, trehalose, and tissue engineering.\nLancet 358, 392 (2001).\nArticle  CAS  PubMed  Google Scholar \n111. Ratner, B. What are the opportunities in the field of tissue\nengineering/regenerative medicine? Workshop on tissue\nengineering and regenerative medicine. (US Department of\nHealth and Human Services, 28 March 2003).\n112. Kilbride, P. et al. Spatial considerations during\ncryopreservation of a large volume sample. Cryobiology 73,\n47–54 (2016).\nArticle  CAS  PubMed  PubMed Central  Google Scholar \n113. Pondrom, S. White House holds summit on organ\ntransplantation. Am. J. Transplant. 16, 2241–2242 (2016).\nArticle  PubMed  Google Scholar \n114. Jeruss, J.S. & Woodruff, T.K. Preservation of fertility in\npatients with cancer. N. Engl. J. Med. 360, 902–911 (2009).\nArticle  CAS  PubMed  PubMed Central  Google Scholar \n115. De Vos, M., Smitz, J. & Woodruff, T.K. Fertility preservation\nin women with cancer. Lancet 384, 1302–1310 (2014).\nArticle  PubMed  PubMed Central  Google Scholar \n116. Tomao, F. et al. Special issues in fertility preservation for\ngynecologic malignancies. Crit. Rev. Oncol. Hematol. 97, 206–\n\n\n219 (2016).\nArticle  PubMed  Google Scholar \n117. Letourneau, J.M. et al. Acute ovarian failure underestimates\nage-specific reproductive impairment for young women\nundergoing chemotherapy for cancer. Cancer 118, 1933–1939\n(2012).\nArticle  PubMed  Google Scholar \n118. Woodruff, T.K. The emergence of a new interdiscipline:\noncofertility. Cancer Treat. Res. 138, 3–11 (2007).\nArticle  PubMed  Google Scholar \n119. Grazul-Bilska, A.T. et al. Morphology and function of\ncryopreserved whole ovine ovaries after heterotopic\nautotransplantation. Reprod. Biol. Endocrinol. 6, 16 (2008).\nArticle  CAS  PubMed  PubMed Central  Google Scholar \n120. Courbiere, B. et al. Difficulties improving ovarian functional\nrecovery by microvascular transplantation and whole ovary\nvitrification. Fertil. Steril. 91, 2697–2706 (2009).\nArticle  PubMed  Google Scholar \n121. Donnez, J. & Dolmans, M.-M. Fertility preservation in women.\nNat. Rev. Endocrinol. 9, 735–749 (2013).\nArticle  CAS  PubMed  Google Scholar \n122. Donnez, J. et al. Ovarian tissue cryopreservation and\ntransplantation: a review. Hum. Reprod. Update 12, 519–535\n(2006).\nArticle  PubMed  Google Scholar \n123. Donnez, J. & Dolmans, M.-M. Transplantation of ovarian\ntissue. Best Pract. Res. Clin. Obstet. Gynaecol. 28, 1188–1197\n(2014).\n\n\nArticle  PubMed  Google Scholar \n124. Anonymous. Cancer Treatment and Survivorship: Facts & Figures\n2014–2015. Special Section: Cancer in Children & Adolescents\nhttps://www.cancer.org/content/dam/cancer-org/research/\ncancer-facts-and-statistics/cancer-treatment-and-survivorship-\nfacts-and-figures/cancer-treatment-and-survivorship-facts-\nand-figures-2014-2015.pdf (American Cancer Society, 2014).\n125. US Department of Health & Human Services. HHS boosts\nstockpile of products to treat acute radiation syndrome.\nEMSWORLD http://www.emsworld.com/news/11178384/\nhhs-boosts-stockpile-of-products-to-treat-acute-radiation-\nsyndrome (26 September 2013).\n126. Stewart, D.L. Preparing Communities for Nuclear Terrorism\nhttps://e-reports-ext.llnl.gov/pdf/761273.pdf (Lawrence\nLivermore National Laboratory, 2013).\n127. Knebel, A.R. et al. Allocation of scarce resources after a\nnuclear detonation: setting the context. Disaster Med. Public\nHealth Prep. 5 (Suppl. 1), S20–S31 (2011).\nArticle  PubMed  Google Scholar \n128. Ben-Bassat, H. Performance and safety of skin allografts. Clin.\nDermatol. 23, 365–375 (2005).\nArticle  PubMed  Google Scholar \n129. Crosse, M. National Preparedness: Countermeasures for Thermal\nBurns GAO-12–304 http://www.gao.gov/\nassets/590/588738.pdf (US Government Accountability\nOffice, 2012).\n130. Anonymous. On-demand cell and tissue biologics for mass\ncasualty response. A16-050 http://www.acq.osd.mil/osbp/\nsbir/solicitations/sbir20161/army161.pdf (Army SBIR, 2016).\n131. de Graaf, I.A.M. et al. Preparation and incubation of\nprecision-cut liver and intestinal slices for application in drug\nmetabolism and toxicity studies. Nat. Protoc. 5, 1540–1551\n\n\n(2010).\nArticle  CAS  PubMed  Google Scholar \n132. Shu, Z., Heimfeld, S. & Gao, D. Hematopoietic SCT with\ncryopreserved grafts: adverse reactions after transplantation\nand cryoprotectant removal before infusion. Bone Marrow\nTransplant. 49, 469–476 (2014).\nArticle  CAS  PubMed  Google Scholar \n133. Ziegler-Graham, K., MacKenzie, E.J., Ephraim, P.L., Travison,\nT.G. & Brookmeyer, R. Estimating the prevalence of limb loss\nin the United States: 2005 to 2050. Arch. Phys. Med. Rehabil.\n89, 422–429 (2008).\nArticle  PubMed  Google Scholar \n134. Kueckelhaus, M. et al. Vascularized composite\nallotransplantation: current standards and novel approaches\nto prevent acute rejection and chronic allograft deterioration.\nTranspl. Int. 29, 655–662 (2016).\nArticle  PubMed  Google Scholar \n135. Zachariassen, K.E. & Kristiansen, E. Ice nucleation and\nantinucleation in nature. Cryobiology 41, 257–279 (2000).\nArticle  CAS  PubMed  Google Scholar \n136. Barbas, A.S., Goldaracena, N., Dib, M.J. & Selzner, M. Ex-vivo\nliver perfusion for organ preservation: Recent advances in the\nfield. Transplant. Rev. (Orlando) 30, 154–160 (2016).\nArticle  CAS  Google Scholar \n137. Niemann, C.U. & Malinoski, D. Therapeutic hypothermia in\ndeceased organ donors and kidney-graft function. N. Engl. J.\nMed. 373, 2687 (2015).\nArticle  CAS  PubMed  Google Scholar \n\n\n138. Schnuelle, P. et al. Effects of donor pretreatment with\ndopamine on graft function after kidney transplantation: a\nrandomized controlled trial. J. Am. Med. Assoc. 302, 1067–\n1075 (2009).\nArticle  CAS  Google Scholar \n139. Singbartl, K. et al. Intensivist-led management of brain-dead\ndonors is associated with an increase in organ recovery for\ntransplantation. Am. J. Transplant. 11, 1517–1521 (2011).\nArticle  CAS  PubMed  Google Scholar \n140. Lee, J.H. et al. Highly multiplexed subcellular RNA\nsequencing in situ. Science 343, 1360–1363 (2014).\nArticle  CAS  PubMed  PubMed Central  Google Scholar \n141. Chen, K.H., Boettiger, A.N., Moffitt, J.R., Wang, S. & Zhuang,\nX. RNA imaging. Spatially resolved, highly multiplexed RNA\nprofiling in single cells. Science 348, aaa6090 (2015).\nArticle  CAS  PubMed  PubMed Central  Google Scholar \n142. Chung, K. et al. Structural and molecular interrogation of\nintact biological systems. Nature 497, 332–337 (2013).\nArticle  CAS  PubMed  PubMed Central  Google Scholar \n143. Sharp, P. Meeting global challenges: discovery and innovation\nthrough convergence. Science 346, 1468–1471 (2014).\nArticle  CAS  Google Scholar \n144. Huang, Y., Williams, J.C. & Johnson, S.M. Brain slice on a\nchip: opportunities and challenges of applying microfluidic\ntechnology to intact tissues. Lab Chip 12, 2103–2117 (2012).\nArticle  CAS  PubMed  Google Scholar \n145. Manuchehrabadi, N. et al. Improved tissue cryopreservation\nusing inductive heating of magnetic nanoparticles. Sci. Transl.\n\n\nMed. 9, eaah4586 (2017).\nArticle  CAS  PubMed  PubMed Central  Google Scholar \n146. Bischof, J. 11. Nanowarming: a new concept in tissue and\norgan preservation. Cryobiology 71, 167 (2015).\nArticle  Google Scholar \n147. Boyden, E.S. A history of optogenetics: the development of\ntools for controlling brain circuits with light. F1000 Biol. Rep.\n3, 11 (2011).\nArticle  PubMed  PubMed Central  Google Scholar \n148. Zhang, F. et al. The microbial opsin family of optogenetic\ntools. Cell 147, 1446–1457 (2011).\nArticle  CAS  PubMed  PubMed Central  Google Scholar \n149. Mali, P. et al. RNA-guided human genome engineering via\nCas9. Science 339, 823–826 (2013).\nArticle  CAS  PubMed  PubMed Central  Google Scholar \n150. Cong, L. et al. Multiplex genome engineering using CRISPR/\nCas systems. Science 339, 819–823 (2013).\nArticle  CAS  PubMed  PubMed Central  Google Scholar \n151. Mojica, F.J.M., Díez-Villaseñor, C., García-Martínez, J. &\nSoria, E. Intervening sequences of regularly spaced\nprokaryotic repeats derive from foreign genetic elements. J.\nMol. Evol. 60, 174–182 (2005).\nArticle  CAS  PubMed  Google Scholar \n152. Jinek, M. et al. A programmable dual-RNA-guided DNA\nendonuclease in adaptive bacterial immunity. Science 337,\n816–821 (2012).\nArticle  CAS  PubMed  PubMed Central  Google Scholar \n\n\n153. Liu, Y. et al. Genomic analysis of miRNAs in an extreme\nmammalian hibernator, the Arctic ground squirrel. Physiol.\nGenomics 42A, 39–51 (2010).\nArticle  CAS  PubMed  Google Scholar \n154. Hashimoto, T. et al. Extremotolerant tardigrade genome and\nimproved radiotolerance of human cultured cells by\ntardigrade-unique protein. Nat. Commun. 7, 12808 (2016).\nArticle  CAS  PubMed  PubMed Central  Google Scholar \n155. Limkemann, A. et al. Donor gluconate rescues livers from\nuncontrolled donation after cardiac death. Surgery 159, 852–\n861 (2016).\nArticle  PubMed  Google Scholar \n156. Parrish, D. et al. New low-volume resuscitation solutions\ncontaining PEG-20k. J. Trauma Acute Care Surg. 79, 22–29\n(2015).\nArticle  CAS  PubMed  PubMed Central  Google Scholar \n157. Magliocca, J.F. et al. Extracorporeal support for organ\ndonation after cardiac death effectively expands the donor\npool. J. Trauma 58, 1095–1102 (2005).\nArticle  PubMed  Google Scholar \n158. Brasile, L. et al. Overcoming severe renal ischemia: the role of\nex vivo warm perfusion. Transplantation 73, 897–901 (2002).\nArticle  PubMed  Google Scholar \n159. Sharp, P., Jacks, T. & Hockfield, S. Convergence: The Future of\nHealth http://www.convergencerevolution.net/2016-report/\n(Massachusetts Institute of Technology, 2016).\n160. Nelson, D.P. Donor Management Research Consensus\nConference. Int. Soc. Heart Lung Transplant. Links Newsletter 5\nhttps://www.ishlt.org/\n\n\nContentDocuments/2013Nov_Links.html (November 2013).\n161. White House. Fact sheet: Obama administration announces\nkey actions to reduce the organ waiting list https://\nobamawhitehouse.archives.gov/the-press-office/2016/06/13/\nfact-sheet-obama-administration-announces-key-actions-\nreduce-organ (2016).\n162. Anonymous. A strategic plan to improve organ and tissue\ndonation and transplantation performance for Canadians https://\nblood.ca/sites/default/files/otdt-indx-final-c2a.pdf (Canadian\nBlood Services, 2011).\n163. Anonymous. Cryopreservation for regenerative medical\napplications. A15-059 http://www.acq.osd.mil/osbp/sbir/\nsolicitations/sbir20151/army151.pdf (Army SBIR, 2015).\n164. Anonymous. Optimal rewarming solutions for cryopreserved\ntissue systems. DHP15–014. SBIRSourcehttps://\nsbirsource.com/sbir/topics/91484 (2015).\n165. Anonymous. Optimization of cryoprotectants,\ncryotherapeutics, and protocols for cryopreservation of large\ntissue systems. DHP15–013 http://www.acq.osd.mil/osbp/\nsbir/solicitations/sbir20151/dhp151.pdf (Defense Health\nProgram SBIR, 2015).\n166. Anonymous. Conservation and maintenance of trauma injured\ntissues for autologous repair and reconstruction. A16-049\nhttp://www.acq.osd.mil/osbp/sbir/solicitations/sbir20161/\narmy161.pdf (Army SBIR, 2016).\n167. Anonymous. Genitourinary tissue repair, restoration and\nprotection: preserving fertility and function in wounded\nwarriors. DHP16–012 http://www.acq.osd.mil/osbp/sbir/\nsolicitations/sbir20161/dhp161.pdf(Defense Health Program\nSBIR, 2016).\n168. Mathew, J. & Kratzke, R.A. Lung cancer and lung\ntransplantation: a review. J. Thorac. Oncol. 4, 753–760\n(2009).\n\n\nArticle  PubMed  Google Scholar \n169. Anonymous. How organs are matched. UNOS https://\nwww.unos.org/transplantation/matching-organs/?\ngclid=CjwKEAjwsuK_BRDD9ISR1bawwUwSJACbOiixRLbb3ISa3IAx_O\n(accessed: 13 October 2016).\n170. Khush, K.K., Zaroff, J.G., Nguyen, J., Menza, R. & Goldstein,\nB.A. National decline in donor heart utilization with regional\nvariability: 1995-2010. Am. J. Transplant. 15, 642–649\n(2015).\nArticle  CAS  PubMed  PubMed Central  Google Scholar \n171. Waselenko, J.K. et al. Medical management of the acute\nradiation syndrome: recommendations of the Strategic\nNational Stockpile Radiation Working Group. Ann. Intern.\nMed. 140, 1037–1051 (2004).\nArticle  PubMed  Google Scholar \n172. Anonymous. Blood marrow and cord blood donation and\ntransplantation. HRSA http://bloodcell.transplant.hrsa.gov/\n(accessed: 1 January 2016).\n173. Carbone, L. What Animals Want: Expertise and Advocacy in\nLaboratory Animal Welfare Policy (Oxford University Press,\n2004).\n174. Rogers, J., Carolin, T., Vaught, J. & Compton, C.\nBiobankonomics: a taxonomy for evaluating the economic\nbenefits of standardized centralized human biobanking for\ntranslational research. J. Natl. Cancer Inst. Monogr. 2011, 32–\n38 (2011).\nArticle  PubMed  Google Scholar \n175. Dragunow, M. The adult human brain in preclinical drug\ndevelopment. Nat. Rev. Drug Discov. 7, 659–666 (2008).\nArticle  CAS  PubMed  Google Scholar \n\n\n176. Anonymous. Burn incidence and treatment in the United\nStates: 2016. American Burn Association http://\nwww.ameriburn.org/resources_factsheet.php (accessed: 1\nJanuary 2016).\n177. DiCarlo, A.L. et al. Radiation injury after a nuclear\ndetonation: medical consequences and the need for scarce\nresources allocation. Disaster Med. Public Health Prep. 5\n(Suppl. 1), S32–S44 (2011).\nArticle  PubMed  PubMed Central  Google Scholar \n178. Anonymous. 2020: A New Vision. A Future for Regenerative\nMedicine https://medicine.osu.edu/regenerativemedicine/\ndocuments/2020vision.pdf (Interagency Federal Working\nGroup on Regenerative Medicine, 2005).\n179. Hay, M., Thomas, D.W., Craighead, J.L., Economides, C. &\nRosenthal, J. Clinical development success rates for\ninvestigational drugs. Nat. Biotechnol. 32, 40–51 (2014).\nArticle  CAS  PubMed  Google Scholar \n180. Cummings, J.L., Morstorf, T. & Zhong, K. Alzheimer's disease\ndrug-development pipeline: few candidates, frequent failures.\nAlzheimers Res. Ther. 6, 37 (2014).\nArticle  PubMed  PubMed Central  Google Scholar \n181. Taylor, M.J. et al. Asanguineous whole body perfusion with a\nnew intracellular acellular solution and ultraprofound\nhypothermia provides cellular protection during 3.5 hours of\ncardiac arrest in a canine model. ASAIO J. 40, M351–M358\n(1994).\nArticle  CAS  PubMed  Google Scholar \n182. Taylor, M.J. et al. A new solution for life without blood.\nAsanguineous low-flow perfusion of a whole-body perfusate\nduring 3 hours of cardiac arrest and profound hypothermia.\nCirculation 91, 431–444 (1995).\n\n\nArticle  CAS  PubMed  Google Scholar \n183. Rhee, P. et al. Induced hypothermia during emergency\ndepartment thoracotomy: an animal model. J. Trauma 48,\n439–450 (2000).\nArticle  CAS  PubMed  Google Scholar \n184. Munshi, L., Keshavjee, S. & Cypel, M. Donor management and\nlung preservation for lung transplantation. Lancet Respir. Med.\n1, 318–328 (2013).\nArticle  PubMed  Google Scholar \n185. Azevedo, M. Donor lungs ready for transplant is goal of\nToronto start-up supported by $2.6M from XENiOS.\nPulmonary Fibrosis News https://\npulmonaryfibrosisnews.com/2016/02/26/xenios-invests-2-6-\nmillion-in-xor-labs-toronto/ (26 February 2016).\n186. Lowe, C.H., Lardner, P.J. & Halpern, E.A. Supercooling in\nreptiles and other vertebrates. Comp. Biochem. Physiol. A 39,\n125–135 (1971).\nArticle  CAS  PubMed  Google Scholar \n187. Blackstone, E., Morrison, M. & Roth, M.B. H2S induces a\nsuspended animation-like state in mice. Science 308, 518\n(2005).\nArticle  CAS  PubMed  Google Scholar \n188. Donnez, J. & Dolmans, M.M. Ovarian cortex transplantation:\n60 reported live births brings the success and worldwide\nexpansion of the technique towards routine clinical practice.\nJ. Assist. Reprod. Genet. 32, 1167–1170 (2015).\nArticle  PubMed  PubMed Central  Google Scholar \n189. Silber, S., Pineda, J., Lenahan, K., DeRosa, M. & Melnick, J.\nFresh and cryopreserved ovary transplantation and resting\nfollicle recruitment. Reprod. Biomed. Online 30, 643–650\n\n\n(2015).\nArticle  PubMed  Google Scholar \n190. Arav, A., Friedman, O., Natan, Y., Gur, E. & Shani, N. Rat\nhindlimb cryopreservation and transplantation - A step\ntowards “organ banking”. Am. J. Transplant. (2017).\n191. Wang, Z. et al. Cryopreservation and replantation of\namputated rat hind limbs. Eur. J. Med. Res. 19, 28 (2014).\nArticle  CAS  PubMed  PubMed Central  Google Scholar \n192. Song, Y.C., Khirabadi, B.S., Lightfoot, F., Brockbank, K.G. &\nTaylor, M.J. Vitreous cryopreservation maintains the function\nof vascular grafts. Nat. Biotechnol. 18, 296–299 (2000).\nArticle  CAS  PubMed  Google Scholar \n193. Taylor, M.J., Brockbank, K.G.M. & Song, Y.C. in Life in the\nFrozen State (eds. Fuller, B.J., Lane, N. & Benson, E.E.) 603–\n641 (CRC Press, 2004).\n194. Abazari, A., Jomha, N.M., Elliott, J.A.W. & McGann, L.E.\nCryopreservation of articular cartilage. Cryobiology 66, 201–\n209 (2013).\nArticle  CAS  PubMed  Google Scholar \n195. Jomha, N.M. et al. Vitrification of intact human articular\ncartilage. Biomaterials 33, 6061–6068 (2012).\nArticle  CAS  PubMed  Google Scholar \n196. Anonymous. Tissue Testing Technologies. SBIR-STTR https://\nwww.sbir.gov/sbc/tissue-testing-technologies-llc-3 (accessed:\n1 January 2016).\n197. Anonymous. Ossium Health Inc. Buzzfile http://\nwww.buzzfile.com/business/Ossium-Health-317-370-7293\n(accessed: 1 January 2016).\n\n\n198. Anonymous. Organ Solutions, LLC. Buzzfile http://\nwww.buzzfile.com/business/Organ-Solutions,-\nLLC-617-643-3800 (accessed: 1 January 2016).\n199. Anonymous. TransMedics, Inc. announces closing of $51.2\nmillion growth financing to transform organ transplant\ntherapy. PRNewswire http://www.prnewswire.com/news-\nreleases/transmedics-inc-announces-closing-of-512-million-\ngrowth-financing-to-transform-organ-transplant-\ntherapy-300274937.html (accessed: 28 September 2016).\n200. Anonymous. TransMedics, Inc. secures $36 million round of\nfinancing led by Abrams Capital Management. TransMedics\nhttp://www.transmedics.com/wt/page/pr_1354044406\n(accessed: 28 September 2016).\n201. Mathis, K.B. Mayo Clinic adding new lung center. The Daily\nRecord http://www.jaxdailyrecord.com/showstory.php?\nStory_id=545906 (5 August 2015).\n202. Anonymous. Company profiles: organ recovery systems.\nPitchBook http://pitchbook.com/profiles/organ-recovery-\nsystems-profile-investors-funding-valuation-and-analysis\n(accessed: 28 September 2016).\nDownload references\nAcknowledgements\nThe lead authors owe thanks to many who helped make this article\npossible: the Thiel Foundation, the Society for Cryobiology, the\nAmerican Society of Mechanical Engineers, Virginia Commonwealth\nUniversity, and New Organ for supporting the events that helped\ndevelop the growing dialog; the NSF for funding the development of\na beta Roadmap to Organ Banking and Bioengineering, and the DoD\nfor funding the development of an Organ Banking Report, each of\nwhich has contributed heavily to the content of this article; L.A.\nacknowledges DARPA's Service Chief Fellows Program for enabling\na major 'Organs on Demand' workshop, integral to developing the\n\n\nconclusions in this article. The authors thank M. Severs, J. Horwitz,\nC. Mallory, and J. Lewis for valuable feedback on the presentation\nof the information herein; the hundreds of participants of the first\nglobal Organ Banking Summit, the Roadmap to Organ Banking and\nBioengineering Workshop, the White House Organ Banking\nRoundtable, the DARPA Organs-on-Demand workshop at the US\nMilitary Academy, and the Emerging Technologies in Organ\nPreservation symposium and roundtable discussion on Capitol Hill,\nalong with many other supporters who have each helped outline the\nneeds and opportunities in biopreservation. U.D. acknowledges NIH\ngrant R01EB015776-05. K.U. and J.F.M. acknowledge NIH grant\nR01 DK107875. J.A.W.E. holds a Canada Research Chair in\nThermodynamics. The authors also thank K. Caldwell, V. Morigi, R.\nFarmanfarmaian, E. Mohamed, M. Rostad, R. El Assal, P. Kilbride,\nand the rest of the Organ Preservation Alliance team for their\nsupport and dedication to making leaps forward in the ability to\npreserve organs and tissues.\nAuthor information\nAuthor notes\n1. Sebastian Giwa and Jedediah K Lewis: These authors\ncontributed equally to this work.\nAuthors and Affiliations\n1. Organ Preservation Alliance, NASA Research Park, Moffett\nField, California, USA\nSebastian Giwa, Jedediah K Lewis, Boris Schmalz, Brad P\nWeegman & Alessandro Tocchio\n2. Sylvatica Biotech, Inc., Charleston, South Carolina, USA\nSebastian Giwa, Brad P Weegman & Michael J Taylor\n3. Ossium Health, San Francisco, California, USA\n\n\nSebastian Giwa & Erik J Woods\n4. Regenerative Biology Research Group, Cancer and\nDevelopmental Biology Laboratory, National Cancer Institute,\nBethesda, Maryland, USA\nLuis Alvarez\n5. Walter Reed National Military Medical Center, Bethesda,\nMaryland, USA\nLuis Alvarez\n6. Department of Chemistry and Life Science, United States\nMilitary Academy, West Point, New York, USA\nLuis Alvarez\n7. Department of Chemical Engineering, Massachusetts Institute\nof Technology, Cambridge, Massachusetts, USA\nRobert Langer\n8. Department of Economics, Stanford University, Stanford,\nCalifornia, USA\nAlvin E Roth\n9. Department of Genetics, Harvard Medical School, Boston,\nMassachusetts, USA\nGeorge M Church\n10. Division of Transplant Surgery, Department of Surgery,\nMassachusetts General Hospital, Boston, Massachusetts, USA\nJames F Markmann\n11. Columbia Center for Translational Immunology, Columbia\nUniversity Medical Center, New York, New York, USA\nDavid H Sachs\n\n\n12. American Society of Transplantation, Mt. Laurel, New Jersey,\nUSA\nAnil Chandraker\n13. Renal Division, Transplantation Research Center, Brigham\nand Women's Hospital, Harvard Medical School, Boston,\nMassachusetts, USA\nAnil Chandraker\n14. American Society of Transplant Surgeons, Arlington, Virginia,\nUSA\nJason A Wertheim\n15. Comprehensive Transplant Center, Northwestern University\nFeinberg School of Medicine, Chicago, Illinois, USA\nJason A Wertheim\n16. United Therapeutics, Silver Spring, Maryland, USA\nMartine Rothblatt\n17. MIT Media Lab and McGovern Institute, Massachusetts\nInstitute of Technology, Cambridge, Massachusetts, USA\nEdward S Boyden\n18. Association of Organ Procurement Organizations, Vienna,\nVirginia, USA\nElling Eidbo\n19. Department of Plastic and Reconstructive Surgery, Johns\nHopkins University School of Medicine, Baltimore, Maryland,\nUSA\nW P Andrew Lee & Gerald Brandacher\n20. Department of Surgery, Division of Plastic Surgery, Brigham\nand Women's Hospital/Harvard Medical School, Boston,\n\n\nMassachusetts, USA\nBohdan Pomahac\n21. Department of Medical Oncology, Dana-Farber Cancer\nInstitute, Harvard Medical School, Boston, Massachusetts,\nUSA\nDavid M Weinstock\n22. Department of Mechanical Engineering and Engineering\nScience, University of North Carolina at Charlotte, Charlotte,\nNorth Carolina, USA\nGloria Elliott\n23. Department of Transplant Medicine, Nazih Zuhdi Transplant\nInstitute, Integris Baptist Medical Center, Oklahoma City,\nOklahoma, USA\nDavid Nelson\n24. Department of Laboratory Medicine and Pathology,\nUniversity of Alberta, Edmonton, Alberta, Canada\nJason P Acker & Janet A W Elliott\n25. Society for Cryobiology, Baltimore, Maryland, USA\nJason P Acker, Erik J Woods & Dayong Gao\n26. Department of Surgery, Center for Engineering in Medicine,\nMassachusetts General Hospital, Harvard Medical School,\nBoston, Massachusetts, USA\nKorkut Uygun & Mehmet Toner\n27. Max Planck Institute of Psychiatry, Munich, Germany\nBoris Schmalz\n28. Department of Radiology, Stanford School of Medicine,\nStanford, California, USA\n\n\nAlessandro Tocchio & Utkan Demirci\n29. 21st Century Medicine, Fontana, California, USA\nGreg M Fahy\n30. Institute of Biochemistry, Carleton University, Ottawa,\nOntario, Canada\nKenneth B Storey\n31. Department of Mechanical Engineering, University of\nCalifornia Berkeley, Berkeley, California, USA\nBoris Rubinsky\n32. Department of Mechanical Engineering, University of\nMinnesota, Minneapolis, Minnesota, USA\nJohn Bischof\n33. Department of Chemical and Materials Engineering,\nUniversity of Alberta, Edmonton, Alberta, Canada\nJanet A W Elliott\n34. Division of Obstetrics and Gynecology-Reproductive Science\nin Medicine, Northwestern University Feinberg School of\nMedicine, Chicago, Illinois, USA\nTeresa K Woodruff\n35. Asymptote Ltd., Cambridge, UK\nG John Morris\n36. Department of Electrical Engineering (by courtesy), Stanford,\nCalifornia, USA\nUtkan Demirci\n37. Department of Bioengineering, Clemson University, Clemson,\nSouth Carolina, USA\n\n\nKelvin G M Brockbank\n38. Department of Microbiology and Immunology, Indiana\nUniversity School of Medicine, Indianapolis, Indiana, USA\nErik J Woods\n39. Department of Chemistry and Biomolecular Sciences,\nUniversity of Ottawa, Ottawa, Ontario, Canada\nRobert N Ben\n40. Department of Biological Sciences, Binghamton University,\nState University of New York, Binghamton, New York, USA\nJohn G Baust\n41. Department of Mechanical Engineering, University of\nWashington, Seattle, Washington, USA\nDayong Gao\n42. Division of Surgery & Interventional Science, University\nCollege Medical School, Royal Free Hospital Campus, London,\nUK\nBarry Fuller\n43. Department of Mechanical Engineering, Carnegie Mellon\nUniversity, Pittsburgh, Pennsylvania, USA\nYoed Rabin & Michael J Taylor\n44. Organ Recovery Systems, Chicago, Illinois, USA\nDavid C Kravitz\n45. Department of Surgery, University of Arizona, Tucson,\nArizona, USA\nMichael J Taylor\nAuthors\n\n\n1. Sebastian Giwa\nView author publications\nSearch author on:PubMed Google Scholar\n2. Jedediah K Lewis\nView author publications\nSearch author on:PubMed Google Scholar\n3. Luis Alvarez\nView author publications\nSearch author on:PubMed Google Scholar\n4. Robert Langer\nView author publications\nSearch author on:PubMed Google Scholar\n5. Alvin E Roth\nView author publications\nSearch author on:PubMed Google Scholar\n6. George M Church\nView author publications\nSearch author on:PubMed Google Scholar\n7. James F Markmann\nView author publications\nSearch author on:PubMed Google Scholar\n8. David H Sachs\nView author publications\nSearch author on:PubMed Google Scholar\n9. Anil Chandraker\nView author publications\n\n\nSearch author on:PubMed Google Scholar\n10. Jason A Wertheim\nView author publications\nSearch author on:PubMed Google Scholar\n11. Martine Rothblatt\nView author publications\nSearch author on:PubMed Google Scholar\n12. Edward S Boyden\nView author publications\nSearch author on:PubMed Google Scholar\n13. Elling Eidbo\nView author publications\nSearch author on:PubMed Google Scholar\n14. W P Andrew Lee\nView author publications\nSearch author on:PubMed Google Scholar\n15. Bohdan Pomahac\nView author publications\nSearch author on:PubMed Google Scholar\n16. Gerald Brandacher\nView author publications\nSearch author on:PubMed Google Scholar\n17. David M Weinstock\nView author publications\nSearch author on:PubMed Google Scholar\n18. Gloria Elliott\n\n\nView author publications\nSearch author on:PubMed Google Scholar\n19. David Nelson\nView author publications\nSearch author on:PubMed Google Scholar\n20. Jason P Acker\nView author publications\nSearch author on:PubMed Google Scholar\n21. Korkut Uygun\nView author publications\nSearch author on:PubMed Google Scholar\n22. Boris Schmalz\nView author publications\nSearch author on:PubMed Google Scholar\n23. Brad P Weegman\nView author publications\nSearch author on:PubMed Google Scholar\n24. Alessandro Tocchio\nView author publications\nSearch author on:PubMed Google Scholar\n25. Greg M Fahy\nView author publications\nSearch author on:PubMed Google Scholar\n26. Kenneth B Storey\nView author publications\nSearch author on:PubMed Google Scholar\n\n\n27. Boris Rubinsky\nView author publications\nSearch author on:PubMed Google Scholar\n28. John Bischof\nView author publications\nSearch author on:PubMed Google Scholar\n29. Janet A W Elliott\nView author publications\nSearch author on:PubMed Google Scholar\n30. Teresa K Woodruff\nView author publications\nSearch author on:PubMed Google Scholar\n31. G John Morris\nView author publications\nSearch author on:PubMed Google Scholar\n32. Utkan Demirci\nView author publications\nSearch author on:PubMed Google Scholar\n33. Kelvin G M Brockbank\nView author publications\nSearch author on:PubMed Google Scholar\n34. Erik J Woods\nView author publications\nSearch author on:PubMed Google Scholar\n35. Robert N Ben\nView author publications\n\n\nSearch author on:PubMed Google Scholar\n36. John G Baust\nView author publications\nSearch author on:PubMed Google Scholar\n37. Dayong Gao\nView author publications\nSearch author on:PubMed Google Scholar\n38. Barry Fuller\nView author publications\nSearch author on:PubMed Google Scholar\n39. Yoed Rabin\nView author publications\nSearch author on:PubMed Google Scholar\n40. David C Kravitz\nView author publications\nSearch author on:PubMed Google Scholar\n41. Michael J Taylor\nView author publications\nSearch author on:PubMed Google Scholar\n42. Mehmet Toner\nView author publications\nSearch author on:PubMed Google Scholar\nContributions\nS.G., J.K.L., and L.A. developed the main conclusions of the article.\nS.G. and J.K.L. developed the key points discussed with input from\nall other co-authors. S.G. developed the original concepts that led to\n\n\nthe article's creation. J.K.L. developed the structure of the article\nand wrote the manuscript. S.G., J.K.L., L.A., R.L., A.E.R., G.M.C.,\nJ.F.M., D.H.S., A.C., J.A.W., M.R., E.S.B., E.E., B.P., W.P.A.L., G.B.,\nD.M.W., G.E., D.N., J.P.A., K.U., B.S., B.P.W., A.T., G.M.F., K.B.S.,\nB.R., J.B., J.A.W.E., T.K.W., G.J.M., U.D., K.G.M.B., E.J.W., R.N.B.,\nJ.G.B., D.G., B.F., Y.R., D.C.K., M.J.T., and M.T. added conclusions,\ncontent, and references, critically reviewed the manuscript, and\nprovided input on structure, style and content. S.G., J.K.L., B.S.,\nB.W., and A.T. created the figures and tables.\nCorresponding author\nCorrespondence to Jedediah K Lewis.\nEthics declarations\nCompeting interests\nJ.K.L. is an officer of the Organ Preservation Alliance, a 501c3 non-\nprofit organization, dedicated to advancing organ and tissue\npreservation. S.G. is an officer of Sylvatica Biotech, a\ncryopreservation biotech company, and Ossium Health, a bone\nmarrow banking company. E.E. is CEO of the Association of Organ\nProcurement Organizations, a non-profit organization that\nrepresents the 58 US organ procurement organizations. E.B. is co-\nfounder and consultant at Cognito Therapeutics and Expansion\nTechnologies, senior advisor to Kernel, advisor to Inner Cosmos,\nPuretech, Constellation Diagnostics, and OccamzRazor, and\nconsultant to Intellectual Ventures. J.F.M. is a consultant for\nVicapsys. M.J.T. is supported in part by salary from Sylvatica\nBiotech, in which he also holds equity. G.C. has a financial interest\nin eGenesis. K.G.M.B. is an owner of Tissue Testing Technologies\nand has stock in Organ Recovery Systems. J.A.W.E. holds\ncryopreservation patents. E.J.W. is an officer of Ossium Health, a\nbone marrow banking company. D.K. is CEO of Organ Recovery\nSystems, a developer of organ preservation technologies. U.D. is a\nfounder of, and has an equity interest in DxNow, Inc., a company\nthat is developing microfluidic and imaging technologies for point-\n\n\nof-care diagnostic solutions, and Koek Biotech, a company that is\ndeveloping microfluidic IVF technologies for clinical solutions.\nU.D.'s interests were reviewed and are managed with the\naforementioned companies' and Stanford School of Medicine's\nconflict of interest policies. G.J.M. is a director of Asymptote Ltd., a\nGE Healthcare company that produces cryochain technologies for\nthe clinical delivery of cell therapies. G.B. is a founding scientific\nadvisor to Ossium Health. K.U. is an inventor on pending patents\nrelevant to this study (WO/2011/002926; WO/2011/35223) and\nhas a provisional patent application relevant to this study (MGH\n22743). K.U. has a financial interest in Organ Solutions, a company\nfocused on developing organ preservation technology. K.U.'s\ninterests are managed by the Massachusetts General Hospital and\nPartners HealthCare in accordance with their conflict of interest\npolicies. M.R. is the founder and CEO of United Therapeutics.\nUnited Therapeutics Corporation is a biotech company focused on\nthe development and commercialization of innovative products to\naddress the unmet medical needs of patients with chronic and life-\nthreatening conditions. Lung Biotechnology is a Public Benefit\nCompany addressing the acute national shortage of transplantable\nlungs and other organs with a variety of technologies that either\ndelay the need for such organs or expand the supply. D.H.S. is\nconsultant for Econugenics, Immunotherapeutics and Ossium Health\nand is a board member of ITB-MED. G.M.F. declares that he is an\nofficer of 21st Century Medicine, which is an organ\ncryopreservation company. A.R. is a cofounder and officer of\nRejuvenate Healthcare, which provides consulting for management\nof end-stage-renal-disease patients.\nRights and permissions\nReprints and permissions\nAbout this article\n[image]\n\n\nCite this article\nGiwa, S., Lewis, J., Alvarez, L. et al. The promise of organ and tissue\npreservation to transform medicine. Nat Biotechnol 35, 530–542\n(2017). https://doi.org/10.1038/nbt.3889\nDownload citation\n•  Received: 31 October 2016\n•  Accepted: 28 April 2017\n•  Published: 07 June 2017\n•  Issue date: June 2017\n•  DOI: https://doi.org/10.1038/nbt.3889\nShare this article\nAnyone you share the following link with will be able to read this\ncontent:\nGet shareable link\nSorry, a shareable link is not currently available for this article.\nCopy shareable link to clipboard\nProvided by the Springer Nature SharedIt content-sharing initiative\nThis article is cited by\n•  An In-depth overview of artificial intelligence\n(AI) tool utilization across diverse phases of\norgan transplantation\n○  Shiva Arjmandmazidi\n\n\n○  Hamid Reza Heidari\n○  Soheila Montazersaheb\nJournal of Translational Medicine (2025)\n•  Innovations in aging biology: highlights from the\nARDD emerging science & technologies\nworkshop\n○  Maximilian Unfried\n○  Tomas Schmauck-Medina\n○  Morten Scheibye-Knudsen\nnpj Aging (2025)\n•  Higher glass transition temperatures reduce\nthermal stress cracking in aqueous solutions\nrelevant to cryopreservation\n○  Soheil Kavian\n○  Ronald Sellers\n○  Matthew J. Powell-Palm\nScientific Reports (2025)\n•  Implantable bioelectronics and wearable sensors\nfor kidney health and disease\n○  Surabhi R. Madhvapathy\n○  Soongwon Cho\n○  John A. Rogers\nNature Reviews Nephrology (2025)\n•  UW supplementation with AP39 improves liver\nviability following static cold storage\n○  McLean Taggart\n○  Saige Holkup\n\n\n○  Alban Longchamp\nScientific Reports (2025)\n Access through your institution\nBuy or subscribe\nAdvertisement\n[image]\nExplore content\n•  Research articles\n•  Reviews & Analysis\n•  News & Comment\n•  Podcasts\n•  Videos\n•  Current issue\n•  Collections\n•  Follow us on Facebook\n•  Follow us on Twitter\n•  Subscribe\n•  Sign up for alerts\n•  RSS feed\nAbout the journal\n•  Aims & Scope\n•  Journal Information\n•  Journal Metrics\n•  About the Editors\n•  Research Cross-Journal Editorial Team\n•  Reviews Cross-Journal Editorial Team\n•  Our publishing models\n\n\n•  Editorial Values Statement\n•  Editorial Policies\n•  Content Types\n•  Web Feeds\n•  Posters\n•  Contact\nPublish with us\n•  Submission Guidelines\n•  For Reviewers\n•  Language editing services\n•  Open access funding\n•  Submit manuscript\nSearch\nSearch articles by subject, keyword or author\nShow results from All journals This journal\nSearch\nAdvanced search\nQuick links\n•  Explore articles by subject\n•  Find a job\n•  Guide to authors\n•  Editorial policies\nNature Biotechnology (Nat Biotechnol)\nISSN 1546-1696 (online)\nISSN 1087-0156 (print)\n\n\nnature.com sitemap\nAbout Nature Portfolio\n•  About us\n•  Press releases\n•  Press office\n•  Contact us\nDiscover content\n•  Journals A-Z\n•  Articles by subject\n•  protocols.io\n•  Nature Index\nPublishing policies\n•  Nature portfolio policies\n•  Open access\nAuthor & Researcher services\n•  Reprints & permissions\n•  Research data\n•  Language editing\n•  Scientific editing\n•  Nature Masterclasses\n•  Research Solutions\nLibraries & institutions\n•  Librarian service & tools\n•  Librarian portal\n•  Open research\n•  Recommend to library\nAdvertising & partnerships\n\n\n•  Advertising\n•  Partnerships & Services\n•  Media kits\n•  Branded content\nProfessional development\n•  Nature Awards\n•  Nature Careers\n•  Nature Conferences\nRegional websites\n•  Nature Africa\n•  Nature China\n•  Nature India\n•  Nature Japan\n•  Nature Middle East\n•  Privacy Policy\n•  Use of cookies\n•  Your privacy choices/Manage cookies\n•  Legal notice\n•  Accessibility statement\n•  Terms & Conditions\n•  Your US state privacy rights\n[image]\n© 2025 Springer Nature Limited\n\n\n Close\n[image]\nSign up for the Nature Briefing newsletter — what matters in\nscience, free to your inbox daily.\nEmail address\n\n\nSign up\nI agree my information will be processed in accordance with the\nNature and Springer Nature Limited Privacy Policy.\n Close\nGet the most important science stories of the day, free in your\ninbox. Sign up for Nature Briefing\n[image]\n\n\n"], "response": "This article discusses the potential impact of machine perfusion on reducing the cost of organ transplantation. It explains how machine perfusion allows for longer preservation times, potentially eliminating the need for organ sharing programs and decreasing transportation costs. The article also mentions ongoing efforts to develop normothermic machine perfusion, which could further extend preservation times and potentially eliminate the need for organ shipping altogether. However, the article notes that while machine perfusion holds great promise, it is still in the experimental stage and requires further testing and validation before becoming widely adopted. Nonetheless, the article suggests that machine perfusion has the potential to significantly reduce the cost of organ transplantation by improving efficiency and reducing waste."}
{"user_input": "How has machine perfusion changed risk thresholds associated with steatotic donor livers?", "retrieved_contexts": ["R E S EAR CH A R TIC L E Open Access\nVisual quality assessment of the liver graft\nby the transplanting surgeon predicts\npostreperfusion syndrome after liver\ntransplantation: a retrospective cohort\nstudy\nFelix Kork1* , Alexandra Rimek1\n, Anne Andert2\n, Niklas Jurek Becker2\n, Christoph Heidenhain3\n, Ulf P. Neumann2\n,\nDaniela Kroy4\n, Anna B. Roehl1\n, Rolf Rossaint1 and Marc Hein1\nAbstract\nBackground: The discrepancy between demand and supply for liver transplants (LT) has led to an increased\ntransplantation of organs from extended criteria donors (ECD).\nMethods: In this single center retrospective analysis of 122 cadaveric LT recipients, we investigated predictors\nof postreperfusion syndrome (PRS) including transplant liver quality categorized by both histological assessment\nof steatosis and subjective visual assessment by the transplanting surgeon using multivariable regression analysis.\nFurthermore, we describe the relevance of PRS during the intraoperative and postoperative course of LT recipients.\nResults: 53.3% (n = 65) of the patients suffered from PRS. Risk factors for PRS were visually assessed organ quality of the\nliver grafts (acceptable: OR 12.2 [95% CI 2.43–61.59], P = 0.002; poor: OR 13.4 [95% CI 1.48–121.1], P = 0.02) as well\nas intraoperative norepinephrine dosage before reperfusion (OR 2.2 [95% CI 1.26–3.86] per 0.1 μg kg− 1 min− 1\n, P = 0.01).\nIn contrast, histological assessment of the graft was not associated with PRS. LT recipients suffering from PRS\nwere hemodynamically more instable after reperfusion compared to recipients not suffering from PRS. They\nhad lower mean arterial pressures until the end of surgery (P < 0.001), received more epinephrine and norepinephrine\nbefore reperfusion (P = 0.02 and P < 0.001, respectively) as well as higher rates of continuous infusion of norepinephrine\n(P < 0.001) and vasopressin (P = 0.02) after reperfusion. Postoperative peak AST was significantly higher (P = 0.001) in LT\nrecipients with PRS. LT recipients with intraoperative PRS had more postoperative adverse cardiac events (P = 0.05) and\nsuffered more often from postoperative delirium (P = 0.04).\nConclusions: Patients receiving ECD liver grafts are especially prone to PRS. Anesthesiologists should keep these newly\ndescribed risk factors in mind when preparing for reperfusion in patients receiving high-risk organs.\nKeywords: Steatosis, Hyponatremia, Cold ischemia time\n* Correspondence: fkork@ukaachen.de 1\nDepartment of Anaesthesiology, Medical Faculty, RWTH Aachen University,\nPauwelsstrasse 30, 52074 Aachen, Germany\nFull list of author information is available at the end of the article\n© The Author(s). 2018 Open Access This article is distributed under the terms of the Creative Commons Attribution 4.0\nInternational License (http://creativecommons.org/licenses/by/4.0/), which permits unrestricted use, distribution, and\nreproduction in any medium, provided you give appropriate credit to the original author(s) and the source, provide a link to\nthe Creative Commons license, and indicate if changes were made. The Creative Commons Public Domain Dedication waiver\n(http://creativecommons.org/publicdomain/zero/1.0/) applies to the data made available in this article, unless otherwise stated.\nKork et al. BMC Anesthesiology (2018) 18:29 \nhttps://doi.org/10.1186/s12871-018-0493-9\n\nBackground\nAccording to the Organ Procurement and Transplant￾ation Network of the United States (US) Department of\nHealth and Human Services, the numbers of liver trans￾plantations (LT) in the US have constantly been rising\nsince the beginning of LT [1]: In 2016, a total of 7841\nLTs were performed in the US. By contrast, the numbers\nof LTs in Germany and in the Eurotransplant region\nhave been decreasing since a peak in 2010 [2, 3]. The de￾creasing organ donations combined with the persisting\nhigh morbidity and mortality of patients on the waiting\nlist has led to a discrepancy between organ supply and\ndemand [2, 4] and therefore to the more frequent ac￾ceptance extended criteria donors (ECD) to the pool of\neligible donors [5, 6].\nThe most critical intraoperative moment for the\nanesthesiologist during LT is the reperfusion of the liver\ngraft. An immediate and severe complication following\nreperfusion is hemodynamic instability, the so called post￾reperfusion syndrome (PRS). PRS is defined as a decrease\nof mean arterial pressure (MAP) of more than 30% during\nthe first 5 min after reperfusion and continuing for at least\n1 min [7–12]. PRS occurs in around 10–60% of LT recipi￾ents [8, 9, 13]. Several risk factors for PRS have been de￾scribed: Older donor age, higher donor risk index, longer\ncold ischemic time (CIT), severity of the recipient’s liver\ndisease, operation time and technique, hemodynamics\nat time of reperfusion, and steatosis of the graft organ\n[8, 13–20]. The mechanisms of PRS appear to be com￾plex and not fully understood [10, 21, 22]. In addition,\nthe transplantation of ECD livers has led to a decrease\nin mortality for LT recipients on the wait lists at the\ncost of increased perioperative complication [23]. Both\nthese factors have made it difficult to predict PRS. In\nparticular, the quality of the donor organ and its role as\nrisk factor for the occurrence of PRS as well as its asso￾ciations with patients’ outcome have been neglected in\nthe past.\nMethods\nAim, design and setting of the study\nWe therefore conducted a retrospective analysis of all\nLTs performed at our center. Primary aim of this study\nwas to identify predictors of PRS including transplant\nliver quality assessed by both subjective visual assess￾ment by the transplanting surgeon and histological as￾sessment of steatosis. Secondary aim of this study was to\ndescribe the relevance of PRS during the intraoperative\nand postoperative course of LT recipients.\nPatients and management\nAll patients receiving cadaveric liver transplantation from\nthe beginning of our center’s newly established liver trans￾plantation program in May 2010 until January 1st, 2014\nwere considered eligible for inclusion. Patients were ex￾cluded in case histological donor data or intraoperative\ndata were incomplete or in case of intraoperative severe\nadverse events prior to reperfusion. Liver transplantation\nwas performed using an extracorporeal venovenous/portal\nvenous bypass. Anesthesiological management, bypass\nand surgical procedures, as well as the immune suppres￾sion regimen have already been described by Moosdorf\nand colleagues [24]. Anesthesiologists did not follow a\nspecific coagulation or transfusion management protocol:\nPatient received at maximum 1 Liter of balanced electro￾lyte solution and volume replacement was subsequently\nconducted with FFP in order to anticipate the coagulation\ndisorder. Transfusion triggers for RBCs were tailored to\nthe patient’s comorbidities and provided at the discretion\nof the providing anesthesiologist. Our department’s stand￾ard operating procedure (SOP) for LT includes a TEM\nafter induction, 15–30 and 45–60 min after reperfusion,\nseeking to keep normal coagulation parameters [25].\nData\nDonor data\nThe following data were abstracted from the covering\nletter of the donor organ: donor age, donor body mass\nindex, donor blood sodium concentration, donor alanine\ntransaminase (ALT) blood concentration, donor aspartate\ntransaminase (AST) blood concentration, donor bilirubin\nblood concentration, as well as warm ischemia time (WIT)\nand cold ischemia time (CIT).\nDonor organ assessment\nDonor livers were macroscopically assessed regarding their\nfat content by the implanting surgeon before the recipient\noperation on the preserved cold graft. Organs were cat￾egorized as either good, acceptable or poor, according\nto EuroTransplant criteria. In addition, histological assess￾ment of the donor organ was conducted by the explanting\ncenter (or if missing by the in-house pathology depart￾ment). Organs were categorized in three categories\ndepending on macrovesicular fat content (≥ one intra￾cellular vacuole displacing organelles): Grade 1 – fat\ncontent 0–29%, grade 2 – fat content 30–59%, grade 3 –\nfat content ≥60% [26, 27].\nRecipient data\nThe following data were abstracted from the patient’s\nmedical chart, as recorded at the time of evaluation for\nbeing listed for transplantation: Recipient age, recipient\ndiagnosis leading to transplantation, portal hypertension\n(PoHT; defined by either esophageal varices, thrombopenia\nor splenomegaly), laboratory model of end stage liver\ndisease score (labMELD; 10 x (0,957 x In(serum cre￾atinine) + 0,37 x In(serum creatinine) + 1,12 x In (inter￾national normalized ratio[INR]) + 0,643)) [28], and the\nKork et al. BMC Anesthesiology (2018) 18:29 Page 2 of 11\n\nneed for renal replacement therapy. From the electronic\npatient data management system, concentrations of serum\nbilirubin, serum AST, serum ALT, serum creatinine, inter￾national normalized ratio (INR) as well as renal replace￾ment therapy were abstracted after admission closest to\nthe beginning of surgery (preoperatively), at ICU admis￾sion immediately after surgery (postoperatively) and on\npostoperative day (POD) 1,3,7 and 14.\nThe following data were abstracted from the paper-based\nanesthesia protocol: Heart rate, mean blood pressure (arter￾ial line), boli of norepinephrine and epinephrine at time of\nreperfusion, infusion rate of norepinephrine, infusion rate\nof epinephrine, infusion rate of vasopressin. These values\nwere abstracted at induction of anesthesia, skin incision,\nbeginning of the anhepatic phase, and at 5, 10, 15, 30 and\n60 min after reperfusion as well as at the end of the surgery.\nFurthermore, the number of intraoperatively administered\nred blood cell concentrates (RBCs), platelet concentrates\n(PCs), fresh frozen plasmas (FFPs), the amount of intraop￾eratively administered fibrinogen, prothrombin complex\nconcentrate (PCC), the occurrence of hyperfibrinolysis\n(by thrombelastometry [TEM]), asystole and cerebral\nedema (temporary mydriasis after reperfusion) were ex￾tracted from the anesthesia protocol.\nFrom the patients chart we abstracted the following\ndata from the postoperative period: primary nonfunction\n(PND; re-transplantation or death within 7 days), early\nallograft dysfunction (bilirubin ≥10 mg/dl on post-operative\nday (POD) 7 and/or INR ≥1.6 on POD 7 and/or AST or\nALT > 2000 IU/L within the first 7 days), acute rejec￾tion (clinical diagnosis), surgical revisions, retransplan￾tation, sepsis, need for renal replacement therapy (RRT),\nadverse cardiovascular events (asystole, resuscitation, non\nST elevation myocardial infarction, heart failure), adverse\ncentral nervous events (delirium, intracranial hemorrhage,\nseizures), duration of mechanical ventilation, intensive care\nunit (ICU) length of stay (LOS), hospital LOS, and death.\nPostreperfusion syndrome\nPRS was defined as fulfillment of at least one of the follow￾ing criteria: (1) Decrease in mean arterial pressure (MAP)\nof at least 30% at time of reperfusion, (2) administration of\nan intravenous bolus of norepinephrine > 2 μg kg body\nweight (BW) -1, (3) increase of continuous norepinephrine\ninfusion of ≥0.1 μg kg BW− 1 within 5 to 30 min after reper￾fusion, or (4) initiation of continuous vasopressin infusion\nafter reperfusion. According to our department’s SOP,\nPRS was treated as follows: (i) 0.5 mg atropine before\nreperfusion if heart rate < 80, (ii) NE boli and NE infu￾sion to maintain MAP, (iii) epinephrine boli and infu￾sion in case of significant bradycardia with hypotension\nand decrease of SVO2 during reperfusion, (iv) infusion\nof vasopressin if high doses of NA are necessary or NA\ntherapy ineffective.\nStatistics\nCategorical data with two categories each were tested\nusing Fisher’s exact test, with more than three categories\nwith the Chi squared test with Yates correction. Since\nthe sample size was > 100, central limit theorem applies\nand normal distribution of continuous variables was as￾sumed without testing. Groupwise comparison of continu￾ous variables were therefore conducted using the t-test for\nindependent samples. Changes of continuous variables over\ntime were compared using a repeated measures ANOVA\ntest. If a time/variable-interaction was detected by the\nANOVA, a post-hoc t-test was conducted for each time\npoint. Survival analysis were conducted plotting Kaplan￾Meier curves and these were compared using the Log\nRank test. Agreement between visual organ assessment by\nthe surgeon and histopathological steatosis grading was\nquantified by calculating an unweighted Cohen’s kappa.\nBinary logistic regression analysis was used to determine\nindependent factors predicting postreperfusion syndrome.\nVariables reaching a level of significance (P ≤ 0.05) when\nunivariably tested, were introduced into the multivariable\nlogistic regression model. Statistical analyses were con￾ducted using IBM SPSS 22, figures were created using\nGraphPad Prism 6.0. A two-sided p-value ≤0.05 was con￾sidered statistically significant.\nResults\nPatients\nA total of 172 patients received a liver transplantation\nduring the study period. 50 patients were excluded due\nto incomplete histological data (n = 46), incomplete intra￾operative documentation (n = 3) or due to severe adverse\nevents prior to reperfusion (n = 1; need for cardiopulmo￾nary bypass due to laceration of the inferior caval vein). A\ntotal of 122 patients were analyzed (Fig. 1).\nClinical characteristics of the study population are\ndepicted in Table 1. Recipients of LT had a mean age of\n55 (54.9 ± 9.8) and a mean labMELD of 20 (19.8 ± 10.3).\nThe most frequent reason for transplantation was cir￾rhosis (57 of 122; 46.7%) followed by tumor (25 of 122;\n20.5%). Organ donors had a mean age of 55 (55.2 ± 16.2),\nwere 46.7% female, had a mean BMI of 29 (28.8 ± 7.2),\nand serum sodium, ALT, AST, bilirubin within the refer￾ence range. The mean CIT of the donor organs was 8 h\n(8.3 ± 2.3), mean WIT was 44 min (43.7 ± 7.5).\nPostreperfusion syndrome\nOf the 122 liver transplant recipients, 65 (53.3%) devel￾oped PRS (Table 1). Patients developing PRS received an\norgan more often due to acute liver failure (10 of 65 vs.\n2 of 57, 15.4% vs. 3.5%, P = 0.03) and less often due to\ncirrhosis (20 of 65 vs. 37 of 57, 30.8% vs. 64.9%, P <\n0.001) compared to recipients not developing PRS and\nsuffered more often from PoHT (52 of 65 vs. 33 of 57,\nKork et al. BMC Anesthesiology (2018) 18:29 Page 3 of 11\n\n80.0% vs. 57.9%, P = 0.01). Organ donors for recipients\ndeveloping PRS had a higher BMI (31.1 ± 8.2 vs. 26.4 ±\n4.8, P < 0.001) and a higher serum sodium concentration\n(149.1 ± 7.8 vs. 146.1 ± 8.4, p = 0.04) compared to organ\ndonors for recipients not developing PRS. Donor organs\nfor patients who developed PRS had longer mean CITs\n(8.7 ± 2.3 vs. 7.8 ± 2.3 h, p = 0.04) and more often had an\nextreme CIT of ≥10 h (17 of 65 vs. 6 of 57, 26.2% vs.\n10.5%, p = 0.02).\nPredictors of postreperfusion syndrome\nIn order to identify predictors of PRS we conducted a\nbinary logistic regression analysis with PRS as dependent\nvariable introducing known risk factors for PRS in the\nmodel (Table 2). Only visually assessed acceptable (OR\n12.2 [95% CI 2.43–61.59], P = 0.002) or poor (OR 13.4\n[95% CI 1.48–121.1], P = 0.02) quality of the donor\norgan and norepinephrine dosage before reperfusion\n(OR 2.2 [95% CI 1.26–3.86] per 0.1 μg kg− 1 min− 1\n, P =\n0.01) predicted the occurrence of PRS. Interestingly, the\nhistological assessment of donor organ’s steatosis was\nnot a good predictor for PRS. This was not due to collin￾earity of the variables: the visual and histological assess￾ment differed significantly (p < 0.001) and agreed poorly\n(cohen’s kappa 0.31, Table 3). For example, 21 of 122\ndonor organs were staged as acceptable or poor by visual\ninspection but classified as stage 1 steatosis by histo￾logical assessment.\nPostreperfusion syndrome and the intraoperative course\nafter reperfusion\nLT recipients with PRS were hemodynamically more un￾stable after reperfusion until the end of surgery compared\nto patients without PRS (Fig. 2): Recipients with PRS had\nlower MAPs after reperfusion (P < 0.001; Fig. 2a) and\naccordingly received higher infusion of continuous\nnorepinephrine (P < 0.001, Fig. 2b) and vasopressin (P <\n0.001; Fig. 2c) compared to patients without PRS. Heart\nrate and continuous epinephrine infusion after reperfu￾sion did not differ in LT recipients with and without\nPRS (Fig. 2d and e). At the time of reperfusion of the\nliver transplant, recipients with PRS received higher boli\nof norepinephrine (1.5 ± 1.6 vs. 0.3 ± 0.4 μg kg− 1\n, P = <\n0.001) and epinephrine (0.3 ± 0.5 vs. 0.1 ± 0.2 μg kg− 1\n; P =\n0.01; Fig. 2f).\nFurthermore, LT recipients with PRS received more\nextensive hemotherapy intraoperatively: Compared to\npatients without PRS, LT recipients with PRS received\nmore platelet concentrates (1.6 ± 1.8 vs. 1.1 ± 1.5 units;\nP = 0.04; more fibrinogen (3.0 ± 3.2 vs. 1.7 ± 1.2 g; P =\n0.01) and more PCC (1313 ± 1610 vs. 579 ± 1133 IU; P =\n0.01; Table 4). There was no significant difference in the\namount of RBC and FFP administered as well as in other\nintraoperative postreperfusion adverse events (Table 4).\nPostreperfusion syndrome and the postoperative course\nafter transplantation\nLT recipients with PRS demonstrated a more severe organ\ndamage after transplantation: During the first three postop￾erative days, AST was higher in patients with PRS (P = 0.02;\nFig. 3a), as was ALT, but without statistical significance\n(P = 0.40; Fig. 3b). LT recipients with and without PRS\ndid not differ in bile retention, as postoperative serum\nbilirubin concentrations were similar (Fig. 3c). Recipients\nwith PRS postoperatively had poorer organ function as\nhemostasis was poorer compared to recipients without\nPRS (P = 0.01; Fig. 3d). The inflammation marker procalci￾tonin as well as the kidney function marker serum creatin￾ine did not differ in LT recipients with and without\nPRS (Fig. 3e and f).\nRegarding postoperative adverse events, LT recipients\nwith PRS suffered more often from postoperative delirium\nFig. 1 Patients. Flow chart of patient inclusion. PRS: postreperfusion syndrome\nKork et al. BMC Anesthesiology (2018) 18:29 Page 4 of 11\n\n(8/65 vs. 1/57, 12.3% vs. 1.8%; P = 0.04) and major cardio￾vascular events (11/65 vs. 3/57, 16.9% vs. 5.3%; P = 0.05;\nTable 5). LT recipients with PRS also tended to have a lon￾ger ICU LOS (11.7 ± 17.0 vs. 9.7 ± 15.7; P = 0.09; Table 5).\nA Kaplan-Meier survival analysis for LT recipient survival\n(Fig. 4a) and graft survival (Fig. 4b) did not show signifi￾cant differences.\nDiscussion\nIn this single center retrospective analysis of 122 LT recip￾ients, we found that approximately half of the patients suf￾fered from PRS (53.3%). Multivariable regression analysis\nidentified two predictors of PRS: Only visually assessed ac￾ceptable (OR 12.2, P = 0.002) and poor (OR 13.4, P = 0.02)\ndonor organ quality by the transplanting surgeon and\nintraoperative norepinephrine infusion rate before reperfu￾sion of the liver transplant (OR 2.2 per 0.1 μg/kg/min, p =\n0.01) were associated with the occurrence of PRS. LT\nrecipients suffering from PRS were hemodynamically\nmore instable after reperfusion compared to recipients\nnot suffering from PRS. They had lower MAPs from re￾perfusion until the end of surgery (P < 0.001). Hence,\nthey received more epinephrine and norepinephrine\nbefore reperfusion (P < 0.001 and P = 0.01, respectively)\nand higher rates of continuous infusion of norepineph￾rine (P < 0.001) and vasopressin (P = 0.02) after reperfu￾sion of the transplant. Moreover, LT recipients with\nintraoperative PRS had a more complicated postopera￾tive course compared to recipients without intraopera￾tive PRS: They had more adverse cardiac events (P =\nTable 1 Clinical characteristics. of liver organ donors (top) and liver transplant recipients (bottom) of 122 single center liver transplantations\n(LTs)\nAll LTs (n = 122) PRS (n = 65) no PRS (n = 57) P\nDonor characteristics\nAge [years] 55.2 ± 16.2 57.1 ± 15.1 53.1 ± 17.2 0.18\nSex [female] 57 (46.7%) 32 (49.2%) 24 (42.1%) 0.42\nBMI [kg/cm2\n] 28.8 ± 7.2 31.1 ± 8.2 26.4 ± 4.8 < 0.001\nSodium [mmol/L] 147.7 ± 8.2 149.1 ± 7.8 146.1 ± 8.4 0.04\nALT [U/L] 114.2 ± 289.6 106.7 ± 223.2 122.8 ± 352.4 0.77\nAST [U/L] 124.4 ± 237.8 115.9 ± 182.1 134.1 ± 290.0 0.69\nBilirubine [mg/dL] 0.86 ± 1.23 0.80 ± 1.33 0.93 ± 1.13 0.59\nCold ischemic time [h] 8.3 ± 2.3 8.7 ± 2.3 7.8 ± 2.3 0.04\n≥ 10 h [n] 23 (18.9%) 17 (26.2%) 6 (10.5%) 0.02\nWarm ischemic time [min] 43.7 ± 7.5 44.9 ± 6.7 42.3 ± 8.2 0.06\nRecipient characteristics\nAge [years] 54.9 ± 9.8 55.2 ± 9.8 54.5 ± 9.8 0.69\nSex [female] 43 (35.2%) 21 (32.3%) 22 (38.6%) 0.57\nBMI [kg/cm2\n] 27.6 ± 5.3 27.3 ± 5.5 28.1 ± 5.0 0.41\nDiagnosis [n]\nacute liver failure 12 (9.8%) 10 (15.4%) 2 (3.5%) 0.03\nacute on chronic 5 (4.1%) 1 (1.5%) 4 (7.0%) 0.18\ncirrhosis 57 (46.7%) 20 (30.8%) 37 (64.9%) < 0.001\ntumor 25 (20.5%) 14 (21.5%) 11 (19.3%) 0.82\ngraft failure 7 (5.7%) 2 (3.1%) 5 (8.8%) 0.25\nothers (PSC, polycystic) 16 (13.1%) 10 (15.4%) 6 (10.5%) 0.59\nportal hypertension 85 (69.7%) 52 (80.0%) 33 (57.9%) 0.01\nlabMELD 19.8 ± 10.3 20.0 ± 9.9 19.6 ± 10.8 0.82\nCreatinine preop [mg/dl] 1.71 ± 1.49 1.75 ± 0.23 1.66 ± 0.15 0.14\npreoperative RRT [n] 15 (12.3%) 8 (12.3%) 7 (12.3%) 1.00\nLT Liver transplantation, PRS postreperfusion syndrome, BMI body mass index, ALT Alanine transferase, AST Aspartat transferase, labMELD laboratory Model of end￾stage liver disease score, RRT renal replacement therapy\nClinical characteristics of liver organ donors (top) and liver transplant recipients (bottom) of 122 single center LTs. The characteristics are displayed for the whole\nstudy population (left) and by occurrence of postoperative reperfusion syndrome; mean and standard deviation (SD) or frequencies\nKork et al. BMC Anesthesiology (2018) 18:29 Page 5 of 11\n\n0.05) and suffered more often from postoperative delir￾ium (P = 0.04).\nAll 122 LT recipients were operated at the same\ncenter with the same technique (venovenous/portalve￾nous bypass) and with uniform anesthesiologic man￾agement, guided by a SOP that included instructions\nfor the management of PRS. No changes in operating\ntechnique or anesthesiologic management were made\nduring the study period, leading to a homogenous single\ncenter study sample. Nevertheless, this study has several\nweaknesses. Due to the retrospective design of the analyses,\ndata quality could be impaired. Histological data for our\nanalyses was limited to steatosis assessment. Analyses of\nhemodynamics from hand-written anesthesia protocols are\noften suspected to present “sugar-coated” hemodynamic\nvalues. Although we cannot rule out that this was the\ncase, our data present clinically and empirically plausible\nhemodynamics. At worst, hemodynamic stability is overes￾timated and the effects shown are even more pronounced.\nThe fact that this was a single center analysis combined\nwith the uncommon but consistent use of intraoperative\nvenovenous/portalvenous bypass limits the external validity\nof our results.\nAlthough rather on the top end of the range, PRS inci￾dence of 53% in our sample concurs with several other\nstudies [8, 10, 12, 17, 19]. The pathophysiology of PRS is\ncomplex and not entirely understood. The abrupt influx\nof cold, hyperkalemic and acidic blood into the circula￾tion, air or thrombotic embolization and the release of\nvasoactive substances from the graft liver contribute to\nPRS [29–31]. The rationale for using a venovenous/por￾talvenous bypass during the anhepatic phase at our cen￾ter is to ensure maximum safety of the procedure [24].\nThe combination of a femoro-brachial and porto-axillary\nTable 2 Predictors of PRS\nunivariable multivariable\nWald OR 95% CI P Wald OR 95% CI P\nDonor related\nAge [years] 1.79 1.02 0.99–1.04 0.18\nSodium [mmol/L] 3.92 1.05 1.00–1.10 0.048 3.74 1.06 1.0–1.13 0.053\nALT [U/L] 0.94 1.00 0.99–1.00 0.76\nAST [U/L] 0.17 1.00 0.99–1.00 0.68\nBilirubine [mg/dL] 0.28 0.92 0.68–1.24 0.60\nCIT [h] 4.09 1.19 1.05–1.41 0.04 1.62 1.14 0.93–1.38 0.20\nWIT [min] 3.54 1.05 0.99–1.11 0.06\nvisual assessment by surgeona\nacceptable 11.03 13.14 2.87–60.03 0.001 9.21 12.23 2.43–61.59 0.002\npoor 6.27 14.6 1.79–118.9 0.01 5.34 13.40 1.48–121.1 0.02\nsteatosis (histological)b\nstage 2 0.36 1.58 0.36–6.93 0.55\nstage 3 1.38 3.79 0.41–34.97 0.42\nRecepient related\nlabMELD 0.05 1.00 0.97–1.04 0.82\nPoHT 6.78 2.91 1.30–6.50 < 0.01 2.15 2.07 0.78–5.48 0.14\nNE dosage before reperfusion [0.1 μg kg−1 min−1\n] 7.86 2.00 1.23–3.24 0.01 7.56 2.20 1.26–3.86 0.01\nALT alanine transferase, AST aspartate transferase, CIT cold ischemia time, WIT warm ischemia time, labMELD laboratory Model of end-stage liver disease score,\nPoHT portal hypertension, NE norepinephrine, OR odds ratio, CI confidence interval a\ncompared to visual assessment category “good”; b\ncompared to stage 1\nResults of univariable (left) and multivariable (right) binary logistic regression analyses in 122 cases of LT to predict PRS. Only visually assessed steatosis by the\nsurgeon prior to implantation and NE dosage before reperfusion remained significant predictors of PRS in the multivariable model\nTable 3 Differences in assessment of the graft organ between\ntransplanting surgeon and histological examination in 122 cases\nof LTs\nTransplanting\nsurgeons’\nmacroscopic\nassessment\nHistological assessment of the macrovesical fat\ncontenta\nTotal\nGrade 1 Grade 2 Grade 3\nGood 88 2 1 91\nAcceptable 17 3 0 20\nPoor 4 3 4 11\nTotal 109 8 5 122\na\nGrade 1: fat content 0–29%, grade 2: fat content 30–59%, grade 3: fat\ncontent ≥60%\nAgreement between these two methods of assessment was poor (cohen’s\nkappa 0.31) and transplanting surgeons classified 21 organs as only acceptable\nor poor that were classified as grade 1 steatosis by histological assessment\nKork et al. BMC Anesthesiology (2018) 18:29 Page 6 of 11\n\nbypass reduces lower limb and mesenterial congestion\nand therefore reduces the abrupt influx of hyperkalemic\nand acidic blood into systemic circulation at the time of\nreperfusion. Nevertheless, the use of a bypass during LT\nsurgery remains controversial [13, 32, 33]. The PRS effect\nseen in our study is therefore likely to be predominantly\ncaused by vasoactive substances released from the graft.\nWith that in mind, PRS incidence does appear rather high.\nA possible explanation for this contradiction may be\nthe fact that we used an extended definition for PRS.\nPRS is commonly defined as a decrease in MAP of more\nthan 30% from the baseline value for more than one minute\nduring the first five minutes after reperfusion [7, 8, 10–12].\nWe extended the definition for PRS for mainly two reasons.\nFirst, the treatment of PRS seeks to preserve hemodynamic\nstability. At the time of reperfusion, anesthesiologists\nexpect a certain degree of hemodynamic instability and pre￾emptively treat a (soon to be) falling MAP with catechol￾amines [11], either as bolus or by increasing continuous\ninfusion of the very same. Since this preemptive treatment\nconceals the occurrence of by-definition-PRS, we added (i)\nthe administration of an intravenous bolus of norepineph￾rine > 2 μg kg (BW) -1 as well as (ii) the increase of continu￾ous norepinephrine infusion of ≥0.1 μg kg BW− 1 within\nthe first 5 min after reperfusion as new criteria to the defin￾ition. Second, our clinical empiricism and the literature\nhave presented cases of prolonged vasodilation after re￾perfusion [34–36]. We thus included (iii) an increase of\ncontinuous norepinephrine infusion up to 30 min after\nreperfusion and (iv) the initiation of continuous vasopressin\nFig. 2 Hemodynamics. Intraoperative hemodynamics of 122 liver transplant (LT) recipients, 65 with postreperfusion syndrome (PRS, black circles),\n57 without postoperative PRS (white circles). LT recipients with PRS were hemodynamically more unstable compared to patients without PRS.\nMean arterial pressure after reperfusion was lower (a), accordingly, norepinephrine (b) and vasopressin infusion (c) were higher in LT recipients\nwith PRS compared to recipients without PRS. Heart rate (d) and epinephrine infusion (e) did not differ. At the time of reperfusion, LT recipients with\nPRS received greater boli of norepinephrine and epinephrine (f). P-values: repeated measures ANOVA; *: post-hoc t-test; mean and standard deviation\nTable 4 Intraoperative adverse events\nPRS (n = 65) no PRS (n = 57) P\nHyperfibrinolysisa [n] 2 (3.1%) 2 (3.5%) 1.00\nAsystole [n] 0 (0.0%) 1 (1.8%) n/ac\nCerebral edemab [n] 0 (0.0%) 1 (1.8%) n/ac\nTransfusions\nRBC [U] 10.7 ± 7.3 9.5 ± 9.0 0.12\nFFP [U] 18.0 ± 9.2 17.2 ± 10.3 0.50\nPlatelet concentrate [U] 1.6 ± 1.8 1.1 ± 1.5 0.04\nFibrinogen [g] 3.0 ± 3.2 1.7 ± 2.6 0.01\nPCC [IU] 1313 ± 1610 579 ± 1133 0.01\nPRS postreperfusion syndrome, RBC red blood cell concentrate, FFP fresh\nfrozen plasma, PCC prothrombin complex concentrate a\ndetected by thrombelastometry; b\ndetected by mydriasis after reperfusion; c\ntoo little events to calculate P; intraoperative adverse events after reperfusion\nin 122 liver transplant recipients apportioned by patients with and without\npostreperfusion syndrome (PRS)\nKork et al. BMC Anesthesiology (2018) 18:29 Page 7 of 11\n\ninfusion after reperfusion as additional criteria for PRS.\nThis altered definition impedes comparability with other\nstudies and may overestimate PRS incidence compared to\nthe commonly used definition. However, our data ap￾pear clinically plausible and concur with description of\nhemodynamic recovery after PRS by other authors [17].\nIn this study, multivariable regression modelling identi￾fied one donor related and one recipient related predictor\nof PRS: graft quality – visually assessed by the transplanting\nsurgeon – and cumulative intraoperative norepinephrine\ndosage before reperfusion of the liver graft. The variety of\nrisk factors and risk prediction models described in differ￾ent studies suggests that PRS may occur in an unpredict￾able manner or may be highly subjective to center-specific\neffects [8, 13–20, 22]. The most frequent reported risk fac￾tors for PRS are longer CIT [15, 16, 18, 20] and intraopera￾tive hemodynamics prior to reperfusion [14, 15, 17, 20],\nfollowed by graft steatosis [8, 16], operation time and tech￾nique [15, 18], severity of recipient’s liver disease [8, 19],\nand donor age [13, 17]. One single center study retrospect￾ive analysis was unable to identify even a single risk factor\nin a retrospective analysis of a sample of 261 LT\nrecipients [37]. Our findings that graft quality and hemo￾dymic impairment prior to reperfusion are risk factors for\nPRS concur with several similar studies. However, it re￾mains cryptic why the multitude of these observational\nstudies generate such a diversity of findings when it comes\nto predicting postreperfusion syndrome. Prospective multi￾center trials, the creation of an LT register or meta-analyses\ninvestigating the prediction of PRS could help to shed light\non this matter in the future.\nThe increasing number of liver transplantations has led\nto an increased demand of donor organs [1] and to the\ngrowing use of organs from extended criteria donors (ECD)\n[23]. A common quality marker for organs is fatty change,\nor steatosis. Steatosis has indeed been linked to the occur￾rence of PRS [8, 16]. Studies have shown that transplant￾ation of liver grafts with moderate to severe steatosis can\nvery well be conducted without sacrificing recipient survival\nbut in particular, that increased efforts are needed when\ndealing with these organs [26, 38]. However, macroscopic\nassessment of the organ may not be qualified to assess\nsteatosis: Rey and colleagues have examined 36 livers of\norgan donors which were explanted but not allocated.\nFig. 3 Clinical chemistry. Postoperative clinical chemistry of 122 liver transplant (LT) recipients, 65 with postreperfusion syndrome (PRS, black\ncircles), 57 without postoperative PRS (white circles). LT recipients with PRS suffered from greater postoperative transplant damage and poorer\ntransplant function during the postoperative course: Aspartat transferase blood concentration was higher (a) and blood hemostasis was poorer\n(d) compared to LT recipients without postreperfusion syndrome (alanine transferase was higher but did not reach significance, (b) LT recipients\nwith and without PRS did not differ in gall retention (c). Inflammation marker procalcitonin (e) and kidney function marker creatinine (f) were\npeaking higher during the postoperative course in LT recipients with PRS compared to recipients without PRS but did not reach statistical\nsignificance. P-values: repeated measures ANOVA; *: post-hoc t-test; mean and standard deviation\nKork et al. BMC Anesthesiology (2018) 18:29 Page 8 of 11\n\nThe authors found that macroscopic appearance and col￾oring compared to histopathologic evaluation for steatosis\nunveiled discrepancies: Most of the graft livers with histo￾pathologically confirmed mild degree of steatosis macro￾scopically appeared yellow, thus of false poor quality and\ncould have been transplanted. In our analyses, micro￾scopic steatosis evaluation was a worse predictor for PRS\nthan the visual evaluation of the transplanting surgeon.\nThis may be the case because surgeons likely assess the\norgan not only by its color, but also by general appearance,\norgan consistency, and size. It may even be the case that\ninformation of the recipient’s medical history and the\nknowledge that the organ was already rejected once by an￾other center or had a long CIT additionally influenced the\nassessment. Therefore, the multitude of information may\nhave enabled the surgeon to predict PRS better than any\nsingle variable (recipient status, CIT, steatosis, etc.).\nWe also found intraoperative norepinephrine infusion rate\nbefore reperfusion to be a predictor of PRS. This also con￾curs with other studies that have identified markers of\nhemodynamic instability prior to reperfusion as predictors\nof PRS. One possible explanation for norepinephrine infu￾sion or hemodynamic instability is hypovolemia. This would\nalso concur with other studies that have shown lower central\nvenous pressure at time of dissection [14] or at time of re￾perfusion [17] as well as a higher requirement for transfu￾sion units [15] to be predictors of PRS. A second possible\nexplanation is vasodilatation or vasplegia which has been\nlinked to end stage liver disease [39, 40]. Case reports have\ndescribed vasoplegic syndrome to occur during liver trans￾plantation [31, 41]. However, differentiation between the\ntwo can sometimes be complicated as both appear alike\n[34]. A third possible explanation may be that these patients\nalready had a compromised cardiac function. E.g., Xu and\ncolleagues could link left ventricular diastolic dysfunction to\nthe occurrence of PRS in a cohort of 330 Chinese LT recipi￾ents [20]. Unfortunately, our data did not contain systematic\nand detailed cardiac function assessment of the recipients\nand the literature lacks systematic investigation of its impact\non the occurrence of PRS. Moreover, it has been suggested\nby several authors that PRS could be only a sign of an\nunderlying problem. It could be that anhepatic hypovolemia,\nvasoplegia and/or impaired cardiac function demask as PRS\nintraoperatively. On top of it, patients receiving a LT\nfrom ECD appear especially susceptible to severe PRS.\nFig. 4 Survival. Kaplan-Meier survival analysis of 122 liver transplant (LT) recipients, 65 with postreperfusion syndrome (PRS; solid line) and 57 with\nPRS (broken line). Survival analyses were conducted for LT recipient survival (a) as well as graft survival (retransplantation or recipient death; (b)\nPRS: postreperfusion syndrome\nTable 5 Postoperative outcome\nPRS (n = 65) no PRS (n = 57) P\nEarly allograft dysfunction [n] 25 (38.5%) 16 (28.1%) 0.25\nRetransplantation [n] 5 (7.7%) 4 (7.0%) 0.75\nDue to primary non functiona [n] 3 (4.6%) 1 (1.8%)\nDue to thrombosis [n] 0 (0.0%) 1 (1.8%)\nAcute rejection [n] 12 (18.5%) 13 (22.8%) 0.66\nSurgical revision [n] 26 (40.0%) 25 (43.9%) 0.72\nBleeding [n] 22 (33.8%) 19 (33.3%) 1.00\nSevere infection/sepsis [n] 11 (16.9%) 8 (14.0%) 0.80\nRenal function [n]\nRRT [n] 27 (41.5%) 20 (35.1%) 0.27\nMajor cardiovascular eventsb [n] 11 (16.9%) 3 (5.3%) 0.05\nAdverse CNS events [n]\nDelirium [n] 8 (12.3%) 1 (1.8%) 0.04\nIntracranial bleeding [n] 3 (4.6%) 0 (0.0%) 0.25\nSeizures [n] 1 (1.5%) 1 (1.8%) 1.00\nExtubation in the OR [n] 15 (23.1%) 20 (35.1%) 0.16\nICU LOS [days] 11.7 ± 17.0 9.7 ± 15.7 0.09\nHospital LOS [days] 36.5 ± 18.2 35.6 ± 23.9 0.24\nDeaths [n] 10 (15.4%) 7 (12.3%) 0.33\nDue to sepsis/MOF [n] 6 (9.2%) 6 (10.5%)\nDue to cardiovascular events [n] 2 (3.1%) 1 (1.8%)\nDue to bleeding [n] 1 (1.5%) 0 (0.0%)\nDue to carcinoma [n] 1 (1.5%) 0 (0.0%)\nShort-term postoperative outcome of 122 liver transplant recipients with and\nwithout postreperfusion syndrome (PRS); RRT renal replacement therapy, CNS\ncentral nervous system, ICU intensive care unit; LOS: length of stay MOF multi\norgan failure PRS postreperfusion syndrome a\nPrimary non-function: re-transplantation or death within 7 days\nb\nmajor cardiovascular events: asystole, resuscitation, non ST elevation\nmyocardial infarction\nKork et al. BMC Anesthesiology (2018) 18:29 Page 9 of 11\n\nIn this light, these patients should especially be opti￾mized regarding hemodynamics and acid-base balance\nwhen awaiting reperfusion.\nSimilar to the prediction of PRS, data on the effect of\nPRS on LT recipients’ outcome is inconclusive. In par￾ticular, the impact of PRS on hard clinical endpoints\nsuch as primary graft nonfunction with requirement for\nretransplantation and mortality is unresolved. E.g., some\nstudies show an effect of PRS on mortality [15, 18–20]\nand others did not [13, 17]. In fact, we were not able to\nshow a significant association of PRS with primary non￾function (4.6 vs. 1.8%) and mortality (15.4% vs. 12.3%) in\nthis study population. This is most likely due to the\nsmall sample size, again underscoring the need for mul￾ticenter registries. Regarding post-transplantation mor￾bidity, we could demonstrate in our sample that the\noccurrence of PRS was associated with a higher fre￾quency of postoperative delirium (12.3% vs. 1.8%) and\nmajor cardiovascular events (16.9% vs. 5.3%). While\nother studies have demonstrated early allograft dysfunc￾tion [42, 43], ICU length of stay [43] and the need for\npostoperative renal dysfunction [19, 20] we could not\nsubstantiate these associations in our study sample.\nConclusions\nThe data of this study demonstrated that both the visual\nassessment of the liver graft by the transplanting surgeon\nas well as the intraoperative recipients need for catechol￾amines before reperfusion of the graft were predictors for\nPRS at our center. Besides the known risk factors for PRS,\nanesthesiologists should keep these newly described\nrisk factors in mind when preparing for reperfusion.\nAs the impact of PRS on short- and long-term hard\nclinical endpoint remains inconclusive, further investi￾gations and possibly multicenter prospective registries\ncould ultimately resolve the impact of PRS on LT re￾cipients’ outcome.\nAbbreviations\nALT: Alanine transferase; AST: Aspartat transferase; CIT: Cold ischemia time;\nECD: Extended criteria donors; FFP: Fresh frozen plasma; INR: International\nnormalized ratio; labMELD: Laboratory Model of end stage liver disease;\nLT: Liver transplantation; MAP: Mean arterial pressure; MELD: Model of end\nstage liver disease; min: Minute(s); NE: Norepinephrine; OR: Odds ratio;\nPC: Platelet concentrate; PCC: Prothrombin complex concentrate;\nPOD: Postoperative day; PoHT: Portal hypertension; PRS: Postreperfusion\nsyndrome; PSC: Primary biliary cirrhosis; RBC: Red blood cell concentrate;\nSOP: Standard operating procedure; TEM: Thrombelastometry; US: United\nStates; WIT: Warm ischemia time\nAcknowledgements\nThis analysis was conducted in the course of the doctoral thesis of AR at the\nMedical Faculty of the RWTH Aachen, Germany.\nFunding\nThe study did not receive external funding and was conducted on\ndepartmental funds only.\nAvailability of data and materials\nThe datasets generated and/or analysed during the current study are not\npublicly available due German Data Protection Laws but are available from\nthe corresponding author on reasonable request after approval of the local\nethics committee and data safety board.\nAuthors’ contributions\nAR, AA, MH designed the research, AR participated in acquisition of the data,\nFK, AR, MH conducted data analysis. FK drafted the manuscript, AR and MH\nparticipated in writing of the manuscript, all authors interpreted the data\nand revised the manuscript critically for important intellectual content,\napproved the final version to be published and agreed to be accountable\nfor all aspects of the work.\nEthics approval and consent to participate\nThe local ethics committee (University Hospital RWTH Aachen, EK 291/13)\napproved the analysis and waived the requirement of informed consent.\nConsent for publication\nNot applicable.\nCompeting interests\nThe authors declare that they have no competing interests.\nPublisher’s Note\nSpringer Nature remains neutral with regard to jurisdictional claims in\npublished maps and institutional affiliations.\nAuthor details\n1\nDepartment of Anaesthesiology, Medical Faculty, RWTH Aachen University,\nPauwelsstrasse 30, 52074 Aachen, Germany. 2\nDepartment of General, Visceral\nand Transplantation Surgery, Medical Faculty, RWTH Aachen University,\nPauwelsstrasse 30, 52074 Aachen, Germany. 3\nDepartment of General, Visceral\nand Oncological Surgery, Sana Hospital Gerresheim, Gräulinger Strasse 120,\n40625 Düsseldorf, Germany. 4\nDepartment of Medicine III, Medical Faculty,\nRWTH Aachen University, Pauwelsstrasse 30, 52074 Aachen, Germany.\nReceived: 15 January 2018 Accepted: 2 March 2018\nReferences\n1. Tranplants by Donor Type [https://optn.transplant.hrsa.gov/data/view-data￾reports/national-data/]. Accessed 10 May 2017.\n2. Tacke F, Kroy DC, Barreiros AP, Neumann UP. Liver transplantation in\nGermany. Liver Transpl. 2016;22(8):1136–42.\n3. Annual Report 2015 [http://www.eurotransplant.org/cms/mediaobject.\nphp?file=AR_ET_20153.pdf]. Accessed 8 May 2017.\n4. Schlitt HJ, Loss M, Scherer MN, Becker T, Jauch KW, Nashan B, Schmidt H,\nSettmacher U, Rogiers X, Neuhaus P, et al. Current developments in liver\ntransplantation in Germany: MELD-based organ allocation and incentives for\ntransplant centres. Z Gastroenterol. 2011;49(1):30–8.\n5. Pezzati D, Ghinolfi D, De Simone P, Balzano E, Filipponi F. Strategies to\noptimize the use of marginal donors in liver transplantation. World J\nHepatol. 2015;7(26):2636–47.\n6. Routh D, Sharma S, Naidu CS, Rao PP, Sharma AK, Ranjan P. Comparison of\noutcomes in ideal donor and extended criteria donor in deceased donor\nliver transplant: a prospective study. Int J Surg. 2014;12(8):774–7.\n7. Aggarwal S, Kang Y, Freeman JA, Fortunato FL, Pinsky MR. Postreperfusion\nsyndrome: cardiovascular collapse following hepatic reperfusion during liver\ntransplantation. Transplant Proc. 1987;19(4 Suppl 3):54–5.\n8. Chung IS, Kim HY, Shin YH, Ko JS, Gwak MS, Sim WS, Kim GS, Lee S-K.\nIncidence and predictors of post-reperfusion syndrome in living donor liver\ntransplantation. Clin Transpl. 2012;26(4):539–43.\n9. Hilmi I, Horton CN, Planinsic RM, Sakai T, Nicolau-Raducu R, Damian D,\nGligor S, Marcos A. The impact of postreperfusion syndrome on short-term\npatient and liver allograft outcome in patients undergoing orthotopic liver\ntransplantation. Liver Transpl. 2008;14(4):504–8.\n10. Lee J, Yoo YJ, Lee JM, Park YJ, Ryu HG. Sevoflurane versus Desflurane on the\nincidence of Postreperfusion syndrome during living donor liver transplantation:\na randomized controlled trial. Transplantation. 2016;100(3):600–6.\nKork et al. BMC Anesthesiology (2018) 18:29 Page 10 of 11\n\n11. Ryu H-G, Jung C-W, Lee H-C, Cho Y-J. Epinephrine and phenylephrine\npretreatments for preventing postreperfusion syndrome during adult liver\ntransplantation. Liver Transpl. 2012;18(12):1430–9.\n12. Ryu HG, Jung CW, Lee CS, Lee J. Nafamostat mesilate attenuates\nPostreperfusion syndrome during liver transplantation. Am J Transplant.\n2011;11(5):977–83.\n13. Nanashima A, Pillay P, Crawford M, Nakasuji M, Verran DJ, Painter D. Analysis\nof postrevascularization syndrome after orthotopic liver transplantation: the\nexperience of an Australian liver transplantation center. J Hepato-Biliary￾Pancreat Surg. 2001;8(6):557–63.\n14. Ayanoglu HO, Ulukaya S, Tokat Y. Causes of postreperfusion syndrome in living\nor cadaveric donor liver transplantations. Transplant Proc. 2003;35(4):1442–4.\n15. Bukowicka B, Akar RA, Olszewska A, Smoter P, Krawczyk M. The occurrence\nof postreperfusion syndrome in orthotopic liver transplantation and its\nsignificance in terms of complications and short-term survival. Ann\nTransplant. 2011;16(2):26–30.\n16. Chui AK, Shi L, Tanaka K, Rao AR, Wang LS, Bookallil M, Mayr M, Chiu E,\nVerran DJ, Mears D, et al. Postreperfusion syndrome in orthotopic liver\ntransplantation. Transplant Proc. 2000;32(7):2116–7.\n17. Fukazawa K, Yamada Y, Gologorsky E, Arheart KL, Pretto EAJ. Hemodynamic\nrecovery following postreperfusion syndrome in liver transplantation.\nJ Cardiothorac Vasc Anesth. 2014;28(4):1006–14.\n18. Paugam-Burtz C, Kavafyan J, Merckx P, Dahmani S, Sommacale D, Ramsay\nM, Belghiti J, Mantz J. Postreperfusion syndrome during liver transplantation\nfor cirrhosis: outcome and predictors. Liver Transpl. 2009;15(5):522–9.\n19. Siniscalchi A, Dante A, Spedicato S, Riganello L, Zanoni A, Cimatti M,\nPierucci E, Bernardi E, Miklosova Z, Moretti C, et al. Hyperdynamic circulation\nin acute liver failure: reperfusion syndrome and outcome following liver\ntransplantation. Transplant Proc. 2010;42(4):1197–9.\n20. Xu ZD, Xu HT, Yuan HB, Zhang H, Ji RH, Zou Z, Fu ZR, Shi XY.\nPostreperfusion syndrome during orthotopic liver transplantation: a single￾center experience. Hepatobiliary Pancreat Dis Int. 2012;11(1):34–9.\n21. DiNorcia J, Lee MK, Harlander-Locke MP, Xia V, Kaldas FM, Zarrinpar A,\nFarmer DG, Yersiz H, Hiatt JR, Busuttil RW, et al. Damage control as a\nstrategy to manage Postreperfusion hemodynamic instability and\ncoagulopathy in liver transplant. JAMA Surg. 2015;150(11):1066–72.\n22. Jeong SM. Postreperfusion syndrome during liver transplantation. Korean J\nAnesthesiol. 2015;68(6):527–39.\n23. Pareja E, Cortes M, Hervas D, Mir J, Valdivieso A, Castell JV, Lahoz A. A score\nmodel for the continuous grading of early allograft dysfunction severity.\nLiver Transpl. 2015;21(1):38–46.\n24. Mossdorf A, Ulmer F, Junge K, Heidenhain C, Hein M, Temizel I, Neumann\nUP, Schoning W, Schmeding M. Bypass during liver transplantation:\nanachronism or revival? Liver transplantation using a combined\nVenovenous/portal venous bypass-experiences with 163 liver transplants in\na newly established liver transplantation program. Gastroenterol Res Pract.\n2015;2015:967951.\n25. Gorlinger K. Coagulation management during liver transplantation.\nHamostaseologie. 2006;26(3 Suppl 1):S64–76.\n26. Angele MK, Rentsch M, Hartl WH, Wittmann B, Graeb C, Jauch KW, Loehe F.\nEffect of graft steatosis on liver function and organ survival after liver\ntransplantation. Am J Surg. 2008;195(2):214–20.\n27. Adam R, Reynes M, Johann M, Morino M, Astarcioglu I, Kafetzis I, Castaing D,\nBismuth H. The outcome of steatotic grafts in liver transplantation.\nTransplant Proc. 1991;23(1 Pt 2):1538–40.\n28. Kamath PS, Wiesner RH, Malinchoc M, Kremers W, Therneau TM, Kosberg CL,\nD'Amico G, Dickson ER, Kim WR. A model to predict survival in patients\nwith end-stage liver disease. Hepatology. 2001;33(2):464–70.\n29. Zalunardo MP, Schlapfer M, Beck-Schimmer B, Seifert B, Spahn DR, Bettex D.\nImpact of cytokine release on ventricular function after hepatic reperfusion:\na prospective observational echocardiographic study with tissue Doppler\nimaging. BMC Anesthesiol. 2015;15:107.\n30. Nakasuji M, Bookallil MJ. Pathophysiological mechanisms of postrevascularization\nhyperkalemia in orthotopic liver transplantation. Anesth Analg. 2000;91(6):1351–5.\n31. Bezinover D, Kadry Z, Uemura T, Sharghi M, Mastro AM, Sosnoski DM, Dalal\nP, Janicki PK. Association between plasma cyclic guanosine monophosphate\nlevels and hemodynamic instability during liver transplantation. Liver\nTranspl. 2013;19(2):191–8.\n32. Acosta F, Rodriguez MA, Sansano T, Contreras RF, Reche M, Roques V,\nBeltran R, Robles R, Bueno FS, Ramirez P, et al. Influence of surgical\ntechnique on postreperfusion syndrome during liver transplantation.\nTransplant Proc. 1999;31(6):2380–1.\n33. Jugan E, Albaladejo P, Jayais P, Ecoffey C. The failure of venovenous bypass to\nprevent graft liver postreperfusion syndrome. Transplantation. 1992;54(1):81–4.\n34. de Armas LC, Castillo YA: Is it possible to distinguish between vasoplegic\nsyndrome and postreperfusion syndrome during liver graft reperfusion?\nAnesth Analg 2010, 110(3):969–970; author reply 970-961.\n35. Cao Z, Gao Y, Tao G. Vasoplegic syndrome during liver transplantation.\nAnesth Analg. 2009;108(6):1941–3.\n36. Bezinover D, Kadry Z, McCullough P, McQuillan PM, Uemura T, Welker K,\nMastro AM, Janicki PK. Release of cytokines and hemodynamic instability\nduring the reperfusion of a liver graft. Liver Transpl. 2011;17(3):324–30.\n37. Kiseleva EA, Ushakova IA, Kim EF, Matveev GP, Biriulina N, Vabishchevich AV.\nTo the issue of postreperfusion syndrome predictors in orthotopic liver\ntransplantation (OLT). Anesteziol Reanimatol. 2012;2:31–5.\n38. McCormack L, Petrowsky H, Jochum W, Mullhaupt B, Weber M, Clavien P-A.\nUse of severely steatotic grafts in liver transplantation: a matched case￾control study. Ann Surg. 2007;246(6):940–6. discussion 946-948\n39. Berzigotti A, Erice E, Gilabert R, Reverter E, Abraldes JG, Garcia-Pagan JC,\nBosch J. Cardiovascular risk factors and systemic endothelial function in\npatients with cirrhosis. Am J Gastroenterol. 2013;108(1):75–82.\n40. Wagener G, Kovalevskaya G, Minhaz M, Mattis F, Emond JC, Landry DW.\nVasopressin deficiency and vasodilatory state in end-stage liver disease.\nJ Cardiothorac Vasc Anesth. 2011;25(4):665–70.\n41. Khosravi MB, Milani S, Ghaffaripour S, Sahmeddini A, Eghbal MH, Malek￾Hosseini SA. Very high dose epinephrine for the treatment of Vasoplegic\nsyndrome during liver transplantation. Int J Organ Transplant Med.\n2013;4(1):32–4.\n42. Reich DL, Wood RK Jr, Emre S, Bodian CA, Hossain S, Krol M, Feierman D.\nAssociation of intraoperative hypotension and pulmonary hypertension\nwith adverse outcomes after orthotopic liver transplantation. J Cardiothorac\nVasc Anesth. 2003;17(6):699–702.\n43. Hilmi IA, Damian D, Al-Khafaji A, Sakai T, Donaldson J, Winger DG, Kellum\nJA. Acute kidney injury after orthotopic liver transplantation using living\ndonor versus deceased donor grafts: a propensity score-matched analysis.\nLiver Transpl. 2015;21(9):1179–85.\n• We accept pre-submission inquiries\n• Our selector tool helps you to find the most relevant journal\n• We provide round the clock customer support \n• Convenient online submission\n• Thorough peer review\n• Inclusion in PubMed and all major indexing services \n• Maximum visibility for your research\nSubmit your manuscript at\nwww.biomedcentral.com/submit\nSubmit your next manuscript to BioMed Central \nand we will help you at every step:\nKork et al. BMC Anesthesiology (2018) 18:29 Page 11 of 11\n\n"], "response": "This research aimed to investigate the impact of using highly steatotic livers for liver transplantation and how it affects postreperfusion syndrome (PRS). The study included 122 liver transplant recipients, of whom 65 developed PRS. The results showed that highly steatotic livers were associated with a higher incidence of PRS, as well as greater hemodynamic instability during reperfusion. However, there was no difference in overall survival between those who received highly steatotic livers and those who did not. The authors suggest that further studies are needed to determine whether the use of highly steatotic livers should be restricted based solely on the presence of PRS. The study also found that visual assessment of liver steatosis by the surgeon was less reliable than histopathological grading. Overall, the study highlights the importance of careful selection of highly steatotic livers for transplantation and the need for ongoing monitoring and management of PRS."}
